"x501874833","x1444730876680626183",2021-10-03 18:27:37,"s_margiotta","@mptuitter Questi sparano cretinate razziste certamente non innocue, ma quelli sparavano pallottole. Come si fa ?","Twitter for iPad",134,,,,FALSE,TRUE,0,3,,,,,,,,,,,,,,,,"x608063632 x930776438617395203","MassimoLeaderPD mptuitter","it",,,,,,,,,,,,,,,,"x1444730356104679432","@mptuitter Questi sparano cretinate razziste certamente non innocue, ma quelli sparavano pallottole. Come si fa ?",2021-10-03 18:25:33,"Twitter Web App",4,3,"x608063632","MassimoLeaderPD","D'Alema er Massimo",18077,1980,59406,"","Amico di capitani coraggiosi, mi diletto di navigazione nel procelloso mare della sinistra. Primum regere deinde philosophari. Parody Account",FALSE,,,,,,,"NA NA","NA NA","NA NA NA NA NA NA NA NA","https://twitter.com/s_margiotta/status/1444730876680626183","Salvatore Margiotta","Roma, Potenza","Senatore, ingegnere, professore universitario. Capogruppo Commissione lavori pubblici e trasporti. Segretario Presidenza Senato","https://t.co/aeYZnOeRaN",FALSE,15681,7305,209,79655,59972,2012-02-24 15:30:04,TRUE,"https://t.co/aeYZnOeRaN","http://instangram.com/salvatore__margiotta",,"https://pbs.twimg.com/profile_banners/501874833/1483357085","http://abs.twimg.com/images/themes/theme1/bg.png","http://pbs.twimg.com/profile_images/1344056897155063808/zdD0fQgS_normal.jpg"
"x501874833","x1444729702795685889",2021-10-03 18:22:57,"s_margiotta","@s_margiotta @ricpuglisi Incapsulati nell'odio verso Salvini hanno perso il ben dell'intelletto. Se ne fosse salvato uno.","Twitter for iPad",139,,,,FALSE,TRUE,0,1,,,,,,,,,,,,,,,,"x247863643 x501874833 x225168723","convivioblog s_margiotta ricpuglisi","it",,,,,,,,,,,,,,,,"x1444729282752827392","@s_margiotta @ricpuglisi Incapsulati nell'odio verso Salvini hanno perso il ben dell'intelletto. Se ne fosse salvato uno.",2021-10-03 18:21:17,"Twitter for Android",8,1,"x247863643","convivioblog","Rosella Vivio",4032,3066,88507,"Italia","Laurea in Filosofia ,giornalista pubblicista. Le streghe hanno smesso di esistere quando noi abbiamo smesso di bruciarle. #noiconclaudia",FALSE,,,,,,,"NA NA","NA NA","NA NA NA NA NA NA NA NA","https://twitter.com/s_margiotta/status/1444729702795685889","Salvatore Margiotta","Roma, Potenza","Senatore, ingegnere, professore universitario. Capogruppo Commissione lavori pubblici e trasporti. Segretario Presidenza Senato","https://t.co/aeYZnOeRaN",FALSE,15681,7305,209,79655,59972,2012-02-24 15:30:04,TRUE,"https://t.co/aeYZnOeRaN","http://instangram.com/salvatore__margiotta",,"https://pbs.twimg.com/profile_banners/501874833/1483357085","http://abs.twimg.com/images/themes/theme1/bg.png","http://pbs.twimg.com/profile_images/1344056897155063808/zdD0fQgS_normal.jpg"
"x501874833","x1444728107123019776",2021-10-03 18:16:37,"s_margiotta","Smoked Mauro Icardi, won a treble with Bayern, come home to win the scudetto with Inter, we gotta put som respect on Ivan Perisic's name https://t.co/L5D8usj0Fb","Twitter for iPad",140,,,,FALSE,TRUE,0,322,,,,,,,,,,,,,,,,"x166517967","SiavoushF","en",,,,,,,,,,,,,,,,"x1444701159982346242","Smoked Mauro Icardi, won a treble with Bayern, come home to win the scudetto with Inter, we gotta put som respect on Ivan Perisic's name https://t.co/L5D8usj0Fb",2021-10-03 16:29:32,"Twitter Web App",3375,322,"x166517967","SiavoushF","Siavoush Fallahi",31483,1084,131745,"Stockholm","Sports journalist @Eurosport.
Tweets about Serie A & European #football. #Calcio",TRUE,,,,,,,"NA NA","NA NA","NA NA NA NA NA NA NA NA","https://twitter.com/s_margiotta/status/1444728107123019776","Salvatore Margiotta","Roma, Potenza","Senatore, ingegnere, professore universitario. Capogruppo Commissione lavori pubblici e trasporti. Segretario Presidenza Senato","https://t.co/aeYZnOeRaN",FALSE,15681,7305,209,79655,59972,2012-02-24 15:30:04,TRUE,"https://t.co/aeYZnOeRaN","http://instangram.com/salvatore__margiotta",,"https://pbs.twimg.com/profile_banners/501874833/1483357085","http://abs.twimg.com/images/themes/theme1/bg.png","http://pbs.twimg.com/profile_images/1344056897155063808/zdD0fQgS_normal.jpg"
"x501874833","x1444727247689093122",2021-10-03 18:13:12,"s_margiotta","@GiusvaPulejo 7 vittorie su 7…sarà dura quest’anno superarli…","Twitter for iPad",47,"x1444726612252110856","x932393936","GiusvaPulejo",FALSE,FALSE,0,0,,,,,,,,,,,,,,,,"x932393936","GiusvaPulejo","it",,,,,,,,,,,,,,,,,,,,,,,,,,,,,,,,,,,,,"NA NA","NA NA","NA NA NA NA NA NA NA NA","https://twitter.com/s_margiotta/status/1444727247689093122","Salvatore Margiotta","Roma, Potenza","Senatore, ingegnere, professore universitario. Capogruppo Commissione lavori pubblici e trasporti. Segretario Presidenza Senato","https://t.co/aeYZnOeRaN",FALSE,15681,7305,209,79655,59972,2012-02-24 15:30:04,TRUE,"https://t.co/aeYZnOeRaN","http://instangram.com/salvatore__margiotta",,"https://pbs.twimg.com/profile_banners/501874833/1483357085","http://abs.twimg.com/images/themes/theme1/bg.png","http://pbs.twimg.com/profile_images/1344056897155063808/zdD0fQgS_normal.jpg"
"x501874833","x1444725780387438594",2021-10-03 18:07:22,"s_margiotta","@convivioblog @ricpuglisi Una incredibile sequela di sciocchezze","Twitter for iPad",38,"x1444723391152406534","x247863643","convivioblog",FALSE,FALSE,19,0,,,,,,,,,,,,,,,,"x247863643 x225168723","convivioblog ricpuglisi","it",,,,,,,,,,,,,,,,,,,,,,,,,,,,,,,,,,,,,"NA NA","NA NA","NA NA NA NA NA NA NA NA","https://twitter.com/s_margiotta/status/1444725780387438594","Salvatore Margiotta","Roma, Potenza","Senatore, ingegnere, professore universitario. Capogruppo Commissione lavori pubblici e trasporti. Segretario Presidenza Senato","https://t.co/aeYZnOeRaN",FALSE,15681,7305,209,79655,59972,2012-02-24 15:30:04,TRUE,"https://t.co/aeYZnOeRaN","http://instangram.com/salvatore__margiotta",,"https://pbs.twimg.com/profile_banners/501874833/1483357085","http://abs.twimg.com/images/themes/theme1/bg.png","http://pbs.twimg.com/profile_images/1344056897155063808/zdD0fQgS_normal.jpg"
"x501874833","x1444710437510074369",2021-10-03 17:06:24,"s_margiotta","@s_margiotta @pierolacorazza @TgRaiBasilicata @LaNuovadelSud @quotidianoweb @TRMh24 @AnsaBasilicata @cronachemezzog @cronachelucane @IlMattinoFoggia Anche a Tramutola abbiamo raggiunto il quorum!!","Twitter for iPad",140,,,,FALSE,TRUE,0,1,,,,,,,,,,,,,,,,"x1086976080 x501874833 x460533065 x4846038599 x485636647 x292831062 x978662725 x1116792006 x1020230252","Nunoriolo s_margiotta pierolacorazza TgRaiBasilicata LaNuovadelSud quotidianoweb TRMh24 AnsaBasilicata cronachemezzog","it",,,,,,,,,,,,,,,,"x1444709844230053892","@s_margiotta @pierolacorazza @TgRaiBasilicata @LaNuovadelSud @quotidianoweb @TRMh24 @AnsaBasilicata @cronachemezzog @cronachelucane @IlMattinoFoggia Anche a Tramutola abbiamo raggiunto il quorum!!",2021-10-03 17:04:02,"Twitter for iPhone",5,1,"x1086976080","Nunoriolo","Nunzio Oriolo",547,988,1330,"TRAMUTOLA (PZ)","geologo - sposato con due figli.",FALSE,,,,,,,"NA NA","NA NA","NA NA NA NA NA NA NA NA","https://twitter.com/s_margiotta/status/1444710437510074369","Salvatore Margiotta","Roma, Potenza","Senatore, ingegnere, professore universitario. Capogruppo Commissione lavori pubblici e trasporti. Segretario Presidenza Senato","https://t.co/aeYZnOeRaN",FALSE,15681,7305,209,79655,59972,2012-02-24 15:30:04,TRUE,"https://t.co/aeYZnOeRaN","http://instangram.com/salvatore__margiotta",,"https://pbs.twimg.com/profile_banners/501874833/1483357085","http://abs.twimg.com/images/themes/theme1/bg.png","http://pbs.twimg.com/profile_images/1344056897155063808/zdD0fQgS_normal.jpg"
"x545136488","x1444759377492258816",2021-10-03 20:20:52,"FraMirabelli","Eccoci a brindare insieme alle persone che hanno costruito una rete solida a sostegno dei nostri 25 anni + 1 di teatro sociale nel carcere minorile Beccaria di Milano ! #teatrosociale #alleanze #giustiziaminorile #Teatro https://t.co/ggIZ7BnvJ8","Twitter for iPhone",140,,,,FALSE,TRUE,0,2,,,,,,,,,,,,,,,,"x36457874","PuntozeroTeatro","it",,,,,,,,,,,,,,,,"x1444239022801530881","Eccoci a brindare insieme alle persone che hanno costruito una rete solida a sostegno dei nostri 25 anni + 1 di teatro sociale nel carcere minorile Beccaria di Milano ! #teatrosociale #alleanze #giustiziaminorile #Teatro https://t.co/ggIZ7BnvJ8",2021-10-02 09:53:10,"Twitter Web App",1,2,"x36457874","PuntozeroTeatro","Puntozero Teatro",298,559,717,"Milano","#SOGNOUNTEATRO",FALSE,,,,,,,"NA NA","NA NA","NA NA NA NA NA NA NA NA","https://twitter.com/FraMirabelli/status/1444759377492258816","Franco Mirabelli","Senatore della Repubblica","Al Senato nella XVIII legislatura. Sono in direzione nazionale del PD. Inguaribile interista. Credo al principio di responsabilità.","https://t.co/B2OuGikaFw",FALSE,3177,329,78,7679,219,2012-04-04 13:43:24,TRUE,"https://t.co/B2OuGikaFw","http://www.francomirabelli.it",,"https://pbs.twimg.com/profile_banners/545136488/1480921204","http://abs.twimg.com/images/themes/theme1/bg.png","http://pbs.twimg.com/profile_images/805667781186322432/TKk4fYcJ_normal.jpg"
"x336975968","x1445020108296949765",2021-10-04 13:36:55,"antoniomisiani","Nervi saldi, sono solo exit polls!! 😜🤞🤞#elezioniamministrative2021 #elezioni2021","Twitter for iPhone",80,,,,FALSE,FALSE,11,1,,,"elezioniamministrative2021 elezioni2021",,,,,,,,,,,,,,,"it",,,,,,,,,,,,,,,,,,,,,,,,,,,,,,,,,,,,,"NA NA","NA NA","NA NA NA NA NA NA NA NA","https://twitter.com/antoniomisiani/status/1445020108296949765","Antonio Misiani","Bergamo, Lombardia","Senatore Pd di Bergamo e Brescia. Responsabile economia e finanze nella Segreteria nazionale PD. Marito di Maria Ines, padre di Maria Chiara e Marco.","https://t.co/AiQJlPBDNJ",FALSE,8912,1930,148,3859,1700,2011-07-17 07:05:58,TRUE,"https://t.co/AiQJlPBDNJ","http://www.antoniomisiani.it",,"https://pbs.twimg.com/profile_banners/336975968/1615037924","http://abs.twimg.com/images/themes/theme1/bg.png","http://pbs.twimg.com/profile_images/1136376924081512448/vtKdIVYV_normal.jpg"
"x1056543564241481728","x1444954173502640133",2021-10-04 09:14:55,"FiammettaModena","L'ANGOLO DI FIAMMETTA MODENA.... https://t.co/QlGuQ0bCAI via @YouTube @FiammettaModena @berlusconi @newsForzaItalia 
@forza_italia @GruppoFISenato @LiciaRonzulli @msgelmini @mara_carfagna @giorgiomule @fp_sisto","Twitter Web App",140,,,,FALSE,TRUE,0,3,,,,,"youtu.be/sjjbBT4ifMY","https://t.co/QlGuQ0bCAI","https://youtu.be/sjjbBT4ifMY",,,,,,,,,"x79814913 x10228272 x1056543564241481728 x920277002858500096 x920740854561673217","PrimaPaginaNews YouTube FiammettaModena berlusconi newsForzaItalia","it",,,,,,,,,,,,,,,,"x1444953639974576132","L'ANGOLO DI FIAMMETTA MODENA.... https://t.co/QlGuQ0bCAI via @YouTube @FiammettaModena @berlusconi @newsForzaItalia 
@forza_italia @GruppoFISenato @LiciaRonzulli @msgelmini @mara_carfagna @giorgiomule @fp_sisto",2021-10-04 09:12:48,"Twitter Web App",3,3,"x79814913","PrimaPaginaNews","Prima Pagina News",3428,4978,35516,"Roma","Agenzia di Stampa Quotidiana Nazionale",FALSE,,,,,,,"NA NA","NA NA","NA NA NA NA NA NA NA NA","https://twitter.com/FiammettaModena/status/1444954173502640133","Fiammetta Modena","Perugia","Senatore della Repubblica Italiana (FI - XVIII) 🇮🇹 
Membro Commissione Giustizia e Bilancio - Giunta Immunità - Avvocato presso #StudioLegaleModena","https://t.co/gTF6j3uQgf",FALSE,1151,1193,5,1939,2356,2018-10-28 13:49:50,TRUE,"https://t.co/gTF6j3uQgf","http://www.senato.it/leg/18/BGT/Schede/Attsen/00032671.htm",,"https://pbs.twimg.com/profile_banners/1056543564241481728/1619698079","http://abs.twimg.com/images/themes/theme1/bg.png","http://pbs.twimg.com/profile_images/1387462469875077124/iB-DnnKG_normal.jpg"
"x102672182","x1444730195655675917",2021-10-03 18:24:55,"robertapinotti","3 October 1934 | A Polish Jewish girl, Nina Ehrlich, was born in Sosnowiec.

In 1943 she was deported to #Auschwitz from Będzin ghetto. She was murdered in a gas chamber. https://t.co/CEVes24p0G","Twitter for iPhone",140,,,,FALSE,TRUE,0,2387,,,"Auschwitz",,,,,,,,,,,,,"x586291040","AuschwitzMuseum","pl",,,,,,,,,,,,,,,,"x1444618230610337797","3 October 1934 | A Polish Jewish girl, Nina Ehrlich, was born in Sosnowiec.

In 1943 she was deported to #Auschwitz from Będzin ghetto. She was murdered in a gas chamber. https://t.co/CEVes24p0G",2021-10-03 11:00:00,"Twitter Web App",11441,2387,"x586291040","AuschwitzMuseum","Auschwitz Memorial",1172607,2374,100888,"Oświęcim, Polska","Official account EN. The Memorial preserves the site of the former German Nazi Auschwitz concentration and extermination camp. You can help https://t.co/j6IljJa4vT",TRUE,,,,,,,"NA NA","NA NA","NA NA NA NA NA NA NA NA","https://twitter.com/robertapinotti/status/1444730195655675917","Roberta Pinotti","","Senatrice del Partito Democratico","https://t.co/ZQoLx1Tx21",FALSE,124050,1749,770,11100,3418,2010-01-07 13:03:42,TRUE,"https://t.co/ZQoLx1Tx21","http://www.robertapinotti.it",,"https://pbs.twimg.com/profile_banners/102672182/1522225477","http://abs.twimg.com/images/themes/theme1/bg.png","http://pbs.twimg.com/profile_images/1093446366997684224/pnplPDaI_normal.jpg"
"x3062283743","x1444944526565588995",2021-10-04 08:36:35,"pirroelisa","12 anni di @Mov5Stelle, 12 anni di impegno, di battaglie civiche, di ostinazione per difendere beni comuni e diritti sociali. Siamo cambiati, perché crescendo si evolve e si matura, ma i nostri principi sono gli stessi che ci hanno animato allora. Buon compleanno Movimento ⭐️ https://t.co/qYSgKuehpj","Twitter for iPhone",276,,,,FALSE,FALSE,60,19,,,,,,,,"http://pbs.twimg.com/media/FA15YxaX0AAUOdl.jpg","https://t.co/qYSgKuehpj","https://twitter.com/pirroelisa/status/1444944526565588995/photo/1","photo","http://pbs.twimg.com/media/FA15YxaX0AAUOdl.jpg","https://t.co/qYSgKuehpj","https://twitter.com/pirroelisa/status/1444944526565588995/photo/1",,"x289400495","Mov5Stelle","it",,,,,,,,,,,,,,,,,,,,,,,,,,,,,,,,,,,,,"NA NA","NA NA","NA NA NA NA NA NA NA NA","https://twitter.com/pirroelisa/status/1444944526565588995","Elisa Pirro","Orbassano, Piemonte","Senatrice della Repubblica @M5S_Senato @Mov5Stelle. Capogruppo della 12ª Commissione permanente (Igiene e Sanità) del Senato",,FALSE,1618,202,18,1647,5161,2015-02-25 15:22:04,TRUE,,,,"https://pbs.twimg.com/profile_banners/3062283743/1632556454","http://abs.twimg.com/images/themes/theme1/bg.png","http://pbs.twimg.com/profile_images/1342556797048119297/PL5jOg4Z_normal.jpg"
"x3358881567","x1444997159431122956",2021-10-04 12:05:44,"PucciarelliLega","🇮🇹 Al Congresso dei Direttori dei Centri d’Eccellenza della NATO, il più importante appuntamento annuale CoE ospitato presso l’istituto militare di Vicenza.

@NSPCOE 
👉 https://t.co/5DnMP26X7E https://t.co/AXtTlmXmvT","Twitter for iPad",192,,,,FALSE,FALSE,10,4,,,,,"facebook.com/10618422538731…","https://t.co/5DnMP26X7E","https://www.facebook.com/1061842253873158/posts/4546480435409305/","http://pbs.twimg.com/media/FA2pP_2XIAcK2fP.jpg","https://t.co/AXtTlmXmvT","https://twitter.com/PucciarelliLega/status/1444997159431122956/photo/1","photo","http://pbs.twimg.com/media/FA2pP_2XIAcK2fP.jpg http://pbs.twimg.com/media/FA2pP_wWQAEadY8.jpg http://pbs.twimg.com/media/FA2pQAdWUAQxdbp.jpg http://pbs.twimg.com/media/FA2pQAWX0AAkyaq.jpg","https://t.co/AXtTlmXmvT https://t.co/AXtTlmXmvT https://t.co/AXtTlmXmvT https://t.co/AXtTlmXmvT","https://twitter.com/PucciarelliLega/status/1444997159431122956/photo/1 https://twitter.com/PucciarelliLega/status/1444997159431122956/photo/1 https://twitter.com/PucciarelliLega/status/1444997159431122956/photo/1 https://twitter.com/PucciarelliLega/status/1444997159431122956/photo/1",,"x4098025317","NSPCOE","it",,,,,,,,,,,,,,,,,,,,,,,,,,,,,,,,,,,,,"NA NA","NA NA","NA NA NA NA NA NA NA NA","https://twitter.com/PucciarelliLega/status/1444997159431122956","Stefania Pucciarelli","","Senatrice della #Lega, Sottosegretario di Stato al Ministero della Difesa 🇮🇹","https://t.co/yVArIYFe54",FALSE,1201,293,16,950,165,2015-07-04 16:46:43,TRUE,"https://t.co/yVArIYFe54","http://stefaniapucciarelli.it",,"https://pbs.twimg.com/profile_banners/3358881567/1616173825","http://abs.twimg.com/images/themes/theme1/bg.png","http://pbs.twimg.com/profile_images/1372958645944729607/A64UTDLI_normal.jpg"
"x3358881567","x1444933247889199104",2021-10-04 07:51:46,"PucciarelliLega","🔴 In diretta da Confindustria Vicenza per Assemblea dei direttori dei centri di eccellenza NATO.

https://t.co/u046wkcXjq","Twitter for iPhone",121,,,,FALSE,FALSE,1,0,,,,,"video.confindustria.vicenza.it/coe-directors-…","https://t.co/u046wkcXjq","https://video.confindustria.vicenza.it/coe-directors-conference-2021/dbd2040e2f466dacb1a4",,,,,,,,,,,"it",,,,,,,,,,,,,,,,,,,,,,,,,,,,,,,,,,,,,"NA NA","NA NA","NA NA NA NA NA NA NA NA","https://twitter.com/PucciarelliLega/status/1444933247889199104","Stefania Pucciarelli","","Senatrice della #Lega, Sottosegretario di Stato al Ministero della Difesa 🇮🇹","https://t.co/yVArIYFe54",FALSE,1201,293,16,950,165,2015-07-04 16:46:43,TRUE,"https://t.co/yVArIYFe54","http://stefaniapucciarelli.it",,"https://pbs.twimg.com/profile_banners/3358881567/1616173825","http://abs.twimg.com/images/themes/theme1/bg.png","http://pbs.twimg.com/profile_images/1372958645944729607/A64UTDLI_normal.jpg"
"x3358881567","x1444747800152059911",2021-10-03 19:34:52,"PucciarelliLega","@NATO #2021CoEDirConference’s icebreaker. What a view you are missing! #WeARENATO #StrongerTogether
@NATO_ACT
@ItalyatNATO
@PucciarelliLega
@NATO_JWC
@AtlForum 
@SHAPE_NATO https://t.co/EwYXI8nWWk","Twitter for iPhone",140,,,,FALSE,TRUE,0,15,,,"2021CoEDirConference WeARENATO StrongerTogether",,,,,,,,,,,,,"x4098025317 x83795099 x22975123 x2900782241","NSPCOE NATO NATO_ACT ItalyatNATO","en",,,,,,,,,,,,,,,,"x1444719555142684673","@NATO #2021CoEDirConference’s icebreaker. What a view you are missing! #WeARENATO #StrongerTogether
@NATO_ACT
@ItalyatNATO
@PucciarelliLega
@NATO_JWC
@AtlForum 
@SHAPE_NATO https://t.co/EwYXI8nWWk",2021-10-03 17:42:38,"Twitter for Android",26,15,"x4098025317","NSPCOE","NATO STABILITY POLICING CENTRE OF EXCELLENCE",1834,370,4981,"Vicenza, Veneto","#NATO #StabilityPolicing #CentreOfExcellence is the hub of expertise on #SP within the #Alliance thr/ #Doctrine, #Training, Exercises/Drills & #LessonsLearned",FALSE,,,,,,,"NA NA","NA NA","NA NA NA NA NA NA NA NA","https://twitter.com/PucciarelliLega/status/1444747800152059911","Stefania Pucciarelli","","Senatrice della #Lega, Sottosegretario di Stato al Ministero della Difesa 🇮🇹","https://t.co/yVArIYFe54",FALSE,1201,293,16,950,165,2015-07-04 16:46:43,TRUE,"https://t.co/yVArIYFe54","http://stefaniapucciarelli.it",,"https://pbs.twimg.com/profile_banners/3358881567/1616173825","http://abs.twimg.com/images/themes/theme1/bg.png","http://pbs.twimg.com/profile_images/1372958645944729607/A64UTDLI_normal.jpg"
"x376610294","x1445024415520071681",2021-10-04 13:54:02,"isabellarauti","Archivio Rauti, la figlia Isabella: «Vi spiego la persecuzione contro il direttore della Biblioteca» https://t.co/JVByM2tEHD https://t.co/HpKZEOk5MR","Twitter Web App",140,,,,FALSE,TRUE,0,2,,,,,,,,,,,,,,,,"x1397757626","SecolodItalia1","it",,,,,,,,,,,,,,,,"x1444359411556753413","Archivio Rauti, la figlia Isabella: «Vi spiego la persecuzione contro il direttore della Biblioteca» https://t.co/JVByM2tEHD https://t.co/HpKZEOk5MR",2021-10-02 17:51:33,"dlvr.it",18,2,"x1397757626","SecolodItalia1","Secolo d'Italia",14358,383,131065,"Roma","Il quotidiano web della Destra italiana.",FALSE,,,,,,,"NA NA","NA NA","NA NA NA NA NA NA NA NA","https://twitter.com/isabellarauti/status/1445024415520071681","Isabella Rauti","","Giornalista, Dottore di Ricerca, Uff Esercito 🇮🇹, Senatrice, Vice Pres Gruppo FDI, Comm Difesa, Dipartimento Famiglia FDI, Associazione Pino Rauti, Onlus HOW","https://t.co/IE1TYO9vGj",FALSE,12277,5613,120,25662,15016,2011-09-20 05:48:40,TRUE,"https://t.co/IE1TYO9vGj","http://www.Isabellarauti.it",,"https://pbs.twimg.com/profile_banners/376610294/1580146815","http://abs.twimg.com/images/themes/theme1/bg.png","http://pbs.twimg.com/profile_images/699248798707621888/sTn5ZaWE_normal.jpg"
"x376610294","x1445019214344073216",2021-10-04 13:33:22,"isabellarauti","Fabio Andriola/ Dalle foibe a Pino Rauti, la Storia come campo di battaglia
👉 https://t.co/uqQwpaggIn 

#Storia #Destra #PinoRauti #Foibe #ArchivioStorico #CentroStudiPinoRauti 
@InRicordoDiPino","Twitter Web App",194,,,,FALSE,FALSE,4,2,,,"Storia Destra PinoRauti Foibe ArchivioStorico CentroStudiPinoRauti",,"destra.it/home/fabio-and…","https://t.co/uqQwpaggIn","https://www.destra.it/home/fabio-andriola-dalle-foibe-a-pino-rauti-la-storia-come-campo-di-battaglia/?fbclid=IwAR1PmMRMS77ZP3cbITkTTW59YzQTSntnty_Yg8uZ8AeOGtGknpB-6P5y55I",,,,,,,,,"x920983700","InRicordoDiPino","it",,,,,,,,,,,,,,,,,,,,,,,,,,,,,,,,,,,,,"NA NA","NA NA","NA NA NA NA NA NA NA NA","https://twitter.com/isabellarauti/status/1445019214344073216","Isabella Rauti","","Giornalista, Dottore di Ricerca, Uff Esercito 🇮🇹, Senatrice, Vice Pres Gruppo FDI, Comm Difesa, Dipartimento Famiglia FDI, Associazione Pino Rauti, Onlus HOW","https://t.co/IE1TYO9vGj",FALSE,12277,5613,120,25662,15016,2011-09-20 05:48:40,TRUE,"https://t.co/IE1TYO9vGj","http://www.Isabellarauti.it",,"https://pbs.twimg.com/profile_banners/376610294/1580146815","http://abs.twimg.com/images/themes/theme1/bg.png","http://pbs.twimg.com/profile_images/699248798707621888/sTn5ZaWE_normal.jpg"
"x376610294","x1444774220265836558",2021-10-03 21:19:51,"isabellarauti","Presentato il libro ""Frecce Tricolori - l' arte del volo acrobatico""

È online la nuova edizione di #VideoNews AM
➡️https://t.co/9BYHBVfr62

#FrecceTricolori
#AeronauticaMilitare
#ForzeArmate🇮🇹 #UnaForzaperilPaese
#3ottobre 
https://t.co/r0ulGDeG08","Twitter for iPhone",140,,,,FALSE,TRUE,0,6,,,"VideoNews",,,,,,,,,,,,,"x1919237072","SM_Difesa","it",,,,,,,,,,,,,,,,"x1444562161766912002","Presentato il libro ""Frecce Tricolori - l' arte del volo acrobatico""

È online la nuova edizione di #VideoNews AM
➡️https://t.co/9BYHBVfr62

#FrecceTricolori
#AeronauticaMilitare
#ForzeArmate🇮🇹 #UnaForzaperilPaese
#3ottobre 
https://t.co/r0ulGDeG08",2021-10-03 07:17:12,"Twitter Web App",33,6,"x1919237072","SM_Difesa","Forze Armate StatoMaggioreDifesa",73084,120,18824,"Roma","Profilo ufficiale Twitter dello Stato Maggiore della Difesa. #ForzeArmate 🇮🇹 #MissioniMilitari #UnaForzaperilPaese Social netiquette https://t.co/wOF3Y1c9SI",TRUE,,,,,,,"NA NA","NA NA","NA NA NA NA NA NA NA NA","https://twitter.com/isabellarauti/status/1444774220265836558","Isabella Rauti","","Giornalista, Dottore di Ricerca, Uff Esercito 🇮🇹, Senatrice, Vice Pres Gruppo FDI, Comm Difesa, Dipartimento Famiglia FDI, Associazione Pino Rauti, Onlus HOW","https://t.co/IE1TYO9vGj",FALSE,12277,5613,120,25662,15016,2011-09-20 05:48:40,TRUE,"https://t.co/IE1TYO9vGj","http://www.Isabellarauti.it",,"https://pbs.twimg.com/profile_banners/376610294/1580146815","http://abs.twimg.com/images/themes/theme1/bg.png","http://pbs.twimg.com/profile_images/699248798707621888/sTn5ZaWE_normal.jpg"
"x376610294","x1444773988283129857",2021-10-03 21:18:56,"isabellarauti","Boomerang #FanPage e #Piazzapulita: il programma di Formigli contro @FratellidItalia ha registrato 1040000 spettatori. Il video di replica di Giorgia #Meloni ha superato quel numero in poche ore su Facebook e con le altre pagine e piattaforme lo ha doppiato. Umiliati e derisi.","Twitter for iPhone",140,,,,FALSE,TRUE,0,28,,,"FanPage Piazzapulita",,,,,,,,,,,,,"x204814083 x1024976264","GioFazzolari FratellidItalia","it",,,,,,,,,,,,,,,,"x1444742135375437827","Boomerang #FanPage e #Piazzapulita: il programma di Formigli contro @FratellidItalia ha registrato 1040000 spettatori. Il video di replica di Giorgia #Meloni ha superato quel numero in poche ore su Facebook e con le altre pagine e piattaforme lo ha doppiato. Umiliati e derisi.",2021-10-03 19:12:21,"Twitter for iPhone",85,28,"x204814083","GioFazzolari","Giovanbattista Fazzolari 🇮🇹",2237,373,4917,"Italia","Senatore e Responsabile del programma di Fratelli d’Italia",FALSE,,,,,,,"NA NA","NA NA","NA NA NA NA NA NA NA NA","https://twitter.com/isabellarauti/status/1444773988283129857","Isabella Rauti","","Giornalista, Dottore di Ricerca, Uff Esercito 🇮🇹, Senatrice, Vice Pres Gruppo FDI, Comm Difesa, Dipartimento Famiglia FDI, Associazione Pino Rauti, Onlus HOW","https://t.co/IE1TYO9vGj",FALSE,12277,5613,120,25662,15016,2011-09-20 05:48:40,TRUE,"https://t.co/IE1TYO9vGj","http://www.Isabellarauti.it",,"https://pbs.twimg.com/profile_banners/376610294/1580146815","http://abs.twimg.com/images/themes/theme1/bg.png","http://pbs.twimg.com/profile_images/699248798707621888/sTn5ZaWE_normal.jpg"
