"x906269360","x1429816539428044804",2021-08-23 14:43:22,"tripodimaria","Questa è la situazione in cui i miei concittadini, sono costretti a vivere a #Chorio di #SanLorenzo da oltre un anno,come in altre zone dell’#AreaMetropolitana di #ReggioCal.Ho appena depositato un’interpellanza urgente ai Ministeri competenti per chiedere immediato intervento! https://t.co/ZON3WCFKVi","Twitter for iPhone",278,,,,FALSE,FALSE,3,2,,,"Chorio SanLorenzo AreaMetropolitana ReggioCal",,,,,"http://pbs.twimg.com/media/E9e6jmIXoAYWxEw.jpg","https://t.co/ZON3WCFKVi","https://twitter.com/tripodimaria/status/1429816539428044804/photo/1","photo","http://pbs.twimg.com/media/E9e6jmIXoAYWxEw.jpg","https://t.co/ZON3WCFKVi","https://twitter.com/tripodimaria/status/1429816539428044804/photo/1",,,,"it",,,,,,,,,,,,,,,,,,,,,,,,,,,,,,,,,,,,,"NA NA","NA NA","NA NA NA NA NA NA NA NA","https://twitter.com/tripodimaria/status/1429816539428044804","Maria Tripodi","","Deputato della Repubblica•  Eletta nel CollegioCalabria2• Capogruppo @forza_Italia CommissioneDifesa•  Dottssa in Relazioni Internazionali•",,FALSE,6469,2310,44,11199,15590,2012-10-26 15:54:35,FALSE,,,,"https://pbs.twimg.com/profile_banners/906269360/1521784227","http://abs.twimg.com/images/themes/theme1/bg.png","http://pbs.twimg.com/profile_images/809321296794415104/jDezppyk_normal.jpg"
"x906269360","x1429743999275999237",2021-08-23 09:55:07,"tripodimaria","Vi aspetto più tardi a #TgCom24! https://t.co/kAoXcunxiM","Twitter for iPhone",32,,,,FALSE,FALSE,8,4,,,"TgCom24",,,,,"http://pbs.twimg.com/media/E9d4ldTXIAUOnN5.jpg","https://t.co/kAoXcunxiM","https://twitter.com/tripodimaria/status/1429743999275999237/photo/1","photo","http://pbs.twimg.com/media/E9d4ldTXIAUOnN5.jpg","https://t.co/kAoXcunxiM","https://twitter.com/tripodimaria/status/1429743999275999237/photo/1",,,,"it",,,,,,,,,,,,,,,,,,,,,,,,,,,,,,,,,,,,,"NA NA","NA NA","NA NA NA NA NA NA NA NA","https://twitter.com/tripodimaria/status/1429743999275999237","Maria Tripodi","","Deputato della Repubblica•  Eletta nel CollegioCalabria2• Capogruppo @forza_Italia CommissioneDifesa•  Dottssa in Relazioni Internazionali•",,FALSE,6469,2310,44,11199,15590,2012-10-26 15:54:35,FALSE,,,,"https://pbs.twimg.com/profile_banners/906269360/1521784227","http://abs.twimg.com/images/themes/theme1/bg.png","http://pbs.twimg.com/profile_images/809321296794415104/jDezppyk_normal.jpg"
"x447056150","x1429594974786629635",2021-08-23 00:02:57,"GiusyVersace","During today's press conference we stopped for cake for Markus Rehm's birthday.

Rehm is aiming to break his own world record (8.62m) in the T64 long jump at #Tokyo2020. Will there be more celebrations for Markus? 

@ParaAthletics @teamdpara @TeamD https://t.co/3oiLN7Ib2o","Twitter for Android",140,,,,FALSE,TRUE,0,33,,,,,,,,,,,,,,,,"x234399791","Paralympics","en",,,,,,,,,,,,,,,,"x1429444495964196864","During today's press conference we stopped for cake for Markus Rehm's birthday.

Rehm is aiming to break his own world record (8.62m) in the T64 long jump at #Tokyo2020. Will there be more celebrations for Markus? 

@ParaAthletics @teamdpara @TeamD https://t.co/3oiLN7Ib2o",2021-08-22 14:05:00,"Twitter Media Studio",152,33,"x234399791","Paralympics","Paralympic Games",276766,3077,36905,"","The Tokyo 2020 #Paralympics begin on August 24. Follow us on Instagram & Tiktok/@paralympics",TRUE,,,,,,,"NA NA","NA NA","NA NA NA NA NA NA NA NA","https://twitter.com/GiusyVersace/status/1429594974786629635","Giusy Versace","Milano","Cominciate col fare il necessario, poi cio' che e' possibile e all'improvviso vi sorprenderete a fare l'impossibile - S.Francesco d'Assisi","http://t.co/jemrvujzQb",FALSE,25956,2090,124,21706,15997,2011-12-26 13:05:12,TRUE,"http://t.co/jemrvujzQb","http://www.giusyversace.it",,"https://pbs.twimg.com/profile_banners/447056150/1363347299","http://abs.twimg.com/images/themes/theme1/bg.png","http://pbs.twimg.com/profile_images/378800000828007270/bad08b8529048aef2d0a82e084b0b31a_normal.jpeg"
"x447056150","x1429594892423110661",2021-08-23 00:02:37,"GiusyVersace","Yeah, it took a little more time than we expected. But hey, we are here, and we are ready, Tokyo! #1DayToGo 

#Paralympics #Tokyo2020 @Tokyo2020 https://t.co/88LITCRMFv","Twitter for Android",140,,,,FALSE,TRUE,0,98,,,"1DayToGo Paralympics",,,,,,,,,,,,,"x234399791","Paralympics","en",,,,,,,,,,,,,,,,"x1429581491596529666","Yeah, it took a little more time than we expected. But hey, we are here, and we are ready, Tokyo! #1DayToGo 

#Paralympics #Tokyo2020 @Tokyo2020 https://t.co/88LITCRMFv",2021-08-22 23:09:22,"Twitter Web App",399,98,"x234399791","Paralympics","Paralympic Games",276766,3077,36905,"","The Tokyo 2020 #Paralympics begin on August 24. Follow us on Instagram & Tiktok/@paralympics",TRUE,,,,,,,"NA NA","NA NA","NA NA NA NA NA NA NA NA","https://twitter.com/GiusyVersace/status/1429594892423110661","Giusy Versace","Milano","Cominciate col fare il necessario, poi cio' che e' possibile e all'improvviso vi sorprenderete a fare l'impossibile - S.Francesco d'Assisi","http://t.co/jemrvujzQb",FALSE,25956,2090,124,21706,15997,2011-12-26 13:05:12,TRUE,"http://t.co/jemrvujzQb","http://www.giusyversace.it",,"https://pbs.twimg.com/profile_banners/447056150/1363347299","http://abs.twimg.com/images/themes/theme1/bg.png","http://pbs.twimg.com/profile_images/378800000828007270/bad08b8529048aef2d0a82e084b0b31a_normal.jpeg"
"x447056150","x1429594856616349697",2021-08-23 00:02:29,"GiusyVersace","Let's watch the #Tokyo2020 #Paralympics together! 📺

Check out your local @Tokyo2020 Paralympics TV, radio and online broadcasters to follow all the action. Live events will also be available on our Youtube and Facebook, subject to geoblocking restrictions.","Twitter for Android",140,,,,FALSE,TRUE,0,207,,,"Tokyo2020 Paralympics",,,,,,,,,,,,,"x234399791 x2249745696","Paralympics Tokyo2020","en",,,,,,,,,,,,,,,,"x1428341416044875783","Let's watch the #Tokyo2020 #Paralympics together! 📺

Check out your local @Tokyo2020 Paralympics TV, radio and online broadcasters to follow all the action. Live events will also be available on our Youtube and Facebook, subject to geoblocking restrictions.",2021-08-19 13:01:45,"Twitter for Advertisers",598,207,"x234399791","Paralympics","Paralympic Games",276766,3077,36905,"","The Tokyo 2020 #Paralympics begin on August 24. Follow us on Instagram & Tiktok/@paralympics",TRUE,,,,,,,"NA NA","NA NA","NA NA NA NA NA NA NA NA","https://twitter.com/GiusyVersace/status/1429594856616349697","Giusy Versace","Milano","Cominciate col fare il necessario, poi cio' che e' possibile e all'improvviso vi sorprenderete a fare l'impossibile - S.Francesco d'Assisi","http://t.co/jemrvujzQb",FALSE,25956,2090,124,21706,15997,2011-12-26 13:05:12,TRUE,"http://t.co/jemrvujzQb","http://www.giusyversace.it",,"https://pbs.twimg.com/profile_banners/447056150/1363347299","http://abs.twimg.com/images/themes/theme1/bg.png","http://pbs.twimg.com/profile_images/378800000828007270/bad08b8529048aef2d0a82e084b0b31a_normal.jpeg"
"x447056150","x1429594536746029063",2021-08-23 00:01:12,"GiusyVersace","Il settimanale Oggi dedica all’imminente Paralimpiade di Tokyo - e a me questa sembra una buona notizia - 4 pagine con ritratti di azzurri attesi a medaglia. 🇮🇹
Storie di sport, come si deve.
La seconda buona notizia è che la RAI dedicherà 13 ore di racconto quotidiano in diretta https://t.co/MWgEqsHssE","Twitter for Android",140,,,,FALSE,TRUE,0,5,,,,,,,,,,,,,,,,"x433268408","MarcDelCheccolo","it",,,,,,,,,,,,,,,,"x1428280725846073345","Il settimanale Oggi dedica all’imminente Paralimpiade di Tokyo - e a me questa sembra una buona notizia - 4 pagine con ritratti di azzurri attesi a medaglia. 🇮🇹
Storie di sport, come si deve.
La seconda buona notizia è che la RAI dedicherà 13 ore di racconto quotidiano in diretta https://t.co/MWgEqsHssE",2021-08-19 09:00:35,"Twitter for iPhone",66,5,"x433268408","MarcDelCheccolo","Marco Del Checcolo",848,580,2775,"","Pantheon: Toto', Eduardo e Peppino De Filippo, Massimo Troisi, Pino Daniele. E il Sic. Unico hobby il Calcio Napoli.",FALSE,,,,,,,"NA NA","NA NA","NA NA NA NA NA NA NA NA","https://twitter.com/GiusyVersace/status/1429594536746029063","Giusy Versace","Milano","Cominciate col fare il necessario, poi cio' che e' possibile e all'improvviso vi sorprenderete a fare l'impossibile - S.Francesco d'Assisi","http://t.co/jemrvujzQb",FALSE,25956,2090,124,21706,15997,2011-12-26 13:05:12,TRUE,"http://t.co/jemrvujzQb","http://www.giusyversace.it",,"https://pbs.twimg.com/profile_banners/447056150/1363347299","http://abs.twimg.com/images/themes/theme1/bg.png","http://pbs.twimg.com/profile_images/378800000828007270/bad08b8529048aef2d0a82e084b0b31a_normal.jpeg"
"x447056150","x1429594477203705857",2021-08-23 00:00:58,"GiusyVersace","Ribelli
In allegato gratuito martedì con il @Corriere 
Viva sempre i ribelli paralimpici azzurri https://t.co/9miryb2MsC","Twitter for Android",117,,,,FALSE,TRUE,0,1,,,,,,,,,,,,,,,,"x119549495 x395218906","claudioarrigoni Corriere","it",,,,,,,,,,,,,,,,"x1429560637173112838","Ribelli
In allegato gratuito martedì con il @Corriere 
Viva sempre i ribelli paralimpici azzurri https://t.co/9miryb2MsC",2021-08-22 21:46:30,"Twitter Web App",6,1,"x119549495","claudioarrigoni","claudio arrigoni",1956,488,5685,"Milano","Journalist and paralympic sport writer - GazzettaTv",FALSE,,,,,,,"NA NA","NA NA","NA NA NA NA NA NA NA NA","https://twitter.com/GiusyVersace/status/1429594477203705857","Giusy Versace","Milano","Cominciate col fare il necessario, poi cio' che e' possibile e all'improvviso vi sorprenderete a fare l'impossibile - S.Francesco d'Assisi","http://t.co/jemrvujzQb",FALSE,25956,2090,124,21706,15997,2011-12-26 13:05:12,TRUE,"http://t.co/jemrvujzQb","http://www.giusyversace.it",,"https://pbs.twimg.com/profile_banners/447056150/1363347299","http://abs.twimg.com/images/themes/theme1/bg.png","http://pbs.twimg.com/profile_images/378800000828007270/bad08b8529048aef2d0a82e084b0b31a_normal.jpeg"
"x447056150","x1429594372832694279",2021-08-23 00:00:33,"GiusyVersace","«Ribelli», giovani d’oro alla #Paralimpiade di @Tokyo2020. E' stato bello poter raccontare storie meravigliose di persone meravigliose grazie a @CorriereBN. E grazie a @EliSoglio anche per questo pezzo. Martedì gratis con il @Corriere (ft @CIPnotizie)  https://t.co/ixyBKpFMQ3","Twitter for Android",140,,,,FALSE,TRUE,0,3,,,"Paralimpiade",,,,,,,,,,,,,"x119549495 x2249745696","claudioarrigoni Tokyo2020","it",,,,,,,,,,,,,,,,"x1429566356047814660","«Ribelli», giovani d’oro alla #Paralimpiade di @Tokyo2020. E' stato bello poter raccontare storie meravigliose di persone meravigliose grazie a @CorriereBN. E grazie a @EliSoglio anche per questo pezzo. Martedì gratis con il @Corriere (ft @CIPnotizie)  https://t.co/ixyBKpFMQ3",2021-08-22 22:09:13,"Twitter Web App",5,3,"x119549495","claudioarrigoni","claudio arrigoni",1956,488,5685,"Milano","Journalist and paralympic sport writer - GazzettaTv",FALSE,,,,,,,"NA NA","NA NA","NA NA NA NA NA NA NA NA","https://twitter.com/GiusyVersace/status/1429594372832694279","Giusy Versace","Milano","Cominciate col fare il necessario, poi cio' che e' possibile e all'improvviso vi sorprenderete a fare l'impossibile - S.Francesco d'Assisi","http://t.co/jemrvujzQb",FALSE,25956,2090,124,21706,15997,2011-12-26 13:05:12,TRUE,"http://t.co/jemrvujzQb","http://www.giusyversace.it",,"https://pbs.twimg.com/profile_banners/447056150/1363347299","http://abs.twimg.com/images/themes/theme1/bg.png","http://pbs.twimg.com/profile_images/378800000828007270/bad08b8529048aef2d0a82e084b0b31a_normal.jpeg"
"x1557514573","x1429825475099172868",2021-08-23 15:18:52,"elio_vito","@DurigonSi @orsi_massimo @ClaudioZavatti1 👍","Twitter for iPad",1,"x1429825160786370562","x1429529284570406921","DurigonSi",FALSE,FALSE,2,0,,,,,,,,,,,,,,,,"x1429529284570406921 x1158155650578505730 x3898955560","DurigonSi orsi_massimo ClaudioZavatti1","und",,,,,,,,,,,,,,,,,,,,,,,,,,,,,,,,,,,,,"NA NA","NA NA","NA NA NA NA NA NA NA NA","https://twitter.com/elio_vito/status/1429825475099172868","Elio Vito 🇮🇹🇪🇺🇺🇸","Roma","Deputato @forza_italia. Juventino",,FALSE,10943,13,88,17031,19618,2013-06-30 07:47:38,TRUE,,,,"https://pbs.twimg.com/profile_banners/1557514573/1623834710","http://abs.twimg.com/images/themes/theme1/bg.png","http://pbs.twimg.com/profile_images/736450788659240960/-8W5fQJa_normal.jpg"
"x1557514573","x1429819868799459332",2021-08-23 14:56:36,"elio_vito","@CafiDanna @PetrazzuoloF @Azione_it @Mov5Stelle Vedremo","Twitter for iPad",7,"x1429818081686310914","x198977983","CafiDanna",FALSE,FALSE,1,0,,,,,,,,,,,,,,,,"x198977983 x1033267486500769792 x1001344387102728194 x289400495","CafiDanna PetrazzuoloF Azione_it Mov5Stelle","it",,,,,,,,,,,,,,,,,,,,,,,,,,,,,,,,,,,,,"NA NA","NA NA","NA NA NA NA NA NA NA NA","https://twitter.com/elio_vito/status/1429819868799459332","Elio Vito 🇮🇹🇪🇺🇺🇸","Roma","Deputato @forza_italia. Juventino",,FALSE,10943,13,88,17031,19618,2013-06-30 07:47:38,TRUE,,,,"https://pbs.twimg.com/profile_banners/1557514573/1623834710","http://abs.twimg.com/images/themes/theme1/bg.png","http://pbs.twimg.com/profile_images/736450788659240960/-8W5fQJa_normal.jpg"
"x1557514573","x1429818552220012544",2021-08-23 14:51:22,"elio_vito","@amendolaenzo @ItalyinMorocco @ItalyMFA @luigidimaio @BenedettaFrucci","Twitter for iPad",16,"x1429803197409943554","x398726169","amendolaenzo",FALSE,FALSE,7,0,,,,,,,,,,,,,,,,"x398726169 x3019961679 x599114492 x48062712 x170739225","amendolaenzo ItalyinMorocco ItalyMFA luigidimaio BenedettaFrucci","und",,,,,,,,,,,,,,,,,,,,,,,,,,,,,,,,,,,,,"NA NA","NA NA","NA NA NA NA NA NA NA NA","https://twitter.com/elio_vito/status/1429818552220012544","Elio Vito 🇮🇹🇪🇺🇺🇸","Roma","Deputato @forza_italia. Juventino",,FALSE,10943,13,88,17031,19618,2013-06-30 07:47:38,TRUE,,,,"https://pbs.twimg.com/profile_banners/1557514573/1623834710","http://abs.twimg.com/images/themes/theme1/bg.png","http://pbs.twimg.com/profile_images/736450788659240960/-8W5fQJa_normal.jpg"
"x1557514573","x1429729998332641280",2021-08-23 08:59:29,"elio_vito","L’autunno dei diritti, approviamoli tutti! #ddlZan🌈#eutanasiaLegale, #ddlPerantoni🌱, #iussoli.
Bel dossier di @franolivo2 oggi su @LaStampa con una mia breve intervista. 🙏☺️ https://t.co/GJ6Pp1UK3v","Twitter for iPhone",173,,,,FALSE,FALSE,200,32,,,"ddlZan eutanasiaLegale ddlPerantoni iussoli",,,,,"http://pbs.twimg.com/media/E9dr2ijWYAA5A_Z.jpg","https://t.co/GJ6Pp1UK3v","https://twitter.com/elio_vito/status/1429729998332641280/photo/1","photo","http://pbs.twimg.com/media/E9dr2ijWYAA5A_Z.jpg http://pbs.twimg.com/media/E9dr2inWEAkJCdN.jpg http://pbs.twimg.com/media/E9dr2ijWQAEUMZR.jpg","https://t.co/GJ6Pp1UK3v https://t.co/GJ6Pp1UK3v https://t.co/GJ6Pp1UK3v","https://twitter.com/elio_vito/status/1429729998332641280/photo/1 https://twitter.com/elio_vito/status/1429729998332641280/photo/1 https://twitter.com/elio_vito/status/1429729998332641280/photo/1",,"x415624891 x29416653","franolivo2 LaStampa","it",,,,,,,,,,,,,,,,,,,,,,,,,,,,,,,,,,,,,"NA NA","NA NA","NA NA NA NA NA NA NA NA","https://twitter.com/elio_vito/status/1429729998332641280","Elio Vito 🇮🇹🇪🇺🇺🇸","Roma","Deputato @forza_italia. Juventino",,FALSE,10943,13,88,17031,19618,2013-06-30 07:47:38,TRUE,,,,"https://pbs.twimg.com/profile_banners/1557514573/1623834710","http://abs.twimg.com/images/themes/theme1/bg.png","http://pbs.twimg.com/profile_images/736450788659240960/-8W5fQJa_normal.jpg"
"x1557514573","x1429725550961119233",2021-08-23 08:41:49,"elio_vito","@orsi_massimo @ClaudioZavatti1 D’altra parte, non c’è due senza tre, vedremo il quarto... 🙏","Twitter for iPhone",60,"x1429722991907192835","x1158155650578505730","orsi_massimo",FALSE,FALSE,9,1,,,,,,,,,,,,,,,,"x1158155650578505730 x3898955560","orsi_massimo ClaudioZavatti1","it",,,,,,,,,,,,,,,,,,,,,,,,,,,,,,,,,,,,,"NA NA","NA NA","NA NA NA NA NA NA NA NA","https://twitter.com/elio_vito/status/1429725550961119233","Elio Vito 🇮🇹🇪🇺🇺🇸","Roma","Deputato @forza_italia. Juventino",,FALSE,10943,13,88,17031,19618,2013-06-30 07:47:38,TRUE,,,,"https://pbs.twimg.com/profile_banners/1557514573/1623834710","http://abs.twimg.com/images/themes/theme1/bg.png","http://pbs.twimg.com/profile_images/736450788659240960/-8W5fQJa_normal.jpg"
"x1557514573","x1429681368125083649",2021-08-23 05:46:15,"elio_vito","@loscurissimo @GuidoCrosetto @civati @RobertoBurioni @LucaBizzarri E non basta sperare in un domani migliore, bisogna agire!","Twitter for iPhone",57,"x1429680658390130688","x4075569083","loscurissimo",FALSE,FALSE,2,2,,,,,,,,,,,,,,,,"x4075569083 x413916151 x14108472 x732817452569141248 x28822067","loscurissimo GuidoCrosetto civati RobertoBurioni LucaBizzarri","it",,,,,,,,,,,,,,,,,,,,,,,,,,,,,,,,,,,,,"NA NA","NA NA","NA NA NA NA NA NA NA NA","https://twitter.com/elio_vito/status/1429681368125083649","Elio Vito 🇮🇹🇪🇺🇺🇸","Roma","Deputato @forza_italia. Juventino",,FALSE,10943,13,88,17031,19618,2013-06-30 07:47:38,TRUE,,,,"https://pbs.twimg.com/profile_banners/1557514573/1623834710","http://abs.twimg.com/images/themes/theme1/bg.png","http://pbs.twimg.com/profile_images/736450788659240960/-8W5fQJa_normal.jpg"
"x1557514573","x1429681043280384001",2021-08-23 05:44:57,"elio_vito","Buongiorno e buona settimana. A me spiace se vi annoio, ma non voglio che il grave caso finisca nel dimenticatoio. È il #23agosto e Durigon non si è ancora dimesso.","Twitter for iPhone",164,,,,FALSE,FALSE,3173,398,,,"23agosto",,,,,,,,,,,,,,,"it",,,,,,,,,,,,,,,,,,,,,,,,,,,,,,,,,,,,,"NA NA","NA NA","NA NA NA NA NA NA NA NA","https://twitter.com/elio_vito/status/1429681043280384001","Elio Vito 🇮🇹🇪🇺🇺🇸","Roma","Deputato @forza_italia. Juventino",,FALSE,10943,13,88,17031,19618,2013-06-30 07:47:38,TRUE,,,,"https://pbs.twimg.com/profile_banners/1557514573/1623834710","http://abs.twimg.com/images/themes/theme1/bg.png","http://pbs.twimg.com/profile_images/736450788659240960/-8W5fQJa_normal.jpg"
"x1557514573","x1429678938377396227",2021-08-23 05:36:35,"elio_vito","Anche oggi il #Copasir in attività. Alle 11 audizione del direttore dell’Aise, gen. Giovanni Caravelli sulla gravissima situazione in #Afghanistan, piano di evacuazione, contrasto al #terrorismo e traffico di #droga","Twitter for iPad",140,,,,FALSE,TRUE,0,14,,,"Copasir",,,,,,,,,,,,,"x214476890","adolfo_urso","it",,,,,,,,,,,,,,,,"x1429663507914571776","Anche oggi il #Copasir in attività. Alle 11 audizione del direttore dell’Aise, gen. Giovanni Caravelli sulla gravissima situazione in #Afghanistan, piano di evacuazione, contrasto al #terrorismo e traffico di #droga",2021-08-23 04:35:16,"Twitter for iPhone",48,14,"x214476890","adolfo_urso","Adolfo Urso",7452,839,10321,"","Presidente del #Copasir, Senatore di Fratelli d’Italia",FALSE,,,,,,,"NA NA","NA NA","NA NA NA NA NA NA NA NA","https://twitter.com/elio_vito/status/1429678938377396227","Elio Vito 🇮🇹🇪🇺🇺🇸","Roma","Deputato @forza_italia. Juventino",,FALSE,10943,13,88,17031,19618,2013-06-30 07:47:38,TRUE,,,,"https://pbs.twimg.com/profile_banners/1557514573/1623834710","http://abs.twimg.com/images/themes/theme1/bg.png","http://pbs.twimg.com/profile_images/736450788659240960/-8W5fQJa_normal.jpg"
"x1557514573","x1429539223548354563",2021-08-22 20:21:25,"elio_vito","@giuppihair66 @ChangeItalia Queste cose qua!","Twitter for iPad",16,"x1429533909101027329","x488617332","giuppihair66",FALSE,FALSE,1,0,,,,,,,,,,,,,,,,"x488617332 x636955791","giuppihair66 ChangeItalia","it",,,,,,,,,,,,,,,,,,,,,,,,,,,,,,,,,,,,,"NA NA","NA NA","NA NA NA NA NA NA NA NA","https://twitter.com/elio_vito/status/1429539223548354563","Elio Vito 🇮🇹🇪🇺🇺🇸","Roma","Deputato @forza_italia. Juventino",,FALSE,10943,13,88,17031,19618,2013-06-30 07:47:38,TRUE,,,,"https://pbs.twimg.com/profile_banners/1557514573/1623834710","http://abs.twimg.com/images/themes/theme1/bg.png","http://pbs.twimg.com/profile_images/736450788659240960/-8W5fQJa_normal.jpg"
"x1557514573","x1429534012494778373",2021-08-22 20:00:42,"elio_vito","@SilvanaBuonoco2 @ChangeItalia 👍","Twitter for iPad",1,"x1429532159887527937","x4897124920","SilvanaBuonoco2",FALSE,FALSE,0,0,,,,,,,,,,,,,,,,"x4897124920 x636955791","SilvanaBuonoco2 ChangeItalia","und",,,,,,,,,,,,,,,,,,,,,,,,,,,,,,,,,,,,,"NA NA","NA NA","NA NA NA NA NA NA NA NA","https://twitter.com/elio_vito/status/1429534012494778373","Elio Vito 🇮🇹🇪🇺🇺🇸","Roma","Deputato @forza_italia. Juventino",,FALSE,10943,13,88,17031,19618,2013-06-30 07:47:38,TRUE,,,,"https://pbs.twimg.com/profile_banners/1557514573/1623834710","http://abs.twimg.com/images/themes/theme1/bg.png","http://pbs.twimg.com/profile_images/736450788659240960/-8W5fQJa_normal.jpg"
"x1557514573","x1429530136811118593",2021-08-22 19:45:18,"elio_vito","@Frank196018 Si dice così, ma non è vero, semplicemente si apprezza quello che si ha","Twitter for iPad",71,"x1429528959247597568","x1398098581236682755","Frank196018",FALSE,FALSE,0,0,,,,,,,,,,,,,,,,"x1398098581236682755","Frank196018","it",,,,,,,,,,,,,,,,,,,,,,,,,,,,,,,,,,,,,"NA NA","NA NA","NA NA NA NA NA NA NA NA","https://twitter.com/elio_vito/status/1429530136811118593","Elio Vito 🇮🇹🇪🇺🇺🇸","Roma","Deputato @forza_italia. Juventino",,FALSE,10943,13,88,17031,19618,2013-06-30 07:47:38,TRUE,,,,"https://pbs.twimg.com/profile_banners/1557514573/1623834710","http://abs.twimg.com/images/themes/theme1/bg.png","http://pbs.twimg.com/profile_images/736450788659240960/-8W5fQJa_normal.jpg"
"x1557514573","x1429528661623988235",2021-08-22 19:39:26,"elio_vito","@Frank196018 No, uno che si accontenta","Twitter for iPad",25,"x1429528006817689603","x1398098581236682755","Frank196018",FALSE,FALSE,1,0,,,,,,,,,,,,,,,,"x1398098581236682755","Frank196018","it",,,,,,,,,,,,,,,,,,,,,,,,,,,,,,,,,,,,,"NA NA","NA NA","NA NA NA NA NA NA NA NA","https://twitter.com/elio_vito/status/1429528661623988235","Elio Vito 🇮🇹🇪🇺🇺🇸","Roma","Deputato @forza_italia. Juventino",,FALSE,10943,13,88,17031,19618,2013-06-30 07:47:38,TRUE,,,,"https://pbs.twimg.com/profile_banners/1557514573/1623834710","http://abs.twimg.com/images/themes/theme1/bg.png","http://pbs.twimg.com/profile_images/736450788659240960/-8W5fQJa_normal.jpg"
"x1557514573","x1429527001094922244",2021-08-22 19:32:51,"elio_vito","@MarxKarletto Doppio","Twitter for iPad",6,"x1429526011612475394","x1211399051523936256","MarxKarletto",FALSE,FALSE,0,0,,,,,,,,,,,,,,,,"x1211399051523936256","MarxKarletto","it",,,,,,,,,,,,,,,,,,,,,,,,,,,,,,,,,,,,,"NA NA","NA NA","NA NA NA NA NA NA NA NA","https://twitter.com/elio_vito/status/1429527001094922244","Elio Vito 🇮🇹🇪🇺🇺🇸","Roma","Deputato @forza_italia. Juventino",,FALSE,10943,13,88,17031,19618,2013-06-30 07:47:38,TRUE,,,,"https://pbs.twimg.com/profile_banners/1557514573/1623834710","http://abs.twimg.com/images/themes/theme1/bg.png","http://pbs.twimg.com/profile_images/736450788659240960/-8W5fQJa_normal.jpg"
"x1557514573","x1429526912465047554",2021-08-22 19:32:29,"elio_vito","@MarxKarletto Si, mi sono comprato la maglia...","Twitter for iPad",33,"x1429525768892203009","x1211399051523936256","MarxKarletto",FALSE,FALSE,1,0,,,,,,,,,,,,,,,,"x1211399051523936256","MarxKarletto","it",,,,,,,,,,,,,,,,,,,,,,,,,,,,,,,,,,,,,"NA NA","NA NA","NA NA NA NA NA NA NA NA","https://twitter.com/elio_vito/status/1429526912465047554","Elio Vito 🇮🇹🇪🇺🇺🇸","Roma","Deputato @forza_italia. Juventino",,FALSE,10943,13,88,17031,19618,2013-06-30 07:47:38,TRUE,,,,"https://pbs.twimg.com/profile_banners/1557514573/1623834710","http://abs.twimg.com/images/themes/theme1/bg.png","http://pbs.twimg.com/profile_images/736450788659240960/-8W5fQJa_normal.jpg"
"x1557514573","x1429524739744223234",2021-08-22 19:23:51,"elio_vito","@ToniPizz No, il mio SMM è Martino, se cerca tra i miei tweet, un paio di giorni fa ha fatto un breve video di presentazione","Twitter for iPad",114,"x1429519138381258766","x3184029167","ToniPizz",FALSE,FALSE,1,0,,,,,,,,,,,,,,,,"x3184029167","ToniPizz","it",,,,,,,,,,,,,,,,,,,,,,,,,,,,,,,,,,,,,"NA NA","NA NA","NA NA NA NA NA NA NA NA","https://twitter.com/elio_vito/status/1429524739744223234","Elio Vito 🇮🇹🇪🇺🇺🇸","Roma","Deputato @forza_italia. Juventino",,FALSE,10943,13,88,17031,19618,2013-06-30 07:47:38,TRUE,,,,"https://pbs.twimg.com/profile_banners/1557514573/1623834710","http://abs.twimg.com/images/themes/theme1/bg.png","http://pbs.twimg.com/profile_images/736450788659240960/-8W5fQJa_normal.jpg"
"x1557514573","x1429518559957377027",2021-08-22 18:59:18,"elio_vito","@roberto2_lamela @PetrazzuoloF Vedremo","Twitter for iPad",7,"x1429517987007107073","x1301475201532731393","roberto2_lamela",FALSE,FALSE,1,0,,,,,,,,,,,,,,,,"x1301475201532731393 x1033267486500769792","roberto2_lamela PetrazzuoloF","it",,,,,,,,,,,,,,,,,,,,,,,,,,,,,,,,,,,,,"NA NA","NA NA","NA NA NA NA NA NA NA NA","https://twitter.com/elio_vito/status/1429518559957377027","Elio Vito 🇮🇹🇪🇺🇺🇸","Roma","Deputato @forza_italia. Juventino",,FALSE,10943,13,88,17031,19618,2013-06-30 07:47:38,TRUE,,,,"https://pbs.twimg.com/profile_banners/1557514573/1623834710","http://abs.twimg.com/images/themes/theme1/bg.png","http://pbs.twimg.com/profile_images/736450788659240960/-8W5fQJa_normal.jpg"
