"x376610294","x1465090129199046656",2021-11-28 22:48:01,"isabellarauti","Il tizio della pacca sul sedere è già stato identificato e denunciato?

Il giornalista del ""non te la prendere"" è già stato sospeso?","Twitter for iPhone",139,,,,FALSE,TRUE,0,1122,,,,,,,,,,,,,,,,"x253636558","RobTallei","it",,,,,,,,,,,,,,,,"x1464916889759531011","Il tizio della pacca sul sedere è già stato identificato e denunciato?

Il giornalista del ""non te la prendere"" è già stato sospeso?",2021-11-28 11:19:38,"Twitter for Android",10469,1122,"x253636558","RobTallei","Roberto Tallei",12728,963,20276,"Milano, Lombardia","Goloso e curioso. Giornalista di @SkyTG24, in onda dal lunedì al venerdì alle 19.30 con #SkyMondo. Le opinioni qui sono mie.",TRUE,,,,,,,"NA NA","NA NA","NA NA NA NA NA NA NA NA","https://twitter.com/isabellarauti/status/1465090129199046656","Isabella Rauti","","Giornalista, Dottore di Ricerca, Uff Esercito 🇮🇹, Senatrice, Vice Pres Gruppo FDI, Comm Difesa, Dipartimento Famiglia FDI, Associazione Pino Rauti, Onlus HOW","https://t.co/IE1TYO9vGj",FALSE,12463,5603,119,26102,15388,2011-09-20 05:48:40,TRUE,"https://t.co/IE1TYO9vGj","http://www.Isabellarauti.it",,"https://pbs.twimg.com/profile_banners/376610294/1580146815","http://abs.twimg.com/images/themes/theme1/bg.png","http://pbs.twimg.com/profile_images/699248798707621888/sTn5ZaWE_normal.jpg"
"x376610294","x1465090050929082368",2021-11-28 22:47:42,"isabellarauti","🔴 😱 Non volevo crederci, l'ha detto veramente: così #Monti vuole ""dosare dall’alto l’informazione"" sul #Covid. Sentite qui: è incredibile (VIDEO) 👇
https://t.co/V9k9Ac20c9","Twitter for iPhone",140,,,,FALSE,TRUE,0,710,,,"Monti Covid",,,,,,,,,,,,,"x399004979","NicolaPorro","it",,,,,,,,,,,,,,,,"x1464866633017704452","🔴 😱 Non volevo crederci, l'ha detto veramente: così #Monti vuole ""dosare dall’alto l’informazione"" sul #Covid. Sentite qui: è incredibile (VIDEO) 👇
https://t.co/V9k9Ac20c9",2021-11-28 07:59:55,"TweetDeck",2149,710,"x399004979","NicolaPorro","Nicola Porro",429205,597,20951,"","Vicedirettore del @ilgiornale, conduttore televisivo e giornalista. Tutti i giorni la sua zuppa su https://t.co/GPJd1eo4b8",TRUE,,,,,,,"NA NA","NA NA","NA NA NA NA NA NA NA NA","https://twitter.com/isabellarauti/status/1465090050929082368","Isabella Rauti","","Giornalista, Dottore di Ricerca, Uff Esercito 🇮🇹, Senatrice, Vice Pres Gruppo FDI, Comm Difesa, Dipartimento Famiglia FDI, Associazione Pino Rauti, Onlus HOW","https://t.co/IE1TYO9vGj",FALSE,12463,5603,119,26102,15388,2011-09-20 05:48:40,TRUE,"https://t.co/IE1TYO9vGj","http://www.Isabellarauti.it",,"https://pbs.twimg.com/profile_banners/376610294/1580146815","http://abs.twimg.com/images/themes/theme1/bg.png","http://pbs.twimg.com/profile_images/699248798707621888/sTn5ZaWE_normal.jpg"
"x376610294","x1465089911619473425",2021-11-28 22:47:09,"isabellarauti","…#cuori ❤️‍🔥ma può finire così una serie?…senza una fine?!Tranne Agata che parte,tutto il resto è in sospeso. Delia,Alberto,virgi,Fausto,il Prof ..Domenica prossima sarò davanti alla Tv…ad aspettare,magari ci ripensano e ci regalano un’ultima puntata vera.       🤣🤣 😂💔💔💔💔 https://t.co/Apw4HorqrH","Twitter for iPhone",271,,,,FALSE,FALSE,26,1,,,"cuori",,,,,"http://pbs.twimg.com/media/FFULgfQWYAYD4-k.jpg","https://t.co/Apw4HorqrH","https://twitter.com/isabellarauti/status/1465089911619473425/photo/1","photo","http://pbs.twimg.com/media/FFULgfQWYAYD4-k.jpg","https://t.co/Apw4HorqrH","https://twitter.com/isabellarauti/status/1465089911619473425/photo/1",,,,"it",,,,,,,,,,,,,,,,,,,,,,,,,,,,,,,,,,,,,"NA NA","NA NA","NA NA NA NA NA NA NA NA","https://twitter.com/isabellarauti/status/1465089911619473425","Isabella Rauti","","Giornalista, Dottore di Ricerca, Uff Esercito 🇮🇹, Senatrice, Vice Pres Gruppo FDI, Comm Difesa, Dipartimento Famiglia FDI, Associazione Pino Rauti, Onlus HOW","https://t.co/IE1TYO9vGj",FALSE,12463,5603,119,26102,15388,2011-09-20 05:48:40,TRUE,"https://t.co/IE1TYO9vGj","http://www.Isabellarauti.it",,"https://pbs.twimg.com/profile_banners/376610294/1580146815","http://abs.twimg.com/images/themes/theme1/bg.png","http://pbs.twimg.com/profile_images/699248798707621888/sTn5ZaWE_normal.jpg"
"x376610294","x1465082388866818056",2021-11-28 22:17:16,"isabellarauti","Complimenti agli Avieri Capo Sebastiano Arman, Amos Mosaner e all’Aviere Scelto Simone Gonin, del Centro Sportivo #AeronauticaMilitare che conquistano la medaglia di bronzo🥉agli Europei di #curling #ECC2021
 #ForzeArmate🇮🇹 #UnaForzaperilPaese
#28novembre 
https://t.co/KiwHqlSed7 https://t.co/k30ra4vj9U","Twitter for iPhone",140,,,,FALSE,TRUE,0,6,,,,,,,,,,,,,,,,"x1919237072","SM_Difesa","it",,,,,,,,,,,,,,,,"x1465055878990770177","Complimenti agli Avieri Capo Sebastiano Arman, Amos Mosaner e all’Aviere Scelto Simone Gonin, del Centro Sportivo #AeronauticaMilitare che conquistano la medaglia di bronzo🥉agli Europei di #curling #ECC2021
 #ForzeArmate🇮🇹 #UnaForzaperilPaese
#28novembre 
https://t.co/KiwHqlSed7 https://t.co/k30ra4vj9U",2021-11-28 20:31:55,"Twitter Web App",22,6,"x1919237072","SM_Difesa","Forze Armate StatoMaggioreDifesa",74727,120,19472,"Roma","Profilo ufficiale Twitter dello Stato Maggiore della Difesa. #ForzeArmate 🇮🇹 #MissioniMilitari #UnaForzaperilPaese Social netiquette https://t.co/cu3Uw6TUbE",TRUE,,,,,,,"NA NA","NA NA","NA NA NA NA NA NA NA NA","https://twitter.com/isabellarauti/status/1465082388866818056","Isabella Rauti","","Giornalista, Dottore di Ricerca, Uff Esercito 🇮🇹, Senatrice, Vice Pres Gruppo FDI, Comm Difesa, Dipartimento Famiglia FDI, Associazione Pino Rauti, Onlus HOW","https://t.co/IE1TYO9vGj",FALSE,12463,5603,119,26102,15388,2011-09-20 05:48:40,TRUE,"https://t.co/IE1TYO9vGj","http://www.Isabellarauti.it",,"https://pbs.twimg.com/profile_banners/376610294/1580146815","http://abs.twimg.com/images/themes/theme1/bg.png","http://pbs.twimg.com/profile_images/699248798707621888/sTn5ZaWE_normal.jpg"
"x376610294","x1465061018841796608",2021-11-28 20:52:21,"isabellarauti","Violenza donne: FdI, lanciata campagna sensibilizzazione e proposte modifica reddito di libertà https://t.co/JPqgO921zc","Twitter Web App",140,,,,FALSE,TRUE,0,4,,,,,"lavocedelpatriota.it/violenza-donne…","https://t.co/JPqgO921zc","https://www.lavocedelpatriota.it/violenza-donne-fdi-lanciata-campagna-sensibilizzazione-e-proposte-modifica-reddito-di-liberta/",,,,,,,,,"x998237902055395328","vocedelpatriota","it",,,,,,,,,,,,,,,,"x1464244799763062790","Violenza donne: FdI, lanciata campagna sensibilizzazione e proposte modifica reddito di libertà https://t.co/JPqgO921zc",2021-11-26 14:48:59,"WordPress.com",11,4,"x998237902055395328","vocedelpatriota","🇮🇹 La Voce del Patriota 🇮🇹",7385,3235,18584,"Italia","📰 Il Giornale dei Patrioti",FALSE,,,,,,,"NA NA","NA NA","NA NA NA NA NA NA NA NA","https://twitter.com/isabellarauti/status/1465061018841796608","Isabella Rauti","","Giornalista, Dottore di Ricerca, Uff Esercito 🇮🇹, Senatrice, Vice Pres Gruppo FDI, Comm Difesa, Dipartimento Famiglia FDI, Associazione Pino Rauti, Onlus HOW","https://t.co/IE1TYO9vGj",FALSE,12463,5603,119,26102,15388,2011-09-20 05:48:40,TRUE,"https://t.co/IE1TYO9vGj","http://www.Isabellarauti.it",,"https://pbs.twimg.com/profile_banners/376610294/1580146815","http://abs.twimg.com/images/themes/theme1/bg.png","http://pbs.twimg.com/profile_images/699248798707621888/sTn5ZaWE_normal.jpg"
"x376610294","x1465058395078156297",2021-11-28 20:41:55,"isabellarauti","#supergreenpass #COVID19 rafforza solo gli errori del governo e copre le sue mancanze. @FratellidItalia chiede potenziamento trasporti pubblici, più sicurezza nelle scuole e blocco degli sbarchi.Basta scaricare le responsabilità sui cittadini e limitare le libertà personali.
#Tg2 https://t.co/32Uhfio24O","Twitter Web App",280,,,,FALSE,FALSE,25,6,,,"supergreenpass COVID19 Tg2",,,,,"http://pbs.twimg.com/ext_tw_video_thumb/1465055811391172613/pu/img/v_ZrvS1LaHUZUbKP.jpg","https://t.co/32Uhfio24O","https://twitter.com/isabellarauti/status/1465058395078156297/video/1","photo","http://pbs.twimg.com/ext_tw_video_thumb/1465055811391172613/pu/img/v_ZrvS1LaHUZUbKP.jpg","https://t.co/32Uhfio24O","https://twitter.com/isabellarauti/status/1465058395078156297/video/1",,"x1024976264","FratellidItalia","it",,,,,,,,,,,,,,,,,,,,,,,,,,,,,,,,,,,,,"NA NA","NA NA","NA NA NA NA NA NA NA NA","https://twitter.com/isabellarauti/status/1465058395078156297","Isabella Rauti","","Giornalista, Dottore di Ricerca, Uff Esercito 🇮🇹, Senatrice, Vice Pres Gruppo FDI, Comm Difesa, Dipartimento Famiglia FDI, Associazione Pino Rauti, Onlus HOW","https://t.co/IE1TYO9vGj",FALSE,12463,5603,119,26102,15388,2011-09-20 05:48:40,TRUE,"https://t.co/IE1TYO9vGj","http://www.Isabellarauti.it",,"https://pbs.twimg.com/profile_banners/376610294/1580146815","http://abs.twimg.com/images/themes/theme1/bg.png","http://pbs.twimg.com/profile_images/699248798707621888/sTn5ZaWE_normal.jpg"
"x376610294","x1465046629128495111",2021-11-28 19:55:10,"isabellarauti","🔵 L'Economist incorona Giorgia #Meloni: ""Può diventare la prima donna Premier"" https://t.co/hXitSH51Vg","Twitter for iPhone",123,,,,FALSE,TRUE,0,132,,,"Meloni",,,,,"http://pbs.twimg.com/media/FFSxEz7XwAQmyTT.jpg","https://t.co/hXitSH51Vg","https://twitter.com/FratellidItalia/status/1464990482535178244/photo/1","photo","http://pbs.twimg.com/media/FFSxEz7XwAQmyTT.jpg","https://t.co/hXitSH51Vg","https://twitter.com/FratellidItalia/status/1464990482535178244/photo/1",,"x1024976264","FratellidItalia","it",,,,,,,,,,,,,,,,"x1464990482535178244","🔵 L'Economist incorona Giorgia #Meloni: ""Può diventare la prima donna Premier"" https://t.co/hXitSH51Vg",2021-11-28 16:12:03,"Twitter for iPhone",837,132,"x1024976264","FratellidItalia","Fratelli d'Italia 🇮🇹",138894,411,143631,"Italia","Account ufficiale di #FratellidItalia. Presidente @GiorgiaMeloni",TRUE,,,,,,,"NA NA","NA NA","NA NA NA NA NA NA NA NA","https://twitter.com/isabellarauti/status/1465046629128495111","Isabella Rauti","","Giornalista, Dottore di Ricerca, Uff Esercito 🇮🇹, Senatrice, Vice Pres Gruppo FDI, Comm Difesa, Dipartimento Famiglia FDI, Associazione Pino Rauti, Onlus HOW","https://t.co/IE1TYO9vGj",FALSE,12463,5603,119,26102,15388,2011-09-20 05:48:40,TRUE,"https://t.co/IE1TYO9vGj","http://www.Isabellarauti.it",,"https://pbs.twimg.com/profile_banners/376610294/1580146815","http://abs.twimg.com/images/themes/theme1/bg.png","http://pbs.twimg.com/profile_images/699248798707621888/sTn5ZaWE_normal.jpg"
"x376610294","x1465030178665639939",2021-11-28 18:49:48,"isabellarauti","Giornalista molestata, @isabellarauti (@FDI_Parlamento ): solidarietà a @BeccagliaGreta.
https://t.co/W0mP3mhuTC","Twitter for iPhone",128,,,,FALSE,TRUE,0,3,,,,,"ilsovranista.info/2021/11/giorna…","https://t.co/W0mP3mhuTC","https://www.ilsovranista.info/2021/11/giornalista-molestata-rautifdi.html",,,,,,,,,"x22600686 x376610294 x985177119624966147 x419869745","Peppe91176 isabellarauti FDI_Parlamento BeccagliaGreta","it",,,,,,,,,,,,,,,,"x1465022349179342849","Giornalista molestata, @isabellarauti (@FDI_Parlamento ): solidarietà a @BeccagliaGreta.
https://t.co/W0mP3mhuTC",2021-11-28 18:18:41,"Twitter Web App",17,3,"x22600686","Peppe91176","Giuseppe Parente",197,325,11708,"Napoli","giornalista pubblicista, edicolante, conduttore radiofonico. Qui twitto i miei pezzi scritti per Fascinazione  ed Il Sovranista",FALSE,,,,,,,"NA NA","NA NA","NA NA NA NA NA NA NA NA","https://twitter.com/isabellarauti/status/1465030178665639939","Isabella Rauti","","Giornalista, Dottore di Ricerca, Uff Esercito 🇮🇹, Senatrice, Vice Pres Gruppo FDI, Comm Difesa, Dipartimento Famiglia FDI, Associazione Pino Rauti, Onlus HOW","https://t.co/IE1TYO9vGj",FALSE,12463,5603,119,26102,15388,2011-09-20 05:48:40,TRUE,"https://t.co/IE1TYO9vGj","http://www.Isabellarauti.it",,"https://pbs.twimg.com/profile_banners/376610294/1580146815","http://abs.twimg.com/images/themes/theme1/bg.png","http://pbs.twimg.com/profile_images/699248798707621888/sTn5ZaWE_normal.jpg"
"x376610294","x1465030030837395456",2021-11-28 18:49:12,"isabellarauti","""Il super Green pass rafforza solo gli errori del governo e serve a coprire le sue mancanze. #FratellidItalia chiede il potenziamento dei trasporti pubblici, più sicurezza nelle scuole e il blocco degli sbarchi. Basta scaricare le responsabilità sui cittadini"" @isabellarauti","Twitter for iPhone",140,,,,FALSE,TRUE,0,11,,,"FratellidItalia",,,,,,,,,,,,,"x985177119624966147","FDI_Parlamento","it",,,,,,,,,,,,,,,,"x1464973563421732864","""Il super Green pass rafforza solo gli errori del governo e serve a coprire le sue mancanze. #FratellidItalia chiede il potenziamento dei trasporti pubblici, più sicurezza nelle scuole e il blocco degli sbarchi. Basta scaricare le responsabilità sui cittadini"" @isabellarauti",2021-11-28 15:04:50,"Twitter Web App",65,11,"x985177119624966147","FDI_Parlamento","FDI Parlamento",6962,89,11364,"Roma, Lazio","Profilo ufficiale dei Gruppi Parlamentari di #fratelliditalia al #Senato e alla #Camera.",FALSE,,,,,,,"NA NA","NA NA","NA NA NA NA NA NA NA NA","https://twitter.com/isabellarauti/status/1465030030837395456","Isabella Rauti","","Giornalista, Dottore di Ricerca, Uff Esercito 🇮🇹, Senatrice, Vice Pres Gruppo FDI, Comm Difesa, Dipartimento Famiglia FDI, Associazione Pino Rauti, Onlus HOW","https://t.co/IE1TYO9vGj",FALSE,12463,5603,119,26102,15388,2011-09-20 05:48:40,TRUE,"https://t.co/IE1TYO9vGj","http://www.Isabellarauti.it",,"https://pbs.twimg.com/profile_banners/376610294/1580146815","http://abs.twimg.com/images/themes/theme1/bg.png","http://pbs.twimg.com/profile_images/699248798707621888/sTn5ZaWE_normal.jpg"
"x18762875","x1465272232880582661",2021-11-29 10:51:38,"matteorenzi","L’Enews di oggi
https://t.co/lB4VnptLKW","Twitter for iPhone",39,,,,FALSE,FALSE,235,91,,,,,"matteorenzi.it/enews_755_lune…","https://t.co/lB4VnptLKW","https://www.matteorenzi.it/enews_755_lunedi_29_novembre_2021",,,,,,,,,,,"it",,,,,,,,,,,,,,,,,,,,,,,,,,,,,,,,,,,,,"NA NA","NA NA","NA NA NA NA NA NA NA NA","https://twitter.com/matteorenzi/status/1465272232880582661","Matteo Renzi","Italy","Senatore di Firenze - @ItaliaViva","https://t.co/c8MoZ1Wbev",FALSE,3334867,973,7415,13479,469,2009-01-08 13:15:21,TRUE,"https://t.co/c8MoZ1Wbev","https://linktr.ee/matteorenzi",,"https://pbs.twimg.com/profile_banners/18762875/1632829942","http://abs.twimg.com/images/themes/theme1/bg.png","http://pbs.twimg.com/profile_images/1463528035798376449/TUDITp4H_normal.jpg"
"x1122573690","x1465357420461502470",2021-11-29 16:30:08,"erica_rivolta","🔴 IL MESSAGGERO: «DECRETO FLUSSI, SI RIAPRONO LE FRONTIERE PER 80MILA STRANIERI. MA LA LEGA PUNTA I PIEDI» https://t.co/SnVInJ0EpE","Hootsuite Inc.",106,,,,FALSE,FALSE,2,1,,,,,,,,"http://pbs.twimg.com/media/FFX-zu8XIAIWWQK.jpg","https://t.co/SnVInJ0EpE","https://twitter.com/erica_rivolta/status/1465357420461502470/photo/1","photo","http://pbs.twimg.com/media/FFX-zu8XIAIWWQK.jpg","https://t.co/SnVInJ0EpE","https://twitter.com/erica_rivolta/status/1465357420461502470/photo/1",,,,"it",,,,,,,,,,,,,,,,,,,,,,,,,,,,,,,,,,,,,"NA NA","NA NA","NA NA NA NA NA NA NA NA","https://twitter.com/erica_rivolta/status/1465357420461502470","Erica Rivolta","Erba (CO)","🟢 SENATRICE LEGA (Vice Presidente della Commissione Bilancio)📍Vice Sindaco/Assessore Lega - Comune di Erba","https://t.co/8MWzTAMw85",FALSE,1025,184,17,1959,373,2013-01-26 17:05:04,TRUE,"https://t.co/8MWzTAMw85","http://www.senato.it/leg/18/BGT/Schede/Attsen/00025415.htm",,"https://pbs.twimg.com/profile_banners/1122573690/1591381827","http://abs.twimg.com/images/themes/theme13/bg.gif","http://pbs.twimg.com/profile_images/961570463460855811/wfFcEjNJ_normal.jpg"
"x1122573690","x1465311364562538500",2021-11-29 13:27:08,"erica_rivolta","🔵 IN MEDIA, OGNI ANNI, 165 MILA CITTADINI DI ALTRE REGIONI SI CURANO IN LOMBARDIA! https://t.co/ZmCfxqnWLY","Hootsuite Inc.",82,,,,FALSE,FALSE,4,1,,,,,,,,"http://pbs.twimg.com/media/FFXU69hXoAgtsZ2.jpg","https://t.co/ZmCfxqnWLY","https://twitter.com/erica_rivolta/status/1465311364562538500/photo/1","photo","http://pbs.twimg.com/media/FFXU69hXoAgtsZ2.jpg","https://t.co/ZmCfxqnWLY","https://twitter.com/erica_rivolta/status/1465311364562538500/photo/1",,,,"it",,,,,,,,,,,,,,,,,,,,,,,,,,,,,,,,,,,,,"NA NA","NA NA","NA NA NA NA NA NA NA NA","https://twitter.com/erica_rivolta/status/1465311364562538500","Erica Rivolta","Erba (CO)","🟢 SENATRICE LEGA (Vice Presidente della Commissione Bilancio)📍Vice Sindaco/Assessore Lega - Comune di Erba","https://t.co/8MWzTAMw85",FALSE,1025,184,17,1959,373,2013-01-26 17:05:04,TRUE,"https://t.co/8MWzTAMw85","http://www.senato.it/leg/18/BGT/Schede/Attsen/00025415.htm",,"https://pbs.twimg.com/profile_banners/1122573690/1591381827","http://abs.twimg.com/images/themes/theme13/bg.gif","http://pbs.twimg.com/profile_images/961570463460855811/wfFcEjNJ_normal.jpg"
"x1122573690","x1465278122606141444",2021-11-29 11:15:02,"erica_rivolta","LA RIVOLTA DEGLI STUDENTI CONTRO L’ASTERISCO “FLUIDO”

https://t.co/V8NfEAhndv","Hootsuite Inc.",78,,,,FALSE,FALSE,1,0,,,,,"ow.ly/uojr30s2eTI","https://t.co/V8NfEAhndv","http://ow.ly/uojr30s2eTI",,,,,,,,,,,"it",,,,,,,,,,,,,,,,,,,,,,,,,,,,,,,,,,,,,"NA NA","NA NA","NA NA NA NA NA NA NA NA","https://twitter.com/erica_rivolta/status/1465278122606141444","Erica Rivolta","Erba (CO)","🟢 SENATRICE LEGA (Vice Presidente della Commissione Bilancio)📍Vice Sindaco/Assessore Lega - Comune di Erba","https://t.co/8MWzTAMw85",FALSE,1025,184,17,1959,373,2013-01-26 17:05:04,TRUE,"https://t.co/8MWzTAMw85","http://www.senato.it/leg/18/BGT/Schede/Attsen/00025415.htm",,"https://pbs.twimg.com/profile_banners/1122573690/1591381827","http://abs.twimg.com/images/themes/theme13/bg.gif","http://pbs.twimg.com/profile_images/961570463460855811/wfFcEjNJ_normal.jpg"
"x1122573690","x1465057213223948294",2021-11-28 20:37:13,"erica_rivolta","Buona serata amici!! 🌅🍁 https://t.co/br1b7OJF5v","Hootsuite Inc.",23,,,,FALSE,FALSE,3,0,,,,,,,,"http://pbs.twimg.com/media/FFTtxZZWYAAS5aw.jpg","https://t.co/br1b7OJF5v","https://twitter.com/erica_rivolta/status/1465057213223948294/photo/1","photo","http://pbs.twimg.com/media/FFTtxZZWYAAS5aw.jpg","https://t.co/br1b7OJF5v","https://twitter.com/erica_rivolta/status/1465057213223948294/photo/1",,,,"it",,,,,,,,,,,,,,,,,,,,,,,,,,,,,,,,,,,,,"NA NA","NA NA","NA NA NA NA NA NA NA NA","https://twitter.com/erica_rivolta/status/1465057213223948294","Erica Rivolta","Erba (CO)","🟢 SENATRICE LEGA (Vice Presidente della Commissione Bilancio)📍Vice Sindaco/Assessore Lega - Comune di Erba","https://t.co/8MWzTAMw85",FALSE,1025,184,17,1959,373,2013-01-26 17:05:04,TRUE,"https://t.co/8MWzTAMw85","http://www.senato.it/leg/18/BGT/Schede/Attsen/00025415.htm",,"https://pbs.twimg.com/profile_banners/1122573690/1591381827","http://abs.twimg.com/images/themes/theme13/bg.gif","http://pbs.twimg.com/profile_images/961570463460855811/wfFcEjNJ_normal.jpg"
"x318316637","x1465375268244185090",2021-11-29 17:41:03,"LiciaRonzulli","In collegamento zoom con i colleghi di partito e i nostri ministri per una riunione sulla #leggedibilancio, in vista dell’incontro di domani con il Presidente #Draghi. 
Taglio delle #tasse, fondi per #imprese e #lavoro: questa la nostra linea 💪🏻 https://t.co/OoYT4Hl153","Twitter for iPhone",245,,,,FALSE,FALSE,6,0,,,"leggedibilancio Draghi tasse imprese lavoro",,,,,"http://pbs.twimg.com/media/FFYPCebXwBItny0.jpg","https://t.co/OoYT4Hl153","https://twitter.com/LiciaRonzulli/status/1465375268244185090/photo/1","photo","http://pbs.twimg.com/media/FFYPCebXwBItny0.jpg","https://t.co/OoYT4Hl153","https://twitter.com/LiciaRonzulli/status/1465375268244185090/photo/1",,,,"it",,,,,,,,,,,,,,,,,,,,,,,,,,,,,,,,,,,,,"NA NA","NA NA","NA NA NA NA NA NA NA NA","https://twitter.com/LiciaRonzulli/status/1465375268244185090","Licia Ronzulli","Italia","Mamma di Vitty. Senatore della Repubblica. Presidente della Commissione bicamerale infanzia e adolescenza.","https://t.co/q54Sl1XcPF",FALSE,17974,364,177,14953,2461,2011-06-16 08:58:51,TRUE,"https://t.co/q54Sl1XcPF","http://www.liciaronzulli.com",,"https://pbs.twimg.com/profile_banners/318316637/1447076568","http://abs.twimg.com/images/themes/theme2/bg.gif","http://pbs.twimg.com/profile_images/525047474944483328/z1kiXNGa_normal.jpeg"
"x318316637","x1465362532747599884",2021-11-29 16:50:27,"LiciaRonzulli","Cara #UnioneEuropea, NOI a Maria, Giuseppe, all'albero di Natale, al Presepe e alle NOSTRA TRADIZIONI NON RINUNCEREMO MAI!
Francamente non capisco certe posizioni...che fanno perdere la fiducia nei confronti dell'UE... https://t.co/GsnmIRNdGn","Twitter for iPhone",218,,,,FALSE,FALSE,22,3,,,"UnioneEuropea",,,,,"http://pbs.twimg.com/media/FFYDdISXwAAXJKh.jpg","https://t.co/GsnmIRNdGn","https://twitter.com/LiciaRonzulli/status/1465362532747599884/photo/1","photo","http://pbs.twimg.com/media/FFYDdISXwAAXJKh.jpg http://pbs.twimg.com/media/FFYDdIRWYAQ_3k7.jpg","https://t.co/GsnmIRNdGn https://t.co/GsnmIRNdGn","https://twitter.com/LiciaRonzulli/status/1465362532747599884/photo/1 https://twitter.com/LiciaRonzulli/status/1465362532747599884/photo/1",,,,"it",,,,,,,,,,,,,,,,,,,,,,,,,,,,,,,,,,,,,"NA NA","NA NA","NA NA NA NA NA NA NA NA","https://twitter.com/LiciaRonzulli/status/1465362532747599884","Licia Ronzulli","Italia","Mamma di Vitty. Senatore della Repubblica. Presidente della Commissione bicamerale infanzia e adolescenza.","https://t.co/q54Sl1XcPF",FALSE,17974,364,177,14953,2461,2011-06-16 08:58:51,TRUE,"https://t.co/q54Sl1XcPF","http://www.liciaronzulli.com",,"https://pbs.twimg.com/profile_banners/318316637/1447076568","http://abs.twimg.com/images/themes/theme2/bg.gif","http://pbs.twimg.com/profile_images/525047474944483328/z1kiXNGa_normal.jpeg"
"x318316637","x1465254741357834240",2021-11-29 09:42:08,"LiciaRonzulli","L. #Ronzulli (@LiciaRonzulli - @forza_italia) a @RaiStudio24: il #supergreenpass rappresenta un #obbligovaccinale di fatto che #Governo non aveva avuto coraggio di imporre prima. A #novax saranno precluse tantissime attività

#greenpass #VarianteOmicron #COVID19 #vaccino #vaccini https://t.co/0jceqIwxCP","Twitter for iPhone",140,,,,FALSE,TRUE,0,2,,,"Ronzulli supergreenpass obbligovaccinale",,,,,,,,,,,,,"x2785214645 x318316637 x147543162 x2785214645","RaiStudio24 LiciaRonzulli forza_italia RaiStudio24","it",,,,,,,,,,,,,,,,"x1465254417360433152","L. #Ronzulli (@LiciaRonzulli - @forza_italia) a @RaiStudio24: il #supergreenpass rappresenta un #obbligovaccinale di fatto che #Governo non aveva avuto coraggio di imporre prima. A #novax saranno precluse tantissime attività

#greenpass #VarianteOmicron #COVID19 #vaccino #vaccini https://t.co/0jceqIwxCP",2021-11-29 09:40:50,"Twitter Web App",4,2,"x2785214645","RaiStudio24","Studio24",6140,822,22536,"roma","La politica. La cronaca. La cultura. In diretta dalle 9:45 alle 11 su @RaiNews.
Conduce Giorgia Rombolà (@GiorgiaRomb)",FALSE,,,,,,,"NA NA","NA NA","NA NA NA NA NA NA NA NA","https://twitter.com/LiciaRonzulli/status/1465254741357834240","Licia Ronzulli","Italia","Mamma di Vitty. Senatore della Repubblica. Presidente della Commissione bicamerale infanzia e adolescenza.","https://t.co/q54Sl1XcPF",FALSE,17974,364,177,14953,2461,2011-06-16 08:58:51,TRUE,"https://t.co/q54Sl1XcPF","http://www.liciaronzulli.com",,"https://pbs.twimg.com/profile_banners/318316637/1447076568","http://abs.twimg.com/images/themes/theme2/bg.gif","http://pbs.twimg.com/profile_images/525047474944483328/z1kiXNGa_normal.jpeg"
"x1263088331300188166","x1465308321796210699",2021-11-29 13:15:02,"GianfrancoRufa","Ma solo a me pare una follia??? https://t.co/sMR7Ni3ceU","Hootsuite Inc.",31,,,,FALSE,FALSE,1,0,,,,,,,,"http://pbs.twimg.com/media/FFXSJz4XIAgU2jn.jpg","https://t.co/sMR7Ni3ceU","https://twitter.com/GianfrancoRufa/status/1465308321796210699/photo/1","photo","http://pbs.twimg.com/media/FFXSJz4XIAgU2jn.jpg","https://t.co/sMR7Ni3ceU","https://twitter.com/GianfrancoRufa/status/1465308321796210699/photo/1",,,,"it",,,,,,,,,,,,,,,,,,,,,,,,,,,,,,,,,,,,,"NA NA","NA NA","NA NA NA NA NA NA NA NA","https://twitter.com/GianfrancoRufa/status/1465308321796210699","GianfrancoRufa","","👔 SENATORE LEGA 📍Membro 8^Commissione “Lavori pubblici, comunicazioni”. 📍Segretario Commissione d’inchiesta sul femminicidio e forma di violenza di genere.","https://t.co/dj89ADXDX7",FALSE,310,6,4,1186,59,2020-05-20 12:45:25,TRUE,"https://t.co/dj89ADXDX7","http://www.senato.it/leg/18/BGT/Schede/Attsen/00032752.htm",,"https://pbs.twimg.com/profile_banners/1263088331300188166/1589979107",,"http://pbs.twimg.com/profile_images/1263088533432041473/Uy8VbMLA_normal.jpg"
