"x412137356","x1468252015172239365",2021-12-07 16:12:13,"ecdelre","Great Panel with 🇪🇺 EUSR @ecdelre and 🇪🇺Head of Unit Central Africa @francescaDM_EU. Stimulating #MED2021 Dialogues on what we can jointly do to concretely improve living conditions of Sahelian people. @ItalyMFA @ispionline 👏🤝 https://t.co/meq1S85RS9 https://t.co/5Jv8v8SbyO","Twitter for Android",139,,,,FALSE,TRUE,0,2,,,"MED2021",,,,,,,,,,,,,"x499663994 x412137356 x924272719054692352","DjimeA ecdelre francescaDM_EU","en",,,,,,,,,,,,,,,,"x1467102958609444867","Great Panel with 🇪🇺 EUSR @ecdelre and 🇪🇺Head of Unit Central Africa @francescaDM_EU. Stimulating #MED2021 Dialogues on what we can jointly do to concretely improve living conditions of Sahelian people. @ItalyMFA @ispionline 👏🤝 https://t.co/meq1S85RS9 https://t.co/5Jv8v8SbyO",2021-12-04 12:06:17,"Twitter for iPhone",10,2,"x499663994","DjimeA","Djimé Adoum, Coalition pour le Sahel",1127,369,983,"Bruxelles, Belgique","Haut Représentant de la Coalition pour le Sahel",FALSE,,,,,,,"NA NA","NA NA","NA NA NA NA NA NA NA NA","https://twitter.com/ecdelre/status/1468252015172239365","Emanuela C. Del Re","Sahel and Bruxelles ","EU Special Representative for the Sahel 🇪🇺 Former Vice-Minister of Foreign Affairs and MP of Italy 🇮🇹 Prof. Political Sociology - Author of essays & volumes","https://t.co/j5mx3SmZsU",FALSE,6166,311,48,3536,1910,2011-11-14 09:30:25,TRUE,"https://t.co/j5mx3SmZsU","https://eeas.europa.eu/headquarters/headquarters-homepage_en/3606/EU%20Special%20Representatives",,"https://pbs.twimg.com/profile_banners/412137356/1625138723","http://abs.twimg.com/images/themes/theme1/bg.png","http://pbs.twimg.com/profile_images/1222088283976601600/UbqmxHp7_normal.jpg"
"x412137356","x1468251882049187844",2021-12-07 16:11:42,"ecdelre","Discussing about the Sahel with EU Special Representative @ecdelre. https://t.co/pXvTNQ9lvw","Twitter for Android",109,,,,FALSE,TRUE,0,2,,,,,,,,"http://pbs.twimg.com/media/FF8Up87XMAcefyx.jpg","https://t.co/pXvTNQ9lvw","https://twitter.com/ECostopoulos/status/1467914723198910464/photo/1","photo","http://pbs.twimg.com/media/FF8Up87XMAcefyx.jpg","https://t.co/pXvTNQ9lvw","https://twitter.com/ECostopoulos/status/1467914723198910464/photo/1",,"x1041565863516811264 x412137356","ECostopoulos ecdelre","en",,,,,,,,,,,,,,,,"x1467914723198910464","Discussing about the Sahel with EU Special Representative @ecdelre. https://t.co/pXvTNQ9lvw",2021-12-06 17:51:57,"Twitter for Android",20,2,"x1041565863516811264","ECostopoulos","Efthymios Costopoulos",1865,679,257,"","Ambassadeur de Grèce au Sénégal/Envoyé spécial pr le Sahel/Ambassador to Senegal/Special Envoy-Sahel, Πρέσβυς της Ελλάδας στο Ντακάρ/Ειδικός Απεσταλμένος-Σαχέλ",FALSE,,,,,,,"NA NA","NA NA","NA NA NA NA NA NA NA NA","https://twitter.com/ecdelre/status/1468251882049187844","Emanuela C. Del Re","Sahel and Bruxelles ","EU Special Representative for the Sahel 🇪🇺 Former Vice-Minister of Foreign Affairs and MP of Italy 🇮🇹 Prof. Political Sociology - Author of essays & volumes","https://t.co/j5mx3SmZsU",FALSE,6166,311,48,3536,1910,2011-11-14 09:30:25,TRUE,"https://t.co/j5mx3SmZsU","https://eeas.europa.eu/headquarters/headquarters-homepage_en/3606/EU%20Special%20Representatives",,"https://pbs.twimg.com/profile_banners/412137356/1625138723","http://abs.twimg.com/images/themes/theme1/bg.png","http://pbs.twimg.com/profile_images/1222088283976601600/UbqmxHp7_normal.jpg"
"x412137356","x1468243901001654287",2021-12-07 15:39:59,"ecdelre","🌍 Atelier « Le défi #sécuritaire : #coopération et autonomie stratégique des États africains » 

Merci pour ces échanges @zinsouofficiel @elghassimw @UN_MINUSMA @ecdelre 🙏

#FDD2021 #Afrique #Paix #Sécurité https://t.co/YNkWbyvxFx","Twitter for Android",140,,,,FALSE,TRUE,0,4,,,"sécuritaire coopération",,,,,,,,,,,,,"x2794727579","DakarForum","fr",,,,,,,,,,,,,,,,"x1468243003336765442","🌍 Atelier « Le défi #sécuritaire : #coopération et autonomie stratégique des États africains » 

Merci pour ces échanges @zinsouofficiel @elghassimw @UN_MINUSMA @ecdelre 🙏

#FDD2021 #Afrique #Paix #Sécurité https://t.co/YNkWbyvxFx",2021-12-07 15:36:25,"Twitter for iPhone",9,4,"x2794727579","DakarForum","DakarForum",9796,1013,1261,"Dakar","Compte Officiel du Forum International de Dakar sur la Paix et la Sécurité en Afrique l Dakar International Forum on Peace and Security in Africa. #FDD2021",FALSE,,,,,,,"NA NA","NA NA","NA NA NA NA NA NA NA NA","https://twitter.com/ecdelre/status/1468243901001654287","Emanuela C. Del Re","Sahel and Bruxelles ","EU Special Representative for the Sahel 🇪🇺 Former Vice-Minister of Foreign Affairs and MP of Italy 🇮🇹 Prof. Political Sociology - Author of essays & volumes","https://t.co/j5mx3SmZsU",FALSE,6166,311,48,3536,1910,2011-11-14 09:30:25,TRUE,"https://t.co/j5mx3SmZsU","https://eeas.europa.eu/headquarters/headquarters-homepage_en/3606/EU%20Special%20Representatives",,"https://pbs.twimg.com/profile_banners/412137356/1625138723","http://abs.twimg.com/images/themes/theme1/bg.png","http://pbs.twimg.com/profile_images/1222088283976601600/UbqmxHp7_normal.jpg"
"x412137356","x1468243807779135508",2021-12-07 15:39:37,"ecdelre","#BehindtheScenes il nous reste quelques heures pour écouter experts et représentants institutionnels @ecdelre, @AGomati, Tatsuo Arai (@JapanEmbSenegal), @zinsouofficiel. Hâte de retrouver ces entretiens sur @cnbcafrica (🙏🏻@KennethIgbomor) https://t.co/9H0aYAXUrN","Twitter for Android",140,,,,FALSE,TRUE,0,9,,,"BehindtheScenes",,,,,,,,,,,,,"x2794727579 x412137356 x478696297","DakarForum ecdelre AGomati","fr",,,,,,,,,,,,,,,,"x1468212077470920707","#BehindtheScenes il nous reste quelques heures pour écouter experts et représentants institutionnels @ecdelre, @AGomati, Tatsuo Arai (@JapanEmbSenegal), @zinsouofficiel. Hâte de retrouver ces entretiens sur @cnbcafrica (🙏🏻@KennethIgbomor) https://t.co/9H0aYAXUrN",2021-12-07 13:33:31,"Twitter for iPhone",11,9,"x2794727579","DakarForum","DakarForum",9796,1013,1261,"Dakar","Compte Officiel du Forum International de Dakar sur la Paix et la Sécurité en Afrique l Dakar International Forum on Peace and Security in Africa. #FDD2021",FALSE,,,,,,,"NA NA","NA NA","NA NA NA NA NA NA NA NA","https://twitter.com/ecdelre/status/1468243807779135508","Emanuela C. Del Re","Sahel and Bruxelles ","EU Special Representative for the Sahel 🇪🇺 Former Vice-Minister of Foreign Affairs and MP of Italy 🇮🇹 Prof. Political Sociology - Author of essays & volumes","https://t.co/j5mx3SmZsU",FALSE,6166,311,48,3536,1910,2011-11-14 09:30:25,TRUE,"https://t.co/j5mx3SmZsU","https://eeas.europa.eu/headquarters/headquarters-homepage_en/3606/EU%20Special%20Representatives",,"https://pbs.twimg.com/profile_banners/412137356/1625138723","http://abs.twimg.com/images/themes/theme1/bg.png","http://pbs.twimg.com/profile_images/1222088283976601600/UbqmxHp7_normal.jpg"
"x412137356","x1468186171033403393",2021-12-07 11:50:35,"ecdelre","Panel particulièrement inspirant et réflexion enrichissante à l’occasion de la VII édition du @DakarForum #FDD2021 sur la #paix et la #sécurité portant sur ""Sécurité et développement : impact de la démographie et du changement climatique en Afrique"".

🔴➡️https://t.co/bdr15rOUBR https://t.co/uhj9ySTAI4","Twitter for Android",278,,,,FALSE,FALSE,13,7,,,"FDD2021 paix sécurité",,"facebook.com/20069586962396…","https://t.co/bdr15rOUBR","https://www.facebook.com/2006958696239686/posts/3066090163659862/","http://pbs.twimg.com/media/FGALiWEXIAAsSTA.jpg","https://t.co/uhj9ySTAI4","https://twitter.com/ecdelre/status/1468186171033403393/photo/1","photo","http://pbs.twimg.com/media/FGALiWEXIAAsSTA.jpg http://pbs.twimg.com/media/FGALignXwAQS9Kj.jpg http://pbs.twimg.com/media/FGALirnXMAIESas.jpg","https://t.co/uhj9ySTAI4 https://t.co/uhj9ySTAI4 https://t.co/uhj9ySTAI4","https://twitter.com/ecdelre/status/1468186171033403393/photo/1 https://twitter.com/ecdelre/status/1468186171033403393/photo/1 https://twitter.com/ecdelre/status/1468186171033403393/photo/1",,"x2794727579","DakarForum","fr",,,,,,,,,,,,,,,,,,,,,,,,,,,,,,,,,,,,,"NA NA","NA NA","NA NA NA NA NA NA NA NA","https://twitter.com/ecdelre/status/1468186171033403393","Emanuela C. Del Re","Sahel and Bruxelles ","EU Special Representative for the Sahel 🇪🇺 Former Vice-Minister of Foreign Affairs and MP of Italy 🇮🇹 Prof. Political Sociology - Author of essays & volumes","https://t.co/j5mx3SmZsU",FALSE,6166,311,48,3536,1910,2011-11-14 09:30:25,TRUE,"https://t.co/j5mx3SmZsU","https://eeas.europa.eu/headquarters/headquarters-homepage_en/3606/EU%20Special%20Representatives",,"https://pbs.twimg.com/profile_banners/412137356/1625138723","http://abs.twimg.com/images/themes/theme1/bg.png","http://pbs.twimg.com/profile_images/1222088283976601600/UbqmxHp7_normal.jpg"
"x940100618","x1468292629154652166",2021-12-07 18:53:37,"federicadieni","Dopo 688 giorni, 22 mesi, quasi due anni, il nostro studente #PatrickZaki è stato scarcerato.
Doveroso il ringraziamento verso i nostri #diplomatici per aver raggiunto questo risultato! Ora con determinazione andiamo avanti per l' #assoluzione di #PatrickZaki
#PatrickZakilibero https://t.co/IED4Vl3DwL","Twitter Web App",278,,,,FALSE,FALSE,1,0,,,"PatrickZaki diplomatici assoluzione PatrickZaki PatrickZakilibero",,,,,"http://pbs.twimg.com/media/FGBrL6sXsAU_eln.jpg","https://t.co/IED4Vl3DwL","https://twitter.com/federicadieni/status/1468292629154652166/photo/1","photo","http://pbs.twimg.com/media/FGBrL6sXsAU_eln.jpg","https://t.co/IED4Vl3DwL","https://twitter.com/federicadieni/status/1468292629154652166/photo/1",,,,"it",,,,,,,,,,,,,,,,,,,,,,,,,,,,,,,,,,,,,"NA NA","NA NA","NA NA NA NA NA NA NA NA","https://twitter.com/federicadieni/status/1468292629154652166","Federica Dieni","","Deputata M5S eletta nella circoscrizione Calabria. Membro della Commissione Affari costituzionali. VicePresidente COPASIR. Avvocato","https://t.co/0GCpTl5rBq",FALSE,9383,544,124,1534,301,2012-11-10 22:45:59,TRUE,"https://t.co/0GCpTl5rBq","http://www.federicadieni.it",,"https://pbs.twimg.com/profile_banners/940100618/1398241247","http://abs.twimg.com/images/themes/theme1/bg.png","http://pbs.twimg.com/profile_images/1407747487406997514/fFr24GWp_normal.jpg"
"x48062712","x1468542015608692742",2021-12-08 11:24:35,"luigidimaio","A conclusione 2a ministeriale Italia-Asia centrale, il Min @luigidimaio ha dato appuntamento alla prossima edizione in Italia. Valorizzata importanza cooperazione🇮🇹 con i paesi dell'area, interlocutori privilegiati dal dialogo politico alla coop. economica, culturale e sanitaria. https://t.co/qjIjedwEzp","Twitter for iPhone",140,,,,FALSE,TRUE,0,4,,,,,,,,,,,,,,,,"x599114492 x48062712","ItalyMFA luigidimaio","it",,,,,,,,,,,,,,,,"x1468536797286305794","A conclusione 2a ministeriale Italia-Asia centrale, il Min @luigidimaio ha dato appuntamento alla prossima edizione in Italia. Valorizzata importanza cooperazione🇮🇹 con i paesi dell'area, interlocutori privilegiati dal dialogo politico alla coop. economica, culturale e sanitaria. https://t.co/qjIjedwEzp",2021-12-08 11:03:51,"Twitter for iPhone",17,4,"x599114492","ItalyMFA","Farnesina 🇮🇹",243186,949,15052,"Roma, Italia","Profilo ufficiale del Ministero degli Affari Esteri e della Cooperazione Internazionale | Ministry of Foreign Affairs and International Cooperation of Italy",TRUE,,,,,,,"NA NA","NA NA","NA NA NA NA NA NA NA NA","https://twitter.com/luigidimaio/status/1468542015608692742","Luigi Di Maio","Pomigliano d'Arco, Campania","Ministro degli Affari Esteri e della Cooperazione Internazionale.","https://t.co/D8gkagqksG",FALSE,742212,349,2123,6778,344,2009-06-17 18:34:46,TRUE,"https://t.co/D8gkagqksG","http://www.luigidimaio.it",,"https://pbs.twimg.com/profile_banners/48062712/1634667505","http://abs.twimg.com/images/themes/theme1/bg.png","http://pbs.twimg.com/profile_images/933106806670462976/YyC7LOW8_normal.jpg"
"x48062712","x1468540077374676993",2021-12-08 11:16:53,"luigidimaio","A margine della riunione ministeriale Italia-Asia centrale, il Min @luigidimaio ha incontrato il Ministro degli Affari Esteri della Repubblica del Tagikistan, Siridjiddin Muhriddin. Rapporti bilaterali 🇮🇹🇹🇯, rilancio del partenariato economico e Afghanistan. @ItalyinUZB","Twitter for iPhone",140,,,,FALSE,TRUE,0,5,,,,,,,,,,,,,,,,"x599114492 x48062712","ItalyMFA luigidimaio","it",,,,,,,,,,,,,,,,"x1468531003547430924","A margine della riunione ministeriale Italia-Asia centrale, il Min @luigidimaio ha incontrato il Ministro degli Affari Esteri della Repubblica del Tagikistan, Siridjiddin Muhriddin. Rapporti bilaterali 🇮🇹🇹🇯, rilancio del partenariato economico e Afghanistan. @ItalyinUZB",2021-12-08 10:40:49,"Twitter for iPhone",9,5,"x599114492","ItalyMFA","Farnesina 🇮🇹",243186,949,15052,"Roma, Italia","Profilo ufficiale del Ministero degli Affari Esteri e della Cooperazione Internazionale | Ministry of Foreign Affairs and International Cooperation of Italy",TRUE,,,,,,,"NA NA","NA NA","NA NA NA NA NA NA NA NA","https://twitter.com/luigidimaio/status/1468540077374676993","Luigi Di Maio","Pomigliano d'Arco, Campania","Ministro degli Affari Esteri e della Cooperazione Internazionale.","https://t.co/D8gkagqksG",FALSE,742212,349,2123,6778,344,2009-06-17 18:34:46,TRUE,"https://t.co/D8gkagqksG","http://www.luigidimaio.it",,"https://pbs.twimg.com/profile_banners/48062712/1634667505","http://abs.twimg.com/images/themes/theme1/bg.png","http://pbs.twimg.com/profile_images/933106806670462976/YyC7LOW8_normal.jpg"
"x48062712","x1468519245273341954",2021-12-08 09:54:06,"luigidimaio","A margine della riunione ministeriale Italia-Asia centrale il Min @luigidimaio ha incontrato il suo omologo kirghiso, @Kazakbaev_R. Focus su rapporti bilaterali🇮🇹🇰🇬 e situazione nella regione centrasiatica, con particolare riferimento all’Afghanistan. https://t.co/sXIaRHmR1I","Twitter for iPhone",140,,,,FALSE,TRUE,0,5,,,,,,,,,,,,,,,,"x599114492 x48062712","ItalyMFA luigidimaio","it",,,,,,,,,,,,,,,,"x1468519140411547650","A margine della riunione ministeriale Italia-Asia centrale il Min @luigidimaio ha incontrato il suo omologo kirghiso, @Kazakbaev_R. Focus su rapporti bilaterali🇮🇹🇰🇬 e situazione nella regione centrasiatica, con particolare riferimento all’Afghanistan. https://t.co/sXIaRHmR1I",2021-12-08 09:53:41,"Twitter for iPhone",33,5,"x599114492","ItalyMFA","Farnesina 🇮🇹",243186,949,15052,"Roma, Italia","Profilo ufficiale del Ministero degli Affari Esteri e della Cooperazione Internazionale | Ministry of Foreign Affairs and International Cooperation of Italy",TRUE,,,,,,,"NA NA","NA NA","NA NA NA NA NA NA NA NA","https://twitter.com/luigidimaio/status/1468519245273341954","Luigi Di Maio","Pomigliano d'Arco, Campania","Ministro degli Affari Esteri e della Cooperazione Internazionale.","https://t.co/D8gkagqksG",FALSE,742212,349,2123,6778,344,2009-06-17 18:34:46,TRUE,"https://t.co/D8gkagqksG","http://www.luigidimaio.it",,"https://pbs.twimg.com/profile_banners/48062712/1634667505","http://abs.twimg.com/images/themes/theme1/bg.png","http://pbs.twimg.com/profile_images/933106806670462976/YyC7LOW8_normal.jpg"
"x48062712","x1468511969837826049",2021-12-08 09:25:11,"luigidimaio","A margine della riunione ministeriale Italia-Asia centrale, il Min @luigidimaio ha incontrato il Vice Primo Ministro e Min Affari Esteri della Rep del Kazakhstan, Mukhtar Tileuberdi. Rapporti politici, economici e culturali 🇮🇹🇰🇿 e situazione in Afghanistan. https://t.co/agomJa7IyC","Twitter for iPhone",140,,,,FALSE,TRUE,0,4,,,,,,,,,,,,,,,,"x599114492 x48062712","ItalyMFA luigidimaio","it",,,,,,,,,,,,,,,,"x1468509583836602372","A margine della riunione ministeriale Italia-Asia centrale, il Min @luigidimaio ha incontrato il Vice Primo Ministro e Min Affari Esteri della Rep del Kazakhstan, Mukhtar Tileuberdi. Rapporti politici, economici e culturali 🇮🇹🇰🇿 e situazione in Afghanistan. https://t.co/agomJa7IyC",2021-12-08 09:15:43,"Twitter for iPhone",31,4,"x599114492","ItalyMFA","Farnesina 🇮🇹",243186,949,15052,"Roma, Italia","Profilo ufficiale del Ministero degli Affari Esteri e della Cooperazione Internazionale | Ministry of Foreign Affairs and International Cooperation of Italy",TRUE,,,,,,,"NA NA","NA NA","NA NA NA NA NA NA NA NA","https://twitter.com/luigidimaio/status/1468511969837826049","Luigi Di Maio","Pomigliano d'Arco, Campania","Ministro degli Affari Esteri e della Cooperazione Internazionale.","https://t.co/D8gkagqksG",FALSE,742212,349,2123,6778,344,2009-06-17 18:34:46,TRUE,"https://t.co/D8gkagqksG","http://www.luigidimaio.it",,"https://pbs.twimg.com/profile_banners/48062712/1634667505","http://abs.twimg.com/images/themes/theme1/bg.png","http://pbs.twimg.com/profile_images/933106806670462976/YyC7LOW8_normal.jpg"
"x48062712","x1468511895795781636",2021-12-08 09:24:54,"luigidimaio","A margine della riunione ministeriale IT-Asia centrale il Min @luigidimaio ha incontrato il suo omologo uzbeko, Abdulaziz Kamilov. Rapporti bil 🇮🇹🇺🇿 e Afghanistan. Sostegno 🇮🇹 a progressiva integrazione 🇺🇿 nelle principali organizzazioni internazionali e regionali. @ItalyinUZB https://t.co/GWxaAV1nHl","Twitter for iPhone",140,,,,FALSE,TRUE,0,5,,,,,,,,,,,,,,,,"x599114492 x48062712","ItalyMFA luigidimaio","it",,,,,,,,,,,,,,,,"x1468503982545031170","A margine della riunione ministeriale IT-Asia centrale il Min @luigidimaio ha incontrato il suo omologo uzbeko, Abdulaziz Kamilov. Rapporti bil 🇮🇹🇺🇿 e Afghanistan. Sostegno 🇮🇹 a progressiva integrazione 🇺🇿 nelle principali organizzazioni internazionali e regionali. @ItalyinUZB https://t.co/GWxaAV1nHl",2021-12-08 08:53:27,"Twitter Web App",21,5,"x599114492","ItalyMFA","Farnesina 🇮🇹",243186,949,15052,"Roma, Italia","Profilo ufficiale del Ministero degli Affari Esteri e della Cooperazione Internazionale | Ministry of Foreign Affairs and International Cooperation of Italy",TRUE,,,,,,,"NA NA","NA NA","NA NA NA NA NA NA NA NA","https://twitter.com/luigidimaio/status/1468511895795781636","Luigi Di Maio","Pomigliano d'Arco, Campania","Ministro degli Affari Esteri e della Cooperazione Internazionale.","https://t.co/D8gkagqksG",FALSE,742212,349,2123,6778,344,2009-06-17 18:34:46,TRUE,"https://t.co/D8gkagqksG","http://www.luigidimaio.it",,"https://pbs.twimg.com/profile_banners/48062712/1634667505","http://abs.twimg.com/images/themes/theme1/bg.png","http://pbs.twimg.com/profile_images/933106806670462976/YyC7LOW8_normal.jpg"
"x48062712","x1468511502067982338",2021-12-08 09:23:20,"luigidimaio","Il Min @luigidimaio introduce i lavori della seconda riunione ministeriale Italia-Asia centrale. Espresso auspicio rafforzamento della collaborazione tra 🇮🇹 e i paesi della regione e individuazione risposte condivise alle sfide comuni che interessano i nostri Paesi. @ItalyinUZB https://t.co/XvWmrj6POl","Twitter for iPhone",140,,,,FALSE,TRUE,0,10,,,,,,,,,,,,,,,,"x599114492 x48062712","ItalyMFA luigidimaio","it",,,,,,,,,,,,,,,,"x1468497176368197632","Il Min @luigidimaio introduce i lavori della seconda riunione ministeriale Italia-Asia centrale. Espresso auspicio rafforzamento della collaborazione tra 🇮🇹 e i paesi della regione e individuazione risposte condivise alle sfide comuni che interessano i nostri Paesi. @ItalyinUZB https://t.co/XvWmrj6POl",2021-12-08 08:26:24,"Twitter Web App",41,10,"x599114492","ItalyMFA","Farnesina 🇮🇹",243186,949,15052,"Roma, Italia","Profilo ufficiale del Ministero degli Affari Esteri e della Cooperazione Internazionale | Ministry of Foreign Affairs and International Cooperation of Italy",TRUE,,,,,,,"NA NA","NA NA","NA NA NA NA NA NA NA NA","https://twitter.com/luigidimaio/status/1468511502067982338","Luigi Di Maio","Pomigliano d'Arco, Campania","Ministro degli Affari Esteri e della Cooperazione Internazionale.","https://t.co/D8gkagqksG",FALSE,742212,349,2123,6778,344,2009-06-17 18:34:46,TRUE,"https://t.co/D8gkagqksG","http://www.luigidimaio.it",,"https://pbs.twimg.com/profile_banners/48062712/1634667505","http://abs.twimg.com/images/themes/theme1/bg.png","http://pbs.twimg.com/profile_images/933106806670462976/YyC7LOW8_normal.jpg"
"x48062712","x1468304858109431808",2021-12-07 19:42:12,"luigidimaio","Il Min. @luigidimaio è in missione a Tashkent per co-presiedere insieme all’omologo uzbeko, Abdulaziz Kamilov, la seconda riunione ministeriale Italia-Asia centrale nel formato 🇮🇹 + 🇰🇿 🇰🇬 🇹🇯 🇹🇲 🇺🇿 https://t.co/f0K8vXJEAQ","Twitter for iPhone",140,,,,FALSE,TRUE,0,12,,,,,,,,,,,,,,,,"x599114492 x48062712","ItalyMFA luigidimaio","it",,,,,,,,,,,,,,,,"x1468294570672893953","Il Min. @luigidimaio è in missione a Tashkent per co-presiedere insieme all’omologo uzbeko, Abdulaziz Kamilov, la seconda riunione ministeriale Italia-Asia centrale nel formato 🇮🇹 + 🇰🇿 🇰🇬 🇹🇯 🇹🇲 🇺🇿 https://t.co/f0K8vXJEAQ",2021-12-07 19:01:19,"Twitter Web App",66,12,"x599114492","ItalyMFA","Farnesina 🇮🇹",243186,949,15052,"Roma, Italia","Profilo ufficiale del Ministero degli Affari Esteri e della Cooperazione Internazionale | Ministry of Foreign Affairs and International Cooperation of Italy",TRUE,,,,,,,"NA NA","NA NA","NA NA NA NA NA NA NA NA","https://twitter.com/luigidimaio/status/1468304858109431808","Luigi Di Maio","Pomigliano d'Arco, Campania","Ministro degli Affari Esteri e della Cooperazione Internazionale.","https://t.co/D8gkagqksG",FALSE,742212,349,2123,6778,344,2009-06-17 18:34:46,TRUE,"https://t.co/D8gkagqksG","http://www.luigidimaio.it",,"https://pbs.twimg.com/profile_banners/48062712/1634667505","http://abs.twimg.com/images/themes/theme1/bg.png","http://pbs.twimg.com/profile_images/933106806670462976/YyC7LOW8_normal.jpg"
"x48062712","x1468184878592180227",2021-12-07 11:45:27,"luigidimaio","Primo obiettivo raggiunto: Patrick Zaki non è più in carcere. 
Adesso continuiamo a lavorare silenziosamente, con costanza e impegno. 
Un doveroso ringraziamento al nostro corpo diplomatico.","Twitter for iPhone",190,,,,FALSE,FALSE,940,157,,,,,,,,,,,,,,,,,,"it",,,,,,,,,,,,,,,,,,,,,,,,,,,,,,,,,,,,,"NA NA","NA NA","NA NA NA NA NA NA NA NA","https://twitter.com/luigidimaio/status/1468184878592180227","Luigi Di Maio","Pomigliano d'Arco, Campania","Ministro degli Affari Esteri e della Cooperazione Internazionale.","https://t.co/D8gkagqksG",FALSE,742212,349,2123,6778,344,2009-06-17 18:34:46,TRUE,"https://t.co/D8gkagqksG","http://www.luigidimaio.it",,"https://pbs.twimg.com/profile_banners/48062712/1634667505","http://abs.twimg.com/images/themes/theme1/bg.png","http://pbs.twimg.com/profile_images/933106806670462976/YyC7LOW8_normal.jpg"
"x122445010","x1468184922041069576",2021-12-07 11:45:37,"FedericoDinca","La notizia della scarcerazione di #PatrickZaki è un primo passo importante in una vicenda che tutti speriamo si possa chiarire e concludere presto. Coraggio Patrick!","Twitter for Android",165,,,,FALSE,FALSE,8,0,,,"PatrickZaki",,,,,,,,,,,,,,,"it",,,,,,,,,,,,,,,,,,,,,,,,,,,,,,,,,,,,,"NA NA","NA NA","NA NA NA NA NA NA NA NA","https://twitter.com/FedericoDinca/status/1468184922041069576","Federico D'Incà","","Ministro per i Rapporti con il Parlamento e le Riforme","https://t.co/UFCWewwvtT",FALSE,14420,1052,220,4523,65,2010-03-12 18:47:13,TRUE,"https://t.co/UFCWewwvtT","http://www.federicodinca.it",,"https://pbs.twimg.com/profile_banners/122445010/1613160864","http://abs.twimg.com/images/themes/theme1/bg.png","http://pbs.twimg.com/profile_images/1409407471559512065/khni2uiy_normal.jpg"
"x208642171","x1468530535060414468",2021-12-08 10:38:58,"ManlioDS","Il Min @luigidimaio introduce i lavori della seconda riunione ministeriale Italia-Asia centrale. Espresso auspicio rafforzamento della collaborazione tra 🇮🇹 e i paesi della regione e individuazione risposte condivise alle sfide comuni che interessano i nostri Paesi. @ItalyinUZB https://t.co/XvWmrj6POl","Twitter for iPhone",140,,,,FALSE,TRUE,0,10,,,,,,,,,,,,,,,,"x599114492 x48062712","ItalyMFA luigidimaio","it",,,,,,,,,,,,,,,,"x1468497176368197632","Il Min @luigidimaio introduce i lavori della seconda riunione ministeriale Italia-Asia centrale. Espresso auspicio rafforzamento della collaborazione tra 🇮🇹 e i paesi della regione e individuazione risposte condivise alle sfide comuni che interessano i nostri Paesi. @ItalyinUZB https://t.co/XvWmrj6POl",2021-12-08 08:26:24,"Twitter Web App",41,10,"x599114492","ItalyMFA","Farnesina 🇮🇹",243186,949,15052,"Roma, Italia","Profilo ufficiale del Ministero degli Affari Esteri e della Cooperazione Internazionale | Ministry of Foreign Affairs and International Cooperation of Italy",TRUE,,,,,,,"NA NA","NA NA","NA NA NA NA NA NA NA NA","https://twitter.com/ManlioDS/status/1468530535060414468","Manlio Di Stefano","Milano, Lombardia","Sottosegretario agli Affari Esteri con delega Export, Imprese, Asia, Spazio, Energia, Mare, Digitale. Deputato M5S e responsabile Rousseau LEX Parlamento.","https://t.co/GTkT8ijnlu",FALSE,46652,591,323,6658,72,2010-10-27 17:05:38,TRUE,"https://t.co/GTkT8ijnlu","http://www.manliodistefano.it",,"https://pbs.twimg.com/profile_banners/208642171/1570710561","http://abs.twimg.com/images/themes/theme1/bg.png","http://pbs.twimg.com/profile_images/1311660080429850629/GB7Vq68n_normal.jpg"
