"user_id","status_id","created_at","screen_name","text","source","display_text_width","reply_to_status_id","reply_to_user_id","reply_to_screen_name","is_quote","is_retweet","favorite_count","retweet_count","quote_count","reply_count","hashtags","symbols","urls_url","urls_t.co","urls_expanded_url","media_url","media_t.co","media_expanded_url","media_type","ext_media_url","ext_media_t.co","ext_media_expanded_url","ext_media_type","mentions_user_id","mentions_screen_name","lang","quoted_status_id","quoted_text","quoted_created_at","quoted_source","quoted_favorite_count","quoted_retweet_count","quoted_user_id","quoted_screen_name","quoted_name","quoted_followers_count","quoted_friends_count","quoted_statuses_count","quoted_location","quoted_description","quoted_verified","retweet_status_id","retweet_text","retweet_created_at","retweet_source","retweet_favorite_count","retweet_retweet_count","retweet_user_id","retweet_screen_name","retweet_name","retweet_followers_count","retweet_friends_count","retweet_statuses_count","retweet_location","retweet_description","retweet_verified","place_url","place_name","place_full_name","place_type","country","country_code","geo_coords","coords_coords","bbox_coords","status_url","name","location","description","url","protected","followers_count","friends_count","listed_count","statuses_count","favourites_count","account_created_at","verified","profile_url","profile_expanded_url","account_lang","profile_banner_url","profile_background_url","profile_image_url"
"x270839361","x1457425168066883584",2021-11-07 19:10:12,"matteosalvinimi","La priorità del sindaco del Pd di Palermo… https://t.co/0yqFt0QewG","Twitter for iPhone",42,,,,FALSE,FALSE,436,89,,,,,,,,"http://pbs.twimg.com/media/FDnQdkXWYAgVA2s.jpg","https://t.co/0yqFt0QewG","https://twitter.com/matteosalvinimi/status/1457425168066883584/photo/1","photo","http://pbs.twimg.com/media/FDnQdkXWYAgVA2s.jpg","https://t.co/0yqFt0QewG","https://twitter.com/matteosalvinimi/status/1457425168066883584/photo/1",,,,"it",,,,,,,,,,,,,,,,,,,,,,,,,,,,,,,,,,,,,"NA NA","NA NA","NA NA NA NA NA NA NA NA","https://twitter.com/matteosalvinimi/status/1457425168066883584","Matteo Salvini","","Leader della Lega #primagliitaliani 🇮🇹","https://t.co/sj3rr6DU3N",FALSE,1424031,2034,3053,52099,3855,2011-03-23 10:32:56,TRUE,"https://t.co/sj3rr6DU3N","https://legaonline.it/",,"https://pbs.twimg.com/profile_banners/270839361/1635585626","http://abs.twimg.com/images/themes/theme1/bg.png","http://pbs.twimg.com/profile_images/966325945060732928/0Ua5xPMX_normal.jpg"
"x270839361","x1457357948158726145",2021-11-07 14:43:05,"matteosalvinimi","La loro colpa? Aver manifestato per i diritti delle donne in un regime di fanatici islamici. Che orrore. Una preghiera per le vittime e per le loro famiglie.","Twitter for iPhone",157,"x1457357837747859468","x270839361","matteosalvinimi",FALSE,FALSE,254,31,,,,,,,,,,,,,,,,,,"it",,,,,,,,,,,,,,,,,,,,,,,,,,,,,,,,,,,,,"NA NA","NA NA","NA NA NA NA NA NA NA NA","https://twitter.com/matteosalvinimi/status/1457357948158726145","Matteo Salvini","","Leader della Lega #primagliitaliani 🇮🇹","https://t.co/sj3rr6DU3N",FALSE,1424031,2034,3053,52099,3855,2011-03-23 10:32:56,TRUE,"https://t.co/sj3rr6DU3N","https://legaonline.it/",,"https://pbs.twimg.com/profile_banners/270839361/1635585626","http://abs.twimg.com/images/themes/theme1/bg.png","http://pbs.twimg.com/profile_images/966325945060732928/0Ua5xPMX_normal.jpg"
"x270839361","x1457357837747859468",2021-11-07 14:42:39,"matteosalvinimi","""L'abbiamo riconosciuta dai suoi vestiti. I proiettili le hanno distrutto la faccia"", ha detto la sorella di Frozan Safi, una delle vittime dei talebani. 
Insieme a Safi, attivista e docente universitaria di 29 anni, trovati altri tre corpi senza vita. https://t.co/L0iRswcmi3","Twitter for iPhone",252,,,,FALSE,FALSE,397,84,,,,,,,,"http://pbs.twimg.com/media/FDmTOkEWUAQrW0z.jpg","https://t.co/L0iRswcmi3","https://twitter.com/matteosalvinimi/status/1457357837747859468/photo/1","photo","http://pbs.twimg.com/media/FDmTOkEWUAQrW0z.jpg","https://t.co/L0iRswcmi3","https://twitter.com/matteosalvinimi/status/1457357837747859468/photo/1",,,,"it",,,,,,,,,,,,,,,,,,,,,,,,,,,,,,,,,,,,,"NA NA","NA NA","NA NA NA NA NA NA NA NA","https://twitter.com/matteosalvinimi/status/1457357837747859468","Matteo Salvini","","Leader della Lega #primagliitaliani 🇮🇹","https://t.co/sj3rr6DU3N",FALSE,1424031,2034,3053,52099,3855,2011-03-23 10:32:56,TRUE,"https://t.co/sj3rr6DU3N","https://legaonline.it/",,"https://pbs.twimg.com/profile_banners/270839361/1635585626","http://abs.twimg.com/images/themes/theme1/bg.png","http://pbs.twimg.com/profile_images/966325945060732928/0Ua5xPMX_normal.jpg"
"x270839361","x1457298307697549314",2021-11-07 10:46:06,"matteosalvinimi","Una nave tedesca sta per lasciare in Sicilia più di 800 clandestini. Domanda: i ministri dell’Interno e degli Esteri hanno chiesto a Berlino e Bruxelles di farsi carico di questi immigrati o per loro va bene così?","Twitter for iPhone",213,,,,FALSE,FALSE,1522,318,,,,,,,,,,,,,,,,,,"it",,,,,,,,,,,,,,,,,,,,,,,,,,,,,,,,,,,,,"NA NA","NA NA","NA NA NA NA NA NA NA NA","https://twitter.com/matteosalvinimi/status/1457298307697549314","Matteo Salvini","","Leader della Lega #primagliitaliani 🇮🇹","https://t.co/sj3rr6DU3N",FALSE,1424031,2034,3053,52099,3855,2011-03-23 10:32:56,TRUE,"https://t.co/sj3rr6DU3N","https://legaonline.it/",,"https://pbs.twimg.com/profile_banners/270839361/1635585626","http://abs.twimg.com/images/themes/theme1/bg.png","http://pbs.twimg.com/profile_images/966325945060732928/0Ua5xPMX_normal.jpg"
"x270839361","x1457291071306833920",2021-11-07 10:17:21,"matteosalvinimi","In preparazione emendamenti per tagliare sprechi del reddito di cittadinanza e destinarli a 2 obiettivi: taglio tasse su bollette di luce e gas, aumento bonus per genitori separati e divorziati che dopo il Covid non riescono a pagare assegno di mantenimento a figli o ex coniugi.","Twitter for iPhone",279,,,,FALSE,FALSE,640,106,,,,,,,,,,,,,,,,,,"it",,,,,,,,,,,,,,,,,,,,,,,,,,,,,,,,,,,,,"NA NA","NA NA","NA NA NA NA NA NA NA NA","https://twitter.com/matteosalvinimi/status/1457291071306833920","Matteo Salvini","","Leader della Lega #primagliitaliani 🇮🇹","https://t.co/sj3rr6DU3N",FALSE,1424031,2034,3053,52099,3855,2011-03-23 10:32:56,TRUE,"https://t.co/sj3rr6DU3N","https://legaonline.it/",,"https://pbs.twimg.com/profile_banners/270839361/1635585626","http://abs.twimg.com/images/themes/theme1/bg.png","http://pbs.twimg.com/profile_images/966325945060732928/0Ua5xPMX_normal.jpg"
"x48062712","x1457374329570738185",2021-11-07 15:48:11,"luigidimaio","Congratulazioni alla @ducaticorse, che bissa il successo dello scorso anno e si conferma campione del mondo costruttori in #MotoGP!
Le eccellenze italiane sono ancora sul tetto del mondo 🇮🇹💪🏻 https://t.co/ia20oWrYS7","Twitter for iPhone",191,,,,FALSE,FALSE,207,22,,,"MotoGP",,,,,"http://pbs.twimg.com/media/FDmiOPjXMAU20HF.jpg","https://t.co/ia20oWrYS7","https://twitter.com/luigidimaio/status/1457374329570738185/photo/1","photo","http://pbs.twimg.com/media/FDmiOPjXMAU20HF.jpg","https://t.co/ia20oWrYS7","https://twitter.com/luigidimaio/status/1457374329570738185/photo/1",,"x71793486","ducaticorse","it",,,,,,,,,,,,,,,,,,,,,,,,,,,,,,,,,,,,,"NA NA","NA NA","NA NA NA NA NA NA NA NA","https://twitter.com/luigidimaio/status/1457374329570738185","Luigi Di Maio","Pomigliano d'Arco, Campania","Ministro degli Affari Esteri e della Cooperazione Internazionale.","https://t.co/D8gkagqksG",FALSE,740751,349,2131,6717,334,2009-06-17 18:34:46,TRUE,"https://t.co/D8gkagqksG","http://www.luigidimaio.it",,"https://pbs.twimg.com/profile_banners/48062712/1634667505","http://abs.twimg.com/images/themes/theme1/bg.png","http://pbs.twimg.com/profile_images/933106806670462976/YyC7LOW8_normal.jpg"
"x48062712","x1457282840224321537",2021-11-07 09:44:38,"luigidimaio","Visita di Stato in #Algeria 🇩🇿, il Presidente #Mattarella 🇮🇹 inaugura il Giardino “Enrico #Mattei” https://t.co/YQDKtDhjwC","Twitter for iPhone",137,,,,FALSE,TRUE,0,130,,,"Algeria Mattarella Mattei",,,,,"http://pbs.twimg.com/ext_tw_video_thumb/1457279583036841986/pu/img/hGy4O_xDV_NTZfs4.jpg","https://t.co/YQDKtDhjwC","https://twitter.com/Quirinale/status/1457281006927589377/video/1","photo","http://pbs.twimg.com/ext_tw_video_thumb/1457279583036841986/pu/img/hGy4O_xDV_NTZfs4.jpg","https://t.co/YQDKtDhjwC","https://twitter.com/Quirinale/status/1457281006927589377/video/1",,"x732819391","Quirinale","it",,,,,,,,,,,,,,,,"x1457281006927589377","Visita di Stato in #Algeria 🇩🇿, il Presidente #Mattarella 🇮🇹 inaugura il Giardino “Enrico #Mattei” https://t.co/YQDKtDhjwC",2021-11-07 09:37:21,"Twitter for iPhone",884,130,"x732819391","Quirinale","Quirinale",708407,7,7078,"","Presidenza della Repubblica Italiana - Official Account",TRUE,,,,,,,"NA NA","NA NA","NA NA NA NA NA NA NA NA","https://twitter.com/luigidimaio/status/1457282840224321537","Luigi Di Maio","Pomigliano d'Arco, Campania","Ministro degli Affari Esteri e della Cooperazione Internazionale.","https://t.co/D8gkagqksG",FALSE,740751,349,2131,6717,334,2009-06-17 18:34:46,TRUE,"https://t.co/D8gkagqksG","http://www.luigidimaio.it",,"https://pbs.twimg.com/profile_banners/48062712/1634667505","http://abs.twimg.com/images/themes/theme1/bg.png","http://pbs.twimg.com/profile_images/933106806670462976/YyC7LOW8_normal.jpg"
"x997531966571466752","x1457355174914281483",2021-11-07 14:32:04,"Pres_Casellati","Con l’associazione #CantiereDelleDonne all’Accademia Galileiana di Scienze Lettere e Arti di #Padova per sostenere la loro “rivoluzione gentile” per l’emancipazione femminile. https://t.co/WAHof8x4Rf","Twitter for iPhone",175,,,,FALSE,FALSE,10,3,,,"CantiereDelleDonne Padova",,,,,"http://pbs.twimg.com/media/FDmQzf4XsAEgZbJ.jpg","https://t.co/WAHof8x4Rf","https://twitter.com/Pres_Casellati/status/1457355174914281483/photo/1","photo","http://pbs.twimg.com/media/FDmQzf4XsAEgZbJ.jpg http://pbs.twimg.com/media/FDmQzf2XEAU9CP2.jpg http://pbs.twimg.com/media/FDmQzf3XIAAsKPm.jpg","https://t.co/WAHof8x4Rf https://t.co/WAHof8x4Rf https://t.co/WAHof8x4Rf","https://twitter.com/Pres_Casellati/status/1457355174914281483/photo/1 https://twitter.com/Pres_Casellati/status/1457355174914281483/photo/1 https://twitter.com/Pres_Casellati/status/1457355174914281483/photo/1",,,,"it",,,,,,,,,,,,,,,,,,,,,,,,,,,,,,,,,,,,,"NA NA","NA NA","NA NA NA NA NA NA NA NA","https://twitter.com/Pres_Casellati/status/1457355174914281483","Maria Elisabetta Alberti Casellati","Roma, Lazio","Presidente del Senato della Repubblica","https://t.co/4xFh9XyLXO",FALSE,13867,502,100,1114,61,2018-05-18 17:38:48,TRUE,"https://t.co/4xFh9XyLXO","https://www.facebook.com/elisabetta.casellati.7",,"https://pbs.twimg.com/profile_banners/997531966571466752/1526665561","http://abs.twimg.com/images/themes/theme1/bg.png","http://pbs.twimg.com/profile_images/997533290520195072/YmnjBO3X_normal.jpg"
"x997531966571466752","x1457258303856250887",2021-11-07 08:07:08,"Pres_Casellati","In visita alla Biblioteca monumentale del Seminario Vescovile Maggiore a #Padova. https://t.co/xKDHLFsxWh","Twitter for iPhone",81,,,,FALSE,FALSE,34,5,,,"Padova",,,,,"http://pbs.twimg.com/media/FDk4rUaXsAUVvJI.jpg","https://t.co/xKDHLFsxWh","https://twitter.com/Pres_Casellati/status/1457258303856250887/photo/1","photo","http://pbs.twimg.com/media/FDk4rUaXsAUVvJI.jpg http://pbs.twimg.com/media/FDk4rUfWQAA5Oeb.jpg http://pbs.twimg.com/media/FDk4rUkXsAAPxHf.jpg http://pbs.twimg.com/media/FDk4rUqWEAAmaqx.jpg","https://t.co/xKDHLFsxWh https://t.co/xKDHLFsxWh https://t.co/xKDHLFsxWh https://t.co/xKDHLFsxWh","https://twitter.com/Pres_Casellati/status/1457258303856250887/photo/1 https://twitter.com/Pres_Casellati/status/1457258303856250887/photo/1 https://twitter.com/Pres_Casellati/status/1457258303856250887/photo/1 https://twitter.com/Pres_Casellati/status/1457258303856250887/photo/1",,,,"it",,,,,,,,,,,,,,,,,,,,,,,,,,,,,,,,,,,,,"NA NA","NA NA","NA NA NA NA NA NA NA NA","https://twitter.com/Pres_Casellati/status/1457258303856250887","Maria Elisabetta Alberti Casellati","Roma, Lazio","Presidente del Senato della Repubblica","https://t.co/4xFh9XyLXO",FALSE,13867,502,100,1114,61,2018-05-18 17:38:48,TRUE,"https://t.co/4xFh9XyLXO","https://www.facebook.com/elisabetta.casellati.7",,"https://pbs.twimg.com/profile_banners/997531966571466752/1526665561","http://abs.twimg.com/images/themes/theme1/bg.png","http://pbs.twimg.com/profile_images/997533290520195072/YmnjBO3X_normal.jpg"
"x2900717633","x1457350538199191562",2021-11-07 14:13:39,"BrunoAstorre","Complimenti a Noemi Di Segni confermata presidente dell’Unione delle Comunità Ebraiche Italiane. Una donna di straordinaria capacità che, come ha fatto in questi anni, saprà portare avanti con convizione il suo impegno. Buon lavoro","Twitter for iPhone",231,,,,FALSE,FALSE,12,1,,,,,,,,,,,,,,,,,,"it",,,,,,,,,,,,,,,,,,,,,,,,,,,,,,,,,,,,,"NA NA","NA NA","NA NA NA NA NA NA NA NA","https://twitter.com/BrunoAstorre/status/1457350538199191562","Bruno Astorre","","Senatore del PD. Membro Direzione nazionale PD. Provengo da una scuola che interpreta la politica come strumento, non come fine.","https://t.co/r8sKGpcczb",FALSE,1651,194,31,1946,144,2014-12-01 15:48:11,TRUE,"https://t.co/r8sKGpcczb","http://www.brunoastorre.it",,"https://pbs.twimg.com/profile_banners/2900717633/1546257168","http://abs.twimg.com/images/themes/theme1/bg.png","http://pbs.twimg.com/profile_images/1058727872578371589/FY_KiON0_normal.jpg"
"x876541483","x1457456877277700104",2021-11-07 21:16:12,"AlbertoBagnai","L'Italia è uscita dall'euro ed il prezzo all'ingrosso della sua energia è 195 euro/Mgwh contro i 35 della Germania. Consumando 300 milioni di Mgwh ogni anno con questo spread l'Italia spenderebbe 50 miliardi in più di bolletta . Saremmo dovuti rimanere nell'euro mannaggia a noi https://t.co/MhdGpcZV5W","Twitter for iPhone",140,,,,FALSE,TRUE,0,239,,,,,,,,,,,,,,,,"x51759517","fdragoni","it",,,,,,,,,,,,,,,,"x1457056669456867333","L'Italia è uscita dall'euro ed il prezzo all'ingrosso della sua energia è 195 euro/Mgwh contro i 35 della Germania. Consumando 300 milioni di Mgwh ogni anno con questo spread l'Italia spenderebbe 50 miliardi in più di bolletta . Saremmo dovuti rimanere nell'euro mannaggia a noi https://t.co/MhdGpcZV5W",2021-11-06 18:45:55,"Twitter for Android",494,239,"x51759517","fdragoni","Fabio Dragoni",40656,654,105245,"","Potevate scegliere fra disonore e guerra. Avete scelto il disonore. Avrete la guerra -
Ho scoperto di essere libertario - Pazienza -
Mi leggi anche su LA VERITÀ",FALSE,,,,,,,"NA NA","NA NA","NA NA NA NA NA NA NA NA","https://twitter.com/AlbertoBagnai/status/1457456877277700104","Alberto Bagnai","","Professore associato di politica economica all’Università Gabriele d’Annunzio, eletto al Senato per la Lega nel collegio Abruzzo 01.","https://t.co/sC5RvUzmsX",FALSE,128531,666,656,219946,6465,2012-10-12 22:13:36,TRUE,"https://t.co/sC5RvUzmsX","http://www.senato.it/leg/18/BGT/Schede/Attsen/00032582.htm",,"https://pbs.twimg.com/profile_banners/876541483/1535647109","http://abs.twimg.com/images/themes/theme1/bg.png","http://pbs.twimg.com/profile_images/849030859462246401/ATk3_aiW_normal.jpg"
"x876541483","x1457456739528421387",2021-11-07 21:15:39,"AlbertoBagnai","San Pernigotto, vescovo di 51 Pegasi b (aka Bellerophon). Sono sicuro che l’amico galattico lo conosce… https://t.co/rehssXH39F","Twitter for iPhone",103,,,,FALSE,FALSE,36,0,,,,,,,,"http://pbs.twimg.com/media/FDntLQ3WUAUQr7a.jpg","https://t.co/rehssXH39F","https://twitter.com/AlbertoBagnai/status/1457456739528421387/photo/1","photo","http://pbs.twimg.com/media/FDntLQ3WUAUQr7a.jpg","https://t.co/rehssXH39F","https://twitter.com/AlbertoBagnai/status/1457456739528421387/photo/1",,,,"it",,,,,,,,,,,,,,,,,,,,,,,,,,,,,,,,,,,,,"NA NA","NA NA","NA NA NA NA NA NA NA NA","https://twitter.com/AlbertoBagnai/status/1457456739528421387","Alberto Bagnai","","Professore associato di politica economica all’Università Gabriele d’Annunzio, eletto al Senato per la Lega nel collegio Abruzzo 01.","https://t.co/sC5RvUzmsX",FALSE,128531,666,656,219946,6465,2012-10-12 22:13:36,TRUE,"https://t.co/sC5RvUzmsX","http://www.senato.it/leg/18/BGT/Schede/Attsen/00032582.htm",,"https://pbs.twimg.com/profile_banners/876541483/1535647109","http://abs.twimg.com/images/themes/theme1/bg.png","http://pbs.twimg.com/profile_images/849030859462246401/ATk3_aiW_normal.jpg"
"x876541483","x1457430836299673606",2021-11-07 19:32:43,"AlbertoBagnai","@seguitemi2021 Hanno fatto un'errore 
Ne parla come se avesse sbagliato 
il taglio di capelli","Twitter for iPhone",112,,,,FALSE,TRUE,0,27,,,,,,,,,,,,,,,,"x1366505333523443715 x1422223616310185998","Anna302478978 seguitemi2021","it",,,,,,,,,,,,,,,,"x1457426914134708228","@seguitemi2021 Hanno fatto un'errore 
Ne parla come se avesse sbagliato 
il taglio di capelli",2021-11-07 19:17:08,"Twitter for Android",65,27,"x1366505333523443715","Anna302478978","Anna3",878,952,30605,"","SONO TORNATA ! 😀",FALSE,,,,,,,"NA NA","NA NA","NA NA NA NA NA NA NA NA","https://twitter.com/AlbertoBagnai/status/1457430836299673606","Alberto Bagnai","","Professore associato di politica economica all’Università Gabriele d’Annunzio, eletto al Senato per la Lega nel collegio Abruzzo 01.","https://t.co/sC5RvUzmsX",FALSE,128531,666,656,219946,6465,2012-10-12 22:13:36,TRUE,"https://t.co/sC5RvUzmsX","http://www.senato.it/leg/18/BGT/Schede/Attsen/00032582.htm",,"https://pbs.twimg.com/profile_banners/876541483/1535647109","http://abs.twimg.com/images/themes/theme1/bg.png","http://pbs.twimg.com/profile_images/849030859462246401/ATk3_aiW_normal.jpg"
"x876541483","x1457427726713901064",2021-11-07 19:20:22,"AlbertoBagnai","Un gradito ritorno! Notizie dalla Galassia… https://t.co/bt8gnruiTL","Twitter for iPhone",43,,,,FALSE,FALSE,60,6,,,,,,,,"http://pbs.twimg.com/media/FDnSynnXsBkCQrt.jpg","https://t.co/bt8gnruiTL","https://twitter.com/AlbertoBagnai/status/1457427726713901064/photo/1","photo","http://pbs.twimg.com/media/FDnSynnXsBkCQrt.jpg","https://t.co/bt8gnruiTL","https://twitter.com/AlbertoBagnai/status/1457427726713901064/photo/1",,,,"it",,,,,,,,,,,,,,,,,,,,,,,,,,,,,,,,,,,,,"NA NA","NA NA","NA NA NA NA NA NA NA NA","https://twitter.com/AlbertoBagnai/status/1457427726713901064","Alberto Bagnai","","Professore associato di politica economica all’Università Gabriele d’Annunzio, eletto al Senato per la Lega nel collegio Abruzzo 01.","https://t.co/sC5RvUzmsX",FALSE,128531,666,656,219946,6465,2012-10-12 22:13:36,TRUE,"https://t.co/sC5RvUzmsX","http://www.senato.it/leg/18/BGT/Schede/Attsen/00032582.htm",,"https://pbs.twimg.com/profile_banners/876541483/1535647109","http://abs.twimg.com/images/themes/theme1/bg.png","http://pbs.twimg.com/profile_images/849030859462246401/ATk3_aiW_normal.jpg"
"x876541483","x1457427128123863055",2021-11-07 19:17:59,"AlbertoBagnai","@AlessandroInn20 No, il Governo ha sempre rifiutato questo impegno, perché aderisce al progetto “europeista” di creazione di un debito sovranazionale contro la volontà degli elettori tedeschi. Per questo abbiamo chiesto tutti i prestiti. Non è una buona idea, ma in questa fase più che dirglielo…","Twitter for iPhone",279,"x1457409852444131336","x1052552909496438784","AlessandroInn20",FALSE,FALSE,2,2,,,,,,,,,,,,,,,,"x1052552909496438784","AlessandroInn20","it",,,,,,,,,,,,,,,,,,,,,,,,,,,,,,,,,,,,,"NA NA","NA NA","NA NA NA NA NA NA NA NA","https://twitter.com/AlbertoBagnai/status/1457427128123863055","Alberto Bagnai","","Professore associato di politica economica all’Università Gabriele d’Annunzio, eletto al Senato per la Lega nel collegio Abruzzo 01.","https://t.co/sC5RvUzmsX",FALSE,128531,666,656,219946,6465,2012-10-12 22:13:36,TRUE,"https://t.co/sC5RvUzmsX","http://www.senato.it/leg/18/BGT/Schede/Attsen/00032582.htm",,"https://pbs.twimg.com/profile_banners/876541483/1535647109","http://abs.twimg.com/images/themes/theme1/bg.png","http://pbs.twimg.com/profile_images/849030859462246401/ATk3_aiW_normal.jpg"
"x876541483","x1457391894896459781",2021-11-07 16:57:59,"AlbertoBagnai","https://t.co/bFFPf94Vmj","Twitter for iPhone",0,,,,FALSE,FALSE,106,6,,,,,,,,"http://pbs.twimg.com/media/FDmyMycXsAIQVuC.jpg","https://t.co/bFFPf94Vmj","https://twitter.com/AlbertoBagnai/status/1457391894896459781/photo/1","photo","http://pbs.twimg.com/media/FDmyMycXsAIQVuC.jpg","https://t.co/bFFPf94Vmj","https://twitter.com/AlbertoBagnai/status/1457391894896459781/photo/1",,,,"und",,,,,,,,,,,,,,,,,,,,,,,,,,,,,,,,,,,,,"NA NA","NA NA","NA NA NA NA NA NA NA NA","https://twitter.com/AlbertoBagnai/status/1457391894896459781","Alberto Bagnai","","Professore associato di politica economica all’Università Gabriele d’Annunzio, eletto al Senato per la Lega nel collegio Abruzzo 01.","https://t.co/sC5RvUzmsX",FALSE,128531,666,656,219946,6465,2012-10-12 22:13:36,TRUE,"https://t.co/sC5RvUzmsX","http://www.senato.it/leg/18/BGT/Schede/Attsen/00032582.htm",,"https://pbs.twimg.com/profile_banners/876541483/1535647109","http://abs.twimg.com/images/themes/theme1/bg.png","http://pbs.twimg.com/profile_images/849030859462246401/ATk3_aiW_normal.jpg"
"x876541483","x1457388390991765506",2021-11-07 16:44:04,"AlbertoBagnai","Dica il candidato quale sia la capacità di progettazione, esecuzione e controllo di investimenti pubblici negli enti locali, dopo oltre 10 anni di tagli al personale e agli investimenti.
Due risposte:
- per fare bene, faranno poco
- per fare tutto, faranno male
#PNRR https://t.co/Xqmrpuc6pQ","Twitter for iPhone",140,,,,FALSE,TRUE,0,181,,,,,,,,,,,,,,,,"x589418956","giuslit","it",,,,,,,,,,,,,,,,"x1457300014712119305","Dica il candidato quale sia la capacità di progettazione, esecuzione e controllo di investimenti pubblici negli enti locali, dopo oltre 10 anni di tagli al personale e agli investimenti.
Due risposte:
- per fare bene, faranno poco
- per fare tutto, faranno male
#PNRR https://t.co/Xqmrpuc6pQ",2021-11-07 10:52:53,"Twitter Web App",406,181,"x589418956","giuslit","Ora Basta",23298,879,61515,"Bari, Italy","Commercialista di Bari [cit.]",FALSE,,,,,,,"NA NA","NA NA","NA NA NA NA NA NA NA NA","https://twitter.com/AlbertoBagnai/status/1457388390991765506","Alberto Bagnai","","Professore associato di politica economica all’Università Gabriele d’Annunzio, eletto al Senato per la Lega nel collegio Abruzzo 01.","https://t.co/sC5RvUzmsX",FALSE,128531,666,656,219946,6465,2012-10-12 22:13:36,TRUE,"https://t.co/sC5RvUzmsX","http://www.senato.it/leg/18/BGT/Schede/Attsen/00032582.htm",,"https://pbs.twimg.com/profile_banners/876541483/1535647109","http://abs.twimg.com/images/themes/theme1/bg.png","http://pbs.twimg.com/profile_images/849030859462246401/ATk3_aiW_normal.jpg"
"x876541483","x1457385115206799368",2021-11-07 16:31:03,"AlbertoBagnai","https://t.co/Lz14hFvLmU","Twitter for iPhone",37,,,,FALSE,TRUE,0,5,,,,,,,,"http://pbs.twimg.com/media/FDmo_LtXsAQjtBD.jpg","https://t.co/Lz14hFvLmU","https://twitter.com/miskatos/status/1457381786745516033/photo/1","photo","http://pbs.twimg.com/media/FDmo_LtXsAQjtBD.jpg","https://t.co/Lz14hFvLmU","https://twitter.com/miskatos/status/1457381786745516033/photo/1",,"x2787897519","miskatos","und",,,,,,,,,,,,,,,,"x1457381786745516033","https://t.co/Lz14hFvLmU",2021-11-07 16:17:49,"Twitter for iPhone",51,5,"x2787897519","miskatos","Miska",561,1183,43647,"Perugia","https://t.co/IZioJOCerq Sostieni https://t.co/AP76e1hzx3",FALSE,,,,,,,"NA NA","NA NA","NA NA NA NA NA NA NA NA","https://twitter.com/AlbertoBagnai/status/1457385115206799368","Alberto Bagnai","","Professore associato di politica economica all’Università Gabriele d’Annunzio, eletto al Senato per la Lega nel collegio Abruzzo 01.","https://t.co/sC5RvUzmsX",FALSE,128531,666,656,219946,6465,2012-10-12 22:13:36,TRUE,"https://t.co/sC5RvUzmsX","http://www.senato.it/leg/18/BGT/Schede/Attsen/00032582.htm",,"https://pbs.twimg.com/profile_banners/876541483/1535647109","http://abs.twimg.com/images/themes/theme1/bg.png","http://pbs.twimg.com/profile_images/849030859462246401/ATk3_aiW_normal.jpg"
"x876541483","x1457351513274261507",2021-11-07 14:17:31,"AlbertoBagnai","Troppo a lungo ci si è cullati sul potere salvifico del vaccino. Ora che la protezione inizia a scendere e gli ospedali accolgono anche tanti vaccinati, rischiamo di chiudere perché non su è fatto abbastanza in termini di incremento dei posti letto 

https://t.co/NYb6qZxnd2","Twitter for iPhone",140,,,,FALSE,TRUE,0,99,,,,,,,,,,,,,,,,"x363251033","AntonioGrzt","it",,,,,,,,,,,,,,,,"x1457347926657753088","Troppo a lungo ci si è cullati sul potere salvifico del vaccino. Ora che la protezione inizia a scendere e gli ospedali accolgono anche tanti vaccinati, rischiamo di chiudere perché non su è fatto abbastanza in termini di incremento dei posti letto 

https://t.co/NYb6qZxnd2",2021-11-07 14:03:16,"Twitter for Android",212,99,"x363251033","AntonioGrzt","Antonio Grizzuti ☣️",5681,685,19502,"Sassari, Sardegna","Doing something great is overrated. Because then people expect that from you all the time. What they don't realize is you're just as screwed up as they are",FALSE,,,,,,,"NA NA","NA NA","NA NA NA NA NA NA NA NA","https://twitter.com/AlbertoBagnai/status/1457351513274261507","Alberto Bagnai","","Professore associato di politica economica all’Università Gabriele d’Annunzio, eletto al Senato per la Lega nel collegio Abruzzo 01.","https://t.co/sC5RvUzmsX",FALSE,128531,666,656,219946,6465,2012-10-12 22:13:36,TRUE,"https://t.co/sC5RvUzmsX","http://www.senato.it/leg/18/BGT/Schede/Attsen/00032582.htm",,"https://pbs.twimg.com/profile_banners/876541483/1535647109","http://abs.twimg.com/images/themes/theme1/bg.png","http://pbs.twimg.com/profile_images/849030859462246401/ATk3_aiW_normal.jpg"
