"x501874833","x1470090517992116227",2021-12-12 17:57:47,"s_margiotta","@s_margiotta @SenatoriPD @CinziaGrenci @PdBasilicata @marcepittella @viviancervell Caro @s_margiotta ti confermo che la pellicola è stata restaurata già da Cinecittá in 4k ne ho avuto riscontro, buona domenica","Twitter for iPad",140,,,,FALSE,TRUE,0,1,,,,,,,,,,,,,,,,"x485951615 x501874833 x404048864 x2365001385 x147496924 x95891990 x919778352 x501874833","afaretta s_margiotta SenatoriPD CinziaGrenci PdBasilicata marcepittella viviancervell s_margiotta","it",,,,,,,,,,,,,,,,"x1470088023119482895","@s_margiotta @SenatoriPD @CinziaGrenci @PdBasilicata @marcepittella @viviancervell Caro @s_margiotta ti confermo che la pellicola è stata restaurata già da Cinecittá in 4k ne ho avuto riscontro, buona domenica",2021-12-12 17:47:52,"Twitter for Android",1,1,"x485951615","afaretta","Antonello Faretta",1258,3135,10469,"Roma, Lazio","Cinéaste",FALSE,,,,,,,"NA NA","NA NA","NA NA NA NA NA NA NA NA","https://twitter.com/s_margiotta/status/1470090517992116227","Salvatore Margiotta","Roma, Potenza","Senatore, ingegnere, professore universitario. Capogruppo Commissione lavori pubblici e trasporti. Segretario Presidenza Senato","https://t.co/aeYZnOeRaN",FALSE,15754,7322,207,80186,60650,2012-02-24 15:30:04,TRUE,"https://t.co/aeYZnOeRaN","http://instangram.com/salvatore__margiotta",,"https://pbs.twimg.com/profile_banners/501874833/1483357085","http://abs.twimg.com/images/themes/theme1/bg.png","http://pbs.twimg.com/profile_images/1344056897155063808/zdD0fQgS_normal.jpg"
"x501874833","x1470064283354607616",2021-12-12 16:13:32,"s_margiotta","@ardigiorgio …se la meritano, la Meloni..se la meritano (semicit., NM)","Twitter for iPad",57,"x1469996934698082317","x14575613","ardigiorgio",FALSE,FALSE,12,1,,,,,,,,,,,,,,,,"x14575613","ardigiorgio","it",,,,,,,,,,,,,,,,,,,,,,,,,,,,,,,,,,,,,"NA NA","NA NA","NA NA NA NA NA NA NA NA","https://twitter.com/s_margiotta/status/1470064283354607616","Salvatore Margiotta","Roma, Potenza","Senatore, ingegnere, professore universitario. Capogruppo Commissione lavori pubblici e trasporti. Segretario Presidenza Senato","https://t.co/aeYZnOeRaN",FALSE,15754,7322,207,80186,60650,2012-02-24 15:30:04,TRUE,"https://t.co/aeYZnOeRaN","http://instangram.com/salvatore__margiotta",,"https://pbs.twimg.com/profile_banners/501874833/1483357085","http://abs.twimg.com/images/themes/theme1/bg.png","http://pbs.twimg.com/profile_images/1344056897155063808/zdD0fQgS_normal.jpg"
"x501874833","x1470059570387169280",2021-12-12 15:54:48,"s_margiotta","Credo che per il bene dell’Italia, per l’attuazione del Pnrr, #Draghi sia molto più utile, quasi essenziale a Palazzo Chigi. La mia intervista al @Corriere https://t.co/TSSAPwC6Tn","Twitter for iPad",140,,,,FALSE,TRUE,0,29,,,"Draghi",,,,,,,,,,,,,"x57282569","AndreaMarcucci","it",,,,,,,,,,,,,,,,"x1469961470779736069","Credo che per il bene dell’Italia, per l’attuazione del Pnrr, #Draghi sia molto più utile, quasi essenziale a Palazzo Chigi. La mia intervista al @Corriere https://t.co/TSSAPwC6Tn",2021-12-12 09:24:59,"Twitter for iPhone",210,29,"x57282569","AndreaMarcucci","Andrea Marcucci",23403,1318,10175,"Lucca, Italia","Senatore del Pd, appassionato di moto e di storia risorgimentale",TRUE,,,,,,,"NA NA","NA NA","NA NA NA NA NA NA NA NA","https://twitter.com/s_margiotta/status/1470059570387169280","Salvatore Margiotta","Roma, Potenza","Senatore, ingegnere, professore universitario. Capogruppo Commissione lavori pubblici e trasporti. Segretario Presidenza Senato","https://t.co/aeYZnOeRaN",FALSE,15754,7322,207,80186,60650,2012-02-24 15:30:04,TRUE,"https://t.co/aeYZnOeRaN","http://instangram.com/salvatore__margiotta",,"https://pbs.twimg.com/profile_banners/501874833/1483357085","http://abs.twimg.com/images/themes/theme1/bg.png","http://pbs.twimg.com/profile_images/1344056897155063808/zdD0fQgS_normal.jpg"
"x501874833","x1470059004277755913",2021-12-12 15:52:33,"s_margiotta","@pietrogiliberti @mariolavia No, di area letta non l’ho definita","Twitter for iPad",35,"x1469995639664791554","x256998498","pietrogiliberti",FALSE,FALSE,1,0,,,,,,,,,,,,,,,,"x256998498 x267174899","pietrogiliberti mariolavia","it",,,,,,,,,,,,,,,,,,,,,,,,,,,,,,,,,,,,,"NA NA","NA NA","NA NA NA NA NA NA NA NA","https://twitter.com/s_margiotta/status/1470059004277755913","Salvatore Margiotta","Roma, Potenza","Senatore, ingegnere, professore universitario. Capogruppo Commissione lavori pubblici e trasporti. Segretario Presidenza Senato","https://t.co/aeYZnOeRaN",FALSE,15754,7322,207,80186,60650,2012-02-24 15:30:04,TRUE,"https://t.co/aeYZnOeRaN","http://instangram.com/salvatore__margiotta",,"https://pbs.twimg.com/profile_banners/501874833/1483357085","http://abs.twimg.com/images/themes/theme1/bg.png","http://pbs.twimg.com/profile_images/1344056897155063808/zdD0fQgS_normal.jpg"
"x501874833","x1469973964483186692",2021-12-12 10:14:38,"s_margiotta","All’Inferno i filosofi e gli intellettuali #NoVax sarebbero puniti più severamente dei semplici attivisti, anche dei più violenti, perché maggiore è il coinvolgimento dell’intelletto nel peccato, peggiore è la pena. 
Leggere prima di commentare: https://t.co/qsdvNJJIdO

#Cacciari https://t.co/xPCLoxIwzy","Twitter for iPad",140,,,,FALSE,TRUE,0,30,,,"NoVax",,,,,,,,,,,,,"x1240690942904066049","elevisconti","it",,,,,,,,,,,,,,,,"x1469930139198930944","All’Inferno i filosofi e gli intellettuali #NoVax sarebbero puniti più severamente dei semplici attivisti, anche dei più violenti, perché maggiore è il coinvolgimento dell’intelletto nel peccato, peggiore è la pena. 
Leggere prima di commentare: https://t.co/qsdvNJJIdO

#Cacciari https://t.co/xPCLoxIwzy",2021-12-12 07:20:29,"Twitter for iPad",184,30,"x1240690942904066049","elevisconti","Elena Visconti",9996,632,17365,"","Mi disegno così ma ho imparato da poco. Dal vivo sono molto meglio, giuro.",FALSE,,,,,,,"NA NA","NA NA","NA NA NA NA NA NA NA NA","https://twitter.com/s_margiotta/status/1469973964483186692","Salvatore Margiotta","Roma, Potenza","Senatore, ingegnere, professore universitario. Capogruppo Commissione lavori pubblici e trasporti. Segretario Presidenza Senato","https://t.co/aeYZnOeRaN",FALSE,15754,7322,207,80186,60650,2012-02-24 15:30:04,TRUE,"https://t.co/aeYZnOeRaN","http://instangram.com/salvatore__margiotta",,"https://pbs.twimg.com/profile_banners/501874833/1483357085","http://abs.twimg.com/images/themes/theme1/bg.png","http://pbs.twimg.com/profile_images/1344056897155063808/zdD0fQgS_normal.jpg"
"x501874833","x1469966076985364485",2021-12-12 09:43:18,"s_margiotta","@cristiana_viola 😂","Twitter for iPad",1,"x1469959538312949762","x77207264","cristiana_viola",FALSE,FALSE,0,0,,,,,,,,,,,,,,,,"x77207264","cristiana_viola","und",,,,,,,,,,,,,,,,,,,,,,,,,,,,,,,,,,,,,"NA NA","NA NA","NA NA NA NA NA NA NA NA","https://twitter.com/s_margiotta/status/1469966076985364485","Salvatore Margiotta","Roma, Potenza","Senatore, ingegnere, professore universitario. Capogruppo Commissione lavori pubblici e trasporti. Segretario Presidenza Senato","https://t.co/aeYZnOeRaN",FALSE,15754,7322,207,80186,60650,2012-02-24 15:30:04,TRUE,"https://t.co/aeYZnOeRaN","http://instangram.com/salvatore__margiotta",,"https://pbs.twimg.com/profile_banners/501874833/1483357085","http://abs.twimg.com/images/themes/theme1/bg.png","http://pbs.twimg.com/profile_images/1344056897155063808/zdD0fQgS_normal.jpg"
"x501874833","x1469951683736264708",2021-12-12 08:46:06,"s_margiotta","La domanda non polemica è: quando se ne discute seriamente? https://t.co/8WVyKECZQS","Twitter for iPad",75,,,,FALSE,TRUE,0,9,,,,,,,,,,,,,,,,"x267174899","mariolavia","it",,,,,,,,,,,,,,,,"x1469950125443362819","La domanda non polemica è: quando se ne discute seriamente? https://t.co/8WVyKECZQS",2021-12-12 08:39:54,"Twitter Web App",42,9,"x267174899","mariolavia","Mario Lavia",33343,1863,51146,"","Giornalista, collaboro a Linkiesta",FALSE,,,,,,,"NA NA","NA NA","NA NA NA NA NA NA NA NA","https://twitter.com/s_margiotta/status/1469951683736264708","Salvatore Margiotta","Roma, Potenza","Senatore, ingegnere, professore universitario. Capogruppo Commissione lavori pubblici e trasporti. Segretario Presidenza Senato","https://t.co/aeYZnOeRaN",FALSE,15754,7322,207,80186,60650,2012-02-24 15:30:04,TRUE,"https://t.co/aeYZnOeRaN","http://instangram.com/salvatore__margiotta",,"https://pbs.twimg.com/profile_banners/501874833/1483357085","http://abs.twimg.com/images/themes/theme1/bg.png","http://pbs.twimg.com/profile_images/1344056897155063808/zdD0fQgS_normal.jpg"
"x501874833","x1469924541623320579",2021-12-12 06:58:15,"s_margiotta","Quindi il campo largo del PD va da un candidato del M5s a una candidata del PD","Twitter for iPad",92,,,,FALSE,TRUE,0,26,,,,,,,,,,,,,,,,"x384340494","vanabeau","it",,,,,,,,,,,,,,,,"x1469757394607554560","Quindi il campo largo del PD va da un candidato del M5s a una candidata del PD",2021-12-11 19:54:04,"Twitter for Android",243,26,"x384340494","vanabeau","Vana B.",13804,3317,92894,"","Architettura/Arkitekturë - Arte/Art - Politica/Politikë 🇪🇺   
DEMOCRAZIA LIBERALE 
#StatiUnitidEuropa",FALSE,,,,,,,"NA NA","NA NA","NA NA NA NA NA NA NA NA","https://twitter.com/s_margiotta/status/1469924541623320579","Salvatore Margiotta","Roma, Potenza","Senatore, ingegnere, professore universitario. Capogruppo Commissione lavori pubblici e trasporti. Segretario Presidenza Senato","https://t.co/aeYZnOeRaN",FALSE,15754,7322,207,80186,60650,2012-02-24 15:30:04,TRUE,"https://t.co/aeYZnOeRaN","http://instangram.com/salvatore__margiotta",,"https://pbs.twimg.com/profile_banners/501874833/1483357085","http://abs.twimg.com/images/themes/theme1/bg.png","http://pbs.twimg.com/profile_images/1344056897155063808/zdD0fQgS_normal.jpg"
"x1314728936","x1470034864057499648",2021-12-12 14:16:38,"NicolaMorra63","Assange, appello a Mattarella durante il presidio contro l’estradizione: “Interceda con gli Stati Uniti per ottenere la grazia”.

#Assange
#HumanRightsDay https://t.co/Jg3lJgBhBM","Twitter for Android",178,,,,FALSE,FALSE,79,44,,,"Assange HumanRightsDay",,"ilfattoquotidiano.it/2021/12/12/ass…","https://t.co/Jg3lJgBhBM","https://www.ilfattoquotidiano.it/2021/12/12/assange-appello-a-mattarella-durante-il-presidio-contro-lestradizione-interceda-con-gli-stati-uniti-per-ottenere-la-grazia/6423641/",,,,,,,,,,,"it",,,,,,,,,,,,,,,,,,,,,,,,,,,,,,,,,,,,,"NA NA","NA NA","NA NA NA NA NA NA NA NA","https://twitter.com/NicolaMorra63/status/1470034864057499648","Nicola Morra","Roma, Lazio","Presidente della Commissione Antimafia","https://t.co/iTPRV42dyl",FALSE,94038,364,419,12336,2779,2013-03-29 18:15:14,TRUE,"https://t.co/iTPRV42dyl","http://www.movimento5stelle.it",,"https://pbs.twimg.com/profile_banners/1314728936/1611601504","http://abs.twimg.com/images/themes/theme1/bg.png","http://pbs.twimg.com/profile_images/1129289852384628736/KNHsbHe3_normal.jpg"
"x306677546","x1470025942655545344",2021-12-12 13:41:11,"uraniapapatheu","Le immagini che arrivano da Ravanusa sono terribili. Il nostro auspicio è che  governo intervenga al più presto per non lasciare da sola un'intera comunità
Ringrazio la Protezione civile, i vigili del fuoco e le Forze dell'ordine per lo straordinario impegno profuso in queste ore","Twitter for Android",280,,,,FALSE,FALSE,1,0,,,,,,,,,,,,,,,,,,"it",,,,,,,,,,,,,,,,,,,,,,,,,,,,,,,,,,,,,"NA NA","NA NA","NA NA NA NA NA NA NA NA","https://twitter.com/uraniapapatheu/status/1470025942655545344","Urania Giulia Papatheu","Roma","Senatrice eletta dal popolo della libertà. #Berlusconipresidente 🇮🇹#forzaitalia🇮🇹",,FALSE,882,428,8,752,3311,2011-05-28 08:26:38,FALSE,,,,"https://pbs.twimg.com/profile_banners/306677546/1558991128","http://abs.twimg.com/images/themes/theme7/bg.gif","http://pbs.twimg.com/profile_images/1114278322995908608/TdTuJp37_normal.jpg"
"x572473007","x1469982747892621322",2021-12-12 10:49:32,"PepePasquale1","In collegamento con l’Accademia Federale della Lega!
@accademiafederalelega @legaofficial @lega_senato https://t.co/VVH1kJoKeQ","Instagram",126,,,,FALSE,FALSE,0,0,,,,,"instagram.com/pasqualepepeof…","https://t.co/VVH1kJoKeQ","https://www.instagram.com/pasqualepepeofficial/p/CXYUnrFrTgb/?utm_medium=twitter",,,,,,,,,"x783840262313353216 x973159484376875009","legaofficial Lega_Senato","it",,,,,,,,,,,,,,,,,,,,,,,,,,,,,,,,,,,,,"NA NA","NA NA","NA NA NA NA NA NA NA NA","https://twitter.com/PepePasquale1/status/1469982747892621322","Pasquale Pepe","","Avvocato. Romanista da sempre e per sempre. Dalla parte del Popolo, a prescindere!",,FALSE,882,717,12,2084,45,2012-05-06 09:40:27,FALSE,,,,,"http://abs.twimg.com/images/themes/theme1/bg.png","http://pbs.twimg.com/profile_images/634638036509310976/LMdKefXI_normal.jpg"
"x102672182","x1470122251299299336",2021-12-12 20:03:52,"robertapinotti","Capo di Stato #Patriota. https://t.co/EweBiJq31U","Twitter for iPhone",65,,,,FALSE,TRUE,0,791,,,"Patriota",,,,,"http://pbs.twimg.com/media/FGbAC8AXEAk-MAA.jpg","https://t.co/EweBiJq31U","https://twitter.com/EnricoLetta/status/1470073490745212930/photo/1","photo","http://pbs.twimg.com/media/FGbAC8AXEAk-MAA.jpg","https://t.co/EweBiJq31U","https://twitter.com/EnricoLetta/status/1470073490745212930/photo/1",,"x419622371","EnricoLetta","it",,,,,,,,,,,,,,,,"x1470073490745212930","Capo di Stato #Patriota. https://t.co/EweBiJq31U",2021-12-12 16:50:07,"Twitter for iPhone",5826,791,"x419622371","EnricoLetta","Enrico Letta",641522,13737,16066,"","Segretario del Partito Democratico @pdnetwork, Presidente @DelorsInstitute.",TRUE,,,,,,,"NA NA","NA NA","NA NA NA NA NA NA NA NA","https://twitter.com/robertapinotti/status/1470122251299299336","Roberta Pinotti","","Senatrice del Partito Democratico","https://t.co/ZQoLx1Tx21",FALSE,123933,1762,761,11177,3522,2010-01-07 13:03:42,TRUE,"https://t.co/ZQoLx1Tx21","http://www.robertapinotti.it",,"https://pbs.twimg.com/profile_banners/102672182/1522225477","http://abs.twimg.com/images/themes/theme1/bg.png","http://pbs.twimg.com/profile_images/1093446366997684224/pnplPDaI_normal.jpg"
"x102672182","x1470005140782526467",2021-12-12 12:18:31,"robertapinotti","Una tragedia immane ha colpito la comunità di #Ravanusa. Vicini al loro dolore e a tutti gli operatori che da questa notte sono in campo per salvare vite. 

@_carabinieri_, @emergenzavvf, @poliziadistato, @DPCgov https://t.co/WlXNLMimY6","Twitter for iPhone",212,,,,FALSE,FALSE,17,3,,,"Ravanusa",,,,,"http://pbs.twimg.com/media/FGaB4ORXEAswvSx.jpg","https://t.co/WlXNLMimY6","https://twitter.com/robertapinotti/status/1470005140782526467/photo/1","photo","http://pbs.twimg.com/media/FGaB4ORXEAswvSx.jpg","https://t.co/WlXNLMimY6","https://twitter.com/robertapinotti/status/1470005140782526467/photo/1",,"x2965811733 x702594325625085952 x20423071 x982240377636700161","_Carabinieri_ emergenzavvf poliziadistato DPCgov","it",,,,,,,,,,,,,,,,,,,,,,,,,,,,,,,,,,,,,"NA NA","NA NA","NA NA NA NA NA NA NA NA","https://twitter.com/robertapinotti/status/1470005140782526467","Roberta Pinotti","","Senatrice del Partito Democratico","https://t.co/ZQoLx1Tx21",FALSE,123933,1762,761,11177,3522,2010-01-07 13:03:42,TRUE,"https://t.co/ZQoLx1Tx21","http://www.robertapinotti.it",,"https://pbs.twimg.com/profile_banners/102672182/1522225477","http://abs.twimg.com/images/themes/theme1/bg.png","http://pbs.twimg.com/profile_images/1093446366997684224/pnplPDaI_normal.jpg"
"x3062283743","x1469983347082502146",2021-12-12 10:51:55,"pirroelisa","Le immagini che arrivano da #Ravanusa spezzano il cuore… un grazie ai vigili del fuoco, alla protezione civile e tutti coloro impegnati nella ricerca dei dispersi. Il più sentito cordoglio per le famiglie delle vittime","Twitter for iPhone",218,,,,FALSE,FALSE,7,4,,,"Ravanusa",,,,,,,,,,,,,,,"it",,,,,,,,,,,,,,,,,,,,,,,,,,,,,,,,,,,,,"NA NA","NA NA","NA NA NA NA NA NA NA NA","https://twitter.com/pirroelisa/status/1469983347082502146","Elisa Pirro","Orbassano, Piemonte","Senatrice della Repubblica @M5S_Senato @Mov5Stelle. Capogruppo della 12ª Commissione permanente (Igiene e Sanità) del Senato",,FALSE,1677,207,24,1678,5353,2015-02-25 15:22:04,TRUE,,,,"https://pbs.twimg.com/profile_banners/3062283743/1632556454","http://abs.twimg.com/images/themes/theme1/bg.png","http://pbs.twimg.com/profile_images/1453376367471570955/OAKjL3bH_normal.jpg"
"x3062283743","x1469976785626488833",2021-12-12 10:25:51,"pirroelisa","@walter0309 Il governo Conte 1 è caduto ad agosto 2019… 🤔
“Dal 14 maggio 2019 è il capo del dipartimento per le Libertà civili e l’Immigrazione.”

https://t.co/kCguQC40ua","Twitter for iPhone",158,"x1469939788182605827","x79998705","walter0309",FALSE,FALSE,0,0,,,,,"interno.gov.it/it/ministero/d…","https://t.co/kCguQC40ua","http://www.interno.gov.it/it/ministero/dipartimenti/dipartimento-liberta-civili-e-limmigrazione/michele-bari",,,,,,,,,"x79998705","walter0309","it",,,,,,,,,,,,,,,,,,,,,,,,,,,,,,,,,,,,,"NA NA","NA NA","NA NA NA NA NA NA NA NA","https://twitter.com/pirroelisa/status/1469976785626488833","Elisa Pirro","Orbassano, Piemonte","Senatrice della Repubblica @M5S_Senato @Mov5Stelle. Capogruppo della 12ª Commissione permanente (Igiene e Sanità) del Senato",,FALSE,1677,207,24,1678,5353,2015-02-25 15:22:04,TRUE,,,,"https://pbs.twimg.com/profile_banners/3062283743/1632556454","http://abs.twimg.com/images/themes/theme1/bg.png","http://pbs.twimg.com/profile_images/1453376367471570955/OAKjL3bH_normal.jpg"
"x3358881567","x1470035661767983109",2021-12-12 14:19:48,"PucciarelliLega","Seguo con profonda apprensione gli avvenimenti di #Ravanusa dopo la tragica esplosione che purtroppo ha già causato la morte di tre persone.

Un ringraziamento di cuore ai Vigili del Fuoco e ai tanti volontari che stanno scavando tra le macerie, senza un attimo di respiro. https://t.co/K9PNymGHvO","Twitter for iPhone",273,,,,FALSE,FALSE,6,3,,,"Ravanusa",,,,,"http://pbs.twimg.com/media/FGado_SXMAAbUai.jpg","https://t.co/K9PNymGHvO","https://twitter.com/PucciarelliLega/status/1470035661767983109/photo/1","photo","http://pbs.twimg.com/media/FGado_SXMAAbUai.jpg","https://t.co/K9PNymGHvO","https://twitter.com/PucciarelliLega/status/1470035661767983109/photo/1",,,,"it",,,,,,,,,,,,,,,,,,,,,,,,,,,,,,,,,,,,,"NA NA","NA NA","NA NA NA NA NA NA NA NA","https://twitter.com/PucciarelliLega/status/1470035661767983109","Stefania Pucciarelli","","Senatrice della #Lega, Sottosegretario di Stato al Ministero della Difesa 🇮🇹","https://t.co/yVArIYFe54",FALSE,1304,293,19,1019,174,2015-07-04 16:46:43,TRUE,"https://t.co/yVArIYFe54","http://stefaniapucciarelli.it",,"https://pbs.twimg.com/profile_banners/3358881567/1616173825","http://abs.twimg.com/images/themes/theme1/bg.png","http://pbs.twimg.com/profile_images/1372958645944729607/A64UTDLI_normal.jpg"
"x376610294","x1470183098260279303",2021-12-13 00:05:39,"isabellarauti","Buongiorno, ecco #LaVeritàdioggi

L’Ue ci aumenta pure le bollette

Non bastava la «confisca» delle case poco green. Allo studio una direttiva che impone ai fornitori di gas di pagare le emissioni di CO2 e di ridurle di oltre il 5% ogni anno.

https://t.co/ywWcjUyacQ https://t.co/a5JcBT4Ge6","Twitter for iPhone",139,,,,FALSE,TRUE,0,152,,,"LaVeritàdioggi",,,,,,,,,,,,,"x900766265245130753","LaVeritaWeb","it",,,,,,,,,,,,,,,,"x1469923019384627204","Buongiorno, ecco #LaVeritàdioggi

L’Ue ci aumenta pure le bollette

Non bastava la «confisca» delle case poco green. Allo studio una direttiva che impone ai fornitori di gas di pagare le emissioni di CO2 e di ridurle di oltre il 5% ogni anno.

https://t.co/ywWcjUyacQ https://t.co/a5JcBT4Ge6",2021-12-12 06:52:12,"Hootsuite Inc.",325,152,"x900766265245130753","LaVeritaWeb","La Verità",137903,68,25245,"Milano, Lombardia","Quotidiano indipendente diretto da @BelpietroTweet. Scopri #LaVeritàdioggi tutti i giorni in edicola al costo di € 1,30. Abbonati online oggi:",FALSE,,,,,,,"NA NA","NA NA","NA NA NA NA NA NA NA NA","https://twitter.com/isabellarauti/status/1470183098260279303","Isabella Rauti","","Giornalista, Dottore di Ricerca, Uff Esercito 🇮🇹, Senatrice, Vice Pres Gruppo FDI, Comm Difesa, Dipartimento Famiglia FDI, Associazione Pino Rauti, Onlus HOW","https://t.co/IE1TYO9vGj",FALSE,12496,5603,119,26253,15499,2011-09-20 05:48:40,TRUE,"https://t.co/IE1TYO9vGj","http://www.Isabellarauti.it",,"https://pbs.twimg.com/profile_banners/376610294/1580146815","http://abs.twimg.com/images/themes/theme1/bg.png","http://pbs.twimg.com/profile_images/699248798707621888/sTn5ZaWE_normal.jpg"
"x376610294","x1470134305225588737",2021-12-12 20:51:46,"isabellarauti","Ddl Zan, FdI orgogliosa della sua coerenza. Si voleva punire chi dissente da pensiero unico https://t.co/1XJGjgA69S","Twitter for iPhone",135,,,,FALSE,TRUE,0,5,,,,,"fratelliditaliasenato.it/ddl-zan-fdi-or…","https://t.co/1XJGjgA69S","https://www.fratelliditaliasenato.it/ddl-zan-fdi-orgogliosa-della-sua-coerenza-si-voleva-punire-chi-dissente-da-pensiero-unico/",,,,,,,,,"x985177119624966147","FDI_Parlamento","it",,,,,,,,,,,,,,,,"x1470099427742334979","Ddl Zan, FdI orgogliosa della sua coerenza. Si voleva punire chi dissente da pensiero unico https://t.co/1XJGjgA69S",2021-12-12 18:33:11,"Twitter for iPad",23,5,"x985177119624966147","FDI_Parlamento","FDI Parlamento",7084,91,11635,"Roma, Lazio","Profilo ufficiale dei Gruppi Parlamentari di #fratelliditalia al #Senato e alla #Camera.",FALSE,,,,,,,"NA NA","NA NA","NA NA NA NA NA NA NA NA","https://twitter.com/isabellarauti/status/1470134305225588737","Isabella Rauti","","Giornalista, Dottore di Ricerca, Uff Esercito 🇮🇹, Senatrice, Vice Pres Gruppo FDI, Comm Difesa, Dipartimento Famiglia FDI, Associazione Pino Rauti, Onlus HOW","https://t.co/IE1TYO9vGj",FALSE,12496,5603,119,26253,15499,2011-09-20 05:48:40,TRUE,"https://t.co/IE1TYO9vGj","http://www.Isabellarauti.it",,"https://pbs.twimg.com/profile_banners/376610294/1580146815","http://abs.twimg.com/images/themes/theme1/bg.png","http://pbs.twimg.com/profile_images/699248798707621888/sTn5ZaWE_normal.jpg"
"x376610294","x1470134185608232964",2021-12-12 20:51:18,"isabellarauti","#Atreju21 @isabellarauti introduce la presentazione del libro “Legge omofobia perché non va” di Alfredo Mantovano https://t.co/OuCeI1rPKL","Twitter for iPhone",140,,,,FALSE,TRUE,0,2,,,"Atreju21",,,,,,,,,,,,,"x4744731035 x376610294","cslivatino isabellarauti","it",,,,,,,,,,,,,,,,"x1470129036340961280","#Atreju21 @isabellarauti introduce la presentazione del libro “Legge omofobia perché non va” di Alfredo Mantovano https://t.co/OuCeI1rPKL",2021-12-12 20:30:50,"Twitter for Android",10,2,"x4744731035","cslivatino","centrostudilivatino",1549,597,1781,"","Il Centro Studi approfondisce in particolare i temi della vita, della famiglia e della libertà religiosa, avendo come quadro di riferimento il diritto naturale.",FALSE,,,,,,,"NA NA","NA NA","NA NA NA NA NA NA NA NA","https://twitter.com/isabellarauti/status/1470134185608232964","Isabella Rauti","","Giornalista, Dottore di Ricerca, Uff Esercito 🇮🇹, Senatrice, Vice Pres Gruppo FDI, Comm Difesa, Dipartimento Famiglia FDI, Associazione Pino Rauti, Onlus HOW","https://t.co/IE1TYO9vGj",FALSE,12496,5603,119,26253,15499,2011-09-20 05:48:40,TRUE,"https://t.co/IE1TYO9vGj","http://www.Isabellarauti.it",,"https://pbs.twimg.com/profile_banners/376610294/1580146815","http://abs.twimg.com/images/themes/theme1/bg.png","http://pbs.twimg.com/profile_images/699248798707621888/sTn5ZaWE_normal.jpg"
"x376610294","x1470133576863789063",2021-12-12 20:48:53,"isabellarauti","#telethon @Telethonitalia #maravenier @RaiUno @RaiUnoTV Contribuiamo alla #maratona benefica e solidale per sostenere la ricerca sulle malattie rare. Basta anche un sms o una telefonata. Dai!! #solidarieta https://t.co/btR4DZlJiP https://t.co/TdWrRUd9XI","Twitter for iPhone",229,,,,FALSE,FALSE,4,2,,,"telethon maravenier maratona solidarieta",,"telethon.it","https://t.co/btR4DZlJiP","http://Www.telethon.it","http://pbs.twimg.com/media/FGb2seOWYAQyzWc.jpg","https://t.co/TdWrRUd9XI","https://twitter.com/isabellarauti/status/1470133576863789063/photo/1","photo","http://pbs.twimg.com/media/FGb2seOWYAQyzWc.jpg http://pbs.twimg.com/media/FGb2seQXMAAvcdq.jpg http://pbs.twimg.com/media/FGb2seNXEAUp-KN.jpg http://pbs.twimg.com/media/FGb2seUXEAYuVCw.jpg","https://t.co/TdWrRUd9XI https://t.co/TdWrRUd9XI https://t.co/TdWrRUd9XI https://t.co/TdWrRUd9XI","https://twitter.com/isabellarauti/status/1470133576863789063/photo/1 https://twitter.com/isabellarauti/status/1470133576863789063/photo/1 https://twitter.com/isabellarauti/status/1470133576863789063/photo/1 https://twitter.com/isabellarauti/status/1470133576863789063/photo/1",,"x26555279 x1208394690 x538418149","Telethonitalia RaiUno RaiUnoTV","it",,,,,,,,,,,,,,,,,,,,,,,,,,,,,,,,,,,,,"NA NA","NA NA","NA NA NA NA NA NA NA NA","https://twitter.com/isabellarauti/status/1470133576863789063","Isabella Rauti","","Giornalista, Dottore di Ricerca, Uff Esercito 🇮🇹, Senatrice, Vice Pres Gruppo FDI, Comm Difesa, Dipartimento Famiglia FDI, Associazione Pino Rauti, Onlus HOW","https://t.co/IE1TYO9vGj",FALSE,12496,5603,119,26253,15499,2011-09-20 05:48:40,TRUE,"https://t.co/IE1TYO9vGj","http://www.Isabellarauti.it",,"https://pbs.twimg.com/profile_banners/376610294/1580146815","http://abs.twimg.com/images/themes/theme1/bg.png","http://pbs.twimg.com/profile_images/699248798707621888/sTn5ZaWE_normal.jpg"
