"x919526072","x1468261408429293574",2021-12-07 16:49:33,"LucioMalan","Fisco: abbattere il costo del lavoro, da Atreju 21 la richiesta dei conservatori https://t.co/GX9S74AdpU","Twitter Web App",125,,,,FALSE,TRUE,0,8,,,,,"lavocedelpatriota.it/fisco-abbatter…","https://t.co/GX9S74AdpU","https://www.lavocedelpatriota.it/fisco-abbattere-il-costo-del-lavoro-da-atreju-21-la-richiesta-dei-conservatori-2/",,,,,,,,,"x998237902055395328","vocedelpatriota","it",,,,,,,,,,,,,,,,"x1468229913144610829","Fisco: abbattere il costo del lavoro, da Atreju 21 la richiesta dei conservatori https://t.co/GX9S74AdpU",2021-12-07 14:44:24,"WordPress.com",8,8,"x998237902055395328","vocedelpatriota","🇮🇹 La Voce del Patriota 🇮🇹",7417,3233,18761,"Italia","📰 Il Giornale dei Patrioti",FALSE,,,,,,,"NA NA","NA NA","NA NA NA NA NA NA NA NA","https://twitter.com/LucioMalan/status/1468261408429293574","Lucio Malan","Italia","Senatore Fratelli d'Italia. Chi è disposto a perdere libertà fondamentale in cambio di temporanea sicurezza, non merita, e non avrà, né libertà né sicurezza.","https://t.co/KZCpB50DyP",FALSE,16079,3623,124,34041,9411,2012-11-01 17:48:51,FALSE,"https://t.co/KZCpB50DyP","http://www.luciomalan.it",,"https://pbs.twimg.com/profile_banners/919526072/1636186892","http://abs.twimg.com/images/themes/theme1/bg.png","http://pbs.twimg.com/profile_images/1456899523222069249/i60vvKs__normal.jpg"
"x919526072","x1468261269803261963",2021-12-07 16:49:00,"LucioMalan","#Atreju21 @NProcaccini: “Una battaglia che #FratellidItalia sostiene è quella dei #dazidiciviltà. Perché la comunità internazionale si attiene a determinati standard per conservare e proteggere l’ambiente e ci sono altri, come il regime cinese, che hanno fatto scelte opposte” https://t.co/05NbrFRVvh","Twitter Web App",140,,,,FALSE,TRUE,0,15,,,"Atreju21 FratellidItalia dazidiciviltà",,,,,,,,,,,,,"x1024976264 x557215750","FratellidItalia NProcaccini","it",,,,,,,,,,,,,,,,"x1468253691299999749","#Atreju21 @NProcaccini: “Una battaglia che #FratellidItalia sostiene è quella dei #dazidiciviltà. Perché la comunità internazionale si attiene a determinati standard per conservare e proteggere l’ambiente e ci sono altri, come il regime cinese, che hanno fatto scelte opposte” https://t.co/05NbrFRVvh",2021-12-07 16:18:53,"Twitter for iPhone",50,15,"x1024976264","FratellidItalia","Fratelli d'Italia 🇮🇹",139492,411,144714,"Italia","Account ufficiale di #FratellidItalia. Presidente @GiorgiaMeloni",TRUE,,,,,,,"NA NA","NA NA","NA NA NA NA NA NA NA NA","https://twitter.com/LucioMalan/status/1468261269803261963","Lucio Malan","Italia","Senatore Fratelli d'Italia. Chi è disposto a perdere libertà fondamentale in cambio di temporanea sicurezza, non merita, e non avrà, né libertà né sicurezza.","https://t.co/KZCpB50DyP",FALSE,16079,3623,124,34041,9411,2012-11-01 17:48:51,FALSE,"https://t.co/KZCpB50DyP","http://www.luciomalan.it",,"https://pbs.twimg.com/profile_banners/919526072/1636186892","http://abs.twimg.com/images/themes/theme1/bg.png","http://pbs.twimg.com/profile_images/1456899523222069249/i60vvKs__normal.jpg"
"x919526072","x1468261081026023428",2021-12-07 16:48:15,"LucioMalan","#ChicoFortiLibero @ChicoForti_Free 
@Atreju2021 #Atreju21 🎄🇮🇹 https://t.co/sJtouehrTZ","Twitter Web App",80,,,,FALSE,TRUE,0,6,,,"ChicoFortiLibero Atreju21",,,,,,,,,,,,,"x1269377600511754240 x597926584 x353048543","MauroGiubileo ChicoForti_Free Atreju2021","und",,,,,,,,,,,,,,,,"x1468254477429923852","#ChicoFortiLibero @ChicoForti_Free 
@Atreju2021 #Atreju21 🎄🇮🇹 https://t.co/sJtouehrTZ",2021-12-07 16:22:00,"Twitter for iPhone",5,6,"x1269377600511754240","MauroGiubileo","Mauro Giubileo #ChinaLiedPeopleDied",471,304,18587,"","19. Giurisprudenza @LaStatale. Atlantista, conservatore nazionale e fiscale. Anti-woke. Qui solo opinioni personali. @FratellidItalia 🇮🇹 @Giov_Nazionale 🇮🇹",FALSE,,,,,,,"NA NA","NA NA","NA NA NA NA NA NA NA NA","https://twitter.com/LucioMalan/status/1468261081026023428","Lucio Malan","Italia","Senatore Fratelli d'Italia. Chi è disposto a perdere libertà fondamentale in cambio di temporanea sicurezza, non merita, e non avrà, né libertà né sicurezza.","https://t.co/KZCpB50DyP",FALSE,16079,3623,124,34041,9411,2012-11-01 17:48:51,FALSE,"https://t.co/KZCpB50DyP","http://www.luciomalan.it",,"https://pbs.twimg.com/profile_banners/919526072/1636186892","http://abs.twimg.com/images/themes/theme1/bg.png","http://pbs.twimg.com/profile_images/1456899523222069249/i60vvKs__normal.jpg"
"x919526072","x1468260876801253377",2021-12-07 16:47:26,"LucioMalan","“Una battaglia che @FratellidItalia sostiene è quella dei dazi di civiltà. Perché la comunità internazionale si attiene a determinati standard per conservare e proteggere l’ambiente e ci sono altri, come il regime cinese, che hanno fatto scelte opposte” @NProcaccini #Atreju21 https://t.co/61Wa75bmQw","Twitter Web App",140,,,,FALSE,TRUE,0,8,,,,,,,,,,,,,,,,"x353048543 x1024976264","Atreju2021 FratellidItalia","it",,,,,,,,,,,,,,,,"x1468259667210080256","“Una battaglia che @FratellidItalia sostiene è quella dei dazi di civiltà. Perché la comunità internazionale si attiene a determinati standard per conservare e proteggere l’ambiente e ci sono altri, come il regime cinese, che hanno fatto scelte opposte” @NProcaccini #Atreju21 https://t.co/61Wa75bmQw",2021-12-07 16:42:38,"Twitter for iPhone",17,8,"x353048543","Atreju2021","Atreju",3984,1765,7452,"Roma","La più grande manifestazione della destra italiana. #Atreju21",FALSE,,,,,,,"NA NA","NA NA","NA NA NA NA NA NA NA NA","https://twitter.com/LucioMalan/status/1468260876801253377","Lucio Malan","Italia","Senatore Fratelli d'Italia. Chi è disposto a perdere libertà fondamentale in cambio di temporanea sicurezza, non merita, e non avrà, né libertà né sicurezza.","https://t.co/KZCpB50DyP",FALSE,16079,3623,124,34041,9411,2012-11-01 17:48:51,FALSE,"https://t.co/KZCpB50DyP","http://www.luciomalan.it",,"https://pbs.twimg.com/profile_banners/919526072/1636186892","http://abs.twimg.com/images/themes/theme1/bg.png","http://pbs.twimg.com/profile_images/1456899523222069249/i60vvKs__normal.jpg"
"x919526072","x1468201660942098440",2021-12-07 12:52:08,"LucioMalan","Dal Corriere della Sera: in Italia salgono le tasse, ma: tutti 😁 ! Il Fondo Monetario Internazionale ci loda! https://t.co/4CFm4JVCuD","Twitter for iPhone",109,,,,FALSE,FALSE,89,40,,,,,,,,"http://pbs.twimg.com/media/FGAZoOGXoAMjKv9.jpg","https://t.co/4CFm4JVCuD","https://twitter.com/LucioMalan/status/1468201660942098440/photo/1","photo","http://pbs.twimg.com/media/FGAZoOGXoAMjKv9.jpg","https://t.co/4CFm4JVCuD","https://twitter.com/LucioMalan/status/1468201660942098440/photo/1",,,,"it",,,,,,,,,,,,,,,,,,,,,,,,,,,,,,,,,,,,,"NA NA","NA NA","NA NA NA NA NA NA NA NA","https://twitter.com/LucioMalan/status/1468201660942098440","Lucio Malan","Italia","Senatore Fratelli d'Italia. Chi è disposto a perdere libertà fondamentale in cambio di temporanea sicurezza, non merita, e non avrà, né libertà né sicurezza.","https://t.co/KZCpB50DyP",FALSE,16079,3623,124,34041,9411,2012-11-01 17:48:51,FALSE,"https://t.co/KZCpB50DyP","http://www.luciomalan.it",,"https://pbs.twimg.com/profile_banners/919526072/1636186892","http://abs.twimg.com/images/themes/theme1/bg.png","http://pbs.twimg.com/profile_images/1456899523222069249/i60vvKs__normal.jpg"
"x919526072","x1468194880644124682",2021-12-07 12:25:11,"LucioMalan","Il dott. Paolo Bellavite, ematologo, in audizione al Senato: con il vaccino Covid (dati AIFA) 608 decessi segnalati, di cui 16 certamente correlati al vaccino e 133 correlabili anche se non certi. Con il vaccino influenzale 4 casi segnalati, nessuno correlato. https://t.co/56Q2EDUQaJ","Twitter for iPhone",260,,,,FALSE,FALSE,498,258,,,,,,,,"http://pbs.twimg.com/media/FGATdgtWYAEIC7j.jpg","https://t.co/56Q2EDUQaJ","https://twitter.com/LucioMalan/status/1468194880644124682/photo/1","photo","http://pbs.twimg.com/media/FGATdgtWYAEIC7j.jpg","https://t.co/56Q2EDUQaJ","https://twitter.com/LucioMalan/status/1468194880644124682/photo/1",,,,"it",,,,,,,,,,,,,,,,,,,,,,,,,,,,,,,,,,,,,"NA NA","NA NA","NA NA NA NA NA NA NA NA","https://twitter.com/LucioMalan/status/1468194880644124682","Lucio Malan","Italia","Senatore Fratelli d'Italia. Chi è disposto a perdere libertà fondamentale in cambio di temporanea sicurezza, non merita, e non avrà, né libertà né sicurezza.","https://t.co/KZCpB50DyP",FALSE,16079,3623,124,34041,9411,2012-11-01 17:48:51,FALSE,"https://t.co/KZCpB50DyP","http://www.luciomalan.it",,"https://pbs.twimg.com/profile_banners/919526072/1636186892","http://abs.twimg.com/images/themes/theme1/bg.png","http://pbs.twimg.com/profile_images/1456899523222069249/i60vvKs__normal.jpg"
"x919526072","x1468184775211069445",2021-12-07 11:45:02,"LucioMalan","La Vergine Maria rappresentata come un trans. È così che un “Ambasciatore speciale Ue per i diritti Lgbt” pensa di costruire un’Europa più inclusiva? Non è sbeffeggiando la religione, offendendo i fedeli o cancellando il Natale che si tutelano diritti civili. Che triste teatrino https://t.co/VXcWH2aUsv","Twitter for iPhone",140,,,,FALSE,TRUE,0,309,,,,,,,,,,,,,,,,"x130537001","GiorgiaMeloni","it",,,,,,,,,,,,,,,,"x1468183366902198275","La Vergine Maria rappresentata come un trans. È così che un “Ambasciatore speciale Ue per i diritti Lgbt” pensa di costruire un’Europa più inclusiva? Non è sbeffeggiando la religione, offendendo i fedeli o cancellando il Natale che si tutelano diritti civili. Che triste teatrino https://t.co/VXcWH2aUsv",2021-12-07 11:39:26,"Twitter for iPhone",1748,309,"x130537001","GiorgiaMeloni","Giorgia Meloni 🇮🇹 ن",1145270,923,18389,"Italia","Romana, classe '77. Politica e giornalista. Sempre, ovunque e prima di tutto, italiana. Presidente di @FratellidItalia e di @ECRParty",TRUE,,,,,,,"NA NA","NA NA","NA NA NA NA NA NA NA NA","https://twitter.com/LucioMalan/status/1468184775211069445","Lucio Malan","Italia","Senatore Fratelli d'Italia. Chi è disposto a perdere libertà fondamentale in cambio di temporanea sicurezza, non merita, e non avrà, né libertà né sicurezza.","https://t.co/KZCpB50DyP",FALSE,16079,3623,124,34041,9411,2012-11-01 17:48:51,FALSE,"https://t.co/KZCpB50DyP","http://www.luciomalan.it",,"https://pbs.twimg.com/profile_banners/919526072/1636186892","http://abs.twimg.com/images/themes/theme1/bg.png","http://pbs.twimg.com/profile_images/1456899523222069249/i60vvKs__normal.jpg"
"x897264492","x1468539186177363971",2021-12-08 11:13:20,"mancaimola","Decreto #antifrode e #superbonus: si lavora sulla #leggedibilancio per salvare i lavori avviati e non fare perdere credibilità ai bonus. Ne abbiamo con il sen. Daniele Manca @mancaimola di @SenatoriPD
 e Domenico #Massimino di @confartigianato.👇

🔴 https://t.co/WjFBgXyw8Q","Twitter for Android",140,,,,FALSE,TRUE,0,1,,,"antifrode superbonus leggedibilancio",,,,,,,,,,,,,"x1040580206845734914","RParlamentare","it",,,,,,,,,,,,,,,,"x1468287198667677699","Decreto #antifrode e #superbonus: si lavora sulla #leggedibilancio per salvare i lavori avviati e non fare perdere credibilità ai bonus. Ne abbiamo con il sen. Daniele Manca @mancaimola di @SenatoriPD
 e Domenico #Massimino di @confartigianato.👇

🔴 https://t.co/WjFBgXyw8Q",2021-12-07 18:32:02,"Twitter Web App",0,1,"x1040580206845734914","RParlamentare","Radio Parlamentare",166,491,610,"Roma, Lazio","Radio Parlamentare - La web radio delle Istituzioni",FALSE,,,,,,,"NA NA","NA NA","NA NA NA NA NA NA NA NA","https://twitter.com/mancaimola/status/1468539186177363971","Daniele Manca","Italia","Senatore gruppo Partito Democratico, Sindaco di Dozza dal 1994 al 2004, Capogruppo in Regione Emilia Romagna nel 2005, Sindaco di Imola dal 2008 al 2018.","https://t.co/9tWrFgO0QG",FALSE,1409,2197,0,519,706,2012-10-22 10:36:57,TRUE,"https://t.co/9tWrFgO0QG","http://danielemanca.it",,"https://pbs.twimg.com/profile_banners/897264492/1538667455","http://abs.twimg.com/images/themes/theme1/bg.png","http://pbs.twimg.com/profile_images/957260155753762816/snY3JfRn_normal.jpg"
"x526777254","x1468501913079529474",2021-12-08 08:45:14,"mantolalla","DATI APERTI E LORO UTILIZZO NELLA PA: ACCOLTE LE CONDIZIONI DELLA COMMISSIONE AFFARI COSTITUZIONALI NEL TESTO CHE RECEPISCE LA DIRETTIVA UE https://t.co/dRqZxfrZG6 #OpenData #pubblicaamministrazione #unioneeuropea https://t.co/FK5LeAXTzM","Twitter Web App",213,,,,FALSE,FALSE,0,0,,,"OpenData pubblicaamministrazione unioneeuropea",,"facebook.com/lallamantovani…","https://t.co/dRqZxfrZG6","https://www.facebook.com/lallamantovaniM5S/posts/955942638339530","http://pbs.twimg.com/media/FGEqj9TX0AEWY0Q.jpg","https://t.co/FK5LeAXTzM","https://twitter.com/mantolalla/status/1468501913079529474/photo/1","photo","http://pbs.twimg.com/media/FGEqj9TX0AEWY0Q.jpg","https://t.co/FK5LeAXTzM","https://twitter.com/mantolalla/status/1468501913079529474/photo/1",,,,"it",,,,,,,,,,,,,,,,,,,,,,,,,,,,,,,,,,,,,"NA NA","NA NA","NA NA NA NA NA NA NA NA","https://twitter.com/mantolalla/status/1468501913079529474","Maria Laura Mantovani","Carpi, Emilia Romagna","Cittadina eletta al Senato per il MoVimento 5 Stelle","https://t.co/NSQtXQs1hL",FALSE,596,353,11,2605,420,2012-03-16 20:44:02,FALSE,"https://t.co/NSQtXQs1hL","https://marialauramantovani.it",,"https://pbs.twimg.com/profile_banners/526777254/1528469923","http://abs.twimg.com/images/themes/theme1/bg.png","http://pbs.twimg.com/profile_images/1190749518721167361/8e8KnoXg_normal.jpg"
"x526777254","x1468302799817617417",2021-12-07 19:34:01,"mantolalla","TERZO SETTORE, IMPEGNO DEL M5S PER STRALCIARE IL REGIME IVA DALLA LEGGE DI BILANCIO  https://t.co/oSIlhnJbCq #terzosettore #iva #Forum #associazioni #regimeiva @forumterzosett @FORUMTERZO https://t.co/idEJRN2GwV","Twitter Web App",187,,,,FALSE,FALSE,1,0,,,"terzosettore iva Forum associazioni regimeiva",,"facebook.com/lallamantovani…","https://t.co/oSIlhnJbCq","https://www.facebook.com/lallamantovaniM5S/posts/955666778367116","http://pbs.twimg.com/media/FGB1dsHXMAkWmyC.jpg","https://t.co/idEJRN2GwV","https://twitter.com/mantolalla/status/1468302799817617417/photo/1","photo","http://pbs.twimg.com/media/FGB1dsHXMAkWmyC.jpg","https://t.co/idEJRN2GwV","https://twitter.com/mantolalla/status/1468302799817617417/photo/1",,"x3373963714 x2149422229","forumterzosett FORUMTERZO","it",,,,,,,,,,,,,,,,,,,,,,,,,,,,,,,,,,,,,"NA NA","NA NA","NA NA NA NA NA NA NA NA","https://twitter.com/mantolalla/status/1468302799817617417","Maria Laura Mantovani","Carpi, Emilia Romagna","Cittadina eletta al Senato per il MoVimento 5 Stelle","https://t.co/NSQtXQs1hL",FALSE,596,353,11,2605,420,2012-03-16 20:44:02,FALSE,"https://t.co/NSQtXQs1hL","https://marialauramantovani.it",,"https://pbs.twimg.com/profile_banners/526777254/1528469923","http://abs.twimg.com/images/themes/theme1/bg.png","http://pbs.twimg.com/profile_images/1190749518721167361/8e8KnoXg_normal.jpg"
"x526777254","x1468252799049867277",2021-12-07 16:15:20,"mantolalla","Lunedì 13 dicembre alle 17 in streaming su https://t.co/iT46Rvo6KG  ""Esempi di pratiche virtuose e cultura del riuso dei dati aperti. Dati sui contratti pubblici; dati sul clima; dati per mappare la diversità"".
Con lme ci sarà Andrea Borruso presidente Associazione @ondatait https://t.co/LtWxjZbzFH","Twitter Web App",275,,,,FALSE,FALSE,1,1,,,,,"facebook.com/lallamantovani…","https://t.co/iT46Rvo6KG","https://www.facebook.com/lallamantovaniM5S","http://pbs.twimg.com/media/FGBH1ZpXwAIs4G6.jpg","https://t.co/LtWxjZbzFH","https://twitter.com/mantolalla/status/1468252799049867277/photo/1","photo","http://pbs.twimg.com/media/FGBH1ZpXwAIs4G6.jpg","https://t.co/LtWxjZbzFH","https://twitter.com/mantolalla/status/1468252799049867277/photo/1",,"x801360345759707136","ondatait","it",,,,,,,,,,,,,,,,,,,,,,,,,,,,,,,,,,,,,"NA NA","NA NA","NA NA NA NA NA NA NA NA","https://twitter.com/mantolalla/status/1468252799049867277","Maria Laura Mantovani","Carpi, Emilia Romagna","Cittadina eletta al Senato per il MoVimento 5 Stelle","https://t.co/NSQtXQs1hL",FALSE,596,353,11,2605,420,2012-03-16 20:44:02,FALSE,"https://t.co/NSQtXQs1hL","https://marialauramantovani.it",,"https://pbs.twimg.com/profile_banners/526777254/1528469923","http://abs.twimg.com/images/themes/theme1/bg.png","http://pbs.twimg.com/profile_images/1190749518721167361/8e8KnoXg_normal.jpg"
"x526777254","x1468241539478532106",2021-12-07 15:30:36,"mantolalla","Disposta scarcerazione di Patrick #Zaki, condivido le parole del nostro presidente Giuseppe #Conte che ha sottolineato come questo sia un primo passo che ci auguriamo porti alla sua completa assoluzione. 
Esprimo la mia vicinanza ai familiari #Zaki #PatrickZaki https://t.co/dMqjml4eco","Twitter Web App",261,,,,FALSE,FALSE,2,0,,,"Zaki Conte Zaki PatrickZaki",,,,,"http://pbs.twimg.com/media/FGA9vF9WQAYOwFS.jpg","https://t.co/dMqjml4eco","https://twitter.com/mantolalla/status/1468241539478532106/photo/1","photo","http://pbs.twimg.com/media/FGA9vF9WQAYOwFS.jpg","https://t.co/dMqjml4eco","https://twitter.com/mantolalla/status/1468241539478532106/photo/1",,,,"it",,,,,,,,,,,,,,,,,,,,,,,,,,,,,,,,,,,,,"NA NA","NA NA","NA NA NA NA NA NA NA NA","https://twitter.com/mantolalla/status/1468241539478532106","Maria Laura Mantovani","Carpi, Emilia Romagna","Cittadina eletta al Senato per il MoVimento 5 Stelle","https://t.co/NSQtXQs1hL",FALSE,596,353,11,2605,420,2012-03-16 20:44:02,FALSE,"https://t.co/NSQtXQs1hL","https://marialauramantovani.it",,"https://pbs.twimg.com/profile_banners/526777254/1528469923","http://abs.twimg.com/images/themes/theme1/bg.png","http://pbs.twimg.com/profile_images/1190749518721167361/8e8KnoXg_normal.jpg"
"x501874833","x1468543513671389186",2021-12-08 11:30:32,"s_margiotta","🙏 Sei anni fa ci lasciava Antonio Luongo, già parlamentare, storico dirigente politico lucano e segretario regionale del @PdBasilicata
La politica lucana non è stata più la stessa.
Sta a noi il lavoro, con l'impegno, con lo studio continuare sulla tua strada... https://t.co/o8I5IbKIfz","Twitter for iPad",140,,,,FALSE,TRUE,0,2,,,,,,,,,,,,,,,,"x1375555109120262145","pdprovmt","it",,,,,,,,,,,,,,,,"x1468540817937682438","🙏 Sei anni fa ci lasciava Antonio Luongo, già parlamentare, storico dirigente politico lucano e segretario regionale del @PdBasilicata
La politica lucana non è stata più la stessa.
Sta a noi il lavoro, con l'impegno, con lo studio continuare sulla tua strada... https://t.co/o8I5IbKIfz",2021-12-08 11:19:49,"Twitter for Android",4,2,"x1375555109120262145","pdprovmt","Partito Democratico Provincia di Matera",87,132,53,"Matera, Basilicata","Pagina Twitter ufficiale del Partito Democratico della Provincia di Matera",FALSE,,,,,,,"NA NA","NA NA","NA NA NA NA NA NA NA NA","https://twitter.com/s_margiotta/status/1468543513671389186","Salvatore Margiotta","Roma, Potenza","Senatore, ingegnere, professore universitario. Capogruppo Commissione lavori pubblici e trasporti. Segretario Presidenza Senato","https://t.co/aeYZnOeRaN",FALSE,15746,7320,207,80114,60575,2012-02-24 15:30:04,TRUE,"https://t.co/aeYZnOeRaN","http://instangram.com/salvatore__margiotta",,"https://pbs.twimg.com/profile_banners/501874833/1483357085","http://abs.twimg.com/images/themes/theme1/bg.png","http://pbs.twimg.com/profile_images/1344056897155063808/zdD0fQgS_normal.jpg"
"x501874833","x1468543477931778059",2021-12-08 11:30:24,"s_margiotta","Leggo di competizioni per primato tra liste esplicitamente correntizie di “area Letta” lucana. Giochino poco appassionante: chi ha voglia di farlo non trascuri però che area omogenea riformista è di gran lunga prima, e doppia quasi singole correnti di “area Letta” @BRiformista","Twitter for iPad",277,,,,FALSE,FALSE,2,1,,,,,,,,,,,,,,,,"x1126813694292385792","BRiformista","it",,,,,,,,,,,,,,,,,,,,,,,,,,,,,,,,,,,,,"NA NA","NA NA","NA NA NA NA NA NA NA NA","https://twitter.com/s_margiotta/status/1468543477931778059","Salvatore Margiotta","Roma, Potenza","Senatore, ingegnere, professore universitario. Capogruppo Commissione lavori pubblici e trasporti. Segretario Presidenza Senato","https://t.co/aeYZnOeRaN",FALSE,15746,7320,207,80114,60575,2012-02-24 15:30:04,TRUE,"https://t.co/aeYZnOeRaN","http://instangram.com/salvatore__margiotta",,"https://pbs.twimg.com/profile_banners/501874833/1483357085","http://abs.twimg.com/images/themes/theme1/bg.png","http://pbs.twimg.com/profile_images/1344056897155063808/zdD0fQgS_normal.jpg"
"x501874833","x1468537082910027782",2021-12-08 11:04:59,"s_margiotta","36 milioni di eventi #malware in #italia su @panorama_it Ieri 1 miliardo e 4 milioni di euro spesi per contrastarli @anitecassinform La nostra sicurezza non vale neanche 40€ ? 

#CyberSecurity https://t.co/AZkioGQf5D","Twitter for iPad",140,,,,FALSE,TRUE,0,2,,,"malware italia",,,,,,,,,,,,,"x315895880 x48660040","AIannamorelli panorama_it","it",,,,,,,,,,,,,,,,"x1468511933448044547","36 milioni di eventi #malware in #italia su @panorama_it Ieri 1 miliardo e 4 milioni di euro spesi per contrastarli @anitecassinform La nostra sicurezza non vale neanche 40€ ? 

#CyberSecurity https://t.co/AZkioGQf5D",2021-12-08 09:25:03,"Twitter for iPhone",1,2,"x315895880","AIannamorelli","Antonio Iannamorelli",2674,1706,14520,"","Interista. Appassionato di storia. Government Affairs Director di Telsy. @Comunica_media @ @unitorvergata. 📖🖋▶️ #CaporettoManagement @lalezionedidiaz",FALSE,,,,,,,"NA NA","NA NA","NA NA NA NA NA NA NA NA","https://twitter.com/s_margiotta/status/1468537082910027782","Salvatore Margiotta","Roma, Potenza","Senatore, ingegnere, professore universitario. Capogruppo Commissione lavori pubblici e trasporti. Segretario Presidenza Senato","https://t.co/aeYZnOeRaN",FALSE,15746,7320,207,80114,60575,2012-02-24 15:30:04,TRUE,"https://t.co/aeYZnOeRaN","http://instangram.com/salvatore__margiotta",,"https://pbs.twimg.com/profile_banners/501874833/1483357085","http://abs.twimg.com/images/themes/theme1/bg.png","http://pbs.twimg.com/profile_images/1344056897155063808/zdD0fQgS_normal.jpg"
"x501874833","x1468500142055698438",2021-12-08 08:38:11,"s_margiotta","E anche il #supergreenpass è andato. Tutti lo esibiscono, sciamano nei bus e per le strade, liberi e sereni (almeno così mi pare). I profeti di sciagure si preparino a lanciare il prossimo anatema. I media (schifo) pomperanno l'allarme, il giorno dopo faranno finta di niente.","Twitter for iPad",140,,,,FALSE,TRUE,0,32,,,"supergreenpass",,,,,,,,,,,,,"x14227296","claudiovelardi","it",,,,,,,,,,,,,,,,"x1468499780804481027","E anche il #supergreenpass è andato. Tutti lo esibiscono, sciamano nei bus e per le strade, liberi e sereni (almeno così mi pare). I profeti di sciagure si preparino a lanciare il prossimo anatema. I media (schifo) pomperanno l'allarme, il giorno dopo faranno finta di niente.",2021-12-08 08:36:45,"Twitter Web App",199,32,"x14227296","claudiovelardi","claudiovelardi",27151,1538,11868,"","https://t.co/QPiCYWP3JO",FALSE,,,,,,,"NA NA","NA NA","NA NA NA NA NA NA NA NA","https://twitter.com/s_margiotta/status/1468500142055698438","Salvatore Margiotta","Roma, Potenza","Senatore, ingegnere, professore universitario. Capogruppo Commissione lavori pubblici e trasporti. Segretario Presidenza Senato","https://t.co/aeYZnOeRaN",FALSE,15746,7320,207,80114,60575,2012-02-24 15:30:04,TRUE,"https://t.co/aeYZnOeRaN","http://instangram.com/salvatore__margiotta",,"https://pbs.twimg.com/profile_banners/501874833/1483357085","http://abs.twimg.com/images/themes/theme1/bg.png","http://pbs.twimg.com/profile_images/1344056897155063808/zdD0fQgS_normal.jpg"
"x501874833","x1468495271105601542",2021-12-08 08:18:50,"s_margiotta","Il campo largo mi pare molto stretto @SenatoriPD, e tende a restringersi ancora","Twitter for iPad",79,,,,FALSE,FALSE,20,1,,,,,,,,,,,,,,,,"x404048864","SenatoriPD","it",,,,,,,,,,,,,,,,,,,,,,,,,,,,,,,,,,,,,"NA NA","NA NA","NA NA NA NA NA NA NA NA","https://twitter.com/s_margiotta/status/1468495271105601542","Salvatore Margiotta","Roma, Potenza","Senatore, ingegnere, professore universitario. Capogruppo Commissione lavori pubblici e trasporti. Segretario Presidenza Senato","https://t.co/aeYZnOeRaN",FALSE,15746,7320,207,80114,60575,2012-02-24 15:30:04,TRUE,"https://t.co/aeYZnOeRaN","http://instangram.com/salvatore__margiotta",,"https://pbs.twimg.com/profile_banners/501874833/1483357085","http://abs.twimg.com/images/themes/theme1/bg.png","http://pbs.twimg.com/profile_images/1344056897155063808/zdD0fQgS_normal.jpg"
"x501874833","x1468493413662269441",2021-12-08 08:11:27,"s_margiotta","Il miglior tributo alla memoria è quello di promettere che ritorni la Politica. Finora se ne è vista davvero poca.
In ricordo di una grande stagione. https://t.co/GVBpUfLse3","Twitter for iPad",140,,,,FALSE,TRUE,0,1,,,,,,,,,,,,,,,,"x919778352","viviancervell","it",,,,,,,,,,,,,,,,"x1468488909852139520","Il miglior tributo alla memoria è quello di promettere che ritorni la Politica. Finora se ne è vista davvero poca.
In ricordo di una grande stagione. https://t.co/GVBpUfLse3",2021-12-08 07:53:33,"Twitter for Android",11,1,"x919778352","viviancervell","Viviana Cervellino",1299,1706,9235,"Genzano di Lucania","Sindaco del Comune di Genzano di Lucania.",FALSE,,,,,,,"NA NA","NA NA","NA NA NA NA NA NA NA NA","https://twitter.com/s_margiotta/status/1468493413662269441","Salvatore Margiotta","Roma, Potenza","Senatore, ingegnere, professore universitario. Capogruppo Commissione lavori pubblici e trasporti. Segretario Presidenza Senato","https://t.co/aeYZnOeRaN",FALSE,15746,7320,207,80114,60575,2012-02-24 15:30:04,TRUE,"https://t.co/aeYZnOeRaN","http://instangram.com/salvatore__margiotta",,"https://pbs.twimg.com/profile_banners/501874833/1483357085","http://abs.twimg.com/images/themes/theme1/bg.png","http://pbs.twimg.com/profile_images/1344056897155063808/zdD0fQgS_normal.jpg"
