"user_id","status_id","created_at","screen_name","text","source","display_text_width","reply_to_status_id","reply_to_user_id","reply_to_screen_name","is_quote","is_retweet","favorite_count","retweet_count","quote_count","reply_count","hashtags","symbols","urls_url","urls_t.co","urls_expanded_url","media_url","media_t.co","media_expanded_url","media_type","ext_media_url","ext_media_t.co","ext_media_expanded_url","ext_media_type","mentions_user_id","mentions_screen_name","lang","quoted_status_id","quoted_text","quoted_created_at","quoted_source","quoted_favorite_count","quoted_retweet_count","quoted_user_id","quoted_screen_name","quoted_name","quoted_followers_count","quoted_friends_count","quoted_statuses_count","quoted_location","quoted_description","quoted_verified","retweet_status_id","retweet_text","retweet_created_at","retweet_source","retweet_favorite_count","retweet_retweet_count","retweet_user_id","retweet_screen_name","retweet_name","retweet_followers_count","retweet_friends_count","retweet_statuses_count","retweet_location","retweet_description","retweet_verified","place_url","place_name","place_full_name","place_type","country","country_code","geo_coords","coords_coords","bbox_coords","status_url","name","location","description","url","protected","followers_count","friends_count","listed_count","statuses_count","favourites_count","account_created_at","verified","profile_url","profile_expanded_url","account_lang","profile_banner_url","profile_background_url","profile_image_url"
"x270839361","x1466095321809838085",2021-12-01 17:22:18,"matteosalvinimi","Buon lavoro e in bocca al lupo a tutti i militanti che parteciperanno ai più di cento congressi cittadini della Lega, in attesa di quelli che saranno celebrati fra gennaio e febbraio.","Twitter for iPhone",183,,,,FALSE,FALSE,87,11,,,,,,,,,,,,,,,,,,"it",,,,,,,,,,,,,,,,,,,,,,,,,,,,,,,,,,,,,"NA NA","NA NA","NA NA NA NA NA NA NA NA","https://twitter.com/matteosalvinimi/status/1466095321809838085","Matteo Salvini","","Leader della Lega #primagliitaliani 🇮🇹","https://t.co/sj3rr6DU3N",FALSE,1428832,2029,3054,52210,3850,2011-03-23 10:32:56,TRUE,"https://t.co/sj3rr6DU3N","https://legaonline.it/",,"https://pbs.twimg.com/profile_banners/270839361/1635585626","http://abs.twimg.com/images/themes/theme1/bg.png","http://pbs.twimg.com/profile_images/966325945060732928/0Ua5xPMX_normal.jpg"
"x270839361","x1466048619132432385",2021-12-01 14:16:43,"matteosalvinimi","In diretta, da Roma, dall’assemblea ALIS e stati generali del trasporto e della logistica. https://t.co/zIz9A8R1kk","Twitter Media Studio",114,,,,FALSE,FALSE,97,19,,,,,"twitter.com/i/broadcasts/1…","https://t.co/zIz9A8R1kk","https://twitter.com/i/broadcasts/1OyJADzXmdWGb",,,,,,,,,,,"it",,,,,,,,,,,,,,,,,,,,,,,,,,,,,,,,,,,,,"NA NA","NA NA","NA NA NA NA NA NA NA NA","https://twitter.com/matteosalvinimi/status/1466048619132432385","Matteo Salvini","","Leader della Lega #primagliitaliani 🇮🇹","https://t.co/sj3rr6DU3N",FALSE,1428832,2029,3054,52210,3850,2011-03-23 10:32:56,TRUE,"https://t.co/sj3rr6DU3N","https://legaonline.it/",,"https://pbs.twimg.com/profile_banners/270839361/1635585626","http://abs.twimg.com/images/themes/theme1/bg.png","http://pbs.twimg.com/profile_images/966325945060732928/0Ua5xPMX_normal.jpg"
"x270839361","x1466023434874408964",2021-12-01 12:36:38,"matteosalvinimi","Approvato, finalmente e definitivamente, in Commissione il mio emendamento per aiutare genitori separati messi in crisi da situazione Covid: un aiuto fino a 800€ al mese per pagare assegno mantenimento a figli o ex coniugi, in caso di difficoltà economiche. Dalle parole ai fatti","Twitter for iPhone",279,,,,FALSE,FALSE,387,60,,,,,,,,,,,,,,,,,,"it",,,,,,,,,,,,,,,,,,,,,,,,,,,,,,,,,,,,,"NA NA","NA NA","NA NA NA NA NA NA NA NA","https://twitter.com/matteosalvinimi/status/1466023434874408964","Matteo Salvini","","Leader della Lega #primagliitaliani 🇮🇹","https://t.co/sj3rr6DU3N",FALSE,1428832,2029,3054,52210,3850,2011-03-23 10:32:56,TRUE,"https://t.co/sj3rr6DU3N","https://legaonline.it/",,"https://pbs.twimg.com/profile_banners/270839361/1635585626","http://abs.twimg.com/images/themes/theme1/bg.png","http://pbs.twimg.com/profile_images/966325945060732928/0Ua5xPMX_normal.jpg"
"x270839361","x1466022921214865413",2021-12-01 12:34:36,"matteosalvinimi","Approvato l’emendamento della Lega che salva i trasporti eccezionali: sono stati cancellati i paletti che avrebbero messo in ginocchio il settore. Orgogliosi di essere intervenuti nell’interesse di migliaia di famiglie e imprese. Dalle parole ai fatti.","Twitter for iPhone",252,,,,FALSE,FALSE,222,34,,,,,,,,,,,,,,,,,,"it",,,,,,,,,,,,,,,,,,,,,,,,,,,,,,,,,,,,,"NA NA","NA NA","NA NA NA NA NA NA NA NA","https://twitter.com/matteosalvinimi/status/1466022921214865413","Matteo Salvini","","Leader della Lega #primagliitaliani 🇮🇹","https://t.co/sj3rr6DU3N",FALSE,1428832,2029,3054,52210,3850,2011-03-23 10:32:56,TRUE,"https://t.co/sj3rr6DU3N","https://legaonline.it/",,"https://pbs.twimg.com/profile_banners/270839361/1635585626","http://abs.twimg.com/images/themes/theme1/bg.png","http://pbs.twimg.com/profile_images/966325945060732928/0Ua5xPMX_normal.jpg"
"x270839361","x1465998203057315843",2021-12-01 10:56:23,"matteosalvinimi","…riduzione delle bollette di luce e gas.
P.s. Incontro sempre più imprenditori, albergatori, ristoratori o agricoltori che mi dicono: “Salvini metti un limite a questa spesa, altrimenti noi non troviamo più manodopera"".","Twitter for iPhone",219,"x1465998199601180680","x270839361","matteosalvinimi",FALSE,FALSE,169,17,,,,,,,,,,,,,,,,,,"it",,,,,,,,,,,,,,,,,,,,,,,,,,,,,,,,,,,,,"NA NA","NA NA","NA NA NA NA NA NA NA NA","https://twitter.com/matteosalvinimi/status/1465998203057315843","Matteo Salvini","","Leader della Lega #primagliitaliani 🇮🇹","https://t.co/sj3rr6DU3N",FALSE,1428832,2029,3054,52210,3850,2011-03-23 10:32:56,TRUE,"https://t.co/sj3rr6DU3N","https://legaonline.it/",,"https://pbs.twimg.com/profile_banners/270839361/1635585626","http://abs.twimg.com/images/themes/theme1/bg.png","http://pbs.twimg.com/profile_images/966325945060732928/0Ua5xPMX_normal.jpg"
"x270839361","x1465998199601180680",2021-12-01 10:56:22,"matteosalvinimi","Furbetti del Reddito di cittadinanza: altri 110 stranieri denunciati (sequestrati 870 mila euro).
Sempre più convinto che dei 9 miliardi stanziati per il Reddito, una buona parte possa essere dedicata all’aumento delle pensioni di invalidità e alla… https://t.co/EHCK7kkZnV","Twitter for iPhone",249,,,,FALSE,FALSE,351,65,,,,,,,,"http://pbs.twimg.com/media/FFhFlrEWUAMswPt.jpg","https://t.co/EHCK7kkZnV","https://twitter.com/matteosalvinimi/status/1465998199601180680/photo/1","photo","http://pbs.twimg.com/media/FFhFlrEWUAMswPt.jpg","https://t.co/EHCK7kkZnV","https://twitter.com/matteosalvinimi/status/1465998199601180680/photo/1",,,,"it",,,,,,,,,,,,,,,,,,,,,,,,,,,,,,,,,,,,,"NA NA","NA NA","NA NA NA NA NA NA NA NA","https://twitter.com/matteosalvinimi/status/1465998199601180680","Matteo Salvini","","Leader della Lega #primagliitaliani 🇮🇹","https://t.co/sj3rr6DU3N",FALSE,1428832,2029,3054,52210,3850,2011-03-23 10:32:56,TRUE,"https://t.co/sj3rr6DU3N","https://legaonline.it/",,"https://pbs.twimg.com/profile_banners/270839361/1635585626","http://abs.twimg.com/images/themes/theme1/bg.png","http://pbs.twimg.com/profile_images/966325945060732928/0Ua5xPMX_normal.jpg"
"x270839361","x1465771905789706243",2021-11-30 19:57:09,"matteosalvinimi","Rapì e fece morire di sete (sotto al sole cocente dell’Iraq!) una bambina della minoranza yazida perché “aveva bagnato il materasso”: mostro jihadista condannato all’ergastolo. Bene. Rimane vergognosa la condanna alla moglie tedesca, complice, a soli 10 anni. https://t.co/xxowjaj9aI","Twitter Web App",259,,,,FALSE,FALSE,480,74,,,,,,,,"http://pbs.twimg.com/media/FFd3qXwXoAMeMM7.jpg","https://t.co/xxowjaj9aI","https://twitter.com/matteosalvinimi/status/1465771905789706243/photo/1","photo","http://pbs.twimg.com/media/FFd3qXwXoAMeMM7.jpg","https://t.co/xxowjaj9aI","https://twitter.com/matteosalvinimi/status/1465771905789706243/photo/1",,,,"it",,,,,,,,,,,,,,,,,,,,,,,,,,,,,,,,,,,,,"NA NA","NA NA","NA NA NA NA NA NA NA NA","https://twitter.com/matteosalvinimi/status/1465771905789706243","Matteo Salvini","","Leader della Lega #primagliitaliani 🇮🇹","https://t.co/sj3rr6DU3N",FALSE,1428832,2029,3054,52210,3850,2011-03-23 10:32:56,TRUE,"https://t.co/sj3rr6DU3N","https://legaonline.it/",,"https://pbs.twimg.com/profile_banners/270839361/1635585626","http://abs.twimg.com/images/themes/theme1/bg.png","http://pbs.twimg.com/profile_images/966325945060732928/0Ua5xPMX_normal.jpg"
"x1075084718","x1466062907255533576",2021-12-01 15:13:29,"arrigoni_paolo","#TAP: sbagliata esclusione del raddoppio dai progetti di interesse comuni europei. L’Italia non può aspettare i tentennamenti dell’#Europa dopo l'ubriacatura del ""solo rinnovabili"". A Bruxelles non si rendono conto che la crisi del caro energia non è transitoria ma strutturale!","Twitter for Android",278,,,,FALSE,FALSE,1,1,,,"TAP Europa",,,,,,,,,,,,,,,"it",,,,,,,,,,,,,,,,,,,,,,,,,,,,,,,,,,,,,"NA NA","NA NA","NA NA NA NA NA NA NA NA","https://twitter.com/arrigoni_paolo/status/1466062907255533576","Paolo Arrigoni","Calolziocorte, Lombardia","Questore del Senato della Repubblica, componente della Commissione Ambiente e del Copasir. Responsabile del Dipartimento Energia della Lega.","https://t.co/M6TePkOvfO",FALSE,4667,181,56,9631,108,2013-01-09 22:36:27,TRUE,"https://t.co/M6TePkOvfO","http://www.senato.it/leg/18/BGT/Schede/Attsen/00029039.htm",,"https://pbs.twimg.com/profile_banners/1075084718/1591968708","http://abs.twimg.com/images/themes/theme1/bg.png","http://pbs.twimg.com/profile_images/3172370357/bec3e4497d64c77f2a93bc9792055992_normal.jpeg"
"x1075084718","x1466053589625933834",2021-12-01 14:36:28,"arrigoni_paolo","La #Lega con un suo emendamento ha salvato i trasporti eccezionali dalle storture introdotte da una misura a firma Pd. Un problema che avrebbe rallentato lo sviluppo del Paese e compromesso la realizzazione dei progetti nel #Pnrr.","Twitter for Android",230,,,,FALSE,FALSE,2,0,,,"Lega Pnrr",,,,,,,,,,,,,,,"it",,,,,,,,,,,,,,,,,,,,,,,,,,,,,,,,,,,,,"NA NA","NA NA","NA NA NA NA NA NA NA NA","https://twitter.com/arrigoni_paolo/status/1466053589625933834","Paolo Arrigoni","Calolziocorte, Lombardia","Questore del Senato della Repubblica, componente della Commissione Ambiente e del Copasir. Responsabile del Dipartimento Energia della Lega.","https://t.co/M6TePkOvfO",FALSE,4667,181,56,9631,108,2013-01-09 22:36:27,TRUE,"https://t.co/M6TePkOvfO","http://www.senato.it/leg/18/BGT/Schede/Attsen/00029039.htm",,"https://pbs.twimg.com/profile_banners/1075084718/1591968708","http://abs.twimg.com/images/themes/theme1/bg.png","http://pbs.twimg.com/profile_images/3172370357/bec3e4497d64c77f2a93bc9792055992_normal.jpeg"
"x1075084718","x1465805489095299072",2021-11-30 22:10:36,"arrigoni_paolo","Grazie emendamento Lega risolto stallo trasporti eccezionali che avrebbe rallentato lo sviluppo del paese, compromesso realizzazione progetti PNRR, vanificato gli investimenti delle societá di trasporto e determinato la circolazione tanti mezzi pesanti per trasporto merci","Twitter for Android",272,,,,FALSE,FALSE,9,0,,,,,,,,,,,,,,,,,,"it",,,,,,,,,,,,,,,,,,,,,,,,,,,,,,,,,,,,,"NA NA","NA NA","NA NA NA NA NA NA NA NA","https://twitter.com/arrigoni_paolo/status/1465805489095299072","Paolo Arrigoni","Calolziocorte, Lombardia","Questore del Senato della Repubblica, componente della Commissione Ambiente e del Copasir. Responsabile del Dipartimento Energia della Lega.","https://t.co/M6TePkOvfO",FALSE,4667,181,56,9631,108,2013-01-09 22:36:27,TRUE,"https://t.co/M6TePkOvfO","http://www.senato.it/leg/18/BGT/Schede/Attsen/00029039.htm",,"https://pbs.twimg.com/profile_banners/1075084718/1591968708","http://abs.twimg.com/images/themes/theme1/bg.png","http://pbs.twimg.com/profile_images/3172370357/bec3e4497d64c77f2a93bc9792055992_normal.jpeg"
"x2900717633","x1466042242611699714",2021-12-01 13:51:23,"BrunoAstorre","Il superbonus 110% ha aiutato il boom del settore edilizio. Non mettiamolo in discussione ma rilanciamolo rendendolo più accessibile con l’abolizione del tetto Isee, come auspico da tempo. Sviluppo, lavoro e riduzione dell’impatto degli edifici sull’ambiente. Questa è la strada","Twitter for iPhone",278,,,,FALSE,FALSE,8,1,,,,,,,,,,,,,,,,,,"it",,,,,,,,,,,,,,,,,,,,,,,,,,,,,,,,,,,,,"NA NA","NA NA","NA NA NA NA NA NA NA NA","https://twitter.com/BrunoAstorre/status/1466042242611699714","Bruno Astorre","","Senatore del PD. Membro Direzione nazionale PD. Provengo da una scuola che interpreta la politica come strumento, non come fine.","https://t.co/r8sKGpcczb",FALSE,1662,194,30,1958,144,2014-12-01 15:48:11,TRUE,"https://t.co/r8sKGpcczb","http://www.brunoastorre.it",,"https://pbs.twimg.com/profile_banners/2900717633/1546257168","http://abs.twimg.com/images/themes/theme1/bg.png","http://pbs.twimg.com/profile_images/1058727872578371589/FY_KiON0_normal.jpg"
"x101602652","x1466036169699901444",2021-12-01 13:27:15,"augussori","🔵 Erika Stefani (Ministro per le disabilità): 
Oggi abbiamo presentato la #DisabilityCard, la tessera che permetterà un più facile accesso alle persone con disabilità ai servizi, in regime di reciprocità con gli altri Paesi della Ue, https://t.co/66X7MjaxUs","Twitter for iPhone",233,,,,FALSE,FALSE,2,0,,,"DisabilityCard",,,,,"http://pbs.twimg.com/media/FFhoH2WXoAMwiPt.jpg","https://t.co/66X7MjaxUs","https://twitter.com/augussori/status/1466036169699901444/photo/1","photo","http://pbs.twimg.com/media/FFhoH2WXoAMwiPt.jpg","https://t.co/66X7MjaxUs","https://twitter.com/augussori/status/1466036169699901444/photo/1",,,,"it",,,,,,,,,,,,,,,,,,,,,,,,,,,,,,,,,,,,,"NA NA","NA NA","NA NA NA NA NA NA NA NA","https://twitter.com/augussori/status/1466036169699901444","Luigi Augussori","Lodi, Lombardy","Profilo del sen. Luigi Augussori, rappresentante lodigiano nel Senato della Repubblica per il gruppo Lega - Salvini Premier. https://t.co/RVDZN85Ue5","https://t.co/494Lk5LQeR",FALSE,968,784,16,3256,328,2010-01-03 23:39:00,TRUE,"https://t.co/494Lk5LQeR","http://www.senato.it/leg/18/BGT/Schede/Attsen/00019244.htm",,"https://pbs.twimg.com/profile_banners/101602652/1536334347","http://abs.twimg.com/images/themes/theme1/bg.png","http://pbs.twimg.com/profile_images/1397968025198989317/FpsdhGWL_normal.jpg"
"x101602652","x1465955350968999939",2021-12-01 08:06:06,"augussori","AIDS, male del nostro tempo mediaticamente passato però in secondo piano, da combattere con ricerca e studio che devono continuare a progredire, nella consapevolezza però che come oggi e in futuro le migliori cure resteranno attenzione e prevenzione.
#GiornataMondialeControAIDS https://t.co/a3uSB7GNa1","Twitter for iPhone",278,,,,FALSE,FALSE,2,0,,,"GiornataMondialeControAIDS",,,,,"http://pbs.twimg.com/media/FFgenAbXMAYjqZj.jpg","https://t.co/a3uSB7GNa1","https://twitter.com/augussori/status/1465955350968999939/photo/1","photo","http://pbs.twimg.com/media/FFgenAbXMAYjqZj.jpg","https://t.co/a3uSB7GNa1","https://twitter.com/augussori/status/1465955350968999939/photo/1",,,,"it",,,,,,,,,,,,,,,,,,,,,,,,,,,,,,,,,,,,,"NA NA","NA NA","NA NA NA NA NA NA NA NA","https://twitter.com/augussori/status/1465955350968999939","Luigi Augussori","Lodi, Lombardy","Profilo del sen. Luigi Augussori, rappresentante lodigiano nel Senato della Repubblica per il gruppo Lega - Salvini Premier. https://t.co/RVDZN85Ue5","https://t.co/494Lk5LQeR",FALSE,968,784,16,3256,328,2010-01-03 23:39:00,TRUE,"https://t.co/494Lk5LQeR","http://www.senato.it/leg/18/BGT/Schede/Attsen/00019244.htm",,"https://pbs.twimg.com/profile_banners/101602652/1536334347","http://abs.twimg.com/images/themes/theme1/bg.png","http://pbs.twimg.com/profile_images/1397968025198989317/FpsdhGWL_normal.jpg"
"x876541483","x1466092081059962884",2021-12-01 17:09:25,"AlbertoBagnai","@Serendippo10 @AlbertoBagnai Gli estremisti come lei dovrebbero affidarsi di più alla letteratura scientifica e di meno agli insulti su internet o al complottismo delle percentuali ipotizzate...","Twitter for iPhone",140,,,,FALSE,TRUE,0,4,,,,,,,,,,,,,,,,"x69696487 x1204084610579259393 x876541483","redflat Serendippo10 AlbertoBagnai","it",,,,,,,,,,,,,,,,"x1466091642620944391","@Serendippo10 @AlbertoBagnai Gli estremisti come lei dovrebbero affidarsi di più alla letteratura scientifica e di meno agli insulti su internet o al complottismo delle percentuali ipotizzate...",2021-12-01 17:07:40,"Twitter Web App",19,4,"x69696487","redflat","Enrico Paolozzi",1238,388,22796,"","Questo account potrebbe essere stato clonato.",FALSE,,,,,,,"NA NA","NA NA","NA NA NA NA NA NA NA NA","https://twitter.com/AlbertoBagnai/status/1466092081059962884","Alberto Bagnai","","Professore associato di politica economica all’Università Gabriele d’Annunzio, eletto al Senato per la Lega nel collegio Abruzzo 01.","https://t.co/sC5RvUzmsX",FALSE,129040,666,656,220351,6463,2012-10-12 22:13:36,TRUE,"https://t.co/sC5RvUzmsX","http://www.senato.it/leg/18/BGT/Schede/Attsen/00032582.htm",,"https://pbs.twimg.com/profile_banners/876541483/1535647109","http://abs.twimg.com/images/themes/theme1/bg.png","http://pbs.twimg.com/profile_images/849030859462246401/ATk3_aiW_normal.jpg"
"x876541483","x1466074507626655745",2021-12-01 15:59:35,"AlbertoBagnai","I casi della vita…","Twitter for iPhone",18,,,,FALSE,FALSE,53,9,,,,,,,,,,,,,,,,,,"it",,,,,,,,,,,,,,,,,,,,,,,,,,,,,,,,,,,,,"NA NA","NA NA","NA NA NA NA NA NA NA NA","https://twitter.com/AlbertoBagnai/status/1466074507626655745","Alberto Bagnai","","Professore associato di politica economica all’Università Gabriele d’Annunzio, eletto al Senato per la Lega nel collegio Abruzzo 01.","https://t.co/sC5RvUzmsX",FALSE,129040,666,656,220351,6463,2012-10-12 22:13:36,TRUE,"https://t.co/sC5RvUzmsX","http://www.senato.it/leg/18/BGT/Schede/Attsen/00032582.htm",,"https://pbs.twimg.com/profile_banners/876541483/1535647109","http://abs.twimg.com/images/themes/theme1/bg.png","http://pbs.twimg.com/profile_images/849030859462246401/ATk3_aiW_normal.jpg"
"x876541483","x1466074453419438082",2021-12-01 15:59:22,"AlbertoBagnai","Terapie intensive sparite dal megafono. Ancora coi “casi”… https://t.co/ih8d6EaTt6","Twitter for iPhone",71,,,,FALSE,TRUE,0,27,,,,,,,,,,,,,,,,"x69696487","redflat","it",,,,,,,,,,,,,,,,"x1466071278629044230","Terapie intensive sparite dal megafono. Ancora coi “casi”… https://t.co/ih8d6EaTt6",2021-12-01 15:46:45,"Twitter for iPhone",82,27,"x69696487","redflat","Enrico Paolozzi",1238,388,22796,"","Questo account potrebbe essere stato clonato.",FALSE,,,,,,,"NA NA","NA NA","NA NA NA NA NA NA NA NA","https://twitter.com/AlbertoBagnai/status/1466074453419438082","Alberto Bagnai","","Professore associato di politica economica all’Università Gabriele d’Annunzio, eletto al Senato per la Lega nel collegio Abruzzo 01.","https://t.co/sC5RvUzmsX",FALSE,129040,666,656,220351,6463,2012-10-12 22:13:36,TRUE,"https://t.co/sC5RvUzmsX","http://www.senato.it/leg/18/BGT/Schede/Attsen/00032582.htm",,"https://pbs.twimg.com/profile_banners/876541483/1535647109","http://abs.twimg.com/images/themes/theme1/bg.png","http://pbs.twimg.com/profile_images/849030859462246401/ATk3_aiW_normal.jpg"
"x876541483","x1466074344392732684",2021-12-01 15:58:56,"AlbertoBagnai","@CriticaScient @Giovaguerrato @Agenzia_Ansa Nel ringraziare, sblocchiamo il ricordo. https://t.co/t5KDDyl6nS","Twitter for iPhone",124,,,,FALSE,TRUE,0,21,,,,,,,,"http://pbs.twimg.com/media/FFiAoU-WQAEuCDl.jpg","https://t.co/t5KDDyl6nS","https://twitter.com/RobertoLB1/status/1466063111304142861/photo/1","photo","http://pbs.twimg.com/media/FFiAoU-WQAEuCDl.jpg","https://t.co/t5KDDyl6nS","https://twitter.com/RobertoLB1/status/1466063111304142861/photo/1",,"x1227232100 x2264348977 x1232067242 x150725695","RobertoLB1 CriticaScient Giovaguerrato Agenzia_Ansa","it",,,,,,,,,,,,,,,,"x1466063111304142861","@CriticaScient @Giovaguerrato @Agenzia_Ansa Nel ringraziare, sblocchiamo il ricordo. https://t.co/t5KDDyl6nS",2021-12-01 15:14:18,"Twitter for Android",49,21,"x1227232100","RobertoLB1","Upim",148,157,12549,"Roma, Lazio","",FALSE,,,,,,,"NA NA","NA NA","NA NA NA NA NA NA NA NA","https://twitter.com/AlbertoBagnai/status/1466074344392732684","Alberto Bagnai","","Professore associato di politica economica all’Università Gabriele d’Annunzio, eletto al Senato per la Lega nel collegio Abruzzo 01.","https://t.co/sC5RvUzmsX",FALSE,129040,666,656,220351,6463,2012-10-12 22:13:36,TRUE,"https://t.co/sC5RvUzmsX","http://www.senato.it/leg/18/BGT/Schede/Attsen/00032582.htm",,"https://pbs.twimg.com/profile_banners/876541483/1535647109","http://abs.twimg.com/images/themes/theme1/bg.png","http://pbs.twimg.com/profile_images/849030859462246401/ATk3_aiW_normal.jpg"
"x876541483","x1466068258633785353",2021-12-01 15:34:45,"AlbertoBagnai","Spiace per il senatore Monti, ma ieri sera grandi ascolti e record stagionale per #fuoridalcoro. Grazie a tutti per l'appoggio e il sostegno. Molti  fanno domande a cui non so rispondere. Ciò che posso assicurare è che ogni volta che andremo in onda saremo sempre #Fuoridalcoro","Twitter for iPhone",140,,,,FALSE,TRUE,0,1579,,,"fuoridalcoro",,,,,,,,,,,,,"x407543535","mariogiordano5","it",,,,,,,,,,,,,,,,"x1465980390716456963","Spiace per il senatore Monti, ma ieri sera grandi ascolti e record stagionale per #fuoridalcoro. Grazie a tutti per l'appoggio e il sostegno. Molti  fanno domande a cui non so rispondere. Ciò che posso assicurare è che ogni volta che andremo in onda saremo sempre #Fuoridalcoro",2021-12-01 09:45:36,"Twitter Web App",7185,1579,"x407543535","mariogiordano5","Mario Giordano",200611,506,4794,"milano","Giornalista",FALSE,,,,,,,"NA NA","NA NA","NA NA NA NA NA NA NA NA","https://twitter.com/AlbertoBagnai/status/1466068258633785353","Alberto Bagnai","","Professore associato di politica economica all’Università Gabriele d’Annunzio, eletto al Senato per la Lega nel collegio Abruzzo 01.","https://t.co/sC5RvUzmsX",FALSE,129040,666,656,220351,6463,2012-10-12 22:13:36,TRUE,"https://t.co/sC5RvUzmsX","http://www.senato.it/leg/18/BGT/Schede/Attsen/00032582.htm",,"https://pbs.twimg.com/profile_banners/876541483/1535647109","http://abs.twimg.com/images/themes/theme1/bg.png","http://pbs.twimg.com/profile_images/849030859462246401/ATk3_aiW_normal.jpg"
"x876541483","x1466036376042934278",2021-12-01 13:28:04,"AlbertoBagnai","Pensate cosa sarebbe accaduto se al posto di Del Debbio e Giordano, qualcuno avesse deciso di stoppare Ranucci o Berlinguer o Floris….","Twitter for iPhone",140,,,,FALSE,TRUE,0,714,,,,,,,,,,,,,,,,"x413916151","GuidoCrosetto","it",,,,,,,,,,,,,,,,"x1465933467401793543","Pensate cosa sarebbe accaduto se al posto di Del Debbio e Giordano, qualcuno avesse deciso di stoppare Ranucci o Berlinguer o Floris….",2021-12-01 06:39:09,"Twitter for iPhone",3813,714,"x413916151","GuidoCrosetto","Guido Crosetto",166039,2218,100825,"","Libero da pregiudizi per convinzione, garantista per dna, conservatore per nascita, rispettoso per scelta. Ex tante cose. Ora uomo libero ed imprenditore.",FALSE,,,,,,,"NA NA","NA NA","NA NA NA NA NA NA NA NA","https://twitter.com/AlbertoBagnai/status/1466036376042934278","Alberto Bagnai","","Professore associato di politica economica all’Università Gabriele d’Annunzio, eletto al Senato per la Lega nel collegio Abruzzo 01.","https://t.co/sC5RvUzmsX",FALSE,129040,666,656,220351,6463,2012-10-12 22:13:36,TRUE,"https://t.co/sC5RvUzmsX","http://www.senato.it/leg/18/BGT/Schede/Attsen/00032582.htm",,"https://pbs.twimg.com/profile_banners/876541483/1535647109","http://abs.twimg.com/images/themes/theme1/bg.png","http://pbs.twimg.com/profile_images/849030859462246401/ATk3_aiW_normal.jpg"
"x876541483","x1466002779256852487",2021-12-01 11:14:34,"AlbertoBagnai","Alberto Bagnai #RiformaFiscale
https://t.co/oINeLFOlWH https://t.co/amrsAhPz5V","Twitter for iPhone",92,,,,FALSE,TRUE,0,48,,,"RiformaFiscale",,"rumble.com/vq1cl3-alberto…","https://t.co/oINeLFOlWH","https://rumble.com/vq1cl3-alberto-bagnai-riformafiscale.html","http://pbs.twimg.com/media/FFgDQYYWQAELWo1.png","https://t.co/amrsAhPz5V","https://twitter.com/iofausto/status/1465925334814105600/photo/1","photo","http://pbs.twimg.com/media/FFgDQYYWQAELWo1.png","https://t.co/amrsAhPz5V","https://twitter.com/iofausto/status/1465925334814105600/photo/1",,"x1372968120034426887","iofausto","it",,,,,,,,,,,,,,,,"x1465925334814105600","Alberto Bagnai #RiformaFiscale
https://t.co/oINeLFOlWH https://t.co/amrsAhPz5V",2021-12-01 06:06:50,"TweetDeck",109,48,"x1372968120034426887","iofausto","IoFausto-Inriverente",1478,157,5871,"","Donazioni Canali Video  YT  Telegram  Rumble https://t.co/tg422ML4qn…",FALSE,,,,,,,"NA NA","NA NA","NA NA NA NA NA NA NA NA","https://twitter.com/AlbertoBagnai/status/1466002779256852487","Alberto Bagnai","","Professore associato di politica economica all’Università Gabriele d’Annunzio, eletto al Senato per la Lega nel collegio Abruzzo 01.","https://t.co/sC5RvUzmsX",FALSE,129040,666,656,220351,6463,2012-10-12 22:13:36,TRUE,"https://t.co/sC5RvUzmsX","http://www.senato.it/leg/18/BGT/Schede/Attsen/00032582.htm",,"https://pbs.twimg.com/profile_banners/876541483/1535647109","http://abs.twimg.com/images/themes/theme1/bg.png","http://pbs.twimg.com/profile_images/849030859462246401/ATk3_aiW_normal.jpg"
