"x919526072","x1464943871163604995",2021-11-28 13:06:50,"LucioMalan","I gendarmi del comitato governativo di salute pubblica che ogni sera trova tribuna su La7 si sono accaniti contro il microbiologo. Finora sugli altari, è reo di considerare prematura la vaccinazione dei bambini.  https://t.co/INlRso82V7","Twitter for iPhone",140,,,,FALSE,TRUE,0,271,,,,,,,,,,,,,,,,"x526448857","BelpietroTweet","it",,,,,,,,,,,,,,,,"x1464836129706983426","I gendarmi del comitato governativo di salute pubblica che ogni sera trova tribuna su La7 si sono accaniti contro il microbiologo. Finora sugli altari, è reo di considerare prematura la vaccinazione dei bambini.  https://t.co/INlRso82V7",2021-11-28 05:58:43,"RunnerCommonKeys",861,271,"x526448857","BelpietroTweet","Maurizio Belpietro",248577,590,2229,"","Direttore @LaVeritaWeb e @Panorama_it",FALSE,,,,,,,"NA NA","NA NA","NA NA NA NA NA NA NA NA","https://twitter.com/LucioMalan/status/1464943871163604995","Lucio Malan","Italia","Senatore Fratelli d'Italia. Chi è disposto a perdere libertà fondamentale in cambio di temporanea sicurezza, non merita, e non avrà, né libertà né sicurezza.","https://t.co/KZCpB50DyP",FALSE,15586,3569,120,33866,9269,2012-11-01 17:48:51,FALSE,"https://t.co/KZCpB50DyP","http://www.luciomalan.it",,"https://pbs.twimg.com/profile_banners/919526072/1636186892","http://abs.twimg.com/images/themes/theme1/bg.png","http://pbs.twimg.com/profile_images/1456899523222069249/i60vvKs__normal.jpg"
"x919526072","x1464865172418404355",2021-11-28 07:54:07,"LucioMalan","Crisanti: “Dubbi sul vaccino ai bimbi”. E Severgnini impazzisce https://t.co/OdpuN5LLZS","Twitter for iPhone",87,,,,FALSE,FALSE,431,150,,,,,"nicolaporro.it/crisanti-dubbi…","https://t.co/OdpuN5LLZS","https://www.nicolaporro.it/crisanti-dubbi-sul-vaccino-ai-bimbi-e-severgnini-impazzisce/",,,,,,,,,,,"it",,,,,,,,,,,,,,,,,,,,,,,,,,,,,,,,,,,,,"NA NA","NA NA","NA NA NA NA NA NA NA NA","https://twitter.com/LucioMalan/status/1464865172418404355","Lucio Malan","Italia","Senatore Fratelli d'Italia. Chi è disposto a perdere libertà fondamentale in cambio di temporanea sicurezza, non merita, e non avrà, né libertà né sicurezza.","https://t.co/KZCpB50DyP",FALSE,15586,3569,120,33866,9269,2012-11-01 17:48:51,FALSE,"https://t.co/KZCpB50DyP","http://www.luciomalan.it",,"https://pbs.twimg.com/profile_banners/919526072/1636186892","http://abs.twimg.com/images/themes/theme1/bg.png","http://pbs.twimg.com/profile_images/1456899523222069249/i60vvKs__normal.jpg"
"x919526072","x1464864900430405637",2021-11-28 07:53:02,"LucioMalan","In Africa si stanno domandando che tipo di droga stiamo usando in Occidente.
👇👇👇 https://t.co/01oa3AH9Ht","Twitter for iPhone",120,,,,FALSE,TRUE,0,41,,,,,,,,"http://pbs.twimg.com/media/FFQ8LUlWUAYvJcq.jpg","https://t.co/01oa3AH9Ht","https://twitter.com/itsmeback_/status/1464861952728051712/photo/1","photo","http://pbs.twimg.com/media/FFQ8LUlWUAYvJcq.jpg http://pbs.twimg.com/media/FFQ8LgtWQAAxhmN.jpg","https://t.co/01oa3AH9Ht https://t.co/01oa3AH9Ht","https://twitter.com/itsmeback_/status/1464861952728051712/photo/1 https://twitter.com/itsmeback_/status/1464861952728051712/photo/1",,"x1434022273506324482","itsmeback_","it",,,,,,,,,,,,,,,,"x1464861952728051712","In Africa si stanno domandando che tipo di droga stiamo usando in Occidente.
👇👇👇 https://t.co/01oa3AH9Ht",2021-11-28 07:41:20,"Twitter for Android",80,41,"x1434022273506324482","itsmeback_","Sabrina F.",4516,4293,5961,"Sicilia, Italia","No DM no CHAT, non leggo.",FALSE,,,,,,,"NA NA","NA NA","NA NA NA NA NA NA NA NA","https://twitter.com/LucioMalan/status/1464864900430405637","Lucio Malan","Italia","Senatore Fratelli d'Italia. Chi è disposto a perdere libertà fondamentale in cambio di temporanea sicurezza, non merita, e non avrà, né libertà né sicurezza.","https://t.co/KZCpB50DyP",FALSE,15586,3569,120,33866,9269,2012-11-01 17:48:51,FALSE,"https://t.co/KZCpB50DyP","http://www.luciomalan.it",,"https://pbs.twimg.com/profile_banners/919526072/1636186892","http://abs.twimg.com/images/themes/theme1/bg.png","http://pbs.twimg.com/profile_images/1456899523222069249/i60vvKs__normal.jpg"
"x137642246","x1464831175533289479",2021-11-28 05:39:02,"MassimoMallegni","Expo 2021, Mallegni: Di Maio in vacanza con suo gruppettino? https://t.co/JQy0Nf9Rkm","Twitter Web App",84,,,,FALSE,FALSE,0,0,,,,,"forzaitaliatoscana.it/articolo/expo-…","https://t.co/JQy0Nf9Rkm","https://www.forzaitaliatoscana.it/articolo/expo-2021-di-maio-vacanza/",,,,,,,,,,,"it",,,,,,,,,,,,,,,,,,,,,,,,,,,,,,,,,,,,,"NA NA","NA NA","NA NA NA NA NA NA NA NA","https://twitter.com/MassimoMallegni/status/1464831175533289479","massimo mallegni","Marina di Pietrasanta","Senatore della Repubblica Italiana. Già Sindaco di Pietrasanta. Imprenditore in ambito Turistico e nell’Arte.","https://t.co/gVkMtGzUtq",FALSE,2076,782,30,6619,4561,2010-04-27 09:33:30,FALSE,"https://t.co/gVkMtGzUtq","http://www.massimomallegni.it",,"https://pbs.twimg.com/profile_banners/137642246/1600442673","http://abs.twimg.com/images/themes/theme1/bg.png","http://pbs.twimg.com/profile_images/959444327519981568/vtb7HIRL_normal.jpg"
"x428521248","x1464928435101442051",2021-11-28 12:05:30,"SimonaMalpezzi","Vergognoso l'episodio accaduto ieri alla giornalista #GretaBeccaglia a Empoli. Gravi le parole del conduttore, giustamente stigmatizzate da @odg_toscana. Quando parliamo di necessità di cambiare modello culturale è esattamente di questo che parliamo. Solidarietà alla giornalista. https://t.co/9bA3ODZtBj","Twitter for iPhone",140,,,,FALSE,TRUE,0,3,,,"GretaBeccaglia",,,,,,,,,,,,,"x2927013813","RossomandoPd","it",,,,,,,,,,,,,,,,"x1464925951121367042","Vergognoso l'episodio accaduto ieri alla giornalista #GretaBeccaglia a Empoli. Gravi le parole del conduttore, giustamente stigmatizzate da @odg_toscana. Quando parliamo di necessità di cambiare modello culturale è esattamente di questo che parliamo. Solidarietà alla giornalista. https://t.co/9bA3ODZtBj",2021-11-28 11:55:38,"Twitter for Android",14,3,"x2927013813","RossomandoPd","Anna Rossomando",1986,439,1147,"Torino","Senatrice Pd, Vicepresidente Senato
Responsabile ""Giustizia e Diritti"" nella Segreteria nazionale del PD",TRUE,,,,,,,"NA NA","NA NA","NA NA NA NA NA NA NA NA","https://twitter.com/SimonaMalpezzi/status/1464928435101442051","Simona Malpezzi","","Insegnante. Mamma di Flavia Heléne e Charlotte. Presidente dei @senatoripd",,FALSE,21412,1086,140,8707,3507,2011-12-04 21:29:30,TRUE,,,,"https://pbs.twimg.com/profile_banners/428521248/1441648645","http://abs.twimg.com/images/themes/theme1/bg.png","http://pbs.twimg.com/profile_images/989616052182102018/JlbLvUFo_normal.jpg"
"x526777254","x1464885219064958977",2021-11-28 09:13:47,"mantolalla","STABILIZZARE I 400 PRECARI DEL CNR CON LE RISORSE STANZIAE DAL GOVERNO CONTE II: mi associo all’appello del nostro presidente Giuseppe Conte. https://t.co/d3I2ERBDgW @GiuseppeConteIT @M5S_Senato @MariaDomenicaC4 #precari #Cnr #Governo https://t.co/5TiHT853Vz","Twitter Web App",234,,,,FALSE,FALSE,14,8,,,"precari Cnr Governo",,"facebook.com/lallamantovani…","https://t.co/d3I2ERBDgW","https://www.facebook.com/lallamantovaniM5S/posts/950044835595977","http://pbs.twimg.com/media/FFRRNl8XMAI-CSs.jpg","https://t.co/5TiHT853Vz","https://twitter.com/mantolalla/status/1464885219064958977/photo/1","photo","http://pbs.twimg.com/media/FFRRNl8XMAI-CSs.jpg","https://t.co/5TiHT853Vz","https://twitter.com/mantolalla/status/1464885219064958977/photo/1",,"x999578121123848192 x1343975432 x1128669323470495746","GiuseppeConteIT M5S_Senato MariaDomenicaC4","it",,,,,,,,,,,,,,,,,,,,,,,,,,,,,,,,,,,,,"NA NA","NA NA","NA NA NA NA NA NA NA NA","https://twitter.com/mantolalla/status/1464885219064958977","Maria Laura Mantovani","Carpi, Emilia Romagna","Cittadina eletta al Senato per il MoVimento 5 Stelle","https://t.co/NSQtXQs1hL",FALSE,592,353,11,2588,420,2012-03-16 20:44:02,FALSE,"https://t.co/NSQtXQs1hL","https://marialauramantovani.it",,"https://pbs.twimg.com/profile_banners/526777254/1528469923","http://abs.twimg.com/images/themes/theme1/bg.png","http://pbs.twimg.com/profile_images/1190749518721167361/8e8KnoXg_normal.jpg"
"x501874833","x1464964759422394373",2021-11-28 14:29:51,"s_margiotta","@s_margiotta Prossimo acquisto mio e del Prof. @PAnnicchino","Twitter for iPad",77,,,,FALSE,TRUE,0,1,,,,,,,,,,,,,,,,"x1312496696870436864 x501874833 x427789815","OFerrari1991 s_margiotta PAnnicchino","it",,,,,,,,,,,,,,,,"x1464957274053656580","@s_margiotta Prossimo acquisto mio e del Prof. @PAnnicchino",2021-11-28 14:00:06,"Twitter for iPhone",2,1,"x1312496696870436864","OFerrari1991","Omar Ferrari",22,374,263,"Rivello, Basilicata","• Food Technology Student at @unibasilicata •",FALSE,,,,,,,"NA NA","NA NA","NA NA NA NA NA NA NA NA","https://twitter.com/s_margiotta/status/1464964759422394373","Salvatore Margiotta","Roma, Potenza","Senatore, ingegnere, professore universitario. Capogruppo Commissione lavori pubblici e trasporti. Segretario Presidenza Senato","https://t.co/aeYZnOeRaN",FALSE,15750,7320,207,80056,60508,2012-02-24 15:30:04,TRUE,"https://t.co/aeYZnOeRaN","http://instangram.com/salvatore__margiotta",,"https://pbs.twimg.com/profile_banners/501874833/1483357085","http://abs.twimg.com/images/themes/theme1/bg.png","http://pbs.twimg.com/profile_images/1344056897155063808/zdD0fQgS_normal.jpg"
"x501874833","x1464911595419713536",2021-11-28 10:58:35,"s_margiotta","Eccolo ⁦@Tommasolabate⁩ ⁦@GiusvaPulejo⁩ ⁦@paolabottelli⁩ ⁦@Antonellogiac⁩ ⁦@riotta⁩ https://t.co/rtpFijqFVv","Twitter for iPad",83,,,,FALSE,FALSE,9,1,,,,,,,,"http://pbs.twimg.com/media/FFRpOeeXwAInju1.jpg","https://t.co/rtpFijqFVv","https://twitter.com/s_margiotta/status/1464911595419713536/photo/1","photo","http://pbs.twimg.com/media/FFRpOeeXwAInju1.jpg","https://t.co/rtpFijqFVv","https://twitter.com/s_margiotta/status/1464911595419713536/photo/1",,"x122014351 x932393936 x84545911 x480023608 x73971750","Tommasolabate GiusvaPulejo paolabottelli Antonellogiac riotta","it",,,,,,,,,,,,,,,,,,,,,,,,,,,,,,,,,,,,,"NA NA","NA NA","NA NA NA NA NA NA NA NA","https://twitter.com/s_margiotta/status/1464911595419713536","Salvatore Margiotta","Roma, Potenza","Senatore, ingegnere, professore universitario. Capogruppo Commissione lavori pubblici e trasporti. Segretario Presidenza Senato","https://t.co/aeYZnOeRaN",FALSE,15750,7320,207,80056,60508,2012-02-24 15:30:04,TRUE,"https://t.co/aeYZnOeRaN","http://instangram.com/salvatore__margiotta",,"https://pbs.twimg.com/profile_banners/501874833/1483357085","http://abs.twimg.com/images/themes/theme1/bg.png","http://pbs.twimg.com/profile_images/1344056897155063808/zdD0fQgS_normal.jpg"
"x501874833","x1464901390438965249",2021-11-28 10:18:02,"s_margiotta","Buongiorno a tutti! 
Chi sa vedere le cose belle è perchè ha la bellezza dentro di sè 💫
#GustavKlimt

L’albero della Vita, 1905 https://t.co/lx8MXiebDH","Twitter for iPad",140,,,,FALSE,TRUE,0,7,,,"GustavKlimt",,,,,,,,,,,,,"x412587936","fedefresa","it",,,,,,,,,,,,,,,,"x1464900868008992769","Buongiorno a tutti! 
Chi sa vedere le cose belle è perchè ha la bellezza dentro di sè 💫
#GustavKlimt

L’albero della Vita, 1905 https://t.co/lx8MXiebDH",2021-11-28 10:15:58,"Twitter for iPhone",27,7,"x412587936","fedefresa","Federica Fresa",7124,5184,15476,"Global","In tempi di menzogna universale, dire la verità è un atto rivoluzionario",FALSE,,,,,,,"NA NA","NA NA","NA NA NA NA NA NA NA NA","https://twitter.com/s_margiotta/status/1464901390438965249","Salvatore Margiotta","Roma, Potenza","Senatore, ingegnere, professore universitario. Capogruppo Commissione lavori pubblici e trasporti. Segretario Presidenza Senato","https://t.co/aeYZnOeRaN",FALSE,15750,7320,207,80056,60508,2012-02-24 15:30:04,TRUE,"https://t.co/aeYZnOeRaN","http://instangram.com/salvatore__margiotta",,"https://pbs.twimg.com/profile_banners/501874833/1483357085","http://abs.twimg.com/images/themes/theme1/bg.png","http://pbs.twimg.com/profile_images/1344056897155063808/zdD0fQgS_normal.jpg"
"x501874833","x1464901186310623236",2021-11-28 10:17:14,"s_margiotta","Presentazione in ⁦@SenatoStampa⁩ del  libro, bello ed emozionante, di ⁦@eleonoradaniele⁩ “Quando ti guardo negli occhi. Storia di Luigi, mio fratello” ⁦@SenatoriPD⁩ https://t.co/s3h2pZkKCU","Twitter for iPad",164,,,,FALSE,FALSE,20,6,,,,,,,,"http://pbs.twimg.com/media/FFRf28xX0AIw9r_.jpg","https://t.co/s3h2pZkKCU","https://twitter.com/s_margiotta/status/1464901186310623236/photo/1","photo","http://pbs.twimg.com/media/FFRf28xX0AIw9r_.jpg http://pbs.twimg.com/media/FFRf3PtX0AMCRA4.jpg","https://t.co/s3h2pZkKCU https://t.co/s3h2pZkKCU","https://twitter.com/s_margiotta/status/1464901186310623236/photo/1 https://twitter.com/s_margiotta/status/1464901186310623236/photo/1",,"x1377373874 x207980798 x404048864","SenatoStampa eleonoradaniele SenatoriPD","it",,,,,,,,,,,,,,,,,,,,,,,,,,,,,,,,,,,,,"NA NA","NA NA","NA NA NA NA NA NA NA NA","https://twitter.com/s_margiotta/status/1464901186310623236","Salvatore Margiotta","Roma, Potenza","Senatore, ingegnere, professore universitario. Capogruppo Commissione lavori pubblici e trasporti. Segretario Presidenza Senato","https://t.co/aeYZnOeRaN",FALSE,15750,7320,207,80056,60508,2012-02-24 15:30:04,TRUE,"https://t.co/aeYZnOeRaN","http://instangram.com/salvatore__margiotta",,"https://pbs.twimg.com/profile_banners/501874833/1483357085","http://abs.twimg.com/images/themes/theme1/bg.png","http://pbs.twimg.com/profile_images/1344056897155063808/zdD0fQgS_normal.jpg"
"x501874833","x1464655014316630041",2021-11-27 17:59:02,"s_margiotta","@CalaminiciM Sarebbe assolutamente all’altezza anche @FinocchiaroAnna","Twitter for iPad",56,"x1464517570971774976","x1325373512","CalaminiciM",FALSE,FALSE,3,0,,,,,,,,,,,,,,,,"x1325373512 x404045211","CalaminiciM FinocchiaroAnna","it",,,,,,,,,,,,,,,,,,,,,,,,,,,,,,,,,,,,,"NA NA","NA NA","NA NA NA NA NA NA NA NA","https://twitter.com/s_margiotta/status/1464655014316630041","Salvatore Margiotta","Roma, Potenza","Senatore, ingegnere, professore universitario. Capogruppo Commissione lavori pubblici e trasporti. Segretario Presidenza Senato","https://t.co/aeYZnOeRaN",FALSE,15750,7320,207,80056,60508,2012-02-24 15:30:04,TRUE,"https://t.co/aeYZnOeRaN","http://instangram.com/salvatore__margiotta",,"https://pbs.twimg.com/profile_banners/501874833/1483357085","http://abs.twimg.com/images/themes/theme1/bg.png","http://pbs.twimg.com/profile_images/1344056897155063808/zdD0fQgS_normal.jpg"
"x501874833","x1464653791144431620",2021-11-27 17:54:10,"s_margiotta","Da leggere la bella intervista di @BentivogliMarco su @ilriformista Purché non si abbia “…la stessa capacità di pensiero dei soprammobili…” @SenatoriPD","Twitter for iPad",140,,,,FALSE,TRUE,0,4,,,,,,,,,,,,,,,,"x501874833 x491327107 x138736601","s_margiotta BentivogliMarco ilriformista","it",,,,,,,,,,,,,,,,"x1464492394301333512","Da leggere la bella intervista di @BentivogliMarco su @ilriformista Purché non si abbia “…la stessa capacità di pensiero dei soprammobili…” @SenatoriPD",2021-11-27 07:12:50,"Twitter for iPad",27,4,"x501874833","s_margiotta","Salvatore Margiotta",15750,7320,80056,"Roma, Potenza","Senatore, ingegnere, professore universitario. Capogruppo Commissione lavori pubblici e trasporti. Segretario Presidenza Senato",TRUE,,,,,,,"NA NA","NA NA","NA NA NA NA NA NA NA NA","https://twitter.com/s_margiotta/status/1464653791144431620","Salvatore Margiotta","Roma, Potenza","Senatore, ingegnere, professore universitario. Capogruppo Commissione lavori pubblici e trasporti. Segretario Presidenza Senato","https://t.co/aeYZnOeRaN",FALSE,15750,7320,207,80056,60508,2012-02-24 15:30:04,TRUE,"https://t.co/aeYZnOeRaN","http://instangram.com/salvatore__margiotta",,"https://pbs.twimg.com/profile_banners/501874833/1483357085","http://abs.twimg.com/images/themes/theme1/bg.png","http://pbs.twimg.com/profile_images/1344056897155063808/zdD0fQgS_normal.jpg"
"x501874833","x1464647665128558592",2021-11-27 17:29:49,"s_margiotta","Ormai il Corriere della Sera è un Chi meno informato. https://t.co/PZtReDq6Fn","Twitter for iPad",71,,,,FALSE,TRUE,0,1,,,,,,,,,,,,,,,,"x932393936","GiusvaPulejo","it",,,,,,,,,,,,,,,,"x1464645799330074624","Ormai il Corriere della Sera è un Chi meno informato. https://t.co/PZtReDq6Fn",2021-11-27 17:22:25,"Twitter for iPhone",2,1,"x932393936","GiusvaPulejo","Giusva Pulejo",5796,308,64203,"","Imprenditore che investe in diversi settori. Di base, tra Messina (soprattutto) e Milano. Marito di Federica, padre di Ferdinando e Alessandro.",FALSE,,,,,,,"NA NA","NA NA","NA NA NA NA NA NA NA NA","https://twitter.com/s_margiotta/status/1464647665128558592","Salvatore Margiotta","Roma, Potenza","Senatore, ingegnere, professore universitario. Capogruppo Commissione lavori pubblici e trasporti. Segretario Presidenza Senato","https://t.co/aeYZnOeRaN",FALSE,15750,7320,207,80056,60508,2012-02-24 15:30:04,TRUE,"https://t.co/aeYZnOeRaN","http://instangram.com/salvatore__margiotta",,"https://pbs.twimg.com/profile_banners/501874833/1483357085","http://abs.twimg.com/images/themes/theme1/bg.png","http://pbs.twimg.com/profile_images/1344056897155063808/zdD0fQgS_normal.jpg"
"x501874833","x1464647588284669955",2021-11-27 17:29:31,"s_margiotta","@amalajz4 😂😂😂","Twitter for iPad",3,"x1464644245252460549","x1660889534","amalajz4",FALSE,FALSE,1,0,,,,,,,,,,,,,,,,"x1660889534","amalajz4","und",,,,,,,,,,,,,,,,,,,,,,,,,,,,,,,,,,,,,"NA NA","NA NA","NA NA NA NA NA NA NA NA","https://twitter.com/s_margiotta/status/1464647588284669955","Salvatore Margiotta","Roma, Potenza","Senatore, ingegnere, professore universitario. Capogruppo Commissione lavori pubblici e trasporti. Segretario Presidenza Senato","https://t.co/aeYZnOeRaN",FALSE,15750,7320,207,80056,60508,2012-02-24 15:30:04,TRUE,"https://t.co/aeYZnOeRaN","http://instangram.com/salvatore__margiotta",,"https://pbs.twimg.com/profile_banners/501874833/1483357085","http://abs.twimg.com/images/themes/theme1/bg.png","http://pbs.twimg.com/profile_images/1344056897155063808/zdD0fQgS_normal.jpg"
"x545136488","x1464863451407437828",2021-11-28 07:47:17,"FraMirabelli","Con le mafie non si può convivere, non si può essere ambigui. Con #PD di Lomazzo e i tanti cittadini, amministratori e associazioni contro la presenza della ‘ndrangheta e della mafia nel nostro territorio. @pdnetwork @FraMirabelli https://t.co/DedM5YIcfo","Twitter for iPhone",140,,,,FALSE,TRUE,0,6,,,"PD",,,,,,,,,,,,,"x385923471","bragachiara","it",,,,,,,,,,,,,,,,"x1464638696452501508","Con le mafie non si può convivere, non si può essere ambigui. Con #PD di Lomazzo e i tanti cittadini, amministratori e associazioni contro la presenza della ‘ndrangheta e della mafia nel nostro territorio. @pdnetwork @FraMirabelli https://t.co/DedM5YIcfo",2021-11-27 16:54:11,"Twitter for iPhone",16,6,"x385923471","bragachiara","Chiara Braga",10664,1690,7017,"Como - Roma","Deputata, Segreteria nazionale PD Responsabile Transizione ecologica, sostenibilità, infrastrutture.Capogruppo PD Commissione Ecomafie. Urbanista",FALSE,,,,,,,"NA NA","NA NA","NA NA NA NA NA NA NA NA","https://twitter.com/FraMirabelli/status/1464863451407437828","Franco Mirabelli","Senatore della Repubblica","Al Senato nella XVIII legislatura. Sono in direzione nazionale del PD. Inguaribile interista. Credo al principio di responsabilità.","https://t.co/B2OuGikaFw",FALSE,3205,330,77,7683,219,2012-04-04 13:43:24,TRUE,"https://t.co/B2OuGikaFw","http://www.francomirabelli.it",,"https://pbs.twimg.com/profile_banners/545136488/1480921204","http://abs.twimg.com/images/themes/theme1/bg.png","http://pbs.twimg.com/profile_images/805667781186322432/TKk4fYcJ_normal.jpg"
"x1056543564241481728","x1464651328555151364",2021-11-27 17:44:23,"FiammettaModena","Ora in diretta a #Rotocalco264 @CusanoItaliaTv https://t.co/X2FOKpDxyK","Periscope",70,,,,FALSE,FALSE,1,1,,,"Rotocalco264",,"twitter.com/i/broadcasts/1…","https://t.co/X2FOKpDxyK","https://twitter.com/i/broadcasts/1vAGRklQqNZJl",,,,,,,,,,,"it",,,,,,,,,,,,,,,,,,,,,,,,,,,,,,,,,,,,,"NA NA","NA NA","NA NA NA NA NA NA NA NA","https://twitter.com/FiammettaModena/status/1464651328555151364","Fiammetta Modena","Perugia","Senatore della Repubblica Italiana (FI - XVIII) 🇮🇹 
Membro Commissione Giustizia e Bilancio - Giunta Immunità - Avvocato presso #StudioLegaleModena","https://t.co/gTF6j3uQgf",FALSE,1178,1203,5,2007,2373,2018-10-28 13:49:50,TRUE,"https://t.co/gTF6j3uQgf","http://www.senato.it/leg/18/BGT/Schede/Attsen/00032671.htm",,"https://pbs.twimg.com/profile_banners/1056543564241481728/1619698079","http://abs.twimg.com/images/themes/theme1/bg.png","http://pbs.twimg.com/profile_images/1458557900494942211/XNRZti92_normal.jpg"
"x126970118","x1464650030174900230",2021-11-27 17:39:13,"vilmamoronese","Ho depositato la quarta interrogazione sul #biodigestore di #Caserta, ho chiesto l'annullamento della procedura di assoggettabilità alla Valutazione di Impatto Ambientale, qui tutte le info 👇
https://t.co/OrSHFdu5lF https://t.co/MJSfPsGbW7","Twitter Web App",215,,,,FALSE,FALSE,6,4,,,"biodigestore Caserta",,"facebook.com/49114625429034…","https://t.co/OrSHFdu5lF","https://www.facebook.com/491146254290346/posts/6544510395620538/","http://pbs.twimg.com/media/FFN6vkbX0As3ewb.jpg","https://t.co/MJSfPsGbW7","https://twitter.com/vilmamoronese/status/1464650030174900230/photo/1","photo","http://pbs.twimg.com/media/FFN6vkbX0As3ewb.jpg","https://t.co/MJSfPsGbW7","https://twitter.com/vilmamoronese/status/1464650030174900230/photo/1",,,,"it",,,,,,,,,,,,,,,,,,,,,,,,,,,,,,,,,,,,,"NA NA","NA NA","NA NA NA NA NA NA NA NA","https://twitter.com/vilmamoronese/status/1464650030174900230","Vilma Moronese","Roma/Caserta","Cittadina portavoce eletta al Senato della Repubblica
Presidente della 13ª Commissione permanente (Territorio, ambiente, beni ambientali)

https://t.co/qQ10BqSZ0W","https://t.co/OKmZGRfOp2",FALSE,9954,207,108,13999,2287,2010-03-27 16:05:07,TRUE,"https://t.co/OKmZGRfOp2","http://www.vilmamoronese.it",,"https://pbs.twimg.com/profile_banners/126970118/1620209206","http://abs.twimg.com/images/themes/theme1/bg.png","http://pbs.twimg.com/profile_images/1313761921007603712/JglYO41z_normal.jpg"
"x701094295","x1464860538538795010",2021-11-28 07:35:42,"Am_Parente","Oggi sono qui 👇 https://t.co/Nd8PEa9rtx","Twitter for iPhone",15,,,,FALSE,FALSE,16,4,,,,,,,,"http://pbs.twimg.com/media/FFQ65H3XIAEQLVw.jpg","https://t.co/Nd8PEa9rtx","https://twitter.com/Am_Parente/status/1464860538538795010/photo/1","photo","http://pbs.twimg.com/media/FFQ65H3XIAEQLVw.jpg","https://t.co/Nd8PEa9rtx","https://twitter.com/Am_Parente/status/1464860538538795010/photo/1",,,,"it",,,,,,,,,,,,,,,,,,,,,,,,,,,,,,,,,,,,,"NA NA","NA NA","NA NA NA NA NA NA NA NA","https://twitter.com/Am_Parente/status/1464860538538795010","Annamaria Parente","","Presidente Commissione Igiene e Sanità Senatrice Italia Viva",,FALSE,4053,473,75,3501,1362,2012-07-17 13:52:36,TRUE,,,,"https://pbs.twimg.com/profile_banners/701094295/1571672940","http://abs.twimg.com/images/themes/theme1/bg.png","http://pbs.twimg.com/profile_images/951438386245533696/YIIomLKr_normal.jpg"
"x572473007","x1464901915481939972",2021-11-28 10:20:07,"PepePasquale1","Piove, fa freddo e tira vento…
E quindi??? https://t.co/aEDhxOx7GX","Instagram",66,,,,FALSE,FALSE,1,0,,,,,"instagram.com/p/CW0OIDPreE5/…","https://t.co/aEDhxOx7GX","https://www.instagram.com/p/CW0OIDPreE5/?utm_medium=twitter",,,,,,,,,,,"it",,,,,,,,,,,,,,,,,,,,,,,,,,,,,,,,,,,,,"NA NA","NA NA","NA NA NA NA NA NA NA NA","https://twitter.com/PepePasquale1/status/1464901915481939972","Pasquale Pepe","","Avvocato. Romanista da sempre e per sempre. Dalla parte del Popolo, a prescindere!",,FALSE,881,717,12,2074,45,2012-05-06 09:40:27,FALSE,,,,,"http://abs.twimg.com/images/themes/theme1/bg.png","http://pbs.twimg.com/profile_images/634638036509310976/LMdKefXI_normal.jpg"
"x572473007","x1464638061149491204",2021-11-27 16:51:40,"PepePasquale1","Ho appena sottoscritto la lista per le elezioni provinciali.
Serve una Provincia dei 100 Comuni, cambiamo anche lì! https://t.co/CCVX0fFoaB","Instagram",139,,,,FALSE,FALSE,1,0,,,,,"instagram.com/p/CWyWI28LysB/…","https://t.co/CCVX0fFoaB","https://www.instagram.com/p/CWyWI28LysB/?utm_medium=twitter",,,,,,,,,,,"it",,,,,,,,,,,,,,,,,,,,,,,,,,,,,,,,,,,,,"NA NA","NA NA","NA NA NA NA NA NA NA NA","https://twitter.com/PepePasquale1/status/1464638061149491204","Pasquale Pepe","","Avvocato. Romanista da sempre e per sempre. Dalla parte del Popolo, a prescindere!",,FALSE,881,717,12,2074,45,2012-05-06 09:40:27,FALSE,,,,,"http://abs.twimg.com/images/themes/theme1/bg.png","http://pbs.twimg.com/profile_images/634638036509310976/LMdKefXI_normal.jpg"
"x137288817","x1464695479023947784",2021-11-27 20:39:49,"SimoPillon","Non siamo stati creati maschi per imitare la grazia femminile, ma per avere l’onore di starle accanto e mettere le nostre capacità e le nostre peculiarità al suo servizio. https://t.co/QNDGvEZTPU","Twitter for iPhone",171,,,,FALSE,FALSE,94,13,,,,,,,,"http://pbs.twimg.com/media/FFOkxeHXsAceXTJ.jpg","https://t.co/QNDGvEZTPU","https://twitter.com/SimoPillon/status/1464695479023947784/photo/1","photo","http://pbs.twimg.com/media/FFOkxeHXsAceXTJ.jpg","https://t.co/QNDGvEZTPU","https://twitter.com/SimoPillon/status/1464695479023947784/photo/1",,,,"it",,,,,,,,,,,,,,,,,,,,,,,,,,,,,,,,,,,,,"NA NA","NA NA","NA NA NA NA NA NA NA NA","https://twitter.com/SimoPillon/status/1464695479023947784","Simone Pillon","Perugia","Marito, padre di 3 figli, avvocato cassazionista, già Presidente Forum Famiglie Umbria e cofondatore del Family Day. Senatore della #Lega.","https://t.co/6dder7smIE",FALSE,7574,453,54,842,233,2010-04-26 10:24:56,TRUE,"https://t.co/6dder7smIE","http://www.senato.it/leg/18/BGT/Schede/Attsen/00032690.htm",,"https://pbs.twimg.com/profile_banners/137288817/1520701434","http://abs.twimg.com/images/themes/theme1/bg.png","http://pbs.twimg.com/profile_images/1008224824613851136/KAG6sIFq_normal.jpg"
