"x2280877178","x1408090436984578055",2021-06-24 15:51:35,"Cristian5stelle","@ArsuraAndrea @stanzaselvaggia @fattoquotidiano Quindi avrebbe dovuto protestare @stanzaselvaggia, non tu.
Peraltro, mi hai insultato perché la penso “in altri modi” (credo sia improbabile che ti sia così risentito per l’articolo davanti al nome), la pista della frustrazione resta plausibile","Twitter for iPhone",244,"x1408086902230634500","x1356893007883218944","ArsuraAndrea",FALSE,FALSE,0,0,,,,,,,,,,,,,,,,"x1356893007883218944 x416476798 x52424550 x416476798","ArsuraAndrea stanzaselvaggia fattoquotidiano stanzaselvaggia","it",,,,,,,,,,,,,,,,,,,,,,,,,,,,,,,,,,,,,"NA NA","NA NA","NA NA NA NA NA NA NA NA","https://twitter.com/Cristian5stelle/status/1408090436984578055","Cristian Romaniello","","Deputato della Repubblica","https://t.co/gtlWPsgHiq",FALSE,1633,366,21,562,44,2014-01-07 16:50:31,TRUE,"https://t.co/gtlWPsgHiq","https://bit.ly/CristianRomaniello",,"https://pbs.twimg.com/profile_banners/2280877178/1571761733","http://abs.twimg.com/images/themes/theme1/bg.png","http://pbs.twimg.com/profile_images/1405540733839237120/74X3HbHZ_normal.jpg"
"x2280877178","x1408085845232467969",2021-06-24 15:33:21,"Cristian5stelle","@salvopaola17 @stanzaselvaggia @fattoquotidiano @ricpuglisi Piazzati… qualcuno avrebbe anche votato","Twitter for iPhone",39,"x1408082523914133506","x2360696926","salvopaola17",FALSE,FALSE,0,0,,,,,,,,,,,,,,,,"x2360696926 x416476798 x52424550 x225168723","salvopaola17 stanzaselvaggia fattoquotidiano ricpuglisi","it",,,,,,,,,,,,,,,,,,,,,,,,,,,,,,,,,,,,,"NA NA","NA NA","NA NA NA NA NA NA NA NA","https://twitter.com/Cristian5stelle/status/1408085845232467969","Cristian Romaniello","","Deputato della Repubblica","https://t.co/gtlWPsgHiq",FALSE,1633,366,21,562,44,2014-01-07 16:50:31,TRUE,"https://t.co/gtlWPsgHiq","https://bit.ly/CristianRomaniello",,"https://pbs.twimg.com/profile_banners/2280877178/1571761733","http://abs.twimg.com/images/themes/theme1/bg.png","http://pbs.twimg.com/profile_images/1405540733839237120/74X3HbHZ_normal.jpg"
"x2280877178","x1408081547345993736",2021-06-24 15:16:16,"Cristian5stelle","@LoredanaMaggi_ @fattoquotidiano @stanzaselvaggia Le chiedo scusa se non posso impegnarmi nella ricerca","Twitter for iPhone",53,"x1408077796983910404","x3163571728","LoredanaMaggi_",FALSE,FALSE,0,0,,,,,,,,,,,,,,,,"x3163571728 x52424550 x416476798","LoredanaMaggi_ fattoquotidiano stanzaselvaggia","it",,,,,,,,,,,,,,,,,,,,,,,,,,,,,,,,,,,,,"NA NA","NA NA","NA NA NA NA NA NA NA NA","https://twitter.com/Cristian5stelle/status/1408081547345993736","Cristian Romaniello","","Deputato della Repubblica","https://t.co/gtlWPsgHiq",FALSE,1633,366,21,562,44,2014-01-07 16:50:31,TRUE,"https://t.co/gtlWPsgHiq","https://bit.ly/CristianRomaniello",,"https://pbs.twimg.com/profile_banners/2280877178/1571761733","http://abs.twimg.com/images/themes/theme1/bg.png","http://pbs.twimg.com/profile_images/1405540733839237120/74X3HbHZ_normal.jpg"
"x2280877178","x1408079230575992832",2021-06-24 15:07:04,"Cristian5stelle","@ArsuraAndrea @stanzaselvaggia @fattoquotidiano Ma, sai, i caratteri sono pochi, per distinguere da altri Lucarelli si possono adottare espressioni di uso corrente. Poi, lo sfogo della tua frustrazione dice molte cose di te, nessuna di me","Twitter for iPhone",190,"x1408075376996143114","x1356893007883218944","ArsuraAndrea",FALSE,FALSE,1,0,,,,,,,,,,,,,,,,"x1356893007883218944 x416476798 x52424550","ArsuraAndrea stanzaselvaggia fattoquotidiano","it",,,,,,,,,,,,,,,,,,,,,,,,,,,,,,,,,,,,,"NA NA","NA NA","NA NA NA NA NA NA NA NA","https://twitter.com/Cristian5stelle/status/1408079230575992832","Cristian Romaniello","","Deputato della Repubblica","https://t.co/gtlWPsgHiq",FALSE,1633,366,21,562,44,2014-01-07 16:50:31,TRUE,"https://t.co/gtlWPsgHiq","https://bit.ly/CristianRomaniello",,"https://pbs.twimg.com/profile_banners/2280877178/1571761733","http://abs.twimg.com/images/themes/theme1/bg.png","http://pbs.twimg.com/profile_images/1405540733839237120/74X3HbHZ_normal.jpg"
"x2280877178","x1408078635932729352",2021-06-24 15:04:42,"Cristian5stelle","@salvopaola17 @stanzaselvaggia @fattoquotidiano Non mi sconvolgono, ma rifletto se devono valutare i progetti del pnrr. Dovresti farlo anche tu, ma sono certo ne riparleremo","Twitter for iPhone",125,"x1408077888985964548","x2360696926","salvopaola17",FALSE,FALSE,1,0,,,,,,,,,,,,,,,,"x2360696926 x416476798 x52424550","salvopaola17 stanzaselvaggia fattoquotidiano","it",,,,,,,,,,,,,,,,,,,,,,,,,,,,,,,,,,,,,"NA NA","NA NA","NA NA NA NA NA NA NA NA","https://twitter.com/Cristian5stelle/status/1408078635932729352","Cristian Romaniello","","Deputato della Repubblica","https://t.co/gtlWPsgHiq",FALSE,1633,366,21,562,44,2014-01-07 16:50:31,TRUE,"https://t.co/gtlWPsgHiq","https://bit.ly/CristianRomaniello",,"https://pbs.twimg.com/profile_banners/2280877178/1571761733","http://abs.twimg.com/images/themes/theme1/bg.png","http://pbs.twimg.com/profile_images/1405540733839237120/74X3HbHZ_normal.jpg"
"x2280877178","x1408077296498524162",2021-06-24 14:59:22,"Cristian5stelle","@LoredanaMaggi_ @fattoquotidiano @stanzaselvaggia “Non sia stato sollevato […]” sembrava un po’ generico","Twitter for iPhone",54,"x1408076557134991365","x3163571728","LoredanaMaggi_",FALSE,FALSE,1,0,,,,,,,,,,,,,,,,"x3163571728 x52424550 x416476798","LoredanaMaggi_ fattoquotidiano stanzaselvaggia","it",,,,,,,,,,,,,,,,,,,,,,,,,,,,,,,,,,,,,"NA NA","NA NA","NA NA NA NA NA NA NA NA","https://twitter.com/Cristian5stelle/status/1408077296498524162","Cristian Romaniello","","Deputato della Repubblica","https://t.co/gtlWPsgHiq",FALSE,1633,366,21,562,44,2014-01-07 16:50:31,TRUE,"https://t.co/gtlWPsgHiq","https://bit.ly/CristianRomaniello",,"https://pbs.twimg.com/profile_banners/2280877178/1571761733","http://abs.twimg.com/images/themes/theme1/bg.png","http://pbs.twimg.com/profile_images/1405540733839237120/74X3HbHZ_normal.jpg"
"x2280877178","x1408075452627886086",2021-06-24 14:52:03,"Cristian5stelle","@LoredanaMaggi_ @fattoquotidiano @stanzaselvaggia A me sembra di sì, ma non devo difendere nessuno","Twitter for iPhone",48,"x1408074821259337735","x3163571728","LoredanaMaggi_",FALSE,FALSE,3,0,,,,,,,,,,,,,,,,"x3163571728 x52424550 x416476798","LoredanaMaggi_ fattoquotidiano stanzaselvaggia","it",,,,,,,,,,,,,,,,,,,,,,,,,,,,,,,,,,,,,"NA NA","NA NA","NA NA NA NA NA NA NA NA","https://twitter.com/Cristian5stelle/status/1408075452627886086","Cristian Romaniello","","Deputato della Repubblica","https://t.co/gtlWPsgHiq",FALSE,1633,366,21,562,44,2014-01-07 16:50:31,TRUE,"https://t.co/gtlWPsgHiq","https://bit.ly/CristianRomaniello",,"https://pbs.twimg.com/profile_banners/2280877178/1571761733","http://abs.twimg.com/images/themes/theme1/bg.png","http://pbs.twimg.com/profile_images/1405540733839237120/74X3HbHZ_normal.jpg"
"x2280877178","x1408070663785435148",2021-06-24 14:33:01,"Cristian5stelle","Leggo attacchi, anche ripugnanti, contro la #Lucarelli, che ha descritto comportamenti di #puglisi nel suo editoriale sul @fattoquotidiano.
Io voglio sapere se chi valuterà l’impatto dei progetti del #PNRR naviga tra intemperanze e gaffe.
@stanzaselvaggia ha fatto il suo lavoro!","Twitter for iPhone",279,,,,FALSE,FALSE,225,37,,,"Lucarelli puglisi PNRR",,,,,,,,,,,,,"x52424550 x416476798","fattoquotidiano stanzaselvaggia","it",,,,,,,,,,,,,,,,,,,,,,,,,,,,,,,,,,,,,"NA NA","NA NA","NA NA NA NA NA NA NA NA","https://twitter.com/Cristian5stelle/status/1408070663785435148","Cristian Romaniello","","Deputato della Repubblica","https://t.co/gtlWPsgHiq",FALSE,1633,366,21,562,44,2014-01-07 16:50:31,TRUE,"https://t.co/gtlWPsgHiq","https://bit.ly/CristianRomaniello",,"https://pbs.twimg.com/profile_banners/2280877178/1571761733","http://abs.twimg.com/images/themes/theme1/bg.png","http://pbs.twimg.com/profile_images/1405540733839237120/74X3HbHZ_normal.jpg"
"x978488840","x1408330195053035521",2021-06-25 07:44:18,"carlaruocco1","#Ranucci ha ragione, la battaglia per la libertà di #stampa va fatta tutti insieme. #25giugno https://t.co/ZCIFvKGTQH","Twitter for Android",93,,,,FALSE,FALSE,120,41,,,"Ranucci stampa 25giugno",,,,,"http://pbs.twimg.com/media/E4tk2GcX0AEdkPo.jpg","https://t.co/ZCIFvKGTQH","https://twitter.com/carlaruocco1/status/1408330195053035521/photo/1","photo","http://pbs.twimg.com/media/E4tk2GcX0AEdkPo.jpg","https://t.co/ZCIFvKGTQH","https://twitter.com/carlaruocco1/status/1408330195053035521/photo/1",,,,"it",,,,,,,,,,,,,,,,,,,,,,,,,,,,,,,,,,,,,"NA NA","NA NA","NA NA NA NA NA NA NA NA","https://twitter.com/carlaruocco1/status/1408330195053035521","Carla Ruocco","Roma","Presidente della Commissione bicamerale d'inchiesta sul sistema bancario e finanziario. Deputata del M5S.",,FALSE,69198,322,389,10727,1591,2012-11-29 14:45:44,TRUE,,,,"https://pbs.twimg.com/profile_banners/978488840/1595932887","http://abs.twimg.com/images/themes/theme1/bg.png","http://pbs.twimg.com/profile_images/1325160610208878593/C9vNyImt_normal.jpg"
"x978488840","x1408099243768922115",2021-06-24 16:26:35,"carlaruocco1","Andiamo avanti uniti guardando al #2050! 💪 Il Movimento rimane un progetto condiviso sui valori che ci hanno sempre contraddistinto! @beppe_grillo #Grillo #23giugno https://t.co/TTKnoAMEsz","Twitter for Android",164,,,,FALSE,FALSE,178,48,,,"Grillo 23giugno",,,,,"http://pbs.twimg.com/media/E4qSzLYXEAAsLzG.jpg","https://t.co/TTKnoAMEsz","https://twitter.com/carlaruocco1/status/1408099243768922115/photo/1","photo","http://pbs.twimg.com/media/E4qSzLYXEAAsLzG.jpg","https://t.co/TTKnoAMEsz","https://twitter.com/carlaruocco1/status/1408099243768922115/photo/1",,"x19067940","beppe_grillo","it",,,,,,,,,,,,,,,,,,,,,,,,,,,,,,,,,,,,,"NA NA","NA NA","NA NA NA NA NA NA NA NA","https://twitter.com/carlaruocco1/status/1408099243768922115","Carla Ruocco","Roma","Presidente della Commissione bicamerale d'inchiesta sul sistema bancario e finanziario. Deputata del M5S.",,FALSE,69198,322,389,10727,1591,2012-11-29 14:45:44,TRUE,,,,"https://pbs.twimg.com/profile_banners/978488840/1595932887","http://abs.twimg.com/images/themes/theme1/bg.png","http://pbs.twimg.com/profile_images/1325160610208878593/C9vNyImt_normal.jpg"
"x978488840","x1408083731504668676",2021-06-24 15:24:57,"carlaruocco1","Sto partecipando all'assemblea di gruppo alla Camera i i  con @beppe_grillo . La discussione interna al Movimento è importante ed essenziale: la nuova struttura necessita di ascolto e dialogo per compiere al meglio passaggi delicati. Andiamo avanti senza timori. #Beppe #24giugno https://t.co/iiMlvWzJQt","Twitter Web App",279,,,,FALSE,FALSE,84,21,,,"Beppe 24giugno",,,,,"http://pbs.twimg.com/media/E4qEsCmWEAUzStT.jpg","https://t.co/iiMlvWzJQt","https://twitter.com/carlaruocco1/status/1408083731504668676/photo/1","photo","http://pbs.twimg.com/media/E4qEsCmWEAUzStT.jpg","https://t.co/iiMlvWzJQt","https://twitter.com/carlaruocco1/status/1408083731504668676/photo/1",,"x19067940","beppe_grillo","it",,,,,,,,,,,,,,,,,,,,,,,,,,,,,,,,,,,,,"NA NA","NA NA","NA NA NA NA NA NA NA NA","https://twitter.com/carlaruocco1/status/1408083731504668676","Carla Ruocco","Roma","Presidente della Commissione bicamerale d'inchiesta sul sistema bancario e finanziario. Deputata del M5S.",,FALSE,69198,322,389,10727,1591,2012-11-29 14:45:44,TRUE,,,,"https://pbs.twimg.com/profile_banners/978488840/1595932887","http://abs.twimg.com/images/themes/theme1/bg.png","http://pbs.twimg.com/profile_images/1325160610208878593/C9vNyImt_normal.jpg"
"x127025568","x1408414854088740865",2021-06-25 13:20:42,"carlosibilia","Stasera alle 19 il concerto “Note per ricordare” della banda musicale del Corpo nazionale dei #vigilidelfuoco. L’esibizione al Petruzzelli di #Bari per ricordare l’#incendio del 1991 che distrusse il teatro.
La diretta streaming al link: https://t.co/ubjPEjiuvI https://t.co/YxhvL02D1B","Twitter for iPhone",140,,,,FALSE,TRUE,0,8,,,"vigilidelfuoco",,,,,,,,,,,,,"x702594325625085952","emergenzavvf","it",,,,,,,,,,,,,,,,"x1408414800313475081","Stasera alle 19 il concerto “Note per ricordare” della banda musicale del Corpo nazionale dei #vigilidelfuoco. L’esibizione al Petruzzelli di #Bari per ricordare l’#incendio del 1991 che distrusse il teatro.
La diretta streaming al link: https://t.co/ubjPEjiuvI https://t.co/YxhvL02D1B",2021-06-25 13:20:30,"Twitter for iPhone",26,8,"x702594325625085952","emergenzavvf","Vigili del Fuoco",107440,47,11362,"Palazzo Viminale, Roma","Profilo ufficiale Direzione Centrale Emergenza.  Non inviare qui richieste di soccorso, se sei in pericolo chiama il 115!  https://t.co/HAL3hF0fIs",TRUE,,,,,,,"NA NA","NA NA","NA NA NA NA NA NA NA NA","https://twitter.com/carlosibilia/status/1408414854088740865","Carlo Sibilia","Avellino, Campania","Laureato in Biotecnologie Mediche. Parlamentare da 8 anni. 3 da Sottosegretario al Ministero dell'Interno.","https://t.co/uMpYN4rf34",FALSE,57442,767,351,13828,3211,2010-03-27 20:02:51,TRUE,"https://t.co/uMpYN4rf34","http://www.carlosibilia.it",,"https://pbs.twimg.com/profile_banners/127025568/1616509445","http://abs.twimg.com/images/themes/theme1/bg.png","http://pbs.twimg.com/profile_images/1173917890476761088/b5kY59X5_normal.jpg"
"x127025568","x1408404473752571907",2021-06-25 12:39:28,"carlosibilia","Oggi all'inaugurazione della sede centrale del Comando dei Vigili del Fuoco di Foggia, attesa da 20 anni.
 
Sono qui per parlare di fatti e per ricordare che lo Stato è vicino al territorio, finalmente oggi mettiamo un punto positivo alla realizzazione di questa caserma. https://t.co/S7JqKKkpik","Twitter for iPhone",271,,,,FALSE,FALSE,6,3,,,,,,,,"http://pbs.twimg.com/media/E4uoRhVWQAIcPy2.jpg","https://t.co/S7JqKKkpik","https://twitter.com/carlosibilia/status/1408404473752571907/photo/1","photo","http://pbs.twimg.com/media/E4uoRhVWQAIcPy2.jpg http://pbs.twimg.com/media/E4uoRhYWYAMcZtF.jpg http://pbs.twimg.com/media/E4uoRhXXMAAoWAw.jpg http://pbs.twimg.com/media/E4uoRhZXoAIo55k.jpg","https://t.co/S7JqKKkpik https://t.co/S7JqKKkpik https://t.co/S7JqKKkpik https://t.co/S7JqKKkpik","https://twitter.com/carlosibilia/status/1408404473752571907/photo/1 https://twitter.com/carlosibilia/status/1408404473752571907/photo/1 https://twitter.com/carlosibilia/status/1408404473752571907/photo/1 https://twitter.com/carlosibilia/status/1408404473752571907/photo/1",,,,"it",,,,,,,,,,,,,,,,,,,,,,,,,,,,,,,,,,,,,"NA NA","NA NA","NA NA NA NA NA NA NA NA","https://twitter.com/carlosibilia/status/1408404473752571907","Carlo Sibilia","Avellino, Campania","Laureato in Biotecnologie Mediche. Parlamentare da 8 anni. 3 da Sottosegretario al Ministero dell'Interno.","https://t.co/uMpYN4rf34",FALSE,57442,767,351,13828,3211,2010-03-27 20:02:51,TRUE,"https://t.co/uMpYN4rf34","http://www.carlosibilia.it",,"https://pbs.twimg.com/profile_banners/127025568/1616509445","http://abs.twimg.com/images/themes/theme1/bg.png","http://pbs.twimg.com/profile_images/1173917890476761088/b5kY59X5_normal.jpg"
"x127025568","x1408354473303580676",2021-06-25 09:20:47,"carlosibilia","Oggi sono in Puglia, ci sono buone notizie: in arrivo nuovi mezzi per il soccorso.
A seguito delle sollecitazioni giunte dal territorio in merito alla necessità di un aggiornamento del parco mezzi, mi fa piacere far sapere che a breve saranno operative 5 (APS) e 8 (AF) https://t.co/KYrl9c7oQS","Twitter Web App",269,,,,FALSE,FALSE,17,7,,,,,,,,"http://pbs.twimg.com/media/E4t6wzrWYAEZid3.jpg","https://t.co/KYrl9c7oQS","https://twitter.com/carlosibilia/status/1408354473303580676/photo/1","photo","http://pbs.twimg.com/media/E4t6wzrWYAEZid3.jpg","https://t.co/KYrl9c7oQS","https://twitter.com/carlosibilia/status/1408354473303580676/photo/1",,,,"it",,,,,,,,,,,,,,,,,,,,,,,,,,,,,,,,,,,,,"NA NA","NA NA","NA NA NA NA NA NA NA NA","https://twitter.com/carlosibilia/status/1408354473303580676","Carlo Sibilia","Avellino, Campania","Laureato in Biotecnologie Mediche. Parlamentare da 8 anni. 3 da Sottosegretario al Ministero dell'Interno.","https://t.co/uMpYN4rf34",FALSE,57442,767,351,13828,3211,2010-03-27 20:02:51,TRUE,"https://t.co/uMpYN4rf34","http://www.carlosibilia.it",,"https://pbs.twimg.com/profile_banners/127025568/1616509445","http://abs.twimg.com/images/themes/theme1/bg.png","http://pbs.twimg.com/profile_images/1173917890476761088/b5kY59X5_normal.jpg"
"x127025568","x1408085183706828808",2021-06-24 15:30:43,"carlosibilia","Lieto di poter portare buone notizie ai cittadini e ai Vigili del Fuoco pugliesi: innanzitutto un nuovo Comando a Foggia, atteso da anni, e il nuovo distaccamento di Monopoli. Fatti.

#puglia #vigilidelfuoco https://t.co/ZsDhhV4Im1","Twitter for iPhone",207,,,,FALSE,FALSE,19,8,,,"puglia vigilidelfuoco",,,,,"http://pbs.twimg.com/media/E4qGAjGX0AcNoz_.jpg","https://t.co/ZsDhhV4Im1","https://twitter.com/carlosibilia/status/1408085183706828808/photo/1","photo","http://pbs.twimg.com/media/E4qGAjGX0AcNoz_.jpg","https://t.co/ZsDhhV4Im1","https://twitter.com/carlosibilia/status/1408085183706828808/photo/1",,,,"it",,,,,,,,,,,,,,,,,,,,,,,,,,,,,,,,,,,,,"NA NA","NA NA","NA NA NA NA NA NA NA NA","https://twitter.com/carlosibilia/status/1408085183706828808","Carlo Sibilia","Avellino, Campania","Laureato in Biotecnologie Mediche. Parlamentare da 8 anni. 3 da Sottosegretario al Ministero dell'Interno.","https://t.co/uMpYN4rf34",FALSE,57442,767,351,13828,3211,2010-03-27 20:02:51,TRUE,"https://t.co/uMpYN4rf34","http://www.carlosibilia.it",,"https://pbs.twimg.com/profile_banners/127025568/1616509445","http://abs.twimg.com/images/themes/theme1/bg.png","http://pbs.twimg.com/profile_images/1173917890476761088/b5kY59X5_normal.jpg"
"x1376730776","x1408423588378578945",2021-06-25 13:55:25,"mariaederaM5S","Da oggi è possibile accedere ai documenti della commissione #Sifar che abbiamo desecretato in ufficio di presidenza della Camera.
Si tratta di 14mila pagine che è possibile richiedere su https://t.co/AqubEbuuyh 
Il prezioso lavoro di trasparenza di @Montecitorio prosegue.","Twitter for iPhone",140,,,,FALSE,TRUE,0,13,,,"Sifar",,,,,,,,,,,,,"x22834067","Roberto_Fico","it",,,,,,,,,,,,,,,,"x1408408646933942272","Da oggi è possibile accedere ai documenti della commissione #Sifar che abbiamo desecretato in ufficio di presidenza della Camera.
Si tratta di 14mila pagine che è possibile richiedere su https://t.co/AqubEbuuyh 
Il prezioso lavoro di trasparenza di @Montecitorio prosegue.",2021-06-25 12:56:03,"Twitter for iPhone",26,13,"x22834067","Roberto_Fico","Roberto Fico",207699,552,6038,"Napoli, Italy","Presidente della Camera dei Deputati",TRUE,,,,,,,"NA NA","NA NA","NA NA NA NA NA NA NA NA","https://twitter.com/mariaederaM5S/status/1408423588378578945","Maria Edera Spadoni","Reggio nell'Emilia","Vicepresidente M5S Camera dei Deputati. “Se cambiamo strada rispetto a quella seguita da tutti rischiamo di perderci ma vale la pena provare a vedere oltre”.","https://t.co/GBfo1KXtgW",FALSE,14436,414,107,4975,2088,2013-04-24 10:43:51,TRUE,"https://t.co/GBfo1KXtgW","https://www.mariaederaspadoni.it/",,"https://pbs.twimg.com/profile_banners/1376730776/1606387274","http://abs.twimg.com/images/themes/theme19/bg.gif","http://pbs.twimg.com/profile_images/1377906768282533892/ViAhVv5v_normal.jpg"
"x1376730776","x1408352586252554243",2021-06-25 09:13:17,"mariaederaM5S","A rispondere nell’ultima puntata di #PuntoSocial sarà la portavoce alla Camera, Maria Edera Spadoni.
⭐⭐⭐⭐⭐
Nel faccia a faccia con i nostri portavoce Tendenze Twitter, attualità su Facebook e Instagram, domande dei followers. https://t.co/wsYttqQ9n1","Twitter for iPhone",140,,,,FALSE,TRUE,0,8,,,"PuntoSocial",,,,,,,,,,,,,"x289400495","Mov5Stelle","it",,,,,,,,,,,,,,,,"x1408352384590434304","A rispondere nell’ultima puntata di #PuntoSocial sarà la portavoce alla Camera, Maria Edera Spadoni.
⭐⭐⭐⭐⭐
Nel faccia a faccia con i nostri portavoce Tendenze Twitter, attualità su Facebook e Instagram, domande dei followers. https://t.co/wsYttqQ9n1",2021-06-25 09:12:29,"Twitter Media Studio",30,8,"x289400495","Mov5Stelle","MoVimento 5 Stelle",713395,317,33637,"Italia","Account twitter ufficiale del Movimento 5 Stelle. https://t.co/txIxpkg3nY https://t.co/Txt9rUtZ3m",TRUE,,,,,,,"NA NA","NA NA","NA NA NA NA NA NA NA NA","https://twitter.com/mariaederaM5S/status/1408352586252554243","Maria Edera Spadoni","Reggio nell'Emilia","Vicepresidente M5S Camera dei Deputati. “Se cambiamo strada rispetto a quella seguita da tutti rischiamo di perderci ma vale la pena provare a vedere oltre”.","https://t.co/GBfo1KXtgW",FALSE,14436,414,107,4975,2088,2013-04-24 10:43:51,TRUE,"https://t.co/GBfo1KXtgW","https://www.mariaederaspadoni.it/",,"https://pbs.twimg.com/profile_banners/1376730776/1606387274","http://abs.twimg.com/images/themes/theme19/bg.gif","http://pbs.twimg.com/profile_images/1377906768282533892/ViAhVv5v_normal.jpg"
"x1376730776","x1408345778465251330",2021-06-25 08:46:14,"mariaederaM5S","Ci vediamo tra pochi minuti a #PuntoSocial sulla pagina FB del @Mov5Stelle. Vi aspetto! 👉 https://t.co/jhxoOvOnbu https://t.co/RDPE74fxyH","Twitter Web App",113,,,,FALSE,FALSE,13,3,,,"PuntoSocial",,"facebook.com/174457180812/p…","https://t.co/jhxoOvOnbu","https://facebook.com/174457180812/posts/10159242893230813/?d=n","http://pbs.twimg.com/media/E4ty9mIX0AIZTKg.jpg","https://t.co/RDPE74fxyH","https://twitter.com/mariaederaM5S/status/1408345778465251330/photo/1","photo","http://pbs.twimg.com/media/E4ty9mIX0AIZTKg.jpg","https://t.co/RDPE74fxyH","https://twitter.com/mariaederaM5S/status/1408345778465251330/photo/1",,"x289400495","Mov5Stelle","it",,,,,,,,,,,,,,,,,,,,,,,,,,,,,,,,,,,,,"NA NA","NA NA","NA NA NA NA NA NA NA NA","https://twitter.com/mariaederaM5S/status/1408345778465251330","Maria Edera Spadoni","Reggio nell'Emilia","Vicepresidente M5S Camera dei Deputati. “Se cambiamo strada rispetto a quella seguita da tutti rischiamo di perderci ma vale la pena provare a vedere oltre”.","https://t.co/GBfo1KXtgW",FALSE,14436,414,107,4975,2088,2013-04-24 10:43:51,TRUE,"https://t.co/GBfo1KXtgW","https://www.mariaederaspadoni.it/",,"https://pbs.twimg.com/profile_banners/1376730776/1606387274","http://abs.twimg.com/images/themes/theme19/bg.gif","http://pbs.twimg.com/profile_images/1377906768282533892/ViAhVv5v_normal.jpg"
"x1376730776","x1408085126131683333",2021-06-24 15:30:29,"mariaederaM5S","Un hub per la parità nel settore della ricerca e dell'innovazione: 25 e 26 giugno la conferenza online https://t.co/1BnZEtWEYT https://t.co/EYgDaLg25Q","Twitter for iPhone",140,,,,FALSE,TRUE,0,2,,,,,,,,,,,,,,,,"x364203623","InGenereIt","it",,,,,,,,,,,,,,,,"x1407715310141116419","Un hub per la parità nel settore della ricerca e dell'innovazione: 25 e 26 giugno la conferenza online https://t.co/1BnZEtWEYT https://t.co/EYgDaLg25Q",2021-06-23 15:00:58,"Twitter Web App",8,2,"x364203623","InGenereIt","inGenere",5672,496,9705,"Italy","Gender, data, policies. Un gruppo di economiste e altro. Una webzine per progettare il millennio con gli occhi, la penna e la squadra delle donne, in rete",FALSE,,,,,,,"NA NA","NA NA","NA NA NA NA NA NA NA NA","https://twitter.com/mariaederaM5S/status/1408085126131683333","Maria Edera Spadoni","Reggio nell'Emilia","Vicepresidente M5S Camera dei Deputati. “Se cambiamo strada rispetto a quella seguita da tutti rischiamo di perderci ma vale la pena provare a vedere oltre”.","https://t.co/GBfo1KXtgW",FALSE,14436,414,107,4975,2088,2013-04-24 10:43:51,TRUE,"https://t.co/GBfo1KXtgW","https://www.mariaederaspadoni.it/",,"https://pbs.twimg.com/profile_banners/1376730776/1606387274","http://abs.twimg.com/images/themes/theme19/bg.gif","http://pbs.twimg.com/profile_images/1377906768282533892/ViAhVv5v_normal.jpg"
"x1376730776","x1408072178084421634",2021-06-24 14:39:02,"mariaederaM5S","✅ Ieri, in comm. Lavoro @Montecitorio, approvata all’unanimità la pdl sulla #paritasalariale. Un passo avanti per milioni di #donne, un ottimo lavoro che raccoglie spunti di diversi provvedimenti presentati sullo stesso argomento,tra cui la pdl M5S @TiziCip.👏Ora subito in Aula. https://t.co/v7oFmmfxop","Twitter for iPhone",140,,,,FALSE,TRUE,0,4,,,"paritasalariale",,,,,,,,,,,,,"x1326743389 x2278995820","g_brescia Montecitorio","it",,,,,,,,,,,,,,,,"x1408016651849801731","✅ Ieri, in comm. Lavoro @Montecitorio, approvata all’unanimità la pdl sulla #paritasalariale. Un passo avanti per milioni di #donne, un ottimo lavoro che raccoglie spunti di diversi provvedimenti presentati sullo stesso argomento,tra cui la pdl M5S @TiziCip.👏Ora subito in Aula. https://t.co/v7oFmmfxop",2021-06-24 10:58:24,"Twitter Web App",11,4,"x1326743389","g_brescia","Giuseppe Brescia",15865,685,9262,"","Deputato M5S - Presidente della Commissione Affari Costituzionali
https://t.co/zObZ4XB3aP…",TRUE,,,,,,,"NA NA","NA NA","NA NA NA NA NA NA NA NA","https://twitter.com/mariaederaM5S/status/1408072178084421634","Maria Edera Spadoni","Reggio nell'Emilia","Vicepresidente M5S Camera dei Deputati. “Se cambiamo strada rispetto a quella seguita da tutti rischiamo di perderci ma vale la pena provare a vedere oltre”.","https://t.co/GBfo1KXtgW",FALSE,14436,414,107,4975,2088,2013-04-24 10:43:51,TRUE,"https://t.co/GBfo1KXtgW","https://www.mariaederaspadoni.it/",,"https://pbs.twimg.com/profile_banners/1376730776/1606387274","http://abs.twimg.com/images/themes/theme19/bg.gif","http://pbs.twimg.com/profile_images/1377906768282533892/ViAhVv5v_normal.jpg"
