"x487751312","x1429550338177122306",2021-08-22 21:05:35,"_paolo_romani_","Dobbiamo invece ringraziare il giovanissimo console Tommaso Claudi, gli ufficiali ed i militari del Tuscania che stanno facendo uno straordinario lavoro per salvare le migliaia di collaboratori afghani che hanno rischiato e rischiano la vita per il nostro Paese.","Twitter for iPhone",262,,,,FALSE,FALSE,17,4,,,,,,,,,,,,,,,,,,"it",,,,,,,,,,,,,,,,,,,,,,,,,,,,,,,,,,,,,"NA NA","NA NA","NA NA NA NA NA NA NA NA","https://twitter.com/_paolo_romani_/status/1429550338177122306","Paolo Romani","","Senatore Gruppo Misto Componente Idea-Cambiamo Presidente Fondazione Finis Terrae @terrae_finis",,FALSE,14048,1240,138,2438,48,2012-02-09 18:08:16,FALSE,,,,"https://pbs.twimg.com/profile_banners/487751312/1388508994","http://abs.twimg.com/images/themes/theme1/bg.png","http://pbs.twimg.com/profile_images/418063137485910017/2GZ-dc3m_normal.jpeg"
"x487751312","x1429548650364080129",2021-08-22 20:58:52,"_paolo_romani_","Questo signore è invece l’ambasciatore francese. Che strano anche lui è rimasto all’aeroporto di Kabul a salvare connazionali e collaboratori afghani. https://t.co/2gOOCW4gGL","Twitter for iPhone",150,,,,FALSE,FALSE,12,2,,,,,,,,"http://pbs.twimg.com/media/E9bG4D0XEAMIMz-.jpg","https://t.co/2gOOCW4gGL","https://twitter.com/_paolo_romani_/status/1429548650364080129/photo/1","photo","http://pbs.twimg.com/media/E9bG4D0XEAMIMz-.jpg","https://t.co/2gOOCW4gGL","https://twitter.com/_paolo_romani_/status/1429548650364080129/photo/1",,,,"it",,,,,,,,,,,,,,,,,,,,,,,,,,,,,,,,,,,,,"NA NA","NA NA","NA NA NA NA NA NA NA NA","https://twitter.com/_paolo_romani_/status/1429548650364080129","Paolo Romani","","Senatore Gruppo Misto Componente Idea-Cambiamo Presidente Fondazione Finis Terrae @terrae_finis",,FALSE,14048,1240,138,2438,48,2012-02-09 18:08:16,FALSE,,,,"https://pbs.twimg.com/profile_banners/487751312/1388508994","http://abs.twimg.com/images/themes/theme1/bg.png","http://pbs.twimg.com/profile_images/418063137485910017/2GZ-dc3m_normal.jpeg"
"x487751312","x1429546402171047946",2021-08-22 20:49:56,"_paolo_romani_","https://t.co/mwCmk2x4OQ","Twitter for iPhone",23,,,,FALSE,FALSE,2,2,,,,,,,,"http://pbs.twimg.com/ext_tw_video_thumb/1429458077699432454/pu/img/Vn2K6gbqhfUsKFMh.jpg","https://t.co/mwCmk2x4OQ","https://twitter.com/laurie_bristow/status/1429458212546306054/video/1","photo","http://pbs.twimg.com/ext_tw_video_thumb/1429458077699432454/pu/img/Vn2K6gbqhfUsKFMh.jpg","https://t.co/mwCmk2x4OQ","https://twitter.com/laurie_bristow/status/1429458212546306054/video/1",,,,"und",,,,,,,,,,,,,,,,,,,,,,,,,,,,,,,,,,,,,"NA NA","NA NA","NA NA NA NA NA NA NA NA","https://twitter.com/_paolo_romani_/status/1429546402171047946","Paolo Romani","","Senatore Gruppo Misto Componente Idea-Cambiamo Presidente Fondazione Finis Terrae @terrae_finis",,FALSE,14048,1240,138,2438,48,2012-02-09 18:08:16,FALSE,,,,"https://pbs.twimg.com/profile_banners/487751312/1388508994","http://abs.twimg.com/images/themes/theme1/bg.png","http://pbs.twimg.com/profile_images/418063137485910017/2GZ-dc3m_normal.jpeg"
"x487751312","x1429545716549103621",2021-08-22 20:47:13,"_paolo_romani_","Questo signore si chiama Laurie Bristow ed è l’ambasciatore UK in Afghanistan. Lavora all’aeroporto di Kabul dal 15 agosto salvando connazionali e collaboratori afghani. Non gli è venuto in mente di prendere il primo volo disponibile per scappare. Dov’è l’ambasciatore italiano? https://t.co/kcji0n7Rll","Twitter for iPhone",278,,,,FALSE,FALSE,14,4,,,,,,,,"http://pbs.twimg.com/media/E9bENZSXEAIxjzT.jpg","https://t.co/kcji0n7Rll","https://twitter.com/_paolo_romani_/status/1429545716549103621/photo/1","photo","http://pbs.twimg.com/media/E9bENZSXEAIxjzT.jpg","https://t.co/kcji0n7Rll","https://twitter.com/_paolo_romani_/status/1429545716549103621/photo/1",,,,"it",,,,,,,,,,,,,,,,,,,,,,,,,,,,,,,,,,,,,"NA NA","NA NA","NA NA NA NA NA NA NA NA","https://twitter.com/_paolo_romani_/status/1429545716549103621","Paolo Romani","","Senatore Gruppo Misto Componente Idea-Cambiamo Presidente Fondazione Finis Terrae @terrae_finis",,FALSE,14048,1240,138,2438,48,2012-02-09 18:08:16,FALSE,,,,"https://pbs.twimg.com/profile_banners/487751312/1388508994","http://abs.twimg.com/images/themes/theme1/bg.png","http://pbs.twimg.com/profile_images/418063137485910017/2GZ-dc3m_normal.jpeg"
"x2927013813","x1429822424636346368",2021-08-23 15:06:45,"RossomandoPd","Una bella notizia la liberazione di #Ikram in Marocco grazie al lavoro della @ItalyMFA e del sottosegretario @amendolaenzo. Ora continuiamo a chiedere con forza lo stop alla detenzione di #Zaki.","Twitter for Android",194,,,,FALSE,FALSE,13,3,,,"Ikram Zaki",,,,,,,,,,,,,"x599114492 x398726169","ItalyMFA amendolaenzo","it",,,,,,,,,,,,,,,,,,,,,,,,,,,,,,,,,,,,,"NA NA","NA NA","NA NA NA NA NA NA NA NA","https://twitter.com/RossomandoPd/status/1429822424636346368","Anna Rossomando","Torino","Senatrice Pd, Vicepresidente Senato
Responsabile ""Giustizia e Diritti"" nella Segreteria nazionale del PD","https://t.co/e0H63vop0O",FALSE,1948,437,45,1133,932,2014-12-17 14:15:04,TRUE,"https://t.co/e0H63vop0O","http://www.annarossomando.it",,"https://pbs.twimg.com/profile_banners/2927013813/1523565514","http://abs.twimg.com/images/themes/theme1/bg.png","http://pbs.twimg.com/profile_images/545221273488351232/sLsTv9Yu_normal.jpeg"
"x2546046132","x1429789258202685449",2021-08-23 12:54:58,"sruotolo1","Presidente #Draghi glielo dice anche #donCiotti: “il messaggio del sottosegretario leghista Claudio #Durigon è devastante perciò non può rimanere al suo posto”. Noi siamo antifascisti e stiamo con #Falcone e #Borsellino.","Twitter for iPhone",220,,,,FALSE,FALSE,1685,386,,,"Draghi donCiotti Durigon Falcone Borsellino",,,,,,,,,,,,,,,"it",,,,,,,,,,,,,,,,,,,,,,,,,,,,,,,,,,,,,"NA NA","NA NA","NA NA NA NA NA NA NA NA","https://twitter.com/sruotolo1/status/1429789258202685449","sandro ruotolo","240 km da Napoli ","Napoletano. Cronista dal 1974. Eletto senatore della Repubblica il 23 febbraio 2020.",,FALSE,53022,2003,195,2397,16574,2014-06-04 12:51:39,FALSE,,,,"https://pbs.twimg.com/profile_banners/2546046132/1549564452","http://abs.twimg.com/images/themes/theme1/bg.png","http://pbs.twimg.com/profile_images/1396476237963485194/QqOQtY0n_normal.jpg"
"x903723812","x1429838824352403464",2021-08-23 16:11:55,"DaniSbrollini","CALCIO - La senatrice @DaniSbrollini per la riapertura degli impianti sportivi con la massima capienza
https://t.co/tISG5wp9s3","Twitter for iPhone",140,,,,FALSE,TRUE,0,3,,,,,,,,,,,,,,,,"x2883896811 x903723812","sportvicentino DaniSbrollini","it",,,,,,,,,,,,,,,,"x1429830948363849732","CALCIO - La senatrice @DaniSbrollini per la riapertura degli impianti sportivi con la massima capienza
https://t.co/tISG5wp9s3",2021-08-23 15:40:37,"Twitter Web App",3,3,"x2883896811","sportvicentino","SPORTvicentino",196,81,1979,"Vicenza","SPORTvicentino, giornale della provincia di Vicenza che si occupa di sport vicentino. Fondato nel 1988 da Gianmauro Anni",FALSE,,,,,,,"NA NA","NA NA","NA NA NA NA NA NA NA NA","https://twitter.com/DaniSbrollini/status/1429838824352403464","Daniela Sbrollini","","Senatrice di Italia Viva, responsabile dipartimento Sport, Candidata Presidente per la Regione Veneto","https://t.co/BOoBSLSk3E",FALSE,5721,2869,76,3558,3387,2012-10-25 11:32:27,FALSE,"https://t.co/BOoBSLSk3E","http://www.danielaperilveneto.it",,"https://pbs.twimg.com/profile_banners/903723812/1600935212","http://abs.twimg.com/images/themes/theme1/bg.png","http://pbs.twimg.com/profile_images/1309043270442516480/eDJAIv9p_normal.jpg"
"x903723812","x1429789470652514311",2021-08-23 12:55:48,"DaniSbrollini","Se é vero che il governo non ha ancora impostato un percorso verso l’obbligatorietà del vaccino anche a causa di un atteggiamento sempre contraddittorio di Lega e M5S, é arrivato il momento che Zaia, visto il ruolo che ricopre, mettesse il turbo a una campagna vaccinale lenta","Twitter for Android",276,"x1429789257808363521","x903723812","DaniSbrollini",FALSE,FALSE,15,5,,,,,,,,,,,,,,,,,,"it",,,,,,,,,,,,,,,,,,,,,,,,,,,,,,,,,,,,,"NA NA","NA NA","NA NA NA NA NA NA NA NA","https://twitter.com/DaniSbrollini/status/1429789470652514311","Daniela Sbrollini","","Senatrice di Italia Viva, responsabile dipartimento Sport, Candidata Presidente per la Regione Veneto","https://t.co/BOoBSLSk3E",FALSE,5721,2869,76,3558,3387,2012-10-25 11:32:27,FALSE,"https://t.co/BOoBSLSk3E","http://www.danielaperilveneto.it",,"https://pbs.twimg.com/profile_banners/903723812/1600935212","http://abs.twimg.com/images/themes/theme1/bg.png","http://pbs.twimg.com/profile_images/1309043270442516480/eDJAIv9p_normal.jpg"
"x903723812","x1429789257808363521",2021-08-23 12:54:57,"DaniSbrollini","Va bene comprare milioni di test antigenici e molecolari per garantire la #didattica in presenza dei nostri ragazzi ma se il Presidente della Regione #Veneto uscisse dalle ambiguità sull’efficacia dei vaccini da parte del suo stesso partito 
#COVID19 https://t.co/AEdWAnXvDa","Twitter for Android",250,,,,FALSE,FALSE,19,9,,,"didattica Veneto COVID19",,,,,"http://pbs.twimg.com/media/E9ehwJ9XIAU0Wzl.jpg","https://t.co/AEdWAnXvDa","https://twitter.com/DaniSbrollini/status/1429789257808363521/photo/1","photo","http://pbs.twimg.com/media/E9ehwJ9XIAU0Wzl.jpg","https://t.co/AEdWAnXvDa","https://twitter.com/DaniSbrollini/status/1429789257808363521/photo/1",,,,"it",,,,,,,,,,,,,,,,,,,,,,,,,,,,,,,,,,,,,"NA NA","NA NA","NA NA NA NA NA NA NA NA","https://twitter.com/DaniSbrollini/status/1429789257808363521","Daniela Sbrollini","","Senatrice di Italia Viva, responsabile dipartimento Sport, Candidata Presidente per la Regione Veneto","https://t.co/BOoBSLSk3E",FALSE,5721,2869,76,3558,3387,2012-10-25 11:32:27,FALSE,"https://t.co/BOoBSLSk3E","http://www.danielaperilveneto.it",,"https://pbs.twimg.com/profile_banners/903723812/1600935212","http://abs.twimg.com/images/themes/theme1/bg.png","http://pbs.twimg.com/profile_images/1309043270442516480/eDJAIv9p_normal.jpg"
"x1044204272051793921","x1429745982514896899",2021-08-23 10:03:00,"PaoloTosato3","Presso la sede Federale della Lega a Milano si verificano i moduli raccolti a sostegno dei Referendum sulla Giustizia.
#referendumgiustizia https://t.co/IdS9JaYHPT","Twitter for Android",139,,,,FALSE,FALSE,1,0,,,"referendumgiustizia",,,,,"http://pbs.twimg.com/media/E9d6ZCUXEAEjIua.jpg","https://t.co/IdS9JaYHPT","https://twitter.com/PaoloTosato3/status/1429745982514896899/photo/1","photo","http://pbs.twimg.com/media/E9d6ZCUXEAEjIua.jpg http://pbs.twimg.com/media/E9d6ZMxXEAEINRI.jpg","https://t.co/IdS9JaYHPT https://t.co/IdS9JaYHPT","https://twitter.com/PaoloTosato3/status/1429745982514896899/photo/1 https://twitter.com/PaoloTosato3/status/1429745982514896899/photo/1",,,,"it",,,,,,,,,,,,,,,,,,,,,,,,,,,,,,,,,,,,,"NA NA","NA NA","NA NA NA NA NA NA NA NA","https://twitter.com/PaoloTosato3/status/1429745982514896899","Paolo Tosato","","Senatore della Lega e Segretario della Presidenza del Senato","https://t.co/MrclRYFQc2",FALSE,71,13,5,149,0,2018-09-24 12:37:53,FALSE,"https://t.co/MrclRYFQc2","http://www.senato.it/leg/18/BGT/Schede/Attsen/00030915.htm",,"https://pbs.twimg.com/profile_banners/1044204272051793921/1592733067",,"http://pbs.twimg.com/profile_images/1274640889474924544/mQIdhj3c_normal.jpg"
"x960631114233712650","x1429834488666787847",2021-08-23 15:54:41,"avvocato_urraro","Un grande in bocca al lupo alla Delegazione Italiana che parteciperà alla XVI edizione dei Giochi Paralimpici da domani al 5 settembre a Tokyo.
#Paralimpiadi #Tokyo2020#ForzaAzzurri https://t.co/qzprPWEeBY","Twitter for iPhone",181,,,,FALSE,FALSE,0,0,,,"Paralimpiadi",,,,,"http://pbs.twimg.com/media/E9fK4xyXMAYbEpW.jpg","https://t.co/qzprPWEeBY","https://twitter.com/avvocato_urraro/status/1429834488666787847/photo/1","photo","http://pbs.twimg.com/media/E9fK4xyXMAYbEpW.jpg","https://t.co/qzprPWEeBY","https://twitter.com/avvocato_urraro/status/1429834488666787847/photo/1",,,,"it",,,,,,,,,,,,,,,,,,,,,,,,,,,,,,,,,,,,,"NA NA","NA NA","NA NA NA NA NA NA NA NA","https://twitter.com/avvocato_urraro/status/1429834488666787847","Francesco Urraro","","Avvocato, Senatore della Repubblica","https://t.co/ty4EsXbIYF",FALSE,707,1491,15,1771,180,2018-02-05 21:48:00,TRUE,"https://t.co/ty4EsXbIYF","http://www.senato.it/leg/18/BGT/Schede/Attsen/00032728.htm",,"https://pbs.twimg.com/profile_banners/960631114233712650/1543947300",,"http://pbs.twimg.com/profile_images/1113853247482224640/yQn0Unc3_normal.jpg"
"x960631114233712650","x1429781472785883141",2021-08-23 12:24:01,"avvocato_urraro","Coesione sociale e territoriale nonché valorizzazione di politiche per le prossime generazioni, l’infanzia e i giovani, questa mattina a Napoli con Severino Nappi per la definizione delle liste a sostegno di un nuovo modello di Città, per ritornare Capitale culturale ed economica https://t.co/vIjc4Qvr8s","Twitter for iPhone",280,,,,FALSE,FALSE,0,0,,,,,,,,"http://pbs.twimg.com/media/E9ealpgXEAQENMA.jpg","https://t.co/vIjc4Qvr8s","https://twitter.com/avvocato_urraro/status/1429781472785883141/photo/1","photo","http://pbs.twimg.com/media/E9ealpgXEAQENMA.jpg http://pbs.twimg.com/media/E9ealpoXoAEeZne.jpg","https://t.co/vIjc4Qvr8s https://t.co/vIjc4Qvr8s","https://twitter.com/avvocato_urraro/status/1429781472785883141/photo/1 https://twitter.com/avvocato_urraro/status/1429781472785883141/photo/1",,,,"it",,,,,,,,,,,,,,,,,,,,,,,,,,,,,,,,,,,,,"NA NA","NA NA","NA NA NA NA NA NA NA NA","https://twitter.com/avvocato_urraro/status/1429781472785883141","Francesco Urraro","","Avvocato, Senatore della Repubblica","https://t.co/ty4EsXbIYF",FALSE,707,1491,15,1771,180,2018-02-05 21:48:00,TRUE,"https://t.co/ty4EsXbIYF","http://www.senato.it/leg/18/BGT/Schede/Attsen/00032728.htm",,"https://pbs.twimg.com/profile_banners/960631114233712650/1543947300",,"http://pbs.twimg.com/profile_images/1113853247482224640/yQn0Unc3_normal.jpg"
"x214476890","x1429801337437499394",2021-08-23 13:42:57,"adolfo_urso","Terza riunione del #Copasir in pochi giorni sulla drammatica crisi in #Afghanistan. Serve più tempo per la evacuazione dei nostri collaboratori e dei loro familiari. Possibili conseguenze su flussi migratori, #terrorismo islamico e traffico di #droga. https://t.co/uh1izL1i5u","Twitter for iPhone",251,,,,FALSE,FALSE,28,7,,,"Copasir Afghanistan terrorismo droga",,,,,"http://pbs.twimg.com/media/E9esvGXWUAUgpZ8.jpg","https://t.co/uh1izL1i5u","https://twitter.com/adolfo_urso/status/1429801337437499394/photo/1","photo","http://pbs.twimg.com/media/E9esvGXWUAUgpZ8.jpg","https://t.co/uh1izL1i5u","https://twitter.com/adolfo_urso/status/1429801337437499394/photo/1",,,,"it",,,,,,,,,,,,,,,,,,,,,,,,,,,,,,,,,,,,,"NA NA","NA NA","NA NA NA NA NA NA NA NA","https://twitter.com/adolfo_urso/status/1429801337437499394","Adolfo Urso","","Presidente del #Copasir, Senatore di Fratelli d’Italia","https://t.co/y9Kag2puP7",FALSE,7452,839,141,10321,7942,2010-11-11 14:06:19,FALSE,"https://t.co/y9Kag2puP7","http://www.adolfo-urso.it",,"https://pbs.twimg.com/profile_banners/214476890/1522176915","http://abs.twimg.com/images/themes/theme1/bg.png","http://pbs.twimg.com/profile_images/961162595095990272/PQrCbTK3_normal.jpg"
"x214476890","x1429790001815080967",2021-08-23 12:57:55,"adolfo_urso","Anche oggi il #Copasir in attività. Alle 11 audizione del direttore dell’Aise, gen. Giovanni Caravelli sulla gravissima situazione in #Afghanistan, piano di evacuazione, contrasto al #terrorismo e traffico di #droga","Twitter for iPad",140,,,,FALSE,TRUE,0,14,,,"Copasir",,,,,,,,,,,,,"x214476890","adolfo_urso","it",,,,,,,,,,,,,,,,"x1429663507914571776","Anche oggi il #Copasir in attività. Alle 11 audizione del direttore dell’Aise, gen. Giovanni Caravelli sulla gravissima situazione in #Afghanistan, piano di evacuazione, contrasto al #terrorismo e traffico di #droga",2021-08-23 04:35:16,"Twitter for iPhone",48,14,"x214476890","adolfo_urso","Adolfo Urso",7452,839,10321,"","Presidente del #Copasir, Senatore di Fratelli d’Italia",FALSE,,,,,,,"NA NA","NA NA","NA NA NA NA NA NA NA NA","https://twitter.com/adolfo_urso/status/1429790001815080967","Adolfo Urso","","Presidente del #Copasir, Senatore di Fratelli d’Italia","https://t.co/y9Kag2puP7",FALSE,7452,839,141,10321,7942,2010-11-11 14:06:19,FALSE,"https://t.co/y9Kag2puP7","http://www.adolfo-urso.it",,"https://pbs.twimg.com/profile_banners/214476890/1522176915","http://abs.twimg.com/images/themes/theme1/bg.png","http://pbs.twimg.com/profile_images/961162595095990272/PQrCbTK3_normal.jpg"
"x214476890","x1429663507914571776",2021-08-23 04:35:16,"adolfo_urso","Anche oggi il #Copasir in attività. Alle 11 audizione del direttore dell’Aise, gen. Giovanni Caravelli sulla gravissima situazione in #Afghanistan, piano di evacuazione, contrasto al #terrorismo e traffico di #droga","Twitter for iPhone",215,,,,FALSE,FALSE,48,14,,,"Copasir Afghanistan terrorismo droga",,,,,,,,,,,,,,,"it",,,,,,,,,,,,,,,,,,,,,,,,,,,,,,,,,,,,,"NA NA","NA NA","NA NA NA NA NA NA NA NA","https://twitter.com/adolfo_urso/status/1429663507914571776","Adolfo Urso","","Presidente del #Copasir, Senatore di Fratelli d’Italia","https://t.co/y9Kag2puP7",FALSE,7452,839,141,10321,7942,2010-11-11 14:06:19,FALSE,"https://t.co/y9Kag2puP7","http://www.adolfo-urso.it",,"https://pbs.twimg.com/profile_banners/214476890/1522176915","http://abs.twimg.com/images/themes/theme1/bg.png","http://pbs.twimg.com/profile_images/961162595095990272/PQrCbTK3_normal.jpg"
"x214476890","x1429550490073849866",2021-08-22 21:06:11,"adolfo_urso","Se non ora, quando? La mia proposta di convocare il Cisr, il nostro organismo per la sicurezza nazionale, sulla crisi in #Afganistan ripresa da @GabrieleCarrer su @formichenews. Grazie anche ad @Emagorno e @soiran4 🙏 #Copasir @adolfo_urso
https://t.co/7YwCqofzxi","Twitter for iPad",140,,,,FALSE,TRUE,0,12,,,,,,,,,,,,,,,,"x1557514573","elio_vito","it",,,,,,,,,,,,,,,,"x1429507453587234824","Se non ora, quando? La mia proposta di convocare il Cisr, il nostro organismo per la sicurezza nazionale, sulla crisi in #Afganistan ripresa da @GabrieleCarrer su @formichenews. Grazie anche ad @Emagorno e @soiran4 🙏 #Copasir @adolfo_urso
https://t.co/7YwCqofzxi",2021-08-22 18:15:10,"Twitter for iPad",30,12,"x1557514573","elio_vito","Elio Vito 🇮🇹🇪🇺🇺🇸",10943,13,17031,"Roma","Deputato @forza_italia. Juventino",TRUE,,,,,,,"NA NA","NA NA","NA NA NA NA NA NA NA NA","https://twitter.com/adolfo_urso/status/1429550490073849866","Adolfo Urso","","Presidente del #Copasir, Senatore di Fratelli d’Italia","https://t.co/y9Kag2puP7",FALSE,7452,839,141,10321,7942,2010-11-11 14:06:19,FALSE,"https://t.co/y9Kag2puP7","http://www.adolfo-urso.it",,"https://pbs.twimg.com/profile_banners/214476890/1522176915","http://abs.twimg.com/images/themes/theme1/bg.png","http://pbs.twimg.com/profile_images/961162595095990272/PQrCbTK3_normal.jpg"
"x861249289","x1429703210466488321",2021-08-23 07:13:02,"FrancoZaffini","🔴 Lamorgese, che disastro. #FratellidItalia https://t.co/GxkQGXKgX4","Twitter for iPhone",43,,,,FALSE,FALSE,56,27,,,"FratellidItalia",,,,,"http://pbs.twimg.com/media/E9dTfcqXsAIaSVN.jpg","https://t.co/GxkQGXKgX4","https://twitter.com/FrancoZaffini/status/1429703210466488321/photo/1","photo","http://pbs.twimg.com/media/E9dTfcqXsAIaSVN.jpg","https://t.co/GxkQGXKgX4","https://twitter.com/FrancoZaffini/status/1429703210466488321/photo/1",,,,"it",,,,,,,,,,,,,,,,,,,,,,,,,,,,,,,,,,,,,"NA NA","NA NA","NA NA NA NA NA NA NA NA","https://twitter.com/FrancoZaffini/status/1429703210466488321","Franco Zaffini","","Senatore di Fratelli d’Italia",,FALSE,994,893,7,3845,2097,2012-10-04 11:28:31,FALSE,,,,"https://pbs.twimg.com/profile_banners/861249289/1416831191","http://abs.twimg.com/images/themes/theme1/bg.png","http://pbs.twimg.com/profile_images/1282069308374487043/E95-ktFS_normal.jpg"
"x413916151","x1429839135485923333",2021-08-23 16:13:09,"GuidoCrosetto","@amendolaenzo @ItalyinMorocco @ItalyMFA @luigidimaio Bene","Twitter for iPhone",4,"x1429803197409943554","x398726169","amendolaenzo",FALSE,FALSE,4,0,,,,,,,,,,,,,,,,"x398726169 x3019961679 x599114492 x48062712","amendolaenzo ItalyinMorocco ItalyMFA luigidimaio","tr",,,,,,,,,,,,,,,,,,,,,,,,,,,,,,,,,,,,,"NA NA","NA NA","NA NA NA NA NA NA NA NA","https://twitter.com/GuidoCrosetto/status/1429839135485923333","Guido Crosetto","","Libero da pregiudizi per convinzione, garantista per dna, conservatore per nascita, rispettoso per scelta. Ex tante cose. Ora uomo libero ed imprenditore.",,FALSE,156128,2182,768,97906,22925,2011-11-16 12:08:47,FALSE,,,,"https://pbs.twimg.com/profile_banners/413916151/1614946720","http://abs.twimg.com/images/themes/theme18/bg.gif","http://pbs.twimg.com/profile_images/1367817705408069638/jsus6PeC_normal.jpg"
"x413916151","x1429839075499036680",2021-08-23 16:12:55,"GuidoCrosetto","@lucianocapone @amendolaenzo @ItalyinMorocco @ItalyMFA @luigidimaio Bene!","Twitter for iPhone",5,"x1429807244443541511","x484771907","lucianocapone",FALSE,FALSE,6,0,,,,,,,,,,,,,,,,"x484771907 x398726169 x3019961679 x599114492 x48062712","lucianocapone amendolaenzo ItalyinMorocco ItalyMFA luigidimaio","tr",,,,,,,,,,,,,,,,,,,,,,,,,,,,,,,,,,,,,"NA NA","NA NA","NA NA NA NA NA NA NA NA","https://twitter.com/GuidoCrosetto/status/1429839075499036680","Guido Crosetto","","Libero da pregiudizi per convinzione, garantista per dna, conservatore per nascita, rispettoso per scelta. Ex tante cose. Ora uomo libero ed imprenditore.",,FALSE,156128,2182,768,97906,22925,2011-11-16 12:08:47,FALSE,,,,"https://pbs.twimg.com/profile_banners/413916151/1614946720","http://abs.twimg.com/images/themes/theme18/bg.gif","http://pbs.twimg.com/profile_images/1367817705408069638/jsus6PeC_normal.jpg"
"x413916151","x1429707077702803457",2021-08-23 07:28:24,"GuidoCrosetto","@zuler01 @delle_nebbie @MilanBergamoBGY Magari a lui che era in regola!","Twitter for iPhone",31,"x1429706768628736002","x720792310","zuler01",FALSE,FALSE,0,0,,,,,,,,,,,,,,,,"x720792310 x1334434478027124736 x902520677470756864","zuler01 delle_nebbie MilanBergamoBGY","it",,,,,,,,,,,,,,,,,,,,,,,,,,,,,,,,,,,,,"NA NA","NA NA","NA NA NA NA NA NA NA NA","https://twitter.com/GuidoCrosetto/status/1429707077702803457","Guido Crosetto","","Libero da pregiudizi per convinzione, garantista per dna, conservatore per nascita, rispettoso per scelta. Ex tante cose. Ora uomo libero ed imprenditore.",,FALSE,156128,2182,768,97906,22925,2011-11-16 12:08:47,FALSE,,,,"https://pbs.twimg.com/profile_banners/413916151/1614946720","http://abs.twimg.com/images/themes/theme18/bg.gif","http://pbs.twimg.com/profile_images/1367817705408069638/jsus6PeC_normal.jpg"
"x413916151","x1429706059862712322",2021-08-23 07:24:21,"GuidoCrosetto","@claudiovelardi “Questo lo dice lei!” (Cit.)","Twitter for iPhone",28,"x1429704416467226624","x14227296","claudiovelardi",FALSE,FALSE,15,0,,,,,,,,,,,,,,,,"x14227296","claudiovelardi","it",,,,,,,,,,,,,,,,,,,,,,,,,,,,,,,,,,,,,"NA NA","NA NA","NA NA NA NA NA NA NA NA","https://twitter.com/GuidoCrosetto/status/1429706059862712322","Guido Crosetto","","Libero da pregiudizi per convinzione, garantista per dna, conservatore per nascita, rispettoso per scelta. Ex tante cose. Ora uomo libero ed imprenditore.",,FALSE,156128,2182,768,97906,22925,2011-11-16 12:08:47,FALSE,,,,"https://pbs.twimg.com/profile_banners/413916151/1614946720","http://abs.twimg.com/images/themes/theme18/bg.gif","http://pbs.twimg.com/profile_images/1367817705408069638/jsus6PeC_normal.jpg"
"x413916151","x1429705894955257857",2021-08-23 07:23:42,"GuidoCrosetto","@gloquenzi Il punto 3 può finire dopo contagio.","Twitter for iPhone",36,"x1429705075509891075","x2812961","gloquenzi",FALSE,FALSE,3,0,,,,,,,,,,,,,,,,"x2812961","gloquenzi","it",,,,,,,,,,,,,,,,,,,,,,,,,,,,,,,,,,,,,"NA NA","NA NA","NA NA NA NA NA NA NA NA","https://twitter.com/GuidoCrosetto/status/1429705894955257857","Guido Crosetto","","Libero da pregiudizi per convinzione, garantista per dna, conservatore per nascita, rispettoso per scelta. Ex tante cose. Ora uomo libero ed imprenditore.",,FALSE,156128,2182,768,97906,22925,2011-11-16 12:08:47,FALSE,,,,"https://pbs.twimg.com/profile_banners/413916151/1614946720","http://abs.twimg.com/images/themes/theme18/bg.gif","http://pbs.twimg.com/profile_images/1367817705408069638/jsus6PeC_normal.jpg"
"x413916151","x1429702562379452418",2021-08-23 07:10:28,"GuidoCrosetto","Tutto il #CDX perderebbe con l’alleanza fra #FI e #LEGA.
Sebbene nell’immediato #FDI potrà aumentare ancora i suoi voti.
Analisi condivisibile di ⁦@GuidoCrosetto⁩ https://t.co/Dsr4qk8hyQ","Twitter for iPhone",140,,,,FALSE,TRUE,0,40,,,"CDX FI LEGA FDI",,,,,,,,,,,,,"x51759517","fdragoni","it",,,,,,,,,,,,,,,,"x1429692913169092613","Tutto il #CDX perderebbe con l’alleanza fra #FI e #LEGA.
Sebbene nell’immediato #FDI potrà aumentare ancora i suoi voti.
Analisi condivisibile di ⁦@GuidoCrosetto⁩ https://t.co/Dsr4qk8hyQ",2021-08-23 06:32:07,"Twitter for iPad",184,40,"x51759517","fdragoni","Fabio Dragoni",33221,623,103000,"","Potevate scegliere fra disonore e guerra. Avete scelto il disonore. Avrete la guerra -
Ho scoperto di essere Libertario -
Pazienza! 
Mi leggi anche su LA VERITÀ",FALSE,,,,,,,"NA NA","NA NA","NA NA NA NA NA NA NA NA","https://twitter.com/GuidoCrosetto/status/1429702562379452418","Guido Crosetto","","Libero da pregiudizi per convinzione, garantista per dna, conservatore per nascita, rispettoso per scelta. Ex tante cose. Ora uomo libero ed imprenditore.",,FALSE,156128,2182,768,97906,22925,2011-11-16 12:08:47,FALSE,,,,"https://pbs.twimg.com/profile_banners/413916151/1614946720","http://abs.twimg.com/images/themes/theme18/bg.gif","http://pbs.twimg.com/profile_images/1367817705408069638/jsus6PeC_normal.jpg"
