"x127025568","x1464961516579532801",2021-11-28 14:16:57,"carlosibilia","Solidarietà a #GretaBeccaglia. Le persone riprese mentre molestano in diretta la giornalista vanno identificate e punite. Non si può più rimanere a guardare mentre accade tutto questo. https://t.co/DyHVeIUFJ9","Twitter for iPhone",184,,,,FALSE,FALSE,7,2,,,"GretaBeccaglia",,,,,"http://pbs.twimg.com/media/FFSWu96XsAYXAjf.jpg","https://t.co/DyHVeIUFJ9","https://twitter.com/carlosibilia/status/1464961516579532801/photo/1","photo","http://pbs.twimg.com/media/FFSWu96XsAYXAjf.jpg","https://t.co/DyHVeIUFJ9","https://twitter.com/carlosibilia/status/1464961516579532801/photo/1",,,,"it",,,,,,,,,,,,,,,,,,,,,,,,,,,,,,,,,,,,,"NA NA","NA NA","NA NA NA NA NA NA NA NA","https://twitter.com/carlosibilia/status/1464961516579532801","Carlo Sibilia","Avellino, Campania","Laureato in Biotecnologie Mediche. Parlamentare da 8 anni. 3 da Sottosegretario al Ministero dell'Interno.","https://t.co/LurVtHtd5m",FALSE,57371,769,350,14258,3363,2010-03-27 20:02:51,TRUE,"https://t.co/LurVtHtd5m","http://www.carlosibilia.it",,"https://pbs.twimg.com/profile_banners/127025568/1633603988","http://abs.twimg.com/images/themes/theme1/bg.png","http://pbs.twimg.com/profile_images/1173917890476761088/b5kY59X5_normal.jpg"
"x127025568","x1464915771956551681",2021-11-28 11:15:11,"carlosibilia","Come sempre, parola agli iscritti 

https://t.co/8PNgOnUt9D","Twitter for iPhone",59,"x1464913508819214340","x127025568","carlosibilia",FALSE,FALSE,5,0,,,,,"movimento5stelle.eu/avviso-di-conv…","https://t.co/8PNgOnUt9D","https://www.movimento5stelle.eu/avviso-di-convocazione-assemblea-degli-iscritti/",,,,,,,,,,,"it",,,,,,,,,,,,,,,,,,,,,,,,,,,,,,,,,,,,,"NA NA","NA NA","NA NA NA NA NA NA NA NA","https://twitter.com/carlosibilia/status/1464915771956551681","Carlo Sibilia","Avellino, Campania","Laureato in Biotecnologie Mediche. Parlamentare da 8 anni. 3 da Sottosegretario al Ministero dell'Interno.","https://t.co/LurVtHtd5m",FALSE,57371,769,350,14258,3363,2010-03-27 20:02:51,TRUE,"https://t.co/LurVtHtd5m","http://www.carlosibilia.it",,"https://pbs.twimg.com/profile_banners/127025568/1633603988","http://abs.twimg.com/images/themes/theme1/bg.png","http://pbs.twimg.com/profile_images/1173917890476761088/b5kY59X5_normal.jpg"
"x127025568","x1464913508819214340",2021-11-28 11:06:11,"carlosibilia","È convocata l’assemblea degli iscritti dalle ore 12 di lunedì 29 novembre alle ore 12 di martedì 30 novembre 2021 per deliberare su:

1) Destinazione delle restituzioni dei portavoce nazionali.

2) Approvazione della proposta di accesso al 2×1000. https://t.co/li68lae87j","Twitter for iPhone",247,,,,FALSE,FALSE,24,10,,,,,,,,"http://pbs.twimg.com/media/FFRrEgeXwAkkIeh.jpg","https://t.co/li68lae87j","https://twitter.com/carlosibilia/status/1464913508819214340/photo/1","photo","http://pbs.twimg.com/media/FFRrEgeXwAkkIeh.jpg","https://t.co/li68lae87j","https://twitter.com/carlosibilia/status/1464913508819214340/photo/1",,,,"it",,,,,,,,,,,,,,,,,,,,,,,,,,,,,,,,,,,,,"NA NA","NA NA","NA NA NA NA NA NA NA NA","https://twitter.com/carlosibilia/status/1464913508819214340","Carlo Sibilia","Avellino, Campania","Laureato in Biotecnologie Mediche. Parlamentare da 8 anni. 3 da Sottosegretario al Ministero dell'Interno.","https://t.co/LurVtHtd5m",FALSE,57371,769,350,14258,3363,2010-03-27 20:02:51,TRUE,"https://t.co/LurVtHtd5m","http://www.carlosibilia.it",,"https://pbs.twimg.com/profile_banners/127025568/1633603988","http://abs.twimg.com/images/themes/theme1/bg.png","http://pbs.twimg.com/profile_images/1173917890476761088/b5kY59X5_normal.jpg"
"x441379961","x1464955596113862661",2021-11-28 13:53:26,"MicSodano","Finalmente @DadoneFabiana ha capito quale sia la via per la cannabis: Liberalizzazione con #ManifestoCollettivo 

PDL 2813 Camera, 1498 al Senato. Ma quando la sottoscriverà? @Italia_Freeweed @Blowjoint @Casadileo1 @elio_vito @MicSodano https://t.co/onP6uANp52","Twitter for Android",140,,,,FALSE,TRUE,0,3,,,"ManifestoCollettivo",,,,,,,,,,,,,"x80868448 x708276706","valeficent_ DadoneFabiana","it",,,,,,,,,,,,,,,,"x1464954150681202695","Finalmente @DadoneFabiana ha capito quale sia la via per la cannabis: Liberalizzazione con #ManifestoCollettivo 

PDL 2813 Camera, 1498 al Senato. Ma quando la sottoscriverà? @Italia_Freeweed @Blowjoint @Casadileo1 @elio_vito @MicSodano https://t.co/onP6uANp52",2021-11-28 13:47:41,"Twitter for iPhone",13,3,"x80868448","valeficent_","VALEFICENT",2803,611,13914,"","ᴅɪɢɪᴛᴀʟ ᴄʀᴇᴀᴛᴏʀ & 𝚜ᴛᴏʀʏᴛᴇʟʟᴇʀ • ғᴇᴍᴀʟᴇ 𝟧0 @HIGH_TIMES_MAG • ᴄᴀɴɴᴀʙɪ𝚜 ᴀᴄᴛɪᴠɪ𝚜ᴛ • ɴᴀᴛᴜʀᴀʟ ʙᴏʀɴ ᴡɪᴛᴄʜ",FALSE,,,,,,,"NA NA","NA NA","NA NA NA NA NA NA NA NA","https://twitter.com/MicSodano/status/1464955596113862661","Michele Sodano","Roma, Lazio","Deputato della Repubblica Italiana","https://t.co/m8H8ymNcYD",FALSE,2623,138,28,549,187,2011-12-20 01:31:36,TRUE,"https://t.co/m8H8ymNcYD","https://www.camera.it/leg18/29?shadow_deputato=307118&idpersona=307118&idlegislatura=18",,"https://pbs.twimg.com/profile_banners/441379961/1354634455","http://abs.twimg.com/images/themes/theme1/bg.png","http://pbs.twimg.com/profile_images/1025350390068506624/GMOdtX-t_normal.jpg"
"x441379961","x1464706406272028677",2021-11-27 21:23:14,"MicSodano","E siamo in 5️⃣0️⃣ a chiedere la panchina arcobaleno a @Montecitorio 
Grazie a @grotondi @bragachiara @albertolosacco @AngeloTofalo @renatapolverini @paola_demicheli @mvbrambilla @StefanoCeccanti @MicSodano @IovinoLuigiM5S @RossellaMuroni @lofioramonti @FusacchiA @andreacecconi84","Twitter Web App",140,,,,FALSE,TRUE,0,15,,,,,,,,,,,,,,,,"x1557514573 x2278995820 x87467449 x385923471 x120206776","elio_vito Montecitorio grotondi bragachiara albertolosacco","it",,,,,,,,,,,,,,,,"x1464610963030740992","E siamo in 5️⃣0️⃣ a chiedere la panchina arcobaleno a @Montecitorio 
Grazie a @grotondi @bragachiara @albertolosacco @AngeloTofalo @renatapolverini @paola_demicheli @mvbrambilla @StefanoCeccanti @MicSodano @IovinoLuigiM5S @RossellaMuroni @lofioramonti @FusacchiA @andreacecconi84",2021-11-27 15:03:59,"Twitter for iPhone",178,15,"x1557514573","elio_vito","Elio Vito 🇮🇹🇪🇺🇺🇸",17288,13,21719,"Roma","Deputato @forza_italia. Napoletano. Juventino",TRUE,,,,,,,"NA NA","NA NA","NA NA NA NA NA NA NA NA","https://twitter.com/MicSodano/status/1464706406272028677","Michele Sodano","Roma, Lazio","Deputato della Repubblica Italiana","https://t.co/m8H8ymNcYD",FALSE,2623,138,28,549,187,2011-12-20 01:31:36,TRUE,"https://t.co/m8H8ymNcYD","https://www.camera.it/leg18/29?shadow_deputato=307118&idpersona=307118&idlegislatura=18",,"https://pbs.twimg.com/profile_banners/441379961/1354634455","http://abs.twimg.com/images/themes/theme1/bg.png","http://pbs.twimg.com/profile_images/1025350390068506624/GMOdtX-t_normal.jpg"
"x441379961","x1464630358159282183",2021-11-27 16:21:03,"MicSodano","@gasparripdl su #Cannabis si pronuncia addirittura contro ex-Procuratore Nazionale Antimafia Cafiero De Raho. Quando lo squallore e l'ignoranza, e perfino la vergogna non hanno limiti. #Genova","Twitter for Android",192,,"x413217587","gasparripdl",FALSE,FALSE,0,0,,,"Cannabis Genova",,,,,,,,,,,,,"x413217587","gasparripdl","it",,,,,,,,,,,,,,,,,,,,,,,,,,,,,,,,,,,,,"NA NA","NA NA","NA NA NA NA NA NA NA NA","https://twitter.com/MicSodano/status/1464630358159282183","Michele Sodano","Roma, Lazio","Deputato della Repubblica Italiana","https://t.co/m8H8ymNcYD",FALSE,2623,138,28,549,187,2011-12-20 01:31:36,TRUE,"https://t.co/m8H8ymNcYD","https://www.camera.it/leg18/29?shadow_deputato=307118&idpersona=307118&idlegislatura=18",,"https://pbs.twimg.com/profile_banners/441379961/1354634455","http://abs.twimg.com/images/themes/theme1/bg.png","http://pbs.twimg.com/profile_images/1025350390068506624/GMOdtX-t_normal.jpg"
"x337171830","x1464907897008238597",2021-11-28 10:43:53,"AngeloTofalo","Nelle prime ore di un evento qualità e quantità delle #informazioni ricevute possono determinare grandi variazioni in termini di efficacia delle azioni messe in campo soprattutto in termini di vite salvate. Oggi vi parlo del protocollo #SocialSecurity &gt; https://t.co/mxr1FeYDLI","Twitter for iPhone",280,,,,FALSE,FALSE,1,2,,,"informazioni SocialSecurity",,"angelotofalo.com/intelligence-c…","https://t.co/mxr1FeYDLI","https://www.angelotofalo.com/intelligence-collettiva-protocollo-social-security/",,,,,,,,,,,"it",,,,,,,,,,,,,,,,,,,,,,,,,,,,,,,,,,,,,"NA NA","NA NA","NA NA NA NA NA NA NA NA","https://twitter.com/AngeloTofalo/status/1464907897008238597","Angelo Tofalo","Salerno, Pellezzano, Campania","Ingegnere, deputato della Repubblica, già Sottosegretario di Stato alla Difesa 🇮🇹 Rapito dall’Intelligence per diffondere la cultura della Sicurezza","https://t.co/4xUgrx6rHJ",FALSE,38099,4930,0,37665,16737,2011-07-17 15:43:34,TRUE,"https://t.co/4xUgrx6rHJ","http://www.angelotofalo.com",,"https://pbs.twimg.com/profile_banners/337171830/1613207709","http://abs.twimg.com/images/themes/theme1/bg.png","http://pbs.twimg.com/profile_images/1035471039734718464/UIb1-oK3_normal.jpg"
"x337171830","x1464681623228600320",2021-11-27 19:44:46,"AngeloTofalo","Presentata a #Torino la collezione di abbigliamento a marchio “Esercito Sportswear”, inserita tra i Top Brand dell’evento organizzato da HOAS. I capi della collezione sono realizzati con materiali impiegati nelle #operazioni nazionali ed internazionali. https://t.co/B7RSMmZoQd","Twitter for iPhone",140,,,,FALSE,TRUE,0,23,,,"Torino",,,,,,,,,,,,,"x437337751","Esercito","it",,,,,,,,,,,,,,,,"x1464645284038942721","Presentata a #Torino la collezione di abbigliamento a marchio “Esercito Sportswear”, inserita tra i Top Brand dell’evento organizzato da HOAS. I capi della collezione sono realizzati con materiali impiegati nelle #operazioni nazionali ed internazionali. https://t.co/B7RSMmZoQd",2021-11-27 17:20:22,"Twitter for iPhone",63,23,"x437337751","Esercito","Esercito Italiano",100743,343,15446,"Roma","L'Esercito Italiano, fondato nel 1861, è la componente più antica tra le Forze Armate italiane.",TRUE,,,,,,,"NA NA","NA NA","NA NA NA NA NA NA NA NA","https://twitter.com/AngeloTofalo/status/1464681623228600320","Angelo Tofalo","Salerno, Pellezzano, Campania","Ingegnere, deputato della Repubblica, già Sottosegretario di Stato alla Difesa 🇮🇹 Rapito dall’Intelligence per diffondere la cultura della Sicurezza","https://t.co/4xUgrx6rHJ",FALSE,38099,4930,0,37665,16737,2011-07-17 15:43:34,TRUE,"https://t.co/4xUgrx6rHJ","http://www.angelotofalo.com",,"https://pbs.twimg.com/profile_banners/337171830/1613207709","http://abs.twimg.com/images/themes/theme1/bg.png","http://pbs.twimg.com/profile_images/1035471039734718464/UIb1-oK3_normal.jpg"
"x337171830","x1464622890444337166",2021-11-27 15:51:23,"AngeloTofalo","✅Esercitazione internazionale per i velivoli F-35B

📹 È online la nuova edizione di #VideoNews AM ⬇️
https://t.co/rajmADrTpb

#AeronauticaMilitare #latuasquadrachevola @MinisteroDifesa @SM_Difesa @ItalianNavy @HMSQNLZ @theF35JPO @prattandwhitney @RoyalNavy https://t.co/miaY96QvWM","Twitter for iPhone",140,,,,FALSE,TRUE,0,14,,,"VideoNews",,,,,,,,,,,,,"x1280597143","ItalianAirForce","it",,,,,,,,,,,,,,,,"x1464489165794553859","✅Esercitazione internazionale per i velivoli F-35B

📹 È online la nuova edizione di #VideoNews AM ⬇️
https://t.co/rajmADrTpb

#AeronauticaMilitare #latuasquadrachevola @MinisteroDifesa @SM_Difesa @ItalianNavy @HMSQNLZ @theF35JPO @prattandwhitney @RoyalNavy https://t.co/miaY96QvWM",2021-11-27 07:00:00,"Hootsuite Inc.",36,14,"x1280597143","ItalianAirForce","Aeronautica Militare",108446,430,27867,"","La Difesa Aerea è la missione principale dell'Aeronautica Militare.365 giorni l'anno,24 ore su 24, i velivoli caccia sono pronti al decollo #latuasquadrachevola",TRUE,,,,,,,"NA NA","NA NA","NA NA NA NA NA NA NA NA","https://twitter.com/AngeloTofalo/status/1464622890444337166","Angelo Tofalo","Salerno, Pellezzano, Campania","Ingegnere, deputato della Repubblica, già Sottosegretario di Stato alla Difesa 🇮🇹 Rapito dall’Intelligence per diffondere la cultura della Sicurezza","https://t.co/4xUgrx6rHJ",FALSE,38099,4930,0,37665,16737,2011-07-17 15:43:34,TRUE,"https://t.co/4xUgrx6rHJ","http://www.angelotofalo.com",,"https://pbs.twimg.com/profile_banners/337171830/1613207709","http://abs.twimg.com/images/themes/theme1/bg.png","http://pbs.twimg.com/profile_images/1035471039734718464/UIb1-oK3_normal.jpg"
"x337171830","x1464622801063657479",2021-11-27 15:51:01,"AngeloTofalo","Anche la #MarinaMilitare ti aspetta al @Job_Orienta , il salone dedicato a orientamento, scuola, formazione e lavoro. Preparati a vivere un’esperienza immersiva a bordo del nostro centro mobile informativo! 

Ti aspettiamo! 

Tutte le info su https://t.co/b0x4rv9Te6 https://t.co/SuOnVC5vxu","Twitter for iPhone",140,,,,FALSE,TRUE,0,14,,,"MarinaMilitare",,,,,,,,,,,,,"x252039915 x372214951","ItalianNavy Job_Orienta","it",,,,,,,,,,,,,,,,"x1464305262450331658","Anche la #MarinaMilitare ti aspetta al @Job_Orienta , il salone dedicato a orientamento, scuola, formazione e lavoro. Preparati a vivere un’esperienza immersiva a bordo del nostro centro mobile informativo! 

Ti aspettiamo! 

Tutte le info su https://t.co/b0x4rv9Te6 https://t.co/SuOnVC5vxu",2021-11-26 18:49:14,"Twitter for iPhone",47,14,"x252039915","ItalianNavy","Marina Militare",98580,190,20352,"Italia","#ProfessionistidelMare #NoisiamolaMarina #UnMarediOpportunità",TRUE,,,,,,,"NA NA","NA NA","NA NA NA NA NA NA NA NA","https://twitter.com/AngeloTofalo/status/1464622801063657479","Angelo Tofalo","Salerno, Pellezzano, Campania","Ingegnere, deputato della Repubblica, già Sottosegretario di Stato alla Difesa 🇮🇹 Rapito dall’Intelligence per diffondere la cultura della Sicurezza","https://t.co/4xUgrx6rHJ",FALSE,38099,4930,0,37665,16737,2011-07-17 15:43:34,TRUE,"https://t.co/4xUgrx6rHJ","http://www.angelotofalo.com",,"https://pbs.twimg.com/profile_banners/337171830/1613207709","http://abs.twimg.com/images/themes/theme1/bg.png","http://pbs.twimg.com/profile_images/1035471039734718464/UIb1-oK3_normal.jpg"
"x337171830","x1464622721015463938",2021-11-27 15:50:42,"AngeloTofalo","Esercitazione VARDIREX (Various Disaster Relief Exercise) per le #TruppeAlpine dell'#Esercito e per la Protezione Civile dell’Associazione Nazionale #Alpini che si addestrano per migliorare la sinergia e la capacità d’intervento in fase emergenziale complessa. #alserviziodelPaese https://t.co/P7pyiwGs7j","Twitter for iPhone",140,,,,FALSE,TRUE,0,27,,,"TruppeAlpine Esercito",,,,,,,,,,,,,"x437337751","Esercito","it",,,,,,,,,,,,,,,,"x1464496386976755713","Esercitazione VARDIREX (Various Disaster Relief Exercise) per le #TruppeAlpine dell'#Esercito e per la Protezione Civile dell’Associazione Nazionale #Alpini che si addestrano per migliorare la sinergia e la capacità d’intervento in fase emergenziale complessa. #alserviziodelPaese https://t.co/P7pyiwGs7j",2021-11-27 07:28:42,"Twitter for iPhone",96,27,"x437337751","Esercito","Esercito Italiano",100743,343,15446,"Roma","L'Esercito Italiano, fondato nel 1861, è la componente più antica tra le Forze Armate italiane.",TRUE,,,,,,,"NA NA","NA NA","NA NA NA NA NA NA NA NA","https://twitter.com/AngeloTofalo/status/1464622721015463938","Angelo Tofalo","Salerno, Pellezzano, Campania","Ingegnere, deputato della Repubblica, già Sottosegretario di Stato alla Difesa 🇮🇹 Rapito dall’Intelligence per diffondere la cultura della Sicurezza","https://t.co/4xUgrx6rHJ",FALSE,38099,4930,0,37665,16737,2011-07-17 15:43:34,TRUE,"https://t.co/4xUgrx6rHJ","http://www.angelotofalo.com",,"https://pbs.twimg.com/profile_banners/337171830/1613207709","http://abs.twimg.com/images/themes/theme1/bg.png","http://pbs.twimg.com/profile_images/1035471039734718464/UIb1-oK3_normal.jpg"
"x116803999","x1464929582340087809",2021-11-28 12:10:04,"raffaele_trano","Approvare  art. 29 bis -legge Bilancio 2022- Limitare compensi amministratori  casse previdenziali - Firma la petizione! https://t.co/g52Cjqcvy7 via @ChangeItalia #Alternativa","Twitter for iPhone",175,,,,FALSE,FALSE,0,0,,,"Alternativa",,"chng.it/LhGfTNc6","https://t.co/g52Cjqcvy7","https://chng.it/LhGfTNc6",,,,,,,,,"x636955791","ChangeItalia","it",,,,,,,,,,,,,,,,,,,,,,,,,,,,,,,,,,,,,"NA NA","NA NA","NA NA NA NA NA NA NA NA","https://twitter.com/raffaele_trano/status/1464929582340087809","Raffaele Trano","Roma","Membro della commissione Bilancio - Camera dei Deputati - laureato in Economia - L'alternativa c'è","https://t.co/Jk99VKj6iB",FALSE,1042,428,21,2527,1203,2010-02-23 16:34:13,TRUE,"https://t.co/Jk99VKj6iB","https://www.raffaeletrano.it/",,"https://pbs.twimg.com/profile_banners/116803999/1584612651","http://abs.twimg.com/images/themes/theme1/bg.png","http://pbs.twimg.com/profile_images/1235940091895390209/HQBO3cQ-_normal.jpg"
"x116803999","x1464920075337617410",2021-11-28 11:32:17,"raffaele_trano","La tanto magnificata riforma #Irpef del governo dei Migliori di #Draghi è riuscita in una impresa storica far arrabbiare i 
#Sindacati e @Confindustria. Ci perdono i lavoratori fini a €15.000 ci guadagnano i quadri da €50.000 in su. Ma la sorpresa saranno le detrazioni. https://t.co/dQzOVzFrJd","Twitter for iPhone",270,,,,FALSE,FALSE,2,1,,,"Irpef Draghi Sindacati",,,,,"http://pbs.twimg.com/media/FFRxCt-XoAMuHTn.jpg","https://t.co/dQzOVzFrJd","https://twitter.com/raffaele_trano/status/1464920075337617410/photo/1","photo","http://pbs.twimg.com/media/FFRxCt-XoAMuHTn.jpg","https://t.co/dQzOVzFrJd","https://twitter.com/raffaele_trano/status/1464920075337617410/photo/1",,"x732136568421556224","Confindustria","it",,,,,,,,,,,,,,,,,,,,,,,,,,,,,,,,,,,,,"NA NA","NA NA","NA NA NA NA NA NA NA NA","https://twitter.com/raffaele_trano/status/1464920075337617410","Raffaele Trano","Roma","Membro della commissione Bilancio - Camera dei Deputati - laureato in Economia - L'alternativa c'è","https://t.co/Jk99VKj6iB",FALSE,1042,428,21,2527,1203,2010-02-23 16:34:13,TRUE,"https://t.co/Jk99VKj6iB","https://www.raffaeletrano.it/",,"https://pbs.twimg.com/profile_banners/116803999/1584612651","http://abs.twimg.com/images/themes/theme1/bg.png","http://pbs.twimg.com/profile_images/1235940091895390209/HQBO3cQ-_normal.jpg"
"x116803999","x1464877357077041153",2021-11-28 08:42:32,"raffaele_trano","@RaphaelRaduzzi Un grande passo avanti","Twitter for iPhone",22,"x1464867494775164939","x292474458","RaphaelRaduzzi",FALSE,FALSE,3,0,,,,,,,,,,,,,,,,"x292474458","RaphaelRaduzzi","it",,,,,,,,,,,,,,,,,,,,,,,,,,,,,,,,,,,,,"NA NA","NA NA","NA NA NA NA NA NA NA NA","https://twitter.com/raffaele_trano/status/1464877357077041153","Raffaele Trano","Roma","Membro della commissione Bilancio - Camera dei Deputati - laureato in Economia - L'alternativa c'è","https://t.co/Jk99VKj6iB",FALSE,1042,428,21,2527,1203,2010-02-23 16:34:13,TRUE,"https://t.co/Jk99VKj6iB","https://www.raffaeletrano.it/",,"https://pbs.twimg.com/profile_banners/116803999/1584612651","http://abs.twimg.com/images/themes/theme1/bg.png","http://pbs.twimg.com/profile_images/1235940091895390209/HQBO3cQ-_normal.jpg"
"x116803999","x1464876972857864194",2021-11-28 08:41:01,"raffaele_trano","La gogna mediatica nei confronti dei #NoGreenPass si traduce in vergogna: @myrtamerlino che offende le persone affette da #Autismo per attaccare le idee di @SenatoMattia è da licenziamento immediato. Qui il video https://t.co/I0r2zSIUSe https://t.co/0CxL1qtTlX","Twitter for iPhone",236,,,,FALSE,FALSE,310,177,,,"NoGreenPass Autismo",,"bit.ly/3I2sOlC","https://t.co/I0r2zSIUSe","https://bit.ly/3I2sOlC","http://pbs.twimg.com/media/FFRJ111XIAUZ5tG.jpg","https://t.co/0CxL1qtTlX","https://twitter.com/raffaele_trano/status/1464876972857864194/photo/1","photo","http://pbs.twimg.com/media/FFRJ111XIAUZ5tG.jpg","https://t.co/0CxL1qtTlX","https://twitter.com/raffaele_trano/status/1464876972857864194/photo/1",,"x372273460 x1406703543348760578","myrtamerlino SenatoMattia","it",,,,,,,,,,,,,,,,,,,,,,,,,,,,,,,,,,,,,"NA NA","NA NA","NA NA NA NA NA NA NA NA","https://twitter.com/raffaele_trano/status/1464876972857864194","Raffaele Trano","Roma","Membro della commissione Bilancio - Camera dei Deputati - laureato in Economia - L'alternativa c'è","https://t.co/Jk99VKj6iB",FALSE,1042,428,21,2527,1203,2010-02-23 16:34:13,TRUE,"https://t.co/Jk99VKj6iB","https://www.raffaeletrano.it/",,"https://pbs.twimg.com/profile_banners/116803999/1584612651","http://abs.twimg.com/images/themes/theme1/bg.png","http://pbs.twimg.com/profile_images/1235940091895390209/HQBO3cQ-_normal.jpg"
"x1386423176","x1464926521441898498",2021-11-28 11:57:54,"AndreaVallascas","Mentre #Monti invoca la ricostituzione dell'#IstitutoLuce, i nostri media si portano avanti allarmandoci sulla pericolosa variante omicron nonostante per i medici sudafricani la reazione globale sia ""una tempesta in una tazza da tè"". https://t.co/Ia9cSLR8IH","Twitter for Android",233,,,,FALSE,FALSE,2,2,,,"Monti IstitutoLuce",,,,,"http://pbs.twimg.com/media/FFR25MbXEAYRx3r.jpg","https://t.co/Ia9cSLR8IH","https://twitter.com/AndreaVallascas/status/1464926521441898498/photo/1","photo","http://pbs.twimg.com/media/FFR25MbXEAYRx3r.jpg http://pbs.twimg.com/media/FFR25uXXEAoGqjz.jpg","https://t.co/Ia9cSLR8IH https://t.co/Ia9cSLR8IH","https://twitter.com/AndreaVallascas/status/1464926521441898498/photo/1 https://twitter.com/AndreaVallascas/status/1464926521441898498/photo/1",,,,"it",,,,,,,,,,,,,,,,,,,,,,,,,,,,,,,"https://api.twitter.com/1.1/geo/id/e34cc541ad2088a0.json","Cagliari","Cagliari, Sardinia","city","Italy","IT","NA NA","NA NA","9.0106167 9.1810219 9.1810219 9.0106167 39.1579821 39.1579821 39.2827906 39.2827906","https://twitter.com/AndreaVallascas/status/1464926521441898498","Andrea Vallascas","Roma","Deputato - eletto nel collegio plurinominale 01 Sardegna - X commissione Attività produttive","https://t.co/JOPvZVdV11",FALSE,2614,315,62,6971,237,2013-04-28 08:06:56,TRUE,"https://t.co/JOPvZVdV11","http://www.andreavallascas.it",,"https://pbs.twimg.com/profile_banners/1386423176/1625234772","http://abs.twimg.com/images/themes/theme1/bg.png","http://pbs.twimg.com/profile_images/1386030783228518407/Z6GX8VUn_normal.jpg"
"x1386423176","x1464915057855418372",2021-11-28 11:12:21,"AndreaVallascas","Articolo 21
Tutti hanno diritto di manifestare liberamente il proprio pensiero con la parola, lo scritto e ogni altro mezzo di diffusione. La Costituzione questa sconosciuta caro Monti. #StopDittatura #stopSuperGreenPass #Art.21 https://t.co/d3HJuwDxYa","Twitter Web App",228,,,,FALSE,FALSE,1,2,,,"StopDittatura stopSuperGreenPass Art",,,,,"http://pbs.twimg.com/media/FFRsDv6WQAg2_NR.jpg","https://t.co/d3HJuwDxYa","https://twitter.com/AndreaVallascas/status/1464915057855418372/photo/1","photo","http://pbs.twimg.com/media/FFRsDv6WQAg2_NR.jpg","https://t.co/d3HJuwDxYa","https://twitter.com/AndreaVallascas/status/1464915057855418372/photo/1",,,,"it",,,,,,,,,,,,,,,,,,,,,,,,,,,,,,,,,,,,,"NA NA","NA NA","NA NA NA NA NA NA NA NA","https://twitter.com/AndreaVallascas/status/1464915057855418372","Andrea Vallascas","Roma","Deputato - eletto nel collegio plurinominale 01 Sardegna - X commissione Attività produttive","https://t.co/JOPvZVdV11",FALSE,2614,315,62,6971,237,2013-04-28 08:06:56,TRUE,"https://t.co/JOPvZVdV11","http://www.andreavallascas.it",,"https://pbs.twimg.com/profile_banners/1386423176/1625234772","http://abs.twimg.com/images/themes/theme1/bg.png","http://pbs.twimg.com/profile_images/1386030783228518407/Z6GX8VUn_normal.jpg"
"x636328779","x1464961502260211723",2021-11-28 14:16:54,"AlexBazzaro","Forse non è chiaro quanto alta rimanga la tensione nel mercato energetico europeo. Nel silenzio generale (da parte di Bruxelles soprattutto), i prezzi dell’elettricità continuano a veleggiare su livelli record in Francia, Germania e Italia. #materiarara. https://t.co/PuabeelhTr","Twitter for iPhone",140,,,,FALSE,TRUE,0,10,,,,,,,,,,,,,,,,"x304899193","TCommodity","it",,,,,,,,,,,,,,,,"x1464956705578618881","Forse non è chiaro quanto alta rimanga la tensione nel mercato energetico europeo. Nel silenzio generale (da parte di Bruxelles soprattutto), i prezzi dell’elettricità continuano a veleggiare su livelli record in Francia, Germania e Italia. #materiarara. https://t.co/PuabeelhTr",2021-11-28 13:57:50,"Twitter for iPhone",22,10,"x304899193","TCommodity","Gianclaudio Torlizzi",7803,421,26492,"Rome-Milan","Fondatore di T-Commodity. Responsabile desk materie prime @Confapi Autore di #MateriaRara. https://t.co/DEa4hlHyZn",FALSE,,,,,,,"NA NA","NA NA","NA NA NA NA NA NA NA NA","https://twitter.com/AlexBazzaro/status/1464961502260211723","Alex Bazzaro","Venezia ","🇮🇹Deputato Lega, Commissione XIV 🇪🇺 🦁Consigliere Comunale Venezia. ✈️ Delegazione @OSCE","https://t.co/C7Juvvqd3j",FALSE,2487,462,34,12037,3512,2012-07-15 15:20:42,TRUE,"https://t.co/C7Juvvqd3j","https://www.camera.it/leg18/29?shadow_deputato=307696&idpersona=307696&idlegislatura=18",,"https://pbs.twimg.com/profile_banners/636328779/1457208495","http://abs.twimg.com/images/themes/theme1/bg.png","http://pbs.twimg.com/profile_images/1315654416171753472/1PG-DcXJ_normal.jpg"
