"user_id","status_id","created_at","screen_name","text","source","display_text_width","reply_to_status_id","reply_to_user_id","reply_to_screen_name","is_quote","is_retweet","favorite_count","retweet_count","quote_count","reply_count","hashtags","symbols","urls_url","urls_t.co","urls_expanded_url","media_url","media_t.co","media_expanded_url","media_type","ext_media_url","ext_media_t.co","ext_media_expanded_url","ext_media_type","mentions_user_id","mentions_screen_name","lang","quoted_status_id","quoted_text","quoted_created_at","quoted_source","quoted_favorite_count","quoted_retweet_count","quoted_user_id","quoted_screen_name","quoted_name","quoted_followers_count","quoted_friends_count","quoted_statuses_count","quoted_location","quoted_description","quoted_verified","retweet_status_id","retweet_text","retweet_created_at","retweet_source","retweet_favorite_count","retweet_retweet_count","retweet_user_id","retweet_screen_name","retweet_name","retweet_followers_count","retweet_friends_count","retweet_statuses_count","retweet_location","retweet_description","retweet_verified","place_url","place_name","place_full_name","place_type","country","country_code","geo_coords","coords_coords","bbox_coords","status_url","name","location","description","url","protected","followers_count","friends_count","listed_count","statuses_count","favourites_count","account_created_at","verified","profile_url","profile_expanded_url","account_lang","profile_banner_url","profile_background_url","profile_image_url"
"x270839361","x1468515915205685249",2021-12-08 09:40:52,"matteosalvinimi","Mentre gli altri provano a censurare, noi ci facciamo sentire.
Condividi anche tu: viva il Natale!
Buona #Immacolata, Amici. #8dicembre https://t.co/XtlD9X5Zjk","Twitter for iPhone",135,,,,FALSE,FALSE,294,68,,,"Immacolata 8dicembre",,,,,"http://pbs.twimg.com/media/FGE3cJrWQAYT20u.jpg","https://t.co/XtlD9X5Zjk","https://twitter.com/matteosalvinimi/status/1468515915205685249/photo/1","photo","http://pbs.twimg.com/media/FGE3cJrWQAYT20u.jpg","https://t.co/XtlD9X5Zjk","https://twitter.com/matteosalvinimi/status/1468515915205685249/photo/1",,,,"it",,,,,,,,,,,,,,,,,,,,,,,,,,,,,,,,,,,,,"NA NA","NA NA","NA NA NA NA NA NA NA NA","https://twitter.com/matteosalvinimi/status/1468515915205685249","Matteo Salvini","","Leader della Lega #primagliitaliani 🇮🇹","https://t.co/sj3rr6DU3N",FALSE,1429495,2029,3053,52256,3850,2011-03-23 10:32:56,TRUE,"https://t.co/sj3rr6DU3N","https://legaonline.it/",,"https://pbs.twimg.com/profile_banners/270839361/1635585626","http://abs.twimg.com/images/themes/theme1/bg.png","http://pbs.twimg.com/profile_images/966325945060732928/0Ua5xPMX_normal.jpg"
"x270839361","x1468350577180610567",2021-12-07 22:43:52,"matteosalvinimi","Se lo scrive perfino il Corriere…
Voi che ne pensate?
Una preghiera per Davide. https://t.co/qkSmP6xGrl","Twitter for iPhone",79,,,,FALSE,FALSE,405,71,,,,,,,,"http://pbs.twimg.com/media/FGChEOMWYAQ7XlN.jpg","https://t.co/qkSmP6xGrl","https://twitter.com/matteosalvinimi/status/1468350577180610567/photo/1","photo","http://pbs.twimg.com/media/FGChEOMWYAQ7XlN.jpg","https://t.co/qkSmP6xGrl","https://twitter.com/matteosalvinimi/status/1468350577180610567/photo/1",,,,"it",,,,,,,,,,,,,,,,,,,,,,,,,,,,,,,,,,,,,"NA NA","NA NA","NA NA NA NA NA NA NA NA","https://twitter.com/matteosalvinimi/status/1468350577180610567","Matteo Salvini","","Leader della Lega #primagliitaliani 🇮🇹","https://t.co/sj3rr6DU3N",FALSE,1429495,2029,3053,52256,3850,2011-03-23 10:32:56,TRUE,"https://t.co/sj3rr6DU3N","https://legaonline.it/",,"https://pbs.twimg.com/profile_banners/270839361/1635585626","http://abs.twimg.com/images/themes/theme1/bg.png","http://pbs.twimg.com/profile_images/966325945060732928/0Ua5xPMX_normal.jpg"
"x270839361","x1468323423407513605",2021-12-07 20:55:58,"matteosalvinimi","Grazie alle forze dell’ordine, buon lavoro alla magistratura, un abbraccio ai grandi imprenditori che danno lustro all’Italia e non si piegano ai ricatti.","Twitter for iPhone",154,"x1468323421339664385","x270839361","matteosalvinimi",FALSE,FALSE,134,13,,,,,,,,,,,,,,,,,,"it",,,,,,,,,,,,,,,,,,,,,,,,,,,,,,,,,,,,,"NA NA","NA NA","NA NA NA NA NA NA NA NA","https://twitter.com/matteosalvinimi/status/1468323423407513605","Matteo Salvini","","Leader della Lega #primagliitaliani 🇮🇹","https://t.co/sj3rr6DU3N",FALSE,1429495,2029,3053,52256,3850,2011-03-23 10:32:56,TRUE,"https://t.co/sj3rr6DU3N","https://legaonline.it/",,"https://pbs.twimg.com/profile_banners/270839361/1635585626","http://abs.twimg.com/images/themes/theme1/bg.png","http://pbs.twimg.com/profile_images/966325945060732928/0Ua5xPMX_normal.jpg"
"x270839361","x1468323421339664385",2021-12-07 20:55:58,"matteosalvinimi","Per l’accusa, ha cercato di estorcere denaro alla famiglia Loro Piana (a cui va la mia solidarietà): un funzionario dell’Agenzia delle Entrate è finito nei guai. Che vergogna. https://t.co/zJONsa66Eu","Twitter for iPhone",175,,,,FALSE,FALSE,180,28,,,,,,,,"http://pbs.twimg.com/media/FGCIXkLXMAceEbG.jpg","https://t.co/zJONsa66Eu","https://twitter.com/matteosalvinimi/status/1468323421339664385/photo/1","photo","http://pbs.twimg.com/media/FGCIXkLXMAceEbG.jpg","https://t.co/zJONsa66Eu","https://twitter.com/matteosalvinimi/status/1468323421339664385/photo/1",,,,"it",,,,,,,,,,,,,,,,,,,,,,,,,,,,,,,,,,,,,"NA NA","NA NA","NA NA NA NA NA NA NA NA","https://twitter.com/matteosalvinimi/status/1468323421339664385","Matteo Salvini","","Leader della Lega #primagliitaliani 🇮🇹","https://t.co/sj3rr6DU3N",FALSE,1429495,2029,3053,52256,3850,2011-03-23 10:32:56,TRUE,"https://t.co/sj3rr6DU3N","https://legaonline.it/",,"https://pbs.twimg.com/profile_banners/270839361/1635585626","http://abs.twimg.com/images/themes/theme1/bg.png","http://pbs.twimg.com/profile_images/966325945060732928/0Ua5xPMX_normal.jpg"
"x270839361","x1468300866402799624",2021-12-07 19:26:20,"matteosalvinimi","Ministra e benpensanti, dove siete??? https://t.co/OuARBfTlG2","Twitter Web App",37,,,,FALSE,FALSE,547,83,,,,,,,,"http://pbs.twimg.com/media/FGBzzhMXoAUhcjw.jpg","https://t.co/OuARBfTlG2","https://twitter.com/matteosalvinimi/status/1468300866402799624/photo/1","photo","http://pbs.twimg.com/media/FGBzzhMXoAUhcjw.jpg","https://t.co/OuARBfTlG2","https://twitter.com/matteosalvinimi/status/1468300866402799624/photo/1",,,,"it",,,,,,,,,,,,,,,,,,,,,,,,,,,,,,,,,,,,,"NA NA","NA NA","NA NA NA NA NA NA NA NA","https://twitter.com/matteosalvinimi/status/1468300866402799624","Matteo Salvini","","Leader della Lega #primagliitaliani 🇮🇹","https://t.co/sj3rr6DU3N",FALSE,1429495,2029,3053,52256,3850,2011-03-23 10:32:56,TRUE,"https://t.co/sj3rr6DU3N","https://legaonline.it/",,"https://pbs.twimg.com/profile_banners/270839361/1635585626","http://abs.twimg.com/images/themes/theme1/bg.png","http://pbs.twimg.com/profile_images/966325945060732928/0Ua5xPMX_normal.jpg"
"x270839361","x1468288735750012934",2021-12-07 18:38:08,"matteosalvinimi","Perfino la Commissione UE dà il via libera al nucleare pulito e sicuro come energia del futuro, ora tocca a noi! https://t.co/GwpWl5f0ym","Twitter Web App",112,,,,FALSE,FALSE,300,40,,,,,,,,"http://pbs.twimg.com/media/FGBoXRTWUAIRSLk.jpg","https://t.co/GwpWl5f0ym","https://twitter.com/matteosalvinimi/status/1468288735750012934/photo/1","photo","http://pbs.twimg.com/media/FGBoXRTWUAIRSLk.jpg","https://t.co/GwpWl5f0ym","https://twitter.com/matteosalvinimi/status/1468288735750012934/photo/1",,,,"it",,,,,,,,,,,,,,,,,,,,,,,,,,,,,,,,,,,,,"NA NA","NA NA","NA NA NA NA NA NA NA NA","https://twitter.com/matteosalvinimi/status/1468288735750012934","Matteo Salvini","","Leader della Lega #primagliitaliani 🇮🇹","https://t.co/sj3rr6DU3N",FALSE,1429495,2029,3053,52256,3850,2011-03-23 10:32:56,TRUE,"https://t.co/sj3rr6DU3N","https://legaonline.it/",,"https://pbs.twimg.com/profile_banners/270839361/1635585626","http://abs.twimg.com/images/themes/theme1/bg.png","http://pbs.twimg.com/profile_images/966325945060732928/0Ua5xPMX_normal.jpg"
"x270839361","x1468271381267820550",2021-12-07 17:29:11,"matteosalvinimi","Alla tristezza di questo signore rispondo augurandogli buon Sant’Ambrogio e buon Santo Natale!","Twitter Web App",94,"x1468271378776399873","x270839361","matteosalvinimi",FALSE,FALSE,306,20,,,,,,,,,,,,,,,,,,"it",,,,,,,,,,,,,,,,,,,,,,,,,,,,,,,,,,,,,"NA NA","NA NA","NA NA NA NA NA NA NA NA","https://twitter.com/matteosalvinimi/status/1468271381267820550","Matteo Salvini","","Leader della Lega #primagliitaliani 🇮🇹","https://t.co/sj3rr6DU3N",FALSE,1429495,2029,3053,52256,3850,2011-03-23 10:32:56,TRUE,"https://t.co/sj3rr6DU3N","https://legaonline.it/",,"https://pbs.twimg.com/profile_banners/270839361/1635585626","http://abs.twimg.com/images/themes/theme1/bg.png","http://pbs.twimg.com/profile_images/966325945060732928/0Ua5xPMX_normal.jpg"
"x270839361","x1468271378776399873",2021-12-07 17:29:10,"matteosalvinimi","Quel galantuomo di Saviano mi attacca dicendo che fra Gesù ed Erode avrei parteggiato per il secondo (battuta da asilo nido) e aggiungendo che “Gesù è nato da due profughi”, anzi da due “clandestini”. https://t.co/qKHB7rwqU6","Twitter Web App",200,,,,FALSE,FALSE,448,68,,,,,,,,"http://pbs.twimg.com/media/FGBZABdWYAU5Hgy.jpg","https://t.co/qKHB7rwqU6","https://twitter.com/matteosalvinimi/status/1468271378776399873/photo/1","photo","http://pbs.twimg.com/media/FGBZABdWYAU5Hgy.jpg","https://t.co/qKHB7rwqU6","https://twitter.com/matteosalvinimi/status/1468271378776399873/photo/1",,,,"it",,,,,,,,,,,,,,,,,,,,,,,,,,,,,,,,,,,,,"NA NA","NA NA","NA NA NA NA NA NA NA NA","https://twitter.com/matteosalvinimi/status/1468271378776399873","Matteo Salvini","","Leader della Lega #primagliitaliani 🇮🇹","https://t.co/sj3rr6DU3N",FALSE,1429495,2029,3053,52256,3850,2011-03-23 10:32:56,TRUE,"https://t.co/sj3rr6DU3N","https://legaonline.it/",,"https://pbs.twimg.com/profile_banners/270839361/1635585626","http://abs.twimg.com/images/themes/theme1/bg.png","http://pbs.twimg.com/profile_images/966325945060732928/0Ua5xPMX_normal.jpg"
"x270839361","x1468194771139239938",2021-12-07 12:24:45,"matteosalvinimi","Morire così, senza un motivo, per una “prova di forza” fra gang. Una preghiera per Davide e l’impegno perché non accada più. https://t.co/LvqspswwIO","Twitter for iPhone",124,,,,FALSE,FALSE,540,82,,,,,,,,"http://pbs.twimg.com/media/FGATXHyXMAIHUB6.jpg","https://t.co/LvqspswwIO","https://twitter.com/matteosalvinimi/status/1468194771139239938/photo/1","photo","http://pbs.twimg.com/media/FGATXHyXMAIHUB6.jpg","https://t.co/LvqspswwIO","https://twitter.com/matteosalvinimi/status/1468194771139239938/photo/1",,,,"it",,,,,,,,,,,,,,,,,,,,,,,,,,,,,,,,,,,,,"NA NA","NA NA","NA NA NA NA NA NA NA NA","https://twitter.com/matteosalvinimi/status/1468194771139239938","Matteo Salvini","","Leader della Lega #primagliitaliani 🇮🇹","https://t.co/sj3rr6DU3N",FALSE,1429495,2029,3053,52256,3850,2011-03-23 10:32:56,TRUE,"https://t.co/sj3rr6DU3N","https://legaonline.it/",,"https://pbs.twimg.com/profile_banners/270839361/1635585626","http://abs.twimg.com/images/themes/theme1/bg.png","http://pbs.twimg.com/profile_images/966325945060732928/0Ua5xPMX_normal.jpg"
"x48062712","x1468542015608692742",2021-12-08 11:24:35,"luigidimaio","A conclusione 2a ministeriale Italia-Asia centrale, il Min @luigidimaio ha dato appuntamento alla prossima edizione in Italia. Valorizzata importanza cooperazione🇮🇹 con i paesi dell'area, interlocutori privilegiati dal dialogo politico alla coop. economica, culturale e sanitaria. https://t.co/qjIjedwEzp","Twitter for iPhone",140,,,,FALSE,TRUE,0,4,,,,,,,,,,,,,,,,"x599114492 x48062712","ItalyMFA luigidimaio","it",,,,,,,,,,,,,,,,"x1468536797286305794","A conclusione 2a ministeriale Italia-Asia centrale, il Min @luigidimaio ha dato appuntamento alla prossima edizione in Italia. Valorizzata importanza cooperazione🇮🇹 con i paesi dell'area, interlocutori privilegiati dal dialogo politico alla coop. economica, culturale e sanitaria. https://t.co/qjIjedwEzp",2021-12-08 11:03:51,"Twitter for iPhone",17,4,"x599114492","ItalyMFA","Farnesina 🇮🇹",243186,949,15052,"Roma, Italia","Profilo ufficiale del Ministero degli Affari Esteri e della Cooperazione Internazionale | Ministry of Foreign Affairs and International Cooperation of Italy",TRUE,,,,,,,"NA NA","NA NA","NA NA NA NA NA NA NA NA","https://twitter.com/luigidimaio/status/1468542015608692742","Luigi Di Maio","Pomigliano d'Arco, Campania","Ministro degli Affari Esteri e della Cooperazione Internazionale.","https://t.co/D8gkagqksG",FALSE,742213,349,2123,6778,344,2009-06-17 18:34:46,TRUE,"https://t.co/D8gkagqksG","http://www.luigidimaio.it",,"https://pbs.twimg.com/profile_banners/48062712/1634667505","http://abs.twimg.com/images/themes/theme1/bg.png","http://pbs.twimg.com/profile_images/933106806670462976/YyC7LOW8_normal.jpg"
"x48062712","x1468540077374676993",2021-12-08 11:16:53,"luigidimaio","A margine della riunione ministeriale Italia-Asia centrale, il Min @luigidimaio ha incontrato il Ministro degli Affari Esteri della Repubblica del Tagikistan, Siridjiddin Muhriddin. Rapporti bilaterali 🇮🇹🇹🇯, rilancio del partenariato economico e Afghanistan. @ItalyinUZB","Twitter for iPhone",140,,,,FALSE,TRUE,0,5,,,,,,,,,,,,,,,,"x599114492 x48062712","ItalyMFA luigidimaio","it",,,,,,,,,,,,,,,,"x1468531003547430924","A margine della riunione ministeriale Italia-Asia centrale, il Min @luigidimaio ha incontrato il Ministro degli Affari Esteri della Repubblica del Tagikistan, Siridjiddin Muhriddin. Rapporti bilaterali 🇮🇹🇹🇯, rilancio del partenariato economico e Afghanistan. @ItalyinUZB",2021-12-08 10:40:49,"Twitter for iPhone",9,5,"x599114492","ItalyMFA","Farnesina 🇮🇹",243186,949,15052,"Roma, Italia","Profilo ufficiale del Ministero degli Affari Esteri e della Cooperazione Internazionale | Ministry of Foreign Affairs and International Cooperation of Italy",TRUE,,,,,,,"NA NA","NA NA","NA NA NA NA NA NA NA NA","https://twitter.com/luigidimaio/status/1468540077374676993","Luigi Di Maio","Pomigliano d'Arco, Campania","Ministro degli Affari Esteri e della Cooperazione Internazionale.","https://t.co/D8gkagqksG",FALSE,742213,349,2123,6778,344,2009-06-17 18:34:46,TRUE,"https://t.co/D8gkagqksG","http://www.luigidimaio.it",,"https://pbs.twimg.com/profile_banners/48062712/1634667505","http://abs.twimg.com/images/themes/theme1/bg.png","http://pbs.twimg.com/profile_images/933106806670462976/YyC7LOW8_normal.jpg"
"x48062712","x1468519245273341954",2021-12-08 09:54:06,"luigidimaio","A margine della riunione ministeriale Italia-Asia centrale il Min @luigidimaio ha incontrato il suo omologo kirghiso, @Kazakbaev_R. Focus su rapporti bilaterali🇮🇹🇰🇬 e situazione nella regione centrasiatica, con particolare riferimento all’Afghanistan. https://t.co/sXIaRHmR1I","Twitter for iPhone",140,,,,FALSE,TRUE,0,5,,,,,,,,,,,,,,,,"x599114492 x48062712","ItalyMFA luigidimaio","it",,,,,,,,,,,,,,,,"x1468519140411547650","A margine della riunione ministeriale Italia-Asia centrale il Min @luigidimaio ha incontrato il suo omologo kirghiso, @Kazakbaev_R. Focus su rapporti bilaterali🇮🇹🇰🇬 e situazione nella regione centrasiatica, con particolare riferimento all’Afghanistan. https://t.co/sXIaRHmR1I",2021-12-08 09:53:41,"Twitter for iPhone",33,5,"x599114492","ItalyMFA","Farnesina 🇮🇹",243186,949,15052,"Roma, Italia","Profilo ufficiale del Ministero degli Affari Esteri e della Cooperazione Internazionale | Ministry of Foreign Affairs and International Cooperation of Italy",TRUE,,,,,,,"NA NA","NA NA","NA NA NA NA NA NA NA NA","https://twitter.com/luigidimaio/status/1468519245273341954","Luigi Di Maio","Pomigliano d'Arco, Campania","Ministro degli Affari Esteri e della Cooperazione Internazionale.","https://t.co/D8gkagqksG",FALSE,742213,349,2123,6778,344,2009-06-17 18:34:46,TRUE,"https://t.co/D8gkagqksG","http://www.luigidimaio.it",,"https://pbs.twimg.com/profile_banners/48062712/1634667505","http://abs.twimg.com/images/themes/theme1/bg.png","http://pbs.twimg.com/profile_images/933106806670462976/YyC7LOW8_normal.jpg"
"x48062712","x1468511969837826049",2021-12-08 09:25:11,"luigidimaio","A margine della riunione ministeriale Italia-Asia centrale, il Min @luigidimaio ha incontrato il Vice Primo Ministro e Min Affari Esteri della Rep del Kazakhstan, Mukhtar Tileuberdi. Rapporti politici, economici e culturali 🇮🇹🇰🇿 e situazione in Afghanistan. https://t.co/agomJa7IyC","Twitter for iPhone",140,,,,FALSE,TRUE,0,4,,,,,,,,,,,,,,,,"x599114492 x48062712","ItalyMFA luigidimaio","it",,,,,,,,,,,,,,,,"x1468509583836602372","A margine della riunione ministeriale Italia-Asia centrale, il Min @luigidimaio ha incontrato il Vice Primo Ministro e Min Affari Esteri della Rep del Kazakhstan, Mukhtar Tileuberdi. Rapporti politici, economici e culturali 🇮🇹🇰🇿 e situazione in Afghanistan. https://t.co/agomJa7IyC",2021-12-08 09:15:43,"Twitter for iPhone",31,4,"x599114492","ItalyMFA","Farnesina 🇮🇹",243186,949,15052,"Roma, Italia","Profilo ufficiale del Ministero degli Affari Esteri e della Cooperazione Internazionale | Ministry of Foreign Affairs and International Cooperation of Italy",TRUE,,,,,,,"NA NA","NA NA","NA NA NA NA NA NA NA NA","https://twitter.com/luigidimaio/status/1468511969837826049","Luigi Di Maio","Pomigliano d'Arco, Campania","Ministro degli Affari Esteri e della Cooperazione Internazionale.","https://t.co/D8gkagqksG",FALSE,742213,349,2123,6778,344,2009-06-17 18:34:46,TRUE,"https://t.co/D8gkagqksG","http://www.luigidimaio.it",,"https://pbs.twimg.com/profile_banners/48062712/1634667505","http://abs.twimg.com/images/themes/theme1/bg.png","http://pbs.twimg.com/profile_images/933106806670462976/YyC7LOW8_normal.jpg"
"x48062712","x1468511895795781636",2021-12-08 09:24:54,"luigidimaio","A margine della riunione ministeriale IT-Asia centrale il Min @luigidimaio ha incontrato il suo omologo uzbeko, Abdulaziz Kamilov. Rapporti bil 🇮🇹🇺🇿 e Afghanistan. Sostegno 🇮🇹 a progressiva integrazione 🇺🇿 nelle principali organizzazioni internazionali e regionali. @ItalyinUZB https://t.co/GWxaAV1nHl","Twitter for iPhone",140,,,,FALSE,TRUE,0,5,,,,,,,,,,,,,,,,"x599114492 x48062712","ItalyMFA luigidimaio","it",,,,,,,,,,,,,,,,"x1468503982545031170","A margine della riunione ministeriale IT-Asia centrale il Min @luigidimaio ha incontrato il suo omologo uzbeko, Abdulaziz Kamilov. Rapporti bil 🇮🇹🇺🇿 e Afghanistan. Sostegno 🇮🇹 a progressiva integrazione 🇺🇿 nelle principali organizzazioni internazionali e regionali. @ItalyinUZB https://t.co/GWxaAV1nHl",2021-12-08 08:53:27,"Twitter Web App",21,5,"x599114492","ItalyMFA","Farnesina 🇮🇹",243186,949,15052,"Roma, Italia","Profilo ufficiale del Ministero degli Affari Esteri e della Cooperazione Internazionale | Ministry of Foreign Affairs and International Cooperation of Italy",TRUE,,,,,,,"NA NA","NA NA","NA NA NA NA NA NA NA NA","https://twitter.com/luigidimaio/status/1468511895795781636","Luigi Di Maio","Pomigliano d'Arco, Campania","Ministro degli Affari Esteri e della Cooperazione Internazionale.","https://t.co/D8gkagqksG",FALSE,742213,349,2123,6778,344,2009-06-17 18:34:46,TRUE,"https://t.co/D8gkagqksG","http://www.luigidimaio.it",,"https://pbs.twimg.com/profile_banners/48062712/1634667505","http://abs.twimg.com/images/themes/theme1/bg.png","http://pbs.twimg.com/profile_images/933106806670462976/YyC7LOW8_normal.jpg"
"x48062712","x1468511502067982338",2021-12-08 09:23:20,"luigidimaio","Il Min @luigidimaio introduce i lavori della seconda riunione ministeriale Italia-Asia centrale. Espresso auspicio rafforzamento della collaborazione tra 🇮🇹 e i paesi della regione e individuazione risposte condivise alle sfide comuni che interessano i nostri Paesi. @ItalyinUZB https://t.co/XvWmrj6POl","Twitter for iPhone",140,,,,FALSE,TRUE,0,10,,,,,,,,,,,,,,,,"x599114492 x48062712","ItalyMFA luigidimaio","it",,,,,,,,,,,,,,,,"x1468497176368197632","Il Min @luigidimaio introduce i lavori della seconda riunione ministeriale Italia-Asia centrale. Espresso auspicio rafforzamento della collaborazione tra 🇮🇹 e i paesi della regione e individuazione risposte condivise alle sfide comuni che interessano i nostri Paesi. @ItalyinUZB https://t.co/XvWmrj6POl",2021-12-08 08:26:24,"Twitter Web App",41,10,"x599114492","ItalyMFA","Farnesina 🇮🇹",243186,949,15052,"Roma, Italia","Profilo ufficiale del Ministero degli Affari Esteri e della Cooperazione Internazionale | Ministry of Foreign Affairs and International Cooperation of Italy",TRUE,,,,,,,"NA NA","NA NA","NA NA NA NA NA NA NA NA","https://twitter.com/luigidimaio/status/1468511502067982338","Luigi Di Maio","Pomigliano d'Arco, Campania","Ministro degli Affari Esteri e della Cooperazione Internazionale.","https://t.co/D8gkagqksG",FALSE,742213,349,2123,6778,344,2009-06-17 18:34:46,TRUE,"https://t.co/D8gkagqksG","http://www.luigidimaio.it",,"https://pbs.twimg.com/profile_banners/48062712/1634667505","http://abs.twimg.com/images/themes/theme1/bg.png","http://pbs.twimg.com/profile_images/933106806670462976/YyC7LOW8_normal.jpg"
"x48062712","x1468304858109431808",2021-12-07 19:42:12,"luigidimaio","Il Min. @luigidimaio è in missione a Tashkent per co-presiedere insieme all’omologo uzbeko, Abdulaziz Kamilov, la seconda riunione ministeriale Italia-Asia centrale nel formato 🇮🇹 + 🇰🇿 🇰🇬 🇹🇯 🇹🇲 🇺🇿 https://t.co/f0K8vXJEAQ","Twitter for iPhone",140,,,,FALSE,TRUE,0,12,,,,,,,,,,,,,,,,"x599114492 x48062712","ItalyMFA luigidimaio","it",,,,,,,,,,,,,,,,"x1468294570672893953","Il Min. @luigidimaio è in missione a Tashkent per co-presiedere insieme all’omologo uzbeko, Abdulaziz Kamilov, la seconda riunione ministeriale Italia-Asia centrale nel formato 🇮🇹 + 🇰🇿 🇰🇬 🇹🇯 🇹🇲 🇺🇿 https://t.co/f0K8vXJEAQ",2021-12-07 19:01:19,"Twitter Web App",66,12,"x599114492","ItalyMFA","Farnesina 🇮🇹",243186,949,15052,"Roma, Italia","Profilo ufficiale del Ministero degli Affari Esteri e della Cooperazione Internazionale | Ministry of Foreign Affairs and International Cooperation of Italy",TRUE,,,,,,,"NA NA","NA NA","NA NA NA NA NA NA NA NA","https://twitter.com/luigidimaio/status/1468304858109431808","Luigi Di Maio","Pomigliano d'Arco, Campania","Ministro degli Affari Esteri e della Cooperazione Internazionale.","https://t.co/D8gkagqksG",FALSE,742213,349,2123,6778,344,2009-06-17 18:34:46,TRUE,"https://t.co/D8gkagqksG","http://www.luigidimaio.it",,"https://pbs.twimg.com/profile_banners/48062712/1634667505","http://abs.twimg.com/images/themes/theme1/bg.png","http://pbs.twimg.com/profile_images/933106806670462976/YyC7LOW8_normal.jpg"
"x48062712","x1468184878592180227",2021-12-07 11:45:27,"luigidimaio","Primo obiettivo raggiunto: Patrick Zaki non è più in carcere. 
Adesso continuiamo a lavorare silenziosamente, con costanza e impegno. 
Un doveroso ringraziamento al nostro corpo diplomatico.","Twitter for iPhone",190,,,,FALSE,FALSE,940,157,,,,,,,,,,,,,,,,,,"it",,,,,,,,,,,,,,,,,,,,,,,,,,,,,,,,,,,,,"NA NA","NA NA","NA NA NA NA NA NA NA NA","https://twitter.com/luigidimaio/status/1468184878592180227","Luigi Di Maio","Pomigliano d'Arco, Campania","Ministro degli Affari Esteri e della Cooperazione Internazionale.","https://t.co/D8gkagqksG",FALSE,742213,349,2123,6778,344,2009-06-17 18:34:46,TRUE,"https://t.co/D8gkagqksG","http://www.luigidimaio.it",,"https://pbs.twimg.com/profile_banners/48062712/1634667505","http://abs.twimg.com/images/themes/theme1/bg.png","http://pbs.twimg.com/profile_images/933106806670462976/YyC7LOW8_normal.jpg"
"x997531966571466752","x1468325855302754305",2021-12-07 21:05:38,"Pres_Casellati","La Prima della Scala suscita sempre grandi emozioni, ma oggi, con il ritorno del pubblico, ha un valore speciale: quello di un nuovo inizio, per chi vive di arte, cultura e bellezza e per tutti gli Italiani🎼. #PrimaScala #Macbeth #7Dicembre @teatroallascala https://t.co/Rvz0Bx93ze","Twitter for iPhone",257,,,,FALSE,FALSE,63,12,,,"PrimaScala Macbeth 7Dicembre",,,,,"http://pbs.twimg.com/media/FGCKlKrXwAAF21y.jpg","https://t.co/Rvz0Bx93ze","https://twitter.com/Pres_Casellati/status/1468325855302754305/photo/1","photo","http://pbs.twimg.com/media/FGCKlKrXwAAF21y.jpg http://pbs.twimg.com/media/FGCKlKsWUAAA_2I.jpg http://pbs.twimg.com/media/FGCKlKrXMAQY7gv.jpg http://pbs.twimg.com/media/FGCKlK3XsAgnvWz.jpg","https://t.co/Rvz0Bx93ze https://t.co/Rvz0Bx93ze https://t.co/Rvz0Bx93ze https://t.co/Rvz0Bx93ze","https://twitter.com/Pres_Casellati/status/1468325855302754305/photo/1 https://twitter.com/Pres_Casellati/status/1468325855302754305/photo/1 https://twitter.com/Pres_Casellati/status/1468325855302754305/photo/1 https://twitter.com/Pres_Casellati/status/1468325855302754305/photo/1",,"x397383380","teatroallascala","it",,,,,,,,,,,,,,,,,,,,,,,,,,,,,,,,,,,,,"NA NA","NA NA","NA NA NA NA NA NA NA NA","https://twitter.com/Pres_Casellati/status/1468325855302754305","Maria Elisabetta Alberti Casellati","Roma, Lazio","Presidente del Senato della Repubblica","https://t.co/4xFh9XyLXO",FALSE,13981,515,100,1143,61,2018-05-18 17:38:48,TRUE,"https://t.co/4xFh9XyLXO","https://www.facebook.com/elisabetta.casellati.7",,"https://pbs.twimg.com/profile_banners/997531966571466752/1526665561","http://abs.twimg.com/images/themes/theme1/bg.png","http://pbs.twimg.com/profile_images/997533290520195072/YmnjBO3X_normal.jpg"
