"x295754318","x1466063576079163396",2021-12-01 15:16:09,"DarioStefano","Sono d’accordo con @EnricoLetta quando dice che il @pdnetwork dev’essere il perno di un campo largo. Ma se questo è l’obiettivo, perché non esserlo anche in #Puglia dove il Pd sembra invece a servizio del disegno egemonico di civismo trasversale di #Emiliano?","Twitter for iPhone",259,,,,FALSE,FALSE,26,4,,,"Puglia Emiliano",,,,,,,,,,,,,"x419622371 x13294452","EnricoLetta pdnetwork","it",,,,,,,,,,,,,,,,,,,,,,,,,,,,,,,,,,,,,"NA NA","NA NA","NA NA NA NA NA NA NA NA","https://twitter.com/DarioStefano/status/1466063576079163396","Dario Stefàno","Lecce - Roma","Presidente Commissione Affari Europei del Senato, componente direzione nazionale Pd. Senatore per la Puglia.","https://t.co/6Ma8FQ2yyO",FALSE,6465,876,98,9446,3308,2011-05-09 16:19:05,TRUE,"https://t.co/6Ma8FQ2yyO","http://www.dariostefano.it",,"https://pbs.twimg.com/profile_banners/295754318/1591176697","http://abs.twimg.com/images/themes/theme1/bg.png","http://pbs.twimg.com/profile_images/1126781188742492161/7B6yfQem_normal.png"
"x1092227216145027072","x1465961849657167874",2021-12-01 08:31:55,"TrentacosteM5S","Approvato in commissione Finanze al Senato il mio emendamento al decreto Fiscale per permettere agli invalidi parziali che lavorano di continuare a ricevere l’assegno alle condizioni di sempre. Un impegno che io e tutto il M5S avevamo preso e che abbiamo onorato. Avanti così.","Twitter for Android",140,,,,FALSE,TRUE,0,59,,,,,,,,,,,,,,,,"x572128310","CatalfoNunzia","it",,,,,,,,,,,,,,,,"x1465798981745889289","Approvato in commissione Finanze al Senato il mio emendamento al decreto Fiscale per permettere agli invalidi parziali che lavorano di continuare a ricevere l’assegno alle condizioni di sempre. Un impegno che io e tutto il M5S avevamo preso e che abbiamo onorato. Avanti così.",2021-11-30 21:44:45,"Twitter for iPhone",167,59,"x572128310","CatalfoNunzia","Nunzia Catalfo",22851,686,7449,"Catania, Sicilia","Senatrice del MoVimento 5 Stelle. Già Ministro del Lavoro e delle Politiche Sociali",TRUE,,,,,,,"NA NA","NA NA","NA NA NA NA NA NA NA NA","https://twitter.com/TrentacosteM5S/status/1465961849657167874","Fabrizio Trentacoste","Enna, Sicilia","Portavoce del MoVimento 5 Stelle eletto al Senato","https://t.co/QyXaiSTYTX",FALSE,121,59,3,25,339,2019-02-04 01:03:55,FALSE,"https://t.co/QyXaiSTYTX","https://www.ilblogdellestelle.it/",,,,"http://pbs.twimg.com/profile_images/1135936025191165953/RSjMHBO8_normal.jpg"
"x960631114233712650","x1466072599457374220",2021-12-01 15:52:00,"avvocato_urraro","https://t.co/imrFWyZLZr","Twitter for iPhone",0,,,,FALSE,FALSE,0,0,,,,,,,,"http://pbs.twimg.com/media/FFiJQdEXEAkwJn7.jpg","https://t.co/imrFWyZLZr","https://twitter.com/avvocato_urraro/status/1466072599457374220/photo/1","photo","http://pbs.twimg.com/media/FFiJQdEXEAkwJn7.jpg","https://t.co/imrFWyZLZr","https://twitter.com/avvocato_urraro/status/1466072599457374220/photo/1",,,,"und",,,,,,,,,,,,,,,,,,,,,,,,,,,,,,,,,,,,,"NA NA","NA NA","NA NA NA NA NA NA NA NA","https://twitter.com/avvocato_urraro/status/1466072599457374220","Francesco Urraro","","Avvocato, Senatore della Repubblica","https://t.co/ty4EsXbIYF",FALSE,751,1921,16,2111,253,2018-02-05 21:48:00,TRUE,"https://t.co/ty4EsXbIYF","http://www.senato.it/leg/18/BGT/Schede/Attsen/00032728.htm",,"https://pbs.twimg.com/profile_banners/960631114233712650/1543947300",,"http://pbs.twimg.com/profile_images/1113853247482224640/yQn0Unc3_normal.jpg"
"x960631114233712650","x1466026885293481986",2021-12-01 12:50:21,"avvocato_urraro","🔵 La #DisabilityCard va a sostituire tutti i certificati cartacei, portando semplificazione, sburocratizzazione e digitalizzazione anche nella vita delle persone disabili che più di altre la burocrazia. D'ora in poi, sarà sufficiente mostrare la… https://t.co/GiIVabQ6RJ https://t.co/OsZS5iamJG","Twitter for iPhone",140,,,,FALSE,TRUE,0,2,,,"DisabilityCard",,,,,,,,,,,,,"x2362890141","erikastefani71","it",,,,,,,,,,,,,,,,"x1466024298175414272","🔵 La #DisabilityCard va a sostituire tutti i certificati cartacei, portando semplificazione, sburocratizzazione e digitalizzazione anche nella vita delle persone disabili che più di altre la burocrazia. D'ora in poi, sarà sufficiente mostrare la… https://t.co/GiIVabQ6RJ https://t.co/OsZS5iamJG",2021-12-01 12:40:04,"Erika Stefani App",6,2,"x2362890141","erikastefani71","Erika Stefani ",4871,139,1038,"","Ministro per le Disabilità e senatore Lega Salvini Premier",FALSE,,,,,,,"NA NA","NA NA","NA NA NA NA NA NA NA NA","https://twitter.com/avvocato_urraro/status/1466026885293481986","Francesco Urraro","","Avvocato, Senatore della Repubblica","https://t.co/ty4EsXbIYF",FALSE,751,1921,16,2111,253,2018-02-05 21:48:00,TRUE,"https://t.co/ty4EsXbIYF","http://www.senato.it/leg/18/BGT/Schede/Attsen/00032728.htm",,"https://pbs.twimg.com/profile_banners/960631114233712650/1543947300",,"http://pbs.twimg.com/profile_images/1113853247482224640/yQn0Unc3_normal.jpg"
"x960631114233712650","x1466014439883345922",2021-12-01 12:00:54,"avvocato_urraro","Presentata questa mattina dal Ministro Erika Stefani la #DisabilityCard, la tessera che permetterà un più facile accesso alle persone con disabilità ai servizi, in regime di reciprocità con gli altri Paesi della Ue, contribuendo alla loro piena inclusione nella vita sociale https://t.co/GpcXtnDOHe","Twitter for iPhone",274,,,,FALSE,FALSE,0,0,,,"DisabilityCard",,,,,"http://pbs.twimg.com/media/FFhUXHOXwAghztS.jpg","https://t.co/GpcXtnDOHe","https://twitter.com/avvocato_urraro/status/1466014439883345922/photo/1","photo","http://pbs.twimg.com/media/FFhUXHOXwAghztS.jpg http://pbs.twimg.com/media/FFhUXHOWQAAHKAL.jpg","https://t.co/GpcXtnDOHe https://t.co/GpcXtnDOHe","https://twitter.com/avvocato_urraro/status/1466014439883345922/photo/1 https://twitter.com/avvocato_urraro/status/1466014439883345922/photo/1",,,,"it",,,,,,,,,,,,,,,,,,,,,,,,,,,,,,,,,,,,,"NA NA","NA NA","NA NA NA NA NA NA NA NA","https://twitter.com/avvocato_urraro/status/1466014439883345922","Francesco Urraro","","Avvocato, Senatore della Repubblica","https://t.co/ty4EsXbIYF",FALSE,751,1921,16,2111,253,2018-02-05 21:48:00,TRUE,"https://t.co/ty4EsXbIYF","http://www.senato.it/leg/18/BGT/Schede/Attsen/00032728.htm",,"https://pbs.twimg.com/profile_banners/960631114233712650/1543947300",,"http://pbs.twimg.com/profile_images/1113853247482224640/yQn0Unc3_normal.jpg"
"x960631114233712650","x1465960090847125507",2021-12-01 08:24:56,"avvocato_urraro","https://t.co/1Sk40fALPj","Twitter for iPhone",23,,,,FALSE,FALSE,0,0,,,,,"mise.gov.it/index.php/it/i…","https://t.co/1Sk40fALPj","https://www.mise.gov.it/index.php/it/incentivi/impresa/fondo-per-il-sostegno-delle-attivita-economiche-chiuse?apertura&fbclid=IwAR33TP4kiwsurixZ2roLzUyhie2d-fI5Ael1neE_jn3vaUbSb03nKwajlyg",,,,,,,,,,,"und",,,,,,,,,,,,,,,,,,,,,,,,,,,,,,,,,,,,,"NA NA","NA NA","NA NA NA NA NA NA NA NA","https://twitter.com/avvocato_urraro/status/1465960090847125507","Francesco Urraro","","Avvocato, Senatore della Repubblica","https://t.co/ty4EsXbIYF",FALSE,751,1921,16,2111,253,2018-02-05 21:48:00,TRUE,"https://t.co/ty4EsXbIYF","http://www.senato.it/leg/18/BGT/Schede/Attsen/00032728.htm",,"https://pbs.twimg.com/profile_banners/960631114233712650/1543947300",,"http://pbs.twimg.com/profile_images/1113853247482224640/yQn0Unc3_normal.jpg"
"x960631114233712650","x1465944485255389185",2021-12-01 07:22:55,"avvocato_urraro","https://t.co/ypa0I8HspT","Twitter for iPhone",0,,,,FALSE,FALSE,0,0,,,,,,,,"http://pbs.twimg.com/media/FFgUvT5XIAA0Bpd.jpg","https://t.co/ypa0I8HspT","https://twitter.com/avvocato_urraro/status/1465944485255389185/photo/1","photo","http://pbs.twimg.com/media/FFgUvT5XIAA0Bpd.jpg","https://t.co/ypa0I8HspT","https://twitter.com/avvocato_urraro/status/1465944485255389185/photo/1",,,,"und",,,,,,,,,,,,,,,,,,,,,,,,,,,,,,,,,,,,,"NA NA","NA NA","NA NA NA NA NA NA NA NA","https://twitter.com/avvocato_urraro/status/1465944485255389185","Francesco Urraro","","Avvocato, Senatore della Repubblica","https://t.co/ty4EsXbIYF",FALSE,751,1921,16,2111,253,2018-02-05 21:48:00,TRUE,"https://t.co/ty4EsXbIYF","http://www.senato.it/leg/18/BGT/Schede/Attsen/00032728.htm",,"https://pbs.twimg.com/profile_banners/960631114233712650/1543947300",,"http://pbs.twimg.com/profile_images/1113853247482224640/yQn0Unc3_normal.jpg"
"x960631114233712650","x1465781576462213139",2021-11-30 20:35:35,"avvocato_urraro","Domani la presentazione, con il Ministro per le Disabilità Stefani, della Disability Card, la tessera che permetterà un più facile accesso alle persone con disabilità ai servizi e la riduzione della burocrazia in regime di reciprocità con gli altri Paesi della UE https://t.co/mLrDJfg3KL","Twitter for iPhone",263,,,,FALSE,FALSE,0,0,,,,,,,,"http://pbs.twimg.com/media/FFeAkoLXMAg5-xP.jpg","https://t.co/mLrDJfg3KL","https://twitter.com/avvocato_urraro/status/1465781576462213139/photo/1","photo","http://pbs.twimg.com/media/FFeAkoLXMAg5-xP.jpg","https://t.co/mLrDJfg3KL","https://twitter.com/avvocato_urraro/status/1465781576462213139/photo/1",,,,"it",,,,,,,,,,,,,,,,,,,,,,,,,,,,,,,,,,,,,"NA NA","NA NA","NA NA NA NA NA NA NA NA","https://twitter.com/avvocato_urraro/status/1465781576462213139","Francesco Urraro","","Avvocato, Senatore della Repubblica","https://t.co/ty4EsXbIYF",FALSE,751,1921,16,2111,253,2018-02-05 21:48:00,TRUE,"https://t.co/ty4EsXbIYF","http://www.senato.it/leg/18/BGT/Schede/Attsen/00032728.htm",,"https://pbs.twimg.com/profile_banners/960631114233712650/1543947300",,"http://pbs.twimg.com/profile_images/1113853247482224640/yQn0Unc3_normal.jpg"
"x214476890","x1466046202546380808",2021-12-01 14:07:07,"adolfo_urso","L’ANGI - Associazione Nazionale Giovani Innovatori è proprio quello che serve alla Nazione per tornare ad essere competivi nella transizione digitale ed ecologica: una rivoluzione economica e sociale di cui i giovani sono il vero motore.","Twitter for iPhone",237,"x1466046197794226178","x214476890","adolfo_urso",FALSE,FALSE,4,2,,,,,,,,,,,,,,,,,,"it",,,,,,,,,,,,,,,,,,,,,,,,,,,,,,,"https://api.twitter.com/1.1/geo/id/7d588036fe12e124.json","Rome","Rome, Lazio","city","Italy","IT","NA NA","NA NA","12.2344266 12.8558641 12.8558641 12.2344266 41.6558738 41.6558738 42.140959 42.140959","https://twitter.com/adolfo_urso/status/1466046202546380808","Adolfo Urso","","Presidente del Copasir, Senatore di Fratelli d’Italia","https://t.co/y9Kag2puP7",FALSE,7585,871,137,10615,8039,2010-11-11 14:06:19,FALSE,"https://t.co/y9Kag2puP7","http://www.adolfo-urso.it",,"https://pbs.twimg.com/profile_banners/214476890/1632846052","http://abs.twimg.com/images/themes/theme1/bg.png","http://pbs.twimg.com/profile_images/1442887033266053124/mTxWAneu_normal.jpg"
"x214476890","x1466046197794226178",2021-12-01 14:07:06,"adolfo_urso","Questo premio giunge al momento giusto perché evidenzia nel contempo quando sia necessario rispondere al crollo demografico e nel contempo a investire sulle innovazioni. https://t.co/0XweAv9mgr","Twitter for iPhone",169,,,,FALSE,FALSE,8,4,,,,,,,,"http://pbs.twimg.com/media/FFhxOalX0AU7V1D.jpg","https://t.co/0XweAv9mgr","https://twitter.com/adolfo_urso/status/1466046197794226178/photo/1","photo","http://pbs.twimg.com/media/FFhxOalX0AU7V1D.jpg http://pbs.twimg.com/media/FFhxOalWQAc6-Fu.jpg http://pbs.twimg.com/media/FFhxOamXoAQHGtI.jpg","https://t.co/0XweAv9mgr https://t.co/0XweAv9mgr https://t.co/0XweAv9mgr","https://twitter.com/adolfo_urso/status/1466046197794226178/photo/1 https://twitter.com/adolfo_urso/status/1466046197794226178/photo/1 https://twitter.com/adolfo_urso/status/1466046197794226178/photo/1",,,,"it",,,,,,,,,,,,,,,,,,,,,,,,,,,,,,,"https://api.twitter.com/1.1/geo/id/7d588036fe12e124.json","Rome","Rome, Lazio","city","Italy","IT","NA NA","NA NA","12.2344266 12.8558641 12.8558641 12.2344266 41.6558738 41.6558738 42.140959 42.140959","https://twitter.com/adolfo_urso/status/1466046197794226178","Adolfo Urso","","Presidente del Copasir, Senatore di Fratelli d’Italia","https://t.co/y9Kag2puP7",FALSE,7585,871,137,10615,8039,2010-11-11 14:06:19,FALSE,"https://t.co/y9Kag2puP7","http://www.adolfo-urso.it",,"https://pbs.twimg.com/profile_banners/214476890/1632846052","http://abs.twimg.com/images/themes/theme1/bg.png","http://pbs.twimg.com/profile_images/1442887033266053124/mTxWAneu_normal.jpg"
"x214476890","x1466010225694199820",2021-12-01 11:44:09,"adolfo_urso","Mi auguro che l’Italia possa rivendicare la sede della nascente Autorità anti riciclaggio europea: abbiamo tutti i titoli per farlo, la migliore performance europea.","Twitter for iPhone",165,"x1466010203351097351","x214476890","adolfo_urso",FALSE,FALSE,7,2,,,,,,,,,,,,,,,,,,"it",,,,,,,,,,,,,,,,,,,,,,,,,,,,,,,,,,,,,"NA NA","NA NA","NA NA NA NA NA NA NA NA","https://twitter.com/adolfo_urso/status/1466010225694199820","Adolfo Urso","","Presidente del Copasir, Senatore di Fratelli d’Italia","https://t.co/y9Kag2puP7",FALSE,7585,871,137,10615,8039,2010-11-11 14:06:19,FALSE,"https://t.co/y9Kag2puP7","http://www.adolfo-urso.it",,"https://pbs.twimg.com/profile_banners/214476890/1632846052","http://abs.twimg.com/images/themes/theme1/bg.png","http://pbs.twimg.com/profile_images/1442887033266053124/mTxWAneu_normal.jpg"
"x214476890","x1466010203351097351",2021-12-01 11:44:04,"adolfo_urso","La transizione al digitale riguarda anche e soprattutto il mondo della Finanza come emerge dalla stessa attività del Copasir e dalla cronache di questi giorni sugli hacheraggi e sulle criptovalute. https://t.co/9C35PodtGC","Twitter for iPhone",197,,,,FALSE,FALSE,8,3,,,,,,,,"http://pbs.twimg.com/media/FFhQdFVXwAQJkKo.jpg","https://t.co/9C35PodtGC","https://twitter.com/adolfo_urso/status/1466010203351097351/photo/1","photo","http://pbs.twimg.com/media/FFhQdFVXwAQJkKo.jpg http://pbs.twimg.com/media/FFhQdFWXMAA5FEw.jpg","https://t.co/9C35PodtGC https://t.co/9C35PodtGC","https://twitter.com/adolfo_urso/status/1466010203351097351/photo/1 https://twitter.com/adolfo_urso/status/1466010203351097351/photo/1",,,,"it",,,,,,,,,,,,,,,,,,,,,,,,,,,,,,,,,,,,,"NA NA","NA NA","NA NA NA NA NA NA NA NA","https://twitter.com/adolfo_urso/status/1466010203351097351","Adolfo Urso","","Presidente del Copasir, Senatore di Fratelli d’Italia","https://t.co/y9Kag2puP7",FALSE,7585,871,137,10615,8039,2010-11-11 14:06:19,FALSE,"https://t.co/y9Kag2puP7","http://www.adolfo-urso.it",,"https://pbs.twimg.com/profile_banners/214476890/1632846052","http://abs.twimg.com/images/themes/theme1/bg.png","http://pbs.twimg.com/profile_images/1442887033266053124/mTxWAneu_normal.jpg"
"x214476890","x1465988796026081285",2021-12-01 10:19:00,"adolfo_urso","https://t.co/bsJPtrkoIt","Twitter for iPhone",23,,,,FALSE,FALSE,7,2,,,,,"formiche.net/2021/11/copasi…","https://t.co/bsJPtrkoIt","https://formiche.net/2021/11/copasir-sparkle-audizione-pansa/",,,,,,,,,,,"und",,,,,,,,,,,,,,,,,,,,,,,,,,,,,,,"https://api.twitter.com/1.1/geo/id/7d588036fe12e124.json","Rome","Rome, Lazio","city","Italy","IT","NA NA","NA NA","12.2344266 12.8558641 12.8558641 12.2344266 41.6558738 41.6558738 42.140959 42.140959","https://twitter.com/adolfo_urso/status/1465988796026081285","Adolfo Urso","","Presidente del Copasir, Senatore di Fratelli d’Italia","https://t.co/y9Kag2puP7",FALSE,7585,871,137,10615,8039,2010-11-11 14:06:19,FALSE,"https://t.co/y9Kag2puP7","http://www.adolfo-urso.it",,"https://pbs.twimg.com/profile_banners/214476890/1632846052","http://abs.twimg.com/images/themes/theme1/bg.png","http://pbs.twimg.com/profile_images/1442887033266053124/mTxWAneu_normal.jpg"
"x214476890","x1465801911685287937",2021-11-30 21:56:23,"adolfo_urso","Bisogna preservare la nostra cultura, le nostre ricerche e i nostri brevetti, dunque proteggere i nostri dati.

Serve uno Stato stratega e una politica industriale che ci rendano sovrani. https://t.co/k3kP7ubdYy","Twitter for iPad",139,,,,FALSE,TRUE,0,9,,,,,,,,,,,,,,,,"x214476890","adolfo_urso","it",,,,,,,,,,,,,,,,"x1465431164081123329","Bisogna preservare la nostra cultura, le nostre ricerche e i nostri brevetti, dunque proteggere i nostri dati.

Serve uno Stato stratega e una politica industriale che ci rendano sovrani. https://t.co/k3kP7ubdYy",2021-11-29 21:23:10,"Twitter for iPhone",55,9,"x214476890","adolfo_urso","Adolfo Urso",7585,871,10615,"","Presidente del Copasir, Senatore di Fratelli d’Italia",FALSE,,,,,,,"NA NA","NA NA","NA NA NA NA NA NA NA NA","https://twitter.com/adolfo_urso/status/1465801911685287937","Adolfo Urso","","Presidente del Copasir, Senatore di Fratelli d’Italia","https://t.co/y9Kag2puP7",FALSE,7585,871,137,10615,8039,2010-11-11 14:06:19,FALSE,"https://t.co/y9Kag2puP7","http://www.adolfo-urso.it",,"https://pbs.twimg.com/profile_banners/214476890/1632846052","http://abs.twimg.com/images/themes/theme1/bg.png","http://pbs.twimg.com/profile_images/1442887033266053124/mTxWAneu_normal.jpg"
"x827908404","x1465750349344657412",2021-11-30 18:31:30,"cescverducci","Con stabilizzazione di oggi di 328 ricercatori e tecnologi,tutti i 1800 lavoratori precari Cnr sono stati assunti. Una grande vittoria, una soddisfazione per chi come me ha sempre dato il massimo in questi anni per vincere questa battaglia @PrecariUnitiCNR #bastaprecariatodistato https://t.co/m2ef2dvEQA","Twitter for Android",280,,,,FALSE,FALSE,31,11,,,"bastaprecariatodistato",,,,,"http://pbs.twimg.com/media/FFdkLKlXIBALhV8.jpg","https://t.co/m2ef2dvEQA","https://twitter.com/cescverducci/status/1465750349344657412/photo/1","photo","http://pbs.twimg.com/media/FFdkLKlXIBALhV8.jpg","https://t.co/m2ef2dvEQA","https://twitter.com/cescverducci/status/1465750349344657412/photo/1",,"x861942264888688641","PrecariUnitiCNR","it",,,,,,,,,,,,,,,,,,,,,,,,,,,,,,,,,,,,,"NA NA","NA NA","NA NA NA NA NA NA NA NA","https://twitter.com/cescverducci/status/1465750349344657412","Francesco Verducci","","Ricercatore universitario in Sociologia politica, militante democratico, vice Presidente Commissione Cultura, Istruzione, Università e Ricerca del @SenatoStampa",,FALSE,4326,1563,56,1339,734,2012-09-16 23:11:45,TRUE,,,,"https://pbs.twimg.com/profile_banners/827908404/1359157451","http://abs.twimg.com/images/themes/theme1/bg.png","http://pbs.twimg.com/profile_images/1260980018999693312/UCBRmGUb_normal.png"
"x861249289","x1465982206296444928",2021-12-01 09:52:49,"FrancoZaffini","“Quale Sanità dopo il Covid? Il Medico di Famiglia primo soggetto di prossimità"" 

Segui la diretta del convegno dalla Sala Zuccari del Senato. @FratellidItalia @FrancescoLollo1 @marcellogemmato @SchifoneM https://t.co/zSjBXHtQiP","Twitter for iPhone",139,,,,FALSE,TRUE,0,4,,,,,,,,,,,,,,,,"x985177119624966147","FDI_Parlamento","it",,,,,,,,,,,,,,,,"x1465982129557356544","“Quale Sanità dopo il Covid? Il Medico di Famiglia primo soggetto di prossimità"" 

Segui la diretta del convegno dalla Sala Zuccari del Senato. @FratellidItalia @FrancescoLollo1 @marcellogemmato @SchifoneM https://t.co/zSjBXHtQiP",2021-12-01 09:52:30,"Twitter for iPhone",17,4,"x985177119624966147","FDI_Parlamento","FDI Parlamento",6988,89,11404,"Roma, Lazio","Profilo ufficiale dei Gruppi Parlamentari di #fratelliditalia al #Senato e alla #Camera.",FALSE,,,,,,,"NA NA","NA NA","NA NA NA NA NA NA NA NA","https://twitter.com/FrancoZaffini/status/1465982206296444928","Franco Zaffini","","Senatore di Fratelli d’Italia",,FALSE,1050,893,7,3962,2137,2012-10-04 11:28:31,FALSE,,,,"https://pbs.twimg.com/profile_banners/861249289/1416831191","http://abs.twimg.com/images/themes/theme1/bg.png","http://pbs.twimg.com/profile_images/1282069308374487043/E95-ktFS_normal.jpg"
"x861249289","x1465981587221364742",2021-12-01 09:50:21,"FrancoZaffini","🔴 ""Quale Sanità dopo il Covid? Il Medico di Famiglia primo soggetto di prossimità"" 

Segui la diretta dalla Sala Zuccari del Senato. @FratellidItalia 

https://t.co/VcR7tRAAHR https://t.co/b9aSYsurAD","Twitter for iPhone",175,,,,FALSE,FALSE,3,2,,,,,"fb.watch/9C-C4RHxly/","https://t.co/VcR7tRAAHR","https://fb.watch/9C-C4RHxly/","http://pbs.twimg.com/media/FFg2erMXEAYvIlU.jpg","https://t.co/b9aSYsurAD","https://twitter.com/FrancoZaffini/status/1465981587221364742/photo/1","photo","http://pbs.twimg.com/media/FFg2erMXEAYvIlU.jpg http://pbs.twimg.com/media/FFg2erSXMAIHVlP.jpg http://pbs.twimg.com/media/FFg2ewzXMAIAYpQ.jpg http://pbs.twimg.com/media/FFg2ezTWYAEbrBc.jpg","https://t.co/b9aSYsurAD https://t.co/b9aSYsurAD https://t.co/b9aSYsurAD https://t.co/b9aSYsurAD","https://twitter.com/FrancoZaffini/status/1465981587221364742/photo/1 https://twitter.com/FrancoZaffini/status/1465981587221364742/photo/1 https://twitter.com/FrancoZaffini/status/1465981587221364742/photo/1 https://twitter.com/FrancoZaffini/status/1465981587221364742/photo/1",,"x1024976264","FratellidItalia","it",,,,,,,,,,,,,,,,,,,,,,,,,,,,,,,,,,,,,"NA NA","NA NA","NA NA NA NA NA NA NA NA","https://twitter.com/FrancoZaffini/status/1465981587221364742","Franco Zaffini","","Senatore di Fratelli d’Italia",,FALSE,1050,893,7,3962,2137,2012-10-04 11:28:31,FALSE,,,,"https://pbs.twimg.com/profile_banners/861249289/1416831191","http://abs.twimg.com/images/themes/theme1/bg.png","http://pbs.twimg.com/profile_images/1282069308374487043/E95-ktFS_normal.jpg"
"x861249289","x1465817157174972424",2021-11-30 22:56:58,"FrancoZaffini","🔵 La Commissione Europea ha ritirato il suo documento sul linguaggio inclusivo che voleva abolire il termine “Natale”.
Vittoria e buon Natale anche a voi. @FratellidItalia #FratellidItalia https://t.co/OIGmpfu3iQ","Twitter for iPhone",188,,,,FALSE,FALSE,1,1,,,"FratellidItalia",,,,,"http://pbs.twimg.com/media/FFeg7wbWQAIAPpb.jpg","https://t.co/OIGmpfu3iQ","https://twitter.com/FrancoZaffini/status/1465817157174972424/photo/1","photo","http://pbs.twimg.com/media/FFeg7wbWQAIAPpb.jpg","https://t.co/OIGmpfu3iQ","https://twitter.com/FrancoZaffini/status/1465817157174972424/photo/1",,"x1024976264","FratellidItalia","it",,,,,,,,,,,,,,,,,,,,,,,,,,,,,,,,,,,,,"NA NA","NA NA","NA NA NA NA NA NA NA NA","https://twitter.com/FrancoZaffini/status/1465817157174972424","Franco Zaffini","","Senatore di Fratelli d’Italia",,FALSE,1050,893,7,3962,2137,2012-10-04 11:28:31,FALSE,,,,"https://pbs.twimg.com/profile_banners/861249289/1416831191","http://abs.twimg.com/images/themes/theme1/bg.png","http://pbs.twimg.com/profile_images/1282069308374487043/E95-ktFS_normal.jpg"
"x413916151","x1466087667704156177",2021-12-01 16:51:53,"GuidoCrosetto","@makkox 😂😂😂","Twitter for iPhone",3,"x1465993106831167488","x16273541","makkox",FALSE,FALSE,2,0,,,,,,,,,,,,,,,,"x16273541","makkox","und",,,,,,,,,,,,,,,,,,,,,,,,,,,,,,,,,,,,,"NA NA","NA NA","NA NA NA NA NA NA NA NA","https://twitter.com/GuidoCrosetto/status/1466087667704156177","Guido Crosetto","","Libero da pregiudizi per convinzione, garantista per dna, conservatore per nascita, rispettoso per scelta. Ex tante cose. Ora uomo libero ed imprenditore.",,FALSE,166039,2218,771,100825,24718,2011-11-16 12:08:47,FALSE,,,,"https://pbs.twimg.com/profile_banners/413916151/1614946720","http://abs.twimg.com/images/themes/theme18/bg.gif","http://pbs.twimg.com/profile_images/1367817705408069638/jsus6PeC_normal.jpg"
"x413916151","x1466087625807351816",2021-12-01 16:51:43,"GuidoCrosetto","ci si affeziona https://t.co/Hw3rIEyLQU","Twitter for iPhone",27,,,,FALSE,TRUE,0,66,,,,,,,,,,,,,,,,"x16273541","makkox","it",,,,,,,,,,,,,,,,"x1465993106831167488","ci si affeziona https://t.co/Hw3rIEyLQU",2021-12-01 10:36:08,"Twitter Web App",942,66,"x16273541","makkox","makkox",586740,744,18295,"gramar nazi istant blok","Marco Dambrosio. Vignettaio col blocco per gli schizzi. @welikechopin @welikeduel @espressonline @ilfoglio_it @ilpost",TRUE,,,,,,,"NA NA","NA NA","NA NA NA NA NA NA NA NA","https://twitter.com/GuidoCrosetto/status/1466087625807351816","Guido Crosetto","","Libero da pregiudizi per convinzione, garantista per dna, conservatore per nascita, rispettoso per scelta. Ex tante cose. Ora uomo libero ed imprenditore.",,FALSE,166039,2218,771,100825,24718,2011-11-16 12:08:47,FALSE,,,,"https://pbs.twimg.com/profile_banners/413916151/1614946720","http://abs.twimg.com/images/themes/theme18/bg.gif","http://pbs.twimg.com/profile_images/1367817705408069638/jsus6PeC_normal.jpg"
"x413916151","x1466058302849175552",2021-12-01 14:55:12,"GuidoCrosetto","@elio_vito @Tg1Rai @abarachini @Michele_Anzaldi Si chiama censura…..la tua 😂😂😂","Twitter for iPhone",30,"x1465978285012275200","x1557514573","elio_vito",FALSE,FALSE,0,0,,,,,,,,,,,,,,,,"x1557514573 x197763661 x354901620 x2902178505","elio_vito Tg1Rai abarachini Michele_Anzaldi","it",,,,,,,,,,,,,,,,,,,,,,,,,,,,,,,,,,,,,"NA NA","NA NA","NA NA NA NA NA NA NA NA","https://twitter.com/GuidoCrosetto/status/1466058302849175552","Guido Crosetto","","Libero da pregiudizi per convinzione, garantista per dna, conservatore per nascita, rispettoso per scelta. Ex tante cose. Ora uomo libero ed imprenditore.",,FALSE,166039,2218,771,100825,24718,2011-11-16 12:08:47,FALSE,,,,"https://pbs.twimg.com/profile_banners/413916151/1614946720","http://abs.twimg.com/images/themes/theme18/bg.gif","http://pbs.twimg.com/profile_images/1367817705408069638/jsus6PeC_normal.jpg"
