"x636328779","x1444938907913801728",2021-10-04 08:14:15,"AlexBazzaro","@AurelianoStingi Ah ecco il socio dello scaltriti... Guardate che qui gli unici in conflitto di interesse siete voi (ricordo che lo scaltriti lavora per Astrazeneca, nel caso non si fosse capito) e io non faccio nessuna propaganda anti vaccini, solo se si lasciassero stare i minori sarebbe meglio","Twitter for iPhone",140,,,,FALSE,TRUE,0,74,,,,,,,,,,,,,,,,"x337767301 x938729294578233344","borghi_claudio AurelianoStingi","it",,,,,,,,,,,,,,,,"x1444840891500335106","@AurelianoStingi Ah ecco il socio dello scaltriti... Guardate che qui gli unici in conflitto di interesse siete voi (ricordo che lo scaltriti lavora per Astrazeneca, nel caso non si fosse capito) e io non faccio nessuna propaganda anti vaccini, solo se si lasciassero stare i minori sarebbe meglio",2021-10-04 01:44:47,"Twitter Web App",311,74,"x337767301","borghi_claudio","Claudio Borghi A.",116654,1328,212681,"Italia","Deputato della Repubblica Italiana eletto in Toscana per la Lega. Consigliere Comunale di Como",TRUE,,,,,,,"NA NA","NA NA","NA NA NA NA NA NA NA NA","https://twitter.com/AlexBazzaro/status/1444938907913801728","Alex Bazzaro","Venezia ","🇮🇹Deputato Lega, Commissione XIV 🇪🇺 🦁Consigliere Comunale Venezia. ✈️ Delegazione @OSCE","https://t.co/C7Juvvqd3j",FALSE,2141,372,0,10303,1462,2012-07-15 15:20:42,TRUE,"https://t.co/C7Juvvqd3j","https://www.camera.it/leg18/29?shadow_deputato=307696&idpersona=307696&idlegislatura=18",,"https://pbs.twimg.com/profile_banners/636328779/1457208495","http://abs.twimg.com/images/themes/theme1/bg.png","http://pbs.twimg.com/profile_images/1315654416171753472/1PG-DcXJ_normal.jpg"
"x636328779","x1444938842071572480",2021-10-04 08:14:00,"AlexBazzaro","L'ex guardasigilli: «Dopo l'iniezione valori sballati. Mi hanno attaccato perché l'ho detto. Ora sono un morto che cammina». https://t.co/WAfcof8MS6","Twitter for iPhone",140,,,,FALSE,TRUE,0,427,,,,,,,,,,,,,,,,"x900766265245130753","LaVeritaWeb","it",,,,,,,,,,,,,,,,"x1444935485894369284","L'ex guardasigilli: «Dopo l'iniezione valori sballati. Mi hanno attaccato perché l'ho detto. Ora sono un morto che cammina». https://t.co/WAfcof8MS6",2021-10-04 08:00:40,"RunnerCommonKeys",938,427,"x900766265245130753","LaVeritaWeb","La Verità",123774,69,23855,"Milano, Lombardia","Quotidiano indipendente diretto da @BelpietroTweet. Scopri #LaVeritàdioggi tutti i giorni in edicola al costo di € 1,30. Abbonati online oggi:",FALSE,,,,,,,"NA NA","NA NA","NA NA NA NA NA NA NA NA","https://twitter.com/AlexBazzaro/status/1444938842071572480","Alex Bazzaro","Venezia ","🇮🇹Deputato Lega, Commissione XIV 🇪🇺 🦁Consigliere Comunale Venezia. ✈️ Delegazione @OSCE","https://t.co/C7Juvvqd3j",FALSE,2141,372,0,10303,1462,2012-07-15 15:20:42,TRUE,"https://t.co/C7Juvvqd3j","https://www.camera.it/leg18/29?shadow_deputato=307696&idpersona=307696&idlegislatura=18",,"https://pbs.twimg.com/profile_banners/636328779/1457208495","http://abs.twimg.com/images/themes/theme1/bg.png","http://pbs.twimg.com/profile_images/1315654416171753472/1PG-DcXJ_normal.jpg"
"x636328779","x1444929757561466881",2021-10-04 07:37:54,"AlexBazzaro","Bambina iniettata e vaccino ""forse da aggiornare"".
Perfetto. https://t.co/eNE7T11HVQ","Twitter for iPhone",104,,,,FALSE,TRUE,0,117,,,,,,,,"http://pbs.twimg.com/media/FA0H00OWUAY6wfO.jpg","https://t.co/eNE7T11HVQ","https://twitter.com/borghi_claudio/status/1444819661883838466/photo/1","photo","http://pbs.twimg.com/media/FA0H00OWUAY6wfO.jpg","https://t.co/eNE7T11HVQ","https://twitter.com/borghi_claudio/status/1444819661883838466/photo/1",,"x337767301","borghi_claudio","it",,,,,,,,,,,,,,,,"x1444819661883838466","Bambina iniettata e vaccino ""forse da aggiornare"".
Perfetto. https://t.co/eNE7T11HVQ",2021-10-04 00:20:25,"Twitter for Android",373,117,"x337767301","borghi_claudio","Claudio Borghi A.",116654,1328,212681,"Italia","Deputato della Repubblica Italiana eletto in Toscana per la Lega. Consigliere Comunale di Como",TRUE,,,,,,,"NA NA","NA NA","NA NA NA NA NA NA NA NA","https://twitter.com/AlexBazzaro/status/1444929757561466881","Alex Bazzaro","Venezia ","🇮🇹Deputato Lega, Commissione XIV 🇪🇺 🦁Consigliere Comunale Venezia. ✈️ Delegazione @OSCE","https://t.co/C7Juvvqd3j",FALSE,2141,372,0,10303,1462,2012-07-15 15:20:42,TRUE,"https://t.co/C7Juvvqd3j","https://www.camera.it/leg18/29?shadow_deputato=307696&idpersona=307696&idlegislatura=18",,"https://pbs.twimg.com/profile_banners/636328779/1457208495","http://abs.twimg.com/images/themes/theme1/bg.png","http://pbs.twimg.com/profile_images/1315654416171753472/1PG-DcXJ_normal.jpg"
"x636328779","x1444772399967313925",2021-10-03 21:12:37,"AlexBazzaro","Nessun nesso. Le ragazzine di 13 anni muoiono frequentemente, il fatto che ciò avvenga immediatamente dopo una vaccinazione che ha fra gli effetti avversi ufficialmente riconosciuti la possibilità di infiammazione cardiaca è un puro caso. 
Sia mai che ci rimetta la mia promozione https://t.co/fdDLmy20e8","Twitter for iPhone",140,,,,FALSE,TRUE,0,361,,,,,,,,,,,,,,,,"x337767301","borghi_claudio","it",,,,,,,,,,,,,,,,"x1444720469425410055","Nessun nesso. Le ragazzine di 13 anni muoiono frequentemente, il fatto che ciò avvenga immediatamente dopo una vaccinazione che ha fra gli effetti avversi ufficialmente riconosciuti la possibilità di infiammazione cardiaca è un puro caso. 
Sia mai che ci rimetta la mia promozione https://t.co/fdDLmy20e8",2021-10-03 17:46:16,"Twitter Web App",1334,361,"x337767301","borghi_claudio","Claudio Borghi A.",116654,1328,212681,"Italia","Deputato della Repubblica Italiana eletto in Toscana per la Lega. Consigliere Comunale di Como",TRUE,,,,,,,"NA NA","NA NA","NA NA NA NA NA NA NA NA","https://twitter.com/AlexBazzaro/status/1444772399967313925","Alex Bazzaro","Venezia ","🇮🇹Deputato Lega, Commissione XIV 🇪🇺 🦁Consigliere Comunale Venezia. ✈️ Delegazione @OSCE","https://t.co/C7Juvvqd3j",FALSE,2141,372,0,10303,1462,2012-07-15 15:20:42,TRUE,"https://t.co/C7Juvvqd3j","https://www.camera.it/leg18/29?shadow_deputato=307696&idpersona=307696&idlegislatura=18",,"https://pbs.twimg.com/profile_banners/636328779/1457208495","http://abs.twimg.com/images/themes/theme1/bg.png","http://pbs.twimg.com/profile_images/1315654416171753472/1PG-DcXJ_normal.jpg"
"x106673706","x1444724186371575808",2021-10-03 18:01:02,"massimobitonci","🚲 Parigi-Roubaix epica, trionfa Sonny Colbrelli. Che vittoria nel fango!
#warriors https://t.co/b9MaR0LBm7","Twitter for iPhone",82,,,,FALSE,FALSE,31,2,,,"warriors",,,,,"http://pbs.twimg.com/media/FAyw_LCXsAsbTTE.jpg","https://t.co/b9MaR0LBm7","https://twitter.com/massimobitonci/status/1444724186371575808/photo/1","photo","http://pbs.twimg.com/media/FAyw_LCXsAsbTTE.jpg","https://t.co/b9MaR0LBm7","https://twitter.com/massimobitonci/status/1444724186371575808/photo/1",,,,"it",,,,,,,,,,,,,,,,,,,,,,,,,,,,,,,,,,,,,"NA NA","NA NA","NA NA NA NA NA NA NA NA","https://twitter.com/massimobitonci/status/1444724186371575808","Massimo Bitonci","","Veneto Deputato Lega Salvini Premier Fondatore LIGA Veneta SP - Capogruppo Comm. Bilancio - Responsabile Dipartimento Att. Produttive - commercialista","https://t.co/kPwsXGqWs8",FALSE,11700,891,99,20963,2047,2010-01-20 08:53:16,TRUE,"https://t.co/kPwsXGqWs8","http://bitonci.it",,"https://pbs.twimg.com/profile_banners/106673706/1520459270","http://abs.twimg.com/images/themes/theme1/bg.png","http://pbs.twimg.com/profile_images/1217032559348961286/R3F9DbBd_normal.jpg"
"x337767301","x1445045033871216645",2021-10-04 15:15:58,"borghi_claudio","@cris_cersei @RobVicaretti L'arte di non capire nulla. Michetti al ballottaggio ci arrivava di sicuro. Quello che conta è la lista","Twitter Web App",103,"x1445040652186787844","x2753154182","cris_cersei",FALSE,FALSE,39,6,,,,,,,,,,,,,,,,"x2753154182 x2819021613","cris_cersei RobVicaretti","it",,,,,,,,,,,,,,,,,,,,,,,,,,,,,,,,,,,,,"NA NA","NA NA","NA NA NA NA NA NA NA NA","https://twitter.com/borghi_claudio/status/1445045033871216645","Claudio Borghi A.","Italia","Deputato della Repubblica Italiana eletto in Toscana per la Lega. Consigliere Comunale di Como","https://t.co/LhQnD0sHz3",FALSE,116654,1328,815,212681,1300,2011-07-18 15:08:25,TRUE,"https://t.co/LhQnD0sHz3","http://tiny.cc/j3065y",,"https://pbs.twimg.com/profile_banners/337767301/1607040672","http://abs.twimg.com/images/themes/theme1/bg.png","http://pbs.twimg.com/profile_images/1449240289/manliorho_-_giusto_normal.jpg"
"x337767301","x1445020664969187339",2021-10-04 13:39:08,"borghi_claudio","@RobVicaretti Scusa Roberto, giusto per sapere, quali sarebbero i candidati SOVRANISTI nelle grandi città? Forse solo Michetti. Mi pare che tutti gli altri siano moderati.","Twitter Web App",157,"x1445019372637106183","x2819021613","RobVicaretti",FALSE,FALSE,162,13,,,,,,,,,,,,,,,,"x2819021613","RobVicaretti","it",,,,,,,,,,,,,,,,,,,,,,,,,,,,,,,,,,,,,"NA NA","NA NA","NA NA NA NA NA NA NA NA","https://twitter.com/borghi_claudio/status/1445020664969187339","Claudio Borghi A.","Italia","Deputato della Repubblica Italiana eletto in Toscana per la Lega. Consigliere Comunale di Como","https://t.co/LhQnD0sHz3",FALSE,116654,1328,815,212681,1300,2011-07-18 15:08:25,TRUE,"https://t.co/LhQnD0sHz3","http://tiny.cc/j3065y",,"https://pbs.twimg.com/profile_banners/337767301/1607040672","http://abs.twimg.com/images/themes/theme1/bg.png","http://pbs.twimg.com/profile_images/1449240289/manliorho_-_giusto_normal.jpg"
"x337767301","x1445009279837167620",2021-10-04 12:53:53,"borghi_claudio","Mi porto avanti col lavoro: come è noto non commento mai gli exit poll","Twitter Web App",70,,,,FALSE,FALSE,418,52,,,,,,,,,,,,,,,,,,"it",,,,,,,,,,,,,,,,,,,,,,,,,,,,,,,,,,,,,"NA NA","NA NA","NA NA NA NA NA NA NA NA","https://twitter.com/borghi_claudio/status/1445009279837167620","Claudio Borghi A.","Italia","Deputato della Repubblica Italiana eletto in Toscana per la Lega. Consigliere Comunale di Como","https://t.co/LhQnD0sHz3",FALSE,116654,1328,815,212681,1300,2011-07-18 15:08:25,TRUE,"https://t.co/LhQnD0sHz3","http://tiny.cc/j3065y",,"https://pbs.twimg.com/profile_banners/337767301/1607040672","http://abs.twimg.com/images/themes/theme1/bg.png","http://pbs.twimg.com/profile_images/1449240289/manliorho_-_giusto_normal.jpg"
"x337767301","x1445006400514629638",2021-10-04 12:42:27,"borghi_claudio","@borghi_claudio @ScaltritiLab @AndreaBeltrameJ A proposito onorevole, le segnalo i problemucci del super algoritmo #nessunacorrelazione.
Mi hanno bloccato dopo avergli fatto notare le incoerenze e l'assenza di documentazione, figurarsi codice sorgente. https://t.co/hiOx29EbDM","Twitter Web App",140,,,,FALSE,TRUE,0,25,,,,,,,,,,,,,,,,"x1211950652898758656 x337767301 x1112334477261504513 x522216700","Politeia10 borghi_claudio ScaltritiLab AndreaBeltrameJ","it",,,,,,,,,,,,,,,,"x1445000458024665091","@borghi_claudio @ScaltritiLab @AndreaBeltrameJ A proposito onorevole, le segnalo i problemucci del super algoritmo #nessunacorrelazione.
Mi hanno bloccato dopo avergli fatto notare le incoerenze e l'assenza di documentazione, figurarsi codice sorgente. https://t.co/hiOx29EbDM",2021-10-04 12:18:50,"Twitter Web App",62,25,"x1211950652898758656","Politeia10","Politeia",170,486,3487,"","Seguo soprattutto chi non la pensa come me. Bloccare è soffocare. Fate scoppiare quella maledetta bolla in cui vi rintanate!",FALSE,,,,,,,"NA NA","NA NA","NA NA NA NA NA NA NA NA","https://twitter.com/borghi_claudio/status/1445006400514629638","Claudio Borghi A.","Italia","Deputato della Repubblica Italiana eletto in Toscana per la Lega. Consigliere Comunale di Como","https://t.co/LhQnD0sHz3",FALSE,116654,1328,815,212681,1300,2011-07-18 15:08:25,TRUE,"https://t.co/LhQnD0sHz3","http://tiny.cc/j3065y",,"https://pbs.twimg.com/profile_banners/337767301/1607040672","http://abs.twimg.com/images/themes/theme1/bg.png","http://pbs.twimg.com/profile_images/1449240289/manliorho_-_giusto_normal.jpg"
"x337767301","x1444993856630571011",2021-10-04 11:52:36,"borghi_claudio","@LazzariAmbrogio No. Mi basta il principio di prudenza. Lei prima però passerà in ginocchio da Genova? Mi pare che ci sia un filo di reticenza ma prima o poi qualcuno arriverà al pettine. 
Mi faccia sapere.
https://t.co/ztUnnSJ7Jz","Twitter Web App",140,,,,FALSE,TRUE,0,43,,,,,,,,,,,,,,,,"x337767301 x1219231327","borghi_claudio LazzariAmbrogio","it",,,,,,,,,,,,,,,,"x1444993832878235648","@LazzariAmbrogio No. Mi basta il principio di prudenza. Lei prima però passerà in ginocchio da Genova? Mi pare che ci sia un filo di reticenza ma prima o poi qualcuno arriverà al pettine. 
Mi faccia sapere.
https://t.co/ztUnnSJ7Jz",2021-10-04 11:52:31,"Twitter Web App",197,43,"x337767301","borghi_claudio","Claudio Borghi A.",116654,1328,212681,"Italia","Deputato della Repubblica Italiana eletto in Toscana per la Lega. Consigliere Comunale di Como",TRUE,,,,,,,"NA NA","NA NA","NA NA NA NA NA NA NA NA","https://twitter.com/borghi_claudio/status/1444993856630571011","Claudio Borghi A.","Italia","Deputato della Repubblica Italiana eletto in Toscana per la Lega. Consigliere Comunale di Como","https://t.co/LhQnD0sHz3",FALSE,116654,1328,815,212681,1300,2011-07-18 15:08:25,TRUE,"https://t.co/LhQnD0sHz3","http://tiny.cc/j3065y",,"https://pbs.twimg.com/profile_banners/337767301/1607040672","http://abs.twimg.com/images/themes/theme1/bg.png","http://pbs.twimg.com/profile_images/1449240289/manliorho_-_giusto_normal.jpg"
"x337767301","x1444993832878235648",2021-10-04 11:52:31,"borghi_claudio","@LazzariAmbrogio No. Mi basta il principio di prudenza. Lei prima però passerà in ginocchio da Genova? Mi pare che ci sia un filo di reticenza ma prima o poi qualcuno arriverà al pettine. 
Mi faccia sapere.
https://t.co/ztUnnSJ7Jz","Twitter Web App",213,"x1444741406992568329","x1219231327","LazzariAmbrogio",FALSE,FALSE,197,43,,,,,"ilsecoloxix.it/italia/2021/09…","https://t.co/ztUnnSJ7Jz","https://www.ilsecoloxix.it/italia/2021/09/06/news/morti-sospette-dopo-il-vaccino-i-pm-in-pressing-sui-medici-legali-per-i-risultati-delle-autopsie-1.40674040",,,,,,,,,"x1219231327","LazzariAmbrogio","it",,,,,,,,,,,,,,,,,,,,,,,,,,,,,,,,,,,,,"NA NA","NA NA","NA NA NA NA NA NA NA NA","https://twitter.com/borghi_claudio/status/1444993832878235648","Claudio Borghi A.","Italia","Deputato della Repubblica Italiana eletto in Toscana per la Lega. Consigliere Comunale di Como","https://t.co/LhQnD0sHz3",FALSE,116654,1328,815,212681,1300,2011-07-18 15:08:25,TRUE,"https://t.co/LhQnD0sHz3","http://tiny.cc/j3065y",,"https://pbs.twimg.com/profile_banners/337767301/1607040672","http://abs.twimg.com/images/themes/theme1/bg.png","http://pbs.twimg.com/profile_images/1449240289/manliorho_-_giusto_normal.jpg"
"x337767301","x1444991021897719809",2021-10-04 11:41:20,"borghi_claudio","@itosettiMD_MBA @Zarathu70651892 @bruno_vonmauer @ScaltritiLab @AndreaBeltrameJ Non so, fattorino a 19 anni, negoziatore abilitato a 21, funzionario a 23, director a 27, direttore dirigente a 29, Managing Director a 36, docente universitario sino a 44, consigliere regionale a 45, deputato a 48, presidente commissione bilancio fino a 50. 
Veda un po' lei.","Twitter Web App",140,,,,FALSE,TRUE,0,23,,,,,,,,,,,,,,,,"x337767301 x634638711 x1356707044888358912 x1033327941697134592 x1112334477261504513 x522216700","borghi_claudio itosettiMD_MBA Zarathu70651892 bruno_vonmauer ScaltritiLab AndreaBeltrameJ","it",,,,,,,,,,,,,,,,"x1444991004818526211","@itosettiMD_MBA @Zarathu70651892 @bruno_vonmauer @ScaltritiLab @AndreaBeltrameJ Non so, fattorino a 19 anni, negoziatore abilitato a 21, funzionario a 23, director a 27, direttore dirigente a 29, Managing Director a 36, docente universitario sino a 44, consigliere regionale a 45, deputato a 48, presidente commissione bilancio fino a 50. 
Veda un po' lei.",2021-10-04 11:41:16,"Twitter Web App",166,23,"x337767301","borghi_claudio","Claudio Borghi A.",116654,1328,212681,"Italia","Deputato della Repubblica Italiana eletto in Toscana per la Lega. Consigliere Comunale di Como",TRUE,,,,,,,"NA NA","NA NA","NA NA NA NA NA NA NA NA","https://twitter.com/borghi_claudio/status/1444991021897719809","Claudio Borghi A.","Italia","Deputato della Repubblica Italiana eletto in Toscana per la Lega. Consigliere Comunale di Como","https://t.co/LhQnD0sHz3",FALSE,116654,1328,815,212681,1300,2011-07-18 15:08:25,TRUE,"https://t.co/LhQnD0sHz3","http://tiny.cc/j3065y",,"https://pbs.twimg.com/profile_banners/337767301/1607040672","http://abs.twimg.com/images/themes/theme1/bg.png","http://pbs.twimg.com/profile_images/1449240289/manliorho_-_giusto_normal.jpg"
"x337767301","x1444991004818526211",2021-10-04 11:41:16,"borghi_claudio","@itosettiMD_MBA @Zarathu70651892 @bruno_vonmauer @ScaltritiLab @AndreaBeltrameJ Non so, fattorino a 19 anni, negoziatore abilitato a 21, funzionario a 23, director a 27, direttore dirigente a 29, Managing Director a 36, docente universitario sino a 44, consigliere regionale a 45, deputato a 48, presidente commissione bilancio fino a 50. 
Veda un po' lei.","Twitter Web App",276,"x1444988821339320322","x634638711","itosettiMD_MBA",FALSE,FALSE,166,23,,,,,,,,,,,,,,,,"x634638711 x1356707044888358912 x1033327941697134592 x1112334477261504513 x522216700","itosettiMD_MBA Zarathu70651892 bruno_vonmauer ScaltritiLab AndreaBeltrameJ","it",,,,,,,,,,,,,,,,,,,,,,,,,,,,,,,,,,,,,"NA NA","NA NA","NA NA NA NA NA NA NA NA","https://twitter.com/borghi_claudio/status/1444991004818526211","Claudio Borghi A.","Italia","Deputato della Repubblica Italiana eletto in Toscana per la Lega. Consigliere Comunale di Como","https://t.co/LhQnD0sHz3",FALSE,116654,1328,815,212681,1300,2011-07-18 15:08:25,TRUE,"https://t.co/LhQnD0sHz3","http://tiny.cc/j3065y",,"https://pbs.twimg.com/profile_banners/337767301/1607040672","http://abs.twimg.com/images/themes/theme1/bg.png","http://pbs.twimg.com/profile_images/1449240289/manliorho_-_giusto_normal.jpg"
"x337767301","x1444988725637926913",2021-10-04 11:32:13,"borghi_claudio","@andrealoca77 Eh beh certo. Lei che invece di insegnare passa il tempo ad insultare Salvini 👇🏼 saprà sicuramente nel dettaglio cosa pensano i leghisti
https://t.co/6Dvai06bCK
Sarebbe interessante piuttosto sapere cosa ne pensa @mautira del comportamento pubblico di un suo docente. Domanderemo.","Twitter Web App",280,"x1444986924465274882","x464020852","andrealoca77",FALSE,FALSE,7,1,,,,,"twitter.com/search?q=from%…","https://t.co/6Dvai06bCK","https://twitter.com/search?q=from%3A%40andrealoca77%20salvini&src=typed_query&f=live",,,,,,,,,"x464020852 x2627238775","andrealoca77 mautira","it",,,,,,,,,,,,,,,,,,,,,,,,,,,,,,,,,,,,,"NA NA","NA NA","NA NA NA NA NA NA NA NA","https://twitter.com/borghi_claudio/status/1444988725637926913","Claudio Borghi A.","Italia","Deputato della Repubblica Italiana eletto in Toscana per la Lega. Consigliere Comunale di Como","https://t.co/LhQnD0sHz3",FALSE,116654,1328,815,212681,1300,2011-07-18 15:08:25,TRUE,"https://t.co/LhQnD0sHz3","http://tiny.cc/j3065y",,"https://pbs.twimg.com/profile_banners/337767301/1607040672","http://abs.twimg.com/images/themes/theme1/bg.png","http://pbs.twimg.com/profile_images/1449240289/manliorho_-_giusto_normal.jpg"
"x337767301","x1444986893595258886",2021-10-04 11:24:56,"borghi_claudio","@Zarathu70651892 @bruno_vonmauer @ScaltritiLab @AndreaBeltrameJ Aggiungo che su investireoggi nel mitico thread sulle obbligazioni perpetue e subordinate c'erano esperti e persone che nella vita facevano tutt'altro ma che sapevano leggere i dati. Livello di elaborazione superiore a qualsiasi ufficio studi dell'epoca.","Twitter Web App",140,,,,FALSE,TRUE,0,12,,,,,,,,,,,,,,,,"x337767301 x1356707044888358912 x1033327941697134592 x1112334477261504513 x522216700","borghi_claudio Zarathu70651892 bruno_vonmauer ScaltritiLab AndreaBeltrameJ","it",,,,,,,,,,,,,,,,"x1444986868614012928","@Zarathu70651892 @bruno_vonmauer @ScaltritiLab @AndreaBeltrameJ Aggiungo che su investireoggi nel mitico thread sulle obbligazioni perpetue e subordinate c'erano esperti e persone che nella vita facevano tutt'altro ma che sapevano leggere i dati. Livello di elaborazione superiore a qualsiasi ufficio studi dell'epoca.",2021-10-04 11:24:50,"Twitter Web App",62,12,"x337767301","borghi_claudio","Claudio Borghi A.",116654,1328,212681,"Italia","Deputato della Repubblica Italiana eletto in Toscana per la Lega. Consigliere Comunale di Como",TRUE,,,,,,,"NA NA","NA NA","NA NA NA NA NA NA NA NA","https://twitter.com/borghi_claudio/status/1444986893595258886","Claudio Borghi A.","Italia","Deputato della Repubblica Italiana eletto in Toscana per la Lega. Consigliere Comunale di Como","https://t.co/LhQnD0sHz3",FALSE,116654,1328,815,212681,1300,2011-07-18 15:08:25,TRUE,"https://t.co/LhQnD0sHz3","http://tiny.cc/j3065y",,"https://pbs.twimg.com/profile_banners/337767301/1607040672","http://abs.twimg.com/images/themes/theme1/bg.png","http://pbs.twimg.com/profile_images/1449240289/manliorho_-_giusto_normal.jpg"
"x337767301","x1444986868614012928",2021-10-04 11:24:50,"borghi_claudio","@Zarathu70651892 @bruno_vonmauer @ScaltritiLab @AndreaBeltrameJ Aggiungo che su investireoggi nel mitico thread sulle obbligazioni perpetue e subordinate c'erano esperti e persone che nella vita facevano tutt'altro ma che sapevano leggere i dati. Livello di elaborazione superiore a qualsiasi ufficio studi dell'epoca.","Twitter Web App",254,"x1444985991572377600","x337767301","borghi_claudio",FALSE,FALSE,62,12,,,,,,,,,,,,,,,,"x1356707044888358912 x1033327941697134592 x1112334477261504513 x522216700","Zarathu70651892 bruno_vonmauer ScaltritiLab AndreaBeltrameJ","it",,,,,,,,,,,,,,,,,,,,,,,,,,,,,,,,,,,,,"NA NA","NA NA","NA NA NA NA NA NA NA NA","https://twitter.com/borghi_claudio/status/1444986868614012928","Claudio Borghi A.","Italia","Deputato della Repubblica Italiana eletto in Toscana per la Lega. Consigliere Comunale di Como","https://t.co/LhQnD0sHz3",FALSE,116654,1328,815,212681,1300,2011-07-18 15:08:25,TRUE,"https://t.co/LhQnD0sHz3","http://tiny.cc/j3065y",,"https://pbs.twimg.com/profile_banners/337767301/1607040672","http://abs.twimg.com/images/themes/theme1/bg.png","http://pbs.twimg.com/profile_images/1449240289/manliorho_-_giusto_normal.jpg"
"x337767301","x1444986036480843789",2021-10-04 11:21:32,"borghi_claudio","@Zarathu70651892 @bruno_vonmauer @ScaltritiLab @AndreaBeltrameJ Sempre ascoltato tutti. Magari trovavo la buona idea.","Twitter Web App",137,,,,FALSE,TRUE,0,8,,,,,,,,,,,,,,,,"x337767301 x1356707044888358912 x1033327941697134592 x1112334477261504513 x522216700","borghi_claudio Zarathu70651892 bruno_vonmauer ScaltritiLab AndreaBeltrameJ","it",,,,,,,,,,,,,,,,"x1444985991572377600","@Zarathu70651892 @bruno_vonmauer @ScaltritiLab @AndreaBeltrameJ Sempre ascoltato tutti. Magari trovavo la buona idea.",2021-10-04 11:21:21,"Twitter Web App",62,8,"x337767301","borghi_claudio","Claudio Borghi A.",116654,1328,212681,"Italia","Deputato della Repubblica Italiana eletto in Toscana per la Lega. Consigliere Comunale di Como",TRUE,,,,,,,"NA NA","NA NA","NA NA NA NA NA NA NA NA","https://twitter.com/borghi_claudio/status/1444986036480843789","Claudio Borghi A.","Italia","Deputato della Repubblica Italiana eletto in Toscana per la Lega. Consigliere Comunale di Como","https://t.co/LhQnD0sHz3",FALSE,116654,1328,815,212681,1300,2011-07-18 15:08:25,TRUE,"https://t.co/LhQnD0sHz3","http://tiny.cc/j3065y",,"https://pbs.twimg.com/profile_banners/337767301/1607040672","http://abs.twimg.com/images/themes/theme1/bg.png","http://pbs.twimg.com/profile_images/1449240289/manliorho_-_giusto_normal.jpg"
"x337767301","x1444985991572377600",2021-10-04 11:21:21,"borghi_claudio","@Zarathu70651892 @bruno_vonmauer @ScaltritiLab @AndreaBeltrameJ Sempre ascoltato tutti. Magari trovavo la buona idea.","Twitter Web App",53,"x1444977840290766849","x1356707044888358912","Zarathu70651892",FALSE,FALSE,62,8,,,,,,,,,,,,,,,,"x1356707044888358912 x1033327941697134592 x1112334477261504513 x522216700","Zarathu70651892 bruno_vonmauer ScaltritiLab AndreaBeltrameJ","it",,,,,,,,,,,,,,,,,,,,,,,,,,,,,,,,,,,,,"NA NA","NA NA","NA NA NA NA NA NA NA NA","https://twitter.com/borghi_claudio/status/1444985991572377600","Claudio Borghi A.","Italia","Deputato della Repubblica Italiana eletto in Toscana per la Lega. Consigliere Comunale di Como","https://t.co/LhQnD0sHz3",FALSE,116654,1328,815,212681,1300,2011-07-18 15:08:25,TRUE,"https://t.co/LhQnD0sHz3","http://tiny.cc/j3065y",,"https://pbs.twimg.com/profile_banners/337767301/1607040672","http://abs.twimg.com/images/themes/theme1/bg.png","http://pbs.twimg.com/profile_images/1449240289/manliorho_-_giusto_normal.jpg"
