"x1314728936","x1459583511317385225",2021-11-13 18:06:41,"NicolaMorra63","Ma se erano rimasti in pochissimi, come fanno ad uscire in 10?

Fra poco qualcuno rimarrà come la famosa particella di sodio nella bottiglia d'acqua Lete... https://t.co/WbriK2ZDYC","Twitter for Android",156,,,,FALSE,FALSE,188,53,,,,,,,,"http://pbs.twimg.com/media/FEF7dl-X0AUv0IZ.jpg","https://t.co/WbriK2ZDYC","https://twitter.com/NicolaMorra63/status/1459583511317385225/photo/1","photo","http://pbs.twimg.com/media/FEF7dl-X0AUv0IZ.jpg","https://t.co/WbriK2ZDYC","https://twitter.com/NicolaMorra63/status/1459583511317385225/photo/1",,,,"it",,,,,,,,,,,,,,,,,,,,,,,,,,,,,,,,,,,,,"NA NA","NA NA","NA NA NA NA NA NA NA NA","https://twitter.com/NicolaMorra63/status/1459583511317385225","Nicola Morra","Roma, Lazio","Presidente della Commissione Antimafia","https://t.co/iTPRV42dyl",FALSE,93931,363,419,12309,2779,2013-03-29 18:15:14,TRUE,"https://t.co/iTPRV42dyl","http://www.movimento5stelle.it",,"https://pbs.twimg.com/profile_banners/1314728936/1611601504","http://abs.twimg.com/images/themes/theme1/bg.png","http://pbs.twimg.com/profile_images/1129289852384628736/KNHsbHe3_normal.jpg"
"x319766967","x1459505728096555013",2021-11-13 12:57:36,"SPatuanelli","Ci ha lasciati Roberto Felluga, storico vignaiolo del Collio e uomo impegnato in prima linea nel rappresentare gli interessi della categoria e del Paese. Esprimo vicinanza alla sua famiglia.","Twitter for iPhone",190,,,,FALSE,FALSE,28,5,,,,,,,,,,,,,,,,,,"it",,,,,,,,,,,,,,,,,,,,,,,,,,,,,,,,,,,,,"NA NA","NA NA","NA NA NA NA NA NA NA NA","https://twitter.com/SPatuanelli/status/1459505728096555013","Stefano Patuanelli","Italia","Ministro delle Politiche Agricole Alimentari e Forestali","https://t.co/t6tFfNIr8I",FALSE,16929,738,217,1482,346,2011-06-18 18:09:13,TRUE,"https://t.co/t6tFfNIr8I","https://www.politicheagricole.it",,"https://pbs.twimg.com/profile_banners/319766967/1633009753","http://abs.twimg.com/images/themes/theme1/bg.png","http://pbs.twimg.com/profile_images/1457716826666897417/LqE4YinB_normal.jpg"
"x572473007","x1459450823105204224",2021-11-13 09:19:26,"PepePasquale1","Con tutte le repentine trasformazioni che ci saranno in questo tempo, quando si parla di lavoro non si può prescindere da due valori: la sicurezza e la stabilità.
Una sfida nella sfida! https://t.co/seN0P0A5os","Instagram",209,,,,FALSE,FALSE,0,0,,,,,"instagram.com/p/CWNfQXlra74/…","https://t.co/seN0P0A5os","https://www.instagram.com/p/CWNfQXlra74/?utm_medium=twitter",,,,,,,,,,,"it",,,,,,,,,,,,,,,,,,,,,,,,,,,,,,,,,,,,,"NA NA","NA NA","NA NA NA NA NA NA NA NA","https://twitter.com/PepePasquale1/status/1459450823105204224","Pasquale Pepe","","Avvocato. Romanista da sempre e per sempre. Dalla parte del Popolo, a prescindere!",,FALSE,881,717,12,2060,44,2012-05-06 09:40:27,FALSE,,,,,"http://abs.twimg.com/images/themes/theme1/bg.png","http://pbs.twimg.com/profile_images/634638036509310976/LMdKefXI_normal.jpg"
"x583596167","x1459564352143597571",2021-11-13 16:50:33,"PerilliM5Senato","Massima solidarietà e sostegno al Ministro degli Esteri @luigidimaio per le minacce ancora una volta ricevute dall’#ISIS.
Questi atti intimidatori non fermeranno l’impegno dell’Italia nella lotta al terrorismo.","Twitter for Android",210,,,,FALSE,FALSE,50,14,,,"ISIS",,,,,,,,,,,,,"x48062712","luigidimaio","it",,,,,,,,,,,,,,,,,,,,,,,,,,,,,,,,,,,,,"NA NA","NA NA","NA NA NA NA NA NA NA NA","https://twitter.com/PerilliM5Senato/status/1459564352143597571","Gianluca Perilli","Senato della Repubblica","Senatore del MoVimento 5 Stelle","https://t.co/dYbvFapguK",FALSE,3659,683,47,477,100,2012-05-18 08:23:19,TRUE,"https://t.co/dYbvFapguK","https://goo.gl/AHKvDD",,"https://pbs.twimg.com/profile_banners/583596167/1528735208","http://abs.twimg.com/images/themes/theme1/bg.png","http://pbs.twimg.com/profile_images/1263507828901318657/cGru4ZXC_normal.jpg"
"x102672182","x1459545224917790729",2021-11-13 15:34:33,"robertapinotti","Solidarietà al Ministro @luigidimaio per le minacce subite.
L'impegno dell’Italia nella lotta contro il terrorismo e contro ogni fondamentalismo non verrà meno. #13novembre","Twitter for iPhone",172,,,,FALSE,FALSE,33,8,,,"13novembre",,,,,,,,,,,,,"x48062712","luigidimaio","it",,,,,,,,,,,,,,,,,,,,,,,,,,,,,,,,,,,,,"NA NA","NA NA","NA NA NA NA NA NA NA NA","https://twitter.com/robertapinotti/status/1459545224917790729","Roberta Pinotti","","Senatrice del Partito Democratico","https://t.co/ZQoLx1Tx21",FALSE,123992,1753,764,11147,3462,2010-01-07 13:03:42,TRUE,"https://t.co/ZQoLx1Tx21","http://www.robertapinotti.it",,"https://pbs.twimg.com/profile_banners/102672182/1522225477","http://abs.twimg.com/images/themes/theme1/bg.png","http://pbs.twimg.com/profile_images/1093446366997684224/pnplPDaI_normal.jpg"
"x102672182","x1459492241865691136",2021-11-13 12:04:01,"robertapinotti","La sera del #13novembre di 6 anni fa un attacco terroristico senza precedenti sconvolse #Parigi e l'Europa uccidendo 130 persone e ferendone altre 400. Alla famiglia di #ValeriaSolesin e i familiari delle vittime la mia più sentita vicinanza. https://t.co/K3NZWghv6j","Twitter for iPhone",242,,,,FALSE,FALSE,41,7,,,"13novembre Parigi ValeriaSolesin",,,,,"http://pbs.twimg.com/media/FEEodOxXEAIoXr7.jpg","https://t.co/K3NZWghv6j","https://twitter.com/robertapinotti/status/1459492241865691136/photo/1","photo","http://pbs.twimg.com/media/FEEodOxXEAIoXr7.jpg","https://t.co/K3NZWghv6j","https://twitter.com/robertapinotti/status/1459492241865691136/photo/1",,,,"it",,,,,,,,,,,,,,,,,,,,,,,,,,,,,,,,,,,,,"NA NA","NA NA","NA NA NA NA NA NA NA NA","https://twitter.com/robertapinotti/status/1459492241865691136","Roberta Pinotti","","Senatrice del Partito Democratico","https://t.co/ZQoLx1Tx21",FALSE,123992,1753,764,11147,3462,2010-01-07 13:03:42,TRUE,"https://t.co/ZQoLx1Tx21","http://www.robertapinotti.it",,"https://pbs.twimg.com/profile_banners/102672182/1522225477","http://abs.twimg.com/images/themes/theme1/bg.png","http://pbs.twimg.com/profile_images/1093446366997684224/pnplPDaI_normal.jpg"
"x3062283743","x1459529764428001290",2021-11-13 14:33:07,"pirroelisa","Nulla potrà fermare l’impegno del nostro Paese contro il terrorismo e non di certo le minacce al nostro @luigidimaio che ha dimostrato già altre volte di non piegarsi e non arretrare. 
Siamo tutti al tuo fianco Luigi 
@Mov5Stelle #Terrorismo #ISIS","Twitter for iPhone",247,,,,FALSE,FALSE,16,4,,,"Terrorismo ISIS",,,,,,,,,,,,,"x48062712 x289400495","luigidimaio Mov5Stelle","it",,,,,,,,,,,,,,,,,,,,,,,,,,,,,,,,,,,,,"NA NA","NA NA","NA NA NA NA NA NA NA NA","https://twitter.com/pirroelisa/status/1459529764428001290","Elisa Pirro","Orbassano, Piemonte","Senatrice della Repubblica @M5S_Senato @Mov5Stelle. Capogruppo della 12ª Commissione permanente (Igiene e Sanità) del Senato",,FALSE,1652,207,24,1671,5299,2015-02-25 15:22:04,TRUE,,,,"https://pbs.twimg.com/profile_banners/3062283743/1632556454","http://abs.twimg.com/images/themes/theme1/bg.png","http://pbs.twimg.com/profile_images/1453376367471570955/OAKjL3bH_normal.jpg"
"x61230132","x1459520514423246849",2021-11-13 13:56:21,"enzopresutto_","Voglio esprimere la mia vicinanza al ministro @luigidimaio per le gravi minacce ricevute da parte dei terroristi ISIS. L’Italia continuerà a mettere in atto ogni manovra possibile nella battaglia contro il terrorismo che proseguirà senza sosta. @Mov5Stelle @M5S_Senato https://t.co/K9QYiu7zG5","Twitter for iPhone",268,,,,FALSE,FALSE,13,2,,,,,,,,"http://pbs.twimg.com/media/FEFCK7SXoAI8D49.jpg","https://t.co/K9QYiu7zG5","https://twitter.com/enzopresutto_/status/1459520514423246849/photo/1","photo","http://pbs.twimg.com/media/FEFCK7SXoAI8D49.jpg","https://t.co/K9QYiu7zG5","https://twitter.com/enzopresutto_/status/1459520514423246849/photo/1",,"x48062712 x289400495 x1343975432","luigidimaio Mov5Stelle M5S_Senato","it",,,,,,,,,,,,,,,,,,,,,,,,,,,,,,,,,,,,,"NA NA","NA NA","NA NA NA NA NA NA NA NA","https://twitter.com/enzopresutto_/status/1459520514423246849","Vincenzo Presutto","","Senatore del @Mov5Stelle | Vicepresidente della Commissione parlamentare sul Federalismo Fiscale, Componente Commissione Vigilanza su Cassa Depositi e Prestiti","https://t.co/a2kvoBz3mi",FALSE,1413,527,31,2240,1056,2009-07-29 16:09:52,TRUE,"https://t.co/a2kvoBz3mi","http://www.senato.it/leg/18/BGT/Schede/Attsen/00032696.htm",,"https://pbs.twimg.com/profile_banners/61230132/1571134711","http://abs.twimg.com/images/themes/theme4/bg.gif","http://pbs.twimg.com/profile_images/1415904961276354560/CbBvmWvN_normal.jpg"
"x376610294","x1459600084505698308",2021-11-13 19:12:32,"isabellarauti","A Fara Sabina e Passo Corese Mostra convegno ricorrenza caduta  #murodiberlino A 32 anni di distanza continuiamo a raccontare il crollo del simbolo più odioso dell’oppressione comunista che divise per 28 anni l’Europa. Attualità di una battaglia ideale per l’Europa dei popoli https://t.co/nUkmfzEPZy","Twitter for iPhone",276,,,,FALSE,FALSE,2,0,,,"murodiberlino",,,,,"http://pbs.twimg.com/media/FEGKiUuXIAYfEB-.jpg","https://t.co/nUkmfzEPZy","https://twitter.com/isabellarauti/status/1459600084505698308/photo/1","photo","http://pbs.twimg.com/media/FEGKiUuXIAYfEB-.jpg http://pbs.twimg.com/media/FEGKiUxXMAosMWA.jpg http://pbs.twimg.com/media/FEGKiU3XIAMXCix.jpg http://pbs.twimg.com/media/FEGKiWCWUAAa1ih.jpg","https://t.co/nUkmfzEPZy https://t.co/nUkmfzEPZy https://t.co/nUkmfzEPZy https://t.co/nUkmfzEPZy","https://twitter.com/isabellarauti/status/1459600084505698308/photo/1 https://twitter.com/isabellarauti/status/1459600084505698308/photo/1 https://twitter.com/isabellarauti/status/1459600084505698308/photo/1 https://twitter.com/isabellarauti/status/1459600084505698308/photo/1",,,,"it",,,,,,,,,,,,,,,,,,,,,,,,,,,,,,,,,,,,,"NA NA","NA NA","NA NA NA NA NA NA NA NA","https://twitter.com/isabellarauti/status/1459600084505698308","Isabella Rauti","","Giornalista, Dottore di Ricerca, Uff Esercito 🇮🇹, Senatrice, Vice Pres Gruppo FDI, Comm Difesa, Dipartimento Famiglia FDI, Associazione Pino Rauti, Onlus HOW","https://t.co/IE1TYO9vGj",FALSE,12432,5608,0,25969,15294,2011-09-20 05:48:40,TRUE,"https://t.co/IE1TYO9vGj","http://www.Isabellarauti.it",,"https://pbs.twimg.com/profile_banners/376610294/1580146815","http://abs.twimg.com/images/themes/theme1/bg.png","http://pbs.twimg.com/profile_images/699248798707621888/sTn5ZaWE_normal.jpg"
"x376610294","x1459590692855062534",2021-11-13 18:35:13,"isabellarauti","In Senato al “Premio al #volontariato 2021”riconoscimento istituzionale ai costruttori del #benecomune, al #nonprofit e al #Terzosettore Premiati i rappresentanti dell’esercito silenzioso della generosità e della #solidarietà che sostiene la nostra nazione. @FratellidItalia https://t.co/DDqTi6UETU","Twitter for iPhone",274,,,,FALSE,FALSE,3,0,,,"volontariato benecomune nonprofit Terzosettore solidarietà",,,,,"http://pbs.twimg.com/media/FEGB_sdXoAUk7dD.jpg","https://t.co/DDqTi6UETU","https://twitter.com/isabellarauti/status/1459590692855062534/photo/1","photo","http://pbs.twimg.com/media/FEGB_sdXoAUk7dD.jpg http://pbs.twimg.com/media/FEGB_sfXMAM1huI.jpg http://pbs.twimg.com/media/FEGB_sfXoAY4fzv.jpg http://pbs.twimg.com/media/FEGB_szXsAE-gSn.jpg","https://t.co/DDqTi6UETU https://t.co/DDqTi6UETU https://t.co/DDqTi6UETU https://t.co/DDqTi6UETU","https://twitter.com/isabellarauti/status/1459590692855062534/photo/1 https://twitter.com/isabellarauti/status/1459590692855062534/photo/1 https://twitter.com/isabellarauti/status/1459590692855062534/photo/1 https://twitter.com/isabellarauti/status/1459590692855062534/photo/1",,"x1024976264","FratellidItalia","it",,,,,,,,,,,,,,,,,,,,,,,,,,,,,,,,,,,,,"NA NA","NA NA","NA NA NA NA NA NA NA NA","https://twitter.com/isabellarauti/status/1459590692855062534","Isabella Rauti","","Giornalista, Dottore di Ricerca, Uff Esercito 🇮🇹, Senatrice, Vice Pres Gruppo FDI, Comm Difesa, Dipartimento Famiglia FDI, Associazione Pino Rauti, Onlus HOW","https://t.co/IE1TYO9vGj",FALSE,12432,5608,0,25969,15294,2011-09-20 05:48:40,TRUE,"https://t.co/IE1TYO9vGj","http://www.Isabellarauti.it",,"https://pbs.twimg.com/profile_banners/376610294/1580146815","http://abs.twimg.com/images/themes/theme1/bg.png","http://pbs.twimg.com/profile_images/699248798707621888/sTn5ZaWE_normal.jpg"
"x376610294","x1459574549268385801",2021-11-13 17:31:04,"isabellarauti","""A MAI PIU' DANNATO MURO"" convegno e mostra a Passo Corese dove porto il mio contributo storico ed emotivo sulla caduta del #murodiberlino 
Con @FratellidItalia #EmanueleMerlino @ChiaraColosimo #SimoneFratini @dansinibaldi  #FrancescoCarlesi #ChiaraCostantini https://t.co/ubz2acLzwh","Twitter Web App",259,,,,FALSE,FALSE,7,4,,,"murodiberlino EmanueleMerlino SimoneFratini FrancescoCarlesi ChiaraCostantini",,,,,"http://pbs.twimg.com/media/FEFzTh-XsAU5vXx.jpg","https://t.co/ubz2acLzwh","https://twitter.com/isabellarauti/status/1459574549268385801/photo/1","photo","http://pbs.twimg.com/media/FEFzTh-XsAU5vXx.jpg","https://t.co/ubz2acLzwh","https://twitter.com/isabellarauti/status/1459574549268385801/photo/1",,"x1024976264 x403051679 x2742049331","FratellidItalia ChiaraColosimo dansinibaldi","it",,,,,,,,,,,,,,,,,,,,,,,,,,,,,,,,,,,,,"NA NA","NA NA","NA NA NA NA NA NA NA NA","https://twitter.com/isabellarauti/status/1459574549268385801","Isabella Rauti","","Giornalista, Dottore di Ricerca, Uff Esercito 🇮🇹, Senatrice, Vice Pres Gruppo FDI, Comm Difesa, Dipartimento Famiglia FDI, Associazione Pino Rauti, Onlus HOW","https://t.co/IE1TYO9vGj",FALSE,12432,5608,0,25969,15294,2011-09-20 05:48:40,TRUE,"https://t.co/IE1TYO9vGj","http://www.Isabellarauti.it",,"https://pbs.twimg.com/profile_banners/376610294/1580146815","http://abs.twimg.com/images/themes/theme1/bg.png","http://pbs.twimg.com/profile_images/699248798707621888/sTn5ZaWE_normal.jpg"
"x376610294","x1459530325336461318",2021-11-13 14:35:20,"isabellarauti","❌❌❌ VERGOGNA : ARRIVA IL BLACK FRIDAY PER L’UTERO IN AFFITTO !
@FratellidItalia  continuerà a battersi, in ogni sede,  perché questa inumana e vergognosa pratica venga considerata #reatouniversale￼ 

#dipartimentopariopportunitàfamigliavalorinonnegoziabili @isabellarauti https://t.co/0qaCn9htBw","Twitter for iPhone",138,,,,FALSE,TRUE,0,3,,,,,,,,,,,,,,,,"x288764479 x1024976264","ChiaraScalzi85 FratellidItalia","it",,,,,,,,,,,,,,,,"x1459525990695292931","❌❌❌ VERGOGNA : ARRIVA IL BLACK FRIDAY PER L’UTERO IN AFFITTO !
@FratellidItalia  continuerà a battersi, in ogni sede,  perché questa inumana e vergognosa pratica venga considerata #reatouniversale￼ 

#dipartimentopariopportunitàfamigliavalorinonnegoziabili @isabellarauti https://t.co/0qaCn9htBw",2021-11-13 14:18:07,"Twitter for Android",3,3,"x288764479","ChiaraScalzi85","Chiara Scalzi",1788,975,13615,"Copertino-Lecce-Salento-Italy","Rendi forte i vecchi sogni perche' questo nostro mondo non perda coraggio(E.P) Dirigente Nazionale di @FratellidItalia 🇮🇹 #pariopportunita #Lecce #Salento",FALSE,,,,,,,"NA NA","NA NA","NA NA NA NA NA NA NA NA","https://twitter.com/isabellarauti/status/1459530325336461318","Isabella Rauti","","Giornalista, Dottore di Ricerca, Uff Esercito 🇮🇹, Senatrice, Vice Pres Gruppo FDI, Comm Difesa, Dipartimento Famiglia FDI, Associazione Pino Rauti, Onlus HOW","https://t.co/IE1TYO9vGj",FALSE,12432,5608,0,25969,15294,2011-09-20 05:48:40,TRUE,"https://t.co/IE1TYO9vGj","http://www.Isabellarauti.it",,"https://pbs.twimg.com/profile_banners/376610294/1580146815","http://abs.twimg.com/images/themes/theme1/bg.png","http://pbs.twimg.com/profile_images/699248798707621888/sTn5ZaWE_normal.jpg"
"x376610294","x1459521358510104578",2021-11-13 13:59:43,"isabellarauti","Utero in affitto. Rauti (FdI): bimba comprata e abbandonata conferma che serve legge. Raccogliere appello Meloni su reato universale https://t.co/LUthRWXiq4","Twitter Web App",140,,,,FALSE,TRUE,0,5,,,,,,,,,,,,,,,,"x998237902055395328","vocedelpatriota","it",,,,,,,,,,,,,,,,"x1459113352467292165","Utero in affitto. Rauti (FdI): bimba comprata e abbandonata conferma che serve legge. Raccogliere appello Meloni su reato universale https://t.co/LUthRWXiq4",2021-11-12 10:58:26,"WordPress.com",10,5,"x998237902055395328","vocedelpatriota","🇮🇹 La Voce del Patriota 🇮🇹",7307,3238,18228,"Italia","📰 Il Giornale dei Patrioti",FALSE,,,,,,,"NA NA","NA NA","NA NA NA NA NA NA NA NA","https://twitter.com/isabellarauti/status/1459521358510104578","Isabella Rauti","","Giornalista, Dottore di Ricerca, Uff Esercito 🇮🇹, Senatrice, Vice Pres Gruppo FDI, Comm Difesa, Dipartimento Famiglia FDI, Associazione Pino Rauti, Onlus HOW","https://t.co/IE1TYO9vGj",FALSE,12432,5608,0,25969,15294,2011-09-20 05:48:40,TRUE,"https://t.co/IE1TYO9vGj","http://www.Isabellarauti.it",,"https://pbs.twimg.com/profile_banners/376610294/1580146815","http://abs.twimg.com/images/themes/theme1/bg.png","http://pbs.twimg.com/profile_images/699248798707621888/sTn5ZaWE_normal.jpg"
"x18762875","x1459553561902211075",2021-11-13 16:07:41,"matteorenzi","Giuseppe Conte a #OttoeMezzo ha attaccato @ItaliaViva sulle autostrade. Qui spiego all’ex premier, già avvocato dei concessionari autostradali, che ha regalato 8 miliardi alla società dei Benetton. E nessuno che abbia il coraggio di dire la verità. Noi sì #ColpoSuColpo https://t.co/EXwHvEsEDF","Twitter Media Studio",269,,,,FALSE,FALSE,960,238,,,"OttoeMezzo ColpoSuColpo",,,,,"http://pbs.twimg.com/amplify_video_thumb/1459551636880306176/img/wABypOKF5ZREEBtr.jpg","https://t.co/EXwHvEsEDF","https://twitter.com/matteorenzi/status/1459553561902211075/video/1","photo","http://pbs.twimg.com/amplify_video_thumb/1459551636880306176/img/wABypOKF5ZREEBtr.jpg","https://t.co/EXwHvEsEDF","https://twitter.com/matteorenzi/status/1459553561902211075/video/1",,"x1059361525109010433","ItaliaViva","it",,,,,,,,,,,,,,,,,,,,,,,,,,,,,,,,,,,,,"NA NA","NA NA","NA NA NA NA NA NA NA NA","https://twitter.com/matteorenzi/status/1459553561902211075","Matteo Renzi","Italy","Senatore di Firenze - @ItaliaViva","https://t.co/c8MoZ1Wbev",FALSE,3334527,972,7420,13441,469,2009-01-08 13:15:21,TRUE,"https://t.co/c8MoZ1Wbev","https://linktr.ee/matteorenzi",,"https://pbs.twimg.com/profile_banners/18762875/1632829942","http://abs.twimg.com/images/themes/theme1/bg.png","http://pbs.twimg.com/profile_images/1456948557152464900/Btbc4-Xb_normal.jpg"
"x18762875","x1459498151761612802",2021-11-13 12:27:30,"matteorenzi","Quello che nessuno ha mai il coraggio di dire al pregiudicato diffamatore seriale Marco Travaglio. Tutte le settimane mi attacca in TV, ora iniziamo a rispondergli #Ottoemezzo #ColpoSuColpo https://t.co/KmiWIdTybx","Twitter Media Studio",189,,,,FALSE,FALSE,2039,429,,,"Ottoemezzo ColpoSuColpo",,,,,"http://pbs.twimg.com/amplify_video_thumb/1459497852707745792/img/wA7m-lR-pc5b5jEs.jpg","https://t.co/KmiWIdTybx","https://twitter.com/matteorenzi/status/1459498151761612802/video/1","photo","http://pbs.twimg.com/amplify_video_thumb/1459497852707745792/img/wA7m-lR-pc5b5jEs.jpg","https://t.co/KmiWIdTybx","https://twitter.com/matteorenzi/status/1459498151761612802/video/1",,,,"it",,,,,,,,,,,,,,,,,,,,,,,,,,,,,,,,,,,,,"NA NA","NA NA","NA NA NA NA NA NA NA NA","https://twitter.com/matteorenzi/status/1459498151761612802","Matteo Renzi","Italy","Senatore di Firenze - @ItaliaViva","https://t.co/c8MoZ1Wbev",FALSE,3334527,972,7420,13441,469,2009-01-08 13:15:21,TRUE,"https://t.co/c8MoZ1Wbev","https://linktr.ee/matteorenzi",,"https://pbs.twimg.com/profile_banners/18762875/1632829942","http://abs.twimg.com/images/themes/theme1/bg.png","http://pbs.twimg.com/profile_images/1456948557152464900/Btbc4-Xb_normal.jpg"
"x18762875","x1459489970947768322",2021-11-13 11:54:59,"matteorenzi","Ieri Massimo Giannini mi ha accusato di dire falsità sulla vicenda Carrai. Vedendo il video ed i documenti ciascuno può farsi un’idea della verità dei fatti #ColpoSuColpo https://t.co/uxT5vxyJF8","Twitter for iPhone",170,,,,FALSE,FALSE,1416,376,,,"ColpoSuColpo",,,,,"http://pbs.twimg.com/ext_tw_video_thumb/1459489895676796937/pu/img/NxdGE5UaYGWGjj4B.jpg","https://t.co/uxT5vxyJF8","https://twitter.com/matteorenzi/status/1459489970947768322/video/1","photo","http://pbs.twimg.com/ext_tw_video_thumb/1459489895676796937/pu/img/NxdGE5UaYGWGjj4B.jpg","https://t.co/uxT5vxyJF8","https://twitter.com/matteorenzi/status/1459489970947768322/video/1",,,,"it",,,,,,,,,,,,,,,,,,,,,,,,,,,,,,,,,,,,,"NA NA","NA NA","NA NA NA NA NA NA NA NA","https://twitter.com/matteorenzi/status/1459489970947768322","Matteo Renzi","Italy","Senatore di Firenze - @ItaliaViva","https://t.co/c8MoZ1Wbev",FALSE,3334527,972,7420,13441,469,2009-01-08 13:15:21,TRUE,"https://t.co/c8MoZ1Wbev","https://linktr.ee/matteorenzi",,"https://pbs.twimg.com/profile_banners/18762875/1632829942","http://abs.twimg.com/images/themes/theme1/bg.png","http://pbs.twimg.com/profile_images/1456948557152464900/Btbc4-Xb_normal.jpg"
"x1122573690","x1459491291985756161",2021-11-13 12:00:14,"erica_rivolta","🔴 BASTA FURBETTI DEL REDDITO DI CITTADINANZA, BASTA SPRECHI!! https://t.co/cPOt72Ta3x","Hootsuite Inc.",61,,,,FALSE,FALSE,1,1,,,,,,,,"http://pbs.twimg.com/ext_tw_video_thumb/1459489988492599298/pu/img/-DuaGmCu36lGIdrw.jpg","https://t.co/cPOt72Ta3x","https://twitter.com/erica_rivolta/status/1459491291985756161/video/1","photo","http://pbs.twimg.com/ext_tw_video_thumb/1459489988492599298/pu/img/-DuaGmCu36lGIdrw.jpg","https://t.co/cPOt72Ta3x","https://twitter.com/erica_rivolta/status/1459491291985756161/video/1",,,,"it",,,,,,,,,,,,,,,,,,,,,,,,,,,,,,,,,,,,,"NA NA","NA NA","NA NA NA NA NA NA NA NA","https://twitter.com/erica_rivolta/status/1459491291985756161","Erica Rivolta","Erba (CO)","🟢 SENATRICE LEGA (Vice Presidente della Commissione Bilancio)📍Vice Sindaco/Assessore Lega - Comune di Erba","https://t.co/8MWzTAMw85",FALSE,1015,185,17,1932,373,2013-01-26 17:05:04,TRUE,"https://t.co/8MWzTAMw85","http://www.senato.it/leg/18/BGT/Schede/Attsen/00025415.htm",,"https://pbs.twimg.com/profile_banners/1122573690/1591381827","http://abs.twimg.com/images/themes/theme13/bg.gif","http://pbs.twimg.com/profile_images/961570463460855811/wfFcEjNJ_normal.jpg"
"x1122573690","x1459476158823682050",2021-11-13 11:00:06,"erica_rivolta","LEGGE CONTRO I RAVE, #SALVINI PRIMO FIRMATARIO

https://t.co/nycTG7GF4y","Hootsuite Inc.",71,,,,FALSE,FALSE,0,0,,,"SALVINI",,"ow.ly/QUpc30s0rFy","https://t.co/nycTG7GF4y","http://ow.ly/QUpc30s0rFy",,,,,,,,,,,"it",,,,,,,,,,,,,,,,,,,,,,,,,,,,,,,,,,,,,"NA NA","NA NA","NA NA NA NA NA NA NA NA","https://twitter.com/erica_rivolta/status/1459476158823682050","Erica Rivolta","Erba (CO)","🟢 SENATRICE LEGA (Vice Presidente della Commissione Bilancio)📍Vice Sindaco/Assessore Lega - Comune di Erba","https://t.co/8MWzTAMw85",FALSE,1015,185,17,1932,373,2013-01-26 17:05:04,TRUE,"https://t.co/8MWzTAMw85","http://www.senato.it/leg/18/BGT/Schede/Attsen/00025415.htm",,"https://pbs.twimg.com/profile_banners/1122573690/1591381827","http://abs.twimg.com/images/themes/theme13/bg.gif","http://pbs.twimg.com/profile_images/961570463460855811/wfFcEjNJ_normal.jpg"
"x3556304655","x1459434024917737476",2021-11-13 08:12:41,"iunioromano","Oggi sono in piazza a Roma i lavoratori #edili per la manifestazione nazionale organizzata dai sindacati di settore. Si sente sempre più il bisogno di una seria riflessione su quanto ancora resta da fare per radicare una solida e consapevole cultura della #sicurezzasullavoro. https://t.co/l18JiXGiLi","Twitter for Android",276,,,,FALSE,FALSE,2,0,,,"edili sicurezzasullavoro",,,,,"http://pbs.twimg.com/media/FEDzgahWQAEhs8U.jpg","https://t.co/l18JiXGiLi","https://twitter.com/iunioromano/status/1459434024917737476/photo/1","photo","http://pbs.twimg.com/media/FEDzgahWQAEhs8U.jpg","https://t.co/l18JiXGiLi","https://twitter.com/iunioromano/status/1459434024917737476/photo/1",,,,"it",,,,,,,,,,,,,,,,,,,,,,,,,,,,,,,,,,,,,"NA NA","NA NA","NA NA NA NA NA NA NA NA","https://twitter.com/iunioromano/status/1459434024917737476","Iunio Valerio Romano","","Senatore della Repubblica Italiana 🇮🇹
@Mov5Stelle 
https://t.co/lKbz1cADhD","https://t.co/LQRw56YgUJ",FALSE,631,1082,10,337,58,2015-09-05 14:39:17,TRUE,"https://t.co/LQRw56YgUJ","http://www.senato.it/leg/18/BGT/Schede/Attsen/00032705.htm",,"https://pbs.twimg.com/profile_banners/3556304655/1571259894","http://abs.twimg.com/images/themes/theme1/bg.png","http://pbs.twimg.com/profile_images/1158359679136927745/u6YVJ-BE_normal.jpg"
"x478868933","x1459637015323070471",2021-11-13 21:39:17,"mruspandini","La coerenza in un simbolo 🇮🇹 @FratellidItalia #Meloni #fratelliditalia https://t.co/IrA6SZCHBE","Twitter for iPhone",70,,,,FALSE,FALSE,6,1,,,"Meloni fratelliditalia",,,,,"http://pbs.twimg.com/media/FEGsINgXwAw_8IY.jpg","https://t.co/IrA6SZCHBE","https://twitter.com/mruspandini/status/1459637015323070471/photo/1","photo","http://pbs.twimg.com/media/FEGsINgXwAw_8IY.jpg","https://t.co/IrA6SZCHBE","https://twitter.com/mruspandini/status/1459637015323070471/photo/1",,"x1024976264","FratellidItalia","it",,,,,,,,,,,,,,,,,,,,,,,,,,,,,,,,,,,,,"NA NA","NA NA","NA NA NA NA NA NA NA NA","https://twitter.com/mruspandini/status/1459637015323070471","Massimo Ruspandini","","Senatore di @FratellidItalia 🇮🇹",,FALSE,1563,206,12,4606,2424,2012-01-30 19:12:00,FALSE,,,,"https://pbs.twimg.com/profile_banners/478868933/1547153715","http://abs.twimg.com/images/themes/theme1/bg.png","http://pbs.twimg.com/profile_images/1380855982213988352/3Htl6lxB_normal.jpg"
