"user_id","status_id","created_at","screen_name","text","source","display_text_width","reply_to_status_id","reply_to_user_id","reply_to_screen_name","is_quote","is_retweet","favorite_count","retweet_count","quote_count","reply_count","hashtags","symbols","urls_url","urls_t.co","urls_expanded_url","media_url","media_t.co","media_expanded_url","media_type","ext_media_url","ext_media_t.co","ext_media_expanded_url","ext_media_type","mentions_user_id","mentions_screen_name","lang","quoted_status_id","quoted_text","quoted_created_at","quoted_source","quoted_favorite_count","quoted_retweet_count","quoted_user_id","quoted_screen_name","quoted_name","quoted_followers_count","quoted_friends_count","quoted_statuses_count","quoted_location","quoted_description","quoted_verified","retweet_status_id","retweet_text","retweet_created_at","retweet_source","retweet_favorite_count","retweet_retweet_count","retweet_user_id","retweet_screen_name","retweet_name","retweet_followers_count","retweet_friends_count","retweet_statuses_count","retweet_location","retweet_description","retweet_verified","place_url","place_name","place_full_name","place_type","country","country_code","geo_coords","coords_coords","bbox_coords","status_url","name","location","description","url","protected","followers_count","friends_count","listed_count","statuses_count","favourites_count","account_created_at","verified","profile_url","profile_expanded_url","account_lang","profile_banner_url","profile_background_url","profile_image_url"
"x270839361","x1476873903364624385",2021-12-31 11:12:32,"matteosalvinimi","Chiedo al Presidente Draghi di convocare anche imprese e segretari di partito.
Famiglie e attività produttive non aspettano.","Twitter for iPhone",124,"x1476873902089543681","x270839361","matteosalvinimi",FALSE,FALSE,125,26,,,,,,,,,,,,,,,,,,"it",,,,,,,,,,,,,,,,,,,,,,,,,,,,,,,,,,,,,"NA NA","NA NA","NA NA NA NA NA NA NA NA","https://twitter.com/matteosalvinimi/status/1476873903364624385","Matteo Salvini","","Leader della Lega #primagliitaliani 🇮🇹","https://t.co/sj3rr6DU3N",FALSE,1433776,2027,3054,52365,3842,2011-03-23 10:32:56,TRUE,"https://t.co/sj3rr6DU3N","https://legaonline.it/",,"https://pbs.twimg.com/profile_banners/270839361/1640371298","http://abs.twimg.com/images/themes/theme1/bg.png","http://pbs.twimg.com/profile_images/966325945060732928/0Ua5xPMX_normal.jpg"
"x270839361","x1476873902089543681",2021-12-31 11:12:31,"matteosalvinimi","Insieme all’emergenza Covid, questa è la vera urgenza dei prossimi mesi. Ognuno deve portare idee e prendersi le proprie responsabilità, i troppi no ideologici degli ultimi anni hanno bloccato e impoverito l’Italia.","Twitter for iPhone",215,"x1476873899375837184","x270839361","matteosalvinimi",FALSE,FALSE,131,22,,,,,,,,,,,,,,,,,,"it",,,,,,,,,,,,,,,,,,,,,,,,,,,,,,,,,,,,,"NA NA","NA NA","NA NA NA NA NA NA NA NA","https://twitter.com/matteosalvinimi/status/1476873902089543681","Matteo Salvini","","Leader della Lega #primagliitaliani 🇮🇹","https://t.co/sj3rr6DU3N",FALSE,1433776,2027,3054,52365,3842,2011-03-23 10:32:56,TRUE,"https://t.co/sj3rr6DU3N","https://legaonline.it/",,"https://pbs.twimg.com/profile_banners/270839361/1640371298","http://abs.twimg.com/images/themes/theme1/bg.png","http://pbs.twimg.com/profile_images/966325945060732928/0Ua5xPMX_normal.jpg"
"x270839361","x1476873899375837184",2021-12-31 11:12:31,"matteosalvinimi","Chiediamo formalmente un tavolo nazionale, anzi una “cabina di regia” come dicono adesso, sul tema caro-bollette luce e gas, una mazzata da 1.000 euro a famiglia e da 30 miliardi per negozi, artigiani e imprese. https://t.co/SMD8uFZNpC","Twitter for iPhone",211,,,,FALSE,FALSE,305,62,,,,,,,,"http://pbs.twimg.com/media/FH7o-t8WQAEhOlS.jpg","https://t.co/SMD8uFZNpC","https://twitter.com/matteosalvinimi/status/1476873899375837184/photo/1","photo","http://pbs.twimg.com/media/FH7o-t8WQAEhOlS.jpg","https://t.co/SMD8uFZNpC","https://twitter.com/matteosalvinimi/status/1476873899375837184/photo/1",,,,"it",,,,,,,,,,,,,,,,,,,,,,,,,,,,,,,,,,,,,"NA NA","NA NA","NA NA NA NA NA NA NA NA","https://twitter.com/matteosalvinimi/status/1476873899375837184","Matteo Salvini","","Leader della Lega #primagliitaliani 🇮🇹","https://t.co/sj3rr6DU3N",FALSE,1433776,2027,3054,52365,3842,2011-03-23 10:32:56,TRUE,"https://t.co/sj3rr6DU3N","https://legaonline.it/",,"https://pbs.twimg.com/profile_banners/270839361/1640371298","http://abs.twimg.com/images/themes/theme1/bg.png","http://pbs.twimg.com/profile_images/966325945060732928/0Ua5xPMX_normal.jpg"
"x270839361","x1476845173262979075",2021-12-31 09:18:22,"matteosalvinimi","Chiedo al Presidente Draghi di convocare anche imprese e segretari di partito, famiglie e attività produttive non aspettano.","Twitter for iPhone",124,"x1476845171388076032","x270839361","matteosalvinimi",FALSE,FALSE,225,26,,,,,,,,,,,,,,,,,,"it",,,,,,,,,,,,,,,,,,,,,,,,,,,,,,,,,,,,,"NA NA","NA NA","NA NA NA NA NA NA NA NA","https://twitter.com/matteosalvinimi/status/1476845173262979075","Matteo Salvini","","Leader della Lega #primagliitaliani 🇮🇹","https://t.co/sj3rr6DU3N",FALSE,1433776,2027,3054,52365,3842,2011-03-23 10:32:56,TRUE,"https://t.co/sj3rr6DU3N","https://legaonline.it/",,"https://pbs.twimg.com/profile_banners/270839361/1640371298","http://abs.twimg.com/images/themes/theme1/bg.png","http://pbs.twimg.com/profile_images/966325945060732928/0Ua5xPMX_normal.jpg"
"x270839361","x1476845171388076032",2021-12-31 09:18:21,"matteosalvinimi","Insieme all’emergenza Covid, questa è la vera urgenza dei prossimi mesi. Ognuno deve portare idee e prendersi le proprie responsabilità, i troppi no ideologici degli ultimi anni hanno bloccato e impoverito l’Italia.","Twitter for iPhone",215,"x1476845170012438530","x270839361","matteosalvinimi",FALSE,FALSE,257,32,,,,,,,,,,,,,,,,,,"it",,,,,,,,,,,,,,,,,,,,,,,,,,,,,,,,,,,,,"NA NA","NA NA","NA NA NA NA NA NA NA NA","https://twitter.com/matteosalvinimi/status/1476845171388076032","Matteo Salvini","","Leader della Lega #primagliitaliani 🇮🇹","https://t.co/sj3rr6DU3N",FALSE,1433776,2027,3054,52365,3842,2011-03-23 10:32:56,TRUE,"https://t.co/sj3rr6DU3N","https://legaonline.it/",,"https://pbs.twimg.com/profile_banners/270839361/1640371298","http://abs.twimg.com/images/themes/theme1/bg.png","http://pbs.twimg.com/profile_images/966325945060732928/0Ua5xPMX_normal.jpg"
"x270839361","x1476845170012438530",2021-12-31 09:18:21,"matteosalvinimi","Chiediamo formalmente un tavolo nazionale, anzi una “cabina di regia” come dicono adesso, sul tema caro-bollette luce e gas, una mazzata da 1.000 euro a famiglia e da 30 miliardi per negozi, artigiani e imprese.","Twitter for iPhone",211,,,,FALSE,FALSE,630,105,,,,,,,,,,,,,,,,,,"it",,,,,,,,,,,,,,,,,,,,,,,,,,,,,,,,,,,,,"NA NA","NA NA","NA NA NA NA NA NA NA NA","https://twitter.com/matteosalvinimi/status/1476845170012438530","Matteo Salvini","","Leader della Lega #primagliitaliani 🇮🇹","https://t.co/sj3rr6DU3N",FALSE,1433776,2027,3054,52365,3842,2011-03-23 10:32:56,TRUE,"https://t.co/sj3rr6DU3N","https://legaonline.it/",,"https://pbs.twimg.com/profile_banners/270839361/1640371298","http://abs.twimg.com/images/themes/theme1/bg.png","http://pbs.twimg.com/profile_images/966325945060732928/0Ua5xPMX_normal.jpg"
"x270839361","x1476674549374672900",2021-12-30 22:00:22,"matteosalvinimi","Riforma della Giustizia, urgenza nazionale.
Una preghiera per Angelo. https://t.co/owLSFC51Da","Twitter for iPhone",69,,,,FALSE,FALSE,525,70,,,,,,,,"http://pbs.twimg.com/media/FH4zrDaXwAcDq6v.jpg","https://t.co/owLSFC51Da","https://twitter.com/matteosalvinimi/status/1476674549374672900/photo/1","photo","http://pbs.twimg.com/media/FH4zrDaXwAcDq6v.jpg","https://t.co/owLSFC51Da","https://twitter.com/matteosalvinimi/status/1476674549374672900/photo/1",,,,"it",,,,,,,,,,,,,,,,,,,,,,,,,,,,,,,,,,,,,"NA NA","NA NA","NA NA NA NA NA NA NA NA","https://twitter.com/matteosalvinimi/status/1476674549374672900","Matteo Salvini","","Leader della Lega #primagliitaliani 🇮🇹","https://t.co/sj3rr6DU3N",FALSE,1433776,2027,3054,52365,3842,2011-03-23 10:32:56,TRUE,"https://t.co/sj3rr6DU3N","https://legaonline.it/",,"https://pbs.twimg.com/profile_banners/270839361/1640371298","http://abs.twimg.com/images/themes/theme1/bg.png","http://pbs.twimg.com/profile_images/966325945060732928/0Ua5xPMX_normal.jpg"
"x48062712","x1476865744486998040",2021-12-31 10:40:06,"luigidimaio","Un altro anno intenso alla Farnesina.
Abbiamo portato a casa risultati importanti per il Paese. Risultati che confermano la leadership dell'Italia a livello internazionale.
#Buon2022 a tutti 🇮🇹
➡️ https://t.co/qgYUGbF6df","Twitter for iPhone",220,,,,FALSE,FALSE,169,33,,,"Buon2022",,"bit.ly/3eFv0SQ","https://t.co/qgYUGbF6df","https://bit.ly/3eFv0SQ",,,,,,,,,,,"it",,,,,,,,,,,,,,,,,,,,,,,,,,,,,,,,,,,,,"NA NA","NA NA","NA NA NA NA NA NA NA NA","https://twitter.com/luigidimaio/status/1476865744486998040","Luigi Di Maio","Pomigliano d'Arco, Campania","Ministro degli Affari Esteri e della Cooperazione Internazionale.","https://t.co/D8gkagqksG",FALSE,743521,349,2127,6808,347,2009-06-17 18:34:46,TRUE,"https://t.co/D8gkagqksG","http://www.luigidimaio.it",,"https://pbs.twimg.com/profile_banners/48062712/1634667505","http://abs.twimg.com/images/themes/theme1/bg.png","http://pbs.twimg.com/profile_images/933106806670462976/YyC7LOW8_normal.jpg"
"x1075084718","x1476911453819056129",2021-12-31 13:41:44,"arrigoni_paolo","Finanziaria 2022: poca attenzione al settore automotive.

Stanziati solo 50 milioni, contro il miliardo di ulteriore rifinanziamento al reddito di cittadinanza. 
Il finanziamento dell'auto elettrica? Spreco di denaro pubblico👇
https://t.co/VXatZp1msA","Twitter for Android",250,,,,FALSE,FALSE,0,0,,,,,"ilnordestquotidiano.it/2021/12/29/fin…","https://t.co/VXatZp1msA","https://www.ilnordestquotidiano.it/2021/12/29/finanziaria-2022-nessuna-attenzione-al-settore-automotive/?utm_source=www.ilnordestquotidiano.it",,,,,,,,,,,"it",,,,,,,,,,,,,,,,,,,,,,,,,,,,,,,,,,,,,"NA NA","NA NA","NA NA NA NA NA NA NA NA","https://twitter.com/arrigoni_paolo/status/1476911453819056129","Paolo Arrigoni","Calolziocorte, Lombardia","Questore del Senato della Repubblica, componente della Commissione Ambiente e del Copasir. Responsabile del Dipartimento Energia della Lega.","https://t.co/M6TePkOvfO",FALSE,4690,181,56,9698,110,2013-01-09 22:36:27,TRUE,"https://t.co/M6TePkOvfO","http://www.senato.it/leg/18/BGT/Schede/Attsen/00029039.htm",,"https://pbs.twimg.com/profile_banners/1075084718/1591968708","http://abs.twimg.com/images/themes/theme1/bg.png","http://pbs.twimg.com/profile_images/3172370357/bec3e4497d64c77f2a93bc9792055992_normal.jpeg"
"x101602652","x1476939961853263874",2021-12-31 15:35:01,"augussori","✅ 5 MILIONI DI EURO PER INDENNIZZARE I LAVORATORI FRAGILI

#Lega #LegaSenato #leggedibilancio https://t.co/6LRW4mrP0m","Twitter for iPhone",93,,,,FALSE,FALSE,2,0,,,"Lega LegaSenato leggedibilancio",,,,,"http://pbs.twimg.com/media/FH8lEPTXEA8UXIr.jpg","https://t.co/6LRW4mrP0m","https://twitter.com/augussori/status/1476939961853263874/photo/1","photo","http://pbs.twimg.com/media/FH8lEPTXEA8UXIr.jpg","https://t.co/6LRW4mrP0m","https://twitter.com/augussori/status/1476939961853263874/photo/1",,,,"it",,,,,,,,,,,,,,,,,,,,,,,,,,,,,,,,,,,,,"NA NA","NA NA","NA NA NA NA NA NA NA NA","https://twitter.com/augussori/status/1476939961853263874","Luigi Augussori","Lodi, Lombardy","Profilo del sen. Luigi Augussori, rappresentante lodigiano nel Senato della Repubblica per il gruppo Lega - Salvini Premier. https://t.co/RVDZN85Ue5","https://t.co/494Lk5LQeR",FALSE,967,787,16,3296,328,2010-01-03 23:39:00,TRUE,"https://t.co/494Lk5LQeR","http://www.senato.it/leg/18/BGT/Schede/Attsen/00019244.htm",,"https://pbs.twimg.com/profile_banners/101602652/1536334347","http://abs.twimg.com/images/themes/theme1/bg.png","http://pbs.twimg.com/profile_images/1397968025198989317/FpsdhGWL_normal.jpg"
"x101602652","x1476912876355035160",2021-12-31 13:47:24,"augussori","✅IL NOSTRO VINO, CON APPOSITO QR CODE SULLE ETICHETTE, DIVENTERÀ AMBASCIATORE DELL’ITALIA NEL MONDO PROMUOVENDO IL MADE IN ITALY 

#Lega #LegaSenato #leggedibilancio https://t.co/D3SBJBe4Rb","Twitter for iPhone",165,,,,FALSE,FALSE,0,0,,,"Lega LegaSenato leggedibilancio",,,,,"http://pbs.twimg.com/media/FH8MbqBXoBYc6mY.jpg","https://t.co/D3SBJBe4Rb","https://twitter.com/augussori/status/1476912876355035160/photo/1","photo","http://pbs.twimg.com/media/FH8MbqBXoBYc6mY.jpg","https://t.co/D3SBJBe4Rb","https://twitter.com/augussori/status/1476912876355035160/photo/1",,,,"it",,,,,,,,,,,,,,,,,,,,,,,,,,,,,,,,,,,,,"NA NA","NA NA","NA NA NA NA NA NA NA NA","https://twitter.com/augussori/status/1476912876355035160","Luigi Augussori","Lodi, Lombardy","Profilo del sen. Luigi Augussori, rappresentante lodigiano nel Senato della Repubblica per il gruppo Lega - Salvini Premier. https://t.co/RVDZN85Ue5","https://t.co/494Lk5LQeR",FALSE,967,787,16,3296,328,2010-01-03 23:39:00,TRUE,"https://t.co/494Lk5LQeR","http://www.senato.it/leg/18/BGT/Schede/Attsen/00019244.htm",,"https://pbs.twimg.com/profile_banners/101602652/1536334347","http://abs.twimg.com/images/themes/theme1/bg.png","http://pbs.twimg.com/profile_images/1397968025198989317/FpsdhGWL_normal.jpg"
"x101602652","x1476865148992299015",2021-12-31 10:37:45,"augussori","🟢Tangenziale di Lodi: ok a proposta Lega alla legge di bilancio in Parlamento🟢

👉🏻https://t.co/Ltgx73wyqP

#Lega #LegaSenato #TangenzialeLodi #Anas #MIMS #MinisteroInfrastrutture #Lodi #Lodigiano https://t.co/gklAwgyOOu","Twitter for iPhone",195,,,,FALSE,FALSE,0,0,,,"Lega LegaSenato TangenzialeLodi Anas MIMS MinisteroInfrastrutture Lodi Lodigiano",,"facebook.com/286548979095/p…","https://t.co/Ltgx73wyqP","https://www.facebook.com/286548979095/posts/10159593628579096/","http://pbs.twimg.com/media/FH7hA-MXIBk78Y2.jpg","https://t.co/gklAwgyOOu","https://twitter.com/augussori/status/1476865148992299015/photo/1","photo","http://pbs.twimg.com/media/FH7hA-MXIBk78Y2.jpg","https://t.co/gklAwgyOOu","https://twitter.com/augussori/status/1476865148992299015/photo/1",,,,"it",,,,,,,,,,,,,,,,,,,,,,,,,,,,,,,,,,,,,"NA NA","NA NA","NA NA NA NA NA NA NA NA","https://twitter.com/augussori/status/1476865148992299015","Luigi Augussori","Lodi, Lombardy","Profilo del sen. Luigi Augussori, rappresentante lodigiano nel Senato della Repubblica per il gruppo Lega - Salvini Premier. https://t.co/RVDZN85Ue5","https://t.co/494Lk5LQeR",FALSE,967,787,16,3296,328,2010-01-03 23:39:00,TRUE,"https://t.co/494Lk5LQeR","http://www.senato.it/leg/18/BGT/Schede/Attsen/00019244.htm",,"https://pbs.twimg.com/profile_banners/101602652/1536334347","http://abs.twimg.com/images/themes/theme1/bg.png","http://pbs.twimg.com/profile_images/1397968025198989317/FpsdhGWL_normal.jpg"
"x876541483","x1476896698526048271",2021-12-31 12:43:06,"AlbertoBagnai","Ricordo che: https://t.co/Yury0xzNNP (così lasciamo in pace il povero Lucifero 😈, che ha già i suoi problemi senza bisogno che lo tiriamo per la giacchetta)…","Twitter for iPhone",157,,,,FALSE,FALSE,127,46,,,,,"ilfattoquotidiano.it/2021/08/10/i-v…","https://t.co/Yury0xzNNP","https://www.ilfattoquotidiano.it/2021/08/10/i-vaccini-biontech-regalano-al-pil-tedesco-una-spinta-dello-05-leconomista-dullien-risultato-straordinario-per-una-start-up/6287608/",,,,,,,,,,,"it",,,,,,,,,,,,,,,,,,,,,,,,,,,,,,,,,,,,,"NA NA","NA NA","NA NA NA NA NA NA NA NA","https://twitter.com/AlbertoBagnai/status/1476896698526048271","Alberto Bagnai","","Professore associato di politica economica all’Università Gabriele d’Annunzio, eletto al Senato per la Lega nel collegio Abruzzo 01.","https://t.co/sC5RvUzmsX",FALSE,130118,666,656,221248,6465,2012-10-12 22:13:36,TRUE,"https://t.co/sC5RvUzmsX","http://www.senato.it/leg/18/BGT/Schede/Attsen/00032582.htm",,"https://pbs.twimg.com/profile_banners/876541483/1535647109","http://abs.twimg.com/images/themes/theme1/bg.png","http://pbs.twimg.com/profile_images/849030859462246401/ATk3_aiW_normal.jpg"
"x876541483","x1476874622003990528",2021-12-31 11:15:23,"AlbertoBagnai","@MarinoMorgana Ma, sai, io sostengo che “l’infane tessera verde” sia un presupposto molto labile su cui costruire una coscienza di classe. Però i criteri non sono tassativi.","Twitter for iPhone",158,"x1476873969512894465","x1347002841559412737","MarinoMorgana",FALSE,FALSE,26,1,,,,,,,,,,,,,,,,"x1347002841559412737","MarinoMorgana","it",,,,,,,,,,,,,,,,,,,,,,,,,,,,,,,,,,,,,"NA NA","NA NA","NA NA NA NA NA NA NA NA","https://twitter.com/AlbertoBagnai/status/1476874622003990528","Alberto Bagnai","","Professore associato di politica economica all’Università Gabriele d’Annunzio, eletto al Senato per la Lega nel collegio Abruzzo 01.","https://t.co/sC5RvUzmsX",FALSE,130118,666,656,221248,6465,2012-10-12 22:13:36,TRUE,"https://t.co/sC5RvUzmsX","http://www.senato.it/leg/18/BGT/Schede/Attsen/00032582.htm",,"https://pbs.twimg.com/profile_banners/876541483/1535647109","http://abs.twimg.com/images/themes/theme1/bg.png","http://pbs.twimg.com/profile_images/849030859462246401/ATk3_aiW_normal.jpg"
"x876541483","x1476873817742000128",2021-12-31 11:12:11,"AlbertoBagnai","@MarinoMorgana Dici?","Twitter for iPhone",5,"x1476871239805423619","x1347002841559412737","MarinoMorgana",FALSE,FALSE,9,0,,,,,,,,,,,,,,,,"x1347002841559412737","MarinoMorgana","es",,,,,,,,,,,,,,,,,,,,,,,,,,,,,,,,,,,,,"NA NA","NA NA","NA NA NA NA NA NA NA NA","https://twitter.com/AlbertoBagnai/status/1476873817742000128","Alberto Bagnai","","Professore associato di politica economica all’Università Gabriele d’Annunzio, eletto al Senato per la Lega nel collegio Abruzzo 01.","https://t.co/sC5RvUzmsX",FALSE,130118,666,656,221248,6465,2012-10-12 22:13:36,TRUE,"https://t.co/sC5RvUzmsX","http://www.senato.it/leg/18/BGT/Schede/Attsen/00032582.htm",,"https://pbs.twimg.com/profile_banners/876541483/1535647109","http://abs.twimg.com/images/themes/theme1/bg.png","http://pbs.twimg.com/profile_images/849030859462246401/ATk3_aiW_normal.jpg"
"x876541483","x1476873557133209600",2021-12-31 11:11:09,"AlbertoBagnai","@GiordanoRossi_ Proprio in questa!?","Twitter for iPhone",19,"x1476671126076104705","x869626455193513984","GiordanoRossi_",FALSE,FALSE,4,0,,,,,,,,,,,,,,,,"x869626455193513984","GiordanoRossi_","it",,,,,,,,,,,,,,,,,,,,,,,,,,,,,,,,,,,,,"NA NA","NA NA","NA NA NA NA NA NA NA NA","https://twitter.com/AlbertoBagnai/status/1476873557133209600","Alberto Bagnai","","Professore associato di politica economica all’Università Gabriele d’Annunzio, eletto al Senato per la Lega nel collegio Abruzzo 01.","https://t.co/sC5RvUzmsX",FALSE,130118,666,656,221248,6465,2012-10-12 22:13:36,TRUE,"https://t.co/sC5RvUzmsX","http://www.senato.it/leg/18/BGT/Schede/Attsen/00032582.htm",,"https://pbs.twimg.com/profile_banners/876541483/1535647109","http://abs.twimg.com/images/themes/theme1/bg.png","http://pbs.twimg.com/profile_images/849030859462246401/ATk3_aiW_normal.jpg"
"x876541483","x1476871814718623745",2021-12-31 11:04:14,"AlbertoBagnai","@aldo_ritmo Anche tu!","Twitter for iPhone",9,"x1476631986903076866","x1423575267025559555","aldo_ritmo",FALSE,FALSE,3,0,,,,,,,,,,,,,,,,"x1423575267025559555","aldo_ritmo","it",,,,,,,,,,,,,,,,,,,,,,,,,,,,,,,,,,,,,"NA NA","NA NA","NA NA NA NA NA NA NA NA","https://twitter.com/AlbertoBagnai/status/1476871814718623745","Alberto Bagnai","","Professore associato di politica economica all’Università Gabriele d’Annunzio, eletto al Senato per la Lega nel collegio Abruzzo 01.","https://t.co/sC5RvUzmsX",FALSE,130118,666,656,221248,6465,2012-10-12 22:13:36,TRUE,"https://t.co/sC5RvUzmsX","http://www.senato.it/leg/18/BGT/Schede/Attsen/00032582.htm",,"https://pbs.twimg.com/profile_banners/876541483/1535647109","http://abs.twimg.com/images/themes/theme1/bg.png","http://pbs.twimg.com/profile_images/849030859462246401/ATk3_aiW_normal.jpg"
"x876541483","x1476871314266804225",2021-12-31 11:02:14,"AlbertoBagnai","@Storace Sei fortunato.","Twitter for iPhone",14,"x1476851860317294592","x602903174","Storace",FALSE,FALSE,19,1,,,,,,,,,,,,,,,,"x602903174","Storace","it",,,,,,,,,,,,,,,,,,,,,,,,,,,,,,,,,,,,,"NA NA","NA NA","NA NA NA NA NA NA NA NA","https://twitter.com/AlbertoBagnai/status/1476871314266804225","Alberto Bagnai","","Professore associato di politica economica all’Università Gabriele d’Annunzio, eletto al Senato per la Lega nel collegio Abruzzo 01.","https://t.co/sC5RvUzmsX",FALSE,130118,666,656,221248,6465,2012-10-12 22:13:36,TRUE,"https://t.co/sC5RvUzmsX","http://www.senato.it/leg/18/BGT/Schede/Attsen/00032582.htm",,"https://pbs.twimg.com/profile_banners/876541483/1535647109","http://abs.twimg.com/images/themes/theme1/bg.png","http://pbs.twimg.com/profile_images/849030859462246401/ATk3_aiW_normal.jpg"
"x876541483","x1476870727282446338",2021-12-31 10:59:54,"AlbertoBagnai","Aggiungerei una quarta legge: iscritto dal 2020 = click.","Twitter for iPhone",56,,,,FALSE,FALSE,128,10,,,,,,,,,,,,,,,,,,"it",,,,,,,,,,,,,,,,,,,,,,,,,,,,,,,,,,,,,"NA NA","NA NA","NA NA NA NA NA NA NA NA","https://twitter.com/AlbertoBagnai/status/1476870727282446338","Alberto Bagnai","","Professore associato di politica economica all’Università Gabriele d’Annunzio, eletto al Senato per la Lega nel collegio Abruzzo 01.","https://t.co/sC5RvUzmsX",FALSE,130118,666,656,221248,6465,2012-10-12 22:13:36,TRUE,"https://t.co/sC5RvUzmsX","http://www.senato.it/leg/18/BGT/Schede/Attsen/00032582.htm",,"https://pbs.twimg.com/profile_banners/876541483/1535647109","http://abs.twimg.com/images/themes/theme1/bg.png","http://pbs.twimg.com/profile_images/849030859462246401/ATk3_aiW_normal.jpg"
"x876541483","x1476869853562777607",2021-12-31 10:56:26,"AlbertoBagnai","@caproyl Tutte cose che a me mancano, com’è noto. Potresti fornirmene un po’?","Twitter for iPhone",68,"x1476847392553115659","x417166557","caproyl",FALSE,FALSE,9,0,,,,,,,,,,,,,,,,"x417166557","caproyl","it",,,,,,,,,,,,,,,,,,,,,,,,,,,,,,,,,,,,,"NA NA","NA NA","NA NA NA NA NA NA NA NA","https://twitter.com/AlbertoBagnai/status/1476869853562777607","Alberto Bagnai","","Professore associato di politica economica all’Università Gabriele d’Annunzio, eletto al Senato per la Lega nel collegio Abruzzo 01.","https://t.co/sC5RvUzmsX",FALSE,130118,666,656,221248,6465,2012-10-12 22:13:36,TRUE,"https://t.co/sC5RvUzmsX","http://www.senato.it/leg/18/BGT/Schede/Attsen/00032582.htm",,"https://pbs.twimg.com/profile_banners/876541483/1535647109","http://abs.twimg.com/images/themes/theme1/bg.png","http://pbs.twimg.com/profile_images/849030859462246401/ATk3_aiW_normal.jpg"
"x876541483","x1476869634431275010",2021-12-31 10:55:34,"AlbertoBagnai","@mnavacchia @borghi_claudio Ma guarda che nessuno sta chiedendo il tuo voto. Tranquillo.","Twitter for iPhone",60,"x1476856230052122624","x254508234","mnavacchia",FALSE,FALSE,4,1,,,,,,,,,,,,,,,,"x254508234 x337767301","mnavacchia borghi_claudio","it",,,,,,,,,,,,,,,,,,,,,,,,,,,,,,,,,,,,,"NA NA","NA NA","NA NA NA NA NA NA NA NA","https://twitter.com/AlbertoBagnai/status/1476869634431275010","Alberto Bagnai","","Professore associato di politica economica all’Università Gabriele d’Annunzio, eletto al Senato per la Lega nel collegio Abruzzo 01.","https://t.co/sC5RvUzmsX",FALSE,130118,666,656,221248,6465,2012-10-12 22:13:36,TRUE,"https://t.co/sC5RvUzmsX","http://www.senato.it/leg/18/BGT/Schede/Attsen/00032582.htm",,"https://pbs.twimg.com/profile_banners/876541483/1535647109","http://abs.twimg.com/images/themes/theme1/bg.png","http://pbs.twimg.com/profile_images/849030859462246401/ATk3_aiW_normal.jpg"
"x876541483","x1476869463433748481",2021-12-31 10:54:53,"AlbertoBagnai","@xsoniadm Qui qualcuno blatera di “colpevolizzazione dell’elettore”. A questa particolare specie di cretini ricordo che la politica, tutta la politica, è responsabilità: sono responsabili delle loro scelte gli eletti, ma prima, logicamente e cronologicamente, gli elettori.","Twitter for iPhone",263,"x1476864067667173378","x2873782396","xsoniadm",FALSE,FALSE,17,5,,,,,,,,,,,,,,,,"x2873782396","xsoniadm","it",,,,,,,,,,,,,,,,,,,,,,,,,,,,,,,,,,,,,"NA NA","NA NA","NA NA NA NA NA NA NA NA","https://twitter.com/AlbertoBagnai/status/1476869463433748481","Alberto Bagnai","","Professore associato di politica economica all’Università Gabriele d’Annunzio, eletto al Senato per la Lega nel collegio Abruzzo 01.","https://t.co/sC5RvUzmsX",FALSE,130118,666,656,221248,6465,2012-10-12 22:13:36,TRUE,"https://t.co/sC5RvUzmsX","http://www.senato.it/leg/18/BGT/Schede/Attsen/00032582.htm",,"https://pbs.twimg.com/profile_banners/876541483/1535647109","http://abs.twimg.com/images/themes/theme1/bg.png","http://pbs.twimg.com/profile_images/849030859462246401/ATk3_aiW_normal.jpg"
"x876541483","x1476868847013613570",2021-12-31 10:52:26,"AlbertoBagnai","@ArielloGiuliano Words, words, words…","Twitter for iPhone",20,"x1476865311483830282","x1290357627852148737","ArielloGiuliano",FALSE,FALSE,7,1,,,,,,,,,,,,,,,,"x1290357627852148737","ArielloGiuliano","en",,,,,,,,,,,,,,,,,,,,,,,,,,,,,,,,,,,,,"NA NA","NA NA","NA NA NA NA NA NA NA NA","https://twitter.com/AlbertoBagnai/status/1476868847013613570","Alberto Bagnai","","Professore associato di politica economica all’Università Gabriele d’Annunzio, eletto al Senato per la Lega nel collegio Abruzzo 01.","https://t.co/sC5RvUzmsX",FALSE,130118,666,656,221248,6465,2012-10-12 22:13:36,TRUE,"https://t.co/sC5RvUzmsX","http://www.senato.it/leg/18/BGT/Schede/Attsen/00032582.htm",,"https://pbs.twimg.com/profile_banners/876541483/1535647109","http://abs.twimg.com/images/themes/theme1/bg.png","http://pbs.twimg.com/profile_images/849030859462246401/ATk3_aiW_normal.jpg"
