"user_id","status_id","created_at","screen_name","text","source","display_text_width","reply_to_status_id","reply_to_user_id","reply_to_screen_name","is_quote","is_retweet","favorite_count","retweet_count","quote_count","reply_count","hashtags","symbols","urls_url","urls_t.co","urls_expanded_url","media_url","media_t.co","media_expanded_url","media_type","ext_media_url","ext_media_t.co","ext_media_expanded_url","ext_media_type","mentions_user_id","mentions_screen_name","lang","quoted_status_id","quoted_text","quoted_created_at","quoted_source","quoted_favorite_count","quoted_retweet_count","quoted_user_id","quoted_screen_name","quoted_name","quoted_followers_count","quoted_friends_count","quoted_statuses_count","quoted_location","quoted_description","quoted_verified","retweet_status_id","retweet_text","retweet_created_at","retweet_source","retweet_favorite_count","retweet_retweet_count","retweet_user_id","retweet_screen_name","retweet_name","retweet_followers_count","retweet_friends_count","retweet_statuses_count","retweet_location","retweet_description","retweet_verified","place_url","place_name","place_full_name","place_type","country","country_code","geo_coords","coords_coords","bbox_coords","status_url","name","location","description","url","protected","followers_count","friends_count","listed_count","statuses_count","favourites_count","account_created_at","verified","profile_url","profile_expanded_url","account_lang","profile_banner_url","profile_background_url","profile_image_url"
"x270839361","x1456587792104964099",2021-11-05 11:42:46,"matteosalvinimi","Presenteremo in Aula proposte per destinare parte dei fondi male utilizzati per il reddito di cittadinanza e che finiscono a furbetti ed evasori al fondo dedicato a mamme e papà in difficoltà.","Twitter for iPhone",192,"x1456587769548001283","x270839361","matteosalvinimi",FALSE,FALSE,126,20,,,,,,,,,,,,,,,,,,"it",,,,,,,,,,,,,,,,,,,,,,,,,,,,,,,,,,,,,"NA NA","NA NA","NA NA NA NA NA NA NA NA","https://twitter.com/matteosalvinimi/status/1456587792104964099","Matteo Salvini","","Leader della Lega #primagliitaliani 🇮🇹","https://t.co/sj3rr6DU3N",FALSE,1423366,2034,3057,52091,3856,2011-03-23 10:32:56,TRUE,"https://t.co/sj3rr6DU3N","https://legaonline.it/",,"https://pbs.twimg.com/profile_banners/270839361/1635585626","http://abs.twimg.com/images/themes/theme1/bg.png","http://pbs.twimg.com/profile_images/966325945060732928/0Ua5xPMX_normal.jpg"
"x270839361","x1456587769548001283",2021-11-05 11:42:41,"matteosalvinimi","Non bastano 10 milioni di euro per aiutare i genitori separati che per colpa del covid non riescono a pagare l’assegno di mantenimento per i figli o l’ex coniuge. https://t.co/QzUr5wVkXL","Twitter for iPhone",162,,,,FALSE,FALSE,185,41,,,,,,,,"http://pbs.twimg.com/media/FDbW2t1XoActjd1.jpg","https://t.co/QzUr5wVkXL","https://twitter.com/matteosalvinimi/status/1456587769548001283/photo/1","photo","http://pbs.twimg.com/media/FDbW2t1XoActjd1.jpg","https://t.co/QzUr5wVkXL","https://twitter.com/matteosalvinimi/status/1456587769548001283/photo/1",,,,"it",,,,,,,,,,,,,,,,,,,,,,,,,,,,,,,,,,,,,"NA NA","NA NA","NA NA NA NA NA NA NA NA","https://twitter.com/matteosalvinimi/status/1456587769548001283","Matteo Salvini","","Leader della Lega #primagliitaliani 🇮🇹","https://t.co/sj3rr6DU3N",FALSE,1423366,2034,3057,52091,3856,2011-03-23 10:32:56,TRUE,"https://t.co/sj3rr6DU3N","https://legaonline.it/",,"https://pbs.twimg.com/profile_banners/270839361/1635585626","http://abs.twimg.com/images/themes/theme1/bg.png","http://pbs.twimg.com/profile_images/966325945060732928/0Ua5xPMX_normal.jpg"
"x270839361","x1456584205488599043",2021-11-05 11:28:31,"matteosalvinimi","Picchia la figlia di 13 anni e la stupra, come stupra la moglie disabile.
Per questo immigrato così ben integrato la “giustizia” italiana decide 5 anni di carcere e basta. 5 anni???
Roba da matti. https://t.co/vCObrYyhLR","Twitter for iPhone",196,,,,FALSE,FALSE,503,109,,,,,,,,"http://pbs.twimg.com/media/FDbTnEXWYAMhDf2.jpg","https://t.co/vCObrYyhLR","https://twitter.com/matteosalvinimi/status/1456584205488599043/photo/1","photo","http://pbs.twimg.com/media/FDbTnEXWYAMhDf2.jpg","https://t.co/vCObrYyhLR","https://twitter.com/matteosalvinimi/status/1456584205488599043/photo/1",,,,"it",,,,,,,,,,,,,,,,,,,,,,,,,,,,,,,,,,,,,"NA NA","NA NA","NA NA NA NA NA NA NA NA","https://twitter.com/matteosalvinimi/status/1456584205488599043","Matteo Salvini","","Leader della Lega #primagliitaliani 🇮🇹","https://t.co/sj3rr6DU3N",FALSE,1423366,2034,3057,52091,3856,2011-03-23 10:32:56,TRUE,"https://t.co/sj3rr6DU3N","https://legaonline.it/",,"https://pbs.twimg.com/profile_banners/270839361/1635585626","http://abs.twimg.com/images/themes/theme1/bg.png","http://pbs.twimg.com/profile_images/966325945060732928/0Ua5xPMX_normal.jpg"
"x270839361","x1456547829204258816",2021-11-05 09:03:58,"matteosalvinimi","La Lega ha evitato il ritorno alla direttiva Bolkestein, che avrebbe messo a rischio il futuro di migliaia di aziende e decine di migliaia di posti di lavoro.","Twitter for iPhone",158,,,,FALSE,FALSE,521,97,,,,,,,,,,,,,,,,,,"it",,,,,,,,,,,,,,,,,,,,,,,,,,,,,,,,,,,,,"NA NA","NA NA","NA NA NA NA NA NA NA NA","https://twitter.com/matteosalvinimi/status/1456547829204258816","Matteo Salvini","","Leader della Lega #primagliitaliani 🇮🇹","https://t.co/sj3rr6DU3N",FALSE,1423366,2034,3057,52091,3856,2011-03-23 10:32:56,TRUE,"https://t.co/sj3rr6DU3N","https://legaonline.it/",,"https://pbs.twimg.com/profile_banners/270839361/1635585626","http://abs.twimg.com/images/themes/theme1/bg.png","http://pbs.twimg.com/profile_images/966325945060732928/0Ua5xPMX_normal.jpg"
"x270839361","x1456362186687881221",2021-11-04 20:46:17,"matteosalvinimi","Al ministro Lamorgese non bastano i già 54mila arrivi di quest'anno? Non possiamo più essere il campo profughi d'Europa.","Twitter for iPhone",120,"x1456362183202377734","x270839361","matteosalvinimi",FALSE,FALSE,597,83,,,,,,,,,,,,,,,,,,"it",,,,,,,,,,,,,,,,,,,,,,,,,,,,,,,,,,,,,"NA NA","NA NA","NA NA NA NA NA NA NA NA","https://twitter.com/matteosalvinimi/status/1456362186687881221","Matteo Salvini","","Leader della Lega #primagliitaliani 🇮🇹","https://t.co/sj3rr6DU3N",FALSE,1423366,2034,3057,52091,3856,2011-03-23 10:32:56,TRUE,"https://t.co/sj3rr6DU3N","https://legaonline.it/",,"https://pbs.twimg.com/profile_banners/270839361/1635585626","http://abs.twimg.com/images/themes/theme1/bg.png","http://pbs.twimg.com/profile_images/966325945060732928/0Ua5xPMX_normal.jpg"
"x270839361","x1456362183202377734",2021-11-04 20:46:17,"matteosalvinimi","Ong in azione: altri 1.000 clandestini verso l’Italia.
Sono organizzazioni straniere, con navi straniere, che erano in acque libiche e maltesi. Non devono sbarcare nel nostro Paese. Punto. https://t.co/PFTgtDpEN9","Twitter for iPhone",188,,,,FALSE,FALSE,1038,224,,,,,,,,"http://pbs.twimg.com/media/FDYJrvFWUAE1bkt.jpg","https://t.co/PFTgtDpEN9","https://twitter.com/matteosalvinimi/status/1456362183202377734/photo/1","photo","http://pbs.twimg.com/media/FDYJrvFWUAE1bkt.jpg","https://t.co/PFTgtDpEN9","https://twitter.com/matteosalvinimi/status/1456362183202377734/photo/1",,,,"it",,,,,,,,,,,,,,,,,,,,,,,,,,,,,,,,,,,,,"NA NA","NA NA","NA NA NA NA NA NA NA NA","https://twitter.com/matteosalvinimi/status/1456362183202377734","Matteo Salvini","","Leader della Lega #primagliitaliani 🇮🇹","https://t.co/sj3rr6DU3N",FALSE,1423366,2034,3057,52091,3856,2011-03-23 10:32:56,TRUE,"https://t.co/sj3rr6DU3N","https://legaonline.it/",,"https://pbs.twimg.com/profile_banners/270839361/1635585626","http://abs.twimg.com/images/themes/theme1/bg.png","http://pbs.twimg.com/profile_images/966325945060732928/0Ua5xPMX_normal.jpg"
"x270839361","x1456288739777470466",2021-11-04 15:54:26,"matteosalvinimi","Coi soldi degli italiani il Consiglio d’Europa promuove l’utilizzo del velo islamico? Non basta ritirare questa demenziale campagna pubblicitaria, qualcuno in Europa deve scusarsi e dimettersi. https://t.co/wV0dCYb4si","Twitter for iPhone",193,,,,FALSE,FALSE,971,213,,,,,,,,"http://pbs.twimg.com/media/FDXG40zWUAUPrBu.jpg","https://t.co/wV0dCYb4si","https://twitter.com/matteosalvinimi/status/1456288739777470466/photo/1","photo","http://pbs.twimg.com/media/FDXG40zWUAUPrBu.jpg","https://t.co/wV0dCYb4si","https://twitter.com/matteosalvinimi/status/1456288739777470466/photo/1",,,,"it",,,,,,,,,,,,,,,,,,,,,,,,,,,,,,,,,,,,,"NA NA","NA NA","NA NA NA NA NA NA NA NA","https://twitter.com/matteosalvinimi/status/1456288739777470466","Matteo Salvini","","Leader della Lega #primagliitaliani 🇮🇹","https://t.co/sj3rr6DU3N",FALSE,1423366,2034,3057,52091,3856,2011-03-23 10:32:56,TRUE,"https://t.co/sj3rr6DU3N","https://legaonline.it/",,"https://pbs.twimg.com/profile_banners/270839361/1635585626","http://abs.twimg.com/images/themes/theme1/bg.png","http://pbs.twimg.com/profile_images/966325945060732928/0Ua5xPMX_normal.jpg"
"x48062712","x1456556905975922695",2021-11-05 09:40:02,"luigidimaio","""Il @Mov5Stelle è sicuramente la forza politica più ecologista che c'è in Italia e che può interpretare questa fase storica, una fase in cui c'è una grandissima preoccupazione per gli stravolgimenti climatici e gli effetti sulle nostre vite"" @luigidimaio a #Unomattina https://t.co/EVbWNfH1Vy","Twitter for iPhone",140,,,,FALSE,TRUE,0,10,,,,,,,,,,,,,,,,"x390118819 x289400495","Unomattina Mov5Stelle","it",,,,,,,,,,,,,,,,"x1456536996583776266","""Il @Mov5Stelle è sicuramente la forza politica più ecologista che c'è in Italia e che può interpretare questa fase storica, una fase in cui c'è una grandissima preoccupazione per gli stravolgimenti climatici e gli effetti sulle nostre vite"" @luigidimaio a #Unomattina https://t.co/EVbWNfH1Vy",2021-11-05 08:20:55,"Twitter Web App",32,10,"x390118819","Unomattina","Unomattina",28444,624,21013,"","Il buongiorno televisivo di Raiuno dal 1986. Conducono Monica Giandotti e Marco Frittella. Dal lunedì al venerdì, dalle 7.10 alle 09.50",TRUE,,,,,,,"NA NA","NA NA","NA NA NA NA NA NA NA NA","https://twitter.com/luigidimaio/status/1456556905975922695","Luigi Di Maio","Pomigliano d'Arco, Campania","Ministro degli Affari Esteri e della Cooperazione Internazionale.","https://t.co/D8gkagqksG",FALSE,740601,349,2132,6713,332,2009-06-17 18:34:46,TRUE,"https://t.co/D8gkagqksG","http://www.luigidimaio.it",,"https://pbs.twimg.com/profile_banners/48062712/1634667505","http://abs.twimg.com/images/themes/theme1/bg.png","http://pbs.twimg.com/profile_images/933106806670462976/YyC7LOW8_normal.jpg"
"x48062712","x1456541488658137088",2021-11-05 08:38:46,"luigidimaio","La lotta agli stravolgimenti climatici è fondamentale per consegnare alle nuove generazioni un Paese migliore. 
Serve l’impegno di tutti. 
A #Unomattina su @RaiUno per parlare di #transizioneecologica, @Mov5Stelle e tanto altro. Seguitemi!

https://t.co/IUEcCKgXgz","Twitter for iPhone",264,,,,FALSE,FALSE,66,19,,,"Unomattina transizioneecologica",,"facebook.com/LuigiDiMaio/vi…","https://t.co/IUEcCKgXgz","https://www.facebook.com/LuigiDiMaio/videos/585484476030788/",,,,,,,,,"x1208394690 x289400495","RaiUno Mov5Stelle","it",,,,,,,,,,,,,,,,,,,,,,,,,,,,,,,,,,,,,"NA NA","NA NA","NA NA NA NA NA NA NA NA","https://twitter.com/luigidimaio/status/1456541488658137088","Luigi Di Maio","Pomigliano d'Arco, Campania","Ministro degli Affari Esteri e della Cooperazione Internazionale.","https://t.co/D8gkagqksG",FALSE,740601,349,2132,6713,332,2009-06-17 18:34:46,TRUE,"https://t.co/D8gkagqksG","http://www.luigidimaio.it",,"https://pbs.twimg.com/profile_banners/48062712/1634667505","http://abs.twimg.com/images/themes/theme1/bg.png","http://pbs.twimg.com/profile_images/933106806670462976/YyC7LOW8_normal.jpg"
"x997531966571466752","x1456634292872880132",2021-11-05 14:47:33,"Pres_Casellati","All’aeroporto militare di Ciampino per la cerimonia di avvicendamento del nuovo Capo di Stato Maggiore della Difesa.
#5novembre #ForzeArmate🇮🇹 #UnaForzaperilPaese https://t.co/9LLRWjQYBw","Twitter for iPhone",162,,,,FALSE,FALSE,10,6,,,"5novembre ForzeArmate UnaForzaperilPaese",,,,,"http://pbs.twimg.com/media/FDcBKssXsAQzdnU.jpg","https://t.co/9LLRWjQYBw","https://twitter.com/Pres_Casellati/status/1456634292872880132/photo/1","photo","http://pbs.twimg.com/media/FDcBKssXsAQzdnU.jpg http://pbs.twimg.com/media/FDcBKszXEAECBeQ.jpg http://pbs.twimg.com/media/FDcBKsqXEAYcgib.jpg","https://t.co/9LLRWjQYBw https://t.co/9LLRWjQYBw https://t.co/9LLRWjQYBw","https://twitter.com/Pres_Casellati/status/1456634292872880132/photo/1 https://twitter.com/Pres_Casellati/status/1456634292872880132/photo/1 https://twitter.com/Pres_Casellati/status/1456634292872880132/photo/1",,,,"it",,,,,,,,,,,,,,,,,,,,,,,,,,,,,,,,,,,,,"NA NA","NA NA","NA NA NA NA NA NA NA NA","https://twitter.com/Pres_Casellati/status/1456634292872880132","Maria Elisabetta Alberti Casellati","Roma, Lazio","Presidente del Senato della Repubblica","https://t.co/4xFh9XyLXO",FALSE,13864,502,100,1112,61,2018-05-18 17:38:48,TRUE,"https://t.co/4xFh9XyLXO","https://www.facebook.com/elisabetta.casellati.7",,"https://pbs.twimg.com/profile_banners/997531966571466752/1526665561","http://abs.twimg.com/images/themes/theme1/bg.png","http://pbs.twimg.com/profile_images/997533290520195072/YmnjBO3X_normal.jpg"
"x997531966571466752","x1456288324604375050",2021-11-04 15:52:47,"Pres_Casellati","Oggi a Roma all’Altare della Patria e poi a Bari al Sacrario dei Caduti d’Oltremare per le celebrazioni della Giornata dell’Unità Nazionale e delle #ForzeArmate🇮🇹.
#4novembre https://t.co/nHd0DUIspb","Twitter for iPhone",174,,,,FALSE,FALSE,30,8,,,"ForzeArmate 4novembre",,,,,"http://pbs.twimg.com/media/FDXGfxEXEAQdMu8.jpg","https://t.co/nHd0DUIspb","https://twitter.com/Pres_Casellati/status/1456288324604375050/photo/1","photo","http://pbs.twimg.com/media/FDXGfxEXEAQdMu8.jpg http://pbs.twimg.com/media/FDXGfxEWUAEqgK2.jpg http://pbs.twimg.com/media/FDXGfxFWQAM7cn4.jpg http://pbs.twimg.com/media/FDXGfxDWEA4Sh-G.jpg","https://t.co/nHd0DUIspb https://t.co/nHd0DUIspb https://t.co/nHd0DUIspb https://t.co/nHd0DUIspb","https://twitter.com/Pres_Casellati/status/1456288324604375050/photo/1 https://twitter.com/Pres_Casellati/status/1456288324604375050/photo/1 https://twitter.com/Pres_Casellati/status/1456288324604375050/photo/1 https://twitter.com/Pres_Casellati/status/1456288324604375050/photo/1",,,,"it",,,,,,,,,,,,,,,,,,,,,,,,,,,,,,,,,,,,,"NA NA","NA NA","NA NA NA NA NA NA NA NA","https://twitter.com/Pres_Casellati/status/1456288324604375050","Maria Elisabetta Alberti Casellati","Roma, Lazio","Presidente del Senato della Repubblica","https://t.co/4xFh9XyLXO",FALSE,13864,502,100,1112,61,2018-05-18 17:38:48,TRUE,"https://t.co/4xFh9XyLXO","https://www.facebook.com/elisabetta.casellati.7",,"https://pbs.twimg.com/profile_banners/997531966571466752/1526665561","http://abs.twimg.com/images/themes/theme1/bg.png","http://pbs.twimg.com/profile_images/997533290520195072/YmnjBO3X_normal.jpg"
"x1075084718","x1456329565018669063",2021-11-04 18:36:40,"arrigoni_paolo","Caro energia: Italia primato, in negativo, del prezzo dell'energia elettrica. I prezzi medi in Europa ad ottobre 2021 lo certificano.
Le cause: l'eccessiva nostra dipendenza energetica dall'estero e il nostro mix energetico.
Stanno meglio i paesi che sfruttano nucleare e carbone!","Twitter for Android",280,,,,FALSE,FALSE,9,2,,,,,,,,,,,,,,,,,,"it",,,,,,,,,,,,,,,,,,,,,,,,,,,,,,,,,,,,,"NA NA","NA NA","NA NA NA NA NA NA NA NA","https://twitter.com/arrigoni_paolo/status/1456329565018669063","Paolo Arrigoni","Calolziocorte, Lombardia","Questore del Senato della Repubblica, componente della Commissione Ambiente e del Copasir. Responsabile del Dipartimento Energia della Lega.","https://t.co/M6TePkOvfO",FALSE,4666,181,57,9590,107,2013-01-09 22:36:27,TRUE,"https://t.co/M6TePkOvfO","http://www.senato.it/leg/18/BGT/Schede/Attsen/00029039.htm",,"https://pbs.twimg.com/profile_banners/1075084718/1591968708","http://abs.twimg.com/images/themes/theme1/bg.png","http://pbs.twimg.com/profile_images/3172370357/bec3e4497d64c77f2a93bc9792055992_normal.jpeg"
"x876541483","x1456549012048392192",2021-11-05 09:08:40,"AlbertoBagnai","Altri ciao?","Twitter for iPhone",11,,,,FALSE,FALSE,85,3,,,,,,,,,,,,,,,,,,"it",,,,,,,,,,,,,,,,,,,,,,,,,,,,,,,,,,,,,"NA NA","NA NA","NA NA NA NA NA NA NA NA","https://twitter.com/AlbertoBagnai/status/1456549012048392192","Alberto Bagnai","","Professore associato di politica economica all’Università Gabriele d’Annunzio, eletto al Senato per la Lega nel collegio Abruzzo 01.","https://t.co/sC5RvUzmsX",FALSE,128438,664,658,219912,6465,2012-10-12 22:13:36,TRUE,"https://t.co/sC5RvUzmsX","http://www.senato.it/leg/18/BGT/Schede/Attsen/00032582.htm",,"https://pbs.twimg.com/profile_banners/876541483/1535647109","http://abs.twimg.com/images/themes/theme1/bg.png","http://pbs.twimg.com/profile_images/849030859462246401/ATk3_aiW_normal.jpg"
"x876541483","x1456548784524115968",2021-11-05 09:07:46,"AlbertoBagnai","@gspazianitesta @borghi_claudio @AlbertoBagnai @LegaSalvini Tra qualche anno l'Orlando di turno ci dirà che si è pentito, perché gli sarebbe piaciuto discuterne. https://t.co/XubvMsuEEB","Twitter for iPhone",140,,,,FALSE,TRUE,0,31,,,,,,,,,,,,,,,,"x1410360850179842048 x877230271652823040 x337767301 x876541483 x13514762","valkeasusi gspazianitesta borghi_claudio AlbertoBagnai LegaSalvini","it",,,,,,,,,,,,,,,,"x1456548093650821121","@gspazianitesta @borghi_claudio @AlbertoBagnai @LegaSalvini Tra qualche anno l'Orlando di turno ci dirà che si è pentito, perché gli sarebbe piaciuto discuterne. https://t.co/XubvMsuEEB",2021-11-05 09:05:01,"Twitter for Android",63,31,"x1410360850179842048","valkeasusi","Let's go Brandon",411,767,8586,"","'Se non ti interessi di politica, presto o tardi la politica si interesserà di te.' J. A.",FALSE,,,,,,,"NA NA","NA NA","NA NA NA NA NA NA NA NA","https://twitter.com/AlbertoBagnai/status/1456548784524115968","Alberto Bagnai","","Professore associato di politica economica all’Università Gabriele d’Annunzio, eletto al Senato per la Lega nel collegio Abruzzo 01.","https://t.co/sC5RvUzmsX",FALSE,128438,664,658,219912,6465,2012-10-12 22:13:36,TRUE,"https://t.co/sC5RvUzmsX","http://www.senato.it/leg/18/BGT/Schede/Attsen/00032582.htm",,"https://pbs.twimg.com/profile_banners/876541483/1535647109","http://abs.twimg.com/images/themes/theme1/bg.png","http://pbs.twimg.com/profile_images/849030859462246401/ATk3_aiW_normal.jpg"
"x876541483","x1456546164292132888",2021-11-05 08:57:21,"AlbertoBagnai","@iofausto @loren_ch La famigerata austerity con le domeniche che non si poteva circolare...","Twitter for iPhone",112,,,,FALSE,TRUE,0,11,,,,,,,,,,,,,,,,"x99702635 x1372968120034426887 x158288741","scarpettavenere iofausto loren_ch","it",,,,,,,,,,,,,,,,"x1456545996041867264","@iofausto @loren_ch La famigerata austerity con le domeniche che non si poteva circolare...",2021-11-05 08:56:41,"Twitter for Android",54,11,"x99702635","scarpettavenere","Scarpetta Venere🇮🇹",4259,1156,224312,"","""La verità tace quando è tempo di tacere e, tacendo, grida col grido della pazienza». Santa Caterina da Siena",FALSE,,,,,,,"NA NA","NA NA","NA NA NA NA NA NA NA NA","https://twitter.com/AlbertoBagnai/status/1456546164292132888","Alberto Bagnai","","Professore associato di politica economica all’Università Gabriele d’Annunzio, eletto al Senato per la Lega nel collegio Abruzzo 01.","https://t.co/sC5RvUzmsX",FALSE,128438,664,658,219912,6465,2012-10-12 22:13:36,TRUE,"https://t.co/sC5RvUzmsX","http://www.senato.it/leg/18/BGT/Schede/Attsen/00032582.htm",,"https://pbs.twimg.com/profile_banners/876541483/1535647109","http://abs.twimg.com/images/themes/theme1/bg.png","http://pbs.twimg.com/profile_images/849030859462246401/ATk3_aiW_normal.jpg"
"x876541483","x1456538816483893262",2021-11-05 08:28:09,"AlbertoBagnai","Il senatore @AlbertoBagnai ieri, in Commissione Finanze, ha sollevato il problema. Sarebbe stato rilevante anche se a farlo fosse stata l'opposizione, ma la @LegaSalvini fa parte della maggioranza: in un Paese normale un intervento del genere ha delle conseguenze. https://t.co/zfCy9rpMCD","Twitter for iPhone",140,,,,FALSE,TRUE,0,80,,,,,,,,,,,,,,,,"x877230271652823040 x876541483","gspazianitesta AlbertoBagnai","it",,,,,,,,,,,,,,,,"x1456536507502764047","Il senatore @AlbertoBagnai ieri, in Commissione Finanze, ha sollevato il problema. Sarebbe stato rilevante anche se a farlo fosse stata l'opposizione, ma la @LegaSalvini fa parte della maggioranza: in un Paese normale un intervento del genere ha delle conseguenze. https://t.co/zfCy9rpMCD",2021-11-05 08:18:59,"Twitter Web App",175,80,"x877230271652823040","gspazianitesta","Giorgio Spaziani Testa",3893,1152,11035,"","Presidente Confedilizia
https://t.co/dnYlUCmj2Q",FALSE,,,,,,,"NA NA","NA NA","NA NA NA NA NA NA NA NA","https://twitter.com/AlbertoBagnai/status/1456538816483893262","Alberto Bagnai","","Professore associato di politica economica all’Università Gabriele d’Annunzio, eletto al Senato per la Lega nel collegio Abruzzo 01.","https://t.co/sC5RvUzmsX",FALSE,128438,664,658,219912,6465,2012-10-12 22:13:36,TRUE,"https://t.co/sC5RvUzmsX","http://www.senato.it/leg/18/BGT/Schede/Attsen/00032582.htm",,"https://pbs.twimg.com/profile_banners/876541483/1535647109","http://abs.twimg.com/images/themes/theme1/bg.png","http://pbs.twimg.com/profile_images/849030859462246401/ATk3_aiW_normal.jpg"
"x876541483","x1456535428446699520",2021-11-05 08:14:41,"AlbertoBagnai","Le @bmj_latest continue d’alerter en dénonçant cette fois ci  les conflits d’intérêts dans la santé ... 😅

« Un vaste réseau de liens de l'industrie des produits médicaux avec des activités et des parties existe dans l'écosystème de la santé »

1/2

https://t.co/73nk2igkIA","Twitter for iPhone",139,,,,FALSE,TRUE,0,886,,,,,,,,,,,,,,,,"x304968157 x16949344","CorinneReverbel bmj_latest","fr",,,,,,,,,,,,,,,,"x1456289389869416451","Le @bmj_latest continue d’alerter en dénonçant cette fois ci  les conflits d’intérêts dans la santé ... 😅

« Un vaste réseau de liens de l'industrie des produits médicaux avec des activités et des parties existe dans l'écosystème de la santé »

1/2

https://t.co/73nk2igkIA",2021-11-04 15:57:01,"Twitter for iPhone",1285,886,"x304968157","CorinneReverbel","Corinne Reverbel",35131,1367,27739,"","Consultante Webmarketing, Docteur Biochimie & Microbio - AUCUN LIEN NI CONFLIT D’INTÉRÊTS avec l’IHU #SoutienAFranceSoir #NoCorrupMed",FALSE,,,,,,,"NA NA","NA NA","NA NA NA NA NA NA NA NA","https://twitter.com/AlbertoBagnai/status/1456535428446699520","Alberto Bagnai","","Professore associato di politica economica all’Università Gabriele d’Annunzio, eletto al Senato per la Lega nel collegio Abruzzo 01.","https://t.co/sC5RvUzmsX",FALSE,128438,664,658,219912,6465,2012-10-12 22:13:36,TRUE,"https://t.co/sC5RvUzmsX","http://www.senato.it/leg/18/BGT/Schede/Attsen/00032582.htm",,"https://pbs.twimg.com/profile_banners/876541483/1535647109","http://abs.twimg.com/images/themes/theme1/bg.png","http://pbs.twimg.com/profile_images/849030859462246401/ATk3_aiW_normal.jpg"
"x876541483","x1456520883510579204",2021-11-05 07:16:54,"AlbertoBagnai","Massimo Bitonci-Lega: ""La bocciatura delle politiche restrittive dell'UE oggi è da parte di tutti, ma non ho sentito 'mea culpa' da sinistra"" https://t.co/HZVKG5032O @LegaCamera @LegaSalvini @matteosalvinimi @Stefanicamera @AlbertoBagnai","Twitter for iPhone",140,,,,FALSE,TRUE,0,45,,,,,,,,,,,,,,,,"x106673706","massimobitonci","it",,,,,,,,,,,,,,,,"x1456520186161401888","Massimo Bitonci-Lega: ""La bocciatura delle politiche restrittive dell'UE oggi è da parte di tutti, ma non ho sentito 'mea culpa' da sinistra"" https://t.co/HZVKG5032O @LegaCamera @LegaSalvini @matteosalvinimi @Stefanicamera @AlbertoBagnai",2021-11-05 07:14:07,"Twitter for iPhone",163,45,"x106673706","massimobitonci","Massimo Bitonci",11725,904,21061,"","Veneto on. Lega Salvini - Fondatore LIGA Veneta SP - Capogruppo Bilancio - Capo Dip. Att. Produttive Lega- già Sindaco di Cittadella e Padova - commercialista",TRUE,,,,,,,"NA NA","NA NA","NA NA NA NA NA NA NA NA","https://twitter.com/AlbertoBagnai/status/1456520883510579204","Alberto Bagnai","","Professore associato di politica economica all’Università Gabriele d’Annunzio, eletto al Senato per la Lega nel collegio Abruzzo 01.","https://t.co/sC5RvUzmsX",FALSE,128438,664,658,219912,6465,2012-10-12 22:13:36,TRUE,"https://t.co/sC5RvUzmsX","http://www.senato.it/leg/18/BGT/Schede/Attsen/00032582.htm",,"https://pbs.twimg.com/profile_banners/876541483/1535647109","http://abs.twimg.com/images/themes/theme1/bg.png","http://pbs.twimg.com/profile_images/849030859462246401/ATk3_aiW_normal.jpg"
"x876541483","x1456361166100475912",2021-11-04 20:42:14,"AlbertoBagnai","Domani è un altro giorno, e quindi si studia un altro argomento… https://t.co/4Q1mb2MZsi","Twitter for iPhone",64,,,,FALSE,FALSE,128,22,,,,,,,,"http://pbs.twimg.com/media/FDYIwlHXMAQuGEE.jpg","https://t.co/4Q1mb2MZsi","https://twitter.com/AlbertoBagnai/status/1456361166100475912/photo/1","photo","http://pbs.twimg.com/media/FDYIwlHXMAQuGEE.jpg","https://t.co/4Q1mb2MZsi","https://twitter.com/AlbertoBagnai/status/1456361166100475912/photo/1",,,,"it",,,,,,,,,,,,,,,,,,,,,,,,,,,,,,,,,,,,,"NA NA","NA NA","NA NA NA NA NA NA NA NA","https://twitter.com/AlbertoBagnai/status/1456361166100475912","Alberto Bagnai","","Professore associato di politica economica all’Università Gabriele d’Annunzio, eletto al Senato per la Lega nel collegio Abruzzo 01.","https://t.co/sC5RvUzmsX",FALSE,128438,664,658,219912,6465,2012-10-12 22:13:36,TRUE,"https://t.co/sC5RvUzmsX","http://www.senato.it/leg/18/BGT/Schede/Attsen/00032582.htm",,"https://pbs.twimg.com/profile_banners/876541483/1535647109","http://abs.twimg.com/images/themes/theme1/bg.png","http://pbs.twimg.com/profile_images/849030859462246401/ATk3_aiW_normal.jpg"
