"x337171830","x1470013222958911491",2021-12-12 12:50:38,"AngeloTofalo","Questa mattina un P.180 del 14º Stormo dell’#AeronauticaMilitare è decollato per #Catania in supporto alla #ProtezioneCivile che sta operando a #Ravanusa dove una ingente perdita di gas nella rete di metano avrebbe causato un'esplosione provocando il crollo di almeno 7 palazzine https://t.co/A4P6PtSJU9","Twitter for iPhone",140,,,,FALSE,TRUE,0,20,,,"AeronauticaMilitare Catania",,,,,,,,,,,,,"x1280597143","ItalianAirForce","it",,,,,,,,,,,,,,,,"x1469999848799846401","Questa mattina un P.180 del 14º Stormo dell’#AeronauticaMilitare è decollato per #Catania in supporto alla #ProtezioneCivile che sta operando a #Ravanusa dove una ingente perdita di gas nella rete di metano avrebbe causato un'esplosione provocando il crollo di almeno 7 palazzine https://t.co/A4P6PtSJU9",2021-12-12 11:57:29,"Twitter for iPad",91,20,"x1280597143","ItalianAirForce","Aeronautica Militare",108723,430,27941,"","La Difesa Aerea è la missione principale dell'Aeronautica Militare.365 giorni l'anno,24 ore su 24, i velivoli caccia sono pronti al decollo #latuasquadrachevola",TRUE,,,,,,,"NA NA","NA NA","NA NA NA NA NA NA NA NA","https://twitter.com/AngeloTofalo/status/1470013222958911491","Angelo Tofalo","Salerno, Pellezzano, Campania","Ingegnere, deputato della Repubblica, già Sottosegretario di Stato alla Difesa 🇮🇹 Rapito dall’Intelligence per diffondere la cultura della Sicurezza","https://t.co/4xUgrx6rHJ",FALSE,38074,4940,358,37715,16743,2011-07-17 15:43:34,TRUE,"https://t.co/4xUgrx6rHJ","http://www.angelotofalo.com",,"https://pbs.twimg.com/profile_banners/337171830/1613207709","http://abs.twimg.com/images/themes/theme1/bg.png","http://pbs.twimg.com/profile_images/1035471039734718464/UIb1-oK3_normal.jpg"
"x337171830","x1469968075030212609",2021-12-12 09:51:14,"AngeloTofalo","Da #Ravanusa arrivano immagini e notizie drammatiche. Il @Mov5Stelle si stringe alle persone coinvolte e ai familiari delle vittime. Il nostro ringraziamento va a tutte le forze in campo che in queste ore si stanno adoperando per garantire i soccorsi https://t.co/MvZcHex4q3","Twitter for iPhone",139,,,,FALSE,TRUE,0,194,,,"Ravanusa",,,,,,,,,,,,,"x999578121123848192 x289400495","GiuseppeConteIT Mov5Stelle","it",,,,,,,,,,,,,,,,"x1469962529904472067","Da #Ravanusa arrivano immagini e notizie drammatiche. Il @Mov5Stelle si stringe alle persone coinvolte e ai familiari delle vittime. Il nostro ringraziamento va a tutte le forze in campo che in queste ore si stanno adoperando per garantire i soccorsi https://t.co/MvZcHex4q3",2021-12-12 09:29:12,"Twitter for iPhone",1207,194,"x999578121123848192","GiuseppeConteIT","Giuseppe Conte",1047576,137,1688,"","Giurista e Avvocato. Professore ordinario di diritto privato. Papà di Niccolò. Presidente del Movimento 5 Stelle.",TRUE,,,,,,,"NA NA","NA NA","NA NA NA NA NA NA NA NA","https://twitter.com/AngeloTofalo/status/1469968075030212609","Angelo Tofalo","Salerno, Pellezzano, Campania","Ingegnere, deputato della Repubblica, già Sottosegretario di Stato alla Difesa 🇮🇹 Rapito dall’Intelligence per diffondere la cultura della Sicurezza","https://t.co/4xUgrx6rHJ",FALSE,38074,4940,358,37715,16743,2011-07-17 15:43:34,TRUE,"https://t.co/4xUgrx6rHJ","http://www.angelotofalo.com",,"https://pbs.twimg.com/profile_banners/337171830/1613207709","http://abs.twimg.com/images/themes/theme1/bg.png","http://pbs.twimg.com/profile_images/1035471039734718464/UIb1-oK3_normal.jpg"
"x337171830","x1469957508886241283",2021-12-12 09:09:15,"AngeloTofalo","🔴 #Ravanusa #crollo palazzina. recuperato dai #vigilidelfuoco il corpo purtroppo privo di vita di un donna. Sale a due il numero delle vittime, un uomo e una donna. Due donne estratte in vita dalle macerie [#12dicembre 07:45] https://t.co/i9unjpK6HG","Twitter for iPhone",140,,,,FALSE,TRUE,0,45,,,"Ravanusa crollo vigilidelfuoco",,,,,,,,,,,,,"x702594325625085952","emergenzavvf","it",,,,,,,,,,,,,,,,"x1469925233599647745","🔴 #Ravanusa #crollo palazzina. recuperato dai #vigilidelfuoco il corpo purtroppo privo di vita di un donna. Sale a due il numero delle vittime, un uomo e una donna. Due donne estratte in vita dalle macerie [#12dicembre 07:45] https://t.co/i9unjpK6HG",2021-12-12 07:01:00,"Twitter for iPhone",160,45,"x702594325625085952","emergenzavvf","Vigili del Fuoco",115807,47,12370,"Palazzo Viminale, Roma","2.000 #soccorsiquotidiani, 700.000 all’anno. Questa è solo una selezione. Importante: in caso di pericolo chiama il 115, non scrivere qui!",TRUE,,,,,,,"NA NA","NA NA","NA NA NA NA NA NA NA NA","https://twitter.com/AngeloTofalo/status/1469957508886241283","Angelo Tofalo","Salerno, Pellezzano, Campania","Ingegnere, deputato della Repubblica, già Sottosegretario di Stato alla Difesa 🇮🇹 Rapito dall’Intelligence per diffondere la cultura della Sicurezza","https://t.co/4xUgrx6rHJ",FALSE,38074,4940,358,37715,16743,2011-07-17 15:43:34,TRUE,"https://t.co/4xUgrx6rHJ","http://www.angelotofalo.com",,"https://pbs.twimg.com/profile_banners/337171830/1613207709","http://abs.twimg.com/images/themes/theme1/bg.png","http://pbs.twimg.com/profile_images/1035471039734718464/UIb1-oK3_normal.jpg"
"x337171830","x1469957390225354753",2021-12-12 09:08:46,"AngeloTofalo","#Afghanistan: più di 5 milioni di bambini sono a un passo dalla carestia. Solo in un giorno, 8 fratelli orfani tra i 18 mesi e gli 8 anni sono morti di fame. Aiutaci ad arrivare in tempo con una donazione al Fondo Emergenze per i Bambini.","Twitter for iPhone",140,,,,FALSE,TRUE,0,513,,,"Afghanistan",,,,,,,,,,,,,"x29178622","SaveChildrenIT","it",,,,,,,,,,,,,,,,"x1466794156651597829","#Afghanistan: più di 5 milioni di bambini sono a un passo dalla carestia. Solo in un giorno, 8 fratelli orfani tra i 18 mesi e gli 8 anni sono morti di fame. Aiutaci ad arrivare in tempo con una donazione al Fondo Emergenze per i Bambini.",2021-12-03 15:39:13,"Twitter for Advertisers",1161,513,"x29178622","SaveChildrenIT","Save the Children IT",341968,956,17033,"Roma, Italia","Da oltre 100 anni lottiamo per salvare le bambine e i bambini a rischio e garantire loro un futuro.",TRUE,,,,,,,"NA NA","NA NA","NA NA NA NA NA NA NA NA","https://twitter.com/AngeloTofalo/status/1469957390225354753","Angelo Tofalo","Salerno, Pellezzano, Campania","Ingegnere, deputato della Repubblica, già Sottosegretario di Stato alla Difesa 🇮🇹 Rapito dall’Intelligence per diffondere la cultura della Sicurezza","https://t.co/4xUgrx6rHJ",FALSE,38074,4940,358,37715,16743,2011-07-17 15:43:34,TRUE,"https://t.co/4xUgrx6rHJ","http://www.angelotofalo.com",,"https://pbs.twimg.com/profile_banners/337171830/1613207709","http://abs.twimg.com/images/themes/theme1/bg.png","http://pbs.twimg.com/profile_images/1035471039734718464/UIb1-oK3_normal.jpg"
"x337171830","x1469957363830509572",2021-12-12 09:08:40,"AngeloTofalo","Nella tarda serata di ieri un equipaggio dell’85º CSAR dell’#AeronauticaMilitare, a bordo di un elicottero HH-139A e in collaborazione con il @cnsas_official, ha recuperato un escursionista rimasto ferito dopo essere precipitato in una zona impervia nei pressi di Sperlonga (LT) https://t.co/tHTQdlfcqY","Twitter for iPhone",140,,,,FALSE,TRUE,0,20,,,"AeronauticaMilitare",,,,,,,,,,,,,"x1280597143","ItalianAirForce","it",,,,,,,,,,,,,,,,"x1469949129610739717","Nella tarda serata di ieri un equipaggio dell’85º CSAR dell’#AeronauticaMilitare, a bordo di un elicottero HH-139A e in collaborazione con il @cnsas_official, ha recuperato un escursionista rimasto ferito dopo essere precipitato in una zona impervia nei pressi di Sperlonga (LT) https://t.co/tHTQdlfcqY",2021-12-12 08:35:57,"Twitter for iPad",89,20,"x1280597143","ItalianAirForce","Aeronautica Militare",108723,430,27941,"","La Difesa Aerea è la missione principale dell'Aeronautica Militare.365 giorni l'anno,24 ore su 24, i velivoli caccia sono pronti al decollo #latuasquadrachevola",TRUE,,,,,,,"NA NA","NA NA","NA NA NA NA NA NA NA NA","https://twitter.com/AngeloTofalo/status/1469957363830509572","Angelo Tofalo","Salerno, Pellezzano, Campania","Ingegnere, deputato della Repubblica, già Sottosegretario di Stato alla Difesa 🇮🇹 Rapito dall’Intelligence per diffondere la cultura della Sicurezza","https://t.co/4xUgrx6rHJ",FALSE,38074,4940,358,37715,16743,2011-07-17 15:43:34,TRUE,"https://t.co/4xUgrx6rHJ","http://www.angelotofalo.com",,"https://pbs.twimg.com/profile_banners/337171830/1613207709","http://abs.twimg.com/images/themes/theme1/bg.png","http://pbs.twimg.com/profile_images/1035471039734718464/UIb1-oK3_normal.jpg"
"x116803999","x1470168545132699657",2021-12-12 23:07:50,"raffaele_trano","Spegni la tv e accendi il cervello. Segui la diretta su #alternativa https://t.co/wh6nTqaMfR","Twitter Web App",68,,,,FALSE,FALSE,0,0,,,"alternativa",,,,,"http://pbs.twimg.com/media/FGcWOl4WYAUxKo9.jpg","https://t.co/wh6nTqaMfR","https://twitter.com/raffaele_trano/status/1470168545132699657/photo/1","photo","http://pbs.twimg.com/media/FGcWOl4WYAUxKo9.jpg","https://t.co/wh6nTqaMfR","https://twitter.com/raffaele_trano/status/1470168545132699657/photo/1",,,,"it",,,,,,,,,,,,,,,,,,,,,,,,,,,,,,,,,,,,,"NA NA","NA NA","NA NA NA NA NA NA NA NA","https://twitter.com/raffaele_trano/status/1470168545132699657","Raffaele Trano","Roma","Membro della commissione Bilancio - Camera dei Deputati - laureato in Economia - L'alternativa c'è","https://t.co/Jk99VKj6iB",FALSE,1083,430,20,2542,1214,2010-02-23 16:34:13,TRUE,"https://t.co/Jk99VKj6iB","https://www.raffaeletrano.it/",,"https://pbs.twimg.com/profile_banners/116803999/1584612651","http://abs.twimg.com/images/themes/theme1/bg.png","http://pbs.twimg.com/profile_images/1235940091895390209/HQBO3cQ-_normal.jpg"
"x116803999","x1470167812266242049",2021-12-12 23:04:55,"raffaele_trano","#Assange colpito da un  ictus in carcere dove si trova da quasi 3 anni senza aver commesso alcun reato. A che titolo l'Europa chiede al mondo il rispetto dei diritti umani  se  accetta la carcerazione illegale di un giornalista? Assange torni libero con @StellaMoris1 e i 2 figli!","Twitter Web App",140,,,,FALSE,TRUE,0,1571,,,"Assange",,,,,,,,,,,,,"x477644408","IaconaRiccardo","it",,,,,,,,,,,,,,,,"x1469949968765132803","#Assange colpito da un  ictus in carcere dove si trova da quasi 3 anni senza aver commesso alcun reato. A che titolo l'Europa chiede al mondo il rispetto dei diritti umani  se  accetta la carcerazione illegale di un giornalista? Assange torni libero con @StellaMoris1 e i 2 figli!",2021-12-12 08:39:17,"Twitter Web App",5156,1571,"x477644408","IaconaRiccardo","riccardo iacona",175258,1356,23924,"roma","Rai Tre, autore e conduttore di PRESADIRETTA  ritwitto tutto quello che penso si debba sapere  , anche quando  non condivido.
E' il mio mestiere !",FALSE,,,,,,,"NA NA","NA NA","NA NA NA NA NA NA NA NA","https://twitter.com/raffaele_trano/status/1470167812266242049","Raffaele Trano","Roma","Membro della commissione Bilancio - Camera dei Deputati - laureato in Economia - L'alternativa c'è","https://t.co/Jk99VKj6iB",FALSE,1083,430,20,2542,1214,2010-02-23 16:34:13,TRUE,"https://t.co/Jk99VKj6iB","https://www.raffaeletrano.it/",,"https://pbs.twimg.com/profile_banners/116803999/1584612651","http://abs.twimg.com/images/themes/theme1/bg.png","http://pbs.twimg.com/profile_images/1235940091895390209/HQBO3cQ-_normal.jpg"
"x636328779","x1470172319465328649",2021-12-12 23:22:50,"AlexBazzaro","@lucabattanta @Mov5Stelle Avendo reso plausibile inimmaginabile fatico oggi a screditare eventuali futuribili implementazioni dì screening.","Twitter for iPhone",113,"x1470170328064315401","x57358236","lucabattanta",FALSE,FALSE,4,2,,,,,,,,,,,,,,,,"x57358236 x289400495","lucabattanta Mov5Stelle","it",,,,,,,,,,,,,,,,,,,,,,,,,,,,,,,,,,,,,"NA NA","NA NA","NA NA NA NA NA NA NA NA","https://twitter.com/AlexBazzaro/status/1470172319465328649","Alex Bazzaro","Venezia ","🇮🇹Deputato Lega, Commissione XIV 🇪🇺 🦁Consigliere Comunale Venezia. ✈️ Delegazione @OSCE Liberale e libertario","https://t.co/yXFTMiY4b3",FALSE,2610,482,35,12388,4430,2012-07-15 15:20:42,TRUE,"https://t.co/yXFTMiY4b3","https://www.camera.it/leg18/29?shadow_deputato=307696&idpersona=307696&idlegislatura=18",,"https://pbs.twimg.com/profile_banners/636328779/1457208495","http://abs.twimg.com/images/themes/theme1/bg.png","http://pbs.twimg.com/profile_images/1315654416171753472/1PG-DcXJ_normal.jpg"
"x636328779","x1470169839348113414",2021-12-12 23:12:58,"AlexBazzaro","Da 2 anni, scienza e media han scaricato i propri fallimenti su fittizie colpe, negligenze o egoismi dei cittadini intesi come individui. Dai runner ai novax, un capro espiatorio su cui indirizzare la rabbia di una popolazione stanca e impaurita. Zero assunzione di responsabilità","Twitter for iPhone",280,,,,FALSE,FALSE,62,19,,,,,,,,,,,,,,,,,,"it",,,,,,,,,,,,,,,,,,,,,,,,,,,,,,,,,,,,,"NA NA","NA NA","NA NA NA NA NA NA NA NA","https://twitter.com/AlexBazzaro/status/1470169839348113414","Alex Bazzaro","Venezia ","🇮🇹Deputato Lega, Commissione XIV 🇪🇺 🦁Consigliere Comunale Venezia. ✈️ Delegazione @OSCE Liberale e libertario","https://t.co/yXFTMiY4b3",FALSE,2610,482,35,12388,4430,2012-07-15 15:20:42,TRUE,"https://t.co/yXFTMiY4b3","https://www.camera.it/leg18/29?shadow_deputato=307696&idpersona=307696&idlegislatura=18",,"https://pbs.twimg.com/profile_banners/636328779/1457208495","http://abs.twimg.com/images/themes/theme1/bg.png","http://pbs.twimg.com/profile_images/1315654416171753472/1PG-DcXJ_normal.jpg"
"x636328779","x1470165639151202308",2021-12-12 22:56:17,"AlexBazzaro","@AlbertoBagnai Nota a margine, il museo ha una collezione notevole.","Twitter for iPhone",52,"x1470157338401284103","x876541483","AlbertoBagnai",FALSE,FALSE,2,0,,,,,,,,,,,,,,,,"x876541483","AlbertoBagnai","it",,,,,,,,,,,,,,,,,,,,,,,,,,,,,,,,,,,,,"NA NA","NA NA","NA NA NA NA NA NA NA NA","https://twitter.com/AlexBazzaro/status/1470165639151202308","Alex Bazzaro","Venezia ","🇮🇹Deputato Lega, Commissione XIV 🇪🇺 🦁Consigliere Comunale Venezia. ✈️ Delegazione @OSCE Liberale e libertario","https://t.co/yXFTMiY4b3",FALSE,2610,482,35,12388,4430,2012-07-15 15:20:42,TRUE,"https://t.co/yXFTMiY4b3","https://www.camera.it/leg18/29?shadow_deputato=307696&idpersona=307696&idlegislatura=18",,"https://pbs.twimg.com/profile_banners/636328779/1457208495","http://abs.twimg.com/images/themes/theme1/bg.png","http://pbs.twimg.com/profile_images/1315654416171753472/1PG-DcXJ_normal.jpg"
"x636328779","x1470152351071838210",2021-12-12 22:03:29,"AlexBazzaro","Buone notizie! Quest’inverno, seguendo il ragionamento della Pomozzi, potremo riscaldarci facendo un immenso falò coi bugiardini dei farmaci che abbiamo in casa. https://t.co/MPdKnl3Ahb","Twitter for iPhone",140,,,,FALSE,TRUE,0,40,,,,,,,,,,,,,,,,"x876541483","AlbertoBagnai","it",,,,,,,,,,,,,,,,"x1470151481433206791","Buone notizie! Quest’inverno, seguendo il ragionamento della Pomozzi, potremo riscaldarci facendo un immenso falò coi bugiardini dei farmaci che abbiamo in casa. https://t.co/MPdKnl3Ahb",2021-12-12 22:00:01,"Twitter for iPhone",143,40,"x876541483","AlbertoBagnai","Alberto Bagnai",129405,666,220681,"","Professore associato di politica economica all’Università Gabriele d’Annunzio, eletto al Senato per la Lega nel collegio Abruzzo 01.",TRUE,,,,,,,"NA NA","NA NA","NA NA NA NA NA NA NA NA","https://twitter.com/AlexBazzaro/status/1470152351071838210","Alex Bazzaro","Venezia ","🇮🇹Deputato Lega, Commissione XIV 🇪🇺 🦁Consigliere Comunale Venezia. ✈️ Delegazione @OSCE Liberale e libertario","https://t.co/yXFTMiY4b3",FALSE,2610,482,35,12388,4430,2012-07-15 15:20:42,TRUE,"https://t.co/yXFTMiY4b3","https://www.camera.it/leg18/29?shadow_deputato=307696&idpersona=307696&idlegislatura=18",,"https://pbs.twimg.com/profile_banners/636328779/1457208495","http://abs.twimg.com/images/themes/theme1/bg.png","http://pbs.twimg.com/profile_images/1315654416171753472/1PG-DcXJ_normal.jpg"
"x636328779","x1470133429442387972",2021-12-12 20:48:17,"AlexBazzaro","Parto prevenuto, ma vediamo. https://t.co/BISlMH5rI6","Twitter for iPhone",28,,,,FALSE,FALSE,2,0,,,,,,,,"http://pbs.twimg.com/media/FGb2j0dXIAI-GDL.jpg","https://t.co/BISlMH5rI6","https://twitter.com/AlexBazzaro/status/1470133429442387972/photo/1","photo","http://pbs.twimg.com/media/FGb2j0dXIAI-GDL.jpg","https://t.co/BISlMH5rI6","https://twitter.com/AlexBazzaro/status/1470133429442387972/photo/1",,,,"it",,,,,,,,,,,,,,,,,,,,,,,,,,,,,,,,,,,,,"NA NA","NA NA","NA NA NA NA NA NA NA NA","https://twitter.com/AlexBazzaro/status/1470133429442387972","Alex Bazzaro","Venezia ","🇮🇹Deputato Lega, Commissione XIV 🇪🇺 🦁Consigliere Comunale Venezia. ✈️ Delegazione @OSCE Liberale e libertario","https://t.co/yXFTMiY4b3",FALSE,2610,482,35,12388,4430,2012-07-15 15:20:42,TRUE,"https://t.co/yXFTMiY4b3","https://www.camera.it/leg18/29?shadow_deputato=307696&idpersona=307696&idlegislatura=18",,"https://pbs.twimg.com/profile_banners/636328779/1457208495","http://abs.twimg.com/images/themes/theme1/bg.png","http://pbs.twimg.com/profile_images/1315654416171753472/1PG-DcXJ_normal.jpg"
"x636328779","x1470127838200279042",2021-12-12 20:26:04,"AlexBazzaro","Pensate al dramma umano delle virostar quando saranno sostituite in blocco dai climatologi su tv e giornali. Tornare al lavoro, senza inviti alla Scala o alla Mostra del Cinema di Venezia e dover assistere sui media ai nuovi esperti che parlano della nuova emergenza.","Twitter for iPhone",267,,,,FALSE,FALSE,37,3,,,,,,,,,,,,,,,,,,"it",,,,,,,,,,,,,,,,,,,,,,,,,,,,,,,,,,,,,"NA NA","NA NA","NA NA NA NA NA NA NA NA","https://twitter.com/AlexBazzaro/status/1470127838200279042","Alex Bazzaro","Venezia ","🇮🇹Deputato Lega, Commissione XIV 🇪🇺 🦁Consigliere Comunale Venezia. ✈️ Delegazione @OSCE Liberale e libertario","https://t.co/yXFTMiY4b3",FALSE,2610,482,35,12388,4430,2012-07-15 15:20:42,TRUE,"https://t.co/yXFTMiY4b3","https://www.camera.it/leg18/29?shadow_deputato=307696&idpersona=307696&idlegislatura=18",,"https://pbs.twimg.com/profile_banners/636328779/1457208495","http://abs.twimg.com/images/themes/theme1/bg.png","http://pbs.twimg.com/profile_images/1315654416171753472/1PG-DcXJ_normal.jpg"
"x636328779","x1470106523401605120",2021-12-12 19:01:23,"AlexBazzaro","@GuidoCrosetto @AlbertoBagnai @Cartabellotta Punto.","Twitter for iPhone",6,"x1470100705298075654","x413916151","GuidoCrosetto",FALSE,FALSE,27,2,,,,,,,,,,,,,,,,"x413916151 x876541483 x231902290","GuidoCrosetto AlbertoBagnai Cartabellotta","es",,,,,,,,,,,,,,,,,,,,,,,,,,,,,,,,,,,,,"NA NA","NA NA","NA NA NA NA NA NA NA NA","https://twitter.com/AlexBazzaro/status/1470106523401605120","Alex Bazzaro","Venezia ","🇮🇹Deputato Lega, Commissione XIV 🇪🇺 🦁Consigliere Comunale Venezia. ✈️ Delegazione @OSCE Liberale e libertario","https://t.co/yXFTMiY4b3",FALSE,2610,482,35,12388,4430,2012-07-15 15:20:42,TRUE,"https://t.co/yXFTMiY4b3","https://www.camera.it/leg18/29?shadow_deputato=307696&idpersona=307696&idlegislatura=18",,"https://pbs.twimg.com/profile_banners/636328779/1457208495","http://abs.twimg.com/images/themes/theme1/bg.png","http://pbs.twimg.com/profile_images/1315654416171753472/1PG-DcXJ_normal.jpg"
"x636328779","x1470091662236033026",2021-12-12 18:02:19,"AlexBazzaro","Il direttore dello Spallanzani smonta la liturgia del terrore. I #bambini diffusori di #Covid? ""Vi dico perché è una sciocchezza..."" 👇
https://t.co/UaZiLMY23I","Twitter for iPhone",140,,,,FALSE,TRUE,0,186,,,"bambini Covid",,,,,,,,,,,,,"x399004979","NicolaPorro","it",,,,,,,,,,,,,,,,"x1470085688557146114","Il direttore dello Spallanzani smonta la liturgia del terrore. I #bambini diffusori di #Covid? ""Vi dico perché è una sciocchezza..."" 👇
https://t.co/UaZiLMY23I",2021-12-12 17:38:35,"TweetDeck",528,186,"x399004979","NicolaPorro","Nicola Porro",430942,598,21045,"","Vicedirettore del @ilgiornale, conduttore televisivo e giornalista. Tutti i giorni la sua zuppa su https://t.co/GPJd1eo4b8",TRUE,,,,,,,"NA NA","NA NA","NA NA NA NA NA NA NA NA","https://twitter.com/AlexBazzaro/status/1470091662236033026","Alex Bazzaro","Venezia ","🇮🇹Deputato Lega, Commissione XIV 🇪🇺 🦁Consigliere Comunale Venezia. ✈️ Delegazione @OSCE Liberale e libertario","https://t.co/yXFTMiY4b3",FALSE,2610,482,35,12388,4430,2012-07-15 15:20:42,TRUE,"https://t.co/yXFTMiY4b3","https://www.camera.it/leg18/29?shadow_deputato=307696&idpersona=307696&idlegislatura=18",,"https://pbs.twimg.com/profile_banners/636328779/1457208495","http://abs.twimg.com/images/themes/theme1/bg.png","http://pbs.twimg.com/profile_images/1315654416171753472/1PG-DcXJ_normal.jpg"
"x636328779","x1470084996744499204",2021-12-12 17:35:50,"AlexBazzaro","#domenica #rey ❤️ https://t.co/kAdf2cmvAk","Twitter for iPhone",17,,,,FALSE,FALSE,33,0,,,"domenica rey",,,,,"http://pbs.twimg.com/media/FGbKgrsWQBA94tL.jpg","https://t.co/kAdf2cmvAk","https://twitter.com/AlexBazzaro/status/1470084996744499204/photo/1","photo","http://pbs.twimg.com/media/FGbKgrsWQBA94tL.jpg","https://t.co/kAdf2cmvAk","https://twitter.com/AlexBazzaro/status/1470084996744499204/photo/1",,,,"und",,,,,,,,,,,,,,,,,,,,,,,,,,,,,,,,,,,,,"NA NA","NA NA","NA NA NA NA NA NA NA NA","https://twitter.com/AlexBazzaro/status/1470084996744499204","Alex Bazzaro","Venezia ","🇮🇹Deputato Lega, Commissione XIV 🇪🇺 🦁Consigliere Comunale Venezia. ✈️ Delegazione @OSCE Liberale e libertario","https://t.co/yXFTMiY4b3",FALSE,2610,482,35,12388,4430,2012-07-15 15:20:42,TRUE,"https://t.co/yXFTMiY4b3","https://www.camera.it/leg18/29?shadow_deputato=307696&idpersona=307696&idlegislatura=18",,"https://pbs.twimg.com/profile_banners/636328779/1457208495","http://abs.twimg.com/images/themes/theme1/bg.png","http://pbs.twimg.com/profile_images/1315654416171753472/1PG-DcXJ_normal.jpg"
"x636328779","x1470082200448163840",2021-12-12 17:24:44,"AlexBazzaro","Il governatore Ron Desantis: «I progressisti allungano le mani su istruzione, big tech e sanità. I cittadini lo sanno e al mid term li puniranno». https://t.co/aLVgKH5Ey9","Twitter for iPhone",140,,,,FALSE,TRUE,0,102,,,,,,,,,,,,,,,,"x900766265245130753","LaVeritaWeb","it",,,,,,,,,,,,,,,,"x1470045951020707845","Il governatore Ron Desantis: «I progressisti allungano le mani su istruzione, big tech e sanità. I cittadini lo sanno e al mid term li puniranno». https://t.co/aLVgKH5Ey9",2021-12-12 15:00:41,"RunnerCommonKeys",395,102,"x900766265245130753","LaVeritaWeb","La Verità",137903,68,25245,"Milano, Lombardia","Quotidiano indipendente diretto da @BelpietroTweet. Scopri #LaVeritàdioggi tutti i giorni in edicola al costo di € 1,30. Abbonati online oggi:",FALSE,,,,,,,"NA NA","NA NA","NA NA NA NA NA NA NA NA","https://twitter.com/AlexBazzaro/status/1470082200448163840","Alex Bazzaro","Venezia ","🇮🇹Deputato Lega, Commissione XIV 🇪🇺 🦁Consigliere Comunale Venezia. ✈️ Delegazione @OSCE Liberale e libertario","https://t.co/yXFTMiY4b3",FALSE,2610,482,35,12388,4430,2012-07-15 15:20:42,TRUE,"https://t.co/yXFTMiY4b3","https://www.camera.it/leg18/29?shadow_deputato=307696&idpersona=307696&idlegislatura=18",,"https://pbs.twimg.com/profile_banners/636328779/1457208495","http://abs.twimg.com/images/themes/theme1/bg.png","http://pbs.twimg.com/profile_images/1315654416171753472/1PG-DcXJ_normal.jpg"
"x636328779","x1470082145884508160",2021-12-12 17:24:31,"AlexBazzaro","@cinziotta73 Non credo, ma adoro chi pontifica su dì un voto nel quale entreranno in gioco dinamiche sulle quali nemmeno i leaders dei partito hanno certezze. E conoscendo gli umori dei colleghi non darei così per scontata questa previsione.","Twitter for iPhone",228,"x1470080353360560131","x1261809647738138624","cinziotta73",FALSE,FALSE,3,0,,,,,,,,,,,,,,,,"x1261809647738138624","cinziotta73","it",,,,,,,,,,,,,,,,,,,,,,,,,,,,,,,,,,,,,"NA NA","NA NA","NA NA NA NA NA NA NA NA","https://twitter.com/AlexBazzaro/status/1470082145884508160","Alex Bazzaro","Venezia ","🇮🇹Deputato Lega, Commissione XIV 🇪🇺 🦁Consigliere Comunale Venezia. ✈️ Delegazione @OSCE Liberale e libertario","https://t.co/yXFTMiY4b3",FALSE,2610,482,35,12388,4430,2012-07-15 15:20:42,TRUE,"https://t.co/yXFTMiY4b3","https://www.camera.it/leg18/29?shadow_deputato=307696&idpersona=307696&idlegislatura=18",,"https://pbs.twimg.com/profile_banners/636328779/1457208495","http://abs.twimg.com/images/themes/theme1/bg.png","http://pbs.twimg.com/profile_images/1315654416171753472/1PG-DcXJ_normal.jpg"
"x636328779","x1470079521793753098",2021-12-12 17:14:05,"AlexBazzaro","Qualcuno non ha ben chiaro chi vota e perché il Presidente della Repubblica. https://t.co/t4UkDeLUY2","Twitter for iPhone",76,,,,FALSE,FALSE,31,4,,,,,,,,"http://pbs.twimg.com/media/FGbFiEUX0AoS6rC.jpg","https://t.co/t4UkDeLUY2","https://twitter.com/AlexBazzaro/status/1470079521793753098/photo/1","photo","http://pbs.twimg.com/media/FGbFiEUX0AoS6rC.jpg","https://t.co/t4UkDeLUY2","https://twitter.com/AlexBazzaro/status/1470079521793753098/photo/1",,,,"it",,,,,,,,,,,,,,,,,,,,,,,,,,,,,,,,,,,,,"NA NA","NA NA","NA NA NA NA NA NA NA NA","https://twitter.com/AlexBazzaro/status/1470079521793753098","Alex Bazzaro","Venezia ","🇮🇹Deputato Lega, Commissione XIV 🇪🇺 🦁Consigliere Comunale Venezia. ✈️ Delegazione @OSCE Liberale e libertario","https://t.co/yXFTMiY4b3",FALSE,2610,482,35,12388,4430,2012-07-15 15:20:42,TRUE,"https://t.co/yXFTMiY4b3","https://www.camera.it/leg18/29?shadow_deputato=307696&idpersona=307696&idlegislatura=18",,"https://pbs.twimg.com/profile_banners/636328779/1457208495","http://abs.twimg.com/images/themes/theme1/bg.png","http://pbs.twimg.com/profile_images/1315654416171753472/1PG-DcXJ_normal.jpg"
