"x201658727","x1451529299773820932",2021-10-22 12:42:07,"VittorioSgarbi","Al Mart di Rovereto la mostra ""Il falso nell'arte.
Alceo Dossena e la scultura italiana del Rinascimento"".
Aperta al pubblico fino a domenica 9 gennaio 2022. https://t.co/XNmj7wYUx5 @stampasgarbi @martmuseumlive","Twitter Web App",211,,,,FALSE,FALSE,29,1,,,,,"mart.tn.it/mostre/il-fals…","https://t.co/XNmj7wYUx5","https://www.mart.tn.it/mostre/il-falso-nell-arte-alceo-dossena-e-la-scultura-italiana-del-rinascimento-149667",,,,,,,,,"x2164988132 x1605770532","stampasgarbi martmuseumlive","it",,,,,,,,,,,,,,,,,,,,,,,,,,,,,,,,,,,,,"NA NA","NA NA","NA NA NA NA NA NA NA NA","https://twitter.com/VittorioSgarbi/status/1451529299773820932","Vittorio Sgarbi","mai nello stesso luogo","Twitter ufficiale di Vittorio Sgarbi - Storico dell'Arte e Opinionista | Contatti: press@vittoriosgarbi.it
Capra Store: https://t.co/XvD8pqlFul","https://t.co/v3GBQb33Lz",FALSE,779264,352,1292,11738,4194,2010-10-12 10:20:00,TRUE,"https://t.co/v3GBQb33Lz","http://www.vittoriosgarbi.it",,"https://pbs.twimg.com/profile_banners/201658727/1634300255","http://abs.twimg.com/images/themes/theme1/bg.png","http://pbs.twimg.com/profile_images/378800000563952334/834a3c187534931f8af26f78b6c274a8_normal.jpeg"
"x201658727","x1451498422859599882",2021-10-22 10:39:26,"VittorioSgarbi","“Ma che te ridi?” @stampasgarbi https://t.co/S1HgyuVELr","Twitter for iPhone",31,,,,FALSE,FALSE,858,87,,,,,,,,"http://pbs.twimg.com/media/FCTCHk-WEBYhd1o.jpg","https://t.co/S1HgyuVELr","https://twitter.com/VittorioSgarbi/status/1451498422859599882/photo/1","photo","http://pbs.twimg.com/media/FCTCHk-WEBYhd1o.jpg","https://t.co/S1HgyuVELr","https://twitter.com/VittorioSgarbi/status/1451498422859599882/photo/1",,"x2164988132","stampasgarbi","it",,,,,,,,,,,,,,,,,,,,,,,,,,,,,,,,,,,,,"NA NA","NA NA","NA NA NA NA NA NA NA NA","https://twitter.com/VittorioSgarbi/status/1451498422859599882","Vittorio Sgarbi","mai nello stesso luogo","Twitter ufficiale di Vittorio Sgarbi - Storico dell'Arte e Opinionista | Contatti: press@vittoriosgarbi.it
Capra Store: https://t.co/XvD8pqlFul","https://t.co/v3GBQb33Lz",FALSE,779264,352,1292,11738,4194,2010-10-12 10:20:00,TRUE,"https://t.co/v3GBQb33Lz","http://www.vittoriosgarbi.it",,"https://pbs.twimg.com/profile_banners/201658727/1634300255","http://abs.twimg.com/images/themes/theme1/bg.png","http://pbs.twimg.com/profile_images/378800000563952334/834a3c187534931f8af26f78b6c274a8_normal.jpeg"
"x201658727","x1451294721532387337",2021-10-21 21:10:00,"VittorioSgarbi","@GDCimino @PiazzapulitaLA7 @corradoformigli @GuidoCrosetto @GiorgiaMeloni @FratellidItalia @BHL @LegaSalvini @stampasgarbi Cialtrone. Vergognati,”editore” di sta cippa!","Twitter for iPhone",45,"x1451288180154580996","x253125067","GDCimino",FALSE,FALSE,3,0,,,,,,,,,,,,,,,,"x253125067 x58453980 x246910613 x413916151 x130537001 x1024976264 x46479088 x13514762 x2164988132","GDCimino PiazzapulitaLA7 corradoformigli GuidoCrosetto GiorgiaMeloni FratellidItalia BHL LegaSalvini stampasgarbi","it",,,,,,,,,,,,,,,,,,,,,,,,,,,,,,,,,,,,,"NA NA","NA NA","NA NA NA NA NA NA NA NA","https://twitter.com/VittorioSgarbi/status/1451294721532387337","Vittorio Sgarbi","mai nello stesso luogo","Twitter ufficiale di Vittorio Sgarbi - Storico dell'Arte e Opinionista | Contatti: press@vittoriosgarbi.it
Capra Store: https://t.co/XvD8pqlFul","https://t.co/v3GBQb33Lz",FALSE,779264,352,1292,11738,4194,2010-10-12 10:20:00,TRUE,"https://t.co/v3GBQb33Lz","http://www.vittoriosgarbi.it",,"https://pbs.twimg.com/profile_banners/201658727/1634300255","http://abs.twimg.com/images/themes/theme1/bg.png","http://pbs.twimg.com/profile_images/378800000563952334/834a3c187534931f8af26f78b6c274a8_normal.jpeg"
"x201658727","x1451294357773037580",2021-10-21 21:08:33,"VittorioSgarbi","@F_Baldux @PiazzapulitaLA7 @corradoformigli @GuidoCrosetto @GiorgiaMeloni @FratellidItalia @BHL @LegaSalvini @stampasgarbi Certo che avrà dovuto spremere le meningi al limite per partorire un commento così intelligente…","Twitter for iPhone",96,"x1451292642004832261","x167566334","F_Baldux",FALSE,FALSE,12,0,,,,,,,,,,,,,,,,"x167566334 x58453980 x246910613 x413916151 x130537001 x1024976264 x46479088 x13514762 x2164988132","F_Baldux PiazzapulitaLA7 corradoformigli GuidoCrosetto GiorgiaMeloni FratellidItalia BHL LegaSalvini stampasgarbi","it",,,,,,,,,,,,,,,,,,,,,,,,,,,,,,,,,,,,,"NA NA","NA NA","NA NA NA NA NA NA NA NA","https://twitter.com/VittorioSgarbi/status/1451294357773037580","Vittorio Sgarbi","mai nello stesso luogo","Twitter ufficiale di Vittorio Sgarbi - Storico dell'Arte e Opinionista | Contatti: press@vittoriosgarbi.it
Capra Store: https://t.co/XvD8pqlFul","https://t.co/v3GBQb33Lz",FALSE,779264,352,1292,11738,4194,2010-10-12 10:20:00,TRUE,"https://t.co/v3GBQb33Lz","http://www.vittoriosgarbi.it",,"https://pbs.twimg.com/profile_banners/201658727/1634300255","http://abs.twimg.com/images/themes/theme1/bg.png","http://pbs.twimg.com/profile_images/378800000563952334/834a3c187534931f8af26f78b6c274a8_normal.jpeg"
"x201658727","x1451290377953087494",2021-10-21 20:52:44,"VittorioSgarbi","#covid Vedo i segnali di una nuova stagione del terrore. @stampasgarbi","Twitter for iPhone",70,,,,FALSE,FALSE,1931,300,,,"covid",,,,,,,,,,,,,"x2164988132","stampasgarbi","it",,,,,,,,,,,,,,,,,,,,,,,,,,,,,,,,,,,,,"NA NA","NA NA","NA NA NA NA NA NA NA NA","https://twitter.com/VittorioSgarbi/status/1451290377953087494","Vittorio Sgarbi","mai nello stesso luogo","Twitter ufficiale di Vittorio Sgarbi - Storico dell'Arte e Opinionista | Contatti: press@vittoriosgarbi.it
Capra Store: https://t.co/XvD8pqlFul","https://t.co/v3GBQb33Lz",FALSE,779264,352,1292,11738,4194,2010-10-12 10:20:00,TRUE,"https://t.co/v3GBQb33Lz","http://www.vittoriosgarbi.it",,"https://pbs.twimg.com/profile_banners/201658727/1634300255","http://abs.twimg.com/images/themes/theme1/bg.png","http://pbs.twimg.com/profile_images/378800000563952334/834a3c187534931f8af26f78b6c274a8_normal.jpeg"
"x201658727","x1451271343912144906",2021-10-21 19:37:06,"VittorioSgarbi","#giornalisticonlelmetto Dai Formigli, la campagna elettorale è finita: puoi ricacciare fascismo e antifascismo in soffitta. Togli l’elmetto: non c’è alcuna guerra. @PiazzapulitaLA7 @corradoformigli @GuidoCrosetto @GiorgiaMeloni @FratellidItalia @BHL @LegaSalvini @stampasgarbi","Twitter for iPhone",276,,,,FALSE,FALSE,809,114,,,"giornalisticonlelmetto",,,,,,,,,,,,,"x58453980 x246910613 x413916151 x130537001 x1024976264 x46479088 x13514762 x2164988132","PiazzapulitaLA7 corradoformigli GuidoCrosetto GiorgiaMeloni FratellidItalia BHL LegaSalvini stampasgarbi","it",,,,,,,,,,,,,,,,,,,,,,,,,,,,,,,,,,,,,"NA NA","NA NA","NA NA NA NA NA NA NA NA","https://twitter.com/VittorioSgarbi/status/1451271343912144906","Vittorio Sgarbi","mai nello stesso luogo","Twitter ufficiale di Vittorio Sgarbi - Storico dell'Arte e Opinionista | Contatti: press@vittoriosgarbi.it
Capra Store: https://t.co/XvD8pqlFul","https://t.co/v3GBQb33Lz",FALSE,779264,352,1292,11738,4194,2010-10-12 10:20:00,TRUE,"https://t.co/v3GBQb33Lz","http://www.vittoriosgarbi.it",,"https://pbs.twimg.com/profile_banners/201658727/1634300255","http://abs.twimg.com/images/themes/theme1/bg.png","http://pbs.twimg.com/profile_images/378800000563952334/834a3c187534931f8af26f78b6c274a8_normal.jpeg"
"x201658727","x1451260628686024706",2021-10-21 18:54:31,"VittorioSgarbi","#berlusconi L’evidente inconsistenza delle accuse che oggi ha  portato a una inevitabile assoluzione di Berlusconi è la prova di un’azione strumentale con l’evidente risultato di diffamare, umiliare e colpire l’ex presidente del Consiglio… https://t.co/5LCCcRP1Gq @Adnkronos https://t.co/7VOhqT49pJ","Twitter for iPhone",274,,,,FALSE,FALSE,456,63,,,"berlusconi",,"facebook.com/12115773460730…","https://t.co/5LCCcRP1Gq","https://www.facebook.com/121157734607309/posts/4740778385978531/?d=n","http://pbs.twimg.com/media/FCPp2P_WUAc1meA.jpg","https://t.co/7VOhqT49pJ","https://twitter.com/VittorioSgarbi/status/1451260628686024706/photo/1","photo","http://pbs.twimg.com/media/FCPp2P_WUAc1meA.jpg","https://t.co/7VOhqT49pJ","https://twitter.com/VittorioSgarbi/status/1451260628686024706/photo/1",,"x25676606","Adnkronos","it",,,,,,,,,,,,,,,,,,,,,,,,,,,,,,,,,,,,,"NA NA","NA NA","NA NA NA NA NA NA NA NA","https://twitter.com/VittorioSgarbi/status/1451260628686024706","Vittorio Sgarbi","mai nello stesso luogo","Twitter ufficiale di Vittorio Sgarbi - Storico dell'Arte e Opinionista | Contatti: press@vittoriosgarbi.it
Capra Store: https://t.co/XvD8pqlFul","https://t.co/v3GBQb33Lz",FALSE,779264,352,1292,11738,4194,2010-10-12 10:20:00,TRUE,"https://t.co/v3GBQb33Lz","http://www.vittoriosgarbi.it",,"https://pbs.twimg.com/profile_banners/201658727/1634300255","http://abs.twimg.com/images/themes/theme1/bg.png","http://pbs.twimg.com/profile_images/378800000563952334/834a3c187534931f8af26f78b6c274a8_normal.jpeg"
"x499672556","x1451443189123067905",2021-10-22 06:59:57,"GiorgioSilli","@4everAnnina Che degrado la politica….","Twitter for iPhone",25,"x1451287553810870275","x989423077","4everAnnina",FALSE,FALSE,1,0,,,,,,,,,,,,,,,,"x989423077","4everAnnina","it",,,,,,,,,,,,,,,,,,,,,,,,,,,,,,,,,,,,,"NA NA","NA NA","NA NA NA NA NA NA NA NA","https://twitter.com/GiorgioSilli/status/1451443189123067905","Giorgio Silli","Prato, Toscana","Babbo di Isabella, Deputato della Repubblica.Tintore. Molto rossiniano","https://t.co/i4HLZLAULC",FALSE,1885,647,33,6578,2359,2012-02-22 10:49:12,FALSE,"https://t.co/i4HLZLAULC","http://giorgiosilli.it",,"https://pbs.twimg.com/profile_banners/499672556/1434717572","http://abs.twimg.com/images/themes/theme1/bg.png","http://pbs.twimg.com/profile_images/1076762978752577536/9E8AyaPD_normal.jpg"
"x1261619708","x1451488814657048588",2021-10-22 10:01:15,"maria_spena","Oggi #22ottobre è San #GiovanniPaoloII. Un #Papa venuto “da un Paese lontano”, che aveva patito sulla pelle il male dei totalitarismi. Una parte importante nella sconfitta del #comunismo la dobbiamo a lui e al suo grande amore per la #libertà. Non dimentichiamolo. https://t.co/fjmGpzvaoL","Twitter for iPhone",264,,,,FALSE,FALSE,9,4,,,"22ottobre GiovanniPaoloII Papa comunismo libertà",,,,,"http://pbs.twimg.com/media/FCS5YZIXIAAGn-1.jpg","https://t.co/fjmGpzvaoL","https://twitter.com/maria_spena/status/1451488814657048588/photo/1","photo","http://pbs.twimg.com/media/FCS5YZIXIAAGn-1.jpg","https://t.co/fjmGpzvaoL","https://twitter.com/maria_spena/status/1451488814657048588/photo/1",,,,"it",,,,,,,,,,,,,,,,,,,,,,,,,,,,,,,,,,,,,"NA NA","NA NA","NA NA NA NA NA NA NA NA","https://twitter.com/maria_spena/status/1451488814657048588","Maria Spena","","🎓Giurisprudenza 🏛Deputata di @forza_italia Vicepresidente XIII Commissione Agricoltura e Componente della Commissione Parlamentare Infanzia e Adolescenza",,FALSE,918,56,13,507,441,2013-03-12 10:05:34,FALSE,,,,"https://pbs.twimg.com/profile_banners/1261619708/1608501867","http://abs.twimg.com/images/themes/theme1/bg.png","http://pbs.twimg.com/profile_images/1436291880451514368/XdLeZL1v_normal.jpg"
"x906269360","x1451615928345628701",2021-10-22 18:26:21,"tripodimaria","“Carlo Donat Cattin 30 anni dopo”. Un bel momento di confronto su una delle personalità più eminenti della Repubblica e della #dc, il cui pensiero politico è perfettamente attualizzabile alla contemporaneità. @grotondi https://t.co/d2FhlaGzJT","Twitter for iPhone",218,,,,FALSE,FALSE,2,0,,,"dc",,,,,"http://pbs.twimg.com/media/FCUs_WfWYAc9gCW.jpg","https://t.co/d2FhlaGzJT","https://twitter.com/tripodimaria/status/1451615928345628701/photo/1","photo","http://pbs.twimg.com/media/FCUs_WfWYAc9gCW.jpg http://pbs.twimg.com/media/FCUs_WhXEBE0LOi.jpg http://pbs.twimg.com/media/FCUs_WgXMAg60E7.jpg","https://t.co/d2FhlaGzJT https://t.co/d2FhlaGzJT https://t.co/d2FhlaGzJT","https://twitter.com/tripodimaria/status/1451615928345628701/photo/1 https://twitter.com/tripodimaria/status/1451615928345628701/photo/1 https://twitter.com/tripodimaria/status/1451615928345628701/photo/1",,"x87467449","grotondi","it",,,,,,,,,,,,,,,,,,,,,,,,,,,,,,,,,,,,,"NA NA","NA NA","NA NA NA NA NA NA NA NA","https://twitter.com/tripodimaria/status/1451615928345628701","Maria Tripodi","","Deputato della Repubblica•                Eletta nel Collegio Calabria02•   Capogruppo @forza_Italia in @cd_difesa•  Dott.ssa in Relazioni Internazionali",,FALSE,6518,2332,44,11410,16193,2012-10-26 15:54:35,FALSE,,,,"https://pbs.twimg.com/profile_banners/906269360/1521784227","http://abs.twimg.com/images/themes/theme1/bg.png","http://pbs.twimg.com/profile_images/809321296794415104/jDezppyk_normal.jpg"
"x906269360","x1451568170335186949",2021-10-22 15:16:35,"tripodimaria","“La grandezza non ha un tempo e non ha un nome”
Così il claim del #4Novembre che rimanda al #MiliteIgnoto, soldato senza nome divenuto poi figlio e fratello di tutti gli italiani.
Uno dei simboli su cui poggia il nostro concetto di identità nazionale.
https://t.co/f7gJiQQZ3a https://t.co/dIco82ra28","Twitter for iPhone",140,,,,FALSE,TRUE,0,44,,,"4Novembre MiliteIgnoto",,,,,,,,,,,,,"x384192964","MinisteroDifesa","it",,,,,,,,,,,,,,,,"x1451552911759187974","“La grandezza non ha un tempo e non ha un nome”
Così il claim del #4Novembre che rimanda al #MiliteIgnoto, soldato senza nome divenuto poi figlio e fratello di tutti gli italiani.
Uno dei simboli su cui poggia il nostro concetto di identità nazionale.
https://t.co/f7gJiQQZ3a https://t.co/dIco82ra28",2021-10-22 14:15:57,"Twitter for iPhone",139,44,"x384192964","MinisteroDifesa","Ministero Difesa",347011,111,15204,"","Benvenuti sul profilo Twitter del Ministero della Difesa|Welcome to the Ministry of Defence Twitter profile #MinisteroDifesa https://t.co/6wL5UwRx3s",TRUE,,,,,,,"NA NA","NA NA","NA NA NA NA NA NA NA NA","https://twitter.com/tripodimaria/status/1451568170335186949","Maria Tripodi","","Deputato della Repubblica•                Eletta nel Collegio Calabria02•   Capogruppo @forza_Italia in @cd_difesa•  Dott.ssa in Relazioni Internazionali",,FALSE,6518,2332,44,11410,16193,2012-10-26 15:54:35,FALSE,,,,"https://pbs.twimg.com/profile_banners/906269360/1521784227","http://abs.twimg.com/images/themes/theme1/bg.png","http://pbs.twimg.com/profile_images/809321296794415104/jDezppyk_normal.jpg"
"x906269360","x1451462374091857921",2021-10-22 08:16:11,"tripodimaria","Al via questo pomeriggio il convegno della fondazione Dc con il quotidiano ‘La Discussione’ e il gruppo parlamentare di Forza Italia alla https://t.co/yHOwAOglpW inizia con l’omaggio a Carlo Donat Cattin,nel trentennale della scomparsa.","Twitter for iPhone",140,,,,FALSE,TRUE,0,4,,,,,,,,,,,,,,,,"x87467449","grotondi","it",,,,,,,,,,,,,,,,"x1451448190876725266","Al via questo pomeriggio il convegno della fondazione Dc con il quotidiano ‘La Discussione’ e il gruppo parlamentare di Forza Italia alla https://t.co/yHOwAOglpW inizia con l’omaggio a Carlo Donat Cattin,nel trentennale della scomparsa.",2021-10-22 07:19:49,"Twitter for iPhone",15,4,"x87467449","grotondi","Gianfranco Rotondi",32514,6081,49707,"Pescara, Abruzzo","sono poco su Twitter ma senza staff",FALSE,,,,,,,"NA NA","NA NA","NA NA NA NA NA NA NA NA","https://twitter.com/tripodimaria/status/1451462374091857921","Maria Tripodi","","Deputato della Repubblica•                Eletta nel Collegio Calabria02•   Capogruppo @forza_Italia in @cd_difesa•  Dott.ssa in Relazioni Internazionali",,FALSE,6518,2332,44,11410,16193,2012-10-26 15:54:35,FALSE,,,,"https://pbs.twimg.com/profile_banners/906269360/1521784227","http://abs.twimg.com/images/themes/theme1/bg.png","http://pbs.twimg.com/profile_images/809321296794415104/jDezppyk_normal.jpg"
"x906269360","x1451461316602830853",2021-10-22 08:11:59,"tripodimaria","🔜 Saint Vincent✈️ per la tre giorni organizzata dalla Fondazione Fiorentino Sullo. Interverrò alla tavola inaugurale “Carlo Donat Cattin 30 anni dopo”. 
Complimenti a @grotondi per aver organizzato l’appuntamento principe della storia #DC, giunto alla 40esima edizione. https://t.co/8jVjOkN0hC","Twitter for iPhone",269,,,,FALSE,FALSE,6,3,,,"DC",,,,,"http://pbs.twimg.com/media/FCSgXvpX0BEvf3B.jpg","https://t.co/8jVjOkN0hC","https://twitter.com/tripodimaria/status/1451461316602830853/photo/1","photo","http://pbs.twimg.com/media/FCSgXvpX0BEvf3B.jpg","https://t.co/8jVjOkN0hC","https://twitter.com/tripodimaria/status/1451461316602830853/photo/1",,"x87467449","grotondi","it",,,,,,,,,,,,,,,,,,,,,,,,,,,,,,,,,,,,,"NA NA","NA NA","NA NA NA NA NA NA NA NA","https://twitter.com/tripodimaria/status/1451461316602830853","Maria Tripodi","","Deputato della Repubblica•                Eletta nel Collegio Calabria02•   Capogruppo @forza_Italia in @cd_difesa•  Dott.ssa in Relazioni Internazionali",,FALSE,6518,2332,44,11410,16193,2012-10-26 15:54:35,FALSE,,,,"https://pbs.twimg.com/profile_banners/906269360/1521784227","http://abs.twimg.com/images/themes/theme1/bg.png","http://pbs.twimg.com/profile_images/809321296794415104/jDezppyk_normal.jpg"
"x447056150","x1451603362936500384",2021-10-22 17:36:25,"GiusyVersace","Inguaribile ottimista con una tremenda voglia di vivere! YES, I AM.😁😎💪
Amici,ci vediamo a #VENEZIA per la
@Venicemarathon si corre per passione e per solidarietà❤
Sab 23 al VILLAGGIO ONLUS e Dom 24 si CORRE🏃‍♀️🏃‍♂️e la raccolta fondi su @Retedeldono continua:Dona e fai donare💪❤ https://t.co/wrGB1ZDJth","Twitter for Android",278,,,,FALSE,FALSE,8,0,,,"VENEZIA",,,,,"http://pbs.twimg.com/media/FCUhj7XXEAYPxOp.jpg","https://t.co/wrGB1ZDJth","https://twitter.com/GiusyVersace/status/1451603362936500384/photo/1","photo","http://pbs.twimg.com/media/FCUhj7XXEAYPxOp.jpg","https://t.co/wrGB1ZDJth","https://twitter.com/GiusyVersace/status/1451603362936500384/photo/1",,"x961987598 x205164413","Venicemarathon Retedeldono","it",,,,,,,,,,,,,,,,,,,,,,,,,,,,,,,,,,,,,"NA NA","NA NA","NA NA NA NA NA NA NA NA","https://twitter.com/GiusyVersace/status/1451603362936500384","Giusy Versace","Milano","Cominciate col fare il necessario, poi cio' che e' possibile e all'improvviso vi sorprenderete a fare l'impossibile - S.Francesco d'Assisi","http://t.co/jemrvujzQb",FALSE,25974,2089,122,21784,16021,2011-12-26 13:05:12,TRUE,"http://t.co/jemrvujzQb","http://www.giusyversace.it",,"https://pbs.twimg.com/profile_banners/447056150/1363347299","http://abs.twimg.com/images/themes/theme1/bg.png","http://pbs.twimg.com/profile_images/378800000828007270/bad08b8529048aef2d0a82e084b0b31a_normal.jpeg"
"x447056150","x1451298784340815872",2021-10-21 21:26:08,"GiusyVersace","#rubyter @berlusconi ASSOLTO PERCHÉ IL FATTO NON SUSSISTE!
Una buona notizia di buona giustizia che di certo non ripaga dell'amarezza ed il calvario subiti da #Berlusconi e la sua famiglia.Pochi altri avrebbero retto ad un tale accanimento spesso anche mediatico.Forza presidente!","Twitter for Android",280,,,,FALSE,FALSE,22,4,,,"rubyter Berlusconi",,,,,,,,,,,,,"x920277002858500096","berlusconi","it",,,,,,,,,,,,,,,,,,,,,,,,,,,,,,,,,,,,,"NA NA","NA NA","NA NA NA NA NA NA NA NA","https://twitter.com/GiusyVersace/status/1451298784340815872","Giusy Versace","Milano","Cominciate col fare il necessario, poi cio' che e' possibile e all'improvviso vi sorprenderete a fare l'impossibile - S.Francesco d'Assisi","http://t.co/jemrvujzQb",FALSE,25974,2089,122,21784,16021,2011-12-26 13:05:12,TRUE,"http://t.co/jemrvujzQb","http://www.giusyversace.it",,"https://pbs.twimg.com/profile_banners/447056150/1363347299","http://abs.twimg.com/images/themes/theme1/bg.png","http://pbs.twimg.com/profile_images/378800000828007270/bad08b8529048aef2d0a82e084b0b31a_normal.jpeg"
"x1557514573","x1451621962275504135",2021-10-22 18:50:20,"elio_vito","@n3tr4mbl3r1 Salvini ha il record di trollate, Giorgia non posso...","Twitter for iPad",54,"x1451621405028765702","x734792555565551616","n3tr4mbl3r1",FALSE,FALSE,0,0,,,,,,,,,,,,,,,,"x734792555565551616","n3tr4mbl3r1","it",,,,,,,,,,,,,,,,,,,,,,,,,,,,,,,,,,,,,"NA NA","NA NA","NA NA NA NA NA NA NA NA","https://twitter.com/elio_vito/status/1451621962275504135","Elio Vito 🇮🇹🇪🇺🇺🇸","Roma","Deputato @forza_italia. Juventino","https://t.co/m1rl9646f6",FALSE,14465,13,101,20209,30997,2013-06-30 07:47:38,TRUE,"https://t.co/m1rl9646f6","https://www.change.org/p/rai-radiotelevisione-italiana-vogliamo-elio-vito-in-tv",,"https://pbs.twimg.com/profile_banners/1557514573/1623834710","http://abs.twimg.com/images/themes/theme1/bg.png","http://pbs.twimg.com/profile_images/736450788659240960/-8W5fQJa_normal.jpg"
"x1557514573","x1451621724663988224",2021-10-22 18:49:23,"elio_vito","@agggenzia @Memix1968 @MichelaMgl Se fate tutto questo casino si...","Twitter for iPad",33,"x1451621306718359553","x1427914251688099842","agggenzia",FALSE,FALSE,0,0,,,,,,,,,,,,,,,,"x1427914251688099842 x837313603535523840 x960859388","agggenzia Memix1968 MichelaMgl","it",,,,,,,,,,,,,,,,,,,,,,,,,,,,,,,,,,,,,"NA NA","NA NA","NA NA NA NA NA NA NA NA","https://twitter.com/elio_vito/status/1451621724663988224","Elio Vito 🇮🇹🇪🇺🇺🇸","Roma","Deputato @forza_italia. Juventino","https://t.co/m1rl9646f6",FALSE,14465,13,101,20209,30997,2013-06-30 07:47:38,TRUE,"https://t.co/m1rl9646f6","https://www.change.org/p/rai-radiotelevisione-italiana-vogliamo-elio-vito-in-tv",,"https://pbs.twimg.com/profile_banners/1557514573/1623834710","http://abs.twimg.com/images/themes/theme1/bg.png","http://pbs.twimg.com/profile_images/736450788659240960/-8W5fQJa_normal.jpg"
"x1557514573","x1451621197725196296",2021-10-22 18:47:18,"elio_vito","@fabcet Questa è buona!","Twitter for iPad",15,"x1451619689055068169","x1015232696","fabcet",FALSE,FALSE,2,0,,,,,,,,,,,,,,,,"x1015232696","fabcet","it",,,,,,,,,,,,,,,,,,,,,,,,,,,,,,,,,,,,,"NA NA","NA NA","NA NA NA NA NA NA NA NA","https://twitter.com/elio_vito/status/1451621197725196296","Elio Vito 🇮🇹🇪🇺🇺🇸","Roma","Deputato @forza_italia. Juventino","https://t.co/m1rl9646f6",FALSE,14465,13,101,20209,30997,2013-06-30 07:47:38,TRUE,"https://t.co/m1rl9646f6","https://www.change.org/p/rai-radiotelevisione-italiana-vogliamo-elio-vito-in-tv",,"https://pbs.twimg.com/profile_banners/1557514573/1623834710","http://abs.twimg.com/images/themes/theme1/bg.png","http://pbs.twimg.com/profile_images/736450788659240960/-8W5fQJa_normal.jpg"
"x1557514573","x1451621102137090053",2021-10-22 18:46:55,"elio_vito","@cenzinopettini1 Grazie, mi piacerebbi pure, sa che trollate internazionali","Twitter for iPad",58,"x1451620448538595334","x1433905383735758852","cenzinopettini1",FALSE,FALSE,1,0,,,,,,,,,,,,,,,,"x1433905383735758852","cenzinopettini1","it",,,,,,,,,,,,,,,,,,,,,,,,,,,,,,,,,,,,,"NA NA","NA NA","NA NA NA NA NA NA NA NA","https://twitter.com/elio_vito/status/1451621102137090053","Elio Vito 🇮🇹🇪🇺🇺🇸","Roma","Deputato @forza_italia. Juventino","https://t.co/m1rl9646f6",FALSE,14465,13,101,20209,30997,2013-06-30 07:47:38,TRUE,"https://t.co/m1rl9646f6","https://www.change.org/p/rai-radiotelevisione-italiana-vogliamo-elio-vito-in-tv",,"https://pbs.twimg.com/profile_banners/1557514573/1623834710","http://abs.twimg.com/images/themes/theme1/bg.png","http://pbs.twimg.com/profile_images/736450788659240960/-8W5fQJa_normal.jpg"
"x1557514573","x1451620888391163909",2021-10-22 18:46:04,"elio_vito","@P_Gonsalvus Ah, grazie, ora so cosa non vedere in TV","Twitter for iPad",40,"x1451620713891352582","x744818179172536320","P_Gonsalvus",FALSE,FALSE,1,0,,,,,,,,,,,,,,,,"x744818179172536320","P_Gonsalvus","it",,,,,,,,,,,,,,,,,,,,,,,,,,,,,,,,,,,,,"NA NA","NA NA","NA NA NA NA NA NA NA NA","https://twitter.com/elio_vito/status/1451620888391163909","Elio Vito 🇮🇹🇪🇺🇺🇸","Roma","Deputato @forza_italia. Juventino","https://t.co/m1rl9646f6",FALSE,14465,13,101,20209,30997,2013-06-30 07:47:38,TRUE,"https://t.co/m1rl9646f6","https://www.change.org/p/rai-radiotelevisione-italiana-vogliamo-elio-vito-in-tv",,"https://pbs.twimg.com/profile_banners/1557514573/1623834710","http://abs.twimg.com/images/themes/theme1/bg.png","http://pbs.twimg.com/profile_images/736450788659240960/-8W5fQJa_normal.jpg"
"x1557514573","x1451620711148228610",2021-10-22 18:45:22,"elio_vito","@RiccardoG_Laura Non le do pubblicità, io","Twitter for iPad",24,"x1451619622474686469","x1114913449","RiccardoG_Laura",FALSE,FALSE,1,0,,,,,,,,,,,,,,,,"x1114913449","RiccardoG_Laura","it",,,,,,,,,,,,,,,,,,,,,,,,,,,,,,,,,,,,,"NA NA","NA NA","NA NA NA NA NA NA NA NA","https://twitter.com/elio_vito/status/1451620711148228610","Elio Vito 🇮🇹🇪🇺🇺🇸","Roma","Deputato @forza_italia. Juventino","https://t.co/m1rl9646f6",FALSE,14465,13,101,20209,30997,2013-06-30 07:47:38,TRUE,"https://t.co/m1rl9646f6","https://www.change.org/p/rai-radiotelevisione-italiana-vogliamo-elio-vito-in-tv",,"https://pbs.twimg.com/profile_banners/1557514573/1623834710","http://abs.twimg.com/images/themes/theme1/bg.png","http://pbs.twimg.com/profile_images/736450788659240960/-8W5fQJa_normal.jpg"
"x1557514573","x1451620596383682566",2021-10-22 18:44:54,"elio_vito","@AntonioFaleo53 Questa è interessante... Renzi c'è? Potrebbe essere qualcosa così...","Twitter for iPad",68,"x1451619933784260613","x962315726966214657","AntonioFaleo53",FALSE,FALSE,0,0,,,,,,,,,,,,,,,,"x962315726966214657","AntonioFaleo53","it",,,,,,,,,,,,,,,,,,,,,,,,,,,,,,,,,,,,,"NA NA","NA NA","NA NA NA NA NA NA NA NA","https://twitter.com/elio_vito/status/1451620596383682566","Elio Vito 🇮🇹🇪🇺🇺🇸","Roma","Deputato @forza_italia. Juventino","https://t.co/m1rl9646f6",FALSE,14465,13,101,20209,30997,2013-06-30 07:47:38,TRUE,"https://t.co/m1rl9646f6","https://www.change.org/p/rai-radiotelevisione-italiana-vogliamo-elio-vito-in-tv",,"https://pbs.twimg.com/profile_banners/1557514573/1623834710","http://abs.twimg.com/images/themes/theme1/bg.png","http://pbs.twimg.com/profile_images/736450788659240960/-8W5fQJa_normal.jpg"
