"user_id","status_id","created_at","screen_name","text","source","display_text_width","reply_to_status_id","reply_to_user_id","reply_to_screen_name","is_quote","is_retweet","favorite_count","retweet_count","quote_count","reply_count","hashtags","symbols","urls_url","urls_t.co","urls_expanded_url","media_url","media_t.co","media_expanded_url","media_type","ext_media_url","ext_media_t.co","ext_media_expanded_url","ext_media_type","mentions_user_id","mentions_screen_name","lang","quoted_status_id","quoted_text","quoted_created_at","quoted_source","quoted_favorite_count","quoted_retweet_count","quoted_user_id","quoted_screen_name","quoted_name","quoted_followers_count","quoted_friends_count","quoted_statuses_count","quoted_location","quoted_description","quoted_verified","retweet_status_id","retweet_text","retweet_created_at","retweet_source","retweet_favorite_count","retweet_retweet_count","retweet_user_id","retweet_screen_name","retweet_name","retweet_followers_count","retweet_friends_count","retweet_statuses_count","retweet_location","retweet_description","retweet_verified","place_url","place_name","place_full_name","place_type","country","country_code","geo_coords","coords_coords","bbox_coords","status_url","name","location","description","url","protected","followers_count","friends_count","listed_count","statuses_count","favourites_count","account_created_at","verified","profile_url","profile_expanded_url","account_lang","profile_banner_url","profile_background_url","profile_image_url"
"x270839361","x1429852100301832196",2021-08-23 17:04:40,"matteosalvinimi","Un’ottima notizia! La studentessa italo-marocchina Ikram Nzihi è finalmente libera. https://t.co/bARCfGEyth","Twitter Web App",83,,,,FALSE,FALSE,194,27,,,,,,,,"http://pbs.twimg.com/media/E9faptlWYAgueLB.jpg","https://t.co/bARCfGEyth","https://twitter.com/matteosalvinimi/status/1429852100301832196/photo/1","photo","http://pbs.twimg.com/media/E9faptlWYAgueLB.jpg","https://t.co/bARCfGEyth","https://twitter.com/matteosalvinimi/status/1429852100301832196/photo/1",,,,"it",,,,,,,,,,,,,,,,,,,,,,,,,,,,,,,,,,,,,"NA NA","NA NA","NA NA NA NA NA NA NA NA","https://twitter.com/matteosalvinimi/status/1429852100301832196","Matteo Salvini","","Leader della Lega #primagliitaliani 🇮🇹","https://t.co/KDs4YUajH3",FALSE,1410546,2040,3066,51583,3858,2011-03-23 10:32:56,TRUE,"https://t.co/KDs4YUajH3","http://www.legaonline.it/referendumgiustizia",,"https://pbs.twimg.com/profile_banners/270839361/1625239837","http://abs.twimg.com/images/themes/theme1/bg.png","http://pbs.twimg.com/profile_images/966325945060732928/0Ua5xPMX_normal.jpg"
"x270839361","x1429847399200133129",2021-08-23 16:45:59,"matteosalvinimi","Qui Città di Castello (PG), in Umbria, con il candidato sindaco Roberto Marinelli. Seguiteci 😊 https://t.co/27N5F2n7hh","Twitter Media Studio",118,,,,FALSE,FALSE,104,18,,,,,"twitter.com/i/broadcasts/1…","https://t.co/27N5F2n7hh","https://twitter.com/i/broadcasts/1gqxvoNAVDQKB",,,,,,,,,,,"it",,,,,,,,,,,,,,,,,,,,,,,,,,,,,,,,,,,,,"NA NA","NA NA","NA NA NA NA NA NA NA NA","https://twitter.com/matteosalvinimi/status/1429847399200133129","Matteo Salvini","","Leader della Lega #primagliitaliani 🇮🇹","https://t.co/KDs4YUajH3",FALSE,1410546,2040,3066,51583,3858,2011-03-23 10:32:56,TRUE,"https://t.co/KDs4YUajH3","http://www.legaonline.it/referendumgiustizia",,"https://pbs.twimg.com/profile_banners/270839361/1625239837","http://abs.twimg.com/images/themes/theme1/bg.png","http://pbs.twimg.com/profile_images/966325945060732928/0Ua5xPMX_normal.jpg"
"x270839361","x1429790141472772107",2021-08-23 12:58:28,"matteosalvinimi","#DAZN, se il buongiorno si vede dal mattino… Se soldi e interessi prevalgono su sport e passione, giusto che i tifosi vengano rimborsati e spengano tutto.","Twitter Web App",154,,,,FALSE,FALSE,709,72,,,"DAZN",,,,,,,,,,,,,,,"it",,,,,,,,,,,,,,,,,,,,,,,,,,,,,,,,,,,,,"NA NA","NA NA","NA NA NA NA NA NA NA NA","https://twitter.com/matteosalvinimi/status/1429790141472772107","Matteo Salvini","","Leader della Lega #primagliitaliani 🇮🇹","https://t.co/KDs4YUajH3",FALSE,1410546,2040,3066,51583,3858,2011-03-23 10:32:56,TRUE,"https://t.co/KDs4YUajH3","http://www.legaonline.it/referendumgiustizia",,"https://pbs.twimg.com/profile_banners/270839361/1625239837","http://abs.twimg.com/images/themes/theme1/bg.png","http://pbs.twimg.com/profile_images/966325945060732928/0Ua5xPMX_normal.jpg"
"x270839361","x1429780543818829833",2021-08-23 12:20:20,"matteosalvinimi","Visita al quartiere Casale Caletto di Roma (Municipio IV) in cui i cittadini devono convivere con il degrado da troppo tempo. Con me anche Enrico Michetti, che con Simonetta Matone, candidata con la Lega come prosindaco, dovrà restituire a Roma la bellezza che merita. https://t.co/ad5YlECbwi","Twitter for iPhone",268,,,,FALSE,FALSE,195,41,,,,,,,,"http://pbs.twimg.com/media/E9eZ0lRWQAQ52SR.jpg","https://t.co/ad5YlECbwi","https://twitter.com/matteosalvinimi/status/1429780543818829833/photo/1","photo","http://pbs.twimg.com/media/E9eZ0lRWQAQ52SR.jpg http://pbs.twimg.com/media/E9eZ0lUWYAMkBfT.jpg http://pbs.twimg.com/media/E9eZ0lIXoAUkPms.jpg http://pbs.twimg.com/media/E9eZ0lQX0AMXx_u.jpg","https://t.co/ad5YlECbwi https://t.co/ad5YlECbwi https://t.co/ad5YlECbwi https://t.co/ad5YlECbwi","https://twitter.com/matteosalvinimi/status/1429780543818829833/photo/1 https://twitter.com/matteosalvinimi/status/1429780543818829833/photo/1 https://twitter.com/matteosalvinimi/status/1429780543818829833/photo/1 https://twitter.com/matteosalvinimi/status/1429780543818829833/photo/1",,,,"it",,,,,,,,,,,,,,,,,,,,,,,,,,,,,,,,,,,,,"NA NA","NA NA","NA NA NA NA NA NA NA NA","https://twitter.com/matteosalvinimi/status/1429780543818829833","Matteo Salvini","","Leader della Lega #primagliitaliani 🇮🇹","https://t.co/KDs4YUajH3",FALSE,1410546,2040,3066,51583,3858,2011-03-23 10:32:56,TRUE,"https://t.co/KDs4YUajH3","http://www.legaonline.it/referendumgiustizia",,"https://pbs.twimg.com/profile_banners/270839361/1625239837","http://abs.twimg.com/images/themes/theme1/bg.png","http://pbs.twimg.com/profile_images/966325945060732928/0Ua5xPMX_normal.jpg"
"x270839361","x1429761520834158595",2021-08-23 11:04:44,"matteosalvinimi","Qui Roma dal quartiere Casale Caletto, Municipio IV. https://t.co/ulntbD3M7x","Twitter Media Studio",76,,,,FALSE,FALSE,201,42,,,,,"twitter.com/i/broadcasts/1…","https://t.co/ulntbD3M7x","https://twitter.com/i/broadcasts/1YqxoyvBQOyGv",,,,,,,,,,,"it",,,,,,,,,,,,,,,,,,,,,,,,,,,,,,,,,,,,,"NA NA","NA NA","NA NA NA NA NA NA NA NA","https://twitter.com/matteosalvinimi/status/1429761520834158595","Matteo Salvini","","Leader della Lega #primagliitaliani 🇮🇹","https://t.co/KDs4YUajH3",FALSE,1410546,2040,3066,51583,3858,2011-03-23 10:32:56,TRUE,"https://t.co/KDs4YUajH3","http://www.legaonline.it/referendumgiustizia",,"https://pbs.twimg.com/profile_banners/270839361/1625239837","http://abs.twimg.com/images/themes/theme1/bg.png","http://pbs.twimg.com/profile_images/966325945060732928/0Ua5xPMX_normal.jpg"
"x270839361","x1429697518372335626",2021-08-23 06:50:25,"matteosalvinimi","Rave party con morti e feriti che durano giorni, orde di baby gang che terrorizzano da tempo la riviera romagnola e non solo, dopo navi francesi e tedesche, oggi una nave con bandiera norvegese lascerà 322 immigrati in Italia. Lamorgese, dove sei?","Twitter for iPhone",247,,,,FALSE,FALSE,1644,319,,,,,,,,,,,,,,,,,,"it",,,,,,,,,,,,,,,,,,,,,,,,,,,,,,,,,,,,,"NA NA","NA NA","NA NA NA NA NA NA NA NA","https://twitter.com/matteosalvinimi/status/1429697518372335626","Matteo Salvini","","Leader della Lega #primagliitaliani 🇮🇹","https://t.co/KDs4YUajH3",FALSE,1410546,2040,3066,51583,3858,2011-03-23 10:32:56,TRUE,"https://t.co/KDs4YUajH3","http://www.legaonline.it/referendumgiustizia",,"https://pbs.twimg.com/profile_banners/270839361/1625239837","http://abs.twimg.com/images/themes/theme1/bg.png","http://pbs.twimg.com/profile_images/966325945060732928/0Ua5xPMX_normal.jpg"
"x270839361","x1429530538071703556",2021-08-22 19:46:54,"matteosalvinimi","Chi infanga la memoria degli Eroi italiani, che hanno sacrificato la vita per il nostro Paese, deve vergognarsi, e chiedere scusa. https://t.co/oOCbZ7FqUu","Twitter for iPhone",130,,,,FALSE,FALSE,734,118,,,,,,,,"http://pbs.twimg.com/media/E9a2ckDWUAICMxf.jpg","https://t.co/oOCbZ7FqUu","https://twitter.com/matteosalvinimi/status/1429530538071703556/photo/1","photo","http://pbs.twimg.com/media/E9a2ckDWUAICMxf.jpg","https://t.co/oOCbZ7FqUu","https://twitter.com/matteosalvinimi/status/1429530538071703556/photo/1",,,,"it",,,,,,,,,,,,,,,,,,,,,,,,,,,,,,,,,,,,,"NA NA","NA NA","NA NA NA NA NA NA NA NA","https://twitter.com/matteosalvinimi/status/1429530538071703556","Matteo Salvini","","Leader della Lega #primagliitaliani 🇮🇹","https://t.co/KDs4YUajH3",FALSE,1410546,2040,3066,51583,3858,2011-03-23 10:32:56,TRUE,"https://t.co/KDs4YUajH3","http://www.legaonline.it/referendumgiustizia",,"https://pbs.twimg.com/profile_banners/270839361/1625239837","http://abs.twimg.com/images/themes/theme1/bg.png","http://pbs.twimg.com/profile_images/966325945060732928/0Ua5xPMX_normal.jpg"
"x270839361","x1429520156724801536",2021-08-22 19:05:39,"matteosalvinimi","Coppia di “turisti” tedeschi, arrestati stanotte nel modenese, che “festeggiano” nudi davanti ai Carabinieri… No comment. Quante ore staranno in galera? https://t.co/Br2X7XLyRm","Twitter Media Studio",152,,,,FALSE,FALSE,692,121,,,,,,,,"http://pbs.twimg.com/amplify_video_thumb/1429520084243042305/img/Bs_llr4lAK5l0OUa.jpg","https://t.co/Br2X7XLyRm","https://twitter.com/matteosalvinimi/status/1429520156724801536/video/1","photo","http://pbs.twimg.com/amplify_video_thumb/1429520084243042305/img/Bs_llr4lAK5l0OUa.jpg","https://t.co/Br2X7XLyRm","https://twitter.com/matteosalvinimi/status/1429520156724801536/video/1",,,,"it",,,,,,,,,,,,,,,,,,,,,,,,,,,,,,,,,,,,,"NA NA","NA NA","NA NA NA NA NA NA NA NA","https://twitter.com/matteosalvinimi/status/1429520156724801536","Matteo Salvini","","Leader della Lega #primagliitaliani 🇮🇹","https://t.co/KDs4YUajH3",FALSE,1410546,2040,3066,51583,3858,2011-03-23 10:32:56,TRUE,"https://t.co/KDs4YUajH3","http://www.legaonline.it/referendumgiustizia",,"https://pbs.twimg.com/profile_banners/270839361/1625239837","http://abs.twimg.com/images/themes/theme1/bg.png","http://pbs.twimg.com/profile_images/966325945060732928/0Ua5xPMX_normal.jpg"
"x48062712","x1429871297023160336",2021-08-23 18:20:57,"luigidimaio","Ikram Nazih è stata liberata oggi in Marocco: https://t.co/x69yT1c8q1","Twitter for iPhone",69,,,,FALSE,FALSE,17,1,,,,,"bit.ly/38bH36Q","https://t.co/x69yT1c8q1","https://bit.ly/38bH36Q",,,,,,,,,,,"it",,,,,,,,,,,,,,,,,,,,,,,,,,,,,,,,,,,,,"NA NA","NA NA","NA NA NA NA NA NA NA NA","https://twitter.com/luigidimaio/status/1429871297023160336","Luigi Di Maio","Pomigliano d'Arco, Campania","Ministro degli Affari Esteri e della Cooperazione Internazionale.","https://t.co/qtDDRMWqf2",FALSE,735907,351,2124,6583,302,2009-06-17 18:34:46,TRUE,"https://t.co/qtDDRMWqf2","http://www.luigidimaio.it",,"https://pbs.twimg.com/profile_banners/48062712/1600414260","http://abs.twimg.com/images/themes/theme1/bg.png","http://pbs.twimg.com/profile_images/933106806670462976/YyC7LOW8_normal.jpg"
"x2900717633","x1429835594541248519",2021-08-23 15:59:05,"BrunoAstorre","#TommasoClaudi, la parte bella dell’Italia. Console di Kabul è in prima linea durante l’emergenza, pronto a coordinare e portare avanti, in prima persona, le operazione di evacuazione dall’aeroporto. 

Grazie di cuore Tommaso https://t.co/fOQKJ0FiaQ","Twitter for iPhone",225,,,,FALSE,FALSE,16,4,,,"TommasoClaudi",,,,,"http://pbs.twimg.com/media/E9fL5NTX0AE5VAb.jpg","https://t.co/fOQKJ0FiaQ","https://twitter.com/BrunoAstorre/status/1429835594541248519/photo/1","photo","http://pbs.twimg.com/media/E9fL5NTX0AE5VAb.jpg","https://t.co/fOQKJ0FiaQ","https://twitter.com/BrunoAstorre/status/1429835594541248519/photo/1",,,,"it",,,,,,,,,,,,,,,,,,,,,,,,,,,,,,,,,,,,,"NA NA","NA NA","NA NA NA NA NA NA NA NA","https://twitter.com/BrunoAstorre/status/1429835594541248519","Bruno Astorre","","Senatore del PD. Membro Direzione nazionale PD. Provengo da una scuola che interpreta la politica come strumento, non come fine.","https://t.co/r8sKGpcczb",FALSE,1623,193,30,1901,141,2014-12-01 15:48:11,TRUE,"https://t.co/r8sKGpcczb","http://www.brunoastorre.it",,"https://pbs.twimg.com/profile_banners/2900717633/1546257168","http://abs.twimg.com/images/themes/theme1/bg.png","http://pbs.twimg.com/profile_images/1058727872578371589/FY_KiON0_normal.jpg"
"x2900717633","x1429834630597857280",2021-08-23 15:55:15,"BrunoAstorre","Da Marrakech vi do una bellissima notizia. A breve Ikram Nzihi, incarcerata da giugno in Marocco, sarà liberata. In queste settimane abbiamo lavorato insieme all'@italyinmorocco e @ItalyMFA per questo. Ikram sta bene e tra poco la riabbracceremo. Sono molto felice. https://t.co/ACex8gauQ0","Twitter for iPhone",140,,,,FALSE,TRUE,0,295,,,,,,,,,,,,,,,,"x398726169","amendolaenzo","it",,,,,,,,,,,,,,,,"x1429803197409943554","Da Marrakech vi do una bellissima notizia. A breve Ikram Nzihi, incarcerata da giugno in Marocco, sarà liberata. In queste settimane abbiamo lavorato insieme all'@italyinmorocco e @ItalyMFA per questo. Ikram sta bene e tra poco la riabbracceremo. Sono molto felice. https://t.co/ACex8gauQ0",2021-08-23 13:50:21,"Twitter for iPhone",1738,295,"x398726169","amendolaenzo","Enzo Amendola 🇮🇹🇪🇺",17352,3961,3413,"","Sottosegretario alla Presidenza del Consiglio con delega Affari UE. Napoletano classe '73,  padre di Jamila e Carlo, marito di Karima.",TRUE,,,,,,,"NA NA","NA NA","NA NA NA NA NA NA NA NA","https://twitter.com/BrunoAstorre/status/1429834630597857280","Bruno Astorre","","Senatore del PD. Membro Direzione nazionale PD. Provengo da una scuola che interpreta la politica come strumento, non come fine.","https://t.co/r8sKGpcczb",FALSE,1623,193,30,1901,141,2014-12-01 15:48:11,TRUE,"https://t.co/r8sKGpcczb","http://www.brunoastorre.it",,"https://pbs.twimg.com/profile_banners/2900717633/1546257168","http://abs.twimg.com/images/themes/theme1/bg.png","http://pbs.twimg.com/profile_images/1058727872578371589/FY_KiON0_normal.jpg"
"x876541483","x1429867323633115146",2021-08-23 18:05:10,"AlbertoBagnai","@SuperElis2 Le persone “attive e perbene” si danno da fare in silenzio, ringraziano e chiedono consigli in privato. I mezzi scemi che vengono qui a sceneggiare il loro dissenso contro chi dissente sono nella migliore delle ipotesi degli squilibrati.","Twitter for iPhone",237,"x1429707457299894275","x860917372835827716","SuperElis2",FALSE,FALSE,0,0,,,,,,,,,,,,,,,,"x860917372835827716","SuperElis2","it",,,,,,,,,,,,,,,,,,,,,,,,,,,,,,,,,,,,,"NA NA","NA NA","NA NA NA NA NA NA NA NA","https://twitter.com/AlbertoBagnai/status/1429867323633115146","Alberto Bagnai","","Professore associato di politica economica all’Università Gabriele d’Annunzio, eletto al Senato per la Lega nel collegio Abruzzo 01.","https://t.co/sC5RvUzmsX",FALSE,126446,666,656,217612,6474,2012-10-12 22:13:36,TRUE,"https://t.co/sC5RvUzmsX","http://www.senato.it/leg/18/BGT/Schede/Attsen/00032582.htm",,"https://pbs.twimg.com/profile_banners/876541483/1535647109","http://abs.twimg.com/images/themes/theme1/bg.png","http://pbs.twimg.com/profile_images/849030859462246401/ATk3_aiW_normal.jpg"
"x876541483","x1429866653127413769",2021-08-23 18:02:30,"AlbertoBagnai","@NeroSire Esatto!","Twitter for iPhone",7,"x1429702696345419780","x1389724088722235392","NeroSire",FALSE,FALSE,3,0,,,,,,,,,,,,,,,,"x1389724088722235392","NeroSire","it",,,,,,,,,,,,,,,,,,,,,,,,,,,,,,,,,,,,,"NA NA","NA NA","NA NA NA NA NA NA NA NA","https://twitter.com/AlbertoBagnai/status/1429866653127413769","Alberto Bagnai","","Professore associato di politica economica all’Università Gabriele d’Annunzio, eletto al Senato per la Lega nel collegio Abruzzo 01.","https://t.co/sC5RvUzmsX",FALSE,126446,666,656,217612,6474,2012-10-12 22:13:36,TRUE,"https://t.co/sC5RvUzmsX","http://www.senato.it/leg/18/BGT/Schede/Attsen/00032582.htm",,"https://pbs.twimg.com/profile_banners/876541483/1535647109","http://abs.twimg.com/images/themes/theme1/bg.png","http://pbs.twimg.com/profile_images/849030859462246401/ATk3_aiW_normal.jpg"
"x876541483","x1429860105064009728",2021-08-23 17:36:29,"AlbertoBagnai","--A STORM IS AFOOT--

There are clear signs that a large part of the West may be on the brink of a de facto regime change: sadly, unless current tendencies are reversed, many of us may find ourselves living in illiberal surveillance and police states for the foreseeable future. https://t.co/4XWA7LeEps","Twitter for iPhone",140,,,,FALSE,TRUE,0,1859,,,,,,,,,,,,,,,,"x896806144664117248","davidjthunder","en",,,,,,,,,,,,,,,,"x1428370459238797322","--A STORM IS AFOOT--

There are clear signs that a large part of the West may be on the brink of a de facto regime change: sadly, unless current tendencies are reversed, many of us may find ourselves living in illiberal surveillance and police states for the foreseeable future. https://t.co/4XWA7LeEps",2021-08-19 14:57:09,"Twitter Web App",3023,1859,"x896806144664117248","davidjthunder","David Thunder",19942,1280,22869,"Pamplona, Spain","Political philosophy lecturer & researcher at Univ of Navarra, Spain. Advocate of bottom-up federalism. Opinions my own. See website below for more info.",FALSE,,,,,,,"NA NA","NA NA","NA NA NA NA NA NA NA NA","https://twitter.com/AlbertoBagnai/status/1429860105064009728","Alberto Bagnai","","Professore associato di politica economica all’Università Gabriele d’Annunzio, eletto al Senato per la Lega nel collegio Abruzzo 01.","https://t.co/sC5RvUzmsX",FALSE,126446,666,656,217612,6474,2012-10-12 22:13:36,TRUE,"https://t.co/sC5RvUzmsX","http://www.senato.it/leg/18/BGT/Schede/Attsen/00032582.htm",,"https://pbs.twimg.com/profile_banners/876541483/1535647109","http://abs.twimg.com/images/themes/theme1/bg.png","http://pbs.twimg.com/profile_images/849030859462246401/ATk3_aiW_normal.jpg"
"x876541483","x1429857846443712530",2021-08-23 17:27:30,"AlbertoBagnai","#Sileri ipotizza obbligo #VacciniCovid per tutti. No, bisogna informare, promuovere i vaccini, non imporli. Potrebbe invece ricordare a Speranza e Cts che attendiamo ok a tracciamento a tappeto con tamponi salivari, (convalidati da ISS) per evitare contagi e quarantene a scuola?","Twitter for iPhone",140,,,,FALSE,TRUE,0,83,,,"Sileri VacciniCovid",,,,,,,,,,,,,"x520451294","roxsasso","it",,,,,,,,,,,,,,,,"x1429781317458272261","#Sileri ipotizza obbligo #VacciniCovid per tutti. No, bisogna informare, promuovere i vaccini, non imporli. Potrebbe invece ricordare a Speranza e Cts che attendiamo ok a tracciamento a tappeto con tamponi salivari, (convalidati da ISS) per evitare contagi e quarantene a scuola?",2021-08-23 12:23:24,"Twitter for Android",198,83,"x520451294","roxsasso","Rossano Sasso",1916,49,1188,"Bari","Padre ed insegnante.
Deputato XVIII Legislatura, dal 1°Marzo 2021 Sottosegretario all'Istruzione.
Mi batto per una scuola migliore.",FALSE,,,,,,,"NA NA","NA NA","NA NA NA NA NA NA NA NA","https://twitter.com/AlbertoBagnai/status/1429857846443712530","Alberto Bagnai","","Professore associato di politica economica all’Università Gabriele d’Annunzio, eletto al Senato per la Lega nel collegio Abruzzo 01.","https://t.co/sC5RvUzmsX",FALSE,126446,666,656,217612,6474,2012-10-12 22:13:36,TRUE,"https://t.co/sC5RvUzmsX","http://www.senato.it/leg/18/BGT/Schede/Attsen/00032582.htm",,"https://pbs.twimg.com/profile_banners/876541483/1535647109","http://abs.twimg.com/images/themes/theme1/bg.png","http://pbs.twimg.com/profile_images/849030859462246401/ATk3_aiW_normal.jpg"
"x876541483","x1429856487304835072",2021-08-23 17:22:06,"AlbertoBagnai","@Costanz00242134 Ultimamente con una significativa acribia.","Twitter for iPhone",42,"x1429778904663961607","x1384159087793885185","Costanz00242134",FALSE,FALSE,3,0,,,,,,,,,,,,,,,,"x1384159087793885185","Costanz00242134","es",,,,,,,,,,,,,,,,,,,,,,,,,,,,,,,,,,,,,"NA NA","NA NA","NA NA NA NA NA NA NA NA","https://twitter.com/AlbertoBagnai/status/1429856487304835072","Alberto Bagnai","","Professore associato di politica economica all’Università Gabriele d’Annunzio, eletto al Senato per la Lega nel collegio Abruzzo 01.","https://t.co/sC5RvUzmsX",FALSE,126446,666,656,217612,6474,2012-10-12 22:13:36,TRUE,"https://t.co/sC5RvUzmsX","http://www.senato.it/leg/18/BGT/Schede/Attsen/00032582.htm",,"https://pbs.twimg.com/profile_banners/876541483/1535647109","http://abs.twimg.com/images/themes/theme1/bg.png","http://pbs.twimg.com/profile_images/849030859462246401/ATk3_aiW_normal.jpg"
"x876541483","x1429856300448587776",2021-08-23 17:21:22,"AlbertoBagnai","@JBAndrep Questo è senz’altro un pezzo del problema. Un “idiot savant” emotivamente squilibrato con brandelli di Verità in tasca non è certo il personaggio più indicato per fare un lavoro politico (e i casi che conosco personalmente ricadono in questa categoria).","Twitter for iPhone",253,"x1429836718245662720","x2436012979","JBAndrep",FALSE,FALSE,3,0,,,,,,,,,,,,,,,,"x2436012979","JBAndrep","it",,,,,,,,,,,,,,,,,,,,,,,,,,,,,,,,,,,,,"NA NA","NA NA","NA NA NA NA NA NA NA NA","https://twitter.com/AlbertoBagnai/status/1429856300448587776","Alberto Bagnai","","Professore associato di politica economica all’Università Gabriele d’Annunzio, eletto al Senato per la Lega nel collegio Abruzzo 01.","https://t.co/sC5RvUzmsX",FALSE,126446,666,656,217612,6474,2012-10-12 22:13:36,TRUE,"https://t.co/sC5RvUzmsX","http://www.senato.it/leg/18/BGT/Schede/Attsen/00032582.htm",,"https://pbs.twimg.com/profile_banners/876541483/1535647109","http://abs.twimg.com/images/themes/theme1/bg.png","http://pbs.twimg.com/profile_images/849030859462246401/ATk3_aiW_normal.jpg"
"x876541483","x1429854838083526665",2021-08-23 17:15:33,"AlbertoBagnai","@Lyon_ Ma che ne sai tu (che, con affetto, dovresti parlare come mangi) di come e dove sto combattendo io?","Twitter for iPhone",99,"x1429820738857541639","x1059772382473306112","Lyon_",FALSE,FALSE,0,0,,,,,,,,,,,,,,,,"x1059772382473306112","Lyon_","it",,,,,,,,,,,,,,,,,,,,,,,,,,,,,,,,,,,,,"NA NA","NA NA","NA NA NA NA NA NA NA NA","https://twitter.com/AlbertoBagnai/status/1429854838083526665","Alberto Bagnai","","Professore associato di politica economica all’Università Gabriele d’Annunzio, eletto al Senato per la Lega nel collegio Abruzzo 01.","https://t.co/sC5RvUzmsX",FALSE,126446,666,656,217612,6474,2012-10-12 22:13:36,TRUE,"https://t.co/sC5RvUzmsX","http://www.senato.it/leg/18/BGT/Schede/Attsen/00032582.htm",,"https://pbs.twimg.com/profile_banners/876541483/1535647109","http://abs.twimg.com/images/themes/theme1/bg.png","http://pbs.twimg.com/profile_images/849030859462246401/ATk3_aiW_normal.jpg"
"x876541483","x1429854043438977025",2021-08-23 17:12:24,"AlbertoBagnai","@Penny73070896 Molti lo fanno senza fare tante storie. Di converso, potrei dimostrare che chi sbraita tanto qui è perché non si dà da fare in giro.","Twitter for iPhone",132,"x1429782226523328514","x1352720317823803393","Penny73070896",FALSE,FALSE,1,0,,,,,,,,,,,,,,,,"x1352720317823803393","Penny73070896","it",,,,,,,,,,,,,,,,,,,,,,,,,,,,,,,,,,,,,"NA NA","NA NA","NA NA NA NA NA NA NA NA","https://twitter.com/AlbertoBagnai/status/1429854043438977025","Alberto Bagnai","","Professore associato di politica economica all’Università Gabriele d’Annunzio, eletto al Senato per la Lega nel collegio Abruzzo 01.","https://t.co/sC5RvUzmsX",FALSE,126446,666,656,217612,6474,2012-10-12 22:13:36,TRUE,"https://t.co/sC5RvUzmsX","http://www.senato.it/leg/18/BGT/Schede/Attsen/00032582.htm",,"https://pbs.twimg.com/profile_banners/876541483/1535647109","http://abs.twimg.com/images/themes/theme1/bg.png","http://pbs.twimg.com/profile_images/849030859462246401/ATk3_aiW_normal.jpg"
"x876541483","x1429851619370409988",2021-08-23 17:02:46,"AlbertoBagnai","Comunque devo dire che buttare nel bidone il vecchio decoder (o peggio ancora il vecchio TV) funzionante perché devo prendere una fuffa nuova è una soluzione molto, ma molto #green #DVB2","Twitter for iPhone",139,,,,FALSE,TRUE,0,37,,,,,,,,,,,,,,,,"x330865662","LykanLA","it",,,,,,,,,,,,,,,,"x1429851327430017028","Comunque devo dire che buttare nel bidone il vecchio decoder (o peggio ancora il vecchio TV) funzionante perché devo prendere una fuffa nuova è una soluzione molto, ma molto #green #DVB2",2021-08-23 17:01:36,"Twitter Web App",129,37,"x330865662","LykanLA","LykanLA 🇮🇹",1341,856,61149,"","Se davanti a te tutto è grigio, sposta l'elefante
Proverbio indiano

RT not necessarily = endorsement

N.B. Profilo politicamente scorretto.   #PAFI",FALSE,,,,,,,"NA NA","NA NA","NA NA NA NA NA NA NA NA","https://twitter.com/AlbertoBagnai/status/1429851619370409988","Alberto Bagnai","","Professore associato di politica economica all’Università Gabriele d’Annunzio, eletto al Senato per la Lega nel collegio Abruzzo 01.","https://t.co/sC5RvUzmsX",FALSE,126446,666,656,217612,6474,2012-10-12 22:13:36,TRUE,"https://t.co/sC5RvUzmsX","http://www.senato.it/leg/18/BGT/Schede/Attsen/00032582.htm",,"https://pbs.twimg.com/profile_banners/876541483/1535647109","http://abs.twimg.com/images/themes/theme1/bg.png","http://pbs.twimg.com/profile_images/849030859462246401/ATk3_aiW_normal.jpg"
