"user_id","status_id","created_at","screen_name","text","source","display_text_width","reply_to_status_id","reply_to_user_id","reply_to_screen_name","is_quote","is_retweet","favorite_count","retweet_count","quote_count","reply_count","hashtags","symbols","urls_url","urls_t.co","urls_expanded_url","media_url","media_t.co","media_expanded_url","media_type","ext_media_url","ext_media_t.co","ext_media_expanded_url","ext_media_type","mentions_user_id","mentions_screen_name","lang","quoted_status_id","quoted_text","quoted_created_at","quoted_source","quoted_favorite_count","quoted_retweet_count","quoted_user_id","quoted_screen_name","quoted_name","quoted_followers_count","quoted_friends_count","quoted_statuses_count","quoted_location","quoted_description","quoted_verified","retweet_status_id","retweet_text","retweet_created_at","retweet_source","retweet_favorite_count","retweet_retweet_count","retweet_user_id","retweet_screen_name","retweet_name","retweet_followers_count","retweet_friends_count","retweet_statuses_count","retweet_location","retweet_description","retweet_verified","place_url","place_name","place_full_name","place_type","country","country_code","geo_coords","coords_coords","bbox_coords","status_url","name","location","description","url","protected","followers_count","friends_count","listed_count","statuses_count","favourites_count","account_created_at","verified","profile_url","profile_expanded_url","account_lang","profile_banner_url","profile_background_url","profile_image_url"
"x270839361","x1464944455925051394",2021-11-28 13:09:10,"matteosalvinimi","“Bisogna trovare delle modalità meno democratiche nella somministrazione dell’informazione”. 
L’ha detto davvero!?! Si vergogni. https://t.co/ozD0mHHQzd","Twitter for iPhone",128,,,,FALSE,FALSE,380,97,,,,,,,,"http://pbs.twimg.com/ext_tw_video_thumb/1464944267206537226/pu/img/8EApTkAAWbQWEIdX.jpg","https://t.co/ozD0mHHQzd","https://twitter.com/matteosalvinimi/status/1464944455925051394/video/1","photo","http://pbs.twimg.com/ext_tw_video_thumb/1464944267206537226/pu/img/8EApTkAAWbQWEIdX.jpg","https://t.co/ozD0mHHQzd","https://twitter.com/matteosalvinimi/status/1464944455925051394/video/1",,,,"it",,,,,,,,,,,,,,,,,,,,,,,,,,,,,,,,,,,,,"NA NA","NA NA","NA NA NA NA NA NA NA NA","https://twitter.com/matteosalvinimi/status/1464944455925051394","Matteo Salvini","","Leader della Lega #primagliitaliani 🇮🇹","https://t.co/sj3rr6DU3N",FALSE,1428380,2029,3051,52194,3850,2011-03-23 10:32:56,TRUE,"https://t.co/sj3rr6DU3N","https://legaonline.it/",,"https://pbs.twimg.com/profile_banners/270839361/1635585626","http://abs.twimg.com/images/themes/theme1/bg.png","http://pbs.twimg.com/profile_images/966325945060732928/0Ua5xPMX_normal.jpg"
"x270839361","x1464708563310370825",2021-11-27 21:31:49,"matteosalvinimi","Non solo dimissioni, io la denuncio!
Si sciacqui la bocca quando parla di donne e uomini in divisa. https://t.co/5qzllviX9U","Twitter for iPhone",99,,,,FALSE,FALSE,1074,176,,,,,,,,"http://pbs.twimg.com/media/FFOwrG4XMAMC1pJ.jpg","https://t.co/5qzllviX9U","https://twitter.com/matteosalvinimi/status/1464708563310370825/photo/1","photo","http://pbs.twimg.com/media/FFOwrG4XMAMC1pJ.jpg","https://t.co/5qzllviX9U","https://twitter.com/matteosalvinimi/status/1464708563310370825/photo/1",,,,"it",,,,,,,,,,,,,,,,,,,,,,,,,,,,,,,,,,,,,"NA NA","NA NA","NA NA NA NA NA NA NA NA","https://twitter.com/matteosalvinimi/status/1464708563310370825","Matteo Salvini","","Leader della Lega #primagliitaliani 🇮🇹","https://t.co/sj3rr6DU3N",FALSE,1428380,2029,3051,52194,3850,2011-03-23 10:32:56,TRUE,"https://t.co/sj3rr6DU3N","https://legaonline.it/",,"https://pbs.twimg.com/profile_banners/270839361/1635585626","http://abs.twimg.com/images/themes/theme1/bg.png","http://pbs.twimg.com/profile_images/966325945060732928/0Ua5xPMX_normal.jpg"
"x270839361","x1464700519138664448",2021-11-27 20:59:51,"matteosalvinimi","Vi ripropongo la mia intervista di poco fa al TG1. Buona serata, Amici. https://t.co/7veE3X3API","Twitter for iPhone",71,,,,FALSE,FALSE,301,58,,,,,,,,"http://pbs.twimg.com/ext_tw_video_thumb/1464700416239804420/pu/img/9_UtipeDLh9wRoTR.jpg","https://t.co/7veE3X3API","https://twitter.com/matteosalvinimi/status/1464700519138664448/video/1","photo","http://pbs.twimg.com/ext_tw_video_thumb/1464700416239804420/pu/img/9_UtipeDLh9wRoTR.jpg","https://t.co/7veE3X3API","https://twitter.com/matteosalvinimi/status/1464700519138664448/video/1",,,,"it",,,,,,,,,,,,,,,,,,,,,,,,,,,,,,,,,,,,,"NA NA","NA NA","NA NA NA NA NA NA NA NA","https://twitter.com/matteosalvinimi/status/1464700519138664448","Matteo Salvini","","Leader della Lega #primagliitaliani 🇮🇹","https://t.co/sj3rr6DU3N",FALSE,1428380,2029,3051,52194,3850,2011-03-23 10:32:56,TRUE,"https://t.co/sj3rr6DU3N","https://legaonline.it/",,"https://pbs.twimg.com/profile_banners/270839361/1635585626","http://abs.twimg.com/images/themes/theme1/bg.png","http://pbs.twimg.com/profile_images/966325945060732928/0Ua5xPMX_normal.jpg"
"x997531966571466752","x1464659717544947712",2021-11-27 18:17:43,"Pres_Casellati","Con Liliana #Segre, insignita della Legion d'Onore ""per il suo straordinario impegno per i diritti umani"". Anche la Francia rende omaggio a una donna che ha trasformato l'orrore vissuto in una instancabile testimonianza contro l'indifferenza alla violenza e all’odio.
#27novembre https://t.co/as2f3OI5Xg","Twitter for iPhone",279,,,,FALSE,FALSE,56,15,,,"Segre 27novembre",,,,,"http://pbs.twimg.com/media/FFOEP2jXoAEdKxu.jpg","https://t.co/as2f3OI5Xg","https://twitter.com/Pres_Casellati/status/1464659717544947712/photo/1","photo","http://pbs.twimg.com/media/FFOEP2jXoAEdKxu.jpg http://pbs.twimg.com/media/FFOEP2nXsAcinHQ.jpg","https://t.co/as2f3OI5Xg https://t.co/as2f3OI5Xg","https://twitter.com/Pres_Casellati/status/1464659717544947712/photo/1 https://twitter.com/Pres_Casellati/status/1464659717544947712/photo/1",,,,"it",,,,,,,,,,,,,,,,,,,,,,,,,,,,,,,,,,,,,"NA NA","NA NA","NA NA NA NA NA NA NA NA","https://twitter.com/Pres_Casellati/status/1464659717544947712","Maria Elisabetta Alberti Casellati","Roma, Lazio","Presidente del Senato della Repubblica","https://t.co/4xFh9XyLXO",FALSE,13947,515,100,1135,61,2018-05-18 17:38:48,TRUE,"https://t.co/4xFh9XyLXO","https://www.facebook.com/elisabetta.casellati.7",,"https://pbs.twimg.com/profile_banners/997531966571466752/1526665561","http://abs.twimg.com/images/themes/theme1/bg.png","http://pbs.twimg.com/profile_images/997533290520195072/YmnjBO3X_normal.jpg"
"x997531966571466752","x1464637402337759242",2021-11-27 16:49:03,"Pres_Casellati","A @Montecitorio per il 150º anniversario della prima seduta della Camera e per i 700 anni dalla morte di #Dante. https://t.co/VmVf8GFzEO","Twitter for iPhone",112,,,,FALSE,FALSE,45,12,,,"Dante",,,,,"http://pbs.twimg.com/media/FFNv8qfXIAoGmY0.jpg","https://t.co/VmVf8GFzEO","https://twitter.com/Pres_Casellati/status/1464637402337759242/photo/1","photo","http://pbs.twimg.com/media/FFNv8qfXIAoGmY0.jpg http://pbs.twimg.com/media/FFNv8qdXIAsMg5y.jpg http://pbs.twimg.com/media/FFNv8qgXEA8MXKt.jpg http://pbs.twimg.com/media/FFNv8rFXMAgQTEC.jpg","https://t.co/VmVf8GFzEO https://t.co/VmVf8GFzEO https://t.co/VmVf8GFzEO https://t.co/VmVf8GFzEO","https://twitter.com/Pres_Casellati/status/1464637402337759242/photo/1 https://twitter.com/Pres_Casellati/status/1464637402337759242/photo/1 https://twitter.com/Pres_Casellati/status/1464637402337759242/photo/1 https://twitter.com/Pres_Casellati/status/1464637402337759242/photo/1",,"x2278995820","Montecitorio","it",,,,,,,,,,,,,,,,,,,,,,,,,,,,,,,,,,,,,"NA NA","NA NA","NA NA NA NA NA NA NA NA","https://twitter.com/Pres_Casellati/status/1464637402337759242","Maria Elisabetta Alberti Casellati","Roma, Lazio","Presidente del Senato della Repubblica","https://t.co/4xFh9XyLXO",FALSE,13947,515,100,1135,61,2018-05-18 17:38:48,TRUE,"https://t.co/4xFh9XyLXO","https://www.facebook.com/elisabetta.casellati.7",,"https://pbs.twimg.com/profile_banners/997531966571466752/1526665561","http://abs.twimg.com/images/themes/theme1/bg.png","http://pbs.twimg.com/profile_images/997533290520195072/YmnjBO3X_normal.jpg"
"x1075084718","x1464960789010436096",2021-11-28 14:14:04,"arrigoni_paolo","@m_masi1960 Assolutamente ... ma l'Europa al momento non applica metodo LCA. Noi (Lega) continueremo ad insistere!","Twitter for Android",102,"x1464875785852960769","x934744142848184321","m_masi1960",FALSE,FALSE,0,0,,,,,,,,,,,,,,,,"x934744142848184321","m_masi1960","it",,,,,,,,,,,,,,,,,,,,,,,,,,,,,,,,,,,,,"NA NA","NA NA","NA NA NA NA NA NA NA NA","https://twitter.com/arrigoni_paolo/status/1464960789010436096","Paolo Arrigoni","Calolziocorte, Lombardia","Questore del Senato della Repubblica, componente della Commissione Ambiente e del Copasir. Responsabile del Dipartimento Energia della Lega.","https://t.co/M6TePkOvfO",FALSE,4663,181,56,9623,108,2013-01-09 22:36:27,TRUE,"https://t.co/M6TePkOvfO","http://www.senato.it/leg/18/BGT/Schede/Attsen/00029039.htm",,"https://pbs.twimg.com/profile_banners/1075084718/1591968708","http://abs.twimg.com/images/themes/theme1/bg.png","http://pbs.twimg.com/profile_images/3172370357/bec3e4497d64c77f2a93bc9792055992_normal.jpeg"
"x1075084718","x1464865766579347456",2021-11-28 07:56:29,"arrigoni_paolo","Se l'obiettivo è contrastare i cambiamenti climatici e decarbonizzare, allora il nemico è l'anidride carbonica e non le auto a combustione interna.
La transizione ecologica deve essere portata avanti con il principio della neutralità tecnologica! https://t.co/d0eoJziEHf","Twitter for Android",246,,,,FALSE,FALSE,8,5,,,,,,,,"http://pbs.twimg.com/media/FFQ_pr-XsAIAEEi.jpg","https://t.co/d0eoJziEHf","https://twitter.com/arrigoni_paolo/status/1464865766579347456/photo/1","photo","http://pbs.twimg.com/media/FFQ_pr-XsAIAEEi.jpg","https://t.co/d0eoJziEHf","https://twitter.com/arrigoni_paolo/status/1464865766579347456/photo/1",,,,"it",,,,,,,,,,,,,,,,,,,,,,,,,,,,,,,,,,,,,"NA NA","NA NA","NA NA NA NA NA NA NA NA","https://twitter.com/arrigoni_paolo/status/1464865766579347456","Paolo Arrigoni","Calolziocorte, Lombardia","Questore del Senato della Repubblica, componente della Commissione Ambiente e del Copasir. Responsabile del Dipartimento Energia della Lega.","https://t.co/M6TePkOvfO",FALSE,4663,181,56,9623,108,2013-01-09 22:36:27,TRUE,"https://t.co/M6TePkOvfO","http://www.senato.it/leg/18/BGT/Schede/Attsen/00029039.htm",,"https://pbs.twimg.com/profile_banners/1075084718/1591968708","http://abs.twimg.com/images/themes/theme1/bg.png","http://pbs.twimg.com/profile_images/3172370357/bec3e4497d64c77f2a93bc9792055992_normal.jpeg"
"x101602652","x1464952357876285440",2021-11-28 13:40:34,"augussori","Ho avuto il piacere di conoscere, mentre votava in uno dei seggi che ho visitato questa mattina,  Tursunbek Akun, presidente del Comitato Democrazia e Trasparenza del Kirghizistan, persona stimatissima dal popolo e in passato già “Difensore civico” nazionale. 
#Kirghizistan #OSCE https://t.co/Z6Jmz11skV","Twitter for iPhone",280,,,,FALSE,FALSE,1,0,,,"Kirghizistan OSCE",,,,,"http://pbs.twimg.com/media/FFSOZ2dWYAoIY13.jpg","https://t.co/Z6Jmz11skV","https://twitter.com/augussori/status/1464952357876285440/photo/1","photo","http://pbs.twimg.com/media/FFSOZ2dWYAoIY13.jpg","https://t.co/Z6Jmz11skV","https://twitter.com/augussori/status/1464952357876285440/photo/1",,,,"it",,,,,,,,,,,,,,,,,,,,,,,,,,,,,,,,,,,,,"NA NA","NA NA","NA NA NA NA NA NA NA NA","https://twitter.com/augussori/status/1464952357876285440","Luigi Augussori","Lodi, Lombardy","Profilo del sen. Luigi Augussori, rappresentante lodigiano nel Senato della Repubblica per il gruppo Lega - Salvini Premier. https://t.co/RVDZN85Ue5","https://t.co/494Lk5LQeR",FALSE,966,784,16,3252,327,2010-01-03 23:39:00,TRUE,"https://t.co/494Lk5LQeR","http://www.senato.it/leg/18/BGT/Schede/Attsen/00019244.htm",,"https://pbs.twimg.com/profile_banners/101602652/1536334347","http://abs.twimg.com/images/themes/theme1/bg.png","http://pbs.twimg.com/profile_images/1397968025198989317/FpsdhGWL_normal.jpg"
"x101602652","x1464922047876943872",2021-11-28 11:40:07,"augussori","Proseguono nelle periferie di Bishkek le operazioni di osservazione elettorale. 
#Bishkek #Kirghizistan 
#electionday #OSCE #OSCEPA 🇰🇬 https://t.co/8WmhggGvZ5","Twitter for iPhone",134,,,,FALSE,FALSE,2,0,,,"Bishkek Kirghizistan electionday OSCE OSCEPA",,,,,"http://pbs.twimg.com/media/FFRy0iDXwAURppR.jpg","https://t.co/8WmhggGvZ5","https://twitter.com/augussori/status/1464922047876943872/photo/1","photo","http://pbs.twimg.com/media/FFRy0iDXwAURppR.jpg http://pbs.twimg.com/media/FFRy0jRXoAIL4zd.jpg http://pbs.twimg.com/media/FFRy0iTXEAYt6J_.jpg http://pbs.twimg.com/media/FFRy0i7WYAEx9ZB.jpg","https://t.co/8WmhggGvZ5 https://t.co/8WmhggGvZ5 https://t.co/8WmhggGvZ5 https://t.co/8WmhggGvZ5","https://twitter.com/augussori/status/1464922047876943872/photo/1 https://twitter.com/augussori/status/1464922047876943872/photo/1 https://twitter.com/augussori/status/1464922047876943872/photo/1 https://twitter.com/augussori/status/1464922047876943872/photo/1",,,,"it",,,,,,,,,,,,,,,,,,,,,,,,,,,,,,,,,,,,,"NA NA","NA NA","NA NA NA NA NA NA NA NA","https://twitter.com/augussori/status/1464922047876943872","Luigi Augussori","Lodi, Lombardy","Profilo del sen. Luigi Augussori, rappresentante lodigiano nel Senato della Repubblica per il gruppo Lega - Salvini Premier. https://t.co/RVDZN85Ue5","https://t.co/494Lk5LQeR",FALSE,966,784,16,3252,327,2010-01-03 23:39:00,TRUE,"https://t.co/494Lk5LQeR","http://www.senato.it/leg/18/BGT/Schede/Attsen/00019244.htm",,"https://pbs.twimg.com/profile_banners/101602652/1536334347","http://abs.twimg.com/images/themes/theme1/bg.png","http://pbs.twimg.com/profile_images/1397968025198989317/FpsdhGWL_normal.jpg"
"x101602652","x1464838143677538312",2021-11-28 06:06:43,"augussori","Il giorno del voto: fin dalle sette del mattino presenti nei seggi per assistere alle operazioni di apertura del voto. 
#Bishkek #Kirghizistan 
#electionday #OSCE #OSCEPA 🇰🇬 https://t.co/B36ttWSiZD","Twitter for iPhone",173,,,,FALSE,FALSE,0,0,,,"Bishkek Kirghizistan electionday OSCE OSCEPA",,,,,"http://pbs.twimg.com/media/FFQmbcgWYAACPf0.jpg","https://t.co/B36ttWSiZD","https://twitter.com/augussori/status/1464838143677538312/photo/1","photo","http://pbs.twimg.com/media/FFQmbcgWYAACPf0.jpg http://pbs.twimg.com/media/FFQmbcsXoAMRAHk.jpg http://pbs.twimg.com/media/FFQmbcvXMAALyyO.jpg http://pbs.twimg.com/media/FFQmbcxWYAAsJW9.jpg","https://t.co/B36ttWSiZD https://t.co/B36ttWSiZD https://t.co/B36ttWSiZD https://t.co/B36ttWSiZD","https://twitter.com/augussori/status/1464838143677538312/photo/1 https://twitter.com/augussori/status/1464838143677538312/photo/1 https://twitter.com/augussori/status/1464838143677538312/photo/1 https://twitter.com/augussori/status/1464838143677538312/photo/1",,,,"it",,,,,,,,,,,,,,,,,,,,,,,,,,,,,,,,,,,,,"NA NA","NA NA","NA NA NA NA NA NA NA NA","https://twitter.com/augussori/status/1464838143677538312","Luigi Augussori","Lodi, Lombardy","Profilo del sen. Luigi Augussori, rappresentante lodigiano nel Senato della Repubblica per il gruppo Lega - Salvini Premier. https://t.co/RVDZN85Ue5","https://t.co/494Lk5LQeR",FALSE,966,784,16,3252,327,2010-01-03 23:39:00,TRUE,"https://t.co/494Lk5LQeR","http://www.senato.it/leg/18/BGT/Schede/Attsen/00019244.htm",,"https://pbs.twimg.com/profile_banners/101602652/1536334347","http://abs.twimg.com/images/themes/theme1/bg.png","http://pbs.twimg.com/profile_images/1397968025198989317/FpsdhGWL_normal.jpg"
"x101602652","x1464696043887640584",2021-11-27 20:42:04,"augussori","A Codogno si è svolto un incontro di sensibilizzazione sulla violenza di genere. Alla serata ha preso parte la senatrice e Sottosegretario al Ministero del Lavoro e delle Politiche Sociali Tiziana Nisini, amica e collega che ringrazio per la vicinanza al nostro territorio. https://t.co/c2pbNbAC1C","Twitter for iPhone",273,,,,FALSE,FALSE,1,0,,,,,,,,"http://pbs.twimg.com/media/FFOlPvlWYAA5Ia0.jpg","https://t.co/c2pbNbAC1C","https://twitter.com/augussori/status/1464696043887640584/photo/1","photo","http://pbs.twimg.com/media/FFOlPvlWYAA5Ia0.jpg http://pbs.twimg.com/media/FFOlPvmWQAQF2p4.jpg http://pbs.twimg.com/media/FFOlPvnX0AwWDA0.jpg","https://t.co/c2pbNbAC1C https://t.co/c2pbNbAC1C https://t.co/c2pbNbAC1C","https://twitter.com/augussori/status/1464696043887640584/photo/1 https://twitter.com/augussori/status/1464696043887640584/photo/1 https://twitter.com/augussori/status/1464696043887640584/photo/1",,,,"it",,,,,,,,,,,,,,,,,,,,,,,,,,,,,,,,,,,,,"NA NA","NA NA","NA NA NA NA NA NA NA NA","https://twitter.com/augussori/status/1464696043887640584","Luigi Augussori","Lodi, Lombardy","Profilo del sen. Luigi Augussori, rappresentante lodigiano nel Senato della Repubblica per il gruppo Lega - Salvini Premier. https://t.co/RVDZN85Ue5","https://t.co/494Lk5LQeR",FALSE,966,784,16,3252,327,2010-01-03 23:39:00,TRUE,"https://t.co/494Lk5LQeR","http://www.senato.it/leg/18/BGT/Schede/Attsen/00019244.htm",,"https://pbs.twimg.com/profile_banners/101602652/1536334347","http://abs.twimg.com/images/themes/theme1/bg.png","http://pbs.twimg.com/profile_images/1397968025198989317/FpsdhGWL_normal.jpg"
"x876541483","x1464958139233673217",2021-11-28 14:03:32,"AlbertoBagnai","Si ricominciano a vedere persone con la mascherina all'aperto, anche da sole (misura inutile anche secondo i più rigorosi dei rigorosi).
Poiché i giornali non li legge più nessuno, dev'essere che funziona ancora bene la tv.","Twitter for iPhone",140,,,,FALSE,TRUE,0,30,,,,,,,,,,,,,,,,"x877230271652823040","gspazianitesta","it",,,,,,,,,,,,,,,,"x1464948855355629576","Si ricominciano a vedere persone con la mascherina all'aperto, anche da sole (misura inutile anche secondo i più rigorosi dei rigorosi).
Poiché i giornali non li legge più nessuno, dev'essere che funziona ancora bene la tv.",2021-11-28 13:26:39,"Twitter Web App",143,30,"x877230271652823040","gspazianitesta","Giorgio Spaziani Testa",4126,1176,11262,"","",FALSE,,,,,,,"NA NA","NA NA","NA NA NA NA NA NA NA NA","https://twitter.com/AlbertoBagnai/status/1464958139233673217","Alberto Bagnai","","Professore associato di politica economica all’Università Gabriele d’Annunzio, eletto al Senato per la Lega nel collegio Abruzzo 01.","https://t.co/sC5RvUzmsX",FALSE,128977,666,656,220264,6463,2012-10-12 22:13:36,TRUE,"https://t.co/sC5RvUzmsX","http://www.senato.it/leg/18/BGT/Schede/Attsen/00032582.htm",,"https://pbs.twimg.com/profile_banners/876541483/1535647109","http://abs.twimg.com/images/themes/theme1/bg.png","http://pbs.twimg.com/profile_images/849030859462246401/ATk3_aiW_normal.jpg"
"x876541483","x1464949142501924866",2021-11-28 13:27:47,"AlbertoBagnai","Mannaggia. Perdonatemi.
Siamo usciti con gli stessi dati (ma il commento è diverso). Ho perso l’abituale vantaggio.
Mi rifarò.😉 https://t.co/GZzEDhnfxU","Twitter for iPhone",140,,,,FALSE,TRUE,0,28,,,,,,,,,,,,,,,,"x589418956","giuslit","it",,,,,,,,,,,,,,,,"x1464934252819230725","Mannaggia. Perdonatemi.
Siamo usciti con gli stessi dati (ma il commento è diverso). Ho perso l’abituale vantaggio.
Mi rifarò.😉 https://t.co/GZzEDhnfxU",2021-11-28 12:28:37,"Twitter Web App",82,28,"x589418956","giuslit","Ora Basta",23989,878,61817,"Bari, Italy","Commercialista di Bari [cit.]",FALSE,,,,,,,"NA NA","NA NA","NA NA NA NA NA NA NA NA","https://twitter.com/AlbertoBagnai/status/1464949142501924866","Alberto Bagnai","","Professore associato di politica economica all’Università Gabriele d’Annunzio, eletto al Senato per la Lega nel collegio Abruzzo 01.","https://t.co/sC5RvUzmsX",FALSE,128977,666,656,220264,6463,2012-10-12 22:13:36,TRUE,"https://t.co/sC5RvUzmsX","http://www.senato.it/leg/18/BGT/Schede/Attsen/00032582.htm",,"https://pbs.twimg.com/profile_banners/876541483/1535647109","http://abs.twimg.com/images/themes/theme1/bg.png","http://pbs.twimg.com/profile_images/849030859462246401/ATk3_aiW_normal.jpg"
"x876541483","x1464947418504613888",2021-11-28 13:20:56,"AlbertoBagnai","National Anthem of Azerbaijan - ""Azərbaycan marşı"" https://t.co/mvXDAInl8m via @YouTube","Twitter for iPhone",87,,,,FALSE,FALSE,19,1,,,,,"youtu.be/YXnDub9JCfI","https://t.co/mvXDAInl8m","https://youtu.be/YXnDub9JCfI",,,,,,,,,"x10228272","YouTube","tr",,,,,,,,,,,,,,,,,,,,,,,,,,,,,,,,,,,,,"NA NA","NA NA","NA NA NA NA NA NA NA NA","https://twitter.com/AlbertoBagnai/status/1464947418504613888","Alberto Bagnai","","Professore associato di politica economica all’Università Gabriele d’Annunzio, eletto al Senato per la Lega nel collegio Abruzzo 01.","https://t.co/sC5RvUzmsX",FALSE,128977,666,656,220264,6463,2012-10-12 22:13:36,TRUE,"https://t.co/sC5RvUzmsX","http://www.senato.it/leg/18/BGT/Schede/Attsen/00032582.htm",,"https://pbs.twimg.com/profile_banners/876541483/1535647109","http://abs.twimg.com/images/themes/theme1/bg.png","http://pbs.twimg.com/profile_images/849030859462246401/ATk3_aiW_normal.jpg"
"x876541483","x1464946962524999687",2021-11-28 13:19:07,"AlbertoBagnai","""Meniń Qazaqstanym"" - National Anthem of Kazakhstan https://t.co/lNwac9Q85N via @YouTube","Twitter for iPhone",88,,,,FALSE,FALSE,17,2,,,,,"youtu.be/wOKn1uZjHuQ","https://t.co/lNwac9Q85N","https://youtu.be/wOKn1uZjHuQ",,,,,,,,,"x10228272","YouTube","und",,,,,,,,,,,,,,,,,,,,,,,,,,,,,,,,,,,,,"NA NA","NA NA","NA NA NA NA NA NA NA NA","https://twitter.com/AlbertoBagnai/status/1464946962524999687","Alberto Bagnai","","Professore associato di politica economica all’Università Gabriele d’Annunzio, eletto al Senato per la Lega nel collegio Abruzzo 01.","https://t.co/sC5RvUzmsX",FALSE,128977,666,656,220264,6463,2012-10-12 22:13:36,TRUE,"https://t.co/sC5RvUzmsX","http://www.senato.it/leg/18/BGT/Schede/Attsen/00032582.htm",,"https://pbs.twimg.com/profile_banners/876541483/1535647109","http://abs.twimg.com/images/themes/theme1/bg.png","http://pbs.twimg.com/profile_images/849030859462246401/ATk3_aiW_normal.jpg"
"x876541483","x1464930831995179009",2021-11-28 12:15:02,"AlbertoBagnai","+++Agenzia QuasiVero, ultim’ora+++
Panico di molti “politici” ed “esperti”: la variante #Omicron potrebbe non essere terribile. E allora come si fa a spargere altra paura? Spoiler: puntare sulla prossima variante. Del resto l’alfabeto greco ha ben 24 lettere…","Twitter for iPhone",140,,,,FALSE,TRUE,0,333,,,"Omicron",,,,,,,,,,,,,"x144210805","Capezzone","it",,,,,,,,,,,,,,,,"x1464930572925640707","+++Agenzia QuasiVero, ultim’ora+++
Panico di molti “politici” ed “esperti”: la variante #Omicron potrebbe non essere terribile. E allora come si fa a spargere altra paura? Spoiler: puntare sulla prossima variante. Del resto l’alfabeto greco ha ben 24 lettere…",2021-11-28 12:14:00,"Twitter for iPhone",1133,333,"x144210805","Capezzone","Daniele Capezzone",134053,3324,50673,"","Atlantista, liberale classico. @LaVeritaWeb. @MercatusI e @AtlanticoMag. In tv su Mediaset. #TorreDiControllo su @RadioGloboFm. #PerUnaNuovaDestra🗽",FALSE,,,,,,,"NA NA","NA NA","NA NA NA NA NA NA NA NA","https://twitter.com/AlbertoBagnai/status/1464930831995179009","Alberto Bagnai","","Professore associato di politica economica all’Università Gabriele d’Annunzio, eletto al Senato per la Lega nel collegio Abruzzo 01.","https://t.co/sC5RvUzmsX",FALSE,128977,666,656,220264,6463,2012-10-12 22:13:36,TRUE,"https://t.co/sC5RvUzmsX","http://www.senato.it/leg/18/BGT/Schede/Attsen/00032582.htm",,"https://pbs.twimg.com/profile_banners/876541483/1535647109","http://abs.twimg.com/images/themes/theme1/bg.png","http://pbs.twimg.com/profile_images/849030859462246401/ATk3_aiW_normal.jpg"
"x876541483","x1464930571155562502",2021-11-28 12:13:59,"AlbertoBagnai","@altfbardo Sei in buona fede anche tu.","Twitter for iPhone",27,"x1464875623206301700","x27259807","altfbardo",FALSE,FALSE,2,0,,,,,,,,,,,,,,,,"x27259807","altfbardo","it",,,,,,,,,,,,,,,,,,,,,,,,,,,,,,,,,,,,,"NA NA","NA NA","NA NA NA NA NA NA NA NA","https://twitter.com/AlbertoBagnai/status/1464930571155562502","Alberto Bagnai","","Professore associato di politica economica all’Università Gabriele d’Annunzio, eletto al Senato per la Lega nel collegio Abruzzo 01.","https://t.co/sC5RvUzmsX",FALSE,128977,666,656,220264,6463,2012-10-12 22:13:36,TRUE,"https://t.co/sC5RvUzmsX","http://www.senato.it/leg/18/BGT/Schede/Attsen/00032582.htm",,"https://pbs.twimg.com/profile_banners/876541483/1535647109","http://abs.twimg.com/images/themes/theme1/bg.png","http://pbs.twimg.com/profile_images/849030859462246401/ATk3_aiW_normal.jpg"
"x876541483","x1464930343799209986",2021-11-28 12:13:05,"AlbertoBagnai","@super_caz Ma basta con queste scemenze!","Twitter for iPhone",29,"x1464869853597212676","x829043245091000320","super_caz",FALSE,FALSE,2,0,,,,,,,,,,,,,,,,"x829043245091000320","super_caz","it",,,,,,,,,,,,,,,,,,,,,,,,,,,,,,,,,,,,,"NA NA","NA NA","NA NA NA NA NA NA NA NA","https://twitter.com/AlbertoBagnai/status/1464930343799209986","Alberto Bagnai","","Professore associato di politica economica all’Università Gabriele d’Annunzio, eletto al Senato per la Lega nel collegio Abruzzo 01.","https://t.co/sC5RvUzmsX",FALSE,128977,666,656,220264,6463,2012-10-12 22:13:36,TRUE,"https://t.co/sC5RvUzmsX","http://www.senato.it/leg/18/BGT/Schede/Attsen/00032582.htm",,"https://pbs.twimg.com/profile_banners/876541483/1535647109","http://abs.twimg.com/images/themes/theme1/bg.png","http://pbs.twimg.com/profile_images/849030859462246401/ATk3_aiW_normal.jpg"
