"user_id","status_id","created_at","screen_name","text","source","display_text_width","reply_to_status_id","reply_to_user_id","reply_to_screen_name","is_quote","is_retweet","favorite_count","retweet_count","quote_count","reply_count","hashtags","symbols","urls_url","urls_t.co","urls_expanded_url","media_url","media_t.co","media_expanded_url","media_type","ext_media_url","ext_media_t.co","ext_media_expanded_url","ext_media_type","mentions_user_id","mentions_screen_name","lang","quoted_status_id","quoted_text","quoted_created_at","quoted_source","quoted_favorite_count","quoted_retweet_count","quoted_user_id","quoted_screen_name","quoted_name","quoted_followers_count","quoted_friends_count","quoted_statuses_count","quoted_location","quoted_description","quoted_verified","retweet_status_id","retweet_text","retweet_created_at","retweet_source","retweet_favorite_count","retweet_retweet_count","retweet_user_id","retweet_screen_name","retweet_name","retweet_followers_count","retweet_friends_count","retweet_statuses_count","retweet_location","retweet_description","retweet_verified","place_url","place_name","place_full_name","place_type","country","country_code","geo_coords","coords_coords","bbox_coords","status_url","name","location","description","url","protected","followers_count","friends_count","listed_count","statuses_count","favourites_count","account_created_at","verified","profile_url","profile_expanded_url","account_lang","profile_banner_url","profile_background_url","profile_image_url"
"x270839361","x1408360717858885633",2021-06-25 09:45:35,"matteosalvinimi","Trovo demenziale che qualche segretario di partito si preoccupi di fare politica ordinando inginocchiamenti ai nostri ragazzi. A me interessa quello che fanno nei 90 minuti, pronti domani sera a tifare ITALIA! Forza azzurri! ⚽️🇮🇹
#italiaaustria https://t.co/u153aIRwcv","Twitter for iPhone",244,,,,FALSE,FALSE,1424,230,,,"italiaaustria",,,,,"http://pbs.twimg.com/media/E4uAmTCWYAUoQmV.jpg","https://t.co/u153aIRwcv","https://twitter.com/matteosalvinimi/status/1408360717858885633/photo/1","photo","http://pbs.twimg.com/media/E4uAmTCWYAUoQmV.jpg","https://t.co/u153aIRwcv","https://twitter.com/matteosalvinimi/status/1408360717858885633/photo/1",,,,"it",,,,,,,,,,,,,,,,,,,,,,,,,,,,,,,,,,,,,"NA NA","NA NA","NA NA NA NA NA NA NA NA","https://twitter.com/matteosalvinimi/status/1408360717858885633","Matteo Salvini","","Leader della Lega #primagliitaliani 🇮🇹","https://t.co/zKjsz53fwl",FALSE,1399972,2047,3062,51059,3848,2011-03-23 10:32:56,TRUE,"https://t.co/zKjsz53fwl","http://www.legaonline.it/iscriviti",,"https://pbs.twimg.com/profile_banners/270839361/1624177197","http://abs.twimg.com/images/themes/theme1/bg.png","http://pbs.twimg.com/profile_images/966325945060732928/0Ua5xPMX_normal.jpg"
"x270839361","x1408134167846662149",2021-06-24 18:45:22,"matteosalvinimi","Dal 2 luglio in Comune e ai gazebo, siete pronti a firmare?
#REFERENDUMGIUSTIZIA 
Info https://t.co/0EypGw8B0d https://t.co/1jiabhnRwr","Twitter for iPhone",110,,,,FALSE,FALSE,571,119,,,"REFERENDUMGIUSTIZIA",,"comitatogiustiziagiusta.it","https://t.co/0EypGw8B0d","http://comitatogiustiziagiusta.it","http://pbs.twimg.com/media/E4qyjteWEAE4S5g.jpg","https://t.co/1jiabhnRwr","https://twitter.com/matteosalvinimi/status/1408134167846662149/photo/1","photo","http://pbs.twimg.com/media/E4qyjteWEAE4S5g.jpg","https://t.co/1jiabhnRwr","https://twitter.com/matteosalvinimi/status/1408134167846662149/photo/1",,,,"it",,,,,,,,,,,,,,,,,,,,,,,,,,,,,,,,,,,,,"NA NA","NA NA","NA NA NA NA NA NA NA NA","https://twitter.com/matteosalvinimi/status/1408134167846662149","Matteo Salvini","","Leader della Lega #primagliitaliani 🇮🇹","https://t.co/zKjsz53fwl",FALSE,1399972,2047,3062,51059,3848,2011-03-23 10:32:56,TRUE,"https://t.co/zKjsz53fwl","http://www.legaonline.it/iscriviti",,"https://pbs.twimg.com/profile_banners/270839361/1624177197","http://abs.twimg.com/images/themes/theme1/bg.png","http://pbs.twimg.com/profile_images/966325945060732928/0Ua5xPMX_normal.jpg"
"x270839361","x1408098400986406915",2021-06-24 16:23:14,"matteosalvinimi","Dopo Roma, Firenze. PAZZESCO, in centro e in pieno giorno. Giovane immigrato in stato di alterazione salta su una macchina e la sfascia a mazzate! Immobilizzato dalla Polizia, speriamo non vengano indagati gli agenti. Altro bell'episodio di integrazione “modello sinistra"". https://t.co/X0cZAtue13","Twitter Web App",273,,,,FALSE,FALSE,1591,382,,,,,,,,"http://pbs.twimg.com/ext_tw_video_thumb/1408097889079922690/pu/img/pvJbiF2ppzwvs5Tb.jpg","https://t.co/X0cZAtue13","https://twitter.com/matteosalvinimi/status/1408098400986406915/video/1","photo","http://pbs.twimg.com/ext_tw_video_thumb/1408097889079922690/pu/img/pvJbiF2ppzwvs5Tb.jpg","https://t.co/X0cZAtue13","https://twitter.com/matteosalvinimi/status/1408098400986406915/video/1",,,,"it",,,,,,,,,,,,,,,,,,,,,,,,,,,,,,,,,,,,,"NA NA","NA NA","NA NA NA NA NA NA NA NA","https://twitter.com/matteosalvinimi/status/1408098400986406915","Matteo Salvini","","Leader della Lega #primagliitaliani 🇮🇹","https://t.co/zKjsz53fwl",FALSE,1399972,2047,3062,51059,3848,2011-03-23 10:32:56,TRUE,"https://t.co/zKjsz53fwl","http://www.legaonline.it/iscriviti",,"https://pbs.twimg.com/profile_banners/270839361/1624177197","http://abs.twimg.com/images/themes/theme1/bg.png","http://pbs.twimg.com/profile_images/966325945060732928/0Ua5xPMX_normal.jpg"
"x270839361","x1408077780919717892",2021-06-24 15:01:18,"matteosalvinimi","Dopo anni di attesa, oggi finalmente il Consiglio dei Ministri ha riconosciuto la professione sanitaria dell’Osteopata, un traguardo atteso da migliaia di professionisti che, anche durante la pandemia, non hanno mai smesso di impegnarsi al servizio dei cittadini.","Twitter for iPhone",263,,,,FALSE,FALSE,920,123,,,,,,,,,,,,,,,,,,"it",,,,,,,,,,,,,,,,,,,,,,,,,,,,,,,,,,,,,"NA NA","NA NA","NA NA NA NA NA NA NA NA","https://twitter.com/matteosalvinimi/status/1408077780919717892","Matteo Salvini","","Leader della Lega #primagliitaliani 🇮🇹","https://t.co/zKjsz53fwl",FALSE,1399972,2047,3062,51059,3848,2011-03-23 10:32:56,TRUE,"https://t.co/zKjsz53fwl","http://www.legaonline.it/iscriviti",,"https://pbs.twimg.com/profile_banners/270839361/1624177197","http://abs.twimg.com/images/themes/theme1/bg.png","http://pbs.twimg.com/profile_images/966325945060732928/0Ua5xPMX_normal.jpg"
"x807946915837083648","x1408391616394665990",2021-06-25 11:48:22,"fofino3","Proroga blocco #licenziamenti, @SenatoMattia lo chiede a #Draghi. 
Il Premier non risponde e fa ironia sul bicchiere mezzo pieno della ripresa.

#LAlternativaCE #opposizione #governo #Draghi https://t.co/MqrcoJ0PBN","Twitter for Android",140,,,,FALSE,TRUE,0,3,,,"licenziamenti Draghi",,,,,,,,,,,,,"x1364265902112444418 x1406703543348760578","LAlternativaCE SenatoMattia","it",,,,,,,,,,,,,,,,"x1408360984494940164","Proroga blocco #licenziamenti, @SenatoMattia lo chiede a #Draghi. 
Il Premier non risponde e fa ironia sul bicchiere mezzo pieno della ripresa.

#LAlternativaCE #opposizione #governo #Draghi https://t.co/MqrcoJ0PBN",2021-06-25 09:46:39,"Twitter for iPhone",0,3,"x1364265902112444418","LAlternativaCE","L'Alternativa c'è",324,56,74,"Italia","Account ufficiale de ""L'Alternativa c'è""",FALSE,,,,,,,"NA NA","NA NA","NA NA NA NA NA NA NA NA","https://twitter.com/fofino3/status/1408391616394665990","Luisa Angrisani","","Alternativa C'è",,FALSE,38,99,0,15,176,2016-12-11 13:55:30,FALSE,,,,,,"http://pbs.twimg.com/profile_images/1408038086878105606/cwYLC0bV_normal.jpg"
"x1075084718","x1408420061661089792",2021-06-25 13:41:24,"arrigoni_paolo","#TransizioneEcologica in @regionepiemonte. Anche @ReRebaudengo interverrà all'importante appuntamento di mercoledì 30 giugno https://t.co/No5yMB2nSo @MiTE_IT @Alberto_Cirio  @takethedate @arrigoni_paolo @UniAvogadro @AncePiemonte @snam @TernaSpA @Italgas @EnelGroupIT @AsjamenoCO2","Twitter for Android",139,,,,FALSE,TRUE,0,4,,,"TransizioneEcologica",,,,,,,,,,,,,"x970572311509323778 x90641656 x545121376","E_Futura regionepiemonte ReRebaudengo","it",,,,,,,,,,,,,,,,"x1408320900966064129","#TransizioneEcologica in @regionepiemonte. Anche @ReRebaudengo interverrà all'importante appuntamento di mercoledì 30 giugno https://t.co/No5yMB2nSo @MiTE_IT @Alberto_Cirio  @takethedate @arrigoni_paolo @UniAvogadro @AncePiemonte @snam @TernaSpA @Italgas @EnelGroupIT @AsjamenoCO2",2021-06-25 07:07:22,"Twitter Web App",4,4,"x970572311509323778","E_Futura","Elettricità Futura",1884,139,5570,"Roma; Milano | Italia","Elettricità Futura è la principale Associazione del mondo elettrico italiano",FALSE,,,,,,,"NA NA","NA NA","NA NA NA NA NA NA NA NA","https://twitter.com/arrigoni_paolo/status/1408420061661089792","Paolo Arrigoni","Calolziocorte, Lombardia","Questore del Senato della Repubblica, componente della Commissione Ambiente e del Copasir. Responsabile del Dipartimento Energia della Lega.","https://t.co/M6TePkOvfO",FALSE,4561,167,58,9425,99,2013-01-09 22:36:27,TRUE,"https://t.co/M6TePkOvfO","http://www.senato.it/leg/18/BGT/Schede/Attsen/00029039.htm",,"https://pbs.twimg.com/profile_banners/1075084718/1591968708","http://abs.twimg.com/images/themes/theme1/bg.png","http://pbs.twimg.com/profile_images/3172370357/bec3e4497d64c77f2a93bc9792055992_normal.jpeg"
"x876541483","x1408401211909365760",2021-06-25 12:26:30,"AlbertoBagnai","Guariti poi vaccinati al sesto mese (con più di duemila anticorpi): è utile o pericolosa la seconda dose? Centri vaccinali hanno indirizzi contrastanti. Chi ha esperienza simile?","Twitter for iPhone",140,,,,FALSE,TRUE,0,67,,,,,,,,,,,,,,,,"x932753953","gbongiorno66","it",,,,,,,,,,,,,,,,"x1408398270657871872","Guariti poi vaccinati al sesto mese (con più di duemila anticorpi): è utile o pericolosa la seconda dose? Centri vaccinali hanno indirizzi contrastanti. Chi ha esperienza simile?",2021-06-25 12:14:49,"Twitter for iPhone",264,67,"x932753953","gbongiorno66","Giulia Bongiorno",76713,714,5677,"","Avvocato",FALSE,,,,,,,"NA NA","NA NA","NA NA NA NA NA NA NA NA","https://twitter.com/AlbertoBagnai/status/1408401211909365760","Alberto Bagnai","","Professore associato di politica economica all’Università Gabriele d’Annunzio, eletto al Senato per la Lega nel collegio Abruzzo 01.","https://t.co/sC5RvUzmsX",FALSE,124313,666,656,215877,6460,2012-10-12 22:13:36,TRUE,"https://t.co/sC5RvUzmsX","http://www.senato.it/leg/18/BGT/Schede/Attsen/00032582.htm",,"https://pbs.twimg.com/profile_banners/876541483/1535647109","http://abs.twimg.com/images/themes/theme1/bg.png","http://pbs.twimg.com/profile_images/849030859462246401/ATk3_aiW_normal.jpg"
"x876541483","x1408401184638091273",2021-06-25 12:26:23,"AlbertoBagnai","A proposito del “inginocchiarsi” ricordo le parole di una donna mito della Sinistra (non quella di oggi radical chic) “la libertà è sempre e solo la libertà di chi la pensa diversamente”","Twitter for iPhone",140,,,,FALSE,TRUE,0,62,,,,,,,,,,,,,,,,"x1161196922","editoreruggeri","it",,,,,,,,,,,,,,,,"x1408398424987377666","A proposito del “inginocchiarsi” ricordo le parole di una donna mito della Sinistra (non quella di oggi radical chic) “la libertà è sempre e solo la libertà di chi la pensa diversamente”",2021-06-25 12:15:25,"Twitter for iPad",215,62,"x1161196922","editoreruggeri","Riccardo Ruggeri",8632,434,24132,"editore","Come editore-scrittore vivo negli “interstizi”, sogno lettori che vogliano informarsi, non certo seguire le mie idee, peggio rafforzare i loro pregiudizi",FALSE,,,,,,,"NA NA","NA NA","NA NA NA NA NA NA NA NA","https://twitter.com/AlbertoBagnai/status/1408401184638091273","Alberto Bagnai","","Professore associato di politica economica all’Università Gabriele d’Annunzio, eletto al Senato per la Lega nel collegio Abruzzo 01.","https://t.co/sC5RvUzmsX",FALSE,124313,666,656,215877,6460,2012-10-12 22:13:36,TRUE,"https://t.co/sC5RvUzmsX","http://www.senato.it/leg/18/BGT/Schede/Attsen/00032582.htm",,"https://pbs.twimg.com/profile_banners/876541483/1535647109","http://abs.twimg.com/images/themes/theme1/bg.png","http://pbs.twimg.com/profile_images/849030859462246401/ATk3_aiW_normal.jpg"
"x876541483","x1408365243336638468",2021-06-25 10:03:34,"AlbertoBagnai","SCOPERTO IN ISRAELE UN NUOVO ANTENATO DELL'UOMO: E' L'HOMO NESHER RAMLA, E POTREBBE SPIEGARE... https://t.co/jVuOyxn7Go https://t.co/xRVM1tvMBq","Twitter for iPhone",140,,,,FALSE,TRUE,0,9,,,,,"ow.ly/vuVw102Ntmc","https://t.co/jVuOyxn7Go","http://ow.ly/vuVw102Ntmc",,,,,,,,,"x70971449","_DAGOSPIA_","it",,,,,,,,,,,,,,,,"x1408364958518235140","SCOPERTO IN ISRAELE UN NUOVO ANTENATO DELL'UOMO: E' L'HOMO NESHER RAMLA, E POTREBBE SPIEGARE... https://t.co/jVuOyxn7Go https://t.co/xRVM1tvMBq",2021-06-25 10:02:26,"Hootsuite Inc.",32,9,"x70971449","_DAGOSPIA_","Dagospia",717182,225,256530,"Roma","http://t.co/20Ba3DvDpD",TRUE,,,,,,,"NA NA","NA NA","NA NA NA NA NA NA NA NA","https://twitter.com/AlbertoBagnai/status/1408365243336638468","Alberto Bagnai","","Professore associato di politica economica all’Università Gabriele d’Annunzio, eletto al Senato per la Lega nel collegio Abruzzo 01.","https://t.co/sC5RvUzmsX",FALSE,124313,666,656,215877,6460,2012-10-12 22:13:36,TRUE,"https://t.co/sC5RvUzmsX","http://www.senato.it/leg/18/BGT/Schede/Attsen/00032582.htm",,"https://pbs.twimg.com/profile_banners/876541483/1535647109","http://abs.twimg.com/images/themes/theme1/bg.png","http://pbs.twimg.com/profile_images/849030859462246401/ATk3_aiW_normal.jpg"
"x876541483","x1408314919544631300",2021-06-25 06:43:36,"AlbertoBagnai","@Gemma82756389 È abbastanza noto: https://t.co/Ieqg2Swxmo.","Twitter for iPhone",43,"x1408311544102932487","x765954217207009282","Gemma82756389",FALSE,FALSE,4,0,,,,,"albertobagnai.it/dischi/","https://t.co/Ieqg2Swxmo","http://albertobagnai.it/dischi/",,,,,,,,,"x765954217207009282","Gemma82756389","it",,,,,,,,,,,,,,,,,,,,,,,,,,,,,,,,,,,,,"NA NA","NA NA","NA NA NA NA NA NA NA NA","https://twitter.com/AlbertoBagnai/status/1408314919544631300","Alberto Bagnai","","Professore associato di politica economica all’Università Gabriele d’Annunzio, eletto al Senato per la Lega nel collegio Abruzzo 01.","https://t.co/sC5RvUzmsX",FALSE,124313,666,656,215877,6460,2012-10-12 22:13:36,TRUE,"https://t.co/sC5RvUzmsX","http://www.senato.it/leg/18/BGT/Schede/Attsen/00032582.htm",,"https://pbs.twimg.com/profile_banners/876541483/1535647109","http://abs.twimg.com/images/themes/theme1/bg.png","http://pbs.twimg.com/profile_images/849030859462246401/ATk3_aiW_normal.jpg"
"x876541483","x1408304816191938560",2021-06-25 06:03:27,"AlbertoBagnai","@Eric_Anceau Et combien de nos ""grands esprits"" qui soufflaient sur les braises?😳
Les jeunes générations savent-elles que nous allions en vacances là vers 1960, sans ""rideau de fer""...😌","Twitter for iPhone",140,,,,FALSE,TRUE,0,4,,,,,,,,,,,,,,,,"x452015954 x523006365","BauvalMichel Eric_Anceau","fr",,,,,,,,,,,,,,,,"x1408302751877107713","@Eric_Anceau Et combien de nos ""grands esprits"" qui soufflaient sur les braises?😳
Les jeunes générations savent-elles que nous allions en vacances là vers 1960, sans ""rideau de fer""...😌",2021-06-25 05:55:15,"Twitter Web App",20,4,"x452015954","BauvalMichel","Bauval",2631,4866,95025,"Saint-Nazaire, France","Michel Thibault-Vallée (Bauval) 

Pour le bonheur du #TiersDuBas!
#Inégalités? Bof!
Désolé, #LesBrosses m'ont très tôt appris ça!",FALSE,,,,,,,"NA NA","NA NA","NA NA NA NA NA NA NA NA","https://twitter.com/AlbertoBagnai/status/1408304816191938560","Alberto Bagnai","","Professore associato di politica economica all’Università Gabriele d’Annunzio, eletto al Senato per la Lega nel collegio Abruzzo 01.","https://t.co/sC5RvUzmsX",FALSE,124313,666,656,215877,6460,2012-10-12 22:13:36,TRUE,"https://t.co/sC5RvUzmsX","http://www.senato.it/leg/18/BGT/Schede/Attsen/00032582.htm",,"https://pbs.twimg.com/profile_banners/876541483/1535647109","http://abs.twimg.com/images/themes/theme1/bg.png","http://pbs.twimg.com/profile_images/849030859462246401/ATk3_aiW_normal.jpg"
"x876541483","x1408288982329397250",2021-06-25 05:00:32,"AlbertoBagnai","@ressicstantibus @LepantoVienna @DavideFalchieri @Donnadipicche3 @Marko_Morandi Manca Giotto.","Twitter for iPhone",13,"x1408186701772636161","x147710399","ressicstantibus",FALSE,FALSE,10,0,,,,,,,,,,,,,,,,"x147710399 x1146737696854986752 x429327262 x927177865669554176 x492602588","ressicstantibus LepantoVienna DavideFalchieri Donnadipicche3 Marko_Morandi","it",,,,,,,,,,,,,,,,,,,,,,,,,,,,,,,,,,,,,"NA NA","NA NA","NA NA NA NA NA NA NA NA","https://twitter.com/AlbertoBagnai/status/1408288982329397250","Alberto Bagnai","","Professore associato di politica economica all’Università Gabriele d’Annunzio, eletto al Senato per la Lega nel collegio Abruzzo 01.","https://t.co/sC5RvUzmsX",FALSE,124313,666,656,215877,6460,2012-10-12 22:13:36,TRUE,"https://t.co/sC5RvUzmsX","http://www.senato.it/leg/18/BGT/Schede/Attsen/00032582.htm",,"https://pbs.twimg.com/profile_banners/876541483/1535647109","http://abs.twimg.com/images/themes/theme1/bg.png","http://pbs.twimg.com/profile_images/849030859462246401/ATk3_aiW_normal.jpg"
"x876541483","x1408180787887935491",2021-06-24 21:50:37,"AlbertoBagnai","@LepantoVienna @DavideFalchieri @Donnadipicche3 @Marko_Morandi https://t.co/cXtLNDTvEW","Twitter for iPhone",105,,,,FALSE,TRUE,0,13,,,,,,,,"http://pbs.twimg.com/media/E4rc7XmWEAAD0GT.jpg","https://t.co/cXtLNDTvEW","https://twitter.com/AlbertoBagnai/status/1408180757852573696/photo/1","photo","http://pbs.twimg.com/media/E4rc7XmWEAAD0GT.jpg","https://t.co/cXtLNDTvEW","https://twitter.com/AlbertoBagnai/status/1408180757852573696/photo/1",,"x876541483 x1146737696854986752 x429327262 x927177865669554176 x492602588","AlbertoBagnai LepantoVienna DavideFalchieri Donnadipicche3 Marko_Morandi","und",,,,,,,,,,,,,,,,"x1408180757852573696","@LepantoVienna @DavideFalchieri @Donnadipicche3 @Marko_Morandi https://t.co/cXtLNDTvEW",2021-06-24 21:50:30,"Twitter for iPhone",80,13,"x876541483","AlbertoBagnai","Alberto Bagnai",124313,666,215877,"","Professore associato di politica economica all’Università Gabriele d’Annunzio, eletto al Senato per la Lega nel collegio Abruzzo 01.",TRUE,,,,,,,"NA NA","NA NA","NA NA NA NA NA NA NA NA","https://twitter.com/AlbertoBagnai/status/1408180787887935491","Alberto Bagnai","","Professore associato di politica economica all’Università Gabriele d’Annunzio, eletto al Senato per la Lega nel collegio Abruzzo 01.","https://t.co/sC5RvUzmsX",FALSE,124313,666,656,215877,6460,2012-10-12 22:13:36,TRUE,"https://t.co/sC5RvUzmsX","http://www.senato.it/leg/18/BGT/Schede/Attsen/00032582.htm",,"https://pbs.twimg.com/profile_banners/876541483/1535647109","http://abs.twimg.com/images/themes/theme1/bg.png","http://pbs.twimg.com/profile_images/849030859462246401/ATk3_aiW_normal.jpg"
"x876541483","x1408180757852573696",2021-06-24 21:50:30,"AlbertoBagnai","@LepantoVienna @DavideFalchieri @Donnadipicche3 @Marko_Morandi https://t.co/cXtLNDTvEW","Twitter for iPhone",0,"x1408180186303057932","x1146737696854986752","LepantoVienna",FALSE,FALSE,80,13,,,,,,,,"http://pbs.twimg.com/media/E4rc7XmWEAAD0GT.jpg","https://t.co/cXtLNDTvEW","https://twitter.com/AlbertoBagnai/status/1408180757852573696/photo/1","photo","http://pbs.twimg.com/media/E4rc7XmWEAAD0GT.jpg","https://t.co/cXtLNDTvEW","https://twitter.com/AlbertoBagnai/status/1408180757852573696/photo/1",,"x1146737696854986752 x429327262 x927177865669554176 x492602588","LepantoVienna DavideFalchieri Donnadipicche3 Marko_Morandi","und",,,,,,,,,,,,,,,,,,,,,,,,,,,,,,,,,,,,,"NA NA","NA NA","NA NA NA NA NA NA NA NA","https://twitter.com/AlbertoBagnai/status/1408180757852573696","Alberto Bagnai","","Professore associato di politica economica all’Università Gabriele d’Annunzio, eletto al Senato per la Lega nel collegio Abruzzo 01.","https://t.co/sC5RvUzmsX",FALSE,124313,666,656,215877,6460,2012-10-12 22:13:36,TRUE,"https://t.co/sC5RvUzmsX","http://www.senato.it/leg/18/BGT/Schede/Attsen/00032582.htm",,"https://pbs.twimg.com/profile_banners/876541483/1535647109","http://abs.twimg.com/images/themes/theme1/bg.png","http://pbs.twimg.com/profile_images/849030859462246401/ATk3_aiW_normal.jpg"
"x876541483","x1408178044234133507",2021-06-24 21:39:43,"AlbertoBagnai","@mspatane Non era all’altezza del suo importante compito.","Twitter for iPhone",47,"x1408044205562290176","x3342659920","mspatane",FALSE,FALSE,2,1,,,,,,,,,,,,,,,,"x3342659920","mspatane","it",,,,,,,,,,,,,,,,,,,,,,,,,,,,,,,,,,,,,"NA NA","NA NA","NA NA NA NA NA NA NA NA","https://twitter.com/AlbertoBagnai/status/1408178044234133507","Alberto Bagnai","","Professore associato di politica economica all’Università Gabriele d’Annunzio, eletto al Senato per la Lega nel collegio Abruzzo 01.","https://t.co/sC5RvUzmsX",FALSE,124313,666,656,215877,6460,2012-10-12 22:13:36,TRUE,"https://t.co/sC5RvUzmsX","http://www.senato.it/leg/18/BGT/Schede/Attsen/00032582.htm",,"https://pbs.twimg.com/profile_banners/876541483/1535647109","http://abs.twimg.com/images/themes/theme1/bg.png","http://pbs.twimg.com/profile_images/849030859462246401/ATk3_aiW_normal.jpg"
"x876541483","x1408176983918276609",2021-06-24 21:35:30,"AlbertoBagnai","https://t.co/pTrx5qglL5","Twitter for iPhone",0,,,,FALSE,FALSE,177,6,,,,,,,,"http://pbs.twimg.com/media/E4rZf_UWUAcRv42.jpg","https://t.co/pTrx5qglL5","https://twitter.com/AlbertoBagnai/status/1408176983918276609/photo/1","photo","http://pbs.twimg.com/media/E4rZf_UWUAcRv42.jpg","https://t.co/pTrx5qglL5","https://twitter.com/AlbertoBagnai/status/1408176983918276609/photo/1",,,,"und",,,,,,,,,,,,,,,,,,,,,,,,,,,,,,,,,,,,,"NA NA","NA NA","NA NA NA NA NA NA NA NA","https://twitter.com/AlbertoBagnai/status/1408176983918276609","Alberto Bagnai","","Professore associato di politica economica all’Università Gabriele d’Annunzio, eletto al Senato per la Lega nel collegio Abruzzo 01.","https://t.co/sC5RvUzmsX",FALSE,124313,666,656,215877,6460,2012-10-12 22:13:36,TRUE,"https://t.co/sC5RvUzmsX","http://www.senato.it/leg/18/BGT/Schede/Attsen/00032582.htm",,"https://pbs.twimg.com/profile_banners/876541483/1535647109","http://abs.twimg.com/images/themes/theme1/bg.png","http://pbs.twimg.com/profile_images/849030859462246401/ATk3_aiW_normal.jpg"
"x876541483","x1408167156727091209",2021-06-24 20:56:27,"AlbertoBagnai","@Marko_Morandi @AlbertoBagnai Roma. Oratorio del Gonfalone","Twitter for iPhone",78,,,,FALSE,TRUE,0,1,,,,,,,,,,,,,,,,"x927177865669554176 x492602588 x876541483","Donnadipicche3 Marko_Morandi AlbertoBagnai","it",,,,,,,,,,,,,,,,"x1408155277023715331","@Marko_Morandi @AlbertoBagnai Roma. Oratorio del Gonfalone",2021-06-24 20:09:14,"Twitter for Android",29,1,"x927177865669554176","Donnadipicche3","Donnadipicche",14,85,43,"Roma, Lazio","Mediterranea, italiana e sabina.
Figlia unica innamorata follemente del suo papà. Amante della buona cucina, perfezionista e curiosa.",FALSE,,,,,,,"NA NA","NA NA","NA NA NA NA NA NA NA NA","https://twitter.com/AlbertoBagnai/status/1408167156727091209","Alberto Bagnai","","Professore associato di politica economica all’Università Gabriele d’Annunzio, eletto al Senato per la Lega nel collegio Abruzzo 01.","https://t.co/sC5RvUzmsX",FALSE,124313,666,656,215877,6460,2012-10-12 22:13:36,TRUE,"https://t.co/sC5RvUzmsX","http://www.senato.it/leg/18/BGT/Schede/Attsen/00032582.htm",,"https://pbs.twimg.com/profile_banners/876541483/1535647109","http://abs.twimg.com/images/themes/theme1/bg.png","http://pbs.twimg.com/profile_images/849030859462246401/ATk3_aiW_normal.jpg"
"x876541483","x1408141837190193156",2021-06-24 19:15:50,"AlbertoBagnai","https://t.co/JJeCoUMkUW","Twitter for iPhone",0,,,,FALSE,FALSE,202,10,,,,,,,,"http://pbs.twimg.com/media/E4q5bm4X0AQj0kd.jpg","https://t.co/JJeCoUMkUW","https://twitter.com/AlbertoBagnai/status/1408141837190193156/photo/1","photo","http://pbs.twimg.com/media/E4q5bm4X0AQj0kd.jpg","https://t.co/JJeCoUMkUW","https://twitter.com/AlbertoBagnai/status/1408141837190193156/photo/1",,,,"und",,,,,,,,,,,,,,,,,,,,,,,,,,,,,,,,,,,,,"NA NA","NA NA","NA NA NA NA NA NA NA NA","https://twitter.com/AlbertoBagnai/status/1408141837190193156","Alberto Bagnai","","Professore associato di politica economica all’Università Gabriele d’Annunzio, eletto al Senato per la Lega nel collegio Abruzzo 01.","https://t.co/sC5RvUzmsX",FALSE,124313,666,656,215877,6460,2012-10-12 22:13:36,TRUE,"https://t.co/sC5RvUzmsX","http://www.senato.it/leg/18/BGT/Schede/Attsen/00032582.htm",,"https://pbs.twimg.com/profile_banners/876541483/1535647109","http://abs.twimg.com/images/themes/theme1/bg.png","http://pbs.twimg.com/profile_images/849030859462246401/ATk3_aiW_normal.jpg"
