"user_id","status_id","created_at","screen_name","text","source","display_text_width","reply_to_status_id","reply_to_user_id","reply_to_screen_name","is_quote","is_retweet","favorite_count","retweet_count","quote_count","reply_count","hashtags","symbols","urls_url","urls_t.co","urls_expanded_url","media_url","media_t.co","media_expanded_url","media_type","ext_media_url","ext_media_t.co","ext_media_expanded_url","ext_media_type","mentions_user_id","mentions_screen_name","lang","quoted_status_id","quoted_text","quoted_created_at","quoted_source","quoted_favorite_count","quoted_retweet_count","quoted_user_id","quoted_screen_name","quoted_name","quoted_followers_count","quoted_friends_count","quoted_statuses_count","quoted_location","quoted_description","quoted_verified","retweet_status_id","retweet_text","retweet_created_at","retweet_source","retweet_favorite_count","retweet_retweet_count","retweet_user_id","retweet_screen_name","retweet_name","retweet_followers_count","retweet_friends_count","retweet_statuses_count","retweet_location","retweet_description","retweet_verified","place_url","place_name","place_full_name","place_type","country","country_code","geo_coords","coords_coords","bbox_coords","status_url","name","location","description","url","protected","followers_count","friends_count","listed_count","statuses_count","favourites_count","account_created_at","verified","profile_url","profile_expanded_url","account_lang","profile_banner_url","profile_background_url","profile_image_url"
"x270839361","x1433117480084512775",2021-09-01 17:20:07,"matteosalvinimi","Totale e affettuosa solidarietà a Veronica Poli, coraggiosa consigliera della Lega a Pisa, che ha ricevuto un biglietto di minacce. Violenze, minacce e insulti non ci fermeranno mai. Sono certo che tutti i partiti esprimeranno vicinanza a Veronica.","Twitter Web App",248,,,,FALSE,FALSE,774,90,,,,,,,,,,,,,,,,,,"it",,,,,,,,,,,,,,,,,,,,,,,,,,,,,,,,,,,,,"NA NA","NA NA","NA NA NA NA NA NA NA NA","https://twitter.com/matteosalvinimi/status/1433117480084512775","Matteo Salvini","","Leader della Lega #primagliitaliani 🇮🇹","https://t.co/KDs4YUajH3",FALSE,1411920,2040,3070,51646,3857,2011-03-23 10:32:56,TRUE,"https://t.co/KDs4YUajH3","http://www.legaonline.it/referendumgiustizia",,"https://pbs.twimg.com/profile_banners/270839361/1625239837","http://abs.twimg.com/images/themes/theme1/bg.png","http://pbs.twimg.com/profile_images/966325945060732928/0Ua5xPMX_normal.jpg"
"x270839361","x1433029568978472968",2021-09-01 11:30:48,"matteosalvinimi","Grazie Rita! La Lega sarà sempre impegnata per avere una Giustizia più giusta, efficiente e moderna. https://t.co/3N7qjqfbPR","Twitter for iPhone",100,,,,FALSE,FALSE,928,130,,,,,,,,"http://pbs.twimg.com/media/E-Mky08WQA0fNkB.jpg","https://t.co/3N7qjqfbPR","https://twitter.com/matteosalvinimi/status/1433029568978472968/photo/1","photo","http://pbs.twimg.com/media/E-Mky08WQA0fNkB.jpg","https://t.co/3N7qjqfbPR","https://twitter.com/matteosalvinimi/status/1433029568978472968/photo/1",,,,"it",,,,,,,,,,,,,,,,,,,,,,,,,,,,,,,,,,,,,"NA NA","NA NA","NA NA NA NA NA NA NA NA","https://twitter.com/matteosalvinimi/status/1433029568978472968","Matteo Salvini","","Leader della Lega #primagliitaliani 🇮🇹","https://t.co/KDs4YUajH3",FALSE,1411920,2040,3070,51646,3857,2011-03-23 10:32:56,TRUE,"https://t.co/KDs4YUajH3","http://www.legaonline.it/referendumgiustizia",,"https://pbs.twimg.com/profile_banners/270839361/1625239837","http://abs.twimg.com/images/themes/theme1/bg.png","http://pbs.twimg.com/profile_images/966325945060732928/0Ua5xPMX_normal.jpg"
"x807946915837083648","x1433187894844346376",2021-09-01 21:59:56,"fofino3","Per completezza d’informazione. La #Lega ha annunciato il ritiro degli emendamenti al #GreenPass con parere contrario del #Governo. Poi ha cambiato idea e ha chiesto di metterli in votazione col beneplacito della presidenza.","Twitter for Android",140,,,,FALSE,TRUE,0,7,,,"Lega GreenPass",,,,,,,,,,,,,"x1364265902112444418","LAlternativaCE","it",,,,,,,,,,,,,,,,"x1433135118768553987","Per completezza d’informazione. La #Lega ha annunciato il ritiro degli emendamenti al #GreenPass con parere contrario del #Governo. Poi ha cambiato idea e ha chiesto di metterli in votazione col beneplacito della presidenza.",2021-09-01 18:30:13,"Twitter Web App",11,7,"x1364265902112444418","LAlternativaCE","L'Alternativa c'è",510,56,170,"Italia","Account ufficiale de ""L'Alternativa c'è""",FALSE,,,,,,,"NA NA","NA NA","NA NA NA NA NA NA NA NA","https://twitter.com/fofino3/status/1433187894844346376","Luisa Angrisani","","Alternativa C'è",,FALSE,53,111,0,139,258,2016-12-11 13:55:30,FALSE,,,,,,"http://pbs.twimg.com/profile_images/1408038086878105606/cwYLC0bV_normal.jpg"
"x101602652","x1433361446516183040",2021-09-02 09:29:34,"augussori","Il quotidiano Il Cittadino di Lodi ha ripreso il mio intervento sull’operazione della Questura che ha permesso di sgominare una baby gang attiva nel Lodigiano. https://t.co/PEtCRWBwyD","Twitter for iPhone",159,,,,FALSE,FALSE,0,0,,,,,,,,"http://pbs.twimg.com/media/E-RSocRWYAQN5yc.jpg","https://t.co/PEtCRWBwyD","https://twitter.com/augussori/status/1433361446516183040/photo/1","photo","http://pbs.twimg.com/media/E-RSocRWYAQN5yc.jpg","https://t.co/PEtCRWBwyD","https://twitter.com/augussori/status/1433361446516183040/photo/1",,,,"it",,,,,,,,,,,,,,,,,,,,,,,,,,,,,,,,,,,,,"NA NA","NA NA","NA NA NA NA NA NA NA NA","https://twitter.com/augussori/status/1433361446516183040","Luigi Augussori","Lodi, Lombardy","Profilo del sen. Luigi Augussori, rappresentante lodigiano nel Senato della Repubblica per il gruppo Lega - Salvini Premier. https://t.co/RVDZN85Ue5","https://t.co/494Lk5LQeR",FALSE,947,779,16,3124,323,2010-01-03 23:39:00,TRUE,"https://t.co/494Lk5LQeR","http://www.senato.it/leg/18/BGT/Schede/Attsen/00019244.htm",,"https://pbs.twimg.com/profile_banners/101602652/1536334347","http://abs.twimg.com/images/themes/theme1/bg.png","http://pbs.twimg.com/profile_images/1397968025198989317/FpsdhGWL_normal.jpg"
"x101602652","x1433088211144880136",2021-09-01 15:23:49,"augussori","Domenica 5 settembre alle ore 16:30 Matteo Salvini sarà a #Codogno per sostenere il candidato sindaco della #Lega Francesco Passerini.  
Vi aspetto!!! https://t.co/HlQMMRVO3O","Twitter for iPhone",150,,,,FALSE,FALSE,6,3,,,"Codogno Lega",,,,,"http://pbs.twimg.com/media/E-NaIBeXMAsQ2-T.jpg","https://t.co/HlQMMRVO3O","https://twitter.com/augussori/status/1433088211144880136/photo/1","photo","http://pbs.twimg.com/media/E-NaIBeXMAsQ2-T.jpg","https://t.co/HlQMMRVO3O","https://twitter.com/augussori/status/1433088211144880136/photo/1",,,,"it",,,,,,,,,,,,,,,,,,,,,,,,,,,,,,,,,,,,,"NA NA","NA NA","NA NA NA NA NA NA NA NA","https://twitter.com/augussori/status/1433088211144880136","Luigi Augussori","Lodi, Lombardy","Profilo del sen. Luigi Augussori, rappresentante lodigiano nel Senato della Repubblica per il gruppo Lega - Salvini Premier. https://t.co/RVDZN85Ue5","https://t.co/494Lk5LQeR",FALSE,947,779,16,3124,323,2010-01-03 23:39:00,TRUE,"https://t.co/494Lk5LQeR","http://www.senato.it/leg/18/BGT/Schede/Attsen/00019244.htm",,"https://pbs.twimg.com/profile_banners/101602652/1536334347","http://abs.twimg.com/images/themes/theme1/bg.png","http://pbs.twimg.com/profile_images/1397968025198989317/FpsdhGWL_normal.jpg"
"x101602652","x1433050355827367937",2021-09-01 12:53:24,"augussori","Mi congratulo con il Questore di Lodi Giovanni Di Teodoro e con gli uomini e donne della sua squadra per l’ottimo lavoro svolto ed invito chiunque avesse subito soprusi da questa baby gang, e non lo avesse ancora fatto, a denunciare. 
👉🏻 https://t.co/wmqrBgPefi
#NonSeiSolo https://t.co/roHtZqHVKp","Twitter for iPhone",273,,,,FALSE,FALSE,0,0,,,"NonSeiSolo",,"facebook.com/286548979095/p…","https://t.co/wmqrBgPefi","https://www.facebook.com/286548979095/posts/10159374830229096/","http://pbs.twimg.com/media/E-M3sGIWYAIdAns.jpg","https://t.co/roHtZqHVKp","https://twitter.com/augussori/status/1433050355827367937/photo/1","photo","http://pbs.twimg.com/media/E-M3sGIWYAIdAns.jpg","https://t.co/roHtZqHVKp","https://twitter.com/augussori/status/1433050355827367937/photo/1",,,,"it",,,,,,,,,,,,,,,,,,,,,,,,,,,,,,,,,,,,,"NA NA","NA NA","NA NA NA NA NA NA NA NA","https://twitter.com/augussori/status/1433050355827367937","Luigi Augussori","Lodi, Lombardy","Profilo del sen. Luigi Augussori, rappresentante lodigiano nel Senato della Repubblica per il gruppo Lega - Salvini Premier. https://t.co/RVDZN85Ue5","https://t.co/494Lk5LQeR",FALSE,947,779,16,3124,323,2010-01-03 23:39:00,TRUE,"https://t.co/494Lk5LQeR","http://www.senato.it/leg/18/BGT/Schede/Attsen/00019244.htm",,"https://pbs.twimg.com/profile_banners/101602652/1536334347","http://abs.twimg.com/images/themes/theme1/bg.png","http://pbs.twimg.com/profile_images/1397968025198989317/FpsdhGWL_normal.jpg"
"x876541483","x1433333710493978624",2021-09-02 07:39:21,"AlbertoBagnai","Ora su @RadioRPL","Twitter for iPhone",36,,,,FALSE,TRUE,0,15,,,,,,,,,,,,,,,,"x337767301 x749461495","borghi_claudio RadioRPL","in",,,,,,,,,,,,,,,,"x1433332624030842883","Ora su @RadioRPL",2021-09-02 07:35:02,"Twitter for Android",87,15,"x337767301","borghi_claudio","Claudio Borghi A.",114530,1322,210806,"Italia","Deputato della Repubblica Italiana eletto in Toscana per la Lega. Consigliere Comunale di Como",TRUE,,,,,,,"NA NA","NA NA","NA NA NA NA NA NA NA NA","https://twitter.com/AlbertoBagnai/status/1433333710493978624","Alberto Bagnai","","Professore associato di politica economica all’Università Gabriele d’Annunzio, eletto al Senato per la Lega nel collegio Abruzzo 01.","https://t.co/sC5RvUzmsX",FALSE,126888,666,659,217986,6474,2012-10-12 22:13:36,TRUE,"https://t.co/sC5RvUzmsX","http://www.senato.it/leg/18/BGT/Schede/Attsen/00032582.htm",,"https://pbs.twimg.com/profile_banners/876541483/1535647109","http://abs.twimg.com/images/themes/theme1/bg.png","http://pbs.twimg.com/profile_images/849030859462246401/ATk3_aiW_normal.jpg"
"x876541483","x1433330964281892866",2021-09-02 07:28:26,"AlbertoBagnai","@Elena45947566 Anche un magistrato è un cittadino, e in teoria (nonostante i grillini) anche in politico. La cittadinanza c’entra poco. Le cose stanno così: https://t.co/7PKXwPNsKx.","Twitter for iPhone",166,"x1433329576273383426","x1167783987911241729","Elena45947566",FALSE,FALSE,4,2,,,,,"chiarini.com/autopsia-risco…","https://t.co/7PKXwPNsKx","https://www.chiarini.com/autopsia-riscontro-diagnostico/",,,,,,,,,"x1167783987911241729","Elena45947566","it",,,,,,,,,,,,,,,,,,,,,,,,,,,,,,,,,,,,,"NA NA","NA NA","NA NA NA NA NA NA NA NA","https://twitter.com/AlbertoBagnai/status/1433330964281892866","Alberto Bagnai","","Professore associato di politica economica all’Università Gabriele d’Annunzio, eletto al Senato per la Lega nel collegio Abruzzo 01.","https://t.co/sC5RvUzmsX",FALSE,126888,666,659,217986,6474,2012-10-12 22:13:36,TRUE,"https://t.co/sC5RvUzmsX","http://www.senato.it/leg/18/BGT/Schede/Attsen/00032582.htm",,"https://pbs.twimg.com/profile_banners/876541483/1535647109","http://abs.twimg.com/images/themes/theme1/bg.png","http://pbs.twimg.com/profile_images/849030859462246401/ATk3_aiW_normal.jpg"
"x876541483","x1433326273326157824",2021-09-02 07:09:48,"AlbertoBagnai","@AlbertoBagnai Per chi in questi anni si fosse perso qualche dato https://t.co/2u87A71wq0","Twitter for iPhone",102,,,,FALSE,TRUE,0,80,,,,,,,,"http://pbs.twimg.com/media/E-Qx6T0XMAExTa9.jpg","https://t.co/2u87A71wq0","https://twitter.com/jklloyd/status/1433325464257449986/photo/1","photo","http://pbs.twimg.com/media/E-Qx6T0XMAExTa9.jpg http://pbs.twimg.com/media/E-Qx6T6WEAEn73H.jpg","https://t.co/2u87A71wq0 https://t.co/2u87A71wq0","https://twitter.com/jklloyd/status/1433325464257449986/photo/1 https://twitter.com/jklloyd/status/1433325464257449986/photo/1",,"x54159740 x876541483","jklloyd AlbertoBagnai","it",,,,,,,,,,,,,,,,"x1433325464257449986","@AlbertoBagnai Per chi in questi anni si fosse perso qualche dato https://t.co/2u87A71wq0",2021-09-02 07:06:35,"Twitter for iPhone",109,80,"x54159740","jklloyd","Jk Lloyd",1778,3802,4873,"Cagliari (Italy) - London (Uk)","Music Producer, Sound Engineer. IT Manager - Onirikalab (.IT .Com) CEO https://t.co/YPofeRuCUZ https://t.co/gkv6Zh1XJh https://t.co/34glBWacXp founder",FALSE,,,,,,,"NA NA","NA NA","NA NA NA NA NA NA NA NA","https://twitter.com/AlbertoBagnai/status/1433326273326157824","Alberto Bagnai","","Professore associato di politica economica all’Università Gabriele d’Annunzio, eletto al Senato per la Lega nel collegio Abruzzo 01.","https://t.co/sC5RvUzmsX",FALSE,126888,666,659,217986,6474,2012-10-12 22:13:36,TRUE,"https://t.co/sC5RvUzmsX","http://www.senato.it/leg/18/BGT/Schede/Attsen/00032582.htm",,"https://pbs.twimg.com/profile_banners/876541483/1535647109","http://abs.twimg.com/images/themes/theme1/bg.png","http://pbs.twimg.com/profile_images/849030859462246401/ATk3_aiW_normal.jpg"
"x876541483","x1433321686137458688",2021-09-02 06:51:34,"AlbertoBagnai","This inflation hysteria in Germany is really quite something. ""Suddenly worse than Italy"", the newspaper ""Die Welt"" titles with regard to recent inflation numbers. A headline playing on inflation phobia and Italy stereotypes - German econ journalism in 2021. https://t.co/NOQqQnwGBw","Twitter for iPhone",140,,,,FALSE,TRUE,0,58,,,,,,,,,,,,,,,,"x765430697041461249","heimbergecon","en",,,,,,,,,,,,,,,,"x1433318430422274052","This inflation hysteria in Germany is really quite something. ""Suddenly worse than Italy"", the newspaper ""Die Welt"" titles with regard to recent inflation numbers. A headline playing on inflation phobia and Italy stereotypes - German econ journalism in 2021. https://t.co/NOQqQnwGBw",2021-09-02 06:38:38,"Twitter Web App",225,58,"x765430697041461249","heimbergecon","Philipp Heimberger",22343,559,5723,"","Economist, Vienna Institute for International Economic Studies (@wiiw_ac_at); political economy, economic policy, macroeconomics, public finance.",FALSE,,,,,,,"NA NA","NA NA","NA NA NA NA NA NA NA NA","https://twitter.com/AlbertoBagnai/status/1433321686137458688","Alberto Bagnai","","Professore associato di politica economica all’Università Gabriele d’Annunzio, eletto al Senato per la Lega nel collegio Abruzzo 01.","https://t.co/sC5RvUzmsX",FALSE,126888,666,659,217986,6474,2012-10-12 22:13:36,TRUE,"https://t.co/sC5RvUzmsX","http://www.senato.it/leg/18/BGT/Schede/Attsen/00032582.htm",,"https://pbs.twimg.com/profile_banners/876541483/1535647109","http://abs.twimg.com/images/themes/theme1/bg.png","http://pbs.twimg.com/profile_images/849030859462246401/ATk3_aiW_normal.jpg"
"x876541483","x1433316199513956353",2021-09-02 06:29:46,"AlbertoBagnai","Buongiorno
L'Aquila Basilica di San Bernardino 
#meraviglieditalia 
#essercisempre 
#2settembre https://t.co/aO6vhzLU8n","Twitter for iPhone",139,,,,FALSE,TRUE,0,11,,,"meraviglieditalia essercisempre 2settembre",,,,,"http://pbs.twimg.com/media/E-QnrqWWUAA-1W3.jpg","https://t.co/aO6vhzLU8n","https://twitter.com/poliziadistato/status/1433314214530146309/photo/1","photo","http://pbs.twimg.com/media/E-QnrqWWUAA-1W3.jpg","https://t.co/aO6vhzLU8n","https://twitter.com/poliziadistato/status/1433314214530146309/photo/1",,"x20423071","poliziadistato","it",,,,,,,,,,,,,,,,"x1433314214530146309","Buongiorno
L'Aquila Basilica di San Bernardino 
#meraviglieditalia 
#essercisempre 
#2settembre https://t.co/aO6vhzLU8n",2021-09-02 06:21:53,"Twitter for Android",189,11,"x20423071","poliziadistato","Polizia di Stato",203107,194,11797,"","Profilo ufficiale Polizia di Stato. 
Per emergenze chiama il 113 o recati al più vicino posto di Polizia  
Policy:
https://t.co/V7zKI3qNmN",TRUE,,,,,,,"NA NA","NA NA","NA NA NA NA NA NA NA NA","https://twitter.com/AlbertoBagnai/status/1433316199513956353","Alberto Bagnai","","Professore associato di politica economica all’Università Gabriele d’Annunzio, eletto al Senato per la Lega nel collegio Abruzzo 01.","https://t.co/sC5RvUzmsX",FALSE,126888,666,659,217986,6474,2012-10-12 22:13:36,TRUE,"https://t.co/sC5RvUzmsX","http://www.senato.it/leg/18/BGT/Schede/Attsen/00032582.htm",,"https://pbs.twimg.com/profile_banners/876541483/1535647109","http://abs.twimg.com/images/themes/theme1/bg.png","http://pbs.twimg.com/profile_images/849030859462246401/ATk3_aiW_normal.jpg"
"x876541483","x1433204855095574530",2021-09-01 23:07:19,"AlbertoBagnai","@alfonsoliguor11 @ConteAlmaviva @2631925 @EmpfindsamerS No, di più. E se è bello dipende da come vi comportate… 😇","Twitter for iPhone",57,"x1433204437347192834","x1061995816708124673","alfonsoliguor11",FALSE,FALSE,9,0,,,,,,,,,,,,,,,,"x1061995816708124673 x1365625315 x1683545012 x1024702799215509504","alfonsoliguor11 ConteAlmaviva 2631925 EmpfindsamerS","it",,,,,,,,,,,,,,,,,,,,,,,,,,,,,,,,,,,,,"NA NA","NA NA","NA NA NA NA NA NA NA NA","https://twitter.com/AlbertoBagnai/status/1433204855095574530","Alberto Bagnai","","Professore associato di politica economica all’Università Gabriele d’Annunzio, eletto al Senato per la Lega nel collegio Abruzzo 01.","https://t.co/sC5RvUzmsX",FALSE,126888,666,659,217986,6474,2012-10-12 22:13:36,TRUE,"https://t.co/sC5RvUzmsX","http://www.senato.it/leg/18/BGT/Schede/Attsen/00032582.htm",,"https://pbs.twimg.com/profile_banners/876541483/1535647109","http://abs.twimg.com/images/themes/theme1/bg.png","http://pbs.twimg.com/profile_images/849030859462246401/ATk3_aiW_normal.jpg"
"x876541483","x1433204279247048707",2021-09-01 23:05:02,"AlbertoBagnai","Sono tempi bui, ideali per riguardarsi “L’Invasione degli Ultracorpi”, il capolavoro originale del 1956, quello con la regia di Don Siegel.
#InvasioneDegliUltracorpi #film #GreenpassObbligatorio https://t.co/UvBLiaXO16","Twitter for iPhone",140,,,,FALSE,TRUE,0,14,,,,,,,,,,,,,,,,"x3433441480","metellodsrosa","it",,,,,,,,,,,,,,,,"x1433201437023121412","Sono tempi bui, ideali per riguardarsi “L’Invasione degli Ultracorpi”, il capolavoro originale del 1956, quello con la regia di Don Siegel.
#InvasioneDegliUltracorpi #film #GreenpassObbligatorio https://t.co/UvBLiaXO16",2021-09-01 22:53:44,"Twitter for iPhone",52,14,"x3433441480","metellodsrosa","Metello Di Santarosa",3837,2888,11567,"Atahualpa, Ecuador","Anarco-sandinista, carbonaro, shintoista, seguace di Bodhidharma, amico di Paperoga e collega di Gommaflex. Per hobby invento nuove religioni",FALSE,,,,,,,"NA NA","NA NA","NA NA NA NA NA NA NA NA","https://twitter.com/AlbertoBagnai/status/1433204279247048707","Alberto Bagnai","","Professore associato di politica economica all’Università Gabriele d’Annunzio, eletto al Senato per la Lega nel collegio Abruzzo 01.","https://t.co/sC5RvUzmsX",FALSE,126888,666,659,217986,6474,2012-10-12 22:13:36,TRUE,"https://t.co/sC5RvUzmsX","http://www.senato.it/leg/18/BGT/Schede/Attsen/00032582.htm",,"https://pbs.twimg.com/profile_banners/876541483/1535647109","http://abs.twimg.com/images/themes/theme1/bg.png","http://pbs.twimg.com/profile_images/849030859462246401/ATk3_aiW_normal.jpg"
"x876541483","x1433204109235130369",2021-09-01 23:04:21,"AlbertoBagnai","Se fossi un procuratore della Repubblica mi occuperei prioritariamente di chi propone (con ampio risalto mediatico) di far pagare le cure ai non vaccinati, o di chi propone di ""sfamarli col piombo"".
Un esagitato e squinternato che tira cazzotti si sistema in fretta col CP.","Twitter for iPhone",140,,,,FALSE,TRUE,0,162,,,,,,,,,,,,,,,,"x589418956","giuslit","it",,,,,,,,,,,,,,,,"x1433021822715318273","Se fossi un procuratore della Repubblica mi occuperei prioritariamente di chi propone (con ampio risalto mediatico) di far pagare le cure ai non vaccinati, o di chi propone di ""sfamarli col piombo"".
Un esagitato e squinternato che tira cazzotti si sistema in fretta col CP.",2021-09-01 11:00:01,"Twitter Web App",549,162,"x589418956","giuslit","Ora Basta",20672,868,60424,"Bari, Italy","Commercialista di Bari [cit.]",FALSE,,,,,,,"NA NA","NA NA","NA NA NA NA NA NA NA NA","https://twitter.com/AlbertoBagnai/status/1433204109235130369","Alberto Bagnai","","Professore associato di politica economica all’Università Gabriele d’Annunzio, eletto al Senato per la Lega nel collegio Abruzzo 01.","https://t.co/sC5RvUzmsX",FALSE,126888,666,659,217986,6474,2012-10-12 22:13:36,TRUE,"https://t.co/sC5RvUzmsX","http://www.senato.it/leg/18/BGT/Schede/Attsen/00032582.htm",,"https://pbs.twimg.com/profile_banners/876541483/1535647109","http://abs.twimg.com/images/themes/theme1/bg.png","http://pbs.twimg.com/profile_images/849030859462246401/ATk3_aiW_normal.jpg"
"x876541483","x1433201196014112770",2021-09-01 22:52:47,"AlbertoBagnai","#MaloreImprovviso 
Stroncato da un malore a 53 anni: addio a Caianiello, re degli eventi https://t.co/1Ik3L0EE4K","Twitter for iPhone",125,,,,FALSE,TRUE,0,26,,,"MaloreImprovviso",,"salernotoday.it/cronaca/malore…","https://t.co/1Ik3L0EE4K","https://www.salernotoday.it/cronaca/malore-morto-corrado-caianiello-salerno.html",,,,,,,,,"x1224996284","Sercit1","it",,,,,,,,,,,,,,,,"x1433199285659648002","#MaloreImprovviso 
Stroncato da un malore a 53 anni: addio a Caianiello, re degli eventi https://t.co/1Ik3L0EE4K",2021-09-01 22:45:11,"Twitter Web App",50,26,"x1224996284","Sercit1","Ser Ci",1114,1571,90371,"","Se dite che i social network sono pieni di stupidaggini, state seguendo le persone sbagliate",FALSE,,,,,,,"NA NA","NA NA","NA NA NA NA NA NA NA NA","https://twitter.com/AlbertoBagnai/status/1433201196014112770","Alberto Bagnai","","Professore associato di politica economica all’Università Gabriele d’Annunzio, eletto al Senato per la Lega nel collegio Abruzzo 01.","https://t.co/sC5RvUzmsX",FALSE,126888,666,659,217986,6474,2012-10-12 22:13:36,TRUE,"https://t.co/sC5RvUzmsX","http://www.senato.it/leg/18/BGT/Schede/Attsen/00032582.htm",,"https://pbs.twimg.com/profile_banners/876541483/1535647109","http://abs.twimg.com/images/themes/theme1/bg.png","http://pbs.twimg.com/profile_images/849030859462246401/ATk3_aiW_normal.jpg"
"x876541483","x1433200366578028549",2021-09-01 22:49:29,"AlbertoBagnai","Noi ne abbiamo tirati giù 15 milioni pare con la salmonella: https://t.co/3K1Q56RCtT, ma loro ogni anno grazie al loro tabacco ne fanno fuori più di 250.000 (https://t.co/kW58393r3F). Diciamo che si sono vendicati ampiamente.","Twitter for iPhone",225,"x1433198863368720384","x876541483","AlbertoBagnai",FALSE,FALSE,47,6,,,,,"ilpost.it/2018/01/17/epi… lungcancereurope.eu/wp-content/upl…","https://t.co/3K1Q56RCtT https://t.co/kW58393r3F","https://www.ilpost.it/2018/01/17/epidemia-salmonella-aztechi-1545/ https://www.lungcancereurope.eu/wp-content/uploads/2017/10/LuCE-Report-final.pdf",,,,,,,,,,,"it",,,,,,,,,,,,,,,,,,,,,,,,,,,,,,,,,,,,,"NA NA","NA NA","NA NA NA NA NA NA NA NA","https://twitter.com/AlbertoBagnai/status/1433200366578028549","Alberto Bagnai","","Professore associato di politica economica all’Università Gabriele d’Annunzio, eletto al Senato per la Lega nel collegio Abruzzo 01.","https://t.co/sC5RvUzmsX",FALSE,126888,666,659,217986,6474,2012-10-12 22:13:36,TRUE,"https://t.co/sC5RvUzmsX","http://www.senato.it/leg/18/BGT/Schede/Attsen/00032582.htm",,"https://pbs.twimg.com/profile_banners/876541483/1535647109","http://abs.twimg.com/images/themes/theme1/bg.png","http://pbs.twimg.com/profile_images/849030859462246401/ATk3_aiW_normal.jpg"
"x876541483","x1433197899974905862",2021-09-01 22:39:41,"AlbertoBagnai","@ConteAlmaviva @2631925 @EmpfindsamerS @alfonsoliguor11 Ma bisogna anche sapere che l’occhio di Bagnai ti segue ovunque.","Twitter for iPhone",64,"x1433197343034200065","x1365625315","ConteAlmaviva",FALSE,FALSE,6,0,,,,,,,,,,,,,,,,"x1365625315 x1683545012 x1024702799215509504 x1061995816708124673","ConteAlmaviva 2631925 EmpfindsamerS alfonsoliguor11","it",,,,,,,,,,,,,,,,,,,,,,,,,,,,,,,,,,,,,"NA NA","NA NA","NA NA NA NA NA NA NA NA","https://twitter.com/AlbertoBagnai/status/1433197899974905862","Alberto Bagnai","","Professore associato di politica economica all’Università Gabriele d’Annunzio, eletto al Senato per la Lega nel collegio Abruzzo 01.","https://t.co/sC5RvUzmsX",FALSE,126888,666,659,217986,6474,2012-10-12 22:13:36,TRUE,"https://t.co/sC5RvUzmsX","http://www.senato.it/leg/18/BGT/Schede/Attsen/00032582.htm",,"https://pbs.twimg.com/profile_banners/876541483/1535647109","http://abs.twimg.com/images/themes/theme1/bg.png","http://pbs.twimg.com/profile_images/849030859462246401/ATk3_aiW_normal.jpg"
"x876541483","x1433197074510659585",2021-09-01 22:36:24,"AlbertoBagnai","@ConteAlmaviva @2631925 @EmpfindsamerS @alfonsoliguor11 Però “ciccione di Halle” è ©️.","Twitter for iPhone",30,"x1433195421980053509","x1365625315","ConteAlmaviva",FALSE,FALSE,10,0,,,,,,,,,,,,,,,,"x1365625315 x1683545012 x1024702799215509504 x1061995816708124673","ConteAlmaviva 2631925 EmpfindsamerS alfonsoliguor11","it",,,,,,,,,,,,,,,,,,,,,,,,,,,,,,,,,,,,,"NA NA","NA NA","NA NA NA NA NA NA NA NA","https://twitter.com/AlbertoBagnai/status/1433197074510659585","Alberto Bagnai","","Professore associato di politica economica all’Università Gabriele d’Annunzio, eletto al Senato per la Lega nel collegio Abruzzo 01.","https://t.co/sC5RvUzmsX",FALSE,126888,666,659,217986,6474,2012-10-12 22:13:36,TRUE,"https://t.co/sC5RvUzmsX","http://www.senato.it/leg/18/BGT/Schede/Attsen/00032582.htm",,"https://pbs.twimg.com/profile_banners/876541483/1535647109","http://abs.twimg.com/images/themes/theme1/bg.png","http://pbs.twimg.com/profile_images/849030859462246401/ATk3_aiW_normal.jpg"
