"user_id","status_id","created_at","screen_name","text","source","display_text_width","reply_to_status_id","reply_to_user_id","reply_to_screen_name","is_quote","is_retweet","favorite_count","retweet_count","quote_count","reply_count","hashtags","symbols","urls_url","urls_t.co","urls_expanded_url","media_url","media_t.co","media_expanded_url","media_type","ext_media_url","ext_media_t.co","ext_media_expanded_url","ext_media_type","mentions_user_id","mentions_screen_name","lang","quoted_status_id","quoted_text","quoted_created_at","quoted_source","quoted_favorite_count","quoted_retweet_count","quoted_user_id","quoted_screen_name","quoted_name","quoted_followers_count","quoted_friends_count","quoted_statuses_count","quoted_location","quoted_description","quoted_verified","retweet_status_id","retweet_text","retweet_created_at","retweet_source","retweet_favorite_count","retweet_retweet_count","retweet_user_id","retweet_screen_name","retweet_name","retweet_followers_count","retweet_friends_count","retweet_statuses_count","retweet_location","retweet_description","retweet_verified","place_url","place_name","place_full_name","place_type","country","country_code","geo_coords","coords_coords","bbox_coords","status_url","name","location","description","url","protected","followers_count","friends_count","listed_count","statuses_count","favourites_count","account_created_at","verified","profile_url","profile_expanded_url","account_lang","profile_banner_url","profile_background_url","profile_image_url"
"x270839361","x1470092494281089032",2021-12-12 18:05:38,"matteosalvinimi","In qualunque Paese al mondo, un imbecille che si filma mentre urina su una macchina della Polizia Locale finirebbe in galera per parecchio tempo. Vediamo se questa “risorsa” in azione a La Spezia andrà dritta in carcere o no. https://t.co/2IL8THmItT","Twitter for iPhone",225,,,,FALSE,FALSE,470,96,,,,,,,,"http://pbs.twimg.com/ext_tw_video_thumb/1470092453692727300/pu/img/OUH2eQucVkLdwxQ8.jpg","https://t.co/2IL8THmItT","https://twitter.com/matteosalvinimi/status/1470092494281089032/video/1","photo","http://pbs.twimg.com/ext_tw_video_thumb/1470092453692727300/pu/img/OUH2eQucVkLdwxQ8.jpg","https://t.co/2IL8THmItT","https://twitter.com/matteosalvinimi/status/1470092494281089032/video/1",,,,"it",,,,,,,,,,,,,,,,,,,,,,,,,,,,,,,,,,,,,"NA NA","NA NA","NA NA NA NA NA NA NA NA","https://twitter.com/matteosalvinimi/status/1470092494281089032","Matteo Salvini","","Leader della Lega #primagliitaliani 🇮🇹","https://t.co/sj3rr6DU3N",FALSE,1430294,2028,3054,52275,3842,2011-03-23 10:32:56,TRUE,"https://t.co/sj3rr6DU3N","https://legaonline.it/",,"https://pbs.twimg.com/profile_banners/270839361/1635585626","http://abs.twimg.com/images/themes/theme1/bg.png","http://pbs.twimg.com/profile_images/966325945060732928/0Ua5xPMX_normal.jpg"
"x997531966571466752","x1470031427194568704",2021-12-12 14:02:58,"Pres_Casellati","Esprimo dolore e vicinanza alle famiglie delle vittime, ai feriti, agli sfollati e a tutta la comunità di #Ravanusa. Sono grata ai soccorritori che lavorano senza sosta per salvare vite umane.
#12dicembre","Twitter for iPhone",204,,,,FALSE,FALSE,54,13,,,"Ravanusa 12dicembre",,,,,,,,,,,,,,,"it",,,,,,,,,,,,,,,,,,,,,,,,,,,,,,,,,,,,,"NA NA","NA NA","NA NA NA NA NA NA NA NA","https://twitter.com/Pres_Casellati/status/1470031427194568704","Maria Elisabetta Alberti Casellati","Roma, Lazio","Presidente del Senato della Repubblica","https://t.co/4xFh9XyLXO",FALSE,13997,515,101,1149,61,2018-05-18 17:38:48,TRUE,"https://t.co/4xFh9XyLXO","https://www.facebook.com/elisabetta.casellati.7",,"https://pbs.twimg.com/profile_banners/997531966571466752/1526665561","http://abs.twimg.com/images/themes/theme1/bg.png","http://pbs.twimg.com/profile_images/997533290520195072/YmnjBO3X_normal.jpg"
"x981514288392294400","x1469967969350569984",2021-12-12 09:50:49,"AnastasiMv5","Ciò che è accaduto questa notte a #Ravanusa è una tragieda immane. Mi stringo alle persone coinvolte e ai famigliari delle vittime. 
Un ringraziamento speciale alle forze dell'ordine e i vigili del fuoco che per tutta la notte hanno lavorato senza sosta per garantire i soccorsi. https://t.co/q3krZe1f7x","Twitter for Android",279,,,,FALSE,FALSE,3,1,,,"Ravanusa",,,,,"http://pbs.twimg.com/media/FGZgE_ZXEAAKSbl.jpg","https://t.co/q3krZe1f7x","https://twitter.com/AnastasiMv5/status/1469967969350569984/photo/1","photo","http://pbs.twimg.com/media/FGZgE_ZXEAAKSbl.jpg","https://t.co/q3krZe1f7x","https://twitter.com/AnastasiMv5/status/1469967969350569984/photo/1",,,,"it",,,,,,,,,,,,,,,,,,,,,,,,,,,,,,,,,,,,,"NA NA","NA NA","NA NA NA NA NA NA NA NA","https://twitter.com/AnastasiMv5/status/1469967969350569984","Cristiano Anastasi","Sicilia, Italia","Portavoce del M5S al Senato della Repubblica


Capo Gruppo Commissione Industria Senato.","https://t.co/QyXaiSTYTX",FALSE,1434,37,22,215,48,2018-04-04 12:50:16,TRUE,"https://t.co/QyXaiSTYTX","https://www.ilblogdellestelle.it/",,"https://pbs.twimg.com/profile_banners/981514288392294400/1559048001","http://abs.twimg.com/images/themes/theme1/bg.png","http://pbs.twimg.com/profile_images/981517957867167747/uuiLqAXA_normal.jpg"
"x2900717633","x1469987525980831747",2021-12-12 11:08:31,"BrunoAstorre","Le immagini e le notizie che arrivano da #Ravanusa sono drammatiche. 
Il mio abbraccio a tutte le famiglie delle vittime e a tutti coloro che, in un attimo, hanno perso tutto. Non ci sono parole, una vera tragedia","Twitter for iPhone",213,,,,FALSE,FALSE,13,4,,,"Ravanusa",,,,,,,,,,,,,,,"it",,,,,,,,,,,,,,,,,,,,,,,,,,,,,,,,,,,,,"NA NA","NA NA","NA NA NA NA NA NA NA NA","https://twitter.com/BrunoAstorre/status/1469987525980831747","Bruno Astorre","","Senatore del PD. Membro Direzione nazionale PD. Provengo da una scuola che interpreta la politica come strumento, non come fine.","https://t.co/r8sKGpcczb",FALSE,1655,195,30,1961,144,2014-12-01 15:48:11,TRUE,"https://t.co/r8sKGpcczb","http://www.brunoastorre.it",,"https://pbs.twimg.com/profile_banners/2900717633/1546257168","http://abs.twimg.com/images/themes/theme1/bg.png","http://pbs.twimg.com/profile_images/1058727872578371589/FY_KiON0_normal.jpg"
"x101602652","x1470057743772008452",2021-12-12 15:47:33,"augussori","Visita all’azienda agricola San Geminiano di Caselle Lurani.
Coltivazioni di riso, mais e allevamento di 5000 suini con annesso spaccio per la vendita diretta dei loro ottimi prodotti. Esperienza e passione dalla famiglia Lanzi ne fanno una delle più importanti realtà lodigiane. https://t.co/R8umumIuWG","Twitter for iPhone",279,,,,FALSE,FALSE,1,0,,,,,,,,"http://pbs.twimg.com/media/FGaxt8lX0AY6Q8z.jpg","https://t.co/R8umumIuWG","https://twitter.com/augussori/status/1470057743772008452/photo/1","photo","http://pbs.twimg.com/media/FGaxt8lX0AY6Q8z.jpg http://pbs.twimg.com/media/FGaxt8rXoAMlXr6.jpg","https://t.co/R8umumIuWG https://t.co/R8umumIuWG","https://twitter.com/augussori/status/1470057743772008452/photo/1 https://twitter.com/augussori/status/1470057743772008452/photo/1",,,,"it",,,,,,,,,,,,,,,,,,,,,,,,,,,,,,,,,,,,,"NA NA","NA NA","NA NA NA NA NA NA NA NA","https://twitter.com/augussori/status/1470057743772008452","Luigi Augussori","Lodi, Lombardy","Profilo del sen. Luigi Augussori, rappresentante lodigiano nel Senato della Repubblica per il gruppo Lega - Salvini Premier. https://t.co/RVDZN85Ue5","https://t.co/494Lk5LQeR",FALSE,968,785,16,3269,329,2010-01-03 23:39:00,TRUE,"https://t.co/494Lk5LQeR","http://www.senato.it/leg/18/BGT/Schede/Attsen/00019244.htm",,"https://pbs.twimg.com/profile_banners/101602652/1536334347","http://abs.twimg.com/images/themes/theme1/bg.png","http://pbs.twimg.com/profile_images/1397968025198989317/FpsdhGWL_normal.jpg"
"x876541483","x1470281132109357061",2021-12-13 06:35:13,"AlbertoBagnai","@Ariannapomozzi @AlbertoBagnai Se è impossibile perché @UnipolSai_CRP offre polizze contro i danni da vaccino ?","Twitter for iPhone",132,,,,FALSE,TRUE,0,5,,,,,,,,,,,,,,,,"x1456223505213759489 x1060148282 x876541483 x3401617943","AlessandroLod18 Ariannapomozzi AlbertoBagnai UnipolSai_CRP","it",,,,,,,,,,,,,,,,"x1470156996980756481","@Ariannapomozzi @AlbertoBagnai Se è impossibile perché @UnipolSai_CRP offre polizze contro i danni da vaccino ?",2021-12-12 22:21:56,"Twitter for Android",29,5,"x1456223505213759489","AlessandroLod18","Alessandro Lodi",123,173,4018,"","",FALSE,,,,,,,"NA NA","NA NA","NA NA NA NA NA NA NA NA","https://twitter.com/AlbertoBagnai/status/1470281132109357061","Alberto Bagnai","","Professore associato di politica economica all’Università Gabriele d’Annunzio, eletto al Senato per la Lega nel collegio Abruzzo 01.","https://t.co/sC5RvUzmsX",FALSE,129405,666,656,220681,6463,2012-10-12 22:13:36,TRUE,"https://t.co/sC5RvUzmsX","http://www.senato.it/leg/18/BGT/Schede/Attsen/00032582.htm",,"https://pbs.twimg.com/profile_banners/876541483/1535647109","http://abs.twimg.com/images/themes/theme1/bg.png","http://pbs.twimg.com/profile_images/849030859462246401/ATk3_aiW_normal.jpg"
"x876541483","x1470280867448864771",2021-12-13 06:34:09,"AlbertoBagnai","Non vorrei fare il menagramo, ma sapete già che poi - col pretesto del superamento delle soglie di smog e PM10 - vi impediranno pure di prendere l'auto...
#GreenFuck https://t.co/N9idmx1OfN","Twitter for iPhone",140,,,,FALSE,TRUE,0,68,,,,,,,,,,,,,,,,"x1388854795","QLexPipiens","it",,,,,,,,,,,,,,,,"x1470021401616789518","Non vorrei fare il menagramo, ma sapete già che poi - col pretesto del superamento delle soglie di smog e PM10 - vi impediranno pure di prendere l'auto...
#GreenFuck https://t.co/N9idmx1OfN",2021-12-12 13:23:08,"Twitter for Android",248,68,"x1388854795","QLexPipiens","Culex Pipiens Molestus 🏴‍☠️",6674,844,107935,"","Mi dicono che sono tuttosubitìsta, ma è solo che non mi piacciono certi preliminari.",FALSE,,,,,,,"NA NA","NA NA","NA NA NA NA NA NA NA NA","https://twitter.com/AlbertoBagnai/status/1470280867448864771","Alberto Bagnai","","Professore associato di politica economica all’Università Gabriele d’Annunzio, eletto al Senato per la Lega nel collegio Abruzzo 01.","https://t.co/sC5RvUzmsX",FALSE,129405,666,656,220681,6463,2012-10-12 22:13:36,TRUE,"https://t.co/sC5RvUzmsX","http://www.senato.it/leg/18/BGT/Schede/Attsen/00032582.htm",,"https://pbs.twimg.com/profile_banners/876541483/1535647109","http://abs.twimg.com/images/themes/theme1/bg.png","http://pbs.twimg.com/profile_images/849030859462246401/ATk3_aiW_normal.jpg"
"x876541483","x1470280622568579075",2021-12-13 06:33:11,"AlbertoBagnai","Confcommercio: sarà un dicembre tragico. A Firenze è calo record del fatturato: -80%. 

I commercianti erano stati avvisati per tempo da più parti che il loro assecondare il regime li avrebbe portati a chiudere. ... https://t.co/47Tv7B88Td","Twitter for iPhone",140,,,,FALSE,TRUE,0,68,,,,,,,,,,,,,,,,"x960110310530142208","AlexGiudetti","it",,,,,,,,,,,,,,,,"x1469982277786603529","Confcommercio: sarà un dicembre tragico. A Firenze è calo record del fatturato: -80%. 

I commercianti erano stati avvisati per tempo da più parti che il loro assecondare il regime li avrebbe portati a chiudere. ... https://t.co/47Tv7B88Td",2021-12-12 10:47:40,"Twitter for Android",151,68,"x960110310530142208","AlexGiudetti","G4M3 0V3R",4546,4864,134834,"","🕶 Non credo di aver bisogno di presentazioni. 🐸🇮🇹🇩🇪🇺🇲

aggiungo una cosa.... ho il click facilissimo...",FALSE,,,,,,,"NA NA","NA NA","NA NA NA NA NA NA NA NA","https://twitter.com/AlbertoBagnai/status/1470280622568579075","Alberto Bagnai","","Professore associato di politica economica all’Università Gabriele d’Annunzio, eletto al Senato per la Lega nel collegio Abruzzo 01.","https://t.co/sC5RvUzmsX",FALSE,129405,666,656,220681,6463,2012-10-12 22:13:36,TRUE,"https://t.co/sC5RvUzmsX","http://www.senato.it/leg/18/BGT/Schede/Attsen/00032582.htm",,"https://pbs.twimg.com/profile_banners/876541483/1535647109","http://abs.twimg.com/images/themes/theme1/bg.png","http://pbs.twimg.com/profile_images/849030859462246401/ATk3_aiW_normal.jpg"
"x876541483","x1470278310953467905",2021-12-13 06:24:00,"AlbertoBagnai","@Nath67Lic @Ariannapomozzi Se uno non vuole o non può capire è mio dovere rispettarlo, e lo rispetto (anche non tentando di convincerlo). Però è anche mio dovere risparmiare tempo. Questa storia non è più affare del potere legislativo. Interverrà coi suoi tempi un altro potere. 👋","Twitter for iPhone",253,"x1470277817560702981","x876541483","AlbertoBagnai",FALSE,FALSE,5,0,,,,,,,,,,,,,,,,"x1183534806 x1060148282","Nath67Lic Ariannapomozzi","it",,,,,,,,,,,,,,,,,,,,,,,,,,,,,,,,,,,,,"NA NA","NA NA","NA NA NA NA NA NA NA NA","https://twitter.com/AlbertoBagnai/status/1470278310953467905","Alberto Bagnai","","Professore associato di politica economica all’Università Gabriele d’Annunzio, eletto al Senato per la Lega nel collegio Abruzzo 01.","https://t.co/sC5RvUzmsX",FALSE,129405,666,656,220681,6463,2012-10-12 22:13:36,TRUE,"https://t.co/sC5RvUzmsX","http://www.senato.it/leg/18/BGT/Schede/Attsen/00032582.htm",,"https://pbs.twimg.com/profile_banners/876541483/1535647109","http://abs.twimg.com/images/themes/theme1/bg.png","http://pbs.twimg.com/profile_images/849030859462246401/ATk3_aiW_normal.jpg"
"x876541483","x1470277817560702981",2021-12-13 06:22:02,"AlbertoBagnai","@Nath67Lic @Ariannapomozzi Proprio perché le persone sono diverse bisogna acquisire una casistica ampia, al fine di stabilire in modo solido quali interazioni con altri farmaci o caratteristiche del paziente consigliano o sconsigliano questa terapia. Ma tu ti confronti con materiale umano simile?","Twitter for iPhone",270,"x1470274729110130689","x1183534806","Nath67Lic",FALSE,FALSE,4,1,,,,,,,,,,,,,,,,"x1183534806 x1060148282","Nath67Lic Ariannapomozzi","it",,,,,,,,,,,,,,,,,,,,,,,,,,,,,,,,,,,,,"NA NA","NA NA","NA NA NA NA NA NA NA NA","https://twitter.com/AlbertoBagnai/status/1470277817560702981","Alberto Bagnai","","Professore associato di politica economica all’Università Gabriele d’Annunzio, eletto al Senato per la Lega nel collegio Abruzzo 01.","https://t.co/sC5RvUzmsX",FALSE,129405,666,656,220681,6463,2012-10-12 22:13:36,TRUE,"https://t.co/sC5RvUzmsX","http://www.senato.it/leg/18/BGT/Schede/Attsen/00032582.htm",,"https://pbs.twimg.com/profile_banners/876541483/1535647109","http://abs.twimg.com/images/themes/theme1/bg.png","http://pbs.twimg.com/profile_images/849030859462246401/ATk3_aiW_normal.jpg"
"x876541483","x1470153812287672323",2021-12-12 22:09:17,"AlbertoBagnai","Il confronto all’americana funziona anche in Italia, come si è visto qui: https://t.co/6nDLS2dHYD. “Un’altra Commissione è possibile”, su #goofynomics | https://t.co/EIcva6e1xz.","Twitter for iPhone",177,,,,FALSE,FALSE,152,56,,,"goofynomics",,"ilriformista.it/morte-david-ro… goofynomics.blogspot.com/2021/12/unaltr…","https://t.co/6nDLS2dHYD https://t.co/EIcva6e1xz","https://www.ilriformista.it/morte-david-rossi-la-deposizione-del-colonnello-aglieco-getta-nuove-ombre-sul-mistero-del-suicidio-del-capo-della-comunicazione-di-mps-266620/ https://goofynomics.blogspot.com/2021/12/unaltra-commissione-e-possibile.html",,,,,,,,,,,"it",,,,,,,,,,,,,,,,,,,,,,,,,,,,,,,,,,,,,"NA NA","NA NA","NA NA NA NA NA NA NA NA","https://twitter.com/AlbertoBagnai/status/1470153812287672323","Alberto Bagnai","","Professore associato di politica economica all’Università Gabriele d’Annunzio, eletto al Senato per la Lega nel collegio Abruzzo 01.","https://t.co/sC5RvUzmsX",FALSE,129405,666,656,220681,6463,2012-10-12 22:13:36,TRUE,"https://t.co/sC5RvUzmsX","http://www.senato.it/leg/18/BGT/Schede/Attsen/00032582.htm",,"https://pbs.twimg.com/profile_banners/876541483/1535647109","http://abs.twimg.com/images/themes/theme1/bg.png","http://pbs.twimg.com/profile_images/849030859462246401/ATk3_aiW_normal.jpg"
"x876541483","x1470152014143307778",2021-12-12 22:02:08,"AlbertoBagnai","@AlbertoBagnai D'altronde qualcuno si è (casualmente) accorto che la prudenza non è mai troppa.
""I viaggiatori provenienti dall'estero dovranno, indipendentemente dal loro stato di vaccinazione, presentare un tampone con esito negativo fatto 24 ore prima dell'arrivo.""
https://t.co/OY5F4KleNA","Twitter for iPhone",140,,,,FALSE,TRUE,0,20,,,,,,,,,,,,,,,,"x2545184177 x876541483","FeliceAquila AlbertoBagnai","it",,,,,,,,,,,,,,,,"x1470134645627015172","@AlbertoBagnai D'altronde qualcuno si è (casualmente) accorto che la prudenza non è mai troppa.
""I viaggiatori provenienti dall'estero dovranno, indipendentemente dal loro stato di vaccinazione, presentare un tampone con esito negativo fatto 24 ore prima dell'arrivo.""
https://t.co/OY5F4KleNA",2021-12-12 20:53:07,"Twitter Web App",50,20,"x2545184177","FeliceAquila","Davide Giovanni",842,182,53343,"Lazio, Italia","Bajo las águilas silenciosas, a inmensidad carece de significado.  

[Antonio Gamoneda]",FALSE,,,,,,,"NA NA","NA NA","NA NA NA NA NA NA NA NA","https://twitter.com/AlbertoBagnai/status/1470152014143307778","Alberto Bagnai","","Professore associato di politica economica all’Università Gabriele d’Annunzio, eletto al Senato per la Lega nel collegio Abruzzo 01.","https://t.co/sC5RvUzmsX",FALSE,129405,666,656,220681,6463,2012-10-12 22:13:36,TRUE,"https://t.co/sC5RvUzmsX","http://www.senato.it/leg/18/BGT/Schede/Attsen/00032582.htm",,"https://pbs.twimg.com/profile_banners/876541483/1535647109","http://abs.twimg.com/images/themes/theme1/bg.png","http://pbs.twimg.com/profile_images/849030859462246401/ATk3_aiW_normal.jpg"
"x876541483","x1470118258951041031",2021-12-12 19:48:01,"AlbertoBagnai","Secondo, è omicidio (doloso, colposo, preterintenzionale) anche con una sola vittima. Quindi il problema non sono i numeri, se non nella misura in cui evidentemente li si sta occultando, ma i ruoli. Incombe ad AIFA gestire la farmacovigilanza. Lo sta facendo bene? 👋","Twitter for iPhone",266,"x1470117583575785484","x876541483","AlbertoBagnai",FALSE,FALSE,504,139,,,,,,,,,,,,,,,,,,"it",,,,,,,,,,,,,,,,,,,,,,,,,,,,,,,,,,,,,"NA NA","NA NA","NA NA NA NA NA NA NA NA","https://twitter.com/AlbertoBagnai/status/1470118258951041031","Alberto Bagnai","","Professore associato di politica economica all’Università Gabriele d’Annunzio, eletto al Senato per la Lega nel collegio Abruzzo 01.","https://t.co/sC5RvUzmsX",FALSE,129405,666,656,220681,6463,2012-10-12 22:13:36,TRUE,"https://t.co/sC5RvUzmsX","http://www.senato.it/leg/18/BGT/Schede/Attsen/00032582.htm",,"https://pbs.twimg.com/profile_banners/876541483/1535647109","http://abs.twimg.com/images/themes/theme1/bg.png","http://pbs.twimg.com/profile_images/849030859462246401/ATk3_aiW_normal.jpg"
"x876541483","x1470117583575785484",2021-12-12 19:45:20,"AlbertoBagnai","Come poi ho spiegato a Magrini, il discorso “ci sono 136000 morti di COVID, per il vaccino solo 608” non ha molto senso, per almeno un paio di motivi. Primo: l’AIFA si occupa di sicurezza dei farmaci, quindi il suo problema non sono i 136000 ma i 608.","Twitter for iPhone",251,"x1470116671314665473","x876541483","AlbertoBagnai",FALSE,FALSE,484,120,,,,,,,,,,,,,,,,,,"it",,,,,,,,,,,,,,,,,,,,,,,,,,,,,,,,,,,,,"NA NA","NA NA","NA NA NA NA NA NA NA NA","https://twitter.com/AlbertoBagnai/status/1470117583575785484","Alberto Bagnai","","Professore associato di politica economica all’Università Gabriele d’Annunzio, eletto al Senato per la Lega nel collegio Abruzzo 01.","https://t.co/sC5RvUzmsX",FALSE,129405,666,656,220681,6463,2012-10-12 22:13:36,TRUE,"https://t.co/sC5RvUzmsX","http://www.senato.it/leg/18/BGT/Schede/Attsen/00032582.htm",,"https://pbs.twimg.com/profile_banners/876541483/1535647109","http://abs.twimg.com/images/themes/theme1/bg.png","http://pbs.twimg.com/profile_images/849030859462246401/ATk3_aiW_normal.jpg"
"x876541483","x1470114428213411846",2021-12-12 19:32:47,"AlbertoBagnai","La furia censoria adesso si abbatte anche su un dato scientifico inoppugnabile. Twitter bannerà chi dice che i vaccinati possono diffondere il virus. Come si chiamavano quelle verità che per non decadere avevano bisogno di tappare la bocca a chi le discuteva? Verità o dogmi? https://t.co/DbLa60q4ib","Twitter for iPhone",140,,,,FALSE,TRUE,0,333,,,,,,,,,,,,,,,,"x1313965595507986434","MessoraClaudio","it",,,,,,,,,,,,,,,,"x1469773437132582914","La furia censoria adesso si abbatte anche su un dato scientifico inoppugnabile. Twitter bannerà chi dice che i vaccinati possono diffondere il virus. Come si chiamavano quelle verità che per non decadere avevano bisogno di tappare la bocca a chi le discuteva? Verità o dogmi? https://t.co/DbLa60q4ib",2021-12-11 20:57:49,"Twitter for Android",587,333,"x1313965595507986434","MessoraClaudio","Claudio Messora",10636,232,1908,"","Editore di @byoblu. Tutta la storia è nelle librerie: cerca ""Il Disallineato"": https://t.co/rZHKk29eTq",FALSE,,,,,,,"NA NA","NA NA","NA NA NA NA NA NA NA NA","https://twitter.com/AlbertoBagnai/status/1470114428213411846","Alberto Bagnai","","Professore associato di politica economica all’Università Gabriele d’Annunzio, eletto al Senato per la Lega nel collegio Abruzzo 01.","https://t.co/sC5RvUzmsX",FALSE,129405,666,656,220681,6463,2012-10-12 22:13:36,TRUE,"https://t.co/sC5RvUzmsX","http://www.senato.it/leg/18/BGT/Schede/Attsen/00032582.htm",,"https://pbs.twimg.com/profile_banners/876541483/1535647109","http://abs.twimg.com/images/themes/theme1/bg.png","http://pbs.twimg.com/profile_images/849030859462246401/ATk3_aiW_normal.jpg"
"x876541483","x1470109615224500228",2021-12-12 19:13:40,"AlbertoBagnai","In Francia il prezzo spot dell’elettricità ha toccato i 300 eur/MWh https://t.co/2ikpHTmxsI https://t.co/qyRL7Ak0Wm","Twitter for iPhone",107,,,,FALSE,TRUE,0,19,,,,,,,,,,,,,,,,"x304899193","TCommodity","it",,,,,,,,,,,,,,,,"x1470107058498383881","In Francia il prezzo spot dell’elettricità ha toccato i 300 eur/MWh https://t.co/2ikpHTmxsI https://t.co/qyRL7Ak0Wm",2021-12-12 19:03:30,"Twitter for iPhone",48,19,"x304899193","TCommodity","Gianclaudio Torlizzi",7893,359,26596,"Rome-Milan","Fondatore di T-Commodity. Autore di #MateriaRara. https://t.co/DEa4hlHyZn",FALSE,,,,,,,"NA NA","NA NA","NA NA NA NA NA NA NA NA","https://twitter.com/AlbertoBagnai/status/1470109615224500228","Alberto Bagnai","","Professore associato di politica economica all’Università Gabriele d’Annunzio, eletto al Senato per la Lega nel collegio Abruzzo 01.","https://t.co/sC5RvUzmsX",FALSE,129405,666,656,220681,6463,2012-10-12 22:13:36,TRUE,"https://t.co/sC5RvUzmsX","http://www.senato.it/leg/18/BGT/Schede/Attsen/00032582.htm",,"https://pbs.twimg.com/profile_banners/876541483/1535647109","http://abs.twimg.com/images/themes/theme1/bg.png","http://pbs.twimg.com/profile_images/849030859462246401/ATk3_aiW_normal.jpg"
"x876541483","x1470105485642768397",2021-12-12 18:57:15,"AlbertoBagnai","@redflat Basterebbe…","Twitter for iPhone",11,"x1470105150568251396","x69696487","redflat",FALSE,FALSE,12,0,,,,,,,,,,,,,,,,"x69696487","redflat","it",,,,,,,,,,,,,,,,,,,,,,,,,,,,,,,,,,,,,"NA NA","NA NA","NA NA NA NA NA NA NA NA","https://twitter.com/AlbertoBagnai/status/1470105485642768397","Alberto Bagnai","","Professore associato di politica economica all’Università Gabriele d’Annunzio, eletto al Senato per la Lega nel collegio Abruzzo 01.","https://t.co/sC5RvUzmsX",FALSE,129405,666,656,220681,6463,2012-10-12 22:13:36,TRUE,"https://t.co/sC5RvUzmsX","http://www.senato.it/leg/18/BGT/Schede/Attsen/00032582.htm",,"https://pbs.twimg.com/profile_banners/876541483/1535647109","http://abs.twimg.com/images/themes/theme1/bg.png","http://pbs.twimg.com/profile_images/849030859462246401/ATk3_aiW_normal.jpg"
"x876541483","x1470105421499310087",2021-12-12 18:57:00,"AlbertoBagnai","#Saviano contro la #Meloni: ""#Atreju è un personaggio di sinistra"" https://t.co/Sttxysvwbr","Twitter for iPhone",109,,,,FALSE,TRUE,0,126,,,"Saviano Meloni Atreju",,,,,"http://pbs.twimg.com/media/FGbcknGWQA4RhrB.jpg","https://t.co/Sttxysvwbr","https://twitter.com/lefrasidiosho/status/1470105173179645955/photo/1","photo","http://pbs.twimg.com/media/FGbcknGWQA4RhrB.jpg","https://t.co/Sttxysvwbr","https://twitter.com/lefrasidiosho/status/1470105173179645955/photo/1",,"x3096871079","lefrasidiosho","it",,,,,,,,,,,,,,,,"x1470105173179645955","#Saviano contro la #Meloni: ""#Atreju è un personaggio di sinistra"" https://t.co/Sttxysvwbr",2021-12-12 18:56:01,"Twitter Web App",1000,126,"x3096871079","lefrasidiosho","Le frasi di Osho",476199,590,11474,"Roma, Lazio","Spina nel fianco",FALSE,,,,,,,"NA NA","NA NA","NA NA NA NA NA NA NA NA","https://twitter.com/AlbertoBagnai/status/1470105421499310087","Alberto Bagnai","","Professore associato di politica economica all’Università Gabriele d’Annunzio, eletto al Senato per la Lega nel collegio Abruzzo 01.","https://t.co/sC5RvUzmsX",FALSE,129405,666,656,220681,6463,2012-10-12 22:13:36,TRUE,"https://t.co/sC5RvUzmsX","http://www.senato.it/leg/18/BGT/Schede/Attsen/00032582.htm",,"https://pbs.twimg.com/profile_banners/876541483/1535647109","http://abs.twimg.com/images/themes/theme1/bg.png","http://pbs.twimg.com/profile_images/849030859462246401/ATk3_aiW_normal.jpg"
