"x636328779","x1476785388652015642",2021-12-31 05:20:48,"AlexBazzaro","Su @atlanticomag @MiloMatte: altro che “normalità”, siamo al “fine emergenza Mai”

https://t.co/OJZrb9VIm0","Twitter for iPhone",121,,,,FALSE,TRUE,0,61,,,,,"atlanticoquotidiano.it/quotidiano/202…","https://t.co/OJZrb9VIm0","https://www.atlanticoquotidiano.it/quotidiano/2021-con-draghi-dalla-promessa-di-normalita-al-fine-emergenza-mai/",,,,,,,,,"x144210805 x953235107741085696 x1098319161221095424","Capezzone atlanticomag MiloMatte","it",,,,,,,,,,,,,,,,"x1476784124954357777","Su @atlanticomag @MiloMatte: altro che “normalità”, siamo al “fine emergenza Mai”

https://t.co/OJZrb9VIm0",2021-12-31 05:15:47,"Twitter for iPhone",247,61,"x144210805","Capezzone","Daniele Capezzone",137819,3358,51329,"","Atlantista, liberale classico. @LaVeritaWeb e #LaVeritaAlleSette. @MercatusI e @AtlanticoMag. In tv su Mediaset. @RadioGloboFm. #PerUnaNuovaDestra🗽",FALSE,,,,,,,"NA NA","NA NA","NA NA NA NA NA NA NA NA","https://twitter.com/AlexBazzaro/status/1476785388652015642","Alex Bazzaro","Venezia ","🇮🇹Deputato Lega, Commissione XIV 🇪🇺 🦁Consigliere Comunale Venezia. ✈️ Delegazione @OSCE Liberale e libertario","https://t.co/yXFTMiY4b3",FALSE,2807,510,36,13017,5897,2012-07-15 15:20:42,TRUE,"https://t.co/yXFTMiY4b3","https://www.camera.it/leg18/29?shadow_deputato=307696&idpersona=307696&idlegislatura=18",,"https://pbs.twimg.com/profile_banners/636328779/1457208495","http://abs.twimg.com/images/themes/theme1/bg.png","http://pbs.twimg.com/profile_images/1315654416171753472/1PG-DcXJ_normal.jpg"
"x636328779","x1476785337364066314",2021-12-31 05:20:36,"AlexBazzaro","Su @atlanticomag @DelpapaMax contro la stretta finale del 5 gennaio 

https://t.co/GwBNPZDB0o","Twitter for iPhone",108,,,,FALSE,TRUE,0,253,,,,,"atlanticoquotidiano.it/quotidiano/il-…","https://t.co/GwBNPZDB0o","https://www.atlanticoquotidiano.it/quotidiano/il-regime-nel-bunker-prepara-la-stretta-finale-per-il-5-gennaio-e-ora-di-dire-basta/",,,,,,,,,"x144210805 x953235107741085696 x1325811912513368068","Capezzone atlanticomag DelpapaMax","it",,,,,,,,,,,,,,,,"x1476783541530865676","Su @atlanticomag @DelpapaMax contro la stretta finale del 5 gennaio 

https://t.co/GwBNPZDB0o",2021-12-31 05:13:28,"Twitter for iPhone",634,253,"x144210805","Capezzone","Daniele Capezzone",137819,3358,51329,"","Atlantista, liberale classico. @LaVeritaWeb e #LaVeritaAlleSette. @MercatusI e @AtlanticoMag. In tv su Mediaset. @RadioGloboFm. #PerUnaNuovaDestra🗽",FALSE,,,,,,,"NA NA","NA NA","NA NA NA NA NA NA NA NA","https://twitter.com/AlexBazzaro/status/1476785337364066314","Alex Bazzaro","Venezia ","🇮🇹Deputato Lega, Commissione XIV 🇪🇺 🦁Consigliere Comunale Venezia. ✈️ Delegazione @OSCE Liberale e libertario","https://t.co/yXFTMiY4b3",FALSE,2807,510,36,13017,5897,2012-07-15 15:20:42,TRUE,"https://t.co/yXFTMiY4b3","https://www.camera.it/leg18/29?shadow_deputato=307696&idpersona=307696&idlegislatura=18",,"https://pbs.twimg.com/profile_banners/636328779/1457208495","http://abs.twimg.com/images/themes/theme1/bg.png","http://pbs.twimg.com/profile_images/1315654416171753472/1PG-DcXJ_normal.jpg"
"x636328779","x1476784879979409433",2021-12-31 05:18:47,"AlexBazzaro","La “maggioranza” dei cittadini ha accettato lockdown e coprifuoco. È iniziata lì. Quando si è rimasti zitti dì fronte ai runner segnalati dai vicini, alla gente in spiaggia da sola multata, e al virus che usciva alle h23.01. Magari perché si era tra quelli a casa e stipendiati…","Twitter for iPhone",278,,,,FALSE,FALSE,412,92,,,,,,,,,,,,,,,,,,"it",,,,,,,,,,,,,,,,,,,,,,,,,,,,,,,"https://api.twitter.com/1.1/geo/id/0af3b7ebabdf70af.json","Venice","Venice, Veneto","city","Italy","IT","NA NA","NA NA","12.1667704 12.5966178 12.5966178 12.1667704 45.2304183 45.2304183 45.5779025 45.5779025","https://twitter.com/AlexBazzaro/status/1476784879979409433","Alex Bazzaro","Venezia ","🇮🇹Deputato Lega, Commissione XIV 🇪🇺 🦁Consigliere Comunale Venezia. ✈️ Delegazione @OSCE Liberale e libertario","https://t.co/yXFTMiY4b3",FALSE,2807,510,36,13017,5897,2012-07-15 15:20:42,TRUE,"https://t.co/yXFTMiY4b3","https://www.camera.it/leg18/29?shadow_deputato=307696&idpersona=307696&idlegislatura=18",,"https://pbs.twimg.com/profile_banners/636328779/1457208495","http://abs.twimg.com/images/themes/theme1/bg.png","http://pbs.twimg.com/profile_images/1315654416171753472/1PG-DcXJ_normal.jpg"
"x636328779","x1476700087120187400",2021-12-30 23:41:51,"AlexBazzaro","Me le ricordavo migliori le frasi dei baci perugina. https://t.co/2j6iCL5x62","Twitter for iPhone",52,,,,FALSE,FALSE,32,8,,,,,,,,"http://pbs.twimg.com/media/FH5K5soX0AYFBQw.jpg","https://t.co/2j6iCL5x62","https://twitter.com/AlexBazzaro/status/1476700087120187400/photo/1","photo","http://pbs.twimg.com/media/FH5K5soX0AYFBQw.jpg","https://t.co/2j6iCL5x62","https://twitter.com/AlexBazzaro/status/1476700087120187400/photo/1",,,,"it",,,,,,,,,,,,,,,,,,,,,,,,,,,,,,,"https://api.twitter.com/1.1/geo/id/0af3b7ebabdf70af.json","Venice","Venice, Veneto","city","Italy","IT","NA NA","NA NA","12.1667704 12.5966178 12.5966178 12.1667704 45.2304183 45.2304183 45.5779025 45.5779025","https://twitter.com/AlexBazzaro/status/1476700087120187400","Alex Bazzaro","Venezia ","🇮🇹Deputato Lega, Commissione XIV 🇪🇺 🦁Consigliere Comunale Venezia. ✈️ Delegazione @OSCE Liberale e libertario","https://t.co/yXFTMiY4b3",FALSE,2807,510,36,13017,5897,2012-07-15 15:20:42,TRUE,"https://t.co/yXFTMiY4b3","https://www.camera.it/leg18/29?shadow_deputato=307696&idpersona=307696&idlegislatura=18",,"https://pbs.twimg.com/profile_banners/636328779/1457208495","http://abs.twimg.com/images/themes/theme1/bg.png","http://pbs.twimg.com/profile_images/1315654416171753472/1PG-DcXJ_normal.jpg"
"x636328779","x1476699448323543043",2021-12-30 23:39:18,"AlexBazzaro","Stato*","Twitter for iPhone",6,"x1476695938487959557","x636328779","AlexBazzaro",FALSE,FALSE,4,0,,,,,,,,,,,,,,,,,,"it",,,,,,,,,,,,,,,,,,,,,,,,,,,,,,,"https://api.twitter.com/1.1/geo/id/0af3b7ebabdf70af.json","Venice","Venice, Veneto","city","Italy","IT","NA NA","NA NA","12.1667704 12.5966178 12.5966178 12.1667704 45.2304183 45.2304183 45.5779025 45.5779025","https://twitter.com/AlexBazzaro/status/1476699448323543043","Alex Bazzaro","Venezia ","🇮🇹Deputato Lega, Commissione XIV 🇪🇺 🦁Consigliere Comunale Venezia. ✈️ Delegazione @OSCE Liberale e libertario","https://t.co/yXFTMiY4b3",FALSE,2807,510,36,13017,5897,2012-07-15 15:20:42,TRUE,"https://t.co/yXFTMiY4b3","https://www.camera.it/leg18/29?shadow_deputato=307696&idpersona=307696&idlegislatura=18",,"https://pbs.twimg.com/profile_banners/636328779/1457208495","http://abs.twimg.com/images/themes/theme1/bg.png","http://pbs.twimg.com/profile_images/1315654416171753472/1PG-DcXJ_normal.jpg"
"x636328779","x1476696841030934537",2021-12-30 23:28:57,"AlexBazzaro","Un Paese unito, nell’ipocondria.","Twitter for iPhone",32,,,,FALSE,FALSE,374,37,,,,,,,,,,,,,,,,,,"it",,,,,,,,,,,,,,,,,,,,,,,,,,,,,,,"https://api.twitter.com/1.1/geo/id/0af3b7ebabdf70af.json","Venice","Venice, Veneto","city","Italy","IT","NA NA","NA NA","12.1667704 12.5966178 12.5966178 12.1667704 45.2304183 45.2304183 45.5779025 45.5779025","https://twitter.com/AlexBazzaro/status/1476696841030934537","Alex Bazzaro","Venezia ","🇮🇹Deputato Lega, Commissione XIV 🇪🇺 🦁Consigliere Comunale Venezia. ✈️ Delegazione @OSCE Liberale e libertario","https://t.co/yXFTMiY4b3",FALSE,2807,510,36,13017,5897,2012-07-15 15:20:42,TRUE,"https://t.co/yXFTMiY4b3","https://www.camera.it/leg18/29?shadow_deputato=307696&idpersona=307696&idlegislatura=18",,"https://pbs.twimg.com/profile_banners/636328779/1457208495","http://abs.twimg.com/images/themes/theme1/bg.png","http://pbs.twimg.com/profile_images/1315654416171753472/1PG-DcXJ_normal.jpg"
"x636328779","x1476685231692394506",2021-12-30 22:42:49,"AlexBazzaro","Una statua. #rey ❤️ https://t.co/G74mYQrycH","Twitter for iPhone",19,,,,FALSE,FALSE,35,0,,,"rey",,,,,"http://pbs.twimg.com/media/FH49YxRX0AcqMcy.jpg","https://t.co/G74mYQrycH","https://twitter.com/AlexBazzaro/status/1476685231692394506/photo/1","photo","http://pbs.twimg.com/media/FH49YxRX0AcqMcy.jpg","https://t.co/G74mYQrycH","https://twitter.com/AlexBazzaro/status/1476685231692394506/photo/1",,,,"it",,,,,,,,,,,,,,,,,,,,,,,,,,,,,,,,,,,,,"NA NA","NA NA","NA NA NA NA NA NA NA NA","https://twitter.com/AlexBazzaro/status/1476685231692394506","Alex Bazzaro","Venezia ","🇮🇹Deputato Lega, Commissione XIV 🇪🇺 🦁Consigliere Comunale Venezia. ✈️ Delegazione @OSCE Liberale e libertario","https://t.co/yXFTMiY4b3",FALSE,2807,510,36,13017,5897,2012-07-15 15:20:42,TRUE,"https://t.co/yXFTMiY4b3","https://www.camera.it/leg18/29?shadow_deputato=307696&idpersona=307696&idlegislatura=18",,"https://pbs.twimg.com/profile_banners/636328779/1457208495","http://abs.twimg.com/images/themes/theme1/bg.png","http://pbs.twimg.com/profile_images/1315654416171753472/1PG-DcXJ_normal.jpg"
"x636328779","x1476654087219425284",2021-12-30 20:39:03,"AlexBazzaro","Hanno la “narrazione” e no, non si fermeranno. Non la smetteranno dì insultare e diffondere notizie volutamente artefatte. Capiscono i numeri. Di piazza, di vendite, di spazi pubblicitari e di protesta politica. O cambiano quelli o avere ragione, ma senza giustizia, sarà inutile.","Twitter for iPhone",280,,,,FALSE,FALSE,42,5,,,,,,,,,,,,,,,,,,"it",,,,,,,,,,,,,,,,,,,,,,,,,,,,,,,"https://api.twitter.com/1.1/geo/id/0af3b7ebabdf70af.json","Venice","Venice, Veneto","city","Italy","IT","NA NA","NA NA","12.1667704 12.5966178 12.5966178 12.1667704 45.2304183 45.2304183 45.5779025 45.5779025","https://twitter.com/AlexBazzaro/status/1476654087219425284","Alex Bazzaro","Venezia ","🇮🇹Deputato Lega, Commissione XIV 🇪🇺 🦁Consigliere Comunale Venezia. ✈️ Delegazione @OSCE Liberale e libertario","https://t.co/yXFTMiY4b3",FALSE,2807,510,36,13017,5897,2012-07-15 15:20:42,TRUE,"https://t.co/yXFTMiY4b3","https://www.camera.it/leg18/29?shadow_deputato=307696&idpersona=307696&idlegislatura=18",,"https://pbs.twimg.com/profile_banners/636328779/1457208495","http://abs.twimg.com/images/themes/theme1/bg.png","http://pbs.twimg.com/profile_images/1315654416171753472/1PG-DcXJ_normal.jpg"
"x636328779","x1476650040273866756",2021-12-30 20:22:59,"AlexBazzaro","@Andunedhel Volentieri","Twitter for iPhone",10,"x1476647484239843334","x1222886635","Andunedhel",FALSE,FALSE,2,0,,,,,,,,,,,,,,,,"x1222886635","Andunedhel","es",,,,,,,,,,,,,,,,,,,,,,,,,,,,,,,"https://api.twitter.com/1.1/geo/id/0af3b7ebabdf70af.json","Venice","Venice, Veneto","city","Italy","IT","NA NA","NA NA","12.1667704 12.5966178 12.5966178 12.1667704 45.2304183 45.2304183 45.5779025 45.5779025","https://twitter.com/AlexBazzaro/status/1476650040273866756","Alex Bazzaro","Venezia ","🇮🇹Deputato Lega, Commissione XIV 🇪🇺 🦁Consigliere Comunale Venezia. ✈️ Delegazione @OSCE Liberale e libertario","https://t.co/yXFTMiY4b3",FALSE,2807,510,36,13017,5897,2012-07-15 15:20:42,TRUE,"https://t.co/yXFTMiY4b3","https://www.camera.it/leg18/29?shadow_deputato=307696&idpersona=307696&idlegislatura=18",,"https://pbs.twimg.com/profile_banners/636328779/1457208495","http://abs.twimg.com/images/themes/theme1/bg.png","http://pbs.twimg.com/profile_images/1315654416171753472/1PG-DcXJ_normal.jpg"
"x636328779","x1476637993494622209",2021-12-30 19:35:06,"AlexBazzaro","@Csigalotti @s_ruggeri79 Sigalotti perché mi fa perdere tempo? Se con l'80% di vaccinati siamo a 130mila casi, se le regioni più vaccinate sono quelle con più contagi quale altra evidenza vuole per dire che ci si contagia di più con il vaccino? Sarà per il falso senso di sicurezza, non lo so, ma è così.","Twitter for iPhone",140,,,,FALSE,TRUE,0,121,,,,,,,,,,,,,,,,"x337767301 x3106098617 x1234391628","borghi_claudio Csigalotti s_ruggeri79","it",,,,,,,,,,,,,,,,"x1476633082279215120","@Csigalotti @s_ruggeri79 Sigalotti perché mi fa perdere tempo? Se con l'80% di vaccinati siamo a 130mila casi, se le regioni più vaccinate sono quelle con più contagi quale altra evidenza vuole per dire che ci si contagia di più con il vaccino? Sarà per il falso senso di sicurezza, non lo so, ma è così.",2021-12-30 19:15:35,"Twitter for Android",424,121,"x337767301","borghi_claudio","Claudio Borghi A.",123668,1336,217115,"Italia","Deputato della Repubblica Italiana eletto in Toscana per la Lega. Consigliere Comunale di Como",TRUE,,,,,,,"NA NA","NA NA","NA NA NA NA NA NA NA NA","https://twitter.com/AlexBazzaro/status/1476637993494622209","Alex Bazzaro","Venezia ","🇮🇹Deputato Lega, Commissione XIV 🇪🇺 🦁Consigliere Comunale Venezia. ✈️ Delegazione @OSCE Liberale e libertario","https://t.co/yXFTMiY4b3",FALSE,2807,510,36,13017,5897,2012-07-15 15:20:42,TRUE,"https://t.co/yXFTMiY4b3","https://www.camera.it/leg18/29?shadow_deputato=307696&idpersona=307696&idlegislatura=18",,"https://pbs.twimg.com/profile_banners/636328779/1457208495","http://abs.twimg.com/images/themes/theme1/bg.png","http://pbs.twimg.com/profile_images/1315654416171753472/1PG-DcXJ_normal.jpg"
"x636328779","x1476628212037955584",2021-12-30 18:56:14,"AlexBazzaro","Qualche politico e qualche direttore di giornale nostrano potrebbe trovarlo un modello interessante. https://t.co/pGqHXF14Eo","Twitter for iPhone",100,,,,FALSE,FALSE,12,0,,,,,,,,"http://pbs.twimg.com/media/FH4Jh3QX0AgbI7x.jpg","https://t.co/pGqHXF14Eo","https://twitter.com/AlexBazzaro/status/1476628212037955584/photo/1","photo","http://pbs.twimg.com/media/FH4Jh3QX0AgbI7x.jpg","https://t.co/pGqHXF14Eo","https://twitter.com/AlexBazzaro/status/1476628212037955584/photo/1",,,,"it",,,,,,,,,,,,,,,,,,,,,,,,,,,,,,,"https://api.twitter.com/1.1/geo/id/0af3b7ebabdf70af.json","Venice","Venice, Veneto","city","Italy","IT","NA NA","NA NA","12.1667704 12.5966178 12.5966178 12.1667704 45.2304183 45.2304183 45.5779025 45.5779025","https://twitter.com/AlexBazzaro/status/1476628212037955584","Alex Bazzaro","Venezia ","🇮🇹Deputato Lega, Commissione XIV 🇪🇺 🦁Consigliere Comunale Venezia. ✈️ Delegazione @OSCE Liberale e libertario","https://t.co/yXFTMiY4b3",FALSE,2807,510,36,13017,5897,2012-07-15 15:20:42,TRUE,"https://t.co/yXFTMiY4b3","https://www.camera.it/leg18/29?shadow_deputato=307696&idpersona=307696&idlegislatura=18",,"https://pbs.twimg.com/profile_banners/636328779/1457208495","http://abs.twimg.com/images/themes/theme1/bg.png","http://pbs.twimg.com/profile_images/1315654416171753472/1PG-DcXJ_normal.jpg"
"x106673706","x1476847275456532480",2021-12-31 09:26:43,"massimobitonci","@Cassand42523175 @trevize17 @LegaSalvini @LegaCamera @Lega_Senato @matteosalvinimi @Stefanicamera @A_Gusmeroli @AlbertoRibolla @GiulioCentemero @LaCavandoli @rebeccafrassini …. Terrapiattista ….😂","Twitter for iPhone",21,"x1476844056105963537","x1348350961312530432","Cassand42523175",FALSE,FALSE,0,0,,,,,,,,,,,,,,,,"x1348350961312530432 x1193096207675117570 x13514762 x1016715966405804032 x973159484376875009 x270839361 x1237851561331527688 x878620152253886464 x585991438 x960185954807025666 x215187433 x454797927","Cassand42523175 trevize17 LegaSalvini LegaCamera Lega_Senato matteosalvinimi Stefanicamera A_Gusmeroli AlbertoRibolla GiulioCentemero LaCavandoli rebeccafrassini","it",,,,,,,,,,,,,,,,,,,,,,,,,,,,,,,,,,,,,"NA NA","NA NA","NA NA NA NA NA NA NA NA","https://twitter.com/massimobitonci/status/1476847275456532480","Massimo Bitonci","","Veneto on. Lega Salvini - Fondatore LIGA Veneta SP - Capogruppo Bilancio - Capo Dip. Att. Produttive Lega- già Sindaco di Cittadella e Padova - commercialista","https://t.co/kPwsXGqWs8",FALSE,11733,905,96,21197,2144,2010-01-20 08:53:16,TRUE,"https://t.co/kPwsXGqWs8","http://bitonci.it",,"https://pbs.twimg.com/profile_banners/106673706/1520459270","http://abs.twimg.com/images/themes/theme1/bg.png","http://pbs.twimg.com/profile_images/1217032559348961286/R3F9DbBd_normal.jpg"
"x106673706","x1476842083629649932",2021-12-31 09:06:05,"massimobitonci","@Cassand42523175 @trevize17 @LegaSalvini @LegaCamera @Lega_Senato @matteosalvinimi @Stefanicamera @A_Gusmeroli @AlbertoRibolla @GiulioCentemero @LaCavandoli @rebeccafrassini … continui pure a parlare delle scie chimiche, le è più congeniale….","Twitter for iPhone",68,"x1476835829549092883","x1348350961312530432","Cassand42523175",FALSE,FALSE,0,0,,,,,,,,,,,,,,,,"x1348350961312530432 x1193096207675117570 x13514762 x1016715966405804032 x973159484376875009 x270839361 x1237851561331527688 x878620152253886464 x585991438 x960185954807025666 x215187433 x454797927","Cassand42523175 trevize17 LegaSalvini LegaCamera Lega_Senato matteosalvinimi Stefanicamera A_Gusmeroli AlbertoRibolla GiulioCentemero LaCavandoli rebeccafrassini","it",,,,,,,,,,,,,,,,,,,,,,,,,,,,,,,,,,,,,"NA NA","NA NA","NA NA NA NA NA NA NA NA","https://twitter.com/massimobitonci/status/1476842083629649932","Massimo Bitonci","","Veneto on. Lega Salvini - Fondatore LIGA Veneta SP - Capogruppo Bilancio - Capo Dip. Att. Produttive Lega- già Sindaco di Cittadella e Padova - commercialista","https://t.co/kPwsXGqWs8",FALSE,11733,905,96,21197,2144,2010-01-20 08:53:16,TRUE,"https://t.co/kPwsXGqWs8","http://bitonci.it",,"https://pbs.twimg.com/profile_banners/106673706/1520459270","http://abs.twimg.com/images/themes/theme1/bg.png","http://pbs.twimg.com/profile_images/1217032559348961286/R3F9DbBd_normal.jpg"
"x106673706","x1476827455705042944",2021-12-31 08:07:58,"massimobitonci","@trevize17 @LegaSalvini @LegaCamera @Lega_Senato @matteosalvinimi @Stefanicamera @A_Gusmeroli @AlbertoRibolla @GiulioCentemero @LaCavandoli @rebeccafrassini forfettari e altri soggetti individuali sono quasi 3 milioni, gente che lavora … qual’è il problema?","Twitter for iPhone",100,"x1476826563131985939","x1193096207675117570","trevize17",FALSE,FALSE,2,0,,,,,,,,,,,,,,,,"x1193096207675117570 x13514762 x1016715966405804032 x973159484376875009 x270839361 x1237851561331527688 x878620152253886464 x585991438 x960185954807025666 x215187433 x454797927","trevize17 LegaSalvini LegaCamera Lega_Senato matteosalvinimi Stefanicamera A_Gusmeroli AlbertoRibolla GiulioCentemero LaCavandoli rebeccafrassini","it",,,,,,,,,,,,,,,,,,,,,,,,,,,,,,,,,,,,,"NA NA","NA NA","NA NA NA NA NA NA NA NA","https://twitter.com/massimobitonci/status/1476827455705042944","Massimo Bitonci","","Veneto on. Lega Salvini - Fondatore LIGA Veneta SP - Capogruppo Bilancio - Capo Dip. Att. Produttive Lega- già Sindaco di Cittadella e Padova - commercialista","https://t.co/kPwsXGqWs8",FALSE,11733,905,96,21197,2144,2010-01-20 08:53:16,TRUE,"https://t.co/kPwsXGqWs8","http://bitonci.it",,"https://pbs.twimg.com/profile_banners/106673706/1520459270","http://abs.twimg.com/images/themes/theme1/bg.png","http://pbs.twimg.com/profile_images/1217032559348961286/R3F9DbBd_normal.jpg"
"x106673706","x1476820054985658379",2021-12-31 07:38:33,"massimobitonci","@A_Gusmeroli @massimobitonci @AlbertoBagnai @fdragoni @MercatusI @LegaCamera @LegaSalvini Potremmo anche proporre esenzione dei contributi per i primi tre/cinque anni. Sarà lo stato a garantire dei contributi figurativi solo al termine del periodo figurativo.","Twitter for iPhone",140,,,,FALSE,TRUE,0,1,,,,,,,,,,,,,,,,"x2970976971 x878620152253886464 x106673706 x876541483 x51759517 x1367414330048864258 x1016715966405804032 x13514762","pia_nucera A_Gusmeroli massimobitonci AlbertoBagnai fdragoni MercatusI LegaCamera LegaSalvini","it",,,,,,,,,,,,,,,,"x1476810503431278592","@A_Gusmeroli @massimobitonci @AlbertoBagnai @fdragoni @MercatusI @LegaCamera @LegaSalvini Potremmo anche proporre esenzione dei contributi per i primi tre/cinque anni. Sarà lo stato a garantire dei contributi figurativi solo al termine del periodo figurativo.",2021-12-31 07:00:36,"Twitter for iPhone",1,1,"x2970976971","pia_nucera","Pia",403,894,2438,"Rome, Lazio","Dottore Commercialista - Curiosa e in costante ricerca nel vivere. Presidente ADC Associazione Dottori Commercialisti -",FALSE,,,,,,,"NA NA","NA NA","NA NA NA NA NA NA NA NA","https://twitter.com/massimobitonci/status/1476820054985658379","Massimo Bitonci","","Veneto on. Lega Salvini - Fondatore LIGA Veneta SP - Capogruppo Bilancio - Capo Dip. Att. Produttive Lega- già Sindaco di Cittadella e Padova - commercialista","https://t.co/kPwsXGqWs8",FALSE,11733,905,96,21197,2144,2010-01-20 08:53:16,TRUE,"https://t.co/kPwsXGqWs8","http://bitonci.it",,"https://pbs.twimg.com/profile_banners/106673706/1520459270","http://abs.twimg.com/images/themes/theme1/bg.png","http://pbs.twimg.com/profile_images/1217032559348961286/R3F9DbBd_normal.jpg"
"x106673706","x1476820031212343297",2021-12-31 07:38:28,"massimobitonci","Tg1 Bitonci: “la cancellazione dell’IRAP per ditte individuali e professionisti è una misura voluta dalla @LegaSalvini!
@LegaCamera @Lega_Senato @matteosalvinimi @Stefanicamera @AlbertoBagnai @A_Gusmeroli @AlbertoRibolla @GiulioCentemero @LaCavandoli @rebeccafrassini https://t.co/jJisBfneH9","Twitter for iPhone",267,,,,FALSE,FALSE,67,17,,,,,,,,"http://pbs.twimg.com/ext_tw_video_thumb/1476819997431377920/pu/img/dFFNom2yeDu7aUo4.jpg","https://t.co/jJisBfneH9","https://twitter.com/massimobitonci/status/1476820031212343297/video/1","photo","http://pbs.twimg.com/ext_tw_video_thumb/1476819997431377920/pu/img/dFFNom2yeDu7aUo4.jpg","https://t.co/jJisBfneH9","https://twitter.com/massimobitonci/status/1476820031212343297/video/1",,"x13514762 x1016715966405804032 x973159484376875009 x270839361 x1237851561331527688 x876541483 x878620152253886464 x585991438 x960185954807025666 x215187433 x454797927","LegaSalvini LegaCamera Lega_Senato matteosalvinimi Stefanicamera AlbertoBagnai A_Gusmeroli AlbertoRibolla GiulioCentemero LaCavandoli rebeccafrassini","it",,,,,,,,,,,,,,,,,,,,,,,,,,,,,,,,,,,,,"NA NA","NA NA","NA NA NA NA NA NA NA NA","https://twitter.com/massimobitonci/status/1476820031212343297","Massimo Bitonci","","Veneto on. Lega Salvini - Fondatore LIGA Veneta SP - Capogruppo Bilancio - Capo Dip. Att. Produttive Lega- già Sindaco di Cittadella e Padova - commercialista","https://t.co/kPwsXGqWs8",FALSE,11733,905,96,21197,2144,2010-01-20 08:53:16,TRUE,"https://t.co/kPwsXGqWs8","http://bitonci.it",,"https://pbs.twimg.com/profile_banners/106673706/1520459270","http://abs.twimg.com/images/themes/theme1/bg.png","http://pbs.twimg.com/profile_images/1217032559348961286/R3F9DbBd_normal.jpg"
"x106673706","x1476664456092520449",2021-12-30 21:20:16,"massimobitonci","🔵Grazie a Il @Monito 

https://t.co/TYuP2FktIV https://t.co/B7ZHikkw7s","Twitter for iPhone",91,,,,FALSE,TRUE,0,6,,,,,"ilmonito.it/nel-frattempo-…","https://t.co/TYuP2FktIV","https://www.ilmonito.it/nel-frattempo-la-legge-di-bilancio/","http://pbs.twimg.com/media/FH3jlyqWUAc3pXb.jpg","https://t.co/B7ZHikkw7s","https://twitter.com/ManfrediPotenti/status/1476586494072696839/photo/1","photo","http://pbs.twimg.com/media/FH3jlyqWUAc3pXb.jpg","https://t.co/B7ZHikkw7s","https://twitter.com/ManfrediPotenti/status/1476586494072696839/photo/1",,"x1051906012104540161 x1209455455","ManfrediPotenti Monito","it",,,,,,,,,,,,,,,,"x1476586494072696839","🔵Grazie a Il @Monito 

https://t.co/TYuP2FktIV https://t.co/B7ZHikkw7s",2021-12-30 16:10:28,"Twitter for Android",10,6,"x1051906012104540161","ManfrediPotenti","Manfredi Potenti",4981,2022,29785,"Rosignano Marittimo, Toscana","🟡 Deputato Lega Salvini Premier 🟡 Membro II Commissione Giustizia 🟡 Segretario Commissione speciale d' inchiesta Ecoreati 🟡 Vicepres. Commissione MobyPrince",TRUE,,,,,,,"NA NA","NA NA","NA NA NA NA NA NA NA NA","https://twitter.com/massimobitonci/status/1476664456092520449","Massimo Bitonci","","Veneto on. Lega Salvini - Fondatore LIGA Veneta SP - Capogruppo Bilancio - Capo Dip. Att. Produttive Lega- già Sindaco di Cittadella e Padova - commercialista","https://t.co/kPwsXGqWs8",FALSE,11733,905,96,21197,2144,2010-01-20 08:53:16,TRUE,"https://t.co/kPwsXGqWs8","http://bitonci.it",,"https://pbs.twimg.com/profile_banners/106673706/1520459270","http://abs.twimg.com/images/themes/theme1/bg.png","http://pbs.twimg.com/profile_images/1217032559348961286/R3F9DbBd_normal.jpg"
"x337767301","x1476979228289626115",2021-12-31 18:11:03,"borghi_claudio","Se questa differenza non appare con VIOLENTA EVIDENZA c'è un'unica definizione: FALLIMENTO.
Se si sbaglia si chiede scusa e si torna indietro. Non si insiste perché con i diritti delle persone non si gioca.
Buon anno a tutti.","Twitter for Android",225,"x1476979226897170432","x337767301","borghi_claudio",FALSE,FALSE,750,204,,,,,,,,,,,,,,,,,,"it",,,,,,,,,,,,,,,,,,,,,,,,,,,,,,,,,,,,,"NA NA","NA NA","NA NA NA NA NA NA NA NA","https://twitter.com/borghi_claudio/status/1476979228289626115","Claudio Borghi A.","Italia","Deputato della Repubblica Italiana eletto in Toscana per la Lega. Consigliere Comunale di Como","https://t.co/LhQnD0sHz3",FALSE,123668,1336,851,217115,1320,2011-07-18 15:08:25,TRUE,"https://t.co/LhQnD0sHz3","http://tiny.cc/j3065y",,"https://pbs.twimg.com/profile_banners/337767301/1607040672","http://abs.twimg.com/images/themes/theme1/bg.png","http://pbs.twimg.com/profile_images/1449240289/manliorho_-_giusto_normal.jpg"
