"x1557514573","x1444770778705182730",2021-10-03 21:06:10,"elio_vito","@EugenioCardi @esset64 Eh già, si torna sempre al punto di partenza. Buttafuoco ha ricordato una storia vera. Una volta presentarono a Tatarella, il vero artefice di Fiuggi, materiale nostalgico, lo buttò dalla finestra. Si rassicuri, comunque, Meloni è lontana dal fascismo. Grazie per la conversazione","Twitter for iPad",280,"x1444766312727826434","x4702133172","EugenioCardi",FALSE,FALSE,5,0,,,,,,,,,,,,,,,,"x4702133172 x3179961507","EugenioCardi esset64","it",,,,,,,,,,,,,,,,,,,,,,,,,,,,,,,,,,,,,"NA NA","NA NA","NA NA NA NA NA NA NA NA","https://twitter.com/elio_vito/status/1444770778705182730","Elio Vito 🇮🇹🇪🇺🇺🇸","Roma","Deputato @forza_italia. Juventino",,FALSE,12953,14,94,19195,26309,2013-06-30 07:47:38,TRUE,,,,"https://pbs.twimg.com/profile_banners/1557514573/1623834710","http://abs.twimg.com/images/themes/theme1/bg.png","http://pbs.twimg.com/profile_images/736450788659240960/-8W5fQJa_normal.jpg"
"x1557514573","x1444764160223584261",2021-10-03 20:39:52,"elio_vito","@EugenioCardi @esset64 S ho letto, ma non sono d'accordo. Comunque sarebbe un errore attribuire a questo il successo di Meloni e FdI. Inoltre, sarà eccessivo garantismo, va bene, benissimo la libertà d'informazione, per carità è sacrosanta, ma le inchieste sull'opposizione preoccupano sempre un po'.","Twitter for iPad",277,"x1444761934117675013","x4702133172","EugenioCardi",FALSE,FALSE,2,0,,,,,,,,,,,,,,,,"x4702133172 x3179961507","EugenioCardi esset64","it",,,,,,,,,,,,,,,,,,,,,,,,,,,,,,,,,,,,,"NA NA","NA NA","NA NA NA NA NA NA NA NA","https://twitter.com/elio_vito/status/1444764160223584261","Elio Vito 🇮🇹🇪🇺🇺🇸","Roma","Deputato @forza_italia. Juventino",,FALSE,12953,14,94,19195,26309,2013-06-30 07:47:38,TRUE,,,,"https://pbs.twimg.com/profile_banners/1557514573/1623834710","http://abs.twimg.com/images/themes/theme1/bg.png","http://pbs.twimg.com/profile_images/736450788659240960/-8W5fQJa_normal.jpg"
"x1557514573","x1444762658088103950",2021-10-03 20:33:54,"elio_vito","@ErsiPeta @LegaSalvini Ah ok scusi, si ha ragione. Povero Sansonetti, solidarietà anche a lui, chi doveva dirglielo che diventava testimonial della Lega...","Twitter for iPad",132,"x1444761748066783238","x2558807253","ErsiPeta",FALSE,FALSE,4,0,,,,,,,,,,,,,,,,"x2558807253 x13514762","ErsiPeta LegaSalvini","it",,,,,,,,,,,,,,,,,,,,,,,,,,,,,,,,,,,,,"NA NA","NA NA","NA NA NA NA NA NA NA NA","https://twitter.com/elio_vito/status/1444762658088103950","Elio Vito 🇮🇹🇪🇺🇺🇸","Roma","Deputato @forza_italia. Juventino",,FALSE,12953,14,94,19195,26309,2013-06-30 07:47:38,TRUE,,,,"https://pbs.twimg.com/profile_banners/1557514573/1623834710","http://abs.twimg.com/images/themes/theme1/bg.png","http://pbs.twimg.com/profile_images/736450788659240960/-8W5fQJa_normal.jpg"
"x1557514573","x1444762187499704321",2021-10-03 20:32:02,"elio_vito","@RizzoliStefano @acino2020 @lauropistis @SrlArt @tpi @LegaleMeglio @Italia_Freeweed @Casadileo1 @LeDevoteDiMaria @La7tv @RaiUno @RaiTre @RaiPortaaPorta @SkyTG24 @MediasetTgcom24 @PostTg2 Ma sì certo va bene, ci mancherebbe, grazie a lei 🙏","Twitter for iPad",51,"x1444761534362755078","x2704125410","RizzoliStefano",FALSE,FALSE,4,0,,,,,,,,,,,,,,,,"x2704125410 x1252546291999158273 x2359798572 x1382318650846285825 x192854350 x1228291394382553089 x1042435812 x1343266983945629696 x1325875276203569157 x121424128 x1208394690 x1433286055 x406880559 x5893702 x331617619 x1101881237243858944","RizzoliStefano acino2020 lauropistis SrlArt tpi LegaleMeglio Italia_Freeweed Casadileo1 LeDevoteDiMaria La7tv RaiUno RaiTre RaiPortaaPorta SkyTG24 MediasetTgcom24 PostTg2","it",,,,,,,,,,,,,,,,,,,,,,,,,,,,,,,,,,,,,"NA NA","NA NA","NA NA NA NA NA NA NA NA","https://twitter.com/elio_vito/status/1444762187499704321","Elio Vito 🇮🇹🇪🇺🇺🇸","Roma","Deputato @forza_italia. Juventino",,FALSE,12953,14,94,19195,26309,2013-06-30 07:47:38,TRUE,,,,"https://pbs.twimg.com/profile_banners/1557514573/1623834710","http://abs.twimg.com/images/themes/theme1/bg.png","http://pbs.twimg.com/profile_images/736450788659240960/-8W5fQJa_normal.jpg"
"x1557514573","x1444761142220496896",2021-10-03 20:27:53,"elio_vito","@ErsiPeta @LegaSalvini Un vano tentativo di difesa... Poi nel caso di Morisi da cosa? Ha tutta la mia solidarietà! Davvero","Twitter for iPad",99,"x1444760026611077125","x2558807253","ErsiPeta",FALSE,FALSE,0,0,,,,,,,,,,,,,,,,"x2558807253 x13514762","ErsiPeta LegaSalvini","it",,,,,,,,,,,,,,,,,,,,,,,,,,,,,,,,,,,,,"NA NA","NA NA","NA NA NA NA NA NA NA NA","https://twitter.com/elio_vito/status/1444761142220496896","Elio Vito 🇮🇹🇪🇺🇺🇸","Roma","Deputato @forza_italia. Juventino",,FALSE,12953,14,94,19195,26309,2013-06-30 07:47:38,TRUE,,,,"https://pbs.twimg.com/profile_banners/1557514573/1623834710","http://abs.twimg.com/images/themes/theme1/bg.png","http://pbs.twimg.com/profile_images/736450788659240960/-8W5fQJa_normal.jpg"
"x1557514573","x1444760525318021124",2021-10-03 20:25:26,"elio_vito","@EugenioCardi @esset64 Non sono d'accordo. Poi, personalmente, a me non convince nemmeno il neo centrismo leghista.. Bei tempi quelli del federalismo di Bossi ed ora apprezzo le giuste rivendicazioni autonomiste venete. Entrambe le posizioni rigorosamente antifasciste e non di destra","Twitter for iPad",261,"x1444740676525121536","x4702133172","EugenioCardi",FALSE,FALSE,5,0,,,,,,,,,,,,,,,,"x4702133172 x3179961507","EugenioCardi esset64","it",,,,,,,,,,,,,,,,,,,,,,,,,,,,,,,,,,,,,"NA NA","NA NA","NA NA NA NA NA NA NA NA","https://twitter.com/elio_vito/status/1444760525318021124","Elio Vito 🇮🇹🇪🇺🇺🇸","Roma","Deputato @forza_italia. Juventino",,FALSE,12953,14,94,19195,26309,2013-06-30 07:47:38,TRUE,,,,"https://pbs.twimg.com/profile_banners/1557514573/1623834710","http://abs.twimg.com/images/themes/theme1/bg.png","http://pbs.twimg.com/profile_images/736450788659240960/-8W5fQJa_normal.jpg"
"x1557514573","x1444758329016868868",2021-10-03 20:16:42,"elio_vito","@LegaSalvini Ridateci #Morisi","Twitter for iPad",16,"x1444731235369107460","x13514762","LegaSalvini",FALSE,FALSE,81,2,,,"Morisi",,,,,,,,,,,,,"x13514762","LegaSalvini","it",,,,,,,,,,,,,,,,,,,,,,,,,,,,,,,,,,,,,"NA NA","NA NA","NA NA NA NA NA NA NA NA","https://twitter.com/elio_vito/status/1444758329016868868","Elio Vito 🇮🇹🇪🇺🇺🇸","Roma","Deputato @forza_italia. Juventino",,FALSE,12953,14,94,19195,26309,2013-06-30 07:47:38,TRUE,,,,"https://pbs.twimg.com/profile_banners/1557514573/1623834710","http://abs.twimg.com/images/themes/theme1/bg.png","http://pbs.twimg.com/profile_images/736450788659240960/-8W5fQJa_normal.jpg"
"x1557514573","x1444746157805158403",2021-10-03 19:28:20,"elio_vito","@lauropistis @SrlArt @tpi @LegaleMeglio @Italia_Freeweed @Casadileo1 @LeDevoteDiMaria @La7tv @RaiUno @RaiTre @RaiPortaaPorta @SkyTG24 @MediasetTgcom24 @PostTg2 Veramente scelgono loro, si potrebbe lanciare una petizione su change, vogliamo Vito in tv!","Twitter for iPhone",91,"x1444742786574688261","x2359798572","lauropistis",FALSE,FALSE,3,1,,,,,,,,,,,,,,,,"x2359798572 x1382318650846285825 x192854350 x1228291394382553089 x1042435812 x1343266983945629696 x1325875276203569157 x121424128 x1208394690 x1433286055 x406880559 x5893702 x331617619 x1101881237243858944","lauropistis SrlArt tpi LegaleMeglio Italia_Freeweed Casadileo1 LeDevoteDiMaria La7tv RaiUno RaiTre RaiPortaaPorta SkyTG24 MediasetTgcom24 PostTg2","it",,,,,,,,,,,,,,,,,,,,,,,,,,,,,,,,,,,,,"NA NA","NA NA","NA NA NA NA NA NA NA NA","https://twitter.com/elio_vito/status/1444746157805158403","Elio Vito 🇮🇹🇪🇺🇺🇸","Roma","Deputato @forza_italia. Juventino",,FALSE,12953,14,94,19195,26309,2013-06-30 07:47:38,TRUE,,,,"https://pbs.twimg.com/profile_banners/1557514573/1623834710","http://abs.twimg.com/images/themes/theme1/bg.png","http://pbs.twimg.com/profile_images/736450788659240960/-8W5fQJa_normal.jpg"
"x1557514573","x1444745505603526663",2021-10-03 19:25:45,"elio_vito","@enniogiannascol @6dimattina_ Grazie 🙏 ci provo, non è facile","Twitter for iPhone",31,"x1444744807918755841","x719545452","enniogiannascol",FALSE,FALSE,1,0,,,,,,,,,,,,,,,,"x719545452 x3018350015","enniogiannascol 6dimattina_","it",,,,,,,,,,,,,,,,,,,,,,,,,,,,,,,,,,,,,"NA NA","NA NA","NA NA NA NA NA NA NA NA","https://twitter.com/elio_vito/status/1444745505603526663","Elio Vito 🇮🇹🇪🇺🇺🇸","Roma","Deputato @forza_italia. Juventino",,FALSE,12953,14,94,19195,26309,2013-06-30 07:47:38,TRUE,,,,"https://pbs.twimg.com/profile_banners/1557514573/1623834710","http://abs.twimg.com/images/themes/theme1/bg.png","http://pbs.twimg.com/profile_images/736450788659240960/-8W5fQJa_normal.jpg"
"x1557514573","x1444745063297323008",2021-10-03 19:23:59,"elio_vito","@SonoStefanoIT @6dimattina_ Se si è alla la prima segnalazione amministrativa praticamente non ci sono conseguenze. Sulla dipendenza ha ragione ma il proibizionismo non la risolve. E non è detto che un consumo occasionale o sporadico la dia. Poi vi è anche quella da tabacco, alcool, sostanze legali e nocive","Twitter for iPhone",280,"x1444741606146334720","x1344220257481871360","SonoStefanoIT",FALSE,FALSE,4,0,,,,,,,,,,,,,,,,"x1344220257481871360 x3018350015","SonoStefanoIT 6dimattina_","it",,,,,,,,,,,,,,,,,,,,,,,,,,,,,,,,,,,,,"NA NA","NA NA","NA NA NA NA NA NA NA NA","https://twitter.com/elio_vito/status/1444745063297323008","Elio Vito 🇮🇹🇪🇺🇺🇸","Roma","Deputato @forza_italia. Juventino",,FALSE,12953,14,94,19195,26309,2013-06-30 07:47:38,TRUE,,,,"https://pbs.twimg.com/profile_banners/1557514573/1623834710","http://abs.twimg.com/images/themes/theme1/bg.png","http://pbs.twimg.com/profile_images/736450788659240960/-8W5fQJa_normal.jpg"
"x1557514573","x1444743822861348877",2021-10-03 19:19:04,"elio_vito","@Liberoarbitrio @tpi @LegaleMeglio @Italia_Freeweed @Casadileo1 @LeDevoteDiMaria No, credo ci sia un errore pure in questo e nel cognome","Twitter for iPhone",55,"x1444742205839663104","x251307101","Liberoarbitrio",FALSE,FALSE,1,0,,,,,,,,,,,,,,,,"x251307101 x192854350 x1228291394382553089 x1042435812 x1343266983945629696 x1325875276203569157","Liberoarbitrio tpi LegaleMeglio Italia_Freeweed Casadileo1 LeDevoteDiMaria","it",,,,,,,,,,,,,,,,,,,,,,,,,,,,,,,,,,,,,"NA NA","NA NA","NA NA NA NA NA NA NA NA","https://twitter.com/elio_vito/status/1444743822861348877","Elio Vito 🇮🇹🇪🇺🇺🇸","Roma","Deputato @forza_italia. Juventino",,FALSE,12953,14,94,19195,26309,2013-06-30 07:47:38,TRUE,,,,"https://pbs.twimg.com/profile_banners/1557514573/1623834710","http://abs.twimg.com/images/themes/theme1/bg.png","http://pbs.twimg.com/profile_images/736450788659240960/-8W5fQJa_normal.jpg"
"x1557514573","x1444743411534282764",2021-10-03 19:17:26,"elio_vito","@enniogiannascol @6dimattina_ La vogliamo affrontare seriamente questa discussione? Oggi FI ed il M5S sono nello stesso governo. Si sarebbe potuto fare lo stesso nel 2018 e la legislatura sarebbe andata diversamente. Chi non ci ha voluto? Non Conte che ebbe un ottimo incontro con FI e SB, ma Salvini e Di Maio","Twitter for iPhone",280,"x1444740811418218504","x719545452","enniogiannascol",FALSE,FALSE,0,0,,,,,,,,,,,,,,,,"x719545452 x3018350015","enniogiannascol 6dimattina_","it",,,,,,,,,,,,,,,,,,,,,,,,,,,,,,,,,,,,,"NA NA","NA NA","NA NA NA NA NA NA NA NA","https://twitter.com/elio_vito/status/1444743411534282764","Elio Vito 🇮🇹🇪🇺🇺🇸","Roma","Deputato @forza_italia. Juventino",,FALSE,12953,14,94,19195,26309,2013-06-30 07:47:38,TRUE,,,,"https://pbs.twimg.com/profile_banners/1557514573/1623834710","http://abs.twimg.com/images/themes/theme1/bg.png","http://pbs.twimg.com/profile_images/736450788659240960/-8W5fQJa_normal.jpg"
"x1557514573","x1444742112780722190",2021-10-03 19:12:16,"elio_vito","@lauropistis @SrlArt @tpi @LegaleMeglio @Italia_Freeweed @Casadileo1 @LeDevoteDiMaria Beh spero che lo facciano, intanto metto qualche tag 😉@La7tv @RaiUno @RaiTre @RaiPortaaPorta @SkyTG24 @MediasetTgcom24 @PostTg2","Twitter for iPhone",127,"x1444740300082122755","x2359798572","lauropistis",FALSE,FALSE,12,1,,,,,,,,,,,,,,,,"x2359798572 x1382318650846285825 x192854350 x1228291394382553089 x1042435812 x1343266983945629696 x1325875276203569157 x121424128 x1208394690 x1433286055 x406880559 x5893702 x331617619 x1101881237243858944","lauropistis SrlArt tpi LegaleMeglio Italia_Freeweed Casadileo1 LeDevoteDiMaria La7tv RaiUno RaiTre RaiPortaaPorta SkyTG24 MediasetTgcom24 PostTg2","it",,,,,,,,,,,,,,,,,,,,,,,,,,,,,,,,,,,,,"NA NA","NA NA","NA NA NA NA NA NA NA NA","https://twitter.com/elio_vito/status/1444742112780722190","Elio Vito 🇮🇹🇪🇺🇺🇸","Roma","Deputato @forza_italia. Juventino",,FALSE,12953,14,94,19195,26309,2013-06-30 07:47:38,TRUE,,,,"https://pbs.twimg.com/profile_banners/1557514573/1623834710","http://abs.twimg.com/images/themes/theme1/bg.png","http://pbs.twimg.com/profile_images/736450788659240960/-8W5fQJa_normal.jpg"
"x1557514573","x1444740257056968705",2021-10-03 19:04:53,"elio_vito","@SonoStefanoIT @6dimattina_ Poi guardi la mia opinione su Morisi è che la vicenda giudiziaria sia pressoché inesistente. Enorme la questione politica di Salvini e della Lega. Perché si è sospeso? Perché si deve curare? Da cosa? Da omosessualità, da un consumo personale magari occasionale...Quanta ipocrisia!","Twitter for iPhone",280,"x1444739444280545281","x1557514573","elio_vito",FALSE,FALSE,2,1,,,,,,,,,,,,,,,,"x1344220257481871360 x3018350015","SonoStefanoIT 6dimattina_","it",,,,,,,,,,,,,,,,,,,,,,,,,,,,,,,,,,,,,"NA NA","NA NA","NA NA NA NA NA NA NA NA","https://twitter.com/elio_vito/status/1444740257056968705","Elio Vito 🇮🇹🇪🇺🇺🇸","Roma","Deputato @forza_italia. Juventino",,FALSE,12953,14,94,19195,26309,2013-06-30 07:47:38,TRUE,,,,"https://pbs.twimg.com/profile_banners/1557514573/1623834710","http://abs.twimg.com/images/themes/theme1/bg.png","http://pbs.twimg.com/profile_images/736450788659240960/-8W5fQJa_normal.jpg"
"x1557514573","x1444739444280545281",2021-10-03 19:01:40,"elio_vito","@SonoStefanoIT @6dimattina_ Poi era un post politico, ci sta tutto. Ripeto sulla prima parte ha pienamente ragione. Sulla seconda, purtroppo sta “assaggiando” pure lui ingiustamente qualche accostamento giornalistico, ecco mi riferivo a quello.","Twitter for iPhone",216,"x1444738695597367314","x1344220257481871360","SonoStefanoIT",FALSE,FALSE,1,0,,,,,,,,,,,,,,,,"x1344220257481871360 x3018350015","SonoStefanoIT 6dimattina_","it",,,,,,,,,,,,,,,,,,,,,,,,,,,,,,,,,,,,,"NA NA","NA NA","NA NA NA NA NA NA NA NA","https://twitter.com/elio_vito/status/1444739444280545281","Elio Vito 🇮🇹🇪🇺🇺🇸","Roma","Deputato @forza_italia. Juventino",,FALSE,12953,14,94,19195,26309,2013-06-30 07:47:38,TRUE,,,,"https://pbs.twimg.com/profile_banners/1557514573/1623834710","http://abs.twimg.com/images/themes/theme1/bg.png","http://pbs.twimg.com/profile_images/736450788659240960/-8W5fQJa_normal.jpg"
"x1557514573","x1444738783048515590",2021-10-03 18:59:02,"elio_vito","@6dimattina_ 😇","Twitter for iPhone",1,"x1444738464826761218","x3018350015","6dimattina_",FALSE,FALSE,2,0,,,,,,,,,,,,,,,,"x3018350015","6dimattina_","und",,,,,,,,,,,,,,,,,,,,,,,,,,,,,,,,,,,,,"NA NA","NA NA","NA NA NA NA NA NA NA NA","https://twitter.com/elio_vito/status/1444738783048515590","Elio Vito 🇮🇹🇪🇺🇺🇸","Roma","Deputato @forza_italia. Juventino",,FALSE,12953,14,94,19195,26309,2013-06-30 07:47:38,TRUE,,,,"https://pbs.twimg.com/profile_banners/1557514573/1623834710","http://abs.twimg.com/images/themes/theme1/bg.png","http://pbs.twimg.com/profile_images/736450788659240960/-8W5fQJa_normal.jpg"
"x1557514573","x1444738491426951168",2021-10-03 18:57:52,"elio_vito","@zpinningtop @anitablanco3 Caspita, bisognerà chiedere al governo un’altra proroga! ☺️","Twitter for iPhone",59,"x1444572225592598530","x2832708639","zpinningtop",FALSE,FALSE,34,1,,,,,,,,,,,,,,,,"x2832708639 x595314283","zpinningtop anitablanco3","it",,,,,,,,,,,,,,,,,,,,,,,,,,,,,,,,,,,,,"NA NA","NA NA","NA NA NA NA NA NA NA NA","https://twitter.com/elio_vito/status/1444738491426951168","Elio Vito 🇮🇹🇪🇺🇺🇸","Roma","Deputato @forza_italia. Juventino",,FALSE,12953,14,94,19195,26309,2013-06-30 07:47:38,TRUE,,,,"https://pbs.twimg.com/profile_banners/1557514573/1623834710","http://abs.twimg.com/images/themes/theme1/bg.png","http://pbs.twimg.com/profile_images/736450788659240960/-8W5fQJa_normal.jpg"
"x1557514573","x1444738028623253504",2021-10-03 18:56:02,"elio_vito","@anitablanco3 @di_reddito Però è molto carina, ci sta.","Twitter for iPhone",28,"x1444737518683963392","x595314283","anitablanco3",FALSE,FALSE,2,0,,,,,,,,,,,,,,,,"x595314283 x515542672","anitablanco3 di_reddito","it",,,,,,,,,,,,,,,,,,,,,,,,,,,,,,,,,,,,,"NA NA","NA NA","NA NA NA NA NA NA NA NA","https://twitter.com/elio_vito/status/1444738028623253504","Elio Vito 🇮🇹🇪🇺🇺🇸","Roma","Deputato @forza_italia. Juventino",,FALSE,12953,14,94,19195,26309,2013-06-30 07:47:38,TRUE,,,,"https://pbs.twimg.com/profile_banners/1557514573/1623834710","http://abs.twimg.com/images/themes/theme1/bg.png","http://pbs.twimg.com/profile_images/736450788659240960/-8W5fQJa_normal.jpg"
"x1557514573","x1444737732681601030",2021-10-03 18:54:52,"elio_vito","@PulvirentiSarah @redroby5 @tizianamaiolo Non c’è dubbio, ha ragione. Sa che ho firmato la pdl per Bella Ciao e chiesto le dimissioni di Durigon.","Twitter for iPhone",103,"x1444737181663252480","x1132372774612344832","PulvirentiSarah",FALSE,FALSE,1,0,,,,,,,,,,,,,,,,"x1132372774612344832 x1330447615046062081 x454173647","PulvirentiSarah redroby5 tizianamaiolo","it",,,,,,,,,,,,,,,,,,,,,,,,,,,,,,,,,,,,,"NA NA","NA NA","NA NA NA NA NA NA NA NA","https://twitter.com/elio_vito/status/1444737732681601030","Elio Vito 🇮🇹🇪🇺🇺🇸","Roma","Deputato @forza_italia. Juventino",,FALSE,12953,14,94,19195,26309,2013-06-30 07:47:38,TRUE,,,,"https://pbs.twimg.com/profile_banners/1557514573/1623834710","http://abs.twimg.com/images/themes/theme1/bg.png","http://pbs.twimg.com/profile_images/736450788659240960/-8W5fQJa_normal.jpg"
"x2902178505","x1445063608556298248",2021-10-04 16:29:46,"Michele_Anzaldi","Tg1, Salvini divide cuffiette con inviata. Anzaldi: ""I potenti mezzi pagati dal Canone?"" https://t.co/wTMHWUxfhR","Twitter Web App",112,,,,FALSE,FALSE,9,1,,,,,"vigilanzatv.it/tg1-salvini-di…","https://t.co/wTMHWUxfhR","https://www.vigilanzatv.it/tg1-salvini-divide-cuffiette-con-inviata-anzaldi-i-potenti-mezzi-pagati-dal-canone/",,,,,,,,,,,"it",,,,,,,,,,,,,,,,,,,,,,,,,,,,,,,,,,,,,"NA NA","NA NA","NA NA NA NA NA NA NA NA","https://twitter.com/Michele_Anzaldi/status/1445063608556298248","Michele Anzaldi","","Deputato - Commissione parlamentare per l'indirizzo generale e la vigilanza dei servizi radiotelevisivi",,FALSE,11964,922,0,11520,1248,2014-12-02 11:46:02,FALSE,,,,,"http://abs.twimg.com/images/themes/theme1/bg.png","http://pbs.twimg.com/profile_images/540845636435066881/my7kHoUQ_normal.jpeg"
"x2902178505","x1445059479033290752",2021-10-04 16:13:22,"Michele_Anzaldi","Ponte Industria, architetto Rosi: bene Anzaldi, chiamiamolo Ponte delle Donne - Roma – “Reputo ottima la proposta dell’on. Anzaldi che dimostra particolare sensibilità per le donne... - RomaDailyNews https://t.co/QVJlL4zJdB","Twitter Web App",223,,,,FALSE,FALSE,8,5,,,,,"romadailynews.it/politica/ponte…","https://t.co/QVJlL4zJdB","https://www.romadailynews.it/politica/ponte-industria-architetto-rosi-bene-anzaldi-chiamiamolo-ponte-delle-donne-0605129/?share_from=twitter",,,,,,,,,,,"it",,,,,,,,,,,,,,,,,,,,,,,,,,,,,,,,,,,,,"NA NA","NA NA","NA NA NA NA NA NA NA NA","https://twitter.com/Michele_Anzaldi/status/1445059479033290752","Michele Anzaldi","","Deputato - Commissione parlamentare per l'indirizzo generale e la vigilanza dei servizi radiotelevisivi",,FALSE,11964,922,0,11520,1248,2014-12-02 11:46:02,FALSE,,,,,"http://abs.twimg.com/images/themes/theme1/bg.png","http://pbs.twimg.com/profile_images/540845636435066881/my7kHoUQ_normal.jpeg"
"x2902178505","x1445000157255421952",2021-10-04 12:17:38,"Michele_Anzaldi","Roma, l'urbanista Rosi: ""Ottima proposta di Anzaldi per il Ponte delle Donne"" https://t.co/BUbD7A7hLX","Twitter Web App",101,,,,FALSE,FALSE,9,3,,,,,"vigilanzatv.it/roma-lurbanist…","https://t.co/BUbD7A7hLX","https://www.vigilanzatv.it/roma-lurbanista-rosi-ottima-proposta-di-anzaldi-per-il-ponte-delle-donne/",,,,,,,,,,,"it",,,,,,,,,,,,,,,,,,,,,,,,,,,,,,,,,,,,,"NA NA","NA NA","NA NA NA NA NA NA NA NA","https://twitter.com/Michele_Anzaldi/status/1445000157255421952","Michele Anzaldi","","Deputato - Commissione parlamentare per l'indirizzo generale e la vigilanza dei servizi radiotelevisivi",,FALSE,11964,922,0,11520,1248,2014-12-02 11:46:02,FALSE,,,,,"http://abs.twimg.com/images/themes/theme1/bg.png","http://pbs.twimg.com/profile_images/540845636435066881/my7kHoUQ_normal.jpeg"
"x2902178505","x1444928493872156673",2021-10-04 07:32:53,"Michele_Anzaldi","https://t.co/wFpAo9a22a","Twitter Web App",23,,,,FALSE,FALSE,3,0,,,,,"italiaviva.it/silenzio_elett…","https://t.co/wFpAo9a22a","https://www.italiaviva.it/silenzio_elettorale_anzaldi_legge_da_cambiare",,,,,,,,,,,"und",,,,,,,,,,,,,,,,,,,,,,,,,,,,,,,,,,,,,"NA NA","NA NA","NA NA NA NA NA NA NA NA","https://twitter.com/Michele_Anzaldi/status/1444928493872156673","Michele Anzaldi","","Deputato - Commissione parlamentare per l'indirizzo generale e la vigilanza dei servizi radiotelevisivi",,FALSE,11964,922,0,11520,1248,2014-12-02 11:46:02,FALSE,,,,,"http://abs.twimg.com/images/themes/theme1/bg.png","http://pbs.twimg.com/profile_images/540845636435066881/my7kHoUQ_normal.jpeg"
"x2902178505","x1444914793123561473",2021-10-04 06:38:26,"Michele_Anzaldi","Elezioni, Silvio e movimenti pro Raggi violano silenzio. Anzaldi ripropone legge https://t.co/1sQ9gDHWXJ","Twitter Web App",104,,,,FALSE,FALSE,54,20,,,,,"vigilanzatv.it/elezioni-silvi…","https://t.co/1sQ9gDHWXJ","https://www.vigilanzatv.it/elezioni-silvio-e-movimenti-pro-raggi-violano-silenzio-anzaldi-ripropone-legge/",,,,,,,,,,,"it",,,,,,,,,,,,,,,,,,,,,,,,,,,,,,,,,,,,,"NA NA","NA NA","NA NA NA NA NA NA NA NA","https://twitter.com/Michele_Anzaldi/status/1444914793123561473","Michele Anzaldi","","Deputato - Commissione parlamentare per l'indirizzo generale e la vigilanza dei servizi radiotelevisivi",,FALSE,11964,922,0,11520,1248,2014-12-02 11:46:02,FALSE,,,,,"http://abs.twimg.com/images/themes/theme1/bg.png","http://pbs.twimg.com/profile_images/540845636435066881/my7kHoUQ_normal.jpeg"
"x2902178505","x1444773072662323217",2021-10-03 21:15:17,"Michele_Anzaldi","Anzaldi: auguri a fotografo Riccardi peccato Roma non lo festeggi https://t.co/pNU99VrziL","Twitter Web App",89,,,,FALSE,FALSE,1,0,,,,,"askanews.it/politica/2021/…","https://t.co/pNU99VrziL","https://www.askanews.it/politica/2021/10/03/anzaldi-auguri-a-fotografo-riccardi-peccato-roma-non-lo-festeggi-pn_20211003_00061/",,,,,,,,,,,"it",,,,,,,,,,,,,,,,,,,,,,,,,,,,,,,,,,,,,"NA NA","NA NA","NA NA NA NA NA NA NA NA","https://twitter.com/Michele_Anzaldi/status/1444773072662323217","Michele Anzaldi","","Deputato - Commissione parlamentare per l'indirizzo generale e la vigilanza dei servizi radiotelevisivi",,FALSE,11964,922,0,11520,1248,2014-12-02 11:46:02,FALSE,,,,,"http://abs.twimg.com/images/themes/theme1/bg.png","http://pbs.twimg.com/profile_images/540845636435066881/my7kHoUQ_normal.jpeg"
"x2902178505","x1444717502685134848",2021-10-03 17:34:28,"Michele_Anzaldi","Ponte di ferro: Anzaldi, 'diventi Ponte delle Donne in ricordo fucilate da nazisti' https://t.co/YyKypAwuSf","Twitter Web App",107,,,,FALSE,FALSE,18,5,,,,,"iltempo.it/adnkronos/2021…","https://t.co/YyKypAwuSf","https://www.iltempo.it/adnkronos/2021/10/03/news/ponte-di-ferro-anzaldi-diventi-ponte-delle-donne-in-ricordo-fucilate-da-nazisti--28910090/#.YVnpk_KD7Lk.twitter",,,,,,,,,,,"it",,,,,,,,,,,,,,,,,,,,,,,,,,,,,,,,,,,,,"NA NA","NA NA","NA NA NA NA NA NA NA NA","https://twitter.com/Michele_Anzaldi/status/1444717502685134848","Michele Anzaldi","","Deputato - Commissione parlamentare per l'indirizzo generale e la vigilanza dei servizi radiotelevisivi",,FALSE,11964,922,0,11520,1248,2014-12-02 11:46:02,FALSE,,,,,"http://abs.twimg.com/images/themes/theme1/bg.png","http://pbs.twimg.com/profile_images/540845636435066881/my7kHoUQ_normal.jpeg"
"x492325083","x1445059976129654806",2021-10-04 16:15:20,"AnnaAscani","Grande vittoria di @EnricoLetta nel collegio e grandi vittorie nelle città. Il @pdnetwork è forte, ovunque, e saprà affermarsi anche nei ballottaggi, dove abbiamo candidati che avranno la capacità di aggregare in queste due settimane per battere la destra.","Twitter for iPhone",256,,,,FALSE,FALSE,36,6,,,,,,,,,,,,,,,,"x419622371 x13294452","EnricoLetta pdnetwork","it",,,,,,,,,,,,,,,,,,,,,,,,,,,,,,,,,,,,,"NA NA","NA NA","NA NA NA NA NA NA NA NA","https://twitter.com/AnnaAscani/status/1445059976129654806","Anna Ascani","Città di Castello | Roma","Agisci in modo da trattare l'umanità in te come negli altri sempre come fine mai come mezzo | Sottosegretaria @MISE_GOV | VP @pdnetwork | Cattolica, interista","https://t.co/EEvJZIOvLd",FALSE,39244,4680,336,27816,26696,2012-02-14 15:58:03,TRUE,"https://t.co/EEvJZIOvLd","http://www.annaascani.it",,"https://pbs.twimg.com/profile_banners/492325083/1591881409","http://abs.twimg.com/images/themes/theme19/bg.gif","http://pbs.twimg.com/profile_images/971028426755858433/j-iBUMSQ_normal.jpg"
