"user_id","status_id","created_at","screen_name","text","source","display_text_width","reply_to_status_id","reply_to_user_id","reply_to_screen_name","is_quote","is_retweet","favorite_count","retweet_count","quote_count","reply_count","hashtags","symbols","urls_url","urls_t.co","urls_expanded_url","media_url","media_t.co","media_expanded_url","media_type","ext_media_url","ext_media_t.co","ext_media_expanded_url","ext_media_type","mentions_user_id","mentions_screen_name","lang","quoted_status_id","quoted_text","quoted_created_at","quoted_source","quoted_favorite_count","quoted_retweet_count","quoted_user_id","quoted_screen_name","quoted_name","quoted_followers_count","quoted_friends_count","quoted_statuses_count","quoted_location","quoted_description","quoted_verified","retweet_status_id","retweet_text","retweet_created_at","retweet_source","retweet_favorite_count","retweet_retweet_count","retweet_user_id","retweet_screen_name","retweet_name","retweet_followers_count","retweet_friends_count","retweet_statuses_count","retweet_location","retweet_description","retweet_verified","place_url","place_name","place_full_name","place_type","country","country_code","geo_coords","coords_coords","bbox_coords","status_url","name","location","description","url","protected","followers_count","friends_count","listed_count","statuses_count","favourites_count","account_created_at","verified","profile_url","profile_expanded_url","account_lang","profile_banner_url","profile_background_url","profile_image_url"
"x270839361","x1465377498351521797",2021-11-29 17:49:55,"matteosalvinimi","Inoltre chiederemo di inserire nella discussione in Parlamento il tema del nucleare di quarta generazione, ecocompatibile, pulito e che potrà diventare una risorsa per l'Italia del Futuro.","Twitter Web App",188,"x1465377496661204997","x270839361","matteosalvinimi",FALSE,FALSE,15,5,,,,,,,,,,,,,,,,,,"it",,,,,,,,,,,,,,,,,,,,,,,,,,,,,,,,,,,,,"NA NA","NA NA","NA NA NA NA NA NA NA NA","https://twitter.com/matteosalvinimi/status/1465377498351521797","Matteo Salvini","","Leader della Lega #primagliitaliani 🇮🇹","https://t.co/sj3rr6DU3N",FALSE,1428510,2029,3053,52199,3850,2011-03-23 10:32:56,TRUE,"https://t.co/sj3rr6DU3N","https://legaonline.it/",,"https://pbs.twimg.com/profile_banners/270839361/1635585626","http://abs.twimg.com/images/themes/theme1/bg.png","http://pbs.twimg.com/profile_images/966325945060732928/0Ua5xPMX_normal.jpg"
"x270839361","x1465377496661204997",2021-11-29 17:49:55,"matteosalvinimi","Per la Lega un’altra priorità è la riduzione delle bollette di luce e gas per famiglie e imprese, recuperando i fondi dagli sprechi e dai furbetti del Reddito di cittadinanza.","Twitter Web App",175,"x1465377494035578882","x270839361","matteosalvinimi",FALSE,FALSE,16,5,,,,,,,,,,,,,,,,,,"it",,,,,,,,,,,,,,,,,,,,,,,,,,,,,,,,,,,,,"NA NA","NA NA","NA NA NA NA NA NA NA NA","https://twitter.com/matteosalvinimi/status/1465377496661204997","Matteo Salvini","","Leader della Lega #primagliitaliani 🇮🇹","https://t.co/sj3rr6DU3N",FALSE,1428510,2029,3053,52199,3850,2011-03-23 10:32:56,TRUE,"https://t.co/sj3rr6DU3N","https://legaonline.it/",,"https://pbs.twimg.com/profile_banners/270839361/1635585626","http://abs.twimg.com/images/themes/theme1/bg.png","http://pbs.twimg.com/profile_images/966325945060732928/0Ua5xPMX_normal.jpg"
"x270839361","x1465377494035578882",2021-11-29 17:49:54,"matteosalvinimi","Dalla rottamazione delle cartelle esattoriali 2018-2019 all'estensione del tetto della Flat tax fino a 100mila euro di fatturato: al presidente Draghi porteremo proposte di buonsenso per sostenere la ripartenza del Paese. https://t.co/JsOKVpZwZK","Twitter Web App",221,,,,FALSE,FALSE,22,8,,,,,,,,"http://pbs.twimg.com/media/FFYRDVEXEAYamvf.jpg","https://t.co/JsOKVpZwZK","https://twitter.com/matteosalvinimi/status/1465377494035578882/photo/1","photo","http://pbs.twimg.com/media/FFYRDVEXEAYamvf.jpg http://pbs.twimg.com/media/FFYRD0sX0AUkImh.jpg","https://t.co/JsOKVpZwZK https://t.co/JsOKVpZwZK","https://twitter.com/matteosalvinimi/status/1465377494035578882/photo/1 https://twitter.com/matteosalvinimi/status/1465377494035578882/photo/1",,,,"it",,,,,,,,,,,,,,,,,,,,,,,,,,,,,,,,,,,,,"NA NA","NA NA","NA NA NA NA NA NA NA NA","https://twitter.com/matteosalvinimi/status/1465377494035578882","Matteo Salvini","","Leader della Lega #primagliitaliani 🇮🇹","https://t.co/sj3rr6DU3N",FALSE,1428510,2029,3053,52199,3850,2011-03-23 10:32:56,TRUE,"https://t.co/sj3rr6DU3N","https://legaonline.it/",,"https://pbs.twimg.com/profile_banners/270839361/1635585626","http://abs.twimg.com/images/themes/theme1/bg.png","http://pbs.twimg.com/profile_images/966325945060732928/0Ua5xPMX_normal.jpg"
"x270839361","x1465303002827345929",2021-11-29 12:53:54,"matteosalvinimi","MARIA. GIUSEPPE. VIVA IL NATALE. 
Sperando che in Europa nessuno si offenda… https://t.co/hWLmu1i6HI","Twitter for iPhone",76,,,,FALSE,FALSE,1110,170,,,,,,,,"http://pbs.twimg.com/media/FFXNUBqXoAcJN5K.jpg","https://t.co/hWLmu1i6HI","https://twitter.com/matteosalvinimi/status/1465303002827345929/photo/1","photo","http://pbs.twimg.com/media/FFXNUBqXoAcJN5K.jpg","https://t.co/hWLmu1i6HI","https://twitter.com/matteosalvinimi/status/1465303002827345929/photo/1",,,,"it",,,,,,,,,,,,,,,,,,,,,,,,,,,,,,,,,,,,,"NA NA","NA NA","NA NA NA NA NA NA NA NA","https://twitter.com/matteosalvinimi/status/1465303002827345929","Matteo Salvini","","Leader della Lega #primagliitaliani 🇮🇹","https://t.co/sj3rr6DU3N",FALSE,1428510,2029,3053,52199,3850,2011-03-23 10:32:56,TRUE,"https://t.co/sj3rr6DU3N","https://legaonline.it/",,"https://pbs.twimg.com/profile_banners/270839361/1635585626","http://abs.twimg.com/images/themes/theme1/bg.png","http://pbs.twimg.com/profile_images/966325945060732928/0Ua5xPMX_normal.jpg"
"x270839361","x1465074327322300426",2021-11-28 21:45:14,"matteosalvinimi","…famiglie e imprese che pagano il doppio per luce e gas.
E torniamo a parlare di nucleare pulito di ultima generazione, sicuro e green.","Twitter for iPhone",135,"x1465074324910612482","x270839361","matteosalvinimi",FALSE,FALSE,256,30,,,,,,,,,,,,,,,,,,"it",,,,,,,,,,,,,,,,,,,,,,,,,,,,,,,,,,,,,"NA NA","NA NA","NA NA NA NA NA NA NA NA","https://twitter.com/matteosalvinimi/status/1465074327322300426","Matteo Salvini","","Leader della Lega #primagliitaliani 🇮🇹","https://t.co/sj3rr6DU3N",FALSE,1428510,2029,3053,52199,3850,2011-03-23 10:32:56,TRUE,"https://t.co/sj3rr6DU3N","https://legaonline.it/",,"https://pbs.twimg.com/profile_banners/270839361/1635585626","http://abs.twimg.com/images/themes/theme1/bg.png","http://pbs.twimg.com/profile_images/966325945060732928/0Ua5xPMX_normal.jpg"
"x270839361","x1465074324910612482",2021-11-28 21:45:13,"matteosalvinimi","Martedì richiesta ufficiale della delegazione della Lega a Draghi: servono miliardi, subito, per bloccare gli aumenti delle bollette di luce e gas, il resto può aspettare. Impensabile regalare 9 miliardi a troppi furbi ed evasori col Reddito di Cittadinanza, aiutiamo… https://t.co/qcFCG7d6kM","Twitter for iPhone",268,,,,FALSE,FALSE,560,87,,,,,,,,"http://pbs.twimg.com/media/FFT9VOfXMAEB7aa.jpg","https://t.co/qcFCG7d6kM","https://twitter.com/matteosalvinimi/status/1465074324910612482/photo/1","photo","http://pbs.twimg.com/media/FFT9VOfXMAEB7aa.jpg","https://t.co/qcFCG7d6kM","https://twitter.com/matteosalvinimi/status/1465074324910612482/photo/1",,,,"it",,,,,,,,,,,,,,,,,,,,,,,,,,,,,,,,,,,,,"NA NA","NA NA","NA NA NA NA NA NA NA NA","https://twitter.com/matteosalvinimi/status/1465074324910612482","Matteo Salvini","","Leader della Lega #primagliitaliani 🇮🇹","https://t.co/sj3rr6DU3N",FALSE,1428510,2029,3053,52199,3850,2011-03-23 10:32:56,TRUE,"https://t.co/sj3rr6DU3N","https://legaonline.it/",,"https://pbs.twimg.com/profile_banners/270839361/1635585626","http://abs.twimg.com/images/themes/theme1/bg.png","http://pbs.twimg.com/profile_images/966325945060732928/0Ua5xPMX_normal.jpg"
"x270839361","x1465036061399302158",2021-11-28 19:13:10,"matteosalvinimi","Ma solo a me pare una follia??? https://t.co/TA78fTVYhQ","Twitter for iPhone",31,,,,FALSE,FALSE,2327,419,,,,,,,,"http://pbs.twimg.com/media/FFTah_BXoAIdccR.jpg","https://t.co/TA78fTVYhQ","https://twitter.com/matteosalvinimi/status/1465036061399302158/photo/1","photo","http://pbs.twimg.com/media/FFTah_BXoAIdccR.jpg","https://t.co/TA78fTVYhQ","https://twitter.com/matteosalvinimi/status/1465036061399302158/photo/1",,,,"it",,,,,,,,,,,,,,,,,,,,,,,,,,,,,,,,,,,,,"NA NA","NA NA","NA NA NA NA NA NA NA NA","https://twitter.com/matteosalvinimi/status/1465036061399302158","Matteo Salvini","","Leader della Lega #primagliitaliani 🇮🇹","https://t.co/sj3rr6DU3N",FALSE,1428510,2029,3053,52199,3850,2011-03-23 10:32:56,TRUE,"https://t.co/sj3rr6DU3N","https://legaonline.it/",,"https://pbs.twimg.com/profile_banners/270839361/1635585626","http://abs.twimg.com/images/themes/theme1/bg.png","http://pbs.twimg.com/profile_images/966325945060732928/0Ua5xPMX_normal.jpg"
"x48062712","x1465328833146630145",2021-11-29 14:36:32,"luigidimaio","Il Ministro @luigidimaio è in missione a Barcellona per partecipare alla Ministeriale #UE - Vicinato Meridionale 
*
FM Luigi Di Maio is travelling to Barcelona to attend the #EU - Southern Neighbourhood Ministerial Meeting 🇪🇺 https://t.co/1e0lVaq0Ba","Twitter for iPhone",139,,,,FALSE,TRUE,0,8,,,"UE",,,,,,,,,,,,,"x599114492 x48062712","ItalyMFA luigidimaio","it",,,,,,,,,,,,,,,,"x1465323694646083591","Il Ministro @luigidimaio è in missione a Barcellona per partecipare alla Ministeriale #UE - Vicinato Meridionale 
*
FM Luigi Di Maio is travelling to Barcelona to attend the #EU - Southern Neighbourhood Ministerial Meeting 🇪🇺 https://t.co/1e0lVaq0Ba",2021-11-29 14:16:07,"Twitter Web App",23,8,"x599114492","ItalyMFA","Farnesina 🇮🇹",242472,948,14931,"Roma, Italia","Profilo ufficiale del Ministero degli Affari Esteri e della Cooperazione Internazionale | Ministry of Foreign Affairs and International Cooperation of Italy",TRUE,,,,,,,"NA NA","NA NA","NA NA NA NA NA NA NA NA","https://twitter.com/luigidimaio/status/1465328833146630145","Luigi Di Maio","Pomigliano d'Arco, Campania","Ministro degli Affari Esteri e della Cooperazione Internazionale.","https://t.co/D8gkagqksG",FALSE,741852,349,2125,6755,336,2009-06-17 18:34:46,TRUE,"https://t.co/D8gkagqksG","http://www.luigidimaio.it",,"https://pbs.twimg.com/profile_banners/48062712/1634667505","http://abs.twimg.com/images/themes/theme1/bg.png","http://pbs.twimg.com/profile_images/933106806670462976/YyC7LOW8_normal.jpg"
"x48062712","x1465328774220853259",2021-11-29 14:36:18,"luigidimaio","#SGLC | Partecipazione Min @luigidimaio agli #StatiGeneraliLinguaCreatività, dedicati al tema “L'Italiano di domani”

La lingua italiana🇮🇹 strumento fondamentale per la diffusione all’estero della conoscenza del nostro Paese, della sua cultura, dei suoi prodotti e dei suoi valori https://t.co/rSI228VWFg","Twitter for iPhone",140,,,,FALSE,TRUE,0,24,,,"SGLC StatiGeneraliLinguaCreatività",,,,,,,,,,,,,"x599114492 x48062712","ItalyMFA luigidimaio","it",,,,,,,,,,,,,,,,"x1465291793919094789","#SGLC | Partecipazione Min @luigidimaio agli #StatiGeneraliLinguaCreatività, dedicati al tema “L'Italiano di domani”

La lingua italiana🇮🇹 strumento fondamentale per la diffusione all’estero della conoscenza del nostro Paese, della sua cultura, dei suoi prodotti e dei suoi valori https://t.co/rSI228VWFg",2021-11-29 12:09:22,"Twitter Web App",60,24,"x599114492","ItalyMFA","Farnesina 🇮🇹",242472,948,14931,"Roma, Italia","Profilo ufficiale del Ministero degli Affari Esteri e della Cooperazione Internazionale | Ministry of Foreign Affairs and International Cooperation of Italy",TRUE,,,,,,,"NA NA","NA NA","NA NA NA NA NA NA NA NA","https://twitter.com/luigidimaio/status/1465328774220853259","Luigi Di Maio","Pomigliano d'Arco, Campania","Ministro degli Affari Esteri e della Cooperazione Internazionale.","https://t.co/D8gkagqksG",FALSE,741852,349,2125,6755,336,2009-06-17 18:34:46,TRUE,"https://t.co/D8gkagqksG","http://www.luigidimaio.it",,"https://pbs.twimg.com/profile_banners/48062712/1634667505","http://abs.twimg.com/images/themes/theme1/bg.png","http://pbs.twimg.com/profile_images/933106806670462976/YyC7LOW8_normal.jpg"
"x48062712","x1465241080337768449",2021-11-29 08:47:51,"luigidimaio","#SGLC | Il Presidente della Repubblica 🇮🇹, Sergio Mattarella e il Min @luigidimaio aprono gli #StatiGeneraliLinguaCreatività 

🔴Seguici a partire dalle⏰10👇 
https://t.co/YUXEKkGowR

#StatiGenerali #italianoDiDomani https://t.co/joalie2KnK","Twitter for iPhone",139,,,,FALSE,TRUE,0,34,,,"SGLC StatiGeneraliLinguaCreatività",,,,,,,,,,,,,"x599114492 x48062712","ItalyMFA luigidimaio","it",,,,,,,,,,,,,,,,"x1465239896491184130","#SGLC | Il Presidente della Repubblica 🇮🇹, Sergio Mattarella e il Min @luigidimaio aprono gli #StatiGeneraliLinguaCreatività 

🔴Seguici a partire dalle⏰10👇 
https://t.co/YUXEKkGowR

#StatiGenerali #italianoDiDomani https://t.co/joalie2KnK",2021-11-29 08:43:08,"Twitter Web App",67,34,"x599114492","ItalyMFA","Farnesina 🇮🇹",242472,948,14931,"Roma, Italia","Profilo ufficiale del Ministero degli Affari Esteri e della Cooperazione Internazionale | Ministry of Foreign Affairs and International Cooperation of Italy",TRUE,,,,,,,"NA NA","NA NA","NA NA NA NA NA NA NA NA","https://twitter.com/luigidimaio/status/1465241080337768449","Luigi Di Maio","Pomigliano d'Arco, Campania","Ministro degli Affari Esteri e della Cooperazione Internazionale.","https://t.co/D8gkagqksG",FALSE,741852,349,2125,6755,336,2009-06-17 18:34:46,TRUE,"https://t.co/D8gkagqksG","http://www.luigidimaio.it",,"https://pbs.twimg.com/profile_banners/48062712/1634667505","http://abs.twimg.com/images/themes/theme1/bg.png","http://pbs.twimg.com/profile_images/933106806670462976/YyC7LOW8_normal.jpg"
"x997531966571466752","x1465373332627468290",2021-11-29 17:33:22,"Pres_Casellati","Enrico Zampetti è stato protagonista della resistenza politica contro uno dei più grandi mali contemporanei,la deportazione nei lager nazisti di internati militari accanto a quelli per motivi razziali. Al convegno “Zaino sulle spalle” per i 100 anni dalla sua nascita. #29Novembre https://t.co/B0RbtKmgDC","Twitter for iPhone",280,,,,FALSE,FALSE,10,5,,,"29Novembre",,,,,"http://pbs.twimg.com/media/FFYNRw3XwAMeLfx.jpg","https://t.co/B0RbtKmgDC","https://twitter.com/Pres_Casellati/status/1465373332627468290/photo/1","photo","http://pbs.twimg.com/media/FFYNRw3XwAMeLfx.jpg http://pbs.twimg.com/media/FFYNRw1X0Aw5sWh.jpg http://pbs.twimg.com/media/FFYNRw7XwAIjYcX.jpg","https://t.co/B0RbtKmgDC https://t.co/B0RbtKmgDC https://t.co/B0RbtKmgDC","https://twitter.com/Pres_Casellati/status/1465373332627468290/photo/1 https://twitter.com/Pres_Casellati/status/1465373332627468290/photo/1 https://twitter.com/Pres_Casellati/status/1465373332627468290/photo/1",,,,"it",,,,,,,,,,,,,,,,,,,,,,,,,,,,,,,,,,,,,"NA NA","NA NA","NA NA NA NA NA NA NA NA","https://twitter.com/Pres_Casellati/status/1465373332627468290","Maria Elisabetta Alberti Casellati","Roma, Lazio","Presidente del Senato della Repubblica","https://t.co/4xFh9XyLXO",FALSE,13953,515,100,1137,61,2018-05-18 17:38:48,TRUE,"https://t.co/4xFh9XyLXO","https://www.facebook.com/elisabetta.casellati.7",,"https://pbs.twimg.com/profile_banners/997531966571466752/1526665561","http://abs.twimg.com/images/themes/theme1/bg.png","http://pbs.twimg.com/profile_images/997533290520195072/YmnjBO3X_normal.jpg"
"x1075084718","x1465282618048630788",2021-11-29 11:32:54,"arrigoni_paolo","#Caroenergia: lunedì nero con quotazioni esplosive. Più miliardi in manovra e alzare la voce in #Europa o ci saranno conseguenze drammatiche sui prezzi dei beni di consumo e sui costi per un'eventuale cassa integrazione per le aziende costrette a chiusura.","Twitter for Android",256,,,,FALSE,FALSE,4,1,,,"Caroenergia Europa",,,,,,,,,,,,,,,"it",,,,,,,,,,,,,,,,,,,,,,,,,,,,,,,,,,,,,"NA NA","NA NA","NA NA NA NA NA NA NA NA","https://twitter.com/arrigoni_paolo/status/1465282618048630788","Paolo Arrigoni","Calolziocorte, Lombardia","Questore del Senato della Repubblica, componente della Commissione Ambiente e del Copasir. Responsabile del Dipartimento Energia della Lega.","https://t.co/M6TePkOvfO",FALSE,4662,181,56,9624,108,2013-01-09 22:36:27,TRUE,"https://t.co/M6TePkOvfO","http://www.senato.it/leg/18/BGT/Schede/Attsen/00029039.htm",,"https://pbs.twimg.com/profile_banners/1075084718/1591968708","http://abs.twimg.com/images/themes/theme1/bg.png","http://pbs.twimg.com/profile_images/3172370357/bec3e4497d64c77f2a93bc9792055992_normal.jpeg"
"x876541483","x1465377187905818629",2021-11-29 17:48:41,"AlbertoBagnai","Qualcuno prova a informare: https://t.co/meK3vsx11q.","Twitter Web App",52,,,,FALSE,FALSE,30,16,,,,,"fb.watch/9AO-b6j6xL/","https://t.co/meK3vsx11q","https://fb.watch/9AO-b6j6xL/",,,,,,,,,,,"it",,,,,,,,,,,,,,,,,,,,,,,,,,,,,,,,,,,,,"NA NA","NA NA","NA NA NA NA NA NA NA NA","https://twitter.com/AlbertoBagnai/status/1465377187905818629","Alberto Bagnai","","Professore associato di politica economica all’Università Gabriele d’Annunzio, eletto al Senato per la Lega nel collegio Abruzzo 01.","https://t.co/sC5RvUzmsX",FALSE,128967,666,656,220269,6463,2012-10-12 22:13:36,TRUE,"https://t.co/sC5RvUzmsX","http://www.senato.it/leg/18/BGT/Schede/Attsen/00032582.htm",,"https://pbs.twimg.com/profile_banners/876541483/1535647109","http://abs.twimg.com/images/themes/theme1/bg.png","http://pbs.twimg.com/profile_images/849030859462246401/ATk3_aiW_normal.jpg"
"x876541483","x1465367897363070983",2021-11-29 17:11:46,"AlbertoBagnai","https://t.co/Q2dZf69Sfv","Twitter for iPhone",0,,,,FALSE,FALSE,72,30,,,,,,,,"http://pbs.twimg.com/media/FFYIVbgXEAYtOd6.jpg","https://t.co/Q2dZf69Sfv","https://twitter.com/AlbertoBagnai/status/1465367897363070983/photo/1","photo","http://pbs.twimg.com/media/FFYIVbgXEAYtOd6.jpg","https://t.co/Q2dZf69Sfv","https://twitter.com/AlbertoBagnai/status/1465367897363070983/photo/1",,,,"und",,,,,,,,,,,,,,,,,,,,,,,,,,,,,,,,,,,,,"NA NA","NA NA","NA NA NA NA NA NA NA NA","https://twitter.com/AlbertoBagnai/status/1465367897363070983","Alberto Bagnai","","Professore associato di politica economica all’Università Gabriele d’Annunzio, eletto al Senato per la Lega nel collegio Abruzzo 01.","https://t.co/sC5RvUzmsX",FALSE,128967,666,656,220269,6463,2012-10-12 22:13:36,TRUE,"https://t.co/sC5RvUzmsX","http://www.senato.it/leg/18/BGT/Schede/Attsen/00032582.htm",,"https://pbs.twimg.com/profile_banners/876541483/1535647109","http://abs.twimg.com/images/themes/theme1/bg.png","http://pbs.twimg.com/profile_images/849030859462246401/ATk3_aiW_normal.jpg"
"x876541483","x1465359233487155203",2021-11-29 16:37:20,"AlbertoBagnai","A @SkyTG24 riprendono la vecchia abitudine di chiudere il microfono solo ad alcuni. Gli suggerisco di non riaprirmelo... 😇","Twitter Web App",122,,,,FALSE,FALSE,272,44,,,,,,,,,,,,,,,,"x5893702","SkyTG24","it",,,,,,,,,,,,,,,,,,,,,,,,,,,,,,,,,,,,,"NA NA","NA NA","NA NA NA NA NA NA NA NA","https://twitter.com/AlbertoBagnai/status/1465359233487155203","Alberto Bagnai","","Professore associato di politica economica all’Università Gabriele d’Annunzio, eletto al Senato per la Lega nel collegio Abruzzo 01.","https://t.co/sC5RvUzmsX",FALSE,128967,666,656,220269,6463,2012-10-12 22:13:36,TRUE,"https://t.co/sC5RvUzmsX","http://www.senato.it/leg/18/BGT/Schede/Attsen/00032582.htm",,"https://pbs.twimg.com/profile_banners/876541483/1535647109","http://abs.twimg.com/images/themes/theme1/bg.png","http://pbs.twimg.com/profile_images/849030859462246401/ATk3_aiW_normal.jpg"
"x876541483","x1465356468937441294",2021-11-29 16:26:21,"AlbertoBagnai","...sed magis amica veritas...","Twitter Web App",29,,,,FALSE,FALSE,62,5,,,,,,,,,,,,,,,,,,"es",,,,,,,,,,,,,,,,,,,,,,,,,,,,,,,,,,,,,"NA NA","NA NA","NA NA NA NA NA NA NA NA","https://twitter.com/AlbertoBagnai/status/1465356468937441294","Alberto Bagnai","","Professore associato di politica economica all’Università Gabriele d’Annunzio, eletto al Senato per la Lega nel collegio Abruzzo 01.","https://t.co/sC5RvUzmsX",FALSE,128967,666,656,220269,6463,2012-10-12 22:13:36,TRUE,"https://t.co/sC5RvUzmsX","http://www.senato.it/leg/18/BGT/Schede/Attsen/00032582.htm",,"https://pbs.twimg.com/profile_banners/876541483/1535647109","http://abs.twimg.com/images/themes/theme1/bg.png","http://pbs.twimg.com/profile_images/849030859462246401/ATk3_aiW_normal.jpg"
"x876541483","x1465353865138778123",2021-11-29 16:16:01,"AlbertoBagnai","Apprendo che ""er barbetta"" lascia...","Twitter Web App",36,,,,FALSE,FALSE,142,13,,,,,,,,,,,,,,,,,,"it",,,,,,,,,,,,,,,,,,,,,,,,,,,,,,,,,,,,,"NA NA","NA NA","NA NA NA NA NA NA NA NA","https://twitter.com/AlbertoBagnai/status/1465353865138778123","Alberto Bagnai","","Professore associato di politica economica all’Università Gabriele d’Annunzio, eletto al Senato per la Lega nel collegio Abruzzo 01.","https://t.co/sC5RvUzmsX",FALSE,128967,666,656,220269,6463,2012-10-12 22:13:36,TRUE,"https://t.co/sC5RvUzmsX","http://www.senato.it/leg/18/BGT/Schede/Attsen/00032582.htm",,"https://pbs.twimg.com/profile_banners/876541483/1535647109","http://abs.twimg.com/images/themes/theme1/bg.png","http://pbs.twimg.com/profile_images/849030859462246401/ATk3_aiW_normal.jpg"
"x876541483","x1465350080601407498",2021-11-29 16:00:58,"AlbertoBagnai","https://t.co/pPjvfhGqFX","Twitter for iPhone",0,,,,FALSE,FALSE,41,12,,,,,,,,"http://pbs.twimg.com/media/FFX4IZlXIAISLHn.jpg","https://t.co/pPjvfhGqFX","https://twitter.com/AlbertoBagnai/status/1465350080601407498/photo/1","photo","http://pbs.twimg.com/media/FFX4IZlXIAISLHn.jpg","https://t.co/pPjvfhGqFX","https://twitter.com/AlbertoBagnai/status/1465350080601407498/photo/1",,,,"und",,,,,,,,,,,,,,,,,,,,,,,,,,,,,,,,,,,,,"NA NA","NA NA","NA NA NA NA NA NA NA NA","https://twitter.com/AlbertoBagnai/status/1465350080601407498","Alberto Bagnai","","Professore associato di politica economica all’Università Gabriele d’Annunzio, eletto al Senato per la Lega nel collegio Abruzzo 01.","https://t.co/sC5RvUzmsX",FALSE,128967,666,656,220269,6463,2012-10-12 22:13:36,TRUE,"https://t.co/sC5RvUzmsX","http://www.senato.it/leg/18/BGT/Schede/Attsen/00032582.htm",,"https://pbs.twimg.com/profile_banners/876541483/1535647109","http://abs.twimg.com/images/themes/theme1/bg.png","http://pbs.twimg.com/profile_images/849030859462246401/ATk3_aiW_normal.jpg"
"x876541483","x1465342200678694917",2021-11-29 15:29:40,"AlbertoBagnai","@zob26lee @borghi_claudio Forse lo abbiamo già visto.","Twitter for iPhone",27,"x1465310641691017217","x1138837292913713155","zob26lee",FALSE,FALSE,10,0,,,,,,,,,,,,,,,,"x1138837292913713155 x337767301","zob26lee borghi_claudio","it",,,,,,,,,,,,,,,,,,,,,,,,,,,,,,,,,,,,,"NA NA","NA NA","NA NA NA NA NA NA NA NA","https://twitter.com/AlbertoBagnai/status/1465342200678694917","Alberto Bagnai","","Professore associato di politica economica all’Università Gabriele d’Annunzio, eletto al Senato per la Lega nel collegio Abruzzo 01.","https://t.co/sC5RvUzmsX",FALSE,128967,666,656,220269,6463,2012-10-12 22:13:36,TRUE,"https://t.co/sC5RvUzmsX","http://www.senato.it/leg/18/BGT/Schede/Attsen/00032582.htm",,"https://pbs.twimg.com/profile_banners/876541483/1535647109","http://abs.twimg.com/images/themes/theme1/bg.png","http://pbs.twimg.com/profile_images/849030859462246401/ATk3_aiW_normal.jpg"
"x876541483","x1465334689686859788",2021-11-29 14:59:49,"AlbertoBagnai","@AlessandroLod18 @ConteAlmaviva @fdragoni @borghi_claudio @2631925 Ex multis (lì parlava dell'Italia, ma vale per tutta l'EZ):
https://t.co/QL77LjDS9h","Twitter for iPhone",140,,,,FALSE,TRUE,0,22,,,,,,,,,,,,,,,,"x960819725856059393 x1456223505213759489 x1365625315 x51759517 x337767301 x1683545012","Fabiusfax AlessandroLod18 ConteAlmaviva fdragoni borghi_claudio 2631925","it",,,,,,,,,,,,,,,,"x1465333774959497216","@AlessandroLod18 @ConteAlmaviva @fdragoni @borghi_claudio @2631925 Ex multis (lì parlava dell'Italia, ma vale per tutta l'EZ):
https://t.co/QL77LjDS9h",2021-11-29 14:56:11,"Twitter Web App",50,22,"x960819725856059393","Fabiusfax","F a b i o F a z z o",953,193,69151,"","Il 18 giugno 1989 vota NO al referendum consultivo per la costituente europea. Devoto alla memoria dell'abate Arnaud Amaury.",FALSE,,,,,,,"NA NA","NA NA","NA NA NA NA NA NA NA NA","https://twitter.com/AlbertoBagnai/status/1465334689686859788","Alberto Bagnai","","Professore associato di politica economica all’Università Gabriele d’Annunzio, eletto al Senato per la Lega nel collegio Abruzzo 01.","https://t.co/sC5RvUzmsX",FALSE,128967,666,656,220269,6463,2012-10-12 22:13:36,TRUE,"https://t.co/sC5RvUzmsX","http://www.senato.it/leg/18/BGT/Schede/Attsen/00032582.htm",,"https://pbs.twimg.com/profile_banners/876541483/1535647109","http://abs.twimg.com/images/themes/theme1/bg.png","http://pbs.twimg.com/profile_images/849030859462246401/ATk3_aiW_normal.jpg"
