"x412371227","x1468501109979426816",2021-12-08 08:42:02,"CalabriaTw","Italian Lives Matter -  https://t.co/wYxGGz3Ec7","Twitter for iPhone",68,,,,FALSE,TRUE,0,487,,,,,"theamericanconservative.com/dreher/italian…","https://t.co/wYxGGz3Ec7","https://www.theamericanconservative.com/dreher/italian-lives-matter-crime-new-york-times/",,,,,,,,,"x125376632","FedericoRampini","en",,,,,,,,,,,,,,,,"x1468371749553201157","Italian Lives Matter -  https://t.co/wYxGGz3Ec7",2021-12-08 00:08:00,"Twitter Web App",1543,487,"x125376632","FedericoRampini","Federico Rampini",163130,71,6312,"New York","Giornalista, scrittore, editorialista del Corriere della Sera da New York. Ex corrispondente da Pechino e San Francisco. Autore di ""Fermare Pechino"" (Mondadori)",FALSE,,,,,,,"NA NA","NA NA","NA NA NA NA NA NA NA NA","https://twitter.com/CalabriaTw/status/1468501109979426816","Annagrazia Calabria","Instagram @annagraziacalabria","New York/Roma @uniluiss - Deputato eletto nel collegio uninominale Roma 3 - Vice Presidente Commissione Affari Costituzionali","https://t.co/55V0tn6NKC",FALSE,23483,800,178,10426,9286,2011-11-14 16:10:11,TRUE,"https://t.co/55V0tn6NKC","http://www.forzaitaliagiovani.org",,"https://pbs.twimg.com/profile_banners/412371227/1630430552","http://abs.twimg.com/images/themes/theme1/bg.png","http://pbs.twimg.com/profile_images/1400114707625922567/uhPqFLLX_normal.jpg"
"x412371227","x1468295601683116037",2021-12-07 19:05:25,"CalabriaTw","Il #supergreenpass ha i suoi effetti positivi sui cittadini. Boom di #vaccini, tra cui molte prime dosi, e record di certificati verdi scaricati, 1,3mln nelle ultime 24h. La strada intrapresa è quella giusta, per un #Natale sereno e in sicurezza e le attività commerciali aperte. https://t.co/cnrRQSgZwx","Twitter for Android",279,,,,FALSE,FALSE,25,12,,,"supergreenpass vaccini Natale",,,,,"http://pbs.twimg.com/media/FGBvEX8XEAgiEJJ.jpg","https://t.co/cnrRQSgZwx","https://twitter.com/CalabriaTw/status/1468295601683116037/photo/1","photo","http://pbs.twimg.com/media/FGBvEX8XEAgiEJJ.jpg","https://t.co/cnrRQSgZwx","https://twitter.com/CalabriaTw/status/1468295601683116037/photo/1",,,,"it",,,,,,,,,,,,,,,,,,,,,,,,,,,,,,,,,,,,,"NA NA","NA NA","NA NA NA NA NA NA NA NA","https://twitter.com/CalabriaTw/status/1468295601683116037","Annagrazia Calabria","Instagram @annagraziacalabria","New York/Roma @uniluiss - Deputato eletto nel collegio uninominale Roma 3 - Vice Presidente Commissione Affari Costituzionali","https://t.co/55V0tn6NKC",FALSE,23483,800,178,10426,9286,2011-11-14 16:10:11,TRUE,"https://t.co/55V0tn6NKC","http://www.forzaitaliagiovani.org",,"https://pbs.twimg.com/profile_banners/412371227/1630430552","http://abs.twimg.com/images/themes/theme1/bg.png","http://pbs.twimg.com/profile_images/1400114707625922567/uhPqFLLX_normal.jpg"
"x104485125","x1468249404608065544",2021-12-07 16:01:51,"mara_carfagna","Il 9 e il 10 vi aspetto a “Uniamo l’Italia”, due giorni di confronto sul nuovo #FondoSviluppoCoesione. Se confermati, avremo 73.5 mld, di cui l’80% al #Sud, per abbattere il muro che divide il nostro Paese. A noi il compito di spenderli bene ▶️ https://t.co/NdFzAmwrVU https://t.co/nmdxaTTI1O","Twitter for iPhone",268,,,,FALSE,FALSE,33,8,,,"FondoSviluppoCoesione Sud",,"bit.ly/3yaKBmk","https://t.co/NdFzAmwrVU","https://bit.ly/3yaKBmk","http://pbs.twimg.com/media/FGBFCsFWQAIjfg6.jpg","https://t.co/nmdxaTTI1O","https://twitter.com/mara_carfagna/status/1468249404608065544/photo/1","photo","http://pbs.twimg.com/media/FGBFCsFWQAIjfg6.jpg","https://t.co/nmdxaTTI1O","https://twitter.com/mara_carfagna/status/1468249404608065544/photo/1",,,,"it",,,,,,,,,,,,,,,,,,,,,,,,,,,,,,,,,,,,,"NA NA","NA NA","NA NA NA NA NA NA NA NA","https://twitter.com/mara_carfagna/status/1468249404608065544","Mara Carfagna","","Ministra per il Sud e la Coesione territoriale e deputata di Forza Italia. Sono stata eletta a Napoli. Presidente di @siamovocelibera.",,FALSE,228155,1677,1191,16486,6306,2010-01-13 13:38:27,TRUE,,,,"https://pbs.twimg.com/profile_banners/104485125/1620037691","http://abs.twimg.com/images/themes/theme1/bg.png","http://pbs.twimg.com/profile_images/1389164870285791233/pYuFkdG2_normal.jpg"
"x104485125","x1468213579455287298",2021-12-07 13:39:30,"mara_carfagna","Torna la grande nautica a #Taranto. Con l'accordo di oggi sul #CISTaranto riprogrammiamo 42,8 mln di interventi e apriamo le porte ai cantieri Ferretti e a centinaia di posti di lavoro. Sono soddisfatta, prevalgono pragmatismo e trasparenza, ogni cittadino saprà cosa finanziamo. https://t.co/sdPK4ReYgj","Twitter for iPhone",279,,,,FALSE,FALSE,66,13,,,"Taranto CISTaranto",,,,,"http://pbs.twimg.com/media/FGAkdvaX0AIplZQ.jpg","https://t.co/sdPK4ReYgj","https://twitter.com/mara_carfagna/status/1468213579455287298/photo/1","photo","http://pbs.twimg.com/media/FGAkdvaX0AIplZQ.jpg","https://t.co/sdPK4ReYgj","https://twitter.com/mara_carfagna/status/1468213579455287298/photo/1",,,,"it",,,,,,,,,,,,,,,,,,,,,,,,,,,,,,,,,,,,,"NA NA","NA NA","NA NA NA NA NA NA NA NA","https://twitter.com/mara_carfagna/status/1468213579455287298","Mara Carfagna","","Ministra per il Sud e la Coesione territoriale e deputata di Forza Italia. Sono stata eletta a Napoli. Presidente di @siamovocelibera.",,FALSE,228155,1677,1191,16486,6306,2010-01-13 13:38:27,TRUE,,,,"https://pbs.twimg.com/profile_banners/104485125/1620037691","http://abs.twimg.com/images/themes/theme1/bg.png","http://pbs.twimg.com/profile_images/1389164870285791233/pYuFkdG2_normal.jpg"
"x104485125","x1468188130272555010",2021-12-07 11:58:22,"mara_carfagna","La liberazione di Patrick Zaki è una bellissima notizia che aspettavamo da tempo. Lo attendiamo presto in Italia!","Twitter for iPhone",113,,,,FALSE,FALSE,271,25,,,,,,,,,,,,,,,,,,"it",,,,,,,,,,,,,,,,,,,,,,,,,,,,,,,,,,,,,"NA NA","NA NA","NA NA NA NA NA NA NA NA","https://twitter.com/mara_carfagna/status/1468188130272555010","Mara Carfagna","","Ministra per il Sud e la Coesione territoriale e deputata di Forza Italia. Sono stata eletta a Napoli. Presidente di @siamovocelibera.",,FALSE,228155,1677,1191,16486,6306,2010-01-13 13:38:27,TRUE,,,,"https://pbs.twimg.com/profile_banners/104485125/1620037691","http://abs.twimg.com/images/themes/theme1/bg.png","http://pbs.twimg.com/profile_images/1389164870285791233/pYuFkdG2_normal.jpg"
"x604395668","x1468518495411449861",2021-12-08 09:51:07,"bennyfiorini","Ordina la statuetta della Madonna con Bambin Gesù in ceramica bianca tramite il Negozio Solidale di ACS e sosterrai anche i cristiani perseguitati. Per info clicca su https://t.co/sMBHkODvpq #8dicembre #ImmacolataConcezione https://t.co/IcYcU0u0KO","Twitter for iPhone",140,,,,FALSE,TRUE,0,17,,,,,,,,,,,,,,,,"x1329155760","acs_italia","it",,,,,,,,,,,,,,,,"x1468482980679233541","Ordina la statuetta della Madonna con Bambin Gesù in ceramica bianca tramite il Negozio Solidale di ACS e sosterrai anche i cristiani perseguitati. Per info clicca su https://t.co/sMBHkODvpq #8dicembre #ImmacolataConcezione https://t.co/IcYcU0u0KO",2021-12-08 07:30:00,"TweetDeck",31,17,"x1329155760","acs_italia","ACS-Italia",14285,8616,24021,"Roma","Aiuto alla Chiesa che Soffre è una Fondazione Pontificia che sostiene i Cristiani perseguitati per la loro fede, anzitutto in Iraq e in Siria",FALSE,,,,,,,"NA NA","NA NA","NA NA NA NA NA NA NA NA","https://twitter.com/bennyfiorini/status/1468518495411449861","Benedetta Fiorini","Reggio Emilia - Modena - Roma","Deputato @LegaSalvini , Uninominale Sassuolo, Segretario Commissione #AttivitàProduttive e... #mamma di Maria Sole.","https://t.co/63QrpwBeZz",FALSE,1873,2675,32,8567,9480,2012-06-10 10:17:22,FALSE,"https://t.co/63QrpwBeZz","https://www.camera.it/leg18/29?shadow_deputato=307284&idLegislatura=18",,"https://pbs.twimg.com/profile_banners/604395668/1520851962","http://abs.twimg.com/images/themes/theme1/bg.png","http://pbs.twimg.com/profile_images/1061037768451805184/tHl_q5iy_normal.jpg"
"x604395668","x1468362541952819202",2021-12-07 23:31:25,"bennyfiorini","Se lo scrive perfino il Corriere…
Voi che ne pensate?
Una preghiera per Davide. https://t.co/qkSmP6xGrl","Twitter for iPhone",124,,,,FALSE,TRUE,0,71,,,,,,,,"http://pbs.twimg.com/media/FGChEOMWYAQ7XlN.jpg","https://t.co/qkSmP6xGrl","https://twitter.com/matteosalvinimi/status/1468350577180610567/photo/1","photo","http://pbs.twimg.com/media/FGChEOMWYAQ7XlN.jpg","https://t.co/qkSmP6xGrl","https://twitter.com/matteosalvinimi/status/1468350577180610567/photo/1",,"x270839361","matteosalvinimi","it",,,,,,,,,,,,,,,,"x1468350577180610567","Se lo scrive perfino il Corriere…
Voi che ne pensate?
Una preghiera per Davide. https://t.co/qkSmP6xGrl",2021-12-07 22:43:52,"Twitter for iPhone",407,71,"x270839361","matteosalvinimi","Matteo Salvini",1429495,2029,52256,"","Leader della Lega #primagliitaliani 🇮🇹",TRUE,,,,,,,"NA NA","NA NA","NA NA NA NA NA NA NA NA","https://twitter.com/bennyfiorini/status/1468362541952819202","Benedetta Fiorini","Reggio Emilia - Modena - Roma","Deputato @LegaSalvini , Uninominale Sassuolo, Segretario Commissione #AttivitàProduttive e... #mamma di Maria Sole.","https://t.co/63QrpwBeZz",FALSE,1873,2675,32,8567,9480,2012-06-10 10:17:22,FALSE,"https://t.co/63QrpwBeZz","https://www.camera.it/leg18/29?shadow_deputato=307284&idLegislatura=18",,"https://pbs.twimg.com/profile_banners/604395668/1520851962","http://abs.twimg.com/images/themes/theme1/bg.png","http://pbs.twimg.com/profile_images/1061037768451805184/tHl_q5iy_normal.jpg"
"x604395668","x1468359553066676226",2021-12-07 23:19:32,"bennyfiorini","‘LA MADONNA DIVENTA TRANS’, #SALVINI FRA I PRIMI A MOSTRARE SDEGNO: “NON È UNA PROVOCAZIONE, È UN VERGOGNOSO INSULTO” https://t.co/fInNGvzJyJ","Twitter for iPhone",140,,,,FALSE,TRUE,0,18,,,"SALVINI",,,,,,,,,,,,,"x13514762","LegaSalvini","it",,,,,,,,,,,,,,,,"x1468283924535291904","‘LA MADONNA DIVENTA TRANS’, #SALVINI FRA I PRIMI A MOSTRARE SDEGNO: “NON È UNA PROVOCAZIONE, È UN VERGOGNOSO INSULTO” https://t.co/fInNGvzJyJ",2021-12-07 18:19:01,"LegaPerSalviniPremier",131,18,"x13514762","LegaSalvini","Lega - Salvini Premier",188689,506,228974,"Italia","Account Ufficiale Lega - Salvini Premier. Facebook: https://t.co/ujbT62WGQG Instagram: https://t.co/n3x3POS5il",TRUE,,,,,,,"NA NA","NA NA","NA NA NA NA NA NA NA NA","https://twitter.com/bennyfiorini/status/1468359553066676226","Benedetta Fiorini","Reggio Emilia - Modena - Roma","Deputato @LegaSalvini , Uninominale Sassuolo, Segretario Commissione #AttivitàProduttive e... #mamma di Maria Sole.","https://t.co/63QrpwBeZz",FALSE,1873,2675,32,8567,9480,2012-06-10 10:17:22,FALSE,"https://t.co/63QrpwBeZz","https://www.camera.it/leg18/29?shadow_deputato=307284&idLegislatura=18",,"https://pbs.twimg.com/profile_banners/604395668/1520851962","http://abs.twimg.com/images/themes/theme1/bg.png","http://pbs.twimg.com/profile_images/1061037768451805184/tHl_q5iy_normal.jpg"
"x604395668","x1468359527724724231",2021-12-07 23:19:26,"bennyfiorini","Per l’accusa, ha cercato di estorcere denaro alla famiglia Loro Piana (a cui va la mia solidarietà): un funzionario dell’Agenzia delle Entrate è finito nei guai. Che vergogna. https://t.co/zJONsa66Eu","Twitter for iPhone",140,,,,FALSE,TRUE,0,28,,,,,,,,,,,,,,,,"x270839361","matteosalvinimi","it",,,,,,,,,,,,,,,,"x1468323421339664385","Per l’accusa, ha cercato di estorcere denaro alla famiglia Loro Piana (a cui va la mia solidarietà): un funzionario dell’Agenzia delle Entrate è finito nei guai. Che vergogna. https://t.co/zJONsa66Eu",2021-12-07 20:55:58,"Twitter for iPhone",180,28,"x270839361","matteosalvinimi","Matteo Salvini",1429495,2029,52256,"","Leader della Lega #primagliitaliani 🇮🇹",TRUE,,,,,,,"NA NA","NA NA","NA NA NA NA NA NA NA NA","https://twitter.com/bennyfiorini/status/1468359527724724231","Benedetta Fiorini","Reggio Emilia - Modena - Roma","Deputato @LegaSalvini , Uninominale Sassuolo, Segretario Commissione #AttivitàProduttive e... #mamma di Maria Sole.","https://t.co/63QrpwBeZz",FALSE,1873,2675,32,8567,9480,2012-06-10 10:17:22,FALSE,"https://t.co/63QrpwBeZz","https://www.camera.it/leg18/29?shadow_deputato=307284&idLegislatura=18",,"https://pbs.twimg.com/profile_banners/604395668/1520851962","http://abs.twimg.com/images/themes/theme1/bg.png","http://pbs.twimg.com/profile_images/1061037768451805184/tHl_q5iy_normal.jpg"
"x604395668","x1468281908257861633",2021-12-07 18:11:00,"bennyfiorini","Alla tristezza di questo signore rispondo augurandogli buon Sant’Ambrogio e buon Santo Natale!","Twitter for iPhone",115,,,,FALSE,TRUE,0,20,,,,,,,,,,,,,,,,"x270839361","matteosalvinimi","it",,,,,,,,,,,,,,,,"x1468271381267820550","Alla tristezza di questo signore rispondo augurandogli buon Sant’Ambrogio e buon Santo Natale!",2021-12-07 17:29:11,"Twitter Web App",306,20,"x270839361","matteosalvinimi","Matteo Salvini",1429495,2029,52256,"","Leader della Lega #primagliitaliani 🇮🇹",TRUE,,,,,,,"NA NA","NA NA","NA NA NA NA NA NA NA NA","https://twitter.com/bennyfiorini/status/1468281908257861633","Benedetta Fiorini","Reggio Emilia - Modena - Roma","Deputato @LegaSalvini , Uninominale Sassuolo, Segretario Commissione #AttivitàProduttive e... #mamma di Maria Sole.","https://t.co/63QrpwBeZz",FALSE,1873,2675,32,8567,9480,2012-06-10 10:17:22,FALSE,"https://t.co/63QrpwBeZz","https://www.camera.it/leg18/29?shadow_deputato=307284&idLegislatura=18",,"https://pbs.twimg.com/profile_banners/604395668/1520851962","http://abs.twimg.com/images/themes/theme1/bg.png","http://pbs.twimg.com/profile_images/1061037768451805184/tHl_q5iy_normal.jpg"
"x604395668","x1468281888007725061",2021-12-07 18:10:56,"bennyfiorini","Quel galantuomo di Saviano mi attacca dicendo che fra Gesù ed Erode avrei parteggiato per il secondo (battuta da asilo nido) e aggiungendo che “Gesù è nato da due profughi”, anzi da due “clandestini”. https://t.co/qKHB7rwqU6","Twitter for iPhone",140,,,,FALSE,TRUE,0,68,,,,,,,,,,,,,,,,"x270839361","matteosalvinimi","it",,,,,,,,,,,,,,,,"x1468271378776399873","Quel galantuomo di Saviano mi attacca dicendo che fra Gesù ed Erode avrei parteggiato per il secondo (battuta da asilo nido) e aggiungendo che “Gesù è nato da due profughi”, anzi da due “clandestini”. https://t.co/qKHB7rwqU6",2021-12-07 17:29:10,"Twitter Web App",449,68,"x270839361","matteosalvinimi","Matteo Salvini",1429495,2029,52256,"","Leader della Lega #primagliitaliani 🇮🇹",TRUE,,,,,,,"NA NA","NA NA","NA NA NA NA NA NA NA NA","https://twitter.com/bennyfiorini/status/1468281888007725061","Benedetta Fiorini","Reggio Emilia - Modena - Roma","Deputato @LegaSalvini , Uninominale Sassuolo, Segretario Commissione #AttivitàProduttive e... #mamma di Maria Sole.","https://t.co/63QrpwBeZz",FALSE,1873,2675,32,8567,9480,2012-06-10 10:17:22,FALSE,"https://t.co/63QrpwBeZz","https://www.camera.it/leg18/29?shadow_deputato=307284&idLegislatura=18",,"https://pbs.twimg.com/profile_banners/604395668/1520851962","http://abs.twimg.com/images/themes/theme1/bg.png","http://pbs.twimg.com/profile_images/1061037768451805184/tHl_q5iy_normal.jpg"
"x553977418","x1468481185273761792",2021-12-08 07:22:52,"fucsiaUSA","Nissoli (FI): Assassinio di un italiano a New York: “all lives matter”. https://t.co/gH6OOT5MgX via @politic48785057","Twitter Web App",116,,,,FALSE,FALSE,0,0,,,,,"politicamentecorretto.com/2021/12/06/nis…","https://t.co/gH6OOT5MgX","https://www.politicamentecorretto.com/2021/12/06/nissoli-fi-assassinio-di-un-italiano-a-new-york-all-lives-matter/",,,,,,,,,"x1254095516507439109","politic48785057","it",,,,,,,,,,,,,,,,,,,,,,,,,,,,,,,,,,,,,"NA NA","NA NA","NA NA NA NA NA NA NA NA","https://twitter.com/fucsiaUSA/status/1468481185273761792","Fucsia Nissoli Fitzgerald","Roma, Lazio","Mamma di 3 figli, sposata, Deputata al Parlamento Italiano (Nord e Centro America) - Mother of 3 children, married, MP at the Italian Parliament","https://t.co/rwYypv38gZ",FALSE,522,23,17,641,2900,2012-04-15 01:35:19,FALSE,"https://t.co/rwYypv38gZ","http://fucsiafitzgeraldnissoli.com",,"https://pbs.twimg.com/profile_banners/553977418/1608376589","http://abs.twimg.com/images/themes/theme1/bg.png","http://pbs.twimg.com/profile_images/1084782743526039552/iECkaGk7_normal.jpg"
"x420332560","x1468191700397043718",2021-12-07 12:12:33,"msgelmini","Il Consiglio dei Ministri ha approvato oggi il ddl per la #prevenzione e il contrasto alla #violenzasulledonne. “Nessun alibi alla coscienza pubblica nel tollerare questo fenomeno” il messaggio lanciato dalle Ministre del Governo in conferenza stampa https://t.co/23Syja7qo5","Twitter for iPhone",139,,,,FALSE,TRUE,0,64,,,"prevenzione violenzasulledonne",,,,,,,,,,,,,"x963938472","Palazzo_Chigi","it",,,,,,,,,,,,,,,,"x1466844352517390337","Il Consiglio dei Ministri ha approvato oggi il ddl per la #prevenzione e il contrasto alla #violenzasulledonne. “Nessun alibi alla coscienza pubblica nel tollerare questo fenomeno” il messaggio lanciato dalle Ministre del Governo in conferenza stampa https://t.co/23Syja7qo5",2021-12-03 18:58:40,"Twitter Web App",263,64,"x963938472","Palazzo_Chigi","Palazzo_Chigi",835534,1813,7766,"","Profilo ufficiale della Presidenza del Consiglio dei Ministri. 
https://t.co/Oa5uNK30zc
https://t.co/kwgG62psre
https://t.co/enxpwlMjJE",TRUE,,,,,,,"NA NA","NA NA","NA NA NA NA NA NA NA NA","https://twitter.com/msgelmini/status/1468191700397043718","Mariastella Gelmini","","Ministro per gli Affari regionali e le Autonomie @DipAffRegionali","https://t.co/AsF4X2LnbR",FALSE,99747,2889,611,18561,4228,2011-11-24 13:50:09,TRUE,"https://t.co/AsF4X2LnbR","http://www.ilblogdistella.it",,"https://pbs.twimg.com/profile_banners/420332560/1592500467","http://abs.twimg.com/images/themes/theme1/bg.png","http://pbs.twimg.com/profile_images/1411984235238506497/DqYre7Dh_normal.jpg"
"x4218365097","x1468236605517406221",2021-12-07 15:10:59,"Vincenza_Lab","Questa non è una provocazione choc è  semplicemente cattivo gusto che sono sicura non piacerà neanche ai Lgbt.
Gli eccessi, le esasperazioni non fanno mai bene, non si possono veicolare questi messaggi come se fosse satira sopratutto se a farlo è un ambasciatore speciale dell’UE https://t.co/3fqYRPvr5F","Twitter for iPhone",279,,,,FALSE,FALSE,12,7,,,,,,,,"http://pbs.twimg.com/media/FGA5aIIWQAQ-A1V.jpg","https://t.co/3fqYRPvr5F","https://twitter.com/Vincenza_Lab/status/1468236605517406221/photo/1","photo","http://pbs.twimg.com/media/FGA5aIIWQAQ-A1V.jpg","https://t.co/3fqYRPvr5F","https://twitter.com/Vincenza_Lab/status/1468236605517406221/photo/1",,,,"it",,,,,,,,,,,,,,,,,,,,,,,,,,,,,,,,,,,,,"NA NA","NA NA","NA NA NA NA NA NA NA NA","https://twitter.com/Vincenza_Lab/status/1468236605517406221","Vincenza Labriola","Roma, Lazio","Deputata Forza Italia - Componente VIII Commissione AMBIENTE TERRITORIO LAVORI PUBBLICI",,FALSE,1312,934,39,10025,15295,2015-11-18 14:02:12,FALSE,,,,"https://pbs.twimg.com/profile_banners/4218365097/1549113042","http://abs.twimg.com/images/themes/theme1/bg.png","http://pbs.twimg.com/profile_images/1446010173622005762/JJTFRXCF_normal.jpg"
"x4218365097","x1468231489951309829",2021-12-07 14:50:40,"Vincenza_Lab","La scarcerazione di #PatrickZaky è una bella notizia che aspettavamo da tanto, troppo tempo. Speriamo presto di vederlo libero, insieme ai suoi cari riprendendo la sua vita bruscamente interrotta da una prigionia assurda","Twitter for iPhone",220,,,,FALSE,FALSE,1,1,,,"PatrickZaky",,,,,,,,,,,,,,,"it",,,,,,,,,,,,,,,,,,,,,,,,,,,,,,,,,,,,,"NA NA","NA NA","NA NA NA NA NA NA NA NA","https://twitter.com/Vincenza_Lab/status/1468231489951309829","Vincenza Labriola","Roma, Lazio","Deputata Forza Italia - Componente VIII Commissione AMBIENTE TERRITORIO LAVORI PUBBLICI",,FALSE,1312,934,39,10025,15295,2015-11-18 14:02:12,FALSE,,,,"https://pbs.twimg.com/profile_banners/4218365097/1549113042","http://abs.twimg.com/images/themes/theme1/bg.png","http://pbs.twimg.com/profile_images/1446010173622005762/JJTFRXCF_normal.jpg"
"x703511639","x1468528036438020103",2021-12-08 10:29:02,"mandelli_andrea","Buona festa dell’#Immacolata a tutti voi e alle vostre famiglie. #8dicembre https://t.co/mnyx6P1oph","Twitter for iPhone",75,,,,FALSE,FALSE,1,0,,,"Immacolata 8dicembre",,,,,"http://pbs.twimg.com/media/FGFCdUSXwAIEIzk.jpg","https://t.co/mnyx6P1oph","https://twitter.com/mandelli_andrea/status/1468528036438020103/photo/1","photo","http://pbs.twimg.com/media/FGFCdUSXwAIEIzk.jpg","https://t.co/mnyx6P1oph","https://twitter.com/mandelli_andrea/status/1468528036438020103/photo/1",,,,"it",,,,,,,,,,,,,,,,,,,,,,,,,,,,,,,,,,,,,"NA NA","NA NA","NA NA NA NA NA NA NA NA","https://twitter.com/mandelli_andrea/status/1468528036438020103","Andrea Mandelli","","Vicepresidente della Camera dei Deputati Responsabile Dipartimento Sanità e Dipartimento Professioni di Forza Italia","https://t.co/SVDGGgRqh9",FALSE,2887,321,52,5624,353,2013-10-07 08:25:51,FALSE,"https://t.co/SVDGGgRqh9","http://www.andrea-mandelli.it",,"https://pbs.twimg.com/profile_banners/703511639/1638270671","http://abs.twimg.com/images/themes/theme1/bg.png","http://pbs.twimg.com/profile_images/1465637554351484932/M4MEQwtE_normal.jpg"
"x921162848","x1468496205781082112",2021-12-08 08:22:33,"Marin63Marco","Vi aspettiamo a #Studio24, alle 9:45 su @RaiNews, con i nostri ospiti per parlare di:

#Mattarella #Quirinale #PrimaScala #COVID19 #VarianteOmicron #supergreenpass #vaccini #Draghi #LeggeDiBilancio #manovra #PNRR #Politica #Cultura #Teatro

Conduce @GiorgiaRomb https://t.co/o4nWmKsFaN","Twitter for iPad",139,,,,FALSE,TRUE,0,5,,,"Studio24 Mattarella Quirinale PrimaScala",,,,,,,,,,,,,"x2785214645 x14060262","RaiStudio24 RaiNews","it",,,,,,,,,,,,,,,,"x1468474144799039488","Vi aspettiamo a #Studio24, alle 9:45 su @RaiNews, con i nostri ospiti per parlare di:

#Mattarella #Quirinale #PrimaScala #COVID19 #VarianteOmicron #supergreenpass #vaccini #Draghi #LeggeDiBilancio #manovra #PNRR #Politica #Cultura #Teatro

Conduce @GiorgiaRomb https://t.co/o4nWmKsFaN",2021-12-08 06:54:53,"Twitter Web App",5,5,"x2785214645","RaiStudio24","Studio24",6153,822,22573,"roma","La politica. La cronaca. La cultura. In diretta dalle 9:45 alle 11 su @RaiNews.
Conduce Giorgia Rombolà (@GiorgiaRomb)",FALSE,,,,,,,"NA NA","NA NA","NA NA NA NA NA NA NA NA","https://twitter.com/Marin63Marco/status/1468496205781082112","marco marin","","Capogruppo di Coraggio Italia alla Camera dei Deputati. Campione olimpico e mondiale di scherma. Medico odontoiatra.",,FALSE,2680,326,32,1964,1106,2012-11-02 14:47:14,FALSE,,,,"https://pbs.twimg.com/profile_banners/921162848/1590419012","http://abs.twimg.com/images/themes/theme1/bg.png","http://pbs.twimg.com/profile_images/1399307773318418436/cewYdggJ_normal.jpg"
"x3187239525","x1468201263330467842",2021-12-07 12:50:33,"stefano_mugnai","https://t.co/jo24RSbU56","Twitter for iPhone",0,,,,FALSE,FALSE,0,0,,,,,,,,"http://pbs.twimg.com/media/FGAZQHBXMAU1qtX.jpg","https://t.co/jo24RSbU56","https://twitter.com/stefano_mugnai/status/1468201263330467842/photo/1","photo","http://pbs.twimg.com/media/FGAZQHBXMAU1qtX.jpg","https://t.co/jo24RSbU56","https://twitter.com/stefano_mugnai/status/1468201263330467842/photo/1",,,,"und",,,,,,,,,,,,,,,,,,,,,,,,,,,,,,,,,,,,,"NA NA","NA NA","NA NA NA NA NA NA NA NA","https://twitter.com/stefano_mugnai/status/1468201263330467842","Stefano Mugnai","Montevarchi, Toscana","Deputato",,FALSE,1492,407,31,7340,1203,2015-04-20 14:26:52,FALSE,,,,"https://pbs.twimg.com/profile_banners/3187239525/1531745236","http://abs.twimg.com/images/themes/theme1/bg.png","http://pbs.twimg.com/profile_images/974200861571379202/aO7ahwGK_normal.jpg"
"x85264321","x1468480025527730176",2021-12-08 07:18:15,"robertoocchiuto","In Calabria abbiamo fatto 100mila somministrazioni di vaccino nei primi 7 giorni di dicembre. Non era mai avvenuto sino ad oggi. 
Avanti così! 

Qui il video completo 👉🏼 https://t.co/IyutaYKEsL https://t.co/BdooJLWrls","Twitter for iPhone",193,,,,FALSE,FALSE,27,4,,,,,"tg2.rai.it/dl/RaiTV/progr…","https://t.co/IyutaYKEsL","http://www.tg2.rai.it/dl/RaiTV/programmi/media/ContentItem-640cf55f-604d-4177-b928-c5fa0d146f3d-tg2.html#p=0","http://pbs.twimg.com/media/FGEWzFSWYAM58OA.jpg","https://t.co/BdooJLWrls","https://twitter.com/robertoocchiuto/status/1468480025527730176/photo/1","photo","http://pbs.twimg.com/media/FGEWzFSWYAM58OA.jpg","https://t.co/BdooJLWrls","https://twitter.com/robertoocchiuto/status/1468480025527730176/photo/1",,,,"it",,,,,,,,,,,,,,,,,,,,,,,,,,,,,,,,,,,,,"NA NA","NA NA","NA NA NA NA NA NA NA NA","https://twitter.com/robertoocchiuto/status/1468480025527730176","Roberto Occhiuto","","Presidente Regione Calabria","https://t.co/Eu4DMhZGED",FALSE,4848,690,76,1129,1404,2009-10-26 07:53:35,FALSE,"https://t.co/Eu4DMhZGED","http://www.robertoocchiuto.it",,"https://pbs.twimg.com/profile_banners/85264321/1634205553","http://abs.twimg.com/images/themes/theme16/bg.gif","http://pbs.twimg.com/profile_images/1448589197669982214/Y1Em3wNP_normal.jpg"
"x961958095650992128","x1468520323649839104",2021-12-08 09:58:23,"GuidoPettarin","Anche Trieste, da ciò, può trarre enormi vantaggi per confermarsi porto all’avanguardia sotto tutti i punti di vista.","Twitter for Android",117,"x1468520285259317252","x961958095650992128","GuidoPettarin",FALSE,FALSE,0,0,,,,,,,,,,,,,,,,,,"it",,,,,,,,,,,,,,,,,,,,,,,,,,,,,,,,,,,,,"NA NA","NA NA","NA NA NA NA NA NA NA NA","https://twitter.com/GuidoPettarin/status/1468520323649839104","Guido Germano Pettarin","","",,FALSE,369,172,8,941,435,2018-02-09 13:40:57,FALSE,,,,,,"http://pbs.twimg.com/profile_images/970996823874854912/CHJikV5h_normal.jpg"
