"x376610294","x1419458708799623168",2021-07-26 00:45:03,"isabellarauti","“Arcuri, l'uomo delle primule da 400.000 euro per i vaccini, dei banchi con le rotelle, dell'inutile app Immuni, delle mascherine strapagate, torna a fare il consulente a Palazzo Chigi. Stiamo scherzando?” @calandriniLT #FratellidItalia https://t.co/FevC46IWlb","Twitter for iPhone",139,,,,FALSE,TRUE,0,54,,,,,,,,,,,,,,,,"x985177119624966147","FDI_Parlamento","it",,,,,,,,,,,,,,,,"x1419413565564407815","“Arcuri, l'uomo delle primule da 400.000 euro per i vaccini, dei banchi con le rotelle, dell'inutile app Immuni, delle mascherine strapagate, torna a fare il consulente a Palazzo Chigi. Stiamo scherzando?” @calandriniLT #FratellidItalia https://t.co/FevC46IWlb",2021-07-25 21:45:40,"Twitter for iPhone",279,54,"x985177119624966147","FDI_Parlamento","FDI Parlamento",5586,88,10575,"Roma, Lazio","Profilo ufficiale dei Gruppi Parlamentari di #fratelliditalia al #Senato e alla #Camera.",FALSE,,,,,,,"NA NA","NA NA","NA NA NA NA NA NA NA NA","https://twitter.com/isabellarauti/status/1419458708799623168","Isabella Rauti","","Giornalista, Dottore di Ricerca, Uff Esercito 🇮🇹, Senatrice, Vice Pres Gruppo FDI, Comm Difesa, Dipartimento Famiglia FDI, Associazione Pino Rauti, Onlus HOW","https://t.co/IE1TYO9vGj",FALSE,12154,5630,118,25319,14758,2011-09-20 05:48:40,TRUE,"https://t.co/IE1TYO9vGj","http://www.Isabellarauti.it",,"https://pbs.twimg.com/profile_banners/376610294/1580146815","http://abs.twimg.com/images/themes/theme1/bg.png","http://pbs.twimg.com/profile_images/699248798707621888/sTn5ZaWE_normal.jpg"
"x18762875","x1419629509842776065",2021-07-26 12:03:45,"matteorenzi","L’Enews di oggi
https://t.co/raghdEdcrR","Twitter for iPhone",39,,,,FALSE,FALSE,108,48,,,,,"matteorenzi.it/enews_721_lune…","https://t.co/raghdEdcrR","https://www.matteorenzi.it/enews_721_lunedi_26_luglio_2021",,,,,,,,,,,"it",,,,,,,,,,,,,,,,,,,,,,,,,,,,,,,,,,,,,"NA NA","NA NA","NA NA NA NA NA NA NA NA","https://twitter.com/matteorenzi/status/1419629509842776065","Matteo Renzi","Italy","Senatore di Firenze - @ItaliaViva","https://t.co/c8MoZ1Wbev",FALSE,3333840,970,7423,13175,468,2009-01-08 13:15:21,TRUE,"https://t.co/c8MoZ1Wbev","https://linktr.ee/matteorenzi",,"https://pbs.twimg.com/profile_banners/18762875/1624437087","http://abs.twimg.com/images/themes/theme1/bg.png","http://pbs.twimg.com/profile_images/1392170945612296195/cI5VKwP2_normal.jpg"
"x18762875","x1419566149545742336",2021-07-26 07:51:58,"matteorenzi","Le parole offensive e deliranti di Marco Travaglio su Draghi - orfano di padre all’età di 15 anni - dimostrano come il direttore del Fatto sia semplicemente un uomo vergognoso. Stupisce che ancora venga pagato per insultare tutti a reti unificate. Solidarietà al Presidente Draghi","Twitter for iPhone",280,,,,FALSE,FALSE,3970,682,,,,,,,,,,,,,,,,,,"it",,,,,,,,,,,,,,,,,,,,,,,,,,,,,,,,,,,,,"NA NA","NA NA","NA NA NA NA NA NA NA NA","https://twitter.com/matteorenzi/status/1419566149545742336","Matteo Renzi","Italy","Senatore di Firenze - @ItaliaViva","https://t.co/c8MoZ1Wbev",FALSE,3333840,970,7423,13175,468,2009-01-08 13:15:21,TRUE,"https://t.co/c8MoZ1Wbev","https://linktr.ee/matteorenzi",,"https://pbs.twimg.com/profile_banners/18762875/1624437087","http://abs.twimg.com/images/themes/theme1/bg.png","http://pbs.twimg.com/profile_images/1392170945612296195/cI5VKwP2_normal.jpg"
"x18762875","x1419357020583612416",2021-07-25 18:00:58,"matteorenzi","Grazie agli amici di Gallipoli. Stare in piazza anziché in spiaggia con questo caldo è stata davvero una scelta #ControCorrente. E tra oggi e domani si continua tra Manduria, Bari, Termoli, Pescara https://t.co/kyYAz3P96X","Twitter for Android",197,,,,FALSE,FALSE,765,153,,,"ControCorrente",,,,,"http://pbs.twimg.com/media/E7KRqsaX0AgWzQV.jpg","https://t.co/kyYAz3P96X","https://twitter.com/matteorenzi/status/1419357020583612416/photo/1","photo","http://pbs.twimg.com/media/E7KRqsaX0AgWzQV.jpg http://pbs.twimg.com/media/E7KRrE4XsAQmFFe.jpg http://pbs.twimg.com/media/E7KRreOXIAEwp8S.jpg http://pbs.twimg.com/media/E7KRr19XMAAK_Bo.jpg","https://t.co/kyYAz3P96X https://t.co/kyYAz3P96X https://t.co/kyYAz3P96X https://t.co/kyYAz3P96X","https://twitter.com/matteorenzi/status/1419357020583612416/photo/1 https://twitter.com/matteorenzi/status/1419357020583612416/photo/1 https://twitter.com/matteorenzi/status/1419357020583612416/photo/1 https://twitter.com/matteorenzi/status/1419357020583612416/photo/1",,,,"it",,,,,,,,,,,,,,,,,,,,,,,,,,,,,,,,,,,,,"NA NA","NA NA","NA NA NA NA NA NA NA NA","https://twitter.com/matteorenzi/status/1419357020583612416","Matteo Renzi","Italy","Senatore di Firenze - @ItaliaViva","https://t.co/c8MoZ1Wbev",FALSE,3333840,970,7423,13175,468,2009-01-08 13:15:21,TRUE,"https://t.co/c8MoZ1Wbev","https://linktr.ee/matteorenzi",,"https://pbs.twimg.com/profile_banners/18762875/1624437087","http://abs.twimg.com/images/themes/theme1/bg.png","http://pbs.twimg.com/profile_images/1392170945612296195/cI5VKwP2_normal.jpg"
"x395183088","x1419395827647361027",2021-07-25 20:35:11,"MatteoRichetti","Le notizie e le immagini che stanno arrivando dalla #Sardegna sono terrificanti. Migliaia di sfollati ed ettari di vegetazione in fiamme. Un pensiero rivolto al popolo #sardo e a tutti i volontari che stanno combattendo contro le fiamme. https://t.co/6j4sgoPXPi","Twitter Web App",237,,,,FALSE,FALSE,173,19,,,"Sardegna sardo",,,,,"http://pbs.twimg.com/media/E7K0-hAWYAUsN_p.jpg","https://t.co/6j4sgoPXPi","https://twitter.com/MatteoRichetti/status/1419395827647361027/photo/1","photo","http://pbs.twimg.com/media/E7K0-hAWYAUsN_p.jpg","https://t.co/6j4sgoPXPi","https://twitter.com/MatteoRichetti/status/1419395827647361027/photo/1",,,,"it",,,,,,,,,,,,,,,,,,,,,,,,,,,,,,,,,,,,,"NA NA","NA NA","NA NA NA NA NA NA NA NA","https://twitter.com/MatteoRichetti/status/1419395827647361027","Matteo Richetti","","Senatore della Repubblica. @Azione_it","https://t.co/DdGUEYf1IW",FALSE,58261,298,345,4585,3345,2011-10-21 08:15:44,TRUE,"https://t.co/DdGUEYf1IW","http://www.matteorichetti.it",,"https://pbs.twimg.com/profile_banners/395183088/1581950847","http://abs.twimg.com/images/themes/theme1/bg.png","http://pbs.twimg.com/profile_images/1054697232186908679/NKX73y0Z_normal.jpg"
"x1122573690","x1419334142257422347",2021-07-25 16:30:04,"erica_rivolta","#Salvini: “Oggi si celebra la prima Giornata Mondiale dei Nonni e degli Anziani, istituita da Papa Francesco. Un pensiero per coloro che ogni giorno, con saggezza ed esperienza, custodiscono le nostre radici”. https://t.co/eXobnBCYWg","Hootsuite Inc.",209,,,,FALSE,FALSE,9,1,,,"Salvini",,,,,"http://pbs.twimg.com/media/E7J84ZkWYAMjOea.jpg","https://t.co/eXobnBCYWg","https://twitter.com/erica_rivolta/status/1419334142257422347/photo/1","photo","http://pbs.twimg.com/media/E7J84ZkWYAMjOea.jpg","https://t.co/eXobnBCYWg","https://twitter.com/erica_rivolta/status/1419334142257422347/photo/1",,,,"it",,,,,,,,,,,,,,,,,,,,,,,,,,,,,,,,,,,,,"NA NA","NA NA","NA NA NA NA NA NA NA NA","https://twitter.com/erica_rivolta/status/1419334142257422347","Erica Rivolta","Erba (CO)","🟢 SENATRICE LEGA (Vice Presidente della Commissione Bilancio)📍Vice Sindaco/Assessore Lega - Comune di Erba","https://t.co/8MWzTAMw85",FALSE,991,183,17,1766,373,2013-01-26 17:05:04,TRUE,"https://t.co/8MWzTAMw85","http://www.senato.it/leg/18/BGT/Schede/Attsen/00025415.htm",,"https://pbs.twimg.com/profile_banners/1122573690/1591381827","http://abs.twimg.com/images/themes/theme13/bg.gif","http://pbs.twimg.com/profile_images/961570463460855811/wfFcEjNJ_normal.jpg"
"x565272070","x1419619530721087492",2021-07-26 11:24:06,"tatjana_rojc","In via Baiamonti hanno coperto di nero le scritte slovene dei manifesti del PD. Grande rammarico per questa destra che non cambia, che ci vorrebbe https://t.co/RvC6SEyOJm i tempi son cambiati, quel nero è il colore della loro sconfitta. / Desnica prekrila plakat DS s črno barvo. https://t.co/wvKe7yNGNx","Twitter for Android",279,,,,FALSE,FALSE,8,4,,,,,"divisi.Ma","https://t.co/RvC6SEyOJm","http://divisi.Ma","http://pbs.twimg.com/media/E7OAb3cXEAAm9FI.jpg","https://t.co/wvKe7yNGNx","https://twitter.com/tatjana_rojc/status/1419619530721087492/photo/1","photo","http://pbs.twimg.com/media/E7OAb3cXEAAm9FI.jpg","https://t.co/wvKe7yNGNx","https://twitter.com/tatjana_rojc/status/1419619530721087492/photo/1",,,,"it",,,,,,,,,,,,,,,,,,,,,,,,,,,,,,,,,,,,,"NA NA","NA NA","NA NA NA NA NA NA NA NA","https://twitter.com/tatjana_rojc/status/1419619530721087492","tatjana rojc","","tatjana rojc",,FALSE,845,705,12,1743,16729,2012-04-28 08:18:24,FALSE,,,,,"http://abs.twimg.com/images/themes/theme1/bg.png","http://pbs.twimg.com/profile_images/1191117433203019776/46nc9D4D_normal.jpg"
"x487751312","x1419302529322700803",2021-07-25 14:24:27,"_paolo_romani_","@ItaliaTeam_it XI","Twitter for iPhone",2,"x1419110865794592768","x4257347277","ItaliaTeam_it",FALSE,FALSE,0,0,,,,,,,,,,,,,,,,"x4257347277","ItaliaTeam_it","und",,,,,,,,,,,,,,,,,,,,,,,,,,,,,,,,,,,,,"NA NA","NA NA","NA NA NA NA NA NA NA NA","https://twitter.com/_paolo_romani_/status/1419302529322700803","Paolo Romani","","Senatore Gruppo Misto Componente Idea-Cambiamo Presidente Fondazione Finis Terrae @terrae_finis",,FALSE,14053,1212,138,2414,48,2012-02-09 18:08:16,FALSE,,,,"https://pbs.twimg.com/profile_banners/487751312/1388508994","http://abs.twimg.com/images/themes/theme1/bg.png","http://pbs.twimg.com/profile_images/418063137485910017/2GZ-dc3m_normal.jpeg"
"x318316637","x1419607671230054400",2021-07-26 10:36:58,"LiciaRonzulli","Per fortuna i numeri della campagna vaccinale dimostrano che gli italiani credono nel #vaccino. Mi spaventa però l’irresponsabilità di pochi: il fanatismo #NoVax non può trovare asilo politico. Da queste piazze non arriva un messaggio positivo, non vanno ascoltate #greenpass https://t.co/fF5r9RaqSb","Twitter Web App",275,,,,FALSE,FALSE,36,5,,,"vaccino NoVax greenpass",,,,,"http://pbs.twimg.com/media/E7N1o9GXMAYXkZJ.jpg","https://t.co/fF5r9RaqSb","https://twitter.com/LiciaRonzulli/status/1419607671230054400/photo/1","photo","http://pbs.twimg.com/media/E7N1o9GXMAYXkZJ.jpg","https://t.co/fF5r9RaqSb","https://twitter.com/LiciaRonzulli/status/1419607671230054400/photo/1",,,,"it",,,,,,,,,,,,,,,,,,,,,,,,,,,,,,,,,,,,,"NA NA","NA NA","NA NA NA NA NA NA NA NA","https://twitter.com/LiciaRonzulli/status/1419607671230054400","Licia Ronzulli","Italia","Mamma di Vitty. Senatore della Repubblica. Presidente della Commissione bicamerale infanzia e adolescenza.","https://t.co/q54Sl1XcPF",FALSE,17069,362,174,14665,2443,2011-06-16 08:58:51,TRUE,"https://t.co/q54Sl1XcPF","http://www.liciaronzulli.com",,"https://pbs.twimg.com/profile_banners/318316637/1447076568","http://abs.twimg.com/images/themes/theme2/bg.gif","http://pbs.twimg.com/profile_images/525047474944483328/z1kiXNGa_normal.jpeg"
"x1263088331300188166","x1419349240116125702",2021-07-25 17:30:03,"GianfrancoRufa","SALVINI DECAPITATO, LA VIGNETTA DELL’ORRORE. E LUI CHIEDE AI FOLLOWER: “LI DENUNCIO?”

https://t.co/diygv9l9kE","Hootsuite Inc.",110,,,,FALSE,FALSE,0,0,,,,,"ow.ly/YHdd30rOUlG","https://t.co/diygv9l9kE","http://ow.ly/YHdd30rOUlG",,,,,,,,,,,"it",,,,,,,,,,,,,,,,,,,,,,,,,,,,,,,,,,,,,"NA NA","NA NA","NA NA NA NA NA NA NA NA","https://twitter.com/GianfrancoRufa/status/1419349240116125702","GianfrancoRufa","","👔 SENATORE LEGA 📍Membro 8^Commissione “Lavori pubblici, comunicazioni”. 📍Segretario Commissione d’inchiesta sul femminicidio e forma di violenza di genere.","https://t.co/dj89ADXDX7",FALSE,278,6,4,1067,59,2020-05-20 12:45:25,TRUE,"https://t.co/dj89ADXDX7","http://www.senato.it/leg/18/BGT/Schede/Attsen/00032752.htm",,"https://pbs.twimg.com/profile_banners/1263088331300188166/1589979107",,"http://pbs.twimg.com/profile_images/1263088533432041473/Uy8VbMLA_normal.jpg"
"x1263088331300188166","x1419318239381839874",2021-07-25 15:26:52,"GianfrancoRufa","APRILIA... SI CONTINUA!! 💚 https://t.co/IV1cTP0IhA","Hootsuite Inc.",26,,,,FALSE,FALSE,0,0,,,,,,,,"http://pbs.twimg.com/media/E7JuatmWEAEmkDb.jpg","https://t.co/IV1cTP0IhA","https://twitter.com/GianfrancoRufa/status/1419318239381839874/photo/1","photo","http://pbs.twimg.com/media/E7JuatmWEAEmkDb.jpg","https://t.co/IV1cTP0IhA","https://twitter.com/GianfrancoRufa/status/1419318239381839874/photo/1",,,,"es",,,,,,,,,,,,,,,,,,,,,,,,,,,,,,,,,,,,,"NA NA","NA NA","NA NA NA NA NA NA NA NA","https://twitter.com/GianfrancoRufa/status/1419318239381839874","GianfrancoRufa","","👔 SENATORE LEGA 📍Membro 8^Commissione “Lavori pubblici, comunicazioni”. 📍Segretario Commissione d’inchiesta sul femminicidio e forma di violenza di genere.","https://t.co/dj89ADXDX7",FALSE,278,6,4,1067,59,2020-05-20 12:45:25,TRUE,"https://t.co/dj89ADXDX7","http://www.senato.it/leg/18/BGT/Schede/Attsen/00032752.htm",,"https://pbs.twimg.com/profile_banners/1263088331300188166/1589979107",,"http://pbs.twimg.com/profile_images/1263088533432041473/Uy8VbMLA_normal.jpg"
"x2546046132","x1419605042777165830",2021-07-26 10:26:31,"sruotolo1","@annatrieste Auguri Annarella 💙💙😘","Twitter for iPhone",20,"x1419600213820547075","x192352800","annatrieste",FALSE,FALSE,4,1,,,,,,,,,,,,,,,,"x192352800","annatrieste","it",,,,,,,,,,,,,,,,,,,,,,,,,,,,,,,,,,,,,"NA NA","NA NA","NA NA NA NA NA NA NA NA","https://twitter.com/sruotolo1/status/1419605042777165830","sandro ruotolo","240 km da Napoli ","Napoletano. Cronista dal 1974. Eletto senatore della Repubblica il 23 febbraio 2020.",,FALSE,52223,1992,189,2357,16179,2014-06-04 12:51:39,FALSE,,,,"https://pbs.twimg.com/profile_banners/2546046132/1549564452","http://abs.twimg.com/images/themes/theme1/bg.png","http://pbs.twimg.com/profile_images/1396476237963485194/QqOQtY0n_normal.jpg"
"x478868933","x1419563918540910592",2021-07-26 07:43:07,"mruspandini","Covid, Meloni: Se indiscrezioni stampa su virus uscito da laboratorio confermate, Governo dovrebbe chiedere risarcimenti al regime di Pechino https://t.co/SZsvn0Ffsd","Twitter Web App",165,,,,FALSE,FALSE,1,0,,,,,"giorgiameloni.it/2021/07/21/cov…","https://t.co/SZsvn0Ffsd","https://www.giorgiameloni.it/2021/07/21/covid-meloni-se-indiscrezioni-stampa-su-virus-uscito-da-laboratorio-confermate-governo-dovrebbe-chiedere-risarcimenti-al-regime-di-pechino/",,,,,,,,,,,"it",,,,,,,,,,,,,,,,,,,,,,,,,,,,,,,,,,,,,"NA NA","NA NA","NA NA NA NA NA NA NA NA","https://twitter.com/mruspandini/status/1419563918540910592","Massimo Ruspandini","","Senatore di @FratellidItalia 🇮🇹",,FALSE,1448,204,12,4338,2358,2012-01-30 19:12:00,FALSE,,,,"https://pbs.twimg.com/profile_banners/478868933/1547153715","http://abs.twimg.com/images/themes/theme1/bg.png","http://pbs.twimg.com/profile_images/1380855982213988352/3Htl6lxB_normal.jpg"
"x478868933","x1419413352531496964",2021-07-25 21:44:49,"mruspandini","Provate a fare un piccolo esperimento: smettete di chiamarlo #GreenPass e chiamatelo per quello che è: “lasciapassare governativo che autorizza alla vita sociale”. E poi argomentate così le tesi pro e contro. Per chiarezza e onestà nei confronti degli italiani.","Twitter for iPhone",140,,,,FALSE,TRUE,0,886,,,"GreenPass",,,,,,,,,,,,,"x130537001","GiorgiaMeloni","it",,,,,,,,,,,,,,,,"x1419269121649389572","Provate a fare un piccolo esperimento: smettete di chiamarlo #GreenPass e chiamatelo per quello che è: “lasciapassare governativo che autorizza alla vita sociale”. E poi argomentate così le tesi pro e contro. Per chiarezza e onestà nei confronti degli italiani.",2021-07-25 12:11:42,"Twitter for iPhone",4015,886,"x130537001","GiorgiaMeloni","Giorgia Meloni 🇮🇹 ن",1109265,917,17779,"Italia","Romana, classe '77. Politica e giornalista. Sempre, ovunque e prima di tutto, italiana. Presidente di @FratellidItalia e di @ECRParty",TRUE,,,,,,,"NA NA","NA NA","NA NA NA NA NA NA NA NA","https://twitter.com/mruspandini/status/1419413352531496964","Massimo Ruspandini","","Senatore di @FratellidItalia 🇮🇹",,FALSE,1448,204,12,4338,2358,2012-01-30 19:12:00,FALSE,,,,"https://pbs.twimg.com/profile_banners/478868933/1547153715","http://abs.twimg.com/images/themes/theme1/bg.png","http://pbs.twimg.com/profile_images/1380855982213988352/3Htl6lxB_normal.jpg"
"x478868933","x1419413287389782022",2021-07-25 21:44:33,"mruspandini","Sapete cosa è accaduto a moltissime persone che erano state vaccinate, quindi in possesso di GC ed hanno scoperto i sintomi di un possibile contagio? Non hanno fatto alcun tampone ed hanno continuato a girare libere, formalmente sane ma positive.","Twitter for iPhone",140,,,,FALSE,TRUE,0,656,,,,,,,,,,,,,,,,"x413916151","GuidoCrosetto","it",,,,,,,,,,,,,,,,"x1419275829377437699","Sapete cosa è accaduto a moltissime persone che erano state vaccinate, quindi in possesso di GC ed hanno scoperto i sintomi di un possibile contagio? Non hanno fatto alcun tampone ed hanno continuato a girare libere, formalmente sane ma positive.",2021-07-25 12:38:21,"Twitter for iPhone",2118,656,"x413916151","GuidoCrosetto","Guido Crosetto",153377,2172,96894,"","Libero da pregiudizi per convinzione, garantista per dna, conservatore per nascita, rispettoso per scelta. Ex tante cose. Ora uomo libero ed imprenditore.",FALSE,,,,,,,"NA NA","NA NA","NA NA NA NA NA NA NA NA","https://twitter.com/mruspandini/status/1419413287389782022","Massimo Ruspandini","","Senatore di @FratellidItalia 🇮🇹",,FALSE,1448,204,12,4338,2358,2012-01-30 19:12:00,FALSE,,,,"https://pbs.twimg.com/profile_banners/478868933/1547153715","http://abs.twimg.com/images/themes/theme1/bg.png","http://pbs.twimg.com/profile_images/1380855982213988352/3Htl6lxB_normal.jpg"
"x478868933","x1419413269878542340",2021-07-25 21:44:29,"mruspandini","#Meloni #FratellidItalia https://t.co/i0FZMkszIM","Twitter for iPhone",24,,,,FALSE,FALSE,109,16,,,"Meloni FratellidItalia",,,,,"http://pbs.twimg.com/media/E7LE2GBXEAEob3Q.jpg","https://t.co/i0FZMkszIM","https://twitter.com/mruspandini/status/1419413269878542340/photo/1","photo","http://pbs.twimg.com/media/E7LE2GBXEAEob3Q.jpg","https://t.co/i0FZMkszIM","https://twitter.com/mruspandini/status/1419413269878542340/photo/1",,,,"und",,,,,,,,,,,,,,,,,,,,,,,,,,,,,,,"https://api.twitter.com/1.1/geo/id/7d588036fe12e124.json","Rome","Rome, Lazio","city","Italy","IT","NA NA","NA NA","12.2344266 12.8558641 12.8558641 12.2344266 41.6558738 41.6558738 42.140959 42.140959","https://twitter.com/mruspandini/status/1419413269878542340","Massimo Ruspandini","","Senatore di @FratellidItalia 🇮🇹",,FALSE,1448,204,12,4338,2358,2012-01-30 19:12:00,FALSE,,,,"https://pbs.twimg.com/profile_banners/478868933/1547153715","http://abs.twimg.com/images/themes/theme1/bg.png","http://pbs.twimg.com/profile_images/1380855982213988352/3Htl6lxB_normal.jpg"
"x478868933","x1419404774772981767",2021-07-25 21:10:44,"mruspandini","Guido Crosetto (FdI): ""Mi sono vaccinato, ma il Green pass è uno strumento che discrimina"" - la Repubblica https://t.co/gYPqmVaOs3","Twitter for iPhone",130,,,,FALSE,FALSE,5,1,,,,,"repubblica.it/politica/2021/…","https://t.co/gYPqmVaOs3","https://www.repubblica.it/politica/2021/07/25/news/crosetto_green_pass-311718757/",,,,,,,,,,,"it",,,,,,,,,,,,,,,,,,,,,,,,,,,,,,,,,,,,,"NA NA","NA NA","NA NA NA NA NA NA NA NA","https://twitter.com/mruspandini/status/1419404774772981767","Massimo Ruspandini","","Senatore di @FratellidItalia 🇮🇹",,FALSE,1448,204,12,4338,2358,2012-01-30 19:12:00,FALSE,,,,"https://pbs.twimg.com/profile_banners/478868933/1547153715","http://abs.twimg.com/images/themes/theme1/bg.png","http://pbs.twimg.com/profile_images/1380855982213988352/3Htl6lxB_normal.jpg"
"x478868933","x1419392999675600900",2021-07-25 20:23:56,"mruspandini","🔵 Lunedì 26 luglio ore 9.00, Giorgia Meloni ospite a Morning News, su canale 5. #Meloni #FratellidItalia https://t.co/ZIYLkR99RM","Twitter for iPhone",104,,,,FALSE,FALSE,11,3,,,"Meloni FratellidItalia",,,,,"http://pbs.twimg.com/media/E7KyaLLXEAUshWd.jpg","https://t.co/ZIYLkR99RM","https://twitter.com/mruspandini/status/1419392999675600900/photo/1","photo","http://pbs.twimg.com/media/E7KyaLLXEAUshWd.jpg","https://t.co/ZIYLkR99RM","https://twitter.com/mruspandini/status/1419392999675600900/photo/1",,,,"it",,,,,,,,,,,,,,,,,,,,,,,,,,,,,,,"https://api.twitter.com/1.1/geo/id/7d588036fe12e124.json","Rome","Rome, Lazio","city","Italy","IT","NA NA","NA NA","12.2344266 12.8558641 12.8558641 12.2344266 41.6558738 41.6558738 42.140959 42.140959","https://twitter.com/mruspandini/status/1419392999675600900","Massimo Ruspandini","","Senatore di @FratellidItalia 🇮🇹",,FALSE,1448,204,12,4338,2358,2012-01-30 19:12:00,FALSE,,,,"https://pbs.twimg.com/profile_banners/478868933/1547153715","http://abs.twimg.com/images/themes/theme1/bg.png","http://pbs.twimg.com/profile_images/1380855982213988352/3Htl6lxB_normal.jpg"
"x478868933","x1419351088248066050",2021-07-25 17:37:24,"mruspandini","🔵 Basta sbarchi #BloccoNavaleSubito https://t.co/8hV9V5tT7Q","Twitter for iPhone",35,,,,FALSE,FALSE,11,4,,,"BloccoNavaleSubito",,,,,"http://pbs.twimg.com/media/E7KMSe-WYAMWPQS.jpg","https://t.co/8hV9V5tT7Q","https://twitter.com/mruspandini/status/1419351088248066050/photo/1","photo","http://pbs.twimg.com/media/E7KMSe-WYAMWPQS.jpg","https://t.co/8hV9V5tT7Q","https://twitter.com/mruspandini/status/1419351088248066050/photo/1",,,,"it",,,,,,,,,,,,,,,,,,,,,,,,,,,,,,,"https://api.twitter.com/1.1/geo/id/7d588036fe12e124.json","Rome","Rome, Lazio","city","Italy","IT","NA NA","NA NA","12.2344266 12.8558641 12.8558641 12.2344266 41.6558738 41.6558738 42.140959 42.140959","https://twitter.com/mruspandini/status/1419351088248066050","Massimo Ruspandini","","Senatore di @FratellidItalia 🇮🇹",,FALSE,1448,204,12,4338,2358,2012-01-30 19:12:00,FALSE,,,,"https://pbs.twimg.com/profile_banners/478868933/1547153715","http://abs.twimg.com/images/themes/theme1/bg.png","http://pbs.twimg.com/profile_images/1380855982213988352/3Htl6lxB_normal.jpg"
"x449774953","x1419647458569826306",2021-07-26 13:15:04,"AntoSaccone","🔴📣 Bisogna accelerare la campagna sulle vaccinazioni per scongiurare nuove chiusure. Il #GreenPass sia uno strumento per fermare la diffusione del virus ma non diventi un ostacolo burocratico che rischierebbe di penalizzare le imprese che devono lavorare!","TweetDeck",140,,,,FALSE,TRUE,0,6,,,"GreenPass",,,,,,,,,,,,,"x376210328","AntonioDePoli","it",,,,,,,,,,,,,,,,"x1419647425174716417","🔴📣 Bisogna accelerare la campagna sulle vaccinazioni per scongiurare nuove chiusure. Il #GreenPass sia uno strumento per fermare la diffusione del virus ma non diventi un ostacolo burocratico che rischierebbe di penalizzare le imprese che devono lavorare!",2021-07-26 13:14:56,"TweetDeck",6,6,"x376210328","AntonioDePoli","Antonio De Poli",5521,613,14745,"Padova","Senatore della Repubblica Italiana - Questore Anziano #OpenSenato - Presidente Nazionale @UdcIta  - Segretario Regionale @UdcVeneto",FALSE,,,,,,,"NA NA","NA NA","NA NA NA NA NA NA NA NA","https://twitter.com/AntoSaccone/status/1419647458569826306","Antonio Saccone","Roma, Lazio","Senatore della Repubblica Italiana @UdcIta","https://t.co/wtPqsrq4TZ",FALSE,263,181,5,1350,2433,2011-12-29 13:45:16,FALSE,"https://t.co/wtPqsrq4TZ","http://udc-italia.it",,"https://pbs.twimg.com/profile_banners/449774953/1551203956","http://abs.twimg.com/images/themes/theme1/bg.png","http://pbs.twimg.com/profile_images/1100480381231476737/V5giQ4MA_normal.png"
"x449774953","x1419642984182726659",2021-07-26 12:57:17,"AntoSaccone","Solidarietà e vicinanza alla popolazione colpita in #Sardegna: 1.500 persone sfollate, oltre 20 mila ettari di boschi ridotti in cenere. Grazie di cuore alle oltre 7.500 persone, impegnate da giorni sul campo, tra forestali, Vigili del fuoco, volontari e Protezione civile! 👏❤️🙏 https://t.co/jp9AJKyy9h","TweetDeck",140,,,,FALSE,TRUE,0,6,,,"Sardegna",,,,,,,,,,,,,"x376210328","AntonioDePoli","it",,,,,,,,,,,,,,,,"x1419642762220158976","Solidarietà e vicinanza alla popolazione colpita in #Sardegna: 1.500 persone sfollate, oltre 20 mila ettari di boschi ridotti in cenere. Grazie di cuore alle oltre 7.500 persone, impegnate da giorni sul campo, tra forestali, Vigili del fuoco, volontari e Protezione civile! 👏❤️🙏 https://t.co/jp9AJKyy9h",2021-07-26 12:56:24,"TweetDeck",7,6,"x376210328","AntonioDePoli","Antonio De Poli",5521,613,14745,"Padova","Senatore della Repubblica Italiana - Questore Anziano #OpenSenato - Presidente Nazionale @UdcIta  - Segretario Regionale @UdcVeneto",FALSE,,,,,,,"NA NA","NA NA","NA NA NA NA NA NA NA NA","https://twitter.com/AntoSaccone/status/1419642984182726659","Antonio Saccone","Roma, Lazio","Senatore della Repubblica Italiana @UdcIta","https://t.co/wtPqsrq4TZ",FALSE,263,181,5,1350,2433,2011-12-29 13:45:16,FALSE,"https://t.co/wtPqsrq4TZ","http://udc-italia.it",,"https://pbs.twimg.com/profile_banners/449774953/1551203956","http://abs.twimg.com/images/themes/theme1/bg.png","http://pbs.twimg.com/profile_images/1100480381231476737/V5giQ4MA_normal.png"
