"x337767301","x1451613438015426565",2021-10-22 18:16:27,"borghi_claudio","@maryfagi @CeraLoretta @MarcoRCapelli @_xenio_ Sempre pronto https://t.co/GoqOzf6JSg","Twitter Web App",13,"x1451610958309298197","x706097800040357889","maryfagi",FALSE,FALSE,8,2,,,,,,,,"http://pbs.twimg.com/tweet_video_thumb/FCUquSfWEAM1Kkk.jpg","https://t.co/GoqOzf6JSg","https://twitter.com/borghi_claudio/status/1451613438015426565/photo/1","photo","http://pbs.twimg.com/tweet_video_thumb/FCUquSfWEAM1Kkk.jpg","https://t.co/GoqOzf6JSg","https://twitter.com/borghi_claudio/status/1451613438015426565/photo/1",,"x706097800040357889 x1268421663047254016 x177164070 x419557618","maryfagi CeraLoretta MarcoRCapelli _xenio_","it",,,,,,,,,,,,,,,,,,,,,,,,,,,,,,,,,,,,,"NA NA","NA NA","NA NA NA NA NA NA NA NA","https://twitter.com/borghi_claudio/status/1451613438015426565","Claudio Borghi A.","Italia","Deputato della Repubblica Italiana eletto in Toscana per la Lega. Consigliere Comunale di Como","https://t.co/LhQnD0sHz3",FALSE,117986,1328,818,213713,1299,2011-07-18 15:08:25,TRUE,"https://t.co/LhQnD0sHz3","http://tiny.cc/j3065y",,"https://pbs.twimg.com/profile_banners/337767301/1607040672","http://abs.twimg.com/images/themes/theme1/bg.png","http://pbs.twimg.com/profile_images/1449240289/manliorho_-_giusto_normal.jpg"
"x337767301","x1451612886506299397",2021-10-22 18:14:16,"borghi_claudio","@alberti68326580 Mi risulta sia stato nominato dalla signora Lamorgese senza interpellare nessuno","Twitter Web App",80,"x1451611859417763879","x1244662772262150144","alberti68326580",FALSE,FALSE,4,2,,,,,,,,,,,,,,,,"x1244662772262150144","alberti68326580","it",,,,,,,,,,,,,,,,,,,,,,,,,,,,,,,,,,,,,"NA NA","NA NA","NA NA NA NA NA NA NA NA","https://twitter.com/borghi_claudio/status/1451612886506299397","Claudio Borghi A.","Italia","Deputato della Repubblica Italiana eletto in Toscana per la Lega. Consigliere Comunale di Como","https://t.co/LhQnD0sHz3",FALSE,117986,1328,818,213713,1299,2011-07-18 15:08:25,TRUE,"https://t.co/LhQnD0sHz3","http://tiny.cc/j3065y",,"https://pbs.twimg.com/profile_banners/337767301/1607040672","http://abs.twimg.com/images/themes/theme1/bg.png","http://pbs.twimg.com/profile_images/1449240289/manliorho_-_giusto_normal.jpg"
"x337767301","x1451610943109144576",2021-10-22 18:06:33,"borghi_claudio","Per chi volesse seguire il percorso del decreto green pass in commissione al Senato ricordo che per sapere che si fa in commissione e chi dice cosa ci sono i resoconti.
https://t.co/rBOfInvMaY","Twitter Web App",192,,,,FALSE,FALSE,103,40,,,,,"senato.it/static/bgt/lis…","https://t.co/rBOfInvMaY","https://www.senato.it/static/bgt/listasommcomm/0/1/A/18/index.html",,,,,,,,,,,"it",,,,,,,,,,,,,,,,,,,,,,,,,,,,,,,,,,,,,"NA NA","NA NA","NA NA NA NA NA NA NA NA","https://twitter.com/borghi_claudio/status/1451610943109144576","Claudio Borghi A.","Italia","Deputato della Repubblica Italiana eletto in Toscana per la Lega. Consigliere Comunale di Como","https://t.co/LhQnD0sHz3",FALSE,117986,1328,818,213713,1299,2011-07-18 15:08:25,TRUE,"https://t.co/LhQnD0sHz3","http://tiny.cc/j3065y",,"https://pbs.twimg.com/profile_banners/337767301/1607040672","http://abs.twimg.com/images/themes/theme1/bg.png","http://pbs.twimg.com/profile_images/1449240289/manliorho_-_giusto_normal.jpg"
"x337767301","x1451607686810935301",2021-10-22 17:53:36,"borghi_claudio","@fabriziofino82 @MarcoRCapelli @maryfagi @_xenio_ La maggioranza in parlamento. Ha visto come sono andate le votazioni anche quando abbiamo votato l'esenzione per i minorenni no? https://t.co/FNuFayvZOM","Twitter for Android",139,,,,FALSE,TRUE,0,10,,,,,,,,,,,,,,,,"x337767301 x1607832000 x177164070 x706097800040357889 x419557618","borghi_claudio fabriziofino82 MarcoRCapelli maryfagi _xenio_","it",,,,,,,,,,,,,,,,"x1451607578694324244","@fabriziofino82 @MarcoRCapelli @maryfagi @_xenio_ La maggioranza in parlamento. Ha visto come sono andate le votazioni anche quando abbiamo votato l'esenzione per i minorenni no? https://t.co/FNuFayvZOM",2021-10-22 17:53:10,"Twitter for Android",37,10,"x337767301","borghi_claudio","Claudio Borghi A.",117986,1328,213713,"Italia","Deputato della Repubblica Italiana eletto in Toscana per la Lega. Consigliere Comunale di Como",TRUE,,,,,,,"NA NA","NA NA","NA NA NA NA NA NA NA NA","https://twitter.com/borghi_claudio/status/1451607686810935301","Claudio Borghi A.","Italia","Deputato della Repubblica Italiana eletto in Toscana per la Lega. Consigliere Comunale di Como","https://t.co/LhQnD0sHz3",FALSE,117986,1328,818,213713,1299,2011-07-18 15:08:25,TRUE,"https://t.co/LhQnD0sHz3","http://tiny.cc/j3065y",,"https://pbs.twimg.com/profile_banners/337767301/1607040672","http://abs.twimg.com/images/themes/theme1/bg.png","http://pbs.twimg.com/profile_images/1449240289/manliorho_-_giusto_normal.jpg"
"x337767301","x1451607578694324244",2021-10-22 17:53:10,"borghi_claudio","@fabriziofino82 @MarcoRCapelli @maryfagi @_xenio_ La maggioranza in parlamento. Ha visto come sono andate le votazioni anche quando abbiamo votato l'esenzione per i minorenni no? https://t.co/FNuFayvZOM","Twitter for Android",128,"x1451605543739613184","x1607832000","fabriziofino82",FALSE,FALSE,37,10,,,,,,,,"http://pbs.twimg.com/media/FCUlZQiXEB8l16Z.jpg","https://t.co/FNuFayvZOM","https://twitter.com/borghi_claudio/status/1451607578694324244/photo/1","photo","http://pbs.twimg.com/media/FCUlZQiXEB8l16Z.jpg","https://t.co/FNuFayvZOM","https://twitter.com/borghi_claudio/status/1451607578694324244/photo/1",,"x1607832000 x177164070 x706097800040357889 x419557618","fabriziofino82 MarcoRCapelli maryfagi _xenio_","it",,,,,,,,,,,,,,,,,,,,,,,,,,,,,,,,,,,,,"NA NA","NA NA","NA NA NA NA NA NA NA NA","https://twitter.com/borghi_claudio/status/1451607578694324244","Claudio Borghi A.","Italia","Deputato della Repubblica Italiana eletto in Toscana per la Lega. Consigliere Comunale di Como","https://t.co/LhQnD0sHz3",FALSE,117986,1328,818,213713,1299,2011-07-18 15:08:25,TRUE,"https://t.co/LhQnD0sHz3","http://tiny.cc/j3065y",,"https://pbs.twimg.com/profile_banners/337767301/1607040672","http://abs.twimg.com/images/themes/theme1/bg.png","http://pbs.twimg.com/profile_images/1449240289/manliorho_-_giusto_normal.jpg"
"x337767301","x1451606871798845445",2021-10-22 17:50:22,"borghi_claudio","@maxok07 @MarcoRCapelli @maryfagi @_xenio_ Potrebbe essere positivo per il partito ma lei sa che non abolirebbe nulla vero?
La domanda è ""come si fa ad abolire una cosa che la maggioranza vuole""","Twitter for Android",151,"x1451605400290275337","x411784978","maxok07",FALSE,FALSE,14,3,,,,,,,,,,,,,,,,"x411784978 x177164070 x706097800040357889 x419557618","maxok07 MarcoRCapelli maryfagi _xenio_","it",,,,,,,,,,,,,,,,,,,,,,,,,,,,,,,,,,,,,"NA NA","NA NA","NA NA NA NA NA NA NA NA","https://twitter.com/borghi_claudio/status/1451606871798845445","Claudio Borghi A.","Italia","Deputato della Repubblica Italiana eletto in Toscana per la Lega. Consigliere Comunale di Como","https://t.co/LhQnD0sHz3",FALSE,117986,1328,818,213713,1299,2011-07-18 15:08:25,TRUE,"https://t.co/LhQnD0sHz3","http://tiny.cc/j3065y",,"https://pbs.twimg.com/profile_banners/337767301/1607040672","http://abs.twimg.com/images/themes/theme1/bg.png","http://pbs.twimg.com/profile_images/1449240289/manliorho_-_giusto_normal.jpg"
"x337767301","x1451606173170470933",2021-10-22 17:47:35,"borghi_claudio","@henryAverydue @MarcoRCapelli @maryfagi @_xenio_ Opposizione dura come quella che abbiamo fatto contro conte e i lockdown? Mi è piaciuto farla ma se l'opposizione di una minoranza fermasse la maggioranza nessuno farebbe mai niente non trova?","Twitter for Android",192,"x1451604547898589199","x1438899313292333062","henryAverydue",FALSE,FALSE,6,2,,,,,,,,,,,,,,,,"x1438899313292333062 x177164070 x706097800040357889 x419557618","henryAverydue MarcoRCapelli maryfagi _xenio_","it",,,,,,,,,,,,,,,,,,,,,,,,,,,,,,,,,,,,,"NA NA","NA NA","NA NA NA NA NA NA NA NA","https://twitter.com/borghi_claudio/status/1451606173170470933","Claudio Borghi A.","Italia","Deputato della Repubblica Italiana eletto in Toscana per la Lega. Consigliere Comunale di Como","https://t.co/LhQnD0sHz3",FALSE,117986,1328,818,213713,1299,2011-07-18 15:08:25,TRUE,"https://t.co/LhQnD0sHz3","http://tiny.cc/j3065y",,"https://pbs.twimg.com/profile_banners/337767301/1607040672","http://abs.twimg.com/images/themes/theme1/bg.png","http://pbs.twimg.com/profile_images/1449240289/manliorho_-_giusto_normal.jpg"
"x337767301","x1451605733074735107",2021-10-22 17:45:50,"borghi_claudio","@Ezio36640283 @MarcoRCapelli @maryfagi @_xenio_ Mi pare di averla già sentita all'inizio di settimana scorsa ma mi pare non abbia funzionato molto. In ogni caso non è una cosa che posso fare io","Twitter for Android",145,"x1451604821283377158","x1322893712557592576","Ezio36640283",FALSE,FALSE,7,2,,,,,,,,,,,,,,,,"x1322893712557592576 x177164070 x706097800040357889 x419557618","Ezio36640283 MarcoRCapelli maryfagi _xenio_","it",,,,,,,,,,,,,,,,,,,,,,,,,,,,,,,,,,,,,"NA NA","NA NA","NA NA NA NA NA NA NA NA","https://twitter.com/borghi_claudio/status/1451605733074735107","Claudio Borghi A.","Italia","Deputato della Repubblica Italiana eletto in Toscana per la Lega. Consigliere Comunale di Como","https://t.co/LhQnD0sHz3",FALSE,117986,1328,818,213713,1299,2011-07-18 15:08:25,TRUE,"https://t.co/LhQnD0sHz3","http://tiny.cc/j3065y",,"https://pbs.twimg.com/profile_banners/337767301/1607040672","http://abs.twimg.com/images/themes/theme1/bg.png","http://pbs.twimg.com/profile_images/1449240289/manliorho_-_giusto_normal.jpg"
"x337767301","x1451605301342396418",2021-10-22 17:44:08,"borghi_claudio","@polpetine @Matteo89565783 @MarcoRCapelli @maryfagi @_xenio_ Ci sono i contrappesi costituzionali, ovvero il presidente della repubblica che potrebbe non firmare (ma l'ha già fatto) o un tribunale che in una causa demandasse la questione alla corte costituzionale che sospetto già cosa direbbe 🙄 ma in ogni caso ci vogliono mesi.","Twitter for Android",268,"x1451604053960663042","x922977180","polpetine",FALSE,FALSE,4,0,,,,,,,,,,,,,,,,"x922977180 x1303284209918902273 x177164070 x706097800040357889 x419557618","polpetine Matteo89565783 MarcoRCapelli maryfagi _xenio_","it",,,,,,,,,,,,,,,,,,,,,,,,,,,,,,,,,,,,,"NA NA","NA NA","NA NA NA NA NA NA NA NA","https://twitter.com/borghi_claudio/status/1451605301342396418","Claudio Borghi A.","Italia","Deputato della Repubblica Italiana eletto in Toscana per la Lega. Consigliere Comunale di Como","https://t.co/LhQnD0sHz3",FALSE,117986,1328,818,213713,1299,2011-07-18 15:08:25,TRUE,"https://t.co/LhQnD0sHz3","http://tiny.cc/j3065y",,"https://pbs.twimg.com/profile_banners/337767301/1607040672","http://abs.twimg.com/images/themes/theme1/bg.png","http://pbs.twimg.com/profile_images/1449240289/manliorho_-_giusto_normal.jpg"
"x337767301","x1451604494157062155",2021-10-22 17:40:55,"borghi_claudio","@Imerio63869627 @MarcoRCapelli @maryfagi @_xenio_ Questo è un problema del partito, non del cittadino. Mi serve una risposta a chi dice di toglierlo e basta.","Twitter for Android",107,"x1451604118460637184","x1435279781579395081","Imerio63869627",FALSE,FALSE,5,3,,,,,,,,,,,,,,,,"x1435279781579395081 x177164070 x706097800040357889 x419557618","Imerio63869627 MarcoRCapelli maryfagi _xenio_","it",,,,,,,,,,,,,,,,,,,,,,,,,,,,,,,,,,,,,"NA NA","NA NA","NA NA NA NA NA NA NA NA","https://twitter.com/borghi_claudio/status/1451604494157062155","Claudio Borghi A.","Italia","Deputato della Repubblica Italiana eletto in Toscana per la Lega. Consigliere Comunale di Como","https://t.co/LhQnD0sHz3",FALSE,117986,1328,818,213713,1299,2011-07-18 15:08:25,TRUE,"https://t.co/LhQnD0sHz3","http://tiny.cc/j3065y",,"https://pbs.twimg.com/profile_banners/337767301/1607040672","http://abs.twimg.com/images/themes/theme1/bg.png","http://pbs.twimg.com/profile_images/1449240289/manliorho_-_giusto_normal.jpg"
"x337767301","x1451603117682921485",2021-10-22 17:35:27,"borghi_claudio","@MarcoRCapelli @maryfagi @_xenio_ Ah sono d'accordo. Idee su come fare per toglierlo se la maggioranza invece lo vuole? Se posso sono a disposizione.","Twitter for Android",140,,,,FALSE,TRUE,0,8,,,,,,,,,,,,,,,,"x337767301 x177164070 x706097800040357889 x419557618","borghi_claudio MarcoRCapelli maryfagi _xenio_","it",,,,,,,,,,,,,,,,"x1451603069532258304","@MarcoRCapelli @maryfagi @_xenio_ Ah sono d'accordo. Idee su come fare per toglierlo se la maggioranza invece lo vuole? Se posso sono a disposizione.",2021-10-22 17:35:15,"Twitter for Android",52,8,"x337767301","borghi_claudio","Claudio Borghi A.",117986,1328,213713,"Italia","Deputato della Repubblica Italiana eletto in Toscana per la Lega. Consigliere Comunale di Como",TRUE,,,,,,,"NA NA","NA NA","NA NA NA NA NA NA NA NA","https://twitter.com/borghi_claudio/status/1451603117682921485","Claudio Borghi A.","Italia","Deputato della Repubblica Italiana eletto in Toscana per la Lega. Consigliere Comunale di Como","https://t.co/LhQnD0sHz3",FALSE,117986,1328,818,213713,1299,2011-07-18 15:08:25,TRUE,"https://t.co/LhQnD0sHz3","http://tiny.cc/j3065y",,"https://pbs.twimg.com/profile_banners/337767301/1607040672","http://abs.twimg.com/images/themes/theme1/bg.png","http://pbs.twimg.com/profile_images/1449240289/manliorho_-_giusto_normal.jpg"
"x337767301","x1451603069532258304",2021-10-22 17:35:15,"borghi_claudio","@MarcoRCapelli @maryfagi @_xenio_ Ah sono d'accordo. Idee su come fare per toglierlo se la maggioranza invece lo vuole? Se posso sono a disposizione.","Twitter for Android",115,"x1451596208443645958","x177164070","MarcoRCapelli",FALSE,FALSE,52,8,,,,,,,,,,,,,,,,"x177164070 x706097800040357889 x419557618","MarcoRCapelli maryfagi _xenio_","it",,,,,,,,,,,,,,,,,,,,,,,,,,,,,,,,,,,,,"NA NA","NA NA","NA NA NA NA NA NA NA NA","https://twitter.com/borghi_claudio/status/1451603069532258304","Claudio Borghi A.","Italia","Deputato della Repubblica Italiana eletto in Toscana per la Lega. Consigliere Comunale di Como","https://t.co/LhQnD0sHz3",FALSE,117986,1328,818,213713,1299,2011-07-18 15:08:25,TRUE,"https://t.co/LhQnD0sHz3","http://tiny.cc/j3065y",,"https://pbs.twimg.com/profile_banners/337767301/1607040672","http://abs.twimg.com/images/themes/theme1/bg.png","http://pbs.twimg.com/profile_images/1449240289/manliorho_-_giusto_normal.jpg"
"x337767301","x1451595636311220230",2021-10-22 17:05:43,"borghi_claudio","Dato che si parla di pensioni e bilancio vi invito a riascoltare la puntata di ieri di ""scuola di magia"" dove ho trattato proprio questi argomenti. 

https://t.co/PCz3Afjbjp","Twitter for Android",173,,,,FALSE,FALSE,70,22,,,,,"youtu.be/2B1hforv1lU","https://t.co/PCz3Afjbjp","https://youtu.be/2B1hforv1lU",,,,,,,,,,,"it",,,,,,,,,,,,,,,,,,,,,,,,,,,,,,,,,,,,,"NA NA","NA NA","NA NA NA NA NA NA NA NA","https://twitter.com/borghi_claudio/status/1451595636311220230","Claudio Borghi A.","Italia","Deputato della Repubblica Italiana eletto in Toscana per la Lega. Consigliere Comunale di Como","https://t.co/LhQnD0sHz3",FALSE,117986,1328,818,213713,1299,2011-07-18 15:08:25,TRUE,"https://t.co/LhQnD0sHz3","http://tiny.cc/j3065y",,"https://pbs.twimg.com/profile_banners/337767301/1607040672","http://abs.twimg.com/images/themes/theme1/bg.png","http://pbs.twimg.com/profile_images/1449240289/manliorho_-_giusto_normal.jpg"
"x337767301","x1451593864981225533",2021-10-22 16:58:41,"borghi_claudio","@maryfagi @_xenio_ So che è uno degli emendamenti che i colleghi del senato hanno presentato al decreto green pass... esenzione per lo sport dei ragazzi","Twitter for Android",140,,,,FALSE,TRUE,0,12,,,,,,,,,,,,,,,,"x337767301 x706097800040357889 x419557618","borghi_claudio maryfagi _xenio_","it",,,,,,,,,,,,,,,,"x1451593821221961731","@maryfagi @_xenio_ So che è uno degli emendamenti che i colleghi del senato hanno presentato al decreto green pass... esenzione per lo sport dei ragazzi",2021-10-22 16:58:30,"Twitter for Android",60,12,"x337767301","borghi_claudio","Claudio Borghi A.",117986,1328,213713,"Italia","Deputato della Repubblica Italiana eletto in Toscana per la Lega. Consigliere Comunale di Como",TRUE,,,,,,,"NA NA","NA NA","NA NA NA NA NA NA NA NA","https://twitter.com/borghi_claudio/status/1451593864981225533","Claudio Borghi A.","Italia","Deputato della Repubblica Italiana eletto in Toscana per la Lega. Consigliere Comunale di Como","https://t.co/LhQnD0sHz3",FALSE,117986,1328,818,213713,1299,2011-07-18 15:08:25,TRUE,"https://t.co/LhQnD0sHz3","http://tiny.cc/j3065y",,"https://pbs.twimg.com/profile_banners/337767301/1607040672","http://abs.twimg.com/images/themes/theme1/bg.png","http://pbs.twimg.com/profile_images/1449240289/manliorho_-_giusto_normal.jpg"
"x337767301","x1451593821221961731",2021-10-22 16:58:30,"borghi_claudio","@maryfagi @_xenio_ So che è uno degli emendamenti che i colleghi del senato hanno presentato al decreto green pass... esenzione per lo sport dei ragazzi","Twitter for Android",133,"x1451292243155996677","x706097800040357889","maryfagi",FALSE,FALSE,60,12,,,,,,,,,,,,,,,,"x706097800040357889 x419557618","maryfagi _xenio_","it",,,,,,,,,,,,,,,,,,,,,,,,,,,,,,,,,,,,,"NA NA","NA NA","NA NA NA NA NA NA NA NA","https://twitter.com/borghi_claudio/status/1451593821221961731","Claudio Borghi A.","Italia","Deputato della Repubblica Italiana eletto in Toscana per la Lega. Consigliere Comunale di Como","https://t.co/LhQnD0sHz3",FALSE,117986,1328,818,213713,1299,2011-07-18 15:08:25,TRUE,"https://t.co/LhQnD0sHz3","http://tiny.cc/j3065y",,"https://pbs.twimg.com/profile_banners/337767301/1607040672","http://abs.twimg.com/images/themes/theme1/bg.png","http://pbs.twimg.com/profile_images/1449240289/manliorho_-_giusto_normal.jpg"
"x337767301","x1451593203447107585",2021-10-22 16:56:03,"borghi_claudio","@matteosalvinimi e @GiorgiaMeloni 
(Fanno paura, MOLTA paura. Insieme loro potrebbero cambiare l'Italia. Certo, non sarà semplice; ma dovremo difendere questa coppia perché faranno e s'inventeranno di tutto per dividerla, di TUTTO! Sono l'unica speranza che abbiamo.) https://t.co/bK44fRqDER","Twitter for Android",140,,,,FALSE,TRUE,0,30,,,,,,,,,,,,,,,,"x419557618 x270839361 x130537001","_xenio_ matteosalvinimi GiorgiaMeloni","it",,,,,,,,,,,,,,,,"x1451286351513542659","@matteosalvinimi e @GiorgiaMeloni 
(Fanno paura, MOLTA paura. Insieme loro potrebbero cambiare l'Italia. Certo, non sarà semplice; ma dovremo difendere questa coppia perché faranno e s'inventeranno di tutto per dividerla, di TUTTO! Sono l'unica speranza che abbiamo.) https://t.co/bK44fRqDER",2021-10-21 20:36:44,"Twitter Web App",114,30,"x419557618","_xenio_","🅰𝓵𝓮 🇮🇹",2128,847,64753,"- NowhereMan®","(Seguo sempre i consigli della mamma: non accetto caramelle dagli sconosciuti!) #sparewheel",FALSE,,,,,,,"NA NA","NA NA","NA NA NA NA NA NA NA NA","https://twitter.com/borghi_claudio/status/1451593203447107585","Claudio Borghi A.","Italia","Deputato della Repubblica Italiana eletto in Toscana per la Lega. Consigliere Comunale di Como","https://t.co/LhQnD0sHz3",FALSE,117986,1328,818,213713,1299,2011-07-18 15:08:25,TRUE,"https://t.co/LhQnD0sHz3","http://tiny.cc/j3065y",,"https://pbs.twimg.com/profile_banners/337767301/1607040672","http://abs.twimg.com/images/themes/theme1/bg.png","http://pbs.twimg.com/profile_images/1449240289/manliorho_-_giusto_normal.jpg"
"x337767301","x1451590365354631182",2021-10-22 16:44:47,"borghi_claudio","Un paese all'asta... https://t.co/PYt8gEUbts","Twitter for Android",20,,,,FALSE,FALSE,255,96,,,,,,,,"http://pbs.twimg.com/media/FCUVvUcXoAcso0P.jpg","https://t.co/PYt8gEUbts","https://twitter.com/borghi_claudio/status/1451590365354631182/photo/1","photo","http://pbs.twimg.com/media/FCUVvUcXoAcso0P.jpg","https://t.co/PYt8gEUbts","https://twitter.com/borghi_claudio/status/1451590365354631182/photo/1",,,,"it",,,,,,,,,,,,,,,,,,,,,,,,,,,,,,,,,,,,,"NA NA","NA NA","NA NA NA NA NA NA NA NA","https://twitter.com/borghi_claudio/status/1451590365354631182","Claudio Borghi A.","Italia","Deputato della Repubblica Italiana eletto in Toscana per la Lega. Consigliere Comunale di Como","https://t.co/LhQnD0sHz3",FALSE,117986,1328,818,213713,1299,2011-07-18 15:08:25,TRUE,"https://t.co/LhQnD0sHz3","http://tiny.cc/j3065y",,"https://pbs.twimg.com/profile_banners/337767301/1607040672","http://abs.twimg.com/images/themes/theme1/bg.png","http://pbs.twimg.com/profile_images/1449240289/manliorho_-_giusto_normal.jpg"
"x337767301","x1451581644834578434",2021-10-22 16:10:07,"borghi_claudio","@dottorbarbieri Ovvio... ne abbiamo parlato enne volte 🤗","Twitter for Android",76,,,,FALSE,TRUE,0,5,,,,,,,,,,,,,,,,"x337767301 x445201884","borghi_claudio dottorbarbieri","it",,,,,,,,,,,,,,,,"x1451580258042396675","@dottorbarbieri Ovvio... ne abbiamo parlato enne volte 🤗",2021-10-22 16:04:37,"Twitter for Android",35,5,"x337767301","borghi_claudio","Claudio Borghi A.",117986,1328,213713,"Italia","Deputato della Repubblica Italiana eletto in Toscana per la Lega. Consigliere Comunale di Como",TRUE,,,,,,,"NA NA","NA NA","NA NA NA NA NA NA NA NA","https://twitter.com/borghi_claudio/status/1451581644834578434","Claudio Borghi A.","Italia","Deputato della Repubblica Italiana eletto in Toscana per la Lega. Consigliere Comunale di Como","https://t.co/LhQnD0sHz3",FALSE,117986,1328,818,213713,1299,2011-07-18 15:08:25,TRUE,"https://t.co/LhQnD0sHz3","http://tiny.cc/j3065y",,"https://pbs.twimg.com/profile_banners/337767301/1607040672","http://abs.twimg.com/images/themes/theme1/bg.png","http://pbs.twimg.com/profile_images/1449240289/manliorho_-_giusto_normal.jpg"
"x337767301","x1451581480354844673",2021-10-22 16:09:28,"borghi_claudio","@ELENABO57732311 Cara Elena, l'eventuale nostra uscita dal governo potrebbe fare meglio al mio partito ma peggio alla sua situazione perché a quel punto avrebbe campo ancor più libero. Sono scelte difficili e, purtroppo per lei, io avrei un'idea ben precisa sul da farsi ma non dipende da me.","Twitter for Android",275,"x1451575156304982018","x507846462","ELENABO57732311",FALSE,FALSE,6,1,,,,,,,,,,,,,,,,"x507846462","ELENABO57732311","it",,,,,,,,,,,,,,,,,,,,,,,,,,,,,,,,,,,,,"NA NA","NA NA","NA NA NA NA NA NA NA NA","https://twitter.com/borghi_claudio/status/1451581480354844673","Claudio Borghi A.","Italia","Deputato della Repubblica Italiana eletto in Toscana per la Lega. Consigliere Comunale di Como","https://t.co/LhQnD0sHz3",FALSE,117986,1328,818,213713,1299,2011-07-18 15:08:25,TRUE,"https://t.co/LhQnD0sHz3","http://tiny.cc/j3065y",,"https://pbs.twimg.com/profile_banners/337767301/1607040672","http://abs.twimg.com/images/themes/theme1/bg.png","http://pbs.twimg.com/profile_images/1449240289/manliorho_-_giusto_normal.jpg"
"x337767301","x1451580600310276109",2021-10-22 16:05:58,"borghi_claudio","@niforcheri Che è il redistributivo?","Twitter for Android",56,,,,FALSE,TRUE,0,4,,,,,,,,,,,,,,,,"x337767301 x949926276","borghi_claudio niforcheri","it",,,,,,,,,,,,,,,,"x1451580582245412866","@niforcheri Che è il redistributivo?",2021-10-22 16:05:54,"Twitter for Android",38,4,"x337767301","borghi_claudio","Claudio Borghi A.",117986,1328,213713,"Italia","Deputato della Repubblica Italiana eletto in Toscana per la Lega. Consigliere Comunale di Como",TRUE,,,,,,,"NA NA","NA NA","NA NA NA NA NA NA NA NA","https://twitter.com/borghi_claudio/status/1451580600310276109","Claudio Borghi A.","Italia","Deputato della Repubblica Italiana eletto in Toscana per la Lega. Consigliere Comunale di Como","https://t.co/LhQnD0sHz3",FALSE,117986,1328,818,213713,1299,2011-07-18 15:08:25,TRUE,"https://t.co/LhQnD0sHz3","http://tiny.cc/j3065y",,"https://pbs.twimg.com/profile_banners/337767301/1607040672","http://abs.twimg.com/images/themes/theme1/bg.png","http://pbs.twimg.com/profile_images/1449240289/manliorho_-_giusto_normal.jpg"
"x337767301","x1451580582245412866",2021-10-22 16:05:54,"borghi_claudio","@niforcheri Che è il redistributivo?","Twitter for Android",24,"x1451573592429371396","x949926276","niforcheri",FALSE,FALSE,38,4,,,,,,,,,,,,,,,,"x949926276","niforcheri","it",,,,,,,,,,,,,,,,,,,,,,,,,,,,,,,,,,,,,"NA NA","NA NA","NA NA NA NA NA NA NA NA","https://twitter.com/borghi_claudio/status/1451580582245412866","Claudio Borghi A.","Italia","Deputato della Repubblica Italiana eletto in Toscana per la Lega. Consigliere Comunale di Como","https://t.co/LhQnD0sHz3",FALSE,117986,1328,818,213713,1299,2011-07-18 15:08:25,TRUE,"https://t.co/LhQnD0sHz3","http://tiny.cc/j3065y",,"https://pbs.twimg.com/profile_banners/337767301/1607040672","http://abs.twimg.com/images/themes/theme1/bg.png","http://pbs.twimg.com/profile_images/1449240289/manliorho_-_giusto_normal.jpg"
"x337767301","x1451580258042396675",2021-10-22 16:04:37,"borghi_claudio","@dottorbarbieri Ovvio... ne abbiamo parlato enne volte 🤗","Twitter for Android",40,"x1451574575083499520","x445201884","dottorbarbieri",FALSE,FALSE,35,5,,,,,,,,,,,,,,,,"x445201884","dottorbarbieri","it",,,,,,,,,,,,,,,,,,,,,,,,,,,,,,,,,,,,,"NA NA","NA NA","NA NA NA NA NA NA NA NA","https://twitter.com/borghi_claudio/status/1451580258042396675","Claudio Borghi A.","Italia","Deputato della Repubblica Italiana eletto in Toscana per la Lega. Consigliere Comunale di Como","https://t.co/LhQnD0sHz3",FALSE,117986,1328,818,213713,1299,2011-07-18 15:08:25,TRUE,"https://t.co/LhQnD0sHz3","http://tiny.cc/j3065y",,"https://pbs.twimg.com/profile_banners/337767301/1607040672","http://abs.twimg.com/images/themes/theme1/bg.png","http://pbs.twimg.com/profile_images/1449240289/manliorho_-_giusto_normal.jpg"
