"x201658727","x1408424166647287810",2021-06-25 13:57:43,"VittorioSgarbi","L’Unesco è una macchina “ruba soldi” che non dà nulla se non il proprio marchio, siccome si regge sul fatto di essere garante di luoghi meravigliosi nel mondo si appropria di questo diritto. È vero che…
https://t.co/3d3B8j7iRV @stampasgarbi","Twitter for iPhone",240,,,,FALSE,FALSE,46,7,,,,,"corrieredelveneto.corriere.it/venezia-mestre…","https://t.co/3d3B8j7iRV","https://corrieredelveneto.corriere.it/venezia-mestre/cronaca/21_giugno_23/venezia-sgarbi-unesco-macchina-ruba-soldi-blacklist-minaccia-irrealistica-18a8e482-d443-11eb-a166-0e58023f5706.shtml",,,,,,,,,"x2164988132","stampasgarbi","it",,,,,,,,,,,,,,,,,,,,,,,,,,,,,,,,,,,,,"NA NA","NA NA","NA NA NA NA NA NA NA NA","https://twitter.com/VittorioSgarbi/status/1408424166647287810","Vittorio Sgarbi","mai nello stesso luogo","Twitter ufficiale di Vittorio Sgarbi - Storico dell'Arte e Opinionista | Contatti: press@vittoriosgarbi.it
Capra Store: https://t.co/CQpENRR2Il","https://t.co/sL8QrTEiOF",FALSE,756643,334,1271,11034,3998,2010-10-12 10:20:00,TRUE,"https://t.co/sL8QrTEiOF","http://www.vittoriosgarbi.it",,"https://pbs.twimg.com/profile_banners/201658727/1622575690","http://abs.twimg.com/images/themes/theme1/bg.png","http://pbs.twimg.com/profile_images/378800000563952334/834a3c187534931f8af26f78b6c274a8_normal.jpeg"
"x201658727","x1408326517713784832",2021-06-25 07:29:41,"VittorioSgarbi","Da sabato 26 giugno e fino al 30 settembre 2021 nello spazio multimediale San Francesco a Civitanova Marche la mostra «La solitudine delle cose» del fotografo Massimo Listri a cura di Vittorio Sgarbi.
Allestimento di Sabrina Colle. @stampasgarbi @AnsaMarche https://t.co/j9peWcD32I","Twitter Web App",257,,,,FALSE,FALSE,41,9,,,,,,,,"http://pbs.twimg.com/media/E4thZIFXEAAqmDV.jpg","https://t.co/j9peWcD32I","https://twitter.com/VittorioSgarbi/status/1408326517713784832/photo/1","photo","http://pbs.twimg.com/media/E4thZIFXEAAqmDV.jpg","https://t.co/j9peWcD32I","https://twitter.com/VittorioSgarbi/status/1408326517713784832/photo/1",,"x2164988132 x1077159518","stampasgarbi AnsaMarche","it",,,,,,,,,,,,,,,,,,,,,,,,,,,,,,,,,,,,,"NA NA","NA NA","NA NA NA NA NA NA NA NA","https://twitter.com/VittorioSgarbi/status/1408326517713784832","Vittorio Sgarbi","mai nello stesso luogo","Twitter ufficiale di Vittorio Sgarbi - Storico dell'Arte e Opinionista | Contatti: press@vittoriosgarbi.it
Capra Store: https://t.co/CQpENRR2Il","https://t.co/sL8QrTEiOF",FALSE,756643,334,1271,11034,3998,2010-10-12 10:20:00,TRUE,"https://t.co/sL8QrTEiOF","http://www.vittoriosgarbi.it",,"https://pbs.twimg.com/profile_banners/201658727/1622575690","http://abs.twimg.com/images/themes/theme1/bg.png","http://pbs.twimg.com/profile_images/378800000563952334/834a3c187534931f8af26f78b6c274a8_normal.jpeg"
"x201658727","x1408323528970190848",2021-06-25 07:17:49,"VittorioSgarbi","#libri «Reagan. Il presidente che cambiò la politica americana», il nuovo libro del giornalista Gennaro Sangiuliano (Tg2). https://t.co/wOU9DFqG0P @GenSangiuliano @stampasgarbi @Librimondadori","Twitter Web App",192,,,,FALSE,FALSE,56,14,,,"libri",,"youtu.be/iafhTc4mbqY","https://t.co/wOU9DFqG0P","https://youtu.be/iafhTc4mbqY",,,,,,,,,"x464894684 x2164988132 x21407990","GenSangiuliano stampasgarbi Librimondadori","it",,,,,,,,,,,,,,,,,,,,,,,,,,,,,,,,,,,,,"NA NA","NA NA","NA NA NA NA NA NA NA NA","https://twitter.com/VittorioSgarbi/status/1408323528970190848","Vittorio Sgarbi","mai nello stesso luogo","Twitter ufficiale di Vittorio Sgarbi - Storico dell'Arte e Opinionista | Contatti: press@vittoriosgarbi.it
Capra Store: https://t.co/CQpENRR2Il","https://t.co/sL8QrTEiOF",FALSE,756643,334,1271,11034,3998,2010-10-12 10:20:00,TRUE,"https://t.co/sL8QrTEiOF","http://www.vittoriosgarbi.it",,"https://pbs.twimg.com/profile_banners/201658727/1622575690","http://abs.twimg.com/images/themes/theme1/bg.png","http://pbs.twimg.com/profile_images/378800000563952334/834a3c187534931f8af26f78b6c274a8_normal.jpeg"
"x201658727","x1408185322010198017",2021-06-24 22:08:38,"VittorioSgarbi","La Roma dei bus nuovi, con aria condizionata... @InfoAtac @virginiaraggi @VittorioSgarbi @romatoday @romamobilita @romafaschifo #vergogna https://t.co/jIlAi5Piqp","Twitter Web App",139,,,,FALSE,TRUE,0,14,,,,,,,,,,,,,,,,"x408475532 x370690455 x1530798872 x201658727 x30427244 x121156941 x599940695","Lob81 InfoAtac virginiaraggi VittorioSgarbi romatoday romamobilita romafaschifo","it",,,,,,,,,,,,,,,,"x1407365176081387527","La Roma dei bus nuovi, con aria condizionata... @InfoAtac @virginiaraggi @VittorioSgarbi @romatoday @romamobilita @romafaschifo #vergogna https://t.co/jIlAi5Piqp",2021-06-22 15:49:40,"Twitter for Android",50,14,"x408475532","Lob81","Robbie",457,742,7145,"Costa Rica","Amo guardare il mondo con occhi da turista! attivista del pensiero positivo :) ; vegetariano!ricercatore del vero.",FALSE,,,,,,,"NA NA","NA NA","NA NA NA NA NA NA NA NA","https://twitter.com/VittorioSgarbi/status/1408185322010198017","Vittorio Sgarbi","mai nello stesso luogo","Twitter ufficiale di Vittorio Sgarbi - Storico dell'Arte e Opinionista | Contatti: press@vittoriosgarbi.it
Capra Store: https://t.co/CQpENRR2Il","https://t.co/sL8QrTEiOF",FALSE,756643,334,1271,11034,3998,2010-10-12 10:20:00,TRUE,"https://t.co/sL8QrTEiOF","http://www.vittoriosgarbi.it",,"https://pbs.twimg.com/profile_banners/201658727/1622575690","http://abs.twimg.com/images/themes/theme1/bg.png","http://pbs.twimg.com/profile_images/378800000563952334/834a3c187534931f8af26f78b6c274a8_normal.jpeg"
"x201658727","x1408120048091287554",2021-06-24 17:49:15,"VittorioSgarbi","Il povero Michele Serra è caduto sulla porchetta…  https://t.co/7SUpXduFha @stampasgarbi @ilgiornale","Twitter for iPhone",100,,,,FALSE,FALSE,77,14,,,,,"youtu.be/RzQByJflir4","https://t.co/7SUpXduFha","https://youtu.be/RzQByJflir4",,,,,,,,,"x2164988132 x25508589","stampasgarbi ilgiornale","it",,,,,,,,,,,,,,,,,,,,,,,,,,,,,,,,,,,,,"NA NA","NA NA","NA NA NA NA NA NA NA NA","https://twitter.com/VittorioSgarbi/status/1408120048091287554","Vittorio Sgarbi","mai nello stesso luogo","Twitter ufficiale di Vittorio Sgarbi - Storico dell'Arte e Opinionista | Contatti: press@vittoriosgarbi.it
Capra Store: https://t.co/CQpENRR2Il","https://t.co/sL8QrTEiOF",FALSE,756643,334,1271,11034,3998,2010-10-12 10:20:00,TRUE,"https://t.co/sL8QrTEiOF","http://www.vittoriosgarbi.it",,"https://pbs.twimg.com/profile_banners/201658727/1622575690","http://abs.twimg.com/images/themes/theme1/bg.png","http://pbs.twimg.com/profile_images/378800000563952334/834a3c187534931f8af26f78b6c274a8_normal.jpeg"
"x201658727","x1408088556199976961",2021-06-24 15:44:07,"VittorioSgarbi","Se pensano d’intimidirmi,  si sono fatti male i conti.
Comunque, alcune precisazioni. 
Non ho esportato nulla di nulla. 
Il quadro, che evidentemente non è mio, mi è stato sottoposto perché lo studiassi e… https://t.co/qccfmyABHx @stampasgarbi","Twitter for iPhone",243,,,,FALSE,FALSE,221,33,,,,,"secoloditalia.it/2021/06/sgarbi…","https://t.co/qccfmyABHx","https://www.secoloditalia.it/2021/06/sgarbi-altre-grane-mi-attaccano-per-la-mia-candidatura-indagato-per-un-quadro-scomparso-dallitalia/",,,,,,,,,"x2164988132","stampasgarbi","it",,,,,,,,,,,,,,,,,,,,,,,,,,,,,,,,,,,,,"NA NA","NA NA","NA NA NA NA NA NA NA NA","https://twitter.com/VittorioSgarbi/status/1408088556199976961","Vittorio Sgarbi","mai nello stesso luogo","Twitter ufficiale di Vittorio Sgarbi - Storico dell'Arte e Opinionista | Contatti: press@vittoriosgarbi.it
Capra Store: https://t.co/CQpENRR2Il","https://t.co/sL8QrTEiOF",FALSE,756643,334,1271,11034,3998,2010-10-12 10:20:00,TRUE,"https://t.co/sL8QrTEiOF","http://www.vittoriosgarbi.it",,"https://pbs.twimg.com/profile_banners/201658727/1622575690","http://abs.twimg.com/images/themes/theme1/bg.png","http://pbs.twimg.com/profile_images/378800000563952334/834a3c187534931f8af26f78b6c274a8_normal.jpeg"
"x201658727","x1408072893649473539",2021-06-24 14:41:53,"VittorioSgarbi","Ci mancava il prete che durante la Messa fa propaganda ideologica a sostegno di una legge liberticida! https://t.co/BW79Wg35Q5","Twitter for iPhone",126,,,,FALSE,FALSE,598,95,,,,,"ilprimatonazionale.it/cronaca/ddl-za…","https://t.co/BW79Wg35Q5","https://www.ilprimatonazionale.it/cronaca/ddl-zan-liniziativa-prete-pro-ddlzan-198723/",,,,,,,,,,,"it",,,,,,,,,,,,,,,,,,,,,,,,,,,,,,,,,,,,,"NA NA","NA NA","NA NA NA NA NA NA NA NA","https://twitter.com/VittorioSgarbi/status/1408072893649473539","Vittorio Sgarbi","mai nello stesso luogo","Twitter ufficiale di Vittorio Sgarbi - Storico dell'Arte e Opinionista | Contatti: press@vittoriosgarbi.it
Capra Store: https://t.co/CQpENRR2Il","https://t.co/sL8QrTEiOF",FALSE,756643,334,1271,11034,3998,2010-10-12 10:20:00,TRUE,"https://t.co/sL8QrTEiOF","http://www.vittoriosgarbi.it",,"https://pbs.twimg.com/profile_banners/201658727/1622575690","http://abs.twimg.com/images/themes/theme1/bg.png","http://pbs.twimg.com/profile_images/378800000563952334/834a3c187534931f8af26f78b6c274a8_normal.jpeg"
"x499672556","x1408124310422790145",2021-06-24 18:06:11,"GiorgioSilli","Quando la competenza va oltre i colori politici. #Congratulazioni e auguri di Buon Lavoro @GiorgioSilli! 
@Montecitorio https://t.co/4YjRIjAmmH","Twitter for iPhone",137,,,,FALSE,TRUE,0,2,,,"Congratulazioni",,,,,,,,,,,,,"x906269360 x499672556 x2278995820","tripodimaria GiorgioSilli Montecitorio","it",,,,,,,,,,,,,,,,"x1407967135570268167","Quando la competenza va oltre i colori politici. #Congratulazioni e auguri di Buon Lavoro @GiorgioSilli! 
@Montecitorio https://t.co/4YjRIjAmmH",2021-06-24 07:41:38,"Twitter for iPhone",5,2,"x906269360","tripodimaria","Maria Tripodi",6387,2285,11023,"","Deputato della Repubblica•  Eletta nel CollegioCalabria2• Capogruppo @forza_Italia CommissioneDifesa•  Dottssa in Relazioni Internazionali•",FALSE,,,,,,,"NA NA","NA NA","NA NA NA NA NA NA NA NA","https://twitter.com/GiorgioSilli/status/1408124310422790145","Giorgio Silli","Prato, Toscana","Deputato della Repubblica, già assessore immigrazione comune di Prato. Tintore. Molto rossiniano","https://t.co/VxbHHp0box",FALSE,1871,629,33,6450,2166,2012-02-22 10:49:12,FALSE,"https://t.co/VxbHHp0box","http://giorgiosilli.it",,"https://pbs.twimg.com/profile_banners/499672556/1434717572","http://abs.twimg.com/images/themes/theme1/bg.png","http://pbs.twimg.com/profile_images/1076762978752577536/9E8AyaPD_normal.jpg"
"x499672556","x1408124250419077120",2021-06-24 18:05:57,"GiorgioSilli","Complimenti al nostro deputato Giorgio Silli che è stato eletto segretario dell’ufficio di #presidenza della Camera dei deputati. Silli è stato votato dall’Assemblea di @Montecitorio con 183 voti (il secondo ne ha presi 9). Buon lavoro!
#Cambiamo https://t.co/b309HuVDhS","Twitter for iPhone",140,,,,FALSE,TRUE,0,1,,,"presidenza",,,,,,,,,,,,,"x1224312700651687937","CambiamoConToti","it",,,,,,,,,,,,,,,,"x1408016524460314625","Complimenti al nostro deputato Giorgio Silli che è stato eletto segretario dell’ufficio di #presidenza della Camera dei deputati. Silli è stato votato dall’Assemblea di @Montecitorio con 183 voti (il secondo ne ha presi 9). Buon lavoro!
#Cambiamo https://t.co/b309HuVDhS",2021-06-24 10:57:53,"Twitter Web App",2,1,"x1224312700651687937","CambiamoConToti","Cambiamo Official",277,173,1186,"","Cambiamo con Toti unisce liberi cittadini che si ispirano ai valori della tradizione liberal democratica",FALSE,,,,,,,"NA NA","NA NA","NA NA NA NA NA NA NA NA","https://twitter.com/GiorgioSilli/status/1408124250419077120","Giorgio Silli","Prato, Toscana","Deputato della Repubblica, già assessore immigrazione comune di Prato. Tintore. Molto rossiniano","https://t.co/VxbHHp0box",FALSE,1871,629,33,6450,2166,2012-02-22 10:49:12,FALSE,"https://t.co/VxbHHp0box","http://giorgiosilli.it",,"https://pbs.twimg.com/profile_banners/499672556/1434717572","http://abs.twimg.com/images/themes/theme1/bg.png","http://pbs.twimg.com/profile_images/1076762978752577536/9E8AyaPD_normal.jpg"
"x499672556","x1408124204344647685",2021-06-24 18:05:46,"GiorgioSilli","Con 183 voti su 398 votanti l'on. @GiorgioSilli è stato eletto segretario di presidenza alla Camera dei Deputati.
#CoraggioItalia https://t.co/Ffog37ArQ0","Twitter for iPhone",140,,,,FALSE,TRUE,0,1,,,,,,,,,,,,,,,,"x1381524763470880769 x499672556","coraggio_italia GiorgioSilli","it",,,,,,,,,,,,,,,,"x1408014149754437637","Con 183 voti su 398 votanti l'on. @GiorgioSilli è stato eletto segretario di presidenza alla Camera dei Deputati.
#CoraggioItalia https://t.co/Ffog37ArQ0",2021-06-24 10:48:27,"Twitter Web App",15,1,"x1381524763470880769","coraggio_italia","Coraggio Italia",279,49,71,"","Account ufficiale di #CoraggioItalia - FB https://t.co/ZexqAB47aM",FALSE,,,,,,,"NA NA","NA NA","NA NA NA NA NA NA NA NA","https://twitter.com/GiorgioSilli/status/1408124204344647685","Giorgio Silli","Prato, Toscana","Deputato della Repubblica, già assessore immigrazione comune di Prato. Tintore. Molto rossiniano","https://t.co/VxbHHp0box",FALSE,1871,629,33,6450,2166,2012-02-22 10:49:12,FALSE,"https://t.co/VxbHHp0box","http://giorgiosilli.it",,"https://pbs.twimg.com/profile_banners/499672556/1434717572","http://abs.twimg.com/images/themes/theme1/bg.png","http://pbs.twimg.com/profile_images/1076762978752577536/9E8AyaPD_normal.jpg"
"x906269360","x1408400913518280712",2021-06-25 12:25:19,"tripodimaria","Sostieni Forza Italia 🇮🇹
E' facile, vale molto e non costa niente!

#2X1000 #F15 https://t.co/0NA2oryOaj","Twitter for iPhone",122,,,,FALSE,TRUE,0,6,,,"2X1000 F15",,,,,"http://pbs.twimg.com/media/E4uGRUPWYAEGvlJ.jpg","https://t.co/0NA2oryOaj","https://twitter.com/forza_italia/status/1408367100742209537/photo/1","photo","http://pbs.twimg.com/media/E4uGRUPWYAEGvlJ.jpg","https://t.co/0NA2oryOaj","https://twitter.com/forza_italia/status/1408367100742209537/photo/1",,"x147543162","forza_italia","it",,,,,,,,,,,,,,,,"x1408367100742209537","Sostieni Forza Italia 🇮🇹
E' facile, vale molto e non costa niente!

#2X1000 #F15 https://t.co/0NA2oryOaj",2021-06-25 10:10:57,"Twitter Web App",12,6,"x147543162","forza_italia","Forza Italia",166469,807,188467,"Italia","Account ufficiale del movimento politico Forza Italia.",TRUE,,,,,,,"NA NA","NA NA","NA NA NA NA NA NA NA NA","https://twitter.com/tripodimaria/status/1408400913518280712","Maria Tripodi","","Deputato della Repubblica•  Eletta nel CollegioCalabria2• Capogruppo @forza_Italia CommissioneDifesa•  Dottssa in Relazioni Internazionali•",,FALSE,6387,2285,44,11023,15034,2012-10-26 15:54:35,FALSE,,,,"https://pbs.twimg.com/profile_banners/906269360/1521784227","http://abs.twimg.com/images/themes/theme1/bg.png","http://pbs.twimg.com/profile_images/809321296794415104/jDezppyk_normal.jpg"
"x906269360","x1408309273289965569",2021-06-25 06:21:10,"tripodimaria","🇮🇹 155° ANNIVERSARIO
Il Corpo Militare della CRI fu istituito il 1° giugno del 1866. La ricorrenza di oggi rievoca il 25 giugno 1985, giorno in cui, con la legge n. 342, fu concesso al Corpo Militare CRI l'uso della Bandiera Nazionale. https://t.co/PbWioDrYfz","Twitter for iPhone",140,,,,FALSE,TRUE,0,14,,,,,,,,,,,,,,,,"x2694346570","CriMiles","it",,,,,,,,,,,,,,,,"x1408302770361442312","🇮🇹 155° ANNIVERSARIO
Il Corpo Militare della CRI fu istituito il 1° giugno del 1866. La ricorrenza di oggi rievoca il 25 giugno 1985, giorno in cui, con la legge n. 342, fu concesso al Corpo Militare CRI l'uso della Bandiera Nazionale. https://t.co/PbWioDrYfz",2021-06-25 05:55:20,"Twitter for iPhone",40,14,"x2694346570","CriMiles","Corpo Militare Volontario CRI",1673,317,1626,"Ispettorato Nazionale Del Corpo Militare","Pagina ufficiale. Il Corpo Militare Volontario della Croce Rossa Italiana è un Corpo Speciale, Ausiliario delle Forze Armate dello Stato, istituito nel 1866.",FALSE,,,,,,,"NA NA","NA NA","NA NA NA NA NA NA NA NA","https://twitter.com/tripodimaria/status/1408309273289965569","Maria Tripodi","","Deputato della Repubblica•  Eletta nel CollegioCalabria2• Capogruppo @forza_Italia CommissioneDifesa•  Dottssa in Relazioni Internazionali•",,FALSE,6387,2285,44,11023,15034,2012-10-26 15:54:35,FALSE,,,,"https://pbs.twimg.com/profile_banners/906269360/1521784227","http://abs.twimg.com/images/themes/theme1/bg.png","http://pbs.twimg.com/profile_images/809321296794415104/jDezppyk_normal.jpg"
"x906269360","x1408298801744560129",2021-06-25 05:39:33,"tripodimaria","Buon 155 Anniversario al @CriMiles, Protagonista sin dal 1866 di un’attività ESEMPLARE al servizio del bene comune e del Paese. #Grazie a medici, infermieri e tutti i volontari che hanno un ruolo essenziale in ogni emergenza, compresa quella pandemica! Orgogliosi di voi🇮🇹! https://t.co/fSiWymtMkV","Twitter for iPhone",273,,,,FALSE,FALSE,11,4,,,"Grazie",,,,,"http://pbs.twimg.com/media/E4tIShJWQAEv6fc.jpg","https://t.co/fSiWymtMkV","https://twitter.com/tripodimaria/status/1408298801744560129/photo/1","photo","http://pbs.twimg.com/media/E4tIShJWQAEv6fc.jpg http://pbs.twimg.com/media/E4tIShOX0AI16cW.jpg","https://t.co/fSiWymtMkV https://t.co/fSiWymtMkV","https://twitter.com/tripodimaria/status/1408298801744560129/photo/1 https://twitter.com/tripodimaria/status/1408298801744560129/photo/1",,"x2694346570","CriMiles","it",,,,,,,,,,,,,,,,,,,,,,,,,,,,,,,,,,,,,"NA NA","NA NA","NA NA NA NA NA NA NA NA","https://twitter.com/tripodimaria/status/1408298801744560129","Maria Tripodi","","Deputato della Repubblica•  Eletta nel CollegioCalabria2• Capogruppo @forza_Italia CommissioneDifesa•  Dottssa in Relazioni Internazionali•",,FALSE,6387,2285,44,11023,15034,2012-10-26 15:54:35,FALSE,,,,"https://pbs.twimg.com/profile_banners/906269360/1521784227","http://abs.twimg.com/images/themes/theme1/bg.png","http://pbs.twimg.com/profile_images/809321296794415104/jDezppyk_normal.jpg"
"x1557514573","x1408427444533706753",2021-06-25 14:10:44,"elio_vito","@piagiardi @ilfoglio_it Già","Twitter for iPad",3,"x1408416181590048774","x925416373","piagiardi",FALSE,FALSE,1,0,,,,,,,,,,,,,,,,"x925416373 x49954018","piagiardi ilfoglio_it","und",,,,,,,,,,,,,,,,,,,,,,,,,,,,,,,,,,,,,"NA NA","NA NA","NA NA NA NA NA NA NA NA","https://twitter.com/elio_vito/status/1408427444533706753","Elio Vito 🇮🇹🇪🇺🇺🇸","Roma","Deputato @forza_italia. Juventino",,FALSE,6740,9,83,12849,8329,2013-06-30 07:47:38,TRUE,,,,"https://pbs.twimg.com/profile_banners/1557514573/1623834710","http://abs.twimg.com/images/themes/theme1/bg.png","http://pbs.twimg.com/profile_images/736450788659240960/-8W5fQJa_normal.jpg"
"x1557514573","x1408387705365581825",2021-06-25 11:32:50,"elio_vito","@Milo_Meelow ☺️🌈","Twitter for iPad",3,"x1408378520053690370","x138438793","Milo_Meelow",FALSE,FALSE,1,0,,,,,,,,,,,,,,,,"x138438793","Milo_Meelow","und",,,,,,,,,,,,,,,,,,,,,,,,,,,,,,,,,,,,,"NA NA","NA NA","NA NA NA NA NA NA NA NA","https://twitter.com/elio_vito/status/1408387705365581825","Elio Vito 🇮🇹🇪🇺🇺🇸","Roma","Deputato @forza_italia. Juventino",,FALSE,6740,9,83,12849,8329,2013-06-30 07:47:38,TRUE,,,,"https://pbs.twimg.com/profile_banners/1557514573/1623834710","http://abs.twimg.com/images/themes/theme1/bg.png","http://pbs.twimg.com/profile_images/736450788659240960/-8W5fQJa_normal.jpg"
"x1557514573","x1408374280115654657",2021-06-25 10:39:29,"elio_vito","@LauraHarth @CardJosephZen 🍎❤️","Twitter for iPad",3,"x1408369807129522177","x318276613","LauraHarth",FALSE,FALSE,0,0,,,,,,,,,,,,,,,,"x318276613 x1089250348223602689","LauraHarth CardJosephZen","und",,,,,,,,,,,,,,,,,,,,,,,,,,,,,,,,,,,,,"NA NA","NA NA","NA NA NA NA NA NA NA NA","https://twitter.com/elio_vito/status/1408374280115654657","Elio Vito 🇮🇹🇪🇺🇺🇸","Roma","Deputato @forza_italia. Juventino",,FALSE,6740,9,83,12849,8329,2013-06-30 07:47:38,TRUE,,,,"https://pbs.twimg.com/profile_banners/1557514573/1623834710","http://abs.twimg.com/images/themes/theme1/bg.png","http://pbs.twimg.com/profile_images/736450788659240960/-8W5fQJa_normal.jpg"
"x1557514573","x1408358501093621761",2021-06-25 09:36:47,"elio_vito","Il #ddlZan 🌈 è una cartina di tornasole, o stai con l'Europa dei diritti o no. Se #Salvini vuole fare il federatore del centrodestra lo voti. 🇮🇹🇪🇺
Una mia intervista oggi a @ilfoglio_it 🙏 https://t.co/wOffV34uLg","Twitter for iPad",187,,,,FALSE,FALSE,52,6,,,"ddlZan Salvini",,,,,"http://pbs.twimg.com/media/E4t-i-4WYAYxU56.jpg","https://t.co/wOffV34uLg","https://twitter.com/elio_vito/status/1408358501093621761/photo/1","photo","http://pbs.twimg.com/media/E4t-i-4WYAYxU56.jpg","https://t.co/wOffV34uLg","https://twitter.com/elio_vito/status/1408358501093621761/photo/1",,"x49954018","ilfoglio_it","it",,,,,,,,,,,,,,,,,,,,,,,,,,,,,,,,,,,,,"NA NA","NA NA","NA NA NA NA NA NA NA NA","https://twitter.com/elio_vito/status/1408358501093621761","Elio Vito 🇮🇹🇪🇺🇺🇸","Roma","Deputato @forza_italia. Juventino",,FALSE,6740,9,83,12849,8329,2013-06-30 07:47:38,TRUE,,,,"https://pbs.twimg.com/profile_banners/1557514573/1623834710","http://abs.twimg.com/images/themes/theme1/bg.png","http://pbs.twimg.com/profile_images/736450788659240960/-8W5fQJa_normal.jpg"
"x1557514573","x1408338303766642688",2021-06-25 08:16:31,"elio_vito","#AppleDaily “the last free outlet of #HongKong” - last first page fully on @ilfoglio_it by @giuliapompili today. “The CCP’s war on free information is a lesson for all.” 

No words needed ❤️🍎🙏 https://t.co/X7IDOIdgNM","Twitter for iPhone",140,,,,FALSE,TRUE,0,79,,,"AppleDaily HongKong",,,,,,,,,,,,,"x318276613 x49954018 x69613737","LauraHarth ilfoglio_it giuliapompili","en",,,,,,,,,,,,,,,,"x1408332032967688193","#AppleDaily “the last free outlet of #HongKong” - last first page fully on @ilfoglio_it by @giuliapompili today. “The CCP’s war on free information is a lesson for all.” 

No words needed ❤️🍎🙏 https://t.co/X7IDOIdgNM",2021-06-25 07:51:36,"Twitter for iPhone",112,79,"x318276613","LauraHarth","Laura Harth 😷 🇹🇼 🍎",4087,2351,9851,"Rome","Proud Campaign Director @SafeguardDefend | @Globalcrl - @ipacglobal Campaigning against authoritarianism: 4 Human Rights, Rule of Law & Right to Know",FALSE,,,,,,,"NA NA","NA NA","NA NA NA NA NA NA NA NA","https://twitter.com/elio_vito/status/1408338303766642688","Elio Vito 🇮🇹🇪🇺🇺🇸","Roma","Deputato @forza_italia. Juventino",,FALSE,6740,9,83,12849,8329,2013-06-30 07:47:38,TRUE,,,,"https://pbs.twimg.com/profile_banners/1557514573/1623834710","http://abs.twimg.com/images/themes/theme1/bg.png","http://pbs.twimg.com/profile_images/736450788659240960/-8W5fQJa_normal.jpg"
"x1557514573","x1408320286240296962",2021-06-25 07:04:56,"elio_vito","@michelelanzo Veramente l’arbitro è il Presidente della Repubblica","Twitter for iPhone",52,"x1408314465502826498","x2650978150","michelelanzo",FALSE,FALSE,7,0,,,,,,,,,,,,,,,,"x2650978150","michelelanzo","it",,,,,,,,,,,,,,,,,,,,,,,,,,,,,,,,,,,,,"NA NA","NA NA","NA NA NA NA NA NA NA NA","https://twitter.com/elio_vito/status/1408320286240296962","Elio Vito 🇮🇹🇪🇺🇺🇸","Roma","Deputato @forza_italia. Juventino",,FALSE,6740,9,83,12849,8329,2013-06-30 07:47:38,TRUE,,,,"https://pbs.twimg.com/profile_banners/1557514573/1623834710","http://abs.twimg.com/images/themes/theme1/bg.png","http://pbs.twimg.com/profile_images/736450788659240960/-8W5fQJa_normal.jpg"
"x1557514573","x1408170992904638474",2021-06-24 21:11:41,"elio_vito","@salvini_giacomo Secondo me, se il DdlZan non dovesse passare la responsabilità principale sarebbe di Berlusconi. Da Salvini e Meloni te lo aspetti, Renzi si capisce, ma Berlusconi no. Va contro la storia sua e del partito che ha fondato. Mah 🌈🇮🇹","Twitter for iPad",229,"x1408007102619078662","x1451424235","salvini_giacomo",FALSE,FALSE,1,0,,,,,,,,,,,,,,,,"x1451424235","salvini_giacomo","it",,,,,,,,,,,,,,,,,,,,,,,,,,,,,,,,,,,,,"NA NA","NA NA","NA NA NA NA NA NA NA NA","https://twitter.com/elio_vito/status/1408170992904638474","Elio Vito 🇮🇹🇪🇺🇺🇸","Roma","Deputato @forza_italia. Juventino",,FALSE,6740,9,83,12849,8329,2013-06-30 07:47:38,TRUE,,,,"https://pbs.twimg.com/profile_banners/1557514573/1623834710","http://abs.twimg.com/images/themes/theme1/bg.png","http://pbs.twimg.com/profile_images/736450788659240960/-8W5fQJa_normal.jpg"
"x1557514573","x1408170387574296588",2021-06-24 21:09:17,"elio_vito","@salvini_giacomo Per me dovrebbe metterci la fiducia, comunque oggi ha firmato questa 🇪🇺 https://t.co/S8GC6bQCH8","Twitter for iPad",71,"x1408011011660058627","x1451424235","salvini_giacomo",FALSE,FALSE,4,0,,,,,,,,"http://pbs.twimg.com/media/E4rTeeMWUAsY751.jpg","https://t.co/S8GC6bQCH8","https://twitter.com/elio_vito/status/1408170387574296588/photo/1","photo","http://pbs.twimg.com/media/E4rTeeMWUAsY751.jpg","https://t.co/S8GC6bQCH8","https://twitter.com/elio_vito/status/1408170387574296588/photo/1",,"x1451424235","salvini_giacomo","it",,,,,,,,,,,,,,,,,,,,,,,,,,,,,,,,,,,,,"NA NA","NA NA","NA NA NA NA NA NA NA NA","https://twitter.com/elio_vito/status/1408170387574296588","Elio Vito 🇮🇹🇪🇺🇺🇸","Roma","Deputato @forza_italia. Juventino",,FALSE,6740,9,83,12849,8329,2013-06-30 07:47:38,TRUE,,,,"https://pbs.twimg.com/profile_banners/1557514573/1623834710","http://abs.twimg.com/images/themes/theme1/bg.png","http://pbs.twimg.com/profile_images/736450788659240960/-8W5fQJa_normal.jpg"
