"x337171830","x1465258040362418181",2021-11-29 09:55:14,"AngeloTofalo","✅Conclusa l'esercitazione ""Gioia Falcon""

📹 È online la nuova edizione di #VideoNews AM ⬇️
https://t.co/rajmADrTpb

#AeronauticaMilitare #latuasquadrachevola @MinisteroDifesa @SM_Difesa https://t.co/4tdbpcGOzT","Twitter for iPhone",140,,,,FALSE,TRUE,0,10,,,"VideoNews",,"youtu.be/PhVqevBJ6kc","https://t.co/rajmADrTpb","https://youtu.be/PhVqevBJ6kc",,,,,,,,,"x1280597143","ItalianAirForce","it",,,,,,,,,,,,,,,,"x1464881775482654722","✅Conclusa l'esercitazione ""Gioia Falcon""

📹 È online la nuova edizione di #VideoNews AM ⬇️
https://t.co/rajmADrTpb

#AeronauticaMilitare #latuasquadrachevola @MinisteroDifesa @SM_Difesa https://t.co/4tdbpcGOzT",2021-11-28 09:00:06,"Hootsuite Inc.",38,10,"x1280597143","ItalianAirForce","Aeronautica Militare",108451,430,27869,"","La Difesa Aerea è la missione principale dell'Aeronautica Militare.365 giorni l'anno,24 ore su 24, i velivoli caccia sono pronti al decollo #latuasquadrachevola",TRUE,,,,,,,"NA NA","NA NA","NA NA NA NA NA NA NA NA","https://twitter.com/AngeloTofalo/status/1465258040362418181","Angelo Tofalo","Salerno, Pellezzano, Campania","Ingegnere, deputato della Repubblica, già Sottosegretario di Stato alla Difesa 🇮🇹 Rapito dall’Intelligence per diffondere la cultura della Sicurezza","https://t.co/4xUgrx6rHJ",FALSE,38095,4930,360,37671,16737,2011-07-17 15:43:34,TRUE,"https://t.co/4xUgrx6rHJ","http://www.angelotofalo.com",,"https://pbs.twimg.com/profile_banners/337171830/1613207709","http://abs.twimg.com/images/themes/theme1/bg.png","http://pbs.twimg.com/profile_images/1035471039734718464/UIb1-oK3_normal.jpg"
"x337171830","x1465257981642252288",2021-11-29 09:55:00,"AngeloTofalo","#naveMarceglia partecipa alla settima edizione dell’esercitazione EUROMARSEC 🇮🇹🇵🇹🇩🇰
Al largo delle coste nigeriane si consolida il coordinamento e l'interoperabilità con le marine europee per la sicurezza marittima nel #GolfodiGuinea

👉https://t.co/mQ2ihMgMNg

#NoiSiamolaMarina https://t.co/b474GI5XvI","Twitter for iPhone",140,,,,FALSE,TRUE,0,10,,,"naveMarceglia",,,,,,,,,,,,,"x252039915","ItalianNavy","it",,,,,,,,,,,,,,,,"x1465228458154500100","#naveMarceglia partecipa alla settima edizione dell’esercitazione EUROMARSEC 🇮🇹🇵🇹🇩🇰
Al largo delle coste nigeriane si consolida il coordinamento e l'interoperabilità con le marine europee per la sicurezza marittima nel #GolfodiGuinea

👉https://t.co/mQ2ihMgMNg

#NoiSiamolaMarina https://t.co/b474GI5XvI",2021-11-29 07:57:41,"Twitter Web App",53,10,"x252039915","ItalianNavy","Marina Militare",98604,190,20356,"Italia","#ProfessionistidelMare #NoisiamolaMarina #UnMarediOpportunità",TRUE,,,,,,,"NA NA","NA NA","NA NA NA NA NA NA NA NA","https://twitter.com/AngeloTofalo/status/1465257981642252288","Angelo Tofalo","Salerno, Pellezzano, Campania","Ingegnere, deputato della Repubblica, già Sottosegretario di Stato alla Difesa 🇮🇹 Rapito dall’Intelligence per diffondere la cultura della Sicurezza","https://t.co/4xUgrx6rHJ",FALSE,38095,4930,360,37671,16737,2011-07-17 15:43:34,TRUE,"https://t.co/4xUgrx6rHJ","http://www.angelotofalo.com",,"https://pbs.twimg.com/profile_banners/337171830/1613207709","http://abs.twimg.com/images/themes/theme1/bg.png","http://pbs.twimg.com/profile_images/1035471039734718464/UIb1-oK3_normal.jpg"
"x337171830","x1465257922087342082",2021-11-29 09:54:46,"AngeloTofalo","Operazioni terminate sia a Segrate sia a San Clemente! Dopo aver rimosso i sistemi di innesco, gli ordigni sono stati fatti brillare dai nostri #artificieri in un’area appositamente individuata e predisposta in modo da tutelare la pubblica incolumità.
#EsercitodegliItaliani https://t.co/ykI5bzag6J","Twitter for iPhone",140,,,,FALSE,TRUE,0,11,,,,,,,,,,,,,,,,"x437337751","Esercito","it",,,,,,,,,,,,,,,,"x1464966396568289282","Operazioni terminate sia a Segrate sia a San Clemente! Dopo aver rimosso i sistemi di innesco, gli ordigni sono stati fatti brillare dai nostri #artificieri in un’area appositamente individuata e predisposta in modo da tutelare la pubblica incolumità.
#EsercitodegliItaliani https://t.co/ykI5bzag6J",2021-11-28 14:36:21,"Twitter for iPhone",84,11,"x437337751","Esercito","Esercito Italiano",100713,343,15450,"Roma","L'Esercito Italiano, fondato nel 1861, è la componente più antica tra le Forze Armate italiane.",TRUE,,,,,,,"NA NA","NA NA","NA NA NA NA NA NA NA NA","https://twitter.com/AngeloTofalo/status/1465257922087342082","Angelo Tofalo","Salerno, Pellezzano, Campania","Ingegnere, deputato della Repubblica, già Sottosegretario di Stato alla Difesa 🇮🇹 Rapito dall’Intelligence per diffondere la cultura della Sicurezza","https://t.co/4xUgrx6rHJ",FALSE,38095,4930,360,37671,16737,2011-07-17 15:43:34,TRUE,"https://t.co/4xUgrx6rHJ","http://www.angelotofalo.com",,"https://pbs.twimg.com/profile_banners/337171830/1613207709","http://abs.twimg.com/images/themes/theme1/bg.png","http://pbs.twimg.com/profile_images/1035471039734718464/UIb1-oK3_normal.jpg"
"x337171830","x1465257860011593728",2021-11-29 09:54:31,"AngeloTofalo","#Roma #CASD #Difesa 30 novembre
Intelligenza Artificiale e implicazioni per la Difesa

Conferenza: Intelligenza Artificiale – il cambIAmento delle organizzazioni

Per tutte le informazioni➡️https://t.co/wE2azebQl9

#ForzeArmate🇮🇹 #UnaForzaperilPaese
#29novembre #Buonadomenica https://t.co/IPdTmCnYQ4","Twitter for iPhone",139,,,,FALSE,TRUE,0,15,,,"Roma CASD Difesa",,,,,,,,,,,,,"x1919237072","SM_Difesa","it",,,,,,,,,,,,,,,,"x1464982652776329228","#Roma #CASD #Difesa 30 novembre
Intelligenza Artificiale e implicazioni per la Difesa

Conferenza: Intelligenza Artificiale – il cambIAmento delle organizzazioni

Per tutte le informazioni➡️https://t.co/wE2azebQl9

#ForzeArmate🇮🇹 #UnaForzaperilPaese
#29novembre #Buonadomenica https://t.co/IPdTmCnYQ4",2021-11-28 15:40:57,"Twitter Web App",50,15,"x1919237072","SM_Difesa","Forze Armate StatoMaggioreDifesa",74727,120,19472,"Roma","Profilo ufficiale Twitter dello Stato Maggiore della Difesa. #ForzeArmate 🇮🇹 #MissioniMilitari #UnaForzaperilPaese Social netiquette https://t.co/cu3Uw6TUbE",TRUE,,,,,,,"NA NA","NA NA","NA NA NA NA NA NA NA NA","https://twitter.com/AngeloTofalo/status/1465257860011593728","Angelo Tofalo","Salerno, Pellezzano, Campania","Ingegnere, deputato della Repubblica, già Sottosegretario di Stato alla Difesa 🇮🇹 Rapito dall’Intelligence per diffondere la cultura della Sicurezza","https://t.co/4xUgrx6rHJ",FALSE,38095,4930,360,37671,16737,2011-07-17 15:43:34,TRUE,"https://t.co/4xUgrx6rHJ","http://www.angelotofalo.com",,"https://pbs.twimg.com/profile_banners/337171830/1613207709","http://abs.twimg.com/images/themes/theme1/bg.png","http://pbs.twimg.com/profile_images/1035471039734718464/UIb1-oK3_normal.jpg"
"x337171830","x1465072053351075846",2021-11-28 21:36:11,"AngeloTofalo","Vuoi diventare uno di noi?
Hai tempo fino al 4 dicembre per partecipare al concorso che prevede il reclutamento di 800 VFP1 - Volontari in Ferma Prefissata - in #Aeronautica Militare.
Fai la tua scelta per volare alto!
➡️ https://t.co/IFNpUvrjo4
 @MinisteroDifesa @SM_Difesa https://t.co/D2JhaAt6NZ","Twitter for iPhone",140,,,,FALSE,TRUE,0,9,,,,,,,,,,,,,,,,"x1280597143","ItalianAirForce","it",,,,,,,,,,,,,,,,"x1465002859137839111","Vuoi diventare uno di noi?
Hai tempo fino al 4 dicembre per partecipare al concorso che prevede il reclutamento di 800 VFP1 - Volontari in Ferma Prefissata - in #Aeronautica Militare.
Fai la tua scelta per volare alto!
➡️ https://t.co/IFNpUvrjo4
 @MinisteroDifesa @SM_Difesa https://t.co/D2JhaAt6NZ",2021-11-28 17:01:14,"Hootsuite Inc.",32,9,"x1280597143","ItalianAirForce","Aeronautica Militare",108451,430,27869,"","La Difesa Aerea è la missione principale dell'Aeronautica Militare.365 giorni l'anno,24 ore su 24, i velivoli caccia sono pronti al decollo #latuasquadrachevola",TRUE,,,,,,,"NA NA","NA NA","NA NA NA NA NA NA NA NA","https://twitter.com/AngeloTofalo/status/1465072053351075846","Angelo Tofalo","Salerno, Pellezzano, Campania","Ingegnere, deputato della Repubblica, già Sottosegretario di Stato alla Difesa 🇮🇹 Rapito dall’Intelligence per diffondere la cultura della Sicurezza","https://t.co/4xUgrx6rHJ",FALSE,38095,4930,360,37671,16737,2011-07-17 15:43:34,TRUE,"https://t.co/4xUgrx6rHJ","http://www.angelotofalo.com",,"https://pbs.twimg.com/profile_banners/337171830/1613207709","http://abs.twimg.com/images/themes/theme1/bg.png","http://pbs.twimg.com/profile_images/1035471039734718464/UIb1-oK3_normal.jpg"
"x116803999","x1465281752931446784",2021-11-29 11:29:28,"raffaele_trano","@nzingaretti Prima di costruire, accertatevi che l’esistente funzioni. A Formia (fa parte del Lazio) il servizio analisi è un disastro. https://t.co/6JCjMWx8Qq","Twitter for iPad",146,"x1465280850313031683","x403544693","nzingaretti",FALSE,FALSE,0,0,,,,,"bit.ly/3rhMBrm","https://t.co/6JCjMWx8Qq","https://bit.ly/3rhMBrm",,,,,,,,,"x403544693","nzingaretti","it",,,,,,,,,,,,,,,,,,,,,,,,,,,,,,,,,,,,,"NA NA","NA NA","NA NA NA NA NA NA NA NA","https://twitter.com/raffaele_trano/status/1465281752931446784","Raffaele Trano","Roma","Membro della commissione Bilancio - Camera dei Deputati - laureato in Economia - L'alternativa c'è","https://t.co/Jk99VKj6iB",FALSE,1080,428,21,2528,1203,2010-02-23 16:34:13,TRUE,"https://t.co/Jk99VKj6iB","https://www.raffaeletrano.it/",,"https://pbs.twimg.com/profile_banners/116803999/1584612651","http://abs.twimg.com/images/themes/theme1/bg.png","http://pbs.twimg.com/profile_images/1235940091895390209/HQBO3cQ-_normal.jpg"
"x1386423176","x1465333582793166848",2021-11-29 14:55:25,"AndreaVallascas","L'esaltazione dell'emergenza è il brodo di cottura del totalitarismo pandemico che sta distruggendo la nostra democrazia. I complici del sistema si stanno assumendo responsabilità storiche.  #Alternativa #StopTotalitarismoPandemico https://t.co/3Hf9jhrfEP","Twitter Web App",231,,,,FALSE,FALSE,3,2,,,"Alternativa StopTotalitarismoPandemico",,,,,"http://pbs.twimg.com/media/FFXovNdXoAQhptm.jpg","https://t.co/3Hf9jhrfEP","https://twitter.com/AndreaVallascas/status/1465333582793166848/photo/1","photo","http://pbs.twimg.com/media/FFXovNdXoAQhptm.jpg","https://t.co/3Hf9jhrfEP","https://twitter.com/AndreaVallascas/status/1465333582793166848/photo/1",,,,"it",,,,,,,,,,,,,,,,,,,,,,,,,,,,,,,,,,,,,"NA NA","NA NA","NA NA NA NA NA NA NA NA","https://twitter.com/AndreaVallascas/status/1465333582793166848","Andrea Vallascas","Roma","Deputato - eletto nel collegio plurinominale 01 Sardegna - X commissione Attività produttive","https://t.co/JOPvZVdV11",FALSE,2615,315,62,6972,237,2013-04-28 08:06:56,TRUE,"https://t.co/JOPvZVdV11","http://www.andreavallascas.it",,"https://pbs.twimg.com/profile_banners/1386423176/1625234772","http://abs.twimg.com/images/themes/theme1/bg.png","http://pbs.twimg.com/profile_images/1386030783228518407/Z6GX8VUn_normal.jpg"
"x375152696","x1465256988359671812",2021-11-29 09:51:03,"AdrianoVarrica","#TRAM #PALERMO, A RISCHIO MEZZO MILIARDO DEL #PNRR: CHIESTA NOMINA #COMMISSARIO

Depositata #interpellanza al #PresidenteDraghi e al #MinistroGiovannini per chiedere un intervento governativo a tutela delle risorse destinate alla città per il trasporto rapido di massa.","Twitter for iPhone",269,,,,FALSE,FALSE,4,2,,,"TRAM PALERMO PNRR COMMISSARIO interpellanza PresidenteDraghi MinistroGiovannini",,,,,,,,,,,,,,,"it",,,,,,,,,,,,,,,,,,,,,,,,,,,,,,,"https://api.twitter.com/1.1/geo/id/7d588036fe12e124.json","Rome","Rome, Lazio","city","Italy","IT","NA NA","NA NA","12.2344266 12.8558641 12.8558641 12.2344266 41.6558738 41.6558738 42.140959 42.140959","https://twitter.com/AdrianoVarrica/status/1465256988359671812","Adriano Varrica","Palermo, Sicilia","Parlamentare alla Camera dei deputati, componente della Commissione VIII^ Ambiente, territorio e lavori pubblici","https://t.co/AurxtUf8Vm",FALSE,436,425,13,210,122,2011-09-17 16:04:27,TRUE,"https://t.co/AurxtUf8Vm","http://www.adrianovarrica.it",,"https://pbs.twimg.com/profile_banners/375152696/1532154945","http://abs.twimg.com/images/themes/theme1/bg.png","http://pbs.twimg.com/profile_images/1020557385889460224/S9WdU4j8_normal.jpg"
"x636328779","x1465368104511451145",2021-11-29 17:12:35,"AlexBazzaro","A Genova Feltrinelli boicotta Stop vax, il mio ultimo libro, dicendo che  non è disponibile e neppure ordinabile. Sì, al sabato vado in piazza anche se sono vecchio, ma non è questa una ragione per impedire la circolazione di un libro nella mia città. Dovreste vergognarvi.","Twitter Web App",140,,,,FALSE,TRUE,0,138,,,,,,,,,,,,,,,,"x707022920","pbecchi","it",,,,,,,,,,,,,,,,"x1465367260042776578","A Genova Feltrinelli boicotta Stop vax, il mio ultimo libro, dicendo che  non è disponibile e neppure ordinabile. Sì, al sabato vado in piazza anche se sono vecchio, ma non è questa una ragione per impedire la circolazione di un libro nella mia città. Dovreste vergognarvi.",2021-11-29 17:09:14,"Twitter for iPhone",454,138,"x707022920","pbecchi","Paolo Becchi",69496,15,26410,"","https://t.co/F0Oq2agQ0J",FALSE,,,,,,,"NA NA","NA NA","NA NA NA NA NA NA NA NA","https://twitter.com/AlexBazzaro/status/1465368104511451145","Alex Bazzaro","Venezia ","🇮🇹Deputato Lega, Commissione XIV 🇪🇺 🦁Consigliere Comunale Venezia. ✈️ Delegazione @OSCE","https://t.co/C7Juvvqd3j",FALSE,2507,463,34,12052,3560,2012-07-15 15:20:42,TRUE,"https://t.co/C7Juvvqd3j","https://www.camera.it/leg18/29?shadow_deputato=307696&idpersona=307696&idlegislatura=18",,"https://pbs.twimg.com/profile_banners/636328779/1457208495","http://abs.twimg.com/images/themes/theme1/bg.png","http://pbs.twimg.com/profile_images/1315654416171753472/1PG-DcXJ_normal.jpg"
"x636328779","x1465312066579873798",2021-11-29 13:29:55,"AlexBazzaro","No va beh, adesso pure la storia strappalacrime della poveretta con il tumore che non può essere operata ""PER COLPA DEI NO VAX"" perchè non ci sono posti in terapia intensiva.
Cara redazione di @Ariachetira se le pensate vergogna, se vi costringono solidarietà, finirà anche questa https://t.co/FLFvkdvVR5","Twitter for iPhone",140,,,,FALSE,TRUE,0,523,,,,,,,,,,,,,,,,"x337767301","borghi_claudio","it",,,,,,,,,,,,,,,,"x1465296647173332997","No va beh, adesso pure la storia strappalacrime della poveretta con il tumore che non può essere operata ""PER COLPA DEI NO VAX"" perchè non ci sono posti in terapia intensiva.
Cara redazione di @Ariachetira se le pensate vergogna, se vi costringono solidarietà, finirà anche questa https://t.co/FLFvkdvVR5",2021-11-29 12:28:39,"Twitter Web App",1573,523,"x337767301","borghi_claudio","Claudio Borghi A.",120805,1329,215637,"Italia","Deputato della Repubblica Italiana eletto in Toscana per la Lega. Consigliere Comunale di Como",TRUE,,,,,,,"NA NA","NA NA","NA NA NA NA NA NA NA NA","https://twitter.com/AlexBazzaro/status/1465312066579873798","Alex Bazzaro","Venezia ","🇮🇹Deputato Lega, Commissione XIV 🇪🇺 🦁Consigliere Comunale Venezia. ✈️ Delegazione @OSCE","https://t.co/C7Juvvqd3j",FALSE,2507,463,34,12052,3560,2012-07-15 15:20:42,TRUE,"https://t.co/C7Juvvqd3j","https://www.camera.it/leg18/29?shadow_deputato=307696&idpersona=307696&idlegislatura=18",,"https://pbs.twimg.com/profile_banners/636328779/1457208495","http://abs.twimg.com/images/themes/theme1/bg.png","http://pbs.twimg.com/profile_images/1315654416171753472/1PG-DcXJ_normal.jpg"
"x636328779","x1465268393565696007",2021-11-29 10:36:23,"AlexBazzaro","La corsa alle terre rare: il dominio cinese e la frontiera dell'Artico
Da leggere l'analisi di @robertopozzo su @atlanticomag
https://t.co/4R6HXMk3cy","Twitter for iPhone",139,,,,FALSE,TRUE,0,15,,,,,,,,,,,,,,,,"x11170692 x259098091 x953235107741085696","jimmomo robertopozzo atlanticomag","it",,,,,,,,,,,,,,,,"x1465225238061490184","La corsa alle terre rare: il dominio cinese e la frontiera dell'Artico
Da leggere l'analisi di @robertopozzo su @atlanticomag
https://t.co/4R6HXMk3cy",2021-11-29 07:44:53,"Twitter Web App",35,15,"x11170692","jimmomo","Federico Punzi",6698,630,38688,"Rome","Italian journalist. Thatcherite. #BrexitLaSfida con @Capezzone. Trump.
Radio Radicale
Direttore https://t.co/uE5avnFJLx @atlanticomag",FALSE,,,,,,,"NA NA","NA NA","NA NA NA NA NA NA NA NA","https://twitter.com/AlexBazzaro/status/1465268393565696007","Alex Bazzaro","Venezia ","🇮🇹Deputato Lega, Commissione XIV 🇪🇺 🦁Consigliere Comunale Venezia. ✈️ Delegazione @OSCE","https://t.co/C7Juvvqd3j",FALSE,2507,463,34,12052,3560,2012-07-15 15:20:42,TRUE,"https://t.co/C7Juvvqd3j","https://www.camera.it/leg18/29?shadow_deputato=307696&idpersona=307696&idlegislatura=18",,"https://pbs.twimg.com/profile_banners/636328779/1457208495","http://abs.twimg.com/images/themes/theme1/bg.png","http://pbs.twimg.com/profile_images/1315654416171753472/1PG-DcXJ_normal.jpg"
"x636328779","x1465254498834735107",2021-11-29 09:41:10,"AlexBazzaro","L'avvocato anti green pass: «Il super certificato è peggio dell'apartheid. Eppure, il governo lo reputa d'esempio per gli altri Paesi. Faremo ricorso al tribunale penale internazionale e alla Corte europea dei diritti dell'uomo». https://t.co/bVd32BSZGr","Twitter for iPhone",139,,,,FALSE,TRUE,0,289,,,,,,,,,,,,,,,,"x900766265245130753","LaVeritaWeb","it",,,,,,,,,,,,,,,,"x1465248028562964484","L'avvocato anti green pass: «Il super certificato è peggio dell'apartheid. Eppure, il governo lo reputa d'esempio per gli altri Paesi. Faremo ricorso al tribunale penale internazionale e alla Corte europea dei diritti dell'uomo». https://t.co/bVd32BSZGr",2021-11-29 09:15:27,"RunnerCommonKeys",748,289,"x900766265245130753","LaVeritaWeb","La Verità",135375,68,24965,"Milano, Lombardia","Quotidiano indipendente diretto da @BelpietroTweet. Scopri #LaVeritàdioggi tutti i giorni in edicola al costo di € 1,30. Abbonati online oggi:",FALSE,,,,,,,"NA NA","NA NA","NA NA NA NA NA NA NA NA","https://twitter.com/AlexBazzaro/status/1465254498834735107","Alex Bazzaro","Venezia ","🇮🇹Deputato Lega, Commissione XIV 🇪🇺 🦁Consigliere Comunale Venezia. ✈️ Delegazione @OSCE","https://t.co/C7Juvvqd3j",FALSE,2507,463,34,12052,3560,2012-07-15 15:20:42,TRUE,"https://t.co/C7Juvvqd3j","https://www.camera.it/leg18/29?shadow_deputato=307696&idpersona=307696&idlegislatura=18",,"https://pbs.twimg.com/profile_banners/636328779/1457208495","http://abs.twimg.com/images/themes/theme1/bg.png","http://pbs.twimg.com/profile_images/1315654416171753472/1PG-DcXJ_normal.jpg"
"x636328779","x1465254410599153664",2021-11-29 09:40:49,"AlexBazzaro","Lo diciamo da giorni su @atlanticomag: troppo impegnato a inseguire e criminalizzare i non vaccinati, a silenziare le piazze, Governo si è fatto trovare totalmente impreparato nella campagna per le terze dosi (fattore decisivo: milioni over 50 non più coperti in pieno inverno)👇🏻 https://t.co/ptGf68Y7CR","Twitter for iPhone",139,,,,FALSE,TRUE,0,19,,,,,,,,,,,,,,,,"x11170692 x953235107741085696","jimmomo atlanticomag","it",,,,,,,,,,,,,,,,"x1465227616563220483","Lo diciamo da giorni su @atlanticomag: troppo impegnato a inseguire e criminalizzare i non vaccinati, a silenziare le piazze, Governo si è fatto trovare totalmente impreparato nella campagna per le terze dosi (fattore decisivo: milioni over 50 non più coperti in pieno inverno)👇🏻 https://t.co/ptGf68Y7CR",2021-11-29 07:54:21,"Twitter Web App",79,19,"x11170692","jimmomo","Federico Punzi",6698,630,38688,"Rome","Italian journalist. Thatcherite. #BrexitLaSfida con @Capezzone. Trump.
Radio Radicale
Direttore https://t.co/uE5avnFJLx @atlanticomag",FALSE,,,,,,,"NA NA","NA NA","NA NA NA NA NA NA NA NA","https://twitter.com/AlexBazzaro/status/1465254410599153664","Alex Bazzaro","Venezia ","🇮🇹Deputato Lega, Commissione XIV 🇪🇺 🦁Consigliere Comunale Venezia. ✈️ Delegazione @OSCE","https://t.co/C7Juvvqd3j",FALSE,2507,463,34,12052,3560,2012-07-15 15:20:42,TRUE,"https://t.co/C7Juvvqd3j","https://www.camera.it/leg18/29?shadow_deputato=307696&idpersona=307696&idlegislatura=18",,"https://pbs.twimg.com/profile_banners/636328779/1457208495","http://abs.twimg.com/images/themes/theme1/bg.png","http://pbs.twimg.com/profile_images/1315654416171753472/1PG-DcXJ_normal.jpg"
"x636328779","x1465254119065726978",2021-11-29 09:39:39,"AlexBazzaro","Per Monti «bisogna trovare un sistema che dosi dall'alto la comunicazione con metodi meno democratici». Tradotto: tappare la bocca alle poche voci libere rimaste. I giornalisti presenti alla proposta non si oppongono, anzi. Tira una certa arietta di regime https://t.co/hHHMJQHA8m","Twitter for iPhone",140,,,,FALSE,TRUE,0,392,,,,,,,,,,,,,,,,"x526448857","BelpietroTweet","it",,,,,,,,,,,,,,,,"x1465229253373566984","Per Monti «bisogna trovare un sistema che dosi dall'alto la comunicazione con metodi meno democratici». Tradotto: tappare la bocca alle poche voci libere rimaste. I giornalisti presenti alla proposta non si oppongono, anzi. Tira una certa arietta di regime https://t.co/hHHMJQHA8m",2021-11-29 08:00:51,"RunnerCommonKeys",1221,392,"x526448857","BelpietroTweet","Maurizio Belpietro",248739,590,2230,"","Direttore @LaVeritaWeb e @Panorama_it",FALSE,,,,,,,"NA NA","NA NA","NA NA NA NA NA NA NA NA","https://twitter.com/AlexBazzaro/status/1465254119065726978","Alex Bazzaro","Venezia ","🇮🇹Deputato Lega, Commissione XIV 🇪🇺 🦁Consigliere Comunale Venezia. ✈️ Delegazione @OSCE","https://t.co/C7Juvvqd3j",FALSE,2507,463,34,12052,3560,2012-07-15 15:20:42,TRUE,"https://t.co/C7Juvvqd3j","https://www.camera.it/leg18/29?shadow_deputato=307696&idpersona=307696&idlegislatura=18",,"https://pbs.twimg.com/profile_banners/636328779/1457208495","http://abs.twimg.com/images/themes/theme1/bg.png","http://pbs.twimg.com/profile_images/1315654416171753472/1PG-DcXJ_normal.jpg"
"x636328779","x1465118358437863439",2021-11-29 00:40:11,"AlexBazzaro","(Latina Oggi) https://t.co/Uzn0GLc54w","Twitter for iPhone",53,,,,FALSE,TRUE,0,92,,,,,,,,"http://pbs.twimg.com/media/FFTDompXEAMJuLR.jpg","https://t.co/Uzn0GLc54w","https://twitter.com/EsteriLega/status/1465010883655090176/photo/1","photo","http://pbs.twimg.com/media/FFTDompXEAMJuLR.jpg","https://t.co/Uzn0GLc54w","https://twitter.com/EsteriLega/status/1465010883655090176/photo/1",,"x1176749662155530240","EsteriLega","it",,,,,,,,,,,,,,,,"x1465010883655090176","(Latina Oggi) https://t.co/Uzn0GLc54w",2021-11-28 17:33:07,"Twitter for Android",222,92,"x1176749662155530240","EsteriLega","Lega Esteri",3007,612,33004,"","Notizie e commenti  sui temi di politica estera italiana, da leghista con uso di mondo🌐 - per blocchi v Sen Bagnai. Account NON ufficiale- notizie+++:Telegram",FALSE,,,,,,,"NA NA","NA NA","NA NA NA NA NA NA NA NA","https://twitter.com/AlexBazzaro/status/1465118358437863439","Alex Bazzaro","Venezia ","🇮🇹Deputato Lega, Commissione XIV 🇪🇺 🦁Consigliere Comunale Venezia. ✈️ Delegazione @OSCE","https://t.co/C7Juvvqd3j",FALSE,2507,463,34,12052,3560,2012-07-15 15:20:42,TRUE,"https://t.co/C7Juvvqd3j","https://www.camera.it/leg18/29?shadow_deputato=307696&idpersona=307696&idlegislatura=18",,"https://pbs.twimg.com/profile_banners/636328779/1457208495","http://abs.twimg.com/images/themes/theme1/bg.png","http://pbs.twimg.com/profile_images/1315654416171753472/1PG-DcXJ_normal.jpg"
"x636328779","x1465052099323084800",2021-11-28 20:16:54,"AlexBazzaro","Svizzera #referendum #Greenpass. Vittoria scontata del #si, ma la vera notizia è che nonostante tutte le pressioni politiche e mediatiche nazionali e mondiali,e con la minaccia di perdere i molti soldi dello Stato, il 38% abbia votato #no","Twitter for iPhone",139,,,,FALSE,TRUE,0,247,,,"referendum Greenpass si",,,,,,,,,,,,,"x47756372","mgmaglie","it",,,,,,,,,,,,,,,,"x1465049631537127424","Svizzera #referendum #Greenpass. Vittoria scontata del #si, ma la vera notizia è che nonostante tutte le pressioni politiche e mediatiche nazionali e mondiali,e con la minaccia di perdere i molti soldi dello Stato, il 38% abbia votato #no",2021-11-28 20:07:06,"Twitter for Android",1221,247,"x47756372","mgmaglie","Mariagiovanna Maglie",69107,313,15153,"","Life, liberty, and
the pursuit of happiness",FALSE,,,,,,,"NA NA","NA NA","NA NA NA NA NA NA NA NA","https://twitter.com/AlexBazzaro/status/1465052099323084800","Alex Bazzaro","Venezia ","🇮🇹Deputato Lega, Commissione XIV 🇪🇺 🦁Consigliere Comunale Venezia. ✈️ Delegazione @OSCE","https://t.co/C7Juvvqd3j",FALSE,2507,463,34,12052,3560,2012-07-15 15:20:42,TRUE,"https://t.co/C7Juvvqd3j","https://www.camera.it/leg18/29?shadow_deputato=307696&idpersona=307696&idlegislatura=18",,"https://pbs.twimg.com/profile_banners/636328779/1457208495","http://abs.twimg.com/images/themes/theme1/bg.png","http://pbs.twimg.com/profile_images/1315654416171753472/1PG-DcXJ_normal.jpg"
