"user_id","status_id","created_at","screen_name","text","source","display_text_width","reply_to_status_id","reply_to_user_id","reply_to_screen_name","is_quote","is_retweet","favorite_count","retweet_count","quote_count","reply_count","hashtags","symbols","urls_url","urls_t.co","urls_expanded_url","media_url","media_t.co","media_expanded_url","media_type","ext_media_url","ext_media_t.co","ext_media_expanded_url","ext_media_type","mentions_user_id","mentions_screen_name","lang","quoted_status_id","quoted_text","quoted_created_at","quoted_source","quoted_favorite_count","quoted_retweet_count","quoted_user_id","quoted_screen_name","quoted_name","quoted_followers_count","quoted_friends_count","quoted_statuses_count","quoted_location","quoted_description","quoted_verified","retweet_status_id","retweet_text","retweet_created_at","retweet_source","retweet_favorite_count","retweet_retweet_count","retweet_user_id","retweet_screen_name","retweet_name","retweet_followers_count","retweet_friends_count","retweet_statuses_count","retweet_location","retweet_description","retweet_verified","place_url","place_name","place_full_name","place_type","country","country_code","geo_coords","coords_coords","bbox_coords","status_url","name","location","description","url","protected","followers_count","friends_count","listed_count","statuses_count","favourites_count","account_created_at","verified","profile_url","profile_expanded_url","account_lang","profile_banner_url","profile_background_url","profile_image_url"
"x270839361","x1451604113448448001",2021-10-22 17:39:24,"matteosalvinimi","Non mi interessano le etichette, mi interessa difendere lavoratori e pensionati ed evitare ritorno a legge Fornero. Ci stiamo lavorando con Draghi, partendo dalla tutela dei lavoratori precoci e dei dipendenti delle piccole imprese, troveremo sicuramente una soluzione positiva.","Twitter for iPhone",278,,,,FALSE,FALSE,176,28,,,,,,,,,,,,,,,,,,"it",,,,,,,,,,,,,,,,,,,,,,,,,,,,,,,,,,,,,"NA NA","NA NA","NA NA NA NA NA NA NA NA","https://twitter.com/matteosalvinimi/status/1451604113448448001","Matteo Salvini","","Leader della Lega #primagliitaliani 🇮🇹","https://t.co/KDs4YUajH3",FALSE,1420652,2038,3062,52031,3856,2011-03-23 10:32:56,TRUE,"https://t.co/KDs4YUajH3","http://www.legaonline.it/referendumgiustizia",,"https://pbs.twimg.com/profile_banners/270839361/1634726953","http://abs.twimg.com/images/themes/theme1/bg.png","http://pbs.twimg.com/profile_images/966325945060732928/0Ua5xPMX_normal.jpg"
"x270839361","x1451604086097383441",2021-10-22 17:39:18,"matteosalvinimi","Una preghiera per Stefano Galli, storico militante della Lega lecchese. Mi stringo al dolore della famiglia.

https://t.co/aLNlSEKFzQ","Twitter for iPhone",133,,,,FALSE,FALSE,76,11,,,,,"leccotoday.it/notizie/lutto-…","https://t.co/aLNlSEKFzQ","https://www.leccotoday.it/notizie/lutto-morto-stefano-galli-lega-.html",,,,,,,,,,,"it",,,,,,,,,,,,,,,,,,,,,,,,,,,,,,,,,,,,,"NA NA","NA NA","NA NA NA NA NA NA NA NA","https://twitter.com/matteosalvinimi/status/1451604086097383441","Matteo Salvini","","Leader della Lega #primagliitaliani 🇮🇹","https://t.co/KDs4YUajH3",FALSE,1420652,2038,3062,52031,3856,2011-03-23 10:32:56,TRUE,"https://t.co/KDs4YUajH3","http://www.legaonline.it/referendumgiustizia",,"https://pbs.twimg.com/profile_banners/270839361/1634726953","http://abs.twimg.com/images/themes/theme1/bg.png","http://pbs.twimg.com/profile_images/966325945060732928/0Ua5xPMX_normal.jpg"
"x270839361","x1451565295500501002",2021-10-22 15:05:09,"matteosalvinimi","Bene la UE, anche in Italia occorre ripensare e superare il No al nucleare pulito e sicuro di ultima generazione, Lega pronta a presentare una proposta di legge.","Twitter for iPhone",161,,,,FALSE,FALSE,452,63,,,,,,,,,,,,,,,,,,"it",,,,,,,,,,,,,,,,,,,,,,,,,,,,,,,,,,,,,"NA NA","NA NA","NA NA NA NA NA NA NA NA","https://twitter.com/matteosalvinimi/status/1451565295500501002","Matteo Salvini","","Leader della Lega #primagliitaliani 🇮🇹","https://t.co/KDs4YUajH3",FALSE,1420652,2038,3062,52031,3856,2011-03-23 10:32:56,TRUE,"https://t.co/KDs4YUajH3","http://www.legaonline.it/referendumgiustizia",,"https://pbs.twimg.com/profile_banners/270839361/1634726953","http://abs.twimg.com/images/themes/theme1/bg.png","http://pbs.twimg.com/profile_images/966325945060732928/0Ua5xPMX_normal.jpg"
"x270839361","x1451554631679725574",2021-10-22 14:22:47,"matteosalvinimi","Qui Palermo con il gruppo regionale della Lega. https://t.co/N4zMRiYBYx","Twitter Media Studio",71,,,,FALSE,FALSE,170,32,,,,,"twitter.com/i/broadcasts/1…","https://t.co/N4zMRiYBYx","https://twitter.com/i/broadcasts/1vOGwynDLpbxB",,,,,,,,,,,"it",,,,,,,,,,,,,,,,,,,,,,,,,,,,,,,,,,,,,"NA NA","NA NA","NA NA NA NA NA NA NA NA","https://twitter.com/matteosalvinimi/status/1451554631679725574","Matteo Salvini","","Leader della Lega #primagliitaliani 🇮🇹","https://t.co/KDs4YUajH3",FALSE,1420652,2038,3062,52031,3856,2011-03-23 10:32:56,TRUE,"https://t.co/KDs4YUajH3","http://www.legaonline.it/referendumgiustizia",,"https://pbs.twimg.com/profile_banners/270839361/1634726953","http://abs.twimg.com/images/themes/theme1/bg.png","http://pbs.twimg.com/profile_images/966325945060732928/0Ua5xPMX_normal.jpg"
"x270839361","x1451506654881718272",2021-10-22 11:12:08,"matteosalvinimi","In partenza per Palermo.
Domani vado a processo come “sequestratore” per aver fermato gli sbarchi di clandestini: a testa alta! https://t.co/GQRc4pqW0q","Twitter for iPhone",127,,,,FALSE,FALSE,1264,152,,,,,,,,"http://pbs.twimg.com/media/FCTJm1cXsAAKlel.jpg","https://t.co/GQRc4pqW0q","https://twitter.com/matteosalvinimi/status/1451506654881718272/photo/1","photo","http://pbs.twimg.com/media/FCTJm1cXsAAKlel.jpg","https://t.co/GQRc4pqW0q","https://twitter.com/matteosalvinimi/status/1451506654881718272/photo/1",,,,"it",,,,,,,,,,,,,,,,,,,,,,,,,,,,,,,,,,,,,"NA NA","NA NA","NA NA NA NA NA NA NA NA","https://twitter.com/matteosalvinimi/status/1451506654881718272","Matteo Salvini","","Leader della Lega #primagliitaliani 🇮🇹","https://t.co/KDs4YUajH3",FALSE,1420652,2038,3062,52031,3856,2011-03-23 10:32:56,TRUE,"https://t.co/KDs4YUajH3","http://www.legaonline.it/referendumgiustizia",,"https://pbs.twimg.com/profile_banners/270839361/1634726953","http://abs.twimg.com/images/themes/theme1/bg.png","http://pbs.twimg.com/profile_images/966325945060732928/0Ua5xPMX_normal.jpg"
"x270839361","x1451468565115293716",2021-10-22 08:40:47,"matteosalvinimi","Roma, in corso sgombero di alcune villette strappate a Casamonica e che saranno destinate a Carabinieri. Ottima notizia. Grazie a forze dell’Ordine e comitato provinciale per ordine e sicurezza pubblica: donne e uomini che meritano di essere aiutati e difesi e non abbandonati.","Twitter for iPhone",277,,,,FALSE,FALSE,511,59,,,,,,,,,,,,,,,,,,"it",,,,,,,,,,,,,,,,,,,,,,,,,,,,,,,,,,,,,"NA NA","NA NA","NA NA NA NA NA NA NA NA","https://twitter.com/matteosalvinimi/status/1451468565115293716","Matteo Salvini","","Leader della Lega #primagliitaliani 🇮🇹","https://t.co/KDs4YUajH3",FALSE,1420652,2038,3062,52031,3856,2011-03-23 10:32:56,TRUE,"https://t.co/KDs4YUajH3","http://www.legaonline.it/referendumgiustizia",,"https://pbs.twimg.com/profile_banners/270839361/1634726953","http://abs.twimg.com/images/themes/theme1/bg.png","http://pbs.twimg.com/profile_images/966325945060732928/0Ua5xPMX_normal.jpg"
"x270839361","x1451310720465920005",2021-10-21 22:13:34,"matteosalvinimi","In diretta da Bruno Vespa, su Rai 1. #portaaporta @RaiPortaaPorta 

[Parte 2] https://t.co/h0klFePFp7","Twitter Media Studio",101,,,,FALSE,FALSE,186,35,,,"portaaporta",,"twitter.com/i/broadcasts/1…","https://t.co/h0klFePFp7","https://twitter.com/i/broadcasts/1eaKbNEoXVvKX",,,,,,,,,"x406880559","RaiPortaaPorta","it",,,,,,,,,,,,,,,,,,,,,,,,,,,,,,,,,,,,,"NA NA","NA NA","NA NA NA NA NA NA NA NA","https://twitter.com/matteosalvinimi/status/1451310720465920005","Matteo Salvini","","Leader della Lega #primagliitaliani 🇮🇹","https://t.co/KDs4YUajH3",FALSE,1420652,2038,3062,52031,3856,2011-03-23 10:32:56,TRUE,"https://t.co/KDs4YUajH3","http://www.legaonline.it/referendumgiustizia",,"https://pbs.twimg.com/profile_banners/270839361/1634726953","http://abs.twimg.com/images/themes/theme1/bg.png","http://pbs.twimg.com/profile_images/966325945060732928/0Ua5xPMX_normal.jpg"
"x270839361","x1451304117729648645",2021-10-21 21:47:20,"matteosalvinimi","In diretta da Bruno Vespa, su Rai 1. #portaaporta @RaiPortaaPorta  https://t.co/As7Qne2o2R","Twitter Media Studio",90,,,,FALSE,FALSE,209,40,,,"portaaporta",,"twitter.com/i/broadcasts/1…","https://t.co/As7Qne2o2R","https://twitter.com/i/broadcasts/1gqxvlemzelGB",,,,,,,,,"x406880559","RaiPortaaPorta","it",,,,,,,,,,,,,,,,,,,,,,,,,,,,,,,,,,,,,"NA NA","NA NA","NA NA NA NA NA NA NA NA","https://twitter.com/matteosalvinimi/status/1451304117729648645","Matteo Salvini","","Leader della Lega #primagliitaliani 🇮🇹","https://t.co/KDs4YUajH3",FALSE,1420652,2038,3062,52031,3856,2011-03-23 10:32:56,TRUE,"https://t.co/KDs4YUajH3","http://www.legaonline.it/referendumgiustizia",,"https://pbs.twimg.com/profile_banners/270839361/1634726953","http://abs.twimg.com/images/themes/theme1/bg.png","http://pbs.twimg.com/profile_images/966325945060732928/0Ua5xPMX_normal.jpg"
"x270839361","x1451284092675403778",2021-10-21 20:27:45,"matteosalvinimi","Vi aspetto alle 23:35 su Rai 1, ospite da Bruno Vespa. #portaaporta @RaiPortaaPorta https://t.co/Rt2Uy15VeA","Twitter Web App",83,,,,FALSE,FALSE,351,42,,,"portaaporta",,,,,"http://pbs.twimg.com/media/FCP_I1YWEAA6q4m.jpg","https://t.co/Rt2Uy15VeA","https://twitter.com/matteosalvinimi/status/1451284092675403778/photo/1","photo","http://pbs.twimg.com/media/FCP_I1YWEAA6q4m.jpg","https://t.co/Rt2Uy15VeA","https://twitter.com/matteosalvinimi/status/1451284092675403778/photo/1",,"x406880559","RaiPortaaPorta","it",,,,,,,,,,,,,,,,,,,,,,,,,,,,,,,,,,,,,"NA NA","NA NA","NA NA NA NA NA NA NA NA","https://twitter.com/matteosalvinimi/status/1451284092675403778","Matteo Salvini","","Leader della Lega #primagliitaliani 🇮🇹","https://t.co/KDs4YUajH3",FALSE,1420652,2038,3062,52031,3856,2011-03-23 10:32:56,TRUE,"https://t.co/KDs4YUajH3","http://www.legaonline.it/referendumgiustizia",,"https://pbs.twimg.com/profile_banners/270839361/1634726953","http://abs.twimg.com/images/themes/theme1/bg.png","http://pbs.twimg.com/profile_images/966325945060732928/0Ua5xPMX_normal.jpg"
"x48062712","x1451610804709642246",2021-10-22 18:06:00,"luigidimaio","Nonostante la pandemia, il made in Italy continua la sua corsa. Ma l'anno del vero rilancio sarà il 2022. Lo ha detto oggi a Londra il ministro degli Esteri Di Maio, intervenuto al G7 del commercio https://t.co/fNvb5imZoS","Twitter for iPhone",140,,,,FALSE,TRUE,0,7,,,,,,,,,,,,,,,,"x69959408","Tg3web","it",,,,,,,,,,,,,,,,"x1451606185174503431","Nonostante la pandemia, il made in Italy continua la sua corsa. Ma l'anno del vero rilancio sarà il 2022. Lo ha detto oggi a Londra il ministro degli Esteri Di Maio, intervenuto al G7 del commercio https://t.co/fNvb5imZoS",2021-10-22 17:47:38,"Twitter Media Studio",28,7,"x69959408","Tg3web","Tg3",254894,455,93330,"Rome Italy","Il canale ufficiale del Tg3. Direttore Mario Orfeo. Seguici anche su Facebook https://t.co/udFlwVKm9R e Instagram https://t.co/2F9ohrRCQw",TRUE,,,,,,,"NA NA","NA NA","NA NA NA NA NA NA NA NA","https://twitter.com/luigidimaio/status/1451610804709642246","Luigi Di Maio","Pomigliano d'Arco, Campania","Ministro degli Affari Esteri e della Cooperazione Internazionale.  Il 26/10 esce “Un amore chiamato politica”, qui per pre ordinarlo: https://t.co/hEUXqSArg5","https://t.co/D8gkagqksG",FALSE,739879,350,2133,6672,320,2009-06-17 18:34:46,TRUE,"https://t.co/D8gkagqksG","http://www.luigidimaio.it",,"https://pbs.twimg.com/profile_banners/48062712/1634667505","http://abs.twimg.com/images/themes/theme1/bg.png","http://pbs.twimg.com/profile_images/933106806670462976/YyC7LOW8_normal.jpg"
"x48062712","x1451583228322660354",2021-10-22 16:16:25,"luigidimaio","Oggi al #G7 di Londra sul Commercio ho ribadito quelle che sono le priorità della nostra presidenza del G20 e della copresidenza della Cop26: https://t.co/7yNunDFBF9","Twitter for iPhone",165,,,,FALSE,FALSE,81,19,,,"G7",,"bit.ly/3Gd759J","https://t.co/7yNunDFBF9","https://bit.ly/3Gd759J",,,,,,,,,,,"it",,,,,,,,,,,,,,,,,,,,,,,,,,,,,,,,,,,,,"NA NA","NA NA","NA NA NA NA NA NA NA NA","https://twitter.com/luigidimaio/status/1451583228322660354","Luigi Di Maio","Pomigliano d'Arco, Campania","Ministro degli Affari Esteri e della Cooperazione Internazionale.  Il 26/10 esce “Un amore chiamato politica”, qui per pre ordinarlo: https://t.co/hEUXqSArg5","https://t.co/D8gkagqksG",FALSE,739879,350,2133,6672,320,2009-06-17 18:34:46,TRUE,"https://t.co/D8gkagqksG","http://www.luigidimaio.it",,"https://pbs.twimg.com/profile_banners/48062712/1634667505","http://abs.twimg.com/images/themes/theme1/bg.png","http://pbs.twimg.com/profile_images/933106806670462976/YyC7LOW8_normal.jpg"
"x48062712","x1451543881221300225",2021-10-22 13:40:04,"luigidimaio","Il Min @luigidimaio ha incontrato il VP e Comm. al commercio🇪🇺 @VDombrovskis

Ribaditi il sostegno 🇮🇹 a @EU_Commission nell’avvio del processo di riforma @wto e l’importanza di favorire il libero commercio internazionale, componente fondamentale della ripresa economica globale https://t.co/dROPCR8Q9E","Twitter for iPhone",140,,,,FALSE,TRUE,0,12,,,,,,,,,,,,,,,,"x599114492 x48062712 x42183750 x157981564","ItalyMFA luigidimaio VDombrovskis EU_Commission","it",,,,,,,,,,,,,,,,"x1451538005626327043","Il Min @luigidimaio ha incontrato il VP e Comm. al commercio🇪🇺 @VDombrovskis

Ribaditi il sostegno 🇮🇹 a @EU_Commission nell’avvio del processo di riforma @wto e l’importanza di favorire il libero commercio internazionale, componente fondamentale della ripresa economica globale https://t.co/dROPCR8Q9E",2021-10-22 13:16:43,"Twitter Web App",38,12,"x599114492","ItalyMFA","Farnesina 🇮🇹",239354,947,14595,"Roma, Italia","Profilo ufficiale del Ministero degli Affari Esteri e della Cooperazione Internazionale | Ministry of Foreign Affairs and International Cooperation of Italy",TRUE,,,,,,,"NA NA","NA NA","NA NA NA NA NA NA NA NA","https://twitter.com/luigidimaio/status/1451543881221300225","Luigi Di Maio","Pomigliano d'Arco, Campania","Ministro degli Affari Esteri e della Cooperazione Internazionale.  Il 26/10 esce “Un amore chiamato politica”, qui per pre ordinarlo: https://t.co/hEUXqSArg5","https://t.co/D8gkagqksG",FALSE,739879,350,2133,6672,320,2009-06-17 18:34:46,TRUE,"https://t.co/D8gkagqksG","http://www.luigidimaio.it",,"https://pbs.twimg.com/profile_banners/48062712/1634667505","http://abs.twimg.com/images/themes/theme1/bg.png","http://pbs.twimg.com/profile_images/933106806670462976/YyC7LOW8_normal.jpg"
"x48062712","x1451520423728979973",2021-10-22 12:06:51,"luigidimaio","Incontro del Min @luigidimaio con la Min Canadese del commercio, @mary_ng

Al centro del colloquio: relazioni economiche bilaterali 🇮🇹🇨🇦, accordo economico commerciale 🇪🇺🇨🇦, @G7 quale forum per affrontare processo riforma @wto dopo i risultati positivi del @g20org di Sorrento https://t.co/ES8tFIWqZc","Twitter for iPhone",140,,,,FALSE,TRUE,0,15,,,,,,,,,,,,,,,,"x599114492 x48062712 x29754743","ItalyMFA luigidimaio mary_ng","it",,,,,,,,,,,,,,,,"x1451518755083796484","Incontro del Min @luigidimaio con la Min Canadese del commercio, @mary_ng

Al centro del colloquio: relazioni economiche bilaterali 🇮🇹🇨🇦, accordo economico commerciale 🇪🇺🇨🇦, @G7 quale forum per affrontare processo riforma @wto dopo i risultati positivi del @g20org di Sorrento https://t.co/ES8tFIWqZc",2021-10-22 12:00:13,"Twitter Web App",87,15,"x599114492","ItalyMFA","Farnesina 🇮🇹",239354,947,14595,"Roma, Italia","Profilo ufficiale del Ministero degli Affari Esteri e della Cooperazione Internazionale | Ministry of Foreign Affairs and International Cooperation of Italy",TRUE,,,,,,,"NA NA","NA NA","NA NA NA NA NA NA NA NA","https://twitter.com/luigidimaio/status/1451520423728979973","Luigi Di Maio","Pomigliano d'Arco, Campania","Ministro degli Affari Esteri e della Cooperazione Internazionale.  Il 26/10 esce “Un amore chiamato politica”, qui per pre ordinarlo: https://t.co/hEUXqSArg5","https://t.co/D8gkagqksG",FALSE,739879,350,2133,6672,320,2009-06-17 18:34:46,TRUE,"https://t.co/D8gkagqksG","http://www.luigidimaio.it",,"https://pbs.twimg.com/profile_banners/48062712/1634667505","http://abs.twimg.com/images/themes/theme1/bg.png","http://pbs.twimg.com/profile_images/933106806670462976/YyC7LOW8_normal.jpg"
"x48062712","x1451497699413569537",2021-10-22 10:36:33,"luigidimaio","Min. @luigidimaio, a margine del @G7 commercio, ha discusso con il Min. dell'Economia 🇩🇪 @peteraltmaier di relazioni bilaterali 🇮🇹 🇩🇪, cooperazione politica industriale e commerciale https://t.co/djBF0KAvhH","Twitter for iPhone",140,,,,FALSE,TRUE,0,10,,,,,,,,,,,,,,,,"x599114492 x48062712 x3191500397 x378693834","ItalyMFA luigidimaio G7 peteraltmaier","it",,,,,,,,,,,,,,,,"x1451494500929507339","Min. @luigidimaio, a margine del @G7 commercio, ha discusso con il Min. dell'Economia 🇩🇪 @peteraltmaier di relazioni bilaterali 🇮🇹 🇩🇪, cooperazione politica industriale e commerciale https://t.co/djBF0KAvhH",2021-10-22 10:23:51,"Twitter Web App",56,10,"x599114492","ItalyMFA","Farnesina 🇮🇹",239354,947,14595,"Roma, Italia","Profilo ufficiale del Ministero degli Affari Esteri e della Cooperazione Internazionale | Ministry of Foreign Affairs and International Cooperation of Italy",TRUE,,,,,,,"NA NA","NA NA","NA NA NA NA NA NA NA NA","https://twitter.com/luigidimaio/status/1451497699413569537","Luigi Di Maio","Pomigliano d'Arco, Campania","Ministro degli Affari Esteri e della Cooperazione Internazionale.  Il 26/10 esce “Un amore chiamato politica”, qui per pre ordinarlo: https://t.co/hEUXqSArg5","https://t.co/D8gkagqksG",FALSE,739879,350,2133,6672,320,2009-06-17 18:34:46,TRUE,"https://t.co/D8gkagqksG","http://www.luigidimaio.it",,"https://pbs.twimg.com/profile_banners/48062712/1634667505","http://abs.twimg.com/images/themes/theme1/bg.png","http://pbs.twimg.com/profile_images/933106806670462976/YyC7LOW8_normal.jpg"
"x48062712","x1451463607275999256",2021-10-22 08:21:05,"luigidimaio","Record su record per il Made in Italy! 
Ora il nostro prossimo obiettivo è superare i 500 miliardi di valore dell'#export.
Questo è l'anno del rilancio, e nella corsa verso la piena ripartenza il #MadeinItaly sta facendo la differenza. Lo dicono i dati: https://t.co/waQvbtojrI","Twitter for iPhone",277,,,,FALSE,FALSE,153,39,,,"export MadeinItaly",,"bit.ly/2ZbAq3k","https://t.co/waQvbtojrI","https://bit.ly/2ZbAq3k",,,,,,,,,,,"it",,,,,,,,,,,,,,,,,,,,,,,,,,,,,,,,,,,,,"NA NA","NA NA","NA NA NA NA NA NA NA NA","https://twitter.com/luigidimaio/status/1451463607275999256","Luigi Di Maio","Pomigliano d'Arco, Campania","Ministro degli Affari Esteri e della Cooperazione Internazionale.  Il 26/10 esce “Un amore chiamato politica”, qui per pre ordinarlo: https://t.co/hEUXqSArg5","https://t.co/D8gkagqksG",FALSE,739879,350,2133,6672,320,2009-06-17 18:34:46,TRUE,"https://t.co/D8gkagqksG","http://www.luigidimaio.it",,"https://pbs.twimg.com/profile_banners/48062712/1634667505","http://abs.twimg.com/images/themes/theme1/bg.png","http://pbs.twimg.com/profile_images/933106806670462976/YyC7LOW8_normal.jpg"
"x3052547715","x1451602170172805122",2021-10-22 17:31:41,"rossellaaccoto","🔴 @MinLavoro @rossellaaccoto ha incontrato delegazione ANMIL con Pres. Naz. #ZoelloForni, Cons.#FaustoLuzi e Resp. scientifico #ScuoladellaTestimonianza #SergioMustica per diffondere #sicurezzasullavoro con Testimonial/formatori della sicurezza. 
#sicurezzalavoro https://t.co/UWVIsOOcgb","Twitter for Android",140,,,,FALSE,TRUE,0,2,,,"ZoelloForni FaustoLuzi",,,,,,,,,,,,,"x1949543874 x2291193420 x3052547715","ANMIL_nazionale MinLavoro rossellaaccoto","it",,,,,,,,,,,,,,,,"x1451139427753996295","🔴 @MinLavoro @rossellaaccoto ha incontrato delegazione ANMIL con Pres. Naz. #ZoelloForni, Cons.#FaustoLuzi e Resp. scientifico #ScuoladellaTestimonianza #SergioMustica per diffondere #sicurezzasullavoro con Testimonial/formatori della sicurezza. 
#sicurezzalavoro https://t.co/UWVIsOOcgb",2021-10-21 10:52:55,"Twitter Web App",3,2,"x1949543874","ANMIL_nazionale","ANMIL Nazionale",1959,2523,4962,"Via Adolfo Ravà, 124 - Roma","Associazione Nazionale fra Lavoratori Mutilati e Invalidi del Lavoro ☎️ 800.180943 - Resp. Comunicazione Marinella de Maffutiis - Instagram: @AnmilOfficial",FALSE,,,,,,,"NA NA","NA NA","NA NA NA NA NA NA NA NA","https://twitter.com/rossellaaccoto/status/1451602170172805122","Rossella Accoto","","Portavoce al Senato della Repubblica per le Marche
Commissione Inchiesta Banche e Commissione Bilancio","https://t.co/jF3OeJTqKU",FALSE,1149,145,32,784,325,2015-02-22 12:25:51,TRUE,"https://t.co/jF3OeJTqKU","https://www.facebook.com/rossella.accoto.m5s/",,"https://pbs.twimg.com/profile_banners/3052547715/1548964810","http://abs.twimg.com/images/themes/theme1/bg.png","http://pbs.twimg.com/profile_images/1192113055645216768/Os-c5C9b_normal.jpg"
"x997531966571466752","x1451607453251129346",2021-10-22 17:52:41,"Pres_Casellati","Il https://t.co/AWZLdZDrms di Carini è un modello virtuoso che recepisce appieno la lezione imposta dalla pandemia: il valore della scienza nel preservare la nostra salute e il nostro stile di vita. #RiMed #Palermo https://t.co/2kQaTv52vS","Twitter for iPhone",214,,,,FALSE,FALSE,9,2,,,"RiMed Palermo",,"Ri.Med","https://t.co/AWZLdZDrms","http://Ri.Med","http://pbs.twimg.com/media/FCUlSC8XsAMdSXt.jpg","https://t.co/2kQaTv52vS","https://twitter.com/Pres_Casellati/status/1451607453251129346/photo/1","photo","http://pbs.twimg.com/media/FCUlSC8XsAMdSXt.jpg http://pbs.twimg.com/media/FCUlSC7WQAYuXGa.jpg http://pbs.twimg.com/media/FCUlSC6XoAQFSEc.jpg http://pbs.twimg.com/media/FCUlSC4WYAQTh2n.jpg","https://t.co/2kQaTv52vS https://t.co/2kQaTv52vS https://t.co/2kQaTv52vS https://t.co/2kQaTv52vS","https://twitter.com/Pres_Casellati/status/1451607453251129346/photo/1 https://twitter.com/Pres_Casellati/status/1451607453251129346/photo/1 https://twitter.com/Pres_Casellati/status/1451607453251129346/photo/1 https://twitter.com/Pres_Casellati/status/1451607453251129346/photo/1",,,,"it",,,,,,,,,,,,,,,,,,,,,,,,,,,,,,,,,,,,,"NA NA","NA NA","NA NA NA NA NA NA NA NA","https://twitter.com/Pres_Casellati/status/1451607453251129346","Maria Elisabetta Alberti Casellati","Roma, Lazio","Presidente del Senato della Repubblica","https://t.co/4xFh9XyLXO",FALSE,13723,490,101,1099,60,2018-05-18 17:38:48,TRUE,"https://t.co/4xFh9XyLXO","https://www.facebook.com/elisabetta.casellati.7",,"https://pbs.twimg.com/profile_banners/997531966571466752/1526665561","http://abs.twimg.com/images/themes/theme1/bg.png","http://pbs.twimg.com/profile_images/997533290520195072/YmnjBO3X_normal.jpg"
"x1075084718","x1451570321375604737",2021-10-22 15:25:08,"arrigoni_paolo","Bene la posizione di #Draghi assunta al Consiglio europeo nel riconoscere il ruolo del #gas insieme alle rinnovabili nella transizione ecologica per il contrasto al rincaro prezzi, pericoloso ostacolo alla ripresa. Il gas può essere utile anche per garantire la decarbonizzazione.","Twitter for Android",280,,,,FALSE,FALSE,2,2,,,"Draghi gas",,,,,,,,,,,,,,,"it",,,,,,,,,,,,,,,,,,,,,,,,,,,,,,,,,,,,,"NA NA","NA NA","NA NA NA NA NA NA NA NA","https://twitter.com/arrigoni_paolo/status/1451570321375604737","Paolo Arrigoni","Calolziocorte, Lombardia","Questore del Senato della Repubblica, componente della Commissione Ambiente e del Copasir. Responsabile del Dipartimento Energia della Lega.","https://t.co/M6TePkOvfO",FALSE,4661,180,57,9567,107,2013-01-09 22:36:27,TRUE,"https://t.co/M6TePkOvfO","http://www.senato.it/leg/18/BGT/Schede/Attsen/00029039.htm",,"https://pbs.twimg.com/profile_banners/1075084718/1591968708","http://abs.twimg.com/images/themes/theme1/bg.png","http://pbs.twimg.com/profile_images/3172370357/bec3e4497d64c77f2a93bc9792055992_normal.jpeg"
"x1075084718","x1451473006132346880",2021-10-22 08:58:26,"arrigoni_paolo","In legge di bilancio occorre prorogare sia il #sismabonus rafforzato sia il #Superbonus 110% per le spese sostenute e rimaste a carico del contribuente per l'intervento di ricostruzione. Chiediamo come Lega al Governo di non dimenticare le popolazioni terremotate.","Twitter for Android",264,,,,FALSE,FALSE,6,2,,,"sismabonus Superbonus",,,,,,,,,,,,,,,"it",,,,,,,,,,,,,,,,,,,,,,,,,,,,,,,,,,,,,"NA NA","NA NA","NA NA NA NA NA NA NA NA","https://twitter.com/arrigoni_paolo/status/1451473006132346880","Paolo Arrigoni","Calolziocorte, Lombardia","Questore del Senato della Repubblica, componente della Commissione Ambiente e del Copasir. Responsabile del Dipartimento Energia della Lega.","https://t.co/M6TePkOvfO",FALSE,4661,180,57,9567,107,2013-01-09 22:36:27,TRUE,"https://t.co/M6TePkOvfO","http://www.senato.it/leg/18/BGT/Schede/Attsen/00029039.htm",,"https://pbs.twimg.com/profile_banners/1075084718/1591968708","http://abs.twimg.com/images/themes/theme1/bg.png","http://pbs.twimg.com/profile_images/3172370357/bec3e4497d64c77f2a93bc9792055992_normal.jpeg"
