"x919526072","x1433149860593684484",2021-09-01 19:28:48,"LucioMalan","Domani mercoledì 2 settembre dalle 11am sarò a @radio3mondo con @ROBZIK per parlare delle conseguenze del ritiro #USA da #Afghanistan nell Indo Pacifico e in particolare a #Taiwan 🇹🇼","Twitter for iPhone",140,,,,FALSE,TRUE,0,8,,,"USA",,,,,,,,,,,,,"x3041208363 x1328672311 x30513255","StefanoPelaggi radio3mondo ROBZIK","it",,,,,,,,,,,,,,,,"x1433144975903141893","Domani mercoledì 2 settembre dalle 11am sarò a @radio3mondo con @ROBZIK per parlare delle conseguenze del ritiro #USA da #Afghanistan nell Indo Pacifico e in particolare a #Taiwan 🇹🇼",2021-09-01 19:09:23,"Twitter for iPhone",16,8,"x3041208363","StefanoPelaggi","Stefano Pelaggi",2052,934,2884,"Roma - Taipei","史大福 PhD History- Teach @SapienzaRoma Write @Geopoliticainfo @formichenews sometimes @ilfoglio_it on #Taiwan #China #softpower #nationalidentity #publicdiplomacy",FALSE,,,,,,,"NA NA","NA NA","NA NA NA NA NA NA NA NA","https://twitter.com/LucioMalan/status/1433149860593684484","Lucio Malan","Italia","Padre di tre, nonno di uno. Senatore di Fratelli d’Italia. Amo la Libertà, l’Italia e la Verità. Sono credente, difendo la famiglia. Canto musica celtica.","https://t.co/KZCpB50DyP",FALSE,13104,3420,118,32160,7888,2012-11-01 17:48:51,FALSE,"https://t.co/KZCpB50DyP","http://www.luciomalan.it",,"https://pbs.twimg.com/profile_banners/919526072/1607764228","http://abs.twimg.com/images/themes/theme1/bg.png","http://pbs.twimg.com/profile_images/1361269399521550336/j4U3ixwe_normal.jpg"
"x919526072","x1433149529788923907",2021-09-01 19:27:29,"LucioMalan","Non hanno il vaccino e rifiutano il tampone, così compagnie aeree e marittime non possono farli salire. Risultato? Niente rimpatrio.
L’ultimo escamotage degli irregolari per non essere espulsi. Una falla incredibile a cui il Governo deve porre immediatamente rimedio. https://t.co/2QKUsvGmai","Twitter for iPhone",140,,,,FALSE,TRUE,0,337,,,,,,,,,,,,,,,,"x130537001","GiorgiaMeloni","it",,,,,,,,,,,,,,,,"x1433133562128130049","Non hanno il vaccino e rifiutano il tampone, così compagnie aeree e marittime non possono farli salire. Risultato? Niente rimpatrio.
L’ultimo escamotage degli irregolari per non essere espulsi. Una falla incredibile a cui il Governo deve porre immediatamente rimedio. https://t.co/2QKUsvGmai",2021-09-01 18:24:02,"Twitter for iPhone",1269,337,"x130537001","GiorgiaMeloni","Giorgia Meloni 🇮🇹 ن",1118000,922,17909,"Italia","Romana, classe '77. Politica e giornalista. Sempre, ovunque e prima di tutto, italiana. Presidente di @FratellidItalia e di @ECRParty",TRUE,,,,,,,"NA NA","NA NA","NA NA NA NA NA NA NA NA","https://twitter.com/LucioMalan/status/1433149529788923907","Lucio Malan","Italia","Padre di tre, nonno di uno. Senatore di Fratelli d’Italia. Amo la Libertà, l’Italia e la Verità. Sono credente, difendo la famiglia. Canto musica celtica.","https://t.co/KZCpB50DyP",FALSE,13104,3420,118,32160,7888,2012-11-01 17:48:51,FALSE,"https://t.co/KZCpB50DyP","http://www.luciomalan.it",,"https://pbs.twimg.com/profile_banners/919526072/1607764228","http://abs.twimg.com/images/themes/theme1/bg.png","http://pbs.twimg.com/profile_images/1361269399521550336/j4U3ixwe_normal.jpg"
"x919526072","x1433130837978009602",2021-09-01 18:13:12,"LucioMalan","I talebani hanno saccheggiato l’unica sinagoga di Kabul, strappando libri ebraici e frantumando menorah. C'era da aspettarselo!

#attualità #afghanistan","Twitter for iPhone",140,,,,FALSE,TRUE,0,21,,,,,,,,,,,,,,,,"x2651749058","EsterP8","it",,,,,,,,,,,,,,,,"x1433039442370043908","I talebani hanno saccheggiato l’unica sinagoga di Kabul, strappando libri ebraici e frantumando menorah. C'era da aspettarselo!

#attualità #afghanistan",2021-09-01 12:10:02,"Twitter for Android",41,21,"x2651749058","EsterP8","ester",1995,2179,34169,"","",FALSE,,,,,,,"NA NA","NA NA","NA NA NA NA NA NA NA NA","https://twitter.com/LucioMalan/status/1433130837978009602","Lucio Malan","Italia","Padre di tre, nonno di uno. Senatore di Fratelli d’Italia. Amo la Libertà, l’Italia e la Verità. Sono credente, difendo la famiglia. Canto musica celtica.","https://t.co/KZCpB50DyP",FALSE,13104,3420,118,32160,7888,2012-11-01 17:48:51,FALSE,"https://t.co/KZCpB50DyP","http://www.luciomalan.it",,"https://pbs.twimg.com/profile_banners/919526072/1607764228","http://abs.twimg.com/images/themes/theme1/bg.png","http://pbs.twimg.com/profile_images/1361269399521550336/j4U3ixwe_normal.jpg"
"x919526072","x1433130392979181574",2021-09-01 18:11:26,"LucioMalan","@TGrillanda Io cerco di fare la mia piccola parte perché si aprano gli occhi e ci si renda conto che il vaccino da solo non risolve il problema e - come ogni farmaco - va usato con criterio.","Twitter for iPhone",178,"x1432930337366085633","x593756816","TGrillanda",FALSE,FALSE,0,0,,,,,,,,,,,,,,,,"x593756816","TGrillanda","it",,,,,,,,,,,,,,,,,,,,,,,,,,,,,,,,,,,,,"NA NA","NA NA","NA NA NA NA NA NA NA NA","https://twitter.com/LucioMalan/status/1433130392979181574","Lucio Malan","Italia","Padre di tre, nonno di uno. Senatore di Fratelli d’Italia. Amo la Libertà, l’Italia e la Verità. Sono credente, difendo la famiglia. Canto musica celtica.","https://t.co/KZCpB50DyP",FALSE,13104,3420,118,32160,7888,2012-11-01 17:48:51,FALSE,"https://t.co/KZCpB50DyP","http://www.luciomalan.it",,"https://pbs.twimg.com/profile_banners/919526072/1607764228","http://abs.twimg.com/images/themes/theme1/bg.png","http://pbs.twimg.com/profile_images/1361269399521550336/j4U3ixwe_normal.jpg"
"x919526072","x1433129257669177345",2021-09-01 18:06:55,"LucioMalan","@BuDuS_it Non faccio alcuna guerra. Dico - come dice lei- che è solo uno strumento, evidentemente insufficiente da solo. L’adorazione va riservata a ad altri soggetti","Twitter for iPhone",156,"x1432950364182044675","x333592940","BuDuS_it",FALSE,FALSE,0,0,,,,,,,,,,,,,,,,"x333592940","BuDuS_it","it",,,,,,,,,,,,,,,,,,,,,,,,,,,,,,,,,,,,,"NA NA","NA NA","NA NA NA NA NA NA NA NA","https://twitter.com/LucioMalan/status/1433129257669177345","Lucio Malan","Italia","Padre di tre, nonno di uno. Senatore di Fratelli d’Italia. Amo la Libertà, l’Italia e la Verità. Sono credente, difendo la famiglia. Canto musica celtica.","https://t.co/KZCpB50DyP",FALSE,13104,3420,118,32160,7888,2012-11-01 17:48:51,FALSE,"https://t.co/KZCpB50DyP","http://www.luciomalan.it",,"https://pbs.twimg.com/profile_banners/919526072/1607764228","http://abs.twimg.com/images/themes/theme1/bg.png","http://pbs.twimg.com/profile_images/1361269399521550336/j4U3ixwe_normal.jpg"
"x919526072","x1433128712543870987",2021-09-01 18:04:45,"LucioMalan","@LTombelli Ecco un altro della setta “vaccino unica salvezza” che si scandalizza se uno accenna al fatto che il vaccino non è il fine ma lo strumento.","Twitter for iPhone",139,"x1432961311470759936","x854689626","LTombelli",FALSE,FALSE,0,0,,,,,,,,,,,,,,,,"x854689626","LTombelli","it",,,,,,,,,,,,,,,,,,,,,,,,,,,,,,,,,,,,,"NA NA","NA NA","NA NA NA NA NA NA NA NA","https://twitter.com/LucioMalan/status/1433128712543870987","Lucio Malan","Italia","Padre di tre, nonno di uno. Senatore di Fratelli d’Italia. Amo la Libertà, l’Italia e la Verità. Sono credente, difendo la famiglia. Canto musica celtica.","https://t.co/KZCpB50DyP",FALSE,13104,3420,118,32160,7888,2012-11-01 17:48:51,FALSE,"https://t.co/KZCpB50DyP","http://www.luciomalan.it",,"https://pbs.twimg.com/profile_banners/919526072/1607764228","http://abs.twimg.com/images/themes/theme1/bg.png","http://pbs.twimg.com/profile_images/1361269399521550336/j4U3ixwe_normal.jpg"
"x919526072","x1433127492630503428",2021-09-01 17:59:55,"LucioMalan","@GiulioTerzi @LucioMalan @rampi https://t.co/YIbmlmenLo","Twitter for iPhone",52,,,,FALSE,TRUE,0,1,,,,,,,,,,,,,,,,"x1713205369 x418028983 x919526072 x14110067","HakamianMahmoud GiulioTerzi LucioMalan rampi","und",,,,,,,,,,,,,,,,"x1433005338769383425","@GiulioTerzi @LucioMalan @rampi https://t.co/YIbmlmenLo",2021-09-01 09:54:31,"Twitter Web App",1,1,"x1713205369","HakamianMahmoud","mahmoud hakamian",2109,636,19240,"Roma Italy","Membro della commissione esteri del Consiglio Nazionale della Resistenza Iraniana",FALSE,,,,,,,"NA NA","NA NA","NA NA NA NA NA NA NA NA","https://twitter.com/LucioMalan/status/1433127492630503428","Lucio Malan","Italia","Padre di tre, nonno di uno. Senatore di Fratelli d’Italia. Amo la Libertà, l’Italia e la Verità. Sono credente, difendo la famiglia. Canto musica celtica.","https://t.co/KZCpB50DyP",FALSE,13104,3420,118,32160,7888,2012-11-01 17:48:51,FALSE,"https://t.co/KZCpB50DyP","http://www.luciomalan.it",,"https://pbs.twimg.com/profile_banners/919526072/1607764228","http://abs.twimg.com/images/themes/theme1/bg.png","http://pbs.twimg.com/profile_images/1361269399521550336/j4U3ixwe_normal.jpg"
"x919526072","x1433127373134774272",2021-09-01 17:59:26,"LucioMalan","@iofausto @LucioMalan I clandestini hanno tutti il green pass?","Twitter for iPhone",83,,,,FALSE,TRUE,0,2,,,,,,,,,,,,,,,,"x1150751883566493696 x1372968120034426887 x919526072","MariaLu91149151 iofausto LucioMalan","it",,,,,,,,,,,,,,,,"x1433018827386892298","@iofausto @LucioMalan I clandestini hanno tutti il green pass?",2021-09-01 10:48:07,"Twitter for Android",3,2,"x1150751883566493696","MariaLu91149151","Maria Luisa",7150,6675,214303,", Emilia Romagna","seguo solo la politica non cerco anime gemelle. 💯",FALSE,,,,,,,"NA NA","NA NA","NA NA NA NA NA NA NA NA","https://twitter.com/LucioMalan/status/1433127373134774272","Lucio Malan","Italia","Padre di tre, nonno di uno. Senatore di Fratelli d’Italia. Amo la Libertà, l’Italia e la Verità. Sono credente, difendo la famiglia. Canto musica celtica.","https://t.co/KZCpB50DyP",FALSE,13104,3420,118,32160,7888,2012-11-01 17:48:51,FALSE,"https://t.co/KZCpB50DyP","http://www.luciomalan.it",,"https://pbs.twimg.com/profile_banners/919526072/1607764228","http://abs.twimg.com/images/themes/theme1/bg.png","http://pbs.twimg.com/profile_images/1361269399521550336/j4U3ixwe_normal.jpg"
"x919526072","x1433127181807456263",2021-09-01 17:58:41,"LucioMalan","Arrivati nella incantevole Bled, Slovenia, per il “Bled Strategic Forum”. Parleremo del futuro dell’Europa e di tanti altri temi di attualità, fondamentali per il destino dell’Italia. #BSF2021 https://t.co/5OeVCnP1Tw","Twitter for iPhone",140,,,,FALSE,TRUE,0,100,,,,,,,,,,,,,,,,"x130537001","GiorgiaMeloni","it",,,,,,,,,,,,,,,,"x1433071752364576779","Arrivati nella incantevole Bled, Slovenia, per il “Bled Strategic Forum”. Parleremo del futuro dell’Europa e di tanti altri temi di attualità, fondamentali per il destino dell’Italia. #BSF2021 https://t.co/5OeVCnP1Tw",2021-09-01 14:18:25,"Twitter for iPhone",1000,100,"x130537001","GiorgiaMeloni","Giorgia Meloni 🇮🇹 ن",1118000,922,17909,"Italia","Romana, classe '77. Politica e giornalista. Sempre, ovunque e prima di tutto, italiana. Presidente di @FratellidItalia e di @ECRParty",TRUE,,,,,,,"NA NA","NA NA","NA NA NA NA NA NA NA NA","https://twitter.com/LucioMalan/status/1433127181807456263","Lucio Malan","Italia","Padre di tre, nonno di uno. Senatore di Fratelli d’Italia. Amo la Libertà, l’Italia e la Verità. Sono credente, difendo la famiglia. Canto musica celtica.","https://t.co/KZCpB50DyP",FALSE,13104,3420,118,32160,7888,2012-11-01 17:48:51,FALSE,"https://t.co/KZCpB50DyP","http://www.luciomalan.it",,"https://pbs.twimg.com/profile_banners/919526072/1607764228","http://abs.twimg.com/images/themes/theme1/bg.png","http://pbs.twimg.com/profile_images/1361269399521550336/j4U3ixwe_normal.jpg"
"x919526072","x1433122528374018051",2021-09-01 17:40:11,"LucioMalan","“Figli sottratti alla madre e messi in casa famiglia per denuncia al padre” (poi si parla di difesa dalle violenze domestiche!). E il ministro Cartabia non risponde alle interrogazioni https://t.co/uhSx8VcyTH","Twitter for iPhone",208,,,,FALSE,FALSE,29,11,,,,,"zonedombratv.it/figli-sottratt…","https://t.co/uhSx8VcyTH","https://www.zonedombratv.it/figli-sottratti-alla-madre-e-messi-in-casa-famiglia-avevano-denunciato-il-padre-per-abusi-mai-ascoltati-dai-giudici/",,,,,,,,,,,"it",,,,,,,,,,,,,,,,,,,,,,,,,,,,,,,,,,,,,"NA NA","NA NA","NA NA NA NA NA NA NA NA","https://twitter.com/LucioMalan/status/1433122528374018051","Lucio Malan","Italia","Padre di tre, nonno di uno. Senatore di Fratelli d’Italia. Amo la Libertà, l’Italia e la Verità. Sono credente, difendo la famiglia. Canto musica celtica.","https://t.co/KZCpB50DyP",FALSE,13104,3420,118,32160,7888,2012-11-01 17:48:51,FALSE,"https://t.co/KZCpB50DyP","http://www.luciomalan.it",,"https://pbs.twimg.com/profile_banners/919526072/1607764228","http://abs.twimg.com/images/themes/theme1/bg.png","http://pbs.twimg.com/profile_images/1361269399521550336/j4U3ixwe_normal.jpg"
"x919526072","x1433036892145164300",2021-09-01 11:59:54,"LucioMalan","@GiorgiaMeloni Parlano di “legalità” per attaccare gli altri ma a sé applicano la regola del Marchese del Grillo","Twitter for iPhone",97,"x1433036480511979525","x130537001","GiorgiaMeloni",FALSE,FALSE,42,11,,,,,,,,,,,,,,,,"x130537001","GiorgiaMeloni","it",,,,,,,,,,,,,,,,,,,,,,,,,,,,,,,,,,,,,"NA NA","NA NA","NA NA NA NA NA NA NA NA","https://twitter.com/LucioMalan/status/1433036892145164300","Lucio Malan","Italia","Padre di tre, nonno di uno. Senatore di Fratelli d’Italia. Amo la Libertà, l’Italia e la Verità. Sono credente, difendo la famiglia. Canto musica celtica.","https://t.co/KZCpB50DyP",FALSE,13104,3420,118,32160,7888,2012-11-01 17:48:51,FALSE,"https://t.co/KZCpB50DyP","http://www.luciomalan.it",,"https://pbs.twimg.com/profile_banners/919526072/1607764228","http://abs.twimg.com/images/themes/theme1/bg.png","http://pbs.twimg.com/profile_images/1361269399521550336/j4U3ixwe_normal.jpg"
"x919526072","x1433036536040333313",2021-09-01 11:58:29,"LucioMalan","Mesi da sceriffo a bacchettare gli italiani con provvedimenti per lo più assurdi, e poi il ministro #Speranza fa i comizi del suo partito “Articolo 1” in un’area occupata abusivamente. Da paladino di regole e restrizioni, a testimonial di illegalità. https://t.co/Kr89rJ9w4Y","Twitter for iPhone",140,,,,FALSE,TRUE,0,250,,,"Speranza",,,,,,,,,,,,,"x130537001","GiorgiaMeloni","it",,,,,,,,,,,,,,,,"x1433036480511979525","Mesi da sceriffo a bacchettare gli italiani con provvedimenti per lo più assurdi, e poi il ministro #Speranza fa i comizi del suo partito “Articolo 1” in un’area occupata abusivamente. Da paladino di regole e restrizioni, a testimonial di illegalità. https://t.co/Kr89rJ9w4Y",2021-09-01 11:58:16,"Twitter for iPhone",1023,250,"x130537001","GiorgiaMeloni","Giorgia Meloni 🇮🇹 ن",1118000,922,17909,"Italia","Romana, classe '77. Politica e giornalista. Sempre, ovunque e prima di tutto, italiana. Presidente di @FratellidItalia e di @ECRParty",TRUE,,,,,,,"NA NA","NA NA","NA NA NA NA NA NA NA NA","https://twitter.com/LucioMalan/status/1433036536040333313","Lucio Malan","Italia","Padre di tre, nonno di uno. Senatore di Fratelli d’Italia. Amo la Libertà, l’Italia e la Verità. Sono credente, difendo la famiglia. Canto musica celtica.","https://t.co/KZCpB50DyP",FALSE,13104,3420,118,32160,7888,2012-11-01 17:48:51,FALSE,"https://t.co/KZCpB50DyP","http://www.luciomalan.it",,"https://pbs.twimg.com/profile_banners/919526072/1607764228","http://abs.twimg.com/images/themes/theme1/bg.png","http://pbs.twimg.com/profile_images/1361269399521550336/j4U3ixwe_normal.jpg"
"x919526072","x1433022817247825921",2021-09-01 11:03:58,"LucioMalan","Sui treni a lunga percorrenza, dove si sta seduti, separati, con sistemi di ricircolo che ripuliscono l'aria ogni 2 ore ci vuole il  grinpas. Sui treni pendolari, dove non funziona manco l'aria e dove nell'attesa si gioca a ""indovina dal mio alito cosa ho mangiato ieri sera""  no.","Twitter for iPhone",139,,,,FALSE,TRUE,0,390,,,,,,,,,,,,,,,,"x1722707281","Cambiacasacca","it",,,,,,,,,,,,,,,,"x1432634866689007617","Sui treni a lunga percorrenza, dove si sta seduti, separati, con sistemi di ricircolo che ripuliscono l'aria ogni 2 ore ci vuole il  grinpas. Sui treni pendolari, dove non funziona manco l'aria e dove nell'attesa si gioca a ""indovina dal mio alito cosa ho mangiato ieri sera""  no.",2021-08-31 09:22:23,"Twitter Web App",1292,390,"x1722707281","Cambiacasacca","Cambiacasacca",19878,6036,74454,"","In politica sono ambidestro, almeno finché non pubblicano i risultati. Tutti in fondo hanno una parte di ragione, quindi son le mie ragioni a far la differenza.",FALSE,,,,,,,"NA NA","NA NA","NA NA NA NA NA NA NA NA","https://twitter.com/LucioMalan/status/1433022817247825921","Lucio Malan","Italia","Padre di tre, nonno di uno. Senatore di Fratelli d’Italia. Amo la Libertà, l’Italia e la Verità. Sono credente, difendo la famiglia. Canto musica celtica.","https://t.co/KZCpB50DyP",FALSE,13104,3420,118,32160,7888,2012-11-01 17:48:51,FALSE,"https://t.co/KZCpB50DyP","http://www.luciomalan.it",,"https://pbs.twimg.com/profile_banners/919526072/1607764228","http://abs.twimg.com/images/themes/theme1/bg.png","http://pbs.twimg.com/profile_images/1361269399521550336/j4U3ixwe_normal.jpg"
"x919526072","x1433021429113659394",2021-09-01 10:58:27,"LucioMalan","Il problema non è quello che dice e che pensa, ma che possa dire una cosa simile come se fosse una normale opinione in TV. https://t.co/491AkAscsl","Twitter for iPhone",139,,,,FALSE,TRUE,0,171,,,,,,,,,,,,,,,,"x585968039","Yi_Benevolence","it",,,,,,,,,,,,,,,,"x1432596453789208577","Il problema non è quello che dice e che pensa, ma che possa dire una cosa simile come se fosse una normale opinione in TV. https://t.co/491AkAscsl",2021-08-31 06:49:45,"TweetDeck",371,171,"x585968039","Yi_Benevolence","Benevolenza 🇮🇹 Accetto minibot 🇮🇹",23203,7110,429054,"","Destra = sinistra, entrambe presuppongono che il denaro sia scarso.  
#noeuro  - #noUE  - #noMES - #noCina",FALSE,,,,,,,"NA NA","NA NA","NA NA NA NA NA NA NA NA","https://twitter.com/LucioMalan/status/1433021429113659394","Lucio Malan","Italia","Padre di tre, nonno di uno. Senatore di Fratelli d’Italia. Amo la Libertà, l’Italia e la Verità. Sono credente, difendo la famiglia. Canto musica celtica.","https://t.co/KZCpB50DyP",FALSE,13104,3420,118,32160,7888,2012-11-01 17:48:51,FALSE,"https://t.co/KZCpB50DyP","http://www.luciomalan.it",,"https://pbs.twimg.com/profile_banners/919526072/1607764228","http://abs.twimg.com/images/themes/theme1/bg.png","http://pbs.twimg.com/profile_images/1361269399521550336/j4U3ixwe_normal.jpg"
"x919526072","x1433021078234927104",2021-09-01 10:57:03,"LucioMalan","Com'era quella della violenza da condannare? https://t.co/kpWNi3KEja","Twitter for iPhone",61,,,,FALSE,TRUE,0,238,,,,,,,,,,,,,,,,"x792731002900709376","Gigadesires","it",,,,,,,,,,,,,,,,"x1432580579543896067","Com'era quella della violenza da condannare? https://t.co/kpWNi3KEja",2021-08-31 05:46:40,"Twitter for Android",624,238,"x792731002900709376","Gigadesires","Giammarco Desideri",7026,3469,78844,"S Benedetto del Tronto, Marche","QUELLO CHE É MORTO NON PUÒ CHE SEGUIRE LA CORRENTE. SOLO QUELLO CHE È VIVO, PUÒ OPPORSI AD ESSA. (G.K. Chesterton)",FALSE,,,,,,,"NA NA","NA NA","NA NA NA NA NA NA NA NA","https://twitter.com/LucioMalan/status/1433021078234927104","Lucio Malan","Italia","Padre di tre, nonno di uno. Senatore di Fratelli d’Italia. Amo la Libertà, l’Italia e la Verità. Sono credente, difendo la famiglia. Canto musica celtica.","https://t.co/KZCpB50DyP",FALSE,13104,3420,118,32160,7888,2012-11-01 17:48:51,FALSE,"https://t.co/KZCpB50DyP","http://www.luciomalan.it",,"https://pbs.twimg.com/profile_banners/919526072/1607764228","http://abs.twimg.com/images/themes/theme1/bg.png","http://pbs.twimg.com/profile_images/1361269399521550336/j4U3ixwe_normal.jpg"
"x428521248","x1433127642136563713",2021-09-01 18:00:30,"SimonaMalpezzi","“Le #Agoràdemocratiche prendono il volo! Segui la diretta dalla festa dell’Unità di Bologna insieme al segretario del PD @EnricoLetta”   
👇https://t.co/tjyWoCg4ne","Twitter for iPhone",140,,,,FALSE,TRUE,0,3,,,"Agoràdemocratiche",,,,,,,,,,,,,"x1416323901592834049","agora_dem","it",,,,,,,,,,,,,,,,"x1433120728547737613","“Le #Agoràdemocratiche prendono il volo! Segui la diretta dalla festa dell’Unità di Bologna insieme al segretario del PD @EnricoLetta”   
👇https://t.co/tjyWoCg4ne",2021-09-01 17:33:02,"Twitter Web App",21,3,"x1416323901592834049","agora_dem","Agorà Democratiche",1268,36,250,"","Il più grande esperimento di democrazia partecipativa del nostro Paese. Prendi parte! #agoràdemocratiche",FALSE,,,,,,,"NA NA","NA NA","NA NA NA NA NA NA NA NA","https://twitter.com/SimonaMalpezzi/status/1433127642136563713","Simona Malpezzi","","Insegnante. Mamma di Flavia Heléne e Charlotte. Presidente dei @senatoripd",,FALSE,21036,1085,143,8619,3421,2011-12-04 21:29:30,TRUE,,,,"https://pbs.twimg.com/profile_banners/428521248/1441648645","http://abs.twimg.com/images/themes/theme1/bg.png","http://pbs.twimg.com/profile_images/989616052182102018/JlbLvUFo_normal.jpg"
"x428521248","x1433102341234954244",2021-09-01 16:19:58,"SimonaMalpezzi","La maggioranza degli italiani sta agendo in modo responsabile ed è a favore delle misure per tutelare salute e ripresa. Le piazze vuote dei #NoVax lo dimostrano. La Ministra Lamorgese ha fatto capire chiaramente che non c’è e non ci sarà nessuna tolleranza per proteste violente.","Twitter for iPhone",279,,,,FALSE,FALSE,45,4,,,"NoVax",,,,,,,,,,,,,,,"it",,,,,,,,,,,,,,,,,,,,,,,,,,,,,,,,,,,,,"NA NA","NA NA","NA NA NA NA NA NA NA NA","https://twitter.com/SimonaMalpezzi/status/1433102341234954244","Simona Malpezzi","","Insegnante. Mamma di Flavia Heléne e Charlotte. Presidente dei @senatoripd",,FALSE,21036,1085,143,8619,3421,2011-12-04 21:29:30,TRUE,,,,"https://pbs.twimg.com/profile_banners/428521248/1441648645","http://abs.twimg.com/images/themes/theme1/bg.png","http://pbs.twimg.com/profile_images/989616052182102018/JlbLvUFo_normal.jpg"
"x57282569","x1433087128582426629",2021-09-01 15:19:31,"AndreaMarcucci","Il flop delle manifestazioni #nogreenpass ci dice due cose: quando lo Stato agisce, la dissuasione funziona, il popolo #novax è molto meno numeroso di quanto si accrediti. E sono due buone notizie.","Twitter for iPhone",197,,,,FALSE,FALSE,136,17,,,"nogreenpass novax",,,,,,,,,,,,,,,"it",,,,,,,,,,,,,,,,,,,,,,,,,,,,,,,,,,,,,"NA NA","NA NA","NA NA NA NA NA NA NA NA","https://twitter.com/AndreaMarcucci/status/1433087128582426629","Andrea Marcucci","Lucca, Italia","Senatore del Pd, appassionato di moto e di storia risorgimentale",,FALSE,23096,1317,278,10022,2567,2009-07-16 08:42:25,TRUE,,,,"https://pbs.twimg.com/profile_banners/57282569/1468948462","http://abs.twimg.com/images/themes/theme5/bg.gif","http://pbs.twimg.com/profile_images/1265650639935283202/2mvPVCA1_normal.jpg"
"x501874833","x1433376804404973571",2021-09-02 10:30:35,"s_margiotta","#Benigni dice su #Mattarella quel che pensano in tanti, e quel che la politica non può o non vuole dire. Grandissimo artista, esprime il sentire comune della maggioranza degli italiani @SenatoriPD","Twitter for iPad",196,,,,FALSE,FALSE,14,5,,,"Benigni Mattarella",,,,,,,,,,,,,"x404048864","SenatoriPD","it",,,,,,,,,,,,,,,,,,,,,,,,,,,,,,,,,,,,,"NA NA","NA NA","NA NA NA NA NA NA NA NA","https://twitter.com/s_margiotta/status/1433376804404973571","Salvatore Margiotta","Roma, Potenza","Senatore, ingegnere, professore universitario. Capogruppo Commissione lavori pubblici e trasporti. Segretario Presidenza Senato","https://t.co/aeYZnOeRaN",FALSE,15625,7287,208,79254,59523,2012-02-24 15:30:04,TRUE,"https://t.co/aeYZnOeRaN","http://instangram.com/salvatore__margiotta",,"https://pbs.twimg.com/profile_banners/501874833/1483357085","http://abs.twimg.com/images/themes/theme1/bg.png","http://pbs.twimg.com/profile_images/1344056897155063808/zdD0fQgS_normal.jpg"
"x501874833","x1433375527595913221",2021-09-02 10:25:31,"s_margiotta","Gentile, riservato, elegante, artista e collega, te ne vai troppo presto e con troppa poca fortuna amico mio Daniele Del Giudice, ""Staccando l'ombra dal suolo"" con la tua eterna grazia. Ho ritrovato da poco le tue lettere e gli inviti, da Paese Sera a Venezia, troppi ricordi. https://t.co/ae2He3Zi53","Twitter for iPad",140,,,,FALSE,TRUE,0,2,,,,,,,,,,,,,,,,"x73971750","riotta","it",,,,,,,,,,,,,,,,"x1433375231029268482","Gentile, riservato, elegante, artista e collega, te ne vai troppo presto e con troppa poca fortuna amico mio Daniele Del Giudice, ""Staccando l'ombra dal suolo"" con la tua eterna grazia. Ho ritrovato da poco le tue lettere e gli inviti, da Paese Sera a Venezia, troppi ricordi. https://t.co/ae2He3Zi53",2021-09-02 10:24:20,"Twitter Web App",7,2,"x73971750","riotta","Gianni Riotta",287164,3493,187390,"","@princeton @cfr_org @uniluiss @lastampa @consiusa @HuffPostItalia @luissdatalab @zeta_luiss @catchybigdata https://t.co/UCeoHVxNVx FB https://t.co/UCeoHVxNVx IG gianniriotta @edmo_EUI",TRUE,,,,,,,"NA NA","NA NA","NA NA NA NA NA NA NA NA","https://twitter.com/s_margiotta/status/1433375527595913221","Salvatore Margiotta","Roma, Potenza","Senatore, ingegnere, professore universitario. Capogruppo Commissione lavori pubblici e trasporti. Segretario Presidenza Senato","https://t.co/aeYZnOeRaN",FALSE,15625,7287,208,79254,59523,2012-02-24 15:30:04,TRUE,"https://t.co/aeYZnOeRaN","http://instangram.com/salvatore__margiotta",,"https://pbs.twimg.com/profile_banners/501874833/1483357085","http://abs.twimg.com/images/themes/theme1/bg.png","http://pbs.twimg.com/profile_images/1344056897155063808/zdD0fQgS_normal.jpg"
