"x87467449","x1470092569040273420",2021-12-12 18:05:56,"grotondi","Non c’è la ressa alle presentazioni del mio libro sulla Dc,questo https://t.co/boQQlYcH3E ci sono principalmente giovanissimi,spesso nemmeno elettori.Altro che nostalgia democristiana.","Twitter for iPhone",184,,,,FALSE,FALSE,22,5,,,,,"no.Ma","https://t.co/boQQlYcH3E","http://no.Ma",,,,,,,,,,,"it",,,,,,,,,,,,,,,,,,,,,,,,,,,,,,,,,,,,,"NA NA","NA NA","NA NA NA NA NA NA NA NA","https://twitter.com/grotondi/status/1470092569040273420","Gianfranco Rotondi","Pescara, Abruzzo","sono poco su Twitter ma senza staff","https://t.co/whoci2nVr7",FALSE,32575,6086,288,50614,8447,2009-11-04 15:52:34,FALSE,"https://t.co/whoci2nVr7","http://www.fondazionedemocraziacristiana.it",,"https://pbs.twimg.com/profile_banners/87467449/1522754488","http://abs.twimg.com/images/themes/theme1/bg.png","http://pbs.twimg.com/profile_images/1420443859952283656/Np6eQk74_normal.jpg"
"x87467449","x1470089518514593809",2021-12-12 17:53:48,"grotondi","@grotondi Ci voleva il genio di Salvini per rincorrere una minoranza rumorosa che manco lo voterà alle prossime elezioni","Twitter for iPhone",140,,,,FALSE,TRUE,0,2,,,,,,,,,,,,,,,,"x715153303 x87467449","AlbeTognarelli grotondi","it",,,,,,,,,,,,,,,,"x1470088146289410051","@grotondi Ci voleva il genio di Salvini per rincorrere una minoranza rumorosa che manco lo voterà alle prossime elezioni",2021-12-12 17:48:21,"Twitter for Android",3,2,"x715153303","AlbeTognarelli","Alberto Tognarelli",195,853,2113,"Pontedera","Studente dell'Università di Firenze. Alunno della @scuolapolitiche. Militante del @pdnetwork. Buonista, radical chic e anti italiano",FALSE,,,,,,,"NA NA","NA NA","NA NA NA NA NA NA NA NA","https://twitter.com/grotondi/status/1470089518514593809","Gianfranco Rotondi","Pescara, Abruzzo","sono poco su Twitter ma senza staff","https://t.co/whoci2nVr7",FALSE,32575,6086,288,50614,8447,2009-11-04 15:52:34,FALSE,"https://t.co/whoci2nVr7","http://www.fondazionedemocraziacristiana.it",,"https://pbs.twimg.com/profile_banners/87467449/1522754488","http://abs.twimg.com/images/themes/theme1/bg.png","http://pbs.twimg.com/profile_images/1420443859952283656/Np6eQk74_normal.jpg"
"x87467449","x1470076511155851267",2021-12-12 17:02:07,"grotondi","Si comincia a parlare di un partito no vax, come era prevedibile","Twitter for iPhone",64,,,,FALSE,FALSE,30,4,,,,,,,,,,,,,,,,,,"it",,,,,,,,,,,,,,,,,,,,,,,,,,,,,,,,,,,,,"NA NA","NA NA","NA NA NA NA NA NA NA NA","https://twitter.com/grotondi/status/1470076511155851267","Gianfranco Rotondi","Pescara, Abruzzo","sono poco su Twitter ma senza staff","https://t.co/whoci2nVr7",FALSE,32575,6086,288,50614,8447,2009-11-04 15:52:34,FALSE,"https://t.co/whoci2nVr7","http://www.fondazionedemocraziacristiana.it",,"https://pbs.twimg.com/profile_banners/87467449/1522754488","http://abs.twimg.com/images/themes/theme1/bg.png","http://pbs.twimg.com/profile_images/1420443859952283656/Np6eQk74_normal.jpg"
"x87467449","x1470070076749623306",2021-12-12 16:36:33,"grotondi","Vicinanza e solidarietà alla comunità di Ravanusa vittima di una triste tragedia.
Che le istituzioni assicurino il massimo sostegno a tutte le famiglie soprattutto a coloro i quali hanno perso i propri cari. https://t.co/cqZ9Oq5OsG","Twitter for iPhone",140,,,,FALSE,TRUE,0,2,,,,,,,,,,,,,,,,"x1319232916455608321","CuffaroToto","it",,,,,,,,,,,,,,,,"x1469997771226816516","Vicinanza e solidarietà alla comunità di Ravanusa vittima di una triste tragedia.
Che le istituzioni assicurino il massimo sostegno a tutte le famiglie soprattutto a coloro i quali hanno perso i propri cari. https://t.co/cqZ9Oq5OsG",2021-12-12 11:49:14,"Twitter for iPhone",8,2,"x1319232916455608321","CuffaroToto","Totò Cuffaro",260,11,108,"","Amo stare tra la gente",FALSE,,,,,,,"NA NA","NA NA","NA NA NA NA NA NA NA NA","https://twitter.com/grotondi/status/1470070076749623306","Gianfranco Rotondi","Pescara, Abruzzo","sono poco su Twitter ma senza staff","https://t.co/whoci2nVr7",FALSE,32575,6086,288,50614,8447,2009-11-04 15:52:34,FALSE,"https://t.co/whoci2nVr7","http://www.fondazionedemocraziacristiana.it",,"https://pbs.twimg.com/profile_banners/87467449/1522754488","http://abs.twimg.com/images/themes/theme1/bg.png","http://pbs.twimg.com/profile_images/1420443859952283656/Np6eQk74_normal.jpg"
"x87467449","x1470005566512771077",2021-12-12 12:20:13,"grotondi","Con Silvio tanta roba https://t.co/trtNU8qVxC","Twitter for iPhone",40,,,,FALSE,TRUE,0,3,,,,,,,,,,,,,,,,"x1261954422420180993","MMastrantuono","es",,,,,,,,,,,,,,,,"x1470002614121152519","Con Silvio tanta roba https://t.co/trtNU8qVxC",2021-12-12 12:08:29,"Twitter for iPhone",3,3,"x1261954422420180993","MMastrantuono","Marco Mastrantuono",503,192,26095,"","conservatore progressista. pantheon: Benedetto XVI, Napolitano, Giolitti, De Gasperi",FALSE,,,,,,,"NA NA","NA NA","NA NA NA NA NA NA NA NA","https://twitter.com/grotondi/status/1470005566512771077","Gianfranco Rotondi","Pescara, Abruzzo","sono poco su Twitter ma senza staff","https://t.co/whoci2nVr7",FALSE,32575,6086,288,50614,8447,2009-11-04 15:52:34,FALSE,"https://t.co/whoci2nVr7","http://www.fondazionedemocraziacristiana.it",,"https://pbs.twimg.com/profile_banners/87467449/1522754488","http://abs.twimg.com/images/themes/theme1/bg.png","http://pbs.twimg.com/profile_images/1420443859952283656/Np6eQk74_normal.jpg"
"x87467449","x1470005546799583232",2021-12-12 12:20:08,"grotondi","#Italia #storia #dc @grotondi https://t.co/8lYtSdC6Od","Twitter for iPhone",68,,,,FALSE,TRUE,0,3,,,"Italia storia dc",,,,,"http://pbs.twimg.com/media/FGaA89fXEAYtjZL.jpg","https://t.co/8lYtSdC6Od","https://twitter.com/GaetanoDB/status/1470004119834443778/photo/1","photo","http://pbs.twimg.com/media/FGaA89fXEAYtjZL.jpg","https://t.co/8lYtSdC6Od","https://twitter.com/GaetanoDB/status/1470004119834443778/photo/1",,"x1242055451723870208 x87467449","GaetanoDB grotondi","und",,,,,,,,,,,,,,,,"x1470004119834443778","#Italia #storia #dc @grotondi https://t.co/8lYtSdC6Od",2021-12-12 12:14:28,"Twitter for iPhone",5,3,"x1242055451723870208","GaetanoDB","Gaetano Di Benedetto",17,172,14,"Montella, Campania","“Quando si dice la verità non bisogna dolersi di averla detta. Essa è sempre illuminante. Ci aiuta ad essere coraggiosi.”  (Aldo Moro)",FALSE,,,,,,,"NA NA","NA NA","NA NA NA NA NA NA NA NA","https://twitter.com/grotondi/status/1470005546799583232","Gianfranco Rotondi","Pescara, Abruzzo","sono poco su Twitter ma senza staff","https://t.co/whoci2nVr7",FALSE,32575,6086,288,50614,8447,2009-11-04 15:52:34,FALSE,"https://t.co/whoci2nVr7","http://www.fondazionedemocraziacristiana.it",,"https://pbs.twimg.com/profile_banners/87467449/1522754488","http://abs.twimg.com/images/themes/theme1/bg.png","http://pbs.twimg.com/profile_images/1420443859952283656/Np6eQk74_normal.jpg"
"x87467449","x1469986334978752516",2021-12-12 11:03:47,"grotondi","Che hanno in comune @berlusconi @BeppeSala @alesallusti @petergomezblog @antoniopascotto ? La variante Dc,mercoledì a Milano https://t.co/xAF6qilIsL","Twitter for iPhone",124,,,,FALSE,FALSE,11,4,,,,,,,,"http://pbs.twimg.com/media/FGZwxy9WUAY4yo2.jpg","https://t.co/xAF6qilIsL","https://twitter.com/grotondi/status/1469986334978752516/photo/1","photo","http://pbs.twimg.com/media/FGZwxy9WUAY4yo2.jpg","https://t.co/xAF6qilIsL","https://twitter.com/grotondi/status/1469986334978752516/photo/1",,"x920277002858500096 x4524412653 x460264679 x274093178 x440877283","berlusconi BeppeSala alesallusti petergomezblog antoniopascotto","it",,,,,,,,,,,,,,,,,,,,,,,,,,,,,,,,,,,,,"NA NA","NA NA","NA NA NA NA NA NA NA NA","https://twitter.com/grotondi/status/1469986334978752516","Gianfranco Rotondi","Pescara, Abruzzo","sono poco su Twitter ma senza staff","https://t.co/whoci2nVr7",FALSE,32575,6086,288,50614,8447,2009-11-04 15:52:34,FALSE,"https://t.co/whoci2nVr7","http://www.fondazionedemocraziacristiana.it",,"https://pbs.twimg.com/profile_banners/87467449/1522754488","http://abs.twimg.com/images/themes/theme1/bg.png","http://pbs.twimg.com/profile_images/1420443859952283656/Np6eQk74_normal.jpg"
"x87467449","x1469985645040861187",2021-12-12 11:01:03,"grotondi","@grotondi Grande Onorevole, benvenuto dalle mie parti. Io sono di Tortoreto, non lontano da Mosciano... Buona domenica.","Twitter for iPhone",139,,,,FALSE,TRUE,0,2,,,,,,,,,,,,,,,,"x3643667115 x87467449","pedelinilore86 grotondi","it",,,,,,,,,,,,,,,,"x1469960232877056002","@grotondi Grande Onorevole, benvenuto dalle mie parti. Io sono di Tortoreto, non lontano da Mosciano... Buona domenica.",2021-12-12 09:20:04,"Twitter Web App",2,2,"x3643667115","pedelinilore86","lorenzo",159,374,11673,"Tortoreto, Abruzzo","Ingegnere Civile presso L'Università dell'Aquila, elettore cattolico, liberale e popolare. DEMOCRAZIA CRISTIANA - PPE",FALSE,,,,,,,"NA NA","NA NA","NA NA NA NA NA NA NA NA","https://twitter.com/grotondi/status/1469985645040861187","Gianfranco Rotondi","Pescara, Abruzzo","sono poco su Twitter ma senza staff","https://t.co/whoci2nVr7",FALSE,32575,6086,288,50614,8447,2009-11-04 15:52:34,FALSE,"https://t.co/whoci2nVr7","http://www.fondazionedemocraziacristiana.it",,"https://pbs.twimg.com/profile_banners/87467449/1522754488","http://abs.twimg.com/images/themes/theme1/bg.png","http://pbs.twimg.com/profile_images/1420443859952283656/Np6eQk74_normal.jpg"
"x87467449","x1469985526639996929",2021-12-12 11:00:35,"grotondi","Per un virologo come @RobertoBurioni consigliamo sempre ""La Variante DC"" di @grotondi. https://t.co/IqoKp7bcPL","Twitter for iPhone",107,,,,FALSE,TRUE,0,2,,,,,,,,,,,,,,,,"x1396026399849320450 x732817452569141248 x87467449","inprimaitaliani RobertoBurioni grotondi","it",,,,,,,,,,,,,,,,"x1469982727105662978","Per un virologo come @RobertoBurioni consigliamo sempre ""La Variante DC"" di @grotondi. https://t.co/IqoKp7bcPL",2021-12-12 10:49:27,"Twitter for Android",4,2,"x1396026399849320450","inprimaitaliani","In Prima gli Italiani",71,284,413,"","30 minuti a settimana di giornali con cui non vi fareste vedere sottobraccio.

Spotify: https://t.co/0Qf4TrAei1",FALSE,,,,,,,"NA NA","NA NA","NA NA NA NA NA NA NA NA","https://twitter.com/grotondi/status/1469985526639996929","Gianfranco Rotondi","Pescara, Abruzzo","sono poco su Twitter ma senza staff","https://t.co/whoci2nVr7",FALSE,32575,6086,288,50614,8447,2009-11-04 15:52:34,FALSE,"https://t.co/whoci2nVr7","http://www.fondazionedemocraziacristiana.it",,"https://pbs.twimg.com/profile_banners/87467449/1522754488","http://abs.twimg.com/images/themes/theme1/bg.png","http://pbs.twimg.com/profile_images/1420443859952283656/Np6eQk74_normal.jpg"
"x560997857","x1469991321217777674",2021-12-12 11:23:36,"francesco_scoma","Immagini drammatiche, quelle che arrivano da #Ravanusa. 
Sono addolorato per la tragedia avvenuta in provincia di Agrigento.
La mia solidarietà e vicinanza alle famiglie delle vittime e a tutto il comune siciliano.
#12dicembre https://t.co/2QclHAtki5","Twitter for iPhone",226,,,,FALSE,FALSE,5,2,,,"Ravanusa 12dicembre",,,,,"http://pbs.twimg.com/media/FGZ1UKEXMAE0WmA.jpg","https://t.co/2QclHAtki5","https://twitter.com/francesco_scoma/status/1469991321217777674/photo/1","photo","http://pbs.twimg.com/media/FGZ1UKEXMAE0WmA.jpg","https://t.co/2QclHAtki5","https://twitter.com/francesco_scoma/status/1469991321217777674/photo/1",,,,"it",,,,,,,,,,,,,,,,,,,,,,,,,,,,,,,,,,,,,"NA NA","NA NA","NA NA NA NA NA NA NA NA","https://twitter.com/francesco_scoma/status/1469991321217777674","Francesco Scoma","Palermo/Roma","Deputato della Repubblica Italiana. Membro del Consiglio di Presidenza della Camera. Sposato con Daniela, papà di F.J.","https://t.co/OMCStqiQOW",FALSE,1287,157,43,1489,11857,2012-04-23 10:07:34,TRUE,"https://t.co/OMCStqiQOW","http://instagram.com/francescoscoma_official",,"https://pbs.twimg.com/profile_banners/560997857/1463349888","http://abs.twimg.com/images/themes/theme1/bg.png","http://pbs.twimg.com/profile_images/2647601736/16dbffc3803f6582aace9b21d4c7f0c7_normal.png"
"x201658727","x1470042552787165187",2021-12-12 14:47:11,"VittorioSgarbi","“Raffaello dipinge ritratti inarrivabili” (Porta a Porta, 9 dicembre 2021) “Raffaello. Un Dio mortale”, edito da “La Nave di Teseo”. https://t.co/ZaYa8G5HLb Con una dedica e autografo puoi ordinarlo qui:
https://t.co/bUZuKPSvhg @stampasgarbi @lanavediteseoed","Twitter Web App",258,,,,FALSE,FALSE,50,4,,,,,"youtu.be/lPpTEj3u-pU vittoriosgarbi.it/libri/raffaell…","https://t.co/ZaYa8G5HLb https://t.co/bUZuKPSvhg","https://youtu.be/lPpTEj3u-pU https://www.vittoriosgarbi.it/libri/raffaello-un-dio-mortale",,,,,,,,,"x2164988132 x4275320235","stampasgarbi lanavediteseoed","it",,,,,,,,,,,,,,,,,,,,,,,,,,,,,,,,,,,,,"NA NA","NA NA","NA NA NA NA NA NA NA NA","https://twitter.com/VittorioSgarbi/status/1470042552787165187","Vittorio Sgarbi","mai nello stesso luogo","Twitter ufficiale di Vittorio Sgarbi - Storico dell'Arte e Opinionista | Contatti: press@vittoriosgarbi.it
Capra Store: https://t.co/XvD8pqlFul","https://t.co/v3GBQb33Lz",FALSE,790525,355,1294,11947,4245,2010-10-12 10:20:00,TRUE,"https://t.co/v3GBQb33Lz","http://www.vittoriosgarbi.it",,"https://pbs.twimg.com/profile_banners/201658727/1634300255","http://abs.twimg.com/images/themes/theme1/bg.png","http://pbs.twimg.com/profile_images/378800000563952334/834a3c187534931f8af26f78b6c274a8_normal.jpeg"
"x201658727","x1470042144832430087",2021-12-12 14:45:34,"VittorioSgarbi","Quello che non c’è a Roma, lo trovate a Sutri. 
(TG2 Storie, 12 dicembre 2021) https://t.co/N8z7HezqcH @stampasgarbi","Twitter Web App",116,,,,FALSE,FALSE,40,6,,,,,"youtube.com/watch?v=dGe1hV…","https://t.co/N8z7HezqcH","https://www.youtube.com/watch?v=dGe1hV3tVTE",,,,,,,,,"x2164988132","stampasgarbi","it",,,,,,,,,,,,,,,,,,,,,,,,,,,,,,,,,,,,,"NA NA","NA NA","NA NA NA NA NA NA NA NA","https://twitter.com/VittorioSgarbi/status/1470042144832430087","Vittorio Sgarbi","mai nello stesso luogo","Twitter ufficiale di Vittorio Sgarbi - Storico dell'Arte e Opinionista | Contatti: press@vittoriosgarbi.it
Capra Store: https://t.co/XvD8pqlFul","https://t.co/v3GBQb33Lz",FALSE,790525,355,1294,11947,4245,2010-10-12 10:20:00,TRUE,"https://t.co/v3GBQb33Lz","http://www.vittoriosgarbi.it",,"https://pbs.twimg.com/profile_banners/201658727/1634300255","http://abs.twimg.com/images/themes/theme1/bg.png","http://pbs.twimg.com/profile_images/378800000563952334/834a3c187534931f8af26f78b6c274a8_normal.jpeg"
"x499672556","x1470082884023336967",2021-12-12 17:27:27,"GiorgioSilli","Il mondo fatato in cui si vietano per legge le crisi aziendali, le delocalizzazioni, l'inflazione, gli aumenti delle bollette.
E poi c'è la realtà.","Twitter for iPhone",140,,,,FALSE,TRUE,0,128,,,,,,,,,,,,,,,,"x454048091","simpaol","it",,,,,,,,,,,,,,,,"x1469923636173803521","Il mondo fatato in cui si vietano per legge le crisi aziendali, le delocalizzazioni, l'inflazione, gli aumenti delle bollette.
E poi c'è la realtà.",2021-12-12 06:54:39,"Twitter for Android",842,128,"x454048091","simpaol","Simone Paoli",2245,624,68167,"Terlano, Trentino-Alto Adige","Non sono geloso delle mie idee. Ingegnere (ex?) mi occupo di ambiente ed energia.  
Juventino più che mai dal 2006.",FALSE,,,,,,,"NA NA","NA NA","NA NA NA NA NA NA NA NA","https://twitter.com/GiorgioSilli/status/1470082884023336967","Giorgio Silli","Prato, Toscana","Babbo di Isabella, Deputato della Repubblica.Tintore. Molto rossiniano","https://t.co/i4HLZLAULC",FALSE,1911,651,33,6641,2506,2012-02-22 10:49:12,FALSE,"https://t.co/i4HLZLAULC","http://giorgiosilli.it",,"https://pbs.twimg.com/profile_banners/499672556/1434717572","http://abs.twimg.com/images/themes/theme1/bg.png","http://pbs.twimg.com/profile_images/1076762978752577536/9E8AyaPD_normal.jpg"
"x447056150","x1470117531096600587",2021-12-12 19:45:07,"GiusyVersace","Take your time!
Gli ostacoli si superano: ALLENATI !
La vita è così bella che troppe volte ci dimentichiamo di viverla❤
#ThankGod #lovethispic #lovelife #tremendavogliadivivere #nevergiveup https://t.co/e2mM8OuQSa","Instagram",213,,,,FALSE,FALSE,4,0,,,"ThankGod lovethispic lovelife tremendavogliadivivere nevergiveup",,"instagram.com/p/CXZR6JyKAM5/…","https://t.co/e2mM8OuQSa","https://www.instagram.com/p/CXZR6JyKAM5/?utm_medium=twitter",,,,,,,,,,,"it",,,,,,,,,,,,,,,,,,,,,,,,,,,,,,,,,,,,,"NA NA","NA NA","NA NA NA NA NA NA NA NA","https://twitter.com/GiusyVersace/status/1470117531096600587","Giusy Versace","Milano","Cominciate col fare il necessario, poi cio' che e' possibile e all'improvviso vi sorprenderete a fare l'impossibile - S.Francesco d'Assisi","http://t.co/jemrvujzQb",FALSE,25976,2088,122,21859,16135,2011-12-26 13:05:12,TRUE,"http://t.co/jemrvujzQb","http://www.giusyversace.it",,"https://pbs.twimg.com/profile_banners/447056150/1363347299","http://abs.twimg.com/images/themes/theme1/bg.png","http://pbs.twimg.com/profile_images/378800000828007270/bad08b8529048aef2d0a82e084b0b31a_normal.jpeg"
"x447056150","x1470106588270710787",2021-12-12 19:01:38,"GiusyVersace","#12dicembre 1969 - un ordigno esplode a Milano nella sede della Banca Nazionale dell’Agricoltura di #PiazzaFontana; 17 vittime, 89 feriti. È l'inizio della strategia della tensione.

L'Aula viene convocata d'urgenza di sabato, il giorno dopo https://t.co/i83AoS8qHq
#StoriadItalia https://t.co/oMBTc0OKZg","Twitter Web App",140,,,,FALSE,TRUE,0,18,,,"12dicembre PiazzaFontana",,,,,,,,,,,,,"x2278995820","Montecitorio","it",,,,,,,,,,,,,,,,"x1469947632760066048","#12dicembre 1969 - un ordigno esplode a Milano nella sede della Banca Nazionale dell’Agricoltura di #PiazzaFontana; 17 vittime, 89 feriti. È l'inizio della strategia della tensione.

L'Aula viene convocata d'urgenza di sabato, il giorno dopo https://t.co/i83AoS8qHq
#StoriadItalia https://t.co/oMBTc0OKZg",2021-12-12 08:30:00,"Twitter Web App",38,18,"x2278995820","Montecitorio","Camera dei deputati",337376,840,23982,"Roma, Italia","Account ufficiale della Camera dei deputati - La democrazia si fa qui - Netiquette: https://t.co/b7xiVxpnPH",TRUE,,,,,,,"NA NA","NA NA","NA NA NA NA NA NA NA NA","https://twitter.com/GiusyVersace/status/1470106588270710787","Giusy Versace","Milano","Cominciate col fare il necessario, poi cio' che e' possibile e all'improvviso vi sorprenderete a fare l'impossibile - S.Francesco d'Assisi","http://t.co/jemrvujzQb",FALSE,25976,2088,122,21859,16135,2011-12-26 13:05:12,TRUE,"http://t.co/jemrvujzQb","http://www.giusyversace.it",,"https://pbs.twimg.com/profile_banners/447056150/1363347299","http://abs.twimg.com/images/themes/theme1/bg.png","http://pbs.twimg.com/profile_images/378800000828007270/bad08b8529048aef2d0a82e084b0b31a_normal.jpeg"
"x447056150","x1470105859334225924",2021-12-12 18:58:44,"GiusyVersace","Protect our communities. Protect each other. 

Please, if you're able - get vaccinated. https://t.co/Cdl2rBqX2m","Twitter Web App",119,,,,FALSE,TRUE,0,3971,,,,,,,,"http://pbs.twimg.com/amplify_video_thumb/1469413926312062982/img/TxBLSFyk8wah1uYI.jpg","https://t.co/Cdl2rBqX2m","https://twitter.com/F1/status/1469562593874522113/video/1","photo","http://pbs.twimg.com/amplify_video_thumb/1469413926312062982/img/TxBLSFyk8wah1uYI.jpg","https://t.co/Cdl2rBqX2m","https://twitter.com/F1/status/1469562593874522113/video/1",,"x69008563","F1","en",,,,,,,,,,,,,,,,"x1469562593874522113","Protect our communities. Protect each other. 

Please, if you're able - get vaccinated. https://t.co/Cdl2rBqX2m",2021-12-11 07:00:00,"Twitter Media Studio",24442,3971,"x69008563","F1","Formula 1",6921575,80,69942,"","MAX VERSTAPPEN, WORLD CHAMPION!",TRUE,,,,,,,"NA NA","NA NA","NA NA NA NA NA NA NA NA","https://twitter.com/GiusyVersace/status/1470105859334225924","Giusy Versace","Milano","Cominciate col fare il necessario, poi cio' che e' possibile e all'improvviso vi sorprenderete a fare l'impossibile - S.Francesco d'Assisi","http://t.co/jemrvujzQb",FALSE,25976,2088,122,21859,16135,2011-12-26 13:05:12,TRUE,"http://t.co/jemrvujzQb","http://www.giusyversace.it",,"https://pbs.twimg.com/profile_banners/447056150/1363347299","http://abs.twimg.com/images/themes/theme1/bg.png","http://pbs.twimg.com/profile_images/378800000828007270/bad08b8529048aef2d0a82e084b0b31a_normal.jpeg"
"x447056150","x1470105712659505152",2021-12-12 18:58:09,"GiusyVersace","Prima decisione: protesta respinta per manovre Max Verstappen sotto Safety Car #f1 #SkyMotori","Twitter Web App",114,,,,FALSE,TRUE,0,24,,,"f1 SkyMotori",,,,,,,,,,,,,"x456041269","mara_sangiorgio","it",,,,,,,,,,,,,,,,"x1470098352972914696","Prima decisione: protesta respinta per manovre Max Verstappen sotto Safety Car #f1 #SkyMotori",2021-12-12 18:28:55,"Twitter for iPhone",369,24,"x456041269","mara_sangiorgio","Mara Sangiorgio",39248,866,5593,"Milano","Journalist at Sky Sport24. Ci vuole un caos dentro di sè per generare una stella danzante...",FALSE,,,,,,,"NA NA","NA NA","NA NA NA NA NA NA NA NA","https://twitter.com/GiusyVersace/status/1470105712659505152","Giusy Versace","Milano","Cominciate col fare il necessario, poi cio' che e' possibile e all'improvviso vi sorprenderete a fare l'impossibile - S.Francesco d'Assisi","http://t.co/jemrvujzQb",FALSE,25976,2088,122,21859,16135,2011-12-26 13:05:12,TRUE,"http://t.co/jemrvujzQb","http://www.giusyversace.it",,"https://pbs.twimg.com/profile_banners/447056150/1363347299","http://abs.twimg.com/images/themes/theme1/bg.png","http://pbs.twimg.com/profile_images/378800000828007270/bad08b8529048aef2d0a82e084b0b31a_normal.jpeg"
"x447056150","x1470103506883432459",2021-12-12 18:49:23,"GiusyVersace","Una gioia indescrivibile, una gioia da CAMPIONE DEL MONDO! 😍🏆😢

#AbuDhabiGP | #Verstappen | #F1 https://t.co/fP6AsmNmv3","Twitter for Android",137,,,,FALSE,TRUE,0,35,,,"AbuDhabiGP Verstappen F1",,,,,"http://pbs.twimg.com/media/FGaphsaXIAQrHuT.jpg","https://t.co/fP6AsmNmv3","https://twitter.com/Eurosport_IT/status/1470048815377965059/photo/1","photo","http://pbs.twimg.com/media/FGaphsaXIAQrHuT.jpg http://pbs.twimg.com/media/FGaphsoXwAAfd9P.jpg http://pbs.twimg.com/media/FGaphtuX0AU5kPV.jpg","https://t.co/fP6AsmNmv3 https://t.co/fP6AsmNmv3 https://t.co/fP6AsmNmv3","https://twitter.com/Eurosport_IT/status/1470048815377965059/photo/1 https://twitter.com/Eurosport_IT/status/1470048815377965059/photo/1 https://twitter.com/Eurosport_IT/status/1470048815377965059/photo/1",,"x275078542","Eurosport_IT","it",,,,,,,,,,,,,,,,"x1470048815377965059","Una gioia indescrivibile, una gioia da CAMPIONE DEL MONDO! 😍🏆😢

#AbuDhabiGP | #Verstappen | #F1 https://t.co/fP6AsmNmv3",2021-12-12 15:12:04,"Twitter Web App",329,35,"x275078542","Eurosport_IT","Eurosport IT",112668,373,168920,"","https://t.co/vZZi5yPnD7 | https://t.co/1N4Hk6wvBZ | https://t.co/m4Cv5SIgxp… | #HomeOfTheOlympics | Support: @EurosportCare",TRUE,,,,,,,"NA NA","NA NA","NA NA NA NA NA NA NA NA","https://twitter.com/GiusyVersace/status/1470103506883432459","Giusy Versace","Milano","Cominciate col fare il necessario, poi cio' che e' possibile e all'improvviso vi sorprenderete a fare l'impossibile - S.Francesco d'Assisi","http://t.co/jemrvujzQb",FALSE,25976,2088,122,21859,16135,2011-12-26 13:05:12,TRUE,"http://t.co/jemrvujzQb","http://www.giusyversace.it",,"https://pbs.twimg.com/profile_banners/447056150/1363347299","http://abs.twimg.com/images/themes/theme1/bg.png","http://pbs.twimg.com/profile_images/378800000828007270/bad08b8529048aef2d0a82e084b0b31a_normal.jpeg"
"x447056150","x1470102984822558723",2021-12-12 18:47:19,"GiusyVersace","#permareperterram #montagna https://t.co/PRPxJnviom","Twitter for Android",44,,,,FALSE,TRUE,0,3,,,"permareperterram montagna",,,,,,,,,,,,,"x868645789","Comunico_70","und",,,,,,,,,,,,,,,,"x1468553314468048899","#permareperterram #montagna https://t.co/PRPxJnviom",2021-12-08 12:09:29,"Twitter for iPhone",13,3,"x868645789","Comunico_70","LucaAnconelli",5520,2081,30657,"Roma, Lazio","#NoiSiamolaMarina https://t.co/hB6mnvoMZU https://t.co/XEPHurKULK https://t.co/XWjNluhWAG",FALSE,,,,,,,"NA NA","NA NA","NA NA NA NA NA NA NA NA","https://twitter.com/GiusyVersace/status/1470102984822558723","Giusy Versace","Milano","Cominciate col fare il necessario, poi cio' che e' possibile e all'improvviso vi sorprenderete a fare l'impossibile - S.Francesco d'Assisi","http://t.co/jemrvujzQb",FALSE,25976,2088,122,21859,16135,2011-12-26 13:05:12,TRUE,"http://t.co/jemrvujzQb","http://www.giusyversace.it",,"https://pbs.twimg.com/profile_banners/447056150/1363347299","http://abs.twimg.com/images/themes/theme1/bg.png","http://pbs.twimg.com/profile_images/378800000828007270/bad08b8529048aef2d0a82e084b0b31a_normal.jpeg"
"x447056150","x1470102782564835341",2021-12-12 18:46:31,"GiusyVersace","Nominato il nuovo cancelliere tedesco: chi è Olaf Scholz https://t.co/bkAPKm0Rj5","Twitter for Android",98,,,,FALSE,TRUE,0,5,,,,,"buff.ly/3rQdaEi","https://t.co/bkAPKm0Rj5","https://buff.ly/3rQdaEi",,,,,,,,,"x132880191","Avvenire_Nei","it",,,,,,,,,,,,,,,,"x1468553196528353286","Nominato il nuovo cancelliere tedesco: chi è Olaf Scholz https://t.co/bkAPKm0Rj5",2021-12-08 12:09:01,"Buffer",9,5,"x132880191","Avvenire_Nei","𝐀𝐯𝐯𝐞𝐧𝐢𝐫𝐞",94512,782,76599,"Milano, Lombardia","Profilo Ufficiale - Quotidiano di ispirazione cattolica",TRUE,,,,,,,"NA NA","NA NA","NA NA NA NA NA NA NA NA","https://twitter.com/GiusyVersace/status/1470102782564835341","Giusy Versace","Milano","Cominciate col fare il necessario, poi cio' che e' possibile e all'improvviso vi sorprenderete a fare l'impossibile - S.Francesco d'Assisi","http://t.co/jemrvujzQb",FALSE,25976,2088,122,21859,16135,2011-12-26 13:05:12,TRUE,"http://t.co/jemrvujzQb","http://www.giusyversace.it",,"https://pbs.twimg.com/profile_banners/447056150/1363347299","http://abs.twimg.com/images/themes/theme1/bg.png","http://pbs.twimg.com/profile_images/378800000828007270/bad08b8529048aef2d0a82e084b0b31a_normal.jpeg"
