"x501874833","x1476940083181850628",2021-12-31 15:35:30,"s_margiotta","Leggo in agenzia che D’Alema - della cui intelligenza ho sempre avuto grande rispetto - avrebbe definito il @pdnetwork dell’epoca renziana come affetto da una “malattia” dalla quale sarebbe poi “guarito”. Non faccio mai polemiche, figurarsi qui e con personalità insigni.","Twitter for iPad",140,,,,FALSE,TRUE,0,49,,,,,,,,,,,,,,,,"x104960470 x13294452","nomfup pdnetwork","it",,,,,,,,,,,,,,,,"x1476909727309303809","Leggo in agenzia che D’Alema - della cui intelligenza ho sempre avuto grande rispetto - avrebbe definito il @pdnetwork dell’epoca renziana come affetto da una “malattia” dalla quale sarebbe poi “guarito”. Non faccio mai polemiche, figurarsi qui e con personalità insigni.",2021-12-31 13:34:53,"Twitter for iPhone",256,49,"x104960470","nomfup","nomfup",123983,7311,144176,"Italy","Un blog collettivo su comunicazione e politica. Ha un fratello: @andreariscassi. Spin-off dei pupazzetti su FB: https://t.co/3OWnDLQTE2",FALSE,,,,,,,"NA NA","NA NA","NA NA NA NA NA NA NA NA","https://twitter.com/s_margiotta/status/1476940083181850628","Salvatore Margiotta","Roma, Potenza","Senatore, ingegnere, professore universitario. Capogruppo Commissione lavori pubblici e trasporti. Segretario Presidenza Senato","https://t.co/aeYZnOeRaN",FALSE,15771,7325,207,80389,60880,2012-02-24 15:30:04,TRUE,"https://t.co/aeYZnOeRaN","http://instangram.com/salvatore__margiotta",,"https://pbs.twimg.com/profile_banners/501874833/1483357085","http://abs.twimg.com/images/themes/theme1/bg.png","http://pbs.twimg.com/profile_images/1344056897155063808/zdD0fQgS_normal.jpg"
"x501874833","x1476939937039753222",2021-12-31 15:34:55,"s_margiotta","Muro umano alla frontiera per non lasciarla andare, immagino. https://t.co/cEnNmZGq1b","Twitter for iPad",106,,,,FALSE,TRUE,0,124,,,,,,,,"http://pbs.twimg.com/media/FH45njaXwAMYwrw.jpg","https://t.co/cEnNmZGq1b","https://twitter.com/stanzaselvaggia/status/1476681083051778049/photo/1","photo","http://pbs.twimg.com/media/FH45njaXwAMYwrw.jpg","https://t.co/cEnNmZGq1b","https://twitter.com/stanzaselvaggia/status/1476681083051778049/photo/1",,"x416476798","stanzaselvaggia","it",,,,,,,,,,,,,,,,"x1476681083051778049","Muro umano alla frontiera per non lasciarla andare, immagino. https://t.co/cEnNmZGq1b",2021-12-30 22:26:20,"Twitter for iPhone",2942,124,"x416476798","stanzaselvaggia","Selvaggia Lucarelli",1091277,1708,30214,"Milan","Giornalista a Domani. Radio Capital alle 9. Ballando con le stelle. In libreria con “Crepacuore”. Contatti: info@newco-mgmt.com",TRUE,,,,,,,"NA NA","NA NA","NA NA NA NA NA NA NA NA","https://twitter.com/s_margiotta/status/1476939937039753222","Salvatore Margiotta","Roma, Potenza","Senatore, ingegnere, professore universitario. Capogruppo Commissione lavori pubblici e trasporti. Segretario Presidenza Senato","https://t.co/aeYZnOeRaN",FALSE,15771,7325,207,80389,60880,2012-02-24 15:30:04,TRUE,"https://t.co/aeYZnOeRaN","http://instangram.com/salvatore__margiotta",,"https://pbs.twimg.com/profile_banners/501874833/1483357085","http://abs.twimg.com/images/themes/theme1/bg.png","http://pbs.twimg.com/profile_images/1344056897155063808/zdD0fQgS_normal.jpg"
"x501874833","x1476920848451874822",2021-12-31 14:19:04,"s_margiotta","@leonardopisani1 @fedefresa @AnnaCamo1 @ElenarussoTW @Unavoltanera @agerardi68 @sildibartolomeo @CinziaGrenci @amalajz4 @GiuseppeLupo8 @antonioblasotta @Vincenz78441140 @LaRobiErre @TestaAgnese @paoloigna1 @PioBelmonte @GiusMelillo @LucianoPetrullo @NicolaValluzzi @rocifa1163 Ottimo!","Twitter for iPad",7,"x1476918635071512596","x500804936","leonardopisani1",FALSE,FALSE,2,0,,,,,,,,,,,,,,,,"x500804936 x412587936 x3510678023 x1325398530 x1235564719198658561 x416381965 x2786579984 x2365001385 x1660889534 x803153028 x615105375 x1344660302575640577 x70420459 x2749172153 x1341462944 x1335550642362912768 x19531637 x85360316 x1225737806 x1594074427","leonardopisani1 fedefresa AnnaCamo1 ElenarussoTW Unavoltanera agerardi68 sildibartolomeo CinziaGrenci amalajz4 GiuseppeLupo8 antonioblasotta Vincenz78441140 LaRobiErre TestaAgnese paoloigna1 PioBelmonte GiusMelillo LucianoPetrullo NicolaValluzzi rocifa1163","it",,,,,,,,,,,,,,,,,,,,,,,,,,,,,,,,,,,,,"NA NA","NA NA","NA NA NA NA NA NA NA NA","https://twitter.com/s_margiotta/status/1476920848451874822","Salvatore Margiotta","Roma, Potenza","Senatore, ingegnere, professore universitario. Capogruppo Commissione lavori pubblici e trasporti. Segretario Presidenza Senato","https://t.co/aeYZnOeRaN",FALSE,15771,7325,207,80389,60880,2012-02-24 15:30:04,TRUE,"https://t.co/aeYZnOeRaN","http://instangram.com/salvatore__margiotta",,"https://pbs.twimg.com/profile_banners/501874833/1483357085","http://abs.twimg.com/images/themes/theme1/bg.png","http://pbs.twimg.com/profile_images/1344056897155063808/zdD0fQgS_normal.jpg"
"x501874833","x1476916512640352258",2021-12-31 14:01:51,"s_margiotta","@leonardopisani1 @fedefresa @AnnaCamo1 @ElenarussoTW @Unavoltanera @agerardi68 @sildibartolomeo @CinziaGrenci @amalajz4 @GiuseppeLupo8 @antonioblasotta @Vincenz78441140 @LaRobiErre @TestaAgnese @paoloigna1 @PioBelmonte @GiusMelillo @LucianoPetrullo @NicolaValluzzi @rocifa1163 Cautarogne non lo capisco neppure io..ce lo@spieghi?","Twitter for iPad",52,"x1476906111634661383","x500804936","leonardopisani1",FALSE,FALSE,0,0,,,,,,,,,,,,,,,,"x500804936 x412587936 x3510678023 x1325398530 x1235564719198658561 x416381965 x2786579984 x2365001385 x1660889534 x803153028 x615105375 x1344660302575640577 x70420459 x2749172153 x1341462944 x1335550642362912768 x19531637 x85360316 x1225737806 x1594074427","leonardopisani1 fedefresa AnnaCamo1 ElenarussoTW Unavoltanera agerardi68 sildibartolomeo CinziaGrenci amalajz4 GiuseppeLupo8 antonioblasotta Vincenz78441140 LaRobiErre TestaAgnese paoloigna1 PioBelmonte GiusMelillo LucianoPetrullo NicolaValluzzi rocifa1163","it",,,,,,,,,,,,,,,,,,,,,,,,,,,,,,,,,,,,,"NA NA","NA NA","NA NA NA NA NA NA NA NA","https://twitter.com/s_margiotta/status/1476916512640352258","Salvatore Margiotta","Roma, Potenza","Senatore, ingegnere, professore universitario. Capogruppo Commissione lavori pubblici e trasporti. Segretario Presidenza Senato","https://t.co/aeYZnOeRaN",FALSE,15771,7325,207,80389,60880,2012-02-24 15:30:04,TRUE,"https://t.co/aeYZnOeRaN","http://instangram.com/salvatore__margiotta",,"https://pbs.twimg.com/profile_banners/501874833/1483357085","http://abs.twimg.com/images/themes/theme1/bg.png","http://pbs.twimg.com/profile_images/1344056897155063808/zdD0fQgS_normal.jpg"
"x501874833","x1476916365378347011",2021-12-31 14:01:15,"s_margiotta","A.D. 31 dicembre 2021 quasi 2022 #VeduteLucane fusidde aurichitedde e cautarogne aviglianesi #Basilicata in tavola @fedefresa @AnnaCamo1 @ElenarussoTW @Unavoltanera @agerardi68 @sildibartolomeo @CinziaGrenci @s_margiotta @amalajz4 @GiuseppeLupo8 @antonioblasotta https://t.co/Z6zx0FxXa2","Twitter for iPad",140,,,,FALSE,TRUE,0,3,,,"VeduteLucane Basilicata",,,,,,,,,,,,,"x500804936","leonardopisani1","it",,,,,,,,,,,,,,,,"x1476906111634661383","A.D. 31 dicembre 2021 quasi 2022 #VeduteLucane fusidde aurichitedde e cautarogne aviglianesi #Basilicata in tavola @fedefresa @AnnaCamo1 @ElenarussoTW @Unavoltanera @agerardi68 @sildibartolomeo @CinziaGrenci @s_margiotta @amalajz4 @GiuseppeLupo8 @antonioblasotta https://t.co/Z6zx0FxXa2",2021-12-31 13:20:31,"Twitter for Android",12,3,"x500804936","leonardopisani1","leonardo pisani",13313,14422,26477,"Avigliano","Non ho soldi, non ho risorse, non ho speranze. Sono l'uomo più felice del mondo. ( Henry Miller)  giornalista",FALSE,,,,,,,"NA NA","NA NA","NA NA NA NA NA NA NA NA","https://twitter.com/s_margiotta/status/1476916365378347011","Salvatore Margiotta","Roma, Potenza","Senatore, ingegnere, professore universitario. Capogruppo Commissione lavori pubblici e trasporti. Segretario Presidenza Senato","https://t.co/aeYZnOeRaN",FALSE,15771,7325,207,80389,60880,2012-02-24 15:30:04,TRUE,"https://t.co/aeYZnOeRaN","http://instangram.com/salvatore__margiotta",,"https://pbs.twimg.com/profile_banners/501874833/1483357085","http://abs.twimg.com/images/themes/theme1/bg.png","http://pbs.twimg.com/profile_images/1344056897155063808/zdD0fQgS_normal.jpg"
"x501874833","x1476889157867814932",2021-12-31 12:13:09,"s_margiotta","https://t.co/ELR8YhOHnn","Twitter for iPad",23,,,,FALSE,FALSE,11,5,,,,,"lecronachelucane.it/2021/12/31/gua…","https://t.co/ELR8YhOHnn","https://www.lecronachelucane.it/2021/12/31/guardiamo-avanti-e-ripartiamo-dalle-prospettive/",,,,,,,,,,,"und",,,,,,,,,,,,,,,,,,,,,,,,,,,,,,,,,,,,,"NA NA","NA NA","NA NA NA NA NA NA NA NA","https://twitter.com/s_margiotta/status/1476889157867814932","Salvatore Margiotta","Roma, Potenza","Senatore, ingegnere, professore universitario. Capogruppo Commissione lavori pubblici e trasporti. Segretario Presidenza Senato","https://t.co/aeYZnOeRaN",FALSE,15771,7325,207,80389,60880,2012-02-24 15:30:04,TRUE,"https://t.co/aeYZnOeRaN","http://instangram.com/salvatore__margiotta",,"https://pbs.twimg.com/profile_banners/501874833/1483357085","http://abs.twimg.com/images/themes/theme1/bg.png","http://pbs.twimg.com/profile_images/1344056897155063808/zdD0fQgS_normal.jpg"
"x501874833","x1476883105893990407",2021-12-31 11:49:06,"s_margiotta","@rizzonervo Cioé deve cambiare strutturalmente la governance","Twitter for iPad",76,,,,FALSE,TRUE,0,1,,,,,,,,,,,,,,,,"x434217283 x513660315","SBalassone rizzonervo","it",,,,,,,,,,,,,,,,"x1476882597686951946","@rizzonervo Cioé deve cambiare strutturalmente la governance",2021-12-31 11:47:05,"Twitter for Android",1,1,"x434217283","SBalassone","Stefano Balassone",1616,475,8557,"roma","manager media, insegna comunicazione, osserva la politica",FALSE,,,,,,,"NA NA","NA NA","NA NA NA NA NA NA NA NA","https://twitter.com/s_margiotta/status/1476883105893990407","Salvatore Margiotta","Roma, Potenza","Senatore, ingegnere, professore universitario. Capogruppo Commissione lavori pubblici e trasporti. Segretario Presidenza Senato","https://t.co/aeYZnOeRaN",FALSE,15771,7325,207,80389,60880,2012-02-24 15:30:04,TRUE,"https://t.co/aeYZnOeRaN","http://instangram.com/salvatore__margiotta",,"https://pbs.twimg.com/profile_banners/501874833/1483357085","http://abs.twimg.com/images/themes/theme1/bg.png","http://pbs.twimg.com/profile_images/1344056897155063808/zdD0fQgS_normal.jpg"
"x501874833","x1476883094024110102",2021-12-31 11:49:03,"s_margiotta","Per il servizio pubblico radiotelevisivo la riforma delle news è necessaria e non è rinviabile. Ci vuole però visione e il coraggio di rinunciare al manuale Cencelli https://t.co/cwYrfff4b1","Twitter for iPad",139,,,,FALSE,TRUE,0,3,,,,,,,,,,,,,,,,"x513660315","rizzonervo","it",,,,,,,,,,,,,,,,"x1476877050501861376","Per il servizio pubblico radiotelevisivo la riforma delle news è necessaria e non è rinviabile. Ci vuole però visione e il coraggio di rinunciare al manuale Cencelli https://t.co/cwYrfff4b1",2021-12-31 11:25:02,"Twitter for iPad",4,3,"x513660315","rizzonervo","nino rizzo nervo",3218,660,2077,"","giornalista",FALSE,,,,,,,"NA NA","NA NA","NA NA NA NA NA NA NA NA","https://twitter.com/s_margiotta/status/1476883094024110102","Salvatore Margiotta","Roma, Potenza","Senatore, ingegnere, professore universitario. Capogruppo Commissione lavori pubblici e trasporti. Segretario Presidenza Senato","https://t.co/aeYZnOeRaN",FALSE,15771,7325,207,80389,60880,2012-02-24 15:30:04,TRUE,"https://t.co/aeYZnOeRaN","http://instangram.com/salvatore__margiotta",,"https://pbs.twimg.com/profile_banners/501874833/1483357085","http://abs.twimg.com/images/themes/theme1/bg.png","http://pbs.twimg.com/profile_images/1344056897155063808/zdD0fQgS_normal.jpg"
"x501874833","x1476880870845857809",2021-12-31 11:40:13,"s_margiotta","Oggi su @repubblica questi due articoli nella stessa pagina: la demenziale intervista a un psedudo intello’ novaxnotampnotutt, e la dolorosa intervista al figlio di un novax convinto, morto in maniera assurda. Suggerisco lettura, come utile spunto di riflessione. Buon anno. https://t.co/XUsnvTnPjF","Twitter for iPad",140,,,,FALSE,TRUE,0,6,,,,,,,,,,,,,,,,"x280175586 x18935802","nunziapenelope repubblica","it",,,,,,,,,,,,,,,,"x1476858321839792128","Oggi su @repubblica questi due articoli nella stessa pagina: la demenziale intervista a un psedudo intello’ novaxnotampnotutt, e la dolorosa intervista al figlio di un novax convinto, morto in maniera assurda. Suggerisco lettura, come utile spunto di riflessione. Buon anno. https://t.co/XUsnvTnPjF",2021-12-31 10:10:37,"Twitter for iPad",17,6,"x280175586","nunziapenelope","nunzia penelope",16040,2307,76244,"","Ho vissuto, per un troppo breve periodo, in un paese civile. (Giornalista, scrittrice, romana, europea, europeista. E ripeto: europea, europeista) 🇪🇺",FALSE,,,,,,,"NA NA","NA NA","NA NA NA NA NA NA NA NA","https://twitter.com/s_margiotta/status/1476880870845857809","Salvatore Margiotta","Roma, Potenza","Senatore, ingegnere, professore universitario. Capogruppo Commissione lavori pubblici e trasporti. Segretario Presidenza Senato","https://t.co/aeYZnOeRaN",FALSE,15771,7325,207,80389,60880,2012-02-24 15:30:04,TRUE,"https://t.co/aeYZnOeRaN","http://instangram.com/salvatore__margiotta",,"https://pbs.twimg.com/profile_banners/501874833/1483357085","http://abs.twimg.com/images/themes/theme1/bg.png","http://pbs.twimg.com/profile_images/1344056897155063808/zdD0fQgS_normal.jpg"
"x501874833","x1476873547016458242",2021-12-31 11:11:07,"s_margiotta","Il ministro Cartabia ha telefonato al padre di Ciatti per esprimere vicinanza per la scarcerazione dell’assassino del figlio e ha detto che ci sarà un approfondimento.
Bene, bisogna veramente andare fino in fondo e capire perché le cose sono state fatte così a cazzo di cane.","Twitter for iPad",140,,,,FALSE,TRUE,0,9,,,,,,,,,,,,,,,,"x1240690942904066049","elevisconti","it",,,,,,,,,,,,,,,,"x1476839581190340608","Il ministro Cartabia ha telefonato al padre di Ciatti per esprimere vicinanza per la scarcerazione dell’assassino del figlio e ha detto che ci sarà un approfondimento.
Bene, bisogna veramente andare fino in fondo e capire perché le cose sono state fatte così a cazzo di cane.",2021-12-31 08:56:09,"Twitter for iPad",100,9,"x1240690942904066049","elevisconti","Elena Visconti",10130,641,17863,"","Mi disegno così ma ho imparato da poco. Dal vivo sono molto meglio, giuro.",FALSE,,,,,,,"NA NA","NA NA","NA NA NA NA NA NA NA NA","https://twitter.com/s_margiotta/status/1476873547016458242","Salvatore Margiotta","Roma, Potenza","Senatore, ingegnere, professore universitario. Capogruppo Commissione lavori pubblici e trasporti. Segretario Presidenza Senato","https://t.co/aeYZnOeRaN",FALSE,15771,7325,207,80389,60880,2012-02-24 15:30:04,TRUE,"https://t.co/aeYZnOeRaN","http://instangram.com/salvatore__margiotta",,"https://pbs.twimg.com/profile_banners/501874833/1483357085","http://abs.twimg.com/images/themes/theme1/bg.png","http://pbs.twimg.com/profile_images/1344056897155063808/zdD0fQgS_normal.jpg"
"x501874833","x1476830420507545611",2021-12-31 08:19:45,"s_margiotta","Il fanatismo cieco e autodistruttivo dei novax, che in non pochi casi li ha spinti fino al suicidio, resterà il fenomeno più disumano e inspiegabile di questi due anni di pandemia.","Twitter for iPad",140,,,,FALSE,TRUE,0,149,,,,,,,,,,,,,,,,"x696595370395172864","PoliticaPerJedi","it",,,,,,,,,,,,,,,,"x1476659602422964238","Il fanatismo cieco e autodistruttivo dei novax, che in non pochi casi li ha spinti fino al suicidio, resterà il fenomeno più disumano e inspiegabile di questi due anni di pandemia.",2021-12-30 21:00:58,"Twitter for Android",1347,149,"x696595370395172864","PoliticaPerJedi","Yoda",50648,1000,51316,"","So this is how liberty dies. With thunderous applause.",FALSE,,,,,,,"NA NA","NA NA","NA NA NA NA NA NA NA NA","https://twitter.com/s_margiotta/status/1476830420507545611","Salvatore Margiotta","Roma, Potenza","Senatore, ingegnere, professore universitario. Capogruppo Commissione lavori pubblici e trasporti. Segretario Presidenza Senato","https://t.co/aeYZnOeRaN",FALSE,15771,7325,207,80389,60880,2012-02-24 15:30:04,TRUE,"https://t.co/aeYZnOeRaN","http://instangram.com/salvatore__margiotta",,"https://pbs.twimg.com/profile_banners/501874833/1483357085","http://abs.twimg.com/images/themes/theme1/bg.png","http://pbs.twimg.com/profile_images/1344056897155063808/zdD0fQgS_normal.jpg"
"x501874833","x1476821831575388161",2021-12-31 07:45:37,"s_margiotta","@sruotolo1 Buon anno Sandro…","Twitter for iPad",17,"x1476815250024456208","x2546046132","sruotolo1",FALSE,FALSE,1,0,,,,,,,,,,,,,,,,"x2546046132","sruotolo1","it",,,,,,,,,,,,,,,,,,,,,,,,,,,,,,,,,,,,,"NA NA","NA NA","NA NA NA NA NA NA NA NA","https://twitter.com/s_margiotta/status/1476821831575388161","Salvatore Margiotta","Roma, Potenza","Senatore, ingegnere, professore universitario. Capogruppo Commissione lavori pubblici e trasporti. Segretario Presidenza Senato","https://t.co/aeYZnOeRaN",FALSE,15771,7325,207,80389,60880,2012-02-24 15:30:04,TRUE,"https://t.co/aeYZnOeRaN","http://instangram.com/salvatore__margiotta",,"https://pbs.twimg.com/profile_banners/501874833/1483357085","http://abs.twimg.com/images/themes/theme1/bg.png","http://pbs.twimg.com/profile_images/1344056897155063808/zdD0fQgS_normal.jpg"
"x501874833","x1476821764328017922",2021-12-31 07:45:21,"s_margiotta","#BuonAnno Non c’è un destino già stabilito e anche quando tutto va per il verso storto c’è quel pensiero che ci fa dire adda passa’ ‘a nuttata, tant’ l’aria s’adda cagna’. Resistere, resistere, resistere. Il nostro futuro dipende da noi. Buon #2022 a tutte e a tutti.","Twitter for iPad",140,,,,FALSE,TRUE,0,65,,,"BuonAnno",,,,,,,,,,,,,"x2546046132","sruotolo1","it",,,,,,,,,,,,,,,,"x1476815250024456208","#BuonAnno Non c’è un destino già stabilito e anche quando tutto va per il verso storto c’è quel pensiero che ci fa dire adda passa’ ‘a nuttata, tant’ l’aria s’adda cagna’. Resistere, resistere, resistere. Il nostro futuro dipende da noi. Buon #2022 a tutte e a tutti.",2021-12-31 07:19:28,"Twitter for iPhone",577,65,"x2546046132","sruotolo1","sandro ruotolo",56342,2047,2571,"240 km da Napoli ","Napoletano. Cronista dal 1974. Eletto senatore della Repubblica il 23 febbraio 2020. Antifascista, tessera Anpi.",FALSE,,,,,,,"NA NA","NA NA","NA NA NA NA NA NA NA NA","https://twitter.com/s_margiotta/status/1476821764328017922","Salvatore Margiotta","Roma, Potenza","Senatore, ingegnere, professore universitario. Capogruppo Commissione lavori pubblici e trasporti. Segretario Presidenza Senato","https://t.co/aeYZnOeRaN",FALSE,15771,7325,207,80389,60880,2012-02-24 15:30:04,TRUE,"https://t.co/aeYZnOeRaN","http://instangram.com/salvatore__margiotta",,"https://pbs.twimg.com/profile_banners/501874833/1483357085","http://abs.twimg.com/images/themes/theme1/bg.png","http://pbs.twimg.com/profile_images/1344056897155063808/zdD0fQgS_normal.jpg"
"x501874833","x1476682269083455495",2021-12-30 22:31:03,"s_margiotta","Una modesta proposta a Cts e Speranza: perché non cambiare il modo di comunicare i dati Covid? Il solo numero dei nuovi contagi spaventa e non spiega. Un esempio dagli Stati Uniti https://t.co/VWB4TNwRXg","Twitter for iPad",140,,,,FALSE,TRUE,0,1008,,,,,,,,,,,,,,,,"x386800314","MarcoFattorini","it",,,,,,,,,,,,,,,,"x1476289307048652807","Una modesta proposta a Cts e Speranza: perché non cambiare il modo di comunicare i dati Covid? Il solo numero dei nuovi contagi spaventa e non spiega. Un esempio dagli Stati Uniti https://t.co/VWB4TNwRXg",2021-12-29 20:29:33,"Twitter for iPhone",3852,1008,"x386800314","MarcoFattorini","Marco Fattorini",1943,586,12187,"Roma, Lazio","1989, giornalista e autore @Cartabiancarai3 (già @PoliticsRai3 e @TvTalk_Rai), scrivo per @Linkiesta, tifoso @VLPesaro nonché scarsissimo giocatore di tennis",FALSE,,,,,,,"NA NA","NA NA","NA NA NA NA NA NA NA NA","https://twitter.com/s_margiotta/status/1476682269083455495","Salvatore Margiotta","Roma, Potenza","Senatore, ingegnere, professore universitario. Capogruppo Commissione lavori pubblici e trasporti. Segretario Presidenza Senato","https://t.co/aeYZnOeRaN",FALSE,15771,7325,207,80389,60880,2012-02-24 15:30:04,TRUE,"https://t.co/aeYZnOeRaN","http://instangram.com/salvatore__margiotta",,"https://pbs.twimg.com/profile_banners/501874833/1483357085","http://abs.twimg.com/images/themes/theme1/bg.png","http://pbs.twimg.com/profile_images/1344056897155063808/zdD0fQgS_normal.jpg"
"x501874833","x1476677815827369988",2021-12-30 22:13:21,"s_margiotta","@s_margiotta @FBiasin Io penso che è la risposta tipica che do io quando mi rendo conto di aver fatto una ca..ata, Salvatore. Non penso che da primo in classifica, capocannoniere della Premier e della champions avrebbe risposto così…","Twitter for iPad",140,,,,FALSE,TRUE,0,1,,,,,,,,,,,,,,,,"x122014351 x501874833 x466499074","Tommasolabate s_margiotta FBiasin","it",,,,,,,,,,,,,,,,"x1476672706422751235","@s_margiotta @FBiasin Io penso che è la risposta tipica che do io quando mi rendo conto di aver fatto una ca..ata, Salvatore. Non penso che da primo in classifica, capocannoniere della Premier e della champions avrebbe risposto così…",2021-12-30 21:53:03,"Twitter for iPhone",12,1,"x122014351","Tommasolabate","Tommaso Labate",122528,1392,20308,"Rome","Lavora al @Corriere. In libreria con “Interista social club”, edito da @Mondadori.",TRUE,,,,,,,"NA NA","NA NA","NA NA NA NA NA NA NA NA","https://twitter.com/s_margiotta/status/1476677815827369988","Salvatore Margiotta","Roma, Potenza","Senatore, ingegnere, professore universitario. Capogruppo Commissione lavori pubblici e trasporti. Segretario Presidenza Senato","https://t.co/aeYZnOeRaN",FALSE,15771,7325,207,80389,60880,2012-02-24 15:30:04,TRUE,"https://t.co/aeYZnOeRaN","http://instangram.com/salvatore__margiotta",,"https://pbs.twimg.com/profile_banners/501874833/1483357085","http://abs.twimg.com/images/themes/theme1/bg.png","http://pbs.twimg.com/profile_images/1344056897155063808/zdD0fQgS_normal.jpg"
"x501874833","x1476643747647602697",2021-12-30 19:57:58,"s_margiotta","@FBiasin Al netto di ogni altra valutazione, é stato certamente determinante nelle due stagioni all’inter. Un pezzo dello scudetto è suo, dunque un pezzo della nostra gioia lo dobbiamo a lui. Vero @Tommasolabate ?","Twitter for iPad",204,"x1476625919158726656","x466499074","FBiasin",FALSE,FALSE,6,0,,,,,,,,,,,,,,,,"x466499074 x122014351","FBiasin Tommasolabate","it",,,,,,,,,,,,,,,,,,,,,,,,,,,,,,,,,,,,,"NA NA","NA NA","NA NA NA NA NA NA NA NA","https://twitter.com/s_margiotta/status/1476643747647602697","Salvatore Margiotta","Roma, Potenza","Senatore, ingegnere, professore universitario. Capogruppo Commissione lavori pubblici e trasporti. Segretario Presidenza Senato","https://t.co/aeYZnOeRaN",FALSE,15771,7325,207,80389,60880,2012-02-24 15:30:04,TRUE,"https://t.co/aeYZnOeRaN","http://instangram.com/salvatore__margiotta",,"https://pbs.twimg.com/profile_banners/501874833/1483357085","http://abs.twimg.com/images/themes/theme1/bg.png","http://pbs.twimg.com/profile_images/1344056897155063808/zdD0fQgS_normal.jpg"
"x501874833","x1476641570749362183",2021-12-30 19:49:19,"s_margiotta","@GiusvaPulejo 😂","Twitter for iPad",1,"x1476625311462735872","x932393936","GiusvaPulejo",FALSE,FALSE,0,0,,,,,,,,,,,,,,,,"x932393936","GiusvaPulejo","und",,,,,,,,,,,,,,,,,,,,,,,,,,,,,,,,,,,,,"NA NA","NA NA","NA NA NA NA NA NA NA NA","https://twitter.com/s_margiotta/status/1476641570749362183","Salvatore Margiotta","Roma, Potenza","Senatore, ingegnere, professore universitario. Capogruppo Commissione lavori pubblici e trasporti. Segretario Presidenza Senato","https://t.co/aeYZnOeRaN",FALSE,15771,7325,207,80389,60880,2012-02-24 15:30:04,TRUE,"https://t.co/aeYZnOeRaN","http://instangram.com/salvatore__margiotta",,"https://pbs.twimg.com/profile_banners/501874833/1483357085","http://abs.twimg.com/images/themes/theme1/bg.png","http://pbs.twimg.com/profile_images/1344056897155063808/zdD0fQgS_normal.jpg"
"x539150646","x1476920246149787659",2021-12-31 14:16:41,"marcomarsilio","Tanto abbiamo fatto, tanto faremo ancora in questo nuovo anno che ci attende.
Buon #2022 a tutti! https://t.co/MeZqtwxd7T","Twitter for iPhone",97,,,,FALSE,FALSE,3,1,,,,,,,,"http://pbs.twimg.com/ext_tw_video_thumb/1476919726039310336/pu/img/N9XEzzw56IGJNazM.jpg","https://t.co/MeZqtwxd7T","https://twitter.com/marcomarsilio/status/1476920246149787659/video/1","photo","http://pbs.twimg.com/ext_tw_video_thumb/1476919726039310336/pu/img/N9XEzzw56IGJNazM.jpg","https://t.co/MeZqtwxd7T","https://twitter.com/marcomarsilio/status/1476920246149787659/video/1",,,,"it",,,,,,,,,,,,,,,,,,,,,,,,,,,,,,,,,,,,,"NA NA","NA NA","NA NA NA NA NA NA NA NA","https://twitter.com/marcomarsilio/status/1476920246149787659","Marco Marsilio","Abruzzo, Italia","Presidente della Regione Abruzzo. Classe '68. Laureato in Filosofia. Ex senatore di @FratellidItalia. Innamorato della mia terra, di mia moglie e mia figlia.","https://t.co/vJHhSKcpwE",FALSE,6147,244,54,11290,622,2012-03-28 13:56:06,TRUE,"https://t.co/vJHhSKcpwE","http://www.marsiliopresidente.it",,"https://pbs.twimg.com/profile_banners/539150646/1553081691","http://abs.twimg.com/images/themes/theme18/bg.gif","http://pbs.twimg.com/profile_images/1387421144161177604/-OpBVceI_normal.jpg"
