"user_id","status_id","created_at","screen_name","text","source","display_text_width","reply_to_status_id","reply_to_user_id","reply_to_screen_name","is_quote","is_retweet","favorite_count","retweet_count","quote_count","reply_count","hashtags","symbols","urls_url","urls_t.co","urls_expanded_url","media_url","media_t.co","media_expanded_url","media_type","ext_media_url","ext_media_t.co","ext_media_expanded_url","ext_media_type","mentions_user_id","mentions_screen_name","lang","quoted_status_id","quoted_text","quoted_created_at","quoted_source","quoted_favorite_count","quoted_retweet_count","quoted_user_id","quoted_screen_name","quoted_name","quoted_followers_count","quoted_friends_count","quoted_statuses_count","quoted_location","quoted_description","quoted_verified","retweet_status_id","retweet_text","retweet_created_at","retweet_source","retweet_favorite_count","retweet_retweet_count","retweet_user_id","retweet_screen_name","retweet_name","retweet_followers_count","retweet_friends_count","retweet_statuses_count","retweet_location","retweet_description","retweet_verified","place_url","place_name","place_full_name","place_type","country","country_code","geo_coords","coords_coords","bbox_coords","status_url","name","location","description","url","protected","followers_count","friends_count","listed_count","statuses_count","favourites_count","account_created_at","verified","profile_url","profile_expanded_url","account_lang","profile_banner_url","profile_background_url","profile_image_url"
"x270839361","x1403653792919343105",2021-06-12 10:01:57,"matteosalvinimi","Ma tanti di voi sono stati sospesi per un post o un aggettivo non gradito...
Viva la Democrazia e la Libertà. Sempre.","Twitter for iPhone",117,"x1403653791203926020","x270839361","matteosalvinimi",FALSE,FALSE,381,50,,,,,,,,,,,,,,,,,,"it",,,,,,,,,,,,,,,,,,,,,,,,,,,,,,,,,,,,,"NA NA","NA NA","NA NA NA NA NA NA NA NA","https://twitter.com/matteosalvinimi/status/1403653792919343105","Matteo Salvini","","Leader della Lega #primagliitaliani 🇮🇹","https://t.co/zKjsz53fwl",FALSE,1398145,2043,3063,50904,3851,2011-03-23 10:32:56,TRUE,"https://t.co/zKjsz53fwl","http://www.legaonline.it/iscriviti",,"https://pbs.twimg.com/profile_banners/270839361/1617400433","http://abs.twimg.com/images/themes/theme1/bg.png","http://pbs.twimg.com/profile_images/966325945060732928/0Ua5xPMX_normal.jpg"
"x270839361","x1403653791203926020",2021-06-12 10:01:57,"matteosalvinimi","Il profilo di questo anonimo “signore” è ancora attivo, dopo mesi dalla denuncia di queste minacce deliranti e vomitevoli, a una bimba di 8 anni, e la “giustizia” italiana non ha ancora fatto e ottenuto nulla. https://t.co/dZ5syjtRqu","Twitter for iPhone",209,,,,FALSE,FALSE,466,107,,,,,,,,"http://pbs.twimg.com/media/E3rHrsgXoAAxQBC.jpg","https://t.co/dZ5syjtRqu","https://twitter.com/matteosalvinimi/status/1403653791203926020/photo/1","photo","http://pbs.twimg.com/media/E3rHrsgXoAAxQBC.jpg","https://t.co/dZ5syjtRqu","https://twitter.com/matteosalvinimi/status/1403653791203926020/photo/1",,,,"it",,,,,,,,,,,,,,,,,,,,,,,,,,,,,,,,,,,,,"NA NA","NA NA","NA NA NA NA NA NA NA NA","https://twitter.com/matteosalvinimi/status/1403653791203926020","Matteo Salvini","","Leader della Lega #primagliitaliani 🇮🇹","https://t.co/zKjsz53fwl",FALSE,1398145,2043,3063,50904,3851,2011-03-23 10:32:56,TRUE,"https://t.co/zKjsz53fwl","http://www.legaonline.it/iscriviti",,"https://pbs.twimg.com/profile_banners/270839361/1617400433","http://abs.twimg.com/images/themes/theme1/bg.png","http://pbs.twimg.com/profile_images/966325945060732928/0Ua5xPMX_normal.jpg"
"x270839361","x1403455956437110785",2021-06-11 20:55:49,"matteosalvinimi","Italia-Turchia, 3 pere (faccio con quello che ho 🤣) e a casa! 🇮🇹🇮🇹🇮🇹
#italiaturchia #euro2020 #europei2021 #ForzaAzzurri https://t.co/zoxAIMjlEI","Twitter for iPhone",120,,,,FALSE,FALSE,1501,139,,,"italiaturchia euro2020 europei2021 ForzaAzzurri",,,,,"http://pbs.twimg.com/media/E3oTwHfWYAI1oEp.jpg","https://t.co/zoxAIMjlEI","https://twitter.com/matteosalvinimi/status/1403455956437110785/photo/1","photo","http://pbs.twimg.com/media/E3oTwHfWYAI1oEp.jpg","https://t.co/zoxAIMjlEI","https://twitter.com/matteosalvinimi/status/1403455956437110785/photo/1",,,,"it",,,,,,,,,,,,,,,,,,,,,,,,,,,,,,,,,,,,,"NA NA","NA NA","NA NA NA NA NA NA NA NA","https://twitter.com/matteosalvinimi/status/1403455956437110785","Matteo Salvini","","Leader della Lega #primagliitaliani 🇮🇹","https://t.co/zKjsz53fwl",FALSE,1398145,2043,3063,50904,3851,2011-03-23 10:32:56,TRUE,"https://t.co/zKjsz53fwl","http://www.legaonline.it/iscriviti",,"https://pbs.twimg.com/profile_banners/270839361/1617400433","http://abs.twimg.com/images/themes/theme1/bg.png","http://pbs.twimg.com/profile_images/966325945060732928/0Ua5xPMX_normal.jpg"
"x270839361","x1403440090907660289",2021-06-11 19:52:46,"matteosalvinimi","Primo tempo, arbitro e VAR arma in più per la Turchia.
#ItaliaTurchia #euro2020","Twitter for iPhone",79,,,,FALSE,FALSE,732,81,,,"ItaliaTurchia euro2020",,,,,,,,,,,,,,,"it",,,,,,,,,,,,,,,,,,,,,,,,,,,,,,,,,,,,,"NA NA","NA NA","NA NA NA NA NA NA NA NA","https://twitter.com/matteosalvinimi/status/1403440090907660289","Matteo Salvini","","Leader della Lega #primagliitaliani 🇮🇹","https://t.co/zKjsz53fwl",FALSE,1398145,2043,3063,50904,3851,2011-03-23 10:32:56,TRUE,"https://t.co/zKjsz53fwl","http://www.legaonline.it/iscriviti",,"https://pbs.twimg.com/profile_banners/270839361/1617400433","http://abs.twimg.com/images/themes/theme1/bg.png","http://pbs.twimg.com/profile_images/966325945060732928/0Ua5xPMX_normal.jpg"
"x270839361","x1403428554822590472",2021-06-11 19:06:56,"matteosalvinimi","Pelle d’oca 🇮🇹
@AndreaBocelli #ItaliaTurchia #EURO2020 https://t.co/0G0aLFRbPX","Twitter for iPhone",54,,,,FALSE,FALSE,536,44,,,"ItaliaTurchia EURO2020",,,,,"http://pbs.twimg.com/media/E3n61NbXoAM4CEJ.jpg","https://t.co/0G0aLFRbPX","https://twitter.com/matteosalvinimi/status/1403428554822590472/photo/1","photo","http://pbs.twimg.com/media/E3n61NbXoAM4CEJ.jpg","https://t.co/0G0aLFRbPX","https://twitter.com/matteosalvinimi/status/1403428554822590472/photo/1",,"x83352390","AndreaBocelli","ca",,,,,,,,,,,,,,,,,,,,,,,,,,,,,,,,,,,,,"NA NA","NA NA","NA NA NA NA NA NA NA NA","https://twitter.com/matteosalvinimi/status/1403428554822590472","Matteo Salvini","","Leader della Lega #primagliitaliani 🇮🇹","https://t.co/zKjsz53fwl",FALSE,1398145,2043,3063,50904,3851,2011-03-23 10:32:56,TRUE,"https://t.co/zKjsz53fwl","http://www.legaonline.it/iscriviti",,"https://pbs.twimg.com/profile_banners/270839361/1617400433","http://abs.twimg.com/images/themes/theme1/bg.png","http://pbs.twimg.com/profile_images/966325945060732928/0Ua5xPMX_normal.jpg"
"x270839361","x1403420358141698049",2021-06-11 18:34:22,"matteosalvinimi","Pronti?!? ⚽️
#estateitaliana 🇮🇹
#euro2020 #italiaturchia https://t.co/GalkbD3Rnc","Twitter for iPhone",56,,,,FALSE,FALSE,1119,151,,,"estateitaliana euro2020 italiaturchia",,,,,"http://pbs.twimg.com/ext_tw_video_thumb/1403420273416757249/pu/img/vDKhWq1ns-WzR4T-.jpg","https://t.co/GalkbD3Rnc","https://twitter.com/matteosalvinimi/status/1403420358141698049/video/1","photo","http://pbs.twimg.com/ext_tw_video_thumb/1403420273416757249/pu/img/vDKhWq1ns-WzR4T-.jpg","https://t.co/GalkbD3Rnc","https://twitter.com/matteosalvinimi/status/1403420358141698049/video/1",,,,"in",,,,,,,,,,,,,,,,,,,,,,,,,,,,,,,,,,,,,"NA NA","NA NA","NA NA NA NA NA NA NA NA","https://twitter.com/matteosalvinimi/status/1403420358141698049","Matteo Salvini","","Leader della Lega #primagliitaliani 🇮🇹","https://t.co/zKjsz53fwl",FALSE,1398145,2043,3063,50904,3851,2011-03-23 10:32:56,TRUE,"https://t.co/zKjsz53fwl","http://www.legaonline.it/iscriviti",,"https://pbs.twimg.com/profile_banners/270839361/1617400433","http://abs.twimg.com/images/themes/theme1/bg.png","http://pbs.twimg.com/profile_images/966325945060732928/0Ua5xPMX_normal.jpg"
"x270839361","x1403411385804013571",2021-06-11 17:58:43,"matteosalvinimi","""Razzisti di mer*a, vaffanc**o"" al poliziotto, e spacca tutto. 
Integrazione a Milano, modello PD.
Solidarietà agli agenti. https://t.co/GByJyzJs9a","Twitter for iPhone",123,,,,FALSE,FALSE,944,212,,,,,,,,"http://pbs.twimg.com/ext_tw_video_thumb/1403411325213151232/pu/img/8o3BI-8qGmwu4S9z.jpg","https://t.co/GByJyzJs9a","https://twitter.com/matteosalvinimi/status/1403411385804013571/video/1","photo","http://pbs.twimg.com/ext_tw_video_thumb/1403411325213151232/pu/img/8o3BI-8qGmwu4S9z.jpg","https://t.co/GByJyzJs9a","https://twitter.com/matteosalvinimi/status/1403411385804013571/video/1",,,,"it",,,,,,,,,,,,,,,,,,,,,,,,,,,,,,,,,,,,,"NA NA","NA NA","NA NA NA NA NA NA NA NA","https://twitter.com/matteosalvinimi/status/1403411385804013571","Matteo Salvini","","Leader della Lega #primagliitaliani 🇮🇹","https://t.co/zKjsz53fwl",FALSE,1398145,2043,3063,50904,3851,2011-03-23 10:32:56,TRUE,"https://t.co/zKjsz53fwl","http://www.legaonline.it/iscriviti",,"https://pbs.twimg.com/profile_banners/270839361/1617400433","http://abs.twimg.com/images/themes/theme1/bg.png","http://pbs.twimg.com/profile_images/966325945060732928/0Ua5xPMX_normal.jpg"
"x270839361","x1403378662053908485",2021-06-11 15:48:41,"matteosalvinimi","""Non ho visto manifestazioni o manifesti firmati dagli intellettuali, tutto questo mi fa molto INCA**ARE!"". Paolo Del Debbio sulla triste vicenda di Samam fa bene ad infuriarsi: serve alzare la voce, contro chi fa finta di niente o derubrica la vicenda a semplice ""femminicidio"". https://t.co/Gi6IIErlqC","Twitter for iPhone",279,,,,FALSE,FALSE,483,95,,,,,,,,"http://pbs.twimg.com/ext_tw_video_thumb/1403378521741922304/pu/img/Wb6FNPsAuZGGaQ-p.jpg","https://t.co/Gi6IIErlqC","https://twitter.com/matteosalvinimi/status/1403378662053908485/video/1","photo","http://pbs.twimg.com/ext_tw_video_thumb/1403378521741922304/pu/img/Wb6FNPsAuZGGaQ-p.jpg","https://t.co/Gi6IIErlqC","https://twitter.com/matteosalvinimi/status/1403378662053908485/video/1",,,,"it",,,,,,,,,,,,,,,,,,,,,,,,,,,,,,,,,,,,,"NA NA","NA NA","NA NA NA NA NA NA NA NA","https://twitter.com/matteosalvinimi/status/1403378662053908485","Matteo Salvini","","Leader della Lega #primagliitaliani 🇮🇹","https://t.co/zKjsz53fwl",FALSE,1398145,2043,3063,50904,3851,2011-03-23 10:32:56,TRUE,"https://t.co/zKjsz53fwl","http://www.legaonline.it/iscriviti",,"https://pbs.twimg.com/profile_banners/270839361/1617400433","http://abs.twimg.com/images/themes/theme1/bg.png","http://pbs.twimg.com/profile_images/966325945060732928/0Ua5xPMX_normal.jpg"
"x48062712","x1403455050823897094",2021-06-11 20:52:13,"luigidimaio","Oggi ci emozioniamo con il colore più bello del mondo: l’azzurro! 
Partiti col piede giusto, forza ragazzi 💪🏻🇮🇹

#EURO2020 #TurchiaItalia https://t.co/HvNTXortZT","Twitter for iPhone",137,,,,FALSE,FALSE,562,64,,,"EURO2020 TurchiaItalia",,,,,"http://pbs.twimg.com/media/E3oS7bmX0AYLkEe.jpg","https://t.co/HvNTXortZT","https://twitter.com/luigidimaio/status/1403455050823897094/photo/1","photo","http://pbs.twimg.com/media/E3oS7bmX0AYLkEe.jpg","https://t.co/HvNTXortZT","https://twitter.com/luigidimaio/status/1403455050823897094/photo/1",,,,"it",,,,,,,,,,,,,,,,,,,,,,,,,,,,,,,,,,,,,"NA NA","NA NA","NA NA NA NA NA NA NA NA","https://twitter.com/luigidimaio/status/1403455050823897094","Luigi Di Maio","Pomigliano d'Arco, Campania","Ministro degli Affari Esteri e della Cooperazione Internazionale.","https://t.co/qtDDRMWqf2",FALSE,729988,350,2094,6441,288,2009-06-17 18:34:46,TRUE,"https://t.co/qtDDRMWqf2","http://www.luigidimaio.it",,"https://pbs.twimg.com/profile_banners/48062712/1600414260","http://abs.twimg.com/images/themes/theme1/bg.png","http://pbs.twimg.com/profile_images/933106806670462976/YyC7LOW8_normal.jpg"
"x48062712","x1403378691611234313",2021-06-11 15:48:48,"luigidimaio","Il Min. @luigidimaio al Forum Economico Franco-Italiano, organizzato da @Confindustria e @medef. Confronto su priorità industria franco-italiana 🇮🇹🇫🇷 e nuove sfide per attuazione #PNRR, futuro 🇪🇺 e ripartenza dopo la pandemia.

Rivedi l'intervento 📽️▶️
https://t.co/PdpMoScGcB","Twitter for iPhone",140,,,,FALSE,TRUE,0,20,,,,,,,,,,,,,,,,"x599114492 x48062712 x732136568421556224 x15969561","ItalyMFA luigidimaio Confindustria medef","it",,,,,,,,,,,,,,,,"x1403368029006802944","Il Min. @luigidimaio al Forum Economico Franco-Italiano, organizzato da @Confindustria e @medef. Confronto su priorità industria franco-italiana 🇮🇹🇫🇷 e nuove sfide per attuazione #PNRR, futuro 🇪🇺 e ripartenza dopo la pandemia.

Rivedi l'intervento 📽️▶️
https://t.co/PdpMoScGcB",2021-06-11 17:06:26,"Twitter Web App",46,20,"x599114492","ItalyMFA","Farnesina 🇮🇹",225407,940,13634,"Roma, Italia","Profilo ufficiale del Ministero degli Affari Esteri e della Cooperazione Internazionale | Ministry of Foreign Affairs and International Cooperation of Italy",TRUE,,,,,,,"NA NA","NA NA","NA NA NA NA NA NA NA NA","https://twitter.com/luigidimaio/status/1403378691611234313","Luigi Di Maio","Pomigliano d'Arco, Campania","Ministro degli Affari Esteri e della Cooperazione Internazionale.","https://t.co/qtDDRMWqf2",FALSE,729988,350,2094,6441,288,2009-06-17 18:34:46,TRUE,"https://t.co/qtDDRMWqf2","http://www.luigidimaio.it",,"https://pbs.twimg.com/profile_banners/48062712/1600414260","http://abs.twimg.com/images/themes/theme1/bg.png","http://pbs.twimg.com/profile_images/933106806670462976/YyC7LOW8_normal.jpg"
"x997531966571466752","x1403614864258502656",2021-06-12 07:27:16,"Pres_Casellati","Chi sfrutta i bambini commette un crimine contro l'umanità. Il #lavorominorile nega l’infanzia, crea povertà educativa ed esclusione sociale. Ogni Paese deve garantire ai suoi cittadini il diritto allo studio e le condizioni per la piena realizzazione personale. (Foto Pre-Covid) https://t.co/115X7WJLrb","Twitter for iPhone",279,,,,FALSE,FALSE,36,11,,,"lavorominorile",,,,,"http://pbs.twimg.com/media/E3qkQ0tXMAAyY2H.jpg","https://t.co/115X7WJLrb","https://twitter.com/Pres_Casellati/status/1403614864258502656/photo/1","photo","http://pbs.twimg.com/media/E3qkQ0tXMAAyY2H.jpg","https://t.co/115X7WJLrb","https://twitter.com/Pres_Casellati/status/1403614864258502656/photo/1",,,,"it",,,,,,,,,,,,,,,,,,,,,,,,,,,,,,,,,,,,,"NA NA","NA NA","NA NA NA NA NA NA NA NA","https://twitter.com/Pres_Casellati/status/1403614864258502656","Maria Elisabetta Alberti Casellati","Roma, Lazio","Presidente del Senato della Repubblica","https://t.co/4xFh9XyLXO",FALSE,13152,441,100,990,60,2018-05-18 17:38:48,TRUE,"https://t.co/4xFh9XyLXO","https://www.facebook.com/elisabetta.casellati.7",,"https://pbs.twimg.com/profile_banners/997531966571466752/1526665561","http://abs.twimg.com/images/themes/theme1/bg.png","http://pbs.twimg.com/profile_images/997533290520195072/YmnjBO3X_normal.jpg"
"x2900717633","x1403388356126519300",2021-06-11 16:27:12,"BrunoAstorre","Approvato in Consiglio dei Ministri il disegno di legge delega per il riordino delle disposizioni di legge in materia di spettacolo,per il riordino e la revisione degli strumenti di sostegno a favore dei lavoratori (SET) e per l’istituzione del Registro dei lavoratori del settore","Twitter for Android",140,,,,FALSE,TRUE,0,28,,,,,,,,,,,,,,,,"x61154684","dariofrance","it",,,,,,,,,,,,,,,,"x1403034698822131716","Approvato in Consiglio dei Ministri il disegno di legge delega per il riordino delle disposizioni di legge in materia di spettacolo,per il riordino e la revisione degli strumenti di sostegno a favore dei lavoratori (SET) e per l’istituzione del Registro dei lavoratori del settore",2021-06-10 19:01:53,"Twitter for iPhone",101,28,"x61154684","dariofrance","Dario Franceschini",461316,1251,3990,"","Deputato, scrittore, avvocato. Ministro della Cultura.",TRUE,,,,,,,"NA NA","NA NA","NA NA NA NA NA NA NA NA","https://twitter.com/BrunoAstorre/status/1403388356126519300","Bruno Astorre","","Senatore del PD. Membro Direzione nazionale PD. Provengo da una scuola che interpreta la politica come strumento, non come fine.","https://t.co/r8sKGpcczb",FALSE,1609,191,30,1840,139,2014-12-01 15:48:11,TRUE,"https://t.co/r8sKGpcczb","http://www.brunoastorre.it",,"https://pbs.twimg.com/profile_banners/2900717633/1546257168","http://abs.twimg.com/images/themes/theme1/bg.png","http://pbs.twimg.com/profile_images/1058727872578371589/FY_KiON0_normal.jpg"
"x876541483","x1403680584275214336",2021-06-12 11:48:25,"AlbertoBagnai","Che poi, alla fine, su tutte queste novità che tali non sono una parola definitiva (che tale non poteva essere) è stata già detta tante volte: https://t.co/OC2cdIaKLf. Se anche ci impediranno di parlare, se andranno avanti con le loro Bücherverbrennungen, avranno comunque perso.","Twitter for iPhone",279,,,,FALSE,FALSE,42,9,,,,,"m.youtube.com/watch?v=Dgp9MP…","https://t.co/OC2cdIaKLf","https://m.youtube.com/watch?v=Dgp9MPLEAqA&pp=QACIAgA%3D",,,,,,,,,,,"it",,,,,,,,,,,,,,,,,,,,,,,,,,,,,,,,,,,,,"NA NA","NA NA","NA NA NA NA NA NA NA NA","https://twitter.com/AlbertoBagnai/status/1403680584275214336","Alberto Bagnai","","Professore associato di politica economica all’Università Gabriele d’Annunzio, eletto al Senato per la Lega nel collegio Abruzzo 01.","https://t.co/sC5RvUzmsX",FALSE,124201,666,656,215577,6460,2012-10-12 22:13:36,TRUE,"https://t.co/sC5RvUzmsX","http://www.senato.it/leg/18/BGT/Schede/Attsen/00032582.htm",,"https://pbs.twimg.com/profile_banners/876541483/1535647109","http://abs.twimg.com/images/themes/theme1/bg.png","http://pbs.twimg.com/profile_images/849030859462246401/ATk3_aiW_normal.jpg"
"x876541483","x1403675003674107906",2021-06-12 11:26:14,"AlbertoBagnai","@Serendippo7 @AlbertoBagnai Pensiero per nulla criptico, sinteticamente riassume la storia degli ultimi 50 anni.","Twitter for iPhone",124,,,,FALSE,TRUE,0,2,,,,,,,,,,,,,,,,"x95482042 x1273531846790385664 x876541483","gs5654 Serendippo7 AlbertoBagnai","it",,,,,,,,,,,,,,,,"x1403639321211645954","@Serendippo7 @AlbertoBagnai Pensiero per nulla criptico, sinteticamente riassume la storia degli ultimi 50 anni.",2021-06-12 11:04:27,"Twitter for Android",25,2,"x95482042","gs5654","Giovanni",686,206,37455,"","",FALSE,,,,,,,"NA NA","NA NA","NA NA NA NA NA NA NA NA","https://twitter.com/AlbertoBagnai/status/1403675003674107906","Alberto Bagnai","","Professore associato di politica economica all’Università Gabriele d’Annunzio, eletto al Senato per la Lega nel collegio Abruzzo 01.","https://t.co/sC5RvUzmsX",FALSE,124201,666,656,215577,6460,2012-10-12 22:13:36,TRUE,"https://t.co/sC5RvUzmsX","http://www.senato.it/leg/18/BGT/Schede/Attsen/00032582.htm",,"https://pbs.twimg.com/profile_banners/876541483/1535647109","http://abs.twimg.com/images/themes/theme1/bg.png","http://pbs.twimg.com/profile_images/849030859462246401/ATk3_aiW_normal.jpg"
"x876541483","x1403674872224571392",2021-06-12 11:25:43,"AlbertoBagnai","@AlbertoBagnai Gli stracciavestisti","Twitter for iPhone",48,,,,FALSE,TRUE,0,1,,,,,,,,,,,,,,,,"x69696487 x876541483","redflat AlbertoBagnai","it",,,,,,,,,,,,,,,,"x1403630928472203264","@AlbertoBagnai Gli stracciavestisti",2021-06-12 10:31:06,"Twitter for iPhone",15,1,"x69696487","redflat","Enrico Paolozzi",1182,345,20393,"","Questo account potrebbe essere stato clonato.",FALSE,,,,,,,"NA NA","NA NA","NA NA NA NA NA NA NA NA","https://twitter.com/AlbertoBagnai/status/1403674872224571392","Alberto Bagnai","","Professore associato di politica economica all’Università Gabriele d’Annunzio, eletto al Senato per la Lega nel collegio Abruzzo 01.","https://t.co/sC5RvUzmsX",FALSE,124201,666,656,215577,6460,2012-10-12 22:13:36,TRUE,"https://t.co/sC5RvUzmsX","http://www.senato.it/leg/18/BGT/Schede/Attsen/00032582.htm",,"https://pbs.twimg.com/profile_banners/876541483/1535647109","http://abs.twimg.com/images/themes/theme1/bg.png","http://pbs.twimg.com/profile_images/849030859462246401/ATk3_aiW_normal.jpg"
"x876541483","x1403674554661314561",2021-06-12 11:24:27,"AlbertoBagnai","@chedisagio @peraltro Ma che fate, dubitate di Speranza?","Twitter for iPhone",76,,,,FALSE,TRUE,0,28,,,,,,,,,,,,,,,,"x337767301 x44487069 x101086929","borghi_claudio chedisagio peraltro","it",,,,,,,,,,,,,,,,"x1403670316178718721","@chedisagio @peraltro Ma che fate, dubitate di Speranza?",2021-06-12 13:07:36,"Twitter for Android",159,28,"x337767301","borghi_claudio","Claudio Borghi A.",107323,1311,206505,"Italia","Deputato della Repubblica Italiana eletto in Toscana per la Lega. Consigliere Comunale di Como",TRUE,,,,,,,"NA NA","NA NA","NA NA NA NA NA NA NA NA","https://twitter.com/AlbertoBagnai/status/1403674554661314561","Alberto Bagnai","","Professore associato di politica economica all’Università Gabriele d’Annunzio, eletto al Senato per la Lega nel collegio Abruzzo 01.","https://t.co/sC5RvUzmsX",FALSE,124201,666,656,215577,6460,2012-10-12 22:13:36,TRUE,"https://t.co/sC5RvUzmsX","http://www.senato.it/leg/18/BGT/Schede/Attsen/00032582.htm",,"https://pbs.twimg.com/profile_banners/876541483/1535647109","http://abs.twimg.com/images/themes/theme1/bg.png","http://pbs.twimg.com/profile_images/849030859462246401/ATk3_aiW_normal.jpg"
"x876541483","x1403622373572685826",2021-06-12 07:57:06,"AlbertoBagnai","“O decidiamo di rinunciare al vaccino Astrazeneca e lo doniamo ai Paesi poveri  oppure possiamo decidere di limitarlo ad alcune fasce di età” https://t.co/Cv0m6kWpcW","Twitter for iPhone",140,,,,FALSE,TRUE,0,197,,,,,,,,,,,,,,,,"x51759517","fdragoni","it",,,,,,,,,,,,,,,,"x1403578251394654208","“O decidiamo di rinunciare al vaccino Astrazeneca e lo doniamo ai Paesi poveri  oppure possiamo decidere di limitarlo ad alcune fasce di età” https://t.co/Cv0m6kWpcW",2021-06-12 07:01:47,"Twitter for Android",510,197,"x51759517","fdragoni","Fabio Dragoni",29543,631,100712,"","Le unioni monetarie sono come i coglioni si rompono! BOCCONIANO però ora ho smesso. Manager in sanità dopo anni di banca. Scrivo di moneta e libertà (LA VERITÀ)",FALSE,,,,,,,"NA NA","NA NA","NA NA NA NA NA NA NA NA","https://twitter.com/AlbertoBagnai/status/1403622373572685826","Alberto Bagnai","","Professore associato di politica economica all’Università Gabriele d’Annunzio, eletto al Senato per la Lega nel collegio Abruzzo 01.","https://t.co/sC5RvUzmsX",FALSE,124201,666,656,215577,6460,2012-10-12 22:13:36,TRUE,"https://t.co/sC5RvUzmsX","http://www.senato.it/leg/18/BGT/Schede/Attsen/00032582.htm",,"https://pbs.twimg.com/profile_banners/876541483/1535647109","http://abs.twimg.com/images/themes/theme1/bg.png","http://pbs.twimg.com/profile_images/849030859462246401/ATk3_aiW_normal.jpg"
"x876541483","x1403614273029410816",2021-06-12 07:24:55,"AlbertoBagnai","“AstraZeneca doniamolo ai poveri”
Bellissimo.
BELLISSiMO.","Twitter for iPhone",70,,,,FALSE,TRUE,0,292,,,,,,,,,,,,,,,,"x1380965912241709056","Pgreco_","it",,,,,,,,,,,,,,,,"x1403612309013024768","“AstraZeneca doniamolo ai poveri”
Bellissimo.
BELLISSiMO.",2021-06-12 09:17:06,"Twitter for iPhone",1030,292,"x1380965912241709056","Pgreco_","Alessandro",2253,56,1130,"Italy","https://t.co/QyfeQ7fk3o",FALSE,,,,,,,"NA NA","NA NA","NA NA NA NA NA NA NA NA","https://twitter.com/AlbertoBagnai/status/1403614273029410816","Alberto Bagnai","","Professore associato di politica economica all’Università Gabriele d’Annunzio, eletto al Senato per la Lega nel collegio Abruzzo 01.","https://t.co/sC5RvUzmsX",FALSE,124201,666,656,215577,6460,2012-10-12 22:13:36,TRUE,"https://t.co/sC5RvUzmsX","http://www.senato.it/leg/18/BGT/Schede/Attsen/00032582.htm",,"https://pbs.twimg.com/profile_banners/876541483/1535647109","http://abs.twimg.com/images/themes/theme1/bg.png","http://pbs.twimg.com/profile_images/849030859462246401/ATk3_aiW_normal.jpg"
"x876541483","x1403614043189956609",2021-06-12 07:24:00,"AlbertoBagnai","Il nuovo orizzonte dell’attenzione ai poveri del terzo mondo è:
“Se non ci fidiamo di un vaccino, diamolo a loro.”
L’hanno detto alcune persone di quelle cui diamo ampio spazio mediatico.","Twitter for iPhone",140,,,,FALSE,TRUE,0,231,,,,,,,,,,,,,,,,"x413916151","GuidoCrosetto","it",,,,,,,,,,,,,,,,"x1403606527550889984","Il nuovo orizzonte dell’attenzione ai poveri del terzo mondo è:
“Se non ci fidiamo di un vaccino, diamolo a loro.”
L’hanno detto alcune persone di quelle cui diamo ampio spazio mediatico.",2021-06-12 08:54:08,"Twitter for iPhone",1013,231,"x413916151","GuidoCrosetto","Guido Crosetto",150062,2161,95573,"","Libero da pregiudizi per convinzione, garantista per dna, conservatore per nascita, rispettoso per scelta. Ex tante cose. Ora uomo libero ed imprenditore.",FALSE,,,,,,,"NA NA","NA NA","NA NA NA NA NA NA NA NA","https://twitter.com/AlbertoBagnai/status/1403614043189956609","Alberto Bagnai","","Professore associato di politica economica all’Università Gabriele d’Annunzio, eletto al Senato per la Lega nel collegio Abruzzo 01.","https://t.co/sC5RvUzmsX",FALSE,124201,666,656,215577,6460,2012-10-12 22:13:36,TRUE,"https://t.co/sC5RvUzmsX","http://www.senato.it/leg/18/BGT/Schede/Attsen/00032582.htm",,"https://pbs.twimg.com/profile_banners/876541483/1535647109","http://abs.twimg.com/images/themes/theme1/bg.png","http://pbs.twimg.com/profile_images/849030859462246401/ATk3_aiW_normal.jpg"
