"user_id","status_id","created_at","screen_name","text","source","display_text_width","reply_to_status_id","reply_to_user_id","reply_to_screen_name","is_quote","is_retweet","favorite_count","retweet_count","quote_count","reply_count","hashtags","symbols","urls_url","urls_t.co","urls_expanded_url","media_url","media_t.co","media_expanded_url","media_type","ext_media_url","ext_media_t.co","ext_media_expanded_url","ext_media_type","mentions_user_id","mentions_screen_name","lang","quoted_status_id","quoted_text","quoted_created_at","quoted_source","quoted_favorite_count","quoted_retweet_count","quoted_user_id","quoted_screen_name","quoted_name","quoted_followers_count","quoted_friends_count","quoted_statuses_count","quoted_location","quoted_description","quoted_verified","retweet_status_id","retweet_text","retweet_created_at","retweet_source","retweet_favorite_count","retweet_retweet_count","retweet_user_id","retweet_screen_name","retweet_name","retweet_followers_count","retweet_friends_count","retweet_statuses_count","retweet_location","retweet_description","retweet_verified","place_url","place_name","place_full_name","place_type","country","country_code","geo_coords","coords_coords","bbox_coords","status_url","name","location","description","url","protected","followers_count","friends_count","listed_count","statuses_count","favourites_count","account_created_at","verified","profile_url","profile_expanded_url","account_lang","profile_banner_url","profile_background_url","profile_image_url"
"x270839361","x1459502568158150663",2021-11-13 12:45:03,"matteosalvinimi","L’immigrazione clandestina va contrastata senza se e senza ma, sia se arriva dalla Bielorussia sia se arriva dalla Tunisia o dalla Libia. L’Italia non può essere lasciata sola. https://t.co/GboE51cxBD","Twitter for iPhone",176,,,,FALSE,FALSE,935,170,,,,,,,,"http://pbs.twimg.com/media/FEEx2NfWQAAWGk8.jpg","https://t.co/GboE51cxBD","https://twitter.com/matteosalvinimi/status/1459502568158150663/photo/1","photo","http://pbs.twimg.com/media/FEEx2NfWQAAWGk8.jpg","https://t.co/GboE51cxBD","https://twitter.com/matteosalvinimi/status/1459502568158150663/photo/1",,,,"it",,,,,,,,,,,,,,,,,,,,,,,,,,,,,,,,,,,,,"NA NA","NA NA","NA NA NA NA NA NA NA NA","https://twitter.com/matteosalvinimi/status/1459502568158150663","Matteo Salvini","","Leader della Lega #primagliitaliani 🇮🇹","https://t.co/sj3rr6DU3N",FALSE,1425712,2034,3048,52135,3855,2011-03-23 10:32:56,TRUE,"https://t.co/sj3rr6DU3N","https://legaonline.it/",,"https://pbs.twimg.com/profile_banners/270839361/1635585626","http://abs.twimg.com/images/themes/theme1/bg.png","http://pbs.twimg.com/profile_images/966325945060732928/0Ua5xPMX_normal.jpg"
"x48062712","x1459599850400538626",2021-11-13 19:11:37,"luigidimaio","L’Italia è in prima linea per contrastare ogni proliferazione terroristica. Lo facciamo per difendere il nostro popolo e le future generazioni. Lo facciamo per ricordare la memoria delle troppe vittime di attentati terroristici: https://t.co/0UwrbaVFj9","Twitter for iPhone",252,,,,FALSE,FALSE,271,51,,,,,"bit.ly/30hTspi","https://t.co/0UwrbaVFj9","https://bit.ly/30hTspi",,,,,,,,,,,"it",,,,,,,,,,,,,,,,,,,,,,,,,,,,,,,,,,,,,"NA NA","NA NA","NA NA NA NA NA NA NA NA","https://twitter.com/luigidimaio/status/1459599850400538626","Luigi Di Maio","Pomigliano d'Arco, Campania","Ministro degli Affari Esteri e della Cooperazione Internazionale.","https://t.co/D8gkagqksG",FALSE,741093,349,2123,6723,335,2009-06-17 18:34:46,TRUE,"https://t.co/D8gkagqksG","http://www.luigidimaio.it",,"https://pbs.twimg.com/profile_banners/48062712/1634667505","http://abs.twimg.com/images/themes/theme1/bg.png","http://pbs.twimg.com/profile_images/933106806670462976/YyC7LOW8_normal.jpg"
"x997531966571466752","x1459532281094324228",2021-11-13 14:43:07,"Pres_Casellati","Con il Premio al #Volontariato oggi  Senato&amp;Cultura rende omaggio al  #TerzoSettore. Una risorsa insostituibile per il Paese. Un esercito silenzioso che sostiene l’Italia con la sua umanità e generosità, ma anche una risorsa economica che rappresenta il 4% del Pil.
#13novembre https://t.co/soekEs0VGJ","Twitter for iPhone",281,,,,FALSE,FALSE,39,8,,,"Volontariato TerzoSettore 13novembre",,,,,"http://pbs.twimg.com/media/FEFM3nuX0AMKmuI.jpg","https://t.co/soekEs0VGJ","https://twitter.com/Pres_Casellati/status/1459532281094324228/photo/1","photo","http://pbs.twimg.com/media/FEFM3nuX0AMKmuI.jpg http://pbs.twimg.com/media/FEFM3nxXMA07Cv7.jpg http://pbs.twimg.com/media/FEFM3nzXMAQicR1.jpg http://pbs.twimg.com/media/FEFM3n1XEAIB7Nm.jpg","https://t.co/soekEs0VGJ https://t.co/soekEs0VGJ https://t.co/soekEs0VGJ https://t.co/soekEs0VGJ","https://twitter.com/Pres_Casellati/status/1459532281094324228/photo/1 https://twitter.com/Pres_Casellati/status/1459532281094324228/photo/1 https://twitter.com/Pres_Casellati/status/1459532281094324228/photo/1 https://twitter.com/Pres_Casellati/status/1459532281094324228/photo/1",,,,"it",,,,,,,,,,,,,,,,,,,,,,,,,,,,,,,,,,,,,"NA NA","NA NA","NA NA NA NA NA NA NA NA","https://twitter.com/Pres_Casellati/status/1459532281094324228","Maria Elisabetta Alberti Casellati","Roma, Lazio","Presidente del Senato della Repubblica","https://t.co/4xFh9XyLXO",FALSE,13887,507,100,1122,61,2018-05-18 17:38:48,TRUE,"https://t.co/4xFh9XyLXO","https://www.facebook.com/elisabetta.casellati.7",,"https://pbs.twimg.com/profile_banners/997531966571466752/1526665561","http://abs.twimg.com/images/themes/theme1/bg.png","http://pbs.twimg.com/profile_images/997533290520195072/YmnjBO3X_normal.jpg"
"x981514288392294400","x1459534414346702857",2021-11-13 14:51:35,"AnastasiMv5","Profonda solidarietà al nostro @luigidimaio. Non saranno le minacce a fermare l'ottimo lavoro che in questi anni sta portando avanti come Ministro degli esteri. 
La lotta al #Terrorismo richiede la massima attenzione di tutte le istituzioni e una politica più coesa.

@Mov5Stelle","Twitter for Android",279,,,,FALSE,FALSE,1,0,,,"Terrorismo",,,,,,,,,,,,,"x48062712 x289400495","luigidimaio Mov5Stelle","it",,,,,,,,,,,,,,,,,,,,,,,,,,,,,,,,,,,,,"NA NA","NA NA","NA NA NA NA NA NA NA NA","https://twitter.com/AnastasiMv5/status/1459534414346702857","Cristiano Anastasi","Sicilia, Italia","Portavoce del M5S al Senato della Repubblica


Capo Gruppo Commissione Industria Senato.","https://t.co/QyXaiSTYTX",FALSE,1428,37,22,211,48,2018-04-04 12:50:16,TRUE,"https://t.co/QyXaiSTYTX","https://www.ilblogdellestelle.it/",,"https://pbs.twimg.com/profile_banners/981514288392294400/1559048001","http://abs.twimg.com/images/themes/theme1/bg.png","http://pbs.twimg.com/profile_images/981517957867167747/uuiLqAXA_normal.jpg"
"x1075084718","x1459588278814924805",2021-11-13 18:25:38,"arrigoni_paolo","L'amministratore delegato di #Volkswagen ha qualche problemino...
La #Lega lo dice da tempo: abbandonare le auto a combustione interna in favore di quelle elettriche significa uccidere le filiere dell'automotive. È folle e inattuabile pensarlo! 👇 https://t.co/3CVCEnS9pK","Twitter for Android",246,,,,FALSE,FALSE,17,5,,,"Volkswagen Lega",,,,,"http://pbs.twimg.com/media/FEF_zetXoAkRDvo.jpg","https://t.co/3CVCEnS9pK","https://twitter.com/arrigoni_paolo/status/1459588278814924805/photo/1","photo","http://pbs.twimg.com/media/FEF_zetXoAkRDvo.jpg","https://t.co/3CVCEnS9pK","https://twitter.com/arrigoni_paolo/status/1459588278814924805/photo/1",,,,"it",,,,,,,,,,,,,,,,,,,,,,,,,,,,,,,,,,,,,"NA NA","NA NA","NA NA NA NA NA NA NA NA","https://twitter.com/arrigoni_paolo/status/1459588278814924805","Paolo Arrigoni","Calolziocorte, Lombardia","Questore del Senato della Repubblica, componente della Commissione Ambiente e del Copasir. Responsabile del Dipartimento Energia della Lega.","https://t.co/M6TePkOvfO",FALSE,4669,182,57,9604,108,2013-01-09 22:36:27,TRUE,"https://t.co/M6TePkOvfO","http://www.senato.it/leg/18/BGT/Schede/Attsen/00029039.htm",,"https://pbs.twimg.com/profile_banners/1075084718/1591968708","http://abs.twimg.com/images/themes/theme1/bg.png","http://pbs.twimg.com/profile_images/3172370357/bec3e4497d64c77f2a93bc9792055992_normal.jpeg"
"x1075084718","x1459527785664372736",2021-11-13 14:25:15,"arrigoni_paolo","Ripensiamo la politica energetica del nostro Paese! È urgente abbandonare l'ambientalismo ideologico anti impresa e procedere con approccio pragmatico che riconosca che tutte le tecnologie che contribuiscono a decarbonizzare devono essere impiegate.","Twitter for Android",249,,,,FALSE,FALSE,4,2,,,,,,,,,,,,,,,,,,"it",,,,,,,,,,,,,,,,,,,,,,,,,,,,,,,,,,,,,"NA NA","NA NA","NA NA NA NA NA NA NA NA","https://twitter.com/arrigoni_paolo/status/1459527785664372736","Paolo Arrigoni","Calolziocorte, Lombardia","Questore del Senato della Repubblica, componente della Commissione Ambiente e del Copasir. Responsabile del Dipartimento Energia della Lega.","https://t.co/M6TePkOvfO",FALSE,4669,182,57,9604,108,2013-01-09 22:36:27,TRUE,"https://t.co/M6TePkOvfO","http://www.senato.it/leg/18/BGT/Schede/Attsen/00029039.htm",,"https://pbs.twimg.com/profile_banners/1075084718/1591968708","http://abs.twimg.com/images/themes/theme1/bg.png","http://pbs.twimg.com/profile_images/3172370357/bec3e4497d64c77f2a93bc9792055992_normal.jpeg"
"x101602652","x1459548512430002177",2021-11-13 15:47:37,"augussori","La #Lega propone che dal reddito di cittadinanza, un provvedimento che con le proprie storture ha avvantaggiato tanti furbetti, si traggano risorse per contenere il rincaro bollette e sostenere i genitori separari messi in difficoltà dalla crisi economica causata dalla pandemia. https://t.co/1nGEWYc2na","Twitter for iPhone",279,,,,FALSE,FALSE,2,0,,,"Lega",,,,,"http://pbs.twimg.com/media/FEFboLjXEAI8Eim.jpg","https://t.co/1nGEWYc2na","https://twitter.com/augussori/status/1459548512430002177/photo/1","photo","http://pbs.twimg.com/media/FEFboLjXEAI8Eim.jpg","https://t.co/1nGEWYc2na","https://twitter.com/augussori/status/1459548512430002177/photo/1",,,,"it",,,,,,,,,,,,,,,,,,,,,,,,,,,,,,,,,,,,,"NA NA","NA NA","NA NA NA NA NA NA NA NA","https://twitter.com/augussori/status/1459548512430002177","Luigi Augussori","Lodi, Lombardy","Profilo del sen. Luigi Augussori, rappresentante lodigiano nel Senato della Repubblica per il gruppo Lega - Salvini Premier. https://t.co/RVDZN85Ue5","https://t.co/494Lk5LQeR",FALSE,968,784,16,3231,325,2010-01-03 23:39:00,TRUE,"https://t.co/494Lk5LQeR","http://www.senato.it/leg/18/BGT/Schede/Attsen/00019244.htm",,"https://pbs.twimg.com/profile_banners/101602652/1536334347","http://abs.twimg.com/images/themes/theme1/bg.png","http://pbs.twimg.com/profile_images/1397968025198989317/FpsdhGWL_normal.jpg"
"x101602652","x1459448731301040134",2021-11-13 09:11:07,"augussori","Dagli sprechi del reddito di cittadinanza si possono reperire ingenti risorse per disabilità, energia pulita ed aiuti alle imprese. Favorire le imprese e lo sviluppo crea il lavoro e benessere.
#Lega #LegaSenato https://t.co/pVqOtz0gIt","Twitter for iPhone",211,,,,FALSE,FALSE,4,0,,,"Lega LegaSenato",,,,,"http://pbs.twimg.com/media/FEEA1yjXIAUDQ7F.jpg","https://t.co/pVqOtz0gIt","https://twitter.com/augussori/status/1459448731301040134/photo/1","photo","http://pbs.twimg.com/media/FEEA1yjXIAUDQ7F.jpg","https://t.co/pVqOtz0gIt","https://twitter.com/augussori/status/1459448731301040134/photo/1",,,,"it",,,,,,,,,,,,,,,,,,,,,,,,,,,,,,,,,,,,,"NA NA","NA NA","NA NA NA NA NA NA NA NA","https://twitter.com/augussori/status/1459448731301040134","Luigi Augussori","Lodi, Lombardy","Profilo del sen. Luigi Augussori, rappresentante lodigiano nel Senato della Repubblica per il gruppo Lega - Salvini Premier. https://t.co/RVDZN85Ue5","https://t.co/494Lk5LQeR",FALSE,968,784,16,3231,325,2010-01-03 23:39:00,TRUE,"https://t.co/494Lk5LQeR","http://www.senato.it/leg/18/BGT/Schede/Attsen/00019244.htm",,"https://pbs.twimg.com/profile_banners/101602652/1536334347","http://abs.twimg.com/images/themes/theme1/bg.png","http://pbs.twimg.com/profile_images/1397968025198989317/FpsdhGWL_normal.jpg"
"x876541483","x1459637320286679044",2021-11-13 21:40:30,"AlbertoBagnai","La giornata non è finita. https://t.co/nTlnPkeCtt","Twitter for iPhone",25,,,,FALSE,FALSE,138,17,,,,,,,,"http://pbs.twimg.com/media/FEGsZ7QXwAAB-E5.jpg","https://t.co/nTlnPkeCtt","https://twitter.com/AlbertoBagnai/status/1459637320286679044/photo/1","photo","http://pbs.twimg.com/media/FEGsZ7QXwAAB-E5.jpg","https://t.co/nTlnPkeCtt","https://twitter.com/AlbertoBagnai/status/1459637320286679044/photo/1",,,,"it",,,,,,,,,,,,,,,,,,,,,,,,,,,,,,,,,,,,,"NA NA","NA NA","NA NA NA NA NA NA NA NA","https://twitter.com/AlbertoBagnai/status/1459637320286679044","Alberto Bagnai","","Professore associato di politica economica all’Università Gabriele d’Annunzio, eletto al Senato per la Lega nel collegio Abruzzo 01.","https://t.co/sC5RvUzmsX",FALSE,128638,666,657,220187,6465,2012-10-12 22:13:36,TRUE,"https://t.co/sC5RvUzmsX","http://www.senato.it/leg/18/BGT/Schede/Attsen/00032582.htm",,"https://pbs.twimg.com/profile_banners/876541483/1535647109","http://abs.twimg.com/images/themes/theme1/bg.png","http://pbs.twimg.com/profile_images/849030859462246401/ATk3_aiW_normal.jpg"
"x876541483","x1459619338760171532",2021-11-13 20:29:03,"AlbertoBagnai","Sapete come andrà a finire vero? 
Pass anche per andare in bagno, obbligo vaccinale ""per la nostra libertà"" ""per non dover più richiudere"" e sciocchezze simili. Faranno quello che vogliono con l'approvazione del parlamento.
Poi i contagi aumenteranno.
E daranno la colpa ad altri.","Twitter for iPhone",140,,,,FALSE,TRUE,0,815,,,,,,,,,,,,,,,,"x337767301","borghi_claudio","it",,,,,,,,,,,,,,,,"x1433707700794298368","Sapete come andrà a finire vero? 
Pass anche per andare in bagno, obbligo vaccinale ""per la nostra libertà"" ""per non dover più richiudere"" e sciocchezze simili. Faranno quello che vogliono con l'approvazione del parlamento.
Poi i contagi aumenteranno.
E daranno la colpa ad altri.",2021-09-03 08:25:27,"Twitter Web App",2909,815,"x337767301","borghi_claudio","Claudio Borghi A.",119483,1328,214830,"Italia","Deputato della Repubblica Italiana eletto in Toscana per la Lega. Consigliere Comunale di Como",TRUE,,,,,,,"NA NA","NA NA","NA NA NA NA NA NA NA NA","https://twitter.com/AlbertoBagnai/status/1459619338760171532","Alberto Bagnai","","Professore associato di politica economica all’Università Gabriele d’Annunzio, eletto al Senato per la Lega nel collegio Abruzzo 01.","https://t.co/sC5RvUzmsX",FALSE,128638,666,657,220187,6465,2012-10-12 22:13:36,TRUE,"https://t.co/sC5RvUzmsX","http://www.senato.it/leg/18/BGT/Schede/Attsen/00032582.htm",,"https://pbs.twimg.com/profile_banners/876541483/1535647109","http://abs.twimg.com/images/themes/theme1/bg.png","http://pbs.twimg.com/profile_images/849030859462246401/ATk3_aiW_normal.jpg"
"x876541483","x1459617656139567107",2021-11-13 20:22:22,"AlbertoBagnai","@VittorioSgarbi @silvia92745700 @stampasgarbi Sì.","Twitter for iPhone",3,"x1459197230326374404","x201658727","VittorioSgarbi",FALSE,FALSE,81,6,,,,,,,,,,,,,,,,"x201658727 x970720216551485440 x2164988132","VittorioSgarbi silvia92745700 stampasgarbi","und",,,,,,,,,,,,,,,,,,,,,,,,,,,,,,,,,,,,,"NA NA","NA NA","NA NA NA NA NA NA NA NA","https://twitter.com/AlbertoBagnai/status/1459617656139567107","Alberto Bagnai","","Professore associato di politica economica all’Università Gabriele d’Annunzio, eletto al Senato per la Lega nel collegio Abruzzo 01.","https://t.co/sC5RvUzmsX",FALSE,128638,666,657,220187,6465,2012-10-12 22:13:36,TRUE,"https://t.co/sC5RvUzmsX","http://www.senato.it/leg/18/BGT/Schede/Attsen/00032582.htm",,"https://pbs.twimg.com/profile_banners/876541483/1535647109","http://abs.twimg.com/images/themes/theme1/bg.png","http://pbs.twimg.com/profile_images/849030859462246401/ATk3_aiW_normal.jpg"
"x876541483","x1459617507782893570",2021-11-13 20:21:46,"AlbertoBagnai","Marvelous animation by @tylermorganwall shows our changing view of Saturn from Earth between 2020 and 2050. Source: https://t.co/fyhttcNi7d https://t.co/3T9m9ot8aw","Twitter for iPhone",140,,,,FALSE,TRUE,0,89,,,,,,,,,,,,,,,,"x359188534 x273781698","simongerman600 tylermorganwall","en",,,,,,,,,,,,,,,,"x1459614591483359235","Marvelous animation by @tylermorganwall shows our changing view of Saturn from Earth between 2020 and 2050. Source: https://t.co/fyhttcNi7d https://t.co/3T9m9ot8aw",2021-11-13 20:10:11,"Buffer",265,89,"x359188534","simongerman600","Simon Kuestenmacher",223943,213569,35189,"Melbourne, Victoria","German #geographer and #demographer in #Melbourne. I love and share #maps and #data that explain how the #world works. Obviously all opinions are my own...",FALSE,,,,,,,"NA NA","NA NA","NA NA NA NA NA NA NA NA","https://twitter.com/AlbertoBagnai/status/1459617507782893570","Alberto Bagnai","","Professore associato di politica economica all’Università Gabriele d’Annunzio, eletto al Senato per la Lega nel collegio Abruzzo 01.","https://t.co/sC5RvUzmsX",FALSE,128638,666,657,220187,6465,2012-10-12 22:13:36,TRUE,"https://t.co/sC5RvUzmsX","http://www.senato.it/leg/18/BGT/Schede/Attsen/00032582.htm",,"https://pbs.twimg.com/profile_banners/876541483/1535647109","http://abs.twimg.com/images/themes/theme1/bg.png","http://pbs.twimg.com/profile_images/849030859462246401/ATk3_aiW_normal.jpg"
"x876541483","x1459613778606276609",2021-11-13 20:06:57,"AlbertoBagnai","Impossibile non essere d'accordo con l'intervento della Maglie .  1/2
#controcorrente #Maglie #NoGreenPass @mgmaglie https://t.co/wM6nWqJm5w","Twitter for iPhone",140,,,,FALSE,TRUE,0,323,,,"controcorrente Maglie NoGreenPass",,,,,,,,,,,,,"x1323040160 x47756372","strange_days_82 mgmaglie","it",,,,,,,,,,,,,,,,"x1459612088452751366","Impossibile non essere d'accordo con l'intervento della Maglie .  1/2
#controcorrente #Maglie #NoGreenPass @mgmaglie https://t.co/wM6nWqJm5w",2021-11-13 20:00:14,"Twitter Web App",940,323,"x1323040160","strange_days_82","Davide Scifo 🌀",6582,3056,10663,"","Amo lo sport. Amo il cinema.Scrivo recensioni su https://t.co/fl3dzyHCDg. Di destra. News di politica con video. Se vuoi sostenermi con una donazione (link in basso)  ⬇",FALSE,,,,,,,"NA NA","NA NA","NA NA NA NA NA NA NA NA","https://twitter.com/AlbertoBagnai/status/1459613778606276609","Alberto Bagnai","","Professore associato di politica economica all’Università Gabriele d’Annunzio, eletto al Senato per la Lega nel collegio Abruzzo 01.","https://t.co/sC5RvUzmsX",FALSE,128638,666,657,220187,6465,2012-10-12 22:13:36,TRUE,"https://t.co/sC5RvUzmsX","http://www.senato.it/leg/18/BGT/Schede/Attsen/00032582.htm",,"https://pbs.twimg.com/profile_banners/876541483/1535647109","http://abs.twimg.com/images/themes/theme1/bg.png","http://pbs.twimg.com/profile_images/849030859462246401/ATk3_aiW_normal.jpg"
"x876541483","x1459611060621783051",2021-11-13 19:56:09,"AlbertoBagnai","@valeegiu1 Ma il problema mica è tuo! È (sorprendentemente) suo.","Twitter for iPhone",53,"x1459604336204562442","x1251668659648561152","valeegiu1",FALSE,FALSE,9,0,,,,,,,,,,,,,,,,"x1251668659648561152","valeegiu1","it",,,,,,,,,,,,,,,,,,,,,,,,,,,,,,,,,,,,,"NA NA","NA NA","NA NA NA NA NA NA NA NA","https://twitter.com/AlbertoBagnai/status/1459611060621783051","Alberto Bagnai","","Professore associato di politica economica all’Università Gabriele d’Annunzio, eletto al Senato per la Lega nel collegio Abruzzo 01.","https://t.co/sC5RvUzmsX",FALSE,128638,666,657,220187,6465,2012-10-12 22:13:36,TRUE,"https://t.co/sC5RvUzmsX","http://www.senato.it/leg/18/BGT/Schede/Attsen/00032582.htm",,"https://pbs.twimg.com/profile_banners/876541483/1535647109","http://abs.twimg.com/images/themes/theme1/bg.png","http://pbs.twimg.com/profile_images/849030859462246401/ATk3_aiW_normal.jpg"
"x876541483","x1459610869785104386",2021-11-13 19:55:24,"AlbertoBagnai","@Svero__ Concordo.","Twitter for iPhone",9,"x1459610715749294087","x1019929135","Svero__",FALSE,FALSE,5,0,,,,,,,,,,,,,,,,"x1019929135","Svero__","pt",,,,,,,,,,,,,,,,,,,,,,,,,,,,,,,,,,,,,"NA NA","NA NA","NA NA NA NA NA NA NA NA","https://twitter.com/AlbertoBagnai/status/1459610869785104386","Alberto Bagnai","","Professore associato di politica economica all’Università Gabriele d’Annunzio, eletto al Senato per la Lega nel collegio Abruzzo 01.","https://t.co/sC5RvUzmsX",FALSE,128638,666,657,220187,6465,2012-10-12 22:13:36,TRUE,"https://t.co/sC5RvUzmsX","http://www.senato.it/leg/18/BGT/Schede/Attsen/00032582.htm",,"https://pbs.twimg.com/profile_banners/876541483/1535647109","http://abs.twimg.com/images/themes/theme1/bg.png","http://pbs.twimg.com/profile_images/849030859462246401/ATk3_aiW_normal.jpg"
"x876541483","x1459586394146365450",2021-11-13 18:18:08,"AlbertoBagnai","@VaeVictis Calma.","Twitter for iPhone",6,"x1459566994630627332","x212724190","VaeVictis",FALSE,FALSE,14,1,,,,,,,,,,,,,,,,"x212724190","VaeVictis","en",,,,,,,,,,,,,,,,,,,,,,,,,,,,,,,,,,,,,"NA NA","NA NA","NA NA NA NA NA NA NA NA","https://twitter.com/AlbertoBagnai/status/1459586394146365450","Alberto Bagnai","","Professore associato di politica economica all’Università Gabriele d’Annunzio, eletto al Senato per la Lega nel collegio Abruzzo 01.","https://t.co/sC5RvUzmsX",FALSE,128638,666,657,220187,6465,2012-10-12 22:13:36,TRUE,"https://t.co/sC5RvUzmsX","http://www.senato.it/leg/18/BGT/Schede/Attsen/00032582.htm",,"https://pbs.twimg.com/profile_banners/876541483/1535647109","http://abs.twimg.com/images/themes/theme1/bg.png","http://pbs.twimg.com/profile_images/849030859462246401/ATk3_aiW_normal.jpg"
"x876541483","x1459521109196431366",2021-11-13 13:58:43,"AlbertoBagnai","Riso amaro https://t.co/d6SAEUPzCt","Twitter for iPhone",48,,,,FALSE,TRUE,0,209,,,,,,,,"http://pbs.twimg.com/media/FEFBnC5WYAMmLfW.jpg","https://t.co/d6SAEUPzCt","https://twitter.com/fdragoni/status/1459519894987411456/photo/1","photo","http://pbs.twimg.com/media/FEFBnC5WYAMmLfW.jpg","https://t.co/d6SAEUPzCt","https://twitter.com/fdragoni/status/1459519894987411456/photo/1",,"x51759517","fdragoni","it",,,,,,,,,,,,,,,,"x1459519894987411456","Riso amaro https://t.co/d6SAEUPzCt",2021-11-13 13:53:54,"Twitter for Android",762,209,"x51759517","fdragoni","Fabio Dragoni",41184,656,105399,"","Potevate scegliere fra disonore e guerra. Avete scelto il disonore. Avrete la guerra -
Ho scoperto di essere libertario - Pazienza -
Mi leggi anche su LA VERITÀ",FALSE,,,,,,,"NA NA","NA NA","NA NA NA NA NA NA NA NA","https://twitter.com/AlbertoBagnai/status/1459521109196431366","Alberto Bagnai","","Professore associato di politica economica all’Università Gabriele d’Annunzio, eletto al Senato per la Lega nel collegio Abruzzo 01.","https://t.co/sC5RvUzmsX",FALSE,128638,666,657,220187,6465,2012-10-12 22:13:36,TRUE,"https://t.co/sC5RvUzmsX","http://www.senato.it/leg/18/BGT/Schede/Attsen/00032582.htm",,"https://pbs.twimg.com/profile_banners/876541483/1535647109","http://abs.twimg.com/images/themes/theme1/bg.png","http://pbs.twimg.com/profile_images/849030859462246401/ATk3_aiW_normal.jpg"
"x876541483","x1459515773630795776",2021-11-13 13:37:31,"AlbertoBagnai","+++Supersintesi (in foto)+++
Ps
Se vi va, leggete #PerUnaNuovaDestra 🗽
https://t.co/pNInor3iIh https://t.co/MTmYcVgCUb","Twitter for iPhone",133,,,,FALSE,TRUE,0,200,,,"PerUnaNuovaDestra",,"amzn.to/3nRgYTP","https://t.co/pNInor3iIh","https://amzn.to/3nRgYTP","http://pbs.twimg.com/media/FED6zJlWUAAqGb_.jpg","https://t.co/MTmYcVgCUb","https://twitter.com/Capezzone/status/1459442041050517504/photo/1","photo","http://pbs.twimg.com/media/FED6zJlWUAAqGb_.jpg","https://t.co/MTmYcVgCUb","https://twitter.com/Capezzone/status/1459442041050517504/photo/1",,"x144210805","Capezzone","it",,,,,,,,,,,,,,,,"x1459442041050517504","+++Supersintesi (in foto)+++
Ps
Se vi va, leggete #PerUnaNuovaDestra 🗽
https://t.co/pNInor3iIh https://t.co/MTmYcVgCUb",2021-11-13 08:44:32,"Twitter for iPhone",654,200,"x144210805","Capezzone","Daniele Capezzone",132644,3316,50401,"","Atlantista, liberale classico. @LaVeritaWeb. @MercatusI e @AtlanticoMag. In tv su Mediaset. #TorreDiControllo su @RadioGloboFm. #PerUnaNuovaDestra",FALSE,,,,,,,"NA NA","NA NA","NA NA NA NA NA NA NA NA","https://twitter.com/AlbertoBagnai/status/1459515773630795776","Alberto Bagnai","","Professore associato di politica economica all’Università Gabriele d’Annunzio, eletto al Senato per la Lega nel collegio Abruzzo 01.","https://t.co/sC5RvUzmsX",FALSE,128638,666,657,220187,6465,2012-10-12 22:13:36,TRUE,"https://t.co/sC5RvUzmsX","http://www.senato.it/leg/18/BGT/Schede/Attsen/00032582.htm",,"https://pbs.twimg.com/profile_banners/876541483/1535647109","http://abs.twimg.com/images/themes/theme1/bg.png","http://pbs.twimg.com/profile_images/849030859462246401/ATk3_aiW_normal.jpg"
