"user_id","status_id","created_at","screen_name","text","source","display_text_width","reply_to_status_id","reply_to_user_id","reply_to_screen_name","is_quote","is_retweet","favorite_count","retweet_count","quote_count","reply_count","hashtags","symbols","urls_url","urls_t.co","urls_expanded_url","media_url","media_t.co","media_expanded_url","media_type","ext_media_url","ext_media_t.co","ext_media_expanded_url","ext_media_type","mentions_user_id","mentions_screen_name","lang","quoted_status_id","quoted_text","quoted_created_at","quoted_source","quoted_favorite_count","quoted_retweet_count","quoted_user_id","quoted_screen_name","quoted_name","quoted_followers_count","quoted_friends_count","quoted_statuses_count","quoted_location","quoted_description","quoted_verified","retweet_status_id","retweet_text","retweet_created_at","retweet_source","retweet_favorite_count","retweet_retweet_count","retweet_user_id","retweet_screen_name","retweet_name","retweet_followers_count","retweet_friends_count","retweet_statuses_count","retweet_location","retweet_description","retweet_verified","place_url","place_name","place_full_name","place_type","country","country_code","geo_coords","coords_coords","bbox_coords","status_url","name","location","description","url","protected","followers_count","friends_count","listed_count","statuses_count","favourites_count","account_created_at","verified","profile_url","profile_expanded_url","account_lang","profile_banner_url","profile_background_url","profile_image_url"
"x270839361","x1445063933090570256",2021-10-04 16:31:04,"matteosalvinimi","Il mio intervento al TG4. https://t.co/ax3LpdOi2c","Twitter Media Studio",49,,,,FALSE,FALSE,58,14,,,,,"twitter.com/i/broadcasts/1…","https://t.co/ax3LpdOi2c","https://twitter.com/i/broadcasts/1RDxlgEaLlqJL",,,,,,,,,,,"it",,,,,,,,,,,,,,,,,,,,,,,,,,,,,,,,,,,,,"NA NA","NA NA","NA NA NA NA NA NA NA NA","https://twitter.com/matteosalvinimi/status/1445063933090570256","Matteo Salvini","","Leader della Lega #primagliitaliani 🇮🇹","https://t.co/KDs4YUajH3",FALSE,1415236,2038,3057,51939,3856,2011-03-23 10:32:56,TRUE,"https://t.co/KDs4YUajH3","http://www.legaonline.it/referendumgiustizia",,"https://pbs.twimg.com/profile_banners/270839361/1633299889","http://abs.twimg.com/images/themes/theme1/bg.png","http://pbs.twimg.com/profile_images/966325945060732928/0Ua5xPMX_normal.jpg"
"x270839361","x1445045562349400073",2021-10-04 15:18:04,"matteosalvinimi","In diretta al TG1. https://t.co/cwdqyMMKTM","Twitter Media Studio",42,,,,FALSE,FALSE,201,42,,,,,"twitter.com/i/broadcasts/1…","https://t.co/cwdqyMMKTM","https://twitter.com/i/broadcasts/1vOxwylyoOEGB",,,,,,,,,,,"it",,,,,,,,,,,,,,,,,,,,,,,,,,,,,,,,,,,,,"NA NA","NA NA","NA NA NA NA NA NA NA NA","https://twitter.com/matteosalvinimi/status/1445045562349400073","Matteo Salvini","","Leader della Lega #primagliitaliani 🇮🇹","https://t.co/KDs4YUajH3",FALSE,1415236,2038,3057,51939,3856,2011-03-23 10:32:56,TRUE,"https://t.co/KDs4YUajH3","http://www.legaonline.it/referendumgiustizia",,"https://pbs.twimg.com/profile_banners/270839361/1633299889","http://abs.twimg.com/images/themes/theme1/bg.png","http://pbs.twimg.com/profile_images/966325945060732928/0Ua5xPMX_normal.jpg"
"x270839361","x1444952932257091585",2021-10-04 09:09:59,"matteosalvinimi","Grazie Maria Giovanna per la fiducia! Più ci attaccano, più ci danno forza!
Città sicure, pulite e moderne: dove la Lega governa, rispondiamo con i fatti 💪🏻🇮🇹

P.s. Si vota fino alle 15!
#oggivotoLega https://t.co/Y7qyfMBIiI","Twitter for iPhone",200,,,,FALSE,FALSE,648,122,,,"oggivotoLega",,,,,"http://pbs.twimg.com/media/FA2BCElXMAAghrN.jpg","https://t.co/Y7qyfMBIiI","https://twitter.com/matteosalvinimi/status/1444952932257091585/photo/1","photo","http://pbs.twimg.com/media/FA2BCElXMAAghrN.jpg","https://t.co/Y7qyfMBIiI","https://twitter.com/matteosalvinimi/status/1444952932257091585/photo/1",,,,"it",,,,,,,,,,,,,,,,,,,,,,,,,,,,,,,,,,,,,"NA NA","NA NA","NA NA NA NA NA NA NA NA","https://twitter.com/matteosalvinimi/status/1444952932257091585","Matteo Salvini","","Leader della Lega #primagliitaliani 🇮🇹","https://t.co/KDs4YUajH3",FALSE,1415236,2038,3057,51939,3856,2011-03-23 10:32:56,TRUE,"https://t.co/KDs4YUajH3","http://www.legaonline.it/referendumgiustizia",,"https://pbs.twimg.com/profile_banners/270839361/1633299889","http://abs.twimg.com/images/themes/theme1/bg.png","http://pbs.twimg.com/profile_images/966325945060732928/0Ua5xPMX_normal.jpg"
"x270839361","x1444771719537991685",2021-10-03 21:09:55,"matteosalvinimi","Soldi buttati, studenti truffati.
Vergogna 5Stelle. https://t.co/1sKBkpdcX9","Twitter Web App",51,,,,FALSE,FALSE,1231,303,,,,,,,,"http://pbs.twimg.com/media/FAzcNZ8XEAMfS3U.jpg","https://t.co/1sKBkpdcX9","https://twitter.com/matteosalvinimi/status/1444771719537991685/photo/1","photo","http://pbs.twimg.com/media/FAzcNZ8XEAMfS3U.jpg","https://t.co/1sKBkpdcX9","https://twitter.com/matteosalvinimi/status/1444771719537991685/photo/1",,,,"it",,,,,,,,,,,,,,,,,,,,,,,,,,,,,,,,,,,,,"NA NA","NA NA","NA NA NA NA NA NA NA NA","https://twitter.com/matteosalvinimi/status/1444771719537991685","Matteo Salvini","","Leader della Lega #primagliitaliani 🇮🇹","https://t.co/KDs4YUajH3",FALSE,1415236,2038,3057,51939,3856,2011-03-23 10:32:56,TRUE,"https://t.co/KDs4YUajH3","http://www.legaonline.it/referendumgiustizia",,"https://pbs.twimg.com/profile_banners/270839361/1633299889","http://abs.twimg.com/images/themes/theme1/bg.png","http://pbs.twimg.com/profile_images/966325945060732928/0Ua5xPMX_normal.jpg"
"x270839361","x1444761065989021696",2021-10-03 20:27:35,"matteosalvinimi","È questa la “Milano del futuro” della sinistra? È questo l’impegno dedicato ai disabili da Sala negli anni della sua amministrazione?
Vergogna!","Twitter Web App",143,"x1444761062826467337","x270839361","matteosalvinimi",FALSE,FALSE,594,88,,,,,,,,,,,,,,,,,,"it",,,,,,,,,,,,,,,,,,,,,,,,,,,,,,,,,,,,,"NA NA","NA NA","NA NA NA NA NA NA NA NA","https://twitter.com/matteosalvinimi/status/1444761065989021696","Matteo Salvini","","Leader della Lega #primagliitaliani 🇮🇹","https://t.co/KDs4YUajH3",FALSE,1415236,2038,3057,51939,3856,2011-03-23 10:32:56,TRUE,"https://t.co/KDs4YUajH3","http://www.legaonline.it/referendumgiustizia",,"https://pbs.twimg.com/profile_banners/270839361/1633299889","http://abs.twimg.com/images/themes/theme1/bg.png","http://pbs.twimg.com/profile_images/966325945060732928/0Ua5xPMX_normal.jpg"
"x270839361","x1444761062826467337",2021-10-03 20:27:34,"matteosalvinimi","PAZZESCO NELLA MILANO DI BEPPE SALA!!!
Eleonora, candidata della Lega, si è recata oggi al seggio elettorale, ma a causa dell’assenza dell’ascensore, il presidente del seggio ha dovuto consegnarle la scheda elettorale nel sottoscala, accanto ai cassonetti della spazzatura (!!!). https://t.co/F40RngMA3Y","Twitter Web App",279,,,,FALSE,FALSE,1010,233,,,,,,,,"http://pbs.twimg.com/media/FAzSgk9WYAE6vBT.jpg","https://t.co/F40RngMA3Y","https://twitter.com/matteosalvinimi/status/1444761062826467337/photo/1","photo","http://pbs.twimg.com/media/FAzSgk9WYAE6vBT.jpg","https://t.co/F40RngMA3Y","https://twitter.com/matteosalvinimi/status/1444761062826467337/photo/1",,,,"it",,,,,,,,,,,,,,,,,,,,,,,,,,,,,,,,,,,,,"NA NA","NA NA","NA NA NA NA NA NA NA NA","https://twitter.com/matteosalvinimi/status/1444761062826467337","Matteo Salvini","","Leader della Lega #primagliitaliani 🇮🇹","https://t.co/KDs4YUajH3",FALSE,1415236,2038,3057,51939,3856,2011-03-23 10:32:56,TRUE,"https://t.co/KDs4YUajH3","http://www.legaonline.it/referendumgiustizia",,"https://pbs.twimg.com/profile_banners/270839361/1633299889","http://abs.twimg.com/images/themes/theme1/bg.png","http://pbs.twimg.com/profile_images/966325945060732928/0Ua5xPMX_normal.jpg"
"x48062712","x1444917504787243009",2021-10-04 06:49:13,"luigidimaio","Il Ministro @luigidimaio interviene a ""Faith and Science: towards @COP26"" insieme a @Pontifex_it e a @AlokSharma_RDG; l'iniziativa è una tappa di avvicinamento al summit #COP26 co-presieduta da 🇮🇹 e 🇬🇧 organizzata presso la Santa Sede.

🟢Segui la diretta▶️https://t.co/8BmUghqZWZ https://t.co/I53ri32abe","Twitter for iPhone",140,,,,FALSE,TRUE,0,30,,,,,,,,,,,,,,,,"x599114492 x48062712 x1195025771368239106 x500711588 x1731554581","ItalyMFA luigidimaio COP26 Pontifex_it AlokSharma_RDG","it",,,,,,,,,,,,,,,,"x1444917140704870403","Il Ministro @luigidimaio interviene a ""Faith and Science: towards @COP26"" insieme a @Pontifex_it e a @AlokSharma_RDG; l'iniziativa è una tappa di avvicinamento al summit #COP26 co-presieduta da 🇮🇹 e 🇬🇧 organizzata presso la Santa Sede.

🟢Segui la diretta▶️https://t.co/8BmUghqZWZ https://t.co/I53ri32abe",2021-10-04 06:47:46,"Twitter Web App",52,30,"x599114492","ItalyMFA","Farnesina 🇮🇹",237204,947,14382,"Roma, Italia","Profilo ufficiale del Ministero degli Affari Esteri e della Cooperazione Internazionale | Ministry of Foreign Affairs and International Cooperation of Italy",TRUE,,,,,,,"NA NA","NA NA","NA NA NA NA NA NA NA NA","https://twitter.com/luigidimaio/status/1444917504787243009","Luigi Di Maio","Pomigliano d'Arco, Campania","Ministro degli Affari Esteri e della Cooperazione Internazionale.","https://t.co/qtDDRMWqf2",FALSE,738349,349,2126,6636,307,2009-06-17 18:34:46,TRUE,"https://t.co/qtDDRMWqf2","http://www.luigidimaio.it",,"https://pbs.twimg.com/profile_banners/48062712/1600414260","http://abs.twimg.com/images/themes/theme1/bg.png","http://pbs.twimg.com/profile_images/933106806670462976/YyC7LOW8_normal.jpg"
"x807946915837083648","x1444704040118636544",2021-10-03 16:40:59,"fofino3","Ormai è chiaro a tutti che questo #greenpass è uno strumento che il governo dei peggiori utilizza a suo piacimento.
Alcune volte è indispensabile, altre volte no: questo è un metodo ingiustificabile. 

Leggi il post qui 👉🏻 https://t.co/gZtLUMfkXU https://t.co/rlRuuamdGg","Twitter for Android",140,,,,FALSE,TRUE,0,35,,,"greenpass",,,,,,,,,,,,,"x1364265902112444418","LAlternativaCE","it",,,,,,,,,,,,,,,,"x1444698833645080579","Ormai è chiaro a tutti che questo #greenpass è uno strumento che il governo dei peggiori utilizza a suo piacimento.
Alcune volte è indispensabile, altre volte no: questo è un metodo ingiustificabile. 

Leggi il post qui 👉🏻 https://t.co/gZtLUMfkXU https://t.co/rlRuuamdGg",2021-10-03 16:20:17,"Twitter for iPhone",44,35,"x1364265902112444418","LAlternativaCE","L'Alternativa c'è",632,57,211,"Italia","Account ufficiale de ""L'Alternativa c'è""",FALSE,,,,,,,"NA NA","NA NA","NA NA NA NA NA NA NA NA","https://twitter.com/fofino3/status/1444704040118636544","Luisa Angrisani","","Alternativa C'è",,FALSE,59,115,0,170,304,2016-12-11 13:55:30,FALSE,,,,,,"http://pbs.twimg.com/profile_images/1408038086878105606/cwYLC0bV_normal.jpg"
"x101602652","x1444983935885324289",2021-10-04 11:13:11,"augussori","Avete tempo fino alle 15.00 per sostenere i candidati della #Lega nel vostro Comune! 
#VotaLega #elezioni #amministrative #territorio https://t.co/VirbrUAkR6","Twitter for iPhone",133,,,,FALSE,FALSE,8,3,,,"Lega VotaLega elezioni amministrative territorio",,,,,"http://pbs.twimg.com/media/FA2dNoiWEAQbP0m.jpg","https://t.co/VirbrUAkR6","https://twitter.com/augussori/status/1444983935885324289/photo/1","photo","http://pbs.twimg.com/media/FA2dNoiWEAQbP0m.jpg","https://t.co/VirbrUAkR6","https://twitter.com/augussori/status/1444983935885324289/photo/1",,,,"it",,,,,,,,,,,,,,,,,,,,,,,,,,,,,,,,,,,,,"NA NA","NA NA","NA NA NA NA NA NA NA NA","https://twitter.com/augussori/status/1444983935885324289","Luigi Augussori","Lodi, Lombardy","Profilo del sen. Luigi Augussori, rappresentante lodigiano nel Senato della Repubblica per il gruppo Lega - Salvini Premier. https://t.co/RVDZN85Ue5","https://t.co/494Lk5LQeR",FALSE,957,781,16,3193,323,2010-01-03 23:39:00,TRUE,"https://t.co/494Lk5LQeR","http://www.senato.it/leg/18/BGT/Schede/Attsen/00019244.htm",,"https://pbs.twimg.com/profile_banners/101602652/1536334347","http://abs.twimg.com/images/themes/theme1/bg.png","http://pbs.twimg.com/profile_images/1397968025198989317/FpsdhGWL_normal.jpg"
"x101602652","x1444956723962335233",2021-10-04 09:25:03,"augussori","Firma anche online le 6 proposte di referendum sulla giustizia promosse dalla #Lega!!

👉🏻 https://t.co/zShIFEi0Js

#ReferendumGiustizia #GiustiziaGiusta #firmaanchetu https://t.co/2bxpqWoXi0","Twitter for iPhone",166,,,,FALSE,FALSE,1,0,,,"Lega ReferendumGiustizia GiustiziaGiusta firmaanchetu",,"legaonline.it/firmaonline","https://t.co/zShIFEi0Js","https://legaonline.it/firmaonline","http://pbs.twimg.com/media/FA2EerXXMAAceZG.jpg","https://t.co/2bxpqWoXi0","https://twitter.com/augussori/status/1444956723962335233/photo/1","photo","http://pbs.twimg.com/media/FA2EerXXMAAceZG.jpg","https://t.co/2bxpqWoXi0","https://twitter.com/augussori/status/1444956723962335233/photo/1",,,,"it",,,,,,,,,,,,,,,,,,,,,,,,,,,,,,,,,,,,,"NA NA","NA NA","NA NA NA NA NA NA NA NA","https://twitter.com/augussori/status/1444956723962335233","Luigi Augussori","Lodi, Lombardy","Profilo del sen. Luigi Augussori, rappresentante lodigiano nel Senato della Repubblica per il gruppo Lega - Salvini Premier. https://t.co/RVDZN85Ue5","https://t.co/494Lk5LQeR",FALSE,957,781,16,3193,323,2010-01-03 23:39:00,TRUE,"https://t.co/494Lk5LQeR","http://www.senato.it/leg/18/BGT/Schede/Attsen/00019244.htm",,"https://pbs.twimg.com/profile_banners/101602652/1536334347","http://abs.twimg.com/images/themes/theme1/bg.png","http://pbs.twimg.com/profile_images/1397968025198989317/FpsdhGWL_normal.jpg"
"x101602652","x1444890416688640002",2021-10-04 05:01:34,"augussori","Per il futuro del tuo Comune investi 10 minuti del tuo tempo! Oggi puoi votare dalle 7.00 alle 15.00. Scegli la passione, la voglia di fare, l’attaccamento al territorio ed alla propria gente. Scegli #Lega! 
#elezioni #amministrative #VotaLega https://t.co/NBQkYiUzd0","Twitter for iPhone",243,,,,FALSE,FALSE,4,0,,,"Lega elezioni amministrative VotaLega",,,,,"http://pbs.twimg.com/media/FA1IKtVXMAQoB62.jpg","https://t.co/NBQkYiUzd0","https://twitter.com/augussori/status/1444890416688640002/photo/1","photo","http://pbs.twimg.com/media/FA1IKtVXMAQoB62.jpg","https://t.co/NBQkYiUzd0","https://twitter.com/augussori/status/1444890416688640002/photo/1",,,,"it",,,,,,,,,,,,,,,,,,,,,,,,,,,,,,,,,,,,,"NA NA","NA NA","NA NA NA NA NA NA NA NA","https://twitter.com/augussori/status/1444890416688640002","Luigi Augussori","Lodi, Lombardy","Profilo del sen. Luigi Augussori, rappresentante lodigiano nel Senato della Repubblica per il gruppo Lega - Salvini Premier. https://t.co/RVDZN85Ue5","https://t.co/494Lk5LQeR",FALSE,957,781,16,3193,323,2010-01-03 23:39:00,TRUE,"https://t.co/494Lk5LQeR","http://www.senato.it/leg/18/BGT/Schede/Attsen/00019244.htm",,"https://pbs.twimg.com/profile_banners/101602652/1536334347","http://abs.twimg.com/images/themes/theme1/bg.png","http://pbs.twimg.com/profile_images/1397968025198989317/FpsdhGWL_normal.jpg"
"x876541483","x1445061730732810245",2021-10-04 16:22:19,"AlbertoBagnai","Funziona solo DAZN
#whatsappdown #instagramdown #facebookdown","Twitter for iPhone",80,,,,FALSE,TRUE,0,159,,,"whatsappdown instagramdown facebookdown",,,,,,,,,,,,,"x3096871079","lefrasidiosho","eu",,,,,,,,,,,,,,,,"x1445061570531319823","Funziona solo DAZN
#whatsappdown #instagramdown #facebookdown",2021-10-04 16:21:41,"Twitter Web App",970,159,"x3096871079","lefrasidiosho","Le frasi di Osho",461568,583,11147,"Roma, Lazio","Spina nel fianco",FALSE,,,,,,,"NA NA","NA NA","NA NA NA NA NA NA NA NA","https://twitter.com/AlbertoBagnai/status/1445061730732810245","Alberto Bagnai","","Professore associato di politica economica all’Università Gabriele d’Annunzio, eletto al Senato per la Lega nel collegio Abruzzo 01.","https://t.co/sC5RvUzmsX",FALSE,127494,666,662,218833,6460,2012-10-12 22:13:36,TRUE,"https://t.co/sC5RvUzmsX","http://www.senato.it/leg/18/BGT/Schede/Attsen/00032582.htm",,"https://pbs.twimg.com/profile_banners/876541483/1535647109","http://abs.twimg.com/images/themes/theme1/bg.png","http://pbs.twimg.com/profile_images/849030859462246401/ATk3_aiW_normal.jpg"
"x876541483","x1445060274248196096",2021-10-04 16:16:31,"AlbertoBagnai","@Rebibbia909 Non si sa mai…","Twitter for iPhone",14,"x1445059430463287311","x3368775521","Rebibbia909",FALSE,FALSE,2,0,,,,,,,,,,,,,,,,"x3368775521","Rebibbia909","it",,,,,,,,,,,,,,,,,,,,,,,,,,,,,,,,,,,,,"NA NA","NA NA","NA NA NA NA NA NA NA NA","https://twitter.com/AlbertoBagnai/status/1445060274248196096","Alberto Bagnai","","Professore associato di politica economica all’Università Gabriele d’Annunzio, eletto al Senato per la Lega nel collegio Abruzzo 01.","https://t.co/sC5RvUzmsX",FALSE,127494,666,662,218833,6460,2012-10-12 22:13:36,TRUE,"https://t.co/sC5RvUzmsX","http://www.senato.it/leg/18/BGT/Schede/Attsen/00032582.htm",,"https://pbs.twimg.com/profile_banners/876541483/1535647109","http://abs.twimg.com/images/themes/theme1/bg.png","http://pbs.twimg.com/profile_images/849030859462246401/ATk3_aiW_normal.jpg"
"x876541483","x1445058956087468042",2021-10-04 16:11:17,"AlbertoBagnai","@AlbertoBagnai A me funziona solo se scrivo messaggi conformi ai traguardi e obiettivi del PNRR, a patto di aver fatto le riforme secondo cronoprogramma","Twitter for iPhone",140,,,,FALSE,TRUE,0,7,,,,,,,,,,,,,,,,"x1103152945 x876541483","TarabellAlberto AlbertoBagnai","it",,,,,,,,,,,,,,,,"x1445058797526036485","@AlbertoBagnai A me funziona solo se scrivo messaggi conformi ai traguardi e obiettivi del PNRR, a patto di aver fatto le riforme secondo cronoprogramma",2021-10-04 16:10:39,"Twitter Web App",52,7,"x1103152945","TarabellAlberto","Alberto Tarabella",897,397,42472,"Massa Italia","Socio di a/simmetrie. RT non è APPROVAZIONE ma libertà di pensiero.",FALSE,,,,,,,"NA NA","NA NA","NA NA NA NA NA NA NA NA","https://twitter.com/AlbertoBagnai/status/1445058956087468042","Alberto Bagnai","","Professore associato di politica economica all’Università Gabriele d’Annunzio, eletto al Senato per la Lega nel collegio Abruzzo 01.","https://t.co/sC5RvUzmsX",FALSE,127494,666,662,218833,6460,2012-10-12 22:13:36,TRUE,"https://t.co/sC5RvUzmsX","http://www.senato.it/leg/18/BGT/Schede/Attsen/00032582.htm",,"https://pbs.twimg.com/profile_banners/876541483/1535647109","http://abs.twimg.com/images/themes/theme1/bg.png","http://pbs.twimg.com/profile_images/849030859462246401/ATk3_aiW_normal.jpg"
"x876541483","x1445057430145179650",2021-10-04 16:05:13,"AlbertoBagnai","@luca_dream Alas, poor Zucky…","Twitter for iPhone",17,"x1445057146840879112","x740982132","luca_dream",FALSE,FALSE,9,2,,,,,,,,,,,,,,,,"x740982132","luca_dream","en",,,,,,,,,,,,,,,,,,,,,,,,,,,,,,,,,,,,,"NA NA","NA NA","NA NA NA NA NA NA NA NA","https://twitter.com/AlbertoBagnai/status/1445057430145179650","Alberto Bagnai","","Professore associato di politica economica all’Università Gabriele d’Annunzio, eletto al Senato per la Lega nel collegio Abruzzo 01.","https://t.co/sC5RvUzmsX",FALSE,127494,666,662,218833,6460,2012-10-12 22:13:36,TRUE,"https://t.co/sC5RvUzmsX","http://www.senato.it/leg/18/BGT/Schede/Attsen/00032582.htm",,"https://pbs.twimg.com/profile_banners/876541483/1535647109","http://abs.twimg.com/images/themes/theme1/bg.png","http://pbs.twimg.com/profile_images/849030859462246401/ATk3_aiW_normal.jpg"
"x876541483","x1445056158385967107",2021-10-04 16:00:10,"AlbertoBagnai","Io ho WhatsApp down. Pure voi?","Twitter for iPhone",30,,,,FALSE,FALSE,155,7,,,,,,,,,,,,,,,,,,"en",,,,,,,,,,,,,,,,,,,,,,,,,,,,,,,,,,,,,"NA NA","NA NA","NA NA NA NA NA NA NA NA","https://twitter.com/AlbertoBagnai/status/1445056158385967107","Alberto Bagnai","","Professore associato di politica economica all’Università Gabriele d’Annunzio, eletto al Senato per la Lega nel collegio Abruzzo 01.","https://t.co/sC5RvUzmsX",FALSE,127494,666,662,218833,6460,2012-10-12 22:13:36,TRUE,"https://t.co/sC5RvUzmsX","http://www.senato.it/leg/18/BGT/Schede/Attsen/00032582.htm",,"https://pbs.twimg.com/profile_banners/876541483/1535647109","http://abs.twimg.com/images/themes/theme1/bg.png","http://pbs.twimg.com/profile_images/849030859462246401/ATk3_aiW_normal.jpg"
"x876541483","x1445055909496033290",2021-10-04 15:59:11,"AlbertoBagnai","WhatsApp ha caído 🙄","Twitter for iPhone",39,,,,FALSE,TRUE,0,2,,,,,,,,,,,,,,,,"x4873396325","EscritorJMVlog","es",,,,,,,,,,,,,,,,"x1445055816869072898","WhatsApp ha caído 🙄",2021-10-04 15:58:49,"Twitter for Android",11,2,"x4873396325","EscritorJMVlog","Escritor José Miguel",25,57,97,"","Sígueme en este viaje...💫💫💫",FALSE,,,,,,,"NA NA","NA NA","NA NA NA NA NA NA NA NA","https://twitter.com/AlbertoBagnai/status/1445055909496033290","Alberto Bagnai","","Professore associato di politica economica all’Università Gabriele d’Annunzio, eletto al Senato per la Lega nel collegio Abruzzo 01.","https://t.co/sC5RvUzmsX",FALSE,127494,666,662,218833,6460,2012-10-12 22:13:36,TRUE,"https://t.co/sC5RvUzmsX","http://www.senato.it/leg/18/BGT/Schede/Attsen/00032582.htm",,"https://pbs.twimg.com/profile_banners/876541483/1535647109","http://abs.twimg.com/images/themes/theme1/bg.png","http://pbs.twimg.com/profile_images/849030859462246401/ATk3_aiW_normal.jpg"
"x876541483","x1445032194909646849",2021-10-04 14:24:57,"AlbertoBagnai","Nota marginal a los #PandoraPapers: el mapa de los países a los que pertenecen los afectados es... curioso. #PandoraLeaks https://t.co/KX94hdHSej","Twitter for iPhone",140,,,,FALSE,TRUE,0,23,,,"PandoraPapers PandoraLeaks",,,,,,,,,,,,,"x1460128572","angelferrero","es",,,,,,,,,,,,,,,,"x1444937821882617856","Nota marginal a los #PandoraPapers: el mapa de los países a los que pertenecen los afectados es... curioso. #PandoraLeaks https://t.co/KX94hdHSej",2021-10-04 08:09:57,"Twitter Web App",42,23,"x1460128572","angelferrero","Àngel Ferrero",2736,834,3846,"Barcelona","✒️ Entre el periodisme i la traducció. * freelance * a diversos mitjans. Col·laboro amb @catarsimagazin i ara també a @jacobin. Foto: Carles Llàcer.",FALSE,,,,,,,"NA NA","NA NA","NA NA NA NA NA NA NA NA","https://twitter.com/AlbertoBagnai/status/1445032194909646849","Alberto Bagnai","","Professore associato di politica economica all’Università Gabriele d’Annunzio, eletto al Senato per la Lega nel collegio Abruzzo 01.","https://t.co/sC5RvUzmsX",FALSE,127494,666,662,218833,6460,2012-10-12 22:13:36,TRUE,"https://t.co/sC5RvUzmsX","http://www.senato.it/leg/18/BGT/Schede/Attsen/00032582.htm",,"https://pbs.twimg.com/profile_banners/876541483/1535647109","http://abs.twimg.com/images/themes/theme1/bg.png","http://pbs.twimg.com/profile_images/849030859462246401/ATk3_aiW_normal.jpg"
"x876541483","x1445029846124568579",2021-10-04 14:15:37,"AlbertoBagnai","@Federic49759244 @alfonsoliguor11 Ecco. Allora, quando saprai chi sono e perché sono qui, credo che ti vergognerai della lezioncina che hai creduto di darmi. È solo un’ipotesi, non voglio importela perché sei una persona civile e conoscermi non è obbligatorio. Buon proseguimento!","Twitter for iPhone",246,"x1445022284973023237","x866059913243525121","Federic49759244",FALSE,FALSE,5,0,,,,,,,,,,,,,,,,"x866059913243525121 x1061995816708124673","Federic49759244 alfonsoliguor11","it",,,,,,,,,,,,,,,,,,,,,,,,,,,,,,,,,,,,,"NA NA","NA NA","NA NA NA NA NA NA NA NA","https://twitter.com/AlbertoBagnai/status/1445029846124568579","Alberto Bagnai","","Professore associato di politica economica all’Università Gabriele d’Annunzio, eletto al Senato per la Lega nel collegio Abruzzo 01.","https://t.co/sC5RvUzmsX",FALSE,127494,666,662,218833,6460,2012-10-12 22:13:36,TRUE,"https://t.co/sC5RvUzmsX","http://www.senato.it/leg/18/BGT/Schede/Attsen/00032582.htm",,"https://pbs.twimg.com/profile_banners/876541483/1535647109","http://abs.twimg.com/images/themes/theme1/bg.png","http://pbs.twimg.com/profile_images/849030859462246401/ATk3_aiW_normal.jpg"
"x876541483","x1445022020958363649",2021-10-04 13:44:31,"AlbertoBagnai","@Federic49759244 @alfonsoliguor11 E da quanto mi conosci?","Twitter for iPhone",23,"x1445021860085784576","x866059913243525121","Federic49759244",FALSE,FALSE,2,0,,,,,,,,,,,,,,,,"x866059913243525121 x1061995816708124673","Federic49759244 alfonsoliguor11","it",,,,,,,,,,,,,,,,,,,,,,,,,,,,,,,,,,,,,"NA NA","NA NA","NA NA NA NA NA NA NA NA","https://twitter.com/AlbertoBagnai/status/1445022020958363649","Alberto Bagnai","","Professore associato di politica economica all’Università Gabriele d’Annunzio, eletto al Senato per la Lega nel collegio Abruzzo 01.","https://t.co/sC5RvUzmsX",FALSE,127494,666,662,218833,6460,2012-10-12 22:13:36,TRUE,"https://t.co/sC5RvUzmsX","http://www.senato.it/leg/18/BGT/Schede/Attsen/00032582.htm",,"https://pbs.twimg.com/profile_banners/876541483/1535647109","http://abs.twimg.com/images/themes/theme1/bg.png","http://pbs.twimg.com/profile_images/849030859462246401/ATk3_aiW_normal.jpg"
"x876541483","x1445021312007692294",2021-10-04 13:41:42,"AlbertoBagnai","@Federic49759244 @alfonsoliguor11 Apprezzo molto lo spirito. Che lavoro facevi?","Twitter for iPhone",45,"x1445020200735330306","x866059913243525121","Federic49759244",FALSE,FALSE,3,0,,,,,,,,,,,,,,,,"x866059913243525121 x1061995816708124673","Federic49759244 alfonsoliguor11","it",,,,,,,,,,,,,,,,,,,,,,,,,,,,,,,,,,,,,"NA NA","NA NA","NA NA NA NA NA NA NA NA","https://twitter.com/AlbertoBagnai/status/1445021312007692294","Alberto Bagnai","","Professore associato di politica economica all’Università Gabriele d’Annunzio, eletto al Senato per la Lega nel collegio Abruzzo 01.","https://t.co/sC5RvUzmsX",FALSE,127494,666,662,218833,6460,2012-10-12 22:13:36,TRUE,"https://t.co/sC5RvUzmsX","http://www.senato.it/leg/18/BGT/Schede/Attsen/00032582.htm",,"https://pbs.twimg.com/profile_banners/876541483/1535647109","http://abs.twimg.com/images/themes/theme1/bg.png","http://pbs.twimg.com/profile_images/849030859462246401/ATk3_aiW_normal.jpg"
