"x337767301","x1429526748673286144",2021-08-22 19:31:50,"borghi_claudio","@nonexpedit Eh...","Twitter for Android",37,,,,FALSE,TRUE,0,17,,,,,,,,,,,,,,,,"x337767301 x763485613","borghi_claudio nonexpedit","und",,,,,,,,,,,,,,,,"x1429526733460590594","@nonexpedit Eh...",2021-08-22 19:31:47,"Twitter for Android",166,17,"x337767301","borghi_claudio","Claudio Borghi A.",113433,1319,210329,"Italia","Deputato della Repubblica Italiana eletto in Toscana per la Lega. Consigliere Comunale di Como",TRUE,,,,,,,"NA NA","NA NA","NA NA NA NA NA NA NA NA","https://twitter.com/borghi_claudio/status/1429526748673286144","Claudio Borghi A.","Italia","Deputato della Repubblica Italiana eletto in Toscana per la Lega. Consigliere Comunale di Como","https://t.co/LhQnD0sHz3",FALSE,113433,1319,801,210329,1292,2011-07-18 15:08:25,TRUE,"https://t.co/LhQnD0sHz3","http://tiny.cc/j3065y",,"https://pbs.twimg.com/profile_banners/337767301/1607040672","http://abs.twimg.com/images/themes/theme1/bg.png","http://pbs.twimg.com/profile_images/1449240289/manliorho_-_giusto_normal.jpg"
"x337767301","x1429526733460590594",2021-08-22 19:31:47,"borghi_claudio","@nonexpedit Eh...","Twitter for Android",5,"x1429462337505857539","x763485613","nonexpedit",FALSE,FALSE,166,17,,,,,,,,,,,,,,,,"x763485613","nonexpedit","und",,,,,,,,,,,,,,,,,,,,,,,,,,,,,,,,,,,,,"NA NA","NA NA","NA NA NA NA NA NA NA NA","https://twitter.com/borghi_claudio/status/1429526733460590594","Claudio Borghi A.","Italia","Deputato della Repubblica Italiana eletto in Toscana per la Lega. Consigliere Comunale di Como","https://t.co/LhQnD0sHz3",FALSE,113433,1319,801,210329,1292,2011-07-18 15:08:25,TRUE,"https://t.co/LhQnD0sHz3","http://tiny.cc/j3065y",,"https://pbs.twimg.com/profile_banners/337767301/1607040672","http://abs.twimg.com/images/themes/theme1/bg.png","http://pbs.twimg.com/profile_images/1449240289/manliorho_-_giusto_normal.jpg"
"x337767301","x1429517457547538433",2021-08-22 18:54:55,"borghi_claudio","Complimenti a @MauroMast mio follower da dieci anni che mette sempre passione nel produrre i pomodori secchi di cui vado matto e che lui vende a tutto il mondo. Impressionante questo video con la distesa di pomodori a perdita d'occhio. 

https://t.co/pHyCSPSZOp","Twitter for Android",261,,,,FALSE,FALSE,252,51,,,,,"linkedin.com/posts/mauro-ma…","https://t.co/pHyCSPSZOp","https://www.linkedin.com/posts/mauro-mastrototaro-142b7841_buonferragosto-pomodorisottolio-puglia-activity-6832010384547823616-4a3v",,,,,,,,,"x546275216","MauroMast","it",,,,,,,,,,,,,,,,,,,,,,,,,,,,,,,,,,,,,"NA NA","NA NA","NA NA NA NA NA NA NA NA","https://twitter.com/borghi_claudio/status/1429517457547538433","Claudio Borghi A.","Italia","Deputato della Repubblica Italiana eletto in Toscana per la Lega. Consigliere Comunale di Como","https://t.co/LhQnD0sHz3",FALSE,113433,1319,801,210329,1292,2011-07-18 15:08:25,TRUE,"https://t.co/LhQnD0sHz3","http://tiny.cc/j3065y",,"https://pbs.twimg.com/profile_banners/337767301/1607040672","http://abs.twimg.com/images/themes/theme1/bg.png","http://pbs.twimg.com/profile_images/1449240289/manliorho_-_giusto_normal.jpg"
"x297896440","x1429812179000246279",2021-08-23 14:26:02,"maxcapitanio","@matteosalvinimi Bravo @matteosalvinimi ! La Lega ha sempre lavorato e continua a lavorare per una connessione stabile in tutto il Paese e contro i disservizi agli utenti. I viucher per la #bul vanno in questa direzione, e la rete unica federata deve essere una priorità  #dazn","Twitter for Android",260,"x1429790141472772107","x270839361","matteosalvinimi",FALSE,FALSE,3,0,,,"bul dazn",,,,,,,,,,,,,"x270839361 x270839361","matteosalvinimi matteosalvinimi","it",,,,,,,,,,,,,,,,,,,,,,,,,,,,,,,,,,,,,"NA NA","NA NA","NA NA NA NA NA NA NA NA","https://twitter.com/maxcapitanio/status/1429812179000246279","Massimiliano Capitanio","","Papà, giornalista, gastronauta
Deputato Lega","https://t.co/95dihMZwGz",FALSE,778,245,13,2436,1291,2011-05-13 09:31:58,TRUE,"https://t.co/95dihMZwGz","https://www.camera.it/leg18/29?shadow_deputato=307685&idLegislatura=18",,"https://pbs.twimg.com/profile_banners/297896440/1378873684","http://abs.twimg.com/images/themes/theme1/bg.png","http://pbs.twimg.com/profile_images/1371816552912322569/H9UVD0n3_normal.jpg"
"x297896440","x1429811432141508618",2021-08-23 14:23:04,"maxcapitanio","#DAZN, se il buongiorno si vede dal mattino… Se soldi e interessi prevalgono su sport e passione, giusto che i tifosi vengano rimborsati e spengano tutto.","Twitter for Android",139,,,,FALSE,TRUE,0,72,,,"DAZN",,,,,,,,,,,,,"x270839361","matteosalvinimi","it",,,,,,,,,,,,,,,,"x1429790141472772107","#DAZN, se il buongiorno si vede dal mattino… Se soldi e interessi prevalgono su sport e passione, giusto che i tifosi vengano rimborsati e spengano tutto.",2021-08-23 12:58:28,"Twitter Web App",710,72,"x270839361","matteosalvinimi","Matteo Salvini",1410548,2040,51583,"","Leader della Lega #primagliitaliani 🇮🇹",TRUE,,,,,,,"NA NA","NA NA","NA NA NA NA NA NA NA NA","https://twitter.com/maxcapitanio/status/1429811432141508618","Massimiliano Capitanio","","Papà, giornalista, gastronauta
Deputato Lega","https://t.co/95dihMZwGz",FALSE,778,245,13,2436,1291,2011-05-13 09:31:58,TRUE,"https://t.co/95dihMZwGz","https://www.camera.it/leg18/29?shadow_deputato=307685&idLegislatura=18",,"https://pbs.twimg.com/profile_banners/297896440/1378873684","http://abs.twimg.com/images/themes/theme1/bg.png","http://pbs.twimg.com/profile_images/1371816552912322569/H9UVD0n3_normal.jpg"
"x215187433","x1429860033458749441",2021-08-23 17:36:12,"LaCavandoli","🔵#Salvini: “#Raveparty con morti e feriti che durano giorni, orde di baby gang che terrorizzano da tempo la #rivieraromagnola e non solo, dopo navi francesi e tedesche, oggi una nave con bandiera norvegese lascerà 322 #immigrati in #Italia. #Lamorgese, dove sei?” https://t.co/6MxsbINLMK","Twitter for Android",140,,,,FALSE,TRUE,0,2,,,"Salvini Raveparty",,,,,,,,,,,,,"x2471849343","MassimoSertori_","it",,,,,,,,,,,,,,,,"x1429838045642203142","🔵#Salvini: “#Raveparty con morti e feriti che durano giorni, orde di baby gang che terrorizzano da tempo la #rivieraromagnola e non solo, dopo navi francesi e tedesche, oggi una nave con bandiera norvegese lascerà 322 #immigrati in #Italia. #Lamorgese, dove sei?” https://t.co/6MxsbINLMK",2021-08-23 16:08:49,"Twitter for iPhone",8,2,"x2471849343","MassimoSertori_","Massimo Sertori",2097,933,7918,"Regione lombardia","•Profilo ufficiale• Assessore di Regione Lombardia e Imprenditore. Già Presidente di UPL e della Provincia di Sondrio. Ex Vicesindaco di Ponte in Valtellina.",FALSE,,,,,,,"NA NA","NA NA","NA NA NA NA NA NA NA NA","https://twitter.com/LaCavandoli/status/1429860033458749441","Laura Cavandoli","Parma e Roma","Deputato Lega XVIII legislatura. Consigliere comunale a Parma. Avvocato, moglie e mamma","https://t.co/DSOoGQuIXr",FALSE,1719,1546,28,12489,13832,2010-11-13 06:39:18,TRUE,"https://t.co/DSOoGQuIXr","https://www.camera.it/leg18/29?shadow_deputato=307285&idpersona=307285&idlegislatura=18",,"https://pbs.twimg.com/profile_banners/215187433/1588976351","http://abs.twimg.com/images/themes/theme1/bg.png","http://pbs.twimg.com/profile_images/990575026305978368/I7O39tTQ_normal.jpg"
"x215187433","x1429859512513662976",2021-08-23 17:34:07,"LaCavandoli","#DAZN, se il buongiorno si vede dal mattino… Se soldi e interessi prevalgono su sport e passione, giusto che i tifosi vengano rimborsati e spengano tutto.","Twitter for Android",139,,,,FALSE,TRUE,0,72,,,"DAZN",,,,,,,,,,,,,"x270839361","matteosalvinimi","it",,,,,,,,,,,,,,,,"x1429790141472772107","#DAZN, se il buongiorno si vede dal mattino… Se soldi e interessi prevalgono su sport e passione, giusto che i tifosi vengano rimborsati e spengano tutto.",2021-08-23 12:58:28,"Twitter Web App",710,72,"x270839361","matteosalvinimi","Matteo Salvini",1410548,2040,51583,"","Leader della Lega #primagliitaliani 🇮🇹",TRUE,,,,,,,"NA NA","NA NA","NA NA NA NA NA NA NA NA","https://twitter.com/LaCavandoli/status/1429859512513662976","Laura Cavandoli","Parma e Roma","Deputato Lega XVIII legislatura. Consigliere comunale a Parma. Avvocato, moglie e mamma","https://t.co/DSOoGQuIXr",FALSE,1719,1546,28,12489,13832,2010-11-13 06:39:18,TRUE,"https://t.co/DSOoGQuIXr","https://www.camera.it/leg18/29?shadow_deputato=307285&idpersona=307285&idlegislatura=18",,"https://pbs.twimg.com/profile_banners/215187433/1588976351","http://abs.twimg.com/images/themes/theme1/bg.png","http://pbs.twimg.com/profile_images/990575026305978368/I7O39tTQ_normal.jpg"
"x215187433","x1429769595062308864",2021-08-23 11:36:49,"LaCavandoli","Rave party con morti e feriti che durano giorni, orde di baby gang che terrorizzano da tempo la riviera romagnola e non solo, dopo navi francesi e tedesche, oggi una nave con bandiera norvegese lascerà 322 immigrati in Italia. Lamorgese, dove sei?","Twitter for Android",140,,,,FALSE,TRUE,0,319,,,,,,,,,,,,,,,,"x270839361","matteosalvinimi","it",,,,,,,,,,,,,,,,"x1429697518372335626","Rave party con morti e feriti che durano giorni, orde di baby gang che terrorizzano da tempo la riviera romagnola e non solo, dopo navi francesi e tedesche, oggi una nave con bandiera norvegese lascerà 322 immigrati in Italia. Lamorgese, dove sei?",2021-08-23 06:50:25,"Twitter for iPhone",1646,319,"x270839361","matteosalvinimi","Matteo Salvini",1410548,2040,51583,"","Leader della Lega #primagliitaliani 🇮🇹",TRUE,,,,,,,"NA NA","NA NA","NA NA NA NA NA NA NA NA","https://twitter.com/LaCavandoli/status/1429769595062308864","Laura Cavandoli","Parma e Roma","Deputato Lega XVIII legislatura. Consigliere comunale a Parma. Avvocato, moglie e mamma","https://t.co/DSOoGQuIXr",FALSE,1719,1546,28,12489,13832,2010-11-13 06:39:18,TRUE,"https://t.co/DSOoGQuIXr","https://www.camera.it/leg18/29?shadow_deputato=307285&idpersona=307285&idlegislatura=18",,"https://pbs.twimg.com/profile_banners/215187433/1588976351","http://abs.twimg.com/images/themes/theme1/bg.png","http://pbs.twimg.com/profile_images/990575026305978368/I7O39tTQ_normal.jpg"
"x215187433","x1429767901385400334",2021-08-23 11:30:06,"LaCavandoli","Foto appena pubblicata https://t.co/qLL1bi5koJ","Instagram",46,,,,FALSE,FALSE,0,0,,,,,"instagram.com/p/CS6lBo3DJdg/…","https://t.co/qLL1bi5koJ","https://www.instagram.com/p/CS6lBo3DJdg/?utm_medium=twitter",,,,,,,,,,,"it",,,,,,,,,,,,,,,,,,,,,,,,,,,,,,,,,,,,,"NA NA","NA NA","NA NA NA NA NA NA NA NA","https://twitter.com/LaCavandoli/status/1429767901385400334","Laura Cavandoli","Parma e Roma","Deputato Lega XVIII legislatura. Consigliere comunale a Parma. Avvocato, moglie e mamma","https://t.co/DSOoGQuIXr",FALSE,1719,1546,28,12489,13832,2010-11-13 06:39:18,TRUE,"https://t.co/DSOoGQuIXr","https://www.camera.it/leg18/29?shadow_deputato=307285&idpersona=307285&idlegislatura=18",,"https://pbs.twimg.com/profile_banners/215187433/1588976351","http://abs.twimg.com/images/themes/theme1/bg.png","http://pbs.twimg.com/profile_images/990575026305978368/I7O39tTQ_normal.jpg"
"x215187433","x1429697649435979780",2021-08-23 06:50:56,"LaCavandoli","Desidero sottolineare sine ira et studio che senza un minimo di serietà non andremo da nessuna parte. Fauci potrà aver fatto errori, ma è uno a parlare. Qui parlano in troppi per dire troppe cose. Come si può pretendere che i cittadini (politici compresi) non si pongano domande? https://t.co/WbChYVR1Ua","Twitter for Android",140,,,,FALSE,TRUE,0,404,,,,,,,,,,,,,,,,"x876541483","AlbertoBagnai","it",,,,,,,,,,,,,,,,"x1429342412628021249","Desidero sottolineare sine ira et studio che senza un minimo di serietà non andremo da nessuna parte. Fauci potrà aver fatto errori, ma è uno a parlare. Qui parlano in troppi per dire troppe cose. Come si può pretendere che i cittadini (politici compresi) non si pongano domande? https://t.co/WbChYVR1Ua",2021-08-22 07:19:21,"Twitter for iPhone",1069,404,"x876541483","AlbertoBagnai","Alberto Bagnai",126446,666,217612,"","Professore associato di politica economica all’Università Gabriele d’Annunzio, eletto al Senato per la Lega nel collegio Abruzzo 01.",TRUE,,,,,,,"NA NA","NA NA","NA NA NA NA NA NA NA NA","https://twitter.com/LaCavandoli/status/1429697649435979780","Laura Cavandoli","Parma e Roma","Deputato Lega XVIII legislatura. Consigliere comunale a Parma. Avvocato, moglie e mamma","https://t.co/DSOoGQuIXr",FALSE,1719,1546,28,12489,13832,2010-11-13 06:39:18,TRUE,"https://t.co/DSOoGQuIXr","https://www.camera.it/leg18/29?shadow_deputato=307285&idpersona=307285&idlegislatura=18",,"https://pbs.twimg.com/profile_banners/215187433/1588976351","http://abs.twimg.com/images/themes/theme1/bg.png","http://pbs.twimg.com/profile_images/990575026305978368/I7O39tTQ_normal.jpg"
"x215187433","x1429696329652084740",2021-08-23 06:45:42,"LaCavandoli","LAURA CAVANDOLI (LEGA) ""SCUOLA IN PRESENZA CON TEST SALIVARI"" https://t.co/VHTLsfxgVb via @wordpressdotcom @LaCavandoli","Twitter for Android",137,,,,FALSE,TRUE,0,1,,,,,"occhiodiparma.wordpress.com/2021/08/22/lau…","https://t.co/VHTLsfxgVb","https://occhiodiparma.wordpress.com/2021/08/22/laura-cavandoli-lega-scuola-in-presenza-con-test-salivari/",,,,,,,,,"x1344877367731351552 x823905 x215187433","salvocchiuto wordpressdotcom LaCavandoli","it",,,,,,,,,,,,,,,,"x1429559311072731150","LAURA CAVANDOLI (LEGA) ""SCUOLA IN PRESENZA CON TEST SALIVARI"" https://t.co/VHTLsfxgVb via @wordpressdotcom @LaCavandoli",2021-08-22 21:41:14,"Twitter Web App",1,1,"x1344877367731351552","salvocchiuto","Salvatore Occhiuto",10,14,65,"Parma","Meglio morire in piedi che vivere in ginocchio 🦁🇮🇹",FALSE,,,,,,,"NA NA","NA NA","NA NA NA NA NA NA NA NA","https://twitter.com/LaCavandoli/status/1429696329652084740","Laura Cavandoli","Parma e Roma","Deputato Lega XVIII legislatura. Consigliere comunale a Parma. Avvocato, moglie e mamma","https://t.co/DSOoGQuIXr",FALSE,1719,1546,28,12489,13832,2010-11-13 06:39:18,TRUE,"https://t.co/DSOoGQuIXr","https://www.camera.it/leg18/29?shadow_deputato=307285&idpersona=307285&idlegislatura=18",,"https://pbs.twimg.com/profile_banners/215187433/1588976351","http://abs.twimg.com/images/themes/theme1/bg.png","http://pbs.twimg.com/profile_images/990575026305978368/I7O39tTQ_normal.jpg"
"x499715019","x1429815501291769860",2021-08-23 14:39:14,"FabriCecchetti","Sicurezza? Controllo del territorio? #Lamorgese dove sei? https://t.co/ve5JlGaWoN","Twitter for iPhone",57,,,,FALSE,FALSE,6,2,,,"Lamorgese",,,,,"http://pbs.twimg.com/media/E9e5ngKXIAAvY0N.jpg","https://t.co/ve5JlGaWoN","https://twitter.com/FabriCecchetti/status/1429815501291769860/photo/1","photo","http://pbs.twimg.com/media/E9e5ngKXIAAvY0N.jpg","https://t.co/ve5JlGaWoN","https://twitter.com/FabriCecchetti/status/1429815501291769860/photo/1",,,,"it",,,,,,,,,,,,,,,,,,,,,,,,,,,,,,,,,,,,,"NA NA","NA NA","NA NA NA NA NA NA NA NA","https://twitter.com/FabriCecchetti/status/1429815501291769860","Fabrizio Cecchetti","Rho, Lombardia","Coordinatore Lega Lombarda e Vicepresidente vicario della Lega alla Camera
Pagina Facebook ➡️ https://t.co/SDMi9QhiDm","https://t.co/QRS1GWDHVm",FALSE,3412,722,62,5196,3758,2012-02-22 11:57:21,TRUE,"https://t.co/QRS1GWDHVm","https://www.camera.it/leg18/29?shadow_deputato=307680&idpersona=307680&idlegislatura=18",,"https://pbs.twimg.com/profile_banners/499715019/1613989548","http://abs.twimg.com/images/themes/theme1/bg.png","http://pbs.twimg.com/profile_images/1269297314163838977/HnL-rkoZ_normal.jpg"
"x422152255","x1429857640419561478",2021-08-23 17:26:41,"GuidoDeMartini","🟩 NO PASS 🟩 IKEA: ecco un’altra azienda da ricordare per come tratta i propri dipendenti. Fermo restando che la colpa è di chi ha deciso di imporre il PASS e di chi considera la mensa aziendale alla stregua di un ristorante (dove si va per piacere e a cui si può rinunciare)👇🏻👇🏻 https://t.co/omvWfI39lH","Twitter for iPhone",278,,,,FALSE,FALSE,31,11,,,,,,,,"http://pbs.twimg.com/media/E9ff7JGXoAE6ihR.jpg","https://t.co/omvWfI39lH","https://twitter.com/GuidoDeMartini/status/1429857640419561478/photo/1","photo","http://pbs.twimg.com/media/E9ff7JGXoAE6ihR.jpg","https://t.co/omvWfI39lH","https://twitter.com/GuidoDeMartini/status/1429857640419561478/photo/1",,,,"it",,,,,,,,,,,,,,,,,,,,,,,,,,,,,,,,,,,,,"NA NA","NA NA","NA NA NA NA NA NA NA NA","https://twitter.com/GuidoDeMartini/status/1429857640419561478","Guido De Martini","","Deputato Lega Salvini Premier eletto in Sardegna 🇮🇹 NO UNIONE EUROPEA-NO EURO 🇮🇹                                        Medico chirurgo specialista oculista","https://t.co/ca1P08pMjm",FALSE,3759,150,24,4884,4654,2011-11-26 21:53:19,TRUE,"https://t.co/ca1P08pMjm","https://www.camera.it/leg18/29?shadow_deputato=307217&idpersona=307217&idlegislatura=18",,"https://pbs.twimg.com/profile_banners/422152255/1521380406","http://abs.twimg.com/images/themes/theme1/bg.png","http://pbs.twimg.com/profile_images/436928099952123904/7o922h0U_normal.jpeg"
"x422152255","x1429831504260173829",2021-08-23 15:42:50,"GuidoDeMartini","➡️ #NoObbligoVaccinale ⬅️👇🏻👇🏻👇🏻 https://t.co/IV8C48jI8Y","Twitter for iPhone",31,,,,FALSE,FALSE,51,19,,,"NoObbligoVaccinale",,,,,"http://pbs.twimg.com/media/E9fIK0RXsAsOfau.jpg","https://t.co/IV8C48jI8Y","https://twitter.com/GuidoDeMartini/status/1429831504260173829/photo/1","photo","http://pbs.twimg.com/media/E9fIK0RXsAsOfau.jpg","https://t.co/IV8C48jI8Y","https://twitter.com/GuidoDeMartini/status/1429831504260173829/photo/1",,,,"und",,,,,,,,,,,,,,,,,,,,,,,,,,,,,,,,,,,,,"NA NA","NA NA","NA NA NA NA NA NA NA NA","https://twitter.com/GuidoDeMartini/status/1429831504260173829","Guido De Martini","","Deputato Lega Salvini Premier eletto in Sardegna 🇮🇹 NO UNIONE EUROPEA-NO EURO 🇮🇹                                        Medico chirurgo specialista oculista","https://t.co/ca1P08pMjm",FALSE,3759,150,24,4884,4654,2011-11-26 21:53:19,TRUE,"https://t.co/ca1P08pMjm","https://www.camera.it/leg18/29?shadow_deputato=307217&idpersona=307217&idlegislatura=18",,"https://pbs.twimg.com/profile_banners/422152255/1521380406","http://abs.twimg.com/images/themes/theme1/bg.png","http://pbs.twimg.com/profile_images/436928099952123904/7o922h0U_normal.jpeg"
"x422152255","x1429822308898807808",2021-08-23 15:06:17,"GuidoDeMartini","🟨 OBBLIGO VACCINALE: COME DIFENDERSI ORA E DOMANI 🟨✅ Controinformare le persone rispetto alla narrazione unica ✅ Protestare pacificamente in piazza contro PASS e OBBLIGO VACCINALE ✅ Boicottare il green pass ✅ VOTARE CONTRO per chi ha un ruolo elettivo ✅ Adire le vie legali","Twitter for iPhone",273,,,,FALSE,FALSE,189,82,,,,,,,,,,,,,,,,,,"it",,,,,,,,,,,,,,,,,,,,,,,,,,,,,,,,,,,,,"NA NA","NA NA","NA NA NA NA NA NA NA NA","https://twitter.com/GuidoDeMartini/status/1429822308898807808","Guido De Martini","","Deputato Lega Salvini Premier eletto in Sardegna 🇮🇹 NO UNIONE EUROPEA-NO EURO 🇮🇹                                        Medico chirurgo specialista oculista","https://t.co/ca1P08pMjm",FALSE,3759,150,24,4884,4654,2011-11-26 21:53:19,TRUE,"https://t.co/ca1P08pMjm","https://www.camera.it/leg18/29?shadow_deputato=307217&idpersona=307217&idlegislatura=18",,"https://pbs.twimg.com/profile_banners/422152255/1521380406","http://abs.twimg.com/images/themes/theme1/bg.png","http://pbs.twimg.com/profile_images/436928099952123904/7o922h0U_normal.jpeg"
"x422152255","x1429818628619317250",2021-08-23 14:51:40,"GuidoDeMartini","👇🏻👇🏻👇🏻 https://t.co/uxw3c0D9to","Twitter for iPhone",6,"x1429816369168756736","x422152255","GuidoDeMartini",FALSE,FALSE,18,7,,,,,,,,"http://pbs.twimg.com/media/E9e8dbUXIAQZxCL.jpg","https://t.co/uxw3c0D9to","https://twitter.com/GuidoDeMartini/status/1429818628619317250/photo/1","photo","http://pbs.twimg.com/media/E9e8dbUXIAQZxCL.jpg","https://t.co/uxw3c0D9to","https://twitter.com/GuidoDeMartini/status/1429818628619317250/photo/1",,,,"und",,,,,,,,,,,,,,,,,,,,,,,,,,,,,,,,,,,,,"NA NA","NA NA","NA NA NA NA NA NA NA NA","https://twitter.com/GuidoDeMartini/status/1429818628619317250","Guido De Martini","","Deputato Lega Salvini Premier eletto in Sardegna 🇮🇹 NO UNIONE EUROPEA-NO EURO 🇮🇹                                        Medico chirurgo specialista oculista","https://t.co/ca1P08pMjm",FALSE,3759,150,24,4884,4654,2011-11-26 21:53:19,TRUE,"https://t.co/ca1P08pMjm","https://www.camera.it/leg18/29?shadow_deputato=307217&idpersona=307217&idlegislatura=18",,"https://pbs.twimg.com/profile_banners/422152255/1521380406","http://abs.twimg.com/images/themes/theme1/bg.png","http://pbs.twimg.com/profile_images/436928099952123904/7o922h0U_normal.jpeg"
"x422152255","x1429816369168756736",2021-08-23 14:42:41,"GuidoDeMartini","➡️ #NoObbligoVaccinale ⬅️ 🟨 PROSEGUE IL FUOCO D’ARTIGLIERIA PREPARATORIO PER LA BATTAGLIA SULL’OBBLIGO VACCINALE 🟨 Ogni giorno minacciano l’obbligo vaccinale per nuove categorie di lavoratori, per fasce d’età, per tutti. DIFENDEREMO LA LIBERTÀ DI SCELTA PERSONALE FINO IN FONDO!","Twitter for iPhone",278,,,,FALSE,FALSE,229,62,,,"NoObbligoVaccinale",,,,,,,,,,,,,,,"it",,,,,,,,,,,,,,,,,,,,,,,,,,,,,,,,,,,,,"NA NA","NA NA","NA NA NA NA NA NA NA NA","https://twitter.com/GuidoDeMartini/status/1429816369168756736","Guido De Martini","","Deputato Lega Salvini Premier eletto in Sardegna 🇮🇹 NO UNIONE EUROPEA-NO EURO 🇮🇹                                        Medico chirurgo specialista oculista","https://t.co/ca1P08pMjm",FALSE,3759,150,24,4884,4654,2011-11-26 21:53:19,TRUE,"https://t.co/ca1P08pMjm","https://www.camera.it/leg18/29?shadow_deputato=307217&idpersona=307217&idlegislatura=18",,"https://pbs.twimg.com/profile_banners/422152255/1521380406","http://abs.twimg.com/images/themes/theme1/bg.png","http://pbs.twimg.com/profile_images/436928099952123904/7o922h0U_normal.jpeg"
"x422152255","x1429749832663642118",2021-08-23 10:18:18,"GuidoDeMartini","🟨 NELL’UNIVERSO MONDO DEI MEDIA QUALCHE ECCEZIONE C’È STATA 🟨 Per esempio il giornale “La Verità” e il canale TV sul 262 “ByoBlu”, hanno dato spazio a delle voci fuori dal coro. Solo sentendo varie opinioni le persone possono fare scelte consapevoli. NON ESISTE LA VERITÀ UNICA!","Twitter for iPhone",278,"x1429745587545645058","x422152255","GuidoDeMartini",FALSE,FALSE,77,32,,,,,,,,,,,,,,,,,,"it",,,,,,,,,,,,,,,,,,,,,,,,,,,,,,,,,,,,,"NA NA","NA NA","NA NA NA NA NA NA NA NA","https://twitter.com/GuidoDeMartini/status/1429749832663642118","Guido De Martini","","Deputato Lega Salvini Premier eletto in Sardegna 🇮🇹 NO UNIONE EUROPEA-NO EURO 🇮🇹                                        Medico chirurgo specialista oculista","https://t.co/ca1P08pMjm",FALSE,3759,150,24,4884,4654,2011-11-26 21:53:19,TRUE,"https://t.co/ca1P08pMjm","https://www.camera.it/leg18/29?shadow_deputato=307217&idpersona=307217&idlegislatura=18",,"https://pbs.twimg.com/profile_banners/422152255/1521380406","http://abs.twimg.com/images/themes/theme1/bg.png","http://pbs.twimg.com/profile_images/436928099952123904/7o922h0U_normal.jpeg"
"x422152255","x1429745587545645058",2021-08-23 10:01:26,"GuidoDeMartini","🟨 DOPO 20 MESI DI COVID-19 LE RESPONSABILITÀ DELLA STAMPA E DELLA TV SONO EVIDENTI 🟨 È stata negata un’informazione corretta ed equilibrata. Solo info provaccini, demonizzazione delle #TerapieDomiciliari, contrapposizione tra chi, liberamente, ha scelto di vaccinarsi oppure no.","Twitter for iPhone",278,,,,FALSE,FALSE,256,105,,,"TerapieDomiciliari",,,,,,,,,,,,,,,"it",,,,,,,,,,,,,,,,,,,,,,,,,,,,,,,,,,,,,"NA NA","NA NA","NA NA NA NA NA NA NA NA","https://twitter.com/GuidoDeMartini/status/1429745587545645058","Guido De Martini","","Deputato Lega Salvini Premier eletto in Sardegna 🇮🇹 NO UNIONE EUROPEA-NO EURO 🇮🇹                                        Medico chirurgo specialista oculista","https://t.co/ca1P08pMjm",FALSE,3759,150,24,4884,4654,2011-11-26 21:53:19,TRUE,"https://t.co/ca1P08pMjm","https://www.camera.it/leg18/29?shadow_deputato=307217&idpersona=307217&idlegislatura=18",,"https://pbs.twimg.com/profile_banners/422152255/1521380406","http://abs.twimg.com/images/themes/theme1/bg.png","http://pbs.twimg.com/profile_images/436928099952123904/7o922h0U_normal.jpeg"
"x422152255","x1429713333159092228",2021-08-23 07:53:16,"GuidoDeMartini","🔴16-9-2018🔴Lettera a chi sostiene l'obbligo vaccinale: l’obiettivo di tutto questo teatro non è eradicare il morbillo.
È eradicare il diritto all’inviolabilità del proprio corpo.
Il bersaglio non sono mai stati i no-vax.
Il bersaglio sei sempre stato tu https://t.co/l41kAhhbgo","Twitter for iPhone",277,,,,FALSE,FALSE,92,54,,,,,"stefano.re/lettera-a-chi-…","https://t.co/l41kAhhbgo","https://stefano.re/lettera-a-chi-sostiene-lobbligo-vaccinale/",,,,,,,,,,,"it",,,,,,,,,,,,,,,,,,,,,,,,,,,,,,,,,,,,,"NA NA","NA NA","NA NA NA NA NA NA NA NA","https://twitter.com/GuidoDeMartini/status/1429713333159092228","Guido De Martini","","Deputato Lega Salvini Premier eletto in Sardegna 🇮🇹 NO UNIONE EUROPEA-NO EURO 🇮🇹                                        Medico chirurgo specialista oculista","https://t.co/ca1P08pMjm",FALSE,3759,150,24,4884,4654,2011-11-26 21:53:19,TRUE,"https://t.co/ca1P08pMjm","https://www.camera.it/leg18/29?shadow_deputato=307217&idpersona=307217&idlegislatura=18",,"https://pbs.twimg.com/profile_banners/422152255/1521380406","http://abs.twimg.com/images/themes/theme1/bg.png","http://pbs.twimg.com/profile_images/436928099952123904/7o922h0U_normal.jpeg"
