"x747960894","x1459560020799115274",2021-11-13 16:33:20,"simo_billi","🇧🇪 Gli eventi culturali ripartono anche per gi Italiani a Bruxelles! 🇮🇹
@PaoloSabbatini @ilariadb74 
#italianiaBruxelles #LucchesiNelMondo
https://t.co/TmMNuv1GcI","Twitter for iPhone",162,,,,FALSE,FALSE,0,0,,,"italianiaBruxelles LucchesiNelMondo",,"simonebilli.eu/2021/11/13/bru…","https://t.co/TmMNuv1GcI","https://www.simonebilli.eu/2021/11/13/bruxelles-puccini/",,,,,,,,,"x27761076 x182512806","PaoloSabbatini ilariadb74","it",,,,,,,,,,,,,,,,,,,,,,,,,,,,,,,"https://api.twitter.com/1.1/geo/id/853cac1ebe034aac.json","Fiumicino","Fiumicino, Lazio","city","Italy","IT","NA NA","NA NA","12.1250835 12.3174662 12.3174662 12.1250835 41.7410238 41.7410238 42.020287 42.020287","https://twitter.com/simo_billi/status/1459560020799115274","simone billi","deputato al parlamento","Lega Salvini Premier    https://t.co/fFLM8mQ7Nw","https://t.co/aEqebu2CuP",FALSE,1314,1817,13,4315,1826,2012-08-09 21:19:53,TRUE,"https://t.co/aEqebu2CuP","https://www.camera.it/leg18/29?tipoAttivita=&tipoVisAtt=&tipoPersona=&shadow_deputato=307151&idLegis",,"https://pbs.twimg.com/profile_banners/747960894/1633724732","http://abs.twimg.com/images/themes/theme1/bg.png","http://pbs.twimg.com/profile_images/1446572156356337665/bC46t5vZ_normal.jpg"
"x106673706","x1459476694172065792",2021-11-13 11:02:14,"massimobitonci","Bonus terme, Lega: Si trovino nuove risorse per l’incentivo https://t.co/P2A4vtqiPM","Twitter Web App",83,,,,FALSE,FALSE,7,2,,,,,"tgpadova.telenuovo.it/cronaca/2021/1…","https://t.co/P2A4vtqiPM","https://tgpadova.telenuovo.it/cronaca/2021/11/12/bonus-terme-lega-si-trovino-nuove-risorse-per-lincentivo",,,,,,,,,,,"it",,,,,,,,,,,,,,,,,,,,,,,,,,,,,,,,,,,,,"NA NA","NA NA","NA NA NA NA NA NA NA NA","https://twitter.com/massimobitonci/status/1459476694172065792","Massimo Bitonci","","Veneto on. Lega Salvini - Fondatore LIGA Veneta SP - Capogruppo Bilancio - Capo Dip. Att. Produttive Lega- già Sindaco di Cittadella e Padova - commercialista","https://t.co/kPwsXGqWs8",FALSE,11720,903,98,21090,2101,2010-01-20 08:53:16,TRUE,"https://t.co/kPwsXGqWs8","http://bitonci.it",,"https://pbs.twimg.com/profile_banners/106673706/1520459270","http://abs.twimg.com/images/themes/theme1/bg.png","http://pbs.twimg.com/profile_images/1217032559348961286/R3F9DbBd_normal.jpg"
"x337767301","x1459727692564205569",2021-11-14 03:39:36,"borghi_claudio","@Theskeptical_ @Lulu_se_ @Guglielmo_Totti @todorov_denis @lameduck1960 @Eriador Bah, diranno che correggono con le faq","Twitter for Android",38,"x1459711744025186311","x956636032002396161","Theskeptical_",FALSE,FALSE,0,0,,,,,,,,,,,,,,,,"x956636032002396161 x1426579316385648644 x860157576364863488 x2525778087 x81637419 x1370605363","Theskeptical_ Lulu_se_ Guglielmo_Totti todorov_denis lameduck1960 Eriador","it",,,,,,,,,,,,,,,,,,,,,,,,,,,,,,,,,,,,,"NA NA","NA NA","NA NA NA NA NA NA NA NA","https://twitter.com/borghi_claudio/status/1459727692564205569","Claudio Borghi A.","Italia","Deputato della Repubblica Italiana eletto in Toscana per la Lega. Consigliere Comunale di Como","https://t.co/LhQnD0sHz3",FALSE,119483,1328,825,214830,1302,2011-07-18 15:08:25,TRUE,"https://t.co/LhQnD0sHz3","http://tiny.cc/j3065y",,"https://pbs.twimg.com/profile_banners/337767301/1607040672","http://abs.twimg.com/images/themes/theme1/bg.png","http://pbs.twimg.com/profile_images/1449240289/manliorho_-_giusto_normal.jpg"
"x337767301","x1459713232361431048",2021-11-14 02:42:09,"borghi_claudio","@PPallavera @Lulu_se_ @Guglielmo_Totti @todorov_denis @lameduck1960 @Eriador Io sono assolutamente schierato. Non vi preoccupate per la mia credibilità, se uno non mi appoggia adesso non avrò bisogno di lui nemmeno dopo.","Twitter Web App",140,,,,FALSE,TRUE,0,3,,,,,,,,,,,,,,,,"x337767301 x1450432206397222913 x1426579316385648644 x860157576364863488 x2525778087 x81637419 x1370605363","borghi_claudio PPallavera Lulu_se_ Guglielmo_Totti todorov_denis lameduck1960 Eriador","it",,,,,,,,,,,,,,,,"x1459713209607274497","@PPallavera @Lulu_se_ @Guglielmo_Totti @todorov_denis @lameduck1960 @Eriador Io sono assolutamente schierato. Non vi preoccupate per la mia credibilità, se uno non mi appoggia adesso non avrò bisogno di lui nemmeno dopo.",2021-11-14 02:42:03,"Twitter Web App",27,3,"x337767301","borghi_claudio","Claudio Borghi A.",119483,1328,214830,"Italia","Deputato della Repubblica Italiana eletto in Toscana per la Lega. Consigliere Comunale di Como",TRUE,,,,,,,"NA NA","NA NA","NA NA NA NA NA NA NA NA","https://twitter.com/borghi_claudio/status/1459713232361431048","Claudio Borghi A.","Italia","Deputato della Repubblica Italiana eletto in Toscana per la Lega. Consigliere Comunale di Como","https://t.co/LhQnD0sHz3",FALSE,119483,1328,825,214830,1302,2011-07-18 15:08:25,TRUE,"https://t.co/LhQnD0sHz3","http://tiny.cc/j3065y",,"https://pbs.twimg.com/profile_banners/337767301/1607040672","http://abs.twimg.com/images/themes/theme1/bg.png","http://pbs.twimg.com/profile_images/1449240289/manliorho_-_giusto_normal.jpg"
"x337767301","x1459713209607274497",2021-11-14 02:42:03,"borghi_claudio","@PPallavera @Lulu_se_ @Guglielmo_Totti @todorov_denis @lameduck1960 @Eriador Io sono assolutamente schierato. Non vi preoccupate per la mia credibilità, se uno non mi appoggia adesso non avrò bisogno di lui nemmeno dopo.","Twitter Web App",143,"x1459710512892153859","x1450432206397222913","PPallavera",FALSE,FALSE,27,3,,,,,,,,,,,,,,,,"x1450432206397222913 x1426579316385648644 x860157576364863488 x2525778087 x81637419 x1370605363","PPallavera Lulu_se_ Guglielmo_Totti todorov_denis lameduck1960 Eriador","it",,,,,,,,,,,,,,,,,,,,,,,,,,,,,,,,,,,,,"NA NA","NA NA","NA NA NA NA NA NA NA NA","https://twitter.com/borghi_claudio/status/1459713209607274497","Claudio Borghi A.","Italia","Deputato della Repubblica Italiana eletto in Toscana per la Lega. Consigliere Comunale di Como","https://t.co/LhQnD0sHz3",FALSE,119483,1328,825,214830,1302,2011-07-18 15:08:25,TRUE,"https://t.co/LhQnD0sHz3","http://tiny.cc/j3065y",,"https://pbs.twimg.com/profile_banners/337767301/1607040672","http://abs.twimg.com/images/themes/theme1/bg.png","http://pbs.twimg.com/profile_images/1449240289/manliorho_-_giusto_normal.jpg"
"x337767301","x1459705111354167297",2021-11-14 02:09:53,"borghi_claudio","@diaboli70729354 @lameduck1960 @Eriador Guardi che se sto a casa l'unica cosa che si ottiene è che in Parlamento ci sarà uno in meno contro il green pass.","Twitter Web App",114,"x1459687075557609474","x1346900877634899969","diaboli70729354",FALSE,FALSE,3,0,,,,,,,,,,,,,,,,"x1346900877634899969 x81637419 x1370605363","diaboli70729354 lameduck1960 Eriador","it",,,,,,,,,,,,,,,,,,,,,,,,,,,,,,,,,,,,,"NA NA","NA NA","NA NA NA NA NA NA NA NA","https://twitter.com/borghi_claudio/status/1459705111354167297","Claudio Borghi A.","Italia","Deputato della Repubblica Italiana eletto in Toscana per la Lega. Consigliere Comunale di Como","https://t.co/LhQnD0sHz3",FALSE,119483,1328,825,214830,1302,2011-07-18 15:08:25,TRUE,"https://t.co/LhQnD0sHz3","http://tiny.cc/j3065y",,"https://pbs.twimg.com/profile_banners/337767301/1607040672","http://abs.twimg.com/images/themes/theme1/bg.png","http://pbs.twimg.com/profile_images/1449240289/manliorho_-_giusto_normal.jpg"
"x337767301","x1459704672898490370",2021-11-14 02:08:08,"borghi_claudio","@Enrica05878360 @lameduck1960 @Eriador No. Decisione di Fico. Salvini (e Meloni) hanno detto che se il Parlamento impone qualcosa a tutti anche i Parlamentari devono sottostare alle medesime regole. Condivisibile. Io sto aspettando di sentire che dirà la Consulta dal momento che anche lei dovrebbe avere l'obbligo.","Twitter Web App",276,"x1459683978265432065","x998293947066781697","Enrica05878360",FALSE,FALSE,4,2,,,,,,,,,,,,,,,,"x998293947066781697 x81637419 x1370605363","Enrica05878360 lameduck1960 Eriador","it",,,,,,,,,,,,,,,,,,,,,,,,,,,,,,,,,,,,,"NA NA","NA NA","NA NA NA NA NA NA NA NA","https://twitter.com/borghi_claudio/status/1459704672898490370","Claudio Borghi A.","Italia","Deputato della Repubblica Italiana eletto in Toscana per la Lega. Consigliere Comunale di Como","https://t.co/LhQnD0sHz3",FALSE,119483,1328,825,214830,1302,2011-07-18 15:08:25,TRUE,"https://t.co/LhQnD0sHz3","http://tiny.cc/j3065y",,"https://pbs.twimg.com/profile_banners/337767301/1607040672","http://abs.twimg.com/images/themes/theme1/bg.png","http://pbs.twimg.com/profile_images/1449240289/manliorho_-_giusto_normal.jpg"
"x337767301","x1459702317821931528",2021-11-14 01:58:47,"borghi_claudio","@alexium_alessio @Lulu_se_ @Guglielmo_Totti @todorov_denis @lameduck1960 @Eriador Ma se anche ci fossero pensieri differenti in un partito ti pare che la soluzione sia andarsene in modo tale che il ""pensiero differente"" diventi egemone? Si resta e si combatte per le proprie idee. Quelli che la pensavano diversamente da me in passato se ne sono forse andati?","Twitter for Android",277,"x1459700608978591749","x268894777","alexium_alessio",FALSE,FALSE,3,0,,,,,,,,,,,,,,,,"x268894777 x1426579316385648644 x860157576364863488 x2525778087 x81637419 x1370605363","alexium_alessio Lulu_se_ Guglielmo_Totti todorov_denis lameduck1960 Eriador","it",,,,,,,,,,,,,,,,,,,,,,,,,,,,,,,,,,,,,"NA NA","NA NA","NA NA NA NA NA NA NA NA","https://twitter.com/borghi_claudio/status/1459702317821931528","Claudio Borghi A.","Italia","Deputato della Repubblica Italiana eletto in Toscana per la Lega. Consigliere Comunale di Como","https://t.co/LhQnD0sHz3",FALSE,119483,1328,825,214830,1302,2011-07-18 15:08:25,TRUE,"https://t.co/LhQnD0sHz3","http://tiny.cc/j3065y",,"https://pbs.twimg.com/profile_banners/337767301/1607040672","http://abs.twimg.com/images/themes/theme1/bg.png","http://pbs.twimg.com/profile_images/1449240289/manliorho_-_giusto_normal.jpg"
"x337767301","x1459699310799564802",2021-11-14 01:46:50,"borghi_claudio","@Lulu_se_ @Guglielmo_Totti @todorov_denis @lameduck1960 @Eriador Non ne condivido le scelte ma vuole quello che voglio io quindi non diventa certo una mia avversaria perché ha deciso di uscire dal partito.","Twitter for Android",139,,,,FALSE,TRUE,0,3,,,,,,,,,,,,,,,,"x337767301 x1426579316385648644 x860157576364863488 x2525778087 x81637419 x1370605363","borghi_claudio Lulu_se_ Guglielmo_Totti todorov_denis lameduck1960 Eriador","it",,,,,,,,,,,,,,,,"x1459698120783183875","@Lulu_se_ @Guglielmo_Totti @todorov_denis @lameduck1960 @Eriador Non ne condivido le scelte ma vuole quello che voglio io quindi non diventa certo una mia avversaria perché ha deciso di uscire dal partito.",2021-11-14 01:42:06,"Twitter for Android",24,3,"x337767301","borghi_claudio","Claudio Borghi A.",119483,1328,214830,"Italia","Deputato della Repubblica Italiana eletto in Toscana per la Lega. Consigliere Comunale di Como",TRUE,,,,,,,"NA NA","NA NA","NA NA NA NA NA NA NA NA","https://twitter.com/borghi_claudio/status/1459699310799564802","Claudio Borghi A.","Italia","Deputato della Repubblica Italiana eletto in Toscana per la Lega. Consigliere Comunale di Como","https://t.co/LhQnD0sHz3",FALSE,119483,1328,825,214830,1302,2011-07-18 15:08:25,TRUE,"https://t.co/LhQnD0sHz3","http://tiny.cc/j3065y",,"https://pbs.twimg.com/profile_banners/337767301/1607040672","http://abs.twimg.com/images/themes/theme1/bg.png","http://pbs.twimg.com/profile_images/1449240289/manliorho_-_giusto_normal.jpg"
"x337767301","x1459699210677325828",2021-11-14 01:46:26,"borghi_claudio","@zengalorenzo @todorov_denis @Guglielmo_Totti @lameduck1960 @Eriador Il mio partito ha opinioni diverse al suo interno sul green pass e vota la fiducia perché il leader ha deciso che stare in maggioranza prima dell'elezione del presidente della repubblica è meglio che essere del tutto fuori dai giochi. Questa scelta sarà giudicata dagli elettori.","Twitter for Android",139,,,,FALSE,TRUE,0,7,,,,,,,,,,,,,,,,"x337767301 x162192942 x2525778087 x860157576364863488 x81637419 x1370605363","borghi_claudio zengalorenzo todorov_denis Guglielmo_Totti lameduck1960 Eriador","it",,,,,,,,,,,,,,,,"x1459699102120386561","@zengalorenzo @todorov_denis @Guglielmo_Totti @lameduck1960 @Eriador Il mio partito ha opinioni diverse al suo interno sul green pass e vota la fiducia perché il leader ha deciso che stare in maggioranza prima dell'elezione del presidente della repubblica è meglio che essere del tutto fuori dai giochi. Questa scelta sarà giudicata dagli elettori.",2021-11-14 01:46:00,"Twitter for Android",28,7,"x337767301","borghi_claudio","Claudio Borghi A.",119483,1328,214830,"Italia","Deputato della Repubblica Italiana eletto in Toscana per la Lega. Consigliere Comunale di Como",TRUE,,,,,,,"NA NA","NA NA","NA NA NA NA NA NA NA NA","https://twitter.com/borghi_claudio/status/1459699210677325828","Claudio Borghi A.","Italia","Deputato della Repubblica Italiana eletto in Toscana per la Lega. Consigliere Comunale di Como","https://t.co/LhQnD0sHz3",FALSE,119483,1328,825,214830,1302,2011-07-18 15:08:25,TRUE,"https://t.co/LhQnD0sHz3","http://tiny.cc/j3065y",,"https://pbs.twimg.com/profile_banners/337767301/1607040672","http://abs.twimg.com/images/themes/theme1/bg.png","http://pbs.twimg.com/profile_images/1449240289/manliorho_-_giusto_normal.jpg"
"x337767301","x1459699102120386561",2021-11-14 01:46:00,"borghi_claudio","@zengalorenzo @todorov_denis @Guglielmo_Totti @lameduck1960 @Eriador Il mio partito ha opinioni diverse al suo interno sul green pass e vota la fiducia perché il leader ha deciso che stare in maggioranza prima dell'elezione del presidente della repubblica è meglio che essere del tutto fuori dai giochi. Questa scelta sarà giudicata dagli elettori.","Twitter for Android",279,"x1459688257789341698","x162192942","zengalorenzo",FALSE,FALSE,28,7,,,,,,,,,,,,,,,,"x162192942 x2525778087 x860157576364863488 x81637419 x1370605363","zengalorenzo todorov_denis Guglielmo_Totti lameduck1960 Eriador","it",,,,,,,,,,,,,,,,,,,,,,,,,,,,,,,,,,,,,"NA NA","NA NA","NA NA NA NA NA NA NA NA","https://twitter.com/borghi_claudio/status/1459699102120386561","Claudio Borghi A.","Italia","Deputato della Repubblica Italiana eletto in Toscana per la Lega. Consigliere Comunale di Como","https://t.co/LhQnD0sHz3",FALSE,119483,1328,825,214830,1302,2011-07-18 15:08:25,TRUE,"https://t.co/LhQnD0sHz3","http://tiny.cc/j3065y",,"https://pbs.twimg.com/profile_banners/337767301/1607040672","http://abs.twimg.com/images/themes/theme1/bg.png","http://pbs.twimg.com/profile_images/1449240289/manliorho_-_giusto_normal.jpg"
"x337767301","x1459698120783183875",2021-11-14 01:42:06,"borghi_claudio","@Lulu_se_ @Guglielmo_Totti @todorov_denis @lameduck1960 @Eriador Non ne condivido le scelte ma vuole quello che voglio io quindi non diventa certo una mia avversaria perché ha deciso di uscire dal partito.","Twitter for Android",140,"x1459697568791896066","x1426579316385648644","Lulu_se_",FALSE,FALSE,24,3,,,,,,,,,,,,,,,,"x1426579316385648644 x860157576364863488 x2525778087 x81637419 x1370605363","Lulu_se_ Guglielmo_Totti todorov_denis lameduck1960 Eriador","it",,,,,,,,,,,,,,,,,,,,,,,,,,,,,,,,,,,,,"NA NA","NA NA","NA NA NA NA NA NA NA NA","https://twitter.com/borghi_claudio/status/1459698120783183875","Claudio Borghi A.","Italia","Deputato della Repubblica Italiana eletto in Toscana per la Lega. Consigliere Comunale di Como","https://t.co/LhQnD0sHz3",FALSE,119483,1328,825,214830,1302,2011-07-18 15:08:25,TRUE,"https://t.co/LhQnD0sHz3","http://tiny.cc/j3065y",,"https://pbs.twimg.com/profile_banners/337767301/1607040672","http://abs.twimg.com/images/themes/theme1/bg.png","http://pbs.twimg.com/profile_images/1449240289/manliorho_-_giusto_normal.jpg"
"x337767301","x1459697383399436291",2021-11-14 01:39:10,"borghi_claudio","@Enrica05878360 @lameduck1960 @Eriador L'unico green pass che ho votato io (con tutte le note motivazioni) è quello per i ristoranti al chiuso e non mi pare stia rovinando la vita di nessuno. Quando voterò no al green pass sul lavoro la sua vita cambierà? No. Il problema non sono io è la maggioranza.","Twitter for Android",262,"x1459683322318270464","x998293947066781697","Enrica05878360",FALSE,FALSE,3,0,,,,,,,,,,,,,,,,"x998293947066781697 x81637419 x1370605363","Enrica05878360 lameduck1960 Eriador","it",,,,,,,,,,,,,,,,,,,,,,,,,,,,,,,,,,,,,"NA NA","NA NA","NA NA NA NA NA NA NA NA","https://twitter.com/borghi_claudio/status/1459697383399436291","Claudio Borghi A.","Italia","Deputato della Repubblica Italiana eletto in Toscana per la Lega. Consigliere Comunale di Como","https://t.co/LhQnD0sHz3",FALSE,119483,1328,825,214830,1302,2011-07-18 15:08:25,TRUE,"https://t.co/LhQnD0sHz3","http://tiny.cc/j3065y",,"https://pbs.twimg.com/profile_banners/337767301/1607040672","http://abs.twimg.com/images/themes/theme1/bg.png","http://pbs.twimg.com/profile_images/1449240289/manliorho_-_giusto_normal.jpg"
"x337767301","x1459696417056989190",2021-11-14 01:35:20,"borghi_claudio","@Guglielmo_Totti @todorov_denis @lameduck1960 @Eriador Hai forse sentito qualcuno spiegare la questione in Parlamento meglio di lui?
https://t.co/Vak6u1Fv3t","Twitter for Android",140,,,,FALSE,TRUE,0,4,,,,,,,,,,,,,,,,"x337767301 x860157576364863488 x2525778087 x81637419 x1370605363","borghi_claudio Guglielmo_Totti todorov_denis lameduck1960 Eriador","it",,,,,,,,,,,,,,,,"x1459696385985556483","@Guglielmo_Totti @todorov_denis @lameduck1960 @Eriador Hai forse sentito qualcuno spiegare la questione in Parlamento meglio di lui?
https://t.co/Vak6u1Fv3t",2021-11-14 01:35:12,"Twitter for Android",20,4,"x337767301","borghi_claudio","Claudio Borghi A.",119483,1328,214830,"Italia","Deputato della Repubblica Italiana eletto in Toscana per la Lega. Consigliere Comunale di Como",TRUE,,,,,,,"NA NA","NA NA","NA NA NA NA NA NA NA NA","https://twitter.com/borghi_claudio/status/1459696417056989190","Claudio Borghi A.","Italia","Deputato della Repubblica Italiana eletto in Toscana per la Lega. Consigliere Comunale di Como","https://t.co/LhQnD0sHz3",FALSE,119483,1328,825,214830,1302,2011-07-18 15:08:25,TRUE,"https://t.co/LhQnD0sHz3","http://tiny.cc/j3065y",,"https://pbs.twimg.com/profile_banners/337767301/1607040672","http://abs.twimg.com/images/themes/theme1/bg.png","http://pbs.twimg.com/profile_images/1449240289/manliorho_-_giusto_normal.jpg"
"x337767301","x1459696385985556483",2021-11-14 01:35:12,"borghi_claudio","@Guglielmo_Totti @todorov_denis @lameduck1960 @Eriador Hai forse sentito qualcuno spiegare la questione in Parlamento meglio di lui?
https://t.co/Vak6u1Fv3t","Twitter for Android",101,"x1459688469526159360","x860157576364863488","Guglielmo_Totti",FALSE,FALSE,20,4,,,,,"youtu.be/d6f_AXIC3Gc","https://t.co/Vak6u1Fv3t","https://youtu.be/d6f_AXIC3Gc",,,,,,,,,"x860157576364863488 x2525778087 x81637419 x1370605363","Guglielmo_Totti todorov_denis lameduck1960 Eriador","it",,,,,,,,,,,,,,,,,,,,,,,,,,,,,,,,,,,,,"NA NA","NA NA","NA NA NA NA NA NA NA NA","https://twitter.com/borghi_claudio/status/1459696385985556483","Claudio Borghi A.","Italia","Deputato della Repubblica Italiana eletto in Toscana per la Lega. Consigliere Comunale di Como","https://t.co/LhQnD0sHz3",FALSE,119483,1328,825,214830,1302,2011-07-18 15:08:25,TRUE,"https://t.co/LhQnD0sHz3","http://tiny.cc/j3065y",,"https://pbs.twimg.com/profile_banners/337767301/1607040672","http://abs.twimg.com/images/themes/theme1/bg.png","http://pbs.twimg.com/profile_images/1449240289/manliorho_-_giusto_normal.jpg"
"x337767301","x1459686712083460103",2021-11-14 00:56:46,"borghi_claudio","@todorov_denis @Guglielmo_Totti @lameduck1960 @Eriador Lasciare un partito tradendo chi mi ha votato con quel simbolo, con un leader, tanti colleghi e militanti che la pensano come me che non mi obbliga a nulla, che mi consente di dire quello che voglio anche se in tanti la pensano diversamente? E perchè dovrei? E per andare dove?","Twitter Web App",277,"x1459684987301736453","x2525778087","todorov_denis",FALSE,FALSE,20,2,,,,,,,,,,,,,,,,"x2525778087 x860157576364863488 x81637419 x1370605363","todorov_denis Guglielmo_Totti lameduck1960 Eriador","it",,,,,,,,,,,,,,,,,,,,,,,,,,,,,,,,,,,,,"NA NA","NA NA","NA NA NA NA NA NA NA NA","https://twitter.com/borghi_claudio/status/1459686712083460103","Claudio Borghi A.","Italia","Deputato della Repubblica Italiana eletto in Toscana per la Lega. Consigliere Comunale di Como","https://t.co/LhQnD0sHz3",FALSE,119483,1328,825,214830,1302,2011-07-18 15:08:25,TRUE,"https://t.co/LhQnD0sHz3","http://tiny.cc/j3065y",,"https://pbs.twimg.com/profile_banners/337767301/1607040672","http://abs.twimg.com/images/themes/theme1/bg.png","http://pbs.twimg.com/profile_images/1449240289/manliorho_-_giusto_normal.jpg"
"x337767301","x1459684348890861574",2021-11-14 00:47:23,"borghi_claudio","@Guglielmo_Totti @lameduck1960 @Eriador Ecco, e tu mettiti nei miei panni.","Twitter Web App",34,"x1459676989212794886","x860157576364863488","Guglielmo_Totti",FALSE,FALSE,9,1,,,,,,,,,,,,,,,,"x860157576364863488 x81637419 x1370605363","Guglielmo_Totti lameduck1960 Eriador","it",,,,,,,,,,,,,,,,,,,,,,,,,,,,,,,,,,,,,"NA NA","NA NA","NA NA NA NA NA NA NA NA","https://twitter.com/borghi_claudio/status/1459684348890861574","Claudio Borghi A.","Italia","Deputato della Repubblica Italiana eletto in Toscana per la Lega. Consigliere Comunale di Como","https://t.co/LhQnD0sHz3",FALSE,119483,1328,825,214830,1302,2011-07-18 15:08:25,TRUE,"https://t.co/LhQnD0sHz3","http://tiny.cc/j3065y",,"https://pbs.twimg.com/profile_banners/337767301/1607040672","http://abs.twimg.com/images/themes/theme1/bg.png","http://pbs.twimg.com/profile_images/1449240289/manliorho_-_giusto_normal.jpg"
"x337767301","x1459684012683837440",2021-11-14 00:46:02,"borghi_claudio","@Avvocatodelpop1 @lameduck1960 @Eriador Ma figurati. Capisco tutti. E' un gran casino, il mio nemico non è certo Barbara che ha tutte le ragioni per essere esasperata.","Twitter Web App",127,"x1459678907309957121","x1457152325638832129","Avvocatodelpop1",FALSE,FALSE,2,0,,,,,,,,,,,,,,,,"x1457152325638832129 x81637419 x1370605363","Avvocatodelpop1 lameduck1960 Eriador","it",,,,,,,,,,,,,,,,,,,,,,,,,,,,,,,,,,,,,"NA NA","NA NA","NA NA NA NA NA NA NA NA","https://twitter.com/borghi_claudio/status/1459684012683837440","Claudio Borghi A.","Italia","Deputato della Repubblica Italiana eletto in Toscana per la Lega. Consigliere Comunale di Como","https://t.co/LhQnD0sHz3",FALSE,119483,1328,825,214830,1302,2011-07-18 15:08:25,TRUE,"https://t.co/LhQnD0sHz3","http://tiny.cc/j3065y",,"https://pbs.twimg.com/profile_banners/337767301/1607040672","http://abs.twimg.com/images/themes/theme1/bg.png","http://pbs.twimg.com/profile_images/1449240289/manliorho_-_giusto_normal.jpg"
"x337767301","x1459683516002844681",2021-11-14 00:44:04,"borghi_claudio","@lameduck1960 @Eriador Guarda che devo mostrare il green cazz anch'io ogni volta che entro in Parlamento. Se anche esco per prendere il caffè poi quando rientro lo devo rimostrare.","Twitter Web App",157,"x1459676731992940549","x81637419","lameduck1960",FALSE,FALSE,10,1,,,,,,,,,,,,,,,,"x81637419 x1370605363","lameduck1960 Eriador","it",,,,,,,,,,,,,,,,,,,,,,,,,,,,,,,,,,,,,"NA NA","NA NA","NA NA NA NA NA NA NA NA","https://twitter.com/borghi_claudio/status/1459683516002844681","Claudio Borghi A.","Italia","Deputato della Repubblica Italiana eletto in Toscana per la Lega. Consigliere Comunale di Como","https://t.co/LhQnD0sHz3",FALSE,119483,1328,825,214830,1302,2011-07-18 15:08:25,TRUE,"https://t.co/LhQnD0sHz3","http://tiny.cc/j3065y",,"https://pbs.twimg.com/profile_banners/337767301/1607040672","http://abs.twimg.com/images/themes/theme1/bg.png","http://pbs.twimg.com/profile_images/1449240289/manliorho_-_giusto_normal.jpg"
"x337767301","x1459682958978203657",2021-11-14 00:41:51,"borghi_claudio","@Enrica05878360 @lameduck1960 @Eriador Lei però deve essere cieca del tutto per non aver visto che sono parecchio incazzato anch'io e che il fatto che in tanti altri siano incazzati l'ho visto sin dal primo giorno di green pass. 
Mi aiuta ciò a risolvere la questione? No.","Twitter Web App",233,"x1459677469494194177","x998293947066781697","Enrica05878360",FALSE,FALSE,4,1,,,,,,,,,,,,,,,,"x998293947066781697 x81637419 x1370605363","Enrica05878360 lameduck1960 Eriador","it",,,,,,,,,,,,,,,,,,,,,,,,,,,,,,,,,,,,,"NA NA","NA NA","NA NA NA NA NA NA NA NA","https://twitter.com/borghi_claudio/status/1459682958978203657","Claudio Borghi A.","Italia","Deputato della Repubblica Italiana eletto in Toscana per la Lega. Consigliere Comunale di Como","https://t.co/LhQnD0sHz3",FALSE,119483,1328,825,214830,1302,2011-07-18 15:08:25,TRUE,"https://t.co/LhQnD0sHz3","http://tiny.cc/j3065y",,"https://pbs.twimg.com/profile_banners/337767301/1607040672","http://abs.twimg.com/images/themes/theme1/bg.png","http://pbs.twimg.com/profile_images/1449240289/manliorho_-_giusto_normal.jpg"
