"x526777254","x1484068360874831873",2022-01-20 07:40:44,"mantolalla","Non può essere l’atto di scelta del singolo parlamentare o grande elettore in quanto il Presidente della Repubblica è il capo dello Stato e rappresenta l’unità nazionale. Deve pertanto rappresentare tutti i cittadini italiani, non solo una parte. 2/8","Twitter Web App",250,"x1484068154523496450","x526777254","mantolalla",FALSE,FALSE,2,0,,,,,,,,,,,,,,,,,,"it",,,,,,,,,,,,,,,,,,,,,,,,,,,,,,,,,,,,,"NA NA","NA NA","NA NA NA NA NA NA NA NA","https://twitter.com/mantolalla/status/1484068360874831873","Maria Laura Mantovani","Carpi, Emilia Romagna","Cittadina eletta al Senato per il MoVimento 5 Stelle","https://t.co/NSQtXQs1hL",FALSE,611,352,11,2657,424,2012-03-16 20:44:02,FALSE,"https://t.co/NSQtXQs1hL","https://marialauramantovani.it",,"https://pbs.twimg.com/profile_banners/526777254/1528469923","http://abs.twimg.com/images/themes/theme1/bg.png","http://pbs.twimg.com/profile_images/1190749518721167361/8e8KnoXg_normal.jpg"
"x526777254","x1484068154523496450",2022-01-20 07:39:55,"mantolalla","È il momento di eleggere il nuovo Presidente della Repubblica e l’attenzione mediatica sulle istituzioni è al massimo livello. Come Senatrice della Repubblica, sono chiamata a dare il mio voto, un atto che deve avere primariamente un significato collettivo, comunitario. 1/8 https://t.co/xYpmBk9XJ7","Twitter Web App",274,,,,FALSE,FALSE,5,3,,,,,,,,"http://pbs.twimg.com/media/FJh1Se9XwAIuaTr.jpg","https://t.co/xYpmBk9XJ7","https://twitter.com/mantolalla/status/1484068154523496450/photo/1","photo","http://pbs.twimg.com/media/FJh1Se9XwAIuaTr.jpg","https://t.co/xYpmBk9XJ7","https://twitter.com/mantolalla/status/1484068154523496450/photo/1",,,,"it",,,,,,,,,,,,,,,,,,,,,,,,,,,,,,,,,,,,,"NA NA","NA NA","NA NA NA NA NA NA NA NA","https://twitter.com/mantolalla/status/1484068154523496450","Maria Laura Mantovani","Carpi, Emilia Romagna","Cittadina eletta al Senato per il MoVimento 5 Stelle","https://t.co/NSQtXQs1hL",FALSE,611,352,11,2657,424,2012-03-16 20:44:02,FALSE,"https://t.co/NSQtXQs1hL","https://marialauramantovani.it",,"https://pbs.twimg.com/profile_banners/526777254/1528469923","http://abs.twimg.com/images/themes/theme1/bg.png","http://pbs.twimg.com/profile_images/1190749518721167361/8e8KnoXg_normal.jpg"
"x57282569","x1484071460431929344",2022-01-20 07:53:03,"AndreaMarcucci","“L’incontro Letta, Conte e Speranza per il #Quirinale22? Ognuno è libero di vedere chi vuole, ma non possiamo diventare quelli che sono passati dalla vocazione maggioritaria a quella minoritaria”. La mia intervista al @mattinodinapoli https://t.co/bTKp81Z9hN","Twitter for iPhone",234,,,,FALSE,FALSE,103,23,,,"Quirinale22",,,,,"http://pbs.twimg.com/media/FJh7IBIXsAAIE3M.jpg","https://t.co/bTKp81Z9hN","https://twitter.com/AndreaMarcucci/status/1484071460431929344/photo/1","photo","http://pbs.twimg.com/media/FJh7IBIXsAAIE3M.jpg","https://t.co/bTKp81Z9hN","https://twitter.com/AndreaMarcucci/status/1484071460431929344/photo/1",,"x82886693","mattinodinapoli","it",,,,,,,,,,,,,,,,,,,,,,,,,,,,,,,,,,,,,"NA NA","NA NA","NA NA NA NA NA NA NA NA","https://twitter.com/AndreaMarcucci/status/1484071460431929344","Andrea Marcucci","Lucca, Italia","Senatore del Pd, appassionato di moto e di storia risorgimentale",,FALSE,23518,1319,276,10213,2661,2009-07-16 08:42:25,TRUE,,,,"https://pbs.twimg.com/profile_banners/57282569/1468948462","http://abs.twimg.com/images/themes/theme5/bg.gif","http://pbs.twimg.com/profile_images/1265650639935283202/2mvPVCA1_normal.jpg"
"x57282569","x1483802480966311944",2022-01-19 14:04:13,"AndreaMarcucci","Conte difende #BeppeGrillo in modo impeccabile. Avrei gradito sentire le stesse parole e lo stesso garantismo da tutto il #M5S anche per tante altre persone coinvolte in indagini. Non si può difendere a priori chi è del M5S ed accusare comunque tutti gli altri.","Twitter for iPhone",261,,,,FALSE,FALSE,590,98,,,"BeppeGrillo M5S",,,,,,,,,,,,,,,"it",,,,,,,,,,,,,,,,,,,,,,,,,,,,,,,,,,,,,"NA NA","NA NA","NA NA NA NA NA NA NA NA","https://twitter.com/AndreaMarcucci/status/1483802480966311944","Andrea Marcucci","Lucca, Italia","Senatore del Pd, appassionato di moto e di storia risorgimentale",,FALSE,23518,1319,276,10213,2661,2009-07-16 08:42:25,TRUE,,,,"https://pbs.twimg.com/profile_banners/57282569/1468948462","http://abs.twimg.com/images/themes/theme5/bg.gif","http://pbs.twimg.com/profile_images/1265650639935283202/2mvPVCA1_normal.jpg"
"x501874833","x1483974742818406408",2022-01-20 01:28:44,"s_margiotta","Domani a #ilSorpasso @IsoradioRai il sottosegretario agli Esteri #enzoamendola #governodraghi insieme a @agnesepini @s_margiotta @barbarasaltamartini","Twitter for iPad",140,,,,FALSE,TRUE,0,1,,,"ilSorpasso enzoamendola governodraghi",,,,,,,,,,,,,"x587784713 x2237907482 x435675068","MonicaSetta IsoradioRai agnesepini","it",,,,,,,,,,,,,,,,"x1483913120598876162","Domani a #ilSorpasso @IsoradioRai il sottosegretario agli Esteri #enzoamendola #governodraghi insieme a @agnesepini @s_margiotta @barbarasaltamartini",2022-01-19 21:23:52,"Twitter for Android",5,1,"x587784713","MonicaSetta","Monica Setta 2",1618,1566,2460,"","❤️📺🦋Giornalista, scrittrice, conduttrice
Ci vediamo tutti i week end
  1 mattina in famiglia @rai1 e su @isoradio tutte le sere dalle 20 alle 21 #ilsorpasso",FALSE,,,,,,,"NA NA","NA NA","NA NA NA NA NA NA NA NA","https://twitter.com/s_margiotta/status/1483974742818406408","Salvatore Margiotta","Roma, Potenza","Senatore, ingegnere, professore universitario. Capogruppo Commissione lavori pubblici e trasporti. Segretario Presidenza Senato","https://t.co/aeYZnOeRaN",FALSE,15771,7325,207,80550,61104,2012-02-24 15:30:04,TRUE,"https://t.co/aeYZnOeRaN","http://instangram.com/salvatore__margiotta",,"https://pbs.twimg.com/profile_banners/501874833/1483357085","http://abs.twimg.com/images/themes/theme1/bg.png","http://pbs.twimg.com/profile_images/1344056897155063808/zdD0fQgS_normal.jpg"
"x501874833","x1483838669605715972",2022-01-19 16:28:01,"s_margiotta","Il traffico di influenze illecite è un mostro giuridico ‘nato’ per volontà di Beppe #Grillo e Alfonso #Bonafede: un reato grillino che colpisce ora lo stesso fondatore dei 5 Stelle (di @aldotorchiaro) 
https://t.co/2qAPWlUzpW","Twitter for iPad",140,,,,FALSE,TRUE,0,113,,,"Grillo Bonafede",,,,,,,,,,,,,"x138736601","ilriformista","it",,,,,,,,,,,,,,,,"x1483759611643576323","Il traffico di influenze illecite è un mostro giuridico ‘nato’ per volontà di Beppe #Grillo e Alfonso #Bonafede: un reato grillino che colpisce ora lo stesso fondatore dei 5 Stelle (di @aldotorchiaro) 
https://t.co/2qAPWlUzpW",2022-01-19 11:13:52,"Twitter Web App",317,113,"x138736601","ilriformista","Il Riformista",21179,779,18373,"","✏️ L’idea riformista, l’idea libertaria e l’idea garantista. Informazione e battaglia delle idee. Le idee non la propaganda.",TRUE,,,,,,,"NA NA","NA NA","NA NA NA NA NA NA NA NA","https://twitter.com/s_margiotta/status/1483838669605715972","Salvatore Margiotta","Roma, Potenza","Senatore, ingegnere, professore universitario. Capogruppo Commissione lavori pubblici e trasporti. Segretario Presidenza Senato","https://t.co/aeYZnOeRaN",FALSE,15771,7325,207,80550,61104,2012-02-24 15:30:04,TRUE,"https://t.co/aeYZnOeRaN","http://instangram.com/salvatore__margiotta",,"https://pbs.twimg.com/profile_banners/501874833/1483357085","http://abs.twimg.com/images/themes/theme1/bg.png","http://pbs.twimg.com/profile_images/1344056897155063808/zdD0fQgS_normal.jpg"
"x501874833","x1483838574688677896",2022-01-19 16:27:39,"s_margiotta","@elevisconti 😂","Twitter for iPad",1,"x1483705684495642627","x1240690942904066049","elevisconti",FALSE,FALSE,1,0,,,,,,,,,,,,,,,,"x1240690942904066049","elevisconti","und",,,,,,,,,,,,,,,,,,,,,,,,,,,,,,,,,,,,,"NA NA","NA NA","NA NA NA NA NA NA NA NA","https://twitter.com/s_margiotta/status/1483838574688677896","Salvatore Margiotta","Roma, Potenza","Senatore, ingegnere, professore universitario. Capogruppo Commissione lavori pubblici e trasporti. Segretario Presidenza Senato","https://t.co/aeYZnOeRaN",FALSE,15771,7325,207,80550,61104,2012-02-24 15:30:04,TRUE,"https://t.co/aeYZnOeRaN","http://instangram.com/salvatore__margiotta",,"https://pbs.twimg.com/profile_banners/501874833/1483357085","http://abs.twimg.com/images/themes/theme1/bg.png","http://pbs.twimg.com/profile_images/1344056897155063808/zdD0fQgS_normal.jpg"
"x539150646","x1483878517188309002",2022-01-19 19:06:22,"marcomarsilio","Questa sera alle 21.20 sarò ospite della trasmissione Effetto Notte, su Radio 24
#sintonizzatevi se vi va.

📻 https://t.co/47RPvlZoqQ https://t.co/nQ8WrnKts3","Twitter for iPhone",133,,,,FALSE,FALSE,5,2,,,"sintonizzatevi",,"bit.ly/3fLvPd3","https://t.co/47RPvlZoqQ","https://bit.ly/3fLvPd3","http://pbs.twimg.com/media/FJfLpCmXoAQe8Ml.jpg","https://t.co/nQ8WrnKts3","https://twitter.com/marcomarsilio/status/1483878517188309002/photo/1","photo","http://pbs.twimg.com/media/FJfLpCmXoAQe8Ml.jpg","https://t.co/nQ8WrnKts3","https://twitter.com/marcomarsilio/status/1483878517188309002/photo/1",,,,"it",,,,,,,,,,,,,,,,,,,,,,,,,,,,,,,,,,,,,"NA NA","NA NA","NA NA NA NA NA NA NA NA","https://twitter.com/marcomarsilio/status/1483878517188309002","Marco Marsilio","Abruzzo, Italia","Presidente della Regione Abruzzo. Classe '68. Laureato in Filosofia. Ex senatore di @FratellidItalia. Innamorato della mia terra, di mia moglie e mia figlia.","https://t.co/vJHhSKcpwE",FALSE,6167,244,54,11298,622,2012-03-28 13:56:06,TRUE,"https://t.co/vJHhSKcpwE","http://www.marsiliopresidente.it",,"https://pbs.twimg.com/profile_banners/539150646/1553081691","http://abs.twimg.com/images/themes/theme18/bg.gif","http://pbs.twimg.com/profile_images/1387421144161177604/-OpBVceI_normal.jpg"
"x1314728936","x1484086036246446080",2022-01-20 08:50:58,"NicolaMorra63","Non va bene, certo che non va bene.
#Foggia e la provincia vanno difese dallo Stato, perché, è evidente, sono sotto attacco. https://t.co/RgsTiL3X2v","Twitter for Android",124,,,,FALSE,FALSE,24,10,,,"Foggia",,,,,"http://pbs.twimg.com/media/FJiIYhWWUAMsD97.jpg","https://t.co/RgsTiL3X2v","https://twitter.com/NicolaMorra63/status/1484086036246446080/photo/1","photo","http://pbs.twimg.com/media/FJiIYhWWUAMsD97.jpg http://pbs.twimg.com/media/FJiIYqbWUAA9ISK.jpg","https://t.co/RgsTiL3X2v https://t.co/RgsTiL3X2v","https://twitter.com/NicolaMorra63/status/1484086036246446080/photo/1 https://twitter.com/NicolaMorra63/status/1484086036246446080/photo/1",,,,"it",,,,,,,,,,,,,,,,,,,,,,,,,,,,,,,,,,,,,"NA NA","NA NA","NA NA NA NA NA NA NA NA","https://twitter.com/NicolaMorra63/status/1484086036246446080","Nicola Morra","Roma, Lazio","Presidente della Commissione Antimafia","https://t.co/iTPRV42dyl",FALSE,94281,362,422,12374,2786,2013-03-29 18:15:14,TRUE,"https://t.co/iTPRV42dyl","http://www.movimento5stelle.it",,"https://pbs.twimg.com/profile_banners/1314728936/1611601504","http://abs.twimg.com/images/themes/theme1/bg.png","http://pbs.twimg.com/profile_images/1129289852384628736/KNHsbHe3_normal.jpg"
"x443198044","x1484099855119265792",2022-01-20 09:45:53,"TNannicini","Abbiamo proposto con @valeriafedeli, @AntonioNicita e @TNannicini una @agora_dem su Informazione, Disinformazione, Democrazia. Ne discuteremo domani, dalla sala David Sassoli. Per registrarvi e partecipare online dovete andare a questo link https://t.co/WNS0bGDK1U. Vi aspettiamo!","Twitter for iPhone",140,,,,FALSE,TRUE,0,9,,,,,,,,,,,,,,,,"x492325083 x480645077 x297939596 x443198044 x1416323901592834049","AnnaAscani valeriafedeli AntonioNicita TNannicini agora_dem","it",,,,,,,,,,,,,,,,"x1484098905394536452","Abbiamo proposto con @valeriafedeli, @AntonioNicita e @TNannicini una @agora_dem su Informazione, Disinformazione, Democrazia. Ne discuteremo domani, dalla sala David Sassoli. Per registrarvi e partecipare online dovete andare a questo link https://t.co/WNS0bGDK1U. Vi aspettiamo!",2022-01-20 09:42:06,"Twitter for iPhone",17,9,"x492325083","AnnaAscani","Anna Ascani",39366,4680,27940,"Città di Castello | Roma","Agisci in modo da trattare l'umanità in te come negli altri sempre come fine mai come mezzo | Sottosegretaria @MISE_GOV | VP @pdnetwork | Cattolica, interista",TRUE,,,,,,,"NA NA","NA NA","NA NA NA NA NA NA NA NA","https://twitter.com/TNannicini/status/1484099855119265792","Tommaso Nannicini","","Senatore della Repubblica @pdnetwork. Professore ordinario di economia politica @Unibocconi. Die-hard @RedSox fan.","https://t.co/zYOOrj4pVH",FALSE,21886,2194,226,10319,11825,2011-12-21 22:48:25,TRUE,"https://t.co/zYOOrj4pVH","http://www.tommasonannicini.eu",,"https://pbs.twimg.com/profile_banners/443198044/1566419274","http://abs.twimg.com/images/themes/theme1/bg.png","http://pbs.twimg.com/profile_images/1185594811367284742/-XoZtGVi_normal.jpg"
"x443198044","x1483781982878318594",2022-01-19 12:42:46,"TNannicini","Ci manca la tua intelligenza. Ci manca la tua esperienza. Ci manca la tua ironia. Ci manca la tua ruvidezza. Ci manchi Emanuele https://t.co/tTYLnswU8p","Twitter for iPhone",127,,,,FALSE,FALSE,103,9,,,,,,,,"http://pbs.twimg.com/media/FJdz2VBXsAI-y3j.jpg","https://t.co/tTYLnswU8p","https://twitter.com/TNannicini/status/1483781982878318594/photo/1","photo","http://pbs.twimg.com/media/FJdz2VBXsAI-y3j.jpg","https://t.co/tTYLnswU8p","https://twitter.com/TNannicini/status/1483781982878318594/photo/1",,,,"it",,,,,,,,,,,,,,,,,,,,,,,,,,,,,,,,,,,,,"NA NA","NA NA","NA NA NA NA NA NA NA NA","https://twitter.com/TNannicini/status/1483781982878318594","Tommaso Nannicini","","Senatore della Repubblica @pdnetwork. Professore ordinario di economia politica @Unibocconi. Die-hard @RedSox fan.","https://t.co/zYOOrj4pVH",FALSE,21886,2194,226,10319,11825,2011-12-21 22:48:25,TRUE,"https://t.co/zYOOrj4pVH","http://www.tommasonannicini.eu",,"https://pbs.twimg.com/profile_banners/443198044/1566419274","http://abs.twimg.com/images/themes/theme1/bg.png","http://pbs.twimg.com/profile_images/1185594811367284742/-XoZtGVi_normal.jpg"
"x1026144254","x1483784402488471552",2022-01-19 12:52:23,"NazarioPagano","Ho incontrato la Ministra della Giustizia, Marta Cartabia, e le ho sottoposto la questione della chiusura dei tribunali minori in #Abruzzo e dei disagi che questa comporterebbe all’iter di numerosi processi e, in generale, all’efficace amministrazione della giustizia. https://t.co/iZGk6WC7AM","Twitter Web App",268,,,,FALSE,FALSE,7,2,,,"Abruzzo",,,,,"http://pbs.twimg.com/media/FJd1ajhXwAEcQiU.jpg","https://t.co/iZGk6WC7AM","https://twitter.com/NazarioPagano/status/1483784402488471552/photo/1","photo","http://pbs.twimg.com/media/FJd1ajhXwAEcQiU.jpg","https://t.co/iZGk6WC7AM","https://twitter.com/NazarioPagano/status/1483784402488471552/photo/1",,,,"it",,,,,,,,,,,,,,,,,,,,,,,,,,,,,,,,,,,,,"NA NA","NA NA","NA NA NA NA NA NA NA NA","https://twitter.com/NazarioPagano/status/1483784402488471552","Nazario Pagano","","Senatore, vice Presidente Commissione Affari costituzionali, avvocato, docente universitario.",,FALSE,2389,1663,27,4426,10173,2012-12-21 10:49:32,FALSE,,,,"https://pbs.twimg.com/profile_banners/1026144254/1600720611","http://abs.twimg.com/images/themes/theme1/bg.png","http://pbs.twimg.com/profile_images/1312022806734024704/6btKrdBQ_normal.jpg"
"x587802594","x1484093096950444035",2022-01-20 09:19:02,"DarioParrini","Ci ha lasciato Sergio #Lepri, il decano dei giornalisti italiani. Nato nel 1919, fiorentino, partecipò alla Resistenza cittadina nelle file del Pli. Portavoce di Fanfani al partito e a Palazzo Chigi, per 30 anni fu all'Ansa. Poi docente alla Luiss. Un maestro del settore. RIP","Twitter Web App",276,,,,FALSE,FALSE,3,0,,,"Lepri",,,,,,,,,,,,,,,"it",,,,,,,,,,,,,,,,,,,,,,,,,,,,,,,,,,,,,"NA NA","NA NA","NA NA NA NA NA NA NA NA","https://twitter.com/DarioParrini/status/1484093096950444035","Dario Parrini","","Sindaco di Vinci dal 2004/2013. Nel 2013/2018 deputato e dal marzo 2018 senatore. Dal febbraio 2014 al marzo 2018 segretario Pd Toscana.","https://t.co/qCtEtxUQPo",FALSE,7479,2929,108,5208,2188,2012-05-22 20:21:16,FALSE,"https://t.co/qCtEtxUQPo","http://www.darioparrini.it",,"https://pbs.twimg.com/profile_banners/587802594/1538124588","http://abs.twimg.com/images/themes/theme1/bg.png","http://pbs.twimg.com/profile_images/1089849225607819264/yYFcG8QI_normal.jpg"
"x137288817","x1484089717670957062",2022-01-20 09:05:36,"SimoPillon","E così secondo Macron tra i fondamenti dell'Europa dovremmo annoverare l'aborto. 
No, monsieur le president, nella Costituzione europea andrebbero messe le radici cristiane che hanno fatto grande questo continente, e non i dogmi mortiferi del relativismo suicida e crepuscolare. https://t.co/8YEfXRIMWx","Twitter for iPhone",278,,,,FALSE,FALSE,39,13,,,,,,,,"http://pbs.twimg.com/media/FJiLuxrXMAQq0od.jpg","https://t.co/8YEfXRIMWx","https://twitter.com/SimoPillon/status/1484089717670957062/photo/1","photo","http://pbs.twimg.com/media/FJiLuxrXMAQq0od.jpg","https://t.co/8YEfXRIMWx","https://twitter.com/SimoPillon/status/1484089717670957062/photo/1",,,,"it",,,,,,,,,,,,,,,,,,,,,,,,,,,,,,,,,,,,,"NA NA","NA NA","NA NA NA NA NA NA NA NA","https://twitter.com/SimoPillon/status/1484089717670957062","Simone Pillon","Perugia","Marito, padre di 3 figli, avvocato cassazionista, già Presidente Forum Famiglie Umbria e cofondatore del Family Day. Senatore della #Lega.","https://t.co/6dder7smIE",FALSE,7703,453,55,858,233,2010-04-26 10:24:56,TRUE,"https://t.co/6dder7smIE","http://www.senato.it/leg/18/BGT/Schede/Attsen/00032690.htm",,"https://pbs.twimg.com/profile_banners/137288817/1520701434","http://abs.twimg.com/images/themes/theme1/bg.png","http://pbs.twimg.com/profile_images/1008224824613851136/KAG6sIFq_normal.jpg"
"x137288817","x1483866423202140168",2022-01-19 18:18:18,"SimoPillon","Oggi in aula sono intervenuto col ministro guardasigilli ricordando l’impegno della Lega con i referendum Giustizia, raccontando di padri, madri e nonne che non vedono più figli e nipoti dopo la separazione, e rappresentando l’urgenza di una moratoria contro l’utero in affitto. https://t.co/WvM7VY0nZt","Twitter for iPhone",278,,,,FALSE,FALSE,53,11,,,,,,,,"http://pbs.twimg.com/media/FJfApUTXIAAB0iZ.jpg","https://t.co/WvM7VY0nZt","https://twitter.com/SimoPillon/status/1483866423202140168/photo/1","photo","http://pbs.twimg.com/media/FJfApUTXIAAB0iZ.jpg","https://t.co/WvM7VY0nZt","https://twitter.com/SimoPillon/status/1483866423202140168/photo/1",,,,"it",,,,,,,,,,,,,,,,,,,,,,,,,,,,,,,,,,,,,"NA NA","NA NA","NA NA NA NA NA NA NA NA","https://twitter.com/SimoPillon/status/1483866423202140168","Simone Pillon","Perugia","Marito, padre di 3 figli, avvocato cassazionista, già Presidente Forum Famiglie Umbria e cofondatore del Family Day. Senatore della #Lega.","https://t.co/6dder7smIE",FALSE,7703,453,55,858,233,2010-04-26 10:24:56,TRUE,"https://t.co/6dder7smIE","http://www.senato.it/leg/18/BGT/Schede/Attsen/00032690.htm",,"https://pbs.twimg.com/profile_banners/137288817/1520701434","http://abs.twimg.com/images/themes/theme1/bg.png","http://pbs.twimg.com/profile_images/1008224824613851136/KAG6sIFq_normal.jpg"
"x102672182","x1483794603232931846",2022-01-19 13:32:55,"robertapinotti","Questa mattina al Comando Operativo di Vertice Interforze per la cerimonia di avvicendamento nella carica di Comandante. Al Gen. S.A. Frigerio il mio ringraziamento e al Gen. C.A. Figliuolo auguri di buon lavoro 🇮🇹 https://t.co/hzU6HxQArk","Twitter for iPhone",214,,,,FALSE,FALSE,15,4,,,,,,,,"http://pbs.twimg.com/media/FJd_U1GWYAETHAt.jpg","https://t.co/hzU6HxQArk","https://twitter.com/robertapinotti/status/1483794603232931846/photo/1","photo","http://pbs.twimg.com/media/FJd_U1GWYAETHAt.jpg http://pbs.twimg.com/media/FJd_U1MXsAcxWuo.jpg http://pbs.twimg.com/media/FJd_U1GWQAcsF7-.jpg http://pbs.twimg.com/media/FJd_U1HXoAMGF-U.jpg","https://t.co/hzU6HxQArk https://t.co/hzU6HxQArk https://t.co/hzU6HxQArk https://t.co/hzU6HxQArk","https://twitter.com/robertapinotti/status/1483794603232931846/photo/1 https://twitter.com/robertapinotti/status/1483794603232931846/photo/1 https://twitter.com/robertapinotti/status/1483794603232931846/photo/1 https://twitter.com/robertapinotti/status/1483794603232931846/photo/1",,,,"it",,,,,,,,,,,,,,,,,,,,,,,,,,,,,,,,,,,,,"NA NA","NA NA","NA NA NA NA NA NA NA NA","https://twitter.com/robertapinotti/status/1483794603232931846","Roberta Pinotti","","Senatrice del Partito Democratico","https://t.co/ZQoLx1Tx21",FALSE,123886,1765,760,11221,3640,2010-01-07 13:03:42,TRUE,"https://t.co/ZQoLx1Tx21","http://www.robertapinotti.it",,"https://pbs.twimg.com/profile_banners/102672182/1522225477","http://abs.twimg.com/images/themes/theme1/bg.png","http://pbs.twimg.com/profile_images/1093446366997684224/pnplPDaI_normal.jpg"
"x3062283743","x1484099476860157952",2022-01-20 09:44:23,"pirroelisa","@criptorob2 Le consiglio di moderare i termini e magari metterci la faccia se vuole insultare. Mi riservo di valutare opportune azioni… la mia dignità e onestà sono anni luce al di sopra di quanto lei possa comprendere","Twitter for iPhone",206,"x1483209121553948673","x1367327570245648384","criptorob2",FALSE,FALSE,0,0,,,,,,,,,,,,,,,,"x1367327570245648384","criptorob2","it",,,,,,,,,,,,,,,,,,,,,,,,,,,,,,,,,,,,,"NA NA","NA NA","NA NA NA NA NA NA NA NA","https://twitter.com/pirroelisa/status/1484099476860157952","Elisa Pirro","Orbassano, Piemonte","Senatrice della Repubblica @M5S_Senato @Mov5Stelle. Capogruppo della 12ª Commissione permanente (Igiene e Sanità) del Senato",,FALSE,1711,219,24,1702,5450,2015-02-25 15:22:04,TRUE,,,,"https://pbs.twimg.com/profile_banners/3062283743/1632556454","http://abs.twimg.com/images/themes/theme1/bg.png","http://pbs.twimg.com/profile_images/1453376367471570955/OAKjL3bH_normal.jpg"
"x3062283743","x1484073745186701313",2022-01-20 08:02:08,"pirroelisa","@Istva7 @mesoada @bavipi Riguardi la definizione di promessa… dire che non si ha la prospettiva di… e poi essere invitato a restare è completamente diverso dal dire “se perdo il referendum lascio la politica” e poi autocandidarsi nelle liste del senato. Differenza evidente se si ha onestà intellettuale","Twitter for iPhone",278,"x1483782336454041602","x1468877055236481032","Istva7",FALSE,FALSE,1,1,,,,,,,,,,,,,,,,"x1468877055236481032 x504305342 x27195745","Istva7 mesoada bavipi","it",,,,,,,,,,,,,,,,,,,,,,,,,,,,,,,,,,,,,"NA NA","NA NA","NA NA NA NA NA NA NA NA","https://twitter.com/pirroelisa/status/1484073745186701313","Elisa Pirro","Orbassano, Piemonte","Senatrice della Repubblica @M5S_Senato @Mov5Stelle. Capogruppo della 12ª Commissione permanente (Igiene e Sanità) del Senato",,FALSE,1711,219,24,1702,5450,2015-02-25 15:22:04,TRUE,,,,"https://pbs.twimg.com/profile_banners/3062283743/1632556454","http://abs.twimg.com/images/themes/theme1/bg.png","http://pbs.twimg.com/profile_images/1453376367471570955/OAKjL3bH_normal.jpg"
"x3062283743","x1484072389944168449",2022-01-20 07:56:45,"pirroelisa","@mesoada @bavipi @Istva7 Siamo alla riscrittura dei fatti… la stessa capacità di deformare la realtà del leader che cercate, invano, di difendere","Twitter for iPhone",120,"x1483870126516875264","x504305342","mesoada",FALSE,FALSE,1,0,,,,,,,,,,,,,,,,"x504305342 x27195745 x1468877055236481032","mesoada bavipi Istva7","it",,,,,,,,,,,,,,,,,,,,,,,,,,,,,,,,,,,,,"NA NA","NA NA","NA NA NA NA NA NA NA NA","https://twitter.com/pirroelisa/status/1484072389944168449","Elisa Pirro","Orbassano, Piemonte","Senatrice della Repubblica @M5S_Senato @Mov5Stelle. Capogruppo della 12ª Commissione permanente (Igiene e Sanità) del Senato",,FALSE,1711,219,24,1702,5450,2015-02-25 15:22:04,TRUE,,,,"https://pbs.twimg.com/profile_banners/3062283743/1632556454","http://abs.twimg.com/images/themes/theme1/bg.png","http://pbs.twimg.com/profile_images/1453376367471570955/OAKjL3bH_normal.jpg"
"x3062283743","x1483869338151133192",2022-01-19 18:29:53,"pirroelisa","@mesoada @bavipi @Istva7 Certo durante una pandemia che ha fermato anche il PIL della Cina. Su restiamo seri. Inoltre Conte è anche quello dei 209 miliardi del Recovery Plan","Twitter for iPhone",148,"x1483803645049249792","x504305342","mesoada",FALSE,FALSE,1,0,,,,,,,,,,,,,,,,"x504305342 x27195745 x1468877055236481032","mesoada bavipi Istva7","it",,,,,,,,,,,,,,,,,,,,,,,,,,,,,,,,,,,,,"NA NA","NA NA","NA NA NA NA NA NA NA NA","https://twitter.com/pirroelisa/status/1483869338151133192","Elisa Pirro","Orbassano, Piemonte","Senatrice della Repubblica @M5S_Senato @Mov5Stelle. Capogruppo della 12ª Commissione permanente (Igiene e Sanità) del Senato",,FALSE,1711,219,24,1702,5450,2015-02-25 15:22:04,TRUE,,,,"https://pbs.twimg.com/profile_banners/3062283743/1632556454","http://abs.twimg.com/images/themes/theme1/bg.png","http://pbs.twimg.com/profile_images/1453376367471570955/OAKjL3bH_normal.jpg"
"x3062283743","x1483778926723883010",2022-01-19 12:30:38,"pirroelisa","@Istva7 @mesoada @bavipi Come fraintendere un messaggio chiarissimo in politica… mette sei capo di un governo non puoi dire che stai lavorando per quello successivo…","Twitter for iPhone",140,"x1483758376395939844","x1468877055236481032","Istva7",FALSE,FALSE,1,0,,,,,,,,,,,,,,,,"x1468877055236481032 x504305342 x27195745","Istva7 mesoada bavipi","it",,,,,,,,,,,,,,,,,,,,,,,,,,,,,,,,,,,,,"NA NA","NA NA","NA NA NA NA NA NA NA NA","https://twitter.com/pirroelisa/status/1483778926723883010","Elisa Pirro","Orbassano, Piemonte","Senatrice della Repubblica @M5S_Senato @Mov5Stelle. Capogruppo della 12ª Commissione permanente (Igiene e Sanità) del Senato",,FALSE,1711,219,24,1702,5450,2015-02-25 15:22:04,TRUE,,,,"https://pbs.twimg.com/profile_banners/3062283743/1632556454","http://abs.twimg.com/images/themes/theme1/bg.png","http://pbs.twimg.com/profile_images/1453376367471570955/OAKjL3bH_normal.jpg"
