"x605614784","x1536387012554629122",2022-06-13 16:36:23,"ElioLannutti","Spiaggia di Punta Prosciutto (LE)
Giugno 2012: ombrellone+2 lettini 12€ (prima fila!)
Giugno 2022: 25€ (terza fila!) https://t.co/9jV33bwzxx","Twitter Web App",140,,,,FALSE,TRUE,0,8,,,,,,,,,,,,,,,,"x1092670394","spinax64","it",,,,,,,,,,,,,,,,"x1536329679774392328","Spiaggia di Punta Prosciutto (LE)
Giugno 2012: ombrellone+2 lettini 12€ (prima fila!)
Giugno 2022: 25€ (terza fila!) https://t.co/9jV33bwzxx",2022-06-13 12:48:33,"Twitter for iPhone",14,8,"x1092670394","spinax64","✨MIKE⭐️⭐️⭐️🤔⭐️🤔⭐️🤔",4225,1070,51995,"","Prima ti ignorano, poi ti deridono, poi ti combattono (poi ti copiano😏). Poi ci governi insieme😭",FALSE,,,,,,,"NA NA","NA NA","NA NA NA NA NA NA NA NA","https://twitter.com/ElioLannutti/status/1536387012554629122","Elio Lannutti","Roma, Lazio","Giornalista, scrittore, ex portavoce M5S Senato, 6^ Commissione Finanze; Antimafia; Commissione inchiesta banche","https://t.co/dM8TNmvnzl",FALSE,27530,3674,185,141802,54234,2012-06-11 17:58:09,FALSE,"https://t.co/dM8TNmvnzl","http://www.eliolannutti.it",,,"http://abs.twimg.com/images/themes/theme1/bg.png","http://pbs.twimg.com/profile_images/2746500033/8d046e016842a92a39f853fbfd0e1bc0_normal.png"
"x605614784","x1536386898402344960",2022-06-13 16:35:55,"ElioLannutti","A Dubai non c'è neanche @repubblica, per loro fortuna. https://t.co/NzxcpsR5Cw","Twitter Web App",92,,,,FALSE,TRUE,0,78,,,,,,,,"http://pbs.twimg.com/media/FVHEdgwWUAAWFDl.png","https://t.co/NzxcpsR5Cw","https://twitter.com/klaatu29/status/1536225035337310210/photo/1","photo","http://pbs.twimg.com/media/FVHEdgwWUAAWFDl.png","https://t.co/NzxcpsR5Cw","https://twitter.com/klaatu29/status/1536225035337310210/photo/1",,"x255581474 x18935802","klaatu29 repubblica","it",,,,,,,,,,,,,,,,"x1536225035337310210","A Dubai non c'è neanche @repubblica, per loro fortuna. https://t.co/NzxcpsR5Cw",2022-06-13 05:52:44,"Twitter Web App",999,78,"x255581474","klaatu29","Alternanza Nido-Lavoro - È il PIL che lo chiede",1031,887,45168,"","I should probably write something very smart here. Whatever.",FALSE,,,,,,,"NA NA","NA NA","NA NA NA NA NA NA NA NA","https://twitter.com/ElioLannutti/status/1536386898402344960","Elio Lannutti","Roma, Lazio","Giornalista, scrittore, ex portavoce M5S Senato, 6^ Commissione Finanze; Antimafia; Commissione inchiesta banche","https://t.co/dM8TNmvnzl",FALSE,27530,3674,185,141802,54234,2012-06-11 17:58:09,FALSE,"https://t.co/dM8TNmvnzl","http://www.eliolannutti.it",,,"http://abs.twimg.com/images/themes/theme1/bg.png","http://pbs.twimg.com/profile_images/2746500033/8d046e016842a92a39f853fbfd0e1bc0_normal.png"
"x605614784","x1536386852592271370",2022-06-13 16:35:45,"ElioLannutti","Le #SanzioniUe danneggiano solo l'#Ue e, nell'#Ue, soprattutto l'#Italia! https://t.co/Ics6etgll0","Twitter Web App",115,,,,FALSE,TRUE,0,10,,,"SanzioniUe Ue Ue Italia",,,,,"http://pbs.twimg.com/media/FVJE2jQXsAAMXuw.jpg","https://t.co/Ics6etgll0","https://twitter.com/nino_pitrone/status/1536366929014931457/photo/1","photo","http://pbs.twimg.com/media/FVJE2jQXsAAMXuw.jpg","https://t.co/Ics6etgll0","https://twitter.com/nino_pitrone/status/1536366929014931457/photo/1",,"x4892218558","nino_pitrone","it",,,,,,,,,,,,,,,,"x1536366929014931457","Le #SanzioniUe danneggiano solo l'#Ue e, nell'#Ue, soprattutto l'#Italia! https://t.co/Ics6etgll0",2022-06-13 15:16:34,"Twitter Web App",11,10,"x4892218558","nino_pitrone","Nino PITRONE",1196,592,91743,"Roma, Lazio","Cav. Uff. Repubblica Italiana,
Dottore in Giurisprudenza e Scienze politiche,
Pensionato Funzione Pubblica Europea",FALSE,,,,,,,"NA NA","NA NA","NA NA NA NA NA NA NA NA","https://twitter.com/ElioLannutti/status/1536386852592271370","Elio Lannutti","Roma, Lazio","Giornalista, scrittore, ex portavoce M5S Senato, 6^ Commissione Finanze; Antimafia; Commissione inchiesta banche","https://t.co/dM8TNmvnzl",FALSE,27530,3674,185,141802,54234,2012-06-11 17:58:09,FALSE,"https://t.co/dM8TNmvnzl","http://www.eliolannutti.it",,,"http://abs.twimg.com/images/themes/theme1/bg.png","http://pbs.twimg.com/profile_images/2746500033/8d046e016842a92a39f853fbfd0e1bc0_normal.png"
"x605614784","x1536386765010903041",2022-06-13 16:35:24,"ElioLannutti","@fattoquotidiano Tra una Fusa(ni) di quà e Petu-là, procede a passo spedito la deriva culturale italiana all'interno dei media.","Twitter Web App",140,,,,FALSE,TRUE,0,3,,,,,,,,,,,,,,,,"x1000480351905632258 x52424550","MarceVann fattoquotidiano","it",,,,,,,,,,,,,,,,"x1536359530665234432","@fattoquotidiano Tra una Fusa(ni) di quà e Petu-là, procede a passo spedito la deriva culturale italiana all'interno dei media.",2022-06-13 14:47:10,"Twitter for Android",6,3,"x1000480351905632258","MarceVann","Marce〰️Vann〰️",4044,3583,392270,"Far from EU","Se ci pungete, non sanguiniamo, e se ci fate il solletico, non ridiamo? Se ci avvelenate, non moriamo? E se ci fate torto, non ci vendicheremo?",FALSE,,,,,,,"NA NA","NA NA","NA NA NA NA NA NA NA NA","https://twitter.com/ElioLannutti/status/1536386765010903041","Elio Lannutti","Roma, Lazio","Giornalista, scrittore, ex portavoce M5S Senato, 6^ Commissione Finanze; Antimafia; Commissione inchiesta banche","https://t.co/dM8TNmvnzl",FALSE,27530,3674,185,141802,54234,2012-06-11 17:58:09,FALSE,"https://t.co/dM8TNmvnzl","http://www.eliolannutti.it",,,"http://abs.twimg.com/images/themes/theme1/bg.png","http://pbs.twimg.com/profile_images/2746500033/8d046e016842a92a39f853fbfd0e1bc0_normal.png"
"x605614784","x1536386698858450945",2022-06-13 16:35:08,"ElioLannutti","Referendum giustizia, lite Fusani-Pedullà (La Notizia) su La7. “Con questo flop abbiamo perso tutti”. “Non è vero, erano una truffa” https://t.co/Fjh3UstMQU","Twitter Web App",140,,,,FALSE,TRUE,0,19,,,,,,,,,,,,,,,,"x52424550","fattoquotidiano","it",,,,,,,,,,,,,,,,"x1536352711154737153","Referendum giustizia, lite Fusani-Pedullà (La Notizia) su La7. “Con questo flop abbiamo perso tutti”. “Non è vero, erano una truffa” https://t.co/Fjh3UstMQU",2022-06-13 14:20:05,"Il Fatto Quotidiano Post",71,19,"x52424550","fattoquotidiano","Il Fatto Quotidiano",2161652,6524,221800,"Roma e Milano","Il Fatto Quotidiano in edicola a un prezzo speciale. Scegli la formula su misura per te! https://t.co/Cpa4qy7lop",TRUE,,,,,,,"NA NA","NA NA","NA NA NA NA NA NA NA NA","https://twitter.com/ElioLannutti/status/1536386698858450945","Elio Lannutti","Roma, Lazio","Giornalista, scrittore, ex portavoce M5S Senato, 6^ Commissione Finanze; Antimafia; Commissione inchiesta banche","https://t.co/dM8TNmvnzl",FALSE,27530,3674,185,141802,54234,2012-06-11 17:58:09,FALSE,"https://t.co/dM8TNmvnzl","http://www.eliolannutti.it",,,"http://abs.twimg.com/images/themes/theme1/bg.png","http://pbs.twimg.com/profile_images/2746500033/8d046e016842a92a39f853fbfd0e1bc0_normal.png"
"x605614784","x1536386599092736006",2022-06-13 16:34:44,"ElioLannutti","“Che in Italia serva una riforma della #giustizia è un dato che non si può più ignorare. Serve per ridare autorevolezza ad una #magistratura ammaccata nella immagine dallo strapotere delle correnti. 
#italianinews #news #informazione  https://t.co/9WTPXUa4gh","Twitter Web App",139,,,,FALSE,TRUE,0,34,,,"giustizia",,,,,,,,,,,,,"x1513919369679720459","Italiani_news","it",,,,,,,,,,,,,,,,"x1536361959553114113","“Che in Italia serva una riforma della #giustizia è un dato che non si può più ignorare. Serve per ridare autorevolezza ad una #magistratura ammaccata nella immagine dallo strapotere delle correnti. 
#italianinews #news #informazione  https://t.co/9WTPXUa4gh",2022-06-13 14:56:50,"Twitter Web App",122,34,"x1513919369679720459","Italiani_news","ITALIANI NEWS",1277,76,369,"Italia","Italiani News Informazione per Expat e per chi vuole restare aggiornato. Curiosita' dal Mondo delle News 📰",FALSE,,,,,,,"NA NA","NA NA","NA NA NA NA NA NA NA NA","https://twitter.com/ElioLannutti/status/1536386599092736006","Elio Lannutti","Roma, Lazio","Giornalista, scrittore, ex portavoce M5S Senato, 6^ Commissione Finanze; Antimafia; Commissione inchiesta banche","https://t.co/dM8TNmvnzl",FALSE,27530,3674,185,141802,54234,2012-06-11 17:58:09,FALSE,"https://t.co/dM8TNmvnzl","http://www.eliolannutti.it",,,"http://abs.twimg.com/images/themes/theme1/bg.png","http://pbs.twimg.com/profile_images/2746500033/8d046e016842a92a39f853fbfd0e1bc0_normal.png"
"x605614784","x1536386512174161921",2022-06-13 16:34:23,"ElioLannutti","L’ineffabile Claudia Fusani sui referendum: “ Con il flop abbiamo perso tutti”. Tutti chi? I cittadini si sono espressi in maniera inequivocabile e hanno detto no, È quindi?
E cosa avremmo perso, l’impunità per i politici certificata da un","Twitter Web App",140,,,,FALSE,TRUE,0,46,,,,,,,,,,,,,,,,"x1876212612","erretti42","it",,,,,,,,,,,,,,,,"x1536382671777153025","L’ineffabile Claudia Fusani sui referendum: “ Con il flop abbiamo perso tutti”. Tutti chi? I cittadini si sono espressi in maniera inequivocabile e hanno detto no, È quindi?
E cosa avremmo perso, l’impunità per i politici certificata da un",2022-06-13 16:19:08,"Twitter for iPad",163,46,"x1876212612","erretti42","giuliana sparano",9068,5691,176201,"","- Eh ! qu'aimes-tu donc, extraordinaire étranger ? - J'aime les nuages... les nuages qui passent... là-bas... là-bas... les merveilleux nuages !""",FALSE,,,,,,,"NA NA","NA NA","NA NA NA NA NA NA NA NA","https://twitter.com/ElioLannutti/status/1536386512174161921","Elio Lannutti","Roma, Lazio","Giornalista, scrittore, ex portavoce M5S Senato, 6^ Commissione Finanze; Antimafia; Commissione inchiesta banche","https://t.co/dM8TNmvnzl",FALSE,27530,3674,185,141802,54234,2012-06-11 17:58:09,FALSE,"https://t.co/dM8TNmvnzl","http://www.eliolannutti.it",,,"http://abs.twimg.com/images/themes/theme1/bg.png","http://pbs.twimg.com/profile_images/2746500033/8d046e016842a92a39f853fbfd0e1bc0_normal.png"
"x605614784","x1536386377948008449",2022-06-13 16:33:51,"ElioLannutti","Capito come ci perculano... E noi zitti e buoni. E no caxxo! Per la serie: ""Io spaccio, mica mi drogo.""
#COVID19 #covid #coronavirus #vaccini https://t.co/SehvfBJg5q","Twitter Web App",140,,,,FALSE,TRUE,0,21,,,"COVID19 covid",,,,,,,,,,,,,"x230775930","RAMIEL81","it",,,,,,,,,,,,,,,,"x1535670435362353154","Capito come ci perculano... E noi zitti e buoni. E no caxxo! Per la serie: ""Io spaccio, mica mi drogo.""
#COVID19 #covid #coronavirus #vaccini https://t.co/SehvfBJg5q",2022-06-11 17:08:57,"Twitter Web App",27,21,"x230775930","RAMIEL81","Ramiel",38,27,5137,"","Amaro e noia la vita, altro mai nulla; e fango è il mondo.",FALSE,,,,,,,"NA NA","NA NA","NA NA NA NA NA NA NA NA","https://twitter.com/ElioLannutti/status/1536386377948008449","Elio Lannutti","Roma, Lazio","Giornalista, scrittore, ex portavoce M5S Senato, 6^ Commissione Finanze; Antimafia; Commissione inchiesta banche","https://t.co/dM8TNmvnzl",FALSE,27530,3674,185,141802,54234,2012-06-11 17:58:09,FALSE,"https://t.co/dM8TNmvnzl","http://www.eliolannutti.it",,,"http://abs.twimg.com/images/themes/theme1/bg.png","http://pbs.twimg.com/profile_images/2746500033/8d046e016842a92a39f853fbfd0e1bc0_normal.png"
"x605614784","x1536386227468910592",2022-06-13 16:33:15,"ElioLannutti","Situazione di para-schiavitù e contratti irregolari, caporalato è piaga europea. Italia? Preoccupa il lavoro grigio”: il rapporto di Terra!
https://t.co/9a9nkRYvnO
Ministero della schiavitù moderna. https://t.co/pdRWSzqjYi","Twitter Web App",139,,,,FALSE,TRUE,0,3,,,,,,,,,,,,,,,,"x1448557296","microcerotis","it",,,,,,,,,,,,,,,,"x1536311027632963585","Situazione di para-schiavitù e contratti irregolari, caporalato è piaga europea. Italia? Preoccupa il lavoro grigio”: il rapporto di Terra!
https://t.co/9a9nkRYvnO
Ministero della schiavitù moderna. https://t.co/pdRWSzqjYi",2022-06-13 11:34:26,"Twitter Web App",2,3,"x1448557296","microcerotis","Franca",396,258,47291,"","",FALSE,,,,,,,"NA NA","NA NA","NA NA NA NA NA NA NA NA","https://twitter.com/ElioLannutti/status/1536386227468910592","Elio Lannutti","Roma, Lazio","Giornalista, scrittore, ex portavoce M5S Senato, 6^ Commissione Finanze; Antimafia; Commissione inchiesta banche","https://t.co/dM8TNmvnzl",FALSE,27530,3674,185,141802,54234,2012-06-11 17:58:09,FALSE,"https://t.co/dM8TNmvnzl","http://www.eliolannutti.it",,,"http://abs.twimg.com/images/themes/theme1/bg.png","http://pbs.twimg.com/profile_images/2746500033/8d046e016842a92a39f853fbfd0e1bc0_normal.png"
"x605614784","x1536386157453447177",2022-06-13 16:32:59,"ElioLannutti","Ciao Darwin, l'accusa di Gabriele Marchetti rimasto tetraplegico dopo l'incidente al gioco dei rulli: «Bonolis non mi ha mai cercato» https://t.co/8WLLhB9zFq @ilmessaggeroit","Twitter Web App",173,,,,FALSE,FALSE,0,2,,,,,"ilmessaggero.it/persone/gabrie…","https://t.co/8WLLhB9zFq","https://www.ilmessaggero.it/persone/gabriele_marchetti_tetraplegico_ciao_darwin_accuse_paolo_bonolis_non_mi_ha_cercato_ultime_notizie-6750305.html",,,,,,,,,"x36079217","ilmessaggeroit","it",,,,,,,,,,,,,,,,,,,,,,,,,,,,,,,,,,,,,"NA NA","NA NA","NA NA NA NA NA NA NA NA","https://twitter.com/ElioLannutti/status/1536386157453447177","Elio Lannutti","Roma, Lazio","Giornalista, scrittore, ex portavoce M5S Senato, 6^ Commissione Finanze; Antimafia; Commissione inchiesta banche","https://t.co/dM8TNmvnzl",FALSE,27530,3674,185,141802,54234,2012-06-11 17:58:09,FALSE,"https://t.co/dM8TNmvnzl","http://www.eliolannutti.it",,,"http://abs.twimg.com/images/themes/theme1/bg.png","http://pbs.twimg.com/profile_images/2746500033/8d046e016842a92a39f853fbfd0e1bc0_normal.png"
"x605614784","x1536385116137717773",2022-06-13 16:28:50,"ElioLannutti","@CinziaSally Chissà se ricordano la fine dei pifferi di montagna…","Twitter Web App",52,"x1536272229645836288","x990487487125520385","CinziaSally",FALSE,FALSE,3,0,,,,,,,,,,,,,,,,"x990487487125520385","CinziaSally","it",,,,,,,,,,,,,,,,,,,,,,,,,,,,,,,,,,,,,"NA NA","NA NA","NA NA NA NA NA NA NA NA","https://twitter.com/ElioLannutti/status/1536385116137717773","Elio Lannutti","Roma, Lazio","Giornalista, scrittore, ex portavoce M5S Senato, 6^ Commissione Finanze; Antimafia; Commissione inchiesta banche","https://t.co/dM8TNmvnzl",FALSE,27530,3674,185,141802,54234,2012-06-11 17:58:09,FALSE,"https://t.co/dM8TNmvnzl","http://www.eliolannutti.it",,,"http://abs.twimg.com/images/themes/theme1/bg.png","http://pbs.twimg.com/profile_images/2746500033/8d046e016842a92a39f853fbfd0e1bc0_normal.png"
"x605614784","x1536384881437069312",2022-06-13 16:27:55,"ElioLannutti","Il punto 1 è meraviglioso...⤵️⤵️⤵️ https://t.co/dLcCKv7kZU","Twitter Web App",75,,,,FALSE,TRUE,0,27,,,,,,,,"http://pbs.twimg.com/media/FVHvc1iX0AEm598.jpg","https://t.co/dLcCKv7kZU","https://twitter.com/CinziaSally/status/1536272229645836288/photo/1","photo","http://pbs.twimg.com/media/FVHvc1iX0AEm598.jpg","https://t.co/dLcCKv7kZU","https://twitter.com/CinziaSally/status/1536272229645836288/photo/1",,"x990487487125520385","CinziaSally","it",,,,,,,,,,,,,,,,"x1536272229645836288","Il punto 1 è meraviglioso...⤵️⤵️⤵️ https://t.co/dLcCKv7kZU",2022-06-13 09:00:16,"Twitter for Android",87,27,"x990487487125520385","CinziaSally","cinzia🧽666",1318,892,145592,"Milano, Lombardia","",FALSE,,,,,,,"NA NA","NA NA","NA NA NA NA NA NA NA NA","https://twitter.com/ElioLannutti/status/1536384881437069312","Elio Lannutti","Roma, Lazio","Giornalista, scrittore, ex portavoce M5S Senato, 6^ Commissione Finanze; Antimafia; Commissione inchiesta banche","https://t.co/dM8TNmvnzl",FALSE,27530,3674,185,141802,54234,2012-06-11 17:58:09,FALSE,"https://t.co/dM8TNmvnzl","http://www.eliolannutti.it",,,"http://abs.twimg.com/images/themes/theme1/bg.png","http://pbs.twimg.com/profile_images/2746500033/8d046e016842a92a39f853fbfd0e1bc0_normal.png"
"x605614784","x1536384729259380737",2022-06-13 16:27:18,"ElioLannutti","Davvero pensavate che interessasse alla gente far rientrare i condannati in parlamento ed eliminare la custodia cautelare per i colletti bianchi? Questi sarebbero i ""diritti dei cittadini""? Dovreste solo vergognarvi anche solo a pensarlo un referendum del genere.","Twitter Web App",140,,,,FALSE,TRUE,0,100,,,,,,,,,,,,,,,,"x113050526","sibilla75","it",,,,,,,,,,,,,,,,"x1536234550061412352","Davvero pensavate che interessasse alla gente far rientrare i condannati in parlamento ed eliminare la custodia cautelare per i colletti bianchi? Questi sarebbero i ""diritti dei cittadini""? Dovreste solo vergognarvi anche solo a pensarlo un referendum del genere.",2022-06-13 06:30:33,"Twitter for Android",433,100,"x113050526","sibilla75","Simona Urso🧽777",4031,3659,67894,"Torino,Piedmont, Italy","La Urso senza D. 
Copywriter. 
Si fanno crowdfunding per ogni cosa e ho deciso di farlo per la mia personale causa e sofferenza. 
https://t.co/5Ow5PzObWr",FALSE,,,,,,,"NA NA","NA NA","NA NA NA NA NA NA NA NA","https://twitter.com/ElioLannutti/status/1536384729259380737","Elio Lannutti","Roma, Lazio","Giornalista, scrittore, ex portavoce M5S Senato, 6^ Commissione Finanze; Antimafia; Commissione inchiesta banche","https://t.co/dM8TNmvnzl",FALSE,27530,3674,185,141802,54234,2012-06-11 17:58:09,FALSE,"https://t.co/dM8TNmvnzl","http://www.eliolannutti.it",,,"http://abs.twimg.com/images/themes/theme1/bg.png","http://pbs.twimg.com/profile_images/2746500033/8d046e016842a92a39f853fbfd0e1bc0_normal.png"
"x605614784","x1536384715384561665",2022-06-13 16:27:15,"ElioLannutti","La legge Severino fu approvata il 31 ottobre 2012 con una maggioranza larghissima: 480 sì, 19 no e 25 astenuti.
Come mai adesso non va più bene? 
Ci dovrà pur essere un motivo.","Twitter Web App",140,,,,FALSE,TRUE,0,81,,,,,,,,,,,,,,,,"x432516884","Moonlightshad1","it",,,,,,,,,,,,,,,,"x1536381895402987520","La legge Severino fu approvata il 31 ottobre 2012 con una maggioranza larghissima: 480 sì, 19 no e 25 astenuti.
Come mai adesso non va più bene? 
Ci dovrà pur essere un motivo.",2022-06-13 16:16:03,"Twitter Web App",463,81,"x432516884","Moonlightshad1","Cristina Correani",19264,4941,140787,"Nei pressi di Roma","Ho imparato tanto tempo fa a non fare lotta con i maiali. 
Ti sporchi tutto e, soprattutto, ai maiali piace.
*George Bernard Shaw*",FALSE,,,,,,,"NA NA","NA NA","NA NA NA NA NA NA NA NA","https://twitter.com/ElioLannutti/status/1536384715384561665","Elio Lannutti","Roma, Lazio","Giornalista, scrittore, ex portavoce M5S Senato, 6^ Commissione Finanze; Antimafia; Commissione inchiesta banche","https://t.co/dM8TNmvnzl",FALSE,27530,3674,185,141802,54234,2012-06-11 17:58:09,FALSE,"https://t.co/dM8TNmvnzl","http://www.eliolannutti.it",,,"http://abs.twimg.com/images/themes/theme1/bg.png","http://pbs.twimg.com/profile_images/2746500033/8d046e016842a92a39f853fbfd0e1bc0_normal.png"
"x605614784","x1536379779590627331",2022-06-13 16:07:38,"ElioLannutti","Ventotene, la candidatura di Mario Adinolfi è un flop clamoroso: zero voti ricevuti https://t.co/LVQTa0SWEW","Twitter Web App",107,,,,FALSE,FALSE,17,10,,,,,"iltempo.it/politica/2022/…","https://t.co/LVQTa0SWEW","https://www.iltempo.it/politica/2022/06/13/news/mario-adinolfi-ventotene-zero-voti-elezioni-amministrative-2022-flop-sindaco-caputo-gay-31995060/#.Yqdgt1YpvvE.twitter",,,,,,,,,,,"it",,,,,,,,,,,,,,,,,,,,,,,,,,,,,,,,,,,,,"NA NA","NA NA","NA NA NA NA NA NA NA NA","https://twitter.com/ElioLannutti/status/1536379779590627331","Elio Lannutti","Roma, Lazio","Giornalista, scrittore, ex portavoce M5S Senato, 6^ Commissione Finanze; Antimafia; Commissione inchiesta banche","https://t.co/dM8TNmvnzl",FALSE,27530,3674,185,141802,54234,2012-06-11 17:58:09,FALSE,"https://t.co/dM8TNmvnzl","http://www.eliolannutti.it",,,"http://abs.twimg.com/images/themes/theme1/bg.png","http://pbs.twimg.com/profile_images/2746500033/8d046e016842a92a39f853fbfd0e1bc0_normal.png"
"x605614784","x1536379425310253063",2022-06-13 16:06:14,"ElioLannutti","I ""legittimati""
Dai loro frutti li riconoscete.
Tagli alla SANITA' https://t.co/kjIRwuZzMb","Twitter Web App",108,,,,FALSE,TRUE,0,10,,,,,,,,"http://pbs.twimg.com/media/FVIIMj2WYAIDxEm.jpg","https://t.co/kjIRwuZzMb","https://twitter.com/microcerotis/status/1536299773678039042/photo/1","photo","http://pbs.twimg.com/media/FVIIMj2WYAIDxEm.jpg","https://t.co/kjIRwuZzMb","https://twitter.com/microcerotis/status/1536299773678039042/photo/1",,"x1448557296","microcerotis","it",,,,,,,,,,,,,,,,"x1536299773678039042","I ""legittimati""
Dai loro frutti li riconoscete.
Tagli alla SANITA' https://t.co/kjIRwuZzMb",2022-06-13 10:49:43,"Twitter Web App",14,10,"x1448557296","microcerotis","Franca",396,258,47291,"","",FALSE,,,,,,,"NA NA","NA NA","NA NA NA NA NA NA NA NA","https://twitter.com/ElioLannutti/status/1536379425310253063","Elio Lannutti","Roma, Lazio","Giornalista, scrittore, ex portavoce M5S Senato, 6^ Commissione Finanze; Antimafia; Commissione inchiesta banche","https://t.co/dM8TNmvnzl",FALSE,27530,3674,185,141802,54234,2012-06-11 17:58:09,FALSE,"https://t.co/dM8TNmvnzl","http://www.eliolannutti.it",,,"http://abs.twimg.com/images/themes/theme1/bg.png","http://pbs.twimg.com/profile_images/2746500033/8d046e016842a92a39f853fbfd0e1bc0_normal.png"
"x605614784","x1536379215637057537",2022-06-13 16:05:24,"ElioLannutti","Zona Bianca, Michele Santoro e lo schiaffo al governo: “Completamente accodati a Usa e Nato” https://t.co/ChLWLFUvxV","Twitter Web App",116,,,,FALSE,FALSE,7,0,,,,,"iltempo.it/personaggi/202…","https://t.co/ChLWLFUvxV","https://www.iltempo.it/personaggi/2022/06/13/news/michele-santoro-governo-italia-armi-nato-usa-russia-alleanza-accodati-armi-missili-zona-bianca-31994087/#.YqdgNfoXvZo.twitter",,,,,,,,,,,"it",,,,,,,,,,,,,,,,,,,,,,,,,,,,,,,,,,,,,"NA NA","NA NA","NA NA NA NA NA NA NA NA","https://twitter.com/ElioLannutti/status/1536379215637057537","Elio Lannutti","Roma, Lazio","Giornalista, scrittore, ex portavoce M5S Senato, 6^ Commissione Finanze; Antimafia; Commissione inchiesta banche","https://t.co/dM8TNmvnzl",FALSE,27530,3674,185,141802,54234,2012-06-11 17:58:09,FALSE,"https://t.co/dM8TNmvnzl","http://www.eliolannutti.it",,,"http://abs.twimg.com/images/themes/theme1/bg.png","http://pbs.twimg.com/profile_images/2746500033/8d046e016842a92a39f853fbfd0e1bc0_normal.png"
"x1087397733428850691","x1536282255659876352",2022-06-13 09:40:07,"LeoneM5s","Questo lunedì - 13 Giugno - alle 15.00 a #Ncuc insieme a Valentina Cicirello, Vicepresidente dell’associazione @lifeandlifeonlus, parleremo del contrasto della violenza di genere, inoltre ci condividerà la loro esperienza e l’impegno sul territorio di Palermo e provincia. https://t.co/aWHil99oNS","Twitter for iPhone",272,,,,FALSE,FALSE,0,0,,,"Ncuc",,,,,"http://pbs.twimg.com/media/FVH4kQdXwAQMard.jpg","https://t.co/aWHil99oNS","https://twitter.com/LeoneM5s/status/1536282255659876352/photo/1","photo","http://pbs.twimg.com/media/FVH4kQdXwAQMard.jpg","https://t.co/aWHil99oNS","https://twitter.com/LeoneM5s/status/1536282255659876352/photo/1",,,,"it",,,,,,,,,,,,,,,,,,,,,,,,,,,,,,,,,,,,,"NA NA","NA NA","NA NA NA NA NA NA NA NA","https://twitter.com/LeoneM5s/status/1536282255659876352","Cinzia Leone","Palermo, Sicilia","Senatrice della Repubblica - 
Vice Presidente Commissione parlamentare d'inchiesta sul femminicidio
- Membro 9ª Agricoltura","https://t.co/okRpkQ9bsf",FALSE,534,74,8,357,247,2019-01-21 17:13:17,TRUE,"https://t.co/okRpkQ9bsf","https://www.movimento5stelle.eu/",,"https://pbs.twimg.com/profile_banners/1087397733428850691/1601029203",,"http://pbs.twimg.com/profile_images/1300386391654838273/T3XmV6Tt_normal.jpg"
"x1056888359543603201","x1536273923293204482",2022-06-13 09:07:00,"LomutiArnaldo","https://t.co/Wj9jX71AcJ","Twitter Web App",23,,,,FALSE,FALSE,0,0,,,,,"ilmattinoquotidiano.it/news/basilicat…","https://t.co/Wj9jX71AcJ","https://www.ilmattinoquotidiano.it/news/basilicata-free/61671/referendum-il-punto-di-lomuti-ovviamente-5-no-a-parte-severino-e-custodia-cautelare.html",,,,,,,,,,,"und",,,,,,,,,,,,,,,,,,,,,,,,,,,,,,,,,,,,,"NA NA","NA NA","NA NA NA NA NA NA NA NA","https://twitter.com/LomutiArnaldo/status/1536273923293204482","Arnaldo Lomuti","","Senatore della Repubblica","https://t.co/3RKnJT0Cjs",FALSE,188,59,8,300,23,2018-10-29 12:39:55,FALSE,"https://t.co/3RKnJT0Cjs","https://www.ilblogdellestelle.it",,"https://pbs.twimg.com/profile_banners/1056888359543603201/1592479756",,"http://pbs.twimg.com/profile_images/1491070298464083968/0gAkY4hr_normal.jpg"
"x2330261468","x1536345212204752896",2022-06-13 13:50:17,"sfnlcd","Grazie ai 10 milioni di italiani che hanno scelto di votare per cambiare la Giustizia. È nostro dovere continuare a far sentire la loro voce!","Twitter for iPhone",140,,,,FALSE,TRUE,0,218,,,,,,,,,,,,,,,,"x270839361","matteosalvinimi","it",,,,,,,,,,,,,,,,"x1536109042107568128","Grazie ai 10 milioni di italiani che hanno scelto di votare per cambiare la Giustizia. È nostro dovere continuare a far sentire la loro voce!",2022-06-12 22:11:49,"Twitter for iPhone",1923,218,"x270839361","matteosalvinimi","Matteo Salvini",1476292,2008,53109,"","Leader della Lega #primagliitaliani 🇮🇹",TRUE,,,,,,,"NA NA","NA NA","NA NA NA NA NA NA NA NA","https://twitter.com/sfnlcd/status/1536345212204752896","Stefano Lucidi","Roma, Lazio","Senatore","https://t.co/x79emJQpZk",FALSE,1551,337,49,6064,3467,2014-02-06 13:02:04,TRUE,"https://t.co/x79emJQpZk","http://www.senato.it/leg/18/BGT/Schede/Attsen/00029123.htm",,"https://pbs.twimg.com/profile_banners/2330261468/1623051634","http://abs.twimg.com/images/themes/theme1/bg.png","http://pbs.twimg.com/profile_images/1456744656239214595/XhKEgQvJ_normal.jpg"
