"x919526072","x1532328282275946496",2022-06-02 11:48:26,"LucioMalan","Happy 92nd Birthday To Me 🎂🎂🥂 https://t.co/mUPg6mRu03","Twitter for iPhone",72,,,,FALSE,TRUE,0,34563,,,,,,,,"http://pbs.twimg.com/media/FUKhCqSWQAgpG0S.jpg","https://t.co/mUPg6mRu03","https://twitter.com/ClintEastwoo_/status/1531963902749286404/photo/1","photo","http://pbs.twimg.com/media/FUKhCqSWQAgpG0S.jpg","https://t.co/mUPg6mRu03","https://twitter.com/ClintEastwoo_/status/1531963902749286404/photo/1",,"x1484172275070869508","ClintEastwoo_","en",,,,,,,,,,,,,,,,"x1531963902749286404","Happy 92nd Birthday To Me 🎂🎂🥂 https://t.co/mUPg6mRu03",2022-06-01 11:40:31,"Twitter for iPhone",438079,34563,"x1484172275070869508","ClintEastwoo_","Clint Eastwood",37570,52,1441,"Carmel-by-the-sea Ca, USA","The official Twitter account of Clint Eastwood. American Actor, Filmmaker, Businessman and Politician. https://t.co/PmEUyqGwBj",FALSE,,,,,,,"NA NA","NA NA","NA NA NA NA NA NA NA NA","https://twitter.com/LucioMalan/status/1532328282275946496","Lucio Malan","Italia","Senatore Fratelli d'Italia. “Chi è disposto a perdere libertà fondamentale in cambio di temporanea sicurezza, non merita, e non avrà, né libertà né sicurezza.”","https://t.co/KZCpB50DyP",FALSE,22495,4358,144,36649,12530,2012-11-01 17:48:51,FALSE,"https://t.co/KZCpB50DyP","http://www.luciomalan.it",,"https://pbs.twimg.com/profile_banners/919526072/1636186892","http://abs.twimg.com/images/themes/theme1/bg.png","http://pbs.twimg.com/profile_images/1456899523222069249/i60vvKs__normal.jpg"
"x526777254","x1532637602242756609",2022-06-03 08:17:34,"mantolalla","Amici di #Parma 
Giovedì 16 giugno, presso l’Hotel Villa Ducale, via del Popolo 81, a PARMA.
Dalle ore 18.45 alle ore 20.30.
Parleremo dei risultati raggiunti nel #Parlamento, ma anche del territorio.
È necessario registrarsi questo link: https://t.co/tjdiBsIm5w https://t.co/4JiAfl67zR","Twitter Web App",262,,,,FALSE,FALSE,0,0,,,"Parma Parlamento",,"forms.gle/Wgg9pWhHZP38ZB…","https://t.co/tjdiBsIm5w","https://forms.gle/Wgg9pWhHZP38ZBYW9","http://pbs.twimg.com/media/FUUE8zdXoAIxdgb.jpg","https://t.co/4JiAfl67zR","https://twitter.com/mantolalla/status/1532637602242756609/photo/1","photo","http://pbs.twimg.com/media/FUUE8zdXoAIxdgb.jpg","https://t.co/4JiAfl67zR","https://twitter.com/mantolalla/status/1532637602242756609/photo/1",,,,"it",,,,,,,,,,,,,,,,,,,,,,,,,,,,,,,,,,,,,"NA NA","NA NA","NA NA NA NA NA NA NA NA","https://twitter.com/mantolalla/status/1532637602242756609","Maria Laura Mantovani ⭐️⭐️⭐️⭐️⭐️","Carpi, Emilia Romagna","Cittadina eletta al Senato per il MoVimento 5 Stelle","https://t.co/v8J5GPClXN",FALSE,694,363,11,3355,499,2012-03-16 20:44:02,FALSE,"https://t.co/v8J5GPClXN","https://marialauramantovani.it",,"https://pbs.twimg.com/profile_banners/526777254/1528469923","http://abs.twimg.com/images/themes/theme1/bg.png","http://pbs.twimg.com/profile_images/1190749518721167361/8e8KnoXg_normal.jpg"
"x526777254","x1532636581697290240",2022-06-03 08:13:30,"mantolalla","Ecco perché sosteniamo il #Superbonus110%
@MinisterodelLavoro, @BancadItalia e @ANPAL confermano l’importante contributo che la nostra misura ha dato alla ripresa dell’occupazione nel settore delle costruzioni, insieme alla ripartenza delle opere pubbliche. #Superbonus https://t.co/X8QMkdHoTS","Twitter Web App",269,,,,FALSE,FALSE,1,0,,,"Superbonus110 Superbonus",,,,,"http://pbs.twimg.com/media/FUUEAUyWQAEovNk.jpg","https://t.co/X8QMkdHoTS","https://twitter.com/mantolalla/status/1532636581697290240/photo/1","photo","http://pbs.twimg.com/media/FUUEAUyWQAEovNk.jpg","https://t.co/X8QMkdHoTS","https://twitter.com/mantolalla/status/1532636581697290240/photo/1",,"x781801333313662976 x14713548","bancaditalia anpal","it",,,,,,,,,,,,,,,,,,,,,,,,,,,,,,,,,,,,,"NA NA","NA NA","NA NA NA NA NA NA NA NA","https://twitter.com/mantolalla/status/1532636581697290240","Maria Laura Mantovani ⭐️⭐️⭐️⭐️⭐️","Carpi, Emilia Romagna","Cittadina eletta al Senato per il MoVimento 5 Stelle","https://t.co/v8J5GPClXN",FALSE,694,363,11,3355,499,2012-03-16 20:44:02,FALSE,"https://t.co/v8J5GPClXN","https://marialauramantovani.it",,"https://pbs.twimg.com/profile_banners/526777254/1528469923","http://abs.twimg.com/images/themes/theme1/bg.png","http://pbs.twimg.com/profile_images/1190749518721167361/8e8KnoXg_normal.jpg"
"x526777254","x1532340200277430273",2022-06-02 12:35:47,"mantolalla","“L'Italia è una Repubblica democratica, fondata sul lavoro”. Il monito con cui si apre la nostra Carta costituzionale non deve mai smettere di guidarci.","Twitter for iPhone",139,,,,FALSE,TRUE,0,224,,,,,,,,,,,,,,,,"x999578121123848192","GiuseppeConteIT","it",,,,,,,,,,,,,,,,"x1532335560014151680","“L'Italia è una Repubblica democratica, fondata sul lavoro”. Il monito con cui si apre la nostra Carta costituzionale non deve mai smettere di guidarci.",2022-06-02 12:17:21,"Twitter for iPhone",1522,224,"x999578121123848192","GiuseppeConteIT","Giuseppe Conte",1101158,142,2001,"","Giurista e Avvocato. Professore ordinario di diritto privato. Papà di Niccolò. Presidente del Movimento 5 Stelle.",TRUE,,,,,,,"NA NA","NA NA","NA NA NA NA NA NA NA NA","https://twitter.com/mantolalla/status/1532340200277430273","Maria Laura Mantovani ⭐️⭐️⭐️⭐️⭐️","Carpi, Emilia Romagna","Cittadina eletta al Senato per il MoVimento 5 Stelle","https://t.co/v8J5GPClXN",FALSE,694,363,11,3355,499,2012-03-16 20:44:02,FALSE,"https://t.co/v8J5GPClXN","https://marialauramantovani.it",,"https://pbs.twimg.com/profile_banners/526777254/1528469923","http://abs.twimg.com/images/themes/theme1/bg.png","http://pbs.twimg.com/profile_images/1190749518721167361/8e8KnoXg_normal.jpg"
"x526777254","x1532306912422903809",2022-06-02 10:23:31,"mantolalla","È con emozione e gioia che vi comunico il Premio consegnato a due scuole reggiane, l’Istituto #GalvaniIodi di #ReggioEmilia e l’Istituto #Gobetti di #Scandiano, che vincono il concorso nazionale “Dalle aule parlamentari alle aule di scuola. @MIsocialTW @RaiTre @M5S_Senato https://t.co/NZGYEYxaMG","Twitter Web App",272,,,,FALSE,FALSE,2,0,,,"GalvaniIodi ReggioEmilia Gobetti Scandiano",,,,,"http://pbs.twimg.com/media/FUPYSbWWYAAhMOY.jpg","https://t.co/NZGYEYxaMG","https://twitter.com/mantolalla/status/1532306912422903809/photo/1","photo","http://pbs.twimg.com/media/FUPYSbWWYAAhMOY.jpg http://pbs.twimg.com/media/FUPYSbbXwAIzTca.jpg","https://t.co/NZGYEYxaMG https://t.co/NZGYEYxaMG","https://twitter.com/mantolalla/status/1532306912422903809/photo/1 https://twitter.com/mantolalla/status/1532306912422903809/photo/1",,"x882235051 x1433286055 x1343975432","MIsocialTW RaiTre M5S_Senato","it",,,,,,,,,,,,,,,,,,,,,,,,,,,,,,,,,,,,,"NA NA","NA NA","NA NA NA NA NA NA NA NA","https://twitter.com/mantolalla/status/1532306912422903809","Maria Laura Mantovani ⭐️⭐️⭐️⭐️⭐️","Carpi, Emilia Romagna","Cittadina eletta al Senato per il MoVimento 5 Stelle","https://t.co/v8J5GPClXN",FALSE,694,363,11,3355,499,2012-03-16 20:44:02,FALSE,"https://t.co/v8J5GPClXN","https://marialauramantovani.it",,"https://pbs.twimg.com/profile_banners/526777254/1528469923","http://abs.twimg.com/images/themes/theme1/bg.png","http://pbs.twimg.com/profile_images/1190749518721167361/8e8KnoXg_normal.jpg"
"x526777254","x1532296361311354880",2022-06-02 09:41:35,"mantolalla","Vorrei poter guardare gli aerei in cielo lanciare solo messaggi di pace e speranza, non di morte.
In questo giorno di festa, il mio pensiero vola accanto tutte le persone che soffrono a causa delle #armi, non solo in #Ucraina, ma in tutto il mondo. #StopWar #Peace #2giugno2022 https://t.co/bOynwYIUFy","Twitter Web App",277,,,,FALSE,FALSE,2,1,,,"armi Ucraina StopWar Peace 2giugno2022",,,,,"http://pbs.twimg.com/media/FUPOfccWYAACOCc.jpg","https://t.co/bOynwYIUFy","https://twitter.com/mantolalla/status/1532296361311354880/photo/1","photo","http://pbs.twimg.com/media/FUPOfccWYAACOCc.jpg","https://t.co/bOynwYIUFy","https://twitter.com/mantolalla/status/1532296361311354880/photo/1",,,,"it",,,,,,,,,,,,,,,,,,,,,,,,,,,,,,,,,,,,,"NA NA","NA NA","NA NA NA NA NA NA NA NA","https://twitter.com/mantolalla/status/1532296361311354880","Maria Laura Mantovani ⭐️⭐️⭐️⭐️⭐️","Carpi, Emilia Romagna","Cittadina eletta al Senato per il MoVimento 5 Stelle","https://t.co/v8J5GPClXN",FALSE,694,363,11,3355,499,2012-03-16 20:44:02,FALSE,"https://t.co/v8J5GPClXN","https://marialauramantovani.it",,"https://pbs.twimg.com/profile_banners/526777254/1528469923","http://abs.twimg.com/images/themes/theme1/bg.png","http://pbs.twimg.com/profile_images/1190749518721167361/8e8KnoXg_normal.jpg"
"x57282569","x1532355373394452483",2022-06-02 13:36:05,"AndreaMarcucci","Matteo Salvini continua a sperare di poter incontrare il ministro degli Esteri russo Sergei Lavrov. Non si conosce a nome di chi lo farebbe e con quale obiettivo. Il leader della Lega è ancora molto confuso. Lasci ai governi la ricerca della pace in #Ucraina","Twitter for iPhone",258,,,,FALSE,FALSE,36,7,,,"Ucraina",,,,,,,,,,,,,,,"it",,,,,,,,,,,,,,,,,,,,,,,,,,,,,,,,,,,,,"NA NA","NA NA","NA NA NA NA NA NA NA NA","https://twitter.com/AndreaMarcucci/status/1532355373394452483","Andrea Marcucci","Lucca, Italia","Senatore del Pd, appassionato di moto e di storia risorgimentale",,FALSE,24169,1320,285,10428,2864,2009-07-16 08:42:25,TRUE,,,,"https://pbs.twimg.com/profile_banners/57282569/1468948462","http://abs.twimg.com/images/themes/theme5/bg.gif","http://pbs.twimg.com/profile_images/1265650639935283202/2mvPVCA1_normal.jpg"
"x501874833","x1532466627874283532",2022-06-02 20:58:10,"s_margiotta","Disse chi voleva boicottare il Tap e ogni altro investimento energetico. https://t.co/KXYV1NnSui","Twitter for iPad",90,,,,FALSE,TRUE,0,62,,,,,,,,,,,,,,,,"x2416067982","CarloCalenda","it",,,,,,,,,,,,,,,,"x1532464864387555331","Disse chi voleva boicottare il Tap e ogni altro investimento energetico. https://t.co/KXYV1NnSui",2022-06-02 20:51:10,"Twitter for iPhone",722,62,"x2416067982","CarloCalenda","Carlo Calenda",348253,161,32242,"Roma","L’Italia è più forte di chi la vuole debole. Only a Sith deals in absolutes. @Azione_it   La libertà che non libera: https://t.co/dYBNv1Rv6p",TRUE,,,,,,,"NA NA","NA NA","NA NA NA NA NA NA NA NA","https://twitter.com/s_margiotta/status/1532466627874283532","Salvatore Margiotta","Roma, Potenza","Senatore, ingegnere, professore universitario. Capogruppo Commissione lavori pubblici e trasporti. Segretario Presidenza Senato","https://t.co/aeYZnOeRaN",FALSE,16003,7378,205,82172,63448,2012-02-24 15:30:04,TRUE,"https://t.co/aeYZnOeRaN","http://instangram.com/salvatore__margiotta",,"https://pbs.twimg.com/profile_banners/501874833/1483357085","http://abs.twimg.com/images/themes/theme1/bg.png","http://pbs.twimg.com/profile_images/1344056897155063808/zdD0fQgS_normal.jpg"
"x501874833","x1532465472976863238",2022-06-02 20:53:35,"s_margiotta","Renzi “tutti i miei tre anni di governo sono stati indirizzati a liberarci dal gas russo, peccato che i talk e tutti gli altri partiti erano schierati contro le trivelle” https://t.co/HxSEGgy8ES","Twitter for iPad",140,,,,FALSE,TRUE,0,98,,,,,,,,,,,,,,,,"x14575613","ardigiorgio","it",,,,,,,,,,,,,,,,"x1532451244744359941","Renzi “tutti i miei tre anni di governo sono stati indirizzati a liberarci dal gas russo, peccato che i talk e tutti gli altri partiti erano schierati contro le trivelle” https://t.co/HxSEGgy8ES",2022-06-02 19:57:02,"Twitter for iPhone",699,98,"x14575613","ardigiorgio","annarita digiorgio",15352,2075,62591,"Taranto, Puglia","colonna infame",FALSE,,,,,,,"NA NA","NA NA","NA NA NA NA NA NA NA NA","https://twitter.com/s_margiotta/status/1532465472976863238","Salvatore Margiotta","Roma, Potenza","Senatore, ingegnere, professore universitario. Capogruppo Commissione lavori pubblici e trasporti. Segretario Presidenza Senato","https://t.co/aeYZnOeRaN",FALSE,16003,7378,205,82172,63448,2012-02-24 15:30:04,TRUE,"https://t.co/aeYZnOeRaN","http://instangram.com/salvatore__margiotta",,"https://pbs.twimg.com/profile_banners/501874833/1483357085","http://abs.twimg.com/images/themes/theme1/bg.png","http://pbs.twimg.com/profile_images/1344056897155063808/zdD0fQgS_normal.jpg"
"x501874833","x1532421934742392837",2022-06-02 18:00:34,"s_margiotta","https://t.co/PnjdddjxvU","Twitter for iPad",0,,,,FALSE,FALSE,5,0,,,,,,,,"http://pbs.twimg.com/media/FURBoD0X0AAXhWW.jpg","https://t.co/PnjdddjxvU","https://twitter.com/s_margiotta/status/1532421934742392837/photo/1","photo","http://pbs.twimg.com/media/FURBoD0X0AAXhWW.jpg","https://t.co/PnjdddjxvU","https://twitter.com/s_margiotta/status/1532421934742392837/photo/1",,,,"und",,,,,,,,,,,,,,,,,,,,,,,,,,,,,,,,,,,,,"NA NA","NA NA","NA NA NA NA NA NA NA NA","https://twitter.com/s_margiotta/status/1532421934742392837","Salvatore Margiotta","Roma, Potenza","Senatore, ingegnere, professore universitario. Capogruppo Commissione lavori pubblici e trasporti. Segretario Presidenza Senato","https://t.co/aeYZnOeRaN",FALSE,16003,7378,205,82172,63448,2012-02-24 15:30:04,TRUE,"https://t.co/aeYZnOeRaN","http://instangram.com/salvatore__margiotta",,"https://pbs.twimg.com/profile_banners/501874833/1483357085","http://abs.twimg.com/images/themes/theme1/bg.png","http://pbs.twimg.com/profile_images/1344056897155063808/zdD0fQgS_normal.jpg"
"x501874833","x1532386804053188609",2022-06-02 15:40:59,"s_margiotta","@PoliticaPerJedi È bello essere pupazzetti. https://t.co/f8t7X4mdVQ","Twitter for iPad",84,,,,FALSE,TRUE,0,1,,,,,,,,"http://pbs.twimg.com/media/FUQg1qPWYAc_rzD.jpg","https://t.co/f8t7X4mdVQ","https://twitter.com/elevisconti/status/1532385886297522177/photo/1","photo","http://pbs.twimg.com/media/FUQg1qPWYAc_rzD.jpg","https://t.co/f8t7X4mdVQ","https://twitter.com/elevisconti/status/1532385886297522177/photo/1",,"x1240690942904066049 x696595370395172864","elevisconti PoliticaPerJedi","it",,,,,,,,,,,,,,,,"x1532385886297522177","@PoliticaPerJedi È bello essere pupazzetti. https://t.co/f8t7X4mdVQ",2022-06-02 15:37:20,"Twitter for iPad",51,1,"x1240690942904066049","elevisconti","Elena Visconti",16181,699,22407,"","Mi disegno così ma ho imparato da poco. Dal vivo sono molto meglio, giuro.",FALSE,,,,,,,"NA NA","NA NA","NA NA NA NA NA NA NA NA","https://twitter.com/s_margiotta/status/1532386804053188609","Salvatore Margiotta","Roma, Potenza","Senatore, ingegnere, professore universitario. Capogruppo Commissione lavori pubblici e trasporti. Segretario Presidenza Senato","https://t.co/aeYZnOeRaN",FALSE,16003,7378,205,82172,63448,2012-02-24 15:30:04,TRUE,"https://t.co/aeYZnOeRaN","http://instangram.com/salvatore__margiotta",,"https://pbs.twimg.com/profile_banners/501874833/1483357085","http://abs.twimg.com/images/themes/theme1/bg.png","http://pbs.twimg.com/profile_images/1344056897155063808/zdD0fQgS_normal.jpg"
"x501874833","x1532385189711814657",2022-06-02 15:34:34,"s_margiotta","#Lautaro: “Se resto all’#Inter? Sì sì sì, ho grande voglia di restare all’#Inter”.

#Skriniar si è già esposto, #Lukaku si è pentito, in generale per mandarli via li devi obbligare.

Io non so proprio se resteranno tutti, ma so che hanno costruito davvero un gran bel gruppo.","Twitter for iPad",140,,,,FALSE,TRUE,0,49,,,"Lautaro Inter Inter Skriniar Lukaku",,,,,,,,,,,,,"x466499074","FBiasin","it",,,,,,,,,,,,,,,,"x1532371199082123265","#Lautaro: “Se resto all’#Inter? Sì sì sì, ho grande voglia di restare all’#Inter”.

#Skriniar si è già esposto, #Lukaku si è pentito, in generale per mandarli via li devi obbligare.

Io non so proprio se resteranno tutti, ma so che hanno costruito davvero un gran bel gruppo.",2022-06-02 14:38:58,"Twitter for iPhone",1547,49,"x466499074","FBiasin","Fabrizio Biasin",163952,616,25260,"","Giornalista. E in più a volte lavoro pure. https://t.co/6QjTx1IMrR",TRUE,,,,,,,"NA NA","NA NA","NA NA NA NA NA NA NA NA","https://twitter.com/s_margiotta/status/1532385189711814657","Salvatore Margiotta","Roma, Potenza","Senatore, ingegnere, professore universitario. Capogruppo Commissione lavori pubblici e trasporti. Segretario Presidenza Senato","https://t.co/aeYZnOeRaN",FALSE,16003,7378,205,82172,63448,2012-02-24 15:30:04,TRUE,"https://t.co/aeYZnOeRaN","http://instangram.com/salvatore__margiotta",,"https://pbs.twimg.com/profile_banners/501874833/1483357085","http://abs.twimg.com/images/themes/theme1/bg.png","http://pbs.twimg.com/profile_images/1344056897155063808/zdD0fQgS_normal.jpg"
"x501874833","x1532384340474224640",2022-06-02 15:31:11,"s_margiotta","Una bella pedalata nella natura dell’Area Sud ☀️ 
#Basilicata https://t.co/TwTXPHJsUM","Twitter for iPad",103,,,,FALSE,TRUE,0,2,,,"Basilicata",,,,,"http://pbs.twimg.com/media/FUPhUI4XoAAtR7X.jpg","https://t.co/TwTXPHJsUM","https://twitter.com/OFerrari1991/status/1532316126201401344/photo/1","photo","http://pbs.twimg.com/media/FUPhUI4XoAAtR7X.jpg","https://t.co/TwTXPHJsUM","https://twitter.com/OFerrari1991/status/1532316126201401344/photo/1",,"x1312496696870436864","OFerrari1991","it",,,,,,,,,,,,,,,,"x1532316126201401344","Una bella pedalata nella natura dell’Area Sud ☀️ 
#Basilicata https://t.co/TwTXPHJsUM",2022-06-02 11:00:08,"Twitter for iPhone",9,2,"x1312496696870436864","OFerrari1991","Omar Ferrari",32,450,639,"Rivello, Basilicata","• Food Technology Student at @unibasilicata •",FALSE,,,,,,,"NA NA","NA NA","NA NA NA NA NA NA NA NA","https://twitter.com/s_margiotta/status/1532384340474224640","Salvatore Margiotta","Roma, Potenza","Senatore, ingegnere, professore universitario. Capogruppo Commissione lavori pubblici e trasporti. Segretario Presidenza Senato","https://t.co/aeYZnOeRaN",FALSE,16003,7378,205,82172,63448,2012-02-24 15:30:04,TRUE,"https://t.co/aeYZnOeRaN","http://instangram.com/salvatore__margiotta",,"https://pbs.twimg.com/profile_banners/501874833/1483357085","http://abs.twimg.com/images/themes/theme1/bg.png","http://pbs.twimg.com/profile_images/1344056897155063808/zdD0fQgS_normal.jpg"
"x501874833","x1532383890698031105",2022-06-02 15:29:24,"s_margiotta","@La_manina__ Sleepy Gualtieri è tua di diritto. 
M’hai fatto ammazzare dal ridere. E poi l’ho pure votato!","Twitter for iPad",123,,,,FALSE,TRUE,0,1,,,,,,,,,,,,,,,,"x1240690942904066049 x1053949922003828737","elevisconti La_manina__","it",,,,,,,,,,,,,,,,"x1532382858744336385","@La_manina__ Sleepy Gualtieri è tua di diritto. 
M’hai fatto ammazzare dal ridere. E poi l’ho pure votato!",2022-06-02 15:25:18,"Twitter for iPad",5,1,"x1240690942904066049","elevisconti","Elena Visconti",16181,699,22407,"","Mi disegno così ma ho imparato da poco. Dal vivo sono molto meglio, giuro.",FALSE,,,,,,,"NA NA","NA NA","NA NA NA NA NA NA NA NA","https://twitter.com/s_margiotta/status/1532383890698031105","Salvatore Margiotta","Roma, Potenza","Senatore, ingegnere, professore universitario. Capogruppo Commissione lavori pubblici e trasporti. Segretario Presidenza Senato","https://t.co/aeYZnOeRaN",FALSE,16003,7378,205,82172,63448,2012-02-24 15:30:04,TRUE,"https://t.co/aeYZnOeRaN","http://instangram.com/salvatore__margiotta",,"https://pbs.twimg.com/profile_banners/501874833/1483357085","http://abs.twimg.com/images/themes/theme1/bg.png","http://pbs.twimg.com/profile_images/1344056897155063808/zdD0fQgS_normal.jpg"
"x501874833","x1532383169772765191",2022-06-02 15:26:32,"s_margiotta","@GiuseppeConteIT Non è un monito. È uno dei principi fondamentali. Ma come parla?","Twitter for iPad",102,,,,FALSE,TRUE,0,66,,,,,,,,,,,,,,,,"x696595370395172864 x999578121123848192","PoliticaPerJedi GiuseppeConteIT","it",,,,,,,,,,,,,,,,"x1532344321650851842","@GiuseppeConteIT Non è un monito. È uno dei principi fondamentali. Ma come parla?",2022-06-02 12:52:10,"Twitter for Android",1609,66,"x696595370395172864","PoliticaPerJedi","Yoda",54639,981,54043,"","So this is how liberty dies. With thunderous applause.",FALSE,,,,,,,"NA NA","NA NA","NA NA NA NA NA NA NA NA","https://twitter.com/s_margiotta/status/1532383169772765191","Salvatore Margiotta","Roma, Potenza","Senatore, ingegnere, professore universitario. Capogruppo Commissione lavori pubblici e trasporti. Segretario Presidenza Senato","https://t.co/aeYZnOeRaN",FALSE,16003,7378,205,82172,63448,2012-02-24 15:30:04,TRUE,"https://t.co/aeYZnOeRaN","http://instangram.com/salvatore__margiotta",,"https://pbs.twimg.com/profile_banners/501874833/1483357085","http://abs.twimg.com/images/themes/theme1/bg.png","http://pbs.twimg.com/profile_images/1344056897155063808/zdD0fQgS_normal.jpg"
"x501874833","x1532349964302655489",2022-06-02 13:14:35,"s_margiotta","@ErbertoFrieri @InfoPansa Mi raccomando le scorzette di arancia….","Twitter for iPad",39,"x1532284480538480642","x412183823","ErbertoFrieri",FALSE,FALSE,1,0,,,,,,,,,,,,,,,,"x412183823 x3130749291","ErbertoFrieri InfoPansa","it",,,,,,,,,,,,,,,,,,,,,,,,,,,,,,,,,,,,,"NA NA","NA NA","NA NA NA NA NA NA NA NA","https://twitter.com/s_margiotta/status/1532349964302655489","Salvatore Margiotta","Roma, Potenza","Senatore, ingegnere, professore universitario. Capogruppo Commissione lavori pubblici e trasporti. Segretario Presidenza Senato","https://t.co/aeYZnOeRaN",FALSE,16003,7378,205,82172,63448,2012-02-24 15:30:04,TRUE,"https://t.co/aeYZnOeRaN","http://instangram.com/salvatore__margiotta",,"https://pbs.twimg.com/profile_banners/501874833/1483357085","http://abs.twimg.com/images/themes/theme1/bg.png","http://pbs.twimg.com/profile_images/1344056897155063808/zdD0fQgS_normal.jpg"
"x501874833","x1532348430558822400",2022-06-02 13:08:30,"s_margiotta","Esiste tra voi un pacifista convinto disposto ad ammettere di aver sbagliato e che almeno il primo invio delle armi era giusto, perché altrimenti l'Ucraina sarebbe stata sopraffatta?
Se c'è lo voglio conoscere e gli regalo una vignetta. Promesso.","Twitter for iPad",140,,,,FALSE,TRUE,0,10,,,,,,,,,,,,,,,,"x1240690942904066049","elevisconti","it",,,,,,,,,,,,,,,,"x1532341365421531136","Esiste tra voi un pacifista convinto disposto ad ammettere di aver sbagliato e che almeno il primo invio delle armi era giusto, perché altrimenti l'Ucraina sarebbe stata sopraffatta?
Se c'è lo voglio conoscere e gli regalo una vignetta. Promesso.",2022-06-02 12:40:25,"Twitter for Android",288,10,"x1240690942904066049","elevisconti","Elena Visconti",16181,699,22407,"","Mi disegno così ma ho imparato da poco. Dal vivo sono molto meglio, giuro.",FALSE,,,,,,,"NA NA","NA NA","NA NA NA NA NA NA NA NA","https://twitter.com/s_margiotta/status/1532348430558822400","Salvatore Margiotta","Roma, Potenza","Senatore, ingegnere, professore universitario. Capogruppo Commissione lavori pubblici e trasporti. Segretario Presidenza Senato","https://t.co/aeYZnOeRaN",FALSE,16003,7378,205,82172,63448,2012-02-24 15:30:04,TRUE,"https://t.co/aeYZnOeRaN","http://instangram.com/salvatore__margiotta",,"https://pbs.twimg.com/profile_banners/501874833/1483357085","http://abs.twimg.com/images/themes/theme1/bg.png","http://pbs.twimg.com/profile_images/1344056897155063808/zdD0fQgS_normal.jpg"
"x501874833","x1532347223081615360",2022-06-02 13:03:42,"s_margiotta","@PieroSansonetti @vitube8991 Non mi ha deluso, perché non mi ha mai illuso. Sarebbe però grave -per la rai- se avesse avuto mandanti.. ritengo invece fossero cazzate autoprodotte..,","Twitter for iPad",152,"x1532005019951693825","x501813967","PieroSansonetti",FALSE,FALSE,10,1,,,,,,,,,,,,,,,,"x501813967 x997586305","PieroSansonetti vitube8991","it",,,,,,,,,,,,,,,,,,,,,,,,,,,,,,,,,,,,,"NA NA","NA NA","NA NA NA NA NA NA NA NA","https://twitter.com/s_margiotta/status/1532347223081615360","Salvatore Margiotta","Roma, Potenza","Senatore, ingegnere, professore universitario. Capogruppo Commissione lavori pubblici e trasporti. Segretario Presidenza Senato","https://t.co/aeYZnOeRaN",FALSE,16003,7378,205,82172,63448,2012-02-24 15:30:04,TRUE,"https://t.co/aeYZnOeRaN","http://instangram.com/salvatore__margiotta",,"https://pbs.twimg.com/profile_banners/501874833/1483357085","http://abs.twimg.com/images/themes/theme1/bg.png","http://pbs.twimg.com/profile_images/1344056897155063808/zdD0fQgS_normal.jpg"
"x501874833","x1532346720717348865",2022-06-02 13:01:42,"s_margiotta","Per lei va bene che le cose restino così? Che un drappello di esseri umani, circa 3000, abbia il potere di fare delle nostre vite quel che vuole, senza risponderne mai a nessuno?
#LucianaLittizzetto
https://t.co/EabQk83TQh","Twitter for iPad",139,,,,FALSE,TRUE,0,401,,,,,,,,,,,,,,,,"x501813967","PieroSansonetti","it",,,,,,,,,,,,,,,,"x1532005019951693825","Per lei va bene che le cose restino così? Che un drappello di esseri umani, circa 3000, abbia il potere di fare delle nostre vite quel che vuole, senza risponderne mai a nessuno?
#LucianaLittizzetto
https://t.co/EabQk83TQh",2022-06-01 14:23:54,"TweetDeck",1656,401,"x501813967","PieroSansonetti","PieroSansonetti",45036,2097,6921,"","Direttore del quotidiano Il Riformista",FALSE,,,,,,,"NA NA","NA NA","NA NA NA NA NA NA NA NA","https://twitter.com/s_margiotta/status/1532346720717348865","Salvatore Margiotta","Roma, Potenza","Senatore, ingegnere, professore universitario. Capogruppo Commissione lavori pubblici e trasporti. Segretario Presidenza Senato","https://t.co/aeYZnOeRaN",FALSE,16003,7378,205,82172,63448,2012-02-24 15:30:04,TRUE,"https://t.co/aeYZnOeRaN","http://instangram.com/salvatore__margiotta",,"https://pbs.twimg.com/profile_banners/501874833/1483357085","http://abs.twimg.com/images/themes/theme1/bg.png","http://pbs.twimg.com/profile_images/1344056897155063808/zdD0fQgS_normal.jpg"
