"user_id","status_id","created_at","screen_name","text","source","display_text_width","reply_to_status_id","reply_to_user_id","reply_to_screen_name","is_quote","is_retweet","favorite_count","retweet_count","quote_count","reply_count","hashtags","symbols","urls_url","urls_t.co","urls_expanded_url","media_url","media_t.co","media_expanded_url","media_type","ext_media_url","ext_media_t.co","ext_media_expanded_url","ext_media_type","mentions_user_id","mentions_screen_name","lang","quoted_status_id","quoted_text","quoted_created_at","quoted_source","quoted_favorite_count","quoted_retweet_count","quoted_user_id","quoted_screen_name","quoted_name","quoted_followers_count","quoted_friends_count","quoted_statuses_count","quoted_location","quoted_description","quoted_verified","retweet_status_id","retweet_text","retweet_created_at","retweet_source","retweet_favorite_count","retweet_retweet_count","retweet_user_id","retweet_screen_name","retweet_name","retweet_followers_count","retweet_friends_count","retweet_statuses_count","retweet_location","retweet_description","retweet_verified","place_url","place_name","place_full_name","place_type","country","country_code","geo_coords","coords_coords","bbox_coords","status_url","name","location","description","url","protected","followers_count","friends_count","listed_count","statuses_count","favourites_count","account_created_at","verified","profile_url","profile_expanded_url","account_lang","profile_banner_url","profile_background_url","profile_image_url"
"x270839361","x1547135334927966209",2022-07-13 08:26:22,"matteosalvinimi","Sbarchi senza sosta. Lampedusa al collasso.
L’Italia sta per esplodere.
Se Lamorgese non è in grado di difendere la sicurezza e i confini italiani si faccia aiutare. https://t.co/B6muW5ISZX","Twitter for iPhone",165,,,,FALSE,FALSE,673,111,,,,,,,,"http://pbs.twimg.com/media/FXiHYjPX0AESMOh.jpg","https://t.co/B6muW5ISZX","https://twitter.com/matteosalvinimi/status/1547135334927966209/photo/1","photo","http://pbs.twimg.com/media/FXiHYjPX0AESMOh.jpg","https://t.co/B6muW5ISZX","https://twitter.com/matteosalvinimi/status/1547135334927966209/photo/1",,,,"it",,,,,,,,,,,,,,,,,,,,,,,,,,,,,,,,,,,,,"NA NA","NA NA","NA NA NA NA NA NA NA NA","https://twitter.com/matteosalvinimi/status/1547135334927966209","Matteo Salvini","","Leader della Lega #primagliitaliani 🇮🇹","https://t.co/sj3rr6DU3N",FALSE,1478042,2008,3137,53258,3824,2011-03-23 10:32:56,TRUE,"https://t.co/sj3rr6DU3N","https://legaonline.it/",,"https://pbs.twimg.com/profile_banners/270839361/1641590097","http://abs.twimg.com/images/themes/theme1/bg.png","http://pbs.twimg.com/profile_images/966325945060732928/0Ua5xPMX_normal.jpg"
"x997531966571466752","x1547330697395933184",2022-07-13 21:22:40,"Pres_Casellati","Oggi ho presentato in #Senato il Viaggio nella #Italia del #vino; un prodotto che è un modello di sviluppo economico e sociale. Un viaggio nel mondo dell’arte, della musica, dell’artigianato, della moda. È turismo a 360 gradi. Un orgoglio del nostro Paese. https://t.co/uH1CwMBW9F","Twitter for iPhone",256,,,,FALSE,FALSE,11,3,,,"Senato Italia vino",,,,,"http://pbs.twimg.com/ext_tw_video_thumb/1547330426217324551/pu/img/D5XuISV6gvGjHfMa.jpg","https://t.co/uH1CwMBW9F","https://twitter.com/Pres_Casellati/status/1547330697395933184/video/1","photo","http://pbs.twimg.com/ext_tw_video_thumb/1547330426217324551/pu/img/D5XuISV6gvGjHfMa.jpg","https://t.co/uH1CwMBW9F","https://twitter.com/Pres_Casellati/status/1547330697395933184/video/1",,,,"it",,,,,,,,,,,,,,,,,,,,,,,,,,,,,,,,,,,,,"NA NA","NA NA","NA NA NA NA NA NA NA NA","https://twitter.com/Pres_Casellati/status/1547330697395933184","Maria Elisabetta Alberti Casellati","Roma, Lazio","Presidente del Senato della Repubblica","https://t.co/4xFh9XyLXO",FALSE,15999,600,117,1312,62,2018-05-18 17:38:48,TRUE,"https://t.co/4xFh9XyLXO","https://www.facebook.com/elisabetta.casellati.7",,"https://pbs.twimg.com/profile_banners/997531966571466752/1526665561","http://abs.twimg.com/images/themes/theme1/bg.png","http://pbs.twimg.com/profile_images/997533290520195072/YmnjBO3X_normal.jpg"
"x997531966571466752","x1547100951881957378",2022-07-13 06:09:45,"Pres_Casellati","Alle #TermediCaracalla per applaudire il talento straordinario e la magia coreografica e interpretativa di #RobertoBolle, étoile della danza mondiale e orgoglio d’Italia. Uno spettacolo emozionante in una cornice che tocca il cuore. Grazie @RobertoBolle. Grazie @OperaRoma https://t.co/epyJYXsQig","Twitter for iPhone",272,,,,FALSE,FALSE,55,11,,,"TermediCaracalla RobertoBolle",,,,,"http://pbs.twimg.com/media/FXhoHPnWAAUaSQr.jpg","https://t.co/epyJYXsQig","https://twitter.com/Pres_Casellati/status/1547100951881957378/photo/1","photo","http://pbs.twimg.com/media/FXhoHPnWAAUaSQr.jpg http://pbs.twimg.com/media/FXhoHPtXEAE3mVO.jpg http://pbs.twimg.com/media/FXhoHPvXwAAgIxh.jpg http://pbs.twimg.com/media/FXhoHPoWYAAVNyu.jpg","https://t.co/epyJYXsQig https://t.co/epyJYXsQig https://t.co/epyJYXsQig https://t.co/epyJYXsQig","https://twitter.com/Pres_Casellati/status/1547100951881957378/photo/1 https://twitter.com/Pres_Casellati/status/1547100951881957378/photo/1 https://twitter.com/Pres_Casellati/status/1547100951881957378/photo/1 https://twitter.com/Pres_Casellati/status/1547100951881957378/photo/1",,"x85335636 x862781052","RobertoBolle OperaRoma","it",,,,,,,,,,,,,,,,,,,,,,,,,,,,,,,,,,,,,"NA NA","NA NA","NA NA NA NA NA NA NA NA","https://twitter.com/Pres_Casellati/status/1547100951881957378","Maria Elisabetta Alberti Casellati","Roma, Lazio","Presidente del Senato della Repubblica","https://t.co/4xFh9XyLXO",FALSE,15999,600,117,1312,62,2018-05-18 17:38:48,TRUE,"https://t.co/4xFh9XyLXO","https://www.facebook.com/elisabetta.casellati.7",,"https://pbs.twimg.com/profile_banners/997531966571466752/1526665561","http://abs.twimg.com/images/themes/theme1/bg.png","http://pbs.twimg.com/profile_images/997533290520195072/YmnjBO3X_normal.jpg"
"x1075084718","x1547282323334373385",2022-07-13 18:10:27,"arrigoni_paolo","Chiediamo al Governo un intervento chiaro e risolutivo per difendere le misure contro il caro-bollette e ribadire con convinzione che l’aliquota Iva al 5% deve intendersi su tutte le voci in bolletta del #gas, senza distinzioni tra prezzo di materia prima e servizi accessori.","Twitter Web App",276,,,,FALSE,FALSE,8,3,,,"gas",,,,,,,,,,,,,,,"it",,,,,,,,,,,,,,,,,,,,,,,,,,,,,,,,,,,,,"NA NA","NA NA","NA NA NA NA NA NA NA NA","https://twitter.com/arrigoni_paolo/status/1547282323334373385","Paolo Arrigoni","Calolziocorte, Lombardia","Questore del Senato della Repubblica, componente della Commissione Ambiente e del Copasir. Responsabile del Dipartimento Energia della Lega.","https://t.co/M6TePkOvfO",FALSE,4831,193,0,10019,118,2013-01-09 22:36:27,TRUE,"https://t.co/M6TePkOvfO","http://www.senato.it/leg/18/BGT/Schede/Attsen/00029039.htm",,"https://pbs.twimg.com/profile_banners/1075084718/1591968708","http://abs.twimg.com/images/themes/theme1/bg.png","http://pbs.twimg.com/profile_images/3172370357/bec3e4497d64c77f2a93bc9792055992_normal.jpeg"
"x1075084718","x1547261765905522688",2022-07-13 16:48:46,"arrigoni_paolo","🗣Ha inizio l'evento ""Sicurezza energetica ed emissioni di #metano . Il gas naturale nel #RePowerEU e l’Italia nei nuovi scenari geopolitici"".
@amicidellaterra  @EnvDefenseEuro 

diretta streaming
📹 https://t.co/m6UeAm4XNL https://t.co/MqSM5zqLj4","Twitter for Android",140,,,,FALSE,TRUE,0,1,,,"metano RePowerEU",,,,,,,,,,,,,"x172531008","opengateitalia","it",,,,,,,,,,,,,,,,"x1547249389218963458","🗣Ha inizio l'evento ""Sicurezza energetica ed emissioni di #metano . Il gas naturale nel #RePowerEU e l’Italia nei nuovi scenari geopolitici"".
@amicidellaterra  @EnvDefenseEuro 

diretta streaming
📹 https://t.co/m6UeAm4XNL https://t.co/MqSM5zqLj4",2022-07-13 15:59:35,"Twitter Web App",4,1,"x172531008","opengateitalia","Open Gate Italia",1788,791,3425,"Roma, Italia","Public affairs, regolamentazione e comunicazione strategica.",FALSE,,,,,,,"NA NA","NA NA","NA NA NA NA NA NA NA NA","https://twitter.com/arrigoni_paolo/status/1547261765905522688","Paolo Arrigoni","Calolziocorte, Lombardia","Questore del Senato della Repubblica, componente della Commissione Ambiente e del Copasir. Responsabile del Dipartimento Energia della Lega.","https://t.co/M6TePkOvfO",FALSE,4831,193,0,10019,118,2013-01-09 22:36:27,TRUE,"https://t.co/M6TePkOvfO","http://www.senato.it/leg/18/BGT/Schede/Attsen/00029039.htm",,"https://pbs.twimg.com/profile_banners/1075084718/1591968708","http://abs.twimg.com/images/themes/theme1/bg.png","http://pbs.twimg.com/profile_images/3172370357/bec3e4497d64c77f2a93bc9792055992_normal.jpeg"
"x876541483","x1547342469246996480",2022-07-13 22:09:27,"AlbertoBagnai","This animation shows how a river can be forced backwards, albeit only long enough to find a new route. Several written accounts from the New Madrid earthquake of 1811 and 1812 describe the horror as great waters swashed upriver causing lakes to form on previously dry land. https://t.co/SmLK6qqylE","Twitter for iPhone",140,,,,FALSE,TRUE,0,11,,,,,,,,,,,,,,,,"x45770236","IRIS_EPO","en",,,,,,,,,,,,,,,,"x1547340209972543488","This animation shows how a river can be forced backwards, albeit only long enough to find a new route. Several written accounts from the New Madrid earthquake of 1811 and 1812 describe the horror as great waters swashed upriver causing lakes to form on previously dry land. https://t.co/SmLK6qqylE",2022-07-13 22:00:28,"Hootsuite Inc.",28,11,"x45770236","IRIS_EPO","IRIS Earthquake Sci",44393,845,28427,"Washington, D.C.","Consortium of 100+ universities dedicated to the operation of facilities for the acquisition, management, and distribution of seismological data.",FALSE,,,,,,,"NA NA","NA NA","NA NA NA NA NA NA NA NA","https://twitter.com/AlbertoBagnai/status/1547342469246996480","Alberto Bagnai","","Professore associato di politica economica all’Università Gabriele d’Annunzio, eletto al Senato per la Lega nel collegio Abruzzo 01.","https://t.co/sC5RvUzmsX",FALSE,134948,666,659,227102,6513,2012-10-12 22:13:36,TRUE,"https://t.co/sC5RvUzmsX","http://www.senato.it/leg/18/BGT/Schede/Attsen/00032582.htm",,"https://pbs.twimg.com/profile_banners/876541483/1535647109","http://abs.twimg.com/images/themes/theme1/bg.png","http://pbs.twimg.com/profile_images/849030859462246401/ATk3_aiW_normal.jpg"
"x876541483","x1547335640815116289",2022-07-13 21:42:19,"AlbertoBagnai","Abbandonato l'alfabeto greco per evidente perdita di appeal sul pubblico, si passa direttamente ai mostri mitologici. Già pronti i nomi per le prossime varianti: si chiameranno ""Hydra"", ""Cerberus"" e ""Mechagodzilla"". https://t.co/9icy9Kwucv","Twitter for iPhone",140,,,,FALSE,TRUE,0,32,,,,,,,,,,,,,,,,"x2339316667","gr_grim","it",,,,,,,,,,,,,,,,"x1547275866291462147","Abbandonato l'alfabeto greco per evidente perdita di appeal sul pubblico, si passa direttamente ai mostri mitologici. Già pronti i nomi per le prossime varianti: si chiameranno ""Hydra"", ""Cerberus"" e ""Mechagodzilla"". https://t.co/9icy9Kwucv",2022-07-13 17:44:48,"Twitter for Android",95,32,"x2339316667","gr_grim","Grim",16825,390,37742,"Italy","«May you live in interesting times» - ancient chinese curse | (Micro)blogger di (Macro)economia (e politica): euro/UE/liberismo e altri crimini contro l'umanità",FALSE,,,,,,,"NA NA","NA NA","NA NA NA NA NA NA NA NA","https://twitter.com/AlbertoBagnai/status/1547335640815116289","Alberto Bagnai","","Professore associato di politica economica all’Università Gabriele d’Annunzio, eletto al Senato per la Lega nel collegio Abruzzo 01.","https://t.co/sC5RvUzmsX",FALSE,134948,666,659,227102,6513,2012-10-12 22:13:36,TRUE,"https://t.co/sC5RvUzmsX","http://www.senato.it/leg/18/BGT/Schede/Attsen/00032582.htm",,"https://pbs.twimg.com/profile_banners/876541483/1535647109","http://abs.twimg.com/images/themes/theme1/bg.png","http://pbs.twimg.com/profile_images/849030859462246401/ATk3_aiW_normal.jpg"
"x876541483","x1547335055160270853",2022-07-13 21:39:59,"AlbertoBagnai","Nice try, NASA https://t.co/SfGcRdcfkO","Twitter for iPhone",57,,,,FALSE,TRUE,0,18507,,,,,,,,"http://pbs.twimg.com/media/FXhz9p9UsAEu7Pi.jpg","https://t.co/SfGcRdcfkO","https://twitter.com/myunclesmemes/status/1547113976659472384/photo/1","photo","http://pbs.twimg.com/media/FXhz9p9UsAEu7Pi.jpg","https://t.co/SfGcRdcfkO","https://twitter.com/myunclesmemes/status/1547113976659472384/photo/1",,"x4880060739","myunclesmemes","pl",,,,,,,,,,,,,,,,"x1547113976659472384","Nice try, NASA https://t.co/SfGcRdcfkO",2022-07-13 07:01:30,"❤️",238477,18507,"x4880060739","myunclesmemes","my uncle’s meme stash",323194,370,215651,"World 6","oh sup I post the best memes daily so smash that follow button | @sourheath | @d3adv3k",FALSE,,,,,,,"NA NA","NA NA","NA NA NA NA NA NA NA NA","https://twitter.com/AlbertoBagnai/status/1547335055160270853","Alberto Bagnai","","Professore associato di politica economica all’Università Gabriele d’Annunzio, eletto al Senato per la Lega nel collegio Abruzzo 01.","https://t.co/sC5RvUzmsX",FALSE,134948,666,659,227102,6513,2012-10-12 22:13:36,TRUE,"https://t.co/sC5RvUzmsX","http://www.senato.it/leg/18/BGT/Schede/Attsen/00032582.htm",,"https://pbs.twimg.com/profile_banners/876541483/1535647109","http://abs.twimg.com/images/themes/theme1/bg.png","http://pbs.twimg.com/profile_images/849030859462246401/ATk3_aiW_normal.jpg"
"x876541483","x1547324733812887559",2022-07-13 20:58:59,"AlbertoBagnai","@FernanaBot Non è tè verde.","Twitter for iPhone",15,"x1547324561586356224","x1459980423988142085","FernanaBot",FALSE,FALSE,3,0,,,,,,,,,,,,,,,,"x1459980423988142085","FernanaBot","it",,,,,,,,,,,,,,,,,,,,,,,,,,,,,,,,,,,,,"NA NA","NA NA","NA NA NA NA NA NA NA NA","https://twitter.com/AlbertoBagnai/status/1547324733812887559","Alberto Bagnai","","Professore associato di politica economica all’Università Gabriele d’Annunzio, eletto al Senato per la Lega nel collegio Abruzzo 01.","https://t.co/sC5RvUzmsX",FALSE,134948,666,659,227102,6513,2012-10-12 22:13:36,TRUE,"https://t.co/sC5RvUzmsX","http://www.senato.it/leg/18/BGT/Schede/Attsen/00032582.htm",,"https://pbs.twimg.com/profile_banners/876541483/1535647109","http://abs.twimg.com/images/themes/theme1/bg.png","http://pbs.twimg.com/profile_images/849030859462246401/ATk3_aiW_normal.jpg"
"x876541483","x1547324482246922243",2022-07-13 20:57:59,"AlbertoBagnai","@FernanaBot Pensa che io ho sognato il PDCM (no joke)…","Twitter for iPhone",42,"x1547323516952973314","x1459980423988142085","FernanaBot",FALSE,FALSE,4,0,,,,,,,,,,,,,,,,"x1459980423988142085","FernanaBot","it",,,,,,,,,,,,,,,,,,,,,,,,,,,,,,,,,,,,,"NA NA","NA NA","NA NA NA NA NA NA NA NA","https://twitter.com/AlbertoBagnai/status/1547324482246922243","Alberto Bagnai","","Professore associato di politica economica all’Università Gabriele d’Annunzio, eletto al Senato per la Lega nel collegio Abruzzo 01.","https://t.co/sC5RvUzmsX",FALSE,134948,666,659,227102,6513,2012-10-12 22:13:36,TRUE,"https://t.co/sC5RvUzmsX","http://www.senato.it/leg/18/BGT/Schede/Attsen/00032582.htm",,"https://pbs.twimg.com/profile_banners/876541483/1535647109","http://abs.twimg.com/images/themes/theme1/bg.png","http://pbs.twimg.com/profile_images/849030859462246401/ATk3_aiW_normal.jpg"
"x876541483","x1547324391788355588",2022-07-13 20:57:37,"AlbertoBagnai","@FernanaBot https://t.co/YT8qefyPcb","Twitter for iPhone",0,"x1547323516952973314","x1459980423988142085","FernanaBot",FALSE,FALSE,3,0,,,,,,,,"http://pbs.twimg.com/media/FXkzU5gWIAACjhd.jpg","https://t.co/YT8qefyPcb","https://twitter.com/AlbertoBagnai/status/1547324391788355588/photo/1","photo","http://pbs.twimg.com/media/FXkzU5gWIAACjhd.jpg","https://t.co/YT8qefyPcb","https://twitter.com/AlbertoBagnai/status/1547324391788355588/photo/1",,"x1459980423988142085","FernanaBot","qme",,,,,,,,,,,,,,,,,,,,,,,,,,,,,,,,,,,,,"NA NA","NA NA","NA NA NA NA NA NA NA NA","https://twitter.com/AlbertoBagnai/status/1547324391788355588","Alberto Bagnai","","Professore associato di politica economica all’Università Gabriele d’Annunzio, eletto al Senato per la Lega nel collegio Abruzzo 01.","https://t.co/sC5RvUzmsX",FALSE,134948,666,659,227102,6513,2012-10-12 22:13:36,TRUE,"https://t.co/sC5RvUzmsX","http://www.senato.it/leg/18/BGT/Schede/Attsen/00032582.htm",,"https://pbs.twimg.com/profile_banners/876541483/1535647109","http://abs.twimg.com/images/themes/theme1/bg.png","http://pbs.twimg.com/profile_images/849030859462246401/ATk3_aiW_normal.jpg"
"x876541483","x1547323216099680265",2022-07-13 20:52:57,"AlbertoBagnai","Un altro mondo è possibile. https://t.co/VqrUPbQf6G","Twitter for iPhone",27,,,,FALSE,FALSE,42,5,,,,,,,,"http://pbs.twimg.com/media/FXkyQhxWQAEVaxL.jpg","https://t.co/VqrUPbQf6G","https://twitter.com/AlbertoBagnai/status/1547323216099680265/photo/1","photo","http://pbs.twimg.com/media/FXkyQhxWQAEVaxL.jpg","https://t.co/VqrUPbQf6G","https://twitter.com/AlbertoBagnai/status/1547323216099680265/photo/1",,,,"it",,,,,,,,,,,,,,,,,,,,,,,,,,,,,,,,,,,,,"NA NA","NA NA","NA NA NA NA NA NA NA NA","https://twitter.com/AlbertoBagnai/status/1547323216099680265","Alberto Bagnai","","Professore associato di politica economica all’Università Gabriele d’Annunzio, eletto al Senato per la Lega nel collegio Abruzzo 01.","https://t.co/sC5RvUzmsX",FALSE,134948,666,659,227102,6513,2012-10-12 22:13:36,TRUE,"https://t.co/sC5RvUzmsX","http://www.senato.it/leg/18/BGT/Schede/Attsen/00032582.htm",,"https://pbs.twimg.com/profile_banners/876541483/1535647109","http://abs.twimg.com/images/themes/theme1/bg.png","http://pbs.twimg.com/profile_images/849030859462246401/ATk3_aiW_normal.jpg"
"x876541483","x1547322933458132995",2022-07-13 20:51:49,"AlbertoBagnai","@FernanaBot Ciao giovane! Come va?","Twitter for iPhone",22,"x1547322029593993224","x1459980423988142085","FernanaBot",FALSE,FALSE,5,0,,,,,,,,,,,,,,,,"x1459980423988142085","FernanaBot","it",,,,,,,,,,,,,,,,,,,,,,,,,,,,,,,,,,,,,"NA NA","NA NA","NA NA NA NA NA NA NA NA","https://twitter.com/AlbertoBagnai/status/1547322933458132995","Alberto Bagnai","","Professore associato di politica economica all’Università Gabriele d’Annunzio, eletto al Senato per la Lega nel collegio Abruzzo 01.","https://t.co/sC5RvUzmsX",FALSE,134948,666,659,227102,6513,2012-10-12 22:13:36,TRUE,"https://t.co/sC5RvUzmsX","http://www.senato.it/leg/18/BGT/Schede/Attsen/00032582.htm",,"https://pbs.twimg.com/profile_banners/876541483/1535647109","http://abs.twimg.com/images/themes/theme1/bg.png","http://pbs.twimg.com/profile_images/849030859462246401/ATk3_aiW_normal.jpg"
"x876541483","x1547321901772668928",2022-07-13 20:47:43,"AlbertoBagnai","https://t.co/sI5E91FIDW","Twitter for iPhone",0,,,,FALSE,FALSE,68,6,,,,,,,,"http://pbs.twimg.com/media/FXkxBq0XkAU_SsZ.jpg","https://t.co/sI5E91FIDW","https://twitter.com/AlbertoBagnai/status/1547321901772668928/photo/1","photo","http://pbs.twimg.com/media/FXkxBq0XkAU_SsZ.jpg","https://t.co/sI5E91FIDW","https://twitter.com/AlbertoBagnai/status/1547321901772668928/photo/1",,,,"zxx",,,,,,,,,,,,,,,,,,,,,,,,,,,,,,,,,,,,,"NA NA","NA NA","NA NA NA NA NA NA NA NA","https://twitter.com/AlbertoBagnai/status/1547321901772668928","Alberto Bagnai","","Professore associato di politica economica all’Università Gabriele d’Annunzio, eletto al Senato per la Lega nel collegio Abruzzo 01.","https://t.co/sC5RvUzmsX",FALSE,134948,666,659,227102,6513,2012-10-12 22:13:36,TRUE,"https://t.co/sC5RvUzmsX","http://www.senato.it/leg/18/BGT/Schede/Attsen/00032582.htm",,"https://pbs.twimg.com/profile_banners/876541483/1535647109","http://abs.twimg.com/images/themes/theme1/bg.png","http://pbs.twimg.com/profile_images/849030859462246401/ATk3_aiW_normal.jpg"
"x876541483","x1547310122258644993",2022-07-13 20:00:55,"AlbertoBagnai","Caso Burioni, la nazificazione della società.
Su @byoblu 
Grazie a @KasperReloaded https://t.co/YtUMWoJzf6","Twitter for iPhone",125,,,,FALSE,TRUE,0,127,,,,,,,,"http://pbs.twimg.com/ext_tw_video_thumb/1546774750952931328/pu/img/zrOLqrmnpMgt5Hks.jpg","https://t.co/YtUMWoJzf6","https://twitter.com/CriticaScient/status/1546774785782317056/video/1","photo","http://pbs.twimg.com/ext_tw_video_thumb/1546774750952931328/pu/img/zrOLqrmnpMgt5Hks.jpg","https://t.co/YtUMWoJzf6","https://twitter.com/CriticaScient/status/1546774785782317056/video/1",,"x2264348977 x8873182 x1441174603129262080","CriticaScient byoblu KasperReloaded","it",,,,,,,,,,,,,,,,"x1546774785782317056","Caso Burioni, la nazificazione della società.
Su @byoblu 
Grazie a @KasperReloaded https://t.co/YtUMWoJzf6",2022-07-12 08:33:41,"Twitter for iPhone",300,127,"x2264348977","CriticaScient","Enzo Pennetta",22825,142,24701,"Roma","Ho ideato il sito Critica Scientifica per fare informazione critica sulla scienza e analisi critica dell'informazione.",FALSE,,,,,,,"NA NA","NA NA","NA NA NA NA NA NA NA NA","https://twitter.com/AlbertoBagnai/status/1547310122258644993","Alberto Bagnai","","Professore associato di politica economica all’Università Gabriele d’Annunzio, eletto al Senato per la Lega nel collegio Abruzzo 01.","https://t.co/sC5RvUzmsX",FALSE,134948,666,659,227102,6513,2012-10-12 22:13:36,TRUE,"https://t.co/sC5RvUzmsX","http://www.senato.it/leg/18/BGT/Schede/Attsen/00032582.htm",,"https://pbs.twimg.com/profile_banners/876541483/1535647109","http://abs.twimg.com/images/themes/theme1/bg.png","http://pbs.twimg.com/profile_images/849030859462246401/ATk3_aiW_normal.jpg"
"x876541483","x1547309973151129605",2022-07-13 20:00:19,"AlbertoBagnai","Effetti nocivi della disinformazione medica televisiva. Notare quanto evidenziato  sotto. Essi lo sanno bene 👇 https://t.co/6R6XpKHvUt","Twitter for iPhone",140,,,,FALSE,TRUE,0,156,,,,,,,,,,,,,,,,"x283416650","barbarab1974","it",,,,,,,,,,,,,,,,"x1547116653808390146","Effetti nocivi della disinformazione medica televisiva. Notare quanto evidenziato  sotto. Essi lo sanno bene 👇 https://t.co/6R6XpKHvUt",2022-07-13 07:12:08,"Twitter for iPhone",402,156,"x283416650","barbarab1974","Dr. Barbara BalanZoni 🧱 🐝",64376,2360,58410,"Italia","Anni 47 MedicoAnestesista Rianimatore
Non tratto coi terroristi 
Aspirante alpinista, mi alleno sulla riva del fiume onorando lo scudo spartano 
Mολὼν λαβέ",FALSE,,,,,,,"NA NA","NA NA","NA NA NA NA NA NA NA NA","https://twitter.com/AlbertoBagnai/status/1547309973151129605","Alberto Bagnai","","Professore associato di politica economica all’Università Gabriele d’Annunzio, eletto al Senato per la Lega nel collegio Abruzzo 01.","https://t.co/sC5RvUzmsX",FALSE,134948,666,659,227102,6513,2012-10-12 22:13:36,TRUE,"https://t.co/sC5RvUzmsX","http://www.senato.it/leg/18/BGT/Schede/Attsen/00032582.htm",,"https://pbs.twimg.com/profile_banners/876541483/1535647109","http://abs.twimg.com/images/themes/theme1/bg.png","http://pbs.twimg.com/profile_images/849030859462246401/ATk3_aiW_normal.jpg"
"x876541483","x1547305262570250240",2022-07-13 19:41:36,"AlbertoBagnai","👀 https://t.co/TmLXOUbBlX","Twitter for iPhone",45,,,,FALSE,TRUE,0,81,,,,,,,,"http://pbs.twimg.com/media/FXkhSLkX0AQEReR.jpg","https://t.co/TmLXOUbBlX","https://twitter.com/borghi_claudio/status/1547304547210731522/photo/1","photo","http://pbs.twimg.com/media/FXkhSLkX0AQEReR.jpg","https://t.co/TmLXOUbBlX","https://twitter.com/borghi_claudio/status/1547304547210731522/photo/1",,"x337767301","borghi_claudio","und",,,,,,,,,,,,,,,,"x1547304547210731522","👀 https://t.co/TmLXOUbBlX",2022-07-13 19:38:46,"Twitter for Android",338,81,"x337767301","borghi_claudio","Claudio Borghi A.",139040,1358,230337,"Italia","Deputato della Repubblica Italiana eletto in Toscana per la Lega.",TRUE,,,,,,,"NA NA","NA NA","NA NA NA NA NA NA NA NA","https://twitter.com/AlbertoBagnai/status/1547305262570250240","Alberto Bagnai","","Professore associato di politica economica all’Università Gabriele d’Annunzio, eletto al Senato per la Lega nel collegio Abruzzo 01.","https://t.co/sC5RvUzmsX",FALSE,134948,666,659,227102,6513,2012-10-12 22:13:36,TRUE,"https://t.co/sC5RvUzmsX","http://www.senato.it/leg/18/BGT/Schede/Attsen/00032582.htm",,"https://pbs.twimg.com/profile_banners/876541483/1535647109","http://abs.twimg.com/images/themes/theme1/bg.png","http://pbs.twimg.com/profile_images/849030859462246401/ATk3_aiW_normal.jpg"
"x876541483","x1547291513683582978",2022-07-13 18:46:58,"AlbertoBagnai","@mrczagatti Sei un caro amico amico amico amico!!!!!!!!!","Twitter for iPhone",75,,,,FALSE,TRUE,0,4,,,,,,,,,,,,,,,,"x876541483 x951373672492789760","AlbertoBagnai mrczagatti","it",,,,,,,,,,,,,,,,"x1547291495564189697","@mrczagatti Sei un caro amico amico amico amico!!!!!!!!!",2022-07-13 18:46:54,"Twitter for iPhone",39,4,"x876541483","AlbertoBagnai","Alberto Bagnai",134948,666,227102,"","Professore associato di politica economica all’Università Gabriele d’Annunzio, eletto al Senato per la Lega nel collegio Abruzzo 01.",TRUE,,,,,,,"NA NA","NA NA","NA NA NA NA NA NA NA NA","https://twitter.com/AlbertoBagnai/status/1547291513683582978","Alberto Bagnai","","Professore associato di politica economica all’Università Gabriele d’Annunzio, eletto al Senato per la Lega nel collegio Abruzzo 01.","https://t.co/sC5RvUzmsX",FALSE,134948,666,659,227102,6513,2012-10-12 22:13:36,TRUE,"https://t.co/sC5RvUzmsX","http://www.senato.it/leg/18/BGT/Schede/Attsen/00032582.htm",,"https://pbs.twimg.com/profile_banners/876541483/1535647109","http://abs.twimg.com/images/themes/theme1/bg.png","http://pbs.twimg.com/profile_images/849030859462246401/ATk3_aiW_normal.jpg"
