"x787096200","x1529158294979457025",2022-05-24 17:52:02,"mariopittoni","Riforma reclutamento, Pittoni: “Doppio canale e concorsi, ma prima fare i Pas. Garantire assegnazione provvisoria interprovinciale ai vincolati” https://t.co/K7jd5oTL1z","Twitter Web App",168,,,,FALSE,FALSE,6,1,,,,,"orizzontescuola.it/riforma-reclut…","https://t.co/K7jd5oTL1z","https://www.orizzontescuola.it/riforma-reclutamento-docenti-pittoni-si-ai-concorsi-ma-prima-fare-i-pas-garantire-ai-docenti-vincolati-lassegnazione-provvisoria-interprovinciale/",,,,,,,,,,,"it",,,,,,,,,,,,,,,,,,,,,,,,,,,,,,,,,,,,,"NA NA","NA NA","NA NA NA NA NA NA NA NA","https://twitter.com/mariopittoni/status/1529158294979457025","Mario Pittoni","Senato della Repubblica","Presidente Commissione Cultura Senato - Capo Dipartimento Istruzione Lega","https://t.co/lW05vWXBxu",FALSE,2182,509,18,2640,199,2012-08-28 14:12:07,TRUE,"https://t.co/lW05vWXBxu","http://www.senato.it/leg/18/BGT/Schede/Attsen/00025295.htm",,"https://pbs.twimg.com/profile_banners/787096200/1592384885","http://abs.twimg.com/images/themes/theme1/bg.png","http://pbs.twimg.com/profile_images/962750320957886464/dmbXjabY_normal.jpg"
"x3358881567","x1529440210450259969",2022-05-25 12:32:16,"PucciarelliLega","🐎 In visita presso il Centro Militare di Equitazione dell’@Esercito nell’Ippodromo militare dei Lanceri di Montebello 8° a Tor di Quinto.

https://t.co/ggOa3JB92V https://t.co/H29ApYbA6Z","Twitter Web App",162,,,,FALSE,FALSE,5,5,,,,,"facebook.com/StefaniaPuccia…","https://t.co/ggOa3JB92V","https://www.facebook.com/StefaniaPucciarelli.Lega/posts/pfbid024F7w42k2FBrNrPRJNavBCvN46U9PBA1o8UrGqeMbYfPBQgDMAeXA9GCGMjqZ9GMTl","http://pbs.twimg.com/media/FTmpiTHWIAAYzx2.jpg","https://t.co/H29ApYbA6Z","https://twitter.com/PucciarelliLega/status/1529440210450259969/photo/1","photo","http://pbs.twimg.com/media/FTmpiTHWIAAYzx2.jpg http://pbs.twimg.com/media/FTmpiTEXEAAL0fN.jpg http://pbs.twimg.com/media/FTmpiTGWYAEYC5C.jpg http://pbs.twimg.com/media/FTmpiTAXEAI43dE.jpg","https://t.co/H29ApYbA6Z https://t.co/H29ApYbA6Z https://t.co/H29ApYbA6Z https://t.co/H29ApYbA6Z","https://twitter.com/PucciarelliLega/status/1529440210450259969/photo/1 https://twitter.com/PucciarelliLega/status/1529440210450259969/photo/1 https://twitter.com/PucciarelliLega/status/1529440210450259969/photo/1 https://twitter.com/PucciarelliLega/status/1529440210450259969/photo/1",,"x437337751","Esercito","it",,,,,,,,,,,,,,,,,,,,,,,,,,,,,,,,,,,,,"NA NA","NA NA","NA NA NA NA NA NA NA NA","https://twitter.com/PucciarelliLega/status/1529440210450259969","Stefania Pucciarelli","","Senatrice della #Lega, Sottosegretario di Stato al Ministero della Difesa 🇮🇹","https://t.co/yVArIYFe54",FALSE,1550,295,21,1203,185,2015-07-04 16:46:43,TRUE,"https://t.co/yVArIYFe54","http://stefaniapucciarelli.it",,"https://pbs.twimg.com/profile_banners/3358881567/1616173825","http://abs.twimg.com/images/themes/theme1/bg.png","http://pbs.twimg.com/profile_images/1372958645944729607/A64UTDLI_normal.jpg"
"x558591392","x1529404952136798208",2022-05-25 10:12:10,"QuagliarielloG","All’Aquila gazebo in piazza con @QuagliarielloG e la lista L’Aquila al Centro, per raccontare ai cittadini il grande lavoro fatto e i nostri progetti per il futuro della città… e non solo!

#LAquilaalCentro #BiondiSindaco #ItaliaalCentro https://t.co/qD08IOk94y","Twitter for iPhone",140,,,,FALSE,TRUE,0,2,,,,,,,,,,,,,,,,"x1517124689033900032 x558591392","ItaliaalCentro_ QuagliarielloG","it",,,,,,,,,,,,,,,,"x1529380328166522880","All’Aquila gazebo in piazza con @QuagliarielloG e la lista L’Aquila al Centro, per raccontare ai cittadini il grande lavoro fatto e i nostri progetti per il futuro della città… e non solo!

#LAquilaalCentro #BiondiSindaco #ItaliaalCentro https://t.co/qD08IOk94y",2022-05-25 08:34:19,"Twitter for Android",5,2,"x1517124689033900032","ItaliaalCentro_","Italia al Centro",27,11,56,"","",FALSE,,,,,,,"NA NA","NA NA","NA NA NA NA NA NA NA NA","https://twitter.com/QuagliarielloG/status/1529404952136798208","GaetanoQuagliariello","Roma","Tifoso del Napoli, senatore, vicepresidente “Coraggio Italia”",,FALSE,45958,995,372,2752,820,2012-04-20 12:26:53,FALSE,,,,"https://pbs.twimg.com/profile_banners/558591392/1631101350","http://abs.twimg.com/images/themes/theme16/bg.gif","http://pbs.twimg.com/profile_images/960595536209481728/kscTuSW-_normal.jpg"
"x558591392","x1529372004633169920",2022-05-25 08:01:14,"QuagliarielloG","Ieri bella giornata all’Aquila con gli amici della lista L’Aquila al Centro. Incontri, ascolto, progetti, e poi gazebo in piazza. Questa è la politica che ci piace: ok la tecnologia ma il contatto con le persone è un’altra cosa! E dopo i 2 anni che abbiamo passato scalda il cuore https://t.co/b8AODsxJ5r","Twitter for iPhone",280,,,,FALSE,FALSE,3,1,,,,,,,,"http://pbs.twimg.com/media/FTlruoWWQAAxPSo.jpg","https://t.co/b8AODsxJ5r","https://twitter.com/QuagliarielloG/status/1529372004633169920/photo/1","photo","http://pbs.twimg.com/media/FTlruoWWQAAxPSo.jpg","https://t.co/b8AODsxJ5r","https://twitter.com/QuagliarielloG/status/1529372004633169920/photo/1",,,,"it",,,,,,,,,,,,,,,,,,,,,,,,,,,,,,,,,,,,,"NA NA","NA NA","NA NA NA NA NA NA NA NA","https://twitter.com/QuagliarielloG/status/1529372004633169920","GaetanoQuagliariello","Roma","Tifoso del Napoli, senatore, vicepresidente “Coraggio Italia”",,FALSE,45958,995,372,2752,820,2012-04-20 12:26:53,FALSE,,,,"https://pbs.twimg.com/profile_banners/558591392/1631101350","http://abs.twimg.com/images/themes/theme16/bg.gif","http://pbs.twimg.com/profile_images/960595536209481728/kscTuSW-_normal.jpg"
"x376610294","x1529470245303422978",2022-05-25 14:31:37,"isabellarauti","100 anni fa nasceva Enrico Berlinguer, interprete di una sinistra che ancora aveva contatto con la realtà e vicinanza col popolo. Distante anni luce dalla sinistra lunare che oggi abbiamo in Italia, asserragliata nel Palazzo per paura del voto del popolo italiano.","Twitter for iPhone",140,,,,FALSE,TRUE,0,66,,,,,,,,,,,,,,,,"x130537001","GiorgiaMeloni","it",,,,,,,,,,,,,,,,"x1529469299961868291","100 anni fa nasceva Enrico Berlinguer, interprete di una sinistra che ancora aveva contatto con la realtà e vicinanza col popolo. Distante anni luce dalla sinistra lunare che oggi abbiamo in Italia, asserragliata nel Palazzo per paura del voto del popolo italiano.",2022-05-25 14:27:51,"Twitter for iPhone",531,66,"x130537001","GiorgiaMeloni","Giorgia Meloni 🇮🇹 ن",1220477,927,19219,"Italia","Romana, classe '77. Politica e giornalista. Sempre, ovunque e prima di tutto, italiana. Presidente di @FratellidItalia e di @ECRParty",TRUE,,,,,,,"NA NA","NA NA","NA NA NA NA NA NA NA NA","https://twitter.com/isabellarauti/status/1529470245303422978","Isabella Rauti","","Giornalista, Dottore di Ricerca, Uff Esercito 🇮🇹, Senatrice, Vice Pres Gruppo FDI, Comm Difesa, Dipartimento Famiglia FDI, Associazione Pino Rauti, Onlus HOW","https://t.co/IE1TYO9vGj",FALSE,13012,5564,126,27126,15954,2011-09-20 05:48:40,TRUE,"https://t.co/IE1TYO9vGj","http://www.Isabellarauti.it",,"https://pbs.twimg.com/profile_banners/376610294/1580146815","http://abs.twimg.com/images/themes/theme1/bg.png","http://pbs.twimg.com/profile_images/699248798707621888/sTn5ZaWE_normal.jpg"
"x376610294","x1529466454801883136",2022-05-25 14:16:33,"isabellarauti","🟠 Con il tuo 5x1000 sostieni la Onlus Hands Off Women – HOW e contribuisci anche tu a difendere le donne.
Firma nel riquadro per il ""sostegno delle Organizzazioni Non Lucrative di Utilità Sociale"" e scrivi il codice fiscale 97717850586. Grazie!
Info 👇
https://t.co/iC2ekTixK9 https://t.co/yJ5mLmwpTb","Twitter Web App",140,,,,FALSE,TRUE,0,1,,,,,,,,,,,,,,,,"x821237737","HandsOffWomen_","it",,,,,,,,,,,,,,,,"x1529466290120925185","🟠 Con il tuo 5x1000 sostieni la Onlus Hands Off Women – HOW e contribuisci anche tu a difendere le donne.
Firma nel riquadro per il ""sostegno delle Organizzazioni Non Lucrative di Utilità Sociale"" e scrivi il codice fiscale 97717850586. Grazie!
Info 👇
https://t.co/iC2ekTixK9 https://t.co/yJ5mLmwpTb",2022-05-25 14:15:54,"Twitter Web App",1,1,"x821237737","HandsOffWomen_","HandsOffWomen",880,1471,2594,"","Worldwide network fighting violence against women https://t.co/vDsnJ0ku16",FALSE,,,,,,,"NA NA","NA NA","NA NA NA NA NA NA NA NA","https://twitter.com/isabellarauti/status/1529466454801883136","Isabella Rauti","","Giornalista, Dottore di Ricerca, Uff Esercito 🇮🇹, Senatrice, Vice Pres Gruppo FDI, Comm Difesa, Dipartimento Famiglia FDI, Associazione Pino Rauti, Onlus HOW","https://t.co/IE1TYO9vGj",FALSE,13012,5564,126,27126,15954,2011-09-20 05:48:40,TRUE,"https://t.co/IE1TYO9vGj","http://www.Isabellarauti.it",,"https://pbs.twimg.com/profile_banners/376610294/1580146815","http://abs.twimg.com/images/themes/theme1/bg.png","http://pbs.twimg.com/profile_images/699248798707621888/sTn5ZaWE_normal.jpg"
"x376610294","x1529454955442147335",2022-05-25 13:30:51,"isabellarauti","🔵 Siamo la tua voce. Sostieni Fratelli d’Italia
#2permille 

@FratellidItalia @FDI_Parlamento @GiorgiaMeloni https://t.co/MbCUcrIqUg","Twitter Web App",108,,,,FALSE,FALSE,9,1,,,"2permille",,,,,"http://pbs.twimg.com/media/FTm3HjnX0AgBIyU.jpg","https://t.co/MbCUcrIqUg","https://twitter.com/isabellarauti/status/1529454955442147335/photo/1","photo","http://pbs.twimg.com/media/FTm3HjnX0AgBIyU.jpg","https://t.co/MbCUcrIqUg","https://twitter.com/isabellarauti/status/1529454955442147335/photo/1",,"x1024976264 x985177119624966147 x130537001","FratellidItalia FDI_Parlamento GiorgiaMeloni","it",,,,,,,,,,,,,,,,,,,,,,,,,,,,,,,,,,,,,"NA NA","NA NA","NA NA NA NA NA NA NA NA","https://twitter.com/isabellarauti/status/1529454955442147335","Isabella Rauti","","Giornalista, Dottore di Ricerca, Uff Esercito 🇮🇹, Senatrice, Vice Pres Gruppo FDI, Comm Difesa, Dipartimento Famiglia FDI, Associazione Pino Rauti, Onlus HOW","https://t.co/IE1TYO9vGj",FALSE,13012,5564,126,27126,15954,2011-09-20 05:48:40,TRUE,"https://t.co/IE1TYO9vGj","http://www.Isabellarauti.it",,"https://pbs.twimg.com/profile_banners/376610294/1580146815","http://abs.twimg.com/images/themes/theme1/bg.png","http://pbs.twimg.com/profile_images/699248798707621888/sTn5ZaWE_normal.jpg"
"x376610294","x1529451277549174785",2022-05-25 13:16:15,"isabellarauti","In un tempo nel quale si pensa che la parola data non conti nulla e i partiti cambiano idea e opinioni sui propri avversari in base a poltrone e interessi, #FratellidItalia è rimasta sempre dalla stessa parte. Non cambierà mai quello che pensiamo: #MaiConLaSinistra #MaiCoi5Stelle https://t.co/gieQs2fKUQ","Twitter for iPhone",140,,,,FALSE,TRUE,0,58,,,,,,,,,,,,,,,,"x130537001","GiorgiaMeloni","it",,,,,,,,,,,,,,,,"x1529427660585127938","In un tempo nel quale si pensa che la parola data non conti nulla e i partiti cambiano idea e opinioni sui propri avversari in base a poltrone e interessi, #FratellidItalia è rimasta sempre dalla stessa parte. Non cambierà mai quello che pensiamo: #MaiConLaSinistra #MaiCoi5Stelle https://t.co/gieQs2fKUQ",2022-05-25 11:42:24,"Twitter for iPhone",308,58,"x130537001","GiorgiaMeloni","Giorgia Meloni 🇮🇹 ن",1220477,927,19219,"Italia","Romana, classe '77. Politica e giornalista. Sempre, ovunque e prima di tutto, italiana. Presidente di @FratellidItalia e di @ECRParty",TRUE,,,,,,,"NA NA","NA NA","NA NA NA NA NA NA NA NA","https://twitter.com/isabellarauti/status/1529451277549174785","Isabella Rauti","","Giornalista, Dottore di Ricerca, Uff Esercito 🇮🇹, Senatrice, Vice Pres Gruppo FDI, Comm Difesa, Dipartimento Famiglia FDI, Associazione Pino Rauti, Onlus HOW","https://t.co/IE1TYO9vGj",FALSE,13012,5564,126,27126,15954,2011-09-20 05:48:40,TRUE,"https://t.co/IE1TYO9vGj","http://www.Isabellarauti.it",,"https://pbs.twimg.com/profile_banners/376610294/1580146815","http://abs.twimg.com/images/themes/theme1/bg.png","http://pbs.twimg.com/profile_images/699248798707621888/sTn5ZaWE_normal.jpg"
"x376610294","x1529388725385498624",2022-05-25 09:07:41,"isabellarauti","Scuola. Rauti (FdI): non si ferma offensiva ideologia gender. Ministro Bianchi risponda a interrogazione FdI https://t.co/JYX0LJJtmR","Twitter Web App",140,,,,FALSE,TRUE,0,5,,,,,,,,,,,,,,,,"x998237902055395328","vocedelpatriota","it",,,,,,,,,,,,,,,,"x1529100234156040194","Scuola. Rauti (FdI): non si ferma offensiva ideologia gender. Ministro Bianchi risponda a interrogazione FdI https://t.co/JYX0LJJtmR",2022-05-24 14:01:19,"WordPress.com",23,5,"x998237902055395328","vocedelpatriota","🇮🇹 La Voce del Patriota",8403,3210,21964,"Italia","📰 Il Giornale dei Patrioti",FALSE,,,,,,,"NA NA","NA NA","NA NA NA NA NA NA NA NA","https://twitter.com/isabellarauti/status/1529388725385498624","Isabella Rauti","","Giornalista, Dottore di Ricerca, Uff Esercito 🇮🇹, Senatrice, Vice Pres Gruppo FDI, Comm Difesa, Dipartimento Famiglia FDI, Associazione Pino Rauti, Onlus HOW","https://t.co/IE1TYO9vGj",FALSE,13012,5564,126,27126,15954,2011-09-20 05:48:40,TRUE,"https://t.co/IE1TYO9vGj","http://www.Isabellarauti.it",,"https://pbs.twimg.com/profile_banners/376610294/1580146815","http://abs.twimg.com/images/themes/theme1/bg.png","http://pbs.twimg.com/profile_images/699248798707621888/sTn5ZaWE_normal.jpg"
"x376610294","x1529184233171853312",2022-05-24 19:35:06,"isabellarauti","#24maggio Il Piave mormorava
Calmo e placido, al passaggio
Dei primi fanti, il ventiquattro maggio
L'esercito marciava
Per raggiunger la frontiera
Per far contro il nemico una barriera
(…) 
Il Piave mormorò: ""Non passa lo straniero"" (…) #24maggio https://t.co/vPCqOJPIXm","Twitter for iPhone",246,,,,FALSE,FALSE,22,4,,,"24maggio 24maggio",,,,,"http://pbs.twimg.com/media/FTjA9EGXEAEG920.jpg","https://t.co/vPCqOJPIXm","https://twitter.com/isabellarauti/status/1529184233171853312/photo/1","photo","http://pbs.twimg.com/media/FTjA9EGXEAEG920.jpg","https://t.co/vPCqOJPIXm","https://twitter.com/isabellarauti/status/1529184233171853312/photo/1",,,,"it",,,,,,,,,,,,,,,,,,,,,,,,,,,,,,,,,,,,,"NA NA","NA NA","NA NA NA NA NA NA NA NA","https://twitter.com/isabellarauti/status/1529184233171853312","Isabella Rauti","","Giornalista, Dottore di Ricerca, Uff Esercito 🇮🇹, Senatrice, Vice Pres Gruppo FDI, Comm Difesa, Dipartimento Famiglia FDI, Associazione Pino Rauti, Onlus HOW","https://t.co/IE1TYO9vGj",FALSE,13012,5564,126,27126,15954,2011-09-20 05:48:40,TRUE,"https://t.co/IE1TYO9vGj","http://www.Isabellarauti.it",,"https://pbs.twimg.com/profile_banners/376610294/1580146815","http://abs.twimg.com/images/themes/theme1/bg.png","http://pbs.twimg.com/profile_images/699248798707621888/sTn5ZaWE_normal.jpg"
"x18762875","x1529339127291957248",2022-05-25 05:50:36,"matteorenzi","Di nuovo una strage di bambini e insegnanti in #Texas. Atrocità totale. Che almeno stavolta si cambino per sempre le regole sulle armi. Ma quale assurdo e indicibile dolore per quelle famiglie","Twitter for iPhone",192,,,,FALSE,FALSE,716,116,,,"Texas",,,,,,,,,,,,,,,"it",,,,,,,,,,,,,,,,,,,,,,,,,,,,,,,,,,,,,"NA NA","NA NA","NA NA NA NA NA NA NA NA","https://twitter.com/matteorenzi/status/1529339127291957248","Matteo Renzi","Italy","Senatore di Firenze - @ItaliaViva https://t.co/Dotkinbk9x","https://t.co/c8MoZ1Wbev",FALSE,3352228,979,7453,13744,466,2009-01-08 13:15:21,TRUE,"https://t.co/c8MoZ1Wbev","https://linktr.ee/matteorenzi",,"https://pbs.twimg.com/profile_banners/18762875/1632829942","http://abs.twimg.com/images/themes/theme1/bg.png","http://pbs.twimg.com/profile_images/1463528035798376449/TUDITp4H_normal.jpg"
"x395183088","x1529509353350381568",2022-05-25 17:07:01,"MatteoRichetti","@ValentinaGrippo Bravissima Velentina!!","Twitter for iPhone",22,"x1529482136922869763","x469408654","ValentinaGrippo",FALSE,FALSE,2,0,,,,,,,,,,,,,,,,"x469408654","ValentinaGrippo","pt",,,,,,,,,,,,,,,,,,,,,,,,,,,,,,,,,,,,,"NA NA","NA NA","NA NA NA NA NA NA NA NA","https://twitter.com/MatteoRichetti/status/1529509353350381568","Matteo Richetti","","Senatore della Repubblica. @Azione_it","https://t.co/duGJXuHHqq",FALSE,60902,302,356,5100,3961,2011-10-21 08:15:44,TRUE,"https://t.co/duGJXuHHqq","http://www.matteorichetti.it",,"https://pbs.twimg.com/profile_banners/395183088/1651131592","http://abs.twimg.com/images/themes/theme1/bg.png","http://pbs.twimg.com/profile_images/1519586614305234945/DluHNkS6_normal.jpg"
"x395183088","x1529463615862054912",2022-05-25 14:05:16,"MatteoRichetti","Domani dalle 20.30 all'hotel Poppi (in Romea a #Gambarare) incontrerò il presidente di Azione @MatteoRichetti con le candidate e i candidati della stessa lista. 
Dalle ore 19 @Azione_it parlerà in loco di #mafie e giustizia con Paola Pastorino, Maurizio Visconti e Luca Cotecchia. https://t.co/asWfLOrv3Q","Twitter for iPhone",140,,,,FALSE,TRUE,0,4,,,"Gambarare",,,,,,,,,,,,,"x521167438 x395183088","marco_dori MatteoRichetti","it",,,,,,,,,,,,,,,,"x1529458975078375425","Domani dalle 20.30 all'hotel Poppi (in Romea a #Gambarare) incontrerò il presidente di Azione @MatteoRichetti con le candidate e i candidati della stessa lista. 
Dalle ore 19 @Azione_it parlerà in loco di #mafie e giustizia con Paola Pastorino, Maurizio Visconti e Luca Cotecchia. https://t.co/asWfLOrv3Q",2022-05-25 13:46:50,"Twitter Web App",12,4,"x521167438","marco_dori","Marco Dori",111,75,1796,"Mira, Veneto","sindaco di Mira (Venezia), Riviera del Brenta.",FALSE,,,,,,,"NA NA","NA NA","NA NA NA NA NA NA NA NA","https://twitter.com/MatteoRichetti/status/1529463615862054912","Matteo Richetti","","Senatore della Repubblica. @Azione_it","https://t.co/duGJXuHHqq",FALSE,60902,302,356,5100,3961,2011-10-21 08:15:44,TRUE,"https://t.co/duGJXuHHqq","http://www.matteorichetti.it",,"https://pbs.twimg.com/profile_banners/395183088/1651131592","http://abs.twimg.com/images/themes/theme1/bg.png","http://pbs.twimg.com/profile_images/1519586614305234945/DluHNkS6_normal.jpg"
"x395183088","x1529392844976308224",2022-05-25 09:24:03,"MatteoRichetti","Non è un libro che parla di @Azione_it né di me. Ma un lavoro per riscoprire il valore del limite. Senza di questo l'individuo prevarica sulla comunità. Non possiamo vivere come negli ultimi trent'anni pensando che la libertà sia illimitata.

La mia intervista a @fanpage https://t.co/PXnjnBO9FG","Twitter for iPhone",140,,,,FALSE,TRUE,0,18,,,,,,,,,,,,,,,,"x2416067982 x1001344387102728194","CarloCalenda Azione_it","it",,,,,,,,,,,,,,,,"x1529387463759863809","Non è un libro che parla di @Azione_it né di me. Ma un lavoro per riscoprire il valore del limite. Senza di questo l'individuo prevarica sulla comunità. Non possiamo vivere come negli ultimi trent'anni pensando che la libertà sia illimitata.

La mia intervista a @fanpage https://t.co/PXnjnBO9FG",2022-05-25 09:02:40,"Twitter Media Studio",87,18,"x2416067982","CarloCalenda","Carlo Calenda",347580,154,32096,"Roma","L’Italia è più forte di chi la vuole debole. Only a Sith deals in absolutes. @Azione_it   La libertà che non libera: https://t.co/dYBNv1Rv6p",TRUE,,,,,,,"NA NA","NA NA","NA NA NA NA NA NA NA NA","https://twitter.com/MatteoRichetti/status/1529392844976308224","Matteo Richetti","","Senatore della Repubblica. @Azione_it","https://t.co/duGJXuHHqq",FALSE,60902,302,356,5100,3961,2011-10-21 08:15:44,TRUE,"https://t.co/duGJXuHHqq","http://www.matteorichetti.it",,"https://pbs.twimg.com/profile_banners/395183088/1651131592","http://abs.twimg.com/images/themes/theme1/bg.png","http://pbs.twimg.com/profile_images/1519586614305234945/DluHNkS6_normal.jpg"
"x395183088","x1529363345119367171",2022-05-25 07:26:50,"MatteoRichetti","A Sabaudia @Azione_it ha messo in campo un gruppo forte, coeso e ricco di competenze. Abbiamo elaborato un progetto politico solido e di lungo termine per la città, ieri con @MatteoRichetti e @ValentinaGrippo abbiamo raccontato tutto ciò davanti ad una numerosissima platea! https://t.co/YnfbxRvmEA","Twitter for iPhone",140,,,,FALSE,TRUE,0,5,,,,,,,,,,,,,,,,"x1031362476 x1001344387102728194","DZingaretti Azione_it","it",,,,,,,,,,,,,,,,"x1529357198127779840","A Sabaudia @Azione_it ha messo in campo un gruppo forte, coeso e ricco di competenze. Abbiamo elaborato un progetto politico solido e di lungo termine per la città, ieri con @MatteoRichetti e @ValentinaGrippo abbiamo raccontato tutto ciò davanti ad una numerosissima platea! https://t.co/YnfbxRvmEA",2022-05-25 07:02:24,"Twitter for iPhone",33,5,"x1031362476","DZingaretti","Davide Zingaretti",577,505,4615,"Aprilia (LT) Italia","Consigliere Comunale ad Aprilia | Giovani Amministratori @anci_lazio | Segretario Provinciale di @Azione_it a Latina | Master in European Studies @uniluiss",FALSE,,,,,,,"NA NA","NA NA","NA NA NA NA NA NA NA NA","https://twitter.com/MatteoRichetti/status/1529363345119367171","Matteo Richetti","","Senatore della Repubblica. @Azione_it","https://t.co/duGJXuHHqq",FALSE,60902,302,356,5100,3961,2011-10-21 08:15:44,TRUE,"https://t.co/duGJXuHHqq","http://www.matteorichetti.it",,"https://pbs.twimg.com/profile_banners/395183088/1651131592","http://abs.twimg.com/images/themes/theme1/bg.png","http://pbs.twimg.com/profile_images/1519586614305234945/DluHNkS6_normal.jpg"
"x1122573690","x1529386829400743936",2022-05-25 09:00:09,"erica_rivolta","#Salvini: Un abbraccio Martina, e tanta pena per quei vigliacchi. https://t.co/MhwBAKzHqV","Hootsuite Inc.",65,,,,FALSE,FALSE,6,1,,,"Salvini",,,,,"http://pbs.twimg.com/media/FTl5N43XEAAUD3A.jpg","https://t.co/MhwBAKzHqV","https://twitter.com/erica_rivolta/status/1529386829400743936/photo/1","photo","http://pbs.twimg.com/media/FTl5N43XEAAUD3A.jpg","https://t.co/MhwBAKzHqV","https://twitter.com/erica_rivolta/status/1529386829400743936/photo/1",,,,"it",,,,,,,,,,,,,,,,,,,,,,,,,,,,,,,,,,,,,"NA NA","NA NA","NA NA NA NA NA NA NA NA","https://twitter.com/erica_rivolta/status/1529386829400743936","Erica Rivolta","Erba (CO)","🟢 SENATRICE LEGA (Vice Presidente della Commissione Bilancio)📍Vice Sindaco/Assessore Lega - Comune di Erba","https://t.co/8MWzTAMw85",FALSE,1130,189,21,2198,373,2013-01-26 17:05:04,TRUE,"https://t.co/8MWzTAMw85","http://www.senato.it/leg/18/BGT/Schede/Attsen/00025415.htm",,"https://pbs.twimg.com/profile_banners/1122573690/1591381827","http://abs.twimg.com/images/themes/theme13/bg.gif","http://pbs.twimg.com/profile_images/961570463460855811/wfFcEjNJ_normal.jpg"
"x3111038797","x1529403057120763904",2022-05-25 10:04:38,"Maria_Rizzotti","Ora intervengo in Aula in discussione della relazione della Commissione Femminicidio sui percorsi di trattamento per uomini autori di violenza https://t.co/BKNNm0aA7t","Periscope",166,,,,FALSE,FALSE,1,1,,,,,"twitter.com/i/broadcasts/1…","https://t.co/BKNNm0aA7t","https://twitter.com/i/broadcasts/1ypKdEvLeRqGW",,,,,,,,,,,"it",,,,,,,,,,,,,,,,,,,,,,,,,,,,,,,,,,,,,"NA NA","NA NA","NA NA NA NA NA NA NA NA","https://twitter.com/Maria_Rizzotti/status/1529403057120763904","Maria Rizzotti","Italia","Senatrice della Repubblica Italiana per @Forza_Italia. Vicepresidente Gruppo Forza Italia Senato. Vicepresidente Commissione Femminicidio","https://t.co/XYq93BsDrL",FALSE,2139,283,19,1861,673,2015-03-27 19:15:24,TRUE,"https://t.co/XYq93BsDrL","http://www.senato.it/leg/17/BGT/Schede/Attsen/00025198.htm",,"https://pbs.twimg.com/profile_banners/3111038797/1621344085","http://abs.twimg.com/images/themes/theme1/bg.png","http://pbs.twimg.com/profile_images/1394004235272982531/eIrle4Pc_normal.jpg"
"x565272070","x1529469956617814018",2022-05-25 14:30:28,"tatjana_rojc","LIVE AL SENATO: il Senatore Dario Parrini ricorda per il PD il centenario della nascita di Enrico Berlinguer./
Senator Demokratske stranke Dario Parrini v avli ob 100.letnici rojstva Enrica Berlinguerja. https://t.co/8E2i5hDkwc","Twitter for Android",203,,,,FALSE,FALSE,4,2,,,,,,,,"http://pbs.twimg.com/media/FTnE0JNX0AAGrzf.jpg","https://t.co/8E2i5hDkwc","https://twitter.com/tatjana_rojc/status/1529469956617814018/photo/1","photo","http://pbs.twimg.com/media/FTnE0JNX0AAGrzf.jpg","https://t.co/8E2i5hDkwc","https://twitter.com/tatjana_rojc/status/1529469956617814018/photo/1",,,,"sl",,,,,,,,,,,,,,,,,,,,,,,,,,,,,,,,,,,,,"NA NA","NA NA","NA NA NA NA NA NA NA NA","https://twitter.com/tatjana_rojc/status/1529469956617814018","tatjana rojc","","Senatore XVIII Legislatura",,FALSE,1023,878,17,2249,23692,2012-04-28 08:18:24,FALSE,,,,,"http://abs.twimg.com/images/themes/theme1/bg.png","http://pbs.twimg.com/profile_images/1191117433203019776/46nc9D4D_normal.jpg"
"x3556304655","x1529466374623477765",2022-05-25 14:16:14,"iunioromano","Oggi al Convegno ""#Salute e #sicurezza dei lavoratori in un mondo del #lavoro in continua evoluzione"", organizzato dalla Monocamerale infortuni. 

... una società del lavoro migliore, dove l'uomo non esiste per lavorare, ma il lavoro esiste per l'uomo (cit.).
@SenatoStampa https://t.co/ZIJCU6D2Pu","Twitter for Android",273,,,,FALSE,FALSE,1,2,,,"Salute sicurezza lavoro",,,,,"http://pbs.twimg.com/media/FTnBj7eWUAYbDss.jpg","https://t.co/ZIJCU6D2Pu","https://twitter.com/iunioromano/status/1529466374623477765/photo/1","photo","http://pbs.twimg.com/media/FTnBj7eWUAYbDss.jpg","https://t.co/ZIJCU6D2Pu","https://twitter.com/iunioromano/status/1529466374623477765/photo/1",,"x1377373874","SenatoStampa","it",,,,,,,,,,,,,,,,,,,,,,,,,,,,,,,,,,,,,"NA NA","NA NA","NA NA NA NA NA NA NA NA","https://twitter.com/iunioromano/status/1529466374623477765","Iunio Valerio Romano","","Senatore della Repubblica Italiana 🇮🇹
@Mov5Stelle 
https://t.co/lKbz1cADhD","https://t.co/LQRw56YgUJ",FALSE,789,1101,11,440,73,2015-09-05 14:39:17,TRUE,"https://t.co/LQRw56YgUJ","http://www.senato.it/leg/18/BGT/Schede/Attsen/00032705.htm",,"https://pbs.twimg.com/profile_banners/3556304655/1571259894","http://abs.twimg.com/images/themes/theme1/bg.png","http://pbs.twimg.com/profile_images/1158359679136927745/u6YVJ-BE_normal.jpg"
