"user_id","status_id","created_at","screen_name","text","source","display_text_width","reply_to_status_id","reply_to_user_id","reply_to_screen_name","is_quote","is_retweet","favorite_count","retweet_count","quote_count","reply_count","hashtags","symbols","urls_url","urls_t.co","urls_expanded_url","media_url","media_t.co","media_expanded_url","media_type","ext_media_url","ext_media_t.co","ext_media_expanded_url","ext_media_type","mentions_user_id","mentions_screen_name","lang","quoted_status_id","quoted_text","quoted_created_at","quoted_source","quoted_favorite_count","quoted_retweet_count","quoted_user_id","quoted_screen_name","quoted_name","quoted_followers_count","quoted_friends_count","quoted_statuses_count","quoted_location","quoted_description","quoted_verified","retweet_status_id","retweet_text","retweet_created_at","retweet_source","retweet_favorite_count","retweet_retweet_count","retweet_user_id","retweet_screen_name","retweet_name","retweet_followers_count","retweet_friends_count","retweet_statuses_count","retweet_location","retweet_description","retweet_verified","place_url","place_name","place_full_name","place_type","country","country_code","geo_coords","coords_coords","bbox_coords","status_url","name","location","description","url","protected","followers_count","friends_count","listed_count","statuses_count","favourites_count","account_created_at","verified","profile_url","profile_expanded_url","account_lang","profile_banner_url","profile_background_url","profile_image_url"
"x270839361","x1500864471727755266",2022-03-07 16:02:29,"matteosalvinimi","Ho incontrato nella sede dell’Ambasciata d’Italia in Polonia i rappresentanti delle nostre più importanti imprese a Varsavia per fare il punto sugli aiuti ai profughi e sulla possibilità di aiutare e sostenere l’accoglienza nel nostro Paese. Vi tengo aggiornati. https://t.co/uq2rp9c9rU","Twitter for iPhone",262,,,,FALSE,FALSE,366,66,,,,,,,,"http://pbs.twimg.com/media/FNQkR2-XMAID9No.jpg","https://t.co/uq2rp9c9rU","https://twitter.com/matteosalvinimi/status/1500864471727755266/photo/1","photo","http://pbs.twimg.com/media/FNQkR2-XMAID9No.jpg http://pbs.twimg.com/media/FNQkR2_XIAIKZ_T.jpg http://pbs.twimg.com/media/FNQkR2-WQAM0KA_.jpg","https://t.co/uq2rp9c9rU https://t.co/uq2rp9c9rU https://t.co/uq2rp9c9rU","https://twitter.com/matteosalvinimi/status/1500864471727755266/photo/1 https://twitter.com/matteosalvinimi/status/1500864471727755266/photo/1 https://twitter.com/matteosalvinimi/status/1500864471727755266/photo/1",,,,"it",,,,,,,,,,,,,,,,,,,,,,,,,,,,,,,,,,,,,"NA NA","NA NA","NA NA NA NA NA NA NA NA","https://twitter.com/matteosalvinimi/status/1500864471727755266","Matteo Salvini","","Leader della Lega #primagliitaliani 🇮🇹","https://t.co/sj3rr6DU3N",FALSE,1457201,2016,3106,52682,3847,2011-03-23 10:32:56,TRUE,"https://t.co/sj3rr6DU3N","https://legaonline.it/",,"https://pbs.twimg.com/profile_banners/270839361/1641590097","http://abs.twimg.com/images/themes/theme1/bg.png","http://pbs.twimg.com/profile_images/966325945060732928/0Ua5xPMX_normal.jpg"
"x270839361","x1500775922911301633",2022-03-07 10:10:37,"matteosalvinimi","Aiutare queste persone in fuga dalla guerra è un Dovere, ognuno faccia ciò che può per salvare vite e fermare la morte. https://t.co/5G4HjwOqqy","Twitter for iPhone",119,,,,FALSE,FALSE,925,117,,,,,,,,"http://pbs.twimg.com/media/FNPTvvHWYAEAQF0.jpg","https://t.co/5G4HjwOqqy","https://twitter.com/matteosalvinimi/status/1500775922911301633/photo/1","photo","http://pbs.twimg.com/media/FNPTvvHWYAEAQF0.jpg","https://t.co/5G4HjwOqqy","https://twitter.com/matteosalvinimi/status/1500775922911301633/photo/1",,,,"it",,,,,,,,,,,,,,,,,,,,,,,,,,,,,,,,,,,,,"NA NA","NA NA","NA NA NA NA NA NA NA NA","https://twitter.com/matteosalvinimi/status/1500775922911301633","Matteo Salvini","","Leader della Lega #primagliitaliani 🇮🇹","https://t.co/sj3rr6DU3N",FALSE,1457201,2016,3106,52682,3847,2011-03-23 10:32:56,TRUE,"https://t.co/sj3rr6DU3N","https://legaonline.it/",,"https://pbs.twimg.com/profile_banners/270839361/1641590097","http://abs.twimg.com/images/themes/theme1/bg.png","http://pbs.twimg.com/profile_images/966325945060732928/0Ua5xPMX_normal.jpg"
"x48062712","x1500937367808524288",2022-03-07 20:52:09,"luigidimaio","📞 Min. @luigidimaio con SG #ONU @antonioguterres per discutere ultimi sviluppi #Ucraina. Riaffermata necessità di porre fine a guerra e aprire la porta a diplomazia. Massimo impegno 🇮🇹 per garantire assistenza umanitaria a popolazione 🇺🇦 in stretto coordinamento con sistema @UN https://t.co/acqyFHqLG3","Twitter for iPhone",139,,,,FALSE,TRUE,0,24,,,"ONU Ucraina",,,,,,,,,,,,,"x599114492 x48062712 x811229675758505984","ItalyMFA luigidimaio antonioguterres","it",,,,,,,,,,,,,,,,"x1500932718569443344","📞 Min. @luigidimaio con SG #ONU @antonioguterres per discutere ultimi sviluppi #Ucraina. Riaffermata necessità di porre fine a guerra e aprire la porta a diplomazia. Massimo impegno 🇮🇹 per garantire assistenza umanitaria a popolazione 🇺🇦 in stretto coordinamento con sistema @UN https://t.co/acqyFHqLG3",2022-03-07 20:33:40,"Twitter Web App",106,24,"x599114492","ItalyMFA","Farnesina 🇮🇹",260598,952,15636,"Roma, Italia","Profilo ufficiale del Ministero degli Affari Esteri e della Cooperazione Internazionale | Follow us in other languages at @ItalyMFA_int",TRUE,,,,,,,"NA NA","NA NA","NA NA NA NA NA NA NA NA","https://twitter.com/luigidimaio/status/1500937367808524288","Luigi Di Maio","Pomigliano d'Arco, Campania","Ministro degli Affari Esteri e della Cooperazione Internazionale.","https://t.co/D8gkagqksG",FALSE,758186,345,2201,6905,369,2009-06-17 18:34:46,TRUE,"https://t.co/D8gkagqksG","http://www.luigidimaio.it",,"https://pbs.twimg.com/profile_banners/48062712/1645985183","http://abs.twimg.com/images/themes/theme1/bg.png","http://pbs.twimg.com/profile_images/933106806670462976/YyC7LOW8_normal.jpg"
"x48062712","x1500835555004882946",2022-03-07 14:07:35,"luigidimaio","Questa guerra si risolve solo con una soluzione diplomatica, non con un’altra guerra.
Adesso serve subito un cessate il fuoco.

Vi informo sulle ultime notizie ad #OggièUnAltroGiorno.

https://t.co/U8IPpNW2FS","Twitter for iPhone",208,,,,FALSE,FALSE,241,39,,,"OggièUnAltroGiorno",,"facebook.com/LuigiDiMaio/vi…","https://t.co/U8IPpNW2FS","https://www.facebook.com/LuigiDiMaio/videos/645772946655621/",,,,,,,,,,,"it",,,,,,,,,,,,,,,,,,,,,,,,,,,,,,,,,,,,,"NA NA","NA NA","NA NA NA NA NA NA NA NA","https://twitter.com/luigidimaio/status/1500835555004882946","Luigi Di Maio","Pomigliano d'Arco, Campania","Ministro degli Affari Esteri e della Cooperazione Internazionale.","https://t.co/D8gkagqksG",FALSE,758186,345,2201,6905,369,2009-06-17 18:34:46,TRUE,"https://t.co/D8gkagqksG","http://www.luigidimaio.it",,"https://pbs.twimg.com/profile_banners/48062712/1645985183","http://abs.twimg.com/images/themes/theme1/bg.png","http://pbs.twimg.com/profile_images/933106806670462976/YyC7LOW8_normal.jpg"
"x1075084718","x1500928158090113027",2022-03-07 20:15:33,"arrigoni_paolo","Non solo luce e gas, governo intervenga anche per contenere costo carburanti che rischia di mettere in crisi settori strategici come pesca e agricoltura. Lega chiede a tutti partiti di sostenere emendamento ad hoc al Decreto Energia: famiglie e imprese meritano aiuti e meno tasse","Twitter for Android",140,,,,FALSE,TRUE,0,128,,,,,,,,,,,,,,,,"x270839361","matteosalvinimi","it",,,,,,,,,,,,,,,,"x1500554094251057158","Non solo luce e gas, governo intervenga anche per contenere costo carburanti che rischia di mettere in crisi settori strategici come pesca e agricoltura. Lega chiede a tutti partiti di sostenere emendamento ad hoc al Decreto Energia: famiglie e imprese meritano aiuti e meno tasse",2022-03-06 19:29:09,"Twitter for iPhone",991,128,"x270839361","matteosalvinimi","Matteo Salvini",1457201,2016,52682,"","Leader della Lega #primagliitaliani 🇮🇹",TRUE,,,,,,,"NA NA","NA NA","NA NA NA NA NA NA NA NA","https://twitter.com/arrigoni_paolo/status/1500928158090113027","Paolo Arrigoni","Calolziocorte, Lombardia","Questore del Senato della Repubblica, componente della Commissione Ambiente e del Copasir. Responsabile del Dipartimento Energia della Lega.","https://t.co/M6TePkOvfO",FALSE,4752,185,56,9864,113,2013-01-09 22:36:27,TRUE,"https://t.co/M6TePkOvfO","http://www.senato.it/leg/18/BGT/Schede/Attsen/00029039.htm",,"https://pbs.twimg.com/profile_banners/1075084718/1591968708","http://abs.twimg.com/images/themes/theme1/bg.png","http://pbs.twimg.com/profile_images/3172370357/bec3e4497d64c77f2a93bc9792055992_normal.jpeg"
"x2900717633","x1500906332177772548",2022-03-07 18:48:49,"BrunoAstorre","Anche i @senatoripd in piazza il 12 marzo a Firenze, insieme a tanti sindaci di tutta Europa, alla manifestazione unitaria promossa da @DarioNardella, presidente di @EUROCITIES. Siamo a fianco del popolo ucraino. #AFirenzePerLaPace #StopWarInUkraine","Twitter for Android",140,,,,FALSE,TRUE,0,17,,,,,,,,,,,,,,,,"x428521248 x404048864","SimonaMalpezzi SenatoriPD","it",,,,,,,,,,,,,,,,"x1500869297106788356","Anche i @senatoripd in piazza il 12 marzo a Firenze, insieme a tanti sindaci di tutta Europa, alla manifestazione unitaria promossa da @DarioNardella, presidente di @EUROCITIES. Siamo a fianco del popolo ucraino. #AFirenzePerLaPace #StopWarInUkraine",2022-03-07 16:21:39,"Twitter for iPhone",67,17,"x428521248","SimonaMalpezzi","Simona Malpezzi",21695,1084,8783,"","Insegnante. Mamma di Flavia Heléne e Charlotte. Presidente dei @senatoripd",TRUE,,,,,,,"NA NA","NA NA","NA NA NA NA NA NA NA NA","https://twitter.com/BrunoAstorre/status/1500906332177772548","Bruno Astorre","","Senatore del PD. Membro Direzione nazionale PD. Provengo da una scuola che interpreta la politica come strumento, non come fine.","https://t.co/r8sKGpcczb",FALSE,1737,198,36,2023,170,2014-12-01 15:48:11,TRUE,"https://t.co/r8sKGpcczb","http://www.brunoastorre.it",,"https://pbs.twimg.com/profile_banners/2900717633/1546257168","http://abs.twimg.com/images/themes/theme1/bg.png","http://pbs.twimg.com/profile_images/1058727872578371589/FY_KiON0_normal.jpg"
"x876541483","x1500954675171921920",2022-03-07 22:00:55,"AlbertoBagnai","Domani, su @LaVeritaWeb, il punto su quello che sta accadendo nell'economia del nostro paese. Due paginone fitte di contenuti.","Twitter for iPhone",140,,,,FALSE,TRUE,0,83,,,,,,,,,,,,,,,,"x2341987590 x900766265245130753","durezzadelviver LaVeritaWeb","it",,,,,,,,,,,,,,,,"x1500886358818230280","Domani, su @LaVeritaWeb, il punto su quello che sta accadendo nell'economia del nostro paese. Due paginone fitte di contenuti.",2022-03-07 17:29:27,"Twitter Web App",300,83,"x2341987590","durezzadelviver","La durezza del vivere 🇬🇷",22856,1875,45050,"Italia","Energia. La sovranità appartiene al popolo. Ogni tanto scrivo su @LaVeritaweb. Telegram: https://t.co/Av0i0ETtvq…",FALSE,,,,,,,"NA NA","NA NA","NA NA NA NA NA NA NA NA","https://twitter.com/AlbertoBagnai/status/1500954675171921920","Alberto Bagnai","","Professore associato di politica economica all’Università Gabriele d’Annunzio, eletto al Senato per la Lega nel collegio Abruzzo 01.","https://t.co/sC5RvUzmsX",FALSE,132923,666,656,223225,6482,2012-10-12 22:13:36,TRUE,"https://t.co/sC5RvUzmsX","http://www.senato.it/leg/18/BGT/Schede/Attsen/00032582.htm",,"https://pbs.twimg.com/profile_banners/876541483/1535647109","http://abs.twimg.com/images/themes/theme1/bg.png","http://pbs.twimg.com/profile_images/849030859462246401/ATk3_aiW_normal.jpg"
"x876541483","x1500881381701963788",2022-03-07 17:09:41,"AlbertoBagnai","Connesso, ma non sento lo studio...","Twitter Web App",35,,,,FALSE,FALSE,45,5,,,,,,,,,,,,,,,,,,"it",,,,,,,,,,,,,,,,,,,,,,,,,,,,,,,,,,,,,"NA NA","NA NA","NA NA NA NA NA NA NA NA","https://twitter.com/AlbertoBagnai/status/1500881381701963788","Alberto Bagnai","","Professore associato di politica economica all’Università Gabriele d’Annunzio, eletto al Senato per la Lega nel collegio Abruzzo 01.","https://t.co/sC5RvUzmsX",FALSE,132923,666,656,223225,6482,2012-10-12 22:13:36,TRUE,"https://t.co/sC5RvUzmsX","http://www.senato.it/leg/18/BGT/Schede/Attsen/00032582.htm",,"https://pbs.twimg.com/profile_banners/876541483/1535647109","http://abs.twimg.com/images/themes/theme1/bg.png","http://pbs.twimg.com/profile_images/849030859462246401/ATk3_aiW_normal.jpg"
"x876541483","x1500879085228249089",2022-03-07 17:00:33,"AlbertoBagnai","Alle 18 (cioè ora, se chiamano) mezz'ora di lessico parlamentare su @radiolibertanet. RT.","Twitter Web App",89,,,,FALSE,FALSE,78,25,,,,,,,,,,,,,,,,"x749461495","radiolibertanet","it",,,,,,,,,,,,,,,,,,,,,,,,,,,,,,,,,,,,,"NA NA","NA NA","NA NA NA NA NA NA NA NA","https://twitter.com/AlbertoBagnai/status/1500879085228249089","Alberto Bagnai","","Professore associato di politica economica all’Università Gabriele d’Annunzio, eletto al Senato per la Lega nel collegio Abruzzo 01.","https://t.co/sC5RvUzmsX",FALSE,132923,666,656,223225,6482,2012-10-12 22:13:36,TRUE,"https://t.co/sC5RvUzmsX","http://www.senato.it/leg/18/BGT/Schede/Attsen/00032582.htm",,"https://pbs.twimg.com/profile_banners/876541483/1535647109","http://abs.twimg.com/images/themes/theme1/bg.png","http://pbs.twimg.com/profile_images/849030859462246401/ATk3_aiW_normal.jpg"
"x876541483","x1500832005570838529",2022-03-07 13:53:28,"AlbertoBagnai","Uno mi ha appena detto che i russi creano notizie e documenti falsi per giustificare le loro azioni.

Dico allora che anche noi potremmo fare la stessa cosa.

Mi risponde di no.
""Noi queste cose non le facciamo""

Capito perché è stato semplice chiuderci per 2 anni?","Twitter for iPhone",140,,,,FALSE,TRUE,0,294,,,,,,,,,,,,,,,,"x2575112879","LaPiramide__","it",,,,,,,,,,,,,,,,"x1500584347350577156","Uno mi ha appena detto che i russi creano notizie e documenti falsi per giustificare le loro azioni.

Dico allora che anche noi potremmo fare la stessa cosa.

Mi risponde di no.
""Noi queste cose non le facciamo""

Capito perché è stato semplice chiuderci per 2 anni?",2022-03-06 21:29:22,"Twitter for Android",1197,294,"x2575112879","LaPiramide__","La Piramide 🇷🇪",4957,379,16911,"Italia","Che la Piramide sia con tutti voi.",FALSE,,,,,,,"NA NA","NA NA","NA NA NA NA NA NA NA NA","https://twitter.com/AlbertoBagnai/status/1500832005570838529","Alberto Bagnai","","Professore associato di politica economica all’Università Gabriele d’Annunzio, eletto al Senato per la Lega nel collegio Abruzzo 01.","https://t.co/sC5RvUzmsX",FALSE,132923,666,656,223225,6482,2012-10-12 22:13:36,TRUE,"https://t.co/sC5RvUzmsX","http://www.senato.it/leg/18/BGT/Schede/Attsen/00032582.htm",,"https://pbs.twimg.com/profile_banners/876541483/1535647109","http://abs.twimg.com/images/themes/theme1/bg.png","http://pbs.twimg.com/profile_images/849030859462246401/ATk3_aiW_normal.jpg"
"x876541483","x1500831428468166658",2022-03-07 13:51:11,"AlbertoBagnai","Magari se lo si fosse fatto prima, invece di perdere tempo con il catasto... https://t.co/ShSugJcumh","Twitter for iPhone",120,,,,FALSE,TRUE,0,128,,,,,,,,"http://pbs.twimg.com/media/FNQFHcUWQAALPmT.jpg","https://t.co/ShSugJcumh","https://twitter.com/borghi_claudio/status/1500830203949551620/photo/1","photo","http://pbs.twimg.com/media/FNQFHcUWQAALPmT.jpg","https://t.co/ShSugJcumh","https://twitter.com/borghi_claudio/status/1500830203949551620/photo/1",,"x337767301","borghi_claudio","it",,,,,,,,,,,,,,,,"x1500830203949551620","Magari se lo si fosse fatto prima, invece di perdere tempo con il catasto... https://t.co/ShSugJcumh",2022-03-07 13:46:19,"Twitter for Android",446,128,"x337767301","borghi_claudio","Claudio Borghi A.",131745,1339,220632,"Italia","Deputato della Repubblica Italiana eletto in Toscana per la Lega. Consigliere Comunale di Como",TRUE,,,,,,,"NA NA","NA NA","NA NA NA NA NA NA NA NA","https://twitter.com/AlbertoBagnai/status/1500831428468166658","Alberto Bagnai","","Professore associato di politica economica all’Università Gabriele d’Annunzio, eletto al Senato per la Lega nel collegio Abruzzo 01.","https://t.co/sC5RvUzmsX",FALSE,132923,666,656,223225,6482,2012-10-12 22:13:36,TRUE,"https://t.co/sC5RvUzmsX","http://www.senato.it/leg/18/BGT/Schede/Attsen/00032582.htm",,"https://pbs.twimg.com/profile_banners/876541483/1535647109","http://abs.twimg.com/images/themes/theme1/bg.png","http://pbs.twimg.com/profile_images/849030859462246401/ATk3_aiW_normal.jpg"
"x876541483","x1500831370041561090",2022-03-07 13:50:57,"AlbertoBagnai","#Europainpillole quest’oggi in partenza per Strasburgo. Settimana difficile, in cui a tenere banco saranno ancora il conflitto in #Ucraina, i prezzi sempre più alti di energia/materie prime e i vertici per tentare di trovare una soluzione a quanto sta accadendo tra #Kiev e #Mosca https://t.co/FxYzDGilxy","Twitter for iPhone",140,,,,FALSE,TRUE,0,22,,,"Europainpillole",,,,,,,,,,,,,"x112873259","Marcozanni86","it",,,,,,,,,,,,,,,,"x1500774854164987906","#Europainpillole quest’oggi in partenza per Strasburgo. Settimana difficile, in cui a tenere banco saranno ancora il conflitto in #Ucraina, i prezzi sempre più alti di energia/materie prime e i vertici per tentare di trovare una soluzione a quanto sta accadendo tra #Kiev e #Mosca https://t.co/FxYzDGilxy",2022-03-07 10:06:22,"Twitter for Android",90,22,"x112873259","Marcozanni86","Marco Zanni",22693,1196,16057,"Bergamo, Lombardia","Eurodeputato @LegaSalvini 🇮🇹",TRUE,,,,,,,"NA NA","NA NA","NA NA NA NA NA NA NA NA","https://twitter.com/AlbertoBagnai/status/1500831370041561090","Alberto Bagnai","","Professore associato di politica economica all’Università Gabriele d’Annunzio, eletto al Senato per la Lega nel collegio Abruzzo 01.","https://t.co/sC5RvUzmsX",FALSE,132923,666,656,223225,6482,2012-10-12 22:13:36,TRUE,"https://t.co/sC5RvUzmsX","http://www.senato.it/leg/18/BGT/Schede/Attsen/00032582.htm",,"https://pbs.twimg.com/profile_banners/876541483/1535647109","http://abs.twimg.com/images/themes/theme1/bg.png","http://pbs.twimg.com/profile_images/849030859462246401/ATk3_aiW_normal.jpg"
"x876541483","x1500827646242041865",2022-03-07 13:36:09,"AlbertoBagnai","Così si vede meglio… https://t.co/cTNWUpBzKo","Twitter for iPhone",20,,,,FALSE,FALSE,279,33,,,,,,,,"http://pbs.twimg.com/media/FNQCyFZXMAMJBjA.jpg","https://t.co/cTNWUpBzKo","https://twitter.com/AlbertoBagnai/status/1500827646242041865/photo/1","photo","http://pbs.twimg.com/media/FNQCyFZXMAMJBjA.jpg","https://t.co/cTNWUpBzKo","https://twitter.com/AlbertoBagnai/status/1500827646242041865/photo/1",,,,"it",,,,,,,,,,,,,,,,,,,,,,,,,,,,,,,,,,,,,"NA NA","NA NA","NA NA NA NA NA NA NA NA","https://twitter.com/AlbertoBagnai/status/1500827646242041865","Alberto Bagnai","","Professore associato di politica economica all’Università Gabriele d’Annunzio, eletto al Senato per la Lega nel collegio Abruzzo 01.","https://t.co/sC5RvUzmsX",FALSE,132923,666,656,223225,6482,2012-10-12 22:13:36,TRUE,"https://t.co/sC5RvUzmsX","http://www.senato.it/leg/18/BGT/Schede/Attsen/00032582.htm",,"https://pbs.twimg.com/profile_banners/876541483/1535647109","http://abs.twimg.com/images/themes/theme1/bg.png","http://pbs.twimg.com/profile_images/849030859462246401/ATk3_aiW_normal.jpg"
"x876541483","x1500827206989357067",2022-03-07 13:34:24,"AlbertoBagnai","@callisto02 @_kteok_03 Grazie.","Twitter for iPhone",7,"x1500768665192517632","x108584277","callisto02",FALSE,FALSE,12,1,,,,,,,,,,,,,,,,"x108584277 x721258783201210369","callisto02 _kteok_03","it",,,,,,,,,,,,,,,,,,,,,,,,,,,,,,,,,,,,,"NA NA","NA NA","NA NA NA NA NA NA NA NA","https://twitter.com/AlbertoBagnai/status/1500827206989357067","Alberto Bagnai","","Professore associato di politica economica all’Università Gabriele d’Annunzio, eletto al Senato per la Lega nel collegio Abruzzo 01.","https://t.co/sC5RvUzmsX",FALSE,132923,666,656,223225,6482,2012-10-12 22:13:36,TRUE,"https://t.co/sC5RvUzmsX","http://www.senato.it/leg/18/BGT/Schede/Attsen/00032582.htm",,"https://pbs.twimg.com/profile_banners/876541483/1535647109","http://abs.twimg.com/images/themes/theme1/bg.png","http://pbs.twimg.com/profile_images/849030859462246401/ATk3_aiW_normal.jpg"
"x876541483","x1500827163037257730",2022-03-07 13:34:14,"AlbertoBagnai","@_kteok_03 @AlbertoBagnai Innanzitutto chi stabilisce il VdM? Inoltre sfugge la ricaduta su ISEE, Imposta di Registro sulle transazioni, locazioni, mutui e molto altro. Infine la casa è stata acquistata con redditi tassati quindi giusto tassare le locazioni, no la proprietà che sarebbe doppia imposizione.","Twitter for iPhone",140,,,,FALSE,TRUE,0,20,,,,,,,,,,,,,,,,"x108584277 x721258783201210369 x876541483","callisto02 _kteok_03 AlbertoBagnai","it",,,,,,,,,,,,,,,,"x1500768665192517632","@_kteok_03 @AlbertoBagnai Innanzitutto chi stabilisce il VdM? Inoltre sfugge la ricaduta su ISEE, Imposta di Registro sulle transazioni, locazioni, mutui e molto altro. Infine la casa è stata acquistata con redditi tassati quindi giusto tassare le locazioni, no la proprietà che sarebbe doppia imposizione.",2022-03-07 09:41:47,"Twitter for Android",68,20,"x108584277","callisto02","Alfredo Ibba Medlam 🇮🇹🇬🇧",835,848,13944,"Rome Italy - London UK","Si vis pacem, para bellum",FALSE,,,,,,,"NA NA","NA NA","NA NA NA NA NA NA NA NA","https://twitter.com/AlbertoBagnai/status/1500827163037257730","Alberto Bagnai","","Professore associato di politica economica all’Università Gabriele d’Annunzio, eletto al Senato per la Lega nel collegio Abruzzo 01.","https://t.co/sC5RvUzmsX",FALSE,132923,666,656,223225,6482,2012-10-12 22:13:36,TRUE,"https://t.co/sC5RvUzmsX","http://www.senato.it/leg/18/BGT/Schede/Attsen/00032582.htm",,"https://pbs.twimg.com/profile_banners/876541483/1535647109","http://abs.twimg.com/images/themes/theme1/bg.png","http://pbs.twimg.com/profile_images/849030859462246401/ATk3_aiW_normal.jpg"
"x876541483","x1500825828262916100",2022-03-07 13:28:56,"AlbertoBagnai","Archeologia… https://t.co/0HVmQAzyyd","Twitter for iPhone",12,,,,FALSE,FALSE,275,24,,,,,,,,"http://pbs.twimg.com/media/FNQBIiDXwAASFUc.jpg","https://t.co/0HVmQAzyyd","https://twitter.com/AlbertoBagnai/status/1500825828262916100/photo/1","photo","http://pbs.twimg.com/media/FNQBIiDXwAASFUc.jpg","https://t.co/0HVmQAzyyd","https://twitter.com/AlbertoBagnai/status/1500825828262916100/photo/1",,,,"cy",,,,,,,,,,,,,,,,,,,,,,,,,,,,,,,,,,,,,"NA NA","NA NA","NA NA NA NA NA NA NA NA","https://twitter.com/AlbertoBagnai/status/1500825828262916100","Alberto Bagnai","","Professore associato di politica economica all’Università Gabriele d’Annunzio, eletto al Senato per la Lega nel collegio Abruzzo 01.","https://t.co/sC5RvUzmsX",FALSE,132923,666,656,223225,6482,2012-10-12 22:13:36,TRUE,"https://t.co/sC5RvUzmsX","http://www.senato.it/leg/18/BGT/Schede/Attsen/00032582.htm",,"https://pbs.twimg.com/profile_banners/876541483/1535647109","http://abs.twimg.com/images/themes/theme1/bg.png","http://pbs.twimg.com/profile_images/849030859462246401/ATk3_aiW_normal.jpg"
"x876541483","x1500822380607950852",2022-03-07 13:15:14,"AlbertoBagnai","#Francia #Presidenziali 
Il Consiglio Costituzionale ha pubblicato la lista dei candidati ammessi alle elezioni presidenziali: 

Nathalie #Arthaud;
Fabien #Roussel;
Emmanuel #Macron;
Jean #Lassalle;
Marine #LePen;
Éric #Zemmour;
Jean-Luc https://t.co/1LImS9sDMk","Twitter for iPhone",140,,,,FALSE,TRUE,0,11,,,"Francia Presidenziali",,,,,,,,,,,,,"x1300916262369984515","ultimora_pol","it",,,,,,,,,,,,,,,,"x1500817921739735043","#Francia #Presidenziali 
Il Consiglio Costituzionale ha pubblicato la lista dei candidati ammessi alle elezioni presidenziali: 

Nathalie #Arthaud;
Fabien #Roussel;
Emmanuel #Macron;
Jean #Lassalle;
Marine #LePen;
Éric #Zemmour;
Jean-Luc https://t.co/1LImS9sDMk",2022-03-07 12:57:31,"UltimoraPoliticsPost",25,11,"x1300916262369984515","ultimora_pol","Ultimora.net - POLITICS",4366,79,20971,"","Notizie sulla politica da https://t.co/iYDWk6tCo8 (@ultimoranet)",FALSE,,,,,,,"NA NA","NA NA","NA NA NA NA NA NA NA NA","https://twitter.com/AlbertoBagnai/status/1500822380607950852","Alberto Bagnai","","Professore associato di politica economica all’Università Gabriele d’Annunzio, eletto al Senato per la Lega nel collegio Abruzzo 01.","https://t.co/sC5RvUzmsX",FALSE,132923,666,656,223225,6482,2012-10-12 22:13:36,TRUE,"https://t.co/sC5RvUzmsX","http://www.senato.it/leg/18/BGT/Schede/Attsen/00032582.htm",,"https://pbs.twimg.com/profile_banners/876541483/1535647109","http://abs.twimg.com/images/themes/theme1/bg.png","http://pbs.twimg.com/profile_images/849030859462246401/ATk3_aiW_normal.jpg"
"x876541483","x1500766742393544713",2022-03-07 09:34:08,"AlbertoBagnai","UCRAINA: BERLINO CONTRO STOP IMPORT GAS DA RUSSIA","Twitter for iPhone",65,,,,FALSE,TRUE,0,126,,,,,,,,,,,,,,,,"x1176749662155530240","EsteriLega","it",,,,,,,,,,,,,,,,"x1500766212883722242","UCRAINA: BERLINO CONTRO STOP IMPORT GAS DA RUSSIA",2022-03-07 09:32:02,"Twitter for Android",433,126,"x1176749662155530240","EsteriLega","Lega Esteri",3335,618,38308,"","Account NON ufficiale.
Notizie e commenti  sui temi di politica estera italiana, da leghista con uso di mondo🌐 - per blocchi v Sen Bagnai.",FALSE,,,,,,,"NA NA","NA NA","NA NA NA NA NA NA NA NA","https://twitter.com/AlbertoBagnai/status/1500766742393544713","Alberto Bagnai","","Professore associato di politica economica all’Università Gabriele d’Annunzio, eletto al Senato per la Lega nel collegio Abruzzo 01.","https://t.co/sC5RvUzmsX",FALSE,132923,666,656,223225,6482,2012-10-12 22:13:36,TRUE,"https://t.co/sC5RvUzmsX","http://www.senato.it/leg/18/BGT/Schede/Attsen/00032582.htm",,"https://pbs.twimg.com/profile_banners/876541483/1535647109","http://abs.twimg.com/images/themes/theme1/bg.png","http://pbs.twimg.com/profile_images/849030859462246401/ATk3_aiW_normal.jpg"
