"x919526072","x1487847725056020487",2022-01-30 17:58:35,"LucioMalan","A un anno di distanza, con 127 milioni di dosi fatte in più, oltre 6 milioni di immuni per guarigione in più, con obblighi, SuperGreenPass, stipendi tolti a centinaia di migliaia di famiglie, in tre regioni più morti di un anno fa, in quattro regioni esattamente lo stesso numero. https://t.co/EEBVZqlvhW","Twitter Web App",280,,,,FALSE,FALSE,1376,691,,,,,,,,"http://pbs.twimg.com/media/FKXknasWUAExvID.png","https://t.co/EEBVZqlvhW","https://twitter.com/LucioMalan/status/1487847725056020487/photo/1","photo","http://pbs.twimg.com/media/FKXknasWUAExvID.png","https://t.co/EEBVZqlvhW","https://twitter.com/LucioMalan/status/1487847725056020487/photo/1",,,,"it",,,,,,,,,,,,,,,,,,,,,,,,,,,,,,,,,,,,,"NA NA","NA NA","NA NA NA NA NA NA NA NA","https://twitter.com/LucioMalan/status/1487847725056020487","Lucio Malan","Italia","Senatore Fratelli d'Italia. “Chi è disposto a perdere libertà fondamentale in cambio di temporanea sicurezza, non merita, e non avrà, né libertà né sicurezza.”","https://t.co/KZCpB50DyP",FALSE,18612,3660,135,35091,10568,2012-11-01 17:48:51,FALSE,"https://t.co/KZCpB50DyP","http://www.luciomalan.it",,"https://pbs.twimg.com/profile_banners/919526072/1636186892","http://abs.twimg.com/images/themes/theme1/bg.png","http://pbs.twimg.com/profile_images/1456899523222069249/i60vvKs__normal.jpg"
"x919526072","x1487846031685566464",2022-01-30 17:51:51,"LucioMalan","Un folla immensa riunita per acclamare il #PresidenteDellaRepubblica #Mattarella. #QuartaRepubblica https://t.co/LPY9p2BYAT","Twitter Web App",140,,,,FALSE,TRUE,0,1092,,,"PresidenteDellaRepubblica Mattarella QuartaRepubblica",,,,,,,,,,,,,"x1323040160","strange_days_82","it",,,,,,,,,,,,,,,,"x1487844497711108096","Un folla immensa riunita per acclamare il #PresidenteDellaRepubblica #Mattarella. #QuartaRepubblica https://t.co/LPY9p2BYAT",2022-01-30 17:45:45,"Twitter Web App",2841,1092,"x1323040160","strange_days_82","Davide Scifo 🌀",10455,3013,13469,"","Amo lo sport. Amo il cinema.Scrivo recensioni su https://t.co/fl3dzyHCDg. Di destra. News di politica con video. Se vuoi sostenermi con una donazione (link in basso)  ⬇",FALSE,,,,,,,"NA NA","NA NA","NA NA NA NA NA NA NA NA","https://twitter.com/LucioMalan/status/1487846031685566464","Lucio Malan","Italia","Senatore Fratelli d'Italia. “Chi è disposto a perdere libertà fondamentale in cambio di temporanea sicurezza, non merita, e non avrà, né libertà né sicurezza.”","https://t.co/KZCpB50DyP",FALSE,18612,3660,135,35091,10568,2012-11-01 17:48:51,FALSE,"https://t.co/KZCpB50DyP","http://www.luciomalan.it",,"https://pbs.twimg.com/profile_banners/919526072/1636186892","http://abs.twimg.com/images/themes/theme1/bg.png","http://pbs.twimg.com/profile_images/1456899523222069249/i60vvKs__normal.jpg"
"x919526072","x1487842115161894919",2022-01-30 17:36:17,"LucioMalan","Nonostante tutto, siamo fieri di aver combattuto con coerenza fino alla fine per rappresentare milioni di elettori del centrodestra https://t.co/h43QTsHw5h","Twitter for iPhone",140,,,,FALSE,TRUE,0,194,,,,,,,,,,,,,,,,"x130537001","GiorgiaMeloni","it",,,,,,,,,,,,,,,,"x1487840638708199424","Nonostante tutto, siamo fieri di aver combattuto con coerenza fino alla fine per rappresentare milioni di elettori del centrodestra https://t.co/h43QTsHw5h",2022-01-30 17:30:25,"Twitter for iPhone",1562,194,"x130537001","GiorgiaMeloni","Giorgia Meloni 🇮🇹 ن",1169663,925,18676,"Italia","Romana, classe '77. Politica e giornalista. Sempre, ovunque e prima di tutto, italiana. Presidente di @FratellidItalia e di @ECRParty",TRUE,,,,,,,"NA NA","NA NA","NA NA NA NA NA NA NA NA","https://twitter.com/LucioMalan/status/1487842115161894919","Lucio Malan","Italia","Senatore Fratelli d'Italia. “Chi è disposto a perdere libertà fondamentale in cambio di temporanea sicurezza, non merita, e non avrà, né libertà né sicurezza.”","https://t.co/KZCpB50DyP",FALSE,18612,3660,135,35091,10568,2012-11-01 17:48:51,FALSE,"https://t.co/KZCpB50DyP","http://www.luciomalan.it",,"https://pbs.twimg.com/profile_banners/919526072/1636186892","http://abs.twimg.com/images/themes/theme1/bg.png","http://pbs.twimg.com/profile_images/1456899523222069249/i60vvKs__normal.jpg"
"x919526072","x1487836816388636687",2022-01-30 17:15:14,"LucioMalan","Giorgia Meloni al Corriere della Sera: “Noi maggioranza. E ora ricostruiremo il centrodestra” https://t.co/4r5IvGAKC4","Twitter for iPhone",137,,,,FALSE,TRUE,0,15,,,,,"giorgiameloni.it/2022/01/30/gio…","https://t.co/4r5IvGAKC4","https://www.giorgiameloni.it/2022/01/30/giorgia-meloni-al-corriere-della-sera-noi-maggioranza-e-ora-ricostruiremo-il-centrodestra/",,,,,,,,,"x985177119624966147","FDI_Parlamento","it",,,,,,,,,,,,,,,,"x1487789094507884545","Giorgia Meloni al Corriere della Sera: “Noi maggioranza. E ora ricostruiremo il centrodestra” https://t.co/4r5IvGAKC4",2022-01-30 14:05:36,"WordPress.com",145,15,"x985177119624966147","FDI_Parlamento","FDI Parlamento",7972,91,12247,"Roma, Lazio","Profilo ufficiale dei Gruppi Parlamentari di #fratelliditalia al #Senato e alla #Camera.",FALSE,,,,,,,"NA NA","NA NA","NA NA NA NA NA NA NA NA","https://twitter.com/LucioMalan/status/1487836816388636687","Lucio Malan","Italia","Senatore Fratelli d'Italia. “Chi è disposto a perdere libertà fondamentale in cambio di temporanea sicurezza, non merita, e non avrà, né libertà né sicurezza.”","https://t.co/KZCpB50DyP",FALSE,18612,3660,135,35091,10568,2012-11-01 17:48:51,FALSE,"https://t.co/KZCpB50DyP","http://www.luciomalan.it",,"https://pbs.twimg.com/profile_banners/919526072/1636186892","http://abs.twimg.com/images/themes/theme1/bg.png","http://pbs.twimg.com/profile_images/1456899523222069249/i60vvKs__normal.jpg"
"x919526072","x1487824051376697350",2022-01-30 16:24:30,"LucioMalan","La conferma di Mattarella e altre “anomalie” - sulla Gazzetta Tricolroe https://t.co/gfrC9ruCaa","Twitter for iPhone",95,,,,FALSE,FALSE,37,4,,,,,"mailchi.mp/lagazzettatric…","https://t.co/gfrC9ruCaa","https://mailchi.mp/lagazzettatricolore.it/speciale-quirinale-30-gennaio-2022",,,,,,,,,,,"it",,,,,,,,,,,,,,,,,,,,,,,,,,,,,,,,,,,,,"NA NA","NA NA","NA NA NA NA NA NA NA NA","https://twitter.com/LucioMalan/status/1487824051376697350","Lucio Malan","Italia","Senatore Fratelli d'Italia. “Chi è disposto a perdere libertà fondamentale in cambio di temporanea sicurezza, non merita, e non avrà, né libertà né sicurezza.”","https://t.co/KZCpB50DyP",FALSE,18612,3660,135,35091,10568,2012-11-01 17:48:51,FALSE,"https://t.co/KZCpB50DyP","http://www.luciomalan.it",,"https://pbs.twimg.com/profile_banners/919526072/1636186892","http://abs.twimg.com/images/themes/theme1/bg.png","http://pbs.twimg.com/profile_images/1456899523222069249/i60vvKs__normal.jpg"
"x919526072","x1487810468580372482",2022-01-30 15:30:32,"LucioMalan","Io non vaccinata vado a fare la spesa per amici e parenti vaccinati a casa col covid. È tutto bellissimo.","Twitter for iPhone",119,,,,FALSE,TRUE,0,462,,,,,,,,,,,,,,,,"x1460947166839685128","zothyria","it",,,,,,,,,,,,,,,,"x1487746344592752642","Io non vaccinata vado a fare la spesa per amici e parenti vaccinati a casa col covid. È tutto bellissimo.",2022-01-30 11:15:44,"Twitter for Android",2247,462,"x1460947166839685128","zothyria","Zothyria",1461,1276,2170,"","Look, my eyes are just holograms",FALSE,,,,,,,"NA NA","NA NA","NA NA NA NA NA NA NA NA","https://twitter.com/LucioMalan/status/1487810468580372482","Lucio Malan","Italia","Senatore Fratelli d'Italia. “Chi è disposto a perdere libertà fondamentale in cambio di temporanea sicurezza, non merita, e non avrà, né libertà né sicurezza.”","https://t.co/KZCpB50DyP",FALSE,18612,3660,135,35091,10568,2012-11-01 17:48:51,FALSE,"https://t.co/KZCpB50DyP","http://www.luciomalan.it",,"https://pbs.twimg.com/profile_banners/919526072/1636186892","http://abs.twimg.com/images/themes/theme1/bg.png","http://pbs.twimg.com/profile_images/1456899523222069249/i60vvKs__normal.jpg"
"x919526072","x1487808811960258564",2022-01-30 15:23:57,"LucioMalan","I talebani accolgono a Kabul una reporter incinta non sposata che era stata respinta dalla Nuova Zelanda. Le norme anti-Covid avevano vietato rientro a casa dal Qatar dell'inviata di Al Jazeera  #ANSA https://t.co/pcondYqG1s","Twitter for iPhone",140,,,,FALSE,TRUE,0,230,,,,,,,,,,,,,,,,"x150725695","Agenzia_Ansa","it",,,,,,,,,,,,,,,,"x1487761563956166656","I talebani accolgono a Kabul una reporter incinta non sposata che era stata respinta dalla Nuova Zelanda. Le norme anti-Covid avevano vietato rientro a casa dal Qatar dell'inviata di Al Jazeera  #ANSA https://t.co/pcondYqG1s",2022-01-30 12:16:12,"Twitter Web App",564,230,"x150725695","Agenzia_Ansa","Agenzia ANSA",1513161,257,234347,"Via della Dataria, 94 - Roma","Le top news dell’ANSA, la più importante agenzia d’informazione in Italia. Ultim’ora, notizie, foto e video da tutto il mondo. Aggiornamenti 24 ore su 24. #ANSA",TRUE,,,,,,,"NA NA","NA NA","NA NA NA NA NA NA NA NA","https://twitter.com/LucioMalan/status/1487808811960258564","Lucio Malan","Italia","Senatore Fratelli d'Italia. “Chi è disposto a perdere libertà fondamentale in cambio di temporanea sicurezza, non merita, e non avrà, né libertà né sicurezza.”","https://t.co/KZCpB50DyP",FALSE,18612,3660,135,35091,10568,2012-11-01 17:48:51,FALSE,"https://t.co/KZCpB50DyP","http://www.luciomalan.it",,"https://pbs.twimg.com/profile_banners/919526072/1636186892","http://abs.twimg.com/images/themes/theme1/bg.png","http://pbs.twimg.com/profile_images/1456899523222069249/i60vvKs__normal.jpg"
"x501874833","x1488141771716677635",2022-01-31 13:27:01,"s_margiotta","@claudiovelardi @NicoStumpo @SilviaFregolent @matteorenzi Esatto….","Twitter for iPad",8,"x1488120735478521856","x14227296","claudiovelardi",FALSE,FALSE,1,0,,,,,,,,,,,,,,,,"x14227296 x422168826 x590358735 x18762875","claudiovelardi NicoStumpo SilviaFregolent matteorenzi","it",,,,,,,,,,,,,,,,,,,,,,,,,,,,,,,,,,,,,"NA NA","NA NA","NA NA NA NA NA NA NA NA","https://twitter.com/s_margiotta/status/1488141771716677635","Salvatore Margiotta","Roma, Potenza","Senatore, ingegnere, professore universitario. Capogruppo Commissione lavori pubblici e trasporti. Segretario Presidenza Senato","https://t.co/aeYZnOeRaN",FALSE,15811,7338,208,80712,61336,2012-02-24 15:30:04,TRUE,"https://t.co/aeYZnOeRaN","http://instangram.com/salvatore__margiotta",,"https://pbs.twimg.com/profile_banners/501874833/1483357085","http://abs.twimg.com/images/themes/theme1/bg.png","http://pbs.twimg.com/profile_images/1344056897155063808/zdD0fQgS_normal.jpg"
"x501874833","x1488141428396023812",2022-01-31 13:25:39,"s_margiotta","@s_margiotta @NicoStumpo @matteorenzi Caro Salvatore, i riformisti devono unirsi. Per il paese è l'unica strada per la ripresa!","Twitter for iPad",140,,,,FALSE,TRUE,0,1,,,,,,,,,,,,,,,,"x590358735 x501874833 x422168826 x18762875","SilviaFregolent s_margiotta NicoStumpo matteorenzi","it",,,,,,,,,,,,,,,,"x1488127058580496390","@s_margiotta @NicoStumpo @matteorenzi Caro Salvatore, i riformisti devono unirsi. Per il paese è l'unica strada per la ripresa!",2022-01-31 12:28:33,"Twitter for Android",3,1,"x590358735","SilviaFregolent","silvia fregolent",4818,361,5962,"","",FALSE,,,,,,,"NA NA","NA NA","NA NA NA NA NA NA NA NA","https://twitter.com/s_margiotta/status/1488141428396023812","Salvatore Margiotta","Roma, Potenza","Senatore, ingegnere, professore universitario. Capogruppo Commissione lavori pubblici e trasporti. Segretario Presidenza Senato","https://t.co/aeYZnOeRaN",FALSE,15811,7338,208,80712,61336,2012-02-24 15:30:04,TRUE,"https://t.co/aeYZnOeRaN","http://instangram.com/salvatore__margiotta",,"https://pbs.twimg.com/profile_banners/501874833/1483357085","http://abs.twimg.com/images/themes/theme1/bg.png","http://pbs.twimg.com/profile_images/1344056897155063808/zdD0fQgS_normal.jpg"
"x501874833","x1488107076752662530",2022-01-31 11:09:09,"s_margiotta","@GiusvaPulejo @NicoStumpo @SilviaFregolent @matteorenzi Infatti parlavamo di calcio. Beh, anche di calcio","Twitter for iPad",49,"x1488105536180662278","x932393936","GiusvaPulejo",FALSE,FALSE,2,0,,,,,,,,,,,,,,,,"x932393936 x422168826 x590358735 x18762875","GiusvaPulejo NicoStumpo SilviaFregolent matteorenzi","it",,,,,,,,,,,,,,,,,,,,,,,,,,,,,,,,,,,,,"NA NA","NA NA","NA NA NA NA NA NA NA NA","https://twitter.com/s_margiotta/status/1488107076752662530","Salvatore Margiotta","Roma, Potenza","Senatore, ingegnere, professore universitario. Capogruppo Commissione lavori pubblici e trasporti. Segretario Presidenza Senato","https://t.co/aeYZnOeRaN",FALSE,15811,7338,208,80712,61336,2012-02-24 15:30:04,TRUE,"https://t.co/aeYZnOeRaN","http://instangram.com/salvatore__margiotta",,"https://pbs.twimg.com/profile_banners/501874833/1483357085","http://abs.twimg.com/images/themes/theme1/bg.png","http://pbs.twimg.com/profile_images/1344056897155063808/zdD0fQgS_normal.jpg"
"x501874833","x1488106925497720832",2022-01-31 11:08:33,"s_margiotta","@s_margiotta @NicoStumpo @SilviaFregolent @matteorenzi Bellissima foto senatore","Twitter for iPad",93,,,,FALSE,TRUE,0,1,,,,,,,,,,,,,,,,"x1263588357000462336 x501874833 x422168826 x590358735 x18762875","BimbiMeb s_margiotta NicoStumpo SilviaFregolent matteorenzi","it",,,,,,,,,,,,,,,,"x1488105203643596803","@s_margiotta @NicoStumpo @SilviaFregolent @matteorenzi Bellissima foto senatore",2022-01-31 11:01:42,"Twitter for iPhone",9,1,"x1263588357000462336","BimbiMeb","bimbi di MEB 🇪🇺",5491,3852,61672,"","Bimbi e Bimbe di Maria Elena Boschi,unitevi! pagina nata per fare il verso alle “Bimbe di Conte”. #ItaliaViva #RenewEurope #trusttheplanbischero",FALSE,,,,,,,"NA NA","NA NA","NA NA NA NA NA NA NA NA","https://twitter.com/s_margiotta/status/1488106925497720832","Salvatore Margiotta","Roma, Potenza","Senatore, ingegnere, professore universitario. Capogruppo Commissione lavori pubblici e trasporti. Segretario Presidenza Senato","https://t.co/aeYZnOeRaN",FALSE,15811,7338,208,80712,61336,2012-02-24 15:30:04,TRUE,"https://t.co/aeYZnOeRaN","http://instangram.com/salvatore__margiotta",,"https://pbs.twimg.com/profile_banners/501874833/1483357085","http://abs.twimg.com/images/themes/theme1/bg.png","http://pbs.twimg.com/profile_images/1344056897155063808/zdD0fQgS_normal.jpg"
"x501874833","x1488102841399095297",2022-01-31 10:52:19,"s_margiotta","Marca vince il titolo di miglior prima pagina del giorno 👏👏
#Nadal 🎾2️⃣1️⃣ https://t.co/v6ReUeYvZC","Twitter for iPad",116,,,,FALSE,TRUE,0,11,,,"Nadal",,,,,"http://pbs.twimg.com/media/FKav5ZPWUAYWN-m.jpg","https://t.co/v6ReUeYvZC","https://twitter.com/GiusvaPulejo/status/1488070134224887808/photo/1","photo","http://pbs.twimg.com/media/FKav5ZPWUAYWN-m.jpg","https://t.co/v6ReUeYvZC","https://twitter.com/GiusvaPulejo/status/1488070134224887808/photo/1",,"x932393936","GiusvaPulejo","it",,,,,,,,,,,,,,,,"x1488070134224887808","Marca vince il titolo di miglior prima pagina del giorno 👏👏
#Nadal 🎾2️⃣1️⃣ https://t.co/v6ReUeYvZC",2022-01-31 08:42:21,"Twitter for iPhone",101,11,"x932393936","GiusvaPulejo","Giusva Pulejo",5730,309,65949,"","Imprenditore che investe in diversi settori. Di base, tra Messina (soprattutto) e Milano. Marito di Federica, padre di Ferdinando e Alessandro.",FALSE,,,,,,,"NA NA","NA NA","NA NA NA NA NA NA NA NA","https://twitter.com/s_margiotta/status/1488102841399095297","Salvatore Margiotta","Roma, Potenza","Senatore, ingegnere, professore universitario. Capogruppo Commissione lavori pubblici e trasporti. Segretario Presidenza Senato","https://t.co/aeYZnOeRaN",FALSE,15811,7338,208,80712,61336,2012-02-24 15:30:04,TRUE,"https://t.co/aeYZnOeRaN","http://instangram.com/salvatore__margiotta",,"https://pbs.twimg.com/profile_banners/501874833/1483357085","http://abs.twimg.com/images/themes/theme1/bg.png","http://pbs.twimg.com/profile_images/1344056897155063808/zdD0fQgS_normal.jpg"
"x501874833","x1488102771630956546",2022-01-31 10:52:03,"s_margiotta","@ren_armignacco @FabrizioRoncone Più di quanto ti fidi di me in politica..😂","Twitter for iPad",42,"x1488079970018770946","x86115382","ren_armignacco",FALSE,FALSE,1,0,,,,,,,,,,,,,,,,"x86115382 x396508806","ren_armignacco FabrizioRoncone","it",,,,,,,,,,,,,,,,,,,,,,,,,,,,,,,,,,,,,"NA NA","NA NA","NA NA NA NA NA NA NA NA","https://twitter.com/s_margiotta/status/1488102771630956546","Salvatore Margiotta","Roma, Potenza","Senatore, ingegnere, professore universitario. Capogruppo Commissione lavori pubblici e trasporti. Segretario Presidenza Senato","https://t.co/aeYZnOeRaN",FALSE,15811,7338,208,80712,61336,2012-02-24 15:30:04,TRUE,"https://t.co/aeYZnOeRaN","http://instangram.com/salvatore__margiotta",,"https://pbs.twimg.com/profile_banners/501874833/1483357085","http://abs.twimg.com/images/themes/theme1/bg.png","http://pbs.twimg.com/profile_images/1344056897155063808/zdD0fQgS_normal.jpg"
"x501874833","x1488102615510564869",2022-01-31 10:51:25,"s_margiotta","Comincia, purtroppo lontano da Milano, la seconda vita sportiva di Christian Eriksen. In bocca al lupo, campione, sarai sempre uno di noi. #amala @Tommasolabate @s_margiotta @ric_capecchi @casarinale58 @antoniopolito1 @riotta @GiovanniMoglia https://t.co/5syAqkn8vR","Twitter for iPad",139,,,,FALSE,TRUE,0,2,,,,,,,,,,,,,,,,"x480023608","Antonellogiac","it",,,,,,,,,,,,,,,,"x1488083994252038157","Comincia, purtroppo lontano da Milano, la seconda vita sportiva di Christian Eriksen. In bocca al lupo, campione, sarai sempre uno di noi. #amala @Tommasolabate @s_margiotta @ric_capecchi @casarinale58 @antoniopolito1 @riotta @GiovanniMoglia https://t.co/5syAqkn8vR",2022-01-31 09:37:26,"Twitter for iPhone",13,2,"x480023608","Antonellogiac","Antonello Giacomelli",5037,1096,4824,"Prato e Roma","Commissario Agcom, giornalista, sposato, tre figli. Mi piacciono Camilleri, Le Carre', Guccini, l'Inter.",FALSE,,,,,,,"NA NA","NA NA","NA NA NA NA NA NA NA NA","https://twitter.com/s_margiotta/status/1488102615510564869","Salvatore Margiotta","Roma, Potenza","Senatore, ingegnere, professore universitario. Capogruppo Commissione lavori pubblici e trasporti. Segretario Presidenza Senato","https://t.co/aeYZnOeRaN",FALSE,15811,7338,208,80712,61336,2012-02-24 15:30:04,TRUE,"https://t.co/aeYZnOeRaN","http://instangram.com/salvatore__margiotta",,"https://pbs.twimg.com/profile_banners/501874833/1483357085","http://abs.twimg.com/images/themes/theme1/bg.png","http://pbs.twimg.com/profile_images/1344056897155063808/zdD0fQgS_normal.jpg"
"x501874833","x1488102542760452096",2022-01-31 10:51:08,"s_margiotta","@s_margiotta Ma grazie! Sono davvero contento. Che bello questo tweet, sì.","Twitter for iPad",95,,,,FALSE,TRUE,0,1,,,,,,,,,,,,,,,,"x396508806 x501874833","FabrizioRoncone s_margiotta","it",,,,,,,,,,,,,,,,"x1488093103063982080","@s_margiotta Ma grazie! Sono davvero contento. Che bello questo tweet, sì.",2022-01-31 10:13:37,"Twitter Web App",3,1,"x396508806","FabrizioRoncone","Fabrizio Roncone",19640,678,3963,"Roma","Corriere della Sera (e poi, certo, la Roma)",FALSE,,,,,,,"NA NA","NA NA","NA NA NA NA NA NA NA NA","https://twitter.com/s_margiotta/status/1488102542760452096","Salvatore Margiotta","Roma, Potenza","Senatore, ingegnere, professore universitario. Capogruppo Commissione lavori pubblici e trasporti. Segretario Presidenza Senato","https://t.co/aeYZnOeRaN",FALSE,15811,7338,208,80712,61336,2012-02-24 15:30:04,TRUE,"https://t.co/aeYZnOeRaN","http://instangram.com/salvatore__margiotta",,"https://pbs.twimg.com/profile_banners/501874833/1483357085","http://abs.twimg.com/images/themes/theme1/bg.png","http://pbs.twimg.com/profile_images/1344056897155063808/zdD0fQgS_normal.jpg"
"x501874833","x1488102461638385666",2022-01-31 10:50:49,"s_margiotta","@s_margiotta @FabrizioRoncone Gran libro e Paraldi grande personaggio @FabrizioRoncone ..come sempre i consigli di @Basil_73 sono giusti","Twitter for iPad",140,,,,FALSE,TRUE,0,1,,,,,,,,,,,,,,,,"x473777312 x501874833 x396508806 x396508806","stesangui10 s_margiotta FabrizioRoncone FabrizioRoncone","it",,,,,,,,,,,,,,,,"x1488097572547870722","@s_margiotta @FabrizioRoncone Gran libro e Paraldi grande personaggio @FabrizioRoncone ..come sempre i consigli di @Basil_73 sono giusti",2022-01-31 10:31:23,"Twitter for iPhone",2,1,"x473777312","stesangui10","Stefano Sanguineti",212,1318,2635,"","",FALSE,,,,,,,"NA NA","NA NA","NA NA NA NA NA NA NA NA","https://twitter.com/s_margiotta/status/1488102461638385666","Salvatore Margiotta","Roma, Potenza","Senatore, ingegnere, professore universitario. Capogruppo Commissione lavori pubblici e trasporti. Segretario Presidenza Senato","https://t.co/aeYZnOeRaN",FALSE,15811,7338,208,80712,61336,2012-02-24 15:30:04,TRUE,"https://t.co/aeYZnOeRaN","http://instangram.com/salvatore__margiotta",,"https://pbs.twimg.com/profile_banners/501874833/1483357085","http://abs.twimg.com/images/themes/theme1/bg.png","http://pbs.twimg.com/profile_images/1344056897155063808/zdD0fQgS_normal.jpg"
"x501874833","x1488102317840900099",2022-01-31 10:50:14,"s_margiotta","Da ⁦@NicoStumpo⁩ a ⁦@SilviaFregolent⁩ e ⁦@matteorenzi⁩ …#campolargo 😉 https://t.co/Hrr6UOlJqw","Twitter for iPad",69,,,,FALSE,FALSE,63,8,,,"campolargo",,,,,"http://pbs.twimg.com/media/FKbNK2oWQAAg3ip.jpg","https://t.co/Hrr6UOlJqw","https://twitter.com/s_margiotta/status/1488102317840900099/photo/1","photo","http://pbs.twimg.com/media/FKbNK2oWQAAg3ip.jpg","https://t.co/Hrr6UOlJqw","https://twitter.com/s_margiotta/status/1488102317840900099/photo/1",,"x422168826 x590358735 x18762875","NicoStumpo SilviaFregolent matteorenzi","pt",,,,,,,,,,,,,,,,,,,,,,,,,,,,,,,,,,,,,"NA NA","NA NA","NA NA NA NA NA NA NA NA","https://twitter.com/s_margiotta/status/1488102317840900099","Salvatore Margiotta","Roma, Potenza","Senatore, ingegnere, professore universitario. Capogruppo Commissione lavori pubblici e trasporti. Segretario Presidenza Senato","https://t.co/aeYZnOeRaN",FALSE,15811,7338,208,80712,61336,2012-02-24 15:30:04,TRUE,"https://t.co/aeYZnOeRaN","http://instangram.com/salvatore__margiotta",,"https://pbs.twimg.com/profile_banners/501874833/1483357085","http://abs.twimg.com/images/themes/theme1/bg.png","http://pbs.twimg.com/profile_images/1344056897155063808/zdD0fQgS_normal.jpg"
"x501874833","x1488047452603224065",2022-01-31 07:12:13,"s_margiotta","@jacopo_iacoboni È la struttura partito, sono i vertici a non funzionare più. Notato che i congressi non vanno più di moda?","Twitter for iPad",139,,,,FALSE,TRUE,0,3,,,,,,,,,,,,,,,,"x406140711 x497995758","tuttotitti jacopo_iacoboni","it",,,,,,,,,,,,,,,,"x1488041995763433472","@jacopo_iacoboni È la struttura partito, sono i vertici a non funzionare più. Notato che i congressi non vanno più di moda?",2022-01-31 06:50:32,"Twitter for Android",9,3,"x406140711","tuttotitti","Cri Del Caso",280,274,13804,"","mi fa schifo Scanzi",FALSE,,,,,,,"NA NA","NA NA","NA NA NA NA NA NA NA NA","https://twitter.com/s_margiotta/status/1488047452603224065","Salvatore Margiotta","Roma, Potenza","Senatore, ingegnere, professore universitario. Capogruppo Commissione lavori pubblici e trasporti. Segretario Presidenza Senato","https://t.co/aeYZnOeRaN",FALSE,15811,7338,208,80712,61336,2012-02-24 15:30:04,TRUE,"https://t.co/aeYZnOeRaN","http://instangram.com/salvatore__margiotta",,"https://pbs.twimg.com/profile_banners/501874833/1483357085","http://abs.twimg.com/images/themes/theme1/bg.png","http://pbs.twimg.com/profile_images/1344056897155063808/zdD0fQgS_normal.jpg"
"x501874833","x1487897283484164099",2022-01-30 21:15:30,"s_margiotta","@DarioBallini Il secondo. Il primo ti è certamente arrivato quando la hai acquistata 😂","Twitter for iPad",72,"x1487876892308951043","x38032906","DarioBallini",FALSE,FALSE,5,0,,,,,,,,,,,,,,,,"x38032906","DarioBallini","it",,,,,,,,,,,,,,,,,,,,,,,,,,,,,,,,,,,,,"NA NA","NA NA","NA NA NA NA NA NA NA NA","https://twitter.com/s_margiotta/status/1487897283484164099","Salvatore Margiotta","Roma, Potenza","Senatore, ingegnere, professore universitario. Capogruppo Commissione lavori pubblici e trasporti. Segretario Presidenza Senato","https://t.co/aeYZnOeRaN",FALSE,15811,7338,208,80712,61336,2012-02-24 15:30:04,TRUE,"https://t.co/aeYZnOeRaN","http://instangram.com/salvatore__margiotta",,"https://pbs.twimg.com/profile_banners/501874833/1483357085","http://abs.twimg.com/images/themes/theme1/bg.png","http://pbs.twimg.com/profile_images/1344056897155063808/zdD0fQgS_normal.jpg"
"x501874833","x1487895192921333766",2022-01-30 21:07:12,"s_margiotta","@la_peau_douce_ Complimenti per la colta citazione","Twitter for iPad",34,"x1487831289935843331","x1338418309079961601","la_peau_douce_",FALSE,FALSE,1,0,,,,,,,,,,,,,,,,"x1338418309079961601","la_peau_douce_","it",,,,,,,,,,,,,,,,,,,,,,,,,,,,,,,,,,,,,"NA NA","NA NA","NA NA NA NA NA NA NA NA","https://twitter.com/s_margiotta/status/1487895192921333766","Salvatore Margiotta","Roma, Potenza","Senatore, ingegnere, professore universitario. Capogruppo Commissione lavori pubblici e trasporti. Segretario Presidenza Senato","https://t.co/aeYZnOeRaN",FALSE,15811,7338,208,80712,61336,2012-02-24 15:30:04,TRUE,"https://t.co/aeYZnOeRaN","http://instangram.com/salvatore__margiotta",,"https://pbs.twimg.com/profile_banners/501874833/1483357085","http://abs.twimg.com/images/themes/theme1/bg.png","http://pbs.twimg.com/profile_images/1344056897155063808/zdD0fQgS_normal.jpg"
