"user_id","status_id","created_at","screen_name","text","source","display_text_width","reply_to_status_id","reply_to_user_id","reply_to_screen_name","is_quote","is_retweet","favorite_count","retweet_count","quote_count","reply_count","hashtags","symbols","urls_url","urls_t.co","urls_expanded_url","media_url","media_t.co","media_expanded_url","media_type","ext_media_url","ext_media_t.co","ext_media_expanded_url","ext_media_type","mentions_user_id","mentions_screen_name","lang","quoted_status_id","quoted_text","quoted_created_at","quoted_source","quoted_favorite_count","quoted_retweet_count","quoted_user_id","quoted_screen_name","quoted_name","quoted_followers_count","quoted_friends_count","quoted_statuses_count","quoted_location","quoted_description","quoted_verified","retweet_status_id","retweet_text","retweet_created_at","retweet_source","retweet_favorite_count","retweet_retweet_count","retweet_user_id","retweet_screen_name","retweet_name","retweet_followers_count","retweet_friends_count","retweet_statuses_count","retweet_location","retweet_description","retweet_verified","place_url","place_name","place_full_name","place_type","country","country_code","geo_coords","coords_coords","bbox_coords","status_url","name","location","description","url","protected","followers_count","friends_count","listed_count","statuses_count","favourites_count","account_created_at","verified","profile_url","profile_expanded_url","account_lang","profile_banner_url","profile_background_url","profile_image_url"
"x270839361","x1482422330127269890",2022-01-15 18:40:00,"matteosalvinimi","Prosegue la saga dei cinghiali in centro a Roma, in questo episodio si trovano al Pronto Soccorso del Gemelli. Una barzelletta… https://t.co/t4rIHCWHTD","Twitter Media Studio",127,,,,FALSE,FALSE,137,31,,,,,,,,"http://pbs.twimg.com/amplify_video_thumb/1482414978191736832/img/iUVI4pqrra2UulJt.jpg","https://t.co/t4rIHCWHTD","https://twitter.com/matteosalvinimi/status/1482422330127269890/video/1","photo","http://pbs.twimg.com/amplify_video_thumb/1482414978191736832/img/iUVI4pqrra2UulJt.jpg","https://t.co/t4rIHCWHTD","https://twitter.com/matteosalvinimi/status/1482422330127269890/video/1",,,,"it",,,,,,,,,,,,,,,,,,,,,,,,,,,,,,,,,,,,,"NA NA","NA NA","NA NA NA NA NA NA NA NA","https://twitter.com/matteosalvinimi/status/1482422330127269890","Matteo Salvini","","Leader della Lega #primagliitaliani 🇮🇹","https://t.co/sj3rr6DU3N",FALSE,1437893,2021,3056,52438,3841,2011-03-23 10:32:56,TRUE,"https://t.co/sj3rr6DU3N","https://legaonline.it/",,"https://pbs.twimg.com/profile_banners/270839361/1641590097","http://abs.twimg.com/images/themes/theme1/bg.png","http://pbs.twimg.com/profile_images/966325945060732928/0Ua5xPMX_normal.jpg"
"x270839361","x1482415951559774208",2022-01-15 18:14:39,"matteosalvinimi","Dopo i No Tav, a Torino ci mancavano a far casino i #NoEsselunga, centri sociali e perditempo vari.
La Lega sta con le Forze dell’Ordine e con chi porta ricchezza e lavoro, non con gentaglia che grida “merde e nazisti” a donne e uomini in divisa. https://t.co/pdRpYsI4lG","Twitter for iPhone",270,,,,FALSE,FALSE,165,23,,,"NoEsselunga",,"torino.repubblica.it/cronaca/2022/0…","https://t.co/pdRpYsI4lG","https://torino.repubblica.it/cronaca/2022/01/15/news/no_alla_nuova_esselunga_tafferugli_in_zona_san_paolo_nel_mirino_il_progetto_ex_westinghouse-333964828/",,,,,,,,,,,"it",,,,,,,,,,,,,,,,,,,,,,,,,,,,,,,,,,,,,"NA NA","NA NA","NA NA NA NA NA NA NA NA","https://twitter.com/matteosalvinimi/status/1482415951559774208","Matteo Salvini","","Leader della Lega #primagliitaliani 🇮🇹","https://t.co/sj3rr6DU3N",FALSE,1437893,2021,3056,52438,3841,2011-03-23 10:32:56,TRUE,"https://t.co/sj3rr6DU3N","https://legaonline.it/",,"https://pbs.twimg.com/profile_banners/270839361/1641590097","http://abs.twimg.com/images/themes/theme1/bg.png","http://pbs.twimg.com/profile_images/966325945060732928/0Ua5xPMX_normal.jpg"
"x270839361","x1482322288099876871",2022-01-15 12:02:28,"matteosalvinimi","Una preghiera per questo povero angelo.
Altro che Bibbiano, assistenti sociali e giudici dovrebbero salvare questi di bambini. https://t.co/qWHWVMJLoV","Twitter for iPhone",126,,,,FALSE,FALSE,393,43,,,,,,,,"http://pbs.twimg.com/media/FJJEQ27XwAIqkHF.jpg","https://t.co/qWHWVMJLoV","https://twitter.com/matteosalvinimi/status/1482322288099876871/photo/1","photo","http://pbs.twimg.com/media/FJJEQ27XwAIqkHF.jpg","https://t.co/qWHWVMJLoV","https://twitter.com/matteosalvinimi/status/1482322288099876871/photo/1",,,,"it",,,,,,,,,,,,,,,,,,,,,,,,,,,,,,,,,,,,,"NA NA","NA NA","NA NA NA NA NA NA NA NA","https://twitter.com/matteosalvinimi/status/1482322288099876871","Matteo Salvini","","Leader della Lega #primagliitaliani 🇮🇹","https://t.co/sj3rr6DU3N",FALSE,1437893,2021,3056,52438,3841,2011-03-23 10:32:56,TRUE,"https://t.co/sj3rr6DU3N","https://legaonline.it/",,"https://pbs.twimg.com/profile_banners/270839361/1641590097","http://abs.twimg.com/images/themes/theme1/bg.png","http://pbs.twimg.com/profile_images/966325945060732928/0Ua5xPMX_normal.jpg"
"x270839361","x1482104036136468488",2022-01-14 21:35:13,"matteosalvinimi","Condivido con voi la mia intervista a @IsoradioRai. https://t.co/Ea5TVirAWn","Twitter Media Studio",75,,,,FALSE,FALSE,193,35,,,,,"twitter.com/i/broadcasts/1…","https://t.co/Ea5TVirAWn","https://twitter.com/i/broadcasts/1DXxyDMylObJM",,,,,,,,,"x2237907482","IsoradioRai","it",,,,,,,,,,,,,,,,,,,,,,,,,,,,,,,,,,,,,"NA NA","NA NA","NA NA NA NA NA NA NA NA","https://twitter.com/matteosalvinimi/status/1482104036136468488","Matteo Salvini","","Leader della Lega #primagliitaliani 🇮🇹","https://t.co/sj3rr6DU3N",FALSE,1437893,2021,3056,52438,3841,2011-03-23 10:32:56,TRUE,"https://t.co/sj3rr6DU3N","https://legaonline.it/",,"https://pbs.twimg.com/profile_banners/270839361/1641590097","http://abs.twimg.com/images/themes/theme1/bg.png","http://pbs.twimg.com/profile_images/966325945060732928/0Ua5xPMX_normal.jpg"
"x48062712","x1482311787865382916",2022-01-15 11:20:44,"luigidimaio","Da oggi l'Italia ha il suo Inviato Speciale per il #clima: https://t.co/GtaVwjFVdP","Twitter for iPhone",82,,,,FALSE,FALSE,103,22,,,"clima",,"bit.ly/3fqTLSX","https://t.co/GtaVwjFVdP","https://bit.ly/3fqTLSX",,,,,,,,,,,"it",,,,,,,,,,,,,,,,,,,,,,,,,,,,,,,,,,,,,"NA NA","NA NA","NA NA NA NA NA NA NA NA","https://twitter.com/luigidimaio/status/1482311787865382916","Luigi Di Maio","Pomigliano d'Arco, Campania","Ministro degli Affari Esteri e della Cooperazione Internazionale.","https://t.co/D8gkagqksG",FALSE,744767,346,2123,6820,349,2009-06-17 18:34:46,TRUE,"https://t.co/D8gkagqksG","http://www.luigidimaio.it",,"https://pbs.twimg.com/profile_banners/48062712/1634667505","http://abs.twimg.com/images/themes/theme1/bg.png","http://pbs.twimg.com/profile_images/933106806670462976/YyC7LOW8_normal.jpg"
"x1075084718","x1482440836843515904",2022-01-15 19:53:32,"arrigoni_paolo","#CAROENERGIA: significative le misure prese in #FRANCIA per contrastare il caro #bollette per il 2022. 
L'esecutivo #DRAGHI non sia da meno e proceda analogalmente con determinazione per evitare il dramma a famiglie e imprese italiane.","Twitter for Android",235,,,,FALSE,FALSE,6,0,,,"CAROENERGIA FRANCIA bollette DRAGHI",,,,,,,,,,,,,,,"it",,,,,,,,,,,,,,,,,,,,,,,,,,,,,,,,,,,,,"NA NA","NA NA","NA NA NA NA NA NA NA NA","https://twitter.com/arrigoni_paolo/status/1482440836843515904","Paolo Arrigoni","Calolziocorte, Lombardia","Questore del Senato della Repubblica, componente della Commissione Ambiente e del Copasir. Responsabile del Dipartimento Energia della Lega.","https://t.co/M6TePkOvfO",FALSE,4699,182,56,9731,110,2013-01-09 22:36:27,TRUE,"https://t.co/M6TePkOvfO","http://www.senato.it/leg/18/BGT/Schede/Attsen/00029039.htm",,"https://pbs.twimg.com/profile_banners/1075084718/1591968708","http://abs.twimg.com/images/themes/theme1/bg.png","http://pbs.twimg.com/profile_images/3172370357/bec3e4497d64c77f2a93bc9792055992_normal.jpeg"
"x1075084718","x1482384052544024584",2022-01-15 16:07:54,"arrigoni_paolo","Anche oggi i prezzi medi di #energia e #gas continuano l'ascesa. È una realtà drammatica se paragonata ai prezzi pagati lo scorso anno dalla Germania e dalla Francia. È urgente un intervento sul caro prezzi che sostenga famiglie e imprese, così come ragionare sul #nucleare!","Twitter for Android",274,,,,FALSE,FALSE,7,2,,,"energia gas nucleare",,,,,,,,,,,,,,,"it",,,,,,,,,,,,,,,,,,,,,,,,,,,,,,,,,,,,,"NA NA","NA NA","NA NA NA NA NA NA NA NA","https://twitter.com/arrigoni_paolo/status/1482384052544024584","Paolo Arrigoni","Calolziocorte, Lombardia","Questore del Senato della Repubblica, componente della Commissione Ambiente e del Copasir. Responsabile del Dipartimento Energia della Lega.","https://t.co/M6TePkOvfO",FALSE,4699,182,56,9731,110,2013-01-09 22:36:27,TRUE,"https://t.co/M6TePkOvfO","http://www.senato.it/leg/18/BGT/Schede/Attsen/00029039.htm",,"https://pbs.twimg.com/profile_banners/1075084718/1591968708","http://abs.twimg.com/images/themes/theme1/bg.png","http://pbs.twimg.com/profile_images/3172370357/bec3e4497d64c77f2a93bc9792055992_normal.jpeg"
"x876541483","x1482441931703697413",2022-01-15 19:57:53,"AlbertoBagnai","- Come so 'sti dati, di' la verità?
- So' #grezzi. https://t.co/i7HYXT9KfO","Twitter for iPhone",94,,,,FALSE,TRUE,0,42,,,"grezzi",,,,,"http://pbs.twimg.com/media/FJKrHsYXIAI74qY.jpg","https://t.co/i7HYXT9KfO","https://twitter.com/triolo_antonio/status/1482435381899452423/photo/1","photo","http://pbs.twimg.com/media/FJKrHsYXIAI74qY.jpg","https://t.co/i7HYXT9KfO","https://twitter.com/triolo_antonio/status/1482435381899452423/photo/1",,"x1858411734","triolo_antonio","it",,,,,,,,,,,,,,,,"x1482435381899452423","- Come so 'sti dati, di' la verità?
- So' #grezzi. https://t.co/i7HYXT9KfO",2022-01-15 19:31:52,"Twitter for Android",138,42,"x1858411734","triolo_antonio","Antonio Triolo 🇮🇹",4192,536,32159,"","Dipendente Comunale - ex-Promotore Finanziario - Appassionato di politica e di Italia",FALSE,,,,,,,"NA NA","NA NA","NA NA NA NA NA NA NA NA","https://twitter.com/AlbertoBagnai/status/1482441931703697413","Alberto Bagnai","","Professore associato di politica economica all’Università Gabriele d’Annunzio, eletto al Senato per la Lega nel collegio Abruzzo 01.","https://t.co/sC5RvUzmsX",FALSE,130979,667,658,221755,6470,2012-10-12 22:13:36,TRUE,"https://t.co/sC5RvUzmsX","http://www.senato.it/leg/18/BGT/Schede/Attsen/00032582.htm",,"https://pbs.twimg.com/profile_banners/876541483/1535647109","http://abs.twimg.com/images/themes/theme1/bg.png","http://pbs.twimg.com/profile_images/849030859462246401/ATk3_aiW_normal.jpg"
"x876541483","x1482425056269582337",2022-01-15 18:50:50,"AlbertoBagnai","@ElenaMarilynch @strange_days_82 Esatto. Ma nun capischeno (o forse capischeno).","Twitter for iPhone",47,"x1482412116313358339","x1668915986","ElenaMarilynch",FALSE,FALSE,8,1,,,,,,,,,,,,,,,,"x1668915986 x1323040160","ElenaMarilynch strange_days_82","it",,,,,,,,,,,,,,,,,,,,,,,,,,,,,,,,,,,,,"NA NA","NA NA","NA NA NA NA NA NA NA NA","https://twitter.com/AlbertoBagnai/status/1482425056269582337","Alberto Bagnai","","Professore associato di politica economica all’Università Gabriele d’Annunzio, eletto al Senato per la Lega nel collegio Abruzzo 01.","https://t.co/sC5RvUzmsX",FALSE,130979,667,658,221755,6470,2012-10-12 22:13:36,TRUE,"https://t.co/sC5RvUzmsX","http://www.senato.it/leg/18/BGT/Schede/Attsen/00032582.htm",,"https://pbs.twimg.com/profile_banners/876541483/1535647109","http://abs.twimg.com/images/themes/theme1/bg.png","http://pbs.twimg.com/profile_images/849030859462246401/ATk3_aiW_normal.jpg"
"x876541483","x1482424040497328130",2022-01-15 18:46:48,"AlbertoBagnai","@Peter_Triscio Io gli avevo detto come prima cosa ""é vaccinato"" così da non lasciarlo al ps ma portarlo in reparto.
In primavera la narrazione era diversa, i vaccinati erano ""immuni"".","Twitter for iPhone",140,,,,FALSE,TRUE,0,13,,,,,,,,,,,,,,,,"x894286780945641472 x1250355750","Mereditella Peter_Triscio","it",,,,,,,,,,,,,,,,"x1482299638946439174","@Peter_Triscio Io gli avevo detto come prima cosa ""é vaccinato"" così da non lasciarlo al ps ma portarlo in reparto.
In primavera la narrazione era diversa, i vaccinati erano ""immuni"".",2022-01-15 10:32:28,"Twitter for Android",53,13,"x894286780945641472","Mereditella","AranciaPragmatica",1124,243,7904,"","⭕ #StandStill inside the #SaltCircle⭕
            🇮🇹 🇺🇸",FALSE,,,,,,,"NA NA","NA NA","NA NA NA NA NA NA NA NA","https://twitter.com/AlbertoBagnai/status/1482424040497328130","Alberto Bagnai","","Professore associato di politica economica all’Università Gabriele d’Annunzio, eletto al Senato per la Lega nel collegio Abruzzo 01.","https://t.co/sC5RvUzmsX",FALSE,130979,667,658,221755,6470,2012-10-12 22:13:36,TRUE,"https://t.co/sC5RvUzmsX","http://www.senato.it/leg/18/BGT/Schede/Attsen/00032582.htm",,"https://pbs.twimg.com/profile_banners/876541483/1535647109","http://abs.twimg.com/images/themes/theme1/bg.png","http://pbs.twimg.com/profile_images/849030859462246401/ATk3_aiW_normal.jpg"
"x876541483","x1482421637941272585",2022-01-15 18:37:15,"AlbertoBagnai","Accurate.  https://t.co/HSAYRBKhYv","Twitter for iPhone",50,,,,FALSE,TRUE,0,9991,,,,,,,,"http://pbs.twimg.com/ext_tw_video_thumb/1481768660440018946/pu/img/9DkEPgxCa8dve9O_.jpg","https://t.co/HSAYRBKhYv","https://twitter.com/dusty_dweller/status/1481768719344828416/video/1","photo","http://pbs.twimg.com/ext_tw_video_thumb/1481768660440018946/pu/img/9DkEPgxCa8dve9O_.jpg","https://t.co/HSAYRBKhYv","https://twitter.com/dusty_dweller/status/1481768719344828416/video/1",,"x911268243167338496","LibertyJen","en",,,,,,,,,,,,,,,,"x1482215836605505537","Accurate.  https://t.co/HSAYRBKhYv",2022-01-15 04:59:28,"Twitter for iPhone",34439,9991,"x911268243167338496","LibertyJen","LibertyJ",11679,1069,93090,"No longer stuck in traffic","#Liberty🇺🇸—People who constantly vote for more laws are the same people who complain when men with guns are sent to enforce them. #ClubWeirdo",FALSE,,,,,,,"NA NA","NA NA","NA NA NA NA NA NA NA NA","https://twitter.com/AlbertoBagnai/status/1482421637941272585","Alberto Bagnai","","Professore associato di politica economica all’Università Gabriele d’Annunzio, eletto al Senato per la Lega nel collegio Abruzzo 01.","https://t.co/sC5RvUzmsX",FALSE,130979,667,658,221755,6470,2012-10-12 22:13:36,TRUE,"https://t.co/sC5RvUzmsX","http://www.senato.it/leg/18/BGT/Schede/Attsen/00032582.htm",,"https://pbs.twimg.com/profile_banners/876541483/1535647109","http://abs.twimg.com/images/themes/theme1/bg.png","http://pbs.twimg.com/profile_images/849030859462246401/ATk3_aiW_normal.jpg"
"x876541483","x1482421300345942024",2022-01-15 18:35:54,"AlbertoBagnai","Sono senza parole.
Immaginate di essere un neolaureato dietro la testiera dell'Istituto Superiore di Sanità e di rispondere con un ""Se per lei è un errore..."" ad un Deputato della Repubblica che contesta dati fasulli.

Basta. Non ce la faccio più.
Fatemi partire. https://t.co/iCN6MHKSgQ https://t.co/smytHRbpvK","Twitter for iPhone",140,,,,FALSE,TRUE,0,65,,,,,,,,,,,,,,,,"x2575112879","LaPiramide__","it",,,,,,,,,,,,,,,,"x1482419643956580356","Sono senza parole.
Immaginate di essere un neolaureato dietro la testiera dell'Istituto Superiore di Sanità e di rispondere con un ""Se per lei è un errore..."" ad un Deputato della Repubblica che contesta dati fasulli.

Basta. Non ce la faccio più.
Fatemi partire. https://t.co/iCN6MHKSgQ https://t.co/smytHRbpvK",2022-01-15 18:29:19,"Twitter for Android",200,65,"x2575112879","LaPiramide__","La Piramide 🔺️",3811,345,14828,"Italia","Che la Piramide sia con tutti voi.",FALSE,,,,,,,"NA NA","NA NA","NA NA NA NA NA NA NA NA","https://twitter.com/AlbertoBagnai/status/1482421300345942024","Alberto Bagnai","","Professore associato di politica economica all’Università Gabriele d’Annunzio, eletto al Senato per la Lega nel collegio Abruzzo 01.","https://t.co/sC5RvUzmsX",FALSE,130979,667,658,221755,6470,2012-10-12 22:13:36,TRUE,"https://t.co/sC5RvUzmsX","http://www.senato.it/leg/18/BGT/Schede/Attsen/00032582.htm",,"https://pbs.twimg.com/profile_banners/876541483/1535647109","http://abs.twimg.com/images/themes/theme1/bg.png","http://pbs.twimg.com/profile_images/849030859462246401/ATk3_aiW_normal.jpg"
"x876541483","x1482420502291492869",2022-01-15 18:32:44,"AlbertoBagnai","BREAKING: Satellite image captures Tonga's Hunga volcano erupting

(Source: @US_Stormwatch) https://t.co/VolrJs7Gfi","Twitter for iPhone",135,,,,FALSE,TRUE,0,7990,,,,,,,,"http://pbs.twimg.com/ext_tw_video_thumb/1482234237650874368/pu/img/SDxog2Rpu6jHGee0.jpg","https://t.co/VolrJs7Gfi","https://twitter.com/spectatorindex/status/1482234355418546176/video/1","photo","http://pbs.twimg.com/ext_tw_video_thumb/1482234237650874368/pu/img/SDxog2Rpu6jHGee0.jpg","https://t.co/VolrJs7Gfi","https://twitter.com/spectatorindex/status/1482234355418546176/video/1",,"x1626294277 x882759681667588096","spectatorindex US_Stormwatch","en",,,,,,,,,,,,,,,,"x1482234355418546176","BREAKING: Satellite image captures Tonga's Hunga volcano erupting

(Source: @US_Stormwatch) https://t.co/VolrJs7Gfi",2022-01-15 06:13:03,"TweetDeck",14400,7990,"x1626294277","spectatorindex","The Spectator Index",1913322,0,9258,"Global","Focused on finance, business, news, science and sports.",FALSE,,,,,,,"NA NA","NA NA","NA NA NA NA NA NA NA NA","https://twitter.com/AlbertoBagnai/status/1482420502291492869","Alberto Bagnai","","Professore associato di politica economica all’Università Gabriele d’Annunzio, eletto al Senato per la Lega nel collegio Abruzzo 01.","https://t.co/sC5RvUzmsX",FALSE,130979,667,658,221755,6470,2012-10-12 22:13:36,TRUE,"https://t.co/sC5RvUzmsX","http://www.senato.it/leg/18/BGT/Schede/Attsen/00032582.htm",,"https://pbs.twimg.com/profile_banners/876541483/1535647109","http://abs.twimg.com/images/themes/theme1/bg.png","http://pbs.twimg.com/profile_images/849030859462246401/ATk3_aiW_normal.jpg"
"x876541483","x1482420376210747394",2022-01-15 18:32:14,"AlbertoBagnai","Spectaculair. Eruptie vandaag van vulkaan Hunga Tonga, één van de grootste ooit per satelliet vastgelegd.
 https://t.co/EaYnB3hCAC https://t.co/KYHYMoQQAC","Twitter for iPhone",140,,,,FALSE,TRUE,0,42,,,,,,,,,,,,,,,,"x7267762","freek","nl",,,,,,,,,,,,,,,,"x1482264478452523009","Spectaculair. Eruptie vandaag van vulkaan Hunga Tonga, één van de grootste ooit per satelliet vastgelegd.
 https://t.co/EaYnB3hCAC https://t.co/KYHYMoQQAC",2022-01-15 08:12:45,"Twitter for Android",79,42,"x7267762","freek","Freek 🍅",662,2984,14957,"Jordaan, Amsterdam","Amsterdam - Leefbaarheid - Humanisme - Socialisme 🍅 - Biodiversiteit - Klimaat - Groene innovatie - Gezondheid - Voedingsgeneeskunde",FALSE,,,,,,,"NA NA","NA NA","NA NA NA NA NA NA NA NA","https://twitter.com/AlbertoBagnai/status/1482420376210747394","Alberto Bagnai","","Professore associato di politica economica all’Università Gabriele d’Annunzio, eletto al Senato per la Lega nel collegio Abruzzo 01.","https://t.co/sC5RvUzmsX",FALSE,130979,667,658,221755,6470,2012-10-12 22:13:36,TRUE,"https://t.co/sC5RvUzmsX","http://www.senato.it/leg/18/BGT/Schede/Attsen/00032582.htm",,"https://pbs.twimg.com/profile_banners/876541483/1535647109","http://abs.twimg.com/images/themes/theme1/bg.png","http://pbs.twimg.com/profile_images/849030859462246401/ATk3_aiW_normal.jpg"
"x876541483","x1482419559030304780",2022-01-15 18:28:59,"AlbertoBagnai","The violent eruption a few hours ago of the Hunga Tonga-Hunga Haʻapai volcano captured by satellites GOES-West and Himawari-8. https://t.co/PzV5v9apF6","Twitter for iPhone",140,,,,FALSE,TRUE,0,21677,,,,,,,,,,,,,,,,"x3101588527","wonderofscience","en",,,,,,,,,,,,,,,,"x1482280041799385092","The violent eruption a few hours ago of the Hunga Tonga-Hunga Haʻapai volcano captured by satellites GOES-West and Himawari-8. https://t.co/PzV5v9apF6",2022-01-15 09:14:36,"TweetDeck",52503,21677,"x3101588527","wonderofscience","Wonder of Science",1427967,42,1779,"🚀","""The most beautiful thing we can experience is the mysterious. It is the source of all true art and science"" - Albert Einstein",FALSE,,,,,,,"NA NA","NA NA","NA NA NA NA NA NA NA NA","https://twitter.com/AlbertoBagnai/status/1482419559030304780","Alberto Bagnai","","Professore associato di politica economica all’Università Gabriele d’Annunzio, eletto al Senato per la Lega nel collegio Abruzzo 01.","https://t.co/sC5RvUzmsX",FALSE,130979,667,658,221755,6470,2012-10-12 22:13:36,TRUE,"https://t.co/sC5RvUzmsX","http://www.senato.it/leg/18/BGT/Schede/Attsen/00032582.htm",,"https://pbs.twimg.com/profile_banners/876541483/1535647109","http://abs.twimg.com/images/themes/theme1/bg.png","http://pbs.twimg.com/profile_images/849030859462246401/ATk3_aiW_normal.jpg"
"x876541483","x1482417994810679302",2022-01-15 18:22:46,"AlbertoBagnai","@istsupsan @borghi_claudio @claudiocerasa Un piccolo arrotondamento di 2.500.000 😎","Twitter for iPhone",97,,,,FALSE,TRUE,0,22,,,,,,,,,,,,,,,,"x1478095509801906177 x2446734732 x337767301 x29045944","Co_dindio istsupsan borghi_claudio claudiocerasa","it",,,,,,,,,,,,,,,,"x1482412544627204103","@istsupsan @borghi_claudio @claudiocerasa Un piccolo arrotondamento di 2.500.000 😎",2022-01-15 18:01:07,"Twitter for Android",54,22,"x1478095509801906177","Co_dindio","Viva_l_A_e_po_bon",27,101,152,"","",FALSE,,,,,,,"NA NA","NA NA","NA NA NA NA NA NA NA NA","https://twitter.com/AlbertoBagnai/status/1482417994810679302","Alberto Bagnai","","Professore associato di politica economica all’Università Gabriele d’Annunzio, eletto al Senato per la Lega nel collegio Abruzzo 01.","https://t.co/sC5RvUzmsX",FALSE,130979,667,658,221755,6470,2012-10-12 22:13:36,TRUE,"https://t.co/sC5RvUzmsX","http://www.senato.it/leg/18/BGT/Schede/Attsen/00032582.htm",,"https://pbs.twimg.com/profile_banners/876541483/1535647109","http://abs.twimg.com/images/themes/theme1/bg.png","http://pbs.twimg.com/profile_images/849030859462246401/ATk3_aiW_normal.jpg"
"x876541483","x1482417950661517320",2022-01-15 18:22:36,"AlbertoBagnai","@istsupsan @borghi_claudio @claudiocerasa Cari signori, manifestamente i dati voi non li sapete usare ed avete perso qualunque credibilità 

Vi resta una unica opzione : pubblicare i dati aperti. Tutti. E lasciare che analisti esterni li analizzino","Twitter for iPhone",140,,,,FALSE,TRUE,0,81,,,,,,,,,,,,,,,,"x901003845005971457 x2446734732 x337767301 x29045944","Musso___ istsupsan borghi_claudio claudiocerasa","it",,,,,,,,,,,,,,,,"x1482416741250703361","@istsupsan @borghi_claudio @claudiocerasa Cari signori, manifestamente i dati voi non li sapete usare ed avete perso qualunque credibilità 

Vi resta una unica opzione : pubblicare i dati aperti. Tutti. E lasciare che analisti esterni li analizzino",2022-01-15 18:17:47,"Twitter for iPhone",233,81,"x901003845005971457","Musso___","Musso 🍊",9989,3743,223261,"","Analfabeta funzionale di classe subalterna. Gelido antipatizzante. Il faut saisir les opportunités. Non c’è Turati senza prima Cavour. Ladran, luego cabalgamos",FALSE,,,,,,,"NA NA","NA NA","NA NA NA NA NA NA NA NA","https://twitter.com/AlbertoBagnai/status/1482417950661517320","Alberto Bagnai","","Professore associato di politica economica all’Università Gabriele d’Annunzio, eletto al Senato per la Lega nel collegio Abruzzo 01.","https://t.co/sC5RvUzmsX",FALSE,130979,667,658,221755,6470,2012-10-12 22:13:36,TRUE,"https://t.co/sC5RvUzmsX","http://www.senato.it/leg/18/BGT/Schede/Attsen/00032582.htm",,"https://pbs.twimg.com/profile_banners/876541483/1535647109","http://abs.twimg.com/images/themes/theme1/bg.png","http://pbs.twimg.com/profile_images/849030859462246401/ATk3_aiW_normal.jpg"
"x876541483","x1482417715071660033",2022-01-15 18:21:39,"AlbertoBagnai","@istsupsan @borghi_claudio @claudiocerasa Scusate ma la vostra risposta non c entra niente col fatto che nella slide si passa da circa 8 milioni a circa 5,5 milioni 2 settimane dopo. Fosse l opposto ok ma così no 🤔PS io ho fatto il booster","Twitter for iPhone",139,,,,FALSE,TRUE,0,16,,,,,,,,,,,,,,,,"x463212973 x2446734732 x337767301 x29045944","robyw64 istsupsan borghi_claudio claudiocerasa","it",,,,,,,,,,,,,,,,"x1482414659433021448","@istsupsan @borghi_claudio @claudiocerasa Scusate ma la vostra risposta non c entra niente col fatto che nella slide si passa da circa 8 milioni a circa 5,5 milioni 2 settimane dopo. Fosse l opposto ok ma così no 🤔PS io ho fatto il booster",2022-01-15 18:09:31,"Twitter for iPhone",60,16,"x463212973","robyw64","robertow",26,326,1761,"","",FALSE,,,,,,,"NA NA","NA NA","NA NA NA NA NA NA NA NA","https://twitter.com/AlbertoBagnai/status/1482417715071660033","Alberto Bagnai","","Professore associato di politica economica all’Università Gabriele d’Annunzio, eletto al Senato per la Lega nel collegio Abruzzo 01.","https://t.co/sC5RvUzmsX",FALSE,130979,667,658,221755,6470,2012-10-12 22:13:36,TRUE,"https://t.co/sC5RvUzmsX","http://www.senato.it/leg/18/BGT/Schede/Attsen/00032582.htm",,"https://pbs.twimg.com/profile_banners/876541483/1535647109","http://abs.twimg.com/images/themes/theme1/bg.png","http://pbs.twimg.com/profile_images/849030859462246401/ATk3_aiW_normal.jpg"
