"x412137356","x1532346799696056320",2022-06-02 13:02:01,"ecdelre","Au terme de sa visite officielle en 🇩🇿, la représentante spéciale de 🇪🇺 pour le #Sahel, @ecdelre, a rencontré ce mercredi des représentants de médias algériens. La coopération avec l'Algérie et les défis que rencontre la région du Sahel ont été au coeur des échanges. https://t.co/8RGyeUS1cy","Twitter for Android",139,,,,FALSE,TRUE,0,3,,,"Sahel",,,,,,,,,,,,,"x1356895296219930626 x412137356","UEenAlgerie ecdelre","fr",,,,,,,,,,,,,,,,"x1532079547528712193","Au terme de sa visite officielle en 🇩🇿, la représentante spéciale de 🇪🇺 pour le #Sahel, @ecdelre, a rencontré ce mercredi des représentants de médias algériens. La coopération avec l'Algérie et les défis que rencontre la région du Sahel ont été au coeur des échanges. https://t.co/8RGyeUS1cy",2022-06-01 19:20:03,"Twitter for Android",9,3,"x1356895296219930626","UEenAlgerie","Union européenne en Algérie",2385,161,573,"Algerie 🇩🇿","🇪🇺🇩🇿
‏الحساب الرسمي للإتحاد الأوروبي بالجزائر

Compte officiel de la Délégation de l'Union européenne en Algérie

#EUinAlgeria.",TRUE,,,,,,,"NA NA","NA NA","NA NA NA NA NA NA NA NA","https://twitter.com/ecdelre/status/1532346799696056320","Emanuela C. Del Re","Sahel and Bruxelles ","EU Special Representative for the Sahel 🇪🇺 Former Vice-Minister of Foreign Affairs and MP of Italy 🇮🇹 Prof. Political Sociology - Author of essays & volumes","https://t.co/j5mx3SmZsU",FALSE,6549,350,49,3867,2148,2011-11-14 09:30:25,TRUE,"https://t.co/j5mx3SmZsU","https://eeas.europa.eu/headquarters/headquarters-homepage_en/3606/EU%20Special%20Representatives",,"https://pbs.twimg.com/profile_banners/412137356/1625138723","http://abs.twimg.com/images/themes/theme1/bg.png","http://pbs.twimg.com/profile_images/1222088283976601600/UbqmxHp7_normal.jpg"
"x412137356","x1532293256305905664",2022-06-02 09:29:15,"ecdelre","🇩🇿est un partenaire stratégique pour🇪🇺: nous comptons sur le soutien d'Alger pour la stabilisation du #Sahel. On doit renforcer davantage notre coopération et partenariat pour répondre adéquatement aux défis contemporains et trouver des réponses africaines aux problèmes africains https://t.co/fX9E3QqVBA","Twitter for Android",280,"x1532290854232137728","x412137356","ecdelre",FALSE,FALSE,2,0,,,"Sahel",,,,,"http://pbs.twimg.com/media/FUPMmIOWUAEeq62.jpg","https://t.co/fX9E3QqVBA","https://twitter.com/ecdelre/status/1532293256305905664/photo/1","photo","http://pbs.twimg.com/media/FUPMmIOWUAEeq62.jpg","https://t.co/fX9E3QqVBA","https://twitter.com/ecdelre/status/1532293256305905664/photo/1",,,,"fr",,,,,,,,,,,,,,,,,,,,,,,,,,,,,,,,,,,,,"NA NA","NA NA","NA NA NA NA NA NA NA NA","https://twitter.com/ecdelre/status/1532293256305905664","Emanuela C. Del Re","Sahel and Bruxelles ","EU Special Representative for the Sahel 🇪🇺 Former Vice-Minister of Foreign Affairs and MP of Italy 🇮🇹 Prof. Political Sociology - Author of essays & volumes","https://t.co/j5mx3SmZsU",FALSE,6549,350,49,3867,2148,2011-11-14 09:30:25,TRUE,"https://t.co/j5mx3SmZsU","https://eeas.europa.eu/headquarters/headquarters-homepage_en/3606/EU%20Special%20Representatives",,"https://pbs.twimg.com/profile_banners/412137356/1625138723","http://abs.twimg.com/images/themes/theme1/bg.png","http://pbs.twimg.com/profile_images/1222088283976601600/UbqmxHp7_normal.jpg"
"x940100618","x1532408170714480640",2022-06-02 17:05:53,"federicadieni","#Salvini non ha legittimità per agire per il nostro Paese, se non vuole riferire al #copasir almeno renda le dovute spiegazioni al presidente Draghi. Abbiamo un Premier e i ministri, non abbiamo bisogno di iniziative propagandiste e pericolose per l’Italia.","Twitter for iPhone",257,,,,FALSE,FALSE,4,2,,,"Salvini copasir",,,,,,,,,,,,,,,"it",,,,,,,,,,,,,,,,,,,,,,,,,,,,,,,,,,,,,"NA NA","NA NA","NA NA NA NA NA NA NA NA","https://twitter.com/federicadieni/status/1532408170714480640","Federica Dieni","","Deputata M5S eletta nella circoscrizione Calabria. Membro della Commissione Affari costituzionali. VicePresidente COPASIR. Avvocato","https://t.co/0GCpTl5rBq",FALSE,9589,553,124,1640,345,2012-11-10 22:45:59,TRUE,"https://t.co/0GCpTl5rBq","http://www.federicadieni.it",,"https://pbs.twimg.com/profile_banners/940100618/1398241247","http://abs.twimg.com/images/themes/theme1/bg.png","http://pbs.twimg.com/profile_images/1407747487406997514/fFr24GWp_normal.jpg"
"x940100618","x1532319608744685570",2022-06-02 11:13:58,"federicadieni","2 giugno 1946 - 2 giugno 2022
Auguri alla nostra Repubblica 🇮🇹
#2giugno 
#FestadellaRepubblica 
#RepubblicaItaliana https://t.co/qjZWQ78xp5","Twitter for Android",115,,,,FALSE,FALSE,1,0,,,"2giugno FestadellaRepubblica RepubblicaItaliana",,,,,"http://pbs.twimg.com/media/FUPkjRaWQAMWfRB.jpg","https://t.co/qjZWQ78xp5","https://twitter.com/federicadieni/status/1532319608744685570/photo/1","photo","http://pbs.twimg.com/media/FUPkjRaWQAMWfRB.jpg http://pbs.twimg.com/media/FUPkjjOWAAErt6p.jpg http://pbs.twimg.com/media/FUPkjvsWAAYHj1E.jpg http://pbs.twimg.com/media/FUPkkCpWAAEnvvz.jpg","https://t.co/qjZWQ78xp5 https://t.co/qjZWQ78xp5 https://t.co/qjZWQ78xp5 https://t.co/qjZWQ78xp5","https://twitter.com/federicadieni/status/1532319608744685570/photo/1 https://twitter.com/federicadieni/status/1532319608744685570/photo/1 https://twitter.com/federicadieni/status/1532319608744685570/photo/1 https://twitter.com/federicadieni/status/1532319608744685570/photo/1",,,,"it",,,,,,,,,,,,,,,,,,,,,,,,,,,,,,,,,,,,,"NA NA","NA NA","NA NA NA NA NA NA NA NA","https://twitter.com/federicadieni/status/1532319608744685570","Federica Dieni","","Deputata M5S eletta nella circoscrizione Calabria. Membro della Commissione Affari costituzionali. VicePresidente COPASIR. Avvocato","https://t.co/0GCpTl5rBq",FALSE,9589,553,124,1640,345,2012-11-10 22:45:59,TRUE,"https://t.co/0GCpTl5rBq","http://www.federicadieni.it",,"https://pbs.twimg.com/profile_banners/940100618/1398241247","http://abs.twimg.com/images/themes/theme1/bg.png","http://pbs.twimg.com/profile_images/1407747487406997514/fFr24GWp_normal.jpg"
"x48062712","x1532332595001929728",2022-06-02 12:05:34,"luigidimaio","La Repubblica è una e indivisibile. E indivisibile è anche il bene superiore della #pace.
Buona #FestadellaRepubblica 🇮🇹
➡️ https://t.co/aTuL3PQEof","Twitter for iPhone",147,,,,FALSE,FALSE,136,36,,,"pace FestadellaRepubblica",,"bit.ly/3aePm6m","https://t.co/aTuL3PQEof","https://bit.ly/3aePm6m",,,,,,,,,,,"it",,,,,,,,,,,,,,,,,,,,,,,,,,,,,,,,,,,,,"NA NA","NA NA","NA NA NA NA NA NA NA NA","https://twitter.com/luigidimaio/status/1532332595001929728","Luigi Di Maio","Pomigliano d'Arco, Campania","Ministro degli Affari Esteri e della Cooperazione Internazionale.","https://t.co/D8gkagqksG",FALSE,769844,339,2229,7111,396,2009-06-17 18:34:46,TRUE,"https://t.co/D8gkagqksG","http://www.luigidimaio.it",,"https://pbs.twimg.com/profile_banners/48062712/1645985183","http://abs.twimg.com/images/themes/theme1/bg.png","http://pbs.twimg.com/profile_images/933106806670462976/YyC7LOW8_normal.jpg"
"x122445010","x1532359378019438594",2022-06-02 13:52:00,"FedericoDinca","Insieme per rendere omaggio a questa giornata così importante, per il bene del nostro Paese. Buona #FestaDellaRepubblicaItaliana. Viva l'Italia 🇮🇹 https://t.co/1hBJNrRQLt","Twitter for Android",146,,,,FALSE,FALSE,5,1,,,"FestaDellaRepubblicaItaliana",,,,,"http://pbs.twimg.com/media/FUQIsoaXsAAsNcn.jpg","https://t.co/1hBJNrRQLt","https://twitter.com/FedericoDinca/status/1532359378019438594/photo/1","photo","http://pbs.twimg.com/media/FUQIsoaXsAAsNcn.jpg http://pbs.twimg.com/media/FUQItweX0AIgVL1.jpg http://pbs.twimg.com/media/FUQIuJUXoAA8wPg.jpg http://pbs.twimg.com/media/FUQIusvWIAclfj3.jpg","https://t.co/1hBJNrRQLt https://t.co/1hBJNrRQLt https://t.co/1hBJNrRQLt https://t.co/1hBJNrRQLt","https://twitter.com/FedericoDinca/status/1532359378019438594/photo/1 https://twitter.com/FedericoDinca/status/1532359378019438594/photo/1 https://twitter.com/FedericoDinca/status/1532359378019438594/photo/1 https://twitter.com/FedericoDinca/status/1532359378019438594/photo/1",,,,"it",,,,,,,,,,,,,,,,,,,,,,,,,,,,,,,,,,,,,"NA NA","NA NA","NA NA NA NA NA NA NA NA","https://twitter.com/FedericoDinca/status/1532359378019438594","Federico D'Incà","","Ministro per i Rapporti con il Parlamento e le Riforme","https://t.co/UFCWewwvtT",FALSE,14559,688,218,4697,101,2010-03-12 18:47:13,TRUE,"https://t.co/UFCWewwvtT","http://www.federicodinca.it",,"https://pbs.twimg.com/profile_banners/122445010/1613160864","http://abs.twimg.com/images/themes/theme1/bg.png","http://pbs.twimg.com/profile_images/1409407471559512065/khni2uiy_normal.jpg"
"x208642171","x1532301287303352322",2022-06-02 10:01:10,"ManlioDS","In fasi 🌍 difficili come quella attuale, comprendiamo ancora di più l’importanza straordinaria dei valori su cui si fondano la nostra Repubblica e la nostra Costituzione: libertà, uguaglianza, pace fra le nazioni.

Buona #FestadellaRepubblica2022, finalmente di nuovo insieme! 🇮🇹 https://t.co/M5NXehnbN0","Twitter for iPhone",279,,,,FALSE,FALSE,11,4,,,"FestadellaRepubblica2022",,,,,"http://pbs.twimg.com/media/FUPT5TrWAAENaNu.jpg","https://t.co/M5NXehnbN0","https://twitter.com/ManlioDS/status/1532301287303352322/photo/1","photo","http://pbs.twimg.com/media/FUPT5TrWAAENaNu.jpg","https://t.co/M5NXehnbN0","https://twitter.com/ManlioDS/status/1532301287303352322/photo/1",,,,"it",,,,,,,,,,,,,,,,,,,,,,,,,,,,,,,,,,,,,"NA NA","NA NA","NA NA NA NA NA NA NA NA","https://twitter.com/ManlioDS/status/1532301287303352322","Manlio Di Stefano","Milano, Lombardia","Sottosegretario agli Affari Esteri con delega Commercio, Export, Imprese, Asia, Spazio, Energia, Mare, Digitale. Deputato M5S.

https://t.co/xZMFlvl8Zo","https://t.co/1gGLrF9TBR",FALSE,46809,634,332,6857,102,2010-10-27 17:05:38,TRUE,"https://t.co/1gGLrF9TBR","http://www.manliodistefano.it",,"https://pbs.twimg.com/profile_banners/208642171/1648716936","http://abs.twimg.com/images/themes/theme1/bg.png","http://pbs.twimg.com/profile_images/1311660080429850629/GB7Vq68n_normal.jpg"
"x22834067","x1532364404389445632",2022-06-02 14:11:58,"Roberto_Fico","La cerimonia di premiazione di ""Lezioni di #Costituzione"", con i Presidenti @Roberto_Fico e  @Pres_Casellati, sarà trasmessa alle 16 su @RaiTre con LIS, su WebTv con sottotitoli e su https://t.co/jCmKGsoI53. 

Buona #FestadellaRepubblica! 
#CameraGiovani #2giugno https://t.co/9D1HwiOgCY","Twitter for iPhone",140,,,,FALSE,TRUE,0,7,,,"Costituzione",,,,,,,,,,,,,"x2278995820 x22834067 x997531966571466752","Montecitorio Roberto_Fico Pres_Casellati","it",,,,,,,,,,,,,,,,"x1532358875461996544","La cerimonia di premiazione di ""Lezioni di #Costituzione"", con i Presidenti @Roberto_Fico e  @Pres_Casellati, sarà trasmessa alle 16 su @RaiTre con LIS, su WebTv con sottotitoli e su https://t.co/jCmKGsoI53. 

Buona #FestadellaRepubblica! 
#CameraGiovani #2giugno https://t.co/9D1HwiOgCY",2022-06-02 13:50:00,"Twitter Web App",12,7,"x2278995820","Montecitorio","Camera dei deputati",362482,844,25891,"Roma, Italia","Account ufficiale della Camera dei deputati - La democrazia si fa qui - Netiquette: https://t.co/b7xiVxpnPH",TRUE,,,,,,,"NA NA","NA NA","NA NA NA NA NA NA NA NA","https://twitter.com/Roberto_Fico/status/1532364404389445632","Roberto Fico","Napoli, Italy","Presidente della Camera dei Deputati","https://t.co/RAbIEv9ppx",FALSE,217611,475,969,6416,2385,2009-03-04 21:05:18,TRUE,"https://t.co/RAbIEv9ppx","http://presidente.camera.it/",,"https://pbs.twimg.com/profile_banners/22834067/1523883395","http://abs.twimg.com/images/themes/theme1/bg.png","http://pbs.twimg.com/profile_images/871776681228472322/x0NkGhan_normal.jpg"
"x22834067","x1532321115120488450",2022-06-02 11:19:57,"Roberto_Fico","Oggi è la festa di tutti gli italiani ed è anche un giorno in cui possiamo e dobbiamo riflettere sul patrimonio civico che abbiamo costruito negli anni, che dobbiamo proteggere e soprattutto promuovere.
Buona #FestadellaRepubblica a tutti.
4/4","Twitter Web App",243,"x1532321113472122881","x22834067","Roberto_Fico",FALSE,FALSE,31,9,,,"FestadellaRepubblica",,,,,,,,,,,,,,,"it",,,,,,,,,,,,,,,,,,,,,,,,,,,,,,,,,,,,,"NA NA","NA NA","NA NA NA NA NA NA NA NA","https://twitter.com/Roberto_Fico/status/1532321115120488450","Roberto Fico","Napoli, Italy","Presidente della Camera dei Deputati","https://t.co/RAbIEv9ppx",FALSE,217611,475,969,6416,2385,2009-03-04 21:05:18,TRUE,"https://t.co/RAbIEv9ppx","http://presidente.camera.it/",,"https://pbs.twimg.com/profile_banners/22834067/1523883395","http://abs.twimg.com/images/themes/theme1/bg.png","http://pbs.twimg.com/profile_images/871776681228472322/x0NkGhan_normal.jpg"
"x22834067","x1532321113472122881",2022-06-02 11:19:57,"Roberto_Fico","Penso a chi è costretto a lasciare la propria città per cercare lavoro altrove. Penso alle drammatiche e inammissibili morti bianche. Penso al lavoro povero e senza tutele. Penso a chi viene insultato, aggredito e discriminato solo perché ama una persona dello stesso sesso.
3/4","Twitter Web App",278,"x1532321111832244224","x22834067","Roberto_Fico",FALSE,FALSE,33,8,,,,,,,,,,,,,,,,,,"it",,,,,,,,,,,,,,,,,,,,,,,,,,,,,,,,,,,,,"NA NA","NA NA","NA NA NA NA NA NA NA NA","https://twitter.com/Roberto_Fico/status/1532321113472122881","Roberto Fico","Napoli, Italy","Presidente della Camera dei Deputati","https://t.co/RAbIEv9ppx",FALSE,217611,475,969,6416,2385,2009-03-04 21:05:18,TRUE,"https://t.co/RAbIEv9ppx","http://presidente.camera.it/",,"https://pbs.twimg.com/profile_banners/22834067/1523883395","http://abs.twimg.com/images/themes/theme1/bg.png","http://pbs.twimg.com/profile_images/871776681228472322/x0NkGhan_normal.jpg"
"x22834067","x1532321111832244224",2022-06-02 11:19:56,"Roberto_Fico","Penso a chi è nato e vissuto in Italia ma non ha la cittadinanza, giovani perfettamente integrati ma senza il diritto di chiamarsi italiani.
2/4","Twitter Web App",144,"x1532321109948915712","x22834067","Roberto_Fico",FALSE,FALSE,25,6,,,,,,,,,,,,,,,,,,"it",,,,,,,,,,,,,,,,,,,,,,,,,,,,,,,,,,,,,"NA NA","NA NA","NA NA NA NA NA NA NA NA","https://twitter.com/Roberto_Fico/status/1532321111832244224","Roberto Fico","Napoli, Italy","Presidente della Camera dei Deputati","https://t.co/RAbIEv9ppx",FALSE,217611,475,969,6416,2385,2009-03-04 21:05:18,TRUE,"https://t.co/RAbIEv9ppx","http://presidente.camera.it/",,"https://pbs.twimg.com/profile_banners/22834067/1523883395","http://abs.twimg.com/images/themes/theme1/bg.png","http://pbs.twimg.com/profile_images/871776681228472322/x0NkGhan_normal.jpg"
"x22834067","x1532321109948915712",2022-06-02 11:19:56,"Roberto_Fico","Nel giorno della #FestadellaRepubblica dobbiamo ribadire l’impegno a proseguire il percorso di democrazia e solidarietà lavorando per dare quelle risposte che da troppo tempo mancano, per ridurre le diseguaglianze e rafforzare la nostra comunità.
1/4","Twitter Web App",250,,,,FALSE,FALSE,50,11,,,"FestadellaRepubblica",,,,,,,,,,,,,,,"it",,,,,,,,,,,,,,,,,,,,,,,,,,,,,,,,,,,,,"NA NA","NA NA","NA NA NA NA NA NA NA NA","https://twitter.com/Roberto_Fico/status/1532321109948915712","Roberto Fico","Napoli, Italy","Presidente della Camera dei Deputati","https://t.co/RAbIEv9ppx",FALSE,217611,475,969,6416,2385,2009-03-04 21:05:18,TRUE,"https://t.co/RAbIEv9ppx","http://presidente.camera.it/",,"https://pbs.twimg.com/profile_banners/22834067/1523883395","http://abs.twimg.com/images/themes/theme1/bg.png","http://pbs.twimg.com/profile_images/871776681228472322/x0NkGhan_normal.jpg"
"x474418037","x1532385883575418883",2022-06-02 15:37:19,"FloraFrate","https://t.co/8oFye0tytF","Twitter Web App",23,,,,FALSE,FALSE,19,7,,,,,"lavocedellascuolalive.it/2022/06/02/scu…","https://t.co/8oFye0tytF","https://www.lavocedellascuolalive.it/2022/06/02/scuola-frate-iv-piu-fondi-contro-barriere-architettoniche/",,,,,,,,,,,"und",,,,,,,,,,,,,,,,,,,,,,,,,,,,,,,,,,,,,"NA NA","NA NA","NA NA NA NA NA NA NA NA","https://twitter.com/FloraFrate/status/1532385883575418883","Flora Frate","Napoli","Sociologa, docente, Deputata della Repubblica
@italiaviva",,FALSE,1511,642,19,342,198,2012-01-25 23:57:43,FALSE,,,,"https://pbs.twimg.com/profile_banners/474418037/1621190785","http://abs.twimg.com/images/themes/theme18/bg.gif","http://pbs.twimg.com/profile_images/1236332526681104388/gzwq7xTK_normal.jpg"
"x474418037","x1532312830283751425",2022-06-02 10:47:02,"FloraFrate","È sempre un’emozione partecipare alla #FestadellaRepubblica. Noi siamo la nostra democrazia. Sono fiera e orgogliosa di rappresentare il nostro Paese.
Viva la nostra Repubblica.

#pace #uguaglianza #liberta’ https://t.co/jNoE5zNJHC","Twitter Web App",207,,,,FALSE,FALSE,23,6,,,"FestadellaRepubblica pace uguaglianza liberta",,,,,"http://pbs.twimg.com/media/FUPeWInWAAAZt-f.jpg","https://t.co/jNoE5zNJHC","https://twitter.com/FloraFrate/status/1532312830283751425/photo/1","photo","http://pbs.twimg.com/media/FUPeWInWAAAZt-f.jpg","https://t.co/jNoE5zNJHC","https://twitter.com/FloraFrate/status/1532312830283751425/photo/1",,,,"it",,,,,,,,,,,,,,,,,,,,,,,,,,,,,,,,,,,,,"NA NA","NA NA","NA NA NA NA NA NA NA NA","https://twitter.com/FloraFrate/status/1532312830283751425","Flora Frate","Napoli","Sociologa, docente, Deputata della Repubblica
@italiaviva",,FALSE,1511,642,19,342,198,2012-01-25 23:57:43,FALSE,,,,"https://pbs.twimg.com/profile_banners/474418037/1621190785","http://abs.twimg.com/images/themes/theme18/bg.gif","http://pbs.twimg.com/profile_images/1236332526681104388/gzwq7xTK_normal.jpg"
"x262823808","x1532302537726074881",2022-06-02 10:06:08,"lucafrusone","Grazie alle donne e agli uomini delle #ForzeArmate e delle #ForzeOrdine per il costante lavoro per la sicurezza nazionale e di tutti noi cittadini.
#2giugno #FestadellaRepubblica
@MinisteroDifesa @SM_Difesa @Esercito @ItalianNavy @ItalianAirForce @_Carabinieri_ @poliziadistato https://t.co/ioUklQ7bFq","Twitter for Android",277,,,,FALSE,FALSE,22,3,,,"ForzeArmate ForzeOrdine 2giugno FestadellaRepubblica",,,,,"http://pbs.twimg.com/media/FUPUwrfWAAICnJg.jpg","https://t.co/ioUklQ7bFq","https://twitter.com/lucafrusone/status/1532302537726074881/photo/1","photo","http://pbs.twimg.com/media/FUPUwrfWAAICnJg.jpg http://pbs.twimg.com/media/FUPU3a1WQAIUcAL.jpg http://pbs.twimg.com/media/FUPU8YmWUAEzRV1.jpg http://pbs.twimg.com/media/FUPVAE4XoAErlqM.jpg","https://t.co/ioUklQ7bFq https://t.co/ioUklQ7bFq https://t.co/ioUklQ7bFq https://t.co/ioUklQ7bFq","https://twitter.com/lucafrusone/status/1532302537726074881/photo/1 https://twitter.com/lucafrusone/status/1532302537726074881/photo/1 https://twitter.com/lucafrusone/status/1532302537726074881/photo/1 https://twitter.com/lucafrusone/status/1532302537726074881/photo/1",,"x384192964 x1919237072 x437337751 x252039915 x1280597143 x2965811733 x20423071","MinisteroDifesa SM_Difesa Esercito ItalianNavy ItalianAirForce _Carabinieri_ poliziadistato","it",,,,,,,,,,,,,,,,,,,,,,,,,,,,,,,,,,,,,"NA NA","NA NA","NA NA NA NA NA NA NA NA","https://twitter.com/lucafrusone/status/1532302537726074881","Luca Frusone","Alatri","Presidente della delegazione italiana presso l'Assemblea parlamentare della NATO. Portavoce alla Camera dei Deputati del MoVimento 5 Stelle","https://t.co/W4WPiRbe3U",FALSE,4942,716,90,4903,676,2011-03-08 20:54:17,TRUE,"https://t.co/W4WPiRbe3U","http://www.lucafrusone.it",,"https://pbs.twimg.com/profile_banners/262823808/1580829885","http://abs.twimg.com/images/themes/theme7/bg.gif","http://pbs.twimg.com/profile_images/1109131343819128834/FhDlxk6Z_normal.png"
"x262823808","x1532302158183518208",2022-06-02 10:04:37,"lucafrusone","Grazie al nostro Presidente della Repubblica Sergio #Mattarella garante della Costituzione e rappresentante dell'unità nazionale.
@Quirinale
#2giugno #FestadellaRepubblica https://t.co/mVYxLWZqA8","Twitter for Android",171,,,,FALSE,FALSE,5,1,,,"Mattarella 2giugno FestadellaRepubblica",,,,,"http://pbs.twimg.com/media/FUPUd3PWQAAQbbF.jpg","https://t.co/mVYxLWZqA8","https://twitter.com/lucafrusone/status/1532302158183518208/photo/1","photo","http://pbs.twimg.com/media/FUPUd3PWQAAQbbF.jpg","https://t.co/mVYxLWZqA8","https://twitter.com/lucafrusone/status/1532302158183518208/photo/1",,"x732819391","Quirinale","it",,,,,,,,,,,,,,,,,,,,,,,,,,,,,,,,,,,,,"NA NA","NA NA","NA NA NA NA NA NA NA NA","https://twitter.com/lucafrusone/status/1532302158183518208","Luca Frusone","Alatri","Presidente della delegazione italiana presso l'Assemblea parlamentare della NATO. Portavoce alla Camera dei Deputati del MoVimento 5 Stelle","https://t.co/W4WPiRbe3U",FALSE,4942,716,90,4903,676,2011-03-08 20:54:17,TRUE,"https://t.co/W4WPiRbe3U","http://www.lucafrusone.it",,"https://pbs.twimg.com/profile_banners/262823808/1580829885","http://abs.twimg.com/images/themes/theme7/bg.gif","http://pbs.twimg.com/profile_images/1109131343819128834/FhDlxk6Z_normal.png"
"x831263917175427072","x1532323579290963968",2022-06-02 11:29:45,"ConnyGiordano_5","'Res publica', cosa pubblica, dove la sovranità viene esercitata dal popolo. È questo il significato di #Repubblica.
Oggi, #2giugno, è una data storica. Che ci fa ricordare del sacrificio di milioni di persone che hanno lottato per la nostra libertà.

Buona #FestaDellaRepubblica. https://t.co/RLjiLKPyo5","Twitter for Android",280,,,,FALSE,FALSE,2,0,,,"Repubblica 2giugno FestaDellaRepubblica",,,,,"http://pbs.twimg.com/media/FUPoJ18WIAELIYj.jpg","https://t.co/RLjiLKPyo5","https://twitter.com/ConnyGiordano_5/status/1532323579290963968/photo/1","photo","http://pbs.twimg.com/media/FUPoJ18WIAELIYj.jpg","https://t.co/RLjiLKPyo5","https://twitter.com/ConnyGiordano_5/status/1532323579290963968/photo/1",,,,"it",,,,,,,,,,,,,,,,,,,,,,,,,,,,,,,,,,,,,"NA NA","NA NA","NA NA NA NA NA NA NA NA","https://twitter.com/ConnyGiordano_5/status/1532323579290963968","Conny Giordano","Napoli","Portavoce M5S alla Camera dei Deputati","https://t.co/cnNiVnYMLV",FALSE,2035,287,25,925,441,2017-02-13 22:08:56,TRUE,"https://t.co/cnNiVnYMLV","http://tiny.cc/conny-giordano",,"https://pbs.twimg.com/profile_banners/831263917175427072/1574174195",,"http://pbs.twimg.com/profile_images/1251986324548132872/R87pZNcy_normal.jpg"
"x1060665188","x1532432354614165504",2022-06-02 18:41:59,"FeliceMariani","#2giugno #FestadellaRepubblica 🇮🇹 il Presidente #Mattarella alla parata ai fori imperiali 
Il video👉https://t.co/cepVA2G0qF https://t.co/ZkrqNJ8D4x","Twitter for iPhone",139,,,,FALSE,TRUE,0,171,,,"2giugno FestadellaRepubblica Mattarella",,"youtu.be/tr6pZP37zpM","https://t.co/cepVA2G0qF","https://youtu.be/tr6pZP37zpM",,,,,,,,,"x732819391","Quirinale","it",,,,,,,,,,,,,,,,"x1532391961822384130","#2giugno #FestadellaRepubblica 🇮🇹 il Presidente #Mattarella alla parata ai fori imperiali 
Il video👉https://t.co/cepVA2G0qF https://t.co/ZkrqNJ8D4x",2022-06-02 16:01:28,"Twitter for iPhone",916,171,"x732819391","Quirinale","Quirinale",785438,7,7327,"","Presidenza della Repubblica Italiana - Official Account",TRUE,,,,,,,"NA NA","NA NA","NA NA NA NA NA NA NA NA","https://twitter.com/FeliceMariani/status/1532432354614165504","Felice Mariani","Roma, Lazio","Deputato Lega Salvini Premier, prima medaglia olimpica italiana nel judo","https://t.co/Fy2B2u0PRs",FALSE,914,182,14,353,76,2013-01-04 15:03:05,TRUE,"https://t.co/Fy2B2u0PRs","https://bit.ly/FeliceMariani",,"https://pbs.twimg.com/profile_banners/1060665188/1530261652","http://abs.twimg.com/images/themes/theme1/bg.png","http://pbs.twimg.com/profile_images/1012617468018413568/KWRfOhED_normal.jpg"
"x473107684","x1532465246392274945",2022-06-02 20:52:41,"DalilaNesci","🇮🇹🇪🇺|Punto stampa del Sottosegretario @DalilaNesci al termine dei lavori del Consiglio #CAG Coesione odierno 

Video 👇
https://t.co/GIzI1C4V7H","Twitter for iPhone",140,,,,FALSE,TRUE,0,3,,,"CAG",,,,,,,,,,,,,"x607174392 x473107684","ItalyinEU DalilaNesci","it",,,,,,,,,,,,,,,,"x1532332314675625987","🇮🇹🇪🇺|Punto stampa del Sottosegretario @DalilaNesci al termine dei lavori del Consiglio #CAG Coesione odierno 

Video 👇
https://t.co/GIzI1C4V7H",2022-06-02 12:04:27,"Twitter for iPhone",9,3,"x607174392","ItalyinEU","Italy 🇮🇹 in EU",14123,832,4467,"Bruxelles","Rappresentanza Permanente d’Italia presso l’UE 🇮🇹🇪🇺 | Permanent Representation of Italy to the EU - il Portavoce e l’ufficio stampa",TRUE,,,,,,,"NA NA","NA NA","NA NA NA NA NA NA NA NA","https://twitter.com/DalilaNesci/status/1532465246392274945","Dalila Nesci","Roma","Nata a Tropea (VV), laureata in giurisprudenza e giornalista. Deputata. Sottosegretaria per il Sud e la Coesione Territoriale.","https://t.co/mhij1A0HIl",FALSE,15239,789,184,14946,3551,2012-01-24 17:03:26,TRUE,"https://t.co/mhij1A0HIl","http://dalilanesci.it",,"https://pbs.twimg.com/profile_banners/473107684/1634202351","http://abs.twimg.com/images/themes/theme13/bg.gif","http://pbs.twimg.com/profile_images/1448575767563100163/NwEfSV24_normal.jpg"
