"x501874833","x1500881256774610949",2022-03-07 17:09:11,"s_margiotta","Virólogi , geopolítici e da oggi anche esperti di finanza 

Che fortuna vivere in un paese di onniscienti 

#Unicredit","Twitter for iPad",135,,,,FALSE,TRUE,0,7,,,"Unicredit",,,,,,,,,,,,,"x2332651824","PresMoratti","it",,,,,,,,,,,,,,,,"x1500808200551026691","Virólogi , geopolítici e da oggi anche esperti di finanza 

Che fortuna vivere in un paese di onniscienti 

#Unicredit",2022-03-07 12:18:53,"Twitter for iPhone",127,7,"x2332651824","PresMoratti","Max Moratti 🖤💙",41319,2012,103402,"Padova, Veneto","Presidente del Triplete, Non mi restano che le Nazionali, senza filtro ovviamente!! Account Parodia MOLLTTO SIMMPATTICO youtube: MAX MORATTI",FALSE,,,,,,,"NA NA","NA NA","NA NA NA NA NA NA NA NA","https://twitter.com/s_margiotta/status/1500881256774610949","Salvatore Margiotta","Roma, Potenza","Senatore, ingegnere, professore universitario. Capogruppo Commissione lavori pubblici e trasporti. Segretario Presidenza Senato","https://t.co/aeYZnOeRaN",FALSE,15871,7355,208,81226,62056,2012-02-24 15:30:04,TRUE,"https://t.co/aeYZnOeRaN","http://instangram.com/salvatore__margiotta",,"https://pbs.twimg.com/profile_banners/501874833/1483357085","http://abs.twimg.com/images/themes/theme1/bg.png","http://pbs.twimg.com/profile_images/1344056897155063808/zdD0fQgS_normal.jpg"
"x501874833","x1500881104487727109",2022-03-07 17:08:34,"s_margiotta","A me, che pure condivido il proposito, sembra che non sia così facile e così rapida la possibilità per l’Italia di autonomizzarsi dal gas russo. Freddezza e intelligenza strategica non vanno mai smarrite, soprattutto in tempo di guerra.","Twitter for iPad",140,,,,FALSE,TRUE,0,11,,,,,,,,,,,,,,,,"x1363893966","PLCastagnetti","it",,,,,,,,,,,,,,,,"x1500812048787193856","A me, che pure condivido il proposito, sembra che non sia così facile e così rapida la possibilità per l’Italia di autonomizzarsi dal gas russo. Freddezza e intelligenza strategica non vanno mai smarrite, soprattutto in tempo di guerra.",2022-03-07 12:34:10,"Twitter for iPhone",74,11,"x1363893966","PLCastagnetti","PL Castagnetti",12222,957,14737,"","",FALSE,,,,,,,"NA NA","NA NA","NA NA NA NA NA NA NA NA","https://twitter.com/s_margiotta/status/1500881104487727109","Salvatore Margiotta","Roma, Potenza","Senatore, ingegnere, professore universitario. Capogruppo Commissione lavori pubblici e trasporti. Segretario Presidenza Senato","https://t.co/aeYZnOeRaN",FALSE,15871,7355,208,81226,62056,2012-02-24 15:30:04,TRUE,"https://t.co/aeYZnOeRaN","http://instangram.com/salvatore__margiotta",,"https://pbs.twimg.com/profile_banners/501874833/1483357085","http://abs.twimg.com/images/themes/theme1/bg.png","http://pbs.twimg.com/profile_images/1344056897155063808/zdD0fQgS_normal.jpg"
"x501874833","x1500859763671842826",2022-03-07 15:43:46,"s_margiotta","Penso con orrore a cosa sarebbe successo se il Parlamento a fine gennaio non avesse confermato Mattarella e Draghi e ci avesse lasciato nel casino di una nuova maggioranza politica e un nuovo governo da formare.","Twitter for iPad",140,,,,FALSE,TRUE,0,84,,,,,,,,,,,,,,,,"x696595370395172864","PoliticaPerJedi","it",,,,,,,,,,,,,,,,"x1500813032758386688","Penso con orrore a cosa sarebbe successo se il Parlamento a fine gennaio non avesse confermato Mattarella e Draghi e ci avesse lasciato nel casino di una nuova maggioranza politica e un nuovo governo da formare.",2022-03-07 12:38:05,"Twitter for Android",1031,84,"x696595370395172864","PoliticaPerJedi","Yoda",54050,995,52056,"","So this is how liberty dies. With thunderous applause.",FALSE,,,,,,,"NA NA","NA NA","NA NA NA NA NA NA NA NA","https://twitter.com/s_margiotta/status/1500859763671842826","Salvatore Margiotta","Roma, Potenza","Senatore, ingegnere, professore universitario. Capogruppo Commissione lavori pubblici e trasporti. Segretario Presidenza Senato","https://t.co/aeYZnOeRaN",FALSE,15871,7355,208,81226,62056,2012-02-24 15:30:04,TRUE,"https://t.co/aeYZnOeRaN","http://instangram.com/salvatore__margiotta",,"https://pbs.twimg.com/profile_banners/501874833/1483357085","http://abs.twimg.com/images/themes/theme1/bg.png","http://pbs.twimg.com/profile_images/1344056897155063808/zdD0fQgS_normal.jpg"
"x539150646","x1500720544655761409",2022-03-07 06:30:34,"marcomarsilio","Da oggi la nostra regione torna in zona bianca. Tiriamo un sospiro di sollievo con questa buona notizia, che fa sperare di poter tornare presto alla normalità. Non dimentichiamoci però di continuare ad osservare le regole così come fatto finora.Forza, #Abruzzo! #covid #zonabianca https://t.co/bL6fRZDSIr","Twitter for iPhone",280,,,,FALSE,FALSE,17,1,,,"Abruzzo covid zonabianca",,,,,"http://pbs.twimg.com/media/FNOhYP4XEAIq7JC.jpg","https://t.co/bL6fRZDSIr","https://twitter.com/marcomarsilio/status/1500720544655761409/photo/1","photo","http://pbs.twimg.com/media/FNOhYP4XEAIq7JC.jpg","https://t.co/bL6fRZDSIr","https://twitter.com/marcomarsilio/status/1500720544655761409/photo/1",,,,"it",,,,,,,,,,,,,,,,,,,,,,,,,,,,,,,,,,,,,"NA NA","NA NA","NA NA NA NA NA NA NA NA","https://twitter.com/marcomarsilio/status/1500720544655761409","Marco Marsilio","Abruzzo, Italia","Presidente della Regione Abruzzo. Classe '68. Laureato in Filosofia. Ex senatore di @FratellidItalia. Innamorato della mia terra, di mia moglie e mia figlia.","https://t.co/vJHhSKcpwE",FALSE,6207,242,56,11324,622,2012-03-28 13:56:06,TRUE,"https://t.co/vJHhSKcpwE","http://www.marsiliopresidente.it",,"https://pbs.twimg.com/profile_banners/539150646/1553081691","http://abs.twimg.com/images/themes/theme18/bg.gif","http://pbs.twimg.com/profile_images/1387421144161177604/-OpBVceI_normal.jpg"
"x810840580897067008","x1500815507284443138",2022-03-07 12:47:55,"BarbaraMasini_","1942, Germania Nazista, Hitler: “Dietro al potere del nemico, c’è l’Ebreo”
2022, #Russia di #Putin, Patriarca #Kirill: “Dietro il nemico in #Ucraina, c’è la lobby gay” 

La storia si ripete, pericolosamente! https://t.co/RijiqVjtZ3","Twitter for iPhone",207,,,,FALSE,FALSE,24,5,,,"Russia Putin Kirill Ucraina",,,,,"http://pbs.twimg.com/media/FNP3v5yXwAI9Vsw.jpg","https://t.co/RijiqVjtZ3","https://twitter.com/BarbaraMasini_/status/1500815507284443138/photo/1","photo","http://pbs.twimg.com/media/FNP3v5yXwAI9Vsw.jpg","https://t.co/RijiqVjtZ3","https://twitter.com/BarbaraMasini_/status/1500815507284443138/photo/1",,,,"it",,,,,,,,,,,,,,,,,,,,,,,,,,,,,,,,,,,,,"NA NA","NA NA","NA NA NA NA NA NA NA NA","https://twitter.com/BarbaraMasini_/status/1500815507284443138","Barbara Masini","Italia","Senatrice, Consigliere Comunale a #Pistoia, Designer, #Wine Lover, assetata di #viaggi e un po' gattara","https://t.co/ljFkdxvOtv",FALSE,1460,231,6,892,357,2016-12-19 13:33:54,FALSE,"https://t.co/ljFkdxvOtv","http://www.barbaramasini.it",,"https://pbs.twimg.com/profile_banners/810840580897067008/1550675044","http://abs.twimg.com/images/themes/theme1/bg.png","http://pbs.twimg.com/profile_images/1412360715365765121/WJdmeNBP_normal.jpg"
"x545136488","x1500876175824011272",2022-03-07 16:48:59,"FraMirabelli","Il 12 marzo a Firenze saremo alla manifestazione per la pace a fianco del popolo ucraino e insieme ai tanti sindaci europei che l’hanno promossa e stanno in queste ore organizzando al meglio l’accoglienza dei profughi #StopWarInUkraine #AFirenzePerLaPace","Twitter for iPhone",254,,,,FALSE,FALSE,23,9,,,"StopWarInUkraine AFirenzePerLaPace",,,,,,,,,,,,,,,"it",,,,,,,,,,,,,,,,,,,,,,,,,,,,,,,,,,,,,"NA NA","NA NA","NA NA NA NA NA NA NA NA","https://twitter.com/FraMirabelli/status/1500876175824011272","Franco Mirabelli","Senatore della Repubblica","Al Senato nella XVIII legislatura. Sono in direzione nazionale del PD. Inguaribile interista. Credo al principio di responsabilità.","https://t.co/B2OuGikaFw",FALSE,3243,331,78,7695,223,2012-04-04 13:43:24,TRUE,"https://t.co/B2OuGikaFw","http://www.francomirabelli.it",,"https://pbs.twimg.com/profile_banners/545136488/1480921204","http://abs.twimg.com/images/themes/theme1/bg.png","http://pbs.twimg.com/profile_images/805667781186322432/TKk4fYcJ_normal.jpg"
"x545136488","x1500847848023379975",2022-03-07 14:56:26,"FraMirabelli","🇮🇹 Grazie alla delegazione dei parlamentari del @pdnetwork che oggi ha visitato i nostri laboratori e incontrato i nostri scienziati!

🇬🇧 Thanks to the delegation of the Democratic Party parliamentarians who visited our laboratories and met our scientists today! https://t.co/JwHyyZZVZv","Twitter for iPhone",140,,,,FALSE,TRUE,0,11,,,,,,,,,,,,,,,,"x951849480277647362 x13294452","humantechnopole pdnetwork","it",,,,,,,,,,,,,,,,"x1500839122260447237","🇮🇹 Grazie alla delegazione dei parlamentari del @pdnetwork che oggi ha visitato i nostri laboratori e incontrato i nostri scienziati!

🇬🇧 Thanks to the delegation of the Democratic Party parliamentarians who visited our laboratories and met our scientists today! https://t.co/JwHyyZZVZv",2022-03-07 14:21:45,"Twitter Web App",35,11,"x951849480277647362","humantechnopole","Human Technopole",5987,486,1317,"Palazzo Italia, Milan","Italy's research institute for #LifeSciences based in Palazzo Italia, Milan. Our mission is to promote human health & well-being.",FALSE,,,,,,,"NA NA","NA NA","NA NA NA NA NA NA NA NA","https://twitter.com/FraMirabelli/status/1500847848023379975","Franco Mirabelli","Senatore della Repubblica","Al Senato nella XVIII legislatura. Sono in direzione nazionale del PD. Inguaribile interista. Credo al principio di responsabilità.","https://t.co/B2OuGikaFw",FALSE,3243,331,78,7695,223,2012-04-04 13:43:24,TRUE,"https://t.co/B2OuGikaFw","http://www.francomirabelli.it",,"https://pbs.twimg.com/profile_banners/545136488/1480921204","http://abs.twimg.com/images/themes/theme1/bg.png","http://pbs.twimg.com/profile_images/805667781186322432/TKk4fYcJ_normal.jpg"
"x336975968","x1500877181421068291",2022-03-07 16:52:59,"antoniomisiani","Il 12 marzo tutti a Firenze con @DarioNardella e i sindaci europei di @EUROCITIES per la pace in Ucraina #AFirenzePerLaPace #StopWarInUkraine","Twitter for iPhone",141,,,,FALSE,FALSE,11,3,,,"AFirenzePerLaPace StopWarInUkraine",,,,,,,,,,,,,"x434505068 x312028258","DarioNardella EUROCITIES","it",,,,,,,,,,,,,,,,,,,,,,,,,,,,,,,,,,,,,"NA NA","NA NA","NA NA NA NA NA NA NA NA","https://twitter.com/antoniomisiani/status/1500877181421068291","Antonio Misiani","Bergamo, Lombardia","Senatore Pd di Bergamo e Brescia. Responsabile economia e finanze nella Segreteria nazionale PD. Marito di Maria Ines, padre di Maria Chiara e Marco.","https://t.co/AiQJlPBDNJ",FALSE,9090,1969,145,3906,1772,2011-07-17 07:05:58,TRUE,"https://t.co/AiQJlPBDNJ","http://www.antoniomisiani.it",,"https://pbs.twimg.com/profile_banners/336975968/1615037924","http://abs.twimg.com/images/themes/theme1/bg.png","http://pbs.twimg.com/profile_images/1136376924081512448/vtKdIVYV_normal.jpg"
"x1314728936","x1500835492195090434",2022-03-07 14:07:20,"NicolaMorra63","""Nel tempo dell’inganno universale dire la verità è un atto rivoluzionario"", sosteneva George Orwell.
#Anonymous #UkraineRussianWar https://t.co/Ognr8l5Jjs","Twitter for Android",131,,,,FALSE,FALSE,184,37,,,"Anonymous UkraineRussianWar",,,,,"http://pbs.twimg.com/media/FNQJ7I3XwAAXY4s.jpg","https://t.co/Ognr8l5Jjs","https://twitter.com/NicolaMorra63/status/1500835492195090434/photo/1","photo","http://pbs.twimg.com/media/FNQJ7I3XwAAXY4s.jpg","https://t.co/Ognr8l5Jjs","https://twitter.com/NicolaMorra63/status/1500835492195090434/photo/1",,,,"it",,,,,,,,,,,,,,,,,,,,,,,,,,,,,,,,,,,,,"NA NA","NA NA","NA NA NA NA NA NA NA NA","https://twitter.com/NicolaMorra63/status/1500835492195090434","Nicola Morra","Roma, Lazio","Presidente della Commissione Antimafia","https://t.co/iTPRV42dyl",FALSE,94958,364,426,12416,2795,2013-03-29 18:15:14,TRUE,"https://t.co/iTPRV42dyl","http://www.movimento5stelle.it",,"https://pbs.twimg.com/profile_banners/1314728936/1611601504","http://abs.twimg.com/images/themes/theme1/bg.png","http://pbs.twimg.com/profile_images/1129289852384628736/KNHsbHe3_normal.jpg"
"x1314728936","x1500814089311948800",2022-03-07 12:42:17,"NicolaMorra63","Santa #prescrizione, per alcuni!

E la giustizia rimane sempre più orfana in un paese che abbandona gli ultimi e salva il privilegio. https://t.co/yLAJaHEsTD","Twitter for Android",133,,,,FALSE,FALSE,147,58,,,"prescrizione",,,,,"http://pbs.twimg.com/media/FNP2cdRXEAY2Suz.jpg","https://t.co/yLAJaHEsTD","https://twitter.com/NicolaMorra63/status/1500814089311948800/photo/1","photo","http://pbs.twimg.com/media/FNP2cdRXEAY2Suz.jpg","https://t.co/yLAJaHEsTD","https://twitter.com/NicolaMorra63/status/1500814089311948800/photo/1",,,,"it",,,,,,,,,,,,,,,,,,,,,,,,,,,,,,,,,,,,,"NA NA","NA NA","NA NA NA NA NA NA NA NA","https://twitter.com/NicolaMorra63/status/1500814089311948800","Nicola Morra","Roma, Lazio","Presidente della Commissione Antimafia","https://t.co/iTPRV42dyl",FALSE,94958,364,426,12416,2795,2013-03-29 18:15:14,TRUE,"https://t.co/iTPRV42dyl","http://www.movimento5stelle.it",,"https://pbs.twimg.com/profile_banners/1314728936/1611601504","http://abs.twimg.com/images/themes/theme1/bg.png","http://pbs.twimg.com/profile_images/1129289852384628736/KNHsbHe3_normal.jpg"
"x443198044","x1500880286049054724",2022-03-07 17:05:19,"TNannicini","Da socio @Coopitalia son contento che abbia scelto la battaglia  #GenitoriallaPari di @VOLAREass come campagna di quest'anno. 
A parte gli scherzi, bravə tuttə, lavoriamo insieme verso lo stesso obiettivo 👉🏻 https://t.co/9Z2xMsPbQY https://t.co/1h5HfcHpTJ","Twitter for iPhone",231,,,,FALSE,FALSE,24,12,,,"GenitoriallaPari",,"volareoggi.org/genitori-alla-…","https://t.co/9Z2xMsPbQY","https://www.volareoggi.org/genitori-alla-pari/","http://pbs.twimg.com/media/FNQyqfeWQAINhO4.jpg","https://t.co/1h5HfcHpTJ","https://twitter.com/TNannicini/status/1500880286049054724/photo/1","photo","http://pbs.twimg.com/media/FNQyqfeWQAINhO4.jpg","https://t.co/1h5HfcHpTJ","https://twitter.com/TNannicini/status/1500880286049054724/photo/1",,"x253510669 x1272888645041688577","Coopitalia VOLAREass","it",,,,,,,,,,,,,,,,,,,,,,,,,,,,,,,,,,,,,"NA NA","NA NA","NA NA NA NA NA NA NA NA","https://twitter.com/TNannicini/status/1500880286049054724","Tommaso Nannicini","","Senatore della Repubblica @pdnetwork. Professore ordinario di economia politica @Unibocconi. Die-hard @RedSox fan. Socialista, europeista.","https://t.co/hylRVePgHo",FALSE,22060,2202,231,10400,12088,2011-12-21 22:48:25,TRUE,"https://t.co/hylRVePgHo","http://www.tommasonannicini.eu",,"https://pbs.twimg.com/profile_banners/443198044/1566419274","http://abs.twimg.com/images/themes/theme1/bg.png","http://pbs.twimg.com/profile_images/1185594811367284742/-XoZtGVi_normal.jpg"
"x443198044","x1500768826266370049",2022-03-07 09:42:25,"TNannicini","Curioso che Salvini, che da ministro dell’interno ha violato diritto internazionale e principi di umanità, ora faccia passerelle in Polonia. Dica se ha cambiato idea su gestione migrazioni e possiamo finalmente fare politiche di accoglienza e inclusione degne di un paese del G7","Twitter for iPhone",278,,,,FALSE,FALSE,85,14,,,,,,,,,,,,,,,,,,"it",,,,,,,,,,,,,,,,,,,,,,,,,,,,,,,,,,,,,"NA NA","NA NA","NA NA NA NA NA NA NA NA","https://twitter.com/TNannicini/status/1500768826266370049","Tommaso Nannicini","","Senatore della Repubblica @pdnetwork. Professore ordinario di economia politica @Unibocconi. Die-hard @RedSox fan. Socialista, europeista.","https://t.co/hylRVePgHo",FALSE,22060,2202,231,10400,12088,2011-12-21 22:48:25,TRUE,"https://t.co/hylRVePgHo","http://www.tommasonannicini.eu",,"https://pbs.twimg.com/profile_banners/443198044/1566419274","http://abs.twimg.com/images/themes/theme1/bg.png","http://pbs.twimg.com/profile_images/1185594811367284742/-XoZtGVi_normal.jpg"
"x443198044","x1500752180512538625",2022-03-07 08:36:17,"TNannicini","Un milione di profughi ucraini sono in Polonia. Presto saranno almeno 5 milioni. Dobbiamo immediatamente costruire un progetto di accoglienza e inclusione in tutta Europa e in Italia. Impediamo che, finita la solidarietà del momento, i populisti fomentino le solite vecchie paure","Twitter for iPhone",279,,,,FALSE,FALSE,92,16,,,,,,,,,,,,,,,,,,"it",,,,,,,,,,,,,,,,,,,,,,,,,,,,,,,,,,,,,"NA NA","NA NA","NA NA NA NA NA NA NA NA","https://twitter.com/TNannicini/status/1500752180512538625","Tommaso Nannicini","","Senatore della Repubblica @pdnetwork. Professore ordinario di economia politica @Unibocconi. Die-hard @RedSox fan. Socialista, europeista.","https://t.co/hylRVePgHo",FALSE,22060,2202,231,10400,12088,2011-12-21 22:48:25,TRUE,"https://t.co/hylRVePgHo","http://www.tommasonannicini.eu",,"https://pbs.twimg.com/profile_banners/443198044/1566419274","http://abs.twimg.com/images/themes/theme1/bg.png","http://pbs.twimg.com/profile_images/1185594811367284742/-XoZtGVi_normal.jpg"
"x545943103","x1500902890214461440",2022-03-07 18:35:09,"SimonaNocerino_","@il_pucciarelli @nadiaferrigo Congratulazioni","Twitter for iPhone",15,"x1500892057224761347","x370278925","il_pucciarelli",FALSE,FALSE,1,0,,,,,,,,,,,,,,,,"x370278925 x226134529","il_pucciarelli nadiaferrigo","it",,,,,,,,,,,,,,,,,,,,,,,,,,,,,,,,,,,,,"NA NA","NA NA","NA NA NA NA NA NA NA NA","https://twitter.com/SimonaNocerino_/status/1500902890214461440","Simona Nocerino","","Senatrice del Movimento 5 Stelle Membro della Commissione Esteri Componente della commissione presieduta dalla Sen. Segre.","https://t.co/t5uyNKUrpn",FALSE,192,84,1,130,235,2012-04-05 12:43:24,TRUE,"https://t.co/t5uyNKUrpn","http://www.senato.it/leg/18/BGT/Schede/Attsen/00032674.htm",,"https://pbs.twimg.com/profile_banners/545943103/1618839645","http://abs.twimg.com/images/themes/theme1/bg.png","http://pbs.twimg.com/profile_images/1249084359316996097/svJ9Kksv_normal.jpg"
"x127012324","x1500897742322900998",2022-03-07 18:14:41,"paolanugnes","Peskov: ""Se Kiev accetta le condizioni di Mosca ci fermiamo subito""

https://t.co/oMxQXi3myT","Twitter for Android",92,,,,FALSE,FALSE,1,0,,,,,"agi.it/estero/news/20…","https://t.co/oMxQXi3myT","https://www.agi.it/estero/news/2022-03-07/ucraina-peskov-kiev-accetta-condizioni-mosca-ci-fermiamo-15903263/",,,,,,,,,,,"it",,,,,,,,,,,,,,,,,,,,,,,,,,,,,,,,,,,,,"NA NA","NA NA","NA NA NA NA NA NA NA NA","https://twitter.com/paolanugnes/status/1500897742322900998","Paola Nugnes","","","https://t.co/esGbxCkvvW",FALSE,2468,1135,46,1463,548,2010-03-27 19:02:10,FALSE,"https://t.co/esGbxCkvvW","http://www.paolanugnes.it",,"https://pbs.twimg.com/profile_banners/127012324/1640701541","http://abs.twimg.com/images/themes/theme13/bg.gif","http://pbs.twimg.com/profile_images/1396766677472321538/b_m8xadS_normal.jpg"
"x127012324","x1500870220130492419",2022-03-07 16:25:19,"paolanugnes","https://t.co/pXXvJaGzKP","Twitter for Android",0,,,,FALSE,FALSE,0,0,,,,,,,,"http://pbs.twimg.com/media/FNQpguhWUAcST8y.jpg","https://t.co/pXXvJaGzKP","https://twitter.com/paolanugnes/status/1500870220130492419/photo/1","photo","http://pbs.twimg.com/media/FNQpguhWUAcST8y.jpg","https://t.co/pXXvJaGzKP","https://twitter.com/paolanugnes/status/1500870220130492419/photo/1",,,,"und",,,,,,,,,,,,,,,,,,,,,,,,,,,,,,,,,,,,,"NA NA","NA NA","NA NA NA NA NA NA NA NA","https://twitter.com/paolanugnes/status/1500870220130492419","Paola Nugnes","","","https://t.co/esGbxCkvvW",FALSE,2468,1135,46,1463,548,2010-03-27 19:02:10,FALSE,"https://t.co/esGbxCkvvW","http://www.paolanugnes.it",,"https://pbs.twimg.com/profile_banners/127012324/1640701541","http://abs.twimg.com/images/themes/theme13/bg.gif","http://pbs.twimg.com/profile_images/1396766677472321538/b_m8xadS_normal.jpg"
"x127012324","x1500858710603751430",2022-03-07 15:39:35,"paolanugnes","https://t.co/hdPbhrjYtW","Twitter for Android",0,,,,FALSE,FALSE,0,0,,,,,,,,"http://pbs.twimg.com/media/FNQfCv6WYAkvhMm.jpg","https://t.co/hdPbhrjYtW","https://twitter.com/paolanugnes/status/1500858710603751430/photo/1","photo","http://pbs.twimg.com/media/FNQfCv6WYAkvhMm.jpg","https://t.co/hdPbhrjYtW","https://twitter.com/paolanugnes/status/1500858710603751430/photo/1",,,,"und",,,,,,,,,,,,,,,,,,,,,,,,,,,,,,,,,,,,,"NA NA","NA NA","NA NA NA NA NA NA NA NA","https://twitter.com/paolanugnes/status/1500858710603751430","Paola Nugnes","","","https://t.co/esGbxCkvvW",FALSE,2468,1135,46,1463,548,2010-03-27 19:02:10,FALSE,"https://t.co/esGbxCkvvW","http://www.paolanugnes.it",,"https://pbs.twimg.com/profile_banners/127012324/1640701541","http://abs.twimg.com/images/themes/theme13/bg.gif","http://pbs.twimg.com/profile_images/1396766677472321538/b_m8xadS_normal.jpg"
"x127012324","x1500778948808130562",2022-03-07 10:22:39,"paolanugnes","Draghi ha detto che non è il momento del dialogo, quindi ha deciso che il  massacro deve continuare.
https://t.co/Tnl0E3nxEF","Twitter for Android",124,,,,FALSE,FALSE,0,0,,,,,"youtu.be/K8YQ8gKIV8U","https://t.co/Tnl0E3nxEF","https://youtu.be/K8YQ8gKIV8U",,,,,,,,,,,"it",,,,,,,,,,,,,,,,,,,,,,,,,,,,,,,,,,,,,"NA NA","NA NA","NA NA NA NA NA NA NA NA","https://twitter.com/paolanugnes/status/1500778948808130562","Paola Nugnes","","","https://t.co/esGbxCkvvW",FALSE,2468,1135,46,1463,548,2010-03-27 19:02:10,FALSE,"https://t.co/esGbxCkvvW","http://www.paolanugnes.it",,"https://pbs.twimg.com/profile_banners/127012324/1640701541","http://abs.twimg.com/images/themes/theme13/bg.gif","http://pbs.twimg.com/profile_images/1396766677472321538/b_m8xadS_normal.jpg"
"x384927198","x1500761325521281025",2022-03-07 09:12:37,"gparagone","“Articolare un ragionamento è diventato impossibile. Viviamo un’epoca di #emergenza perenne”  

😔

https://t.co/6u8Ds8oGG5
#SonnoDellaRagione #Cacciari #CrisiUcraina","Twitter Web App",165,"x1500727800336158722","x384927198","gparagone",FALSE,FALSE,115,16,,,"emergenza SonnoDellaRagione Cacciari CrisiUcraina",,"ilparagone.it/attualita/cacc…","https://t.co/6u8Ds8oGG5","https://www.ilparagone.it/attualita/cacciari-pensiero-unico-cosa-seria/",,,,,,,,,,,"it",,,,,,,,,,,,,,,,,,,,,,,,,,,,,,,,,,,,,"NA NA","NA NA","NA NA NA NA NA NA NA NA","https://twitter.com/gparagone/status/1500761325521281025","Gianluigi Paragone","","Ribelle per Costituzione","https://t.co/GMVG8hvFxK",FALSE,157529,708,798,28807,947,2011-10-04 15:36:54,TRUE,"https://t.co/GMVG8hvFxK","http://www.ilparagone.it",,"https://pbs.twimg.com/profile_banners/384927198/1396696737","http://abs.twimg.com/images/themes/theme1/bg.png","http://pbs.twimg.com/profile_images/1013755932772388864/IPHQNqB4_normal.jpg"
"x384927198","x1500727800336158722",2022-03-07 06:59:24,"gparagone","#Cacciari ad alzo zero:

“Qui non siamo al #PensieroUnico, ma al pensiero demenziale.”","Twitter Web App",86,,,,FALSE,FALSE,882,127,,,"Cacciari PensieroUnico",,,,,,,,,,,,,,,"it",,,,,,,,,,,,,,,,,,,,,,,,,,,,,,,,,,,,,"NA NA","NA NA","NA NA NA NA NA NA NA NA","https://twitter.com/gparagone/status/1500727800336158722","Gianluigi Paragone","","Ribelle per Costituzione","https://t.co/GMVG8hvFxK",FALSE,157529,708,798,28807,947,2011-10-04 15:36:54,TRUE,"https://t.co/GMVG8hvFxK","http://www.ilparagone.it",,"https://pbs.twimg.com/profile_banners/384927198/1396696737","http://abs.twimg.com/images/themes/theme1/bg.png","http://pbs.twimg.com/profile_images/1013755932772388864/IPHQNqB4_normal.jpg"
"x587802594","x1500885688706871306",2022-03-07 17:26:47,"DarioParrini","I @SenatoriPD sabato prossimo saranno in piazza a Firenze all'iniziativa lanciata da @DarioNardella per manifestare la propria vicinanza al popolo ucraino. 
#StopWarInUkraine 
#AFirenzePerLaPace","Twitter Web App",194,,,,FALSE,FALSE,7,3,,,"StopWarInUkraine AFirenzePerLaPace",,,,,,,,,,,,,"x404048864 x434505068","SenatoriPD DarioNardella","it",,,,,,,,,,,,,,,,,,,,,,,,,,,,,,,,,,,,,"NA NA","NA NA","NA NA NA NA NA NA NA NA","https://twitter.com/DarioParrini/status/1500885688706871306","Dario Parrini","","Sindaco di Vinci dal 2004/2013. Nel 2013/2018 deputato e dal marzo 2018 senatore. Dal febbraio 2014 al marzo 2018 segretario Pd Toscana.","https://t.co/qCtEtxUQPo",FALSE,7485,2932,110,5222,2226,2012-05-22 20:21:16,FALSE,"https://t.co/qCtEtxUQPo","http://www.darioparrini.it",,"https://pbs.twimg.com/profile_banners/587802594/1538124588","http://abs.twimg.com/images/themes/theme1/bg.png","http://pbs.twimg.com/profile_images/1089849225607819264/yYFcG8QI_normal.jpg"
"x587802594","x1500871070076780550",2022-03-07 16:28:42,"DarioParrini","Anche i @senatoripd in piazza il 12 marzo a Firenze, insieme a tanti sindaci di tutta Europa, alla manifestazione unitaria promossa da @DarioNardella, presidente di @EUROCITIES. Siamo a fianco del popolo ucraino. #AFirenzePerLaPace #StopWarInUkraine","Twitter Web App",140,,,,FALSE,TRUE,0,17,,,,,,,,,,,,,,,,"x428521248 x404048864","SimonaMalpezzi SenatoriPD","it",,,,,,,,,,,,,,,,"x1500869297106788356","Anche i @senatoripd in piazza il 12 marzo a Firenze, insieme a tanti sindaci di tutta Europa, alla manifestazione unitaria promossa da @DarioNardella, presidente di @EUROCITIES. Siamo a fianco del popolo ucraino. #AFirenzePerLaPace #StopWarInUkraine",2022-03-07 16:21:39,"Twitter for iPhone",67,17,"x428521248","SimonaMalpezzi","Simona Malpezzi",21695,1084,8783,"","Insegnante. Mamma di Flavia Heléne e Charlotte. Presidente dei @senatoripd",TRUE,,,,,,,"NA NA","NA NA","NA NA NA NA NA NA NA NA","https://twitter.com/DarioParrini/status/1500871070076780550","Dario Parrini","","Sindaco di Vinci dal 2004/2013. Nel 2013/2018 deputato e dal marzo 2018 senatore. Dal febbraio 2014 al marzo 2018 segretario Pd Toscana.","https://t.co/qCtEtxUQPo",FALSE,7485,2932,110,5222,2226,2012-05-22 20:21:16,FALSE,"https://t.co/qCtEtxUQPo","http://www.darioparrini.it",,"https://pbs.twimg.com/profile_banners/587802594/1538124588","http://abs.twimg.com/images/themes/theme1/bg.png","http://pbs.twimg.com/profile_images/1089849225607819264/yYFcG8QI_normal.jpg"
