"x492325083","x1500880468371288074",2022-03-07 17:06:03,"AnnaAscani","‘Cities stand with Ukraine’
Come presidente di @EUROCITIES, la più grande rete di città europee, ho proposto una manifestazione a favore del popolo ucraino. Un’iniziativa comune nelle città europee per chiedere il cessate il fuoco. 
Le città sono per la pace. #CitiesWithUkraine https://t.co/XeNjGVWx5m","Twitter for iPhone",140,,,,FALSE,TRUE,0,44,,,,,,,,,,,,,,,,"x434505068 x312028258","DarioNardella EUROCITIES","it",,,,,,,,,,,,,,,,"x1499712748443385858","‘Cities stand with Ukraine’
Come presidente di @EUROCITIES, la più grande rete di città europee, ho proposto una manifestazione a favore del popolo ucraino. Un’iniziativa comune nelle città europee per chiedere il cessate il fuoco. 
Le città sono per la pace. #CitiesWithUkraine https://t.co/XeNjGVWx5m",2022-03-04 11:45:57,"Twitter for iPhone",143,44,"x434505068","DarioNardella","Dario Nardella",72146,1829,20862,"Firenze","Sindaco di Firenze e Presidente di Eurocities. Musicista, giurista, babbo di Cosimo, Amélie e Francesco. Al servizio della mia città, la più bella del mondo.",TRUE,,,,,,,"NA NA","NA NA","NA NA NA NA NA NA NA NA","https://twitter.com/AnnaAscani/status/1500880468371288074","Anna Ascani","Città di Castello | Roma","Agisci in modo da trattare l'umanità in te come negli altri sempre come fine mai come mezzo | Sottosegretaria @MISE_GOV | VP @pdnetwork | Cattolica, interista","https://t.co/EEvJZIOvLd",FALSE,39621,4694,342,28034,27192,2012-02-14 15:58:03,TRUE,"https://t.co/EEvJZIOvLd","http://www.annaascani.it",,"https://pbs.twimg.com/profile_banners/492325083/1591881409","http://abs.twimg.com/images/themes/theme19/bg.gif","http://pbs.twimg.com/profile_images/971028426755858433/j-iBUMSQ_normal.jpg"
"x492325083","x1500805219927662593",2022-03-07 12:07:02,"AnnaAscani","Tomorrow the @EU_commission will table proposals on how to quickly get rid of our dependency on Russian fossil fuels.

This means:

• Diversifying suppliers, switching to LNG and pipeline gas
 
• Repowering the EU by investing in renewables
 
• Improving energy efficiency https://t.co/dDzZUru005","Twitter for iPhone",140,,,,FALSE,TRUE,0,1041,,,,,,,,,,,,,,,,"x1146329871418843136 x157981564","vonderleyen EU_Commission","en",,,,,,,,,,,,,,,,"x1500779620416864260","Tomorrow the @EU_commission will table proposals on how to quickly get rid of our dependency on Russian fossil fuels.

This means:

• Diversifying suppliers, switching to LNG and pipeline gas
 
• Repowering the EU by investing in renewables
 
• Improving energy efficiency https://t.co/dDzZUru005",2022-03-07 10:25:19,"Twitter for iPhone",4038,1041,"x1146329871418843136","vonderleyen","Ursula von der Leyen",971159,207,3018,"","President of the @EU_Commission. Mother of seven. Brussels-born. European by heart. 🇪🇺",TRUE,,,,,,,"NA NA","NA NA","NA NA NA NA NA NA NA NA","https://twitter.com/AnnaAscani/status/1500805219927662593","Anna Ascani","Città di Castello | Roma","Agisci in modo da trattare l'umanità in te come negli altri sempre come fine mai come mezzo | Sottosegretaria @MISE_GOV | VP @pdnetwork | Cattolica, interista","https://t.co/EEvJZIOvLd",FALSE,39621,4694,342,28034,27192,2012-02-14 15:58:03,TRUE,"https://t.co/EEvJZIOvLd","http://www.annaascani.it",,"https://pbs.twimg.com/profile_banners/492325083/1591881409","http://abs.twimg.com/images/themes/theme19/bg.gif","http://pbs.twimg.com/profile_images/971028426755858433/j-iBUMSQ_normal.jpg"
"x492325083","x1500735701700259842",2022-03-07 07:30:48,"AnnaAscani","Gli arrestati nelle manifestazioni contro la guerra in Russia di ieri sono stati almeno 4.468.
Dall’inizio della guerra Putin ha fatto arrestare almeno 13.035 cittadini russi.
#RussiaIsNotPutin https://t.co/9CXvE1M9jq","Twitter for iPhone",140,,,,FALSE,TRUE,0,36,,,,,,,,,,,,,,,,"x216361540","LiaQuartapelle","it",,,,,,,,,,,,,,,,"x1500725187368480768","Gli arrestati nelle manifestazioni contro la guerra in Russia di ieri sono stati almeno 4.468.
Dall’inizio della guerra Putin ha fatto arrestare almeno 13.035 cittadini russi.
#RussiaIsNotPutin https://t.co/9CXvE1M9jq",2022-03-07 06:49:01,"Twitter for iPhone",132,36,"x216361540","LiaQuartapelle","Lia Quartapelle 🇮🇹🇪🇺",31749,5877,19595,"Milano Roma A/R","Responsabile esteri @pdnetwork e ricercatrice @ispionline | La speranza è un rischio da correre. Georges Bernanos | https://t.co/FRQKV02CPE",TRUE,,,,,,,"NA NA","NA NA","NA NA NA NA NA NA NA NA","https://twitter.com/AnnaAscani/status/1500735701700259842","Anna Ascani","Città di Castello | Roma","Agisci in modo da trattare l'umanità in te come negli altri sempre come fine mai come mezzo | Sottosegretaria @MISE_GOV | VP @pdnetwork | Cattolica, interista","https://t.co/EEvJZIOvLd",FALSE,39621,4694,342,28034,27192,2012-02-14 15:58:03,TRUE,"https://t.co/EEvJZIOvLd","http://www.annaascani.it",,"https://pbs.twimg.com/profile_banners/492325083/1591881409","http://abs.twimg.com/images/themes/theme19/bg.gif","http://pbs.twimg.com/profile_images/971028426755858433/j-iBUMSQ_normal.jpg"
"x473842449","x1500939938556166146",2022-03-07 21:02:22,"alfredobazoli","Alle anime candide si fa presente che qui il problema non è il passato genericamente filo-putiniano di Salvini

Il punto è l'esplicito sostegno a Putin nella sua aggressione a Crimea e Donbass, e la bollatura di EuroMaidan quale complotto ordito dall'Occidente https://t.co/r5b8rdpEkL","Twitter for Android",140,,,,FALSE,TRUE,0,52,,,,,,,,,,,,,,,,"x151029385","PietroSalvatori","it",,,,,,,,,,,,,,,,"x1500880725721206798","Alle anime candide si fa presente che qui il problema non è il passato genericamente filo-putiniano di Salvini

Il punto è l'esplicito sostegno a Putin nella sua aggressione a Crimea e Donbass, e la bollatura di EuroMaidan quale complotto ordito dall'Occidente https://t.co/r5b8rdpEkL",2022-03-07 17:07:04,"Twitter Web App",176,52,"x151029385","PietroSalvatori","Pietro Salvatori",15435,2346,40502,"Roma","giornalista, inviato politico di @huffpostitalia. Nel tempo libero Juve e toscano",FALSE,,,,,,,"NA NA","NA NA","NA NA NA NA NA NA NA NA","https://twitter.com/alfredobazoli/status/1500939938556166146","alfredo bazoli","Brescia","52 anni, avvocato, capogruppo del Partito Democratico in commissione giustizia alla Camera dei Deputati","https://t.co/8fFzktGvMW",FALSE,2370,619,57,2404,761,2012-01-25 11:39:20,FALSE,"https://t.co/8fFzktGvMW","http://www.alfredobazoli.it",,,"http://abs.twimg.com/images/themes/theme1/bg.png","http://pbs.twimg.com/profile_images/3671040322/7d7bd18c8680bf5fdaea36765192715c_normal.jpeg"
"x473842449","x1500936745247989760",2022-03-07 20:49:40,"alfredobazoli","No, Matteo, we will not forget how you did your best to legitimise the policies and actions of the very regime that is now committing a genocide of the Ukrainian nation. https://t.co/fKYtvvCwzf","Twitter for Android",140,,,,FALSE,TRUE,0,2731,,,,,,,,,,,,,,,,"x56070554","A_SHEKH0VTS0V","en",,,,,,,,,,,,,,,,"x1500877846033702914","No, Matteo, we will not forget how you did your best to legitimise the policies and actions of the very regime that is now committing a genocide of the Ukrainian nation. https://t.co/fKYtvvCwzf",2022-03-07 16:55:38,"Twitter for iPhone",10078,2731,"x56070554","A_SHEKH0VTS0V","Anton Shekhovtsov",15007,1210,7553,"Europe","Director of the Centre for Democratic Integrity (https://t.co/0ABHU8MEzc), author of ""Russia and the Western Far Right"" (https://t.co/aqWjLsA32I)",FALSE,,,,,,,"NA NA","NA NA","NA NA NA NA NA NA NA NA","https://twitter.com/alfredobazoli/status/1500936745247989760","alfredo bazoli","Brescia","52 anni, avvocato, capogruppo del Partito Democratico in commissione giustizia alla Camera dei Deputati","https://t.co/8fFzktGvMW",FALSE,2370,619,57,2404,761,2012-01-25 11:39:20,FALSE,"https://t.co/8fFzktGvMW","http://www.alfredobazoli.it",,,"http://abs.twimg.com/images/themes/theme1/bg.png","http://pbs.twimg.com/profile_images/3671040322/7d7bd18c8680bf5fdaea36765192715c_normal.jpeg"
"x473842449","x1500926036275511297",2022-03-07 20:07:07,"alfredobazoli","This huge seaside property in the city of Pesaro (🇮🇹) is the villa of the Matvienko family. Valentina Matvienko is the head of the Federation Council (upper house of the Russian Parliament). Valentina's signature stands under the decrees to start the war with Ukraine. https://t.co/mMoKKauAzh","Twitter for Android",140,,,,FALSE,TRUE,0,4480,,,,,,,,,,,,,,,,"x2845731895","pevchikh","en",,,,,,,,,,,,,,,,"x1500815932255518722","This huge seaside property in the city of Pesaro (🇮🇹) is the villa of the Matvienko family. Valentina Matvienko is the head of the Federation Council (upper house of the Russian Parliament). Valentina's signature stands under the decrees to start the war with Ukraine. https://t.co/mMoKKauAzh",2022-03-07 12:49:36,"Twitter Web App",10874,4480,"x2845731895","pevchikh","Maria Pevchikh",162471,716,8132,"","Руководительница Отдела Расследований ФБК ""женщина с непрозрачной жизненной историей и весьма интересными фактами в биографии"" https://t.co/GtZqjHNzyJ",FALSE,,,,,,,"NA NA","NA NA","NA NA NA NA NA NA NA NA","https://twitter.com/alfredobazoli/status/1500926036275511297","alfredo bazoli","Brescia","52 anni, avvocato, capogruppo del Partito Democratico in commissione giustizia alla Camera dei Deputati","https://t.co/8fFzktGvMW",FALSE,2370,619,57,2404,761,2012-01-25 11:39:20,FALSE,"https://t.co/8fFzktGvMW","http://www.alfredobazoli.it",,,"http://abs.twimg.com/images/themes/theme1/bg.png","http://pbs.twimg.com/profile_images/3671040322/7d7bd18c8680bf5fdaea36765192715c_normal.jpeg"
"x473842449","x1500733983688208391",2022-03-07 07:23:58,"alfredobazoli","Il Partito Democratico ha da un anno un segretario, da oggi un leader. https://t.co/NmfEVYOw2W","Twitter for Android",115,,,,FALSE,TRUE,0,175,,,,,,,,"http://pbs.twimg.com/media/FNMKUOMXIAQUZYT.jpg","https://t.co/NmfEVYOw2W","https://twitter.com/PoliticaPerJedi/status/1500554448376147972/photo/1","photo","http://pbs.twimg.com/media/FNMKUOMXIAQUZYT.jpg","https://t.co/NmfEVYOw2W","https://twitter.com/PoliticaPerJedi/status/1500554448376147972/photo/1",,"x696595370395172864","PoliticaPerJedi","it",,,,,,,,,,,,,,,,"x1500554448376147972","Il Partito Democratico ha da un anno un segretario, da oggi un leader. https://t.co/NmfEVYOw2W",2022-03-06 19:30:34,"Twitter for iPad",2596,175,"x696595370395172864","PoliticaPerJedi","Yoda",54050,995,52056,"","So this is how liberty dies. With thunderous applause.",FALSE,,,,,,,"NA NA","NA NA","NA NA NA NA NA NA NA NA","https://twitter.com/alfredobazoli/status/1500733983688208391","alfredo bazoli","Brescia","52 anni, avvocato, capogruppo del Partito Democratico in commissione giustizia alla Camera dei Deputati","https://t.co/8fFzktGvMW",FALSE,2370,619,57,2404,761,2012-01-25 11:39:20,FALSE,"https://t.co/8fFzktGvMW","http://www.alfredobazoli.it",,,"http://abs.twimg.com/images/themes/theme1/bg.png","http://pbs.twimg.com/profile_images/3671040322/7d7bd18c8680bf5fdaea36765192715c_normal.jpeg"
"x474175425","x1500961430002151430",2022-03-07 22:27:46,"EnricoBorghi1","@PLCastagnetti La Storia, evidentemente, non era finita…","Twitter for iPhone",41,"x1500839211573952521","x1363893966","PLCastagnetti",FALSE,FALSE,1,0,,,,,,,,,,,,,,,,"x1363893966","PLCastagnetti","it",,,,,,,,,,,,,,,,,,,,,,,,,,,,,,,,,,,,,"NA NA","NA NA","NA NA NA NA NA NA NA NA","https://twitter.com/EnricoBorghi1/status/1500961430002151430","Enrico Borghi","","Deputato della Repubblica, eletto nel Partito Democratico (collegio Alto Piemonte), membro della segreteria nazionale PD e responsabile politiche sicurezza Dem","https://t.co/MzsIxLrNdh",FALSE,6095,2256,103,21660,20030,2012-01-25 18:39:06,FALSE,"https://t.co/MzsIxLrNdh","http://www.e-borghi.it",,"https://pbs.twimg.com/profile_banners/474175425/1495827618","http://abs.twimg.com/images/themes/theme1/bg.png","http://pbs.twimg.com/profile_images/1298374106656759810/wmdEax-a_normal.jpg"
"x474175425","x1500961103052001282",2022-03-07 22:26:28,"EnricoBorghi1","Mario Draghi e le polemiche sul #catasto: “nessuno pagherà più tasse” https://t.co/omywaNnrPn","Twitter for iPhone",110,,,,FALSE,TRUE,0,129,,,"catasto",,,,,"http://pbs.twimg.com/ext_tw_video_thumb/1500797950003396609/pu/img/AH7NClofryYfEHxN.jpg","https://t.co/omywaNnrPn","https://twitter.com/paolansuini/status/1500798017619865603/video/1","photo","http://pbs.twimg.com/ext_tw_video_thumb/1500797950003396609/pu/img/AH7NClofryYfEHxN.jpg","https://t.co/omywaNnrPn","https://twitter.com/paolansuini/status/1500798017619865603/video/1",,"x3056156219","paolansuini","it",,,,,,,,,,,,,,,,"x1500798017619865603","Mario Draghi e le polemiche sul #catasto: “nessuno pagherà più tasse” https://t.co/omywaNnrPn",2022-03-07 11:38:25,"Twitter for iPhone",442,129,"x3056156219","paolansuini","paola ansuini",6367,812,2728,"","Director of communications Opinions my own. RT/link/follow is not endorsement.",FALSE,,,,,,,"NA NA","NA NA","NA NA NA NA NA NA NA NA","https://twitter.com/EnricoBorghi1/status/1500961103052001282","Enrico Borghi","","Deputato della Repubblica, eletto nel Partito Democratico (collegio Alto Piemonte), membro della segreteria nazionale PD e responsabile politiche sicurezza Dem","https://t.co/MzsIxLrNdh",FALSE,6095,2256,103,21660,20030,2012-01-25 18:39:06,FALSE,"https://t.co/MzsIxLrNdh","http://www.e-borghi.it",,"https://pbs.twimg.com/profile_banners/474175425/1495827618","http://abs.twimg.com/images/themes/theme1/bg.png","http://pbs.twimg.com/profile_images/1298374106656759810/wmdEax-a_normal.jpg"
"x474175425","x1500873299659743233",2022-03-07 16:37:34,"EnricoBorghi1","‘Cities stand with Ukraine’
Come presidente di @EUROCITIES, la più grande rete di città europee, ho proposto una manifestazione a favore del popolo ucraino. Un’iniziativa comune nelle città europee per chiedere il cessate il fuoco. 
Le città sono per la pace. #CitiesWithUkraine https://t.co/XeNjGVWx5m","Twitter for iPhone",140,,,,FALSE,TRUE,0,44,,,,,,,,,,,,,,,,"x434505068 x312028258","DarioNardella EUROCITIES","it",,,,,,,,,,,,,,,,"x1499712748443385858","‘Cities stand with Ukraine’
Come presidente di @EUROCITIES, la più grande rete di città europee, ho proposto una manifestazione a favore del popolo ucraino. Un’iniziativa comune nelle città europee per chiedere il cessate il fuoco. 
Le città sono per la pace. #CitiesWithUkraine https://t.co/XeNjGVWx5m",2022-03-04 11:45:57,"Twitter for iPhone",143,44,"x434505068","DarioNardella","Dario Nardella",72146,1829,20862,"Firenze","Sindaco di Firenze e Presidente di Eurocities. Musicista, giurista, babbo di Cosimo, Amélie e Francesco. Al servizio della mia città, la più bella del mondo.",TRUE,,,,,,,"NA NA","NA NA","NA NA NA NA NA NA NA NA","https://twitter.com/EnricoBorghi1/status/1500873299659743233","Enrico Borghi","","Deputato della Repubblica, eletto nel Partito Democratico (collegio Alto Piemonte), membro della segreteria nazionale PD e responsabile politiche sicurezza Dem","https://t.co/MzsIxLrNdh",FALSE,6095,2256,103,21660,20030,2012-01-25 18:39:06,FALSE,"https://t.co/MzsIxLrNdh","http://www.e-borghi.it",,"https://pbs.twimg.com/profile_banners/474175425/1495827618","http://abs.twimg.com/images/themes/theme1/bg.png","http://pbs.twimg.com/profile_images/1298374106656759810/wmdEax-a_normal.jpg"
"x474175425","x1500793433618796549",2022-03-07 11:20:12,"EnricoBorghi1","Sì. Quei segni, piccoli ma inequivocabili, utili a confermarti che sei sulla strada giusta. https://t.co/fISIvXJoVV","Twitter for iPhone",108,,,,FALSE,TRUE,0,180,,,,,,,,,,,,,,,,"x419622371","EnricoLetta","it",,,,,,,,,,,,,,,,"x1500739999456759810","Sì. Quei segni, piccoli ma inequivocabili, utili a confermarti che sei sulla strada giusta. https://t.co/fISIvXJoVV",2022-03-07 07:47:52,"Twitter for iPhone",3159,180,"x419622371","EnricoLetta","Enrico Letta",665248,13824,16632,"","Segretario del Partito Democratico @pdnetwork, Presidente @DelorsInstitute.",TRUE,,,,,,,"NA NA","NA NA","NA NA NA NA NA NA NA NA","https://twitter.com/EnricoBorghi1/status/1500793433618796549","Enrico Borghi","","Deputato della Repubblica, eletto nel Partito Democratico (collegio Alto Piemonte), membro della segreteria nazionale PD e responsabile politiche sicurezza Dem","https://t.co/MzsIxLrNdh",FALSE,6095,2256,103,21660,20030,2012-01-25 18:39:06,FALSE,"https://t.co/MzsIxLrNdh","http://www.e-borghi.it",,"https://pbs.twimg.com/profile_banners/474175425/1495827618","http://abs.twimg.com/images/themes/theme1/bg.png","http://pbs.twimg.com/profile_images/1298374106656759810/wmdEax-a_normal.jpg"
"x385923471","x1500898399054286849",2022-03-07 18:17:18,"bragachiara","#HumanTechnopole si fonda su eccellenza scientifica e vuole offrire al Paese un progetto competitivo a livello internazionale. L'obiettivo è promuovere ricerca italiana e favorire rientro dei nostri talenti. Ricerca è fattore di crescita e inclusione
@serracchiani
@SimonaMalpezzi https://t.co/6Ew79BY93N","Twitter for iPhone",140,,,,FALSE,TRUE,0,2,,,"HumanTechnopole",,,,,,,,,,,,,"x76616277","Deputatipd","it",,,,,,,,,,,,,,,,"x1500829743716913155","#HumanTechnopole si fonda su eccellenza scientifica e vuole offrire al Paese un progetto competitivo a livello internazionale. L'obiettivo è promuovere ricerca italiana e favorire rientro dei nostri talenti. Ricerca è fattore di crescita e inclusione
@serracchiani
@SimonaMalpezzi https://t.co/6Ew79BY93N",2022-03-07 13:44:29,"Twitter for iPhone",10,2,"x76616277","Deputatipd","Deputati PD",93287,183,102011,"Roma, Lazio","Account ufficiale del Gruppo del Partito Democratico alla Camera. Seguici anche su https://t.co/rh1UpkyMMy",FALSE,,,,,,,"NA NA","NA NA","NA NA NA NA NA NA NA NA","https://twitter.com/bragachiara/status/1500898399054286849","Chiara Braga","Como - Roma","Deputata, Segreteria nazionale PD Responsabile Transizione ecologica, sostenibilità, infrastrutture.Capogruppo PD Commissione Ecomafie. Urbanista","https://t.co/UG5BiMDaHn",FALSE,10730,1705,200,7147,13232,2011-10-06 11:19:37,FALSE,"https://t.co/UG5BiMDaHn","http://www.chiarabraga.it",,"https://pbs.twimg.com/profile_banners/385923471/1559121970","http://abs.twimg.com/images/themes/theme1/bg.png","http://pbs.twimg.com/profile_images/1435621424744615936/QQkPdWtg_normal.jpg"
"x385923471","x1500896515065327616",2022-03-07 18:09:49,"bragachiara","🇮🇹 Grazie alla delegazione dei parlamentari del @pdnetwork che oggi ha visitato i nostri laboratori e incontrato i nostri scienziati!

🇬🇧 Thanks to the delegation of the Democratic Party parliamentarians who visited our laboratories and met our scientists today! https://t.co/JwHyyZZVZv","Twitter for iPhone",140,,,,FALSE,TRUE,0,11,,,,,,,,,,,,,,,,"x951849480277647362 x13294452","humantechnopole pdnetwork","it",,,,,,,,,,,,,,,,"x1500839122260447237","🇮🇹 Grazie alla delegazione dei parlamentari del @pdnetwork che oggi ha visitato i nostri laboratori e incontrato i nostri scienziati!

🇬🇧 Thanks to the delegation of the Democratic Party parliamentarians who visited our laboratories and met our scientists today! https://t.co/JwHyyZZVZv",2022-03-07 14:21:45,"Twitter Web App",35,11,"x951849480277647362","humantechnopole","Human Technopole",5987,486,1317,"Palazzo Italia, Milan","Italy's research institute for #LifeSciences based in Palazzo Italia, Milan. Our mission is to promote human health & well-being.",FALSE,,,,,,,"NA NA","NA NA","NA NA NA NA NA NA NA NA","https://twitter.com/bragachiara/status/1500896515065327616","Chiara Braga","Como - Roma","Deputata, Segreteria nazionale PD Responsabile Transizione ecologica, sostenibilità, infrastrutture.Capogruppo PD Commissione Ecomafie. Urbanista","https://t.co/UG5BiMDaHn",FALSE,10730,1705,200,7147,13232,2011-10-06 11:19:37,FALSE,"https://t.co/UG5BiMDaHn","http://www.chiarabraga.it",,"https://pbs.twimg.com/profile_banners/385923471/1559121970","http://abs.twimg.com/images/themes/theme1/bg.png","http://pbs.twimg.com/profile_images/1435621424744615936/QQkPdWtg_normal.jpg"
"x339682634","x1501006425471995910",2022-03-08 01:26:33,"carla_cantone","Carte de l'expansion de l'OTAN en Europe depuis 1997 https://t.co/Q8q8bABi2T","Twitter for Android",95,,,,FALSE,TRUE,0,30,,,,,,,,"http://pbs.twimg.com/media/FNPMiUsWQAEVXuk.jpg","https://t.co/Q8q8bABi2T","https://twitter.com/lecartographe/status/1500768083476164612/photo/1","photo","http://pbs.twimg.com/media/FNPMiUsWQAEVXuk.jpg","https://t.co/Q8q8bABi2T","https://twitter.com/lecartographe/status/1500768083476164612/photo/1",,"x751148918","lecartographe","fr",,,,,,,,,,,,,,,,"x1500768083476164612","Carte de l'expansion de l'OTAN en Europe depuis 1997 https://t.co/Q8q8bABi2T",2022-03-07 09:39:28,"Twitter Web App",64,30,"x751148918","lecartographe","Le Cartographe 🗺 🍷",14249,985,16013,"Châteauroux-les-Alpes, Alpes !","A. Nicolas. Cartographe/géomaticien. Des idées à la carte... #SIG #HautesAlpes #CNRSÉditions #RevueXXI #6Mois #RevueVinsDeFrance #ToponymieRomantique #QuizzTown",FALSE,,,,,,,"NA NA","NA NA","NA NA NA NA NA NA NA NA","https://twitter.com/carla_cantone/status/1501006425471995910","Carla Cantone","New York, NY","",,FALSE,161,855,0,3985,68205,2011-07-21 13:57:38,FALSE,,,,"https://pbs.twimg.com/profile_banners/339682634/1640090519","http://abs.twimg.com/images/themes/theme1/bg.png","http://pbs.twimg.com/profile_images/1330234437079019525/hJImSvHC_normal.jpg"
"x339682634","x1500947422134087682",2022-03-07 21:32:06,"carla_cantone","@poncyvaper This is why the British working class needs its own party to fight for a workers government, not a ""Labour"" party that seeks to administer capitalism","Twitter for Android",149,"x1500584476669366276","x302258807","poncyvaper",FALSE,FALSE,0,0,,,,,,,,,,,,,,,,"x302258807","poncyvaper","en",,,,,,,,,,,,,,,,,,,,,,,,,,,,,,,,,,,,,"NA NA","NA NA","NA NA NA NA NA NA NA NA","https://twitter.com/carla_cantone/status/1500947422134087682","Carla Cantone","New York, NY","",,FALSE,161,855,0,3985,68205,2011-07-21 13:57:38,FALSE,,,,"https://pbs.twimg.com/profile_banners/339682634/1640090519","http://abs.twimg.com/images/themes/theme1/bg.png","http://pbs.twimg.com/profile_images/1330234437079019525/hJImSvHC_normal.jpg"
"x441863803","x1500917957274357764",2022-03-07 19:35:01,"StefanoCeccanti","Ciao patriarca #Kirill, sai perché posso postare questo disegno? Perché qui noi votiamo, scriviamo, disegniamo, esprimiamo quello che vogliamo. E amiamo anche chi vogliamo, perché siamo liberi. 
Ah già, ma tu non puoi leggermi: ti hanno chiuso persino Twitter.
Contento te... https://t.co/BtF7ZVOpJv","Twitter for Android",140,,,,FALSE,TRUE,0,29,,,"Kirill",,,,,,,,,,,,,"x1240690942904066049","elevisconti","it",,,,,,,,,,,,,,,,"x1500906680342786049","Ciao patriarca #Kirill, sai perché posso postare questo disegno? Perché qui noi votiamo, scriviamo, disegniamo, esprimiamo quello che vogliamo. E amiamo anche chi vogliamo, perché siamo liberi. 
Ah già, ma tu non puoi leggermi: ti hanno chiuso persino Twitter.
Contento te... https://t.co/BtF7ZVOpJv",2022-03-07 18:50:12,"Twitter for Android",217,29,"x1240690942904066049","elevisconti","Elena Visconti",11312,663,20069,"","Mi disegno così ma ho imparato da poco. Dal vivo sono molto meglio, giuro.",FALSE,,,,,,,"NA NA","NA NA","NA NA NA NA NA NA NA NA","https://twitter.com/StefanoCeccanti/status/1500917957274357764","StefanoCeccanti","Roma, La Sapienza e Camera","prof diritto pubblico comparato La Sapienza, deputato Pisa Livorno Poggibonsi, Capogruppo Pd commissione affari costituzionali","https://t.co/oEFwEITb4D",FALSE,18595,1778,204,59443,154,2011-12-20 14:05:49,FALSE,"https://t.co/oEFwEITb4D","http://www.stefanoceccanti.it",,"https://pbs.twimg.com/profile_banners/441863803/1517909312","http://abs.twimg.com/images/themes/theme1/bg.png","http://pbs.twimg.com/profile_images/1496799531392020482/rLqOUO1h_normal.jpg"
"x441863803","x1500883636530425860",2022-03-07 17:18:38,"StefanoCeccanti","Ho il sospetto che il Dio in cui crede Kirill non sia il Dio in cui credo. Né sia il Dio invocato da papa Francesco. E nemmeno sia il Dio che ci ha rivelato Gesù di Nazaret e invocato dai fedeli ortodossi ucraini. https://t.co/DYiSMCKtJ3","Twitter for Android",140,,,,FALSE,TRUE,0,8,,,,,,,,,,,,,,,,"x949907912","donvimar","it",,,,,,,,,,,,,,,,"x1500796008854401024","Ho il sospetto che il Dio in cui crede Kirill non sia il Dio in cui credo. Né sia il Dio invocato da papa Francesco. E nemmeno sia il Dio che ci ha rivelato Gesù di Nazaret e invocato dai fedeli ortodossi ucraini. https://t.co/DYiSMCKtJ3",2022-03-07 11:30:26,"Twitter for Android",52,8,"x949907912","donvimar","Vincenzo Marras",844,182,6272,"Milano, Lombardia","Sacerdote della Società San Paolo. Dal 1984 al 2009 al mensile Jesus. Dal settembre 2015 a giugno 2018 parroco a Roma. Da agosto 2018 a Milano.",FALSE,,,,,,,"NA NA","NA NA","NA NA NA NA NA NA NA NA","https://twitter.com/StefanoCeccanti/status/1500883636530425860","StefanoCeccanti","Roma, La Sapienza e Camera","prof diritto pubblico comparato La Sapienza, deputato Pisa Livorno Poggibonsi, Capogruppo Pd commissione affari costituzionali","https://t.co/oEFwEITb4D",FALSE,18595,1778,204,59443,154,2011-12-20 14:05:49,FALSE,"https://t.co/oEFwEITb4D","http://www.stefanoceccanti.it",,"https://pbs.twimg.com/profile_banners/441863803/1517909312","http://abs.twimg.com/images/themes/theme1/bg.png","http://pbs.twimg.com/profile_images/1496799531392020482/rLqOUO1h_normal.jpg"
