"x87467449","x1483841042168397826",2022-01-19 16:37:27,"grotondi","@MIF_76 Con nome e cognome,volli così","Twitter for iPhone",29,"x1483840734138621957","x342008649","MIF_76",FALSE,FALSE,3,0,,,,,,,,,,,,,,,,"x342008649","MIF_76","it",,,,,,,,,,,,,,,,,,,,,,,,,,,,,,,,,,,,,"NA NA","NA NA","NA NA NA NA NA NA NA NA","https://twitter.com/grotondi/status/1483841042168397826","Gianfranco Rotondi","Pescara, Abruzzo","sono poco su Twitter ma senza staff","https://t.co/whoci2nVr7",FALSE,32690,6094,289,51487,8619,2009-11-04 15:52:34,FALSE,"https://t.co/whoci2nVr7","http://www.fondazionedemocraziacristiana.it",,"https://pbs.twimg.com/profile_banners/87467449/1522754488","http://abs.twimg.com/images/themes/theme1/bg.png","http://pbs.twimg.com/profile_images/1420443859952283656/Np6eQk74_normal.jpg"
"x87467449","x1483839730756296713",2022-01-19 16:32:14,"grotondi","Grillo dovrebbe cacciare a calci nel sedere quei fanatici del suo partito che,  durante l’esame della spazzacorrotti, col sangue agli occhi, hanno fatto a pezzi le nostre obiezioni sul reato di traffico di influenze. Ed hanno anche aumentato la pena fissandola a 4 anni e 6 mesi.","Twitter for iPhone",140,,,,FALSE,TRUE,0,139,,,,,,,,,,,,,,,,"x1314572933340295168","Enrico__Costa","it",,,,,,,,,,,,,,,,"x1483681924472320002","Grillo dovrebbe cacciare a calci nel sedere quei fanatici del suo partito che,  durante l’esame della spazzacorrotti, col sangue agli occhi, hanno fatto a pezzi le nostre obiezioni sul reato di traffico di influenze. Ed hanno anche aumentato la pena fissandola a 4 anni e 6 mesi.",2022-01-19 06:05:10,"Twitter for iPhone",848,139,"x1314572933340295168","Enrico__Costa","Enrico Costa",6402,100,746,"","Deputato di @Azione_it",FALSE,,,,,,,"NA NA","NA NA","NA NA NA NA NA NA NA NA","https://twitter.com/grotondi/status/1483839730756296713","Gianfranco Rotondi","Pescara, Abruzzo","sono poco su Twitter ma senza staff","https://t.co/whoci2nVr7",FALSE,32690,6094,289,51487,8619,2009-11-04 15:52:34,FALSE,"https://t.co/whoci2nVr7","http://www.fondazionedemocraziacristiana.it",,"https://pbs.twimg.com/profile_banners/87467449/1522754488","http://abs.twimg.com/images/themes/theme1/bg.png","http://pbs.twimg.com/profile_images/1420443859952283656/Np6eQk74_normal.jpg"
"x87467449","x1483839151174729731",2022-01-19 16:29:56,"grotondi","Voglio bene a Craxi,perché non dimentico che firmó editoriali per il ‘Popolo’,quando ne fui direttore e lo attestai su una linea di centrodestra.
      Ci sentivamo tutti i giorni,al punto che un giorno mi disse:ma perché non vieni a trovarmi?
     Non l’ho ancora fatto,lo farò","Twitter for iPhone",278,,,,FALSE,FALSE,98,11,,,,,,,,,,,,,,,,,,"it",,,,,,,,,,,,,,,,,,,,,,,,,,,,,,,,,,,,,"NA NA","NA NA","NA NA NA NA NA NA NA NA","https://twitter.com/grotondi/status/1483839151174729731","Gianfranco Rotondi","Pescara, Abruzzo","sono poco su Twitter ma senza staff","https://t.co/whoci2nVr7",FALSE,32690,6094,289,51487,8619,2009-11-04 15:52:34,FALSE,"https://t.co/whoci2nVr7","http://www.fondazionedemocraziacristiana.it",,"https://pbs.twimg.com/profile_banners/87467449/1522754488","http://abs.twimg.com/images/themes/theme1/bg.png","http://pbs.twimg.com/profile_images/1420443859952283656/Np6eQk74_normal.jpg"
"x87467449","x1483821317254172675",2022-01-19 15:19:04,"grotondi","Ha ragione da vendere #StefaniaCraxi: #Berlusconi va benissimo per fare il governo dei migliori ma come candidato presidente è divisivo. Fate pace con voi stessi…#lariachetira 
@martinoloiacono","Twitter for iPhone",140,,,,FALSE,TRUE,0,5,,,"StefaniaCraxi Berlusconi",,,,,,,,,,,,,"x87159394","maxperri71","it",,,,,,,,,,,,,,,,"x1483756276630933516","Ha ragione da vendere #StefaniaCraxi: #Berlusconi va benissimo per fare il governo dei migliori ma come candidato presidente è divisivo. Fate pace con voi stessi…#lariachetira 
@martinoloiacono",2022-01-19 11:00:37,"Twitter for iPhone",20,5,"x87159394","maxperri71","Massimiliano Perri 🌳",1933,3631,40850,"Milan, Lombardy - Italy","50enne, sposo lieto dal 97 di Lorenza, papà di LetiziaSimoneFilippoVeraAlice; avvocato per studio, comunicatore per passione: ieri Expo2015, domani? #quicosemie",FALSE,,,,,,,"NA NA","NA NA","NA NA NA NA NA NA NA NA","https://twitter.com/grotondi/status/1483821317254172675","Gianfranco Rotondi","Pescara, Abruzzo","sono poco su Twitter ma senza staff","https://t.co/whoci2nVr7",FALSE,32690,6094,289,51487,8619,2009-11-04 15:52:34,FALSE,"https://t.co/whoci2nVr7","http://www.fondazionedemocraziacristiana.it",,"https://pbs.twimg.com/profile_banners/87467449/1522754488","http://abs.twimg.com/images/themes/theme1/bg.png","http://pbs.twimg.com/profile_images/1420443859952283656/Np6eQk74_normal.jpg"
"x87467449","x1483821265718812681",2022-01-19 15:18:52,"grotondi","Riformista, innovatore e decisionista ma anche figura controversa. Craxi è stato uno dei leader più importanti dell’Italia contemporanea. 

Milano, 24 febbraio 1934 – Hammamet, 19 gennaio 2000 🇮🇹🌹 https://t.co/FmklryToAi","Twitter for iPhone",140,,,,FALSE,TRUE,0,23,,,,,,,,,,,,,,,,"x4577632036","martinoloiacono","it",,,,,,,,,,,,,,,,"x1483684586781655040","Riformista, innovatore e decisionista ma anche figura controversa. Craxi è stato uno dei leader più importanti dell’Italia contemporanea. 

Milano, 24 febbraio 1934 – Hammamet, 19 gennaio 2000 🇮🇹🌹 https://t.co/FmklryToAi",2022-01-19 06:15:45,"Twitter for iPhone",191,23,"x4577632036","martinoloiacono","Martino Loiacono",5895,2858,32063,"Milano, Lombardia","@ItaliaOggi, @atlanticomag e @Tempi_it. Politica, comunicazione, media e a volte marketing. Mai senza Milan e America. Qui opinioni personali.",FALSE,,,,,,,"NA NA","NA NA","NA NA NA NA NA NA NA NA","https://twitter.com/grotondi/status/1483821265718812681","Gianfranco Rotondi","Pescara, Abruzzo","sono poco su Twitter ma senza staff","https://t.co/whoci2nVr7",FALSE,32690,6094,289,51487,8619,2009-11-04 15:52:34,FALSE,"https://t.co/whoci2nVr7","http://www.fondazionedemocraziacristiana.it",,"https://pbs.twimg.com/profile_banners/87467449/1522754488","http://abs.twimg.com/images/themes/theme1/bg.png","http://pbs.twimg.com/profile_images/1420443859952283656/Np6eQk74_normal.jpg"
"x87467449","x1483821121740881922",2022-01-19 15:18:18,"grotondi","Qui politica. Oggi è l'anniversario della scomparsa di Bettino #Craxi. Per me è un giorno di lutto. Vedo però troppe lacrime di coccodrillo. La verità è che Craxi fu lasciato da solo alla gogna mediatica giudiziaria. Pochi lo difesero.","Twitter for iPhone",140,,,,FALSE,TRUE,0,26,,,"Craxi",,,,,,,,,,,,,"x544218009","DonatoRobilotta","it",,,,,,,,,,,,,,,,"x1483754522988187653","Qui politica. Oggi è l'anniversario della scomparsa di Bettino #Craxi. Per me è un giorno di lutto. Vedo però troppe lacrime di coccodrillo. La verità è che Craxi fu lasciato da solo alla gogna mediatica giudiziaria. Pochi lo difesero.",2022-01-19 10:53:39,"Twitter for Android",125,26,"x544218009","DonatoRobilotta","Donato Robilotta",2027,953,39917,"Roma","Opinioni e un po' di Politica  per passione. Da sempre Socialista. Pres. ass. Amici de Il Garofano Rosso.",FALSE,,,,,,,"NA NA","NA NA","NA NA NA NA NA NA NA NA","https://twitter.com/grotondi/status/1483821121740881922","Gianfranco Rotondi","Pescara, Abruzzo","sono poco su Twitter ma senza staff","https://t.co/whoci2nVr7",FALSE,32690,6094,289,51487,8619,2009-11-04 15:52:34,FALSE,"https://t.co/whoci2nVr7","http://www.fondazionedemocraziacristiana.it",,"https://pbs.twimg.com/profile_banners/87467449/1522754488","http://abs.twimg.com/images/themes/theme1/bg.png","http://pbs.twimg.com/profile_images/1420443859952283656/Np6eQk74_normal.jpg"
"x87467449","x1483782711408046087",2022-01-19 12:45:40,"grotondi","Oggi con il cuore ad #Hammamet dove riposa Bettino #Craxi. 
Un riferimento, un leader, un campione del riformismo socialista e liberale https://t.co/ENFPZzeBJa","Twitter for iPhone",140,,,,FALSE,TRUE,0,25,,,"Hammamet Craxi",,,,,,,,,,,,,"x109659461","StefanoCaldoro","it",,,,,,,,,,,,,,,,"x1483746120987811841","Oggi con il cuore ad #Hammamet dove riposa Bettino #Craxi. 
Un riferimento, un leader, un campione del riformismo socialista e liberale https://t.co/ENFPZzeBJa",2022-01-19 10:20:16,"Twitter for iPhone",213,25,"x109659461","StefanoCaldoro","Stefano Caldoro",18000,1799,5917,"Napoli","Capo dell’opposizione di centrodestra in Consiglio regionale della Campania",FALSE,,,,,,,"NA NA","NA NA","NA NA NA NA NA NA NA NA","https://twitter.com/grotondi/status/1483782711408046087","Gianfranco Rotondi","Pescara, Abruzzo","sono poco su Twitter ma senza staff","https://t.co/whoci2nVr7",FALSE,32690,6094,289,51487,8619,2009-11-04 15:52:34,FALSE,"https://t.co/whoci2nVr7","http://www.fondazionedemocraziacristiana.it",,"https://pbs.twimg.com/profile_banners/87467449/1522754488","http://abs.twimg.com/images/themes/theme1/bg.png","http://pbs.twimg.com/profile_images/1420443859952283656/Np6eQk74_normal.jpg"
"x201658727","x1483870353659154440",2022-01-19 18:33:55,"VittorioSgarbi","In Inghilterra Johnson annuncia la revoca del Green Pass in Gran Bretagna. Via anche lo “smart working” e le mascherine.
Perché noi, invece, ci ostiniamo a vivere da reclusi? @stampasgarbi","Twitter for iPhone",188,,,,FALSE,FALSE,4404,1017,,,,,,,,,,,,,,,,"x2164988132","stampasgarbi","it",,,,,,,,,,,,,,,,,,,,,,,,,,,,,,,,,,,,,"NA NA","NA NA","NA NA NA NA NA NA NA NA","https://twitter.com/VittorioSgarbi/status/1483870353659154440","Vittorio Sgarbi","mai nello stesso luogo","Twitter ufficiale di Vittorio Sgarbi - Storico dell'Arte e Opinionista | Contatti: press@vittoriosgarbi.it
Capra Store: https://t.co/XvD8pqlFul","https://t.co/v3GBQb33Lz",FALSE,804005,358,1306,12057,4264,2010-10-12 10:20:00,TRUE,"https://t.co/v3GBQb33Lz","http://www.vittoriosgarbi.it",,"https://pbs.twimg.com/profile_banners/201658727/1640596883","http://abs.twimg.com/images/themes/theme1/bg.png","http://pbs.twimg.com/profile_images/378800000563952334/834a3c187534931f8af26f78b6c274a8_normal.jpeg"
"x201658727","x1483857667768606721",2022-01-19 17:43:31,"VittorioSgarbi","Mascherine: prevalga la ragione non il fanatismo. https://t.co/IjAgqol9dT @stampasgarbi","Twitter for iPhone",87,,,,FALSE,FALSE,326,46,,,,,"youtu.be/BUOreLAp9rQ","https://t.co/IjAgqol9dT","https://youtu.be/BUOreLAp9rQ",,,,,,,,,"x2164988132","stampasgarbi","it",,,,,,,,,,,,,,,,,,,,,,,,,,,,,,,,,,,,,"NA NA","NA NA","NA NA NA NA NA NA NA NA","https://twitter.com/VittorioSgarbi/status/1483857667768606721","Vittorio Sgarbi","mai nello stesso luogo","Twitter ufficiale di Vittorio Sgarbi - Storico dell'Arte e Opinionista | Contatti: press@vittoriosgarbi.it
Capra Store: https://t.co/XvD8pqlFul","https://t.co/v3GBQb33Lz",FALSE,804005,358,1306,12057,4264,2010-10-12 10:20:00,TRUE,"https://t.co/v3GBQb33Lz","http://www.vittoriosgarbi.it",,"https://pbs.twimg.com/profile_banners/201658727/1640596883","http://abs.twimg.com/images/themes/theme1/bg.png","http://pbs.twimg.com/profile_images/378800000563952334/834a3c187534931f8af26f78b6c274a8_normal.jpeg"
"x201658727","x1483852123691532288",2022-01-19 17:21:29,"VittorioSgarbi","In diretta. https://t.co/BB1aUpCgQO @stampasgarbi","Twitter for iPhone",49,,,,FALSE,FALSE,33,4,,,,,"fb.watch/aE0wV0I5Fa/","https://t.co/BB1aUpCgQO","https://fb.watch/aE0wV0I5Fa/",,,,,,,,,"x2164988132","stampasgarbi","it",,,,,,,,,,,,,,,,,,,,,,,,,,,,,,,,,,,,,"NA NA","NA NA","NA NA NA NA NA NA NA NA","https://twitter.com/VittorioSgarbi/status/1483852123691532288","Vittorio Sgarbi","mai nello stesso luogo","Twitter ufficiale di Vittorio Sgarbi - Storico dell'Arte e Opinionista | Contatti: press@vittoriosgarbi.it
Capra Store: https://t.co/XvD8pqlFul","https://t.co/v3GBQb33Lz",FALSE,804005,358,1306,12057,4264,2010-10-12 10:20:00,TRUE,"https://t.co/v3GBQb33Lz","http://www.vittoriosgarbi.it",,"https://pbs.twimg.com/profile_banners/201658727/1640596883","http://abs.twimg.com/images/themes/theme1/bg.png","http://pbs.twimg.com/profile_images/378800000563952334/834a3c187534931f8af26f78b6c274a8_normal.jpeg"
"x201658727","x1483842066983665666",2022-01-19 16:41:31,"VittorioSgarbi","Alle 18,00 alla Galleria Nazionale di Roma. @stampasgarbi @lanavediteseoed https://t.co/AnpK4UdNYg","Twitter for iPhone",74,,,,FALSE,FALSE,87,12,,,,,,,,"http://pbs.twimg.com/media/FJeqfjIXMAA2AtS.jpg","https://t.co/AnpK4UdNYg","https://twitter.com/VittorioSgarbi/status/1483842066983665666/photo/1","photo","http://pbs.twimg.com/media/FJeqfjIXMAA2AtS.jpg","https://t.co/AnpK4UdNYg","https://twitter.com/VittorioSgarbi/status/1483842066983665666/photo/1",,"x2164988132 x4275320235","stampasgarbi lanavediteseoed","it",,,,,,,,,,,,,,,,,,,,,,,,,,,,,,,,,,,,,"NA NA","NA NA","NA NA NA NA NA NA NA NA","https://twitter.com/VittorioSgarbi/status/1483842066983665666","Vittorio Sgarbi","mai nello stesso luogo","Twitter ufficiale di Vittorio Sgarbi - Storico dell'Arte e Opinionista | Contatti: press@vittoriosgarbi.it
Capra Store: https://t.co/XvD8pqlFul","https://t.co/v3GBQb33Lz",FALSE,804005,358,1306,12057,4264,2010-10-12 10:20:00,TRUE,"https://t.co/v3GBQb33Lz","http://www.vittoriosgarbi.it",,"https://pbs.twimg.com/profile_banners/201658727/1640596883","http://abs.twimg.com/images/themes/theme1/bg.png","http://pbs.twimg.com/profile_images/378800000563952334/834a3c187534931f8af26f78b6c274a8_normal.jpeg"
"x201658727","x1483835090757115908",2022-01-19 16:13:48,"VittorioSgarbi","Quando si dice “navigare in brutte acque”… 
https://t.co/W3t71WhpOD @stampasgarbi","Twitter for iPhone",81,,,,FALSE,FALSE,167,24,,,,,"ansa.it/amp/lombardia/…","https://t.co/W3t71WhpOD","https://www.ansa.it/amp/lombardia/notizie/2022/01/18/beppe-grillo-indagato-a-milano-per-contratti-con-moby_a0571e9d-8e08-4381-980f-d6c97ed7389f.html",,,,,,,,,"x2164988132","stampasgarbi","it",,,,,,,,,,,,,,,,,,,,,,,,,,,,,,,,,,,,,"NA NA","NA NA","NA NA NA NA NA NA NA NA","https://twitter.com/VittorioSgarbi/status/1483835090757115908","Vittorio Sgarbi","mai nello stesso luogo","Twitter ufficiale di Vittorio Sgarbi - Storico dell'Arte e Opinionista | Contatti: press@vittoriosgarbi.it
Capra Store: https://t.co/XvD8pqlFul","https://t.co/v3GBQb33Lz",FALSE,804005,358,1306,12057,4264,2010-10-12 10:20:00,TRUE,"https://t.co/v3GBQb33Lz","http://www.vittoriosgarbi.it",,"https://pbs.twimg.com/profile_banners/201658727/1640596883","http://abs.twimg.com/images/themes/theme1/bg.png","http://pbs.twimg.com/profile_images/378800000563952334/834a3c187534931f8af26f78b6c274a8_normal.jpeg"
"x499672556","x1483767667647557633",2022-01-19 11:45:53,"GiorgioSilli","Secondo inchiesta, mentre Conte governava e Toninelli iniziava braccio di ferro con Moby per rinnovo concessioni tratte, Moby firmava contratti con Beppe Grillo e con Casaleggio per un totale di un 1 milione di €.

Travaglio che ne pensa?
Capite a cosa è sempre servito M5S?","Twitter for iPhone",140,,,,FALSE,TRUE,0,143,,,,,,,,,,,,,,,,"x39512728","jontargetti","it",,,,,,,,,,,,,,,,"x1483700212694671363","Secondo inchiesta, mentre Conte governava e Toninelli iniziava braccio di ferro con Moby per rinnovo concessioni tratte, Moby firmava contratti con Beppe Grillo e con Casaleggio per un totale di un 1 milione di €.

Travaglio che ne pensa?
Capite a cosa è sempre servito M5S?",2022-01-19 07:17:51,"Twitter for Android",507,143,"x39512728","jontargetti","Jonathan Targetti",2408,1318,7862,"Prato","Babbo di Olimpia e Ida 👶🏻. Radicale, liberale, liberista e libertario. Nel tempo libero lavoro.",FALSE,,,,,,,"NA NA","NA NA","NA NA NA NA NA NA NA NA","https://twitter.com/GiorgioSilli/status/1483767667647557633","Giorgio Silli","Prato, Toscana","Babbo di Isabella, Deputato della Repubblica.Tintore. Molto rossiniano","https://t.co/i4HLZLAULC",FALSE,1913,654,33,6692,2609,2012-02-22 10:49:12,FALSE,"https://t.co/i4HLZLAULC","http://giorgiosilli.it",,"https://pbs.twimg.com/profile_banners/499672556/1434717572","http://abs.twimg.com/images/themes/theme1/bg.png","http://pbs.twimg.com/profile_images/1076762978752577536/9E8AyaPD_normal.jpg"
"x906269360","x1484118339358187520",2022-01-20 10:59:20,"tripodimaria","La giusta direzione. Dobbiamo fare tutto il possibile per aiutare famiglie e imprese contro il caro bollette. Siamo di fronte a una storica occasione di ripartenza. Non possiamo farcela sfuggire. https://t.co/KWaCGESZFe","Twitter for iPhone",140,,,,FALSE,TRUE,0,2,,,,,,,,,,,,,,,,"x147543162","forza_italia","it",,,,,,,,,,,,,,,,"x1484115532861353985","La giusta direzione. Dobbiamo fare tutto il possibile per aiutare famiglie e imprese contro il caro bollette. Siamo di fronte a una storica occasione di ripartenza. Non possiamo farcela sfuggire. https://t.co/KWaCGESZFe",2022-01-20 10:48:11,"Twitter for Android",8,2,"x147543162","forza_italia","Forza Italia",169496,802,191095,"Italia","Account ufficiale del movimento politico Forza Italia.",TRUE,,,,,,,"NA NA","NA NA","NA NA NA NA NA NA NA NA","https://twitter.com/tripodimaria/status/1484118339358187520","Maria Tripodi","","Deputato della Repubblica•                Eletta nel Collegio Calabria02•   Capogruppo @forza_Italia in @cd_difesa•  Dott.ssa in Relazioni Internazionali",,FALSE,6587,2352,44,11709,17168,2012-10-26 15:54:35,FALSE,,,,"https://pbs.twimg.com/profile_banners/906269360/1521784227","http://abs.twimg.com/images/themes/theme1/bg.png","http://pbs.twimg.com/profile_images/809321296794415104/jDezppyk_normal.jpg"
"x906269360","x1484072785077014538",2022-01-20 07:58:19,"tripodimaria","#RassegnaStampa ☕️ 🗞 grazie a @LiveCalabria per lo spazio dedicatomi. 
#Collegio 
#Calabria 
#BuonaPolitica @robertoocchiuto @forza_italia https://t.co/AJYTMtgS7w","Twitter for iPhone",138,,,,FALSE,FALSE,3,0,,,"RassegnaStampa Collegio Calabria BuonaPolitica",,,,,"http://pbs.twimg.com/media/FJh8UuCXwAIdkO3.jpg","https://t.co/AJYTMtgS7w","https://twitter.com/tripodimaria/status/1484072785077014538/photo/1","photo","http://pbs.twimg.com/media/FJh8UuCXwAIdkO3.jpg","https://t.co/AJYTMtgS7w","https://twitter.com/tripodimaria/status/1484072785077014538/photo/1",,"x1040238352593813504 x85264321 x147543162","LiveCalabria robertoocchiuto forza_italia","it",,,,,,,,,,,,,,,,,,,,,,,,,,,,,,,,,,,,,"NA NA","NA NA","NA NA NA NA NA NA NA NA","https://twitter.com/tripodimaria/status/1484072785077014538","Maria Tripodi","","Deputato della Repubblica•                Eletta nel Collegio Calabria02•   Capogruppo @forza_Italia in @cd_difesa•  Dott.ssa in Relazioni Internazionali",,FALSE,6587,2352,44,11709,17168,2012-10-26 15:54:35,FALSE,,,,"https://pbs.twimg.com/profile_banners/906269360/1521784227","http://abs.twimg.com/images/themes/theme1/bg.png","http://pbs.twimg.com/profile_images/809321296794415104/jDezppyk_normal.jpg"
"x906269360","x1483859714337296387",2022-01-19 17:51:39,"tripodimaria","Il #CapoSMD Amm. #CavoDragone: l'integrazione interforze deve proseguire e anzi accelerare perché non è un punto di arrivo
Viviamo una stagione transitoria che ci permetterà di arrivare a quello è diventato un mantra: la transizione alle operazioni nel multidominio
#ForzeArmate🇮🇹 https://t.co/4L2CZ3zYrK","Twitter for iPhone",140,,,,FALSE,TRUE,0,18,,,"CapoSMD CavoDragone",,,,,,,,,,,,,"x1919237072","SM_Difesa","it",,,,,,,,,,,,,,,,"x1483846993831251976","Il #CapoSMD Amm. #CavoDragone: l'integrazione interforze deve proseguire e anzi accelerare perché non è un punto di arrivo
Viviamo una stagione transitoria che ci permetterà di arrivare a quello è diventato un mantra: la transizione alle operazioni nel multidominio
#ForzeArmate🇮🇹 https://t.co/4L2CZ3zYrK",2022-01-19 17:01:06,"Twitter Web App",78,18,"x1919237072","SM_Difesa","Forze Armate StatoMaggioreDifesa",76057,121,19864,"Roma","Profilo ufficiale Twitter dello Stato Maggiore della Difesa. #ForzeArmate 🇮🇹 #MissioniMilitari #UnaForzaperilPaese Social netiquette https://t.co/cu3Uw6TUbE",TRUE,,,,,,,"NA NA","NA NA","NA NA NA NA NA NA NA NA","https://twitter.com/tripodimaria/status/1483859714337296387","Maria Tripodi","","Deputato della Repubblica•                Eletta nel Collegio Calabria02•   Capogruppo @forza_Italia in @cd_difesa•  Dott.ssa in Relazioni Internazionali",,FALSE,6587,2352,44,11709,17168,2012-10-26 15:54:35,FALSE,,,,"https://pbs.twimg.com/profile_banners/906269360/1521784227","http://abs.twimg.com/images/themes/theme1/bg.png","http://pbs.twimg.com/profile_images/809321296794415104/jDezppyk_normal.jpg"
"x906269360","x1483824005228466176",2022-01-19 15:29:45,"tripodimaria","All’odg in @CD_difesa importanti #ProgrammiPluriennali e la #Risoluzione su #OtoMelara• #Wass, volta a tutelare gli interessi nazionali in una eventuale cessione. Obbiettivo il rafforzamento delle aziende strategiche del comparto!
#SistemaPaese🇮🇹
#OpenCamera https://t.co/3TFcxXSwJL","Twitter for iPhone",258,,,,FALSE,FALSE,7,2,,,"ProgrammiPluriennali Risoluzione OtoMelara Wass SistemaPaese OpenCamera",,,,,"http://pbs.twimg.com/media/FJeaEA8X0AM2nCN.jpg","https://t.co/3TFcxXSwJL","https://twitter.com/tripodimaria/status/1483824005228466176/photo/1","photo","http://pbs.twimg.com/media/FJeaEA8X0AM2nCN.jpg","https://t.co/3TFcxXSwJL","https://twitter.com/tripodimaria/status/1483824005228466176/photo/1",,"x1218974562","CD_difesa","it",,,,,,,,,,,,,,,,,,,,,,,,,,,,,,,,,,,,,"NA NA","NA NA","NA NA NA NA NA NA NA NA","https://twitter.com/tripodimaria/status/1483824005228466176","Maria Tripodi","","Deputato della Repubblica•                Eletta nel Collegio Calabria02•   Capogruppo @forza_Italia in @cd_difesa•  Dott.ssa in Relazioni Internazionali",,FALSE,6587,2352,44,11709,17168,2012-10-26 15:54:35,FALSE,,,,"https://pbs.twimg.com/profile_banners/906269360/1521784227","http://abs.twimg.com/images/themes/theme1/bg.png","http://pbs.twimg.com/profile_images/809321296794415104/jDezppyk_normal.jpg"
"x906269360","x1483802105618087944",2022-01-19 14:02:44,"tripodimaria","Tantissimi Auguri di Buon lavoro al Generale Figliuolo, da oggi nuovo Comandante del #Covi e un sentito ringraziamento al Gen. Frigerio per l’alto servizio reso. 

#ForzeArmate🇮🇹 https://t.co/duq86jXKFG","Twitter for iPhone",178,,,,FALSE,FALSE,3,1,,,"Covi ForzeArmate",,,,,"http://pbs.twimg.com/media/FJeGJf_XwAE5Bvj.jpg","https://t.co/duq86jXKFG","https://twitter.com/tripodimaria/status/1483802105618087944/photo/1","photo","http://pbs.twimg.com/media/FJeGJf_XwAE5Bvj.jpg","https://t.co/duq86jXKFG","https://twitter.com/tripodimaria/status/1483802105618087944/photo/1",,,,"it",,,,,,,,,,,,,,,,,,,,,,,,,,,,,,,,,,,,,"NA NA","NA NA","NA NA NA NA NA NA NA NA","https://twitter.com/tripodimaria/status/1483802105618087944","Maria Tripodi","","Deputato della Repubblica•                Eletta nel Collegio Calabria02•   Capogruppo @forza_Italia in @cd_difesa•  Dott.ssa in Relazioni Internazionali",,FALSE,6587,2352,44,11709,17168,2012-10-26 15:54:35,FALSE,,,,"https://pbs.twimg.com/profile_banners/906269360/1521784227","http://abs.twimg.com/images/themes/theme1/bg.png","http://pbs.twimg.com/profile_images/809321296794415104/jDezppyk_normal.jpg"
"x906269360","x1483801148217831425",2022-01-19 13:58:56,"tripodimaria","In #Calabria 201 nuove assunzioni a tempo indeterminato nella #Sanita’🏥, grazie al lavoro, la pianificazione e la lungimiranza del suo Commissario ad Acta. Continua la #BuonaPolitica di @robertoocchiuto! #ForzaPresidente, #AvantiCosi! @GruppoFICamera https://t.co/XD0RI03Tf5","Twitter for iPhone",250,,,,FALSE,FALSE,2,1,,,"Calabria Sanita BuonaPolitica ForzaPresidente AvantiCosi",,,,,"http://pbs.twimg.com/media/FJeFRkIXIAQB9U_.jpg","https://t.co/XD0RI03Tf5","https://twitter.com/tripodimaria/status/1483801148217831425/photo/1","photo","http://pbs.twimg.com/media/FJeFRkIXIAQB9U_.jpg","https://t.co/XD0RI03Tf5","https://twitter.com/tripodimaria/status/1483801148217831425/photo/1",,"x85264321 x1344131071","robertoocchiuto GruppoFICamera","it",,,,,,,,,,,,,,,,,,,,,,,,,,,,,,,,,,,,,"NA NA","NA NA","NA NA NA NA NA NA NA NA","https://twitter.com/tripodimaria/status/1483801148217831425","Maria Tripodi","","Deputato della Repubblica•                Eletta nel Collegio Calabria02•   Capogruppo @forza_Italia in @cd_difesa•  Dott.ssa in Relazioni Internazionali",,FALSE,6587,2352,44,11709,17168,2012-10-26 15:54:35,FALSE,,,,"https://pbs.twimg.com/profile_banners/906269360/1521784227","http://abs.twimg.com/images/themes/theme1/bg.png","http://pbs.twimg.com/profile_images/809321296794415104/jDezppyk_normal.jpg"
"x906269360","x1483785156817260549",2022-01-19 12:55:23,"tripodimaria","Novità: 201 assunzioni a tempo indeterminato nella #sanità calabrese ✅ https://t.co/RzqZf160zw","Twitter for iPhone",115,,,,FALSE,TRUE,0,12,,,"sanità",,,,,"http://pbs.twimg.com/ext_tw_video_thumb/1483783992721776645/pu/img/DCES9m6eqyNwTmh7.jpg","https://t.co/RzqZf160zw","https://twitter.com/robertoocchiuto/status/1483784083150983168/video/1","photo","http://pbs.twimg.com/ext_tw_video_thumb/1483783992721776645/pu/img/DCES9m6eqyNwTmh7.jpg","https://t.co/RzqZf160zw","https://twitter.com/robertoocchiuto/status/1483784083150983168/video/1",,"x85264321","robertoocchiuto","it",,,,,,,,,,,,,,,,"x1483784083150983168","Novità: 201 assunzioni a tempo indeterminato nella #sanità calabrese ✅ https://t.co/RzqZf160zw",2022-01-19 12:51:07,"Twitter for iPhone",53,12,"x85264321","robertoocchiuto","Roberto Occhiuto",5082,691,1143,"","Presidente Regione Calabria",FALSE,,,,,,,"NA NA","NA NA","NA NA NA NA NA NA NA NA","https://twitter.com/tripodimaria/status/1483785156817260549","Maria Tripodi","","Deputato della Repubblica•                Eletta nel Collegio Calabria02•   Capogruppo @forza_Italia in @cd_difesa•  Dott.ssa in Relazioni Internazionali",,FALSE,6587,2352,44,11709,17168,2012-10-26 15:54:35,FALSE,,,,"https://pbs.twimg.com/profile_banners/906269360/1521784227","http://abs.twimg.com/images/themes/theme1/bg.png","http://pbs.twimg.com/profile_images/809321296794415104/jDezppyk_normal.jpg"
