"user_id","status_id","created_at","screen_name","text","source","display_text_width","reply_to_status_id","reply_to_user_id","reply_to_screen_name","is_quote","is_retweet","favorite_count","retweet_count","quote_count","reply_count","hashtags","symbols","urls_url","urls_t.co","urls_expanded_url","media_url","media_t.co","media_expanded_url","media_type","ext_media_url","ext_media_t.co","ext_media_expanded_url","ext_media_type","mentions_user_id","mentions_screen_name","lang","quoted_status_id","quoted_text","quoted_created_at","quoted_source","quoted_favorite_count","quoted_retweet_count","quoted_user_id","quoted_screen_name","quoted_name","quoted_followers_count","quoted_friends_count","quoted_statuses_count","quoted_location","quoted_description","quoted_verified","retweet_status_id","retweet_text","retweet_created_at","retweet_source","retweet_favorite_count","retweet_retweet_count","retweet_user_id","retweet_screen_name","retweet_name","retweet_followers_count","retweet_friends_count","retweet_statuses_count","retweet_location","retweet_description","retweet_verified","place_url","place_name","place_full_name","place_type","country","country_code","geo_coords","coords_coords","bbox_coords","status_url","name","location","description","url","protected","followers_count","friends_count","listed_count","statuses_count","favourites_count","account_created_at","verified","profile_url","profile_expanded_url","account_lang","profile_banner_url","profile_background_url","profile_image_url"
"x270839361","x1536383790146265089",2022-06-13 16:23:34,"matteosalvinimi","Accolta la richiesta della Lega, per il bene di studenti e insegnanti.

https://t.co/6x04MyjtwV","Twitter for Android",95,,,,FALSE,FALSE,333,79,,,,,"ilmessaggero.it/scuola/mascher…","https://t.co/6x04MyjtwV","https://www.ilmessaggero.it/scuola/mascherine_esami_maturita_raccomandata_obbligo_cosa_cambia-6750897.html",,,,,,,,,,,"it",,,,,,,,,,,,,,,,,,,,,,,,,,,,,,,,,,,,,"NA NA","NA NA","NA NA NA NA NA NA NA NA","https://twitter.com/matteosalvinimi/status/1536383790146265089","Matteo Salvini","","Leader della Lega #primagliitaliani 🇮🇹","https://t.co/sj3rr6DU3N",FALSE,1476292,2008,3140,53109,3825,2011-03-23 10:32:56,TRUE,"https://t.co/sj3rr6DU3N","https://legaonline.it/",,"https://pbs.twimg.com/profile_banners/270839361/1641590097","http://abs.twimg.com/images/themes/theme1/bg.png","http://pbs.twimg.com/profile_images/966325945060732928/0Ua5xPMX_normal.jpg"
"x48062712","x1536187833618243584",2022-06-13 03:24:55,"luigidimaio","Il Ministro degli Esteri @luigidimaio è in missione in Etiopia 🇪🇹 e Kenya 🇰🇪

***
Mission of Foreign Minister Luigi Di Maio to Ethiopia 🇪🇹 and Kenya 🇰🇪 https://t.co/m6KaEv4xw6","Twitter for iPhone",140,,,,FALSE,TRUE,0,25,,,,,,,,,,,,,,,,"x599114492 x48062712","ItalyMFA luigidimaio","it",,,,,,,,,,,,,,,,"x1535989018831224832","Il Ministro degli Esteri @luigidimaio è in missione in Etiopia 🇪🇹 e Kenya 🇰🇪

***
Mission of Foreign Minister Luigi Di Maio to Ethiopia 🇪🇹 and Kenya 🇰🇪 https://t.co/m6KaEv4xw6",2022-06-12 14:14:54,"Twitter Web App",82,25,"x599114492","ItalyMFA","Farnesina 🇮🇹",274355,955,16346,"Roma, Italia","Profilo ufficiale del Ministero degli Affari Esteri e della Cooperazione Internazionale | Follow us in other languages at @ItalyMFA_int",TRUE,,,,,,,"NA NA","NA NA","NA NA NA NA NA NA NA NA","https://twitter.com/luigidimaio/status/1536187833618243584","Luigi Di Maio","Pomigliano d'Arco, Campania","Ministro degli Affari Esteri e della Cooperazione Internazionale.","https://t.co/D8gkagqksG",FALSE,770226,339,2231,7125,399,2009-06-17 18:34:46,TRUE,"https://t.co/D8gkagqksG","http://www.luigidimaio.it",,"https://pbs.twimg.com/profile_banners/48062712/1645985183","http://abs.twimg.com/images/themes/theme1/bg.png","http://pbs.twimg.com/profile_images/933106806670462976/YyC7LOW8_normal.jpg"
"x2900717633","x1536405342967431168",2022-06-13 17:49:13,"BrunoAstorre","Volevano vincere al primo turno e invece no. Meloni e Salvini litigano e si spaccano. Le partite di Frosinone e Viterbo sono aperte.","Twitter for iPhone",132,"x1536397311990980615","x2900717633","BrunoAstorre",FALSE,FALSE,4,2,,,,,,,,,,,,,,,,,,"it",,,,,,,,,,,,,,,,,,,,,,,,,,,,,,,,,,,,,"NA NA","NA NA","NA NA NA NA NA NA NA NA","https://twitter.com/BrunoAstorre/status/1536405342967431168","Bruno Astorre","","Senatore del PD. Membro Direzione nazionale PD. Provengo da una scuola che interpreta la politica come strumento, non come fine.","https://t.co/r8sKGpcczb",FALSE,1778,197,35,2064,179,2014-12-01 15:48:11,TRUE,"https://t.co/r8sKGpcczb","http://www.brunoastorre.it",,"https://pbs.twimg.com/profile_banners/2900717633/1546257168","http://abs.twimg.com/images/themes/theme1/bg.png","http://pbs.twimg.com/profile_images/1058727872578371589/FY_KiON0_normal.jpg"
"x2900717633","x1536397311990980615",2022-06-13 17:17:18,"BrunoAstorre","Il @pdnetwork è primo in tanti Comuni del Lazio. Andremo al ballottaggio, molto probabilmente, sia a Viterbo che a Frosinone. Queste elezioni confermano un dato: con l’attuale maggioranza regionale, al completo, vinciamo. Dove è stato possibile l’abbiamo portata avanti. Al lavoro","Twitter for iPhone",280,,,,FALSE,FALSE,8,3,,,,,,,,,,,,,,,,"x13294452","pdnetwork","it",,,,,,,,,,,,,,,,,,,,,,,,,,,,,,,,,,,,,"NA NA","NA NA","NA NA NA NA NA NA NA NA","https://twitter.com/BrunoAstorre/status/1536397311990980615","Bruno Astorre","","Senatore del PD. Membro Direzione nazionale PD. Provengo da una scuola che interpreta la politica come strumento, non come fine.","https://t.co/r8sKGpcczb",FALSE,1778,197,35,2064,179,2014-12-01 15:48:11,TRUE,"https://t.co/r8sKGpcczb","http://www.brunoastorre.it",,"https://pbs.twimg.com/profile_banners/2900717633/1546257168","http://abs.twimg.com/images/themes/theme1/bg.png","http://pbs.twimg.com/profile_images/1058727872578371589/FY_KiON0_normal.jpg"
"x876541483","x1536411282794065920",2022-06-13 18:12:49,"AlbertoBagnai","🔝🍾 https://t.co/j7rnUCg7ym","Twitter for iPhone",22,,,,FALSE,TRUE,0,24,,,,,,,,,,,,,,,,"x1858411734","triolo_antonio","art",,,,,,,,,,,,,,,,"x1536386859672162304","🔝🍾 https://t.co/j7rnUCg7ym",2022-06-13 16:35:46,"Twitter for Android",106,24,"x1858411734","triolo_antonio","Antonio Triolo 🇮🇹",4227,537,32949,"","Dipendente Comunale - ex-Promotore Finanziario - Appassionato di politica e di Italia",FALSE,,,,,,,"NA NA","NA NA","NA NA NA NA NA NA NA NA","https://twitter.com/AlbertoBagnai/status/1536411282794065920","Alberto Bagnai","","Professore associato di politica economica all’Università Gabriele d’Annunzio, eletto al Senato per la Lega nel collegio Abruzzo 01.","https://t.co/sC5RvUzmsX",FALSE,134675,666,656,226249,6503,2012-10-12 22:13:36,TRUE,"https://t.co/sC5RvUzmsX","http://www.senato.it/leg/18/BGT/Schede/Attsen/00032582.htm",,"https://pbs.twimg.com/profile_banners/876541483/1535647109","http://abs.twimg.com/images/themes/theme1/bg.png","http://pbs.twimg.com/profile_images/849030859462246401/ATk3_aiW_normal.jpg"
"x876541483","x1536399384249872384",2022-06-13 17:25:32,"AlbertoBagnai","@JustinTrudeau My car was stolen, but in a gentle way: that's because i put three theft protection alarms on it.","Twitter for iPhone",126,,,,FALSE,TRUE,0,38,,,,,,,,,,,,,,,,"x49018471 x14260960","Dayne999 JustinTrudeau","en",,,,,,,,,,,,,,,,"x1536383878012801024","@JustinTrudeau My car was stolen, but in a gentle way: that's because i put three theft protection alarms on it.",2022-06-13 16:23:55,"Twitter for Android",382,38,"x49018471","Dayne999","DaynO🧉🐒🇷🇸♂️",4036,790,20914,"Tabarnia","Negazionista dell'esistenza delle scimmie.",FALSE,,,,,,,"NA NA","NA NA","NA NA NA NA NA NA NA NA","https://twitter.com/AlbertoBagnai/status/1536399384249872384","Alberto Bagnai","","Professore associato di politica economica all’Università Gabriele d’Annunzio, eletto al Senato per la Lega nel collegio Abruzzo 01.","https://t.co/sC5RvUzmsX",FALSE,134675,666,656,226249,6503,2012-10-12 22:13:36,TRUE,"https://t.co/sC5RvUzmsX","http://www.senato.it/leg/18/BGT/Schede/Attsen/00032582.htm",,"https://pbs.twimg.com/profile_banners/876541483/1535647109","http://abs.twimg.com/images/themes/theme1/bg.png","http://pbs.twimg.com/profile_images/849030859462246401/ATk3_aiW_normal.jpg"
"x876541483","x1536388486516953088",2022-06-13 16:42:14,"AlbertoBagnai","@AlbertoBagnai Il debito fa salire lo spread?
Ci vuole più debito per farlo scendere.
Coerenti fino in fondo...
Ma c'è un fondo?","Twitter for iPhone",140,,,,FALSE,TRUE,0,21,,,,,,,,,,,,,,,,"x2333071543 x876541483","sherpa810 AlbertoBagnai","it",,,,,,,,,,,,,,,,"x1536378158026563584","@AlbertoBagnai Il debito fa salire lo spread?
Ci vuole più debito per farlo scendere.
Coerenti fino in fondo...
Ma c'è un fondo?",2022-06-13 16:01:12,"Twitter for Android",80,21,"x2333071543","sherpa810","Sherpa810",2426,225,176953,"","🇮🇹 Amate il vostro paese, è il più bello del mondo, nonostante i traditori.
Sostenete @AsimmetrieOrg.
Se ritwitto non vuol sempre dire che approvo.🇮🇹",FALSE,,,,,,,"NA NA","NA NA","NA NA NA NA NA NA NA NA","https://twitter.com/AlbertoBagnai/status/1536388486516953088","Alberto Bagnai","","Professore associato di politica economica all’Università Gabriele d’Annunzio, eletto al Senato per la Lega nel collegio Abruzzo 01.","https://t.co/sC5RvUzmsX",FALSE,134675,666,656,226249,6503,2012-10-12 22:13:36,TRUE,"https://t.co/sC5RvUzmsX","http://www.senato.it/leg/18/BGT/Schede/Attsen/00032582.htm",,"https://pbs.twimg.com/profile_banners/876541483/1535647109","http://abs.twimg.com/images/themes/theme1/bg.png","http://pbs.twimg.com/profile_images/849030859462246401/ATk3_aiW_normal.jpg"
"x876541483","x1536388471635554304",2022-06-13 16:42:11,"AlbertoBagnai","@AlbertoBagnai Geniale, il debito fa aumentare lo spread, il PNRR è un debito (grosso e rognoso), il PNRR fa abbassare lo spread 😅😅 https://t.co/Jj7syp1tjS","Twitter for iPhone",140,,,,FALSE,TRUE,0,34,,,,,,,,,,,,,,,,"x1111899109613600768 x876541483","NavigatoreIt AlbertoBagnai","it",,,,,,,,,,,,,,,,"x1536381025990893570","@AlbertoBagnai Geniale, il debito fa aumentare lo spread, il PNRR è un debito (grosso e rognoso), il PNRR fa abbassare lo spread 😅😅 https://t.co/Jj7syp1tjS",2022-06-13 16:12:35,"Twitter Web App",81,34,"x1111899109613600768","NavigatoreIt","Il Navigatore italiano",37,169,2286,"Roma, Lazio","Enrico Fermi esempio di grande scienziato, quello del dubbio, quello che non si da pace nel voler conoscere.",FALSE,,,,,,,"NA NA","NA NA","NA NA NA NA NA NA NA NA","https://twitter.com/AlbertoBagnai/status/1536388471635554304","Alberto Bagnai","","Professore associato di politica economica all’Università Gabriele d’Annunzio, eletto al Senato per la Lega nel collegio Abruzzo 01.","https://t.co/sC5RvUzmsX",FALSE,134675,666,656,226249,6503,2012-10-12 22:13:36,TRUE,"https://t.co/sC5RvUzmsX","http://www.senato.it/leg/18/BGT/Schede/Attsen/00032582.htm",,"https://pbs.twimg.com/profile_banners/876541483/1535647109","http://abs.twimg.com/images/themes/theme1/bg.png","http://pbs.twimg.com/profile_images/849030859462246401/ATk3_aiW_normal.jpg"
"x876541483","x1536385373462470660",2022-06-13 16:29:52,"AlbertoBagnai","Accolta la richiesta della Lega, per il bene di studenti e insegnanti.

https://t.co/6x04MyjtwV","Twitter for iPhone",116,,,,FALSE,TRUE,0,79,,,,,"ilmessaggero.it/scuola/mascher…","https://t.co/6x04MyjtwV","https://www.ilmessaggero.it/scuola/mascherine_esami_maturita_raccomandata_obbligo_cosa_cambia-6750897.html",,,,,,,,,"x270839361","matteosalvinimi","it",,,,,,,,,,,,,,,,"x1536383790146265089","Accolta la richiesta della Lega, per il bene di studenti e insegnanti.

https://t.co/6x04MyjtwV",2022-06-13 16:23:34,"Twitter for Android",333,79,"x270839361","matteosalvinimi","Matteo Salvini",1476292,2008,53109,"","Leader della Lega #primagliitaliani 🇮🇹",TRUE,,,,,,,"NA NA","NA NA","NA NA NA NA NA NA NA NA","https://twitter.com/AlbertoBagnai/status/1536385373462470660","Alberto Bagnai","","Professore associato di politica economica all’Università Gabriele d’Annunzio, eletto al Senato per la Lega nel collegio Abruzzo 01.","https://t.co/sC5RvUzmsX",FALSE,134675,666,656,226249,6503,2012-10-12 22:13:36,TRUE,"https://t.co/sC5RvUzmsX","http://www.senato.it/leg/18/BGT/Schede/Attsen/00032582.htm",,"https://pbs.twimg.com/profile_banners/876541483/1535647109","http://abs.twimg.com/images/themes/theme1/bg.png","http://pbs.twimg.com/profile_images/849030859462246401/ATk3_aiW_normal.jpg"
"x876541483","x1536381597955592198",2022-06-13 16:14:52,"AlbertoBagnai","🔴 BREAKING - Comunali 

Roberto Lagalla (CDX) è eletto sindaco di #Palermo al primo turno.

#MaratonaYouTrend https://t.co/iuEjMrqmqE","Twitter for iPhone",140,,,,FALSE,TRUE,0,35,,,"Palermo MaratonaYouTrend",,,,,,,,,,,,,"x404064077","you_trend","it",,,,,,,,,,,,,,,,"x1536381321358061570","🔴 BREAKING - Comunali 

Roberto Lagalla (CDX) è eletto sindaco di #Palermo al primo turno.

#MaratonaYouTrend https://t.co/iuEjMrqmqE",2022-06-13 16:13:46,"Twitter Web App",135,35,"x404064077","you_trend","YouTrend",97201,1444,35342,"Italia","Analisi, dati, politica: YouTrend è il magazine digitale di @AgenziaQuorum. Organizziamo https://t.co/kKyfJi7uVJ.",TRUE,,,,,,,"NA NA","NA NA","NA NA NA NA NA NA NA NA","https://twitter.com/AlbertoBagnai/status/1536381597955592198","Alberto Bagnai","","Professore associato di politica economica all’Università Gabriele d’Annunzio, eletto al Senato per la Lega nel collegio Abruzzo 01.","https://t.co/sC5RvUzmsX",FALSE,134675,666,656,226249,6503,2012-10-12 22:13:36,TRUE,"https://t.co/sC5RvUzmsX","http://www.senato.it/leg/18/BGT/Schede/Attsen/00032582.htm",,"https://pbs.twimg.com/profile_banners/876541483/1535647109","http://abs.twimg.com/images/themes/theme1/bg.png","http://pbs.twimg.com/profile_images/849030859462246401/ATk3_aiW_normal.jpg"
"x876541483","x1536375087963594754",2022-06-13 15:49:00,"AlbertoBagnai","Il debito di Schrödinger, una rapida lezione di economia quantistica su #goofynomics | https://t.co/5aGOGfwi5E 🐈‍⬛","Twitter for iPhone",114,,,,FALSE,FALSE,134,62,,,"goofynomics",,"goofynomics.blogspot.com/2022/06/il-deb…","https://t.co/5aGOGfwi5E","https://goofynomics.blogspot.com/2022/06/il-debito-di-schrodinger.html",,,,,,,,,,,"it",,,,,,,,,,,,,,,,,,,,,,,,,,,,,,,,,,,,,"NA NA","NA NA","NA NA NA NA NA NA NA NA","https://twitter.com/AlbertoBagnai/status/1536375087963594754","Alberto Bagnai","","Professore associato di politica economica all’Università Gabriele d’Annunzio, eletto al Senato per la Lega nel collegio Abruzzo 01.","https://t.co/sC5RvUzmsX",FALSE,134675,666,656,226249,6503,2012-10-12 22:13:36,TRUE,"https://t.co/sC5RvUzmsX","http://www.senato.it/leg/18/BGT/Schede/Attsen/00032582.htm",,"https://pbs.twimg.com/profile_banners/876541483/1535647109","http://abs.twimg.com/images/themes/theme1/bg.png","http://pbs.twimg.com/profile_images/849030859462246401/ATk3_aiW_normal.jpg"
"x876541483","x1536343192856956932",2022-06-13 13:42:15,"AlbertoBagnai","Il 110% spiegato facile: come, perché sì, e perché no: https://t.co/lpOqFrCUb2 #superbonus","Twitter for iPhone",90,,,,FALSE,FALSE,102,43,,,"superbonus",,"fb.watch/dC_1SH5xy6/","https://t.co/lpOqFrCUb2","https://fb.watch/dC_1SH5xy6/",,,,,,,,,,,"it",,,,,,,,,,,,,,,,,,,,,,,,,,,,,,,,,,,,,"NA NA","NA NA","NA NA NA NA NA NA NA NA","https://twitter.com/AlbertoBagnai/status/1536343192856956932","Alberto Bagnai","","Professore associato di politica economica all’Università Gabriele d’Annunzio, eletto al Senato per la Lega nel collegio Abruzzo 01.","https://t.co/sC5RvUzmsX",FALSE,134675,666,656,226249,6503,2012-10-12 22:13:36,TRUE,"https://t.co/sC5RvUzmsX","http://www.senato.it/leg/18/BGT/Schede/Attsen/00032582.htm",,"https://pbs.twimg.com/profile_banners/876541483/1535647109","http://abs.twimg.com/images/themes/theme1/bg.png","http://pbs.twimg.com/profile_images/849030859462246401/ATk3_aiW_normal.jpg"
"x876541483","x1536342705512402944",2022-06-13 13:40:19,"AlbertoBagnai","Per quest'anno, non cambiare, stesso seggio stesso mare 
#referendumsullagiustizia #Referendum2022 #affluenza https://t.co/YAcDT1DuWz","Twitter for iPhone",140,,,,FALSE,TRUE,0,140,,,"referendumsullagiustizia Referendum2022 affluenza",,,,,,,,,,,,,"x3096871079","lefrasidiosho","it",,,,,,,,,,,,,,,,"x1536342478571204608","Per quest'anno, non cambiare, stesso seggio stesso mare 
#referendumsullagiustizia #Referendum2022 #affluenza https://t.co/YAcDT1DuWz",2022-06-13 13:39:25,"Twitter for Android",1066,140,"x3096871079","lefrasidiosho","Le frasi di Osho",541080,597,12040,"Roma, Lazio","Spina nel fianco",FALSE,,,,,,,"NA NA","NA NA","NA NA NA NA NA NA NA NA","https://twitter.com/AlbertoBagnai/status/1536342705512402944","Alberto Bagnai","","Professore associato di politica economica all’Università Gabriele d’Annunzio, eletto al Senato per la Lega nel collegio Abruzzo 01.","https://t.co/sC5RvUzmsX",FALSE,134675,666,656,226249,6503,2012-10-12 22:13:36,TRUE,"https://t.co/sC5RvUzmsX","http://www.senato.it/leg/18/BGT/Schede/Attsen/00032582.htm",,"https://pbs.twimg.com/profile_banners/876541483/1535647109","http://abs.twimg.com/images/themes/theme1/bg.png","http://pbs.twimg.com/profile_images/849030859462246401/ATk3_aiW_normal.jpg"
"x876541483","x1536310868757164032",2022-06-13 11:33:49,"AlbertoBagnai","@affarefatto2 E farla a debito (perché il PNRR è debito)!","Twitter for iPhone",43,"x1536308973820956672","x198981717","affarefatto2",FALSE,FALSE,46,7,,,,,,,,,,,,,,,,"x198981717","affarefatto2","it",,,,,,,,,,,,,,,,,,,,,,,,,,,,,,,,,,,,,"NA NA","NA NA","NA NA NA NA NA NA NA NA","https://twitter.com/AlbertoBagnai/status/1536310868757164032","Alberto Bagnai","","Professore associato di politica economica all’Università Gabriele d’Annunzio, eletto al Senato per la Lega nel collegio Abruzzo 01.","https://t.co/sC5RvUzmsX",FALSE,134675,666,656,226249,6503,2012-10-12 22:13:36,TRUE,"https://t.co/sC5RvUzmsX","http://www.senato.it/leg/18/BGT/Schede/Attsen/00032582.htm",,"https://pbs.twimg.com/profile_banners/876541483/1535647109","http://abs.twimg.com/images/themes/theme1/bg.png","http://pbs.twimg.com/profile_images/849030859462246401/ATk3_aiW_normal.jpg"
"x876541483","x1536310758988038146",2022-06-13 11:33:22,"AlbertoBagnai","@AlbertoBagnai Quindi Giavazzi ci dice che per salvarci dobbiamo fare spesa pubblica. È interessante il cambio rispetto a quando scriveva sul corriere nel 2011. La domanda adesso è “se ci dicono di no”","Twitter for iPhone",140,,,,FALSE,TRUE,0,40,,,,,,,,,,,,,,,,"x198981717 x876541483","affarefatto2 AlbertoBagnai","it",,,,,,,,,,,,,,,,"x1536308973820956672","@AlbertoBagnai Quindi Giavazzi ci dice che per salvarci dobbiamo fare spesa pubblica. È interessante il cambio rispetto a quando scriveva sul corriere nel 2011. La domanda adesso è “se ci dicono di no”",2022-06-13 11:26:17,"Twitter Web App",106,40,"x198981717","affarefatto2","affarefatto-il sorcio",49,153,1523,"","Nei primi 10 anni di maturità ho invocato il liberismo dei giornaloni. Poi ho cominciato a lavorare. E ora non credo più a niente che provenga dai MSM.",FALSE,,,,,,,"NA NA","NA NA","NA NA NA NA NA NA NA NA","https://twitter.com/AlbertoBagnai/status/1536310758988038146","Alberto Bagnai","","Professore associato di politica economica all’Università Gabriele d’Annunzio, eletto al Senato per la Lega nel collegio Abruzzo 01.","https://t.co/sC5RvUzmsX",FALSE,134675,666,656,226249,6503,2012-10-12 22:13:36,TRUE,"https://t.co/sC5RvUzmsX","http://www.senato.it/leg/18/BGT/Schede/Attsen/00032582.htm",,"https://pbs.twimg.com/profile_banners/876541483/1535647109","http://abs.twimg.com/images/themes/theme1/bg.png","http://pbs.twimg.com/profile_images/849030859462246401/ATk3_aiW_normal.jpg"
"x876541483","x1536306685823918081",2022-06-13 11:17:11,"AlbertoBagnai","Cangiare la legge con il voto popolare? ORRORE!

Che torni ad 'ser Imperatore, lo Rex et lo Vescovo a dettar legge sull'Italica peninsula!

#referendum #affluenza #NoQuorum #13giugno #referendumsullagiustizia #Referendum2022 #Referendumabrogativi2022 #referendumgiustizia2022 https://t.co/qpeKHMgDw8","Twitter for iPhone",140,,,,FALSE,TRUE,0,31,,,,,,,,,,,,,,,,"x2276059140","LoImperatore","it",,,,,,,,,,,,,,,,"x1536303971580657665","Cangiare la legge con il voto popolare? ORRORE!

Che torni ad 'ser Imperatore, lo Rex et lo Vescovo a dettar legge sull'Italica peninsula!

#referendum #affluenza #NoQuorum #13giugno #referendumsullagiustizia #Referendum2022 #Referendumabrogativi2022 #referendumgiustizia2022 https://t.co/qpeKHMgDw8",2022-06-13 11:06:24,"Twitter Web App",77,31,"x2276059140","LoImperatore","Feudalesimo&Libertà",12880,50,6086,"Aquisgrana","Per il ripristino dei diritti feudali in Italia e in Europa",FALSE,,,,,,,"NA NA","NA NA","NA NA NA NA NA NA NA NA","https://twitter.com/AlbertoBagnai/status/1536306685823918081","Alberto Bagnai","","Professore associato di politica economica all’Università Gabriele d’Annunzio, eletto al Senato per la Lega nel collegio Abruzzo 01.","https://t.co/sC5RvUzmsX",FALSE,134675,666,656,226249,6503,2012-10-12 22:13:36,TRUE,"https://t.co/sC5RvUzmsX","http://www.senato.it/leg/18/BGT/Schede/Attsen/00032582.htm",,"https://pbs.twimg.com/profile_banners/876541483/1535647109","http://abs.twimg.com/images/themes/theme1/bg.png","http://pbs.twimg.com/profile_images/849030859462246401/ATk3_aiW_normal.jpg"
"x876541483","x1536306218590998530",2022-06-13 11:15:20,"AlbertoBagnai","Leggono #goofynomics. Meglio così! https://t.co/qd7k6OSr7h","Twitter for iPhone",34,,,,FALSE,FALSE,233,65,,,"goofynomics",,,,,"http://pbs.twimg.com/media/FVIOXI8X0AEd7DU.jpg","https://t.co/qd7k6OSr7h","https://twitter.com/AlbertoBagnai/status/1536306218590998530/photo/1","photo","http://pbs.twimg.com/media/FVIOXI8X0AEd7DU.jpg","https://t.co/qd7k6OSr7h","https://twitter.com/AlbertoBagnai/status/1536306218590998530/photo/1",,,,"it",,,,,,,,,,,,,,,,,,,,,,,,,,,,,,,,,,,,,"NA NA","NA NA","NA NA NA NA NA NA NA NA","https://twitter.com/AlbertoBagnai/status/1536306218590998530","Alberto Bagnai","","Professore associato di politica economica all’Università Gabriele d’Annunzio, eletto al Senato per la Lega nel collegio Abruzzo 01.","https://t.co/sC5RvUzmsX",FALSE,134675,666,656,226249,6503,2012-10-12 22:13:36,TRUE,"https://t.co/sC5RvUzmsX","http://www.senato.it/leg/18/BGT/Schede/Attsen/00032582.htm",,"https://pbs.twimg.com/profile_banners/876541483/1535647109","http://abs.twimg.com/images/themes/theme1/bg.png","http://pbs.twimg.com/profile_images/849030859462246401/ATk3_aiW_normal.jpg"
"x876541483","x1536285295355772929",2022-06-13 09:52:11,"AlbertoBagnai","È fuga dalle urne anche per le #amministrative2022. Il dato preoccupante dell'#affluenza #noquorum #referendumgiustizia #13giugno  https://t.co/aiKbGURllC https://t.co/hcUkt2MNKj","Twitter for iPhone",140,,,,FALSE,TRUE,0,11,,,"amministrative2022 affluenza noquorum referendumgiustizia",,,,,,,,,,,,,"x78567974","tempoweb","it",,,,,,,,,,,,,,,,"x1536285120017072129","È fuga dalle urne anche per le #amministrative2022. Il dato preoccupante dell'#affluenza #noquorum #referendumgiustizia #13giugno  https://t.co/aiKbGURllC https://t.co/hcUkt2MNKj",2022-06-13 09:51:30,"Il Tempo",23,11,"x78567974","tempoweb","IL TEMPO",93766,1399,100133,"Rome","Segui Il Tempo Quotidiano Indipendente📰 
Ultim'ora, notizie e video in un tweet",FALSE,,,,,,,"NA NA","NA NA","NA NA NA NA NA NA NA NA","https://twitter.com/AlbertoBagnai/status/1536285295355772929","Alberto Bagnai","","Professore associato di politica economica all’Università Gabriele d’Annunzio, eletto al Senato per la Lega nel collegio Abruzzo 01.","https://t.co/sC5RvUzmsX",FALSE,134675,666,656,226249,6503,2012-10-12 22:13:36,TRUE,"https://t.co/sC5RvUzmsX","http://www.senato.it/leg/18/BGT/Schede/Attsen/00032582.htm",,"https://pbs.twimg.com/profile_banners/876541483/1535647109","http://abs.twimg.com/images/themes/theme1/bg.png","http://pbs.twimg.com/profile_images/849030859462246401/ATk3_aiW_normal.jpg"
"x876541483","x1536243244480315393",2022-06-13 07:05:06,"AlbertoBagnai","Compito a casa per TUTTI quelli della mia community.
ISCRIVETEVI ALLE LISTE DEGLI SCRUTATORI.","Twitter for iPhone",113,,,,FALSE,TRUE,0,84,,,,,,,,,,,,,,,,"x337767301","borghi_claudio","it",,,,,,,,,,,,,,,,"x1536116404818268160","Compito a casa per TUTTI quelli della mia community.
ISCRIVETEVI ALLE LISTE DEGLI SCRUTATORI.",2022-06-12 22:41:05,"Twitter Web App",403,84,"x337767301","borghi_claudio","Claudio Borghi A.",137814,1355,227814,"Italia","Deputato della Repubblica Italiana eletto in Toscana per la Lega. Consigliere Comunale di Como",TRUE,,,,,,,"NA NA","NA NA","NA NA NA NA NA NA NA NA","https://twitter.com/AlbertoBagnai/status/1536243244480315393","Alberto Bagnai","","Professore associato di politica economica all’Università Gabriele d’Annunzio, eletto al Senato per la Lega nel collegio Abruzzo 01.","https://t.co/sC5RvUzmsX",FALSE,134675,666,656,226249,6503,2012-10-12 22:13:36,TRUE,"https://t.co/sC5RvUzmsX","http://www.senato.it/leg/18/BGT/Schede/Attsen/00032582.htm",,"https://pbs.twimg.com/profile_banners/876541483/1535647109","http://abs.twimg.com/images/themes/theme1/bg.png","http://pbs.twimg.com/profile_images/849030859462246401/ATk3_aiW_normal.jpg"
