"user_id","status_id","created_at","screen_name","text","source","display_text_width","reply_to_status_id","reply_to_user_id","reply_to_screen_name","is_quote","is_retweet","favorite_count","retweet_count","quote_count","reply_count","hashtags","symbols","urls_url","urls_t.co","urls_expanded_url","media_url","media_t.co","media_expanded_url","media_type","ext_media_url","ext_media_t.co","ext_media_expanded_url","ext_media_type","mentions_user_id","mentions_screen_name","lang","quoted_status_id","quoted_text","quoted_created_at","quoted_source","quoted_favorite_count","quoted_retweet_count","quoted_user_id","quoted_screen_name","quoted_name","quoted_followers_count","quoted_friends_count","quoted_statuses_count","quoted_location","quoted_description","quoted_verified","retweet_status_id","retweet_text","retweet_created_at","retweet_source","retweet_favorite_count","retweet_retweet_count","retweet_user_id","retweet_screen_name","retweet_name","retweet_followers_count","retweet_friends_count","retweet_statuses_count","retweet_location","retweet_description","retweet_verified","place_url","place_name","place_full_name","place_type","country","country_code","geo_coords","coords_coords","bbox_coords","status_url","name","location","description","url","protected","followers_count","friends_count","listed_count","statuses_count","favourites_count","account_created_at","verified","profile_url","profile_expanded_url","account_lang","profile_banner_url","profile_background_url","profile_image_url"
"x270839361","x1532632830043467777",2022-06-03 07:58:36,"matteosalvinimi","Perché la guerra non duri altri 100 giorni io lavoro per la Pace, il dialogo, il cessate il fuoco e il disarmo. Nonostante critiche, insulti e minacce io non mi fermo: all’Italia serve la Pace, chi vuole che la guerra continui non fa il bene del nostro Paese. https://t.co/OW6ls7m0WE","Twitter for iPhone",259,,,,FALSE,FALSE,139,21,,,,,,,,"http://pbs.twimg.com/media/FUUBbsnXwAASK1W.jpg","https://t.co/OW6ls7m0WE","https://twitter.com/matteosalvinimi/status/1532632830043467777/photo/1","photo","http://pbs.twimg.com/media/FUUBbsnXwAASK1W.jpg","https://t.co/OW6ls7m0WE","https://twitter.com/matteosalvinimi/status/1532632830043467777/photo/1",,,,"it",,,,,,,,,,,,,,,,,,,,,,,,,,,,,,,,,,,,,"NA NA","NA NA","NA NA NA NA NA NA NA NA","https://twitter.com/matteosalvinimi/status/1532632830043467777","Matteo Salvini","","Leader della Lega #primagliitaliani 🇮🇹","https://t.co/sj3rr6DU3N",FALSE,1475464,2008,3140,53042,3826,2011-03-23 10:32:56,TRUE,"https://t.co/sj3rr6DU3N","https://legaonline.it/",,"https://pbs.twimg.com/profile_banners/270839361/1641590097","http://abs.twimg.com/images/themes/theme1/bg.png","http://pbs.twimg.com/profile_images/966325945060732928/0Ua5xPMX_normal.jpg"
"x270839361","x1532446321075961858",2022-06-02 19:37:29,"matteosalvinimi","In diretta da Paolo Del Debbio su Rete 4. #DrittoeRovescio @Drittorovescio_  https://t.co/ogGpDCzMig","Twitter Media Studio",100,,,,FALSE,FALSE,171,33,,,"DrittoeRovescio",,"twitter.com/i/broadcasts/1…","https://t.co/ogGpDCzMig","https://twitter.com/i/broadcasts/1vOxwyamMOrGB",,,,,,,,,"x3044664286","Drittorovescio_","it",,,,,,,,,,,,,,,,,,,,,,,,,,,,,,,,,,,,,"NA NA","NA NA","NA NA NA NA NA NA NA NA","https://twitter.com/matteosalvinimi/status/1532446321075961858","Matteo Salvini","","Leader della Lega #primagliitaliani 🇮🇹","https://t.co/sj3rr6DU3N",FALSE,1475464,2008,3140,53042,3826,2011-03-23 10:32:56,TRUE,"https://t.co/sj3rr6DU3N","https://legaonline.it/",,"https://pbs.twimg.com/profile_banners/270839361/1641590097","http://abs.twimg.com/images/themes/theme1/bg.png","http://pbs.twimg.com/profile_images/966325945060732928/0Ua5xPMX_normal.jpg"
"x270839361","x1532438472350388226",2022-06-02 19:06:17,"matteosalvinimi","Verso le 21:25 sarò ospite di Paolo Del Debbio, su rete 4. Vi aspetto! #DrittoeRovescio @Drittorovescio_ https://t.co/SR8EAoxAmu","Twitter for iPhone",104,,,,FALSE,FALSE,157,14,,,"DrittoeRovescio",,,,,"http://pbs.twimg.com/media/FURQquwWUAQr3xb.jpg","https://t.co/SR8EAoxAmu","https://twitter.com/matteosalvinimi/status/1532438472350388226/photo/1","photo","http://pbs.twimg.com/media/FURQquwWUAQr3xb.jpg","https://t.co/SR8EAoxAmu","https://twitter.com/matteosalvinimi/status/1532438472350388226/photo/1",,"x3044664286","Drittorovescio_","it",,,,,,,,,,,,,,,,,,,,,,,,,,,,,,,,,,,,,"NA NA","NA NA","NA NA NA NA NA NA NA NA","https://twitter.com/matteosalvinimi/status/1532438472350388226","Matteo Salvini","","Leader della Lega #primagliitaliani 🇮🇹","https://t.co/sj3rr6DU3N",FALSE,1475464,2008,3140,53042,3826,2011-03-23 10:32:56,TRUE,"https://t.co/sj3rr6DU3N","https://legaonline.it/",,"https://pbs.twimg.com/profile_banners/270839361/1641590097","http://abs.twimg.com/images/themes/theme1/bg.png","http://pbs.twimg.com/profile_images/966325945060732928/0Ua5xPMX_normal.jpg"
"x270839361","x1532438228044763174",2022-06-02 19:05:19,"matteosalvinimi","Brava Martina #Trevisan, orgoglio italiano! A testa alta 🇮🇹 https://t.co/jCZeXxklH0","Twitter for iPhone",83,,,,FALSE,FALSE,140,10,,,"Trevisan",,"gazzetta.it/Tennis/02-06-2…","https://t.co/jCZeXxklH0","https://www.gazzetta.it/Tennis/02-06-2022/roland-garros-trevisan-sconfitta-2-0-gauff-semifinale-440808056407.shtml",,,,,,,,,,,"it",,,,,,,,,,,,,,,,,,,,,,,,,,,,,,,,,,,,,"NA NA","NA NA","NA NA NA NA NA NA NA NA","https://twitter.com/matteosalvinimi/status/1532438228044763174","Matteo Salvini","","Leader della Lega #primagliitaliani 🇮🇹","https://t.co/sj3rr6DU3N",FALSE,1475464,2008,3140,53042,3826,2011-03-23 10:32:56,TRUE,"https://t.co/sj3rr6DU3N","https://legaonline.it/",,"https://pbs.twimg.com/profile_banners/270839361/1641590097","http://abs.twimg.com/images/themes/theme1/bg.png","http://pbs.twimg.com/profile_images/966325945060732928/0Ua5xPMX_normal.jpg"
"x270839361","x1532434537522810904",2022-06-02 18:50:39,"matteosalvinimi","Conte contro i #ReferendumGiustizia e in difesa della casta dei magistrati politicizzati? Il TUO voto domenica 12 giugno può cambiare la giustizia e la storia. #iodicosì @iodicosi_ https://t.co/S4kHci0DGO","Twitter for iPhone",180,,,,FALSE,FALSE,200,45,,,"ReferendumGiustizia iodicosì",,,,,"http://pbs.twimg.com/media/FURNFp_XsAAhg3C.jpg","https://t.co/S4kHci0DGO","https://twitter.com/matteosalvinimi/status/1532434537522810904/photo/1","photo","http://pbs.twimg.com/media/FURNFp_XsAAhg3C.jpg","https://t.co/S4kHci0DGO","https://twitter.com/matteosalvinimi/status/1532434537522810904/photo/1",,"x1511773607508205570","iodicosi_","it",,,,,,,,,,,,,,,,,,,,,,,,,,,,,,,,,,,,,"NA NA","NA NA","NA NA NA NA NA NA NA NA","https://twitter.com/matteosalvinimi/status/1532434537522810904","Matteo Salvini","","Leader della Lega #primagliitaliani 🇮🇹","https://t.co/sj3rr6DU3N",FALSE,1475464,2008,3140,53042,3826,2011-03-23 10:32:56,TRUE,"https://t.co/sj3rr6DU3N","https://legaonline.it/",,"https://pbs.twimg.com/profile_banners/270839361/1641590097","http://abs.twimg.com/images/themes/theme1/bg.png","http://pbs.twimg.com/profile_images/966325945060732928/0Ua5xPMX_normal.jpg"
"x270839361","x1532431426003554316",2022-06-02 18:38:17,"matteosalvinimi","Domani sarà giornata veneta: primo incontro a Cerea (ore 10), poi vi aspetto a Verona (ore 12) e nel pomeriggio a Belluno (16:30) e Padova (19:15). Con me ci saranno anche donne e uomini della Lega candidati alle elezioni del 12 giugno, venite per conoscerli! #12giugnovotoLega https://t.co/7aWUXEriSK","Twitter for iPhone",277,,,,FALSE,FALSE,120,29,,,"12giugnovotoLega",,,,,"http://pbs.twimg.com/media/FURKQkbWUAASZju.jpg","https://t.co/7aWUXEriSK","https://twitter.com/matteosalvinimi/status/1532431426003554316/photo/1","photo","http://pbs.twimg.com/media/FURKQkbWUAASZju.jpg","https://t.co/7aWUXEriSK","https://twitter.com/matteosalvinimi/status/1532431426003554316/photo/1",,,,"it",,,,,,,,,,,,,,,,,,,,,,,,,,,,,,,,,,,,,"NA NA","NA NA","NA NA NA NA NA NA NA NA","https://twitter.com/matteosalvinimi/status/1532431426003554316","Matteo Salvini","","Leader della Lega #primagliitaliani 🇮🇹","https://t.co/sj3rr6DU3N",FALSE,1475464,2008,3140,53042,3826,2011-03-23 10:32:56,TRUE,"https://t.co/sj3rr6DU3N","https://legaonline.it/",,"https://pbs.twimg.com/profile_banners/270839361/1641590097","http://abs.twimg.com/images/themes/theme1/bg.png","http://pbs.twimg.com/profile_images/966325945060732928/0Ua5xPMX_normal.jpg"
"x270839361","x1532383505564454916",2022-06-02 15:27:52,"matteosalvinimi","Sottoscrivo, e non vedo l’ora di votare 5 SÌ per cambiare la Giustizia italiana domenica 12 giugno.
#johnnydepp @iodicosi_ #referendumgiustizia","Twitter for iPhone",143,"x1532383501374431234","x270839361","matteosalvinimi",FALSE,FALSE,207,30,,,"johnnydepp referendumgiustizia",,,,,,,,,,,,,"x1511773607508205570","iodicosi_","it",,,,,,,,,,,,,,,,,,,,,,,,,,,,,,,,,,,,,"NA NA","NA NA","NA NA NA NA NA NA NA NA","https://twitter.com/matteosalvinimi/status/1532383505564454916","Matteo Salvini","","Leader della Lega #primagliitaliani 🇮🇹","https://t.co/sj3rr6DU3N",FALSE,1475464,2008,3140,53042,3826,2011-03-23 10:32:56,TRUE,"https://t.co/sj3rr6DU3N","https://legaonline.it/",,"https://pbs.twimg.com/profile_banners/270839361/1641590097","http://abs.twimg.com/images/themes/theme1/bg.png","http://pbs.twimg.com/profile_images/966325945060732928/0Ua5xPMX_normal.jpg"
"x270839361","x1532383501374431234",2022-06-02 15:27:51,"matteosalvinimi","Mentre in Italia la “giustizia” mette in galera tre innocenti al giorno, oggi compreso, negli Stati Uniti a Johnny Depp vengono restituite innocenza e onore: “Spero che la posizione generale torni all’innocenza fino a prova contraria, in tribunale e nei media” ha dichiarato. https://t.co/ZUKQG8Kirg","Twitter for iPhone",275,,,,FALSE,FALSE,290,56,,,,,,,,"http://pbs.twimg.com/media/FUQeq2CXoAEKAnS.jpg","https://t.co/ZUKQG8Kirg","https://twitter.com/matteosalvinimi/status/1532383501374431234/photo/1","photo","http://pbs.twimg.com/media/FUQeq2CXoAEKAnS.jpg http://pbs.twimg.com/media/FUQeq17XEAA4UEe.jpg","https://t.co/ZUKQG8Kirg https://t.co/ZUKQG8Kirg","https://twitter.com/matteosalvinimi/status/1532383501374431234/photo/1 https://twitter.com/matteosalvinimi/status/1532383501374431234/photo/1",,,,"it",,,,,,,,,,,,,,,,,,,,,,,,,,,,,,,,,,,,,"NA NA","NA NA","NA NA NA NA NA NA NA NA","https://twitter.com/matteosalvinimi/status/1532383501374431234","Matteo Salvini","","Leader della Lega #primagliitaliani 🇮🇹","https://t.co/sj3rr6DU3N",FALSE,1475464,2008,3140,53042,3826,2011-03-23 10:32:56,TRUE,"https://t.co/sj3rr6DU3N","https://legaonline.it/",,"https://pbs.twimg.com/profile_banners/270839361/1641590097","http://abs.twimg.com/images/themes/theme1/bg.png","http://pbs.twimg.com/profile_images/966325945060732928/0Ua5xPMX_normal.jpg"
"x270839361","x1532305335234576386",2022-06-02 10:17:15,"matteosalvinimi","Buon #2giugno a chi farà qualche giorno di vacanza, io parto da Roma direzione Milano, nei prossimi giorni incontri coi cittadini in Veneto, Friuli Venezia Giulia, Lombardia, Sicilia e Lazio. Chi si ferma è perduto! https://t.co/uIv2s8518h","Twitter for iPhone",215,,,,FALSE,FALSE,333,44,,,"2giugno",,,,,"http://pbs.twimg.com/media/FUPXk3PWUAAUKGm.jpg","https://t.co/uIv2s8518h","https://twitter.com/matteosalvinimi/status/1532305335234576386/photo/1","photo","http://pbs.twimg.com/media/FUPXk3PWUAAUKGm.jpg","https://t.co/uIv2s8518h","https://twitter.com/matteosalvinimi/status/1532305335234576386/photo/1",,,,"it",,,,,,,,,,,,,,,,,,,,,,,,,,,,,,,,,,,,,"NA NA","NA NA","NA NA NA NA NA NA NA NA","https://twitter.com/matteosalvinimi/status/1532305335234576386","Matteo Salvini","","Leader della Lega #primagliitaliani 🇮🇹","https://t.co/sj3rr6DU3N",FALSE,1475464,2008,3140,53042,3826,2011-03-23 10:32:56,TRUE,"https://t.co/sj3rr6DU3N","https://legaonline.it/",,"https://pbs.twimg.com/profile_banners/270839361/1641590097","http://abs.twimg.com/images/themes/theme1/bg.png","http://pbs.twimg.com/profile_images/966325945060732928/0Ua5xPMX_normal.jpg"
"x48062712","x1532332595001929728",2022-06-02 12:05:34,"luigidimaio","La Repubblica è una e indivisibile. E indivisibile è anche il bene superiore della #pace.
Buona #FestadellaRepubblica 🇮🇹
➡️ https://t.co/aTuL3PQEof","Twitter for iPhone",147,,,,FALSE,FALSE,136,36,,,"pace FestadellaRepubblica",,"bit.ly/3aePm6m","https://t.co/aTuL3PQEof","https://bit.ly/3aePm6m",,,,,,,,,,,"it",,,,,,,,,,,,,,,,,,,,,,,,,,,,,,,,,,,,,"NA NA","NA NA","NA NA NA NA NA NA NA NA","https://twitter.com/luigidimaio/status/1532332595001929728","Luigi Di Maio","Pomigliano d'Arco, Campania","Ministro degli Affari Esteri e della Cooperazione Internazionale.","https://t.co/D8gkagqksG",FALSE,769844,339,2229,7111,396,2009-06-17 18:34:46,TRUE,"https://t.co/D8gkagqksG","http://www.luigidimaio.it",,"https://pbs.twimg.com/profile_banners/48062712/1645985183","http://abs.twimg.com/images/themes/theme1/bg.png","http://pbs.twimg.com/profile_images/933106806670462976/YyC7LOW8_normal.jpg"
"x3052547715","x1532311330140610560",2022-06-02 10:41:04,"rossellaaccoto","#Redditodicittadinanza, convegno su formazione e ricerca nei Patti per l'inclusione sociale organizzato da Ministero del Lavoro e @UniPadova: due giornate ricche di interventi e spunti di riflessione, anche grazie a presenza di molti ospiti e operatori.
▶️https://t.co/Bpyqw5hHMC https://t.co/dpn6MRvo0l","Twitter for Android",140,,,,FALSE,TRUE,0,2,,,"Redditodicittadinanza",,,,,,,,,,,,,"x2291193420","MinLavoro","it",,,,,,,,,,,,,,,,"x1531991636963639300","#Redditodicittadinanza, convegno su formazione e ricerca nei Patti per l'inclusione sociale organizzato da Ministero del Lavoro e @UniPadova: due giornate ricche di interventi e spunti di riflessione, anche grazie a presenza di molti ospiti e operatori.
▶️https://t.co/Bpyqw5hHMC https://t.co/dpn6MRvo0l",2022-06-01 13:30:43,"Twitter Web App",9,2,"x2291193420","MinLavoro","Ministero Lavoro",78537,554,4175,"Via Vittorio Veneto, 56 - Roma","Profilo ufficiale del Ministero del Lavoro e delle Politiche Sociali",TRUE,,,,,,,"NA NA","NA NA","NA NA NA NA NA NA NA NA","https://twitter.com/rossellaaccoto/status/1532311330140610560","Rossella Accoto","","Portavoce al Senato della Repubblica per le Marche
Commissione Inchiesta Banche e Commissione Bilancio","https://t.co/jF3OeJTqKU",FALSE,1214,161,30,822,348,2015-02-22 12:25:51,TRUE,"https://t.co/jF3OeJTqKU","https://www.facebook.com/rossella.accoto.m5s/",,"https://pbs.twimg.com/profile_banners/3052547715/1548964810","http://abs.twimg.com/images/themes/theme1/bg.png","http://pbs.twimg.com/profile_images/1192113055645216768/Os-c5C9b_normal.jpg"
"x3052547715","x1532311152520216577",2022-06-02 10:40:22,"rossellaaccoto","Alla parata di Roma insieme al collega Federico Freni e alle colleghe @DeborahBergamin e @rossellaaccoto. La #Repubblica, democratica e antifascista, deve essere celebrata con spirito di unità e orgoglio. Il #2giugno è la festa dell'intero Paese.
Evviva la Repubblica! https://t.co/1tNCmu4CP7","Twitter for Android",140,,,,FALSE,TRUE,0,1,,,"Repubblica",,,,,,,,,,,,,"x1064882252901990401 x92556620 x3052547715","SartoreMef DeborahBergamin rossellaaccoto","it",,,,,,,,,,,,,,,,"x1532287385534349313","Alla parata di Roma insieme al collega Federico Freni e alle colleghe @DeborahBergamin e @rossellaaccoto. La #Repubblica, democratica e antifascista, deve essere celebrata con spirito di unità e orgoglio. Il #2giugno è la festa dell'intero Paese.
Evviva la Repubblica! https://t.co/1tNCmu4CP7",2022-06-02 09:05:55,"Twitter for Android",4,1,"x1064882252901990401","SartoreMef","Alessandra Sartore",917,1104,310,"Roma, Lazio","Sottosegretaria Ministero dell’Economia e delle Finanze.  
Dal 2013 al 2021 Assessore Programmazione economica, Bilancio, Patrimonio e Demanio del Lazio",FALSE,,,,,,,"NA NA","NA NA","NA NA NA NA NA NA NA NA","https://twitter.com/rossellaaccoto/status/1532311152520216577","Rossella Accoto","","Portavoce al Senato della Repubblica per le Marche
Commissione Inchiesta Banche e Commissione Bilancio","https://t.co/jF3OeJTqKU",FALSE,1214,161,30,822,348,2015-02-22 12:25:51,TRUE,"https://t.co/jF3OeJTqKU","https://www.facebook.com/rossella.accoto.m5s/",,"https://pbs.twimg.com/profile_banners/3052547715/1548964810","http://abs.twimg.com/images/themes/theme1/bg.png","http://pbs.twimg.com/profile_images/1192113055645216768/Os-c5C9b_normal.jpg"
"x997531966571466752","x1532392597804695555",2022-06-02 16:04:00,"Pres_Casellati","A @Montecitorio per la premiazione del concorso #LezioniDiCostituzione.
Ascoltare in un'Aula le voci di giovani studenti impegnati in questo percorso di maturazione civica è una grande emozione. Il dialogo tra Istituzioni e cittadini è alla base della democrazia. https://t.co/gC2MifS5Pp","Twitter for iPhone",263,,,,FALSE,FALSE,25,8,,,"LezioniDiCostituzione",,,,,"http://pbs.twimg.com/ext_tw_video_thumb/1532392438836379649/pu/img/Yho0Xq6CZaU_Yec4.jpg","https://t.co/gC2MifS5Pp","https://twitter.com/Pres_Casellati/status/1532392597804695555/video/1","photo","http://pbs.twimg.com/ext_tw_video_thumb/1532392438836379649/pu/img/Yho0Xq6CZaU_Yec4.jpg","https://t.co/gC2MifS5Pp","https://twitter.com/Pres_Casellati/status/1532392597804695555/video/1",,"x2278995820","Montecitorio","it",,,,,,,,,,,,,,,,,,,,,,,,,,,,,,,,,,,,,"NA NA","NA NA","NA NA NA NA NA NA NA NA","https://twitter.com/Pres_Casellati/status/1532392597804695555","Maria Elisabetta Alberti Casellati","Roma, Lazio","Presidente del Senato della Repubblica","https://t.co/4xFh9XyLXO",FALSE,15795,587,113,1271,62,2018-05-18 17:38:48,TRUE,"https://t.co/4xFh9XyLXO","https://www.facebook.com/elisabetta.casellati.7",,"https://pbs.twimg.com/profile_banners/997531966571466752/1526665561","http://abs.twimg.com/images/themes/theme1/bg.png","http://pbs.twimg.com/profile_images/997533290520195072/YmnjBO3X_normal.jpg"
"x997531966571466752","x1532354334515675136",2022-06-02 13:31:57,"Pres_Casellati","All’Altare della Patria e ai Fori Imperiali per il 76° anniversario della Repubblica.Una festa di tutti gli italiani, perché segna l’inizio di quel cammino di democrazia che ha regalato al nostro Paese libertà diritti giustizia 🇮🇹.
#FestadellaRepubblica 
#2giugno https://t.co/HCOFqFYJvv","Twitter for iPhone",263,,,,FALSE,FALSE,36,11,,,"FestadellaRepubblica 2giugno",,,,,"http://pbs.twimg.com/media/FUQEJJzWUAEOzQH.jpg","https://t.co/HCOFqFYJvv","https://twitter.com/Pres_Casellati/status/1532354334515675136/photo/1","photo","http://pbs.twimg.com/media/FUQEJJzWUAEOzQH.jpg http://pbs.twimg.com/media/FUQEJJ1X0AEvDT1.jpg http://pbs.twimg.com/media/FUQEJJ2WIAA8ZIz.jpg http://pbs.twimg.com/media/FUQEJJyX0AI0vEo.jpg","https://t.co/HCOFqFYJvv https://t.co/HCOFqFYJvv https://t.co/HCOFqFYJvv https://t.co/HCOFqFYJvv","https://twitter.com/Pres_Casellati/status/1532354334515675136/photo/1 https://twitter.com/Pres_Casellati/status/1532354334515675136/photo/1 https://twitter.com/Pres_Casellati/status/1532354334515675136/photo/1 https://twitter.com/Pres_Casellati/status/1532354334515675136/photo/1",,,,"it",,,,,,,,,,,,,,,,,,,,,,,,,,,,,,,,,,,,,"NA NA","NA NA","NA NA NA NA NA NA NA NA","https://twitter.com/Pres_Casellati/status/1532354334515675136","Maria Elisabetta Alberti Casellati","Roma, Lazio","Presidente del Senato della Repubblica","https://t.co/4xFh9XyLXO",FALSE,15795,587,113,1271,62,2018-05-18 17:38:48,TRUE,"https://t.co/4xFh9XyLXO","https://www.facebook.com/elisabetta.casellati.7",,"https://pbs.twimg.com/profile_banners/997531966571466752/1526665561","http://abs.twimg.com/images/themes/theme1/bg.png","http://pbs.twimg.com/profile_images/997533290520195072/YmnjBO3X_normal.jpg"
"x101602652","x1532399560206823427",2022-06-02 16:31:40,"augussori","🔵🔵Viabilità migliorata e traffico più scorrevole!

#VotaLEGA #ScriviAUGUSSORI #dalleparoleaifatti #UnGrandeProgettoDiCittá #Lega #Lodi2022 #CasanovaSindaco https://t.co/nw0yR4iJer","Twitter for iPhone",155,,,,FALSE,FALSE,0,0,,,"VotaLEGA ScriviAUGUSSORI dalleparoleaifatti UnGrandeProgettoDiCittá Lega Lodi2022 CasanovaSindaco",,,,,"http://pbs.twimg.com/media/FUQtRtiWAAIA9Ag.jpg","https://t.co/nw0yR4iJer","https://twitter.com/augussori/status/1532399560206823427/photo/1","photo","http://pbs.twimg.com/media/FUQtRtiWAAIA9Ag.jpg","https://t.co/nw0yR4iJer","https://twitter.com/augussori/status/1532399560206823427/photo/1",,,,"it",,,,,,,,,,,,,,,,,,,,,,,,,,,,,,,,,,,,,"NA NA","NA NA","NA NA NA NA NA NA NA NA","https://twitter.com/augussori/status/1532399560206823427","Luigi Augussori","Lodi, Lombardy","Profilo del sen. Luigi Augussori, rappresentante lodigiano nel Senato della Repubblica per il gruppo Lega - Salvini Premier. https://t.co/RVDZN85Ue5","https://t.co/494Lk5LQeR",FALSE,1005,847,18,3560,335,2010-01-03 23:39:00,TRUE,"https://t.co/494Lk5LQeR","http://www.senato.it/leg/18/BGT/Schede/Attsen/00019244.htm",,"https://pbs.twimg.com/profile_banners/101602652/1651901040","http://abs.twimg.com/images/themes/theme1/bg.png","http://pbs.twimg.com/profile_images/1522809403216470016/YjJcca8y_normal.jpg"
"x101602652","x1532362305383673856",2022-06-02 14:03:38,"augussori","🔵🔵REFERENDUM GIUSTIZIA
📌QUESITO 4: equa valutazione dei Magistrati
#ReferendumGiustizia #CambiamoLaGiustizia #12giugno #IoVotoSì https://t.co/97jUkxE7PI","Twitter for iPhone",128,,,,FALSE,FALSE,0,0,,,"ReferendumGiustizia CambiamoLaGiustizia 12giugno IoVotoSì",,,,,"http://pbs.twimg.com/media/FUQLZGgXwAE0iik.jpg","https://t.co/97jUkxE7PI","https://twitter.com/augussori/status/1532362305383673856/photo/1","photo","http://pbs.twimg.com/media/FUQLZGgXwAE0iik.jpg","https://t.co/97jUkxE7PI","https://twitter.com/augussori/status/1532362305383673856/photo/1",,,,"it",,,,,,,,,,,,,,,,,,,,,,,,,,,,,,,,,,,,,"NA NA","NA NA","NA NA NA NA NA NA NA NA","https://twitter.com/augussori/status/1532362305383673856","Luigi Augussori","Lodi, Lombardy","Profilo del sen. Luigi Augussori, rappresentante lodigiano nel Senato della Repubblica per il gruppo Lega - Salvini Premier. https://t.co/RVDZN85Ue5","https://t.co/494Lk5LQeR",FALSE,1005,847,18,3560,335,2010-01-03 23:39:00,TRUE,"https://t.co/494Lk5LQeR","http://www.senato.it/leg/18/BGT/Schede/Attsen/00019244.htm",,"https://pbs.twimg.com/profile_banners/101602652/1651901040","http://abs.twimg.com/images/themes/theme1/bg.png","http://pbs.twimg.com/profile_images/1522809403216470016/YjJcca8y_normal.jpg"
"x101602652","x1532309681812787200",2022-06-02 10:34:31,"augussori","Questa mattina in piazza della Vittoria a Lodi ho presenziato alle tradizionali celebrazioni per il 2 Giugno in cui si commemora la vittoria della Repubblica sulla Monarchia nel Referendum del 1946.

#Lodi #2Giugno #territorio https://t.co/PmVuKs1AUt","Twitter for iPhone",226,,,,FALSE,FALSE,0,0,,,"Lodi 2Giugno territorio",,,,,"http://pbs.twimg.com/media/FUPbhoVWAAAioFl.jpg","https://t.co/PmVuKs1AUt","https://twitter.com/augussori/status/1532309681812787200/photo/1","photo","http://pbs.twimg.com/media/FUPbhoVWAAAioFl.jpg http://pbs.twimg.com/media/FUPbhoVWYA4SHup.jpg http://pbs.twimg.com/media/FUPbhoXXwAAn0nZ.jpg http://pbs.twimg.com/media/FUPbhocXoAEPO0n.jpg","https://t.co/PmVuKs1AUt https://t.co/PmVuKs1AUt https://t.co/PmVuKs1AUt https://t.co/PmVuKs1AUt","https://twitter.com/augussori/status/1532309681812787200/photo/1 https://twitter.com/augussori/status/1532309681812787200/photo/1 https://twitter.com/augussori/status/1532309681812787200/photo/1 https://twitter.com/augussori/status/1532309681812787200/photo/1",,,,"it",,,,,,,,,,,,,,,,,,,,,,,,,,,,,,,,,,,,,"NA NA","NA NA","NA NA NA NA NA NA NA NA","https://twitter.com/augussori/status/1532309681812787200","Luigi Augussori","Lodi, Lombardy","Profilo del sen. Luigi Augussori, rappresentante lodigiano nel Senato della Repubblica per il gruppo Lega - Salvini Premier. https://t.co/RVDZN85Ue5","https://t.co/494Lk5LQeR",FALSE,1005,847,18,3560,335,2010-01-03 23:39:00,TRUE,"https://t.co/494Lk5LQeR","http://www.senato.it/leg/18/BGT/Schede/Attsen/00019244.htm",,"https://pbs.twimg.com/profile_banners/101602652/1651901040","http://abs.twimg.com/images/themes/theme1/bg.png","http://pbs.twimg.com/profile_images/1522809403216470016/YjJcca8y_normal.jpg"
"x876541483","x1532572657971040258",2022-06-03 03:59:30,"AlbertoBagnai","@Nobuo89 @GuidoDeMartini @a_meluzzi Sei un artista dell’eufemismo. Una volta avevi amici più svegli.","Twitter for iPhone",64,"x1532380665089605640","x245484212","Nobuo89",FALSE,FALSE,6,0,,,,,,,,,,,,,,,,"x245484212 x422152255 x1032615842","Nobuo89 GuidoDeMartini a_meluzzi","it",,,,,,,,,,,,,,,,,,,,,,,,,,,,,,,,,,,,,"NA NA","NA NA","NA NA NA NA NA NA NA NA","https://twitter.com/AlbertoBagnai/status/1532572657971040258","Alberto Bagnai","","Professore associato di politica economica all’Università Gabriele d’Annunzio, eletto al Senato per la Lega nel collegio Abruzzo 01.","https://t.co/sC5RvUzmsX",FALSE,134563,666,656,225855,6501,2012-10-12 22:13:36,TRUE,"https://t.co/sC5RvUzmsX","http://www.senato.it/leg/18/BGT/Schede/Attsen/00032582.htm",,"https://pbs.twimg.com/profile_banners/876541483/1535647109","http://abs.twimg.com/images/themes/theme1/bg.png","http://pbs.twimg.com/profile_images/849030859462246401/ATk3_aiW_normal.jpg"
