"x501874833","x1482444562647994384",2022-01-15 20:08:20,"s_margiotta","@ncorrasco Purtroppo non è incredibile….","Twitter for iPad",29,"x1482444147508367360","x1369945826","ncorrasco",FALSE,FALSE,1,0,,,,,,,,,,,,,,,,"x1369945826","ncorrasco","it",,,,,,,,,,,,,,,,,,,,,,,,,,,,,,,,,,,,,"NA NA","NA NA","NA NA NA NA NA NA NA NA","https://twitter.com/s_margiotta/status/1482444562647994384","Salvatore Margiotta","Roma, Potenza","Senatore, ingegnere, professore universitario. Capogruppo Commissione lavori pubblici e trasporti. Segretario Presidenza Senato","https://t.co/aeYZnOeRaN",FALSE,15771,7326,207,80522,61068,2012-02-24 15:30:04,TRUE,"https://t.co/aeYZnOeRaN","http://instangram.com/salvatore__margiotta",,"https://pbs.twimg.com/profile_banners/501874833/1483357085","http://abs.twimg.com/images/themes/theme1/bg.png","http://pbs.twimg.com/profile_images/1344056897155063808/zdD0fQgS_normal.jpg"
"x501874833","x1482444414928752645",2022-01-15 20:07:45,"s_margiotta","La cosa incredibile è che alcuni non si rendono neanche conto della gravità inaudita di ciò che dicono e poi, quando altri glielo fanno notare, ritrattano in modo comico.

#Melandri","Twitter for iPad",140,,,,FALSE,TRUE,0,3,,,,,,,,,,,,,,,,"x1369945826","ncorrasco","it",,,,,,,,,,,,,,,,"x1482444147508367360","La cosa incredibile è che alcuni non si rendono neanche conto della gravità inaudita di ciò che dicono e poi, quando altri glielo fanno notare, ritrattano in modo comico.

#Melandri",2022-01-15 20:06:41,"Twitter Web App",27,3,"x1369945826","ncorrasco","Nunzio Corrasco",8822,2165,57066,"Roma","Giornalista pubblicista 

Scrivo, ascolto, vivo, amo...",FALSE,,,,,,,"NA NA","NA NA","NA NA NA NA NA NA NA NA","https://twitter.com/s_margiotta/status/1482444414928752645","Salvatore Margiotta","Roma, Potenza","Senatore, ingegnere, professore universitario. Capogruppo Commissione lavori pubblici e trasporti. Segretario Presidenza Senato","https://t.co/aeYZnOeRaN",FALSE,15771,7326,207,80522,61068,2012-02-24 15:30:04,TRUE,"https://t.co/aeYZnOeRaN","http://instangram.com/salvatore__margiotta",,"https://pbs.twimg.com/profile_banners/501874833/1483357085","http://abs.twimg.com/images/themes/theme1/bg.png","http://pbs.twimg.com/profile_images/1344056897155063808/zdD0fQgS_normal.jpg"
"x501874833","x1482440271841439750",2022-01-15 19:51:17,"s_margiotta","Sono molto felice che sia finita l’autosospensione dal @pdnetwork di @LottiLuca. Penso ci sia bisogno della sua intelligenza e della sua passione, pure della sua ruvidezza, per affrontare i mesi che abbiamo davanti","Twitter for iPad",139,,,,FALSE,TRUE,0,5,,,,,,,,,,,,,,,,"x104960470 x13294452 x1949844973","nomfup pdnetwork LottiLuca","it",,,,,,,,,,,,,,,,"x1482400670493941761","Sono molto felice che sia finita l’autosospensione dal @pdnetwork di @LottiLuca. Penso ci sia bisogno della sua intelligenza e della sua passione, pure della sua ruvidezza, per affrontare i mesi che abbiamo davanti",2022-01-15 17:13:56,"Twitter for iPhone",61,5,"x104960470","nomfup","nomfup",124774,7327,144751,"Italy","Un blog collettivo su comunicazione e politica. Ha un fratello: @andreariscassi. Spin-off dei pupazzetti su FB: https://t.co/3OWnDLQTE2",FALSE,,,,,,,"NA NA","NA NA","NA NA NA NA NA NA NA NA","https://twitter.com/s_margiotta/status/1482440271841439750","Salvatore Margiotta","Roma, Potenza","Senatore, ingegnere, professore universitario. Capogruppo Commissione lavori pubblici e trasporti. Segretario Presidenza Senato","https://t.co/aeYZnOeRaN",FALSE,15771,7326,207,80522,61068,2012-02-24 15:30:04,TRUE,"https://t.co/aeYZnOeRaN","http://instangram.com/salvatore__margiotta",,"https://pbs.twimg.com/profile_banners/501874833/1483357085","http://abs.twimg.com/images/themes/theme1/bg.png","http://pbs.twimg.com/profile_images/1344056897155063808/zdD0fQgS_normal.jpg"
"x501874833","x1482434765492035587",2022-01-15 19:29:25,"s_margiotta","Il secondogenito, 11 anni appena compiuti, ci ha appena spiegato perché non ci chiede di avere un telefonino: ""Significherebbe diventare più grande, mentre io ancora voglio essere un bambino, voglio il tempo dei bambini"". Chissà quale tempo, il suo o il nostro, è più infantile.","Twitter for iPad",140,,,,FALSE,TRUE,0,16,,,,,,,,,,,,,,,,"x978611755","ManuelaPerrone","it",,,,,,,,,,,,,,,,"x1482352327625519108","Il secondogenito, 11 anni appena compiuti, ci ha appena spiegato perché non ci chiede di avere un telefonino: ""Significherebbe diventare più grande, mentre io ancora voglio essere un bambino, voglio il tempo dei bambini"". Chissà quale tempo, il suo o il nostro, è più infantile.",2022-01-15 14:01:50,"Twitter for Android",175,16,"x978611755","ManuelaPerrone","Manuela Perrone",8697,3309,9415,"Roma","giornalista, capo ufficio stampa del ministro per la Pa, già cronista parlamentare Sole 24 Ore, Alley Oop, due volte mamma. Opinions my own. Rt not endorsement",FALSE,,,,,,,"NA NA","NA NA","NA NA NA NA NA NA NA NA","https://twitter.com/s_margiotta/status/1482434765492035587","Salvatore Margiotta","Roma, Potenza","Senatore, ingegnere, professore universitario. Capogruppo Commissione lavori pubblici e trasporti. Segretario Presidenza Senato","https://t.co/aeYZnOeRaN",FALSE,15771,7326,207,80522,61068,2012-02-24 15:30:04,TRUE,"https://t.co/aeYZnOeRaN","http://instangram.com/salvatore__margiotta",,"https://pbs.twimg.com/profile_banners/501874833/1483357085","http://abs.twimg.com/images/themes/theme1/bg.png","http://pbs.twimg.com/profile_images/1344056897155063808/zdD0fQgS_normal.jpg"
"x501874833","x1482432276164235266",2022-01-15 19:19:31,"s_margiotta","@OFerrari1991 @PAnnicchino 😂","Twitter for iPad",1,"x1482395713673826308","x1312496696870436864","OFerrari1991",FALSE,FALSE,1,0,,,,,,,,,,,,,,,,"x1312496696870436864 x427789815","OFerrari1991 PAnnicchino","und",,,,,,,,,,,,,,,,,,,,,,,,,,,,,,,,,,,,,"NA NA","NA NA","NA NA NA NA NA NA NA NA","https://twitter.com/s_margiotta/status/1482432276164235266","Salvatore Margiotta","Roma, Potenza","Senatore, ingegnere, professore universitario. Capogruppo Commissione lavori pubblici e trasporti. Segretario Presidenza Senato","https://t.co/aeYZnOeRaN",FALSE,15771,7326,207,80522,61068,2012-02-24 15:30:04,TRUE,"https://t.co/aeYZnOeRaN","http://instangram.com/salvatore__margiotta",,"https://pbs.twimg.com/profile_banners/501874833/1483357085","http://abs.twimg.com/images/themes/theme1/bg.png","http://pbs.twimg.com/profile_images/1344056897155063808/zdD0fQgS_normal.jpg"
"x501874833","x1482393797103337474",2022-01-15 16:46:37,"s_margiotta","Dubito che farebbe sistemare la sua moto da me. Non mi riterrebbe capace. Ma si sente in dovere di parlare di una cosa che non conosce. 
Hai avuto culo, se vuoi ti racconto di chi non l’ha avuto, il tuo culo. https://t.co/L1M4xXXmcv","Twitter for iPad",140,,,,FALSE,TRUE,0,14,,,,,,,,,,,,,,,,"x259449213","FulvioPaglia","it",,,,,,,,,,,,,,,,"x1482345065762758659","Dubito che farebbe sistemare la sua moto da me. Non mi riterrebbe capace. Ma si sente in dovere di parlare di una cosa che non conosce. 
Hai avuto culo, se vuoi ti racconto di chi non l’ha avuto, il tuo culo. https://t.co/L1M4xXXmcv",2022-01-15 13:32:58,"Twitter for iPhone",143,14,"x259449213","FulvioPaglia","Fulvio Paglialunga",7260,939,34934,"Tra Taranto e Roma","Giornalista. Autore @agorarai. Scrivo di calcio su @ilvenerdi, @IlFoglio_it. Ultimo libro ""Un giorno questo calcio sarà tuo"" @BaldiniCastoldi. Tifo Taranto.",TRUE,,,,,,,"NA NA","NA NA","NA NA NA NA NA NA NA NA","https://twitter.com/s_margiotta/status/1482393797103337474","Salvatore Margiotta","Roma, Potenza","Senatore, ingegnere, professore universitario. Capogruppo Commissione lavori pubblici e trasporti. Segretario Presidenza Senato","https://t.co/aeYZnOeRaN",FALSE,15771,7326,207,80522,61068,2012-02-24 15:30:04,TRUE,"https://t.co/aeYZnOeRaN","http://instangram.com/salvatore__margiotta",,"https://pbs.twimg.com/profile_banners/501874833/1483357085","http://abs.twimg.com/images/themes/theme1/bg.png","http://pbs.twimg.com/profile_images/1344056897155063808/zdD0fQgS_normal.jpg"
"x501874833","x1482389773968883713",2022-01-15 16:30:38,"s_margiotta","@PAnnicchino …e siamo solo agli inizi…..😉","Twitter for iPad",28,"x1482388887175671810","x427789815","PAnnicchino",FALSE,FALSE,2,0,,,,,,,,,,,,,,,,"x427789815","PAnnicchino","it",,,,,,,,,,,,,,,,,,,,,,,,,,,,,,,,,,,,,"NA NA","NA NA","NA NA NA NA NA NA NA NA","https://twitter.com/s_margiotta/status/1482389773968883713","Salvatore Margiotta","Roma, Potenza","Senatore, ingegnere, professore universitario. Capogruppo Commissione lavori pubblici e trasporti. Segretario Presidenza Senato","https://t.co/aeYZnOeRaN",FALSE,15771,7326,207,80522,61068,2012-02-24 15:30:04,TRUE,"https://t.co/aeYZnOeRaN","http://instangram.com/salvatore__margiotta",,"https://pbs.twimg.com/profile_banners/501874833/1483357085","http://abs.twimg.com/images/themes/theme1/bg.png","http://pbs.twimg.com/profile_images/1344056897155063808/zdD0fQgS_normal.jpg"
"x501874833","x1482387770475696135",2022-01-15 16:22:40,"s_margiotta","Nel 1948 i grandi elettori di di quel tempo scelsero come capo dello Stato Luigi Einaudi che pure aveva votato per la monarchia. Allora come oggi, c’è da tenere unita l’Italia. Dobbiamo tenere il filo del dialogo con tutta la maggioranza, per evitare rotture #DirezionePd","Twitter for iPad",140,,,,FALSE,TRUE,0,6,,,,,,,,,,,,,,,,"x57282569","AndreaMarcucci","it",,,,,,,,,,,,,,,,"x1482311158111653891","Nel 1948 i grandi elettori di di quel tempo scelsero come capo dello Stato Luigi Einaudi che pure aveva votato per la monarchia. Allora come oggi, c’è da tenere unita l’Italia. Dobbiamo tenere il filo del dialogo con tutta la maggioranza, per evitare rotture #DirezionePd",2022-01-15 11:18:14,"Twitter for iPhone",45,6,"x57282569","AndreaMarcucci","Andrea Marcucci",23519,1319,10207,"Lucca, Italia","Senatore del Pd, appassionato di moto e di storia risorgimentale",TRUE,,,,,,,"NA NA","NA NA","NA NA NA NA NA NA NA NA","https://twitter.com/s_margiotta/status/1482387770475696135","Salvatore Margiotta","Roma, Potenza","Senatore, ingegnere, professore universitario. Capogruppo Commissione lavori pubblici e trasporti. Segretario Presidenza Senato","https://t.co/aeYZnOeRaN",FALSE,15771,7326,207,80522,61068,2012-02-24 15:30:04,TRUE,"https://t.co/aeYZnOeRaN","http://instangram.com/salvatore__margiotta",,"https://pbs.twimg.com/profile_banners/501874833/1483357085","http://abs.twimg.com/images/themes/theme1/bg.png","http://pbs.twimg.com/profile_images/1344056897155063808/zdD0fQgS_normal.jpg"
"x501874833","x1482387526526672899",2022-01-15 16:21:42,"s_margiotta","@Ruffino_Lorenzo Tra la scorsa e questa, piccolo aumento. Forse siamo davvero al plateau. Tra quattro e tre, quasi raddoppiata; tra tre e due, quasi triplicata…poi, aumenti più deboli….","Twitter for iPad",168,"x1482383575588691977","x2451869940","Ruffino_Lorenzo",FALSE,FALSE,2,0,,,,,,,,,,,,,,,,"x2451869940","Ruffino_Lorenzo","it",,,,,,,,,,,,,,,,,,,,,,,,,,,,,,,,,,,,,"NA NA","NA NA","NA NA NA NA NA NA NA NA","https://twitter.com/s_margiotta/status/1482387526526672899","Salvatore Margiotta","Roma, Potenza","Senatore, ingegnere, professore universitario. Capogruppo Commissione lavori pubblici e trasporti. Segretario Presidenza Senato","https://t.co/aeYZnOeRaN",FALSE,15771,7326,207,80522,61068,2012-02-24 15:30:04,TRUE,"https://t.co/aeYZnOeRaN","http://instangram.com/salvatore__margiotta",,"https://pbs.twimg.com/profile_banners/501874833/1483357085","http://abs.twimg.com/images/themes/theme1/bg.png","http://pbs.twimg.com/profile_images/1344056897155063808/zdD0fQgS_normal.jpg"
"x501874833","x1482386593721761803",2022-01-15 16:18:00,"s_margiotta","https://t.co/Xa3e3iOAAl","Twitter for iPad",23,,,,FALSE,FALSE,13,4,,,,,"lecronachelucane.it/2022/01/15/mar…","https://t.co/Xa3e3iOAAl","https://www.lecronachelucane.it/2022/01/15/margiotta-mette-le-ali-alla-basilicata/",,,,,,,,,,,"und",,,,,,,,,,,,,,,,,,,,,,,,,,,,,,,,,,,,,"NA NA","NA NA","NA NA NA NA NA NA NA NA","https://twitter.com/s_margiotta/status/1482386593721761803","Salvatore Margiotta","Roma, Potenza","Senatore, ingegnere, professore universitario. Capogruppo Commissione lavori pubblici e trasporti. Segretario Presidenza Senato","https://t.co/aeYZnOeRaN",FALSE,15771,7326,207,80522,61068,2012-02-24 15:30:04,TRUE,"https://t.co/aeYZnOeRaN","http://instangram.com/salvatore__margiotta",,"https://pbs.twimg.com/profile_banners/501874833/1483357085","http://abs.twimg.com/images/themes/theme1/bg.png","http://pbs.twimg.com/profile_images/1344056897155063808/zdD0fQgS_normal.jpg"
"x501874833","x1482385890844491778",2022-01-15 16:15:12,"s_margiotta","Mattarella nomina Renzo Arbore cavaliere di Gran Croce. Bravi entrambi. https://t.co/6CHNfc7cx1","Twitter for iPad",116,,,,FALSE,TRUE,0,1,,,,,"quotidiano.net/cronaca/renzo-…","https://t.co/6CHNfc7cx1","https://www.quotidiano.net/cronaca/renzo-arbore-cavaliere-mattarella-1.7251913",,,,,,,,,"x1181563222853337088","GustavoMichele6","it",,,,,,,,,,,,,,,,"x1482344566225264650","Mattarella nomina Renzo Arbore cavaliere di Gran Croce. Bravi entrambi. https://t.co/6CHNfc7cx1",2022-01-15 13:30:59,"Twitter Web App",8,1,"x1181563222853337088","GustavoMichele6","Gustavo Micheletti",2831,2692,32794,"Lucca","Assueto mori, ab interitu vita.",FALSE,,,,,,,"NA NA","NA NA","NA NA NA NA NA NA NA NA","https://twitter.com/s_margiotta/status/1482385890844491778","Salvatore Margiotta","Roma, Potenza","Senatore, ingegnere, professore universitario. Capogruppo Commissione lavori pubblici e trasporti. Segretario Presidenza Senato","https://t.co/aeYZnOeRaN",FALSE,15771,7326,207,80522,61068,2012-02-24 15:30:04,TRUE,"https://t.co/aeYZnOeRaN","http://instangram.com/salvatore__margiotta",,"https://pbs.twimg.com/profile_banners/501874833/1483357085","http://abs.twimg.com/images/themes/theme1/bg.png","http://pbs.twimg.com/profile_images/1344056897155063808/zdD0fQgS_normal.jpg"
"x501874833","x1482385770145107972",2022-01-15 16:14:43,"s_margiotta","@PioBelmonte @leonardopisani1 @vitocarlucci78 @fedefresa @CinziaGrenci @LaRobiErre @ElenarussoTW @RoRoi92375042 @TestaAgnese @AnnalisaPercoco @paoloigna1 @gaetanocappelli @rocifa1163 @RaffaeleLaRegin @GiuseppeLupo8 @sergioragone My God!","Twitter for iPad",7,"x1482359769730060289","x1335550642362912768","PioBelmonte",FALSE,FALSE,1,0,,,,,,,,,,,,,,,,"x1335550642362912768 x500804936 x1103569482 x412587936 x2365001385 x70420459 x1325398530 x1379821523490463745 x2749172153 x1453744382 x1341462944 x418575807 x1594074427 x1429014151 x803153028 x7950242","PioBelmonte leonardopisani1 vitocarlucci78 fedefresa CinziaGrenci LaRobiErre ElenarussoTW RoRoi92375042 TestaAgnese AnnalisaPercoco paoloigna1 gaetanocappelli rocifa1163 RaffaeleLaRegin GiuseppeLupo8 sergioragone","en",,,,,,,,,,,,,,,,,,,,,,,,,,,,,,,,,,,,,"NA NA","NA NA","NA NA NA NA NA NA NA NA","https://twitter.com/s_margiotta/status/1482385770145107972","Salvatore Margiotta","Roma, Potenza","Senatore, ingegnere, professore universitario. Capogruppo Commissione lavori pubblici e trasporti. Segretario Presidenza Senato","https://t.co/aeYZnOeRaN",FALSE,15771,7326,207,80522,61068,2012-02-24 15:30:04,TRUE,"https://t.co/aeYZnOeRaN","http://instangram.com/salvatore__margiotta",,"https://pbs.twimg.com/profile_banners/501874833/1483357085","http://abs.twimg.com/images/themes/theme1/bg.png","http://pbs.twimg.com/profile_images/1344056897155063808/zdD0fQgS_normal.jpg"
"x501874833","x1482385621905817602",2022-01-15 16:14:08,"s_margiotta","@s_margiotta @SenatoriPD @pdnetwork @PdBasilicata @pdprovmt @marcepittella @rocifa1163 Bravo","Twitter for iPad",110,,,,FALSE,TRUE,0,1,,,,,,,,,,,,,,,,"x632742781 x501874833 x404048864 x13294452 x147496924 x1375555109120262145 x95891990 x1594074427","paolo_r_2012 s_margiotta SenatoriPD pdnetwork PdBasilicata pdprovmt marcepittella rocifa1163","pt",,,,,,,,,,,,,,,,"x1482376881609531394","@s_margiotta @SenatoriPD @pdnetwork @PdBasilicata @pdprovmt @marcepittella @rocifa1163 Bravo",2022-01-15 15:39:24,"Twitter for iPhone",1,1,"x632742781","paolo_r_2012","Paolo Roma",34152,25897,561549,"Lazio, Italia, UE","REM TENE VERBA SEQUENTUR",FALSE,,,,,,,"NA NA","NA NA","NA NA NA NA NA NA NA NA","https://twitter.com/s_margiotta/status/1482385621905817602","Salvatore Margiotta","Roma, Potenza","Senatore, ingegnere, professore universitario. Capogruppo Commissione lavori pubblici e trasporti. Segretario Presidenza Senato","https://t.co/aeYZnOeRaN",FALSE,15771,7326,207,80522,61068,2012-02-24 15:30:04,TRUE,"https://t.co/aeYZnOeRaN","http://instangram.com/salvatore__margiotta",,"https://pbs.twimg.com/profile_banners/501874833/1483357085","http://abs.twimg.com/images/themes/theme1/bg.png","http://pbs.twimg.com/profile_images/1344056897155063808/zdD0fQgS_normal.jpg"
"x501874833","x1482339275421200388",2022-01-15 13:09:58,"s_margiotta","I primi risultati di un ottimo lavoro svolto al MIT da Sottosegretario del Senatore ⁦@s_margiotta⁩  https://t.co/VvIiCjHc3G","Twitter for iPad",140,,,,FALSE,TRUE,0,2,,,,,,,,,,,,,,,,"x1103569482 x501874833","vitocarlucci78 s_margiotta","it",,,,,,,,,,,,,,,,"x1482338010079322114","I primi risultati di un ottimo lavoro svolto al MIT da Sottosegretario del Senatore ⁦@s_margiotta⁩  https://t.co/VvIiCjHc3G",2022-01-15 13:04:56,"Twitter for iPhone",11,2,"x1103569482","vitocarlucci78","Vito Carlucci",263,599,644,"","",FALSE,,,,,,,"NA NA","NA NA","NA NA NA NA NA NA NA NA","https://twitter.com/s_margiotta/status/1482339275421200388","Salvatore Margiotta","Roma, Potenza","Senatore, ingegnere, professore universitario. Capogruppo Commissione lavori pubblici e trasporti. Segretario Presidenza Senato","https://t.co/aeYZnOeRaN",FALSE,15771,7326,207,80522,61068,2012-02-24 15:30:04,TRUE,"https://t.co/aeYZnOeRaN","http://instangram.com/salvatore__margiotta",,"https://pbs.twimg.com/profile_banners/501874833/1483357085","http://abs.twimg.com/images/themes/theme1/bg.png","http://pbs.twimg.com/profile_images/1344056897155063808/zdD0fQgS_normal.jpg"
"x501874833","x1482336570137001990",2022-01-15 12:59:13,"s_margiotta","⁦@SenatoriPD⁩ ⁦@pdnetwork⁩ ⁦@PdBasilicata⁩ ⁦@pdprovmt⁩ ⁦@marcepittella⁩ ⁦@rocifa1163⁩  https://t.co/9yIqy7vvMD","Twitter for iPad",110,,,,FALSE,FALSE,33,12,,,,,"sassilive.it/cronaca/politi…","https://t.co/9yIqy7vvMD","https://www.sassilive.it/cronaca/politica/rfi-senatore-margiotta-pd-con-avvio-dibattito-pubblico-per-linea-alta-velocita-potenza-battipaglia-e-salerno-reggio-calabria-prende-corpo-progetto-ambizioso-scettici-si-ravvedano/",,,,,,,,,"x404048864 x13294452 x147496924 x1375555109120262145 x95891990 x1594074427","SenatoriPD pdnetwork PdBasilicata pdprovmt marcepittella rocifa1163","und",,,,,,,,,,,,,,,,,,,,,,,,,,,,,,,,,,,,,"NA NA","NA NA","NA NA NA NA NA NA NA NA","https://twitter.com/s_margiotta/status/1482336570137001990","Salvatore Margiotta","Roma, Potenza","Senatore, ingegnere, professore universitario. Capogruppo Commissione lavori pubblici e trasporti. Segretario Presidenza Senato","https://t.co/aeYZnOeRaN",FALSE,15771,7326,207,80522,61068,2012-02-24 15:30:04,TRUE,"https://t.co/aeYZnOeRaN","http://instangram.com/salvatore__margiotta",,"https://pbs.twimg.com/profile_banners/501874833/1483357085","http://abs.twimg.com/images/themes/theme1/bg.png","http://pbs.twimg.com/profile_images/1344056897155063808/zdD0fQgS_normal.jpg"
"x501874833","x1482314932423114758",2022-01-15 11:33:14,"s_margiotta","Egregio @vitocarlucci78 ho affrontato neve e lupi per fotografare il tuo San Cataldo alle Caldane ove tu beatamente facevi abbondante colazione al caldo. Per queste foto devi un'altra cena a me è ai taggati.. @fedefresa @CinziaGrenci @LaRobiErre @s_margiotta @ElenarussoTW https://t.co/7OBRBfAfbx","Twitter for iPad",140,,,,FALSE,TRUE,0,4,,,,,,,,,,,,,,,,"x500804936 x1103569482","leonardopisani1 vitocarlucci78","it",,,,,,,,,,,,,,,,"x1482311619107508227","Egregio @vitocarlucci78 ho affrontato neve e lupi per fotografare il tuo San Cataldo alle Caldane ove tu beatamente facevi abbondante colazione al caldo. Per queste foto devi un'altra cena a me è ai taggati.. @fedefresa @CinziaGrenci @LaRobiErre @s_margiotta @ElenarussoTW https://t.co/7OBRBfAfbx",2022-01-15 11:20:04,"Twitter for Android",10,4,"x500804936","leonardopisani1","leonardo pisani",13301,14416,26511,"Avigliano","Non ho soldi, non ho risorse, non ho speranze. Sono l'uomo più felice del mondo. ( Henry Miller)  giornalista",FALSE,,,,,,,"NA NA","NA NA","NA NA NA NA NA NA NA NA","https://twitter.com/s_margiotta/status/1482314932423114758","Salvatore Margiotta","Roma, Potenza","Senatore, ingegnere, professore universitario. Capogruppo Commissione lavori pubblici e trasporti. Segretario Presidenza Senato","https://t.co/aeYZnOeRaN",FALSE,15771,7326,207,80522,61068,2012-02-24 15:30:04,TRUE,"https://t.co/aeYZnOeRaN","http://instangram.com/salvatore__margiotta",,"https://pbs.twimg.com/profile_banners/501874833/1483357085","http://abs.twimg.com/images/themes/theme1/bg.png","http://pbs.twimg.com/profile_images/1344056897155063808/zdD0fQgS_normal.jpg"
"x501874833","x1482263699603795968",2022-01-15 08:09:39,"s_margiotta","che inferno l’inverno algherese https://t.co/AKZVn0UBru","Twitter for iPad",75,,,,FALSE,TRUE,0,147,,,,,,,,"http://pbs.twimg.com/media/FJIOjfMXIAINKRf.jpg","https://t.co/AKZVn0UBru","https://twitter.com/la_peau_douce_/status/1482263235210457088/photo/1","photo","http://pbs.twimg.com/media/FJIOjfMXIAINKRf.jpg","https://t.co/AKZVn0UBru","https://twitter.com/la_peau_douce_/status/1482263235210457088/photo/1",,"x1338418309079961601","la_peau_douce_","it",,,,,,,,,,,,,,,,"x1482263235210457088","che inferno l’inverno algherese https://t.co/AKZVn0UBru",2022-01-15 08:07:49,"Twitter for iPhone",3365,147,"x1338418309079961601","la_peau_douce_","la peau douce",8733,821,2839,"","La gente mi vuol bene perché mi vede poco. Paolo Poli | al lunedì, sempre che non mi caccino alla domenica, faccio la posta al cuore su https://t.co/5QxEvXWYpn",FALSE,,,,,,,"NA NA","NA NA","NA NA NA NA NA NA NA NA","https://twitter.com/s_margiotta/status/1482263699603795968","Salvatore Margiotta","Roma, Potenza","Senatore, ingegnere, professore universitario. Capogruppo Commissione lavori pubblici e trasporti. Segretario Presidenza Senato","https://t.co/aeYZnOeRaN",FALSE,15771,7326,207,80522,61068,2012-02-24 15:30:04,TRUE,"https://t.co/aeYZnOeRaN","http://instangram.com/salvatore__margiotta",,"https://pbs.twimg.com/profile_banners/501874833/1483357085","http://abs.twimg.com/images/themes/theme1/bg.png","http://pbs.twimg.com/profile_images/1344056897155063808/zdD0fQgS_normal.jpg"
"x501874833","x1482218824019718145",2022-01-15 05:11:20,"s_margiotta","La natura non è altro che una poesia enigmatica 
(Michel de Montaigne) #VentagliDiParole #BuonaNotte tutti con il lago Laudemio monte Sirino #Basilicata @fedefresa @CinziaGrenci @ElenarussoTW @AnnalisaPercoco @Malika63483161 @s_margiotta @RPlacido @MeaGraal @KompagnaTeresa https://t.co/TdzLxLWKap","Twitter for iPad",140,,,,FALSE,TRUE,0,6,,,"VentagliDiParole BuonaNotte",,,,,,,,,,,,,"x500804936","leonardopisani1","it",,,,,,,,,,,,,,,,"x1482109082769281027","La natura non è altro che una poesia enigmatica 
(Michel de Montaigne) #VentagliDiParole #BuonaNotte tutti con il lago Laudemio monte Sirino #Basilicata @fedefresa @CinziaGrenci @ElenarussoTW @AnnalisaPercoco @Malika63483161 @s_margiotta @RPlacido @MeaGraal @KompagnaTeresa https://t.co/TdzLxLWKap",2022-01-14 21:55:16,"Twitter for Android",12,6,"x500804936","leonardopisani1","leonardo pisani",13301,14416,26511,"Avigliano","Non ho soldi, non ho risorse, non ho speranze. Sono l'uomo più felice del mondo. ( Henry Miller)  giornalista",FALSE,,,,,,,"NA NA","NA NA","NA NA NA NA NA NA NA NA","https://twitter.com/s_margiotta/status/1482218824019718145","Salvatore Margiotta","Roma, Potenza","Senatore, ingegnere, professore universitario. Capogruppo Commissione lavori pubblici e trasporti. Segretario Presidenza Senato","https://t.co/aeYZnOeRaN",FALSE,15771,7326,207,80522,61068,2012-02-24 15:30:04,TRUE,"https://t.co/aeYZnOeRaN","http://instangram.com/salvatore__margiotta",,"https://pbs.twimg.com/profile_banners/501874833/1483357085","http://abs.twimg.com/images/themes/theme1/bg.png","http://pbs.twimg.com/profile_images/1344056897155063808/zdD0fQgS_normal.jpg"
"x501874833","x1482216821617205250",2022-01-15 05:03:23,"s_margiotta","😍 | BUONGIORNO

Oh Ciao! 👋🏆⚫️🔵

#Inter #ForzaInter #SupercoppaFrecciarossa #IMWinner https://t.co/A4j5O1AoUg","Twitter for iPad",119,,,,FALSE,TRUE,0,481,,,"Inter ForzaInter SupercoppaFrecciarossa IMWinner",,,,,"http://pbs.twimg.com/media/FJDLmE8XwAYQVv0.jpg","https://t.co/A4j5O1AoUg","https://twitter.com/Inter/status/1481908136873238529/photo/1","photo","http://pbs.twimg.com/media/FJDLmE8XwAYQVv0.jpg","https://t.co/A4j5O1AoUg","https://twitter.com/Inter/status/1481908136873238529/photo/1",,"x124450567","Inter","it",,,,,,,,,,,,,,,,"x1481908136873238529","😍 | BUONGIORNO

Oh Ciao! 👋🏆⚫️🔵

#Inter #ForzaInter #SupercoppaFrecciarossa #IMWinner https://t.co/A4j5O1AoUg",2022-01-14 08:36:47,"Twitter for iPhone",5012,481,"x124450567","Inter","Inter 🏆🇮🇹",2498588,93,85751,"Milano, Italia","CAMPIONI D’ITALIA 20/21 🏆🇮🇹 #IMScudetto #IMInter
@Inter_en; @Inter_id; @Inter_jp; @Inter_ar; @Inter_br; @Inter_es; @Inter_Women",TRUE,,,,,,,"NA NA","NA NA","NA NA NA NA NA NA NA NA","https://twitter.com/s_margiotta/status/1482216821617205250","Salvatore Margiotta","Roma, Potenza","Senatore, ingegnere, professore universitario. Capogruppo Commissione lavori pubblici e trasporti. Segretario Presidenza Senato","https://t.co/aeYZnOeRaN",FALSE,15771,7326,207,80522,61068,2012-02-24 15:30:04,TRUE,"https://t.co/aeYZnOeRaN","http://instangram.com/salvatore__margiotta",,"https://pbs.twimg.com/profile_banners/501874833/1483357085","http://abs.twimg.com/images/themes/theme1/bg.png","http://pbs.twimg.com/profile_images/1344056897155063808/zdD0fQgS_normal.jpg"
