"x587805027","x1532293733668081666",2022-06-02 09:31:09,"lauraravetto","@ninnyaiuto Non sono vanitosa non ne tengo😜","Twitter for iPhone",31,"x1532285621825204224","x17711306","ninnyaiuto",FALSE,FALSE,0,0,,,,,,,,,,,,,,,,"x17711306","ninnyaiuto","it",,,,,,,,,,,,,,,,,,,,,,,,,,,,,,,,,,,,,"NA NA","NA NA","NA NA NA NA NA NA NA NA","https://twitter.com/lauraravetto/status/1532293733668081666","Laura Ravetto","","Liberale vera, Mamma di Clarissa Delfina, Parlamentare della Lega - Salvini Premier. Avvocato. Fiera demolitrice di soffitti di cristallo.","https://t.co/dM2z2oPmjj",FALSE,42432,2077,293,11069,128,2012-05-22 20:25:06,FALSE,"https://t.co/dM2z2oPmjj","https://urly.it/35p4_",,"https://pbs.twimg.com/profile_banners/587805027/1496397252","http://abs.twimg.com/images/themes/theme1/bg.png","http://pbs.twimg.com/profile_images/1057683147377307649/_SnZxSEe_normal.jpg"
"x87467449","x1532426507699769353",2022-06-02 18:18:45,"grotondi","Non ho mai avuto un atteggiamento tenero e accondiscendente verso @matteosalvinimi soprattutto quando era potente e di moda.Mi sembra però che su questo social vi sia un pregiudizio negativo verso di lui anche quando prova a fare qualcosa di serio,con tutte le difficoltà dell’ora","Twitter for iPhone",280,,,,FALSE,FALSE,82,10,,,,,,,,,,,,,,,,"x270839361","matteosalvinimi","it",,,,,,,,,,,,,,,,,,,,,,,,,,,,,,,,,,,,,"NA NA","NA NA","NA NA NA NA NA NA NA NA","https://twitter.com/grotondi/status/1532426507699769353","Gianfranco Rotondi","Pescara, Abruzzo","sono poco su Twitter ma senza staff","https://t.co/NA4kmpLj89",FALSE,33397,6098,283,52823,8939,2009-11-04 15:52:34,FALSE,"https://t.co/NA4kmpLj89","https://girotondi.net/",,"https://pbs.twimg.com/profile_banners/87467449/1522754488","http://abs.twimg.com/images/themes/theme1/bg.png","http://pbs.twimg.com/profile_images/1420443859952283656/Np6eQk74_normal.jpg"
"x87467449","x1532330168299266048",2022-06-02 11:55:56,"grotondi","Due anni che non ci sei più, ma il tuo ricordo mi accompagna ogni giorno. Voglio immaginarti sorridente e con il tuo colto humor, ovunque tu sia. #Robertogervaso #miopadre #2giugno2020 #anniversario https://t.co/TT5xFNx63m","Twitter for iPhone",140,,,,FALSE,TRUE,0,83,,,,,,,,,,,,,,,,"x2860686345","veroverogervaso","it",,,,,,,,,,,,,,,,"x1532289225403650048","Due anni che non ci sei più, ma il tuo ricordo mi accompagna ogni giorno. Voglio immaginarti sorridente e con il tuo colto humor, ovunque tu sia. #Robertogervaso #miopadre #2giugno2020 #anniversario https://t.co/TT5xFNx63m",2022-06-02 09:13:14,"Twitter for Android",2170,83,"x2860686345","veroverogervaso","Veronica Gervaso",2235,637,993,"Milano, Lombardia","Giornalista, Vice-Caporedattore Economia e conduttrice del Tg5. Milano. Mamma di tre figli.",FALSE,,,,,,,"NA NA","NA NA","NA NA NA NA NA NA NA NA","https://twitter.com/grotondi/status/1532330168299266048","Gianfranco Rotondi","Pescara, Abruzzo","sono poco su Twitter ma senza staff","https://t.co/NA4kmpLj89",FALSE,33397,6098,283,52823,8939,2009-11-04 15:52:34,FALSE,"https://t.co/NA4kmpLj89","https://girotondi.net/",,"https://pbs.twimg.com/profile_banners/87467449/1522754488","http://abs.twimg.com/images/themes/theme1/bg.png","http://pbs.twimg.com/profile_images/1420443859952283656/Np6eQk74_normal.jpg"
"x87467449","x1532330098724044800",2022-06-02 11:55:39,"grotondi","In questa campagna elettorale ho capito di avere un vero elettorato DC. Ho persone di 18 anni che mi votano ma anche di 100. Qui con la signora Amelia ultracentenaria @grotondi https://t.co/W8etuTFfYd","Twitter for iPhone",139,,,,FALSE,TRUE,0,2,,,,,,,,,,,,,,,,"x708028408949768195","luigi_forte00","it",,,,,,,,,,,,,,,,"x1532326345258278914","In questa campagna elettorale ho capito di avere un vero elettorato DC. Ho persone di 18 anni che mi votano ma anche di 100. Qui con la signora Amelia ultracentenaria @grotondi https://t.co/W8etuTFfYd",2022-06-02 11:40:44,"Twitter for iPhone",13,2,"x708028408949768195","luigi_forte00","Luigi Forte",74,31,296,"Napoli, Campania","Sono troppo democristiano e troppo berlusconiano. Commento e discuto sempre nei limiti del rispetto reciproco",FALSE,,,,,,,"NA NA","NA NA","NA NA NA NA NA NA NA NA","https://twitter.com/grotondi/status/1532330098724044800","Gianfranco Rotondi","Pescara, Abruzzo","sono poco su Twitter ma senza staff","https://t.co/NA4kmpLj89",FALSE,33397,6098,283,52823,8939,2009-11-04 15:52:34,FALSE,"https://t.co/NA4kmpLj89","https://girotondi.net/",,"https://pbs.twimg.com/profile_banners/87467449/1522754488","http://abs.twimg.com/images/themes/theme1/bg.png","http://pbs.twimg.com/profile_images/1420443859952283656/Np6eQk74_normal.jpg"
"x1905601525","x1532639532255956992",2022-06-03 08:25:14,"Sandra_Savino","Il 12 giugno fai una cosa per te, anzi, per tutti: vai a votare e vota si ai quesiti referendari. https://t.co/J2uKkPyXvA","Twitter for Android",97,,,,FALSE,FALSE,5,2,,,,,,,,"http://pbs.twimg.com/media/FUUHhtMXoAAHCG2.jpg","https://t.co/J2uKkPyXvA","https://twitter.com/Sandra_Savino/status/1532639532255956992/photo/1","photo","http://pbs.twimg.com/media/FUUHhtMXoAAHCG2.jpg","https://t.co/J2uKkPyXvA","https://twitter.com/Sandra_Savino/status/1532639532255956992/photo/1",,,,"it",,,,,,,,,,,,,,,,,,,,,,,,,,,,,,,,,,,,,"NA NA","NA NA","NA NA NA NA NA NA NA NA","https://twitter.com/Sandra_Savino/status/1532639532255956992","SandraSAVINO","FriuliVeneziaGiulia","Coordinatrice regionale di ForzaItalia FVG, Deputato di Forza Italia alla Camera","https://t.co/Pjhmn9VHdW",FALSE,2349,571,32,3423,4851,2013-09-25 22:22:16,FALSE,"https://t.co/Pjhmn9VHdW","http://facebook.com/SandraSavinoTrieste",,"https://pbs.twimg.com/profile_banners/1905601525/1556988283","http://abs.twimg.com/images/themes/theme1/bg.png","http://pbs.twimg.com/profile_images/481018914562789376/jbymyEld_normal.png"
"x201658727","x1532640147308789760",2022-06-03 08:27:40,"VittorioSgarbi","Il programma di oggi a Messina. @stampasgarbi https://t.co/9DTCg7dVj6","Twitter for iPhone",45,,,,FALSE,FALSE,12,1,,,,,,,,"http://pbs.twimg.com/media/FUUIFLPXwAEU4Bw.jpg","https://t.co/9DTCg7dVj6","https://twitter.com/VittorioSgarbi/status/1532640147308789760/photo/1","photo","http://pbs.twimg.com/media/FUUIFLPXwAEU4Bw.jpg","https://t.co/9DTCg7dVj6","https://twitter.com/VittorioSgarbi/status/1532640147308789760/photo/1",,"x2164988132","stampasgarbi","it",,,,,,,,,,,,,,,,,,,,,,,,,,,,,,,,,,,,,"NA NA","NA NA","NA NA NA NA NA NA NA NA","https://twitter.com/VittorioSgarbi/status/1532640147308789760","Vittorio Sgarbi","mai nello stesso luogo","Twitter ufficiale di Vittorio Sgarbi - Storico dell'Arte e Opinionista | Contatti: press@vittoriosgarbi.it
Capra Store: https://t.co/XvD8pqlFul","https://t.co/v3GBQb33Lz",FALSE,850178,381,1329,12581,4340,2010-10-12 10:20:00,TRUE,"https://t.co/v3GBQb33Lz","http://www.vittoriosgarbi.it",,"https://pbs.twimg.com/profile_banners/201658727/1640596883","http://abs.twimg.com/images/themes/theme1/bg.png","http://pbs.twimg.com/profile_images/378800000563952334/834a3c187534931f8af26f78b6c274a8_normal.jpeg"
"x201658727","x1532422252725166080",2022-06-02 18:01:50,"VittorioSgarbi","La bellissima “Pietà” di Antonello Gagini a Soverato. https://t.co/0XcQU5y4wG @stampasgarbi","Twitter for iPhone",91,,,,FALSE,FALSE,53,5,,,,,"youtu.be/JliWzzPZzIA","https://t.co/0XcQU5y4wG","https://youtu.be/JliWzzPZzIA",,,,,,,,,"x2164988132","stampasgarbi","it",,,,,,,,,,,,,,,,,,,,,,,,,,,,,,,,,,,,,"NA NA","NA NA","NA NA NA NA NA NA NA NA","https://twitter.com/VittorioSgarbi/status/1532422252725166080","Vittorio Sgarbi","mai nello stesso luogo","Twitter ufficiale di Vittorio Sgarbi - Storico dell'Arte e Opinionista | Contatti: press@vittoriosgarbi.it
Capra Store: https://t.co/XvD8pqlFul","https://t.co/v3GBQb33Lz",FALSE,850178,381,1329,12581,4340,2010-10-12 10:20:00,TRUE,"https://t.co/v3GBQb33Lz","http://www.vittoriosgarbi.it",,"https://pbs.twimg.com/profile_banners/201658727/1640596883","http://abs.twimg.com/images/themes/theme1/bg.png","http://pbs.twimg.com/profile_images/378800000563952334/834a3c187534931f8af26f78b6c274a8_normal.jpeg"
"x201658727","x1532337288889389058",2022-06-02 12:24:13,"VittorioSgarbi","Ci vediamo domani venerdì 3 giugno a Messina e sabato 4 giugno a Scicli (Ragusa). https://t.co/5qFgR9JLAX @stampasgarbi https://t.co/qMcqFz8nAD","Twitter for iPhone",119,,,,FALSE,FALSE,49,2,,,,,"facebook.com/10004443744939…","https://t.co/5qFgR9JLAX","https://www.facebook.com/100044437449392/posts/pfbid02BqgGCi6mqu8htWJSEXDpxuCDWsuWKBDvaPpKgwQoUsQNCfKH3pZ1x3FNx4CXqeAJl/?d=n","http://pbs.twimg.com/media/FUP0pFXX0AIRZox.jpg","https://t.co/qMcqFz8nAD","https://twitter.com/VittorioSgarbi/status/1532337288889389058/photo/1","photo","http://pbs.twimg.com/media/FUP0pFXX0AIRZox.jpg","https://t.co/qMcqFz8nAD","https://twitter.com/VittorioSgarbi/status/1532337288889389058/photo/1",,"x2164988132","stampasgarbi","it",,,,,,,,,,,,,,,,,,,,,,,,,,,,,,,,,,,,,"NA NA","NA NA","NA NA NA NA NA NA NA NA","https://twitter.com/VittorioSgarbi/status/1532337288889389058","Vittorio Sgarbi","mai nello stesso luogo","Twitter ufficiale di Vittorio Sgarbi - Storico dell'Arte e Opinionista | Contatti: press@vittoriosgarbi.it
Capra Store: https://t.co/XvD8pqlFul","https://t.co/v3GBQb33Lz",FALSE,850178,381,1329,12581,4340,2010-10-12 10:20:00,TRUE,"https://t.co/v3GBQb33Lz","http://www.vittoriosgarbi.it",,"https://pbs.twimg.com/profile_banners/201658727/1640596883","http://abs.twimg.com/images/themes/theme1/bg.png","http://pbs.twimg.com/profile_images/378800000563952334/834a3c187534931f8af26f78b6c274a8_normal.jpeg"
"x201658727","x1532330904282185728",2022-06-02 11:58:51,"VittorioSgarbi","In diretta.
https://t.co/PVRtjFG9ub @stampasgarbi","Twitter for iPhone",49,,,,FALSE,FALSE,7,2,,,,,"fb.watch/dolZYTBUfJ/","https://t.co/PVRtjFG9ub","https://fb.watch/dolZYTBUfJ/",,,,,,,,,"x2164988132","stampasgarbi","it",,,,,,,,,,,,,,,,,,,,,,,,,,,,,,,,,,,,,"NA NA","NA NA","NA NA NA NA NA NA NA NA","https://twitter.com/VittorioSgarbi/status/1532330904282185728","Vittorio Sgarbi","mai nello stesso luogo","Twitter ufficiale di Vittorio Sgarbi - Storico dell'Arte e Opinionista | Contatti: press@vittoriosgarbi.it
Capra Store: https://t.co/XvD8pqlFul","https://t.co/v3GBQb33Lz",FALSE,850178,381,1329,12581,4340,2010-10-12 10:20:00,TRUE,"https://t.co/v3GBQb33Lz","http://www.vittoriosgarbi.it",,"https://pbs.twimg.com/profile_banners/201658727/1640596883","http://abs.twimg.com/images/themes/theme1/bg.png","http://pbs.twimg.com/profile_images/378800000563952334/834a3c187534931f8af26f78b6c274a8_normal.jpeg"
"x906269360","x1532439229795553298",2022-06-02 19:09:18,"tripodimaria","Today, we celebrate the Republic Day of Italy! Buona Festa della Repubblica! #WeAreNATO https://t.co/Gofz1xy1VM","Twitter for iPhone",125,,,,FALSE,TRUE,0,42,,,"WeAreNATO",,,,,"http://pbs.twimg.com/media/FUOlJJlWUAAXJ9V.jpg","https://t.co/Gofz1xy1VM","https://twitter.com/NATO_JWC/status/1532249881154396160/photo/1","photo","http://pbs.twimg.com/media/FUOlJJlWUAAXJ9V.jpg","https://t.co/Gofz1xy1VM","https://twitter.com/NATO_JWC/status/1532249881154396160/photo/1",,"x1131213093231562752","NATO_JWC","en",,,,,,,,,,,,,,,,"x1532249881154396160","Today, we celebrate the Republic Day of Italy! Buona Festa della Repubblica! #WeAreNATO https://t.co/Gofz1xy1VM",2022-06-02 06:36:54,"Twitter Web App",222,42,"x1131213093231562752","NATO_JWC","NATO Joint Warfare Centre",7814,145,493,"Stavanger, Norway","This is the official Twitter account of NATO Joint Warfare Centre. The Centre was established in Stavanger, Norway, on 23 October 2003. #WeAreNATO",TRUE,,,,,,,"NA NA","NA NA","NA NA NA NA NA NA NA NA","https://twitter.com/tripodimaria/status/1532439229795553298","Maria Tripodi","","Deputato della Repubblica•                Eletta nel Collegio Calabria02•   Capogruppo @forza_Italia in @cd_difesa•  Dott.ssa in Relazioni Internazionali",,FALSE,6684,2412,43,12184,18788,2012-10-26 15:54:35,FALSE,,,,"https://pbs.twimg.com/profile_banners/906269360/1521784227","http://abs.twimg.com/images/themes/theme1/bg.png","http://pbs.twimg.com/profile_images/809321296794415104/jDezppyk_normal.jpg"
"x906269360","x1532396623921303552",2022-06-02 16:20:00,"tripodimaria","Sulle note dell'Inno nazionale, riviviamo alcuni suggestivi momenti della #FestadellaRepubblica
#2Giugno
#MinisteroDifesa

@guerini_lorenzo @SM_Difesa @Esercito @ItalianNavy @ItalianAirForce @_Carabinieri_ https://t.co/qdFSjGPBpW","Twitter for iPhone",140,,,,FALSE,TRUE,0,67,,,"FestadellaRepubblica 2Giugno",,,,,,,,,,,,,"x384192964","MinisteroDifesa","it",,,,,,,,,,,,,,,,"x1532376121097994242","Sulle note dell'Inno nazionale, riviviamo alcuni suggestivi momenti della #FestadellaRepubblica
#2Giugno
#MinisteroDifesa

@guerini_lorenzo @SM_Difesa @Esercito @ItalianNavy @ItalianAirForce @_Carabinieri_ https://t.co/qdFSjGPBpW",2022-06-02 14:58:32,"Twitter Web App",214,67,"x384192964","MinisteroDifesa","Ministero Difesa",367385,113,15930,"","Benvenuti sul profilo Twitter del Ministero della Difesa|Welcome to the Ministry of Defence Twitter profile #MinisteroDifesa https://t.co/6wL5UwRx3s",TRUE,,,,,,,"NA NA","NA NA","NA NA NA NA NA NA NA NA","https://twitter.com/tripodimaria/status/1532396623921303552","Maria Tripodi","","Deputato della Repubblica•                Eletta nel Collegio Calabria02•   Capogruppo @forza_Italia in @cd_difesa•  Dott.ssa in Relazioni Internazionali",,FALSE,6684,2412,43,12184,18788,2012-10-26 15:54:35,FALSE,,,,"https://pbs.twimg.com/profile_banners/906269360/1521784227","http://abs.twimg.com/images/themes/theme1/bg.png","http://pbs.twimg.com/profile_images/809321296794415104/jDezppyk_normal.jpg"
"x906269360","x1532335066055155713",2022-06-02 12:15:23,"tripodimaria","#2Giugno 
Come da tradizione, a suggellare le celebrazioni odierne, il sorvolo delle @FrecceTricolori. La bandiera italiana nei cieli di Roma per la #FestadellaRepubblica 
#AeronauticaMilitare https://t.co/KZIW9kQpkC","Twitter for iPhone",140,,,,FALSE,TRUE,0,97,,,"2Giugno",,,,,,,,,,,,,"x1280597143 x12353582","ItalianAirForce FrecceTricolori","it",,,,,,,,,,,,,,,,"x1532312717746372609","#2Giugno 
Come da tradizione, a suggellare le celebrazioni odierne, il sorvolo delle @FrecceTricolori. La bandiera italiana nei cieli di Roma per la #FestadellaRepubblica 
#AeronauticaMilitare https://t.co/KZIW9kQpkC",2022-06-02 10:46:35,"Twitter Web App",433,97,"x1280597143","ItalianAirForce","Aeronautica Militare",118427,434,28855,"","La Difesa Aerea è la missione principale dell'Aeronautica Militare.365 giorni l'anno,24 ore su 24, i velivoli caccia sono pronti al decollo #latuasquadrachevola",TRUE,,,,,,,"NA NA","NA NA","NA NA NA NA NA NA NA NA","https://twitter.com/tripodimaria/status/1532335066055155713","Maria Tripodi","","Deputato della Repubblica•                Eletta nel Collegio Calabria02•   Capogruppo @forza_Italia in @cd_difesa•  Dott.ssa in Relazioni Internazionali",,FALSE,6684,2412,43,12184,18788,2012-10-26 15:54:35,FALSE,,,,"https://pbs.twimg.com/profile_banners/906269360/1521784227","http://abs.twimg.com/images/themes/theme1/bg.png","http://pbs.twimg.com/profile_images/809321296794415104/jDezppyk_normal.jpg"
"x906269360","x1532329092812505089",2022-06-02 11:51:39,"tripodimaria","Viva i nostri Valori fondanti, Viva la #Repubblica 🇮🇹, Unica e indivisibile! https://t.co/RP0Tkl4MLl","Twitter for iPhone",76,,,,FALSE,FALSE,8,1,,,"Repubblica",,,,,"http://pbs.twimg.com/media/FUPtLT_XEAEEgye.jpg","https://t.co/RP0Tkl4MLl","https://twitter.com/tripodimaria/status/1532329092812505089/photo/1","photo","http://pbs.twimg.com/media/FUPtLT_XEAEEgye.jpg http://pbs.twimg.com/media/FUPtLUBWAAI73i9.jpg http://pbs.twimg.com/media/FUPtLUCWQAAOntI.jpg","https://t.co/RP0Tkl4MLl https://t.co/RP0Tkl4MLl https://t.co/RP0Tkl4MLl","https://twitter.com/tripodimaria/status/1532329092812505089/photo/1 https://twitter.com/tripodimaria/status/1532329092812505089/photo/1 https://twitter.com/tripodimaria/status/1532329092812505089/photo/1",,,,"it",,,,,,,,,,,,,,,,,,,,,,,,,,,,,,,,,,,,,"NA NA","NA NA","NA NA NA NA NA NA NA NA","https://twitter.com/tripodimaria/status/1532329092812505089","Maria Tripodi","","Deputato della Repubblica•                Eletta nel Collegio Calabria02•   Capogruppo @forza_Italia in @cd_difesa•  Dott.ssa in Relazioni Internazionali",,FALSE,6684,2412,43,12184,18788,2012-10-26 15:54:35,FALSE,,,,"https://pbs.twimg.com/profile_banners/906269360/1521784227","http://abs.twimg.com/images/themes/theme1/bg.png","http://pbs.twimg.com/profile_images/809321296794415104/jDezppyk_normal.jpg"
"x447056150","x1532427687205212160",2022-06-02 18:23:26,"GiusyVersace","oggi a #Milano con @LucaSqueri ospiti del prefetto Renato Saccone che ha ricordato importanza di offrire più lavoro e istruzione a tutti i giovani per una società più colta e pronta a garantire un futuro libero e democratico! #verità #2giugno2022 🇮🇹 #wlarepubblica https://t.co/L28nauY5hL","Twitter for iPhone",264,,,,FALSE,FALSE,5,0,,,"Milano verità 2giugno2022 wlarepubblica",,,,,"http://pbs.twimg.com/media/FURG2dVX0AAjB_C.jpg","https://t.co/L28nauY5hL","https://twitter.com/GiusyVersace/status/1532427687205212160/photo/1","photo","http://pbs.twimg.com/media/FURG2dVX0AAjB_C.jpg http://pbs.twimg.com/media/FURG2dgWAAAw0rA.jpg http://pbs.twimg.com/media/FURG2d-XEAEEQKF.jpg","https://t.co/L28nauY5hL https://t.co/L28nauY5hL https://t.co/L28nauY5hL","https://twitter.com/GiusyVersace/status/1532427687205212160/photo/1 https://twitter.com/GiusyVersace/status/1532427687205212160/photo/1 https://twitter.com/GiusyVersace/status/1532427687205212160/photo/1",,"x615326948","LucaSqueri","it",,,,,,,,,,,,,,,,,,,,,,,,,,,,,,,,,,,,,"NA NA","NA NA","NA NA NA NA NA NA NA NA","https://twitter.com/GiusyVersace/status/1532427687205212160","Giusy Versace","Milano","Cominciate col fare il necessario, poi cio' che e' possibile e all'improvviso vi sorprenderete a fare l'impossibile - S.Francesco d'Assisi","http://t.co/jemrvujzQb",FALSE,25997,2088,120,22016,16447,2011-12-26 13:05:12,TRUE,"http://t.co/jemrvujzQb","http://www.giusyversace.it",,"https://pbs.twimg.com/profile_banners/447056150/1363347299","http://abs.twimg.com/images/themes/theme1/bg.png","http://pbs.twimg.com/profile_images/378800000828007270/bad08b8529048aef2d0a82e084b0b31a_normal.jpeg"
"x447056150","x1532422099498848257",2022-06-02 18:01:14,"GiusyVersace","#2giugno 
Il prefetto di #Milano Renato Saccone oggi in occasione della #FestaDellaRepubblicaItaliana dopo la lettura del messaggio del presidente #Mattarella ha ricordato quanto sia doveroso tutelare i diritti fondamentali della nostra #Costituzione https://t.co/3bXIXqYNdM","Twitter for iPhone",250,,,,FALSE,FALSE,2,0,,,"2giugno Milano FestaDellaRepubblicaItaliana Mattarella Costituzione",,,,,"http://pbs.twimg.com/ext_tw_video_thumb/1532422015944212482/pu/img/qnG631ddfHYGSGWb.jpg","https://t.co/3bXIXqYNdM","https://twitter.com/GiusyVersace/status/1532422099498848257/video/1","photo","http://pbs.twimg.com/ext_tw_video_thumb/1532422015944212482/pu/img/qnG631ddfHYGSGWb.jpg","https://t.co/3bXIXqYNdM","https://twitter.com/GiusyVersace/status/1532422099498848257/video/1",,,,"it",,,,,,,,,,,,,,,,,,,,,,,,,,,,,,,,,,,,,"NA NA","NA NA","NA NA NA NA NA NA NA NA","https://twitter.com/GiusyVersace/status/1532422099498848257","Giusy Versace","Milano","Cominciate col fare il necessario, poi cio' che e' possibile e all'improvviso vi sorprenderete a fare l'impossibile - S.Francesco d'Assisi","http://t.co/jemrvujzQb",FALSE,25997,2088,120,22016,16447,2011-12-26 13:05:12,TRUE,"http://t.co/jemrvujzQb","http://www.giusyversace.it",,"https://pbs.twimg.com/profile_banners/447056150/1363347299","http://abs.twimg.com/images/themes/theme1/bg.png","http://pbs.twimg.com/profile_images/378800000828007270/bad08b8529048aef2d0a82e084b0b31a_normal.jpeg"
"x1557514573","x1532619849943351296",2022-06-03 07:07:01,"elio_vito","Salvini vuole parlare con Lavrov? Può sempre andare a Rete4!","Twitter for iPhone",60,,,,FALSE,FALSE,340,24,,,,,,,,,,,,,,,,,,"it",,,,,,,,,,,,,,,,,,,,,,,,,,,,,,,,,,,,,"NA NA","NA NA","NA NA NA NA NA NA NA NA","https://twitter.com/elio_vito/status/1532619849943351296","Elio Vito 🇮🇹🇪🇺🇺🇸🏳️‍🌈🍁🌍","Roma","Deputato @forza_italia🤔 Napoletano. Juventino⚪️⚫️","https://t.co/TxIGBtgFXw",FALSE,25713,13,127,28472,67765,2013-06-30 07:47:38,TRUE,"https://t.co/TxIGBtgFXw","http://documenti.camera.it/leg18/pdl/pdf/leg.18.pdl.camera.3470.18PDL0175510.pdf",,"https://pbs.twimg.com/profile_banners/1557514573/1640814244","http://abs.twimg.com/images/themes/theme1/bg.png","http://pbs.twimg.com/profile_images/736450788659240960/-8W5fQJa_normal.jpg"
"x1557514573","x1532471753544458254",2022-06-02 21:18:32,"elio_vito","@LegaSalvini Vi pare normale che Salvini parli con i russi?!","Twitter for iPad",47,"x1532419022557696000","x13514762","LegaSalvini",FALSE,FALSE,621,8,,,,,,,,,,,,,,,,"x13514762","LegaSalvini","it",,,,,,,,,,,,,,,,,,,,,,,,,,,,,,,,,,,,,"NA NA","NA NA","NA NA NA NA NA NA NA NA","https://twitter.com/elio_vito/status/1532471753544458254","Elio Vito 🇮🇹🇪🇺🇺🇸🏳️‍🌈🍁🌍","Roma","Deputato @forza_italia🤔 Napoletano. Juventino⚪️⚫️","https://t.co/TxIGBtgFXw",FALSE,25713,13,127,28472,67765,2013-06-30 07:47:38,TRUE,"https://t.co/TxIGBtgFXw","http://documenti.camera.it/leg18/pdl/pdf/leg.18.pdl.camera.3470.18PDL0175510.pdf",,"https://pbs.twimg.com/profile_banners/1557514573/1640814244","http://abs.twimg.com/images/themes/theme1/bg.png","http://pbs.twimg.com/profile_images/736450788659240960/-8W5fQJa_normal.jpg"
"x1557514573","x1532465594318086146",2022-06-02 20:54:04,"elio_vito","@hardirty_it @Giuse_DeRitis92 Direi di no","Twitter for iPhone",11,"x1532464691364102144","x1245287475490291712","hardirty_it",FALSE,FALSE,0,0,,,,,,,,,,,,,,,,"x1245287475490291712 x1498039400546160643","hardirty_it Giuse_DeRitis92","it",,,,,,,,,,,,,,,,,,,,,,,,,,,,,,,,,,,,,"NA NA","NA NA","NA NA NA NA NA NA NA NA","https://twitter.com/elio_vito/status/1532465594318086146","Elio Vito 🇮🇹🇪🇺🇺🇸🏳️‍🌈🍁🌍","Roma","Deputato @forza_italia🤔 Napoletano. Juventino⚪️⚫️","https://t.co/TxIGBtgFXw",FALSE,25713,13,127,28472,67765,2013-06-30 07:47:38,TRUE,"https://t.co/TxIGBtgFXw","http://documenti.camera.it/leg18/pdl/pdf/leg.18.pdl.camera.3470.18PDL0175510.pdf",,"https://pbs.twimg.com/profile_banners/1557514573/1640814244","http://abs.twimg.com/images/themes/theme1/bg.png","http://pbs.twimg.com/profile_images/736450788659240960/-8W5fQJa_normal.jpg"
"x1557514573","x1532406080273260544",2022-06-02 16:57:34,"elio_vito","'Chi si ferma è perduto' lo aveva detto ahimè Mussolini, poi è stato un film del grande Totò ed oggi lo ha scritto...Salvini, non so a quale dei due si sia ispirato!🤔","Twitter for iPad",166,,,,FALSE,FALSE,471,37,,,,,,,,,,,,,,,,,,"it",,,,,,,,,,,,,,,,,,,,,,,,,,,,,,,,,,,,,"NA NA","NA NA","NA NA NA NA NA NA NA NA","https://twitter.com/elio_vito/status/1532406080273260544","Elio Vito 🇮🇹🇪🇺🇺🇸🏳️‍🌈🍁🌍","Roma","Deputato @forza_italia🤔 Napoletano. Juventino⚪️⚫️","https://t.co/TxIGBtgFXw",FALSE,25713,13,127,28472,67765,2013-06-30 07:47:38,TRUE,"https://t.co/TxIGBtgFXw","http://documenti.camera.it/leg18/pdl/pdf/leg.18.pdl.camera.3470.18PDL0175510.pdf",,"https://pbs.twimg.com/profile_banners/1557514573/1640814244","http://abs.twimg.com/images/themes/theme1/bg.png","http://pbs.twimg.com/profile_images/736450788659240960/-8W5fQJa_normal.jpg"
"x1557514573","x1532367767671918596",2022-06-02 14:25:20,"elio_vito","@Giuse_DeRitis92 Sono io, certo, e dove dovrei stare?🤔","Twitter for iPhone",37,"x1532324056787308545","x1498039400546160643","Giuse_DeRitis92",FALSE,FALSE,2,0,,,,,,,,,,,,,,,,"x1498039400546160643","Giuse_DeRitis92","it",,,,,,,,,,,,,,,,,,,,,,,,,,,,,,,,,,,,,"NA NA","NA NA","NA NA NA NA NA NA NA NA","https://twitter.com/elio_vito/status/1532367767671918596","Elio Vito 🇮🇹🇪🇺🇺🇸🏳️‍🌈🍁🌍","Roma","Deputato @forza_italia🤔 Napoletano. Juventino⚪️⚫️","https://t.co/TxIGBtgFXw",FALSE,25713,13,127,28472,67765,2013-06-30 07:47:38,TRUE,"https://t.co/TxIGBtgFXw","http://documenti.camera.it/leg18/pdl/pdf/leg.18.pdl.camera.3470.18PDL0175510.pdf",,"https://pbs.twimg.com/profile_banners/1557514573/1640814244","http://abs.twimg.com/images/themes/theme1/bg.png","http://pbs.twimg.com/profile_images/736450788659240960/-8W5fQJa_normal.jpg"
"x1557514573","x1532364866048167937",2022-06-02 14:13:48,"elio_vito","@EP_President @RobertaMetsola @Europarl_EN In Italia invece li ospitiamo in Tv😡","Twitter for iPhone",36,"x1532350261829697537","x818837224003289088","EP_President",FALSE,FALSE,77,4,,,,,,,,,,,,,,,,"x818837224003289088 x55031092 x36329597","EP_President RobertaMetsola Europarl_EN","it",,,,,,,,,,,,,,,,,,,,,,,,,,,,,,,,,,,,,"NA NA","NA NA","NA NA NA NA NA NA NA NA","https://twitter.com/elio_vito/status/1532364866048167937","Elio Vito 🇮🇹🇪🇺🇺🇸🏳️‍🌈🍁🌍","Roma","Deputato @forza_italia🤔 Napoletano. Juventino⚪️⚫️","https://t.co/TxIGBtgFXw",FALSE,25713,13,127,28472,67765,2013-06-30 07:47:38,TRUE,"https://t.co/TxIGBtgFXw","http://documenti.camera.it/leg18/pdl/pdf/leg.18.pdl.camera.3470.18PDL0175510.pdf",,"https://pbs.twimg.com/profile_banners/1557514573/1640814244","http://abs.twimg.com/images/themes/theme1/bg.png","http://pbs.twimg.com/profile_images/736450788659240960/-8W5fQJa_normal.jpg"
