"x984849914235637761","x1536381197093306369",2022-06-13 16:13:16,"BaldinoVittoria","Quesiti complessi e lontani dalle esigenze della gente, portati avanti per gli interessi dei partiti che li hanno promossi. Se i referendum fossero stati sull'#Eutanasia e la #Cannabis di certo non saremmo qui a parlare di #astensionismo.","Twitter Web App",238,,,,FALSE,FALSE,15,5,,,"Eutanasia Cannabis astensionismo",,,,,,,,,,,,,,,"it",,,,,,,,,,,,,,,,,,,,,,,,,,,,,,,,,,,,,"NA NA","NA NA","NA NA NA NA NA NA NA NA","https://twitter.com/BaldinoVittoria/status/1536381197093306369","Vittoria Baldino","Roma, Lazio","Portavoce alla Camera dei Deputati. Capogruppo M5S Commissione Affari Costituzionali. Comitato Politiche Giovanili. ⭐⭐⭐⭐⭐","https://t.co/DEIEWBlYGn",FALSE,3578,547,33,1059,263,2018-04-13 17:44:51,TRUE,"https://t.co/DEIEWBlYGn","https://is.gd/RRBupZ",,"https://pbs.twimg.com/profile_banners/984849914235637761/1583493839",,"http://pbs.twimg.com/profile_images/1476695181852356614/m8ku4wEJ_normal.jpg"
"x1326743389","x1536272229419327488",2022-06-13 09:00:16,"g_brescia","Di fronte al #referendum col peggior tasso di affluenza della storia della Repubblica, mi auguro che gli altri partiti vogliano riprendere la riforma già approvata nel 2019 alla Camera e ferma da troppo tempo al Senato per introdurre il #referendumpropositivo.","Twitter Web App",260,"x1536272088109039617","x1326743389","g_brescia",FALSE,FALSE,4,1,,,"referendum referendumpropositivo",,,,,,,,,,,,,,,"it",,,,,,,,,,,,,,,,,,,,,,,,,,,,,,,,,,,,,"NA NA","NA NA","NA NA NA NA NA NA NA NA","https://twitter.com/g_brescia/status/1536272229419327488","Giuseppe Brescia","","Deputato del MoVimento 5 Stelle 
Presidente della I Commissione Affari Costituzionali
Coordinatore del Comitato per la sicurezza M5S","https://t.co/nwiJ5QDcNs",FALSE,15979,545,121,9820,2144,2013-04-04 11:25:40,TRUE,"https://t.co/nwiJ5QDcNs","http://www.giuseppebrescia.it",,"https://pbs.twimg.com/profile_banners/1326743389/1631547379","http://abs.twimg.com/images/themes/theme1/bg.png","http://pbs.twimg.com/profile_images/1134036981732859904/zgNfHGej_normal.png"
"x1326743389","x1536272088109039617",2022-06-13 08:59:43,"g_brescia","Il #caos seggi deve far riflettere il Viminale. Troppi no sono arrivati a tante nostre proposte innovative, dal voto elettronico a quello ai #fuorisede. E' prima di tutto un diritto, non rito, tradizione e procedura immutabile. ℹ️ https://t.co/s26Fx72MoH","Twitter Web App",254,,,,FALSE,FALSE,6,2,,,"caos fuorisede",,"facebook.com/GiuseppeBresci…","https://t.co/s26Fx72MoH","https://www.facebook.com/GiuseppeBresciaM5S/posts/556844619154304",,,,,,,,,,,"it",,,,,,,,,,,,,,,,,,,,,,,,,,,,,,,,,,,,,"NA NA","NA NA","NA NA NA NA NA NA NA NA","https://twitter.com/g_brescia/status/1536272088109039617","Giuseppe Brescia","","Deputato del MoVimento 5 Stelle 
Presidente della I Commissione Affari Costituzionali
Coordinatore del Comitato per la sicurezza M5S","https://t.co/nwiJ5QDcNs",FALSE,15979,545,121,9820,2144,2013-04-04 11:25:40,TRUE,"https://t.co/nwiJ5QDcNs","http://www.giuseppebrescia.it",,"https://pbs.twimg.com/profile_banners/1326743389/1631547379","http://abs.twimg.com/images/themes/theme1/bg.png","http://pbs.twimg.com/profile_images/1134036981732859904/zgNfHGej_normal.png"
"x408370356","x1536299761006960646",2022-06-13 10:49:40,"SBuffagni","𝗡𝗶𝗸 𝗠𝗲𝗹𝗹𝗶 Top Scorer di Gara 3: 𝟮𝟮 (con 5 rimbalzi)! 🔝©️⚪️🔴

#insieme #LBAFinals #OlimpiaMilanoVirtusBologna #NikMelli #ForzaOlimpia 
@NikMelli https://t.co/vWiSlOus9l","Twitter for iPhone",140,,,,FALSE,TRUE,0,9,,,"insieme LBAFinals OlimpiaMilanoVirtusBologna NikMelli",,,,,,,,,,,,,"x267111941","OlimpiaMI1936","it",,,,,,,,,,,,,,,,"x1536271802997133312","𝗡𝗶𝗸 𝗠𝗲𝗹𝗹𝗶 Top Scorer di Gara 3: 𝟮𝟮 (con 5 rimbalzi)! 🔝©️⚪️🔴

#insieme #LBAFinals #OlimpiaMilanoVirtusBologna #NikMelli #ForzaOlimpia 
@NikMelli https://t.co/vWiSlOus9l",2022-06-13 08:58:35,"Twitter for iPhone",74,9,"x267111941","OlimpiaMI1936","Olimpia Milano",57569,396,51023,"Milano","Olimpia Milano Official Twitter Account",TRUE,,,,,,,"NA NA","NA NA","NA NA NA NA NA NA NA NA","https://twitter.com/SBuffagni/status/1536299761006960646","Stefano Buffagni","Milano - Italia","Papà - Deputato alla Camera del MoVimento 5 Stelle - Dottore Commercialista - Revisore Conti - Olimpia Milano - #Amala","https://t.co/kC2c3piOT8",FALSE,5279,571,82,10849,5218,2011-11-09 10:16:54,TRUE,"https://t.co/kC2c3piOT8","http://www.stefanobuffagni.it",,"https://pbs.twimg.com/profile_banners/408370356/1378026556","http://abs.twimg.com/images/themes/theme1/bg.png","http://pbs.twimg.com/profile_images/733026017779015681/DB8G3tyV_normal.jpg"
"x988044962406326272","x1536328469788995584",2022-06-13 12:43:45,"BuompaneG","#Salariominimo #M5S è pronto ad approvarlo. Sempre dalla parte dei cittadini e a tutela delle fasce più deboli della popolazione. Al Senato c’è il nostro disegno di legge. Ora tocca alle altre forze politiche fare un passo avanti e avere coraggio! ⤵️ https://t.co/5XGwoavA7w","Twitter for Android",274,,,,FALSE,FALSE,1,0,,,"Salariominimo M5S",,"fb.watch/dCVThPr-OR/","https://t.co/5XGwoavA7w","https://fb.watch/dCVThPr-OR/",,,,,,,,,,,"it",,,,,,,,,,,,,,,,,,,,,,,,,,,,,,,,,,,,,"NA NA","NA NA","NA NA NA NA NA NA NA NA","https://twitter.com/BuompaneG/status/1536328469788995584","Giuseppe Buompane","","Portavoce del Movimento 5 Stelle alla Camera dei Deputati
V Commissione Bilancio Camera
Commissione Parlamentare di Inchiesta sul sistema Bancario e finanziario","https://t.co/StOAkM7UnA",FALSE,2423,673,22,2143,307,2018-04-22 13:20:50,TRUE,"https://t.co/StOAkM7UnA","https://bit.ly/3bFRFeI",,"https://pbs.twimg.com/profile_banners/988044962406326272/1597160551","http://abs.twimg.com/images/themes/theme1/bg.png","http://pbs.twimg.com/profile_images/1012056307346628609/W6P2ICVp_normal.jpg"
"x1016331956727046146","x1536330747249819651",2022-06-13 12:52:48,"cillis_luciano","Occorre avere sin da una ora la visione per le prossime annate agrarie per attivare un sistema di risposta ai gravi insulti economici causati da pandemia e guerra.
#FoodSecurity https://t.co/uRba4jHzDE","Twitter for Android",177,,,,FALSE,FALSE,1,0,,,"FoodSecurity",,,,,"http://pbs.twimg.com/media/FVIkqwVXsAITEwh.jpg","https://t.co/uRba4jHzDE","https://twitter.com/cillis_luciano/status/1536330747249819651/photo/1","photo","http://pbs.twimg.com/media/FVIkqwVXsAITEwh.jpg","https://t.co/uRba4jHzDE","https://twitter.com/cillis_luciano/status/1536330747249819651/photo/1",,,,"it",,,,,,,,,,,,,,,,,,,,,,,,,,,,,,,,,,,,,"NA NA","NA NA","NA NA NA NA NA NA NA NA","https://twitter.com/cillis_luciano/status/1536330747249819651","Luciano Cillis","Basilicata, Italia","Portavoce alla Camera m5s",,FALSE,138,83,9,3,0,2018-07-09 14:43:15,FALSE,,,,"https://pbs.twimg.com/profile_banners/1016331956727046146/1531148031",,"http://pbs.twimg.com/profile_images/1016334628230258688/ozUnA8Sk_normal.jpg"
"x398603525","x1536234816194105344",2022-06-13 06:31:36,"Emanuela_Corda","#Lega #ForzaItalia con la preziosa collaborazione di #Renzi e altri cespugli #draghiani pensavano di rilanciarsi #gratis con i #referendum e invece oggi fanno i conti con una colossale disfatta! Della serie: come buttare soldi pubblici al vento! #vergogna","Twitter for iPhone",255,,,,FALSE,FALSE,8,3,,,"Lega ForzaItalia Renzi draghiani gratis referendum vergogna",,,,,,,,,,,,,,,"it",,,,,,,,,,,,,,,,,,,,,,,,,,,,,,,,,,,,,"NA NA","NA NA","NA NA NA NA NA NA NA NA","https://twitter.com/Emanuela_Corda/status/1536234816194105344","Emanuela Corda","Cagliari Roma","Sono una libera professionista. Amo la storia, la cultura, il mondo, la verità. Attualmente portavoce eletta alla Camera dei Deputati",,FALSE,8400,238,96,993,303,2011-10-26 09:06:56,TRUE,,,,"https://pbs.twimg.com/profile_banners/398603525/1639788403","http://abs.twimg.com/images/themes/theme1/bg.png","http://pbs.twimg.com/profile_images/1475823428343107588/KLiCaLJ3_normal.jpg"
"x398603525","x1536206488049487872",2022-06-13 04:39:02,"Emanuela_Corda","#Severissima #disfatta per chi avrebbe voluto abbattere la #legge #Severino","Twitter for iPhone",75,,,,FALSE,FALSE,6,1,,,"Severissima disfatta legge Severino",,,,,,,,,,,,,,,"it",,,,,,,,,,,,,,,,,,,,,,,,,,,,,,,,,,,,,"NA NA","NA NA","NA NA NA NA NA NA NA NA","https://twitter.com/Emanuela_Corda/status/1536206488049487872","Emanuela Corda","Cagliari Roma","Sono una libera professionista. Amo la storia, la cultura, il mondo, la verità. Attualmente portavoce eletta alla Camera dei Deputati",,FALSE,8400,238,96,993,303,2011-10-26 09:06:56,TRUE,,,,"https://pbs.twimg.com/profile_banners/398603525/1639788403","http://abs.twimg.com/images/themes/theme1/bg.png","http://pbs.twimg.com/profile_images/1475823428343107588/KLiCaLJ3_normal.jpg"
"x13065292","x1536373285084049409",2022-06-13 15:41:50,"matteodallosso","L'incrociatore russo Varyag davanti alle coste del Salento: la sfida di Putin alla Nato (e all'Italia)  #puglia #putin #nave #salento #varyag https://t.co/JoemrNhEMA","Twitter for iPhone",140,,,,FALSE,TRUE,0,17,,,"puglia putin",,,,,,,,,,,,,"x331617619","MediasetTgcom24","it",,,,,,,,,,,,,,,,"x1536312755577360386","L'incrociatore russo Varyag davanti alle coste del Salento: la sfida di Putin alla Nato (e all'Italia)  #puglia #putin #nave #salento #varyag https://t.co/JoemrNhEMA",2022-06-13 11:41:18,"Social Mediaset ",83,17,"x331617619","MediasetTgcom24","Tgcom24",1385098,963,219731,"","Profilo ufficiale di Tgcom24: tutte le notizie sul sito https://t.co/sC5iMbymSN e sul canale 51 del digitale terrestre",TRUE,,,,,,,"NA NA","NA NA","NA NA NA NA NA NA NA NA","https://twitter.com/matteodallosso/status/1536373285084049409","Matteo Dall'Osso #iovotosì!","Roma Italy","Ingegnere, deputato eletto alla Camera, Forza Italia.","https://t.co/fWV0dhImmo",FALSE,17001,765,131,13550,7659,2008-02-04 20:58:07,TRUE,"https://t.co/fWV0dhImmo","http://www.matteodallosso.it",,"https://pbs.twimg.com/profile_banners/13065292/1644167647","http://abs.twimg.com/images/themes/theme15/bg.png","http://pbs.twimg.com/profile_images/1425571343173574659/9SrYnoz3_normal.jpg"
"x48062712","x1536187833618243584",2022-06-13 03:24:55,"luigidimaio","Il Ministro degli Esteri @luigidimaio è in missione in Etiopia 🇪🇹 e Kenya 🇰🇪

***
Mission of Foreign Minister Luigi Di Maio to Ethiopia 🇪🇹 and Kenya 🇰🇪 https://t.co/m6KaEv4xw6","Twitter for iPhone",140,,,,FALSE,TRUE,0,25,,,,,,,,,,,,,,,,"x599114492 x48062712","ItalyMFA luigidimaio","it",,,,,,,,,,,,,,,,"x1535989018831224832","Il Ministro degli Esteri @luigidimaio è in missione in Etiopia 🇪🇹 e Kenya 🇰🇪

***
Mission of Foreign Minister Luigi Di Maio to Ethiopia 🇪🇹 and Kenya 🇰🇪 https://t.co/m6KaEv4xw6",2022-06-12 14:14:54,"Twitter Web App",82,25,"x599114492","ItalyMFA","Farnesina 🇮🇹",274355,955,16346,"Roma, Italia","Profilo ufficiale del Ministero degli Affari Esteri e della Cooperazione Internazionale | Follow us in other languages at @ItalyMFA_int",TRUE,,,,,,,"NA NA","NA NA","NA NA NA NA NA NA NA NA","https://twitter.com/luigidimaio/status/1536187833618243584","Luigi Di Maio","Pomigliano d'Arco, Campania","Ministro degli Affari Esteri e della Cooperazione Internazionale.","https://t.co/D8gkagqksG",FALSE,770226,339,2231,7125,399,2009-06-17 18:34:46,TRUE,"https://t.co/D8gkagqksG","http://www.luigidimaio.it",,"https://pbs.twimg.com/profile_banners/48062712/1645985183","http://abs.twimg.com/images/themes/theme1/bg.png","http://pbs.twimg.com/profile_images/933106806670462976/YyC7LOW8_normal.jpg"
"x122445010","x1536288044155813888",2022-06-13 10:03:07,"FedericoDinca","Questa tornata #elettorale ha purtroppo confermato la tendenza sull'#astensionismo che abbiamo esaminato con la commissione di esperti nel Libro Bianco. https://t.co/bRwFNZp4TR","Twitter for Android",176,,,,FALSE,FALSE,1,1,,,"elettorale astensionismo",,"m.facebook.com/story.php?stor…","https://t.co/bRwFNZp4TR","https://m.facebook.com/story.php?story_fbid=pfbid02ipBzs85u7fTnrh8FgFtdmVxi2g9Mgijdco7nqG1yBsuwCs8pjxMCdh85HQ1k8iAjl&id=100044528885410",,,,,,,,,,,"it",,,,,,,,,,,,,,,,,,,,,,,,,,,,,,,,,,,,,"NA NA","NA NA","NA NA NA NA NA NA NA NA","https://twitter.com/FedericoDinca/status/1536288044155813888","Federico D'Incà","","Ministro per i Rapporti con il Parlamento e le Riforme","https://t.co/UFCWewwvtT",FALSE,14565,688,218,4714,102,2010-03-12 18:47:13,TRUE,"https://t.co/UFCWewwvtT","http://www.federicodinca.it",,"https://pbs.twimg.com/profile_banners/122445010/1613160864","http://abs.twimg.com/images/themes/theme1/bg.png","http://pbs.twimg.com/profile_images/1409407471559512065/khni2uiy_normal.jpg"
"x22834067","x1536309353707446275",2022-06-13 11:27:47,"Roberto_Fico","Il riconoscimento a @stefanomassini nella 75esima edizione dei #TonyAwards per #TheLehmanTrilogy è una meravigliosa notizia per il teatro italiano e per tutto il settore culturale del nostro Paese. 
Congratulazioni per questo prestigioso riconoscimento internazionale!","Twitter Web App",268,,,,FALSE,FALSE,30,4,,,"TonyAwards TheLehmanTrilogy",,,,,,,,,,,,,"x2385561870","stefanomassini","it",,,,,,,,,,,,,,,,,,,,,,,,,,,,,,,,,,,,,"NA NA","NA NA","NA NA NA NA NA NA NA NA","https://twitter.com/Roberto_Fico/status/1536309353707446275","Roberto Fico","Napoli, Italy","Presidente della Camera dei Deputati","https://t.co/RAbIEv9ppx",FALSE,217633,476,972,6423,2386,2009-03-04 21:05:18,TRUE,"https://t.co/RAbIEv9ppx","http://presidente.camera.it/",,"https://pbs.twimg.com/profile_banners/22834067/1523883395","http://abs.twimg.com/images/themes/theme1/bg.png","http://pbs.twimg.com/profile_images/871776681228472322/x0NkGhan_normal.jpg"
"x262823808","x1536342695387406336",2022-06-13 13:40:17,"lucafrusone","#TakeoffAccelerator consente alle migliori #startup di proporre idee e realizzare progettualità ad alto potenziale industriale e tecnologico. Questo rafforzerà l'ecosistema italiano in cui sono già presenti delle eccellenze, come l'industria aerospaziale. https://t.co/S2tQ8SrwBd","Twitter Web App",279,,,,FALSE,FALSE,2,1,,,"TakeoffAccelerator startup",,"bit.ly/39g5Xqa","https://t.co/S2tQ8SrwBd","http://bit.ly/39g5Xqa",,,,,,,,,,,"it",,,,,,,,,,,,,,,,,,,,,,,,,,,,,,,,,,,,,"NA NA","NA NA","NA NA NA NA NA NA NA NA","https://twitter.com/lucafrusone/status/1536342695387406336","Luca Frusone","Alatri","Presidente della delegazione italiana presso l'Assemblea parlamentare della NATO. Portavoce alla Camera dei Deputati del MoVimento 5 Stelle","https://t.co/W4WPiRbe3U",FALSE,4940,717,90,4910,683,2011-03-08 20:54:17,TRUE,"https://t.co/W4WPiRbe3U","http://www.lucafrusone.it",,"https://pbs.twimg.com/profile_banners/262823808/1580829885","http://abs.twimg.com/images/themes/theme7/bg.gif","http://pbs.twimg.com/profile_images/1109131343819128834/FhDlxk6Z_normal.png"
"x920435114","x1536317987992608769",2022-06-13 12:02:06,"LuigiGallo15","Astensionisti e votanti del no hanno respinto un attacco sopra le righe alla magistratura. La legalità in politica è ancora un tema attuale perché i partiti non ci hanno seguito su legalità e sul taglio degli stipendi","Twitter for Android",217,,,,FALSE,FALSE,3,1,,,,,,,,,,,,,,,,,,"it",,,,,,,,,,,,,,,,,,,,,,,,,,,,,,,,,,,,,"NA NA","NA NA","NA NA NA NA NA NA NA NA","https://twitter.com/LuigiGallo15/status/1536317987992608769","Luigi Gallo","Torre del Greco, Campania","Vice Presidente del Gruppo Parlamentare M5S della Camera dei Deputati, area Economica, già Presidente della Commissione Cultura, Scienza ed Istruzione","https://t.co/Uw9cxfSVTG",FALSE,17051,1396,158,20520,34,2012-11-02 05:41:34,TRUE,"https://t.co/Uw9cxfSVTG","http://galloluigi.com",,"https://pbs.twimg.com/profile_banners/920435114/1646308274","http://abs.twimg.com/images/themes/theme1/bg.png","http://pbs.twimg.com/profile_images/1496581832544079875/vmbJoPsr_normal.jpg"
"x11945512","x1536376153300160513",2022-06-13 15:53:14,"mirellaliuzzi","#cte #ctematera Dal 22 al 26 giugno, un evento lungo cinque giorni che mette al centro l’innovazione digitale, dalla robotica alla blockchain, dal 5G alla stampa 3d fino ai gemelli digitali. Ecco cosa succederà a Matera @CteMatera: https://t.co/T0rl3FaEqY https://t.co/6zdqRxeOt4","Twitter Web App",140,,,,FALSE,TRUE,0,3,,,"cte ctematera",,,,,,,,,,,,,"x119711344","wireditalia","it",,,,,,,,,,,,,,,,"x1535186077941653504","#cte #ctematera Dal 22 al 26 giugno, un evento lungo cinque giorni che mette al centro l’innovazione digitale, dalla robotica alla blockchain, dal 5G alla stampa 3d fino ai gemelli digitali. Ecco cosa succederà a Matera @CteMatera: https://t.co/T0rl3FaEqY https://t.co/6zdqRxeOt4",2022-06-10 09:04:18,"Echobox",4,3,"x119711344","wireditalia","Wired Italia",438122,131,127523,"","Un mondo migliore. Un mondo nuovo. Ogni giorno. Quality is our Business Plan #CONDENASTQUALITY",TRUE,,,,,,,"NA NA","NA NA","NA NA NA NA NA NA NA NA","https://twitter.com/mirellaliuzzi/status/1536376153300160513","Mirella Liuzzi","Matera","🇮🇹 Member of the Italian Parliament. She/her.","https://t.co/SnLJwhyvTY",FALSE,13573,881,225,14221,1317,2008-01-07 15:04:26,TRUE,"https://t.co/SnLJwhyvTY","http://www.mirellaliuzzi.it",,"https://pbs.twimg.com/profile_banners/11945512/1613343939","http://abs.twimg.com/images/themes/theme6/bg.gif","http://pbs.twimg.com/profile_images/1012435043157970944/jEhhfnce_normal.jpg"
"x398927724","x1536299649535037442",2022-06-13 10:49:14,"AnnaLauraOrrico","#StefanoMassini sbanca i #TonyAwards2022 e porta a casa ben 5 (cinque!) Oscar del teatro. Complimenti! Un gran bel riconoscimento per l'attore e drammaturgo fiorentino e per l'#Italia https://t.co/Rai2skRpMA","Twitter for Android",183,,,,FALSE,FALSE,1,0,,,"StefanoMassini TonyAwards2022 Italia",,,,,"http://pbs.twimg.com/media/FVIIY4nXsAAdlit.jpg","https://t.co/Rai2skRpMA","https://twitter.com/AnnaLauraOrrico/status/1536299649535037442/photo/1","photo","http://pbs.twimg.com/media/FVIIY4nXsAAdlit.jpg","https://t.co/Rai2skRpMA","https://twitter.com/AnnaLauraOrrico/status/1536299649535037442/photo/1",,,,"it",,,,,,,,,,,,,,,,,,,,,,,,,,,,,,,,,,,,,"NA NA","NA NA","NA NA NA NA NA NA NA NA","https://twitter.com/AnnaLauraOrrico/status/1536299649535037442","Anna Laura Orrico","Cosenza, Calabria","Deputata del M5S. Imprenditrice e innovatrice, già Sottosegretario alla Cultura nel Conte 2. Mi occupo di turismo, imprese creative, Sud e piccoli paesi.","https://t.co/cjWBq7G1qK",FALSE,2477,1323,52,2258,576,2011-10-26 19:01:11,TRUE,"https://t.co/cjWBq7G1qK","https://www.annalauraorrico.it/",,"https://pbs.twimg.com/profile_banners/398927724/1614352965","http://abs.twimg.com/images/themes/theme1/bg.png","http://pbs.twimg.com/profile_images/1365321400702091269/JMxki1BF_normal.jpg"
"x292474458","x1536476705673596935",2022-06-13 22:32:47,"RaphaelRaduzzi","@ELuttwak Scusi Luttwak, ma sostenere guerra è sanzioni mentre Bce ti abbandona : non è possibile https://t.co/84QnyfejBU","Twitter for Android",135,,,,FALSE,TRUE,0,12,,,,,,,,"http://pbs.twimg.com/media/FVJ9XqdWIAEeoxF.jpg","https://t.co/84QnyfejBU","https://twitter.com/Musso___/status/1536428275664404482/photo/1","photo","http://pbs.twimg.com/media/FVJ9XqdWIAEeoxF.jpg","https://t.co/84QnyfejBU","https://twitter.com/Musso___/status/1536428275664404482/photo/1",,"x901003845005971457 x1239676915386068993","Musso___ ELuttwak","it",,,,,,,,,,,,,,,,"x1536428275664404482","@ELuttwak Scusi Luttwak, ma sostenere guerra è sanzioni mentre Bce ti abbandona : non è possibile https://t.co/84QnyfejBU",2022-06-13 19:20:21,"Twitter for iPhone",46,12,"x901003845005971457","Musso___","Musso 🍊",11242,4045,236261,"","Analfabeta funzionale di classe subalterna. Gelido antipatizzante. Il faut saisir les opportunités. Non c’è Turati senza prima Cavour. Ladran, luego cabalgamos",FALSE,,,,,,,"NA NA","NA NA","NA NA NA NA NA NA NA NA","https://twitter.com/RaphaelRaduzzi/status/1536476705673596935","Raphael Raduzzi","Padova","Italian MP 🇮🇹 - Essere libero non è nulla, divenirlo è cosa celeste. @Alternativa_it","https://t.co/7py1uEl32G",FALSE,8137,1219,33,6053,4832,2011-05-03 18:14:43,TRUE,"https://t.co/7py1uEl32G","https://bit.ly/2Z0j5rQ",,"https://pbs.twimg.com/profile_banners/292474458/1486213591","http://abs.twimg.com/images/themes/theme1/bg.png","http://pbs.twimg.com/profile_images/1533707094645415937/JHG-6NEZ_normal.jpg"
"x292474458","x1536326593190285313",2022-06-13 12:36:18,"RaphaelRaduzzi","E il #DucePorco sfiora i 400 👉 mooooolto peggio del governo #sovranista
#ducedraghistaisereno https://t.co/Jkl1J1Tu6d","Twitter for Android",131,,,,FALSE,TRUE,0,33,,,"DucePorco sovranista ducedraghistaisereno",,,,,"http://pbs.twimg.com/media/FVID0bJWIAUXTZg.png","https://t.co/Jkl1J1Tu6d","https://twitter.com/Musso___/status/1536294625392087040/photo/1","photo","http://pbs.twimg.com/media/FVID0bJWIAUXTZg.png","https://t.co/Jkl1J1Tu6d","https://twitter.com/Musso___/status/1536294625392087040/photo/1",,"x901003845005971457","Musso___","it",,,,,,,,,,,,,,,,"x1536294625392087040","E il #DucePorco sfiora i 400 👉 mooooolto peggio del governo #sovranista
#ducedraghistaisereno https://t.co/Jkl1J1Tu6d",2022-06-13 10:29:16,"Twitter Web App",80,33,"x901003845005971457","Musso___","Musso 🍊",11242,4045,236261,"","Analfabeta funzionale di classe subalterna. Gelido antipatizzante. Il faut saisir les opportunités. Non c’è Turati senza prima Cavour. Ladran, luego cabalgamos",FALSE,,,,,,,"NA NA","NA NA","NA NA NA NA NA NA NA NA","https://twitter.com/RaphaelRaduzzi/status/1536326593190285313","Raphael Raduzzi","Padova","Italian MP 🇮🇹 - Essere libero non è nulla, divenirlo è cosa celeste. @Alternativa_it","https://t.co/7py1uEl32G",FALSE,8137,1219,33,6053,4832,2011-05-03 18:14:43,TRUE,"https://t.co/7py1uEl32G","https://bit.ly/2Z0j5rQ",,"https://pbs.twimg.com/profile_banners/292474458/1486213591","http://abs.twimg.com/images/themes/theme1/bg.png","http://pbs.twimg.com/profile_images/1533707094645415937/JHG-6NEZ_normal.jpg"
"x2149359853","x1536422092689776641",2022-06-13 18:55:46,"RaffaAngela","Il capogruppo di Fratelli d’Italia alla Camera dei deputati, nonché cognato di Giorgia Meloni (ha sposato la sorella Arianna Meloni).. cioè Francesco Lollobrigida ha chiesto che venga tolto il reddito di cittadinanza “ai disertori dei seggi”. Presumo par… https://t.co/4VjWjYeg21 https://t.co/Q6oIBzVO5U","IFTTT",279,,,,FALSE,FALSE,8,2,,,,,"instagr.am/p/CewWl9IN4vv/","https://t.co/4VjWjYeg21","https://instagr.am/p/CewWl9IN4vv/","http://pbs.twimg.com/media/FVJ3wGzWIAIoPFz.jpg","https://t.co/Q6oIBzVO5U","https://twitter.com/RaffaAngela/status/1536422092689776641/photo/1","photo","http://pbs.twimg.com/media/FVJ3wGzWIAIoPFz.jpg","https://t.co/Q6oIBzVO5U","https://twitter.com/RaffaAngela/status/1536422092689776641/photo/1",,,,"it",,,,,,,,,,,,,,,,,,,,,,,,,,,,,,,,,,,,,"NA NA","NA NA","NA NA NA NA NA NA NA NA","https://twitter.com/RaffaAngela/status/1536422092689776641","Angela Raffa","Messina, Sicilia","Deputata Movimento 5 Stelle","https://t.co/QVUmXyFvz0",FALSE,2021,864,16,1254,203,2013-10-22 16:44:17,FALSE,"https://t.co/QVUmXyFvz0","http://facebook.com/angelaraffaM5S/",,"https://pbs.twimg.com/profile_banners/2149359853/1615924017","http://abs.twimg.com/images/themes/theme1/bg.png","http://pbs.twimg.com/profile_images/1371910875033001995/1LehpM1a_normal.jpg"
"x127025568","x1536276726698893312",2022-06-13 09:18:08,"carlosibilia","La colpa della scarsa affluenza è di chi ha proposto un #referendum sbagliato. Quello sul taglio dei parlamentari infatti ha avuto esito diverso. Se ci fossero stati quesiti come #salariominimo, #eutanasialegale, #ddlzan, certamente il quorum sarebbe stato raggiunto.","Twitter for iPhone",267,,,,FALSE,FALSE,85,25,,,"referendum salariominimo eutanasialegale ddlzan",,,,,,,,,,,,,,,"it",,,,,,,,,,,,,,,,,,,,,,,,,,,,,,,,,,,,,"NA NA","NA NA","NA NA NA NA NA NA NA NA","https://twitter.com/carlosibilia/status/1536276726698893312","Carlo Sibilia","Avellino, Campania","Laureato in Biotecnologie Mediche. Parlamentare da 9 anni. 4 da Sottosegretario al Ministero dell'Interno.","https://t.co/LurVtHtd5m",FALSE,57409,770,349,14763,3731,2010-03-27 20:02:51,TRUE,"https://t.co/LurVtHtd5m","http://www.carlosibilia.it",,"https://pbs.twimg.com/profile_banners/127025568/1645873895","http://abs.twimg.com/images/themes/theme1/bg.png","http://pbs.twimg.com/profile_images/1500877497814196229/PUGZXtCA_normal.jpg"
