"user_id","status_id","created_at","screen_name","text","source","display_text_width","reply_to_status_id","reply_to_user_id","reply_to_screen_name","is_quote","is_retweet","favorite_count","retweet_count","quote_count","reply_count","hashtags","symbols","urls_url","urls_t.co","urls_expanded_url","media_url","media_t.co","media_expanded_url","media_type","ext_media_url","ext_media_t.co","ext_media_expanded_url","ext_media_type","mentions_user_id","mentions_screen_name","lang","quoted_status_id","quoted_text","quoted_created_at","quoted_source","quoted_favorite_count","quoted_retweet_count","quoted_user_id","quoted_screen_name","quoted_name","quoted_followers_count","quoted_friends_count","quoted_statuses_count","quoted_location","quoted_description","quoted_verified","retweet_status_id","retweet_text","retweet_created_at","retweet_source","retweet_favorite_count","retweet_retweet_count","retweet_user_id","retweet_screen_name","retweet_name","retweet_followers_count","retweet_friends_count","retweet_statuses_count","retweet_location","retweet_description","retweet_verified","place_url","place_name","place_full_name","place_type","country","country_code","geo_coords","coords_coords","bbox_coords","status_url","name","location","description","url","protected","followers_count","friends_count","listed_count","statuses_count","favourites_count","account_created_at","verified","profile_url","profile_expanded_url","account_lang","profile_banner_url","profile_background_url","profile_image_url"
"x270839361","x1529471505079336960",2022-05-25 14:36:37,"matteosalvinimi","Altro processo, altra richiesta di condanna per Berlusconi per il “caso Ruby”. Ma basta, non se ne può più! 12 giugno, con i SÌ ai Referendum la Giustizia cambia. https://t.co/hzeoRsUXaS","Twitter Web App",162,,,,FALSE,FALSE,258,44,,,,,,,,"http://pbs.twimg.com/media/FTnGJhmWYAEs3a5.jpg","https://t.co/hzeoRsUXaS","https://twitter.com/matteosalvinimi/status/1529471505079336960/photo/1","photo","http://pbs.twimg.com/media/FTnGJhmWYAEs3a5.jpg","https://t.co/hzeoRsUXaS","https://twitter.com/matteosalvinimi/status/1529471505079336960/photo/1",,,,"it",,,,,,,,,,,,,,,,,,,,,,,,,,,,,,,,,,,,,"NA NA","NA NA","NA NA NA NA NA NA NA NA","https://twitter.com/matteosalvinimi/status/1529471505079336960","Matteo Salvini","","Leader della Lega #primagliitaliani 🇮🇹","https://t.co/sj3rr6DU3N",FALSE,1474904,2008,3135,52992,3826,2011-03-23 10:32:56,TRUE,"https://t.co/sj3rr6DU3N","https://legaonline.it/",,"https://pbs.twimg.com/profile_banners/270839361/1641590097","http://abs.twimg.com/images/themes/theme1/bg.png","http://pbs.twimg.com/profile_images/966325945060732928/0Ua5xPMX_normal.jpg"
"x270839361","x1529381857627934720",2022-05-25 08:40:24,"matteosalvinimi","Buone notizie dal fronte: coltivare i semi della pace, del ritorno al dialogo e della diplomazia vale più di qualunque arma.
https://t.co/tKuAiZoHLl","Twitter for Android",148,,,,FALSE,FALSE,188,27,,,,,"ansa.it/nuova_europa/i…","https://t.co/tKuAiZoHLl","https://www.ansa.it/nuova_europa/it/notizie/rubriche/politica/2022/05/25/mosca-pronti-a-dialogo-su-forniture-grano-dallucraina_8bf8f236-baf3-4d10-a4b6-8c7732d70f57.html",,,,,,,,,,,"it",,,,,,,,,,,,,,,,,,,,,,,,,,,,,,,,,,,,,"NA NA","NA NA","NA NA NA NA NA NA NA NA","https://twitter.com/matteosalvinimi/status/1529381857627934720","Matteo Salvini","","Leader della Lega #primagliitaliani 🇮🇹","https://t.co/sj3rr6DU3N",FALSE,1474904,2008,3135,52992,3826,2011-03-23 10:32:56,TRUE,"https://t.co/sj3rr6DU3N","https://legaonline.it/",,"https://pbs.twimg.com/profile_banners/270839361/1641590097","http://abs.twimg.com/images/themes/theme1/bg.png","http://pbs.twimg.com/profile_images/966325945060732928/0Ua5xPMX_normal.jpg"
"x270839361","x1529213776880230400",2022-05-24 21:32:30,"matteosalvinimi","In diretta con @BrunoVespa su Rai 1, state con noi. @RaiPortaaPorta #portaaporta  https://t.co/sj01VkF0n4","Twitter Media Studio",105,,,,FALSE,FALSE,161,42,,,"portaaporta",,"twitter.com/i/broadcasts/1…","https://t.co/sj01VkF0n4","https://twitter.com/i/broadcasts/1ypKdEvodvrGW",,,,,,,,,"x1091721366 x406880559","BrunoVespa RaiPortaaPorta","it",,,,,,,,,,,,,,,,,,,,,,,,,,,,,,,,,,,,,"NA NA","NA NA","NA NA NA NA NA NA NA NA","https://twitter.com/matteosalvinimi/status/1529213776880230400","Matteo Salvini","","Leader della Lega #primagliitaliani 🇮🇹","https://t.co/sj3rr6DU3N",FALSE,1474904,2008,3135,52992,3826,2011-03-23 10:32:56,TRUE,"https://t.co/sj3rr6DU3N","https://legaonline.it/",,"https://pbs.twimg.com/profile_banners/270839361/1641590097","http://abs.twimg.com/images/themes/theme1/bg.png","http://pbs.twimg.com/profile_images/966325945060732928/0Ua5xPMX_normal.jpg"
"x270839361","x1529195453543227393",2022-05-24 20:19:41,"matteosalvinimi","In pochi minuti puoi ascoltare idee e proposte di imprenditori, professionisti e amministratori raccolte dalla Lega per creare un programma da offrire al Paese.
Ascolta e fammi sapere cosa ne pensi, ogni suggerimento è utile.","Twitter Web App",225,"x1529195405312860160","x270839361","matteosalvinimi",FALSE,FALSE,91,17,,,,,,,,,,,,,,,,,,"it",,,,,,,,,,,,,,,,,,,,,,,,,,,,,,,,,,,,,"NA NA","NA NA","NA NA NA NA NA NA NA NA","https://twitter.com/matteosalvinimi/status/1529195453543227393","Matteo Salvini","","Leader della Lega #primagliitaliani 🇮🇹","https://t.co/sj3rr6DU3N",FALSE,1474904,2008,3135,52992,3826,2011-03-23 10:32:56,TRUE,"https://t.co/sj3rr6DU3N","https://legaonline.it/",,"https://pbs.twimg.com/profile_banners/270839361/1641590097","http://abs.twimg.com/images/themes/theme1/bg.png","http://pbs.twimg.com/profile_images/966325945060732928/0Ua5xPMX_normal.jpg"
"x270839361","x1529195405312860160",2022-05-24 20:19:30,"matteosalvinimi","#èlitaliachevogliamo, Economia, Flat Tax, Pace fiscale, catasto e ripresa economica, questi i temi discussi, a Roma, alla prima tappa del giro di ascolto della Lega che proseguirà regione per regione. https://t.co/zX1wKXflD8","Twitter Media Studio",200,,,,FALSE,FALSE,157,35,,,"èlitaliachevogliamo",,,,,"http://pbs.twimg.com/amplify_video_thumb/1529194086053187584/img/lHsO_jJEFsl_iLq8.jpg","https://t.co/zX1wKXflD8","https://twitter.com/matteosalvinimi/status/1529195405312860160/video/1","photo","http://pbs.twimg.com/amplify_video_thumb/1529194086053187584/img/lHsO_jJEFsl_iLq8.jpg","https://t.co/zX1wKXflD8","https://twitter.com/matteosalvinimi/status/1529195405312860160/video/1",,,,"it",,,,,,,,,,,,,,,,,,,,,,,,,,,,,,,,,,,,,"NA NA","NA NA","NA NA NA NA NA NA NA NA","https://twitter.com/matteosalvinimi/status/1529195405312860160","Matteo Salvini","","Leader della Lega #primagliitaliani 🇮🇹","https://t.co/sj3rr6DU3N",FALSE,1474904,2008,3135,52992,3826,2011-03-23 10:32:56,TRUE,"https://t.co/sj3rr6DU3N","https://legaonline.it/",,"https://pbs.twimg.com/profile_banners/270839361/1641590097","http://abs.twimg.com/images/themes/theme1/bg.png","http://pbs.twimg.com/profile_images/966325945060732928/0Ua5xPMX_normal.jpg"
"x270839361","x1529176106229813253",2022-05-24 19:02:49,"matteosalvinimi","Se il “filantropo” Soros chiede all’Italia di fare qualcosa, la scelta giusta è fare il contrario. https://t.co/mWDJ0nzvNb","Twitter for Android",98,,,,FALSE,FALSE,1383,252,,,,,,,,"http://pbs.twimg.com/media/FTi5kHSXoAAs3w1.jpg","https://t.co/mWDJ0nzvNb","https://twitter.com/matteosalvinimi/status/1529176106229813253/photo/1","photo","http://pbs.twimg.com/media/FTi5kHSXoAAs3w1.jpg","https://t.co/mWDJ0nzvNb","https://twitter.com/matteosalvinimi/status/1529176106229813253/photo/1",,,,"it",,,,,,,,,,,,,,,,,,,,,,,,,,,,,,,,,,,,,"NA NA","NA NA","NA NA NA NA NA NA NA NA","https://twitter.com/matteosalvinimi/status/1529176106229813253","Matteo Salvini","","Leader della Lega #primagliitaliani 🇮🇹","https://t.co/sj3rr6DU3N",FALSE,1474904,2008,3135,52992,3826,2011-03-23 10:32:56,TRUE,"https://t.co/sj3rr6DU3N","https://legaonline.it/",,"https://pbs.twimg.com/profile_banners/270839361/1641590097","http://abs.twimg.com/images/themes/theme1/bg.png","http://pbs.twimg.com/profile_images/966325945060732928/0Ua5xPMX_normal.jpg"
"x48062712","x1529494939612094465",2022-05-25 16:09:44,"luigidimaio","🇮🇹🇩🇪 Incontro del Ministro @luigidimaio con il Presidente della Commissione Affari Esteri @bundestag, Michael Roth.
Al centro dei colloqui:
🔹dialogo parlamentare 🇮🇹🇩🇪
🔹situazione #Ucraina
🔹Allargamento 🇪🇺
🔹Seguiti Conferenza su Futuro dell’Europa #CoFoE https://t.co/PsDTTo8O8e","Twitter for iPhone",140,,,,FALSE,TRUE,0,7,,,,,,,,,,,,,,,,"x599114492 x48062712 x3088296873","ItalyMFA luigidimaio Bundestag","it",,,,,,,,,,,,,,,,"x1529493483911892993","🇮🇹🇩🇪 Incontro del Ministro @luigidimaio con il Presidente della Commissione Affari Esteri @bundestag, Michael Roth.
Al centro dei colloqui:
🔹dialogo parlamentare 🇮🇹🇩🇪
🔹situazione #Ucraina
🔹Allargamento 🇪🇺
🔹Seguiti Conferenza su Futuro dell’Europa #CoFoE https://t.co/PsDTTo8O8e",2022-05-25 16:03:57,"Twitter Web App",25,7,"x599114492","ItalyMFA","Farnesina 🇮🇹",273054,954,16219,"Roma, Italia","Profilo ufficiale del Ministero degli Affari Esteri e della Cooperazione Internazionale | Follow us in other languages at @ItalyMFA_int",TRUE,,,,,,,"NA NA","NA NA","NA NA NA NA NA NA NA NA","https://twitter.com/luigidimaio/status/1529494939612094465","Luigi Di Maio","Pomigliano d'Arco, Campania","Ministro degli Affari Esteri e della Cooperazione Internazionale.","https://t.co/D8gkagqksG",FALSE,769575,339,2229,7099,394,2009-06-17 18:34:46,TRUE,"https://t.co/D8gkagqksG","http://www.luigidimaio.it",,"https://pbs.twimg.com/profile_banners/48062712/1645985183","http://abs.twimg.com/images/themes/theme1/bg.png","http://pbs.twimg.com/profile_images/933106806670462976/YyC7LOW8_normal.jpg"
"x48062712","x1529478714811109376",2022-05-25 15:05:16,"luigidimaio","La notizia del barbaro massacro di 19 bambini di nemmeno dieci anni e dei loro due insegnanti in una scuola elementare del #Texas lascia inorriditi e sconvolti. Condividiamo il profondo dolore delle famiglie e di tutto il popolo americano. A loro oggi va il nostro pensiero.","Twitter for iPhone",274,,,,FALSE,FALSE,84,11,,,"Texas",,,,,,,,,,,,,,,"it",,,,,,,,,,,,,,,,,,,,,,,,,,,,,,,,,,,,,"NA NA","NA NA","NA NA NA NA NA NA NA NA","https://twitter.com/luigidimaio/status/1529478714811109376","Luigi Di Maio","Pomigliano d'Arco, Campania","Ministro degli Affari Esteri e della Cooperazione Internazionale.","https://t.co/D8gkagqksG",FALSE,769575,339,2229,7099,394,2009-06-17 18:34:46,TRUE,"https://t.co/D8gkagqksG","http://www.luigidimaio.it",,"https://pbs.twimg.com/profile_banners/48062712/1645985183","http://abs.twimg.com/images/themes/theme1/bg.png","http://pbs.twimg.com/profile_images/933106806670462976/YyC7LOW8_normal.jpg"
"x997531966571466752","x1529430089879937025",2022-05-25 11:52:03,"Pres_Casellati","Con il Presidente del Parlamento della Nuova Zelanda Trevor Mallard per confrontarci sulle relazioni bilaterali tra i due Paesi e gli sviluppi del conflitto in Ucraina🇮🇹🇳🇿.
@NZParliament @SpeakerMallard
#25maggio #Senato https://t.co/bnbo1z1Izx","Twitter for iPhone",220,,,,FALSE,FALSE,14,9,,,"25maggio Senato",,,,,"http://pbs.twimg.com/ext_tw_video_thumb/1529429969578991620/pu/img/P45mc42elqn_iqEr.jpg","https://t.co/bnbo1z1Izx","https://twitter.com/Pres_Casellati/status/1529430089879937025/video/1","photo","http://pbs.twimg.com/ext_tw_video_thumb/1529429969578991620/pu/img/P45mc42elqn_iqEr.jpg","https://t.co/bnbo1z1Izx","https://twitter.com/Pres_Casellati/status/1529430089879937025/video/1",,"x15470058","NZParliament","it",,,,,,,,,,,,,,,,,,,,,,,,,,,,,,,,,,,,,"NA NA","NA NA","NA NA NA NA NA NA NA NA","https://twitter.com/Pres_Casellati/status/1529430089879937025","Maria Elisabetta Alberti Casellati","Roma, Lazio","Presidente del Senato della Repubblica","https://t.co/4xFh9XyLXO",FALSE,15762,580,114,1258,62,2018-05-18 17:38:48,TRUE,"https://t.co/4xFh9XyLXO","https://www.facebook.com/elisabetta.casellati.7",,"https://pbs.twimg.com/profile_banners/997531966571466752/1526665561","http://abs.twimg.com/images/themes/theme1/bg.png","http://pbs.twimg.com/profile_images/997533290520195072/YmnjBO3X_normal.jpg"
"x1075084718","x1529481665503977472",2022-05-25 15:17:00,"arrigoni_paolo","Von der Leyen a Davos: dallo STOP al gas, al gas per tutti da tutti!!! Progressi del pragmatismo a Bruxelles!","Twitter for Android",109,,,,FALSE,FALSE,37,9,,,,,,,,,,,,,,,,,,"it",,,,,,,,,,,,,,,,,,,,,,,,,,,,,,,,,,,,,"NA NA","NA NA","NA NA NA NA NA NA NA NA","https://twitter.com/arrigoni_paolo/status/1529481665503977472","Paolo Arrigoni","Calolziocorte, Lombardia","Questore del Senato della Repubblica, componente della Commissione Ambiente e del Copasir. Responsabile del Dipartimento Energia della Lega.","https://t.co/M6TePkOvfO",FALSE,4781,187,56,9945,115,2013-01-09 22:36:27,TRUE,"https://t.co/M6TePkOvfO","http://www.senato.it/leg/18/BGT/Schede/Attsen/00029039.htm",,"https://pbs.twimg.com/profile_banners/1075084718/1591968708","http://abs.twimg.com/images/themes/theme1/bg.png","http://pbs.twimg.com/profile_images/3172370357/bec3e4497d64c77f2a93bc9792055992_normal.jpeg"
"x1075084718","x1529462862292344832",2022-05-25 14:02:17,"arrigoni_paolo","Von der Leyen a Davos: dallo STOP al gas, al gas per tutti da tutti!!! Progressi del pragmatismo a Bruxelles! https://t.co/1PTRMArPIU","Twitter for Android",109,,,,FALSE,FALSE,5,4,,,,,,,,"http://pbs.twimg.com/media/FTm-XIvWIAEFoeR.jpg","https://t.co/1PTRMArPIU","https://twitter.com/arrigoni_paolo/status/1529462862292344832/photo/1","photo","http://pbs.twimg.com/media/FTm-XIvWIAEFoeR.jpg","https://t.co/1PTRMArPIU","https://twitter.com/arrigoni_paolo/status/1529462862292344832/photo/1",,,,"it",,,,,,,,,,,,,,,,,,,,,,,,,,,,,,,,,,,,,"NA NA","NA NA","NA NA NA NA NA NA NA NA","https://twitter.com/arrigoni_paolo/status/1529462862292344832","Paolo Arrigoni","Calolziocorte, Lombardia","Questore del Senato della Repubblica, componente della Commissione Ambiente e del Copasir. Responsabile del Dipartimento Energia della Lega.","https://t.co/M6TePkOvfO",FALSE,4781,187,56,9945,115,2013-01-09 22:36:27,TRUE,"https://t.co/M6TePkOvfO","http://www.senato.it/leg/18/BGT/Schede/Attsen/00029039.htm",,"https://pbs.twimg.com/profile_banners/1075084718/1591968708","http://abs.twimg.com/images/themes/theme1/bg.png","http://pbs.twimg.com/profile_images/3172370357/bec3e4497d64c77f2a93bc9792055992_normal.jpeg"
"x101602652","x1529492686713004039",2022-05-25 16:00:47,"augussori","Domani sera si terrà a Lodi un incontro sul tema del Referendum sulla Giustizia organizzato dal comitato promotore per il sì. Io ci sarò!
#ReferendumGiustizia #CambiamolaGiustizia #IoDicoSì https://t.co/GwiOosJL61","Twitter for iPhone",189,,,,FALSE,FALSE,0,0,,,"ReferendumGiustizia CambiamolaGiustizia IoDicoSì",,,,,"http://pbs.twimg.com/media/FTnZfW5WAAA_rWs.jpg","https://t.co/GwiOosJL61","https://twitter.com/augussori/status/1529492686713004039/photo/1","photo","http://pbs.twimg.com/media/FTnZfW5WAAA_rWs.jpg","https://t.co/GwiOosJL61","https://twitter.com/augussori/status/1529492686713004039/photo/1",,,,"it",,,,,,,,,,,,,,,,,,,,,,,,,,,,,,,,,,,,,"NA NA","NA NA","NA NA NA NA NA NA NA NA","https://twitter.com/augussori/status/1529492686713004039","Luigi Augussori","Lodi, Lombardy","Profilo del sen. Luigi Augussori, rappresentante lodigiano nel Senato della Repubblica per il gruppo Lega - Salvini Premier. https://t.co/RVDZN85Ue5","https://t.co/494Lk5LQeR",FALSE,1003,847,18,3532,335,2010-01-03 23:39:00,TRUE,"https://t.co/494Lk5LQeR","http://www.senato.it/leg/18/BGT/Schede/Attsen/00019244.htm",,"https://pbs.twimg.com/profile_banners/101602652/1651901040","http://abs.twimg.com/images/themes/theme1/bg.png","http://pbs.twimg.com/profile_images/1522809403216470016/YjJcca8y_normal.jpg"
"x101602652","x1529355981666545664",2022-05-25 06:57:34,"augussori","🔴Falcone e Borsellino, inaccettabile che la sinistra lodigiana usi la loro immagine per scopi elettorali🔴
👉🏻 https://t.co/BhVGYmpWei https://t.co/8yf3DtUZck","Twitter for iPhone",132,,,,FALSE,FALSE,0,0,,,,,"facebook.com/10005820801238…","https://t.co/BhVGYmpWei","https://www.facebook.com/100058208012388/posts/418975860052678/?d=n","http://pbs.twimg.com/media/FTldKJWXsAM-x05.jpg","https://t.co/8yf3DtUZck","https://twitter.com/augussori/status/1529355981666545664/photo/1","photo","http://pbs.twimg.com/media/FTldKJWXsAM-x05.jpg","https://t.co/8yf3DtUZck","https://twitter.com/augussori/status/1529355981666545664/photo/1",,,,"it",,,,,,,,,,,,,,,,,,,,,,,,,,,,,,,,,,,,,"NA NA","NA NA","NA NA NA NA NA NA NA NA","https://twitter.com/augussori/status/1529355981666545664","Luigi Augussori","Lodi, Lombardy","Profilo del sen. Luigi Augussori, rappresentante lodigiano nel Senato della Repubblica per il gruppo Lega - Salvini Premier. https://t.co/RVDZN85Ue5","https://t.co/494Lk5LQeR",FALSE,1003,847,18,3532,335,2010-01-03 23:39:00,TRUE,"https://t.co/494Lk5LQeR","http://www.senato.it/leg/18/BGT/Schede/Attsen/00019244.htm",,"https://pbs.twimg.com/profile_banners/101602652/1651901040","http://abs.twimg.com/images/themes/theme1/bg.png","http://pbs.twimg.com/profile_images/1522809403216470016/YjJcca8y_normal.jpg"
"x876541483","x1529498086103449602",2022-05-25 16:22:15,"AlbertoBagnai","@Blinky74 Sai dirmi con parole tue gli “scopi per cui si dovrebbe fare politica”? Per motivi anagrafici e professionali sono abituato a non dare nulla per scontato…","Twitter for iPhone",154,"x1529485495163662337","x22901191","Blinky74",FALSE,FALSE,5,0,,,,,,,,,,,,,,,,"x22901191","Blinky74","it",,,,,,,,,,,,,,,,,,,,,,,,,,,,,,,,,,,,,"NA NA","NA NA","NA NA NA NA NA NA NA NA","https://twitter.com/AlbertoBagnai/status/1529498086103449602","Alberto Bagnai","","Professore associato di politica economica all’Università Gabriele d’Annunzio, eletto al Senato per la Lega nel collegio Abruzzo 01.","https://t.co/sC5RvUzmsX",FALSE,134538,666,657,225497,6495,2012-10-12 22:13:36,TRUE,"https://t.co/sC5RvUzmsX","http://www.senato.it/leg/18/BGT/Schede/Attsen/00032582.htm",,"https://pbs.twimg.com/profile_banners/876541483/1535647109","http://abs.twimg.com/images/themes/theme1/bg.png","http://pbs.twimg.com/profile_images/849030859462246401/ATk3_aiW_normal.jpg"
"x876541483","x1529477047701078016",2022-05-25 14:58:39,"AlbertoBagnai","Il declino di #Palermo degli ultimi anni lo si può fermare con nuove energie. 
La Città ha oggi l'occasione di eleggere persone perbene e competenti: Antonio Triolo e Elisabetta Luparello al consiglio comunale, lista PRIMA L'ITALIA
https://t.co/K80bDhG8Bm https://t.co/V4qObx44r6","Twitter for iPhone",139,,,,FALSE,TRUE,0,20,,,"Palermo",,,,,,,,,,,,,"x514949332","AlbertoSamona","it",,,,,,,,,,,,,,,,"x1529466421197127681","Il declino di #Palermo degli ultimi anni lo si può fermare con nuove energie. 
La Città ha oggi l'occasione di eleggere persone perbene e competenti: Antonio Triolo e Elisabetta Luparello al consiglio comunale, lista PRIMA L'ITALIA
https://t.co/K80bDhG8Bm https://t.co/V4qObx44r6",2022-05-25 14:16:25,"Twitter for Android",56,20,"x514949332","AlbertoSamona","Alberto Samonà",1368,316,1344,"","Giornalista. Scrittore. Militante della Lega. Assessore regionale dei Beni Culturali e dell'Identità Siciliana. Cattolico di Rito Greco-Bizantino e uomo libero",FALSE,,,,,,,"NA NA","NA NA","NA NA NA NA NA NA NA NA","https://twitter.com/AlbertoBagnai/status/1529477047701078016","Alberto Bagnai","","Professore associato di politica economica all’Università Gabriele d’Annunzio, eletto al Senato per la Lega nel collegio Abruzzo 01.","https://t.co/sC5RvUzmsX",FALSE,134538,666,657,225497,6495,2012-10-12 22:13:36,TRUE,"https://t.co/sC5RvUzmsX","http://www.senato.it/leg/18/BGT/Schede/Attsen/00032582.htm",,"https://pbs.twimg.com/profile_banners/876541483/1535647109","http://abs.twimg.com/images/themes/theme1/bg.png","http://pbs.twimg.com/profile_images/849030859462246401/ATk3_aiW_normal.jpg"
"x876541483","x1529475490813206528",2022-05-25 14:52:27,"AlbertoBagnai","https://t.co/Rdjw10c0mv","Twitter for iPhone",0,,,,FALSE,FALSE,50,19,,,,,,,,"http://pbs.twimg.com/media/FTnJ2eHXwAAesgn.jpg","https://t.co/Rdjw10c0mv","https://twitter.com/AlbertoBagnai/status/1529475490813206528/photo/1","photo","http://pbs.twimg.com/media/FTnJ2eHXwAAesgn.jpg","https://t.co/Rdjw10c0mv","https://twitter.com/AlbertoBagnai/status/1529475490813206528/photo/1",,,,"und",,,,,,,,,,,,,,,,,,,,,,,,,,,,,,,,,,,,,"NA NA","NA NA","NA NA NA NA NA NA NA NA","https://twitter.com/AlbertoBagnai/status/1529475490813206528","Alberto Bagnai","","Professore associato di politica economica all’Università Gabriele d’Annunzio, eletto al Senato per la Lega nel collegio Abruzzo 01.","https://t.co/sC5RvUzmsX",FALSE,134538,666,657,225497,6495,2012-10-12 22:13:36,TRUE,"https://t.co/sC5RvUzmsX","http://www.senato.it/leg/18/BGT/Schede/Attsen/00032582.htm",,"https://pbs.twimg.com/profile_banners/876541483/1535647109","http://abs.twimg.com/images/themes/theme1/bg.png","http://pbs.twimg.com/profile_images/849030859462246401/ATk3_aiW_normal.jpg"
"x876541483","x1529464716518641665",2022-05-25 14:09:39,"AlbertoBagnai","Venerdì a #Cuneo insieme al Segretario #LegaPiemonte @MolinariRik e al vice presidente della commissione finanze @A_Gusmeroli per sostenere la candidatura a Sindaco di #FrancoCivallero Sindaco... https://t.co/Jc4DGfrEuE","Twitter for iPhone",140,,,,FALSE,TRUE,0,12,,,"Cuneo LegaPiemonte",,,,,,,,,,,,,"x988289097235075072 x529406554","GiorgioBergesio MolinariRik","it",,,,,,,,,,,,,,,,"x1529453576837275650","Venerdì a #Cuneo insieme al Segretario #LegaPiemonte @MolinariRik e al vice presidente della commissione finanze @A_Gusmeroli per sostenere la candidatura a Sindaco di #FrancoCivallero Sindaco... https://t.co/Jc4DGfrEuE",2022-05-25 13:25:23,"Twitter for Android",35,12,"x988289097235075072","GiorgioBergesio","Giorgio Maria Bergesio",916,418,4482,"","Manager aziendale e Senatore #Lega. 
https://t.co/cCG3ZEr6fR",TRUE,,,,,,,"NA NA","NA NA","NA NA NA NA NA NA NA NA","https://twitter.com/AlbertoBagnai/status/1529464716518641665","Alberto Bagnai","","Professore associato di politica economica all’Università Gabriele d’Annunzio, eletto al Senato per la Lega nel collegio Abruzzo 01.","https://t.co/sC5RvUzmsX",FALSE,134538,666,657,225497,6495,2012-10-12 22:13:36,TRUE,"https://t.co/sC5RvUzmsX","http://www.senato.it/leg/18/BGT/Schede/Attsen/00032582.htm",,"https://pbs.twimg.com/profile_banners/876541483/1535647109","http://abs.twimg.com/images/themes/theme1/bg.png","http://pbs.twimg.com/profile_images/849030859462246401/ATk3_aiW_normal.jpg"
"x876541483","x1529463805939527683",2022-05-25 14:06:02,"AlbertoBagnai","#Docenti e #ricercatori rientrati in Italia prima del 2020, online la #circolare dell'Agenzia con le risposte ai dubbi sul regime #agevolato alla luce della Legge di Bilancio 2022  https://t.co/lKFXwkLQLd https://t.co/D3Ts9cnDbP","Twitter for iPhone",140,,,,FALSE,TRUE,0,7,,,"Docenti ricercatori circolare",,,,,,,,,,,,,"x1313749698","Agenzia_Entrate","it",,,,,,,,,,,,,,,,"x1529461208159592452","#Docenti e #ricercatori rientrati in Italia prima del 2020, online la #circolare dell'Agenzia con le risposte ai dubbi sul regime #agevolato alla luce della Legge di Bilancio 2022  https://t.co/lKFXwkLQLd https://t.co/D3Ts9cnDbP",2022-05-25 13:55:42,"Salesforce - Social Studio",16,7,"x1313749698","Agenzia_Entrate","Agenzia Entrate",57885,84,3748,"","Account ufficiale dell’Agenzia delle Entrate",TRUE,,,,,,,"NA NA","NA NA","NA NA NA NA NA NA NA NA","https://twitter.com/AlbertoBagnai/status/1529463805939527683","Alberto Bagnai","","Professore associato di politica economica all’Università Gabriele d’Annunzio, eletto al Senato per la Lega nel collegio Abruzzo 01.","https://t.co/sC5RvUzmsX",FALSE,134538,666,657,225497,6495,2012-10-12 22:13:36,TRUE,"https://t.co/sC5RvUzmsX","http://www.senato.it/leg/18/BGT/Schede/Attsen/00032582.htm",,"https://pbs.twimg.com/profile_banners/876541483/1535647109","http://abs.twimg.com/images/themes/theme1/bg.png","http://pbs.twimg.com/profile_images/849030859462246401/ATk3_aiW_normal.jpg"
"x876541483","x1529463062905880578",2022-05-25 14:03:04,"AlbertoBagnai","Ha avuto contatti con una scimmia nelle ultime 48 ore? #vaiolodellescimmie","Twitter for iPhone",93,,,,FALSE,TRUE,0,113,,,"vaiolodellescimmie",,,,,,,,,,,,,"x3096871079","lefrasidiosho","it",,,,,,,,,,,,,,,,"x1529446547670421505","Ha avuto contatti con una scimmia nelle ultime 48 ore? #vaiolodellescimmie",2022-05-25 12:57:27,"Twitter for Android",433,113,"x3096871079","lefrasidiosho","Le frasi di Osho",538705,598,11999,"Roma, Lazio","Spina nel fianco",FALSE,,,,,,,"NA NA","NA NA","NA NA NA NA NA NA NA NA","https://twitter.com/AlbertoBagnai/status/1529463062905880578","Alberto Bagnai","","Professore associato di politica economica all’Università Gabriele d’Annunzio, eletto al Senato per la Lega nel collegio Abruzzo 01.","https://t.co/sC5RvUzmsX",FALSE,134538,666,657,225497,6495,2012-10-12 22:13:36,TRUE,"https://t.co/sC5RvUzmsX","http://www.senato.it/leg/18/BGT/Schede/Attsen/00032582.htm",,"https://pbs.twimg.com/profile_banners/876541483/1535647109","http://abs.twimg.com/images/themes/theme1/bg.png","http://pbs.twimg.com/profile_images/849030859462246401/ATk3_aiW_normal.jpg"
