"user_id","status_id","created_at","screen_name","text","source","display_text_width","reply_to_status_id","reply_to_user_id","reply_to_screen_name","is_quote","is_retweet","favorite_count","retweet_count","quote_count","reply_count","hashtags","symbols","urls_url","urls_t.co","urls_expanded_url","media_url","media_t.co","media_expanded_url","media_type","ext_media_url","ext_media_t.co","ext_media_expanded_url","ext_media_type","mentions_user_id","mentions_screen_name","lang","quoted_status_id","quoted_text","quoted_created_at","quoted_source","quoted_favorite_count","quoted_retweet_count","quoted_user_id","quoted_screen_name","quoted_name","quoted_followers_count","quoted_friends_count","quoted_statuses_count","quoted_location","quoted_description","quoted_verified","retweet_status_id","retweet_text","retweet_created_at","retweet_source","retweet_favorite_count","retweet_retweet_count","retweet_user_id","retweet_screen_name","retweet_name","retweet_followers_count","retweet_friends_count","retweet_statuses_count","retweet_location","retweet_description","retweet_verified","place_url","place_name","place_full_name","place_type","country","country_code","geo_coords","coords_coords","bbox_coords","status_url","name","location","description","url","protected","followers_count","friends_count","listed_count","statuses_count","favourites_count","account_created_at","verified","profile_url","profile_expanded_url","account_lang","profile_banner_url","profile_background_url","profile_image_url"
"x270839361","x1488117345579159555",2022-01-31 11:49:57,"matteosalvinimi","Vi propongo la mia lettera a @ilgiornale di questa mattina, trovate il testo completo al seguente link 👇
https://t.co/KXqiMgOhBL","Twitter Web App",128,,,,FALSE,FALSE,215,64,,,,,"ilgiornale.it/news/politica/…","https://t.co/KXqiMgOhBL","https://www.ilgiornale.it/news/politica/ora-partito-repubblicano-piano-salvini-2006382.html",,,,,,,,,"x25508589","ilgiornale","it",,,,,,,,,,,,,,,,,,,,,,,,,,,,,,,,,,,,,"NA NA","NA NA","NA NA NA NA NA NA NA NA","https://twitter.com/matteosalvinimi/status/1488117345579159555","Matteo Salvini","","Leader della Lega #primagliitaliani 🇮🇹","https://t.co/sj3rr6DU3N",FALSE,1443554,2019,3097,52492,3841,2011-03-23 10:32:56,TRUE,"https://t.co/sj3rr6DU3N","https://legaonline.it/",,"https://pbs.twimg.com/profile_banners/270839361/1641590097","http://abs.twimg.com/images/themes/theme1/bg.png","http://pbs.twimg.com/profile_images/966325945060732928/0Ua5xPMX_normal.jpg"
"x1075084718","x1488141207041724420",2022-01-31 13:24:46,"arrigoni_paolo","Sia per contenere la stangata bollette, sia per pianificare misure strutturali sul sistema energetico.
Sul fronte edilizio è necessario modificare la norma che ha introdotto la stretta sulla cessione dei crediti. Non si può penalizzare tutta la filiera e paralizzare il settore.","Twitter for Android",278,"x1488140682741100547","x1075084718","arrigoni_paolo",FALSE,FALSE,3,1,,,,,,,,,,,,,,,,,,"it",,,,,,,,,,,,,,,,,,,,,,,,,,,,,,,,,,,,,"NA NA","NA NA","NA NA NA NA NA NA NA NA","https://twitter.com/arrigoni_paolo/status/1488141207041724420","Paolo Arrigoni","Calolziocorte, Lombardia","Questore del Senato della Repubblica, componente della Commissione Ambiente e del Copasir. Responsabile del Dipartimento Energia della Lega.","https://t.co/M6TePkOvfO",FALSE,4703,183,56,9768,110,2013-01-09 22:36:27,TRUE,"https://t.co/M6TePkOvfO","http://www.senato.it/leg/18/BGT/Schede/Attsen/00029039.htm",,"https://pbs.twimg.com/profile_banners/1075084718/1591968708","http://abs.twimg.com/images/themes/theme1/bg.png","http://pbs.twimg.com/profile_images/3172370357/bec3e4497d64c77f2a93bc9792055992_normal.jpeg"
"x1075084718","x1488140682741100547",2022-01-31 13:22:41,"arrigoni_paolo","#CaroEnergia e stretta #CassioneCrediti sono le priorità di Governo e Parlamento per evitare dramma a famiglie e imprese ed il blocco della ripresa.
Il livello dei prezzi di elettricità e gas, l'instabilità dalle tensioni Russia-Ucraina, devono portare a scostamento di bilancio.","Twitter for Android",279,,,,FALSE,FALSE,2,1,,,"CaroEnergia CassioneCrediti",,,,,,,,,,,,,,,"it",,,,,,,,,,,,,,,,,,,,,,,,,,,,,,,,,,,,,"NA NA","NA NA","NA NA NA NA NA NA NA NA","https://twitter.com/arrigoni_paolo/status/1488140682741100547","Paolo Arrigoni","Calolziocorte, Lombardia","Questore del Senato della Repubblica, componente della Commissione Ambiente e del Copasir. Responsabile del Dipartimento Energia della Lega.","https://t.co/M6TePkOvfO",FALSE,4703,183,56,9768,110,2013-01-09 22:36:27,TRUE,"https://t.co/M6TePkOvfO","http://www.senato.it/leg/18/BGT/Schede/Attsen/00029039.htm",,"https://pbs.twimg.com/profile_banners/1075084718/1591968708","http://abs.twimg.com/images/themes/theme1/bg.png","http://pbs.twimg.com/profile_images/3172370357/bec3e4497d64c77f2a93bc9792055992_normal.jpeg"
"x2900717633","x1488069848433319937",2022-01-31 08:41:13,"BrunoAstorre","🇵🇹 Una bella notizia per tutta l’Europa il trionfo di Costa in #Portogallo. Una vittoria ottenuta con la maggioranza assoluta. Rimettiamo la politica al centro del dibattito e riconquistiamo la fiducia dei cittadini.","Twitter for iPhone",216,,,,FALSE,FALSE,17,4,,,"Portogallo",,,,,,,,,,,,,,,"it",,,,,,,,,,,,,,,,,,,,,,,,,,,,,,,,,,,,,"NA NA","NA NA","NA NA NA NA NA NA NA NA","https://twitter.com/BrunoAstorre/status/1488069848433319937","Bruno Astorre","","Senatore del PD. Membro Direzione nazionale PD. Provengo da una scuola che interpreta la politica come strumento, non come fine.","https://t.co/r8sKGpcczb",FALSE,1703,197,35,1995,158,2014-12-01 15:48:11,TRUE,"https://t.co/r8sKGpcczb","http://www.brunoastorre.it",,"https://pbs.twimg.com/profile_banners/2900717633/1546257168","http://abs.twimg.com/images/themes/theme1/bg.png","http://pbs.twimg.com/profile_images/1058727872578371589/FY_KiON0_normal.jpg"
"x101602652","x1488081376385581056",2022-01-31 09:27:02,"augussori","Da ""Il Cittadino"", quotidiano lodigiano, di oggi 31 gennaio
#Lega #LegaSenato #Quirinale #PresidentedellaRepubblica #ElezioneQuirinale #ElezionePresidente https://t.co/37Sjv7pV4c","Twitter for iPhone",154,,,,FALSE,FALSE,0,0,,,"Lega LegaSenato Quirinale PresidentedellaRepubblica ElezioneQuirinale ElezionePresidente",,,,,"http://pbs.twimg.com/media/FKa6HfnX0AAjsbo.jpg","https://t.co/37Sjv7pV4c","https://twitter.com/augussori/status/1488081376385581056/photo/1","photo","http://pbs.twimg.com/media/FKa6HfnX0AAjsbo.jpg","https://t.co/37Sjv7pV4c","https://twitter.com/augussori/status/1488081376385581056/photo/1",,,,"it",,,,,,,,,,,,,,,,,,,,,,,,,,,,,,,,,,,,,"NA NA","NA NA","NA NA NA NA NA NA NA NA","https://twitter.com/augussori/status/1488081376385581056","Luigi Augussori","Lodi, Lombardy","Profilo del sen. Luigi Augussori, rappresentante lodigiano nel Senato della Repubblica per il gruppo Lega - Salvini Premier. https://t.co/RVDZN85Ue5","https://t.co/494Lk5LQeR",FALSE,980,788,17,3333,329,2010-01-03 23:39:00,TRUE,"https://t.co/494Lk5LQeR","http://www.senato.it/leg/18/BGT/Schede/Attsen/00019244.htm",,"https://pbs.twimg.com/profile_banners/101602652/1536334347","http://abs.twimg.com/images/themes/theme1/bg.png","http://pbs.twimg.com/profile_images/1397968025198989317/FpsdhGWL_normal.jpg"
"x101602652","x1487914473495179266",2022-01-30 22:23:49,"augussori","@cristianobosco Come tutte le altre dieci di PO. Stagione spettacolare !!","Twitter for iPhone",57,"x1487914128022941696","x23303699","cristianobosco",FALSE,FALSE,1,0,,,,,,,,,,,,,,,,"x23303699","cristianobosco","it",,,,,,,,,,,,,,,,,,,,,,,,,,,,,,,,,,,,,"NA NA","NA NA","NA NA NA NA NA NA NA NA","https://twitter.com/augussori/status/1487914473495179266","Luigi Augussori","Lodi, Lombardy","Profilo del sen. Luigi Augussori, rappresentante lodigiano nel Senato della Repubblica per il gruppo Lega - Salvini Premier. https://t.co/RVDZN85Ue5","https://t.co/494Lk5LQeR",FALSE,980,788,17,3333,329,2010-01-03 23:39:00,TRUE,"https://t.co/494Lk5LQeR","http://www.senato.it/leg/18/BGT/Schede/Attsen/00019244.htm",,"https://pbs.twimg.com/profile_banners/101602652/1536334347","http://abs.twimg.com/images/themes/theme1/bg.png","http://pbs.twimg.com/profile_images/1397968025198989317/FpsdhGWL_normal.jpg"
"x101602652","x1487913233939898381",2022-01-30 22:18:53,"augussori","@cristianobosco Ehm... fa anche gli INT? 🟠⚫️","Twitter for iPhone",28,"x1487891804267720713","x23303699","cristianobosco",FALSE,FALSE,1,0,,,,,,,,,,,,,,,,"x23303699","cristianobosco","it",,,,,,,,,,,,,,,,,,,,,,,,,,,,,,,,,,,,,"NA NA","NA NA","NA NA NA NA NA NA NA NA","https://twitter.com/augussori/status/1487913233939898381","Luigi Augussori","Lodi, Lombardy","Profilo del sen. Luigi Augussori, rappresentante lodigiano nel Senato della Repubblica per il gruppo Lega - Salvini Premier. https://t.co/RVDZN85Ue5","https://t.co/494Lk5LQeR",FALSE,980,788,17,3333,329,2010-01-03 23:39:00,TRUE,"https://t.co/494Lk5LQeR","http://www.senato.it/leg/18/BGT/Schede/Attsen/00019244.htm",,"https://pbs.twimg.com/profile_banners/101602652/1536334347","http://abs.twimg.com/images/themes/theme1/bg.png","http://pbs.twimg.com/profile_images/1397968025198989317/FpsdhGWL_normal.jpg"
"x876541483","x1488108091983941633",2022-01-31 11:13:11,"AlbertoBagnai","To put things in perspective, può essere utile ricordare da dove siamo partiti… https://t.co/coHXTWYBVx","Twitter for iPhone",79,,,,FALSE,FALSE,200,73,,,,,,,,"http://pbs.twimg.com/media/FKbSa6yXsAYgQVq.jpg","https://t.co/coHXTWYBVx","https://twitter.com/AlbertoBagnai/status/1488108091983941633/photo/1","photo","http://pbs.twimg.com/media/FKbSa6yXsAYgQVq.jpg","https://t.co/coHXTWYBVx","https://twitter.com/AlbertoBagnai/status/1488108091983941633/photo/1",,,,"it",,,,,,,,,,,,,,,,,,,,,,,,,,,,,,,,,,,,,"NA NA","NA NA","NA NA NA NA NA NA NA NA","https://twitter.com/AlbertoBagnai/status/1488108091983941633","Alberto Bagnai","","Professore associato di politica economica all’Università Gabriele d’Annunzio, eletto al Senato per la Lega nel collegio Abruzzo 01.","https://t.co/sC5RvUzmsX",FALSE,131740,666,664,222390,6475,2012-10-12 22:13:36,TRUE,"https://t.co/sC5RvUzmsX","http://www.senato.it/leg/18/BGT/Schede/Attsen/00032582.htm",,"https://pbs.twimg.com/profile_banners/876541483/1535647109","http://abs.twimg.com/images/themes/theme1/bg.png","http://pbs.twimg.com/profile_images/849030859462246401/ATk3_aiW_normal.jpg"
"x876541483","x1488091802733539329",2022-01-31 10:08:27,"AlbertoBagnai","Comincia lo show. https://t.co/jk9uMVhDaF","Twitter for iPhone",62,,,,FALSE,TRUE,0,170,,,,,,,,"http://pbs.twimg.com/media/FKavOwlXEAQPuHl.png","https://t.co/jk9uMVhDaF","https://twitter.com/durezzadelviver/status/1488069441455808514/photo/1","photo","http://pbs.twimg.com/media/FKavOwlXEAQPuHl.png","https://t.co/jk9uMVhDaF","https://twitter.com/durezzadelviver/status/1488069441455808514/photo/1",,"x2341987590","durezzadelviver","pt",,,,,,,,,,,,,,,,"x1488069441455808514","Comincia lo show. https://t.co/jk9uMVhDaF",2022-01-31 08:39:36,"Twitter Web App",361,170,"x2341987590","durezzadelviver","La durezza del vivere 🇬🇷",20888,1806,44067,"Italia","Energia. La sovranità appartiene al popolo. Ogni tanto scrivo su @LaVeritaweb. Telegram: https://t.co/Av0i0ETtvq…",FALSE,,,,,,,"NA NA","NA NA","NA NA NA NA NA NA NA NA","https://twitter.com/AlbertoBagnai/status/1488091802733539329","Alberto Bagnai","","Professore associato di politica economica all’Università Gabriele d’Annunzio, eletto al Senato per la Lega nel collegio Abruzzo 01.","https://t.co/sC5RvUzmsX",FALSE,131740,666,664,222390,6475,2012-10-12 22:13:36,TRUE,"https://t.co/sC5RvUzmsX","http://www.senato.it/leg/18/BGT/Schede/Attsen/00032582.htm",,"https://pbs.twimg.com/profile_banners/876541483/1535647109","http://abs.twimg.com/images/themes/theme1/bg.png","http://pbs.twimg.com/profile_images/849030859462246401/ATk3_aiW_normal.jpg"
"x876541483","x1488091716716580864",2022-01-31 10:08:07,"AlbertoBagnai","Curiosità ... ( cc @AlbertoBagnai  ) https://t.co/Bsfy6tKiG5","Twitter for iPhone",51,,,,FALSE,TRUE,0,20,,,,,,,,,,,,,,,,"x29164255 x876541483","sluchetti AlbertoBagnai","it",,,,,,,,,,,,,,,,"x1488091504367349761","Curiosità ... ( cc @AlbertoBagnai  ) https://t.co/Bsfy6tKiG5",2022-01-31 10:07:16,"Twitter Web App",49,20,"x29164255","sluchetti","Stefano Luchetti",1377,2037,55646,"","Boh ... che vi dico? ""Se sbaglio mi corrìgerete"".
Mi raccomando! Buona educazione sotto i miei tweet. Grazie.",FALSE,,,,,,,"NA NA","NA NA","NA NA NA NA NA NA NA NA","https://twitter.com/AlbertoBagnai/status/1488091716716580864","Alberto Bagnai","","Professore associato di politica economica all’Università Gabriele d’Annunzio, eletto al Senato per la Lega nel collegio Abruzzo 01.","https://t.co/sC5RvUzmsX",FALSE,131740,666,664,222390,6475,2012-10-12 22:13:36,TRUE,"https://t.co/sC5RvUzmsX","http://www.senato.it/leg/18/BGT/Schede/Attsen/00032582.htm",,"https://pbs.twimg.com/profile_banners/876541483/1535647109","http://abs.twimg.com/images/themes/theme1/bg.png","http://pbs.twimg.com/profile_images/849030859462246401/ATk3_aiW_normal.jpg"
"x876541483","x1488091343259844608",2022-01-31 10:06:38,"AlbertoBagnai","Prima dell'elezione presidenziale, @LegaSalvini, @forza_italia e @FratellidItalia hanno presentato, insieme, un emendamento che chiede lo stralcio dalla riforma fiscale della revisione-salasso del catasto.
Su @LaVeritaWeb, @Capezzone ricorda ai 3 partiti questo fondamentale tema. https://t.co/YpxWYbDcpR","Twitter for iPhone",140,,,,FALSE,TRUE,0,66,,,,,,,,,,,,,,,,"x877230271652823040 x13514762 x147543162 x1024976264","gspazianitesta LegaSalvini forza_italia FratellidItalia","it",,,,,,,,,,,,,,,,"x1488080750834499585","Prima dell'elezione presidenziale, @LegaSalvini, @forza_italia e @FratellidItalia hanno presentato, insieme, un emendamento che chiede lo stralcio dalla riforma fiscale della revisione-salasso del catasto.
Su @LaVeritaWeb, @Capezzone ricorda ai 3 partiti questo fondamentale tema. https://t.co/YpxWYbDcpR",2022-01-31 09:24:32,"Twitter Web App",177,66,"x877230271652823040","gspazianitesta","Giorgio Spaziani Testa",4567,1222,11748,"","",FALSE,,,,,,,"NA NA","NA NA","NA NA NA NA NA NA NA NA","https://twitter.com/AlbertoBagnai/status/1488091343259844608","Alberto Bagnai","","Professore associato di politica economica all’Università Gabriele d’Annunzio, eletto al Senato per la Lega nel collegio Abruzzo 01.","https://t.co/sC5RvUzmsX",FALSE,131740,666,664,222390,6475,2012-10-12 22:13:36,TRUE,"https://t.co/sC5RvUzmsX","http://www.senato.it/leg/18/BGT/Schede/Attsen/00032582.htm",,"https://pbs.twimg.com/profile_banners/876541483/1535647109","http://abs.twimg.com/images/themes/theme1/bg.png","http://pbs.twimg.com/profile_images/849030859462246401/ATk3_aiW_normal.jpg"
"x876541483","x1488091309449654273",2022-01-31 10:06:30,"AlbertoBagnai","Qui: https://t.co/W3la6sHwO7 https://t.co/LberMEk6pl","Twitter for iPhone",28,,,,FALSE,FALSE,78,27,,,,,"istat.it/it/files//2022…","https://t.co/W3la6sHwO7","https://www.istat.it/it/files//2022/01/FLASH_21q4.pdf","http://pbs.twimg.com/media/FKbDKEAX0AALmmp.jpg","https://t.co/LberMEk6pl","https://twitter.com/AlbertoBagnai/status/1488091309449654273/photo/1","photo","http://pbs.twimg.com/media/FKbDKEAX0AALmmp.jpg","https://t.co/LberMEk6pl","https://twitter.com/AlbertoBagnai/status/1488091309449654273/photo/1",,,,"und",,,,,,,,,,,,,,,,,,,,,,,,,,,,,,,,,,,,,"NA NA","NA NA","NA NA NA NA NA NA NA NA","https://twitter.com/AlbertoBagnai/status/1488091309449654273","Alberto Bagnai","","Professore associato di politica economica all’Università Gabriele d’Annunzio, eletto al Senato per la Lega nel collegio Abruzzo 01.","https://t.co/sC5RvUzmsX",FALSE,131740,666,664,222390,6475,2012-10-12 22:13:36,TRUE,"https://t.co/sC5RvUzmsX","http://www.senato.it/leg/18/BGT/Schede/Attsen/00032582.htm",,"https://pbs.twimg.com/profile_banners/876541483/1535647109","http://abs.twimg.com/images/themes/theme1/bg.png","http://pbs.twimg.com/profile_images/849030859462246401/ATk3_aiW_normal.jpg"
"x876541483","x1488077925299671045",2022-01-31 09:13:19,"AlbertoBagnai","Si assume la responsabilità per l'accaudato. 
Si scusa per il disagio.
Revoca la sua disposizione.
Bene, quando lascia l'incarico di di direttore sanitario del Galeazzi? https://t.co/IrOb7vByt9","Twitter for iPhone",140,,,,FALSE,TRUE,0,99,,,,,,,,,,,,,,,,"x873992653704220676","Mr_Ozymandias","it",,,,,,,,,,,,,,,,"x1487783935245496322","Si assume la responsabilità per l'accaudato. 
Si scusa per il disagio.
Revoca la sua disposizione.
Bene, quando lascia l'incarico di di direttore sanitario del Galeazzi? https://t.co/IrOb7vByt9",2022-01-30 13:45:06,"Twitter for Android",284,99,"x873992653704220676","Mr_Ozymandias","Ozymandias",5803,1077,57499,"","“Se muore, è biologia, se scoppia, è chimica, se non funziona, è fisica.”",FALSE,,,,,,,"NA NA","NA NA","NA NA NA NA NA NA NA NA","https://twitter.com/AlbertoBagnai/status/1488077925299671045","Alberto Bagnai","","Professore associato di politica economica all’Università Gabriele d’Annunzio, eletto al Senato per la Lega nel collegio Abruzzo 01.","https://t.co/sC5RvUzmsX",FALSE,131740,666,664,222390,6475,2012-10-12 22:13:36,TRUE,"https://t.co/sC5RvUzmsX","http://www.senato.it/leg/18/BGT/Schede/Attsen/00032582.htm",,"https://pbs.twimg.com/profile_banners/876541483/1535647109","http://abs.twimg.com/images/themes/theme1/bg.png","http://pbs.twimg.com/profile_images/849030859462246401/ATk3_aiW_normal.jpg"
"x876541483","x1487892181054590982",2022-01-30 20:55:14,"AlbertoBagnai","Poi si domandano perché i non sierati che si ammalano spesso non vogliono andare negli ospedali (che si sono pagati e strapagati in decine di anni di tasse e magari non l'hanno neppure mai utilizzati). https://t.co/yfeWoFgsrq","Twitter for iPhone",140,,,,FALSE,TRUE,0,140,,,,,,,,,,,,,,,,"x1313965595507986434","MessoraClaudio","it",,,,,,,,,,,,,,,,"x1487418793026633729","Poi si domandano perché i non sierati che si ammalano spesso non vogliono andare negli ospedali (che si sono pagati e strapagati in decine di anni di tasse e magari non l'hanno neppure mai utilizzati). https://t.co/yfeWoFgsrq",2022-01-29 13:34:09,"Twitter for Android",268,140,"x1313965595507986434","MessoraClaudio","Claudio Messora",11634,254,2192,"","Editore di @byoblu. Tutta la storia è nelle librerie: cerca ""Il Disallineato"": https://t.co/rZHKk29eTq",FALSE,,,,,,,"NA NA","NA NA","NA NA NA NA NA NA NA NA","https://twitter.com/AlbertoBagnai/status/1487892181054590982","Alberto Bagnai","","Professore associato di politica economica all’Università Gabriele d’Annunzio, eletto al Senato per la Lega nel collegio Abruzzo 01.","https://t.co/sC5RvUzmsX",FALSE,131740,666,664,222390,6475,2012-10-12 22:13:36,TRUE,"https://t.co/sC5RvUzmsX","http://www.senato.it/leg/18/BGT/Schede/Attsen/00032582.htm",,"https://pbs.twimg.com/profile_banners/876541483/1535647109","http://abs.twimg.com/images/themes/theme1/bg.png","http://pbs.twimg.com/profile_images/849030859462246401/ATk3_aiW_normal.jpg"
"x876541483","x1487891620540338179",2022-01-30 20:53:00,"AlbertoBagnai","Quando domani leggerete il dato della crescita del PIL nel IV trimestre (si prevede un +0,? rispetto al III) ricordatevi di questa tabella.
In soli 3 mesi, lavori conclusi per 6 miliardi e crediti di imposta maturati per 6,7.
Da venerdì tutto questo è stato quasi bloccato. https://t.co/0vQY3ljGu5","Twitter for iPhone",140,,,,FALSE,TRUE,0,126,,,,,,,,,,,,,,,,"x589418956","giuslit","it",,,,,,,,,,,,,,,,"x1487870731019030530","Quando domani leggerete il dato della crescita del PIL nel IV trimestre (si prevede un +0,? rispetto al III) ricordatevi di questa tabella.
In soli 3 mesi, lavori conclusi per 6 miliardi e crediti di imposta maturati per 6,7.
Da venerdì tutto questo è stato quasi bloccato. https://t.co/0vQY3ljGu5",2022-01-30 19:30:00,"Twitter Web App",279,126,"x589418956","giuslit","Ora Basta",26083,879,62631,"Bari, Italy","Commercialista di Bari [cit.]",FALSE,,,,,,,"NA NA","NA NA","NA NA NA NA NA NA NA NA","https://twitter.com/AlbertoBagnai/status/1487891620540338179","Alberto Bagnai","","Professore associato di politica economica all’Università Gabriele d’Annunzio, eletto al Senato per la Lega nel collegio Abruzzo 01.","https://t.co/sC5RvUzmsX",FALSE,131740,666,664,222390,6475,2012-10-12 22:13:36,TRUE,"https://t.co/sC5RvUzmsX","http://www.senato.it/leg/18/BGT/Schede/Attsen/00032582.htm",,"https://pbs.twimg.com/profile_banners/876541483/1535647109","http://abs.twimg.com/images/themes/theme1/bg.png","http://pbs.twimg.com/profile_images/849030859462246401/ATk3_aiW_normal.jpg"
"x876541483","x1487891512264380416",2022-01-30 20:52:34,"AlbertoBagnai","Sisma 2016, Lega: proroga sospensione mutui a privati e imprese in Gazzetta Ufficiale https://t.co/gpj8xXZERR via @ekuonews","Twitter for iPhone",140,,,,FALSE,TRUE,0,21,,,,,"ekuonews.it/30/01/2022/sis…","https://t.co/gpj8xXZERR","https://www.ekuonews.it/30/01/2022/sisma-2016-lega-proroga-sospensione-mutui-a-privati-e-imprese-in-gazzetta-ufficiale/",,,,,,,,,"x1194933747075993600 x1065266253219184640","zennaronews ekuonews","it",,,,,,,,,,,,,,,,"x1487886805642977284","Sisma 2016, Lega: proroga sospensione mutui a privati e imprese in Gazzetta Ufficiale https://t.co/gpj8xXZERR via @ekuonews",2022-01-30 20:33:52,"Twitter for iPhone",60,21,"x1194933747075993600","zennaronews","Antonio Zennaro",1115,681,2380,"","manager settore finanziario, outsider, Deputato Commissione Finanze, (ex Com Bilancio e Copasir), 🇮🇹 Lega - Salvini Premier",FALSE,,,,,,,"NA NA","NA NA","NA NA NA NA NA NA NA NA","https://twitter.com/AlbertoBagnai/status/1487891512264380416","Alberto Bagnai","","Professore associato di politica economica all’Università Gabriele d’Annunzio, eletto al Senato per la Lega nel collegio Abruzzo 01.","https://t.co/sC5RvUzmsX",FALSE,131740,666,664,222390,6475,2012-10-12 22:13:36,TRUE,"https://t.co/sC5RvUzmsX","http://www.senato.it/leg/18/BGT/Schede/Attsen/00032582.htm",,"https://pbs.twimg.com/profile_banners/876541483/1535647109","http://abs.twimg.com/images/themes/theme1/bg.png","http://pbs.twimg.com/profile_images/849030859462246401/ATk3_aiW_normal.jpg"
"x876541483","x1487857455040282628",2022-01-30 18:37:14,"AlbertoBagnai","#Mattarella ha giustamente rimarcato che stiamo nel pieno dell'emergenza sanitaria ed economica...la stessa emergenza che però non esiste più quando si parla di riscossione, tasse e ristori.

https://t.co/dyHJbh0RBZ","Twitter for iPhone",140,,,,FALSE,TRUE,0,150,,,"Mattarella",,,,,,,,,,,,,"x789398693963112448","Mandolesi_Giu","it",,,,,,,,,,,,,,,,"x1487850488662044676","#Mattarella ha giustamente rimarcato che stiamo nel pieno dell'emergenza sanitaria ed economica...la stessa emergenza che però non esiste più quando si parla di riscossione, tasse e ristori.

https://t.co/dyHJbh0RBZ",2022-01-30 18:09:34,"Twitter for Android",438,150,"x789398693963112448","Mandolesi_Giu","Giuliano Mandolesi",2806,1034,10368,"Roma","Romano. Commercialista/Giornalista. Collaboro con @Italiaoggi e @StartMagNews.

Ferro azzurro ama Anacott Acciaio",FALSE,,,,,,,"NA NA","NA NA","NA NA NA NA NA NA NA NA","https://twitter.com/AlbertoBagnai/status/1487857455040282628","Alberto Bagnai","","Professore associato di politica economica all’Università Gabriele d’Annunzio, eletto al Senato per la Lega nel collegio Abruzzo 01.","https://t.co/sC5RvUzmsX",FALSE,131740,666,664,222390,6475,2012-10-12 22:13:36,TRUE,"https://t.co/sC5RvUzmsX","http://www.senato.it/leg/18/BGT/Schede/Attsen/00032582.htm",,"https://pbs.twimg.com/profile_banners/876541483/1535647109","http://abs.twimg.com/images/themes/theme1/bg.png","http://pbs.twimg.com/profile_images/849030859462246401/ATk3_aiW_normal.jpg"
"x876541483","x1487842872464396298",2022-01-30 17:39:18,"AlbertoBagnai","Italy is making life difficult for the unvaccinated. For one holdout, that means flying via Spain to reach a domestic destination. Another, seeking to return to work, chose deliberate infection over a shot. https://t.co/MDtaPTaFd4","Twitter for iPhone",140,,,,FALSE,TRUE,0,1136,,,,,,,,,,,,,,,,"x3108351","WSJ","en",,,,,,,,,,,,,,,,"x1487749953921421313","Italy is making life difficult for the unvaccinated. For one holdout, that means flying via Spain to reach a domestic destination. Another, seeking to return to work, chose deliberate infection over a shot. https://t.co/MDtaPTaFd4",2022-01-30 11:30:04,"SocialFlow",1903,1136,"x3108351","WSJ","The Wall Street Journal",19387845,1047,362508,"New York, NY","Sign up for our newsletters and email alerts: https://t.co/WFU7oLKkip",TRUE,,,,,,,"NA NA","NA NA","NA NA NA NA NA NA NA NA","https://twitter.com/AlbertoBagnai/status/1487842872464396298","Alberto Bagnai","","Professore associato di politica economica all’Università Gabriele d’Annunzio, eletto al Senato per la Lega nel collegio Abruzzo 01.","https://t.co/sC5RvUzmsX",FALSE,131740,666,664,222390,6475,2012-10-12 22:13:36,TRUE,"https://t.co/sC5RvUzmsX","http://www.senato.it/leg/18/BGT/Schede/Attsen/00032582.htm",,"https://pbs.twimg.com/profile_banners/876541483/1535647109","http://abs.twimg.com/images/themes/theme1/bg.png","http://pbs.twimg.com/profile_images/849030859462246401/ATk3_aiW_normal.jpg"
