"x1472157889154400258","x1487795368079286281",2022-01-30 14:30:32,"mismas00","@GiorgiaMeloni @FratellidItalia Contro il paese per lo sfascio.","Twitter for Android",31,"x1487479405026983939","x130537001","GiorgiaMeloni",FALSE,FALSE,0,0,,,,,,,,,,,,,,,,"x130537001 x1024976264","GiorgiaMeloni FratellidItalia","it",,,,,,,,,,,,,,,,,,,,,,,,,,,,,,,,,,,,,"NA NA","NA NA","NA NA NA NA NA NA NA NA","https://twitter.com/mismas00/status/1487795368079286281","Mismas00","","",,FALSE,0,5,0,38,1,2021-12-18 10:53:07,FALSE,,,,,,"http://pbs.twimg.com/profile_images/1472158227898978304/OBH7bPG9_normal.jpg"
"x292474458","x1487847813459365889",2022-01-30 17:58:56,"RaphaelRaduzzi","Vergognosi è dire poco.
Hanno dato il peggio di loro, il tempo di una settimana per decidere cosa? Il nulla. 
#Vergognatevi 

Leggete tutto qui: https://t.co/lE6aBQfwbD https://t.co/eY2sSGpISL","Twitter for Android",140,,,,FALSE,TRUE,0,36,,,,,,,,,,,,,,,,"x1364265902112444418","Alternativa_it","it",,,,,,,,,,,,,,,,"x1487522058942791690","Vergognosi è dire poco.
Hanno dato il peggio di loro, il tempo di una settimana per decidere cosa? Il nulla. 
#Vergognatevi 

Leggete tutto qui: https://t.co/lE6aBQfwbD https://t.co/eY2sSGpISL",2022-01-29 20:24:30,"Twitter for iPhone",118,36,"x1364265902112444418","Alternativa_it","Alternativa",2215,58,419,"Italia","Account ufficiale di Alternativa. Gruppo all’opposizione.",FALSE,,,,,,,"NA NA","NA NA","NA NA NA NA NA NA NA NA","https://twitter.com/RaphaelRaduzzi/status/1487847813459365889","Raphael Raduzzi","Padova","Italian MP 🇮🇹 - Essere libero non è nulla, divenirlo è cosa celeste. @Alternativa_it","https://t.co/7py1uEl32G",FALSE,5602,1160,28,5171,3505,2011-05-03 18:14:43,TRUE,"https://t.co/7py1uEl32G","https://bit.ly/2Z0j5rQ",,"https://pbs.twimg.com/profile_banners/292474458/1486213591","http://abs.twimg.com/images/themes/theme1/bg.png","http://pbs.twimg.com/profile_images/1022152837999079425/097DBrBE_normal.jpg"
"x2149359853","x1487801552437972992",2022-01-30 14:55:06,"RaffaAngela","Alcuni mi consigliano: smetti di scrivere, in questi momenti di delusione meglio non esporsi. Non li ascolterò. Io ci metto la faccia sempre. Troppo comodo farlo solo quando conviene. ‘La dignità fatta di vuoto’ non mi appartiene. Compito di un politico … https://t.co/SG50ewB7fC https://t.co/yKKcatVUgM","IFTTT",279,,,,FALSE,FALSE,60,9,,,,,"instagr.am/p/CZW1CjpNp38/","https://t.co/SG50ewB7fC","https://instagr.am/p/CZW1CjpNp38/","http://pbs.twimg.com/media/FKW7oKeXsAAG6qi.jpg","https://t.co/yKKcatVUgM","https://twitter.com/RaffaAngela/status/1487801552437972992/photo/1","photo","http://pbs.twimg.com/media/FKW7oKeXsAAG6qi.jpg","https://t.co/yKKcatVUgM","https://twitter.com/RaffaAngela/status/1487801552437972992/photo/1",,,,"it",,,,,,,,,,,,,,,,,,,,,,,,,,,,,,,,,,,,,"NA NA","NA NA","NA NA NA NA NA NA NA NA","https://twitter.com/RaffaAngela/status/1487801552437972992","Angela Raffa","Messina, Sicilia","Deputata Movimento 5 Stelle","https://t.co/QVUmXyFvz0",FALSE,1859,863,17,1181,186,2013-10-22 16:44:17,FALSE,"https://t.co/QVUmXyFvz0","http://facebook.com/angelaraffaM5S/",,"https://pbs.twimg.com/profile_banners/2149359853/1615924017","http://abs.twimg.com/images/themes/theme1/bg.png","http://pbs.twimg.com/profile_images/1371910875033001995/1LehpM1a_normal.jpg"
"x939092301091168261","x1488088496694824961",2022-01-31 09:55:19,"GianlucaRospi","@VitoBardi 👏👏 Bene presidente @VitoBardi. Ora al lavoro per rilanciare la biblioteca e il suo importantissimo patrimonio","Twitter for Android",109,"x1487405441231556608","x1374984704550703104","VitoBardi",FALSE,FALSE,1,0,,,,,,,,,,,,,,,,"x1374984704550703104 x1374984704550703104","VitoBardi VitoBardi","it",,,,,,,,,,,,,,,,,,,,,,,,,,,,,,,,,,,,,"NA NA","NA NA","NA NA NA NA NA NA NA NA","https://twitter.com/GianlucaRospi/status/1488088496694824961","Gianluca Rospi","Matera, Basilicata","Ingegnere - Dottore di Ricerca in Architettura, Costruzioni, Strutture - Deputato della Repubblica Italiana - XVIII Legislatura. #PopoloProtagonista",,FALSE,489,430,18,966,213,2017-12-08 11:20:26,FALSE,,,,"https://pbs.twimg.com/profile_banners/939092301091168261/1637253718",,"http://pbs.twimg.com/profile_images/1090010332637155330/18Gsam69_normal.jpg"
"x127025568","x1488111560035819521",2022-01-31 11:26:58,"carlosibilia","È giusto e doveroso aprire un confronto trasparente nel #m5s; vanno dissipati i veleni e chiarite le posizioni. Ricordo a tutti che ci sono emergenze in corso nel Paese ed è necessario lavorare uniti: nel m5s e dentro il campo progressista, seguendo il percorso avviato da Conte.","Twitter for iPhone",279,,,,FALSE,FALSE,28,3,,,"m5s",,,,,,,,,,,,,,,"it",,,,,,,,,,,,,,,,,,,,,,,,,,,,,,,,,,,,,"NA NA","NA NA","NA NA NA NA NA NA NA NA","https://twitter.com/carlosibilia/status/1488111560035819521","Carlo Sibilia","Avellino, Campania","Laureato in Biotecnologie Mediche. Parlamentare da 8 anni. 3 da Sottosegretario al Ministero dell'Interno.","https://t.co/LurVtHtd5m",FALSE,57270,765,353,14387,3422,2010-03-27 20:02:51,TRUE,"https://t.co/LurVtHtd5m","http://www.carlosibilia.it",,"https://pbs.twimg.com/profile_banners/127025568/1633603988","http://abs.twimg.com/images/themes/theme1/bg.png","http://pbs.twimg.com/profile_images/1173917890476761088/b5kY59X5_normal.jpg"
"x127025568","x1487840795180867587",2022-01-30 17:31:02,"carlosibilia","@lefrasidiosho Finaccia se stessimo applaudendo Berlusconi o derivati. Preferisco sempre Mattarella dai 🙏","Twitter for iPhone",90,"x1487835062976622594","x3096871079","lefrasidiosho",FALSE,FALSE,3,0,,,,,,,,,,,,,,,,"x3096871079","lefrasidiosho","it",,,,,,,,,,,,,,,,,,,,,,,,,,,,,,,,,,,,,"NA NA","NA NA","NA NA NA NA NA NA NA NA","https://twitter.com/carlosibilia/status/1487840795180867587","Carlo Sibilia","Avellino, Campania","Laureato in Biotecnologie Mediche. Parlamentare da 8 anni. 3 da Sottosegretario al Ministero dell'Interno.","https://t.co/LurVtHtd5m",FALSE,57270,765,353,14387,3422,2010-03-27 20:02:51,TRUE,"https://t.co/LurVtHtd5m","http://www.carlosibilia.it",,"https://pbs.twimg.com/profile_banners/127025568/1633603988","http://abs.twimg.com/images/themes/theme1/bg.png","http://pbs.twimg.com/profile_images/1173917890476761088/b5kY59X5_normal.jpg"
"x441379961","x1488135253432672264",2022-01-31 13:01:07,"MicSodano","Quando tradisci la tua natura e parcheggi gli ideali e le visioni che devono segnare la tua strada, l'epilogo è certamente disastroso. Ecco cosa è successo al @Mov5Stelle, e non era difficile intuire che l'inizio della fine sarebbe stato proprio il sostegno al Governo #Draghi.","Twitter for Android",277,,,,FALSE,FALSE,8,0,,,"Draghi",,,,,,,,,,,,,"x289400495","Mov5Stelle","it",,,,,,,,,,,,,,,,,,,,,,,,,,,,,,,,,,,,,"NA NA","NA NA","NA NA NA NA NA NA NA NA","https://twitter.com/MicSodano/status/1488135253432672264","Michele Sodano","Roma, Lazio","Deputato della Repubblica Italiana","https://t.co/m8H8ymNcYD",FALSE,3069,140,25,582,202,2011-12-20 01:31:36,TRUE,"https://t.co/m8H8ymNcYD","https://www.camera.it/leg18/29?shadow_deputato=307118&idpersona=307118&idlegislatura=18",,"https://pbs.twimg.com/profile_banners/441379961/1354634455","http://abs.twimg.com/images/themes/theme1/bg.png","http://pbs.twimg.com/profile_images/1025350390068506624/GMOdtX-t_normal.jpg"
"x1376730776","x1488114124752097285",2022-01-31 11:37:09,"mariaederaM5S","Your voice matters in the fight for women's rights. https://t.co/JvECLdhicv","Twitter Web App",89,,,,FALSE,TRUE,0,369,,,,,,,,"http://pbs.twimg.com/media/FKWvVRUXsAAO2BL.jpg","https://t.co/JvECLdhicv","https://twitter.com/UN_Women/status/1487788033315381248/photo/1","photo","http://pbs.twimg.com/media/FKWvVRUXsAAO2BL.jpg","https://t.co/JvECLdhicv","https://twitter.com/UN_Women/status/1487788033315381248/photo/1",,"x17137628","UN_Women","en",,,,,,,,,,,,,,,,"x1487788033315381248","Your voice matters in the fight for women's rights. https://t.co/JvECLdhicv",2022-01-30 14:01:23,"Hootsuite Inc.",1293,369,"x17137628","UN_Women","UN Women",2113726,4339,66637,"Worldwide","UN Women is the United Nations entity for gender equality and women's empowerment.",TRUE,,,,,,,"NA NA","NA NA","NA NA NA NA NA NA NA NA","https://twitter.com/mariaederaM5S/status/1488114124752097285","Maria Edera Spadoni","Reggio nell'Emilia","Vicepresidente M5S Camera dei Deputati. “Se cambiamo strada rispetto a quella seguita da tutti rischiamo di perderci ma vale la pena provare a vedere oltre”.","https://t.co/EFgZ4ksifq",FALSE,14574,493,107,5579,3950,2013-04-24 10:43:51,TRUE,"https://t.co/EFgZ4ksifq","https://www.mariaederaspadoni.it/",,"https://pbs.twimg.com/profile_banners/1376730776/1606387274","http://abs.twimg.com/images/themes/theme19/bg.gif","http://pbs.twimg.com/profile_images/1471479324071149569/mEWcbSDL_normal.jpg"
"x1376730776","x1488114064261791750",2022-01-31 11:36:55,"mariaederaM5S","Last Friday, #W20 Indonesia Secretariat is officially inaugurated! We held a simple celebration by having Tumpeng, Indonesian traditional food to symbolize gratefulness, synergy, and togetherness. https://t.co/EfJijDhZJj","Twitter Web App",140,,,,FALSE,TRUE,0,2,,,"W20",,,,,,,,,,,,,"x940228710522908672","w20org","en",,,,,,,,,,,,,,,,"x1488043480286830592","Last Friday, #W20 Indonesia Secretariat is officially inaugurated! We held a simple celebration by having Tumpeng, Indonesian traditional food to symbolize gratefulness, synergy, and togetherness. https://t.co/EfJijDhZJj",2022-01-31 06:56:26,"Twitter for iPhone",7,2,"x940228710522908672","w20org","W20 Indonesia",12854,74,1995,"Jakarta","The Official Account of Women 20 #W20 Indonesia",FALSE,,,,,,,"NA NA","NA NA","NA NA NA NA NA NA NA NA","https://twitter.com/mariaederaM5S/status/1488114064261791750","Maria Edera Spadoni","Reggio nell'Emilia","Vicepresidente M5S Camera dei Deputati. “Se cambiamo strada rispetto a quella seguita da tutti rischiamo di perderci ma vale la pena provare a vedere oltre”.","https://t.co/EFgZ4ksifq",FALSE,14574,493,107,5579,3950,2013-04-24 10:43:51,TRUE,"https://t.co/EFgZ4ksifq","https://www.mariaederaspadoni.it/",,"https://pbs.twimg.com/profile_banners/1376730776/1606387274","http://abs.twimg.com/images/themes/theme19/bg.gif","http://pbs.twimg.com/profile_images/1471479324071149569/mEWcbSDL_normal.jpg"
"x1376730776","x1488113985677402112",2022-01-31 11:36:36,"mariaederaM5S","Sport teaches
👏 Solidarity
💪 Resilience &amp; confidence
🤼‍♀️Teamwork

#WomenInSport defy gender stereotypes &amp; social norms, make inspiring role models &amp; demonstrate equality. https://t.co/WjijKfI1Il via @UN_Women #GenerationEquality https://t.co/pNUqNKmlQY","Twitter Web App",148,,,,FALSE,TRUE,0,49,,,"WomenInSport",,,,,,,,,,,,,"x14159148","UN","en",,,,,,,,,,,,,,,,"x1488060481675792384","Sport teaches
👏 Solidarity
💪 Resilience &amp; confidence
🤼‍♀️Teamwork

#WomenInSport defy gender stereotypes &amp; social norms, make inspiring role models &amp; demonstrate equality. https://t.co/WjijKfI1Il via @UN_Women #GenerationEquality https://t.co/pNUqNKmlQY",2022-01-31 08:04:00,"TweetDeck",148,49,"x14159148","UN","United Nations",14792407,1198,83231,"New York, NY","Official account of the United Nations. 
For peace, dignity & equality on a healthy planet.",TRUE,,,,,,,"NA NA","NA NA","NA NA NA NA NA NA NA NA","https://twitter.com/mariaederaM5S/status/1488113985677402112","Maria Edera Spadoni","Reggio nell'Emilia","Vicepresidente M5S Camera dei Deputati. “Se cambiamo strada rispetto a quella seguita da tutti rischiamo di perderci ma vale la pena provare a vedere oltre”.","https://t.co/EFgZ4ksifq",FALSE,14574,493,107,5579,3950,2013-04-24 10:43:51,TRUE,"https://t.co/EFgZ4ksifq","https://www.mariaederaspadoni.it/",,"https://pbs.twimg.com/profile_banners/1376730776/1606387274","http://abs.twimg.com/images/themes/theme19/bg.gif","http://pbs.twimg.com/profile_images/1471479324071149569/mEWcbSDL_normal.jpg"
"x1376730776","x1488113969445412871",2022-01-31 11:36:32,"mariaederaM5S","Are you ready for #IWD2022?

The theme for International Women’s Day, 8 March, is “Gender equality today for a sustainable tomorrow.”

🌱👇 Find out more. https://t.co/pG1dAGmL9J","Twitter Web App",140,,,,FALSE,TRUE,0,210,,,"IWD2022",,,,,,,,,,,,,"x17137628","UN_Women","en",,,,,,,,,,,,,,,,"x1485848665696739333","Are you ready for #IWD2022?

The theme for International Women’s Day, 8 March, is “Gender equality today for a sustainable tomorrow.”

🌱👇 Find out more. https://t.co/pG1dAGmL9J",2022-01-25 05:35:02,"Hootsuite Inc.",467,210,"x17137628","UN_Women","UN Women",2113726,4339,66637,"Worldwide","UN Women is the United Nations entity for gender equality and women's empowerment.",TRUE,,,,,,,"NA NA","NA NA","NA NA NA NA NA NA NA NA","https://twitter.com/mariaederaM5S/status/1488113969445412871","Maria Edera Spadoni","Reggio nell'Emilia","Vicepresidente M5S Camera dei Deputati. “Se cambiamo strada rispetto a quella seguita da tutti rischiamo di perderci ma vale la pena provare a vedere oltre”.","https://t.co/EFgZ4ksifq",FALSE,14574,493,107,5579,3950,2013-04-24 10:43:51,TRUE,"https://t.co/EFgZ4ksifq","https://www.mariaederaspadoni.it/",,"https://pbs.twimg.com/profile_banners/1376730776/1606387274","http://abs.twimg.com/images/themes/theme19/bg.gif","http://pbs.twimg.com/profile_images/1471479324071149569/mEWcbSDL_normal.jpg"
"x1376730776","x1488113856400482308",2022-01-31 11:36:05,"mariaederaM5S","Il Ministro @robersperanza ha firmato il decreto che indice la #GiornataNazionale di #educazione e #prevenzione contro la violenza nei confronti degli operatori sanitari e socio-sanitari, il 12 marzo di ogni anno.
Leggi la news 👉 https://t.co/hnyblnbfel https://t.co/SuFouoLZRw","Twitter Web App",140,,,,FALSE,TRUE,0,68,,,"GiornataNazionale educazione prevenzione",,,,,,,,,,,,,"x1904010924 x331005596","MinisteroSalute robersperanza","it",,,,,,,,,,,,,,,,"x1487725759175315457","Il Ministro @robersperanza ha firmato il decreto che indice la #GiornataNazionale di #educazione e #prevenzione contro la violenza nei confronti degli operatori sanitari e socio-sanitari, il 12 marzo di ogni anno.
Leggi la news 👉 https://t.co/hnyblnbfel https://t.co/SuFouoLZRw",2022-01-30 09:53:56,"Twitter Web App",180,68,"x1904010924","MinisteroSalute","Ministero della Salute",291404,234,5071,"","Profilo ufficiale del Ministero della Salute",TRUE,,,,,,,"NA NA","NA NA","NA NA NA NA NA NA NA NA","https://twitter.com/mariaederaM5S/status/1488113856400482308","Maria Edera Spadoni","Reggio nell'Emilia","Vicepresidente M5S Camera dei Deputati. “Se cambiamo strada rispetto a quella seguita da tutti rischiamo di perderci ma vale la pena provare a vedere oltre”.","https://t.co/EFgZ4ksifq",FALSE,14574,493,107,5579,3950,2013-04-24 10:43:51,TRUE,"https://t.co/EFgZ4ksifq","https://www.mariaederaspadoni.it/",,"https://pbs.twimg.com/profile_banners/1376730776/1606387274","http://abs.twimg.com/images/themes/theme19/bg.gif","http://pbs.twimg.com/profile_images/1471479324071149569/mEWcbSDL_normal.jpg"
"x1376730776","x1488113785063755781",2022-01-31 11:35:48,"mariaederaM5S","Le elezioni del #PresidentedellaRepubblica viste da un punto di vista insolito. Quello sui tanti professionisti che in questi giorni hanno raccontato da Montecitorio, con parole e immagini, uno dei riti più importanti della nostra democrazia.

#Quirinale2022 https://t.co/ScGlmWJpw0","Twitter Web App",140,,,,FALSE,TRUE,0,22,,,"PresidentedellaRepubblica",,,,,,,,,,,,,"x2278995820","Montecitorio","it",,,,,,,,,,,,,,,,"x1487739890133569536","Le elezioni del #PresidentedellaRepubblica viste da un punto di vista insolito. Quello sui tanti professionisti che in questi giorni hanno raccontato da Montecitorio, con parole e immagini, uno dei riti più importanti della nostra democrazia.

#Quirinale2022 https://t.co/ScGlmWJpw0",2022-01-30 10:50:05,"Twitter Media Studio",76,22,"x2278995820","Montecitorio","Camera dei deputati",343953,840,24414,"Roma, Italia","Account ufficiale della Camera dei deputati - La democrazia si fa qui - Netiquette: https://t.co/b7xiVxpnPH",TRUE,,,,,,,"NA NA","NA NA","NA NA NA NA NA NA NA NA","https://twitter.com/mariaederaM5S/status/1488113785063755781","Maria Edera Spadoni","Reggio nell'Emilia","Vicepresidente M5S Camera dei Deputati. “Se cambiamo strada rispetto a quella seguita da tutti rischiamo di perderci ma vale la pena provare a vedere oltre”.","https://t.co/EFgZ4ksifq",FALSE,14574,493,107,5579,3950,2013-04-24 10:43:51,TRUE,"https://t.co/EFgZ4ksifq","https://www.mariaederaspadoni.it/",,"https://pbs.twimg.com/profile_banners/1376730776/1606387274","http://abs.twimg.com/images/themes/theme19/bg.gif","http://pbs.twimg.com/profile_images/1471479324071149569/mEWcbSDL_normal.jpg"
"x1376730776","x1488113688770920448",2022-01-31 11:35:25,"mariaederaM5S","🔸 Blog | L'Italia è al 42simo posto nella classifica della #corruzione - Info Data https://t.co/3ne2S0A5Mo https://t.co/2LoeB49fEC","Twitter Web App",140,,,,FALSE,TRUE,0,4,,,"corruzione",,"infodata.ilsole24ore.com/2022/01/30/lit…","https://t.co/3ne2S0A5Mo","https://www.infodata.ilsole24ore.com/2022/01/30/litalia-al-42simo-posto-nella-classifica-della-corruzione/?utm_term=Autofeed&utm_medium=TWSole24Ore&utm_source=Twitter#Echobox=1643540304",,,,,,,,,"x420351046","sole24ore","it",,,,,,,,,,,,,,,,"x1487769038818267137","🔸 Blog | L'Italia è al 42simo posto nella classifica della #corruzione - Info Data https://t.co/3ne2S0A5Mo https://t.co/2LoeB49fEC",2022-01-30 12:45:54,"Echobox",12,4,"x420351046","sole24ore","IlSole24ORE",1617837,784,219942,"","Account ufficiale del Sole 24 ORE https://t.co/q7qoYPrgZ3",TRUE,,,,,,,"NA NA","NA NA","NA NA NA NA NA NA NA NA","https://twitter.com/mariaederaM5S/status/1488113688770920448","Maria Edera Spadoni","Reggio nell'Emilia","Vicepresidente M5S Camera dei Deputati. “Se cambiamo strada rispetto a quella seguita da tutti rischiamo di perderci ma vale la pena provare a vedere oltre”.","https://t.co/EFgZ4ksifq",FALSE,14574,493,107,5579,3950,2013-04-24 10:43:51,TRUE,"https://t.co/EFgZ4ksifq","https://www.mariaederaspadoni.it/",,"https://pbs.twimg.com/profile_banners/1376730776/1606387274","http://abs.twimg.com/images/themes/theme19/bg.gif","http://pbs.twimg.com/profile_images/1471479324071149569/mEWcbSDL_normal.jpg"
"x1376730776","x1488113309215768578",2022-01-31 11:33:55,"mariaederaM5S","La settimana prossima (1-2 febbraio) al Parlamento europeo si terranno una serie di eventi nell'ambito delle ""Giornate delle donne afghane""  finaliste del Premio Sacharov nel 2021.

Info⤵️
https://t.co/8KkKqXbYyd","Twitter Web App",140,,,,FALSE,TRUE,0,3,,,,,,,,,,,,,,,,"x37621971","Europarl_IT","it",,,,,,,,,,,,,,,,"x1487787686068985857","La settimana prossima (1-2 febbraio) al Parlamento europeo si terranno una serie di eventi nell'ambito delle ""Giornate delle donne afghane""  finaliste del Premio Sacharov nel 2021.

Info⤵️
https://t.co/8KkKqXbYyd",2022-01-30 14:00:00,"Twitter for Advertisers",8,3,"x37621971","Europarl_IT","Parlamento europeo",215905,23037,13883,"Brussels, Belgium","Segui le ultime notizie del Parlamento europeo. Account gestito dalla squadra web del PE. 
Partecipa: https://t.co/5KRxmLCv4i",TRUE,,,,,,,"NA NA","NA NA","NA NA NA NA NA NA NA NA","https://twitter.com/mariaederaM5S/status/1488113309215768578","Maria Edera Spadoni","Reggio nell'Emilia","Vicepresidente M5S Camera dei Deputati. “Se cambiamo strada rispetto a quella seguita da tutti rischiamo di perderci ma vale la pena provare a vedere oltre”.","https://t.co/EFgZ4ksifq",FALSE,14574,493,107,5579,3950,2013-04-24 10:43:51,TRUE,"https://t.co/EFgZ4ksifq","https://www.mariaederaspadoni.it/",,"https://pbs.twimg.com/profile_banners/1376730776/1606387274","http://abs.twimg.com/images/themes/theme19/bg.gif","http://pbs.twimg.com/profile_images/1471479324071149569/mEWcbSDL_normal.jpg"
"x1376730776","x1488113231944114180",2022-01-31 11:33:36,"mariaederaM5S","Firmato il #18gennaio scorso il Memorandum d’Intesa #NoWomenNoPanel ""Senza donne non se ne parla"" per vincere l’abitudine e proporre modelli nuovi, per rendere i media protagonisti di una rappresentazione di genere equilibrata.
@cnel_it @comuni_anci @elenabonetti @regioni_it https://t.co/ZSeFgwOAsO","Twitter Web App",140,,,,FALSE,TRUE,0,3,,,"18gennaio NoWomenNoPanel",,,,,,,,,,,,,"x1969148101","RaiperilSociale","it",,,,,,,,,,,,,,,,"x1487844350721773578","Firmato il #18gennaio scorso il Memorandum d’Intesa #NoWomenNoPanel ""Senza donne non se ne parla"" per vincere l’abitudine e proporre modelli nuovi, per rendere i media protagonisti di una rappresentazione di genere equilibrata.
@cnel_it @comuni_anci @elenabonetti @regioni_it https://t.co/ZSeFgwOAsO",2022-01-30 17:45:10,"PostPickr",6,3,"x1969148101","RaiperilSociale","Rai per il Sociale",48925,990,181044,"","Account ufficiale Rai per il Sociale
Seguici anche su Facebook e Instagram",FALSE,,,,,,,"NA NA","NA NA","NA NA NA NA NA NA NA NA","https://twitter.com/mariaederaM5S/status/1488113231944114180","Maria Edera Spadoni","Reggio nell'Emilia","Vicepresidente M5S Camera dei Deputati. “Se cambiamo strada rispetto a quella seguita da tutti rischiamo di perderci ma vale la pena provare a vedere oltre”.","https://t.co/EFgZ4ksifq",FALSE,14574,493,107,5579,3950,2013-04-24 10:43:51,TRUE,"https://t.co/EFgZ4ksifq","https://www.mariaederaspadoni.it/",,"https://pbs.twimg.com/profile_banners/1376730776/1606387274","http://abs.twimg.com/images/themes/theme19/bg.gif","http://pbs.twimg.com/profile_images/1471479324071149569/mEWcbSDL_normal.jpg"
"x337171830","x1488096176255741953",2022-01-31 10:25:50,"AngeloTofalo","#Quirinale2022: È sempre tutta colpa dei #Servizi!

Una mia riflessione… https://t.co/QJl4p7SN2E

#ServiziSegreti https://t.co/kSEE8u55XS","Twitter for iPhone",113,,,,FALSE,FALSE,1,1,,,"Quirinale2022 Servizi ServiziSegreti",,"angelotofalo.com/e-sempre-tutta…","https://t.co/QJl4p7SN2E","https://www.angelotofalo.com/e-sempre-tutta-colpa-dei-servizi-segreti/","http://pbs.twimg.com/media/FKbHlWJWQAQB9yE.jpg","https://t.co/kSEE8u55XS","https://twitter.com/AngeloTofalo/status/1488096176255741953/photo/1","photo","http://pbs.twimg.com/media/FKbHlWJWQAQB9yE.jpg","https://t.co/kSEE8u55XS","https://twitter.com/AngeloTofalo/status/1488096176255741953/photo/1",,,,"it",,,,,,,,,,,,,,,,,,,,,,,,,,,,,,,,,,,,,"NA NA","NA NA","NA NA NA NA NA NA NA NA","https://twitter.com/AngeloTofalo/status/1488096176255741953","Angelo Tofalo","Salerno, Pellezzano, Campania","Ingegnere, deputato della Repubblica, già Sottosegretario di Stato alla Difesa 🇮🇹 Rapito dall’Intelligence per diffondere la cultura della Sicurezza","https://t.co/4xUgrx6rHJ",FALSE,38014,4963,359,37865,16733,2011-07-17 15:43:34,TRUE,"https://t.co/4xUgrx6rHJ","http://www.angelotofalo.com",,"https://pbs.twimg.com/profile_banners/337171830/1613207709","http://abs.twimg.com/images/themes/theme1/bg.png","http://pbs.twimg.com/profile_images/1035471039734718464/UIb1-oK3_normal.jpg"
"x337171830","x1487849003844841473",2022-01-30 18:03:40,"AngeloTofalo","#Covid bimba 6 mesi in attesa trapianto midollo trasportata in bio contenimento Lecce-Brescia con #C130J dell’#AeronauticaMilitare. La bimba e la mamma, entrambe positive, hanno viaggiato in una speciale barella isolata assistite da team medico biocontenimento della Forza Armata https://t.co/WLv9hx6wMY","Twitter for iPhone",140,,,,FALSE,TRUE,0,31,,,"Covid C130J",,,,,,,,,,,,,"x1280597143","ItalianAirForce","it",,,,,,,,,,,,,,,,"x1487814724209283073","#Covid bimba 6 mesi in attesa trapianto midollo trasportata in bio contenimento Lecce-Brescia con #C130J dell’#AeronauticaMilitare. La bimba e la mamma, entrambe positive, hanno viaggiato in una speciale barella isolata assistite da team medico biocontenimento della Forza Armata https://t.co/WLv9hx6wMY",2022-01-30 15:47:27,"Twitter for iPad",144,31,"x1280597143","ItalianAirForce","Aeronautica Militare",110206,430,28153,"","La Difesa Aerea è la missione principale dell'Aeronautica Militare.365 giorni l'anno,24 ore su 24, i velivoli caccia sono pronti al decollo #latuasquadrachevola",TRUE,,,,,,,"NA NA","NA NA","NA NA NA NA NA NA NA NA","https://twitter.com/AngeloTofalo/status/1487849003844841473","Angelo Tofalo","Salerno, Pellezzano, Campania","Ingegnere, deputato della Repubblica, già Sottosegretario di Stato alla Difesa 🇮🇹 Rapito dall’Intelligence per diffondere la cultura della Sicurezza","https://t.co/4xUgrx6rHJ",FALSE,38014,4963,359,37865,16733,2011-07-17 15:43:34,TRUE,"https://t.co/4xUgrx6rHJ","http://www.angelotofalo.com",,"https://pbs.twimg.com/profile_banners/337171830/1613207709","http://abs.twimg.com/images/themes/theme1/bg.png","http://pbs.twimg.com/profile_images/1035471039734718464/UIb1-oK3_normal.jpg"
