"x33501253","x1477603196189224961",2022-01-02 11:30:29,"guglielmopicchi","@kiccir è una notizia del 2019...di cui non si è mai parlato","Twitter Web App",52,"x1477601926678257665","x895673763588521988","kiccir",FALSE,FALSE,0,0,,,,,,,,,,,,,,,,"x895673763588521988","kiccir","it",,,,,,,,,,,,,,,,,,,,,,,,,,,,,,,,,,,,,"NA NA","NA NA","NA NA NA NA NA NA NA NA","https://twitter.com/guglielmopicchi/status/1477603196189224961","Guglielmo Picchi 🇮🇹","Firenze, London, Roma, Berlin","MP Lega. Florentine living in London, investment banker, former Deputy Minister of foreign affairs, Bocconi MBA, in search of Börte in Khiva.","https://t.co/otOdeTTpDm",FALSE,10401,1388,101,25865,8372,2009-04-20 12:52:06,TRUE,"https://t.co/otOdeTTpDm","https://www.camera.it/leg18/29?shadow_deputato=301500&idpersona=301500&idlegislatura=18",,"https://pbs.twimg.com/profile_banners/33501253/1622802151","http://abs.twimg.com/images/themes/theme19/bg.gif","http://pbs.twimg.com/profile_images/1354458698291286016/rYEQ7kiU_normal.jpg"
"x33501253","x1477601611979673601",2022-01-02 11:24:11,"guglielmopicchi","Purtroppo caro @EugenioGiani il caos tamponi di cui sono vittime i Toscani è solo colpa di chi governa ovvero tua di Bezzini e del PD. #caostamponitoscana https://t.co/ZiO5i7m3Ez","Twitter Web App",154,,,,FALSE,FALSE,10,3,,,"caostamponitoscana",,,,,"http://pbs.twimg.com/media/FIF-glYX0AEX6yl.jpg","https://t.co/ZiO5i7m3Ez","https://twitter.com/guglielmopicchi/status/1477601611979673601/photo/1","photo","http://pbs.twimg.com/media/FIF-glYX0AEX6yl.jpg","https://t.co/ZiO5i7m3Ez","https://twitter.com/guglielmopicchi/status/1477601611979673601/photo/1",,"x926031224","EugenioGiani","it",,,,,,,,,,,,,,,,,,,,,,,,,,,,,,,,,,,,,"NA NA","NA NA","NA NA NA NA NA NA NA NA","https://twitter.com/guglielmopicchi/status/1477601611979673601","Guglielmo Picchi 🇮🇹","Firenze, London, Roma, Berlin","MP Lega. Florentine living in London, investment banker, former Deputy Minister of foreign affairs, Bocconi MBA, in search of Börte in Khiva.","https://t.co/otOdeTTpDm",FALSE,10401,1388,101,25865,8372,2009-04-20 12:52:06,TRUE,"https://t.co/otOdeTTpDm","https://www.camera.it/leg18/29?shadow_deputato=301500&idpersona=301500&idlegislatura=18",,"https://pbs.twimg.com/profile_banners/33501253/1622802151","http://abs.twimg.com/images/themes/theme19/bg.gif","http://pbs.twimg.com/profile_images/1354458698291286016/rYEQ7kiU_normal.jpg"
"x33501253","x1477600890467069953",2022-01-02 11:21:19,"guglielmopicchi","La maternità surrogata è una violenza a danno di donne e bambini: come promesso, è pronta una mozione della Lega per chiedere al governo di impegnarsi per contrastare questa pratica, considerandola un vero reato da perseguire anche se commesso all’estero da cittadini italiani.","Twitter Web App",140,,,,FALSE,TRUE,0,109,,,,,,,,,,,,,,,,"x270839361","matteosalvinimi","it",,,,,,,,,,,,,,,,"x1477595143528194048","La maternità surrogata è una violenza a danno di donne e bambini: come promesso, è pronta una mozione della Lega per chiedere al governo di impegnarsi per contrastare questa pratica, considerandola un vero reato da perseguire anche se commesso all’estero da cittadini italiani.",2022-01-02 10:58:29,"Twitter Web App",799,109,"x270839361","matteosalvinimi","Matteo Salvini",1434272,2025,52373,"","Leader della Lega #primagliitaliani 🇮🇹",TRUE,,,,,,,"NA NA","NA NA","NA NA NA NA NA NA NA NA","https://twitter.com/guglielmopicchi/status/1477600890467069953","Guglielmo Picchi 🇮🇹","Firenze, London, Roma, Berlin","MP Lega. Florentine living in London, investment banker, former Deputy Minister of foreign affairs, Bocconi MBA, in search of Börte in Khiva.","https://t.co/otOdeTTpDm",FALSE,10401,1388,101,25865,8372,2009-04-20 12:52:06,TRUE,"https://t.co/otOdeTTpDm","https://www.camera.it/leg18/29?shadow_deputato=301500&idpersona=301500&idlegislatura=18",,"https://pbs.twimg.com/profile_banners/33501253/1622802151","http://abs.twimg.com/images/themes/theme19/bg.gif","http://pbs.twimg.com/profile_images/1354458698291286016/rYEQ7kiU_normal.jpg"
"x33501253","x1477600752218562560",2022-01-02 11:20:46,"guglielmopicchi","Today, Poland takes over the one-year chairmanship of the @OSCE with 🇵🇱 FM @RauZbigniew acting as Chairperson-in-Office.

👉 Follow @PLinOSCE to keep up to date with all the latest news from #OSCE2022POL.

Thank you 🇸🇪 @SweMFA for all your work over the past year! #OSCE2021SWE https://t.co/n83ebSXAYU","Twitter Web App",139,,,,FALSE,TRUE,0,46,,,,,,,,,,,,,,,,"x81055599 x20226248 x1156897065852657664","PolandMFA OSCE RauZbigniew","en",,,,,,,,,,,,,,,,"x1477188166557839361","Today, Poland takes over the one-year chairmanship of the @OSCE with 🇵🇱 FM @RauZbigniew acting as Chairperson-in-Office.

👉 Follow @PLinOSCE to keep up to date with all the latest news from #OSCE2022POL.

Thank you 🇸🇪 @SweMFA for all your work over the past year! #OSCE2021SWE https://t.co/n83ebSXAYU",2022-01-01 08:01:18,"Twitter Web App",78,46,"x81055599","PolandMFA","Ministry of Foreign Affairs 🇵🇱",55959,503,25575,"Warsaw, Poland","Ministry of Foreign Affairs of the Republic of Poland 🇵🇱 Polska dyplomacja: @MSZ_RP",TRUE,,,,,,,"NA NA","NA NA","NA NA NA NA NA NA NA NA","https://twitter.com/guglielmopicchi/status/1477600752218562560","Guglielmo Picchi 🇮🇹","Firenze, London, Roma, Berlin","MP Lega. Florentine living in London, investment banker, former Deputy Minister of foreign affairs, Bocconi MBA, in search of Börte in Khiva.","https://t.co/otOdeTTpDm",FALSE,10401,1388,101,25865,8372,2009-04-20 12:52:06,TRUE,"https://t.co/otOdeTTpDm","https://www.camera.it/leg18/29?shadow_deputato=301500&idpersona=301500&idlegislatura=18",,"https://pbs.twimg.com/profile_banners/33501253/1622802151","http://abs.twimg.com/images/themes/theme19/bg.gif","http://pbs.twimg.com/profile_images/1354458698291286016/rYEQ7kiU_normal.jpg"
"x33501253","x1477600721319120900",2022-01-02 11:20:39,"guglielmopicchi","Today Poland 🇵🇱  takes over as OSCE Chair for 2022. Read what @RauZbigniew says about their plans and priorities for the coming year👇 
https://t.co/GBeQZmjjov
#OSCE2022POL @PLinOSCE @PolandMFA","Twitter Web App",140,,,,FALSE,TRUE,0,106,,,,,,,,,,,,,,,,"x20226248 x1156897065852657664","OSCE RauZbigniew","en",,,,,,,,,,,,,,,,"x1477191764674899970","Today Poland 🇵🇱  takes over as OSCE Chair for 2022. Read what @RauZbigniew says about their plans and priorities for the coming year👇 
https://t.co/GBeQZmjjov
#OSCE2022POL @PLinOSCE @PolandMFA",2022-01-01 08:15:36,"Emplifi",220,106,"x20226248","OSCE","OSCE",134228,937,12793,"Vienna, Austria","The Organization for Security and Co-operation in Europe is the world's largest regional security organization. RT ≠ endorsement. In Russian: @osce_ru",TRUE,,,,,,,"NA NA","NA NA","NA NA NA NA NA NA NA NA","https://twitter.com/guglielmopicchi/status/1477600721319120900","Guglielmo Picchi 🇮🇹","Firenze, London, Roma, Berlin","MP Lega. Florentine living in London, investment banker, former Deputy Minister of foreign affairs, Bocconi MBA, in search of Börte in Khiva.","https://t.co/otOdeTTpDm",FALSE,10401,1388,101,25865,8372,2009-04-20 12:52:06,TRUE,"https://t.co/otOdeTTpDm","https://www.camera.it/leg18/29?shadow_deputato=301500&idpersona=301500&idlegislatura=18",,"https://pbs.twimg.com/profile_banners/33501253/1622802151","http://abs.twimg.com/images/themes/theme19/bg.gif","http://pbs.twimg.com/profile_images/1354458698291286016/rYEQ7kiU_normal.jpg"
"x33501253","x1477600437885095941",2022-01-02 11:19:31,"guglielmopicchi","Lo sapevate?
As for Italy’s Commission nominee, three people in Rome and Brussels who are involved in the discussion said that the League’s main candidate is Guglielmo Picchi, a foreign ministry undersecretary with close ties to the U.S. Republican Party. https://t.co/11RIbrZhJK","Twitter Web App",279,,,,FALSE,FALSE,10,0,,,,,"politico.eu/article/italy-…","https://t.co/11RIbrZhJK","https://www.politico.eu/article/italy-struggles-eu-isolation-league-5stars/",,,,,,,,,,,"en",,,,,,,,,,,,,,,,,,,,,,,,,,,,,,,,,,,,,"NA NA","NA NA","NA NA NA NA NA NA NA NA","https://twitter.com/guglielmopicchi/status/1477600437885095941","Guglielmo Picchi 🇮🇹","Firenze, London, Roma, Berlin","MP Lega. Florentine living in London, investment banker, former Deputy Minister of foreign affairs, Bocconi MBA, in search of Börte in Khiva.","https://t.co/otOdeTTpDm",FALSE,10401,1388,101,25865,8372,2009-04-20 12:52:06,TRUE,"https://t.co/otOdeTTpDm","https://www.camera.it/leg18/29?shadow_deputato=301500&idpersona=301500&idlegislatura=18",,"https://pbs.twimg.com/profile_banners/33501253/1622802151","http://abs.twimg.com/images/themes/theme19/bg.gif","http://pbs.twimg.com/profile_images/1354458698291286016/rYEQ7kiU_normal.jpg"
"x33501253","x1477581937019654144",2022-01-02 10:06:00,"guglielmopicchi","In questi lunghi giorni purtroppo leggo anche i giornali. così tanta immondizia nemmeno per le strade di Roma. Anche se stragrande maggioranza dei giornalisti sono di qualità poi queste non le applicano quando scrivono di politica e pandemia.","Twitter for Android",242,,,,FALSE,FALSE,11,2,,,,,,,,,,,,,,,,,,"it",,,,,,,,,,,,,,,,,,,,,,,,,,,,,,,,,,,,,"NA NA","NA NA","NA NA NA NA NA NA NA NA","https://twitter.com/guglielmopicchi/status/1477581937019654144","Guglielmo Picchi 🇮🇹","Firenze, London, Roma, Berlin","MP Lega. Florentine living in London, investment banker, former Deputy Minister of foreign affairs, Bocconi MBA, in search of Börte in Khiva.","https://t.co/otOdeTTpDm",FALSE,10401,1388,101,25865,8372,2009-04-20 12:52:06,TRUE,"https://t.co/otOdeTTpDm","https://www.camera.it/leg18/29?shadow_deputato=301500&idpersona=301500&idlegislatura=18",,"https://pbs.twimg.com/profile_banners/33501253/1622802151","http://abs.twimg.com/images/themes/theme19/bg.gif","http://pbs.twimg.com/profile_images/1354458698291286016/rYEQ7kiU_normal.jpg"
"x33501253","x1477576559645138946",2022-01-02 09:44:38,"guglielmopicchi","The Virgin and Child with St. Anne, 1519 #leonardodavinci #highrenaissance https://t.co/IQO0gfOSr4","Twitter for Android",117,,,,FALSE,TRUE,0,17,,,"leonardodavinci highrenaissance",,,,,"http://pbs.twimg.com/media/FIFGvkrXMAwDaOR.jpg","https://t.co/IQO0gfOSr4","https://twitter.com/ArtistDaVinci/status/1477539937700429826/photo/1","photo","http://pbs.twimg.com/media/FIFGvkrXMAwDaOR.jpg","https://t.co/IQO0gfOSr4","https://twitter.com/ArtistDaVinci/status/1477539937700429826/photo/1",,"x812847929321025536","ArtistDaVinci","en",,,,,,,,,,,,,,,,"x1477539937700429826","The Virgin and Child with St. Anne, 1519 #leonardodavinci #highrenaissance https://t.co/IQO0gfOSr4",2022-01-02 07:19:07,"Off The Easel Bots",82,17,"x812847929321025536","ArtistDaVinci","Leonardo da Vinci",22181,281,19096,"(World) Florence, Italy","Fan account of Leonardo da Vinci. He is considered one of the greatest painters of all time and epitomized the Renaissance humanist ideal. #artbot by @andreitr",FALSE,,,,,,,"NA NA","NA NA","NA NA NA NA NA NA NA NA","https://twitter.com/guglielmopicchi/status/1477576559645138946","Guglielmo Picchi 🇮🇹","Firenze, London, Roma, Berlin","MP Lega. Florentine living in London, investment banker, former Deputy Minister of foreign affairs, Bocconi MBA, in search of Börte in Khiva.","https://t.co/otOdeTTpDm",FALSE,10401,1388,101,25865,8372,2009-04-20 12:52:06,TRUE,"https://t.co/otOdeTTpDm","https://www.camera.it/leg18/29?shadow_deputato=301500&idpersona=301500&idlegislatura=18",,"https://pbs.twimg.com/profile_banners/33501253/1622802151","http://abs.twimg.com/images/themes/theme19/bg.gif","http://pbs.twimg.com/profile_images/1354458698291286016/rYEQ7kiU_normal.jpg"
"x61160450","x1477673171549577227",2022-01-02 16:08:32,"edorixi","👏👏👏 https://t.co/MWnmE7n2GY","Twitter for iPhone",3,,,,FALSE,FALSE,7,3,,,,,,,,"http://pbs.twimg.com/media/FIG_6p9WQAEGaxO.jpg","https://t.co/MWnmE7n2GY","https://twitter.com/edorixi/status/1477673171549577227/photo/1","photo","http://pbs.twimg.com/media/FIG_6p9WQAEGaxO.jpg","https://t.co/MWnmE7n2GY","https://twitter.com/edorixi/status/1477673171549577227/photo/1",,,,"und",,,,,,,,,,,,,,,,,,,,,,,,,,,,,,,,,,,,,"NA NA","NA NA","NA NA NA NA NA NA NA NA","https://twitter.com/edorixi/status/1477673171549577227","Edoardo Rixi","Genova","🇮🇹 Deputato Lega Salvini Premier.       🏴󠁧󠁢󠁥󠁮󠁧󠁿 Segretario Lega Salvini premier Liguria.      Responsabile Trasporti e Infrastrutture della Lega",,FALSE,8806,7218,66,10926,908,2009-07-29 09:59:50,FALSE,,,,"https://pbs.twimg.com/profile_banners/61160450/1635194502","http://abs.twimg.com/images/themes/theme4/bg.gif","http://pbs.twimg.com/profile_images/1374091879428591624/940HDyEj_normal.jpg"
"x520451294","x1477631665304485892",2022-01-02 13:23:36,"roxsasso","Aeratori, mascherine Ffp2, tracciamento a #scuola. 
La risposta non può essere quella di sacrificare il diritto all'istruzione di 3.500.000 di bambini 5-11 relegandoli in dad se non vaccinati. 
Su questo siamo pronti a far sentire forte la nostra voce.

https://t.co/w7PemZ3XlL","Twitter for Android",277,,,,FALSE,FALSE,208,69,,,"scuola",,"ansa.it/sito/notizie/t…","https://t.co/w7PemZ3XlL","https://www.ansa.it/sito/notizie/topnews/2022/01/02/scuola-sasso-sia-in-presenza-o-ci-faremo-sentire_f658e9e9-d3db-434d-a508-2fb691ada6cc.html",,,,,,,,,,,"it",,,,,,,,,,,,,,,,,,,,,,,,,,,,,,,,,,,,,"NA NA","NA NA","NA NA NA NA NA NA NA NA","https://twitter.com/roxsasso/status/1477631665304485892","Rossano Sasso","Bari","Padre ed insegnante.
Deputato XVIII Legislatura, dal 1°Marzo 2021 Sottosegretario all'Istruzione.
Mi batto per una scuola migliore.","https://t.co/5FoBZihYVP",FALSE,2084,34,25,1244,492,2012-03-10 14:42:33,FALSE,"https://t.co/5FoBZihYVP","https://www.camera.it/leg18/29?tipoAttivita=attivita&tipoVisAtt=&tipoPersona=&shadow_deputato=307360",,"https://pbs.twimg.com/profile_banners/520451294/1613915174","http://abs.twimg.com/images/themes/theme1/bg.png","http://pbs.twimg.com/profile_images/1437088260065570818/OQpJHgX-_normal.jpg"
"x924585253783695360","x1477606032205619202",2022-01-02 11:41:45,"GianlucaVinci80","https://t.co/OTPYZ3cMJH","Twitter for iPhone",0,,,,FALSE,FALSE,11,5,,,,,,,,"http://pbs.twimg.com/media/FIGC2b_X0AAGBPG.jpg","https://t.co/OTPYZ3cMJH","https://twitter.com/GianlucaVinci80/status/1477606032205619202/photo/1","photo","http://pbs.twimg.com/media/FIGC2b_X0AAGBPG.jpg","https://t.co/OTPYZ3cMJH","https://twitter.com/GianlucaVinci80/status/1477606032205619202/photo/1",,,,"und",,,,,,,,,,,,,,,,,,,,,,,,,,,,,,,,,,,,,"NA NA","NA NA","NA NA NA NA NA NA NA NA","https://twitter.com/GianlucaVinci80/status/1477606032205619202","On. Gianluca Vinci","Reggio nell'Emilia","Deputato, Avvocato Cassazionista, Consigliere Comunale a Reggio Emilia, Presidente Commissione Comunale Controllo e Garanzia","https://t.co/vtj28tydqz",FALSE,673,145,7,644,295,2017-10-29 10:34:37,FALSE,"https://t.co/vtj28tydqz","https://www.camera.it/leg18/29?shadow_deputato=307334&idpersona=307334&idlegislatura=18",,"https://pbs.twimg.com/profile_banners/924585253783695360/1601383926",,"http://pbs.twimg.com/profile_images/1246911778753335304/KD8LGqUg_normal.jpg"
"x381443107","x1477602198284558340",2022-01-02 11:26:31,"eugenio_zoffili","✅ GRAZIE LEGA, GRAZIE MATTEO SALVINI! https://t.co/yhlzOPA3ib","Twitter for iPhone",37,,,,FALSE,FALSE,4,1,,,,,,,,"http://pbs.twimg.com/media/FIF_XPAXsAE432U.jpg","https://t.co/yhlzOPA3ib","https://twitter.com/eugenio_zoffili/status/1477602198284558340/photo/1","photo","http://pbs.twimg.com/media/FIF_XPAXsAE432U.jpg","https://t.co/yhlzOPA3ib","https://twitter.com/eugenio_zoffili/status/1477602198284558340/photo/1",,,,"it",,,,,,,,,,,,,,,,,,,,,,,,,,,,,,,,,,,,,"NA NA","NA NA","NA NA NA NA NA NA NA NA","https://twitter.com/eugenio_zoffili/status/1477602198284558340","Eugenio Zoffili","Ponte Lambro, Lombardia","Vice Coordinatore regionale Lega Lombarda per Salvini Premier • Deputato 🇮🇹 Capogruppo III Affari Esteri • Presidente Bicamerale Schengen-Europol-Immigrazione","https://t.co/jI4wpsqp81",FALSE,4920,3816,0,10447,3780,2011-09-28 10:30:38,TRUE,"https://t.co/jI4wpsqp81","https://www.camera.it/leg18/29?shadow_deputato=307616&idLegislatura=18",,"https://pbs.twimg.com/profile_banners/381443107/1640393785","http://abs.twimg.com/images/themes/theme1/bg.png","http://pbs.twimg.com/profile_images/963139168950988801/PNCAMv73_normal.jpg"
"x210951712","x1477730400252407815",2022-01-02 19:55:56,"mvbrambilla","@MauroLupo Che bello","Twitter for Android",9,"x1477674803138113547","x97699315","MauroLupo",FALSE,FALSE,0,0,,,,,,,,,,,,,,,,"x97699315","MauroLupo","it",,,,,,,,,,,,,,,,,,,,,,,,,,,,,,,,,,,,,"NA NA","NA NA","NA NA NA NA NA NA NA NA","https://twitter.com/mvbrambilla/status/1477730400252407815","Michela V. Brambilla","","","http://t.co/KNUAHXfJX4",FALSE,85693,2469,333,5554,3674,2010-11-01 21:53:18,FALSE,"http://t.co/KNUAHXfJX4","http://www.michelavittoriabrambilla.it",,"https://pbs.twimg.com/profile_banners/210951712/1390553013","http://abs.twimg.com/images/themes/theme1/bg.png","http://pbs.twimg.com/profile_images/1513353320/foto_4__normal.jpg"
"x20430345","x1477586115666362371",2022-01-02 10:22:36,"renatobrunetta","La proposta #Draghi-#Macron sulle nuove regole per il Patto di stabilità restituisce centralità alla politica rilanciando l’idea dell’ex ministro del Tesoro #GuidoCarli. L’articolo del ministro @renatobrunetta su @sole24ore. #2gennaio2022 @fondguidocarli https://t.co/LsPi5Fcitt","Twitter for iPhone",140,,,,FALSE,TRUE,0,8,,,"Draghi Macron",,,,,,,,,,,,,"x1148862736073465857","fondguidocarli","it",,,,,,,,,,,,,,,,"x1477582590215401472","La proposta #Draghi-#Macron sulle nuove regole per il Patto di stabilità restituisce centralità alla politica rilanciando l’idea dell’ex ministro del Tesoro #GuidoCarli. L’articolo del ministro @renatobrunetta su @sole24ore. #2gennaio2022 @fondguidocarli https://t.co/LsPi5Fcitt",2022-01-02 10:08:36,"Twitter for iPhone",18,8,"x1148862736073465857","fondguidocarli","Fondazione Guido Carli",331,482,746,"Roma, Lazio","Ideata e presieduta da Romana Liuzzo. Nasce il 6 luglio del 2017 con lo scopo di ricordare la memoria di Guido Carli. E premiare le eccellenze italiane.",FALSE,,,,,,,"NA NA","NA NA","NA NA NA NA NA NA NA NA","https://twitter.com/renatobrunetta/status/1477586115666362371","Renato Brunetta","","Professore ordinario di Economia del Lavoro, Ministro per la Pubblica Amministrazione @FunzPub, Deputato di Forza Italia 🇮🇹","https://t.co/KusLYR1fiw",FALSE,215690,1362,1350,69995,37597,2009-02-09 11:55:16,TRUE,"https://t.co/KusLYR1fiw","http://t.me/renatobrunetta",,"https://pbs.twimg.com/profile_banners/20430345/1614368424","http://abs.twimg.com/images/themes/theme1/bg.png","http://pbs.twimg.com/profile_images/1306193644001603584/h7as6uZh_normal.jpg"
"x604395668","x1477713911977762817",2022-01-02 18:50:25,"bennyfiorini","#Salvini: “Emergenza energetica in Europa, sembra che finalmente anche la Commissione si prepari a riconoscere #gas e #nucleare come “energie Green”. L’Italia non può stare ferma, la Lega è pronta anche a raccogliere… https://t.co/3u7JH9arM2
https://t.co/ZmSJM19mfK https://t.co/CHMcDgkVZi","Twitter for iPhone",140,,,,FALSE,TRUE,0,3,,,"Salvini gas",,,,,,,,,,,,,"x1016715966405804032","LegaCamera","it",,,,,,,,,,,,,,,,"x1477626998491168773","#Salvini: “Emergenza energetica in Europa, sembra che finalmente anche la Commissione si prepari a riconoscere #gas e #nucleare come “energie Green”. L’Italia non può stare ferma, la Lega è pronta anche a raccogliere… https://t.co/3u7JH9arM2
https://t.co/ZmSJM19mfK https://t.co/CHMcDgkVZi",2022-01-02 13:05:04,"LegaCamera",7,3,"x1016715966405804032","LegaCamera","Lega Camera",3651,55,12145,"Roma, Lazio","Gruppo Parlamentare Lega Camera",FALSE,,,,,,,"NA NA","NA NA","NA NA NA NA NA NA NA NA","https://twitter.com/bennyfiorini/status/1477713911977762817","Benedetta Fiorini","Reggio Emilia - Modena - Roma","Deputato @LegaSalvini , Uninominale Sassuolo, Segretario Commissione #AttivitàProduttive e... #mamma di Maria Sole.","https://t.co/63QrpwBeZz",FALSE,1888,2677,32,8745,9808,2012-06-10 10:17:22,FALSE,"https://t.co/63QrpwBeZz","https://www.camera.it/leg18/29?shadow_deputato=307284&idLegislatura=18",,"https://pbs.twimg.com/profile_banners/604395668/1520851962","http://abs.twimg.com/images/themes/theme1/bg.png","http://pbs.twimg.com/profile_images/1061037768451805184/tHl_q5iy_normal.jpg"
"x604395668","x1477691262086045698",2022-01-02 17:20:25,"bennyfiorini","Il 2022 parte all'insegna dell'emergenza #energetica: boom dei costi in #bolletta. Ma una soluzione ci sarebbe... 👇
https://t.co/nxIPWtOa1F","Twitter for iPhone",140,,,,FALSE,TRUE,0,27,,,"energetica bolletta",,,,,,,,,,,,,"x399004979","NicolaPorro","it",,,,,,,,,,,,,,,,"x1477689748659609602","Il 2022 parte all'insegna dell'emergenza #energetica: boom dei costi in #bolletta. Ma una soluzione ci sarebbe... 👇
https://t.co/nxIPWtOa1F",2022-01-02 17:14:24,"TweetDeck",81,27,"x399004979","NicolaPorro","Nicola Porro",434281,598,21182,"","Vicedirettore del @ilgiornale, conduttore televisivo e giornalista. Tutti i giorni la sua zuppa su https://t.co/GPJd1eo4b8",TRUE,,,,,,,"NA NA","NA NA","NA NA NA NA NA NA NA NA","https://twitter.com/bennyfiorini/status/1477691262086045698","Benedetta Fiorini","Reggio Emilia - Modena - Roma","Deputato @LegaSalvini , Uninominale Sassuolo, Segretario Commissione #AttivitàProduttive e... #mamma di Maria Sole.","https://t.co/63QrpwBeZz",FALSE,1888,2677,32,8745,9808,2012-06-10 10:17:22,FALSE,"https://t.co/63QrpwBeZz","https://www.camera.it/leg18/29?shadow_deputato=307284&idLegislatura=18",,"https://pbs.twimg.com/profile_banners/604395668/1520851962","http://abs.twimg.com/images/themes/theme1/bg.png","http://pbs.twimg.com/profile_images/1061037768451805184/tHl_q5iy_normal.jpg"
"x604395668","x1477676278413205509",2022-01-02 16:20:53,"bennyfiorini","++ PERSONAGGI DELL'ANNO SCELTI DAI LETTORI DI https://t.co/wElpdfqE3s: IN POLITICA HA VINTO SALVINI ++ 🇮🇹 https://t.co/2LISu1dN3W","Twitter for iPhone",140,,,,FALSE,TRUE,0,55,,,,,"AFFARITALIANI.IT","https://t.co/wElpdfqE3s","http://AFFARITALIANI.IT",,,,,,,,,"x13514762","LegaSalvini","it",,,,,,,,,,,,,,,,"x1477371308564484097","++ PERSONAGGI DELL'ANNO SCELTI DAI LETTORI DI https://t.co/wElpdfqE3s: IN POLITICA HA VINTO SALVINI ++ 🇮🇹 https://t.co/2LISu1dN3W",2022-01-01 20:09:02,"LegaPerSalviniPremier",419,55,"x13514762","LegaSalvini","Lega - Salvini Premier",190298,506,229973,"Italia","Account Ufficiale Lega - Salvini Premier. Facebook: https://t.co/ujbT62WGQG Instagram: https://t.co/n3x3POS5il",TRUE,,,,,,,"NA NA","NA NA","NA NA NA NA NA NA NA NA","https://twitter.com/bennyfiorini/status/1477676278413205509","Benedetta Fiorini","Reggio Emilia - Modena - Roma","Deputato @LegaSalvini , Uninominale Sassuolo, Segretario Commissione #AttivitàProduttive e... #mamma di Maria Sole.","https://t.co/63QrpwBeZz",FALSE,1888,2677,32,8745,9808,2012-06-10 10:17:22,FALSE,"https://t.co/63QrpwBeZz","https://www.camera.it/leg18/29?shadow_deputato=307284&idLegislatura=18",,"https://pbs.twimg.com/profile_banners/604395668/1520851962","http://abs.twimg.com/images/themes/theme1/bg.png","http://pbs.twimg.com/profile_images/1061037768451805184/tHl_q5iy_normal.jpg"
"x604395668","x1477676180614656001",2022-01-02 16:20:30,"bennyfiorini","Chi uccide il proprio figlio non può essere chiamato “padre”. Una preghiera per il povero angelo e per la mamma. https://t.co/P1VzPVABVN","Twitter for iPhone",140,,,,FALSE,TRUE,0,71,,,,,,,,,,,,,,,,"x270839361","matteosalvinimi","it",,,,,,,,,,,,,,,,"x1477664571745779712","Chi uccide il proprio figlio non può essere chiamato “padre”. Una preghiera per il povero angelo e per la mamma. https://t.co/P1VzPVABVN",2022-01-02 15:34:22,"Twitter for iPhone",611,71,"x270839361","matteosalvinimi","Matteo Salvini",1434272,2025,52373,"","Leader della Lega #primagliitaliani 🇮🇹",TRUE,,,,,,,"NA NA","NA NA","NA NA NA NA NA NA NA NA","https://twitter.com/bennyfiorini/status/1477676180614656001","Benedetta Fiorini","Reggio Emilia - Modena - Roma","Deputato @LegaSalvini , Uninominale Sassuolo, Segretario Commissione #AttivitàProduttive e... #mamma di Maria Sole.","https://t.co/63QrpwBeZz",FALSE,1888,2677,32,8745,9808,2012-06-10 10:17:22,FALSE,"https://t.co/63QrpwBeZz","https://www.camera.it/leg18/29?shadow_deputato=307284&idLegislatura=18",,"https://pbs.twimg.com/profile_banners/604395668/1520851962","http://abs.twimg.com/images/themes/theme1/bg.png","http://pbs.twimg.com/profile_images/1061037768451805184/tHl_q5iy_normal.jpg"
