"x421841453","x1477582639855026180",2022-01-02 10:08:48,"augustamontarul","Accantonata la questione della frode fiscale, fallita l’operazione di Travaglio “No al garante della prostituzione”, non restava che la mafia. Dare del mafioso a un politico è sempre un bel colpo. Quindi si spara con queste cartucce
https://t.co/e76eX1RGwz","Twitter for iPhone",139,,,,FALSE,TRUE,0,22,,,,,,,,,,,,,,,,"x138736601","ilriformista","it",,,,,,,,,,,,,,,,"x1477545193259913218","Accantonata la questione della frode fiscale, fallita l’operazione di Travaglio “No al garante della prostituzione”, non restava che la mafia. Dare del mafioso a un politico è sempre un bel colpo. Quindi si spara con queste cartucce
https://t.co/e76eX1RGwz",2022-01-02 07:40:00,"Twitter Web App",87,22,"x138736601","ilriformista","Il Riformista",20944,778,17978,"","✏️ L’idea riformista, l’idea libertaria e l’idea garantista. Informazione e battaglia delle idee. Le idee non la propaganda.",TRUE,,,,,,,"NA NA","NA NA","NA NA NA NA NA NA NA NA","https://twitter.com/augustamontarul/status/1477582639855026180","Augusta Montaruli","Torino, Italia. ","La politica e' un'arte nobile ma io non ho sangue blu. Pellegrina, avvocato penalista. Italiana militante, deputato FDI",,FALSE,5349,1241,42,9970,2946,2011-11-26 13:07:50,FALSE,,,,"https://pbs.twimg.com/profile_banners/421841453/1606984810","http://abs.twimg.com/images/themes/theme1/bg.png","http://pbs.twimg.com/profile_images/1254672650473005063/IaNhJHU6_normal.jpg"
"x421841453","x1477579715540135937",2022-01-02 09:57:10,"augustamontarul","Caro bollette? Colpa di Bruxelles, ecco perché. L’analisi di Tabarelli (Nomisma Energia) https://t.co/U4AYPoqXJ6","Twitter for iPhone",131,,,,FALSE,TRUE,0,108,,,,,"startmag.it/energia/aument…","https://t.co/U4AYPoqXJ6","https://www.startmag.it/energia/aumento-bollette-analisi-davide-tabarelli",,,,,,,,,"x413916151","GuidoCrosetto","it",,,,,,,,,,,,,,,,"x1477576799072706566","Caro bollette? Colpa di Bruxelles, ecco perché. L’analisi di Tabarelli (Nomisma Energia) https://t.co/U4AYPoqXJ6",2022-01-02 09:45:35,"Twitter for iPhone",304,108,"x413916151","GuidoCrosetto","Guido Crosetto",169209,2237,101612,"","Libero da pregiudizi per convinzione, garantista per dna, conservatore per nascita, rispettoso per scelta. Ex tante cose. Ora uomo libero ed imprenditore.",FALSE,,,,,,,"NA NA","NA NA","NA NA NA NA NA NA NA NA","https://twitter.com/augustamontarul/status/1477579715540135937","Augusta Montaruli","Torino, Italia. ","La politica e' un'arte nobile ma io non ho sangue blu. Pellegrina, avvocato penalista. Italiana militante, deputato FDI",,FALSE,5349,1241,42,9970,2946,2011-11-26 13:07:50,FALSE,,,,"https://pbs.twimg.com/profile_banners/421841453/1606984810","http://abs.twimg.com/images/themes/theme1/bg.png","http://pbs.twimg.com/profile_images/1254672650473005063/IaNhJHU6_normal.jpg"
"x122327232","x1477680323412508672",2022-01-02 16:36:57,"EmanuelePrisco","La crisi energetica sta spingendo l'Italia sull'orlo di un lockdown produttivo e industriale. Intere filiere, a partire da quelle legate alla manifattura, rischiano di collassare sotto il macigno degli aumenti in bolletta, con ricadute occupazionali ed economiche devastanti.","Twitter for iPhone",139,,,,FALSE,TRUE,0,130,,,,,,,,,,,,,,,,"x130537001","GiorgiaMeloni","it",,,,,,,,,,,,,,,,"x1477671653828186115","La crisi energetica sta spingendo l'Italia sull'orlo di un lockdown produttivo e industriale. Intere filiere, a partire da quelle legate alla manifattura, rischiano di collassare sotto il macigno degli aumenti in bolletta, con ricadute occupazionali ed economiche devastanti.",2022-01-02 16:02:30,"Twitter for iPhone",708,130,"x130537001","GiorgiaMeloni","Giorgia Meloni 🇮🇹 ن",1153149,926,18525,"Italia","Romana, classe '77. Politica e giornalista. Sempre, ovunque e prima di tutto, italiana. Presidente di @FratellidItalia e di @ECRParty",TRUE,,,,,,,"NA NA","NA NA","NA NA NA NA NA NA NA NA","https://twitter.com/EmanuelePrisco/status/1477680323412508672","Emanuele Prisco","Perugia","43 anni. Funzionario vvf, parlamentare di @FratellidItalia, sposato, papa'.","https://t.co/aO1FqT1n2c",FALSE,1240,824,0,1829,1043,2010-03-12 10:00:37,FALSE,"https://t.co/aO1FqT1n2c","http://www.emanueleprisco.it",,"https://pbs.twimg.com/profile_banners/122327232/1542492815","http://abs.twimg.com/images/themes/theme1/bg.png","http://pbs.twimg.com/profile_images/1447954730290921483/jWw-yznD_normal.jpg"
"x359933447","x1477732747355504640",2022-01-02 20:05:16,"w_rizzetto","@avatar_tor @rositaromeo @PaoloCond @nitalikmeta @raffaelebruno @vittorlingiardi Segnalato grazie","Twitter for iPhone",16,"x1477725867623211012","x428460389","avatar_tor",FALSE,FALSE,1,0,,,,,,,,,,,,,,,,"x428460389 x303352932 x467480325 x2241456512 x84071044 x1386680904849018884","avatar_tor rositaromeo PaoloCond nitalikmeta raffaelebruno vittorlingiardi","it",,,,,,,,,,,,,,,,,,,,,,,,,,,,,,,,,,,,,"NA NA","NA NA","NA NA NA NA NA NA NA NA","https://twitter.com/w_rizzetto/status/1477732747355504640","walter rizzetto","italia","Deputato XVII e XVIII Legislatura. Odio tutti gli ascensori e difficilmente uscirei con uno come me.",,FALSE,5467,2440,96,10677,6568,2011-08-22 12:18:49,FALSE,,,,"https://pbs.twimg.com/profile_banners/359933447/1465832876","http://abs.twimg.com/images/themes/theme2/bg.gif","http://pbs.twimg.com/profile_images/1323917517136498691/tQK4eXtd_normal.jpg"
"x359933447","x1477725746890170370",2022-01-02 19:37:27,"w_rizzetto","@mariannaaprile Hanno hackerato anche il profilo di Michelle 😅","Twitter for iPhone",46,"x1477490220035682308","x22038676","mariannaaprile",FALSE,FALSE,0,0,,,,,,,,,,,,,,,,"x22038676","mariannaaprile","it",,,,,,,,,,,,,,,,,,,,,,,,,,,,,,,,,,,,,"NA NA","NA NA","NA NA NA NA NA NA NA NA","https://twitter.com/w_rizzetto/status/1477725746890170370","walter rizzetto","italia","Deputato XVII e XVIII Legislatura. Odio tutti gli ascensori e difficilmente uscirei con uno come me.",,FALSE,5467,2440,96,10677,6568,2011-08-22 12:18:49,FALSE,,,,"https://pbs.twimg.com/profile_banners/359933447/1465832876","http://abs.twimg.com/images/themes/theme2/bg.gif","http://pbs.twimg.com/profile_images/1323917517136498691/tQK4eXtd_normal.jpg"
"x333554062","x1477640424567287809",2022-01-02 13:58:25,"FrancescoBerti_","Le misure in tema di politica estera approvate nella Legge di bilancio 2022

⬇

https://t.co/8oKI8D4taT","Twitter Web App",103,,,,FALSE,FALSE,0,0,,,,,"francescoberti.it/2022/01/02/pol…","https://t.co/8oKI8D4taT","https://www.francescoberti.it/2022/01/02/politica-estera-bilancio/",,,,,,,,,,,"it",,,,,,,,,,,,,,,,,,,,,,,,,,,,,,,,,,,,,"NA NA","NA NA","NA NA NA NA NA NA NA NA","https://twitter.com/FrancescoBerti_/status/1477640424567287809","Francesco Berti","Livorno, Toscana","Deputato M5S - MP at the Italian Parliament for the 5SM. Europa, esteri e enti locali 🇮🇹🇪🇺","https://t.co/tXgB4YY7nA",FALSE,1618,1008,32,1229,3165,2011-07-11 18:30:51,TRUE,"https://t.co/tXgB4YY7nA","http://www.francescoberti.it",,"https://pbs.twimg.com/profile_banners/333554062/1640696866","http://abs.twimg.com/images/themes/theme1/bg.png","http://pbs.twimg.com/profile_images/1365283302559649796/vuUKtvth_normal.jpg"
"x333554062","x1477625484032757761",2022-01-02 12:59:03,"FrancescoBerti_","A volte basterebbe ammettere di aver scritto una baggianata. Può capitare a tutti, anche ai Magnifici. https://t.co/ai8zrLVMYI","Twitter for iPhone",140,,,,FALSE,TRUE,0,160,,,,,,,,,,,,,,,,"x61765111","sbonaccini","it",,,,,,,,,,,,,,,,"x1477397236833308674","A volte basterebbe ammettere di aver scritto una baggianata. Può capitare a tutti, anche ai Magnifici. https://t.co/ai8zrLVMYI",2022-01-01 21:52:04,"Twitter for iPhone",2329,160,"x61765111","sbonaccini","Stefano Bonaccini",119209,11938,39199,"","Presidente della Regione Emilia-Romagna e Presidente del Consiglio dei Comuni e delle Regioni d’Europa (CEMR)",TRUE,,,,,,,"NA NA","NA NA","NA NA NA NA NA NA NA NA","https://twitter.com/FrancescoBerti_/status/1477625484032757761","Francesco Berti","Livorno, Toscana","Deputato M5S - MP at the Italian Parliament for the 5SM. Europa, esteri e enti locali 🇮🇹🇪🇺","https://t.co/tXgB4YY7nA",FALSE,1618,1008,32,1229,3165,2011-07-11 18:30:51,TRUE,"https://t.co/tXgB4YY7nA","http://www.francescoberti.it",,"https://pbs.twimg.com/profile_banners/333554062/1640696866","http://abs.twimg.com/images/themes/theme1/bg.png","http://pbs.twimg.com/profile_images/1365283302559649796/vuUKtvth_normal.jpg"
"x408370356","x1477754617522003968",2022-01-02 21:32:10,"SBuffagni","Love. In tutti i sensi.
#NBAtipo

https://t.co/pypeVALT9A","Twitter for iPhone",78,,,,FALSE,TRUE,0,40,,,"NBAtipo",,,,,"http://pbs.twimg.com/ext_tw_video_thumb/1477462351804833794/pu/img/nrKyv2IAg-LuFOXT.jpg","https://t.co/pypeVALT9A","https://twitter.com/overtime/status/1477462372113653761/video/1","photo","http://pbs.twimg.com/ext_tw_video_thumb/1477462351804833794/pu/img/nrKyv2IAg-LuFOXT.jpg","https://t.co/pypeVALT9A","https://twitter.com/overtime/status/1477462372113653761/video/1",,"x500879034","parallelecinico","it",,,,,,,,,,,,,,,,"x1477746994055729152","Love. In tutti i sensi.
#NBAtipo

https://t.co/pypeVALT9A",2022-01-02 21:01:53,"Twitter for Android",726,40,"x500879034","parallelecinico","La Giornata Tipo",76186,984,73612,"Bologna","Se non hai mai fatto il tagliafuori ad un buffet, non hai il basket nel sangue. https://t.co/NO14g7OjnN - Raffaele Ferraro @raffamimmo",FALSE,,,,,,,"NA NA","NA NA","NA NA NA NA NA NA NA NA","https://twitter.com/SBuffagni/status/1477754617522003968","Stefano Buffagni","Milano - Italia","Papà - Deputato alla Camera del MoVimento 5 Stelle - Dottore Commercialista - Revisore Conti - Olimpia Milano - #Amala","https://t.co/kC2c3piOT8",FALSE,5280,572,83,10605,4493,2011-11-09 10:16:54,TRUE,"https://t.co/kC2c3piOT8","http://www.stefanobuffagni.it",,"https://pbs.twimg.com/profile_banners/408370356/1378026556","http://abs.twimg.com/images/themes/theme1/bg.png","http://pbs.twimg.com/profile_images/733026017779015681/DB8G3tyV_normal.jpg"
"x398603525","x1477753371817914376",2022-01-02 21:27:13,"Emanuela_Corda","Il #PD continua a riesum… ops…. a “rinnovarsi” con grandi e fresche novità. Pronto al rientro anche #Dalema","Twitter for iPhone",107,,,,FALSE,FALSE,10,4,,,"PD Dalema",,,,,,,,,,,,,,,"it",,,,,,,,,,,,,,,,,,,,,,,,,,,,,,,,,,,,,"NA NA","NA NA","NA NA NA NA NA NA NA NA","https://twitter.com/Emanuela_Corda/status/1477753371817914376","Emanuela Corda","Cagliari Roma","Sono una libera professionista. Amo la storia, la cultura, il mondo, la verità. Attualmente portavoce cittadina eletta alla Camera dei Deputati",,FALSE,8182,237,98,914,281,2011-10-26 09:06:56,TRUE,,,,"https://pbs.twimg.com/profile_banners/398603525/1639788403","http://abs.twimg.com/images/themes/theme1/bg.png","http://pbs.twimg.com/profile_images/1475823428343107588/KLiCaLJ3_normal.jpg"
"x398603525","x1477622362602455044",2022-01-02 12:46:38,"Emanuela_Corda","Consiglio per il #2022: sottraete i bimbi ai vostri #video #virali sui #social! Rispettare la loro intimità! Restituitegli l’infanzia. Siete liberi di farvi tutti i video che desiderate, ma i bambini non possono scegliere. Lasciateli in pace. Stop #theTrumanShow","Twitter for iPhone",262,,,,FALSE,FALSE,15,9,,,"video virali social theTrumanShow",,,,,,,,,,,,,,,"it",,,,,,,,,,,,,,,,,,,,,,,,,,,,,,,,,,,,,"NA NA","NA NA","NA NA NA NA NA NA NA NA","https://twitter.com/Emanuela_Corda/status/1477622362602455044","Emanuela Corda","Cagliari Roma","Sono una libera professionista. Amo la storia, la cultura, il mondo, la verità. Attualmente portavoce cittadina eletta alla Camera dei Deputati",,FALSE,8182,237,98,914,281,2011-10-26 09:06:56,TRUE,,,,"https://pbs.twimg.com/profile_banners/398603525/1639788403","http://abs.twimg.com/images/themes/theme1/bg.png","http://pbs.twimg.com/profile_images/1475823428343107588/KLiCaLJ3_normal.jpg"
"x398603525","x1477599450424086534",2022-01-02 11:15:36,"Emanuela_Corda","BREVE STORIA TRISTE
Gente che si ammala di #Covid, si fa ricoverare e si fotografa con il cellulare per far la storia sui #social e far vedere quanto sta male mentre viene trasportata in ospedale. Prima è consigliata tappa in psichiatria…
FINE. 😅 #Pandemenza","Twitter for iPhone",258,,,,FALSE,FALSE,14,0,,,"Covid social Pandemenza",,,,,,,,,,,,,,,"it",,,,,,,,,,,,,,,,,,,,,,,,,,,,,,,,,,,,,"NA NA","NA NA","NA NA NA NA NA NA NA NA","https://twitter.com/Emanuela_Corda/status/1477599450424086534","Emanuela Corda","Cagliari Roma","Sono una libera professionista. Amo la storia, la cultura, il mondo, la verità. Attualmente portavoce cittadina eletta alla Camera dei Deputati",,FALSE,8182,237,98,914,281,2011-10-26 09:06:56,TRUE,,,,"https://pbs.twimg.com/profile_banners/398603525/1639788403","http://abs.twimg.com/images/themes/theme1/bg.png","http://pbs.twimg.com/profile_images/1475823428343107588/KLiCaLJ3_normal.jpg"
"x412137356","x1477607505744252929",2022-01-02 11:47:36,"ecdelre","#HAPPYNEWYEAR2022 

#RaphaelAdegoke #MotherAfrica https://t.co/yTsrgzeOIm","Twitter for Android",49,,,,FALSE,FALSE,10,1,,,"HAPPYNEWYEAR2022 RaphaelAdegoke MotherAfrica",,,,,"http://pbs.twimg.com/media/FIGEMhwXEAIZkea.jpg","https://t.co/yTsrgzeOIm","https://twitter.com/ecdelre/status/1477607505744252929/photo/1","photo","http://pbs.twimg.com/media/FIGEMhwXEAIZkea.jpg","https://t.co/yTsrgzeOIm","https://twitter.com/ecdelre/status/1477607505744252929/photo/1",,,,"und",,,,,,,,,,,,,,,,,,,,,,,,,,,,,,,,,,,,,"NA NA","NA NA","NA NA NA NA NA NA NA NA","https://twitter.com/ecdelre/status/1477607505744252929","Emanuela C. Del Re","Sahel and Bruxelles ","EU Special Representative for the Sahel 🇪🇺 Former Vice-Minister of Foreign Affairs and MP of Italy 🇮🇹 Prof. Political Sociology - Author of essays & volumes","https://t.co/j5mx3SmZsU",FALSE,6238,311,49,3563,1926,2011-11-14 09:30:25,TRUE,"https://t.co/j5mx3SmZsU","https://eeas.europa.eu/headquarters/headquarters-homepage_en/3606/EU%20Special%20Representatives",,"https://pbs.twimg.com/profile_banners/412137356/1625138723","http://abs.twimg.com/images/themes/theme1/bg.png","http://pbs.twimg.com/profile_images/1222088283976601600/UbqmxHp7_normal.jpg"
"x1052596340","x1477738057591889920",2022-01-02 20:26:22,"riccardo_fra","#Superbonus chiude il 2021 con 17 miliardi di detrazioni 95.000 cantieri. #ambiente #lavoro #salute #crescita. #BuonAnno https://t.co/r2cue6Xp7t","Twitter for iPhone",120,,,,FALSE,FALSE,37,19,,,"Superbonus ambiente lavoro salute crescita BuonAnno",,,,,"http://pbs.twimg.com/media/FIH67SvXwAQig6Z.jpg","https://t.co/r2cue6Xp7t","https://twitter.com/riccardo_fra/status/1477738057591889920/photo/1","photo","http://pbs.twimg.com/media/FIH67SvXwAQig6Z.jpg","https://t.co/r2cue6Xp7t","https://twitter.com/riccardo_fra/status/1477738057591889920/photo/1",,,,"it",,,,,,,,,,,,,,,,,,,,,,,,,,,,,,,,,,,,,"NA NA","NA NA","NA NA NA NA NA NA NA NA","https://twitter.com/riccardo_fra/status/1477738057591889920","Riccardo Fraccaro","","Deputato #M5S. https://t.co/LJ8npKe2Eq","https://t.co/FWQiVIVn48",FALSE,50705,6938,393,4644,4100,2013-01-01 13:29:45,TRUE,"https://t.co/FWQiVIVn48","http://www.riccardofraccaro.it/",,"https://pbs.twimg.com/profile_banners/1052596340/1553614671","http://abs.twimg.com/images/themes/theme19/bg.gif","http://pbs.twimg.com/profile_images/1169301653050331136/PnpDqkzk_normal.jpg"
"x474418037","x1477605205357309952",2022-01-02 11:38:28,"FloraFrate","Si all’obbligo vaccinale. Ecco la nostra petizione per raccogliere le firme. 
Se sei d’accordo, firma anche tu! #obbligovaccinale 

https://t.co/zglXkkGfab","Twitter Web App",155,,,,FALSE,FALSE,47,12,,,"obbligovaccinale",,"italiaviva.it/petizione_si_o…","https://t.co/zglXkkGfab","https://www.italiaviva.it/petizione_si_obbligo_vaccinale",,,,,,,,,,,"it",,,,,,,,,,,,,,,,,,,,,,,,,,,,,,,,,,,,,"NA NA","NA NA","NA NA NA NA NA NA NA NA","https://twitter.com/FloraFrate/status/1477605205357309952","Flora Frate","Napoli","Sociologa, docente, Deputata della Repubblica
@italiaviva",,FALSE,1465,619,18,300,117,2012-01-25 23:57:43,FALSE,,,,"https://pbs.twimg.com/profile_banners/474418037/1621190785","http://abs.twimg.com/images/themes/theme18/bg.gif","http://pbs.twimg.com/profile_images/1236332526681104388/gzwq7xTK_normal.jpg"
"x2345113069","x1477694749993807877",2022-01-02 17:34:17,"IovinoLuigiM5S","@matteosalvinimi Ti rinfresco la memoria: non eri tu nel 2015 che dicevi che Mattarella non era il tuo Presidente?

Adesso ti congratuli per il suo discorso strumentalizzando e ingannando milioni di italiani.
Per fortuna che la rete ha memoria…","Twitter for iPhone",227,"x1477011757352865792","x270839361","matteosalvinimi",FALSE,FALSE,0,0,,,,,,,,,,,,,,,,"x270839361","matteosalvinimi","it",,,,,,,,,,,,,,,,,,,,,,,,,,,,,,,,,,,,,"NA NA","NA NA","NA NA NA NA NA NA NA NA","https://twitter.com/IovinoLuigiM5S/status/1477694749993807877","Luigi Iovino","San Paolo Bel Sito","Deputato - Segretario dell’Ufficio di Presidenza➡️ https://t.co/ZYlnsO7Lwi","https://t.co/oi2cbb2bVR",FALSE,1218,386,21,382,193,2014-02-15 13:10:00,TRUE,"https://t.co/oi2cbb2bVR","http://bit.ly/2y5AiVP",,"https://pbs.twimg.com/profile_banners/2345113069/1526673421","http://abs.twimg.com/images/themes/theme1/bg.png","http://pbs.twimg.com/profile_images/997569333646778368/k9oZvDjO_normal.jpg"
"x2345113069","x1477693433347293188",2022-01-02 17:29:03,"IovinoLuigiM5S","@matteosalvinimi Ti rinfresco la memoria: non eri tu nel 2015 che dicevi che Mattarella non era il tuo Presidente?

Adesso ti congratuli per il suo discorso strumentalizzando ed ingannando milioni di italiani.
Per fortuna che la rete ha memoria…","Twitter for iPhone",228,"x1477011757352865792","x270839361","matteosalvinimi",FALSE,FALSE,0,0,,,,,,,,,,,,,,,,"x270839361","matteosalvinimi","it",,,,,,,,,,,,,,,,,,,,,,,,,,,,,,,,,,,,,"NA NA","NA NA","NA NA NA NA NA NA NA NA","https://twitter.com/IovinoLuigiM5S/status/1477693433347293188","Luigi Iovino","San Paolo Bel Sito","Deputato - Segretario dell’Ufficio di Presidenza➡️ https://t.co/ZYlnsO7Lwi","https://t.co/oi2cbb2bVR",FALSE,1218,386,21,382,193,2014-02-15 13:10:00,TRUE,"https://t.co/oi2cbb2bVR","http://bit.ly/2y5AiVP",,"https://pbs.twimg.com/profile_banners/2345113069/1526673421","http://abs.twimg.com/images/themes/theme1/bg.png","http://pbs.twimg.com/profile_images/997569333646778368/k9oZvDjO_normal.jpg"
"x2149359853","x1477715236002086918",2022-01-02 18:55:41,"RaffaAngela","Basta con questo perbenismo ipocrita. Politici con ricoprono il loro incarico con 'indisciplina e disonore', vengono presi con le mani nella marmellata. A quel punto non possono fare altro che dimettersi e subito parte il coro dei colleghi per lodare “di… https://t.co/lLV5lsrWGL https://t.co/xgKW0rZqd1","IFTTT",279,,,,FALSE,FALSE,49,19,,,,,"instagr.am/p/CYPOlwyIPig/","https://t.co/lLV5lsrWGL","https://instagr.am/p/CYPOlwyIPig/","http://pbs.twimg.com/media/FIHmLPKXoAMWbvX.jpg","https://t.co/xgKW0rZqd1","https://twitter.com/RaffaAngela/status/1477715236002086918/photo/1","photo","http://pbs.twimg.com/media/FIHmLPKXoAMWbvX.jpg","https://t.co/xgKW0rZqd1","https://twitter.com/RaffaAngela/status/1477715236002086918/photo/1",,,,"it",,,,,,,,,,,,,,,,,,,,,,,,,,,,,,,,,,,,,"NA NA","NA NA","NA NA NA NA NA NA NA NA","https://twitter.com/RaffaAngela/status/1477715236002086918","Angela Raffa","Messina, Sicilia","Deputata Movimento 5 Stelle","https://t.co/6hyx1nskYi",FALSE,1664,947,15,1124,186,2013-10-22 16:44:17,FALSE,"https://t.co/6hyx1nskYi","http://facebook.com/angelaraffaM5S/",,"https://pbs.twimg.com/profile_banners/2149359853/1615924017","http://abs.twimg.com/images/themes/theme1/bg.png","http://pbs.twimg.com/profile_images/1371910875033001995/1LehpM1a_normal.jpg"
"x337171830","x1477565137330577408",2022-01-02 08:59:15,"AngeloTofalo","L’unico modo per contrastare il nebuloso insieme delle minacce (cibernetiche, terroristiche, pandemiche, economico finanziarie, ecc.) è creare una joint venture tra cittadini, imprese e Stato, capace di migliorare il grado di resilienza del Sistema Paese &gt; https://t.co/Ti5EHugXXM https://t.co/ojyxOkJKwx","Twitter for iPhone",283,,,,FALSE,FALSE,19,7,,,,,"angelotofalo.com/intelligence-c…","https://t.co/Ti5EHugXXM","https://www.angelotofalo.com/intelligence-collettiva-concetto-sicurezza-partecipata/","http://pbs.twimg.com/media/FIFdpD0XIAAJomf.jpg","https://t.co/ojyxOkJKwx","https://twitter.com/AngeloTofalo/status/1477565137330577408/photo/1","photo","http://pbs.twimg.com/media/FIFdpD0XIAAJomf.jpg","https://t.co/ojyxOkJKwx","https://twitter.com/AngeloTofalo/status/1477565137330577408/photo/1",,,,"it",,,,,,,,,,,,,,,,,,,,,,,,,,,,,,,,,,,,,"NA NA","NA NA","NA NA NA NA NA NA NA NA","https://twitter.com/AngeloTofalo/status/1477565137330577408","Angelo Tofalo","Salerno, Pellezzano, Campania","Ingegnere, deputato della Repubblica, già Sottosegretario di Stato alla Difesa 🇮🇹 Rapito dall’Intelligence per diffondere la cultura della Sicurezza","https://t.co/4xUgrx6rHJ",FALSE,38047,4943,358,37781,16738,2011-07-17 15:43:34,TRUE,"https://t.co/4xUgrx6rHJ","http://www.angelotofalo.com",,"https://pbs.twimg.com/profile_banners/337171830/1613207709","http://abs.twimg.com/images/themes/theme1/bg.png","http://pbs.twimg.com/profile_images/1035471039734718464/UIb1-oK3_normal.jpg"
"x1386423176","x1477699077869559811",2022-01-02 17:51:29,"AndreaVallascas","Il nuovo articolo 1 dopo l'azione del padre costituente Mario Draghi, nonché aspirante garante della Costituzione

Siamo in piena emergenza democratica!
#EmergenzaDemocratica #NODraghi #NonnoDraghiVigilaICantieri https://t.co/sYSzC7doBA","Twitter for Android",212,,,,FALSE,FALSE,10,8,,,"EmergenzaDemocratica NODraghi NonnoDraghiVigilaICantieri",,,,,"http://pbs.twimg.com/media/FIHXepeXMAQTUg4.jpg","https://t.co/sYSzC7doBA","https://twitter.com/AndreaVallascas/status/1477699077869559811/photo/1","photo","http://pbs.twimg.com/media/FIHXepeXMAQTUg4.jpg","https://t.co/sYSzC7doBA","https://twitter.com/AndreaVallascas/status/1477699077869559811/photo/1",,,,"it",,,,,,,,,,,,,,,,,,,,,,,,,,,,,,,,,,,,,"NA NA","NA NA","NA NA NA NA NA NA NA NA","https://twitter.com/AndreaVallascas/status/1477699077869559811","Andrea Vallascas","Roma","Deputato - eletto nel collegio plurinominale 01 Sardegna - X commissione Attività produttive","https://t.co/JOPvZVdV11",FALSE,2687,322,62,7008,241,2013-04-28 08:06:56,TRUE,"https://t.co/JOPvZVdV11","http://www.andreavallascas.it",,"https://pbs.twimg.com/profile_banners/1386423176/1625234772","http://abs.twimg.com/images/themes/theme1/bg.png","http://pbs.twimg.com/profile_images/1386030783228518407/Z6GX8VUn_normal.jpg"
"x1386423176","x1477636989054865411",2022-01-02 13:44:46,"AndreaVallascas","Il potere avvince i potenti che spesso ne rimangono vittime. La storia è piena di prevaricatori convinti di essere onnipotenti. A nonno Mario auguro per il bene dell'Italia un anno di giardinetti e cantieri da vigilare, ma fuori da Chigi e Quirinale!. #IldeliriodiMario https://t.co/qTzYodwmXG","Twitter Web App",269,,,,FALSE,FALSE,15,9,,,"IldeliriodiMario",,,,,"http://pbs.twimg.com/media/FIGeWTpX0AEuq1z.jpg","https://t.co/qTzYodwmXG","https://twitter.com/AndreaVallascas/status/1477636989054865411/photo/1","photo","http://pbs.twimg.com/media/FIGeWTpX0AEuq1z.jpg","https://t.co/qTzYodwmXG","https://twitter.com/AndreaVallascas/status/1477636989054865411/photo/1",,,,"it",,,,,,,,,,,,,,,,,,,,,,,,,,,,,,,,,,,,,"NA NA","NA NA","NA NA NA NA NA NA NA NA","https://twitter.com/AndreaVallascas/status/1477636989054865411","Andrea Vallascas","Roma","Deputato - eletto nel collegio plurinominale 01 Sardegna - X commissione Attività produttive","https://t.co/JOPvZVdV11",FALSE,2687,322,62,7008,241,2013-04-28 08:06:56,TRUE,"https://t.co/JOPvZVdV11","http://www.andreavallascas.it",,"https://pbs.twimg.com/profile_banners/1386423176/1625234772","http://abs.twimg.com/images/themes/theme1/bg.png","http://pbs.twimg.com/profile_images/1386030783228518407/Z6GX8VUn_normal.jpg"
"x636328779","x1477790212747104257",2022-01-02 23:53:37,"AlexBazzaro","Il green pass è una legge dello stato che si applica a chiunque, non solo a chi non è vaccinato.

Il governo ha il potere di subordinare la vostra vita alle condizioni di erogazione del pass, che vi assicuro, cambieranno. Oggi covid. Domani le tasse, o qualche punteggio sociale.","Twitter for iPhone",140,,,,FALSE,TRUE,0,209,,,,,,,,,,,,,,,,"x37603069","mrk4m1","it",,,,,,,,,,,,,,,,"x1477549850430525443","Il green pass è una legge dello stato che si applica a chiunque, non solo a chi non è vaccinato.

Il governo ha il potere di subordinare la vostra vita alle condizioni di erogazione del pass, che vi assicuro, cambieranno. Oggi covid. Domani le tasse, o qualche punteggio sociale.",2022-01-02 07:58:30,"Twitter for Android",862,209,"x37603069","mrk4m1","Matte",1581,630,10122,"Become ungovernable","Toxic freedom maximalist.",FALSE,,,,,,,"NA NA","NA NA","NA NA NA NA NA NA NA NA","https://twitter.com/AlexBazzaro/status/1477790212747104257","Alex Bazzaro","Venezia ","🇮🇹Deputato Lega, Commissione XIV 🇪🇺 🦁Consigliere Comunale Venezia. ✈️ Delegazione @OSCE Liberale e libertario","https://t.co/yXFTMiY4b3",FALSE,2819,512,36,13090,6060,2012-07-15 15:20:42,TRUE,"https://t.co/yXFTMiY4b3","https://www.camera.it/leg18/29?shadow_deputato=307696&idpersona=307696&idlegislatura=18",,"https://pbs.twimg.com/profile_banners/636328779/1457208495","http://abs.twimg.com/images/themes/theme1/bg.png","http://pbs.twimg.com/profile_images/1315654416171753472/1PG-DcXJ_normal.jpg"
