"x636328779","x1482293141730435073",2022-01-15 10:06:39,"AlexBazzaro","Da noi ai non inoculati tolgono lavoro e diritti, Londra si appresta a mollare il lasciapassare a giorni. Negli Usa Joe Biden furibondo per il no all’obbligo da parte della Corte. Anche in Francia crollano i dogmi. https://t.co/jZW1VWN2n1","Twitter for iPhone",140,,,,FALSE,TRUE,0,136,,,,,,,,,,,,,,,,"x900766265245130753","LaVeritaWeb","it",,,,,,,,,,,,,,,,"x1482246547421151233","Da noi ai non inoculati tolgono lavoro e diritti, Londra si appresta a mollare il lasciapassare a giorni. Negli Usa Joe Biden furibondo per il no all’obbligo da parte della Corte. Anche in Francia crollano i dogmi. https://t.co/jZW1VWN2n1",2022-01-15 07:01:30,"RunnerCommonKeys",409,136,"x900766265245130753","LaVeritaWeb","La Verità",146238,67,25892,"Milano, Lombardia","Quotidiano indipendente diretto da @BelpietroTweet. Scopri #LaVeritàdioggi tutti i giorni in edicola al costo di € 1,30. Abbonati online oggi:",FALSE,,,,,,,"NA NA","NA NA","NA NA NA NA NA NA NA NA","https://twitter.com/AlexBazzaro/status/1482293141730435073","Alex Bazzaro","Venezia ","🇮🇹Deputato Lega, Commissione XIV 🇪🇺 🦁Consigliere Comunale Venezia. ✈️ Delegazione @OSCE Liberale e libertario","https://t.co/yXFTMiY4b3",FALSE,3150,532,40,13533,7078,2012-07-15 15:20:42,TRUE,"https://t.co/yXFTMiY4b3","https://www.camera.it/leg18/29?shadow_deputato=307696&idpersona=307696&idlegislatura=18",,"https://pbs.twimg.com/profile_banners/636328779/1457208495","http://abs.twimg.com/images/themes/theme1/bg.png","http://pbs.twimg.com/profile_images/1315654416171753472/1PG-DcXJ_normal.jpg"
"x636328779","x1482266996993626112",2022-01-15 08:22:45,"AlexBazzaro","Ormai, seppur con astrusi giri di parole, si ammette che il #greenpass non funziona. Tuttavia lo si da per strumento certo e accettato dagli italiani, per “teorizzarne” futuribili implementazioni. Perché è sempre stato il fine e il vaccino l’utile mezzo. Non il contrario.","Twitter for iPhone",272,,,,FALSE,FALSE,502,115,,,"greenpass",,,,,,,,,,,,,,,"it",,,,,,,,,,,,,,,,,,,,,,,,,,,,,,,,,,,,,"NA NA","NA NA","NA NA NA NA NA NA NA NA","https://twitter.com/AlexBazzaro/status/1482266996993626112","Alex Bazzaro","Venezia ","🇮🇹Deputato Lega, Commissione XIV 🇪🇺 🦁Consigliere Comunale Venezia. ✈️ Delegazione @OSCE Liberale e libertario","https://t.co/yXFTMiY4b3",FALSE,3150,532,40,13533,7078,2012-07-15 15:20:42,TRUE,"https://t.co/yXFTMiY4b3","https://www.camera.it/leg18/29?shadow_deputato=307696&idpersona=307696&idlegislatura=18",,"https://pbs.twimg.com/profile_banners/636328779/1457208495","http://abs.twimg.com/images/themes/theme1/bg.png","http://pbs.twimg.com/profile_images/1315654416171753472/1PG-DcXJ_normal.jpg"
"x636328779","x1482259527357632513",2022-01-15 07:53:05,"AlexBazzaro","Con la doverosa premessa che “scudo penale” non vuol dire “scudo civile”, è comunque interessante vedere come lo scudo penale funzioni. Qui un’introduzione alla materia (art. 3 e 3-bis del DL 44/2021): https://t.co/yzqvRLa1zb. https://t.co/SVuHeL4PbF","Twitter for iPhone",140,,,,FALSE,TRUE,0,135,,,,,,,,,,,,,,,,"x876541483","AlbertoBagnai","it",,,,,,,,,,,,,,,,"x1482259455601516544","Con la doverosa premessa che “scudo penale” non vuol dire “scudo civile”, è comunque interessante vedere come lo scudo penale funzioni. Qui un’introduzione alla materia (art. 3 e 3-bis del DL 44/2021): https://t.co/yzqvRLa1zb. https://t.co/SVuHeL4PbF",2022-01-15 07:52:47,"Twitter for iPhone",284,135,"x876541483","AlbertoBagnai","Alberto Bagnai",130979,667,221755,"","Professore associato di politica economica all’Università Gabriele d’Annunzio, eletto al Senato per la Lega nel collegio Abruzzo 01.",TRUE,,,,,,,"NA NA","NA NA","NA NA NA NA NA NA NA NA","https://twitter.com/AlexBazzaro/status/1482259527357632513","Alex Bazzaro","Venezia ","🇮🇹Deputato Lega, Commissione XIV 🇪🇺 🦁Consigliere Comunale Venezia. ✈️ Delegazione @OSCE Liberale e libertario","https://t.co/yXFTMiY4b3",FALSE,3150,532,40,13533,7078,2012-07-15 15:20:42,TRUE,"https://t.co/yXFTMiY4b3","https://www.camera.it/leg18/29?shadow_deputato=307696&idpersona=307696&idlegislatura=18",,"https://pbs.twimg.com/profile_banners/636328779/1457208495","http://abs.twimg.com/images/themes/theme1/bg.png","http://pbs.twimg.com/profile_images/1315654416171753472/1PG-DcXJ_normal.jpg"
"x636328779","x1482256343549591553",2022-01-15 07:40:25,"AlexBazzaro","9 giorni all’alba. #Quirinale","Twitter for iPhone",29,,,,FALSE,FALSE,35,1,,,"Quirinale",,,,,,,,,,,,,,,"it",,,,,,,,,,,,,,,,,,,,,,,,,,,,,,,,,,,,,"NA NA","NA NA","NA NA NA NA NA NA NA NA","https://twitter.com/AlexBazzaro/status/1482256343549591553","Alex Bazzaro","Venezia ","🇮🇹Deputato Lega, Commissione XIV 🇪🇺 🦁Consigliere Comunale Venezia. ✈️ Delegazione @OSCE Liberale e libertario","https://t.co/yXFTMiY4b3",FALSE,3150,532,40,13533,7078,2012-07-15 15:20:42,TRUE,"https://t.co/yXFTMiY4b3","https://www.camera.it/leg18/29?shadow_deputato=307696&idpersona=307696&idlegislatura=18",,"https://pbs.twimg.com/profile_banners/636328779/1457208495","http://abs.twimg.com/images/themes/theme1/bg.png","http://pbs.twimg.com/profile_images/1315654416171753472/1PG-DcXJ_normal.jpg"
"x636328779","x1482155991844233218",2022-01-15 01:01:40,"AlexBazzaro","Ricevo messaggi di persone che, dopo #eventiavversi post-vax ufficialmente “non gravi” (trombosi occhio, pericarditi, acufeni ecc), non vogliono fare la dose successiva. Ma i medici di base rispettano indicazioni Ministero e procedono. @MinisteroSalute può mettersi all’ascolto?","Twitter for iPhone",140,,,,FALSE,TRUE,0,444,,,"eventiavversi",,,,,,,,,,,,,"x26319569","madforfree","it",,,,,,,,,,,,,,,,"x1482088467496591360","Ricevo messaggi di persone che, dopo #eventiavversi post-vax ufficialmente “non gravi” (trombosi occhio, pericarditi, acufeni ecc), non vogliono fare la dose successiva. Ma i medici di base rispettano indicazioni Ministero e procedono. @MinisteroSalute può mettersi all’ascolto?",2022-01-14 20:33:21,"Twitter for iPhone",1579,444,"x26319569","madforfree","Maddalena Loy",9168,1034,8689,"","Web Journalist (ex Foglio, Rai, Unità - capo del sito), un tempo burocrate della rete a Bruxelles (Parlamento europeo). Comunicatrice digitale. Mamma.",FALSE,,,,,,,"NA NA","NA NA","NA NA NA NA NA NA NA NA","https://twitter.com/AlexBazzaro/status/1482155991844233218","Alex Bazzaro","Venezia ","🇮🇹Deputato Lega, Commissione XIV 🇪🇺 🦁Consigliere Comunale Venezia. ✈️ Delegazione @OSCE Liberale e libertario","https://t.co/yXFTMiY4b3",FALSE,3150,532,40,13533,7078,2012-07-15 15:20:42,TRUE,"https://t.co/yXFTMiY4b3","https://www.camera.it/leg18/29?shadow_deputato=307696&idpersona=307696&idlegislatura=18",,"https://pbs.twimg.com/profile_banners/636328779/1457208495","http://abs.twimg.com/images/themes/theme1/bg.png","http://pbs.twimg.com/profile_images/1315654416171753472/1PG-DcXJ_normal.jpg"
"x636328779","x1482093399779983363",2022-01-14 20:52:57,"AlexBazzaro","@Flea_Market2022 @a_meluzzi Si, ma li di solito arrivavamo ultimi. Avrei voluto mantenessimo la tradizione.","Twitter for iPhone",79,"x1482092958023254016","x1480301422394716161","Flea_Market2022",FALSE,FALSE,1,1,,,,,,,,,,,,,,,,"x1480301422394716161 x1032615842","Flea_Market2022 a_meluzzi","it",,,,,,,,,,,,,,,,,,,,,,,,,,,,,,,,,,,,,"NA NA","NA NA","NA NA NA NA NA NA NA NA","https://twitter.com/AlexBazzaro/status/1482093399779983363","Alex Bazzaro","Venezia ","🇮🇹Deputato Lega, Commissione XIV 🇪🇺 🦁Consigliere Comunale Venezia. ✈️ Delegazione @OSCE Liberale e libertario","https://t.co/yXFTMiY4b3",FALSE,3150,532,40,13533,7078,2012-07-15 15:20:42,TRUE,"https://t.co/yXFTMiY4b3","https://www.camera.it/leg18/29?shadow_deputato=307696&idpersona=307696&idlegislatura=18",,"https://pbs.twimg.com/profile_banners/636328779/1457208495","http://abs.twimg.com/images/themes/theme1/bg.png","http://pbs.twimg.com/profile_images/1315654416171753472/1PG-DcXJ_normal.jpg"
"x747960894","x1482402234218516482",2022-01-15 17:20:08,"simo_billi","📌 Nuovi Comites alla partenza, buon lavoro a tutti!
@LegaSalvini @LegaCamera @matteosalvinimi #comites #comites2022 

https://t.co/hfFw9rQJHX","Twitter for iPhone",141,,,,FALSE,FALSE,0,0,,,"comites comites2022",,"simonebilli.eu/2022/01/15/pri…","https://t.co/hfFw9rQJHX","https://www.simonebilli.eu/2022/01/15/primo-neo-comites-olanda/",,,,,,,,,"x13514762 x1016715966405804032 x270839361","LegaSalvini LegaCamera matteosalvinimi","it",,,,,,,,,,,,,,,,,,,,,,,,,,,,,,,"https://api.twitter.com/1.1/geo/id/7d588036fe12e124.json","Rome","Rome, Lazio","city","Italy","IT","NA NA","NA NA","12.2344266 12.8558641 12.8558641 12.2344266 41.6558738 41.6558738 42.140959 42.140959","https://twitter.com/simo_billi/status/1482402234218516482","simone billi","deputato al parlamento","Lega Salvini Premier    https://t.co/fFLM8mQ7Nw","https://t.co/aEqebu2CuP",FALSE,1321,1815,13,4351,1850,2012-08-09 21:19:53,TRUE,"https://t.co/aEqebu2CuP","https://www.camera.it/leg18/29?tipoAttivita=&tipoVisAtt=&tipoPersona=&shadow_deputato=307151&idLegis",,"https://pbs.twimg.com/profile_banners/747960894/1633724732","http://abs.twimg.com/images/themes/theme1/bg.png","http://pbs.twimg.com/profile_images/1446572156356337665/bC46t5vZ_normal.jpg"
"x106673706","x1482270275148427267",2022-01-15 08:35:47,"massimobitonci","Via il CATASTO dalla riforma del FISCO: la @LegaSalvini deposita emendamento di stralcio! #bastatassesullacasa  @LegaCamera @Lega_Senato @Lega_gruppoID @matteosalvinimi @Stefanicamera @A_Gusmeroli @AlbertoBagnai @GiulioCentemero @LaCavandoli @AlbertoRibolla @MolinariRik https://t.co/eqQk9T9I0j","Twitter for iPhone",270,,,,FALSE,FALSE,29,8,,,"bastatassesullacasa",,,,,"http://pbs.twimg.com/media/FJIU9PgXEAEKV3M.jpg","https://t.co/eqQk9T9I0j","https://twitter.com/massimobitonci/status/1482270275148427267/photo/1","photo","http://pbs.twimg.com/media/FJIU9PgXEAEKV3M.jpg","https://t.co/eqQk9T9I0j","https://twitter.com/massimobitonci/status/1482270275148427267/photo/1",,"x13514762 x1016715966405804032 x973159484376875009 x1303622958401937408 x270839361 x1237851561331527688 x878620152253886464 x876541483 x960185954807025666 x215187433 x585991438 x529406554","LegaSalvini LegaCamera Lega_Senato Lega_gruppoID matteosalvinimi Stefanicamera A_Gusmeroli AlbertoBagnai GiulioCentemero LaCavandoli AlbertoRibolla MolinariRik","it",,,,,,,,,,,,,,,,,,,,,,,,,,,,,,,,,,,,,"NA NA","NA NA","NA NA NA NA NA NA NA NA","https://twitter.com/massimobitonci/status/1482270275148427267","Massimo Bitonci","","Veneto on. Lega Salvini - Fondatore LIGA Veneta SP - Capogruppo Bilancio - Capo Dip. Att. Produttive Lega- già Sindaco di Cittadella e Padova - commercialista","https://t.co/kPwsXGqWs8",FALSE,11734,907,95,21224,2163,2010-01-20 08:53:16,TRUE,"https://t.co/kPwsXGqWs8","http://bitonci.it",,"https://pbs.twimg.com/profile_banners/106673706/1520459270","http://abs.twimg.com/images/themes/theme1/bg.png","http://pbs.twimg.com/profile_images/1217032559348961286/R3F9DbBd_normal.jpg"
"x337767301","x1482435166287106054",2022-01-15 19:31:00,"borghi_claudio","@Luca24686644 @istsupsan Avversario no, sono un vostro rappresentante e mi pare sia il minimo che voi vi possiate aspettare da chi ha questo importante ruolo.","Twitter for Android",140,,,,FALSE,TRUE,0,25,,,,,,,,,,,,,,,,"x337767301 x1354186631578865665 x2446734732","borghi_claudio Luca24686644 istsupsan","it",,,,,,,,,,,,,,,,"x1482435143700729858","@Luca24686644 @istsupsan Avversario no, sono un vostro rappresentante e mi pare sia il minimo che voi vi possiate aspettare da chi ha questo importante ruolo.",2022-01-15 19:30:55,"Twitter for Android",239,25,"x337767301","borghi_claudio","Claudio Borghi A.",125798,1335,217973,"Italia","Deputato della Repubblica Italiana eletto in Toscana per la Lega. Consigliere Comunale di Como",TRUE,,,,,,,"NA NA","NA NA","NA NA NA NA NA NA NA NA","https://twitter.com/borghi_claudio/status/1482435166287106054","Claudio Borghi A.","Italia","Deputato della Repubblica Italiana eletto in Toscana per la Lega. Consigliere Comunale di Como","https://t.co/LhQnD0sHz3",FALSE,125798,1335,855,217973,1327,2011-07-18 15:08:25,TRUE,"https://t.co/LhQnD0sHz3","http://tiny.cc/j3065y",,"https://pbs.twimg.com/profile_banners/337767301/1607040672","http://abs.twimg.com/images/themes/theme1/bg.png","http://pbs.twimg.com/profile_images/1449240289/manliorho_-_giusto_normal.jpg"
"x337767301","x1482435143700729858",2022-01-15 19:30:55,"borghi_claudio","@Luca24686644 @istsupsan Avversario no, sono un vostro rappresentante e mi pare sia il minimo che voi vi possiate aspettare da chi ha questo importante ruolo.","Twitter for Android",133,"x1482434413136949249","x1354186631578865665","Luca24686644",FALSE,FALSE,239,25,,,,,,,,,,,,,,,,"x1354186631578865665 x2446734732","Luca24686644 istsupsan","it",,,,,,,,,,,,,,,,,,,,,,,,,,,,,,,,,,,,,"NA NA","NA NA","NA NA NA NA NA NA NA NA","https://twitter.com/borghi_claudio/status/1482435143700729858","Claudio Borghi A.","Italia","Deputato della Repubblica Italiana eletto in Toscana per la Lega. Consigliere Comunale di Como","https://t.co/LhQnD0sHz3",FALSE,125798,1335,855,217973,1327,2011-07-18 15:08:25,TRUE,"https://t.co/LhQnD0sHz3","http://tiny.cc/j3065y",,"https://pbs.twimg.com/profile_banners/337767301/1607040672","http://abs.twimg.com/images/themes/theme1/bg.png","http://pbs.twimg.com/profile_images/1449240289/manliorho_-_giusto_normal.jpg"
"x337767301","x1482434097100337156",2022-01-15 19:26:45,"borghi_claudio","@Raffael54354375 @istsupsan Nelle sedi opportune non mi rispondono  a su twitter sì. Veda un po' lei se è normale.","Twitter for Android",134,,,,FALSE,TRUE,0,52,,,,,,,,,,,,,,,,"x337767301 x1456625725835030534 x2446734732","borghi_claudio Raffael54354375 istsupsan","it",,,,,,,,,,,,,,,,"x1482434071875760133","@Raffael54354375 @istsupsan Nelle sedi opportune non mi rispondono  a su twitter sì. Veda un po' lei se è normale.",2022-01-15 19:26:39,"Twitter for Android",232,52,"x337767301","borghi_claudio","Claudio Borghi A.",125798,1335,217973,"Italia","Deputato della Repubblica Italiana eletto in Toscana per la Lega. Consigliere Comunale di Como",TRUE,,,,,,,"NA NA","NA NA","NA NA NA NA NA NA NA NA","https://twitter.com/borghi_claudio/status/1482434097100337156","Claudio Borghi A.","Italia","Deputato della Repubblica Italiana eletto in Toscana per la Lega. Consigliere Comunale di Como","https://t.co/LhQnD0sHz3",FALSE,125798,1335,855,217973,1327,2011-07-18 15:08:25,TRUE,"https://t.co/LhQnD0sHz3","http://tiny.cc/j3065y",,"https://pbs.twimg.com/profile_banners/337767301/1607040672","http://abs.twimg.com/images/themes/theme1/bg.png","http://pbs.twimg.com/profile_images/1449240289/manliorho_-_giusto_normal.jpg"
"x337767301","x1482434071875760133",2022-01-15 19:26:39,"borghi_claudio","@Raffael54354375 @istsupsan Nelle sedi opportune non mi rispondono  a su twitter sì. Veda un po' lei se è normale.","Twitter for Android",86,"x1482432044508622849","x1456625725835030534","Raffael54354375",FALSE,FALSE,232,52,,,,,,,,,,,,,,,,"x1456625725835030534 x2446734732","Raffael54354375 istsupsan","it",,,,,,,,,,,,,,,,,,,,,,,,,,,,,,,,,,,,,"NA NA","NA NA","NA NA NA NA NA NA NA NA","https://twitter.com/borghi_claudio/status/1482434071875760133","Claudio Borghi A.","Italia","Deputato della Repubblica Italiana eletto in Toscana per la Lega. Consigliere Comunale di Como","https://t.co/LhQnD0sHz3",FALSE,125798,1335,855,217973,1327,2011-07-18 15:08:25,TRUE,"https://t.co/LhQnD0sHz3","http://tiny.cc/j3065y",,"https://pbs.twimg.com/profile_banners/337767301/1607040672","http://abs.twimg.com/images/themes/theme1/bg.png","http://pbs.twimg.com/profile_images/1449240289/manliorho_-_giusto_normal.jpg"
"x337767301","x1482432877379952646",2022-01-15 19:21:54,"borghi_claudio","Ah un'ultima cosa @istsupsan nel caso vi venisse la bella idea di dire che voi la mia richiesta di informazioni non l'abbiate mai ricevuta vi anticipo: non provateci.
Immaginando come sarebbe andata a finire ho usato la PEC e ho tutte le ricevute del caso. https://t.co/aWECx2QrgK","Twitter for Android",256,,,,FALSE,FALSE,736,264,,,,,,,,"http://pbs.twimg.com/media/FJKo1hIXIAQJPSx.jpg","https://t.co/aWECx2QrgK","https://twitter.com/borghi_claudio/status/1482432877379952646/photo/1","photo","http://pbs.twimg.com/media/FJKo1hIXIAQJPSx.jpg http://pbs.twimg.com/media/FJKo14LXMAQfGf6.jpg","https://t.co/aWECx2QrgK https://t.co/aWECx2QrgK","https://twitter.com/borghi_claudio/status/1482432877379952646/photo/1 https://twitter.com/borghi_claudio/status/1482432877379952646/photo/1",,"x2446734732","istsupsan","it",,,,,,,,,,,,,,,,,,,,,,,,,,,,,,,,,,,,,"NA NA","NA NA","NA NA NA NA NA NA NA NA","https://twitter.com/borghi_claudio/status/1482432877379952646","Claudio Borghi A.","Italia","Deputato della Repubblica Italiana eletto in Toscana per la Lega. Consigliere Comunale di Como","https://t.co/LhQnD0sHz3",FALSE,125798,1335,855,217973,1327,2011-07-18 15:08:25,TRUE,"https://t.co/LhQnD0sHz3","http://tiny.cc/j3065y",,"https://pbs.twimg.com/profile_banners/337767301/1607040672","http://abs.twimg.com/images/themes/theme1/bg.png","http://pbs.twimg.com/profile_images/1449240289/manliorho_-_giusto_normal.jpg"
"x337767301","x1482427850602987524",2022-01-15 19:01:56,"borghi_claudio","@istsupsan Ah capisco tutto, avete dei problemi con l'italiano, forse è per questo che non mi rispondete. Non è un'affermazione ma una DOMANDA e non sto parlando dei calcoli ma della PRESENTAZIONE dei dati. 
Nessuno vi ha mai detto ""PRESENTATE i dati in modo da DARE L'IMPRESSIONE che...""?","Twitter Web App",140,,,,FALSE,TRUE,0,77,,,,,,,,,,,,,,,,"x337767301 x2446734732","borghi_claudio istsupsan","it",,,,,,,,,,,,,,,,"x1482427791060656139","@istsupsan Ah capisco tutto, avete dei problemi con l'italiano, forse è per questo che non mi rispondete. Non è un'affermazione ma una DOMANDA e non sto parlando dei calcoli ma della PRESENTAZIONE dei dati. 
Nessuno vi ha mai detto ""PRESENTATE i dati in modo da DARE L'IMPRESSIONE che...""?",2022-01-15 19:01:42,"Twitter Web App",339,77,"x337767301","borghi_claudio","Claudio Borghi A.",125798,1335,217973,"Italia","Deputato della Repubblica Italiana eletto in Toscana per la Lega. Consigliere Comunale di Como",TRUE,,,,,,,"NA NA","NA NA","NA NA NA NA NA NA NA NA","https://twitter.com/borghi_claudio/status/1482427850602987524","Claudio Borghi A.","Italia","Deputato della Repubblica Italiana eletto in Toscana per la Lega. Consigliere Comunale di Como","https://t.co/LhQnD0sHz3",FALSE,125798,1335,855,217973,1327,2011-07-18 15:08:25,TRUE,"https://t.co/LhQnD0sHz3","http://tiny.cc/j3065y",,"https://pbs.twimg.com/profile_banners/337767301/1607040672","http://abs.twimg.com/images/themes/theme1/bg.png","http://pbs.twimg.com/profile_images/1449240289/manliorho_-_giusto_normal.jpg"
"x337767301","x1482427791060656139",2022-01-15 19:01:42,"borghi_claudio","@istsupsan Ah capisco tutto, avete dei problemi con l'italiano, forse è per questo che non mi rispondete. Non è un'affermazione ma una DOMANDA e non sto parlando dei calcoli ma della PRESENTAZIONE dei dati. 
Nessuno vi ha mai detto ""PRESENTATE i dati in modo da DARE L'IMPRESSIONE che...""?","Twitter Web App",278,"x1482424139478716417","x2446734732","istsupsan",FALSE,FALSE,339,77,,,,,,,,,,,,,,,,"x2446734732","istsupsan","it",,,,,,,,,,,,,,,,,,,,,,,,,,,,,,,,,,,,,"NA NA","NA NA","NA NA NA NA NA NA NA NA","https://twitter.com/borghi_claudio/status/1482427791060656139","Claudio Borghi A.","Italia","Deputato della Repubblica Italiana eletto in Toscana per la Lega. Consigliere Comunale di Como","https://t.co/LhQnD0sHz3",FALSE,125798,1335,855,217973,1327,2011-07-18 15:08:25,TRUE,"https://t.co/LhQnD0sHz3","http://tiny.cc/j3065y",,"https://pbs.twimg.com/profile_banners/337767301/1607040672","http://abs.twimg.com/images/themes/theme1/bg.png","http://pbs.twimg.com/profile_images/1449240289/manliorho_-_giusto_normal.jpg"
"x337767301","x1482416557783490565",2022-01-15 18:17:04,"borghi_claudio","Ah @istsupsan già che ci siete, vi sembra non dico giusto ma direi DECENTE che un Deputato della Repubblica faccia dieci interrogazioni (undici con quella di questa settimana) e non ci si degni di rispondere a NESSUNA? Siete voi a non dare i dati richiesti al ministro? https://t.co/ZNkW8Gawdy","Twitter Web App",269,,,,FALSE,FALSE,814,331,,,,,,,,"http://pbs.twimg.com/media/FJKZ9SKXoAMDmJF.png","https://t.co/ZNkW8Gawdy","https://twitter.com/borghi_claudio/status/1482416557783490565/photo/1","photo","http://pbs.twimg.com/media/FJKZ9SKXoAMDmJF.png","https://t.co/ZNkW8Gawdy","https://twitter.com/borghi_claudio/status/1482416557783490565/photo/1",,"x2446734732","istsupsan","it",,,,,,,,,,,,,,,,,,,,,,,,,,,,,,,,,,,,,"NA NA","NA NA","NA NA NA NA NA NA NA NA","https://twitter.com/borghi_claudio/status/1482416557783490565","Claudio Borghi A.","Italia","Deputato della Repubblica Italiana eletto in Toscana per la Lega. Consigliere Comunale di Como","https://t.co/LhQnD0sHz3",FALSE,125798,1335,855,217973,1327,2011-07-18 15:08:25,TRUE,"https://t.co/LhQnD0sHz3","http://tiny.cc/j3065y",,"https://pbs.twimg.com/profile_banners/337767301/1607040672","http://abs.twimg.com/images/themes/theme1/bg.png","http://pbs.twimg.com/profile_images/1449240289/manliorho_-_giusto_normal.jpg"
"x337767301","x1482413403528388624",2022-01-15 18:04:31,"borghi_claudio","Ah @istsupsan già che qui rispondete: 
Mi potreste dire se dal ministro o da qualche altro dirigente vi sia mai arrivata una qualche sollecitazione ad ""adattare"" statistiche e infografiche al fine di sostenere una qualche tesi predefinita invece di una rappresentazione neutra?","Twitter Web App",277,,,,FALSE,FALSE,863,284,,,,,,,,,,,,,,,,"x2446734732","istsupsan","it",,,,,,,,,,,,,,,,,,,,,,,,,,,,,,,,,,,,,"NA NA","NA NA","NA NA NA NA NA NA NA NA","https://twitter.com/borghi_claudio/status/1482413403528388624","Claudio Borghi A.","Italia","Deputato della Repubblica Italiana eletto in Toscana per la Lega. Consigliere Comunale di Como","https://t.co/LhQnD0sHz3",FALSE,125798,1335,855,217973,1327,2011-07-18 15:08:25,TRUE,"https://t.co/LhQnD0sHz3","http://tiny.cc/j3065y",,"https://pbs.twimg.com/profile_banners/337767301/1607040672","http://abs.twimg.com/images/themes/theme1/bg.png","http://pbs.twimg.com/profile_images/1449240289/manliorho_-_giusto_normal.jpg"
"x337767301","x1482411920430882825",2022-01-15 17:58:38,"borghi_claudio","@istsupsan @claudiocerasa Ma mi state pigliando in giro?
Ci sono due dati diversi di due milioni e mezzo su sei, fa quasi il 50%
O E' SBAGLIATO UNO O E' SBAGLIATO L'ALTRO.
Quindi sì, per me è un errore.
NB. Vi ho chiesto dei dati per telefono. Nulla. 
Ho fatto domanda di accesso agli atti. Nulla
Quindi?","Twitter Web App",140,,,,FALSE,TRUE,0,316,,,,,,,,,,,,,,,,"x337767301 x2446734732 x29045944","borghi_claudio istsupsan claudiocerasa","it",,,,,,,,,,,,,,,,"x1482411893348315138","@istsupsan @claudiocerasa Ma mi state pigliando in giro?
Ci sono due dati diversi di due milioni e mezzo su sei, fa quasi il 50%
O E' SBAGLIATO UNO O E' SBAGLIATO L'ALTRO.
Quindi sì, per me è un errore.
NB. Vi ho chiesto dei dati per telefono. Nulla. 
Ho fatto domanda di accesso agli atti. Nulla
Quindi?",2022-01-15 17:58:31,"Twitter Web App",966,316,"x337767301","borghi_claudio","Claudio Borghi A.",125798,1335,217973,"Italia","Deputato della Repubblica Italiana eletto in Toscana per la Lega. Consigliere Comunale di Como",TRUE,,,,,,,"NA NA","NA NA","NA NA NA NA NA NA NA NA","https://twitter.com/borghi_claudio/status/1482411920430882825","Claudio Borghi A.","Italia","Deputato della Repubblica Italiana eletto in Toscana per la Lega. Consigliere Comunale di Como","https://t.co/LhQnD0sHz3",FALSE,125798,1335,855,217973,1327,2011-07-18 15:08:25,TRUE,"https://t.co/LhQnD0sHz3","http://tiny.cc/j3065y",,"https://pbs.twimg.com/profile_banners/337767301/1607040672","http://abs.twimg.com/images/themes/theme1/bg.png","http://pbs.twimg.com/profile_images/1449240289/manliorho_-_giusto_normal.jpg"
"x337767301","x1482411893348315138",2022-01-15 17:58:31,"borghi_claudio","@istsupsan @claudiocerasa Ma mi state pigliando in giro?
Ci sono due dati diversi di due milioni e mezzo su sei, fa quasi il 50%
O E' SBAGLIATO UNO O E' SBAGLIATO L'ALTRO.
Quindi sì, per me è un errore.
NB. Vi ho chiesto dei dati per telefono. Nulla. 
Ho fatto domanda di accesso agli atti. Nulla
Quindi?","Twitter Web App",278,"x1482410273462005768","x2446734732","istsupsan",FALSE,FALSE,966,316,,,,,,,,,,,,,,,,"x2446734732 x29045944","istsupsan claudiocerasa","it",,,,,,,,,,,,,,,,,,,,,,,,,,,,,,,,,,,,,"NA NA","NA NA","NA NA NA NA NA NA NA NA","https://twitter.com/borghi_claudio/status/1482411893348315138","Claudio Borghi A.","Italia","Deputato della Repubblica Italiana eletto in Toscana per la Lega. Consigliere Comunale di Como","https://t.co/LhQnD0sHz3",FALSE,125798,1335,855,217973,1327,2011-07-18 15:08:25,TRUE,"https://t.co/LhQnD0sHz3","http://tiny.cc/j3065y",,"https://pbs.twimg.com/profile_banners/337767301/1607040672","http://abs.twimg.com/images/themes/theme1/bg.png","http://pbs.twimg.com/profile_images/1449240289/manliorho_-_giusto_normal.jpg"
