"x384927198","x1547273066119561216",2022-07-13 17:33:40,"gparagone","A Roma in piazza #tassisti a @Palazzo_Chigi oggi, ristoratori DOMANI….

Davanti al @MEF_GOV, a chiedere al ""non pervenuto"" Ministro Franco se.... ha tempo per occuparsi dell’Economia REALE.

#MioItalia @PaoloBianchini #14juillet #UberFiles #taxi","Twitter Web App",245,,,,FALSE,FALSE,92,22,,,"tassisti MioItalia 14juillet UberFiles taxi",,,,,,,,,,,,,"x963938472 x1488372031 x71424627","Palazzo_Chigi MEF_GOV Paolobianchini","it",,,,,,,,,,,,,,,,,,,,,,,,,,,,,,,,,,,,,"NA NA","NA NA","NA NA NA NA NA NA NA NA","https://twitter.com/gparagone/status/1547273066119561216","Gianluigi Paragone","","Ribelle per Costituzione","https://t.co/GMVG8hvFxK",FALSE,166563,743,813,29312,1816,2011-10-04 15:36:54,TRUE,"https://t.co/GMVG8hvFxK","http://www.ilparagone.it",,"https://pbs.twimg.com/profile_banners/384927198/1396696737","http://abs.twimg.com/images/themes/theme1/bg.png","http://pbs.twimg.com/profile_images/1013755932772388864/IPHQNqB4_normal.jpg"
"x384927198","x1547262705509273601",2022-07-13 16:52:30,"gparagone","“Tempesta perfetta”

#Cingolani non è George Clooney e quel film NON aveva un lieto fine.
👇
https://t.co/itTD9VbE2I  #razionamenti","Twitter Web App",130,,,,FALSE,FALSE,35,9,,,"Cingolani razionamenti",,"ilparagone.it/attualita/lita…","https://t.co/itTD9VbE2I","https://www.ilparagone.it/attualita/litalia-si-blocchera-ecco-come-il-governo-e-cingolani-hanno-preparato-la-tempesta-perfetta/",,,,,,,,,,,"it",,,,,,,,,,,,,,,,,,,,,,,,,,,,,,,,,,,,,"NA NA","NA NA","NA NA NA NA NA NA NA NA","https://twitter.com/gparagone/status/1547262705509273601","Gianluigi Paragone","","Ribelle per Costituzione","https://t.co/GMVG8hvFxK",FALSE,166563,743,813,29312,1816,2011-10-04 15:36:54,TRUE,"https://t.co/GMVG8hvFxK","http://www.ilparagone.it",,"https://pbs.twimg.com/profile_banners/384927198/1396696737","http://abs.twimg.com/images/themes/theme1/bg.png","http://pbs.twimg.com/profile_images/1013755932772388864/IPHQNqB4_normal.jpg"
"x384927198","x1547178428809494528",2022-07-13 11:17:37,"gparagone","#Taxi, Gianluigi #Paragone al sit-in degli incatenati davanti a Palazzo Chigi @gparagone #governo #ddlconcorrenza #13luglio #iltempoquotidiano  https://t.co/lYQv8a4sUU https://t.co/zTj1PULn4m","Twitter for Android",140,,,,FALSE,TRUE,0,19,,,"Taxi Paragone governo ddlconcorrenza 13luglio",,,,,,,,,,,,,"x78567974 x384927198","tempoweb gparagone","it",,,,,,,,,,,,,,,,"x1547152023891726336","#Taxi, Gianluigi #Paragone al sit-in degli incatenati davanti a Palazzo Chigi @gparagone #governo #ddlconcorrenza #13luglio #iltempoquotidiano  https://t.co/lYQv8a4sUU https://t.co/zTj1PULn4m",2022-07-13 09:32:41,"Il Tempo",48,19,"x78567974","tempoweb","IL TEMPO",94613,1401,101702,"Rome","Segui Il Tempo Quotidiano Indipendente📰 
Ultim'ora, notizie e video in un tweet",FALSE,,,,,,,"NA NA","NA NA","NA NA NA NA NA NA NA NA","https://twitter.com/gparagone/status/1547178428809494528","Gianluigi Paragone","","Ribelle per Costituzione","https://t.co/GMVG8hvFxK",FALSE,166563,743,813,29312,1816,2011-10-04 15:36:54,TRUE,"https://t.co/GMVG8hvFxK","http://www.ilparagone.it",,"https://pbs.twimg.com/profile_banners/384927198/1396696737","http://abs.twimg.com/images/themes/theme1/bg.png","http://pbs.twimg.com/profile_images/1013755932772388864/IPHQNqB4_normal.jpg"
"x384927198","x1547169618954952708",2022-07-13 10:42:36,"gparagone","Tutti adesso vorrebbero recitare la migliore parte in copione e così anche #Salvini

Anziché provare a fare il ""figo"", dovrebbe però dire che il suo Ministro si chiama #Lamorgese.

#elezioni #crisidigoverno @matteosalvinimi @LegaSalvini","Twitter Web App",236,,,,FALSE,FALSE,169,36,,,"Salvini Lamorgese elezioni crisidigoverno",,,,,,,,,,,,,"x270839361 x13514762","matteosalvinimi LegaSalvini","it",,,,,,,,,,,,,,,,,,,,,,,,,,,,,,,,,,,,,"NA NA","NA NA","NA NA NA NA NA NA NA NA","https://twitter.com/gparagone/status/1547169618954952708","Gianluigi Paragone","","Ribelle per Costituzione","https://t.co/GMVG8hvFxK",FALSE,166563,743,813,29312,1816,2011-10-04 15:36:54,TRUE,"https://t.co/GMVG8hvFxK","http://www.ilparagone.it",,"https://pbs.twimg.com/profile_banners/384927198/1396696737","http://abs.twimg.com/images/themes/theme1/bg.png","http://pbs.twimg.com/profile_images/1013755932772388864/IPHQNqB4_normal.jpg"
"x384927198","x1547156869600485376",2022-07-13 09:51:57,"gparagone","#Tassisti incatenati davanti a @Palazzo_Chigi ....

La SOLIDARIETÀ di #Italexit ai tempi di #Uberlandia. 

#Draghistan #UberFiles #taxi #Lavoro https://t.co/p2yYj0iG9G","Twitter for Android",143,,,,FALSE,FALSE,223,45,,,"Tassisti Italexit Uberlandia Draghistan UberFiles taxi Lavoro",,,,,"http://pbs.twimg.com/media/FXia-IjWQAAhLpU.jpg","https://t.co/p2yYj0iG9G","https://twitter.com/gparagone/status/1547156869600485376/photo/1","photo","http://pbs.twimg.com/media/FXia-IjWQAAhLpU.jpg","https://t.co/p2yYj0iG9G","https://twitter.com/gparagone/status/1547156869600485376/photo/1",,"x963938472","Palazzo_Chigi","it",,,,,,,,,,,,,,,,,,,,,,,,,,,,,,,,,,,,,"NA NA","NA NA","NA NA NA NA NA NA NA NA","https://twitter.com/gparagone/status/1547156869600485376","Gianluigi Paragone","","Ribelle per Costituzione","https://t.co/GMVG8hvFxK",FALSE,166563,743,813,29312,1816,2011-10-04 15:36:54,TRUE,"https://t.co/GMVG8hvFxK","http://www.ilparagone.it",,"https://pbs.twimg.com/profile_banners/384927198/1396696737","http://abs.twimg.com/images/themes/theme1/bg.png","http://pbs.twimg.com/profile_images/1013755932772388864/IPHQNqB4_normal.jpg"
"x137288817","x1547102965579800576",2022-07-13 06:17:45,"SimoPillon","Quanto odiano il matrimonio quelli di Repubblica? Altro che normalità del divorzio e favola del matrimonio. La normalità per la maggior parte delle coppie si chiama matrimonio.

▶️ Post completo: https://t.co/iu8vrCoeSy https://t.co/RpDG82MMcL","Twitter for iPhone",219,,,,FALSE,FALSE,110,11,,,,,"facebook.com/10004413992435…","https://t.co/iu8vrCoeSy","https://www.facebook.com/100044139924353/posts/pfbid02PRfr6RXVSSJJEar38hBm381xjwej7nMerR7r9Cx5jwdiBcMGHbtjaJVATBTZ7xtil/?d=n","http://pbs.twimg.com/media/FXhp8fxWIAAHdGI.jpg","https://t.co/RpDG82MMcL","https://twitter.com/SimoPillon/status/1547102965579800576/photo/1","photo","http://pbs.twimg.com/media/FXhp8fxWIAAHdGI.jpg","https://t.co/RpDG82MMcL","https://twitter.com/SimoPillon/status/1547102965579800576/photo/1",,,,"it",,,,,,,,,,,,,,,,,,,,,,,,,,,,,,,,,,,,,"NA NA","NA NA","NA NA NA NA NA NA NA NA","https://twitter.com/SimoPillon/status/1547102965579800576","Simone Pillon","Perugia","Marito, padre di 3 figli, avvocato cassazionista, già Presidente Forum Famiglie Umbria e cofondatore del Family Day. Senatore della #Lega.","https://t.co/6dder7smIE",FALSE,8899,455,0,1089,237,2010-04-26 10:24:56,TRUE,"https://t.co/6dder7smIE","http://www.senato.it/leg/18/BGT/Schede/Attsen/00032690.htm",,"https://pbs.twimg.com/profile_banners/137288817/1520701434","http://abs.twimg.com/images/themes/theme1/bg.png","http://pbs.twimg.com/profile_images/1008224824613851136/KAG6sIFq_normal.jpg"
"x102672182","x1547339441550884865",2022-07-13 21:57:25,"robertapinotti","La cultura 5S sta portando il Paese nel baratro. In un momento della storia così difficile per la guerra, la pandemia,l’inflazione crescente e la gestione del Pnrr occorre rimanere uniti nelle differenze. Il Paese non può capire che l’interesse di parte prevalga sul bene di tutti https://t.co/BwwkDdXtC7","Twitter for iPhone",140,,,,FALSE,TRUE,0,12,,,,,,,,,,,,,,,,"x279211405","OcchettaF","it",,,,,,,,,,,,,,,,"x1547339009738817536","La cultura 5S sta portando il Paese nel baratro. In un momento della storia così difficile per la guerra, la pandemia,l’inflazione crescente e la gestione del Pnrr occorre rimanere uniti nelle differenze. Il Paese non può capire che l’interesse di parte prevalga sul bene di tutti https://t.co/BwwkDdXtC7",2022-07-13 21:55:42,"Twitter for iPhone",13,12,"x279211405","OcchettaF","Francesco Occhetta",10877,934,17391,"Italia, Roma","Gesuita, scrittore, insegno presso @UniGregoriana coordino @connessioniFP Segretario Generale Fondazione vaticana @FratellituttiF",FALSE,,,,,,,"NA NA","NA NA","NA NA NA NA NA NA NA NA","https://twitter.com/robertapinotti/status/1547339441550884865","Roberta Pinotti","","Senatrice del Partito Democratico","https://t.co/ZQoLx1Tx21",FALSE,123814,1799,750,11417,3780,2010-01-07 13:03:42,TRUE,"https://t.co/ZQoLx1Tx21","http://www.robertapinotti.it",,"https://pbs.twimg.com/profile_banners/102672182/1522225477","http://abs.twimg.com/images/themes/theme1/bg.png","http://pbs.twimg.com/profile_images/1093446366997684224/pnplPDaI_normal.jpg"
"x102672182","x1547293116276817920",2022-07-13 18:53:20,"robertapinotti","Il successo del lancio di #VegaC conferma la leadership dell’Italia e dell’Europa nello Spazio, anche come elemento centrale per la Difesa Comune Europea. Complimenti a @esa @asi_spazio e @avio_group per il risultato raggiunto. https://t.co/eLIMQIIogG","Twitter for iPhone",227,,,,FALSE,FALSE,39,10,,,"VegaC",,,,,"http://pbs.twimg.com/media/FXkW4ocX0AI5olM.jpg","https://t.co/eLIMQIIogG","https://twitter.com/robertapinotti/status/1547293116276817920/photo/1","photo","http://pbs.twimg.com/media/FXkW4ocX0AI5olM.jpg","https://t.co/eLIMQIIogG","https://twitter.com/robertapinotti/status/1547293116276817920/photo/1",,"x21436960 x412080599 x337679837","esa ASI_spazio Avio_Group","it",,,,,,,,,,,,,,,,,,,,,,,,,,,,,,,,,,,,,"NA NA","NA NA","NA NA NA NA NA NA NA NA","https://twitter.com/robertapinotti/status/1547293116276817920","Roberta Pinotti","","Senatrice del Partito Democratico","https://t.co/ZQoLx1Tx21",FALSE,123814,1799,750,11417,3780,2010-01-07 13:03:42,TRUE,"https://t.co/ZQoLx1Tx21","http://www.robertapinotti.it",,"https://pbs.twimg.com/profile_banners/102672182/1522225477","http://abs.twimg.com/images/themes/theme1/bg.png","http://pbs.twimg.com/profile_images/1093446366997684224/pnplPDaI_normal.jpg"
"x102672182","x1547282424639492097",2022-07-13 18:10:51,"robertapinotti","""In questo momento delicato e complesso per il futuro del Paese il @pdnetwork è forza responsabile a sostegno del #GovernoDraghi"".

@robertapinotti https://t.co/WpGrmTNwRY","Twitter for iPhone",140,,,,FALSE,TRUE,0,3,,,,,,,,,,,,,,,,"x404048864 x13294452","SenatoriPD pdnetwork","it",,,,,,,,,,,,,,,,"x1547257641713508353","""In questo momento delicato e complesso per il futuro del Paese il @pdnetwork è forza responsabile a sostegno del #GovernoDraghi"".

@robertapinotti https://t.co/WpGrmTNwRY",2022-07-13 16:32:23,"Twitter Web App",9,3,"x404048864","SenatoriPD","Senatori Pd",61925,9738,145329,"Senato della Repubblica - Roma","Il gruppo del Partito Democratico al Senato",FALSE,,,,,,,"NA NA","NA NA","NA NA NA NA NA NA NA NA","https://twitter.com/robertapinotti/status/1547282424639492097","Roberta Pinotti","","Senatrice del Partito Democratico","https://t.co/ZQoLx1Tx21",FALSE,123814,1799,750,11417,3780,2010-01-07 13:03:42,TRUE,"https://t.co/ZQoLx1Tx21","http://www.robertapinotti.it",,"https://pbs.twimg.com/profile_banners/102672182/1522225477","http://abs.twimg.com/images/themes/theme1/bg.png","http://pbs.twimg.com/profile_images/1093446366997684224/pnplPDaI_normal.jpg"
"x102672182","x1547222718034153478",2022-07-13 14:13:36,"robertapinotti","Assemblea congiunta dei gruppi parlamentari @senatoripd e @deputatipd con il Segretario @EnricoLetta. In questo momento delicato e complesso per il futuro del Paese il @pdnetwork è forza responsabile a sostegno del  #GovernoDraghi. https://t.co/g3D5o1RJ2W","Twitter for iPhone",231,,,,FALSE,FALSE,29,8,,,"GovernoDraghi",,,,,"http://pbs.twimg.com/media/FXjW2qCWYAAY6xr.jpg","https://t.co/g3D5o1RJ2W","https://twitter.com/robertapinotti/status/1547222718034153478/photo/1","photo","http://pbs.twimg.com/media/FXjW2qCWYAAY6xr.jpg http://pbs.twimg.com/media/FXjW2yKWAAAukwu.jpg","https://t.co/g3D5o1RJ2W https://t.co/g3D5o1RJ2W","https://twitter.com/robertapinotti/status/1547222718034153478/photo/1 https://twitter.com/robertapinotti/status/1547222718034153478/photo/1",,"x404048864 x76616277 x419622371 x13294452","SenatoriPD Deputatipd EnricoLetta pdnetwork","it",,,,,,,,,,,,,,,,,,,,,,,,,,,,,,,,,,,,,"NA NA","NA NA","NA NA NA NA NA NA NA NA","https://twitter.com/robertapinotti/status/1547222718034153478","Roberta Pinotti","","Senatrice del Partito Democratico","https://t.co/ZQoLx1Tx21",FALSE,123814,1799,750,11417,3780,2010-01-07 13:03:42,TRUE,"https://t.co/ZQoLx1Tx21","http://www.robertapinotti.it",,"https://pbs.twimg.com/profile_banners/102672182/1522225477","http://abs.twimg.com/images/themes/theme1/bg.png","http://pbs.twimg.com/profile_images/1093446366997684224/pnplPDaI_normal.jpg"
"x3062283743","x1547336988533133313",2022-07-13 21:47:40,"pirroelisa","Secondo Orlando da parte della maggioranza c’è stata una sottovalutazione delle istanze del #M5S e si rischia un fallo di reazione… in realtà ci hanno dato decine di calci sui denti e finalmente alziamo un braccio a parare l’ennesimo colpo, altro che fallo di reazione…","Twitter for iPhone",269,,,,FALSE,FALSE,10,5,,,"M5S",,,,,,,,,,,,,,,"it",,,,,,,,,,,,,,,,,,,,,,,,,,,,,,,,,,,,,"NA NA","NA NA","NA NA NA NA NA NA NA NA","https://twitter.com/pirroelisa/status/1547336988533133313","Elisa Pirro","Orbassano, Piemonte","Senatrice della Repubblica @M5S_Senato @Mov5Stelle. Capogruppo della 12ª Commissione permanente (Igiene e Sanità) del Senato",,FALSE,1843,233,23,1831,5961,2015-02-25 15:22:04,TRUE,,,,"https://pbs.twimg.com/profile_banners/3062283743/1632556454","http://abs.twimg.com/images/themes/theme1/bg.png","http://pbs.twimg.com/profile_images/1453376367471570955/OAKjL3bH_normal.jpg"
"x14460250","x1547160724769837058",2022-07-13 10:07:16,"giannipittella","maurizio, amico mio, riprenditi presto! abbiamo bisogno della bellezza delle parole, delle immagini, delle tue narrazioni.
#degiovanni https://t.co/ikz1zPDUrT","Twitter for Android",134,,,,FALSE,FALSE,18,4,,,"degiovanni",,,,,"http://pbs.twimg.com/media/FXieeuOXoAU5f9Z.jpg","https://t.co/ikz1zPDUrT","https://twitter.com/giannipittella/status/1547160724769837058/photo/1","photo","http://pbs.twimg.com/media/FXieeuOXoAU5f9Z.jpg","https://t.co/ikz1zPDUrT","https://twitter.com/giannipittella/status/1547160724769837058/photo/1",,,,"it",,,,,,,,,,,,,,,,,,,,,,,,,,,,,,,,,,,,,"NA NA","NA NA","NA NA NA NA NA NA NA NA","https://twitter.com/giannipittella/status/1547160724769837058","Gianni Pittella","Italy","Sindaco di Lauria. Senatore del Partito Democratico. Già Presidente del Gruppo S&D al Parlamento europeo.","https://t.co/ADr1Ug2PX1",FALSE,39628,7812,695,20756,1502,2008-04-21 09:58:18,TRUE,"https://t.co/ADr1Ug2PX1","http://www.giannipittella.com",,"https://pbs.twimg.com/profile_banners/14460250/1563094194","http://abs.twimg.com/images/themes/theme1/bg.png","http://pbs.twimg.com/profile_images/1316112762536419332/JuSOegdn_normal.jpg"
"x3358881567","x1547325704026705922",2022-07-13 21:02:50,"PucciarelliLega","Al primo convegno annuale del Centro Studi Machiavelli per quanto riguarda la Difesa presso la Camera dei Deputati (palazzo dei gruppi).

https://t.co/jnidLN6ueM https://t.co/beoq1uW9go","Twitter Web App",161,,,,FALSE,FALSE,5,5,,,,,"facebook.com/StefaniaPuccia…","https://t.co/jnidLN6ueM","https://www.facebook.com/StefaniaPucciarelli.Lega/posts/pfbid0a1yjGtT2ncEYwDeacoTrdVbHAESGZZ76iikUNKsspoHvbAdBBdUNHPKYgeLkVxR4l","http://pbs.twimg.com/media/FXk0fzeXwAIkpFB.jpg","https://t.co/beoq1uW9go","https://twitter.com/PucciarelliLega/status/1547325704026705922/photo/1","photo","http://pbs.twimg.com/media/FXk0fzeXwAIkpFB.jpg http://pbs.twimg.com/media/FXk0fzsXEAIm4xb.jpg","https://t.co/beoq1uW9go https://t.co/beoq1uW9go","https://twitter.com/PucciarelliLega/status/1547325704026705922/photo/1 https://twitter.com/PucciarelliLega/status/1547325704026705922/photo/1",,,,"it",,,,,,,,,,,,,,,,,,,,,,,,,,,,,,,,,,,,,"NA NA","NA NA","NA NA NA NA NA NA NA NA","https://twitter.com/PucciarelliLega/status/1547325704026705922","Stefania Pucciarelli","","Senatrice della #Lega, Sottosegretario di Stato al Ministero della Difesa 🇮🇹","https://t.co/yVArIYFe54",FALSE,1647,300,21,1290,200,2015-07-04 16:46:43,TRUE,"https://t.co/yVArIYFe54","http://stefaniapucciarelli.it",,"https://pbs.twimg.com/profile_banners/3358881567/1616173825","http://abs.twimg.com/images/themes/theme1/bg.png","http://pbs.twimg.com/profile_images/1372958645944729607/A64UTDLI_normal.jpg"
"x558591392","x1547161852697886721",2022-07-13 10:11:45,"QuagliarielloG","Forza #MaurizioDeGiovanni, oggi il mio tifo è tutto e solo per te 💙 @MdGOfficial","Twitter for iPhone",80,,,,FALSE,FALSE,3,0,,,"MaurizioDeGiovanni",,,,,,,,,,,,,"x417392878","MdGOfficial","it",,,,,,,,,,,,,,,,,,,,,,,,,,,,,,,,,,,,,"NA NA","NA NA","NA NA NA NA NA NA NA NA","https://twitter.com/QuagliarielloG/status/1547161852697886721","GaetanoQuagliariello","Roma","Tifoso del Napoli, senatore, coordinatore nazionale “Italia al Centro”",,FALSE,45901,997,371,2767,835,2012-04-20 12:26:53,FALSE,,,,"https://pbs.twimg.com/profile_banners/558591392/1656696557","http://abs.twimg.com/images/themes/theme16/bg.gif","http://pbs.twimg.com/profile_images/960595536209481728/kscTuSW-_normal.jpg"
"x376610294","x1547331428580483072",2022-07-13 21:25:35,"isabellarauti","Utero in affitto. Stop a registri anagrafe figli coppie omogenitoriali. Ministro Lamorgese faccia rispettare legge https://t.co/gfUiCEByMD via @vocedelpatriota @FratellidItalia @FDI_Parlamento @GiorgiaMeloni #dipartimento #pariopportunita #famiglia #valoriNonNegoziabili","Twitter for iPhone",270,,,,FALSE,FALSE,2,1,,,"dipartimento pariopportunita famiglia valoriNonNegoziabili",,"lavocedelpatriota.it/utero-in-affit…","https://t.co/gfUiCEByMD","https://www.lavocedelpatriota.it/utero-in-affitto-rauti-fdi-stop-a-registri-anagrafe-figli-coppie-omogenitoriali-ministro-lamorgese-faccia-rispettare-legge/",,,,,,,,,"x998237902055395328 x1024976264 x985177119624966147 x130537001","vocedelpatriota FratellidItalia FDI_Parlamento GiorgiaMeloni","it",,,,,,,,,,,,,,,,,,,,,,,,,,,,,,,,,,,,,"NA NA","NA NA","NA NA NA NA NA NA NA NA","https://twitter.com/isabellarauti/status/1547331428580483072","Isabella Rauti","","Giornalista, Dottore di Ricerca, Uff Esercito 🇮🇹, Senatrice, Vice Pres Gruppo FDI, Comm Difesa, Dipartimento Famiglia FDI, Associazione Pino Rauti, Onlus HOW","https://t.co/IE1TYO9vGj",FALSE,13051,5565,124,27305,16060,2011-09-20 05:48:40,TRUE,"https://t.co/IE1TYO9vGj","http://www.Isabellarauti.it",,"https://pbs.twimg.com/profile_banners/376610294/1580146815","http://abs.twimg.com/images/themes/theme1/bg.png","http://pbs.twimg.com/profile_images/699248798707621888/sTn5ZaWE_normal.jpg"
"x376610294","x1547310498831540225",2022-07-13 20:02:25,"isabellarauti","STOP ALLA TRASCRIZIONE ANAGRAFICA DEI FIGLI DELLE COPPIE OMOGENITORIALI
La legge non lo consente! @GiorgiaMeloni @FratellidItalia @vocedelpatriota @FDI_Parlamento NO #Uteroinaffitto #maternitasurrogata https://t.co/SgopNNEF48","Twitter for iPhone",201,,,,FALSE,FALSE,7,3,,,"Uteroinaffitto maternitasurrogata",,,,,"http://pbs.twimg.com/media/FXkmslLXEAMDdcy.jpg","https://t.co/SgopNNEF48","https://twitter.com/isabellarauti/status/1547310498831540225/photo/1","photo","http://pbs.twimg.com/media/FXkmslLXEAMDdcy.jpg","https://t.co/SgopNNEF48","https://twitter.com/isabellarauti/status/1547310498831540225/photo/1",,"x130537001 x1024976264 x998237902055395328 x985177119624966147","GiorgiaMeloni FratellidItalia vocedelpatriota FDI_Parlamento","it",,,,,,,,,,,,,,,,,,,,,,,,,,,,,,,,,,,,,"NA NA","NA NA","NA NA NA NA NA NA NA NA","https://twitter.com/isabellarauti/status/1547310498831540225","Isabella Rauti","","Giornalista, Dottore di Ricerca, Uff Esercito 🇮🇹, Senatrice, Vice Pres Gruppo FDI, Comm Difesa, Dipartimento Famiglia FDI, Associazione Pino Rauti, Onlus HOW","https://t.co/IE1TYO9vGj",FALSE,13051,5565,124,27305,16060,2011-09-20 05:48:40,TRUE,"https://t.co/IE1TYO9vGj","http://www.Isabellarauti.it",,"https://pbs.twimg.com/profile_banners/376610294/1580146815","http://abs.twimg.com/images/themes/theme1/bg.png","http://pbs.twimg.com/profile_images/699248798707621888/sTn5ZaWE_normal.jpg"
"x376610294","x1547285601644412931",2022-07-13 18:23:29,"isabellarauti","#fdi SCENARIO KAFKIANO,ELEZIONI SUBITO! Si sta configurando una situazione surreale; è evidente che la scissione dei 5stelle ha indebolito il Governo ma l'esecutivo fa finta di nulla.l'italia è ostaggio di beghe di  maggioranza 👇 
Intervista a #9Colonne  https://t.co/KjdUfWvX3Z","Twitter for iPhone",278,,,,FALSE,FALSE,1,2,,,"fdi 9Colonne",,"fb.watch/eeNp22Vlm2/","https://t.co/KjdUfWvX3Z","https://fb.watch/eeNp22Vlm2/",,,,,,,,,,,"it",,,,,,,,,,,,,,,,,,,,,,,,,,,,,,,,,,,,,"NA NA","NA NA","NA NA NA NA NA NA NA NA","https://twitter.com/isabellarauti/status/1547285601644412931","Isabella Rauti","","Giornalista, Dottore di Ricerca, Uff Esercito 🇮🇹, Senatrice, Vice Pres Gruppo FDI, Comm Difesa, Dipartimento Famiglia FDI, Associazione Pino Rauti, Onlus HOW","https://t.co/IE1TYO9vGj",FALSE,13051,5565,124,27305,16060,2011-09-20 05:48:40,TRUE,"https://t.co/IE1TYO9vGj","http://www.Isabellarauti.it",,"https://pbs.twimg.com/profile_banners/376610294/1580146815","http://abs.twimg.com/images/themes/theme1/bg.png","http://pbs.twimg.com/profile_images/699248798707621888/sTn5ZaWE_normal.jpg"
"x18762875","x1547234031955214337",2022-07-13 14:58:34,"matteorenzi","il tramonto di quell’aggressivo e blandito gruppo di potere che in questi anni è stato il M5S è impressionante, l’orrore del vuoto è ormai approdato allo stadio del panico.","Twitter Web App",140,,,,FALSE,TRUE,0,247,,,,,,,,,,,,,,,,"x497995758","jacopo_iacoboni","it",,,,,,,,,,,,,,,,"x1547196203074461696","il tramonto di quell’aggressivo e blandito gruppo di potere che in questi anni è stato il M5S è impressionante, l’orrore del vuoto è ormai approdato allo stadio del panico.",2022-07-13 12:28:14,"Twitter for iPhone",1517,247,"x497995758","jacopo_iacoboni","jacopo iacoboni",99300,2780,66554,"europe","@LaStampa writer | books L’Esperimento, L’Esecuzione, Oligarchi (How Putin’s Friends buy Italy), Oct 2021 | Не забудем и не простим jiacoboni@protonmail.com",FALSE,,,,,,,"NA NA","NA NA","NA NA NA NA NA NA NA NA","https://twitter.com/matteorenzi/status/1547234031955214337","Matteo Renzi","Italy","Senatore di Firenze - @ItaliaViva","https://t.co/c8MoZ1Wbev",FALSE,3350452,980,7446,13848,466,2009-01-08 13:15:21,TRUE,"https://t.co/c8MoZ1Wbev","https://linktr.ee/matteorenzi",,"https://pbs.twimg.com/profile_banners/18762875/1632829942","http://abs.twimg.com/images/themes/theme1/bg.png","http://pbs.twimg.com/profile_images/1463528035798376449/TUDITp4H_normal.jpg"
"x18762875","x1547197634087161859",2022-07-13 12:33:56,"matteorenzi","Penso che così il Governo non vada più avanti. Meglio un Draghi bis senza grillini o le elezioni. Ne ho parlato oggi con La Nazione QN
https://t.co/zeCu4LqLDm","Twitter for iPhone",158,,,,FALSE,FALSE,535,146,,,,,"matteorenzi.it/renzi_basta_ri…","https://t.co/zeCu4LqLDm","https://www.matteorenzi.it/renzi_basta_ricatti_facciamo_draghi_bis_senza_grillini",,,,,,,,,,,"it",,,,,,,,,,,,,,,,,,,,,,,,,,,,,,,,,,,,,"NA NA","NA NA","NA NA NA NA NA NA NA NA","https://twitter.com/matteorenzi/status/1547197634087161859","Matteo Renzi","Italy","Senatore di Firenze - @ItaliaViva","https://t.co/c8MoZ1Wbev",FALSE,3350452,980,7446,13848,466,2009-01-08 13:15:21,TRUE,"https://t.co/c8MoZ1Wbev","https://linktr.ee/matteorenzi",,"https://pbs.twimg.com/profile_banners/18762875/1632829942","http://abs.twimg.com/images/themes/theme1/bg.png","http://pbs.twimg.com/profile_images/1463528035798376449/TUDITp4H_normal.jpg"
"x395183088","x1547330773027536897",2022-07-13 21:22:58,"MatteoRichetti","La linea di @Azione_it è netta: si vada avanti con #Draghi senza 5S fino a fine legislatura. Di tutto abbiamo bisogno tranne che di correre alle elezioni in mezzo a una crisi che diventerebbe subito uno tsunami, per poi ritrovarci con l’ennesima maggioranza incapace di governare.","Twitter for iPhone",140,,,,FALSE,TRUE,0,97,,,"Draghi",,,,,,,,,,,,,"x2416067982 x1001344387102728194","CarloCalenda Azione_it","it",,,,,,,,,,,,,,,,"x1547324478845239298","La linea di @Azione_it è netta: si vada avanti con #Draghi senza 5S fino a fine legislatura. Di tutto abbiamo bisogno tranne che di correre alle elezioni in mezzo a una crisi che diventerebbe subito uno tsunami, per poi ritrovarci con l’ennesima maggioranza incapace di governare.",2022-07-13 20:57:58,"Twitter for iPhone",1061,97,"x2416067982","CarloCalenda","Carlo Calenda",352433,169,33139,"Roma","L’Italia è più forte di chi la vuole debole. Only a Sith deals in absolutes. @Azione_it La libertà che non libera: https://t.co/dYBNv1Rv6p",TRUE,,,,,,,"NA NA","NA NA","NA NA NA NA NA NA NA NA","https://twitter.com/MatteoRichetti/status/1547330773027536897","Matteo Richetti","","Senatore della Repubblica. @Azione_it","https://t.co/duGJXuHHqq",FALSE,60970,302,355,5172,4067,2011-10-21 08:15:44,TRUE,"https://t.co/duGJXuHHqq","http://www.matteorichetti.it",,"https://pbs.twimg.com/profile_banners/395183088/1651131592","http://abs.twimg.com/images/themes/theme1/bg.png","http://pbs.twimg.com/profile_images/1541427718797070336/xeokMUqc_normal.jpg"
