"x6827962","x1536259442219503616",2022-06-13 08:09:28,"antoniopalmieri","Sette sfumature di giallo. Il segreto di una vacanza felice. Buon lunedì e buona settimana a tutti https://t.co/fvCCfDPttM #ultimobanco via @Corriere","Twitter for Android",139,,,,FALSE,TRUE,0,9,,,,,"trib.al/3ndTskc","https://t.co/fvCCfDPttM","https://trib.al/3ndTskc",,,,,,,,,"x205706610","aledavenia","it",,,,,,,,,,,,,,,,"x1536231082693210113","Sette sfumature di giallo. Il segreto di una vacanza felice. Buon lunedì e buona settimana a tutti https://t.co/fvCCfDPttM #ultimobanco via @Corriere",2022-06-13 06:16:46,"Twitter for iPhone",50,9,"x205706610","aledavenia","Alessandro D'Avenia",51589,2364,21093,"Milano-Roma-Palermo","Writer&Teacher - Tanti alunni, qualche libro. Gli ultimi: L’appello, Ogni storia è una storia d'amore, L'arte di essere fragili. Sul @Corriere ogni lunedì",FALSE,,,,,,,"NA NA","NA NA","NA NA NA NA NA NA NA NA","https://twitter.com/antoniopalmieri/status/1536259442219503616","Antonio Palmieri","Italia","Sposato, due figli; milanese interista; cattolico peccatore. Deputato; responsabile campagne elettorali e web @forza_italia. Pro innovazione sociale e digitale.","https://t.co/lh0A5TNBMz",FALSE,18992,4339,501,27080,12546,2007-06-15 07:17:03,TRUE,"https://t.co/lh0A5TNBMz","https://amzn.to/3DY1r9E",,"https://pbs.twimg.com/profile_banners/6827962/1653639598","http://abs.twimg.com/images/themes/theme4/bg.gif","http://pbs.twimg.com/profile_images/1308063812935974913/Gd3PpDTa_normal.jpg"
"x6827962","x1536231214507515904",2022-06-13 06:17:17,"antoniopalmieri","@Antonio77013179 Buon onomastico 🙂 #13giugno #SantAntonio","Twitter for Android",40,"x1536223288736849920","x1213121477756641285","Antonio77013179",FALSE,FALSE,0,0,,,"13giugno SantAntonio",,,,,,,,,,,,,"x1213121477756641285","Antonio77013179","it",,,,,,,,,,,,,,,,,,,,,,,,,,,,,,,,,,,,,"NA NA","NA NA","NA NA NA NA NA NA NA NA","https://twitter.com/antoniopalmieri/status/1536231214507515904","Antonio Palmieri","Italia","Sposato, due figli; milanese interista; cattolico peccatore. Deputato; responsabile campagne elettorali e web @forza_italia. Pro innovazione sociale e digitale.","https://t.co/lh0A5TNBMz",FALSE,18992,4339,501,27080,12546,2007-06-15 07:17:03,TRUE,"https://t.co/lh0A5TNBMz","https://amzn.to/3DY1r9E",,"https://pbs.twimg.com/profile_banners/6827962/1653639598","http://abs.twimg.com/images/themes/theme4/bg.gif","http://pbs.twimg.com/profile_images/1308063812935974913/Gd3PpDTa_normal.jpg"
"x6827962","x1536209875713372162",2022-06-13 04:52:30,"antoniopalmieri","Buon onomastico @Antonio_Tajani @antoniomartinop @antoniopolito1 @apreiti @_dorian18 @abonardo @AntonioNicita @A_Sassano @anbarone @AntFuniciello @Antonio79B @antoniocianci @AAcquafredda @Noto_IPR @_antoniolongo @Rinaldi_euro @aperdichizzi #13giugno #SantAntonio https://t.co/UFhFVYZjEB","Twitter for Android",262,,,,FALSE,FALSE,14,2,,,"13giugno SantAntonio",,,,,"http://pbs.twimg.com/media/FVG2vRCWUAAMSHK.jpg","https://t.co/UFhFVYZjEB","https://twitter.com/antoniopalmieri/status/1536209875713372162/photo/1","photo","http://pbs.twimg.com/media/FVG2vRCWUAAMSHK.jpg","https://t.co/UFhFVYZjEB","https://twitter.com/antoniopalmieri/status/1536209875713372162/photo/1",,"x529247064 x958641224944181248 x311539656 x31717022 x2216040698 x367312496 x297939596 x445039548 x224831537 x407982210 x2360515482 x266059397 x876544544 x544115277 x778338918425059329 x1333369999 x42954145","Antonio_Tajani antoniomartinop antoniopolito1 apreiti _dorian18 abonardo AntonioNicita A_Sassano anbarone AntFuniciello Antonio79B antoniocianci AAcquafredda Noto_IPR _antoniolongo Rinaldi_euro aperdichizzi","it",,,,,,,,,,,,,,,,,,,,,,,,,,,,,,,,,,,,,"NA NA","NA NA","NA NA NA NA NA NA NA NA","https://twitter.com/antoniopalmieri/status/1536209875713372162","Antonio Palmieri","Italia","Sposato, due figli; milanese interista; cattolico peccatore. Deputato; responsabile campagne elettorali e web @forza_italia. Pro innovazione sociale e digitale.","https://t.co/lh0A5TNBMz",FALSE,18992,4339,501,27080,12546,2007-06-15 07:17:03,TRUE,"https://t.co/lh0A5TNBMz","https://amzn.to/3DY1r9E",,"https://pbs.twimg.com/profile_banners/6827962/1653639598","http://abs.twimg.com/images/themes/theme4/bg.gif","http://pbs.twimg.com/profile_images/1308063812935974913/Gd3PpDTa_normal.jpg"
"x6827962","x1536206434924482561",2022-06-13 04:38:50,"antoniopalmieri","Lidl non sta organizzando alcun sondaggio speciale per vincere aspirapolveri a 2,99 euro. Attenzione, avvisiamo tutti quanti. https://t.co/mKMwpthfqt","Twitter for Android",139,,,,FALSE,TRUE,0,7,,,,,,,,,,,,,,,,"x209923","marcocc","it",,,,,,,,,,,,,,,,"x1536204228104011776","Lidl non sta organizzando alcun sondaggio speciale per vincere aspirapolveri a 2,99 euro. Attenzione, avvisiamo tutti quanti. https://t.co/mKMwpthfqt",2022-06-13 04:30:03,"PostPickr",6,7,"x209923","marcocc","M.Camisani-Calzolari",25294,66,15806,"51.5286416,-0.1015987","Marco Camisani Calzolari - Striscia la notizia. Digital evangelist. Book writer and University professor",TRUE,,,,,,,"NA NA","NA NA","NA NA NA NA NA NA NA NA","https://twitter.com/antoniopalmieri/status/1536206434924482561","Antonio Palmieri","Italia","Sposato, due figli; milanese interista; cattolico peccatore. Deputato; responsabile campagne elettorali e web @forza_italia. Pro innovazione sociale e digitale.","https://t.co/lh0A5TNBMz",FALSE,18992,4339,501,27080,12546,2007-06-15 07:17:03,TRUE,"https://t.co/lh0A5TNBMz","https://amzn.to/3DY1r9E",,"https://pbs.twimg.com/profile_banners/6827962/1653639598","http://abs.twimg.com/images/themes/theme4/bg.gif","http://pbs.twimg.com/profile_images/1308063812935974913/Gd3PpDTa_normal.jpg"
"x6827962","x1536195181275398145",2022-06-13 03:54:06,"antoniopalmieri","@lorepregliasco @giorgis65 @ivanscalfarotto @lucacarabetta @maurorotelli @AnnaAscani @Greg_Fontana @Fornaro62 @RossomandoPd @Stefanicamera @StefanoCeccanti Grazie Lorenzo. Credo che il primo punto sia partire dal ministero dell'interno e capire norme e pratiche che producono questo ""risultato"" e confrontarlo con ciò che accade nelle altre democrazie. Così sapremo da che parte iniziare.","Twitter for Android",232,"x1536139931785076736","x454423746","lorepregliasco",FALSE,FALSE,4,0,,,,,,,,,,,,,,,,"x454423746 x697713603709898752 x30248306 x318927329 x17242197 x492325083 x2451712279 x586037920 x2927013813 x1237851561331527688 x441863803","lorepregliasco giorgis65 ivanscalfarotto lucacarabetta maurorotelli AnnaAscani Greg_Fontana Fornaro62 RossomandoPd Stefanicamera StefanoCeccanti","it",,,,,,,,,,,,,,,,,,,,,,,,,,,,,,,,,,,,,"NA NA","NA NA","NA NA NA NA NA NA NA NA","https://twitter.com/antoniopalmieri/status/1536195181275398145","Antonio Palmieri","Italia","Sposato, due figli; milanese interista; cattolico peccatore. Deputato; responsabile campagne elettorali e web @forza_italia. Pro innovazione sociale e digitale.","https://t.co/lh0A5TNBMz",FALSE,18992,4339,501,27080,12546,2007-06-15 07:17:03,TRUE,"https://t.co/lh0A5TNBMz","https://amzn.to/3DY1r9E",,"https://pbs.twimg.com/profile_banners/6827962/1653639598","http://abs.twimg.com/images/themes/theme4/bg.gif","http://pbs.twimg.com/profile_images/1308063812935974913/Gd3PpDTa_normal.jpg"
"x837629276912504832","x1536451929500528646",2022-06-13 20:54:20,"AvvRossello","ALEX KATZ: IL PITTORE POETA CHE AMAVA LA VITA, LE PERSONE CARE E I LUOGHI DEL CUORE https://t.co/dTjuyBKeyb","Twitter for iPhone",107,,,,FALSE,FALSE,0,0,,,,,"rossellofamilyoffice.co.uk/2022/06/11/ale…","https://t.co/dTjuyBKeyb","https://rossellofamilyoffice.co.uk/2022/06/11/alex-katz-il-pittore-poeta-che-amava-la-vita-le-persone-care-e-i-luoghi-del-cuore/",,,,,,,,,,,"it",,,,,,,,,,,,,,,,,,,,,,,,,,,,,,,,,,,,,"NA NA","NA NA","NA NA NA NA NA NA NA NA","https://twitter.com/AvvRossello/status/1536451929500528646","Cristina Rossello","Milano, Lombardia","Avvocato - Family Office Banche, Gruppi e Imprese. Ideatrice Progetto Donne e Futuro, spunto riflessione contributo femminile economia Milano Roma Bruxelles","https://t.co/Cg0UWatUdI",FALSE,1537,1850,31,8399,10849,2017-03-03 11:42:36,FALSE,"https://t.co/Cg0UWatUdI","http://www.cristinarossello.it",,"https://pbs.twimg.com/profile_banners/837629276912504832/1488546629","http://abs.twimg.com/images/themes/theme1/bg.png","http://pbs.twimg.com/profile_images/965972917740867585/lyjpsQ_Z_normal.jpg"
"x837629276912504832","x1536418874811351041",2022-06-13 18:42:59,"AvvRossello","Pochi mesi e di nuovo l’obbligo del burqa. Coperti totalmente in corpo, testa, viso. C’è qualcosa di simbolico nel poter vedere solo attraverso una rete: una perenne prigione. Violenza, annientamento dell’identità con licenza totale delle sanzioni al maschile #afganistanwomen","Twitter for iPhone",276,,,,FALSE,FALSE,0,0,,,"afganistanwomen",,,,,,,,,,,,,,,"it",,,,,,,,,,,,,,,,,,,,,,,,,,,,,,,,,,,,,"NA NA","NA NA","NA NA NA NA NA NA NA NA","https://twitter.com/AvvRossello/status/1536418874811351041","Cristina Rossello","Milano, Lombardia","Avvocato - Family Office Banche, Gruppi e Imprese. Ideatrice Progetto Donne e Futuro, spunto riflessione contributo femminile economia Milano Roma Bruxelles","https://t.co/Cg0UWatUdI",FALSE,1537,1850,31,8399,10849,2017-03-03 11:42:36,FALSE,"https://t.co/Cg0UWatUdI","http://www.cristinarossello.it",,"https://pbs.twimg.com/profile_banners/837629276912504832/1488546629","http://abs.twimg.com/images/themes/theme1/bg.png","http://pbs.twimg.com/profile_images/965972917740867585/lyjpsQ_Z_normal.jpg"
"x87467449","x1536421247155851267",2022-06-13 18:52:25,"grotondi","Da @matteosalvinimi stanno venendo parole di grande equilibrio,bisogna riconoscerlo.","Twitter for iPhone",84,,,,FALSE,FALSE,26,2,,,,,,,,,,,,,,,,"x270839361","matteosalvinimi","it",,,,,,,,,,,,,,,,,,,,,,,,,,,,,,,,,,,,,"NA NA","NA NA","NA NA NA NA NA NA NA NA","https://twitter.com/grotondi/status/1536421247155851267","Gianfranco Rotondi","Pescara, Abruzzo","sono poco su Twitter ma senza staff","https://t.co/NA4kmpLj89",FALSE,33420,6094,282,52876,8954,2009-11-04 15:52:34,FALSE,"https://t.co/NA4kmpLj89","https://girotondi.net/",,"https://pbs.twimg.com/profile_banners/87467449/1522754488","http://abs.twimg.com/images/themes/theme1/bg.png","http://pbs.twimg.com/profile_images/1420443859952283656/Np6eQk74_normal.jpg"
"x87467449","x1536414593232293890",2022-06-13 18:25:58,"grotondi","Lega in caduta,Fi fiacca,Fdi in https://t.co/gHwvS2XM8P centrodestra manca un partito a vocazione maggioritaria che stabilizzi l’alleanza.","Twitter for iPhone",138,,,,FALSE,FALSE,20,4,,,,,"ascesa.Al","https://t.co/gHwvS2XM8P","http://ascesa.Al",,,,,,,,,,,"it",,,,,,,,,,,,,,,,,,,,,,,,,,,,,,,,,,,,,"NA NA","NA NA","NA NA NA NA NA NA NA NA","https://twitter.com/grotondi/status/1536414593232293890","Gianfranco Rotondi","Pescara, Abruzzo","sono poco su Twitter ma senza staff","https://t.co/NA4kmpLj89",FALSE,33420,6094,282,52876,8954,2009-11-04 15:52:34,FALSE,"https://t.co/NA4kmpLj89","https://girotondi.net/",,"https://pbs.twimg.com/profile_banners/87467449/1522754488","http://abs.twimg.com/images/themes/theme1/bg.png","http://pbs.twimg.com/profile_images/1420443859952283656/Np6eQk74_normal.jpg"
"x87467449","x1536305048946343937",2022-06-13 11:10:41,"grotondi","Domani alle 16 la Camera dei Deputati commemorerà ufficialmente Ciriaco De Mita. https://t.co/fkyFQb6K3p","Twitter for iPhone",80,,,,FALSE,FALSE,23,3,,,,,,,,"http://pbs.twimg.com/media/FVINTC4XsAA9-p-.jpg","https://t.co/fkyFQb6K3p","https://twitter.com/grotondi/status/1536305048946343937/photo/1","photo","http://pbs.twimg.com/media/FVINTC4XsAA9-p-.jpg","https://t.co/fkyFQb6K3p","https://twitter.com/grotondi/status/1536305048946343937/photo/1",,,,"it",,,,,,,,,,,,,,,,,,,,,,,,,,,,,,,,,,,,,"NA NA","NA NA","NA NA NA NA NA NA NA NA","https://twitter.com/grotondi/status/1536305048946343937","Gianfranco Rotondi","Pescara, Abruzzo","sono poco su Twitter ma senza staff","https://t.co/NA4kmpLj89",FALSE,33420,6094,282,52876,8954,2009-11-04 15:52:34,FALSE,"https://t.co/NA4kmpLj89","https://girotondi.net/",,"https://pbs.twimg.com/profile_banners/87467449/1522754488","http://abs.twimg.com/images/themes/theme1/bg.png","http://pbs.twimg.com/profile_images/1420443859952283656/Np6eQk74_normal.jpg"
"x4104382283","x1536304129039007744",2022-06-13 11:07:02,"DanielaRuffino2","Siamo gli unici rappresentanti credibili del terzo polo.Ruffino,noi unici rappresentanti credibili terzo polo. Uno spazio che può andare dal 10% al 20% di elettori che non sopportano più il bipopulismo #Azione e #piuEuropa rappresentano questa area! https://t.co/DWMmxzf9rK","Twitter for iPad",249,,,,FALSE,FALSE,3,0,,,"Azione piuEuropa",,,,,"http://pbs.twimg.com/media/FVIMcm0WUAIB1Fp.jpg","https://t.co/DWMmxzf9rK","https://twitter.com/DanielaRuffino2/status/1536304129039007744/photo/1","photo","http://pbs.twimg.com/media/FVIMcm0WUAIB1Fp.jpg","https://t.co/DWMmxzf9rK","https://twitter.com/DanielaRuffino2/status/1536304129039007744/photo/1",,,,"it",,,,,,,,,,,,,,,,,,,,,,,,,,,,,,,,,,,,,"NA NA","NA NA","NA NA NA NA NA NA NA NA","https://twitter.com/DanielaRuffino2/status/1536304129039007744","Daniela Ruffino","Giaveno, Piemonte","Deputato @Azione_it, membro della Commissione Ambiente","https://t.co/NKcW8H4oGs",FALSE,497,455,15,2244,70,2015-11-03 12:04:59,FALSE,"https://t.co/NKcW8H4oGs","http://www.danielaruffino.it",,"https://pbs.twimg.com/profile_banners/4104382283/1651137958","http://abs.twimg.com/images/themes/theme18/bg.gif","http://pbs.twimg.com/profile_images/1519608849145241601/D9LKazIt_normal.jpg"
"x499672556","x1536412905125601280",2022-06-13 18:19:16,"GiorgioSilli","Marco Bucci si riconferma sindaco di #Genova 🏴󠁧󠁢󠁥󠁮󠁧󠁿 Commentiamo insieme il risultato straordinario di queste elezioni

Guarda in diretta 👉 https://t.co/wKLDtQtRrm https://t.co/HDIzzvAqCJ","Twitter for iPhone",140,,,,FALSE,TRUE,0,4,,,"Genova",,,,,,,,,,,,,"x2331718804","GiovanniToti","it",,,,,,,,,,,,,,,,"x1536381526350389251","Marco Bucci si riconferma sindaco di #Genova 🏴󠁧󠁢󠁥󠁮󠁧󠁿 Commentiamo insieme il risultato straordinario di queste elezioni

Guarda in diretta 👉 https://t.co/wKLDtQtRrm https://t.co/HDIzzvAqCJ",2022-06-13 16:14:35,"Twitter for iPhone",15,4,"x2331718804","GiovanniToti","Giovanni Toti",78023,281,18801,"","Presidente della Regione Liguria, giornalista, politico per cambiare il Paese con i fatti 🇮🇹",TRUE,,,,,,,"NA NA","NA NA","NA NA NA NA NA NA NA NA","https://twitter.com/GiorgioSilli/status/1536412905125601280","Giorgio Silli","Prato, Toscana","Babbo di Isabella, Deputato della Repubblica.Tintore. Molto rossiniano","https://t.co/i4HLZLAULC",FALSE,1933,682,35,7039,3450,2012-02-22 10:49:12,FALSE,"https://t.co/i4HLZLAULC","http://giorgiosilli.it",,"https://pbs.twimg.com/profile_banners/499672556/1434717572","http://abs.twimg.com/images/themes/theme1/bg.png","http://pbs.twimg.com/profile_images/1076762978752577536/9E8AyaPD_normal.jpg"
"x499672556","x1536309609085943808",2022-06-13 11:28:48,"GiorgioSilli","""MISTER OBAMAAAAAA""

After the 2009 G20 group photo, PM Silvio Berlusconi calls out loudly to U.S. President Barack Obama, triggering an annoyed comment from Queen Elizabeth (""What is it? Why does he have to shout?!"") https://t.co/opgl6Wlmjf","Twitter for iPhone",140,,,,FALSE,TRUE,0,113,,,,,,,,,,,,,,,,"x1508528078854795271","CrazyItalianPol","en",,,,,,,,,,,,,,,,"x1536241885123162114","""MISTER OBAMAAAAAA""

After the 2009 G20 group photo, PM Silvio Berlusconi calls out loudly to U.S. President Barack Obama, triggering an annoyed comment from Queen Elizabeth (""What is it? Why does he have to shout?!"") https://t.co/opgl6Wlmjf",2022-06-13 06:59:42,"Twitter for Android",1509,113,"x1508528078854795271","CrazyItalianPol","Crazy Ass Moments in Italian Politics",35080,417,1166,"Rome, Italy","Italy is not a country, is a dream. Inspired by @ampol_moment. Also on Instagram and TikTok. DM for submissions.",FALSE,,,,,,,"NA NA","NA NA","NA NA NA NA NA NA NA NA","https://twitter.com/GiorgioSilli/status/1536309609085943808","Giorgio Silli","Prato, Toscana","Babbo di Isabella, Deputato della Repubblica.Tintore. Molto rossiniano","https://t.co/i4HLZLAULC",FALSE,1933,682,35,7039,3450,2012-02-22 10:49:12,FALSE,"https://t.co/i4HLZLAULC","http://giorgiosilli.it",,"https://pbs.twimg.com/profile_banners/499672556/1434717572","http://abs.twimg.com/images/themes/theme1/bg.png","http://pbs.twimg.com/profile_images/1076762978752577536/9E8AyaPD_normal.jpg"
"x615326948","x1536268634238210048",2022-06-13 08:45:59,"LucaSqueri","Arrivato ora all’Assemblea Generale di @Confcommercio 🇮🇹

#assemblea2022 
#confcommerciocè https://t.co/86IsgTco9g","Twitter Web App",134,,,,FALSE,TRUE,0,5,,,"assemblea2022 confcommerciocè",,,,,"http://pbs.twimg.com/media/FUu7WdLWUAAr8Mw.jpg","https://t.co/86IsgTco9g","https://twitter.com/renatobrunetta/status/1534526102458212352/photo/1","photo","http://pbs.twimg.com/media/FUu7WdLWUAAr8Mw.jpg http://pbs.twimg.com/media/FUu7WdHWAAA51EI.jpg http://pbs.twimg.com/media/FUu7WdJWUAAafgh.jpg http://pbs.twimg.com/media/FUu7WdJXsAUnsST.jpg","https://t.co/86IsgTco9g https://t.co/86IsgTco9g https://t.co/86IsgTco9g https://t.co/86IsgTco9g","https://twitter.com/renatobrunetta/status/1534526102458212352/photo/1 https://twitter.com/renatobrunetta/status/1534526102458212352/photo/1 https://twitter.com/renatobrunetta/status/1534526102458212352/photo/1 https://twitter.com/renatobrunetta/status/1534526102458212352/photo/1",,"x20430345 x339073452","renatobrunetta Confcommercio","it",,,,,,,,,,,,,,,,"x1534526102458212352","Arrivato ora all’Assemblea Generale di @Confcommercio 🇮🇹

#assemblea2022 
#confcommerciocè https://t.co/86IsgTco9g",2022-06-08 13:21:47,"Twitter for iPhone",17,5,"x20430345","renatobrunetta","Renato Brunetta",216621,1407,70890,"","Professore ordinario di Economia del Lavoro, Ministro per la Pubblica Amministrazione @FunzPub, Presidente della Fondazione #VCMS, Deputato di Forza Italia 🇮🇹",TRUE,,,,,,,"NA NA","NA NA","NA NA NA NA NA NA NA NA","https://twitter.com/LucaSqueri/status/1536268634238210048","Luca Squeri","","Deputato di @forza_italia nella Camera dei Deputati, X Commissione Attività Produttive","https://t.co/82YzCfqH1t",FALSE,9427,174,63,885,119,2012-06-22 16:43:43,FALSE,"https://t.co/82YzCfqH1t","https://bit.ly/33chns8",,"https://pbs.twimg.com/profile_banners/615326948/1376340793","http://abs.twimg.com/images/themes/theme1/bg.png","http://pbs.twimg.com/profile_images/378800000419279509/99d4f8e01660a77eb30b54c884577047_normal.jpeg"
"x1557514573","x1536416566530691073",2022-06-13 18:33:49,"elio_vito","@marcocappato @kiara86769608 🙏","Twitter for iPad",1,"x1536406728056635392","x128870883","marcocappato",FALSE,FALSE,47,0,,,,,,,,,,,,,,,,"x128870883 x998943681964068865","marcocappato kiara86769608","und",,,,,,,,,,,,,,,,,,,,,,,,,,,,,,,,,,,,,"NA NA","NA NA","NA NA NA NA NA NA NA NA","https://twitter.com/elio_vito/status/1536416566530691073","Elio Vito 🇮🇹🇪🇺🇺🇸🏳️‍🌈🍁🌍","Roma","Deputato @forza_italia🤔 Napoletano. Juventino⚪️⚫️","https://t.co/TxIGBtgFXw",FALSE,26166,13,127,28731,69133,2013-06-30 07:47:38,TRUE,"https://t.co/TxIGBtgFXw","http://documenti.camera.it/leg18/pdl/pdf/leg.18.pdl.camera.3470.18PDL0175510.pdf",,"https://pbs.twimg.com/profile_banners/1557514573/1640814244","http://abs.twimg.com/images/themes/theme1/bg.png","http://pbs.twimg.com/profile_images/736450788659240960/-8W5fQJa_normal.jpg"
"x1557514573","x1536409448050204672",2022-06-13 18:05:32,"elio_vito","@marioadinolfi Manco il Parroco di Santa Candida ti ha votato...😇 https://t.co/UWmgOXqJoB","Twitter for iPhone",50,"x1536366299479252999","x14942383","marioadinolfi",FALSE,FALSE,411,12,,,,,,,,"http://pbs.twimg.com/media/FVJsPk1XEAAvvPN.jpg","https://t.co/UWmgOXqJoB","https://twitter.com/elio_vito/status/1536409448050204672/photo/1","photo","http://pbs.twimg.com/media/FVJsPk1XEAAvvPN.jpg","https://t.co/UWmgOXqJoB","https://twitter.com/elio_vito/status/1536409448050204672/photo/1",,"x14942383","marioadinolfi","it",,,,,,,,,,,,,,,,,,,,,,,,,,,,,,,,,,,,,"NA NA","NA NA","NA NA NA NA NA NA NA NA","https://twitter.com/elio_vito/status/1536409448050204672","Elio Vito 🇮🇹🇪🇺🇺🇸🏳️‍🌈🍁🌍","Roma","Deputato @forza_italia🤔 Napoletano. Juventino⚪️⚫️","https://t.co/TxIGBtgFXw",FALSE,26166,13,127,28731,69133,2013-06-30 07:47:38,TRUE,"https://t.co/TxIGBtgFXw","http://documenti.camera.it/leg18/pdl/pdf/leg.18.pdl.camera.3470.18PDL0175510.pdf",,"https://pbs.twimg.com/profile_banners/1557514573/1640814244","http://abs.twimg.com/images/themes/theme1/bg.png","http://pbs.twimg.com/profile_images/736450788659240960/-8W5fQJa_normal.jpg"
"x1557514573","x1536405655418028033",2022-06-13 17:50:27,"elio_vito","Comunque, ora ve lo dico, #ForzaItaliasecondoVito a Verona appoggerebbe Tommasi!","Twitter for iPhone",80,,,,FALSE,FALSE,586,28,,,"ForzaItaliasecondoVito",,,,,,,,,,,,,,,"it",,,,,,,,,,,,,,,,,,,,,,,,,,,,,,,,,,,,,"NA NA","NA NA","NA NA NA NA NA NA NA NA","https://twitter.com/elio_vito/status/1536405655418028033","Elio Vito 🇮🇹🇪🇺🇺🇸🏳️‍🌈🍁🌍","Roma","Deputato @forza_italia🤔 Napoletano. Juventino⚪️⚫️","https://t.co/TxIGBtgFXw",FALSE,26166,13,127,28731,69133,2013-06-30 07:47:38,TRUE,"https://t.co/TxIGBtgFXw","http://documenti.camera.it/leg18/pdl/pdf/leg.18.pdl.camera.3470.18PDL0175510.pdf",,"https://pbs.twimg.com/profile_banners/1557514573/1640814244","http://abs.twimg.com/images/themes/theme1/bg.png","http://pbs.twimg.com/profile_images/736450788659240960/-8W5fQJa_normal.jpg"
"x1557514573","x1536386198431744001",2022-06-13 16:33:09,"elio_vito","@RobadaMatteo @forza_italia 😳","Twitter for iPad",1,"x1536384643825647619","x1318911648577560581","RobadaMatteo",FALSE,FALSE,3,0,,,,,,,,,,,,,,,,"x1318911648577560581 x147543162","RobadaMatteo forza_italia","und",,,,,,,,,,,,,,,,,,,,,,,,,,,,,,,,,,,,,"NA NA","NA NA","NA NA NA NA NA NA NA NA","https://twitter.com/elio_vito/status/1536386198431744001","Elio Vito 🇮🇹🇪🇺🇺🇸🏳️‍🌈🍁🌍","Roma","Deputato @forza_italia🤔 Napoletano. Juventino⚪️⚫️","https://t.co/TxIGBtgFXw",FALSE,26166,13,127,28731,69133,2013-06-30 07:47:38,TRUE,"https://t.co/TxIGBtgFXw","http://documenti.camera.it/leg18/pdl/pdf/leg.18.pdl.camera.3470.18PDL0175510.pdf",,"https://pbs.twimg.com/profile_banners/1557514573/1640814244","http://abs.twimg.com/images/themes/theme1/bg.png","http://pbs.twimg.com/profile_images/736450788659240960/-8W5fQJa_normal.jpg"
"x1557514573","x1536386047927586818",2022-06-13 16:32:33,"elio_vito","@Ollolanda_ @forza_italia 🙄","Twitter for iPad",1,"x1536385278834839552","x1443957981670936580","Ollolanda_",FALSE,FALSE,1,0,,,,,,,,,,,,,,,,"x1443957981670936580 x147543162","Ollolanda_ forza_italia","und",,,,,,,,,,,,,,,,,,,,,,,,,,,,,,,,,,,,,"NA NA","NA NA","NA NA NA NA NA NA NA NA","https://twitter.com/elio_vito/status/1536386047927586818","Elio Vito 🇮🇹🇪🇺🇺🇸🏳️‍🌈🍁🌍","Roma","Deputato @forza_italia🤔 Napoletano. Juventino⚪️⚫️","https://t.co/TxIGBtgFXw",FALSE,26166,13,127,28731,69133,2013-06-30 07:47:38,TRUE,"https://t.co/TxIGBtgFXw","http://documenti.camera.it/leg18/pdl/pdf/leg.18.pdl.camera.3470.18PDL0175510.pdf",,"https://pbs.twimg.com/profile_banners/1557514573/1640814244","http://abs.twimg.com/images/themes/theme1/bg.png","http://pbs.twimg.com/profile_images/736450788659240960/-8W5fQJa_normal.jpg"
"x1557514573","x1536384263595122689",2022-06-13 16:25:27,"elio_vito","Spiace dirlo, ma i risultati delle liste di @forza_italia a queste elezioni amministrative, a parte il caso di Palermo, sono poco lusinghieri, al 4-5 %.
Quando si dimette Tajani? https://t.co/5ohoCYmYos","Twitter for iPad",178,,,,FALSE,FALSE,186,19,,,,,,,,"http://pbs.twimg.com/media/FVJVVn9WIAEL66x.jpg","https://t.co/5ohoCYmYos","https://twitter.com/elio_vito/status/1536384263595122689/photo/1","photo","http://pbs.twimg.com/media/FVJVVn9WIAEL66x.jpg","https://t.co/5ohoCYmYos","https://twitter.com/elio_vito/status/1536384263595122689/photo/1",,"x147543162","forza_italia","it",,,,,,,,,,,,,,,,,,,,,,,,,,,,,,,,,,,,,"NA NA","NA NA","NA NA NA NA NA NA NA NA","https://twitter.com/elio_vito/status/1536384263595122689","Elio Vito 🇮🇹🇪🇺🇺🇸🏳️‍🌈🍁🌍","Roma","Deputato @forza_italia🤔 Napoletano. Juventino⚪️⚫️","https://t.co/TxIGBtgFXw",FALSE,26166,13,127,28731,69133,2013-06-30 07:47:38,TRUE,"https://t.co/TxIGBtgFXw","http://documenti.camera.it/leg18/pdl/pdf/leg.18.pdl.camera.3470.18PDL0175510.pdf",,"https://pbs.twimg.com/profile_banners/1557514573/1640814244","http://abs.twimg.com/images/themes/theme1/bg.png","http://pbs.twimg.com/profile_images/736450788659240960/-8W5fQJa_normal.jpg"
"x1557514573","x1536363726764376065",2022-06-13 15:03:51,"elio_vito","@di_reddito Ma ci sono 👀","Twitter for iPad",12,"x1536356651896283140","x515542672","di_reddito",FALSE,FALSE,6,0,,,,,,,,,,,,,,,,"x515542672","di_reddito","it",,,,,,,,,,,,,,,,,,,,,,,,,,,,,,,,,,,,,"NA NA","NA NA","NA NA NA NA NA NA NA NA","https://twitter.com/elio_vito/status/1536363726764376065","Elio Vito 🇮🇹🇪🇺🇺🇸🏳️‍🌈🍁🌍","Roma","Deputato @forza_italia🤔 Napoletano. Juventino⚪️⚫️","https://t.co/TxIGBtgFXw",FALSE,26166,13,127,28731,69133,2013-06-30 07:47:38,TRUE,"https://t.co/TxIGBtgFXw","http://documenti.camera.it/leg18/pdl/pdf/leg.18.pdl.camera.3470.18PDL0175510.pdf",,"https://pbs.twimg.com/profile_banners/1557514573/1640814244","http://abs.twimg.com/images/themes/theme1/bg.png","http://pbs.twimg.com/profile_images/736450788659240960/-8W5fQJa_normal.jpg"
