"x441863803","x1529491553546383360",2022-05-25 15:56:17,"StefanoCeccanti","Per adesioni per la presenza di persona di giornalisti si prega di scrivere entro le ore 13 di domani, giovedì 26, alla mail claudiamaria.zaffino@gmail.com
Si potrà comunque assistere on line dal sito Web Tv Camera","Twitter Web App",214,"x1529491551587557377","x441863803","StefanoCeccanti",FALSE,FALSE,2,0,,,,,,,,,,,,,,,,,,"it",,,,,,,,,,,,,,,,,,,,,,,,,,,,,,,,,,,,,"NA NA","NA NA","NA NA NA NA NA NA NA NA","https://twitter.com/StefanoCeccanti/status/1529491553546383360","StefanoCeccanti","Roma, La Sapienza e Camera","prof diritto pubblico comparato La Sapienza, deputato Pisa Livorno Poggibonsi, Capogruppo Pd commissione affari costituzionali","https://t.co/oEFwEIBAd5",FALSE,18787,1810,204,60399,162,2011-12-20 14:05:49,FALSE,"https://t.co/oEFwEIBAd5","http://www.stefanoceccanti.it",,"https://pbs.twimg.com/profile_banners/441863803/1517909312","http://abs.twimg.com/images/themes/theme1/bg.png","http://pbs.twimg.com/profile_images/1527271701729492998/D6TImceL_normal.jpg"
"x441863803","x1529491551587557377",2022-05-25 15:56:17,"StefanoCeccanti","Venerdì 27 alle ore 12 sala Stampa Camera conferenza stampa appello ""PERCHÉ 3 SÌ AI REFERENDUM GIUSTIZIA"" .
Ada Lucia De Cesaris, avvocato
Mario Lavia, giornalista Linkiesta
Enrico Morando, presidente Associazione Libertà Eguale
Sergio Scalpelli, presidente Linkiesta Club","Twitter Web App",272,,,,FALSE,FALSE,11,1,,,,,,,,,,,,,,,,,,"it",,,,,,,,,,,,,,,,,,,,,,,,,,,,,,,,,,,,,"NA NA","NA NA","NA NA NA NA NA NA NA NA","https://twitter.com/StefanoCeccanti/status/1529491551587557377","StefanoCeccanti","Roma, La Sapienza e Camera","prof diritto pubblico comparato La Sapienza, deputato Pisa Livorno Poggibonsi, Capogruppo Pd commissione affari costituzionali","https://t.co/oEFwEIBAd5",FALSE,18787,1810,204,60399,162,2011-12-20 14:05:49,FALSE,"https://t.co/oEFwEIBAd5","http://www.stefanoceccanti.it",,"https://pbs.twimg.com/profile_banners/441863803/1517909312","http://abs.twimg.com/images/themes/theme1/bg.png","http://pbs.twimg.com/profile_images/1527271701729492998/D6TImceL_normal.jpg"
"x441863803","x1529461104505675777",2022-05-25 13:55:17,"StefanoCeccanti","Introduzione al rapporto sulla legislazione della Regione Emilia Romagna (con annesso testo)
https://t.co/4So0WuTcxr","Twitter Web App",116,,,,FALSE,FALSE,1,0,,,,,"federalismi.it/nv14/articolo-…","https://t.co/4So0WuTcxr","https://www.federalismi.it/nv14/articolo-documento.cfm?hpsez=Primo_Piano&content=XX%2BRapporto%2Bsulla%2Blegislazione%2Bdella%2BRegione%2BEmilia%2DRomagna%2B%28con%2Bpresentazione%2Bdi%2BStefano%2BCeccanti%29&content_auth=&Artid=47249",,,,,,,,,,,"it",,,,,,,,,,,,,,,,,,,,,,,,,,,,,,,,,,,,,"NA NA","NA NA","NA NA NA NA NA NA NA NA","https://twitter.com/StefanoCeccanti/status/1529461104505675777","StefanoCeccanti","Roma, La Sapienza e Camera","prof diritto pubblico comparato La Sapienza, deputato Pisa Livorno Poggibonsi, Capogruppo Pd commissione affari costituzionali","https://t.co/oEFwEIBAd5",FALSE,18787,1810,204,60399,162,2011-12-20 14:05:49,FALSE,"https://t.co/oEFwEIBAd5","http://www.stefanoceccanti.it",,"https://pbs.twimg.com/profile_banners/441863803/1517909312","http://abs.twimg.com/images/themes/theme1/bg.png","http://pbs.twimg.com/profile_images/1527271701729492998/D6TImceL_normal.jpg"
"x441863803","x1529340645709586434",2022-05-25 05:56:38,"StefanoCeccanti","Su Pd e referendum giustizia Petruccioli sul Riformista che si può leggere qui:
https://t.co/nxkGmKy0sH","Twitter Web App",103,,,,FALSE,FALSE,1,0,,,,,"bit.ly/3yY9bJi","https://t.co/nxkGmKy0sH","https://bit.ly/3yY9bJi",,,,,,,,,,,"it",,,,,,,,,,,,,,,,,,,,,,,,,,,,,,,,,,,,,"NA NA","NA NA","NA NA NA NA NA NA NA NA","https://twitter.com/StefanoCeccanti/status/1529340645709586434","StefanoCeccanti","Roma, La Sapienza e Camera","prof diritto pubblico comparato La Sapienza, deputato Pisa Livorno Poggibonsi, Capogruppo Pd commissione affari costituzionali","https://t.co/oEFwEIBAd5",FALSE,18787,1810,204,60399,162,2011-12-20 14:05:49,FALSE,"https://t.co/oEFwEIBAd5","http://www.stefanoceccanti.it",,"https://pbs.twimg.com/profile_banners/441863803/1517909312","http://abs.twimg.com/images/themes/theme1/bg.png","http://pbs.twimg.com/profile_images/1527271701729492998/D6TImceL_normal.jpg"
"x441863803","x1529340547734855685",2022-05-25 05:56:15,"StefanoCeccanti","Rassegna ragionata 25.05.22 https://t.co/toMFr36wIk","Twitter Web App",51,,,,FALSE,FALSE,0,0,,,,,"stefanoceccanti.it/rassegna-25-05…","https://t.co/toMFr36wIk","https://stefanoceccanti.it/rassegna-25-05-22/",,,,,,,,,,,"it",,,,,,,,,,,,,,,,,,,,,,,,,,,,,,,,,,,,,"NA NA","NA NA","NA NA NA NA NA NA NA NA","https://twitter.com/StefanoCeccanti/status/1529340547734855685","StefanoCeccanti","Roma, La Sapienza e Camera","prof diritto pubblico comparato La Sapienza, deputato Pisa Livorno Poggibonsi, Capogruppo Pd commissione affari costituzionali","https://t.co/oEFwEIBAd5",FALSE,18787,1810,204,60399,162,2011-12-20 14:05:49,FALSE,"https://t.co/oEFwEIBAd5","http://www.stefanoceccanti.it",,"https://pbs.twimg.com/profile_banners/441863803/1517909312","http://abs.twimg.com/images/themes/theme1/bg.png","http://pbs.twimg.com/profile_images/1527271701729492998/D6TImceL_normal.jpg"
"x408615010","x1529164701766144003",2022-05-24 18:17:30,"susannacenni","La priorità è ora promuovere una missione militare umanitaria per trasportare via dal porto di #Odessa il #grano. Milioni di persone di paesi in difficoltà lo stanno aspettando. Fondamentale anche per riempire di nuovo le scorte. Europa e Italia siano in prima fila.","Twitter for iPhone",139,,,,FALSE,TRUE,0,176,,,"Odessa grano",,,,,,,,,,,,,"x419622371","EnricoLetta","it",,,,,,,,,,,,,,,,"x1529147588255039489","La priorità è ora promuovere una missione militare umanitaria per trasportare via dal porto di #Odessa il #grano. Milioni di persone di paesi in difficoltà lo stanno aspettando. Fondamentale anche per riempire di nuovo le scorte. Europa e Italia siano in prima fila.",2022-05-24 17:09:29,"Twitter for iPhone",1285,176,"x419622371","EnricoLetta","Enrico Letta",682227,14016,17332,"","Segretario del Partito Democratico @pdnetwork, Presidente @DelorsInstitute.",TRUE,,,,,,,"NA NA","NA NA","NA NA NA NA NA NA NA NA","https://twitter.com/susannacenni/status/1529164701766144003","susanna cenni","","vivo in provincia di Siena, dal 2008  deputata Pd mi occupo di agricoltura donne ambiente economia preferisco parola NOI all'abuso di IO, segreteria Naz Pd","https://t.co/FEwj7W9pEP",FALSE,2775,441,71,3189,4264,2011-11-09 17:17:44,FALSE,"https://t.co/FEwj7W9pEP","http://www.susannacenni.it",,"https://pbs.twimg.com/profile_banners/408615010/1411494478","http://abs.twimg.com/images/themes/theme1/bg.png","http://pbs.twimg.com/profile_images/1630681271/susanna_e_raffaella_ad_Alberese_luglio_2011_normal.jpg"
"x518743903","x1529506666890289153",2022-05-25 16:56:20,"Vito_DeFilippo","@letta ricorda Berlinguer: orgogliosi di una continuità che significa anche “successo” per il @pdnetwork : la nostra storia ha radici profonde. Possiamo rendere forte  il futuro del nostro Paese. @pdnetwork @BasilicataGD @pdprovmt @RaffaeleLaRegin @maura_locantore https://t.co/ne62DiHW8p","Twitter for iPhone",264,,"x565454260","Letta",FALSE,FALSE,0,0,,,,,,,,"http://pbs.twimg.com/media/FTnmNAWXEAA7X-J.jpg","https://t.co/ne62DiHW8p","https://twitter.com/Vito_DeFilippo/status/1529506666890289153/photo/1","photo","http://pbs.twimg.com/media/FTnmNAWXEAA7X-J.jpg","https://t.co/ne62DiHW8p","https://twitter.com/Vito_DeFilippo/status/1529506666890289153/photo/1",,"x565454260 x13294452 x13294452 x523467814 x1375555109120262145 x1429014151 x1334520595","Letta pdnetwork pdnetwork BasilicataGD pdprovmt RaffaeleLaRegin maura_locantore","it",,,,,,,,,,,,,,,,,,,,,,,,,,,,,,,,,,,,,"NA NA","NA NA","NA NA NA NA NA NA NA NA","https://twitter.com/Vito_DeFilippo/status/1529506666890289153","Vito De Filippo","","Deputato Partito Democratico commissione affari sociali giornalista, sposato con due figli, dal sigillo di Spinoza...caute!",,FALSE,4547,1987,75,3709,6474,2012-03-08 18:23:33,FALSE,,,,,"http://abs.twimg.com/images/themes/theme1/bg.png","http://pbs.twimg.com/profile_images/1369676632760475650/-pg8jpVM_normal.jpg"
"x518743903","x1529425379349381120",2022-05-25 11:33:20,"Vito_DeFilippo","Rendiamo omaggio a Enrico #Berlinguer e ad una politica che metteva il noi sempre davanti all’io https://t.co/Xtu08Hnazj","Twitter for iPhone",137,,,,FALSE,TRUE,0,48,,,"Berlinguer",,"youtu.be/5GOHvdw9VN8","https://t.co/Xtu08Hnazj","https://youtu.be/5GOHvdw9VN8",,,,,,,,,"x419622371","EnricoLetta","it",,,,,,,,,,,,,,,,"x1529418094816395267","Rendiamo omaggio a Enrico #Berlinguer e ad una politica che metteva il noi sempre davanti all’io https://t.co/Xtu08Hnazj",2022-05-25 11:04:23,"Twitter Web App",252,48,"x419622371","EnricoLetta","Enrico Letta",682227,14016,17332,"","Segretario del Partito Democratico @pdnetwork, Presidente @DelorsInstitute.",TRUE,,,,,,,"NA NA","NA NA","NA NA NA NA NA NA NA NA","https://twitter.com/Vito_DeFilippo/status/1529425379349381120","Vito De Filippo","","Deputato Partito Democratico commissione affari sociali giornalista, sposato con due figli, dal sigillo di Spinoza...caute!",,FALSE,4547,1987,75,3709,6474,2012-03-08 18:23:33,FALSE,,,,,"http://abs.twimg.com/images/themes/theme1/bg.png","http://pbs.twimg.com/profile_images/1369676632760475650/-pg8jpVM_normal.jpg"
"x518743903","x1529386602606342144",2022-05-25 08:59:15,"Vito_DeFilippo","Ho presentato un’interrogazione sul caso Scanzano Jonico, un comune lucano sciolto per infiltrazioni mafiose nel 2019 e che rischia di andare al voto nella primavera del 2023. Ringrazio i colleghi @Vito_DeFilippo e @LucianoCillis1 per aver firmato l’atto.
https://t.co/7IepxLdFro","Twitter for iPhone",139,,,,FALSE,TRUE,0,11,,,,,,,,,,,,,,,,"x11945512","mirellaliuzzi","it",,,,,,,,,,,,,,,,"x1529386150225494016","Ho presentato un’interrogazione sul caso Scanzano Jonico, un comune lucano sciolto per infiltrazioni mafiose nel 2019 e che rischia di andare al voto nella primavera del 2023. Ringrazio i colleghi @Vito_DeFilippo e @LucianoCillis1 per aver firmato l’atto.
https://t.co/7IepxLdFro",2022-05-25 08:57:27,"Twitter for iPad",17,11,"x11945512","mirellaliuzzi","Mirella Liuzzi",13581,879,14217,"Matera","🇮🇹 Member of the Italian Parliament. She/her.",TRUE,,,,,,,"NA NA","NA NA","NA NA NA NA NA NA NA NA","https://twitter.com/Vito_DeFilippo/status/1529386602606342144","Vito De Filippo","","Deputato Partito Democratico commissione affari sociali giornalista, sposato con due figli, dal sigillo di Spinoza...caute!",,FALSE,4547,1987,75,3709,6474,2012-03-08 18:23:33,FALSE,,,,,"http://abs.twimg.com/images/themes/theme1/bg.png","http://pbs.twimg.com/profile_images/1369676632760475650/-pg8jpVM_normal.jpg"
"x484982241","x1529482736733388807",2022-05-25 15:21:15,"graziano_delrio","Oggi a @Montecitorio il Governo ha chiarito gli interventi che si possono adottare per migliorare l’#assegnounico per i figli. Alcuni aspetti sono competenza del Parlamento: saremo ancora in prima linea per una misura che merita di funzionare al meglio e per tutti 
@Deputatipd","Twitter for iPhone",277,,,,FALSE,FALSE,6,2,,,"assegnounico",,,,,,,,,,,,,"x2278995820 x76616277","Montecitorio Deputatipd","it",,,,,,,,,,,,,,,,,,,,,,,,,,,,,,,,,,,,,"NA NA","NA NA","NA NA NA NA NA NA NA NA","https://twitter.com/graziano_delrio/status/1529482736733388807","Graziano Delrio","Roma e Reggio Emilia","Parlamentare del Partito democratico alla Camera dei Deputati. Netiquette: chi insulta è fuori.","https://t.co/zSebzw3kb4",FALSE,307224,839,1149,6691,2423,2012-02-06 18:12:54,TRUE,"https://t.co/zSebzw3kb4","https://www.facebook.com/pages/Graziano-Delrio/160694770110?fref=ts",,"https://pbs.twimg.com/profile_banners/484982241/1462210116","http://abs.twimg.com/images/themes/theme5/bg.gif","http://pbs.twimg.com/profile_images/760447122483339264/IFXQU6x5_normal.jpg"
"x484982241","x1529384187173666816",2022-05-25 08:49:39,"graziano_delrio","Impegno politico come ragione di vita, sguardo attento alle lotte sociali e alle trasformazioni della democrazia. Un’eredità che ancora ci parla. Enrico #Berlinguer a 100 anni dalla nascita","Twitter for iPhone",189,,,,FALSE,FALSE,31,7,,,"Berlinguer",,,,,,,,,,,,,,,"it",,,,,,,,,,,,,,,,,,,,,,,,,,,,,,,,,,,,,"NA NA","NA NA","NA NA NA NA NA NA NA NA","https://twitter.com/graziano_delrio/status/1529384187173666816","Graziano Delrio","Roma e Reggio Emilia","Parlamentare del Partito democratico alla Camera dei Deputati. Netiquette: chi insulta è fuori.","https://t.co/zSebzw3kb4",FALSE,307224,839,1149,6691,2423,2012-02-06 18:12:54,TRUE,"https://t.co/zSebzw3kb4","https://www.facebook.com/pages/Graziano-Delrio/160694770110?fref=ts",,"https://pbs.twimg.com/profile_banners/484982241/1462210116","http://abs.twimg.com/images/themes/theme5/bg.gif","http://pbs.twimg.com/profile_images/760447122483339264/IFXQU6x5_normal.jpg"
"x2725835234","x1529381542627315712",2022-05-25 08:39:08,"Piero_De_Luca","Fu un esempio politico e morale per tutti. Un uomo delle istituzioni. Un uomo la cui vita fu impegno, partecipazione, umanità, per una società più giusta accanto ai lavoratori, vicino ai più fragili. Ricordiamo i suoi valori, la sua passione, a 100 anni dalla nascita. #Berlinguer https://t.co/d1sNDxP25G","Twitter for Android",280,,,,FALSE,FALSE,26,13,,,"Berlinguer",,,,,"http://pbs.twimg.com/media/FTl0aGkXwAAmfa8.jpg","https://t.co/d1sNDxP25G","https://twitter.com/Piero_De_Luca/status/1529381542627315712/photo/1","photo","http://pbs.twimg.com/media/FTl0aGkXwAAmfa8.jpg","https://t.co/d1sNDxP25G","https://twitter.com/Piero_De_Luca/status/1529381542627315712/photo/1",,,,"it",,,,,,,,,,,,,,,,,,,,,,,,,,,,,,,,,,,,,"NA NA","NA NA","NA NA NA NA NA NA NA NA","https://twitter.com/Piero_De_Luca/status/1529381542627315712","Piero De Luca 🇮🇹 🇪🇺","","Avvocato, Deputato, Vice Presidente Gruppo PD, Capogruppo PD in Commissione Politiche dell'Unione europea alla Camera","https://t.co/aGgA7sSiR4",FALSE,2296,175,28,1068,862,2014-08-12 09:59:41,FALSE,"https://t.co/aGgA7sSiR4","http://www.pierodeluca.it",,"https://pbs.twimg.com/profile_banners/2725835234/1521836786","http://abs.twimg.com/images/themes/theme1/bg.png","http://pbs.twimg.com/profile_images/1152157738253901824/eJrtyiYG_normal.jpg"
"x384881122","x1529380591896076288",2022-05-25 08:35:22,"andreademaria_","Ecologia, pace, questione morale, diritti delle donne, austerità, Europa: abbiamo imparato molto in una vita spesa a difendere giustizia sociale e democrazia. Un lascito che ancora ci guida.  
@pdnetwork 
A 100 anni dalla nascita di Enrico #Berlinguer https://t.co/OzLSoXNEQV","Twitter for Android",251,,,,FALSE,FALSE,1,0,,,"Berlinguer",,,,,"http://pbs.twimg.com/media/FTlzixmWAAEA-Z7.jpg","https://t.co/OzLSoXNEQV","https://twitter.com/andreademaria_/status/1529380591896076288/photo/1","photo","http://pbs.twimg.com/media/FTlzixmWAAEA-Z7.jpg","https://t.co/OzLSoXNEQV","https://twitter.com/andreademaria_/status/1529380591896076288/photo/1",,"x13294452","pdnetwork","it",,,,,,,,,,,,,,,,,,,,,,,,,,,,,,,,,,,,,"NA NA","NA NA","NA NA NA NA NA NA NA NA","https://twitter.com/andreademaria_/status/1529380591896076288","Andrea De Maria","","Segretario di Presidenza della Camera dei Deputati.
Deputato PD.
https://t.co/OyE9Nsn7hD","https://t.co/caF8fUsTb6",FALSE,4239,503,69,5150,362,2011-10-04 14:00:32,FALSE,"https://t.co/caF8fUsTb6","http://www.andreademaria.eu",,"https://pbs.twimg.com/profile_banners/384881122/1599667571","http://abs.twimg.com/images/themes/theme1/bg.png","http://pbs.twimg.com/profile_images/805752169307795456/mJY3QtI0_normal.jpg"
"x48484178","x1529513763405275140",2022-05-25 17:24:32,"marcodimaio","Solidarietà al sindaco di Bologna, @matteolepore, per le ignobili minacce ricevute a seguito dello sgombero di un immobile occupato abusivamente. Siamo al suo fianco e accanto a tutti coloro che si battono per far rispettare la legalità.","Twitter for iPhone",237,,,,FALSE,FALSE,1,0,,,,,,,,,,,,,,,,"x232282275","matteolepore","it",,,,,,,,,,,,,,,,,,,,,,,,,,,,,,,,,,,,,"NA NA","NA NA","NA NA NA NA NA NA NA NA","https://twitter.com/marcodimaio/status/1529513763405275140","Marco Di Maio 🇪🇺🇮🇹","Forlì, Italy","Padre, marito, giornalista, parlamentare | Eletto nel collegio uninominale Forlì-Faenza | Vice Presidente dei deputati di @ItaliaViva","https://t.co/xz6GugJkjq",FALSE,10314,923,154,14293,11024,2009-06-18 20:47:35,TRUE,"https://t.co/xz6GugJkjq","http://www.marcodimaio.info",,"https://pbs.twimg.com/profile_banners/48484178/1627898152","http://abs.twimg.com/images/themes/theme9/bg.gif","http://pbs.twimg.com/profile_images/1426538051862421509/5CmpSJYR_normal.jpg"
"x48484178","x1529384032630362112",2022-05-25 08:49:02,"marcodimaio","Il grillino Claudio Cominardi ha postato su Instagram una foto che ritrae il nostro premier Draghi al guinzaglio di Joe Biden.
Cominardi è tesoriere (ruolo fondamentale) del M5S: l’avv. Conte la pensa così? L. Di Maio e altri ministri grillini che dicono? 
Grave e imbarazzante. https://t.co/LHnb2IAfOM","Twitter for iPhone",278,,,,FALSE,FALSE,176,46,,,,,,,,"http://pbs.twimg.com/media/FTl2q7NXoAARRqv.jpg","https://t.co/LHnb2IAfOM","https://twitter.com/marcodimaio/status/1529384032630362112/photo/1","photo","http://pbs.twimg.com/media/FTl2q7NXoAARRqv.jpg","https://t.co/LHnb2IAfOM","https://twitter.com/marcodimaio/status/1529384032630362112/photo/1",,,,"it",,,,,,,,,,,,,,,,,,,,,,,,,,,,,,,,,,,,,"NA NA","NA NA","NA NA NA NA NA NA NA NA","https://twitter.com/marcodimaio/status/1529384032630362112","Marco Di Maio 🇪🇺🇮🇹","Forlì, Italy","Padre, marito, giornalista, parlamentare | Eletto nel collegio uninominale Forlì-Faenza | Vice Presidente dei deputati di @ItaliaViva","https://t.co/xz6GugJkjq",FALSE,10314,923,154,14293,11024,2009-06-18 20:47:35,TRUE,"https://t.co/xz6GugJkjq","http://www.marcodimaio.info",,"https://pbs.twimg.com/profile_banners/48484178/1627898152","http://abs.twimg.com/images/themes/theme9/bg.gif","http://pbs.twimg.com/profile_images/1426538051862421509/5CmpSJYR_normal.jpg"
"x100218289","x1529484700133339137",2022-05-25 15:29:03,"pierofassino","352 favorevoli, 39 contrari. Sì della Camera alla ratifica ed esecuzione del Trattato tra la Repubblica italiana e la Repubblica francese per una cooperazione bilaterale rafforzata #Francia #TrattatoQuirinale #OpenCamera https://t.co/FIlljGs2m3","Twitter for Android",140,,,,FALSE,TRUE,0,20,,,,,,,,,,,,,,,,"x2278995820","Montecitorio","it",,,,,,,,,,,,,,,,"x1529429109159481344","352 favorevoli, 39 contrari. Sì della Camera alla ratifica ed esecuzione del Trattato tra la Repubblica italiana e la Repubblica francese per una cooperazione bilaterale rafforzata #Francia #TrattatoQuirinale #OpenCamera https://t.co/FIlljGs2m3",2022-05-25 11:48:09,"Twitter Web App",45,20,"x2278995820","Montecitorio","Camera dei deputati",362219,844,25805,"Roma, Italia","Account ufficiale della Camera dei deputati - La democrazia si fa qui - Netiquette: https://t.co/b7xiVxpnPH",TRUE,,,,,,,"NA NA","NA NA","NA NA NA NA NA NA NA NA","https://twitter.com/pierofassino/status/1529484700133339137","Piero Fassino","Torino / Roma","Deputato @Pdnetwork | Presidente della Commissione Affari esteri @Montecitorio | Presidente Commissione @PACE_News Monitoraggio Standard democratici","https://t.co/bLTiWMj06W",FALSE,155408,3895,901,6255,5129,2009-12-29 12:54:01,TRUE,"https://t.co/bLTiWMj06W","https://www.pierofassino.it/RichiestaNews.html",,"https://pbs.twimg.com/profile_banners/100218289/1642618292","http://abs.twimg.com/images/themes/theme1/bg.png","http://pbs.twimg.com/profile_images/1486994564783165441/Q3qU_xUI_normal.jpg"
"x100218289","x1529477230027579392",2022-05-25 14:59:22,"pierofassino","Great meeting with my Italian counterpart @pierofassino and members of the foreign affairs committee of @Montecitorio! Thanks for inspiring discussion on Europe’s future, solidarity with #Ukraine, green transition and a new era of cooperation between our two committees. 🇮🇹🇪🇺🇩🇪 https://t.co/WN8laqm1xW","Twitter for Android",140,,,,FALSE,TRUE,0,5,,,,,,,,,,,,,,,,"x1114675538 x100218289 x2278995820","MiRo_SPD pierofassino Montecitorio","en",,,,,,,,,,,,,,,,"x1529476944256966657","Great meeting with my Italian counterpart @pierofassino and members of the foreign affairs committee of @Montecitorio! Thanks for inspiring discussion on Europe’s future, solidarity with #Ukraine, green transition and a new era of cooperation between our two committees. 🇮🇹🇪🇺🇩🇪 https://t.co/WN8laqm1xW",2022-05-25 14:58:14,"Twitter for iPhone",26,5,"x1114675538","MiRo_SPD","Michael Roth MdB 🇪🇺🇺🇦",55702,1564,19080,"Bad Hersfeld","Vorsitzender des Auswärtigen Ausschusses des Deutschen Bundestages * seit 1998 direkt gewählter MdB * Präsidium @spdde * Feminist * Europäer * freiheitsliebend",TRUE,,,,,,,"NA NA","NA NA","NA NA NA NA NA NA NA NA","https://twitter.com/pierofassino/status/1529477230027579392","Piero Fassino","Torino / Roma","Deputato @Pdnetwork | Presidente della Commissione Affari esteri @Montecitorio | Presidente Commissione @PACE_News Monitoraggio Standard democratici","https://t.co/bLTiWMj06W",FALSE,155408,3895,901,6255,5129,2009-12-29 12:54:01,TRUE,"https://t.co/bLTiWMj06W","https://www.pierofassino.it/RichiestaNews.html",,"https://pbs.twimg.com/profile_banners/100218289/1642618292","http://abs.twimg.com/images/themes/theme1/bg.png","http://pbs.twimg.com/profile_images/1486994564783165441/Q3qU_xUI_normal.jpg"
"x100218289","x1529473939604381696",2022-05-25 14:46:18,"pierofassino","A grande maggioranza la Camera dei Deputati ha approvato il #TrattatodelQuirinale per una relazione strategica Italia-Francia e un impulso forte al rilancio dell'integrazione europea 🇮🇹🇫🇷🇪🇺 https://t.co/QvhwOMvzwo","Twitter for Android",189,,,,FALSE,FALSE,11,5,,,"TrattatodelQuirinale",,,,,"http://pbs.twimg.com/ext_tw_video_thumb/1529473829994745857/pu/img/x9R_DSOzpU1XwoUw.jpg","https://t.co/QvhwOMvzwo","https://twitter.com/pierofassino/status/1529473939604381696/video/1","photo","http://pbs.twimg.com/ext_tw_video_thumb/1529473829994745857/pu/img/x9R_DSOzpU1XwoUw.jpg","https://t.co/QvhwOMvzwo","https://twitter.com/pierofassino/status/1529473939604381696/video/1",,,,"it",,,,,,,,,,,,,,,,,,,,,,,,,,,,,,,,,,,,,"NA NA","NA NA","NA NA NA NA NA NA NA NA","https://twitter.com/pierofassino/status/1529473939604381696","Piero Fassino","Torino / Roma","Deputato @Pdnetwork | Presidente della Commissione Affari esteri @Montecitorio | Presidente Commissione @PACE_News Monitoraggio Standard democratici","https://t.co/bLTiWMj06W",FALSE,155408,3895,901,6255,5129,2009-12-29 12:54:01,TRUE,"https://t.co/bLTiWMj06W","https://www.pierofassino.it/RichiestaNews.html",,"https://pbs.twimg.com/profile_banners/100218289/1642618292","http://abs.twimg.com/images/themes/theme1/bg.png","http://pbs.twimg.com/profile_images/1486994564783165441/Q3qU_xUI_normal.jpg"
"x100218289","x1529431457134944256",2022-05-25 11:57:29,"pierofassino","Oggi #GiornatadellAfrica, continente che alla fine del secolo avrà 4 miliardi di abitanti il cui destino richiama la  responsabilità europea di promuovere politiche di cooperazione economica, sociale, sanitaria, politica. 🇮🇹 e 🇪🇺 assumano l'#Africa come una priorità strategica https://t.co/PXkgTPyZOQ","Twitter for Android",277,,,,FALSE,FALSE,11,5,,,"GiornatadellAfrica Africa",,,,,"http://pbs.twimg.com/media/FTmhzRQXEAALZvK.jpg","https://t.co/PXkgTPyZOQ","https://twitter.com/pierofassino/status/1529431457134944256/photo/1","photo","http://pbs.twimg.com/media/FTmhzRQXEAALZvK.jpg","https://t.co/PXkgTPyZOQ","https://twitter.com/pierofassino/status/1529431457134944256/photo/1",,,,"it",,,,,,,,,,,,,,,,,,,,,,,,,,,,,,,,,,,,,"NA NA","NA NA","NA NA NA NA NA NA NA NA","https://twitter.com/pierofassino/status/1529431457134944256","Piero Fassino","Torino / Roma","Deputato @Pdnetwork | Presidente della Commissione Affari esteri @Montecitorio | Presidente Commissione @PACE_News Monitoraggio Standard democratici","https://t.co/bLTiWMj06W",FALSE,155408,3895,901,6255,5129,2009-12-29 12:54:01,TRUE,"https://t.co/bLTiWMj06W","https://www.pierofassino.it/RichiestaNews.html",,"https://pbs.twimg.com/profile_banners/100218289/1642618292","http://abs.twimg.com/images/themes/theme1/bg.png","http://pbs.twimg.com/profile_images/1486994564783165441/Q3qU_xUI_normal.jpg"
"x100218289","x1529389133927415809",2022-05-25 09:09:18,"pierofassino","100 anni fa nasceva #EnricoBerlinguer. Una guida politica e morale per milioni di italiani. Seppe fare scelte coraggiose per difendere la democrazia e affermare i valori della sinistra in Europa e nell'occidente. https://t.co/KNPD7Hsq0H","Twitter for Android",212,,,,FALSE,FALSE,26,6,,,"EnricoBerlinguer",,,,,"http://pbs.twimg.com/media/FTl7T6oWUAAKeAs.jpg","https://t.co/KNPD7Hsq0H","https://twitter.com/pierofassino/status/1529389133927415809/photo/1","photo","http://pbs.twimg.com/media/FTl7T6oWUAAKeAs.jpg","https://t.co/KNPD7Hsq0H","https://twitter.com/pierofassino/status/1529389133927415809/photo/1",,,,"it",,,,,,,,,,,,,,,,,,,,,,,,,,,,,,,,,,,,,"NA NA","NA NA","NA NA NA NA NA NA NA NA","https://twitter.com/pierofassino/status/1529389133927415809","Piero Fassino","Torino / Roma","Deputato @Pdnetwork | Presidente della Commissione Affari esteri @Montecitorio | Presidente Commissione @PACE_News Monitoraggio Standard democratici","https://t.co/bLTiWMj06W",FALSE,155408,3895,901,6255,5129,2009-12-29 12:54:01,TRUE,"https://t.co/bLTiWMj06W","https://www.pierofassino.it/RichiestaNews.html",,"https://pbs.twimg.com/profile_banners/100218289/1642618292","http://abs.twimg.com/images/themes/theme1/bg.png","http://pbs.twimg.com/profile_images/1486994564783165441/Q3qU_xUI_normal.jpg"
