"user_id","status_id","created_at","screen_name","text","source","display_text_width","reply_to_status_id","reply_to_user_id","reply_to_screen_name","is_quote","is_retweet","favorite_count","retweet_count","quote_count","reply_count","hashtags","symbols","urls_url","urls_t.co","urls_expanded_url","media_url","media_t.co","media_expanded_url","media_type","ext_media_url","ext_media_t.co","ext_media_expanded_url","ext_media_type","mentions_user_id","mentions_screen_name","lang","quoted_status_id","quoted_text","quoted_created_at","quoted_source","quoted_favorite_count","quoted_retweet_count","quoted_user_id","quoted_screen_name","quoted_name","quoted_followers_count","quoted_friends_count","quoted_statuses_count","quoted_location","quoted_description","quoted_verified","retweet_status_id","retweet_text","retweet_created_at","retweet_source","retweet_favorite_count","retweet_retweet_count","retweet_user_id","retweet_screen_name","retweet_name","retweet_followers_count","retweet_friends_count","retweet_statuses_count","retweet_location","retweet_description","retweet_verified","place_url","place_name","place_full_name","place_type","country","country_code","geo_coords","coords_coords","bbox_coords","status_url","name","location","description","url","protected","followers_count","friends_count","listed_count","statuses_count","favourites_count","account_created_at","verified","profile_url","profile_expanded_url","account_lang","profile_banner_url","profile_background_url","profile_image_url"
"x270839361","x1533106536318369796",2022-06-04 15:20:56,"matteosalvinimi","Buon pomeriggio Amici.
Domani sarò alle 15.30 a Buccinasco (MI), alle 18 a Desenzano del Garda (BS) e alle 20 a Castiglione delle Stiviere (MN).
Vi aspetto per discutere insieme del futuro delle vostre città e dei #ReferendumGiustizia.
🇮🇹💪🏻

#iodicoSì #12giugnovotoLega https://t.co/EPWKG8Iyz5","Twitter Web App",269,,,,FALSE,FALSE,63,14,,,"ReferendumGiustizia iodicoSì 12giugnovotoLega",,,,,"http://pbs.twimg.com/media/FUawRCaXoAQIJTV.jpg","https://t.co/EPWKG8Iyz5","https://twitter.com/matteosalvinimi/status/1533106536318369796/photo/1","photo","http://pbs.twimg.com/media/FUawRCaXoAQIJTV.jpg","https://t.co/EPWKG8Iyz5","https://twitter.com/matteosalvinimi/status/1533106536318369796/photo/1",,,,"it",,,,,,,,,,,,,,,,,,,,,,,,,,,,,,,,,,,,,"NA NA","NA NA","NA NA NA NA NA NA NA NA","https://twitter.com/matteosalvinimi/status/1533106536318369796","Matteo Salvini","","Leader della Lega #primagliitaliani 🇮🇹","https://t.co/sj3rr6DU3N",FALSE,1475693,2008,3140,53050,3826,2011-03-23 10:32:56,TRUE,"https://t.co/sj3rr6DU3N","https://legaonline.it/",,"https://pbs.twimg.com/profile_banners/270839361/1641590097","http://abs.twimg.com/images/themes/theme1/bg.png","http://pbs.twimg.com/profile_images/966325945060732928/0Ua5xPMX_normal.jpg"
"x270839361","x1533104123511554049",2022-06-04 15:11:21,"matteosalvinimi","Vittoria!!!
Complimenti agli azzurri della Nazionale Italiana Cuochi che conquistano il titolo di campioni del mondo nella categoria senior del Global Chef Challenge di Abu Dhabi.
Grandi ragazzi, orgoglio nazionale! 🇮🇹 https://t.co/mBQfXuMRf2","Twitter Web App",218,,,,FALSE,FALSE,71,9,,,,,,,,"http://pbs.twimg.com/media/FUauDpwWUAAruml.jpg","https://t.co/mBQfXuMRf2","https://twitter.com/matteosalvinimi/status/1533104123511554049/photo/1","photo","http://pbs.twimg.com/media/FUauDpwWUAAruml.jpg","https://t.co/mBQfXuMRf2","https://twitter.com/matteosalvinimi/status/1533104123511554049/photo/1",,,,"it",,,,,,,,,,,,,,,,,,,,,,,,,,,,,,,,,,,,,"NA NA","NA NA","NA NA NA NA NA NA NA NA","https://twitter.com/matteosalvinimi/status/1533104123511554049","Matteo Salvini","","Leader della Lega #primagliitaliani 🇮🇹","https://t.co/sj3rr6DU3N",FALSE,1475693,2008,3140,53050,3826,2011-03-23 10:32:56,TRUE,"https://t.co/sj3rr6DU3N","https://legaonline.it/",,"https://pbs.twimg.com/profile_banners/270839361/1641590097","http://abs.twimg.com/images/themes/theme1/bg.png","http://pbs.twimg.com/profile_images/966325945060732928/0Ua5xPMX_normal.jpg"
"x270839361","x1533069166370074624",2022-06-04 12:52:26,"matteosalvinimi","Congratulazioni a Ferrara, al suo sindaco (Lega) e ai ferraresi. 🇮🇹
https://t.co/FqdXyGUTXe","Twitter Web App",91,,,,FALSE,FALSE,123,20,,,,,"ilrestodelcarlino.it/ferrara/cosa%2…","https://t.co/FqdXyGUTXe","https://www.ilrestodelcarlino.it/ferrara/cosa%20fare/wall-street-journal-1.7722030",,,,,,,,,,,"it",,,,,,,,,,,,,,,,,,,,,,,,,,,,,,,,,,,,,"NA NA","NA NA","NA NA NA NA NA NA NA NA","https://twitter.com/matteosalvinimi/status/1533069166370074624","Matteo Salvini","","Leader della Lega #primagliitaliani 🇮🇹","https://t.co/sj3rr6DU3N",FALSE,1475693,2008,3140,53050,3826,2011-03-23 10:32:56,TRUE,"https://t.co/sj3rr6DU3N","https://legaonline.it/",,"https://pbs.twimg.com/profile_banners/270839361/1641590097","http://abs.twimg.com/images/themes/theme1/bg.png","http://pbs.twimg.com/profile_images/966325945060732928/0Ua5xPMX_normal.jpg"
"x270839361","x1533062911475830787",2022-06-04 12:27:35,"matteosalvinimi","Una vergogna, una schifezza.
GIUSTIZIA per Alessio e Simone, la vita di due bimbi vale.
Mi auguro vivamente che il Presidente Mattarella intervenga! https://t.co/x8XeeYDBaM","Twitter Web App",148,,,,FALSE,FALSE,312,52,,,,,,,,"http://pbs.twimg.com/media/FUaIlYgWYAEoX7j.jpg","https://t.co/x8XeeYDBaM","https://twitter.com/matteosalvinimi/status/1533062911475830787/photo/1","photo","http://pbs.twimg.com/media/FUaIlYgWYAEoX7j.jpg","https://t.co/x8XeeYDBaM","https://twitter.com/matteosalvinimi/status/1533062911475830787/photo/1",,,,"it",,,,,,,,,,,,,,,,,,,,,,,,,,,,,,,,,,,,,"NA NA","NA NA","NA NA NA NA NA NA NA NA","https://twitter.com/matteosalvinimi/status/1533062911475830787","Matteo Salvini","","Leader della Lega #primagliitaliani 🇮🇹","https://t.co/sj3rr6DU3N",FALSE,1475693,2008,3140,53050,3826,2011-03-23 10:32:56,TRUE,"https://t.co/sj3rr6DU3N","https://legaonline.it/",,"https://pbs.twimg.com/profile_banners/270839361/1641590097","http://abs.twimg.com/images/themes/theme1/bg.png","http://pbs.twimg.com/profile_images/966325945060732928/0Ua5xPMX_normal.jpg"
"x48062712","x1532777461674557441",2022-06-03 17:33:19,"luigidimaio","Con grande piacere ho avuto colloquio telefonico con collega francese @MinColonna. 
Focus su rapporti Italia-Francia, nel quadro del #TrattatoQuirinale. Ribadito sostegno convinto a popolo ucraino, aggredito da esercito russo. Lavoriamo a obiettivo pace e a sicurezza alimentare.","Twitter for iPhone",279,,,,FALSE,FALSE,121,22,,,"TrattatoQuirinale",,,,,,,,,,,,,"x1141660959364308992","MinColonna","it",,,,,,,,,,,,,,,,,,,,,,,,,,,,,,,,,,,,,"NA NA","NA NA","NA NA NA NA NA NA NA NA","https://twitter.com/luigidimaio/status/1532777461674557441","Luigi Di Maio","Pomigliano d'Arco, Campania","Ministro degli Affari Esteri e della Cooperazione Internazionale.","https://t.co/D8gkagqksG",FALSE,769937,339,2230,7113,397,2009-06-17 18:34:46,TRUE,"https://t.co/D8gkagqksG","http://www.luigidimaio.it",,"https://pbs.twimg.com/profile_banners/48062712/1645985183","http://abs.twimg.com/images/themes/theme1/bg.png","http://pbs.twimg.com/profile_images/933106806670462976/YyC7LOW8_normal.jpg"
"x1075084718","x1533124057989783560",2022-06-04 16:30:34,"arrigoni_paolo","Questo significa violentare il principio della neutralità tecnologica, demolire la filiera dell'automotive italiana, consegnarci mani e piedi alla Cina e, paradossalmente, non contribuire alla tutela dell'ambiente!","Twitter for Android",214,"x1533123889357807617","x1075084718","arrigoni_paolo",FALSE,FALSE,16,9,,,,,,,,,,,,,,,,,,"it",,,,,,,,,,,,,,,,,,,,,,,,,,,,,,,,,,,,,"NA NA","NA NA","NA NA NA NA NA NA NA NA","https://twitter.com/arrigoni_paolo/status/1533124057989783560","Paolo Arrigoni","Calolziocorte, Lombardia","Questore del Senato della Repubblica, componente della Commissione Ambiente e del Copasir. Responsabile del Dipartimento Energia della Lega.","https://t.co/M6TePkOvfO",FALSE,4781,187,56,9958,117,2013-01-09 22:36:27,TRUE,"https://t.co/M6TePkOvfO","http://www.senato.it/leg/18/BGT/Schede/Attsen/00029039.htm",,"https://pbs.twimg.com/profile_banners/1075084718/1591968708","http://abs.twimg.com/images/themes/theme1/bg.png","http://pbs.twimg.com/profile_images/3172370357/bec3e4497d64c77f2a93bc9792055992_normal.jpeg"
"x1075084718","x1533123889357807617",2022-06-04 16:29:53,"arrigoni_paolo","Mobilità sostenibile: mercoledì prossimo il Parlamento europeo è chiamato a votare la proposta della Commissione UE di mettere al bando dal 2035 le auto a benzina e diesel in favore delle sole elettriche!
Una follia!","Twitter for Android",216,,,,FALSE,FALSE,18,13,,,,,,,,,,,,,,,,,,"it",,,,,,,,,,,,,,,,,,,,,,,,,,,,,,,,,,,,,"NA NA","NA NA","NA NA NA NA NA NA NA NA","https://twitter.com/arrigoni_paolo/status/1533123889357807617","Paolo Arrigoni","Calolziocorte, Lombardia","Questore del Senato della Repubblica, componente della Commissione Ambiente e del Copasir. Responsabile del Dipartimento Energia della Lega.","https://t.co/M6TePkOvfO",FALSE,4781,187,56,9958,117,2013-01-09 22:36:27,TRUE,"https://t.co/M6TePkOvfO","http://www.senato.it/leg/18/BGT/Schede/Attsen/00029039.htm",,"https://pbs.twimg.com/profile_banners/1075084718/1591968708","http://abs.twimg.com/images/themes/theme1/bg.png","http://pbs.twimg.com/profile_images/3172370357/bec3e4497d64c77f2a93bc9792055992_normal.jpeg"
"x101602652","x1533003543803748352",2022-06-04 08:31:41,"augussori","🔵🔵RISTRUTTURAZIONE TOTALE DI VILLA BRAILA

#VotaLEGA #ScriviAUGUSSORI #dalleparoleaifatti #UnGrandeProgettoDiCittá #Lega #Lodi2022 #CasanovaSindaco https://t.co/N5BTZ3JJCy","Twitter for iPhone",147,,,,FALSE,FALSE,0,0,,,"VotaLEGA ScriviAUGUSSORI dalleparoleaifatti UnGrandeProgettoDiCittá Lega Lodi2022 CasanovaSindaco",,,,,"http://pbs.twimg.com/media/FUZSmGyWUAEiulZ.jpg","https://t.co/N5BTZ3JJCy","https://twitter.com/augussori/status/1533003543803748352/photo/1","photo","http://pbs.twimg.com/media/FUZSmGyWUAEiulZ.jpg","https://t.co/N5BTZ3JJCy","https://twitter.com/augussori/status/1533003543803748352/photo/1",,,,"it",,,,,,,,,,,,,,,,,,,,,,,,,,,,,,,,,,,,,"NA NA","NA NA","NA NA NA NA NA NA NA NA","https://twitter.com/augussori/status/1533003543803748352","Luigi Augussori","Lodi, Lombardy","Profilo del sen. Luigi Augussori, rappresentante lodigiano nel Senato della Repubblica per il gruppo Lega - Salvini Premier. https://t.co/RVDZN85Ue5","https://t.co/494Lk5LQeR",FALSE,1006,847,18,3566,335,2010-01-03 23:39:00,TRUE,"https://t.co/494Lk5LQeR","http://www.senato.it/leg/18/BGT/Schede/Attsen/00019244.htm",,"https://pbs.twimg.com/profile_banners/101602652/1651901040","http://abs.twimg.com/images/themes/theme1/bg.png","http://pbs.twimg.com/profile_images/1522809403216470016/YjJcca8y_normal.jpg"
"x101602652","x1532977461516025857",2022-06-04 06:48:02,"augussori","🔵Domani mattina Massimiliano Romeo, Presidente dei Senatori Lega, sarà a Lodi per sostenere la candidatura di Sara Casanova a Sindaco di Lodi. 
#VotaLEGA #ScriviAUGUSSORI #dalleparoleaifatti #UnGrandeProgettoDiCittá #Lega #Lodi2022 #CasanovaSindaco https://t.co/looZ0QxN2A","Twitter for iPhone",248,,,,FALSE,FALSE,6,2,,,"VotaLEGA ScriviAUGUSSORI dalleparoleaifatti UnGrandeProgettoDiCittá Lega Lodi2022 CasanovaSindaco",,,,,"http://pbs.twimg.com/media/FUY6319X0AElNda.jpg","https://t.co/looZ0QxN2A","https://twitter.com/augussori/status/1532977461516025857/photo/1","photo","http://pbs.twimg.com/media/FUY6319X0AElNda.jpg","https://t.co/looZ0QxN2A","https://twitter.com/augussori/status/1532977461516025857/photo/1",,,,"it",,,,,,,,,,,,,,,,,,,,,,,,,,,,,,,,,,,,,"NA NA","NA NA","NA NA NA NA NA NA NA NA","https://twitter.com/augussori/status/1532977461516025857","Luigi Augussori","Lodi, Lombardy","Profilo del sen. Luigi Augussori, rappresentante lodigiano nel Senato della Repubblica per il gruppo Lega - Salvini Premier. https://t.co/RVDZN85Ue5","https://t.co/494Lk5LQeR",FALSE,1006,847,18,3566,335,2010-01-03 23:39:00,TRUE,"https://t.co/494Lk5LQeR","http://www.senato.it/leg/18/BGT/Schede/Attsen/00019244.htm",,"https://pbs.twimg.com/profile_banners/101602652/1651901040","http://abs.twimg.com/images/themes/theme1/bg.png","http://pbs.twimg.com/profile_images/1522809403216470016/YjJcca8y_normal.jpg"
"x101602652","x1532836913429848065",2022-06-03 21:29:33,"augussori","🔵Massimiliano Romeo a Lodi
Il Presidente del Gruppo Lega Senato sarà a Lodi domenica 5 giugno per sostenere la candidatura di Sara Casanova Sindaco di Lodi.
#VotaLEGA #ScriviAUGUSSORI #dalleparoleaifatti #UnGrandeProgettoDiCittá #Lega #Lodi2022 #CasanovaSindaco https://t.co/BiHTdpSPeu","Twitter for iPhone",261,,,,FALSE,FALSE,1,0,,,"VotaLEGA ScriviAUGUSSORI dalleparoleaifatti UnGrandeProgettoDiCittá Lega Lodi2022 CasanovaSindaco",,,,,"http://pbs.twimg.com/media/FUW7CupWYAIWNtH.jpg","https://t.co/BiHTdpSPeu","https://twitter.com/augussori/status/1532836913429848065/photo/1","photo","http://pbs.twimg.com/media/FUW7CupWYAIWNtH.jpg","https://t.co/BiHTdpSPeu","https://twitter.com/augussori/status/1532836913429848065/photo/1",,,,"it",,,,,,,,,,,,,,,,,,,,,,,,,,,,,,,,,,,,,"NA NA","NA NA","NA NA NA NA NA NA NA NA","https://twitter.com/augussori/status/1532836913429848065","Luigi Augussori","Lodi, Lombardy","Profilo del sen. Luigi Augussori, rappresentante lodigiano nel Senato della Repubblica per il gruppo Lega - Salvini Premier. https://t.co/RVDZN85Ue5","https://t.co/494Lk5LQeR",FALSE,1006,847,18,3566,335,2010-01-03 23:39:00,TRUE,"https://t.co/494Lk5LQeR","http://www.senato.it/leg/18/BGT/Schede/Attsen/00019244.htm",,"https://pbs.twimg.com/profile_banners/101602652/1651901040","http://abs.twimg.com/images/themes/theme1/bg.png","http://pbs.twimg.com/profile_images/1522809403216470016/YjJcca8y_normal.jpg"
"x876541483","x1533107551419699200",2022-06-04 15:24:58,"AlbertoBagnai","@MaurizioFuochi No. Ho votato contro l’obbligo per i sanitari, come molti altri colleghi, e l’autore di questo capolavoro di arte povera lo sa benissimo.","Twitter for iPhone",137,"x1533105178043420672","x1428767360","MaurizioFuochi",FALSE,FALSE,7,1,,,,,,,,,,,,,,,,"x1428767360","MaurizioFuochi","it",,,,,,,,,,,,,,,,,,,,,,,,,,,,,,,,,,,,,"NA NA","NA NA","NA NA NA NA NA NA NA NA","https://twitter.com/AlbertoBagnai/status/1533107551419699200","Alberto Bagnai","","Professore associato di politica economica all’Università Gabriele d’Annunzio, eletto al Senato per la Lega nel collegio Abruzzo 01.","https://t.co/sC5RvUzmsX",FALSE,134572,666,656,225894,6501,2012-10-12 22:13:36,TRUE,"https://t.co/sC5RvUzmsX","http://www.senato.it/leg/18/BGT/Schede/Attsen/00032582.htm",,"https://pbs.twimg.com/profile_banners/876541483/1535647109","http://abs.twimg.com/images/themes/theme1/bg.png","http://pbs.twimg.com/profile_images/849030859462246401/ATk3_aiW_normal.jpg"
"x876541483","x1533107042629582851",2022-06-04 15:22:57,"AlbertoBagnai","@lorenzlu Sì, è vero, tu non sei finto. Ci hai votato soprattutto per il tema dell’immigrazione, ci hai anche difeso. Grazie. Temo però che ti mancasse sempre un pezzo di ragionamento, ma non è colpa tua. https://t.co/C9XRvRji2E","Twitter for iPhone",194,"x1533085553675145216","x70741097","lorenzlu",FALSE,FALSE,3,0,,,,,,,,"http://pbs.twimg.com/media/FUawueIWYAER0FJ.jpg","https://t.co/C9XRvRji2E","https://twitter.com/AlbertoBagnai/status/1533107042629582851/photo/1","photo","http://pbs.twimg.com/media/FUawueIWYAER0FJ.jpg","https://t.co/C9XRvRji2E","https://twitter.com/AlbertoBagnai/status/1533107042629582851/photo/1",,"x70741097","lorenzlu","it",,,,,,,,,,,,,,,,,,,,,,,,,,,,,,,,,,,,,"NA NA","NA NA","NA NA NA NA NA NA NA NA","https://twitter.com/AlbertoBagnai/status/1533107042629582851","Alberto Bagnai","","Professore associato di politica economica all’Università Gabriele d’Annunzio, eletto al Senato per la Lega nel collegio Abruzzo 01.","https://t.co/sC5RvUzmsX",FALSE,134572,666,656,225894,6501,2012-10-12 22:13:36,TRUE,"https://t.co/sC5RvUzmsX","http://www.senato.it/leg/18/BGT/Schede/Attsen/00032582.htm",,"https://pbs.twimg.com/profile_banners/876541483/1535647109","http://abs.twimg.com/images/themes/theme1/bg.png","http://pbs.twimg.com/profile_images/849030859462246401/ATk3_aiW_normal.jpg"
"x876541483","x1533104636390952961",2022-06-04 15:13:23,"AlbertoBagnai","@Frctonin Invertirei: sarebbe meglio che qualcuno li cagasse così farebbero meno inutile rumore qui.","Twitter for iPhone",90,"x1533096254493843458","x1011991627517263872","Frctonin",FALSE,FALSE,3,0,,,,,,,,,,,,,,,,"x1011991627517263872","Frctonin","it",,,,,,,,,,,,,,,,,,,,,,,,,,,,,,,,,,,,,"NA NA","NA NA","NA NA NA NA NA NA NA NA","https://twitter.com/AlbertoBagnai/status/1533104636390952961","Alberto Bagnai","","Professore associato di politica economica all’Università Gabriele d’Annunzio, eletto al Senato per la Lega nel collegio Abruzzo 01.","https://t.co/sC5RvUzmsX",FALSE,134572,666,656,225894,6501,2012-10-12 22:13:36,TRUE,"https://t.co/sC5RvUzmsX","http://www.senato.it/leg/18/BGT/Schede/Attsen/00032582.htm",,"https://pbs.twimg.com/profile_banners/876541483/1535647109","http://abs.twimg.com/images/themes/theme1/bg.png","http://pbs.twimg.com/profile_images/849030859462246401/ATk3_aiW_normal.jpg"
"x876541483","x1533104228926889984",2022-06-04 15:11:46,"AlbertoBagnai","@Trashanza1 Bravo. Allora vai a rompere i coglioni a LEU. Grazie.","Twitter for iPhone",53,"x1533102144550801408","x1336094616429473794","Trashanza1",FALSE,FALSE,23,6,,,,,,,,,,,,,,,,"x1336094616429473794","Trashanza1","it",,,,,,,,,,,,,,,,,,,,,,,,,,,,,,,,,,,,,"NA NA","NA NA","NA NA NA NA NA NA NA NA","https://twitter.com/AlbertoBagnai/status/1533104228926889984","Alberto Bagnai","","Professore associato di politica economica all’Università Gabriele d’Annunzio, eletto al Senato per la Lega nel collegio Abruzzo 01.","https://t.co/sC5RvUzmsX",FALSE,134572,666,656,225894,6501,2012-10-12 22:13:36,TRUE,"https://t.co/sC5RvUzmsX","http://www.senato.it/leg/18/BGT/Schede/Attsen/00032582.htm",,"https://pbs.twimg.com/profile_banners/876541483/1535647109","http://abs.twimg.com/images/themes/theme1/bg.png","http://pbs.twimg.com/profile_images/849030859462246401/ATk3_aiW_normal.jpg"
"x876541483","x1533104024387452928",2022-06-04 15:10:57,"AlbertoBagnai","@sherpa810 @Marko_Morandi Però l’Apololega è divertente. Quelli che gli vanno dietro sono quelli che hanno votato PD, poi 5 Stelle, e ora verosimilmente non voteranno.","Twitter for iPhone",141,"x1533103228505694213","x2333071543","sherpa810",FALSE,FALSE,20,5,,,,,,,,,,,,,,,,"x2333071543 x492602588","sherpa810 Marko_Morandi","it",,,,,,,,,,,,,,,,,,,,,,,,,,,,,,,,,,,,,"NA NA","NA NA","NA NA NA NA NA NA NA NA","https://twitter.com/AlbertoBagnai/status/1533104024387452928","Alberto Bagnai","","Professore associato di politica economica all’Università Gabriele d’Annunzio, eletto al Senato per la Lega nel collegio Abruzzo 01.","https://t.co/sC5RvUzmsX",FALSE,134572,666,656,225894,6501,2012-10-12 22:13:36,TRUE,"https://t.co/sC5RvUzmsX","http://www.senato.it/leg/18/BGT/Schede/Attsen/00032582.htm",,"https://pbs.twimg.com/profile_banners/876541483/1535647109","http://abs.twimg.com/images/themes/theme1/bg.png","http://pbs.twimg.com/profile_images/849030859462246401/ATk3_aiW_normal.jpg"
"x876541483","x1533089638583238656",2022-06-04 14:13:47,"AlbertoBagnai","@AlbertoBagnai https://t.co/uT5J6Aj7o6","Twitter for iPhone",53,,,,FALSE,TRUE,0,8,,,,,,,,"http://pbs.twimg.com/media/FUaeXF6WUAMbWOH.jpg","https://t.co/uT5J6Aj7o6","https://twitter.com/sherpa810/status/1533086848511356930/photo/1","photo","http://pbs.twimg.com/media/FUaeXF6WUAMbWOH.jpg http://pbs.twimg.com/media/FUaeXSoXoAEzHEa.jpg","https://t.co/uT5J6Aj7o6 https://t.co/uT5J6Aj7o6","https://twitter.com/sherpa810/status/1533086848511356930/photo/1 https://twitter.com/sherpa810/status/1533086848511356930/photo/1",,"x2333071543 x876541483","sherpa810 AlbertoBagnai","und",,,,,,,,,,,,,,,,"x1533086848511356930","@AlbertoBagnai https://t.co/uT5J6Aj7o6",2022-06-04 14:02:42,"Twitter for Android",32,8,"x2333071543","sherpa810","Sherpa810",2427,224,176352,"","🇮🇹 Amate il vostro paese, è il più bello del mondo, nonostante i traditori.
Sostenete @AsimmetrieOrg.
Se ritwitto non vuol sempre dire che approvo.🇮🇹",FALSE,,,,,,,"NA NA","NA NA","NA NA NA NA NA NA NA NA","https://twitter.com/AlbertoBagnai/status/1533089638583238656","Alberto Bagnai","","Professore associato di politica economica all’Università Gabriele d’Annunzio, eletto al Senato per la Lega nel collegio Abruzzo 01.","https://t.co/sC5RvUzmsX",FALSE,134572,666,656,225894,6501,2012-10-12 22:13:36,TRUE,"https://t.co/sC5RvUzmsX","http://www.senato.it/leg/18/BGT/Schede/Attsen/00032582.htm",,"https://pbs.twimg.com/profile_banners/876541483/1535647109","http://abs.twimg.com/images/themes/theme1/bg.png","http://pbs.twimg.com/profile_images/849030859462246401/ATk3_aiW_normal.jpg"
"x876541483","x1533089527182594048",2022-06-04 14:13:21,"AlbertoBagnai","🗓️Mercoledì 8 giugno alle 18
📌Parco Airoldi, Piazza Leoni 9 #Palermo 
👉 Manifestazione politica ""Idee e progetti per Palermo"" con Alberto #Bagnai e Claudio Borghi. Interverranno Antonio Triolo, Elisabetta Luparello,Luca Briziarelli e io! Avanti così!
https://t.co/7n7VAkO3iv https://t.co/bP7FX0ZLTx","Twitter for iPhone",140,,,,FALSE,TRUE,0,17,,,"Palermo",,,,,,,,,,,,,"x514949332","AlbertoSamona","it",,,,,,,,,,,,,,,,"x1533011167274205185","🗓️Mercoledì 8 giugno alle 18
📌Parco Airoldi, Piazza Leoni 9 #Palermo 
👉 Manifestazione politica ""Idee e progetti per Palermo"" con Alberto #Bagnai e Claudio Borghi. Interverranno Antonio Triolo, Elisabetta Luparello,Luca Briziarelli e io! Avanti così!
https://t.co/7n7VAkO3iv https://t.co/bP7FX0ZLTx",2022-06-04 09:01:58,"Twitter for Android",39,17,"x514949332","AlbertoSamona","Alberto Samonà",1371,316,1357,"","Giornalista. Scrittore. Militante della Lega. Assessore regionale dei Beni Culturali e dell'Identità Siciliana. Cattolico di Rito Greco-Bizantino e uomo libero",FALSE,,,,,,,"NA NA","NA NA","NA NA NA NA NA NA NA NA","https://twitter.com/AlbertoBagnai/status/1533089527182594048","Alberto Bagnai","","Professore associato di politica economica all’Università Gabriele d’Annunzio, eletto al Senato per la Lega nel collegio Abruzzo 01.","https://t.co/sC5RvUzmsX",FALSE,134572,666,656,225894,6501,2012-10-12 22:13:36,TRUE,"https://t.co/sC5RvUzmsX","http://www.senato.it/leg/18/BGT/Schede/Attsen/00032582.htm",,"https://pbs.twimg.com/profile_banners/876541483/1535647109","http://abs.twimg.com/images/themes/theme1/bg.png","http://pbs.twimg.com/profile_images/849030859462246401/ATk3_aiW_normal.jpg"
"x876541483","x1533047723645194241",2022-06-04 11:27:14,"AlbertoBagnai","Questa è poi una delle cose più assurde in assoluto.
In pratica con ciò si sancise che un medico non possa più esercitare il proprio ruolo in scienza e coscienza ma solo in base a direttive. Questa cosa non è solo paradossale e deontologicamente discutibile, ma anche pericolosa. https://t.co/HUi3wkBrIv","Twitter for iPhone",140,,,,FALSE,TRUE,0,48,,,,,,,,,,,,,,,,"x330865662","LykanLA","it",,,,,,,,,,,,,,,,"x1533047607257358338","Questa è poi una delle cose più assurde in assoluto.
In pratica con ciò si sancise che un medico non possa più esercitare il proprio ruolo in scienza e coscienza ma solo in base a direttive. Questa cosa non è solo paradossale e deontologicamente discutibile, ma anche pericolosa. https://t.co/HUi3wkBrIv",2022-06-04 11:26:46,"Twitter for Android",88,48,"x330865662","LykanLA","LykanLA 🇮🇹",1740,993,67860,"","Se davanti a te tutto è grigio, sposta l'elefante
Proverbio indiano

RT not necessarily = endorsement

N.B. Profilo politicamente scorretto.   #PAFI",FALSE,,,,,,,"NA NA","NA NA","NA NA NA NA NA NA NA NA","https://twitter.com/AlbertoBagnai/status/1533047723645194241","Alberto Bagnai","","Professore associato di politica economica all’Università Gabriele d’Annunzio, eletto al Senato per la Lega nel collegio Abruzzo 01.","https://t.co/sC5RvUzmsX",FALSE,134572,666,656,225894,6501,2012-10-12 22:13:36,TRUE,"https://t.co/sC5RvUzmsX","http://www.senato.it/leg/18/BGT/Schede/Attsen/00032582.htm",,"https://pbs.twimg.com/profile_banners/876541483/1535647109","http://abs.twimg.com/images/themes/theme1/bg.png","http://pbs.twimg.com/profile_images/849030859462246401/ATk3_aiW_normal.jpg"
"x876541483","x1533047524537270272",2022-06-04 11:26:27,"AlbertoBagnai","@OfficialTozzi L’accesso universale alle cure è costituzionalmente garantito perfino nel caso di un omicida, di un pedofilo o di un clandestino che non ha mai versato un centesimo di contributi. 

Tu non hai concesso proprio nulla, ignorante.","Twitter for iPhone",139,,,,FALSE,TRUE,0,54,,,,,,,,,,,,,,,,"x628527048 x1106181225453142017","flayawa OfficialTozzi","it",,,,,,,,,,,,,,,,"x1532994097748779008","@OfficialTozzi L’accesso universale alle cure è costituzionalmente garantito perfino nel caso di un omicida, di un pedofilo o di un clandestino che non ha mai versato un centesimo di contributi. 

Tu non hai concesso proprio nulla, ignorante.",2022-06-04 07:54:09,"Twitter for iPhone",368,54,"x628527048","flayawa","Flaminia🍷🍽",22668,932,78086,"Roma","L’uomo non ha limiti e quando un giorno se ne renderà conto, sarà libero anche qui in questo mondo. (@fla_dp alter ego, per stare tranquilli...)",FALSE,,,,,,,"NA NA","NA NA","NA NA NA NA NA NA NA NA","https://twitter.com/AlbertoBagnai/status/1533047524537270272","Alberto Bagnai","","Professore associato di politica economica all’Università Gabriele d’Annunzio, eletto al Senato per la Lega nel collegio Abruzzo 01.","https://t.co/sC5RvUzmsX",FALSE,134572,666,656,225894,6501,2012-10-12 22:13:36,TRUE,"https://t.co/sC5RvUzmsX","http://www.senato.it/leg/18/BGT/Schede/Attsen/00032582.htm",,"https://pbs.twimg.com/profile_banners/876541483/1535647109","http://abs.twimg.com/images/themes/theme1/bg.png","http://pbs.twimg.com/profile_images/849030859462246401/ATk3_aiW_normal.jpg"
