"x996725885238726662","x1483885914254368774",2022-01-19 19:35:45,"Francesca_M5S","I #medicidifamiglia la grande sfida da vincere. Sono 3000 i #medici di famiglia da sostituire nei 5000 piccoli Comuni italiani. Occorre una vera rivoluzione amministrativa. I medici di famiglia vanno assunti e non convenzionati. https://t.co/eVYBLvLJZX","Twitter for iPhone",228,,,,FALSE,FALSE,1,1,,,"medicidifamiglia medici",,,,,"http://pbs.twimg.com/media/FJfSX1GXsAE_Sc3.jpg","https://t.co/eVYBLvLJZX","https://twitter.com/Francesca_M5S/status/1483885914254368774/photo/1","photo","http://pbs.twimg.com/media/FJfSX1GXsAE_Sc3.jpg","https://t.co/eVYBLvLJZX","https://twitter.com/Francesca_M5S/status/1483885914254368774/photo/1",,,,"it",,,,,,,,,,,,,,,,,,,,,,,,,,,,,,,,,,,,,"NA NA","NA NA","NA NA NA NA NA NA NA NA","https://twitter.com/Francesca_M5S/status/1483885914254368774","Francesca Troiano","Roma, Lazio","Psicologa, psicoterapeuta e deputata della Repubblica. 
Membro della VI Commissione (Finanze).","https://t.co/Fpn4zKX9CU",FALSE,877,76,14,156,12,2018-05-16 12:15:44,TRUE,"https://t.co/Fpn4zKX9CU","http://bit.ly/2P0FcZ6",,"https://pbs.twimg.com/profile_banners/996725885238726662/1615394758","http://abs.twimg.com/images/themes/theme1/bg.png","http://pbs.twimg.com/profile_images/1369626673247907840/Ko4nxv4z_normal.jpg"
"x1712358318","x1483790528923811852",2022-01-19 13:16:44,"ZolezziAlberto","Il ristorante Geranium di Copenaghen ha rimosso la carne dal suo menù. Classificato con 3 stelle nella guida Michelin, è considerato il secondo miglior ristorante al mondo del 2021.  https://t.co/XZ4g0kOXc3","Twitter Web App",139,,,,FALSE,TRUE,0,51,,,,,,,,,,,,,,,,"x19067940","beppe_grillo","it",,,,,,,,,,,,,,,,"x1483734902717698051","Il ristorante Geranium di Copenaghen ha rimosso la carne dal suo menù. Classificato con 3 stelle nella guida Michelin, è considerato il secondo miglior ristorante al mondo del 2021.  https://t.co/XZ4g0kOXc3",2022-01-19 09:35:41,"Twitter for Android",188,51,"x19067940","beppe_grillo","Beppe Grillo",2413321,317,74116,"Genova, Italia","In alto i cuori!",TRUE,,,,,,,"NA NA","NA NA","NA NA NA NA NA NA NA NA","https://twitter.com/ZolezziAlberto/status/1483790528923811852","Alberto Zolezzi","","portavoce alla Camera, Movimento 5 Stelle","https://t.co/h097bQB1Wx",FALSE,3478,561,61,388,5,2013-08-30 10:39:06,TRUE,"https://t.co/h097bQB1Wx","http://www.parlamentari5stelle.it",,"https://pbs.twimg.com/profile_banners/1712358318/1454498827","http://abs.twimg.com/images/themes/theme1/bg.png","http://pbs.twimg.com/profile_images/378800000469161840/fe74b7cfd555b6dd289a460d11246397_normal.jpeg"
"x636328779","x1484122160142729219",2022-01-20 11:14:31,"AlexBazzaro","2 mesi o 4500 euro per aver aiutato un essere umano in difficoltà.

Ne usciremo migliori. #supergreenpass https://t.co/Gi57eoIwgL","Twitter for iPhone",105,,,,FALSE,FALSE,9,4,,,"supergreenpass",,,,,"http://pbs.twimg.com/media/FJipO5WXIAYZn1G.jpg","https://t.co/Gi57eoIwgL","https://twitter.com/AlexBazzaro/status/1484122160142729219/photo/1","photo","http://pbs.twimg.com/media/FJipO5WXIAYZn1G.jpg","https://t.co/Gi57eoIwgL","https://twitter.com/AlexBazzaro/status/1484122160142729219/photo/1",,,,"it",,,,,,,,,,,,,,,,,,,,,,,,,,,,,,,,,,,,,"NA NA","NA NA","NA NA NA NA NA NA NA NA","https://twitter.com/AlexBazzaro/status/1484122160142729219","Alex Bazzaro","Venezia ","🇮🇹Deputato Lega, Commissione XIV  🦁Consigliere Comunale Venezia. ✈️ Delegazione @OSCE Liberale e libertario","https://t.co/yXFTMiY4b3",FALSE,3315,543,40,13682,7504,2012-07-15 15:20:42,TRUE,"https://t.co/yXFTMiY4b3","https://www.camera.it/leg18/29?shadow_deputato=307696&idpersona=307696&idlegislatura=18",,"https://pbs.twimg.com/profile_banners/636328779/1457208495","http://abs.twimg.com/images/themes/theme1/bg.png","http://pbs.twimg.com/profile_images/1315654416171753472/1PG-DcXJ_normal.jpg"
"x636328779","x1484119803870822406",2022-01-20 11:05:09,"AlexBazzaro","Per solidarizzare con la cancellazione delle (pochissime) restrizioni in Gran Bretagna vi informo che ho acquistato qualche altro titolo di stato inglese.
Come sempre ricordo che non è un consiglio di investimento (e aspetto sereno i soliti articoli di melma sui miei risparmi)","Twitter for iPhone",140,,,,FALSE,TRUE,0,35,,,,,,,,,,,,,,,,"x337767301","borghi_claudio","it",,,,,,,,,,,,,,,,"x1484116936493522944","Per solidarizzare con la cancellazione delle (pochissime) restrizioni in Gran Bretagna vi informo che ho acquistato qualche altro titolo di stato inglese.
Come sempre ricordo che non è un consiglio di investimento (e aspetto sereno i soliti articoli di melma sui miei risparmi)",2022-01-20 10:53:45,"Twitter Web App",295,35,"x337767301","borghi_claudio","Claudio Borghi A.",126463,1333,218148,"Italia","Deputato della Repubblica Italiana eletto in Toscana per la Lega. Consigliere Comunale di Como",TRUE,,,,,,,"NA NA","NA NA","NA NA NA NA NA NA NA NA","https://twitter.com/AlexBazzaro/status/1484119803870822406","Alex Bazzaro","Venezia ","🇮🇹Deputato Lega, Commissione XIV  🦁Consigliere Comunale Venezia. ✈️ Delegazione @OSCE Liberale e libertario","https://t.co/yXFTMiY4b3",FALSE,3315,543,40,13682,7504,2012-07-15 15:20:42,TRUE,"https://t.co/yXFTMiY4b3","https://www.camera.it/leg18/29?shadow_deputato=307696&idpersona=307696&idlegislatura=18",,"https://pbs.twimg.com/profile_banners/636328779/1457208495","http://abs.twimg.com/images/themes/theme1/bg.png","http://pbs.twimg.com/profile_images/1315654416171753472/1PG-DcXJ_normal.jpg"
"x636328779","x1484117931302735874",2022-01-20 10:57:43,"AlexBazzaro","23 settembre 2020.

Aveva ragione sulla libertà. Ma lo abbiamo fregato sui casi. Siamo avanti pure lì!😉 #supergreenpass https://t.co/Emg3jTnLUB","Twitter for iPhone",119,,,,FALSE,FALSE,11,1,,,"supergreenpass",,,,,"http://pbs.twimg.com/media/FJilY9wXwAIK8by.jpg","https://t.co/Emg3jTnLUB","https://twitter.com/AlexBazzaro/status/1484117931302735874/photo/1","photo","http://pbs.twimg.com/media/FJilY9wXwAIK8by.jpg","https://t.co/Emg3jTnLUB","https://twitter.com/AlexBazzaro/status/1484117931302735874/photo/1",,,,"it",,,,,,,,,,,,,,,,,,,,,,,,,,,,,,,,,,,,,"NA NA","NA NA","NA NA NA NA NA NA NA NA","https://twitter.com/AlexBazzaro/status/1484117931302735874","Alex Bazzaro","Venezia ","🇮🇹Deputato Lega, Commissione XIV  🦁Consigliere Comunale Venezia. ✈️ Delegazione @OSCE Liberale e libertario","https://t.co/yXFTMiY4b3",FALSE,3315,543,40,13682,7504,2012-07-15 15:20:42,TRUE,"https://t.co/yXFTMiY4b3","https://www.camera.it/leg18/29?shadow_deputato=307696&idpersona=307696&idlegislatura=18",,"https://pbs.twimg.com/profile_banners/636328779/1457208495","http://abs.twimg.com/images/themes/theme1/bg.png","http://pbs.twimg.com/profile_images/1315654416171753472/1PG-DcXJ_normal.jpg"
"x636328779","x1484104886534946816",2022-01-20 10:05:52,"AlexBazzaro","“Io mi sono vaccinato per gli altri” https://t.co/jkijr8oI1z","Twitter for iPhone",36,,,,FALSE,FALSE,50,9,,,,,,,,"http://pbs.twimg.com/media/FJiZhxOXEAAH-a2.jpg","https://t.co/jkijr8oI1z","https://twitter.com/AlexBazzaro/status/1484104886534946816/photo/1","photo","http://pbs.twimg.com/media/FJiZhxOXEAAH-a2.jpg","https://t.co/jkijr8oI1z","https://twitter.com/AlexBazzaro/status/1484104886534946816/photo/1",,,,"it",,,,,,,,,,,,,,,,,,,,,,,,,,,,,,,,,,,,,"NA NA","NA NA","NA NA NA NA NA NA NA NA","https://twitter.com/AlexBazzaro/status/1484104886534946816","Alex Bazzaro","Venezia ","🇮🇹Deputato Lega, Commissione XIV  🦁Consigliere Comunale Venezia. ✈️ Delegazione @OSCE Liberale e libertario","https://t.co/yXFTMiY4b3",FALSE,3315,543,40,13682,7504,2012-07-15 15:20:42,TRUE,"https://t.co/yXFTMiY4b3","https://www.camera.it/leg18/29?shadow_deputato=307696&idpersona=307696&idlegislatura=18",,"https://pbs.twimg.com/profile_banners/636328779/1457208495","http://abs.twimg.com/images/themes/theme1/bg.png","http://pbs.twimg.com/profile_images/1315654416171753472/1PG-DcXJ_normal.jpg"
"x636328779","x1484103419283529733",2022-01-20 10:00:03,"AlexBazzaro","Grillo e Frattini ricordano a tutti chi comanda. Chi non è complottista è coglione.","Twitter for iPhone",104,,,,FALSE,TRUE,0,51,,,,,,,,,,,,,,,,"x104170025","boni_castellane","it",,,,,,,,,,,,,,,,"x1484095169200803847","Grillo e Frattini ricordano a tutti chi comanda. Chi non è complottista è coglione.",2022-01-20 09:27:16,"Twitter Web App",253,51,"x104170025","boni_castellane","Bonifacio Castellane",10111,1339,92274,"","Avere un account su Twitter non fa di te Oscar Wilde.",FALSE,,,,,,,"NA NA","NA NA","NA NA NA NA NA NA NA NA","https://twitter.com/AlexBazzaro/status/1484103419283529733","Alex Bazzaro","Venezia ","🇮🇹Deputato Lega, Commissione XIV  🦁Consigliere Comunale Venezia. ✈️ Delegazione @OSCE Liberale e libertario","https://t.co/yXFTMiY4b3",FALSE,3315,543,40,13682,7504,2012-07-15 15:20:42,TRUE,"https://t.co/yXFTMiY4b3","https://www.camera.it/leg18/29?shadow_deputato=307696&idpersona=307696&idlegislatura=18",,"https://pbs.twimg.com/profile_banners/636328779/1457208495","http://abs.twimg.com/images/themes/theme1/bg.png","http://pbs.twimg.com/profile_images/1315654416171753472/1PG-DcXJ_normal.jpg"
"x636328779","x1484103363662864385",2022-01-20 09:59:49,"AlexBazzaro","In futuro chiunque potrà toglierci tutto per qualsiasi motivo. Nessuno ci potrà difendere, né le forze dell'ordine né la magistratura né la politica. Questa cosa si chiama ""occupazione nemica"" e sotto occupazione si vive come si può e come si deve.","Twitter for iPhone",139,,,,FALSE,TRUE,0,129,,,,,,,,,,,,,,,,"x104170025","boni_castellane","it",,,,,,,,,,,,,,,,"x1484101296433119235","In futuro chiunque potrà toglierci tutto per qualsiasi motivo. Nessuno ci potrà difendere, né le forze dell'ordine né la magistratura né la politica. Questa cosa si chiama ""occupazione nemica"" e sotto occupazione si vive come si può e come si deve.",2022-01-20 09:51:36,"Twitter Web App",429,129,"x104170025","boni_castellane","Bonifacio Castellane",10111,1339,92274,"","Avere un account su Twitter non fa di te Oscar Wilde.",FALSE,,,,,,,"NA NA","NA NA","NA NA NA NA NA NA NA NA","https://twitter.com/AlexBazzaro/status/1484103363662864385","Alex Bazzaro","Venezia ","🇮🇹Deputato Lega, Commissione XIV  🦁Consigliere Comunale Venezia. ✈️ Delegazione @OSCE Liberale e libertario","https://t.co/yXFTMiY4b3",FALSE,3315,543,40,13682,7504,2012-07-15 15:20:42,TRUE,"https://t.co/yXFTMiY4b3","https://www.camera.it/leg18/29?shadow_deputato=307696&idpersona=307696&idlegislatura=18",,"https://pbs.twimg.com/profile_banners/636328779/1457208495","http://abs.twimg.com/images/themes/theme1/bg.png","http://pbs.twimg.com/profile_images/1315654416171753472/1PG-DcXJ_normal.jpg"
"x636328779","x1484103061794697216",2022-01-20 09:58:37,"AlexBazzaro","I danno fatti dai media tradizionali sulla psiche del singolo e sul tessuto sociale non sono calcolabili. Impaurito i deboli rendendoli aggressivi per codardia. Aizzato i violenti, utili idioti momentaneamente dalla parte giusta. 

Da farsa a tragedia a volte il passo è breve.","Twitter for iPhone",277,,,,FALSE,FALSE,33,5,,,,,,,,,,,,,,,,,,"it",,,,,,,,,,,,,,,,,,,,,,,,,,,,,,,,,,,,,"NA NA","NA NA","NA NA NA NA NA NA NA NA","https://twitter.com/AlexBazzaro/status/1484103061794697216","Alex Bazzaro","Venezia ","🇮🇹Deputato Lega, Commissione XIV  🦁Consigliere Comunale Venezia. ✈️ Delegazione @OSCE Liberale e libertario","https://t.co/yXFTMiY4b3",FALSE,3315,543,40,13682,7504,2012-07-15 15:20:42,TRUE,"https://t.co/yXFTMiY4b3","https://www.camera.it/leg18/29?shadow_deputato=307696&idpersona=307696&idlegislatura=18",,"https://pbs.twimg.com/profile_banners/636328779/1457208495","http://abs.twimg.com/images/themes/theme1/bg.png","http://pbs.twimg.com/profile_images/1315654416171753472/1PG-DcXJ_normal.jpg"
"x636328779","x1484100890344800261",2022-01-20 09:50:00,"AlexBazzaro","Nella loro vituperevole condotta i gerarchi nazisti ebbero una immeritata fortuna: ai loro tempi la propaganda non prendeva le forme degradanti del talk show. Poterono così esercitare il male con tetra dignità. Volenteroso carnefice è esteticamente superiore a guitto carnefice.","Twitter for iPhone",140,,,,FALSE,TRUE,0,217,,,,,,,,,,,,,,,,"x876541483","AlbertoBagnai","it",,,,,,,,,,,,,,,,"x1483990314499125252","Nella loro vituperevole condotta i gerarchi nazisti ebbero una immeritata fortuna: ai loro tempi la propaganda non prendeva le forme degradanti del talk show. Poterono così esercitare il male con tetra dignità. Volenteroso carnefice è esteticamente superiore a guitto carnefice.",2022-01-20 02:30:36,"Twitter for iPhone",820,217,"x876541483","AlbertoBagnai","Alberto Bagnai",131206,666,221988,"","Professore associato di politica economica all’Università Gabriele d’Annunzio, eletto al Senato per la Lega nel collegio Abruzzo 01.",TRUE,,,,,,,"NA NA","NA NA","NA NA NA NA NA NA NA NA","https://twitter.com/AlexBazzaro/status/1484100890344800261","Alex Bazzaro","Venezia ","🇮🇹Deputato Lega, Commissione XIV  🦁Consigliere Comunale Venezia. ✈️ Delegazione @OSCE Liberale e libertario","https://t.co/yXFTMiY4b3",FALSE,3315,543,40,13682,7504,2012-07-15 15:20:42,TRUE,"https://t.co/yXFTMiY4b3","https://www.camera.it/leg18/29?shadow_deputato=307696&idpersona=307696&idlegislatura=18",,"https://pbs.twimg.com/profile_banners/636328779/1457208495","http://abs.twimg.com/images/themes/theme1/bg.png","http://pbs.twimg.com/profile_images/1315654416171753472/1PG-DcXJ_normal.jpg"
"x636328779","x1484099572821544961",2022-01-20 09:44:46,"AlexBazzaro","4 giorni all’alba. #Quirinale22","Twitter for iPhone",31,,,,FALSE,FALSE,18,0,,,"Quirinale22",,,,,,,,,,,,,,,"it",,,,,,,,,,,,,,,,,,,,,,,,,,,,,,,,,,,,,"NA NA","NA NA","NA NA NA NA NA NA NA NA","https://twitter.com/AlexBazzaro/status/1484099572821544961","Alex Bazzaro","Venezia ","🇮🇹Deputato Lega, Commissione XIV  🦁Consigliere Comunale Venezia. ✈️ Delegazione @OSCE Liberale e libertario","https://t.co/yXFTMiY4b3",FALSE,3315,543,40,13682,7504,2012-07-15 15:20:42,TRUE,"https://t.co/yXFTMiY4b3","https://www.camera.it/leg18/29?shadow_deputato=307696&idpersona=307696&idlegislatura=18",,"https://pbs.twimg.com/profile_banners/636328779/1457208495","http://abs.twimg.com/images/themes/theme1/bg.png","http://pbs.twimg.com/profile_images/1315654416171753472/1PG-DcXJ_normal.jpg"
"x636328779","x1483963209929404419",2022-01-20 00:42:54,"AlexBazzaro","@La7tv “Un po’ delusi” = abbiamo mentito dicendo che evitava il contagio e non era così.","Twitter for iPhone",81,"x1483904518454718467","x121424128","La7tv",FALSE,FALSE,133,14,,,,,,,,,,,,,,,,"x121424128","La7tv","it",,,,,,,,,,,,,,,,,,,,,,,,,,,,,,,,,,,,,"NA NA","NA NA","NA NA NA NA NA NA NA NA","https://twitter.com/AlexBazzaro/status/1483963209929404419","Alex Bazzaro","Venezia ","🇮🇹Deputato Lega, Commissione XIV  🦁Consigliere Comunale Venezia. ✈️ Delegazione @OSCE Liberale e libertario","https://t.co/yXFTMiY4b3",FALSE,3315,543,40,13682,7504,2012-07-15 15:20:42,TRUE,"https://t.co/yXFTMiY4b3","https://www.camera.it/leg18/29?shadow_deputato=307696&idpersona=307696&idlegislatura=18",,"https://pbs.twimg.com/profile_banners/636328779/1457208495","http://abs.twimg.com/images/themes/theme1/bg.png","http://pbs.twimg.com/profile_images/1315654416171753472/1PG-DcXJ_normal.jpg"
"x636328779","x1483925286257266699",2022-01-19 22:12:12,"AlexBazzaro","@Leroimichel3 Le parti cambiano. E pochi sono coloro abbastanza in alto da essere esenti dal preoccuparsene.","Twitter for iPhone",94,"x1483924392266588163","x1313487516104830976","Leroimichel3",FALSE,FALSE,2,0,,,,,,,,,,,,,,,,"x1313487516104830976","Leroimichel3","it",,,,,,,,,,,,,,,,,,,,,,,,,,,,,,,,,,,,,"NA NA","NA NA","NA NA NA NA NA NA NA NA","https://twitter.com/AlexBazzaro/status/1483925286257266699","Alex Bazzaro","Venezia ","🇮🇹Deputato Lega, Commissione XIV  🦁Consigliere Comunale Venezia. ✈️ Delegazione @OSCE Liberale e libertario","https://t.co/yXFTMiY4b3",FALSE,3315,543,40,13682,7504,2012-07-15 15:20:42,TRUE,"https://t.co/yXFTMiY4b3","https://www.camera.it/leg18/29?shadow_deputato=307696&idpersona=307696&idlegislatura=18",,"https://pbs.twimg.com/profile_banners/636328779/1457208495","http://abs.twimg.com/images/themes/theme1/bg.png","http://pbs.twimg.com/profile_images/1315654416171753472/1PG-DcXJ_normal.jpg"
"x636328779","x1483923250866438144",2022-01-19 22:04:07,"AlexBazzaro","Se nell’ospedale che dirigo, a dei cittadini avessero rinviato le operazioni di cui avevano bisogno a fronte di una libera scelta, eviterei di ridermela in tv.","Twitter for iPhone",159,,,,FALSE,FALSE,84,16,,,,,,,,,,,,,,,,,,"it",,,,,,,,,,,,,,,,,,,,,,,,,,,,,,,,,,,,,"NA NA","NA NA","NA NA NA NA NA NA NA NA","https://twitter.com/AlexBazzaro/status/1483923250866438144","Alex Bazzaro","Venezia ","🇮🇹Deputato Lega, Commissione XIV  🦁Consigliere Comunale Venezia. ✈️ Delegazione @OSCE Liberale e libertario","https://t.co/yXFTMiY4b3",FALSE,3315,543,40,13682,7504,2012-07-15 15:20:42,TRUE,"https://t.co/yXFTMiY4b3","https://www.camera.it/leg18/29?shadow_deputato=307696&idpersona=307696&idlegislatura=18",,"https://pbs.twimg.com/profile_banners/636328779/1457208495","http://abs.twimg.com/images/themes/theme1/bg.png","http://pbs.twimg.com/profile_images/1315654416171753472/1PG-DcXJ_normal.jpg"
"x636328779","x1483882993324331015",2022-01-19 19:24:09,"AlexBazzaro","Johnson annuncia il termine dell'obbligo dei pass e di mascherine. Si riapriranno le visite alle case di cura e si tornerà a lavorare senza smartworking. Resta 
 l'autoisolamento, fino al 24 marzo, dopo di che nessun obbligo per i positivi covid, ma solo consigli di comportamento https://t.co/G5q92c6fgV","Twitter for iPhone",280,,,,FALSE,FALSE,38,9,,,,,,,,"http://pbs.twimg.com/ext_tw_video_thumb/1483882860423569415/pu/img/lNJPQOsb6v3qGiTU.jpg","https://t.co/G5q92c6fgV","https://twitter.com/AlexBazzaro/status/1483882993324331015/video/1","photo","http://pbs.twimg.com/ext_tw_video_thumb/1483882860423569415/pu/img/lNJPQOsb6v3qGiTU.jpg","https://t.co/G5q92c6fgV","https://twitter.com/AlexBazzaro/status/1483882993324331015/video/1",,,,"it",,,,,,,,,,,,,,,,,,,,,,,,,,,,,,,,,,,,,"NA NA","NA NA","NA NA NA NA NA NA NA NA","https://twitter.com/AlexBazzaro/status/1483882993324331015","Alex Bazzaro","Venezia ","🇮🇹Deputato Lega, Commissione XIV  🦁Consigliere Comunale Venezia. ✈️ Delegazione @OSCE Liberale e libertario","https://t.co/yXFTMiY4b3",FALSE,3315,543,40,13682,7504,2012-07-15 15:20:42,TRUE,"https://t.co/yXFTMiY4b3","https://www.camera.it/leg18/29?shadow_deputato=307696&idpersona=307696&idlegislatura=18",,"https://pbs.twimg.com/profile_banners/636328779/1457208495","http://abs.twimg.com/images/themes/theme1/bg.png","http://pbs.twimg.com/profile_images/1315654416171753472/1PG-DcXJ_normal.jpg"
"x636328779","x1483880584942391308",2022-01-19 19:14:35,"AlexBazzaro","@GuidoDeMartini Forza Guido!","Twitter for iPhone",12,"x1483874837911285768","x422152255","GuidoDeMartini",FALSE,FALSE,17,0,,,,,,,,,,,,,,,,"x422152255","GuidoDeMartini","es",,,,,,,,,,,,,,,,,,,,,,,,,,,,,,,,,,,,,"NA NA","NA NA","NA NA NA NA NA NA NA NA","https://twitter.com/AlexBazzaro/status/1483880584942391308","Alex Bazzaro","Venezia ","🇮🇹Deputato Lega, Commissione XIV  🦁Consigliere Comunale Venezia. ✈️ Delegazione @OSCE Liberale e libertario","https://t.co/yXFTMiY4b3",FALSE,3315,543,40,13682,7504,2012-07-15 15:20:42,TRUE,"https://t.co/yXFTMiY4b3","https://www.camera.it/leg18/29?shadow_deputato=307696&idpersona=307696&idlegislatura=18",,"https://pbs.twimg.com/profile_banners/636328779/1457208495","http://abs.twimg.com/images/themes/theme1/bg.png","http://pbs.twimg.com/profile_images/1315654416171753472/1PG-DcXJ_normal.jpg"
"x636328779","x1483880190560423938",2022-01-19 19:13:01,"AlexBazzaro","Ne usciremo migliori. https://t.co/PCS8oj7CIR","Twitter for iPhone",21,,,,FALSE,FALSE,33,4,,,,,,,,"http://pbs.twimg.com/media/FJfNKudXwAA24gO.jpg","https://t.co/PCS8oj7CIR","https://twitter.com/AlexBazzaro/status/1483880190560423938/photo/1","photo","http://pbs.twimg.com/media/FJfNKudXwAA24gO.jpg","https://t.co/PCS8oj7CIR","https://twitter.com/AlexBazzaro/status/1483880190560423938/photo/1",,,,"it",,,,,,,,,,,,,,,,,,,,,,,,,,,,,,,,,,,,,"NA NA","NA NA","NA NA NA NA NA NA NA NA","https://twitter.com/AlexBazzaro/status/1483880190560423938","Alex Bazzaro","Venezia ","🇮🇹Deputato Lega, Commissione XIV  🦁Consigliere Comunale Venezia. ✈️ Delegazione @OSCE Liberale e libertario","https://t.co/yXFTMiY4b3",FALSE,3315,543,40,13682,7504,2012-07-15 15:20:42,TRUE,"https://t.co/yXFTMiY4b3","https://www.camera.it/leg18/29?shadow_deputato=307696&idpersona=307696&idlegislatura=18",,"https://pbs.twimg.com/profile_banners/636328779/1457208495","http://abs.twimg.com/images/themes/theme1/bg.png","http://pbs.twimg.com/profile_images/1315654416171753472/1PG-DcXJ_normal.jpg"
"x636328779","x1483879371165347840",2022-01-19 19:09:45,"AlexBazzaro","Alla Camera e al Senato per votare è necessario il green pass base. Non tenere conto della Sardegna e della sua doverosa continuità territoriale per raggiungere Roma, crea un precedente grave e priva gli elettori dei loro rappresentanti. Solidarietà ai Deputati e Senatori sardi.","Twitter for iPhone",279,,,,FALSE,FALSE,387,91,,,,,,,,,,,,,,,,,,"it",,,,,,,,,,,,,,,,,,,,,,,,,,,,,,,,,,,,,"NA NA","NA NA","NA NA NA NA NA NA NA NA","https://twitter.com/AlexBazzaro/status/1483879371165347840","Alex Bazzaro","Venezia ","🇮🇹Deputato Lega, Commissione XIV  🦁Consigliere Comunale Venezia. ✈️ Delegazione @OSCE Liberale e libertario","https://t.co/yXFTMiY4b3",FALSE,3315,543,40,13682,7504,2012-07-15 15:20:42,TRUE,"https://t.co/yXFTMiY4b3","https://www.camera.it/leg18/29?shadow_deputato=307696&idpersona=307696&idlegislatura=18",,"https://pbs.twimg.com/profile_banners/636328779/1457208495","http://abs.twimg.com/images/themes/theme1/bg.png","http://pbs.twimg.com/profile_images/1315654416171753472/1PG-DcXJ_normal.jpg"
"x636328779","x1483878308387430404",2022-01-19 19:05:32,"AlexBazzaro","Oggi #PaoloBorsellino avrebbe compiuto 82 anni. 
«Il nodo è pertanto essenzialmente politico: la via obbligata per la rimozione delle cause che costituiscono la forza di cosa nostra passa attraverso la restituzione della fiducia nella Pubblica Amministrazione» P.B.
 #PaoloVive https://t.co/BNYO42UdAc","Twitter for iPhone",140,,,,FALSE,TRUE,0,4,,,"PaoloBorsellino",,,,,,,,,,,,,"x514949332","AlbertoSamona","it",,,,,,,,,,,,,,,,"x1483877534718701570","Oggi #PaoloBorsellino avrebbe compiuto 82 anni. 
«Il nodo è pertanto essenzialmente politico: la via obbligata per la rimozione delle cause che costituiscono la forza di cosa nostra passa attraverso la restituzione della fiducia nella Pubblica Amministrazione» P.B.
 #PaoloVive https://t.co/BNYO42UdAc",2022-01-19 19:02:28,"Twitter for Android",14,4,"x514949332","AlbertoSamona","Alberto Samonà",1348,316,1241,"","Giornalista. Scrittore. Militante della Lega. Assessore regionale dei Beni Culturali e dell'Identità Siciliana. Cattolico di Rito Greco-Bizantino e uomo libero",FALSE,,,,,,,"NA NA","NA NA","NA NA NA NA NA NA NA NA","https://twitter.com/AlexBazzaro/status/1483878308387430404","Alex Bazzaro","Venezia ","🇮🇹Deputato Lega, Commissione XIV  🦁Consigliere Comunale Venezia. ✈️ Delegazione @OSCE Liberale e libertario","https://t.co/yXFTMiY4b3",FALSE,3315,543,40,13682,7504,2012-07-15 15:20:42,TRUE,"https://t.co/yXFTMiY4b3","https://www.camera.it/leg18/29?shadow_deputato=307696&idpersona=307696&idlegislatura=18",,"https://pbs.twimg.com/profile_banners/636328779/1457208495","http://abs.twimg.com/images/themes/theme1/bg.png","http://pbs.twimg.com/profile_images/1315654416171753472/1PG-DcXJ_normal.jpg"
"x636328779","x1483876088648450054",2022-01-19 18:56:43,"AlexBazzaro","IL MIO VOTO NEGATO. Senza Green Pass rafforzato non si può neppure votare per il Quirinale. Succede anche questo con le nuove regole anti Covid. Ma non vale per tutti i parlamentari senza vaccino. La restrizione è solo per chi vive sulle isole. #NoPass👇🏻👇🏻 https://t.co/feaePFkQmm","Twitter for iPhone",140,,,,FALSE,TRUE,0,140,,,,,,,,,,,,,,,,"x422152255","GuidoDeMartini","it",,,,,,,,,,,,,,,,"x1483874837911285768","IL MIO VOTO NEGATO. Senza Green Pass rafforzato non si può neppure votare per il Quirinale. Succede anche questo con le nuove regole anti Covid. Ma non vale per tutti i parlamentari senza vaccino. La restrizione è solo per chi vive sulle isole. #NoPass👇🏻👇🏻 https://t.co/feaePFkQmm",2022-01-19 18:51:45,"Twitter for iPhone",405,140,"x422152255","GuidoDeMartini","Guido De Martini",7548,164,6377,"","Deputato Lega Salvini Premier eletto in Sardegna 🇮🇹 NO UNIONE EUROPEA-NO EURO 🇮🇹                                        Medico chirurgo specialista oculista",TRUE,,,,,,,"NA NA","NA NA","NA NA NA NA NA NA NA NA","https://twitter.com/AlexBazzaro/status/1483876088648450054","Alex Bazzaro","Venezia ","🇮🇹Deputato Lega, Commissione XIV  🦁Consigliere Comunale Venezia. ✈️ Delegazione @OSCE Liberale e libertario","https://t.co/yXFTMiY4b3",FALSE,3315,543,40,13682,7504,2012-07-15 15:20:42,TRUE,"https://t.co/yXFTMiY4b3","https://www.camera.it/leg18/29?shadow_deputato=307696&idpersona=307696&idlegislatura=18",,"https://pbs.twimg.com/profile_banners/636328779/1457208495","http://abs.twimg.com/images/themes/theme1/bg.png","http://pbs.twimg.com/profile_images/1315654416171753472/1PG-DcXJ_normal.jpg"
