"x1557514573","x1547284956556181504",2022-07-13 18:20:55,"elio_vito","@waltergalleni5 @GiuseppeConteIT No, con Dibba 🙄","Twitter for iPhone",15,"x1547176067529674753","x1521990197096841216","waltergalleni5",FALSE,FALSE,20,0,,,,,,,,,,,,,,,,"x1521990197096841216 x999578121123848192","waltergalleni5 GiuseppeConteIT","it",,,,,,,,,,,,,,,,,,,,,,,,,,,,,,,,,,,,,"NA NA","NA NA","NA NA NA NA NA NA NA NA","https://twitter.com/elio_vito/status/1547284956556181504","Elio Vito 🇮🇹🇪🇺🇺🇸🏳️‍🌈🍁🌍","Roma","Juventino⚪️⚫️Napoletano","https://t.co/TxIGBtgFXw",FALSE,30363,13,127,29145,72295,2013-06-30 07:47:38,TRUE,"https://t.co/TxIGBtgFXw","http://documenti.camera.it/leg18/pdl/pdf/leg.18.pdl.camera.3470.18PDL0175510.pdf",,"https://pbs.twimg.com/profile_banners/1557514573/1640814244","http://abs.twimg.com/images/themes/theme1/bg.png","http://pbs.twimg.com/profile_images/1543840964619427840/lQxOtYCg_normal.jpg"
"x1557514573","x1547280490750779399",2022-07-13 18:03:10,"elio_vito","@La_manina__ Chi maligna è maligno...","Twitter for iPhone",24,"x1547251290220253186","x1053949922003828737","La_manina__",FALSE,FALSE,48,1,,,,,,,,,,,,,,,,"x1053949922003828737","La_manina__","it",,,,,,,,,,,,,,,,,,,,,,,,,,,,,,,,,,,,,"NA NA","NA NA","NA NA NA NA NA NA NA NA","https://twitter.com/elio_vito/status/1547280490750779399","Elio Vito 🇮🇹🇪🇺🇺🇸🏳️‍🌈🍁🌍","Roma","Juventino⚪️⚫️Napoletano","https://t.co/TxIGBtgFXw",FALSE,30363,13,127,29145,72295,2013-06-30 07:47:38,TRUE,"https://t.co/TxIGBtgFXw","http://documenti.camera.it/leg18/pdl/pdf/leg.18.pdl.camera.3470.18PDL0175510.pdf",,"https://pbs.twimg.com/profile_banners/1557514573/1640814244","http://abs.twimg.com/images/themes/theme1/bg.png","http://pbs.twimg.com/profile_images/1543840964619427840/lQxOtYCg_normal.jpg"
"x1557514573","x1547280146113220608",2022-07-13 18:01:48,"elio_vito","@M49liberorso Si cambia partito mai squadra ⚪️⚫️","Twitter for iPhone",34,"x1547269940050272268","x1288086111806521349","M49liberorso",FALSE,FALSE,201,2,,,,,,,,,,,,,,,,"x1288086111806521349","M49liberorso","it",,,,,,,,,,,,,,,,,,,,,,,,,,,,,,,,,,,,,"NA NA","NA NA","NA NA NA NA NA NA NA NA","https://twitter.com/elio_vito/status/1547280146113220608","Elio Vito 🇮🇹🇪🇺🇺🇸🏳️‍🌈🍁🌍","Roma","Juventino⚪️⚫️Napoletano","https://t.co/TxIGBtgFXw",FALSE,30363,13,127,29145,72295,2013-06-30 07:47:38,TRUE,"https://t.co/TxIGBtgFXw","http://documenti.camera.it/leg18/pdl/pdf/leg.18.pdl.camera.3470.18PDL0175510.pdf",,"https://pbs.twimg.com/profile_banners/1557514573/1640814244","http://abs.twimg.com/images/themes/theme1/bg.png","http://pbs.twimg.com/profile_images/1543840964619427840/lQxOtYCg_normal.jpg"
"x1557514573","x1547270283157020673",2022-07-13 17:22:37,"elio_vito","Elio Vito via dal Parlamento: «Forza Italia è illiberale. Carfagna e Bernini? Per i diritti solo sui social. FI ha scelto di stare con i fascisti» - l'intervista a @elio_vito  di @SimoneAlliva  https://t.co/cXOKNJNtNW","Twitter for iPhone",140,,,,FALSE,TRUE,0,41,,,,,,,,,,,,,,,,"x85852409","espressonline","it",,,,,,,,,,,,,,,,"x1547252571747848198","Elio Vito via dal Parlamento: «Forza Italia è illiberale. Carfagna e Bernini? Per i diritti solo sui social. FI ha scelto di stare con i fascisti» - l'intervista a @elio_vito  di @SimoneAlliva  https://t.co/cXOKNJNtNW",2022-07-13 16:12:14,"Twitter Web App",170,41,"x85852409","espressonline","L'Espresso",585836,70,39246,"Italy","L'account del settimanale L'Espresso 📱 Abbonati all'edizione digitale https://t.co/v5PqHdxMWp",TRUE,,,,,,,"NA NA","NA NA","NA NA NA NA NA NA NA NA","https://twitter.com/elio_vito/status/1547270283157020673","Elio Vito 🇮🇹🇪🇺🇺🇸🏳️‍🌈🍁🌍","Roma","Juventino⚪️⚫️Napoletano","https://t.co/TxIGBtgFXw",FALSE,30363,13,127,29145,72295,2013-06-30 07:47:38,TRUE,"https://t.co/TxIGBtgFXw","http://documenti.camera.it/leg18/pdl/pdf/leg.18.pdl.camera.3470.18PDL0175510.pdf",,"https://pbs.twimg.com/profile_banners/1557514573/1640814244","http://abs.twimg.com/images/themes/theme1/bg.png","http://pbs.twimg.com/profile_images/1543840964619427840/lQxOtYCg_normal.jpg"
"x1557514573","x1547268614096658434",2022-07-13 17:15:59,"elio_vito","Elio Vito e le dimissioni accolte subito: “Me lo aspettavo, in questa destra non ho più spazio. Candidarmi a sinistra? Perché no, vediamo” https://t.co/WeJ8vy3YxG","Twitter for iPhone",140,,,,FALSE,TRUE,0,16,,,,,,,,,,,,,,,,"x52424550","fattoquotidiano","it",,,,,,,,,,,,,,,,"x1547265892878323714","Elio Vito e le dimissioni accolte subito: “Me lo aspettavo, in questa destra non ho più spazio. Candidarmi a sinistra? Perché no, vediamo” https://t.co/WeJ8vy3YxG",2022-07-13 17:05:10,"Il Fatto Quotidiano Post",137,16,"x52424550","fattoquotidiano","Il Fatto Quotidiano",2165058,6523,224453,"Roma e Milano","Scarica l’app e abbonati al #FattoQuotidiano 
ad un prezzo speciale su ➡️ https://t.co/Wfi20j14IP",TRUE,,,,,,,"NA NA","NA NA","NA NA NA NA NA NA NA NA","https://twitter.com/elio_vito/status/1547268614096658434","Elio Vito 🇮🇹🇪🇺🇺🇸🏳️‍🌈🍁🌍","Roma","Juventino⚪️⚫️Napoletano","https://t.co/TxIGBtgFXw",FALSE,30363,13,127,29145,72295,2013-06-30 07:47:38,TRUE,"https://t.co/TxIGBtgFXw","http://documenti.camera.it/leg18/pdl/pdf/leg.18.pdl.camera.3470.18PDL0175510.pdf",,"https://pbs.twimg.com/profile_banners/1557514573/1640814244","http://abs.twimg.com/images/themes/theme1/bg.png","http://pbs.twimg.com/profile_images/1543840964619427840/lQxOtYCg_normal.jpg"
"x1557514573","x1547268341500354563",2022-07-13 17:14:54,"elio_vito","@di_reddito La coerenza non è mai sbagliata","Twitter for iPhone",31,"x1547266317413228551","x515542672","di_reddito",FALSE,FALSE,168,3,,,,,,,,,,,,,,,,"x515542672","di_reddito","it",,,,,,,,,,,,,,,,,,,,,,,,,,,,,,,,,,,,,"NA NA","NA NA","NA NA NA NA NA NA NA NA","https://twitter.com/elio_vito/status/1547268341500354563","Elio Vito 🇮🇹🇪🇺🇺🇸🏳️‍🌈🍁🌍","Roma","Juventino⚪️⚫️Napoletano","https://t.co/TxIGBtgFXw",FALSE,30363,13,127,29145,72295,2013-06-30 07:47:38,TRUE,"https://t.co/TxIGBtgFXw","http://documenti.camera.it/leg18/pdl/pdf/leg.18.pdl.camera.3470.18PDL0175510.pdf",,"https://pbs.twimg.com/profile_banners/1557514573/1640814244","http://abs.twimg.com/images/themes/theme1/bg.png","http://pbs.twimg.com/profile_images/1543840964619427840/lQxOtYCg_normal.jpg"
"x1557514573","x1547220537335848965",2022-07-13 14:04:56,"elio_vito","@carlosibilia Grazie Carlo, viva il 🐺","Twitter for iPad",23,"x1547213898448867329","x127025568","carlosibilia",FALSE,FALSE,194,5,,,,,,,,,,,,,,,,"x127025568","carlosibilia","it",,,,,,,,,,,,,,,,,,,,,,,,,,,,,,,,,,,,,"NA NA","NA NA","NA NA NA NA NA NA NA NA","https://twitter.com/elio_vito/status/1547220537335848965","Elio Vito 🇮🇹🇪🇺🇺🇸🏳️‍🌈🍁🌍","Roma","Juventino⚪️⚫️Napoletano","https://t.co/TxIGBtgFXw",FALSE,30363,13,127,29145,72295,2013-06-30 07:47:38,TRUE,"https://t.co/TxIGBtgFXw","http://documenti.camera.it/leg18/pdl/pdf/leg.18.pdl.camera.3470.18PDL0175510.pdf",,"https://pbs.twimg.com/profile_banners/1557514573/1640814244","http://abs.twimg.com/images/themes/theme1/bg.png","http://pbs.twimg.com/profile_images/1543840964619427840/lQxOtYCg_normal.jpg"
"x1557514573","x1547198125978402816",2022-07-13 12:35:53,"elio_vito","Visto come si fa?
@matteorenzi @CarloCalenda @luigidimaio","Twitter for iPhone",57,,,,FALSE,FALSE,2586,319,,,,,,,,,,,,,,,,"x18762875 x2416067982 x48062712","matteorenzi CarloCalenda luigidimaio","it",,,,,,,,,,,,,,,,,,,,,,,,,,,,,,,,,,,,,"NA NA","NA NA","NA NA NA NA NA NA NA NA","https://twitter.com/elio_vito/status/1547198125978402816","Elio Vito 🇮🇹🇪🇺🇺🇸🏳️‍🌈🍁🌍","Roma","Juventino⚪️⚫️Napoletano","https://t.co/TxIGBtgFXw",FALSE,30363,13,127,29145,72295,2013-06-30 07:47:38,TRUE,"https://t.co/TxIGBtgFXw","http://documenti.camera.it/leg18/pdl/pdf/leg.18.pdl.camera.3470.18PDL0175510.pdf",,"https://pbs.twimg.com/profile_banners/1557514573/1640814244","http://abs.twimg.com/images/themes/theme1/bg.png","http://pbs.twimg.com/profile_images/1543840964619427840/lQxOtYCg_normal.jpg"
"x1557514573","x1547191426101944322",2022-07-13 12:09:16,"elio_vito","@flaviafratello 🙄","Twitter for iPhone",1,"x1547173074851741697","x516548989","flaviafratello",FALSE,FALSE,239,1,,,,,,,,,,,,,,,,"x516548989","flaviafratello","und",,,,,,,,,,,,,,,,,,,,,,,,,,,,,,,,,,,,,"NA NA","NA NA","NA NA NA NA NA NA NA NA","https://twitter.com/elio_vito/status/1547191426101944322","Elio Vito 🇮🇹🇪🇺🇺🇸🏳️‍🌈🍁🌍","Roma","Juventino⚪️⚫️Napoletano","https://t.co/TxIGBtgFXw",FALSE,30363,13,127,29145,72295,2013-06-30 07:47:38,TRUE,"https://t.co/TxIGBtgFXw","http://documenti.camera.it/leg18/pdl/pdf/leg.18.pdl.camera.3470.18PDL0175510.pdf",,"https://pbs.twimg.com/profile_banners/1557514573/1640814244","http://abs.twimg.com/images/themes/theme1/bg.png","http://pbs.twimg.com/profile_images/1543840964619427840/lQxOtYCg_normal.jpg"
"x1557514573","x1547178225209688066",2022-07-13 11:16:48,"elio_vito","Starò con le persone discriminate per l'orientamento sessuale e per l'identità di genere, con i consumatori che vengono arrestati se anziché andare dallo spacciatore coltivano cannabis, starò con chi non ha reddito, con chi non ha cittadinanza, chi non ha diritti.
Vi ringrazio","Twitter for iPad",277,"x1547177932254318597","x1557514573","elio_vito",FALSE,FALSE,1238,98,,,,,,,,,,,,,,,,,,"it",,,,,,,,,,,,,,,,,,,,,,,,,,,,,,,,,,,,,"NA NA","NA NA","NA NA NA NA NA NA NA NA","https://twitter.com/elio_vito/status/1547178225209688066","Elio Vito 🇮🇹🇪🇺🇺🇸🏳️‍🌈🍁🌍","Roma","Juventino⚪️⚫️Napoletano","https://t.co/TxIGBtgFXw",FALSE,30363,13,127,29145,72295,2013-06-30 07:47:38,TRUE,"https://t.co/TxIGBtgFXw","http://documenti.camera.it/leg18/pdl/pdf/leg.18.pdl.camera.3470.18PDL0175510.pdf",,"https://pbs.twimg.com/profile_banners/1557514573/1640814244","http://abs.twimg.com/images/themes/theme1/bg.png","http://pbs.twimg.com/profile_images/1543840964619427840/lQxOtYCg_normal.jpg"
"x1557514573","x1547177932254318597",2022-07-13 11:15:38,"elio_vito","Forza Italia ha deciso di stare con chi i diritti non vuole riconoscerli. Forza Italia ha deciso di stare con neofascisti e con integralisti.
Spiace, io starò dall'altra parte, con la libertà, la laicità e i diritti.","Twitter for iPad",216,"x1547177761239928833","x1557514573","elio_vito",FALSE,FALSE,763,70,,,,,,,,,,,,,,,,,,"it",,,,,,,,,,,,,,,,,,,,,,,,,,,,,,,,,,,,,"NA NA","NA NA","NA NA NA NA NA NA NA NA","https://twitter.com/elio_vito/status/1547177932254318597","Elio Vito 🇮🇹🇪🇺🇺🇸🏳️‍🌈🍁🌍","Roma","Juventino⚪️⚫️Napoletano","https://t.co/TxIGBtgFXw",FALSE,30363,13,127,29145,72295,2013-06-30 07:47:38,TRUE,"https://t.co/TxIGBtgFXw","http://documenti.camera.it/leg18/pdl/pdf/leg.18.pdl.camera.3470.18PDL0175510.pdf",,"https://pbs.twimg.com/profile_banners/1557514573/1640814244","http://abs.twimg.com/images/themes/theme1/bg.png","http://pbs.twimg.com/profile_images/1543840964619427840/lQxOtYCg_normal.jpg"
"x1557514573","x1547177761239928833",2022-07-13 11:14:58,"elio_vito","Sento dire che non dovremmo affrontare temi divisivi, cosa ci stiamo a fare allora? E perché poi i diritti sono divisivi? Perché c'è una differente visione della società, non tra destra e sinistra ma tra chi i diritti vuole difenderli e conquistarli e chi invece vuole calpestarli","Twitter for iPad",280,"x1547177604289118214","x1557514573","elio_vito",FALSE,FALSE,286,27,,,,,,,,,,,,,,,,,,"it",,,,,,,,,,,,,,,,,,,,,,,,,,,,,,,,,,,,,"NA NA","NA NA","NA NA NA NA NA NA NA NA","https://twitter.com/elio_vito/status/1547177761239928833","Elio Vito 🇮🇹🇪🇺🇺🇸🏳️‍🌈🍁🌍","Roma","Juventino⚪️⚫️Napoletano","https://t.co/TxIGBtgFXw",FALSE,30363,13,127,29145,72295,2013-06-30 07:47:38,TRUE,"https://t.co/TxIGBtgFXw","http://documenti.camera.it/leg18/pdl/pdf/leg.18.pdl.camera.3470.18PDL0175510.pdf",,"https://pbs.twimg.com/profile_banners/1557514573/1640814244","http://abs.twimg.com/images/themes/theme1/bg.png","http://pbs.twimg.com/profile_images/1543840964619427840/lQxOtYCg_normal.jpg"
"x1557514573","x1547177604289118214",2022-07-13 11:14:20,"elio_vito","Ma se i partiti cambiano, la politica resta.
E la politica deve recuperare popolarità, partecipazione, motivazione, fiducia. E per farlo deve essere contrasto, lotta, rispetto.
E il luogo del confronto, dello scontro democratico è il Parlamento.","Twitter for iPad",245,"x1547177413204971520","x1557514573","elio_vito",FALSE,FALSE,202,17,,,,,,,,,,,,,,,,,,"it",,,,,,,,,,,,,,,,,,,,,,,,,,,,,,,,,,,,,"NA NA","NA NA","NA NA NA NA NA NA NA NA","https://twitter.com/elio_vito/status/1547177604289118214","Elio Vito 🇮🇹🇪🇺🇺🇸🏳️‍🌈🍁🌍","Roma","Juventino⚪️⚫️Napoletano","https://t.co/TxIGBtgFXw",FALSE,30363,13,127,29145,72295,2013-06-30 07:47:38,TRUE,"https://t.co/TxIGBtgFXw","http://documenti.camera.it/leg18/pdl/pdf/leg.18.pdl.camera.3470.18PDL0175510.pdf",,"https://pbs.twimg.com/profile_banners/1557514573/1640814244","http://abs.twimg.com/images/themes/theme1/bg.png","http://pbs.twimg.com/profile_images/1543840964619427840/lQxOtYCg_normal.jpg"
"x1557514573","x1547177413204971520",2022-07-13 11:13:35,"elio_vito","Così come è ambiguo criticare la Cina ma poi farci affari ed ospitare la sua propaganda in giornali e televisioni di famiglia, come peraltro è ospitata, ahimè, quella russa.","Twitter for iPad",173,"x1547177270309257217","x1557514573","elio_vito",FALSE,FALSE,192,10,,,,,,,,,,,,,,,,,,"it",,,,,,,,,,,,,,,,,,,,,,,,,,,,,,,,,,,,,"NA NA","NA NA","NA NA NA NA NA NA NA NA","https://twitter.com/elio_vito/status/1547177413204971520","Elio Vito 🇮🇹🇪🇺🇺🇸🏳️‍🌈🍁🌍","Roma","Juventino⚪️⚫️Napoletano","https://t.co/TxIGBtgFXw",FALSE,30363,13,127,29145,72295,2013-06-30 07:47:38,TRUE,"https://t.co/TxIGBtgFXw","http://documenti.camera.it/leg18/pdl/pdf/leg.18.pdl.camera.3470.18PDL0175510.pdf",,"https://pbs.twimg.com/profile_banners/1557514573/1640814244","http://abs.twimg.com/images/themes/theme1/bg.png","http://pbs.twimg.com/profile_images/1543840964619427840/lQxOtYCg_normal.jpg"
"x1557514573","x1547177270309257217",2022-07-13 11:13:01,"elio_vito","Una cosa però voglio dirla. Non siamo in guerra ma c'è una guerra. E dinanzi a questa guerra, una guerra alle nostre democrazie ed ai nostri valori, dinanzi a chi l'ha provocata, dinanzi a Putin Forza Italia è timorosa, reticente, ambigua.","Twitter for iPad",239,"x1547176976951173122","x1557514573","elio_vito",FALSE,FALSE,190,16,,,,,,,,,,,,,,,,,,"it",,,,,,,,,,,,,,,,,,,,,,,,,,,,,,,,,,,,,"NA NA","NA NA","NA NA NA NA NA NA NA NA","https://twitter.com/elio_vito/status/1547177270309257217","Elio Vito 🇮🇹🇪🇺🇺🇸🏳️‍🌈🍁🌍","Roma","Juventino⚪️⚫️Napoletano","https://t.co/TxIGBtgFXw",FALSE,30363,13,127,29145,72295,2013-06-30 07:47:38,TRUE,"https://t.co/TxIGBtgFXw","http://documenti.camera.it/leg18/pdl/pdf/leg.18.pdl.camera.3470.18PDL0175510.pdf",,"https://pbs.twimg.com/profile_banners/1557514573/1640814244","http://abs.twimg.com/images/themes/theme1/bg.png","http://pbs.twimg.com/profile_images/1543840964619427840/lQxOtYCg_normal.jpg"
"x1557514573","x1547176976951173122",2022-07-13 11:11:51,"elio_vito","Ma non sputerò nel piatto dove ho mangiato, per la semplice ragione che io nel piatto non ho mangiato.","Twitter for iPad",102,"x1547176811930476544","x1557514573","elio_vito",FALSE,FALSE,211,16,,,,,,,,,,,,,,,,,,"it",,,,,,,,,,,,,,,,,,,,,,,,,,,,,,,,,,,,,"NA NA","NA NA","NA NA NA NA NA NA NA NA","https://twitter.com/elio_vito/status/1547176976951173122","Elio Vito 🇮🇹🇪🇺🇺🇸🏳️‍🌈🍁🌍","Roma","Juventino⚪️⚫️Napoletano","https://t.co/TxIGBtgFXw",FALSE,30363,13,127,29145,72295,2013-06-30 07:47:38,TRUE,"https://t.co/TxIGBtgFXw","http://documenti.camera.it/leg18/pdl/pdf/leg.18.pdl.camera.3470.18PDL0175510.pdf",,"https://pbs.twimg.com/profile_banners/1557514573/1640814244","http://abs.twimg.com/images/themes/theme1/bg.png","http://pbs.twimg.com/profile_images/1543840964619427840/lQxOtYCg_normal.jpg"
"x1557514573","x1547176811930476544",2022-07-13 11:11:11,"elio_vito","Io sono cambiato ma pure Forza Italia non è la stessa, ha perso la vocazione liberale, riformatrice, moderna.
Ora si definisce un partito cristiano, viene da ridere, ha un leader che non è libero e dirigenti intolleranti e dispotici interessati a perpetuare il loro piccolo potere","Twitter for iPad",280,"x1547176630103195648","x1557514573","elio_vito",FALSE,FALSE,219,13,,,,,,,,,,,,,,,,,,"it",,,,,,,,,,,,,,,,,,,,,,,,,,,,,,,,,,,,,"NA NA","NA NA","NA NA NA NA NA NA NA NA","https://twitter.com/elio_vito/status/1547176811930476544","Elio Vito 🇮🇹🇪🇺🇺🇸🏳️‍🌈🍁🌍","Roma","Juventino⚪️⚫️Napoletano","https://t.co/TxIGBtgFXw",FALSE,30363,13,127,29145,72295,2013-06-30 07:47:38,TRUE,"https://t.co/TxIGBtgFXw","http://documenti.camera.it/leg18/pdl/pdf/leg.18.pdl.camera.3470.18PDL0175510.pdf",,"https://pbs.twimg.com/profile_banners/1557514573/1640814244","http://abs.twimg.com/images/themes/theme1/bg.png","http://pbs.twimg.com/profile_images/1543840964619427840/lQxOtYCg_normal.jpg"
"x1557514573","x1547176630103195648",2022-07-13 11:10:28,"elio_vito","Ma non voglio dare lezioni a nessuno, non sono un professore, sono uno studente, che ha la stessa voglia di imparare che avevo quando sono entrato in Parlamento.","Twitter for iPad",161,"x1547176478919516162","x1557514573","elio_vito",FALSE,FALSE,178,15,,,,,,,,,,,,,,,,,,"it",,,,,,,,,,,,,,,,,,,,,,,,,,,,,,,,,,,,,"NA NA","NA NA","NA NA NA NA NA NA NA NA","https://twitter.com/elio_vito/status/1547176630103195648","Elio Vito 🇮🇹🇪🇺🇺🇸🏳️‍🌈🍁🌍","Roma","Juventino⚪️⚫️Napoletano","https://t.co/TxIGBtgFXw",FALSE,30363,13,127,29145,72295,2013-06-30 07:47:38,TRUE,"https://t.co/TxIGBtgFXw","http://documenti.camera.it/leg18/pdl/pdf/leg.18.pdl.camera.3470.18PDL0175510.pdf",,"https://pbs.twimg.com/profile_banners/1557514573/1640814244","http://abs.twimg.com/images/themes/theme1/bg.png","http://pbs.twimg.com/profile_images/1543840964619427840/lQxOtYCg_normal.jpg"
"x1557514573","x1547176478919516162",2022-07-13 11:09:52,"elio_vito","Ecco vorrei dire a qualche collega che non occorre una legge, c'è la Costituzione, il parlamentare rappresenta la Nazione e non può quindi prendere a nessun titolo, in nessuna forma soldi da un altro Stato, non può fare conferenze a pagamento, non può farsi anticipare i biglietti","Twitter for iPad",280,"x1547176287470510082","x1557514573","elio_vito",FALSE,FALSE,277,46,,,,,,,,,,,,,,,,,,"it",,,,,,,,,,,,,,,,,,,,,,,,,,,,,,,,,,,,,"NA NA","NA NA","NA NA NA NA NA NA NA NA","https://twitter.com/elio_vito/status/1547176478919516162","Elio Vito 🇮🇹🇪🇺🇺🇸🏳️‍🌈🍁🌍","Roma","Juventino⚪️⚫️Napoletano","https://t.co/TxIGBtgFXw",FALSE,30363,13,127,29145,72295,2013-06-30 07:47:38,TRUE,"https://t.co/TxIGBtgFXw","http://documenti.camera.it/leg18/pdl/pdf/leg.18.pdl.camera.3470.18PDL0175510.pdf",,"https://pbs.twimg.com/profile_banners/1557514573/1640814244","http://abs.twimg.com/images/themes/theme1/bg.png","http://pbs.twimg.com/profile_images/1543840964619427840/lQxOtYCg_normal.jpg"
"x1557514573","x1547176287470510082",2022-07-13 11:09:06,"elio_vito","E non c'entra l'art. 67 della Costituzione, che parla di esercitare il mandato in libertà, ed io così ho fatto in questi anni, non delle ragioni per lasciare il mandato.
Nell'art. 67 c'è però una cosa ancora più importante, che rappresentiamo la Nazione.","Twitter for iPad",254,"x1547176073288376320","x1557514573","elio_vito",FALSE,FALSE,163,16,,,,,,,,,,,,,,,,,,"it",,,,,,,,,,,,,,,,,,,,,,,,,,,,,,,,,,,,,"NA NA","NA NA","NA NA NA NA NA NA NA NA","https://twitter.com/elio_vito/status/1547176287470510082","Elio Vito 🇮🇹🇪🇺🇺🇸🏳️‍🌈🍁🌍","Roma","Juventino⚪️⚫️Napoletano","https://t.co/TxIGBtgFXw",FALSE,30363,13,127,29145,72295,2013-06-30 07:47:38,TRUE,"https://t.co/TxIGBtgFXw","http://documenti.camera.it/leg18/pdl/pdf/leg.18.pdl.camera.3470.18PDL0175510.pdf",,"https://pbs.twimg.com/profile_banners/1557514573/1640814244","http://abs.twimg.com/images/themes/theme1/bg.png","http://pbs.twimg.com/profile_images/1543840964619427840/lQxOtYCg_normal.jpg"
"x1557514573","x1547176073288376320",2022-07-13 11:08:15,"elio_vito","Signor Presidente,
Colleghe, Colleghi,
Vi chiedo di accogliere le mie dimissioni.
Credo che quando, come me, si rompe con un partito nel quale si è militato a lungo, ricoprendo incarichi di rilievo, dare le dimissioni sia un gesto indispensabile. https://t.co/tiMVmHqBVv","Twitter for iPad",246,,,,FALSE,FALSE,1234,109,,,,,,,,"http://pbs.twimg.com/media/FXisUVcWYAAf7Rb.jpg","https://t.co/tiMVmHqBVv","https://twitter.com/elio_vito/status/1547176073288376320/photo/1","photo","http://pbs.twimg.com/media/FXisUVcWYAAf7Rb.jpg http://pbs.twimg.com/media/FXisUVgWAAEUBPc.jpg","https://t.co/tiMVmHqBVv https://t.co/tiMVmHqBVv","https://twitter.com/elio_vito/status/1547176073288376320/photo/1 https://twitter.com/elio_vito/status/1547176073288376320/photo/1",,,,"it",,,,,,,,,,,,,,,,,,,,,,,,,,,,,,,,,,,,,"NA NA","NA NA","NA NA NA NA NA NA NA NA","https://twitter.com/elio_vito/status/1547176073288376320","Elio Vito 🇮🇹🇪🇺🇺🇸🏳️‍🌈🍁🌍","Roma","Juventino⚪️⚫️Napoletano","https://t.co/TxIGBtgFXw",FALSE,30363,13,127,29145,72295,2013-06-30 07:47:38,TRUE,"https://t.co/TxIGBtgFXw","http://documenti.camera.it/leg18/pdl/pdf/leg.18.pdl.camera.3470.18PDL0175510.pdf",,"https://pbs.twimg.com/profile_banners/1557514573/1640814244","http://abs.twimg.com/images/themes/theme1/bg.png","http://pbs.twimg.com/profile_images/1543840964619427840/lQxOtYCg_normal.jpg"
"x596497608","x1547259695240552448",2022-07-13 16:40:32,"federicazanella","Anche Chiara Ferragni, di fronte all’escalation dei reati e degli episodi di criminalità a #Milano, denuncia una situazione fuori controllo.

Ormai in città se ne sono accorti tutti. Tranne la giunta e la maggioranza che la governano.

#sicurezza @LegaMilano https://t.co/WGd9OvjNuv","Twitter for iPhone",140,,,,FALSE,TRUE,0,7,,,"Milano",,,,,,,,,,,,,"x453830519","bologninistefan","it",,,,,,,,,,,,,,,,"x1547244378967740416","Anche Chiara Ferragni, di fronte all’escalation dei reati e degli episodi di criminalità a #Milano, denuncia una situazione fuori controllo.

Ormai in città se ne sono accorti tutti. Tranne la giunta e la maggioranza che la governano.

#sicurezza @LegaMilano https://t.co/WGd9OvjNuv",2022-07-13 15:39:41,"Twitter Web App",15,7,"x453830519","bologninistefan","Stefano Bolognini",1579,455,4404,"Milano, Lombardia","Assessore a Sviluppo Città Metropolitana, Giovani e Comunicazione || Commissario Provinciale Milano Lega Salvini Premier",FALSE,,,,,,,"NA NA","NA NA","NA NA NA NA NA NA NA NA","https://twitter.com/federicazanella/status/1547259695240552448","Federica Zanella","","#Deputato @LegaSalvini già pres.Corecom Lombardia. #Giornalista professionista. #Imprenditrice comunicazione, laureata lettere antiche. Innamorata dell’Italia","https://t.co/O3GykH8XU5",FALSE,1838,392,17,2054,1520,2012-06-01 12:25:38,FALSE,"https://t.co/O3GykH8XU5","https://bit.ly/3928YIl",,"https://pbs.twimg.com/profile_banners/596497608/1605797640","http://abs.twimg.com/images/themes/theme1/bg.png","http://pbs.twimg.com/profile_images/1401107283837435906/cF34iKWk_normal.jpg"
"x2902178505","x1547328857539231744",2022-07-13 21:15:22,"Michele_Anzaldi","Conte sfiducia Governo. Anzaldi: ""Nessuna rete Rai ne parla, basta canone"" https://t.co/292N19KRT7","Twitter for Android",98,,,,FALSE,FALSE,12,0,,,,,"vigilanzatv.it/conte-sfiducia…","https://t.co/292N19KRT7","https://www.vigilanzatv.it/conte-sfiducia-governo-anzaldi-nessuna-rete-rai-ne-parla-basta-canone/",,,,,,,,,,,"it",,,,,,,,,,,,,,,,,,,,,,,,,,,,,,,,,,,,,"NA NA","NA NA","NA NA NA NA NA NA NA NA","https://twitter.com/Michele_Anzaldi/status/1547328857539231744","Michele Anzaldi","","Deputato - Commissione parlamentare per l'indirizzo generale e la vigilanza dei servizi radiotelevisivi",,FALSE,12799,929,98,13189,1486,2014-12-02 11:46:02,FALSE,,,,,"http://abs.twimg.com/images/themes/theme1/bg.png","http://pbs.twimg.com/profile_images/540845636435066881/my7kHoUQ_normal.jpeg"
"x2902178505","x1547323255983378433",2022-07-13 20:53:06,"Michele_Anzaldi","Conte sfiducia il governo e fa cadere Draghi nel mezzo di una guerra e alla vigilia del razionamento dell'energia, ma nessuna rete Rai ne parla, non c'è nessuno speciale nè un approfondimento. C'è solo la tv commerciale con Controcorrente su Rete 4. Basta canone a questa Rai.","Twitter for Android",276,,,,FALSE,FALSE,178,36,,,,,,,,,,,,,,,,,,"it",,,,,,,,,,,,,,,,,,,,,,,,,,,,,,,,,,,,,"NA NA","NA NA","NA NA NA NA NA NA NA NA","https://twitter.com/Michele_Anzaldi/status/1547323255983378433","Michele Anzaldi","","Deputato - Commissione parlamentare per l'indirizzo generale e la vigilanza dei servizi radiotelevisivi",,FALSE,12799,929,98,13189,1486,2014-12-02 11:46:02,FALSE,,,,,"http://abs.twimg.com/images/themes/theme1/bg.png","http://pbs.twimg.com/profile_images/540845636435066881/my7kHoUQ_normal.jpeg"
