"x87467449","x1482087251718852612",2022-01-14 20:28:31,"grotondi","Berlusconi ci fa tornare giovani.

#ottoemezzo","Twitter for iPhone",67,,,,FALSE,TRUE,0,4,,,"ottoemezzo",,,,,,,,,,,,,"x4577632036","martinoloiacono","it",,,,,,,,,,,,,,,,"x1482082970827640838","Berlusconi ci fa tornare giovani.

#ottoemezzo",2022-01-14 20:11:30,"Twitter for iPhone",49,4,"x4577632036","martinoloiacono","Martino Loiacono",5858,2889,31987,"Milano, Lombardia","@ItaliaOggi, @atlanticomag e @Tempi_it. Politica, comunicazione, media e a volte marketing. Mai senza Milan e America. Qui opinioni personali.",FALSE,,,,,,,"NA NA","NA NA","NA NA NA NA NA NA NA NA","https://twitter.com/grotondi/status/1482087251718852612","Gianfranco Rotondi","Pescara, Abruzzo","sono poco su Twitter ma senza staff","https://t.co/whoci2nVr7",FALSE,32688,6094,289,51381,8608,2009-11-04 15:52:34,FALSE,"https://t.co/whoci2nVr7","http://www.fondazionedemocraziacristiana.it",,"https://pbs.twimg.com/profile_banners/87467449/1522754488","http://abs.twimg.com/images/themes/theme1/bg.png","http://pbs.twimg.com/profile_images/1420443859952283656/Np6eQk74_normal.jpg"
"x87467449","x1482086726751428610",2022-01-14 20:26:26,"grotondi","Pd e @M5S_Camera si oppongono alla elezione di @berlusconi col quale governano e grazie al quale vogliono completare la legislatura e salvare la pensione.","Twitter for iPhone",154,,,,FALSE,FALSE,221,49,,,,,,,,,,,,,,,,"x1354935949 x920277002858500096","M5S_Camera berlusconi","it",,,,,,,,,,,,,,,,,,,,,,,,,,,,,,,,,,,,,"NA NA","NA NA","NA NA NA NA NA NA NA NA","https://twitter.com/grotondi/status/1482086726751428610","Gianfranco Rotondi","Pescara, Abruzzo","sono poco su Twitter ma senza staff","https://t.co/whoci2nVr7",FALSE,32688,6094,289,51381,8608,2009-11-04 15:52:34,FALSE,"https://t.co/whoci2nVr7","http://www.fondazionedemocraziacristiana.it",,"https://pbs.twimg.com/profile_banners/87467449/1522754488","http://abs.twimg.com/images/themes/theme1/bg.png","http://pbs.twimg.com/profile_images/1420443859952283656/Np6eQk74_normal.jpg"
"x87467449","x1482086398513623040",2022-01-14 20:25:07,"grotondi","@tizianamaiolo @DonatoRobilotta Come dice @grotondi, La Sinistra quando non ha i numeri pretende uno che piace a loro","Twitter for iPhone",138,,,,FALSE,TRUE,0,2,,,,,,,,,,,,,,,,"x1481581717148291072 x454173647 x544218009 x87467449","Fabiobassplayer tizianamaiolo DonatoRobilotta grotondi","it",,,,,,,,,,,,,,,,"x1482082652324872192","@tizianamaiolo @DonatoRobilotta Come dice @grotondi, La Sinistra quando non ha i numeri pretende uno che piace a loro",2022-01-14 20:10:14,"Twitter for Android",3,2,"x1481581717148291072","Fabiobassplayer","Fabio",4,434,66,"","Rocker d'altri tempi 🤘",FALSE,,,,,,,"NA NA","NA NA","NA NA NA NA NA NA NA NA","https://twitter.com/grotondi/status/1482086398513623040","Gianfranco Rotondi","Pescara, Abruzzo","sono poco su Twitter ma senza staff","https://t.co/whoci2nVr7",FALSE,32688,6094,289,51381,8608,2009-11-04 15:52:34,FALSE,"https://t.co/whoci2nVr7","http://www.fondazionedemocraziacristiana.it",,"https://pbs.twimg.com/profile_banners/87467449/1522754488","http://abs.twimg.com/images/themes/theme1/bg.png","http://pbs.twimg.com/profile_images/1420443859952283656/Np6eQk74_normal.jpg"
"x87467449","x1482086355215826944",2022-01-14 20:24:57,"grotondi","@pf9395 @Marcell59184176 @grotondi @GiuseppeConteIT @SBuffagni @berlusconi Di quanto ci sputate sopra, ora i suoi 5Stelline Negroni (senza nessuna offesa per il salame) ci governano insieme pur di arrivare alla pensione da parlamentare alla faccia sua, mia e di quanti hanno creduto a stà buffonata di partitino cge non esiste più!!","Twitter for iPhone",140,,,,FALSE,TRUE,0,3,,,,,,,,,,,,,,,,"x404214104 x104571080 x1238023634737913856 x87467449 x999578121123848192 x408370356 x920277002858500096","PietroTrentini pf9395 Marcell59184176 grotondi GiuseppeConteIT SBuffagni berlusconi","it",,,,,,,,,,,,,,,,"x1482084877042339847","@pf9395 @Marcell59184176 @grotondi @GiuseppeConteIT @SBuffagni @berlusconi Di quanto ci sputate sopra, ora i suoi 5Stelline Negroni (senza nessuna offesa per il salame) ci governano insieme pur di arrivare alla pensione da parlamentare alla faccia sua, mia e di quanti hanno creduto a stà buffonata di partitino cge non esiste più!!",2022-01-14 20:19:05,"Twitter for iPhone",2,3,"x404214104","PietroTrentini","Pietro Trentini",210,396,4904,"","La miglior vendetta? La felicità. Non c'è nulla che faccia più impazzire la gente che vederti felice...",FALSE,,,,,,,"NA NA","NA NA","NA NA NA NA NA NA NA NA","https://twitter.com/grotondi/status/1482086355215826944","Gianfranco Rotondi","Pescara, Abruzzo","sono poco su Twitter ma senza staff","https://t.co/whoci2nVr7",FALSE,32688,6094,289,51381,8608,2009-11-04 15:52:34,FALSE,"https://t.co/whoci2nVr7","http://www.fondazionedemocraziacristiana.it",,"https://pbs.twimg.com/profile_banners/87467449/1522754488","http://abs.twimg.com/images/themes/theme1/bg.png","http://pbs.twimg.com/profile_images/1420443859952283656/Np6eQk74_normal.jpg"
"x201658727","x1482443410913079305",2022-01-15 20:03:46,"VittorioSgarbi","Raffaello non è stato un uomo complesso come Leonardo o un ""maledetto"" come Caravaggio. Raffaello ha dipinto soltanto. E ogni volta  un capolavoro. “Raffaello. Un Dio mortale” edizioni @lanavediteseoed Qui con dedica e autografo:
https://t.co/bUZuKPSvhg @stampasgarbi https://t.co/rxS2YZbsb0","Twitter Web App",267,,,,FALSE,FALSE,102,14,,,,,"vittoriosgarbi.it/libri/raffaell…","https://t.co/bUZuKPSvhg","https://www.vittoriosgarbi.it/libri/raffaello-un-dio-mortale","http://pbs.twimg.com/media/FJKxUpXXMAIm_Gg.jpg","https://t.co/rxS2YZbsb0","https://twitter.com/VittorioSgarbi/status/1482443410913079305/photo/1","photo","http://pbs.twimg.com/media/FJKxUpXXMAIm_Gg.jpg","https://t.co/rxS2YZbsb0","https://twitter.com/VittorioSgarbi/status/1482443410913079305/photo/1",,"x4275320235 x2164988132","lanavediteseoed stampasgarbi","it",,,,,,,,,,,,,,,,,,,,,,,,,,,,,,,,,,,,,"NA NA","NA NA","NA NA NA NA NA NA NA NA","https://twitter.com/VittorioSgarbi/status/1482443410913079305","Vittorio Sgarbi","mai nello stesso luogo","Twitter ufficiale di Vittorio Sgarbi - Storico dell'Arte e Opinionista | Contatti: press@vittoriosgarbi.it
Capra Store: https://t.co/XvD8pqlFul","https://t.co/v3GBQb33Lz",FALSE,801589,358,1300,12041,4263,2010-10-12 10:20:00,TRUE,"https://t.co/v3GBQb33Lz","http://www.vittoriosgarbi.it",,"https://pbs.twimg.com/profile_banners/201658727/1640596883","http://abs.twimg.com/images/themes/theme1/bg.png","http://pbs.twimg.com/profile_images/378800000563952334/834a3c187534931f8af26f78b6c274a8_normal.jpeg"
"x201658727","x1482379002128048130",2022-01-15 15:47:50,"VittorioSgarbi","Il virus ha colpito il cervello dei giornalisti ormai incapaci di raccontare con lealtà i fatti. Il Caso Riva del Garda. https://t.co/lHmWHhUHti @stampasgarbi","Twitter Web App",158,,,,FALSE,FALSE,842,159,,,,,"youtube.com/watch?v=LBf7lq…","https://t.co/lHmWHhUHti","https://www.youtube.com/watch?v=LBf7lqybizw",,,,,,,,,"x2164988132","stampasgarbi","it",,,,,,,,,,,,,,,,,,,,,,,,,,,,,,,,,,,,,"NA NA","NA NA","NA NA NA NA NA NA NA NA","https://twitter.com/VittorioSgarbi/status/1482379002128048130","Vittorio Sgarbi","mai nello stesso luogo","Twitter ufficiale di Vittorio Sgarbi - Storico dell'Arte e Opinionista | Contatti: press@vittoriosgarbi.it
Capra Store: https://t.co/XvD8pqlFul","https://t.co/v3GBQb33Lz",FALSE,801589,358,1300,12041,4263,2010-10-12 10:20:00,TRUE,"https://t.co/v3GBQb33Lz","http://www.vittoriosgarbi.it",,"https://pbs.twimg.com/profile_banners/201658727/1640596883","http://abs.twimg.com/images/themes/theme1/bg.png","http://pbs.twimg.com/profile_images/378800000563952334/834a3c187534931f8af26f78b6c274a8_normal.jpeg"
"x201658727","x1482376692245086218",2022-01-15 15:38:39,"VittorioSgarbi","15 gennaio 1993 Crimor Unità Militare Combattente cattura a Palermo #RIINA Salvatore #MAFIA. Vince il Bene Comune. Garrisce una sola Bandiera, il #Tricolore. 
#capitanoUltimo #Carabinieri https://t.co/853BE3y8Gc","Twitter Web App",139,,,,FALSE,TRUE,0,74,,,"RIINA MAFIA",,,,,,,,,,,,,"x923979591693275136","UltimoUMC","it",,,,,,,,,,,,,,,,"x1482271007276781568","15 gennaio 1993 Crimor Unità Militare Combattente cattura a Palermo #RIINA Salvatore #MAFIA. Vince il Bene Comune. Garrisce una sola Bandiera, il #Tricolore. 
#capitanoUltimo #Carabinieri https://t.co/853BE3y8Gc",2022-01-15 08:38:42,"Twitter for Android",343,74,"x923979591693275136","UltimoUMC","Capitano Ultimo",20722,309,3057,"Roma, Lazio","Sergio De Caprio il ""Capitano Ultimo"". Carabiniere straccione.   Sono nato dove il vento corre libero e non c'è niente che spezza i raggi del sole.",FALSE,,,,,,,"NA NA","NA NA","NA NA NA NA NA NA NA NA","https://twitter.com/VittorioSgarbi/status/1482376692245086218","Vittorio Sgarbi","mai nello stesso luogo","Twitter ufficiale di Vittorio Sgarbi - Storico dell'Arte e Opinionista | Contatti: press@vittoriosgarbi.it
Capra Store: https://t.co/XvD8pqlFul","https://t.co/v3GBQb33Lz",FALSE,801589,358,1300,12041,4263,2010-10-12 10:20:00,TRUE,"https://t.co/v3GBQb33Lz","http://www.vittoriosgarbi.it",,"https://pbs.twimg.com/profile_banners/201658727/1640596883","http://abs.twimg.com/images/themes/theme1/bg.png","http://pbs.twimg.com/profile_images/378800000563952334/834a3c187534931f8af26f78b6c274a8_normal.jpeg"
"x201658727","x1482373025651740673",2022-01-15 15:24:05,"VittorioSgarbi","David Sassoli, la sepoltura al cimitero di Sutri. https://t.co/A2YkIogAkd @stampasgarbi","Twitter Web App",87,,,,FALSE,FALSE,46,7,,,,,"youtube.com/watch?v=0BtP_t…","https://t.co/A2YkIogAkd","https://www.youtube.com/watch?v=0BtP_tBjHS0",,,,,,,,,"x2164988132","stampasgarbi","it",,,,,,,,,,,,,,,,,,,,,,,,,,,,,,,,,,,,,"NA NA","NA NA","NA NA NA NA NA NA NA NA","https://twitter.com/VittorioSgarbi/status/1482373025651740673","Vittorio Sgarbi","mai nello stesso luogo","Twitter ufficiale di Vittorio Sgarbi - Storico dell'Arte e Opinionista | Contatti: press@vittoriosgarbi.it
Capra Store: https://t.co/XvD8pqlFul","https://t.co/v3GBQb33Lz",FALSE,801589,358,1300,12041,4263,2010-10-12 10:20:00,TRUE,"https://t.co/v3GBQb33Lz","http://www.vittoriosgarbi.it",,"https://pbs.twimg.com/profile_banners/201658727/1640596883","http://abs.twimg.com/images/themes/theme1/bg.png","http://pbs.twimg.com/profile_images/378800000563952334/834a3c187534931f8af26f78b6c274a8_normal.jpeg"
"x201658727","x1482365080289300487",2022-01-15 14:52:30,"VittorioSgarbi","Ecco a voi la ripresa (per il…). Volo Roma-Milano, poco fa (prezzo assolutamente non proibitivo, in linea con un treno). A bordo 6-7 passeggeri in tutto. Vogliamo continuare a usare il Covid per distruggere economia, consumi, benessere? https://t.co/zOkAJIGFlS","Twitter Web App",140,,,,FALSE,TRUE,0,810,,,,,,,,,,,,,,,,"x144210805","Capezzone","it",,,,,,,,,,,,,,,,"x1482321662871810048","Ecco a voi la ripresa (per il…). Volo Roma-Milano, poco fa (prezzo assolutamente non proibitivo, in linea con un treno). A bordo 6-7 passeggeri in tutto. Vogliamo continuare a usare il Covid per distruggere economia, consumi, benessere? https://t.co/zOkAJIGFlS",2022-01-15 11:59:59,"Twitter for iPhone",2670,810,"x144210805","Capezzone","Daniele Capezzone",140562,3383,51575,"","Atlantista, liberale classico. @LaVeritaWeb e #LaVeritaAlleSette. @MercatusI e @AtlanticoMag. In tv su Mediaset. @RadioGloboFm. #PerUnaNuovaDestra🗽",FALSE,,,,,,,"NA NA","NA NA","NA NA NA NA NA NA NA NA","https://twitter.com/VittorioSgarbi/status/1482365080289300487","Vittorio Sgarbi","mai nello stesso luogo","Twitter ufficiale di Vittorio Sgarbi - Storico dell'Arte e Opinionista | Contatti: press@vittoriosgarbi.it
Capra Store: https://t.co/XvD8pqlFul","https://t.co/v3GBQb33Lz",FALSE,801589,358,1300,12041,4263,2010-10-12 10:20:00,TRUE,"https://t.co/v3GBQb33Lz","http://www.vittoriosgarbi.it",,"https://pbs.twimg.com/profile_banners/201658727/1640596883","http://abs.twimg.com/images/themes/theme1/bg.png","http://pbs.twimg.com/profile_images/378800000563952334/834a3c187534931f8af26f78b6c274a8_normal.jpeg"
"x201658727","x1482361324906684416",2022-01-15 14:37:35,"VittorioSgarbi","#presidenziali2022 Il gruppo dirigente di Forza Italia ha dimostrato la sua natura. Sono cortigiani che cercano di screditare una idea che non hanno avuto. Non basta dire che ci sono i voti, occorre dare loro un volto…
Tajani e company sono uccelli del malaugurio… @Corriere https://t.co/35LIFCWZD2","Twitter for iPhone",274,,,,FALSE,FALSE,285,30,,,"presidenziali2022",,,,,"http://pbs.twimg.com/media/FJJnw2NXMAIcJJC.jpg","https://t.co/35LIFCWZD2","https://twitter.com/VittorioSgarbi/status/1482361324906684416/photo/1","photo","http://pbs.twimg.com/media/FJJnw2NXMAIcJJC.jpg","https://t.co/35LIFCWZD2","https://twitter.com/VittorioSgarbi/status/1482361324906684416/photo/1",,"x395218906","Corriere","it",,,,,,,,,,,,,,,,,,,,,,,,,,,,,,,,,,,,,"NA NA","NA NA","NA NA NA NA NA NA NA NA","https://twitter.com/VittorioSgarbi/status/1482361324906684416","Vittorio Sgarbi","mai nello stesso luogo","Twitter ufficiale di Vittorio Sgarbi - Storico dell'Arte e Opinionista | Contatti: press@vittoriosgarbi.it
Capra Store: https://t.co/XvD8pqlFul","https://t.co/v3GBQb33Lz",FALSE,801589,358,1300,12041,4263,2010-10-12 10:20:00,TRUE,"https://t.co/v3GBQb33Lz","http://www.vittoriosgarbi.it",,"https://pbs.twimg.com/profile_banners/201658727/1640596883","http://abs.twimg.com/images/themes/theme1/bg.png","http://pbs.twimg.com/profile_images/378800000563952334/834a3c187534931f8af26f78b6c274a8_normal.jpeg"
"x201658727","x1482342811383087111",2022-01-15 13:24:01,"VittorioSgarbi","Vaccino anti Covid: garantire la libertà di chi non vuole farlo. Senza ricatti. Senza ritorsioni. https://t.co/3UPZSSVdLn (alle 15,00 online) @stampasgarbi","Twitter Web App",155,,,,FALSE,FALSE,1291,302,,,,,"youtu.be/nlIJqGpIjdg","https://t.co/3UPZSSVdLn","https://youtu.be/nlIJqGpIjdg",,,,,,,,,"x2164988132","stampasgarbi","it",,,,,,,,,,,,,,,,,,,,,,,,,,,,,,,,,,,,,"NA NA","NA NA","NA NA NA NA NA NA NA NA","https://twitter.com/VittorioSgarbi/status/1482342811383087111","Vittorio Sgarbi","mai nello stesso luogo","Twitter ufficiale di Vittorio Sgarbi - Storico dell'Arte e Opinionista | Contatti: press@vittoriosgarbi.it
Capra Store: https://t.co/XvD8pqlFul","https://t.co/v3GBQb33Lz",FALSE,801589,358,1300,12041,4263,2010-10-12 10:20:00,TRUE,"https://t.co/v3GBQb33Lz","http://www.vittoriosgarbi.it",,"https://pbs.twimg.com/profile_banners/201658727/1640596883","http://abs.twimg.com/images/themes/theme1/bg.png","http://pbs.twimg.com/profile_images/378800000563952334/834a3c187534931f8af26f78b6c274a8_normal.jpeg"
"x1328329476","x1482271960579153920",2022-01-15 08:42:29,"mati_siracusano","Perché fanno maggioranza ed accettano ministri espressione di una forza politica, fondata e guidata da un uomo che fa loro così schifo? 
Berlusconi è persona per bene quando dà i voti per i Governi che piacciono alla sx e torna un mostro quando ambisce a qualcosa?","Twitter for iPhone",140,,,,FALSE,TRUE,0,304,,,,,,,,,,,,,,,,"x413916151","GuidoCrosetto","it",,,,,,,,,,,,,,,,"x1482256478354513920","Perché fanno maggioranza ed accettano ministri espressione di una forza politica, fondata e guidata da un uomo che fa loro così schifo? 
Berlusconi è persona per bene quando dà i voti per i Governi che piacciono alla sx e torna un mostro quando ambisce a qualcosa?",2022-01-15 07:40:58,"Twitter for iPhone",2082,304,"x413916151","GuidoCrosetto","Guido Crosetto",171259,2245,101989,"","Libero da pregiudizi per convinzione, garantista per dna, conservatore per nascita, rispettoso per scelta. Ex tante cose. Ora uomo libero ed imprenditore.",FALSE,,,,,,,"NA NA","NA NA","NA NA NA NA NA NA NA NA","https://twitter.com/mati_siracusano/status/1482271960579153920","Matilde Siracusano","Messina, Sicilia","Messinese, classe 1985. Parlamentare di Forza Italia alla Camera dei Deputati-membro della Commissione  Giustizia",,FALSE,1907,907,9,1280,2282,2013-04-05 04:03:29,FALSE,,,,"https://pbs.twimg.com/profile_banners/1328329476/1581003641","http://abs.twimg.com/images/themes/theme1/bg.png","http://pbs.twimg.com/profile_images/1455331120573259780/oew1O31e_normal.jpg"
"x1261619708","x1482423189988941829",2022-01-15 18:43:25,"maria_spena","Oggi Enrico #Letta ha detto che #Berlusconi è il politico più #divisivo degli ultimi 25 anni. Sta parlando della stessa persona grazie a cui ha potuto fare il premier nel 2013 e che pochi mesi fa definiva “un federatore”? https://t.co/bfeMWCkQhJ","Twitter for iPhone",221,,,,FALSE,FALSE,0,0,,,"Letta Berlusconi divisivo",,,,,"http://pbs.twimg.com/media/FJKgBDiX0A0BuI-.jpg","https://t.co/bfeMWCkQhJ","https://twitter.com/maria_spena/status/1482423189988941829/photo/1","photo","http://pbs.twimg.com/media/FJKgBDiX0A0BuI-.jpg","https://t.co/bfeMWCkQhJ","https://twitter.com/maria_spena/status/1482423189988941829/photo/1",,,,"it",,,,,,,,,,,,,,,,,,,,,,,,,,,,,,,,,,,,,"NA NA","NA NA","NA NA NA NA NA NA NA NA","https://twitter.com/maria_spena/status/1482423189988941829","Maria Spena","","🎓Giurisprudenza 🏛Deputata di @forza_italia Vicepresidente XIII Commissione Agricoltura e Componente della Commissione Parlamentare Infanzia e Adolescenza",,FALSE,949,57,13,530,508,2013-03-12 10:05:34,FALSE,,,,"https://pbs.twimg.com/profile_banners/1261619708/1608501867","http://abs.twimg.com/images/themes/theme1/bg.png","http://pbs.twimg.com/profile_images/1471206059096391688/YwTNJ5uE_normal.jpg"
"x906269360","x1482384316252446723",2022-01-15 16:08:57,"tripodimaria","Non chi comincia, ma quel che perservera. 
#MarinaMilitare
#NoiSiamolaMarina
#ProfessionistidelMare https://t.co/y2bAQaqndF","Twitter for iPhone",140,,,,FALSE,TRUE,0,29,,,"MarinaMilitare NoiSiamolaMarina ProfessionistidelMare",,,,,"http://pbs.twimg.com/media/FJJ8RgzXMAADlWc.jpg","https://t.co/y2bAQaqndF","https://twitter.com/ItalianNavy/status/1482383871220006919/photo/1","photo","http://pbs.twimg.com/media/FJJ8RgzXMAADlWc.jpg","https://t.co/y2bAQaqndF","https://twitter.com/ItalianNavy/status/1482383871220006919/photo/1",,"x252039915","ItalianNavy","it",,,,,,,,,,,,,,,,"x1482383871220006919","Non chi comincia, ma quel che perservera. 
#MarinaMilitare
#NoiSiamolaMarina
#ProfessionistidelMare https://t.co/y2bAQaqndF",2022-01-15 16:07:10,"Twitter for Android",121,29,"x252039915","ItalianNavy","Marina Militare",99758,190,20495,"Italia","#ProfessionistidelMare #NoisiamolaMarina #UnMarediOpportunità",TRUE,,,,,,,"NA NA","NA NA","NA NA NA NA NA NA NA NA","https://twitter.com/tripodimaria/status/1482384316252446723","Maria Tripodi","","Deputato della Repubblica•                Eletta nel Collegio Calabria02•   Capogruppo @forza_Italia in @cd_difesa•  Dott.ssa in Relazioni Internazionali",,FALSE,6581,2349,44,11694,17122,2012-10-26 15:54:35,FALSE,,,,"https://pbs.twimg.com/profile_banners/906269360/1521784227","http://abs.twimg.com/images/themes/theme1/bg.png","http://pbs.twimg.com/profile_images/809321296794415104/jDezppyk_normal.jpg"
"x906269360","x1482274803470024705",2022-01-15 08:53:47,"tripodimaria","Domani si vota a #Roma, per eleggere il nuovo deputato del collegio 1. Portiamo a @Montecitorio la competenza di Simonetta Matone. Forza! https://t.co/CuHMdnHSwR","Twitter for iPhone",140,,,,FALSE,TRUE,0,14,,,"Roma",,,,,,,,,,,,,"x147543162 x2278995820","forza_italia Montecitorio","it",,,,,,,,,,,,,,,,"x1482273485753925636","Domani si vota a #Roma, per eleggere il nuovo deputato del collegio 1. Portiamo a @Montecitorio la competenza di Simonetta Matone. Forza! https://t.co/CuHMdnHSwR",2022-01-15 08:48:32,"Twitter for Android",40,14,"x147543162","forza_italia","Forza Italia",169391,802,191035,"Italia","Account ufficiale del movimento politico Forza Italia.",TRUE,,,,,,,"NA NA","NA NA","NA NA NA NA NA NA NA NA","https://twitter.com/tripodimaria/status/1482274803470024705","Maria Tripodi","","Deputato della Repubblica•                Eletta nel Collegio Calabria02•   Capogruppo @forza_Italia in @cd_difesa•  Dott.ssa in Relazioni Internazionali",,FALSE,6581,2349,44,11694,17122,2012-10-26 15:54:35,FALSE,,,,"https://pbs.twimg.com/profile_banners/906269360/1521784227","http://abs.twimg.com/images/themes/theme1/bg.png","http://pbs.twimg.com/profile_images/809321296794415104/jDezppyk_normal.jpg"
"x447056150","x1482387114306191360",2022-01-15 16:20:04,"GiusyVersace","Foto appena pubblicata https://t.co/uRrai893xb","Instagram",46,,,,FALSE,FALSE,5,0,,,,,"instagram.com/p/CYwdd84qMp3/…","https://t.co/uRrai893xb","https://www.instagram.com/p/CYwdd84qMp3/?utm_medium=twitter",,,,,,,,,,,"it",,,,,,,,,,,,,,,,,,,,,,,,,,,,,,,,,,,,,"NA NA","NA NA","NA NA NA NA NA NA NA NA","https://twitter.com/GiusyVersace/status/1482387114306191360","Giusy Versace","Milano","Cominciate col fare il necessario, poi cio' che e' possibile e all'improvviso vi sorprenderete a fare l'impossibile - S.Francesco d'Assisi","http://t.co/jemrvujzQb",FALSE,26007,2089,121,21894,16218,2011-12-26 13:05:12,TRUE,"http://t.co/jemrvujzQb","http://www.giusyversace.it",,"https://pbs.twimg.com/profile_banners/447056150/1363347299","http://abs.twimg.com/images/themes/theme1/bg.png","http://pbs.twimg.com/profile_images/378800000828007270/bad08b8529048aef2d0a82e084b0b31a_normal.jpeg"
"x447056150","x1482384717114757122",2022-01-15 16:10:32,"GiusyVersace","#kalipe @massimilianotv grazie 🙏per averci fatto vivere il coraggio e  l'emozione della vetta #cervino compresa la testimonianza che ci ha donato @GiusyVersace ❤
 &lt;&lt;la paura e' un dono&gt;&gt; #rai2 https://t.co/FC3ln8eOUX","Twitter for Android",140,,,,FALSE,TRUE,0,2,,,"kalipe cervino",,,,,,,,,,,,,"x1011181519 x605205470","GRicci1978 massimilianotv","it",,,,,,,,,,,,,,,,"x1478847266953781252","#kalipe @massimilianotv grazie 🙏per averci fatto vivere il coraggio e  l'emozione della vetta #cervino compresa la testimonianza che ci ha donato @GiusyVersace ❤
 &lt;&lt;la paura e' un dono&gt;&gt; #rai2 https://t.co/FC3ln8eOUX",2022-01-05 21:53:58,"Twitter for Android",12,2,"x1011181519","GRicci1978","Gianluca Ricci",2085,4197,4931,"Roma","Manager TLC, Communication (premio Telegatto 2008), President #CuoreDigitale, Premio Orgoglio Italiano",FALSE,,,,,,,"NA NA","NA NA","NA NA NA NA NA NA NA NA","https://twitter.com/GiusyVersace/status/1482384717114757122","Giusy Versace","Milano","Cominciate col fare il necessario, poi cio' che e' possibile e all'improvviso vi sorprenderete a fare l'impossibile - S.Francesco d'Assisi","http://t.co/jemrvujzQb",FALSE,26007,2089,121,21894,16218,2011-12-26 13:05:12,TRUE,"http://t.co/jemrvujzQb","http://www.giusyversace.it",,"https://pbs.twimg.com/profile_banners/447056150/1363347299","http://abs.twimg.com/images/themes/theme1/bg.png","http://pbs.twimg.com/profile_images/378800000828007270/bad08b8529048aef2d0a82e084b0b31a_normal.jpeg"
"x447056150","x1482384513481297926",2022-01-15 16:09:44,"GiusyVersace","Piccoli grandi traguardi ❤💪
#paralimpici nei #gruppisportivi 
#enonfiniscequi 
Grazie  @claudioarrigoni @Corriere #buonenotizie 
👇
https://t.co/sWUngLppou","Twitter for Android",154,,,,FALSE,FALSE,6,1,,,"paralimpici gruppisportivi enonfiniscequi buonenotizie",,"corriere.it/buone-notizie/…","https://t.co/sWUngLppou","https://www.corriere.it/buone-notizie/22_gennaio_10/per-atleti-paralimpici-arriva-parita-sportiva-giusy-versace-finalmente-fa56d10a-71f5-11ec-b185-e6e7d7d180a3.shtml",,,,,,,,,"x119549495 x395218906","claudioarrigoni Corriere","it",,,,,,,,,,,,,,,,,,,,,,,,,,,,,,,,,,,,,"NA NA","NA NA","NA NA NA NA NA NA NA NA","https://twitter.com/GiusyVersace/status/1482384513481297926","Giusy Versace","Milano","Cominciate col fare il necessario, poi cio' che e' possibile e all'improvviso vi sorprenderete a fare l'impossibile - S.Francesco d'Assisi","http://t.co/jemrvujzQb",FALSE,26007,2089,121,21894,16218,2011-12-26 13:05:12,TRUE,"http://t.co/jemrvujzQb","http://www.giusyversace.it",,"https://pbs.twimg.com/profile_banners/447056150/1363347299","http://abs.twimg.com/images/themes/theme1/bg.png","http://pbs.twimg.com/profile_images/378800000828007270/bad08b8529048aef2d0a82e084b0b31a_normal.jpeg"
"x1557514573","x1482447950202736642",2022-01-15 20:21:48,"elio_vito","@Memix1968 Ah! 👀","Twitter for iPad",5,"x1482447408986574855","x837313603535523840","Memix1968",FALSE,FALSE,1,0,,,,,,,,,,,,,,,,"x837313603535523840","Memix1968","und",,,,,,,,,,,,,,,,,,,,,,,,,,,,,,,,,,,,,"NA NA","NA NA","NA NA NA NA NA NA NA NA","https://twitter.com/elio_vito/status/1482447950202736642","Elio Vito 🇮🇹🇪🇺🇺🇸🏳️‍🌈🌍","Roma","Deputato @forza_italia. Napoletano. Juventino","https://t.co/M08fBO5zuy",FALSE,19420,13,108,24123,46024,2013-06-30 07:47:38,TRUE,"https://t.co/M08fBO5zuy","https://www.nextquotidiano.it/elio-vito-presidente-della-repubblica/",,"https://pbs.twimg.com/profile_banners/1557514573/1640814244","http://abs.twimg.com/images/themes/theme1/bg.png","http://pbs.twimg.com/profile_images/736450788659240960/-8W5fQJa_normal.jpg"
"x1557514573","x1482447699429498880",2022-01-15 20:20:48,"elio_vito","@di_reddito Non dia idee...","Twitter for iPad",15,"x1482099900686946305","x515542672","di_reddito",FALSE,FALSE,3,0,,,,,,,,,,,,,,,,"x515542672","di_reddito","it",,,,,,,,,,,,,,,,,,,,,,,,,,,,,,,,,,,,,"NA NA","NA NA","NA NA NA NA NA NA NA NA","https://twitter.com/elio_vito/status/1482447699429498880","Elio Vito 🇮🇹🇪🇺🇺🇸🏳️‍🌈🌍","Roma","Deputato @forza_italia. Napoletano. Juventino","https://t.co/M08fBO5zuy",FALSE,19420,13,108,24123,46024,2013-06-30 07:47:38,TRUE,"https://t.co/M08fBO5zuy","https://www.nextquotidiano.it/elio-vito-presidente-della-repubblica/",,"https://pbs.twimg.com/profile_banners/1557514573/1640814244","http://abs.twimg.com/images/themes/theme1/bg.png","http://pbs.twimg.com/profile_images/736450788659240960/-8W5fQJa_normal.jpg"
