"x412137356","x1532983956399865858",2022-06-04 07:13:51,"ecdelre","🇪🇺🌍 Qui est @ecdelre Représentante spéciale de l'Union européenne pour le Sahel  ? 
@InterTV5 @antoinegenton @chatelot @lemondefr #Sahel #Mali #E U
📺 Samedi 4 juin à 12H (heure Paris) @TV5MONDE https://t.co/gxK7aJ4LRy","Twitter for Android",140,,,,FALSE,TRUE,0,4,,,,,,,,,,,,,,,,"x324512739 x412137356 x324512739 x194238132 x246348551","InterTV5 ecdelre InterTV5 antoinegenton chatelot","fr",,,,,,,,,,,,,,,,"x1532795922903715841","🇪🇺🌍 Qui est @ecdelre Représentante spéciale de l'Union européenne pour le Sahel  ? 
@InterTV5 @antoinegenton @chatelot @lemondefr #Sahel #Mali #E U
📺 Samedi 4 juin à 12H (heure Paris) @TV5MONDE https://t.co/gxK7aJ4LRy",2022-06-03 18:46:40,"Yuzzit Pro",3,4,"x324512739","InterTV5","Internationales",4814,1172,2695,"Paris","Le grand entretien sur l’actualité du monde présenté par @francoisejoly sur @TV5MONDE en partenariat avec @lemondefr #Internationales",FALSE,,,,,,,"NA NA","NA NA","NA NA NA NA NA NA NA NA","https://twitter.com/ecdelre/status/1532983956399865858","Emanuela C. Del Re","Sahel and Bruxelles ","EU Special Representative for the Sahel 🇪🇺 Former Vice-Minister of Foreign Affairs and MP of Italy 🇮🇹 Prof. Political Sociology - Author of essays & volumes","https://t.co/j5mx3SmZsU",FALSE,6558,350,49,3872,2153,2011-11-14 09:30:25,TRUE,"https://t.co/j5mx3SmZsU","https://eeas.europa.eu/headquarters/headquarters-homepage_en/3606/EU%20Special%20Representatives",,"https://pbs.twimg.com/profile_banners/412137356/1625138723","http://abs.twimg.com/images/themes/theme1/bg.png","http://pbs.twimg.com/profile_images/1222088283976601600/UbqmxHp7_normal.jpg"
"x412137356","x1532983920685367296",2022-06-04 07:13:42,"ecdelre","🇪🇺🌍 Stratégie de l'Union européenne avec le Mali : "" La fermeté sans fermeture !"" @ecdelre Représentante spéciale de l'Union européenne pour le Sahel @InterTV5 @antoinegenton @chatelot @lemondefr #Sahel #Mali 
📺 Samedi 4 juin à 12H (heure Paris) @TV5MONDE https://t.co/oq9UlQBnRK","Twitter for Android",139,,,,FALSE,TRUE,0,5,,,,,,,,,,,,,,,,"x324512739 x412137356","InterTV5 ecdelre","fr",,,,,,,,,,,,,,,,"x1532981353641398272","🇪🇺🌍 Stratégie de l'Union européenne avec le Mali : "" La fermeté sans fermeture !"" @ecdelre Représentante spéciale de l'Union européenne pour le Sahel @InterTV5 @antoinegenton @chatelot @lemondefr #Sahel #Mali 
📺 Samedi 4 juin à 12H (heure Paris) @TV5MONDE https://t.co/oq9UlQBnRK",2022-06-04 07:03:30,"Yuzzit Pro",6,5,"x324512739","InterTV5","Internationales",4814,1172,2695,"Paris","Le grand entretien sur l’actualité du monde présenté par @francoisejoly sur @TV5MONDE en partenariat avec @lemondefr #Internationales",FALSE,,,,,,,"NA NA","NA NA","NA NA NA NA NA NA NA NA","https://twitter.com/ecdelre/status/1532983920685367296","Emanuela C. Del Re","Sahel and Bruxelles ","EU Special Representative for the Sahel 🇪🇺 Former Vice-Minister of Foreign Affairs and MP of Italy 🇮🇹 Prof. Political Sociology - Author of essays & volumes","https://t.co/j5mx3SmZsU",FALSE,6558,350,49,3872,2153,2011-11-14 09:30:25,TRUE,"https://t.co/j5mx3SmZsU","https://eeas.europa.eu/headquarters/headquarters-homepage_en/3606/EU%20Special%20Representatives",,"https://pbs.twimg.com/profile_banners/412137356/1625138723","http://abs.twimg.com/images/themes/theme1/bg.png","http://pbs.twimg.com/profile_images/1222088283976601600/UbqmxHp7_normal.jpg"
"x48062712","x1532777461674557441",2022-06-03 17:33:19,"luigidimaio","Con grande piacere ho avuto colloquio telefonico con collega francese @MinColonna. 
Focus su rapporti Italia-Francia, nel quadro del #TrattatoQuirinale. Ribadito sostegno convinto a popolo ucraino, aggredito da esercito russo. Lavoriamo a obiettivo pace e a sicurezza alimentare.","Twitter for iPhone",279,,,,FALSE,FALSE,121,22,,,"TrattatoQuirinale",,,,,,,,,,,,,"x1141660959364308992","MinColonna","it",,,,,,,,,,,,,,,,,,,,,,,,,,,,,,,,,,,,,"NA NA","NA NA","NA NA NA NA NA NA NA NA","https://twitter.com/luigidimaio/status/1532777461674557441","Luigi Di Maio","Pomigliano d'Arco, Campania","Ministro degli Affari Esteri e della Cooperazione Internazionale.","https://t.co/D8gkagqksG",FALSE,769937,339,2230,7113,397,2009-06-17 18:34:46,TRUE,"https://t.co/D8gkagqksG","http://www.luigidimaio.it",,"https://pbs.twimg.com/profile_banners/48062712/1645985183","http://abs.twimg.com/images/themes/theme1/bg.png","http://pbs.twimg.com/profile_images/933106806670462976/YyC7LOW8_normal.jpg"
"x122445010","x1533107645334310920",2022-06-04 15:25:21,"FedericoDinca","Il #FestivalEconomiaTrento rappresenta un evento imperdibile che richiama figure di rilievo a livello nazionale e internazionale. Oggi ho avuto il piacere di poter intervenire sul tema: “Un futuro sostenibile dopo la pandemia”.
https://t.co/L9E5m0mi8A https://t.co/Or1dBIbuwL","Twitter for Android",251,,,,FALSE,FALSE,2,2,,,"FestivalEconomiaTrento",,"facebook.com/10004452888541…","https://t.co/L9E5m0mi8A","https://www.facebook.com/100044528885410/posts/pfbid031o3RDCFNvBHunjqKuVE2H1CRTBkMbjZUg6fe6JaqCW5WX2oLa12VEyCTLZ8LWAxMl/","http://pbs.twimg.com/media/FUaxQUDWYAUaeRT.jpg","https://t.co/Or1dBIbuwL","https://twitter.com/FedericoDinca/status/1533107645334310920/photo/1","photo","http://pbs.twimg.com/media/FUaxQUDWYAUaeRT.jpg http://pbs.twimg.com/media/FUaxQuiXoAE_7Ly.jpg http://pbs.twimg.com/media/FUaxRIPX0AAbPRK.jpg http://pbs.twimg.com/media/FUaxRknXEAANX2I.jpg","https://t.co/Or1dBIbuwL https://t.co/Or1dBIbuwL https://t.co/Or1dBIbuwL https://t.co/Or1dBIbuwL","https://twitter.com/FedericoDinca/status/1533107645334310920/photo/1 https://twitter.com/FedericoDinca/status/1533107645334310920/photo/1 https://twitter.com/FedericoDinca/status/1533107645334310920/photo/1 https://twitter.com/FedericoDinca/status/1533107645334310920/photo/1",,,,"it",,,,,,,,,,,,,,,,,,,,,,,,,,,,,,,,,,,,,"NA NA","NA NA","NA NA NA NA NA NA NA NA","https://twitter.com/FedericoDinca/status/1533107645334310920","Federico D'Incà","","Ministro per i Rapporti con il Parlamento e le Riforme","https://t.co/UFCWewwvtT",FALSE,14557,688,218,4698,101,2010-03-12 18:47:13,TRUE,"https://t.co/UFCWewwvtT","http://www.federicodinca.it",,"https://pbs.twimg.com/profile_banners/122445010/1613160864","http://abs.twimg.com/images/themes/theme1/bg.png","http://pbs.twimg.com/profile_images/1409407471559512065/khni2uiy_normal.jpg"
"x839373926","x1532785943249289217",2022-06-03 18:07:01,"lofioramonti","@AugustoMazzoni Ah, ecco","Twitter for Android",8,"x1532778713225494535","x185599054","AugustoMazzoni",FALSE,FALSE,0,0,,,,,,,,,,,,,,,,"x185599054","AugustoMazzoni","it",,,,,,,,,,,,,,,,,,,,,,,,,,,,,,,,,,,,,"NA NA","NA NA","NA NA NA NA NA NA NA NA","https://twitter.com/lofioramonti/status/1532785943249289217","Lorenzo Fioramonti","Italia","Education is the most powerful weapon which you can use to change the world - Nelson Mandela","https://t.co/8C7JpXw9fS",FALSE,18555,517,190,6294,3301,2012-09-22 08:38:12,TRUE,"https://t.co/8C7JpXw9fS","http://www.lorenzofioramonti.org",,"https://pbs.twimg.com/profile_banners/839373926/1592162762","http://abs.twimg.com/images/themes/theme1/bg.png","http://pbs.twimg.com/profile_images/1311294397607280641/JIGjx9JV_normal.jpg"
"x839373926","x1532774169552818183",2022-06-03 17:20:14,"lofioramonti","Magari con qualche miliardo in meno buttato in scemenze come andare su #Marte forse questi posti di lavoro si potrebbero salvare, no?
#elon_musk https://t.co/gmhPZn3hXH","Twitter for Android",168,,,,FALSE,FALSE,8,0,,,"Marte elon_musk",,"ilfattoquotidiano.it/2022/06/03/elo…","https://t.co/gmhPZn3hXH","https://www.ilfattoquotidiano.it/2022/06/03/elon-musk-tagliera-10mila-dipendenti-di-tesla-ci-sono-pessime-sensazioni-sulleconomia/6614456/",,,,,,,,,,,"it",,,,,,,,,,,,,,,,,,,,,,,,,,,,,,,,,,,,,"NA NA","NA NA","NA NA NA NA NA NA NA NA","https://twitter.com/lofioramonti/status/1532774169552818183","Lorenzo Fioramonti","Italia","Education is the most powerful weapon which you can use to change the world - Nelson Mandela","https://t.co/8C7JpXw9fS",FALSE,18555,517,190,6294,3301,2012-09-22 08:38:12,TRUE,"https://t.co/8C7JpXw9fS","http://www.lorenzofioramonti.org",,"https://pbs.twimg.com/profile_banners/839373926/1592162762","http://abs.twimg.com/images/themes/theme1/bg.png","http://pbs.twimg.com/profile_images/1311294397607280641/JIGjx9JV_normal.jpg"
"x1052596340","x1533043985693954048",2022-06-04 11:12:23,"riccardo_fra","Anche il CNA ha lanciato l'allarme sul blocco della cessione dei crediti legati ai bonus edilizi. Il Governo si sieda a un tavolo di confronto con parti sociali e banche per trovare una soluzione immediata. 
Non perdiamo tempo prezioso. 
Ne parlo qui👇🏻
https://t.co/xfyZPZOGjm https://t.co/vGwtIQ6W9J","Twitter for iPhone",276,,,,FALSE,FALSE,21,13,,,,,"bit.ly/3avde60","https://t.co/xfyZPZOGjm","https://bit.ly/3avde60","http://pbs.twimg.com/media/FUZ3YFOXsAAqucB.jpg","https://t.co/vGwtIQ6W9J","https://twitter.com/riccardo_fra/status/1533043985693954048/photo/1","photo","http://pbs.twimg.com/media/FUZ3YFOXsAAqucB.jpg","https://t.co/vGwtIQ6W9J","https://twitter.com/riccardo_fra/status/1533043985693954048/photo/1",,,,"it",,,,,,,,,,,,,,,,,,,,,,,,,,,,,,,,,,,,,"NA NA","NA NA","NA NA NA NA NA NA NA NA","https://twitter.com/riccardo_fra/status/1533043985693954048","Riccardo Fraccaro","","Deputato #M5S. https://t.co/LJ8npKe2Eq","https://t.co/FWQiVIVn48",FALSE,51099,6879,387,4687,4052,2013-01-01 13:29:45,TRUE,"https://t.co/FWQiVIVn48","http://www.riccardofraccaro.it/",,"https://pbs.twimg.com/profile_banners/1052596340/1553614671","http://abs.twimg.com/images/themes/theme19/bg.gif","http://pbs.twimg.com/profile_images/1169301653050331136/PnpDqkzk_normal.jpg"
"x920435114","x1533125457905913860",2022-06-04 16:36:07,"LuigiGallo15","""Bisogna decidere se ascoltare le urla del pianeta o ascoltare solo i poteri che ci hanno condotto con il loro modello in questa crisi"" - di @LuigiGallo15, M5s https://t.co/0QdWCr6KCQ","Twitter for Android",139,,,,FALSE,TRUE,0,5,,,,,,,,,,,,,,,,"x274095255","ilfattoblog","it",,,,,,,,,,,,,,,,"x1533048819478298624","""Bisogna decidere se ascoltare le urla del pianeta o ascoltare solo i poteri che ci hanno condotto con il loro modello in questa crisi"" - di @LuigiGallo15, M5s https://t.co/0QdWCr6KCQ",2022-06-04 11:31:35,"TweetDeck",12,5,"x274095255","ilfattoblog","I Blog del Fatto",55997,469,51730,"","Le opinioni, i commenti e le testimonianze della nostra community di blogger. Ogni giorno su https://t.co/WtXNzvKpET",FALSE,,,,,,,"NA NA","NA NA","NA NA NA NA NA NA NA NA","https://twitter.com/LuigiGallo15/status/1533125457905913860","Luigi Gallo","Torre del Greco, Campania","Vice Presidente del Gruppo Parlamentare M5S della Camera dei Deputati, area Economica, già Presidente della Commissione Cultura, Scienza ed Istruzione","https://t.co/Uw9cxfSVTG",FALSE,17051,1396,158,20514,34,2012-11-02 05:41:34,TRUE,"https://t.co/Uw9cxfSVTG","http://galloluigi.com",,"https://pbs.twimg.com/profile_banners/920435114/1646308274","http://abs.twimg.com/images/themes/theme1/bg.png","http://pbs.twimg.com/profile_images/1496581832544079875/vmbJoPsr_normal.jpg"
"x593903001","x1533000895272730626",2022-06-04 08:21:09,"lorenzoni_m5s","Aspetto i punti al @Fanta_citorio 🤣
Grazie a @makkox per l'apprezzamento 🙃 il nostro grafico è bravo. Paramount il realtà è il #Terminillo, la montagna di Roma, e la strada è la futura #Salaria a 4 corsie per cui è stato nominato un Commissario grazie al governo Conte 2 https://t.co/zPvTMGdBfW","Twitter for Android",270,,,,FALSE,FALSE,19,2,,,"Terminillo Salaria",,,,,"http://pbs.twimg.com/ext_tw_video_thumb/1533000826909859840/pu/img/tQjEZtR0cOqoIRD5.jpg","https://t.co/zPvTMGdBfW","https://twitter.com/lorenzoni_m5s/status/1533000895272730626/video/1","photo","http://pbs.twimg.com/ext_tw_video_thumb/1533000826909859840/pu/img/tQjEZtR0cOqoIRD5.jpg","https://t.co/zPvTMGdBfW","https://twitter.com/lorenzoni_m5s/status/1533000895272730626/video/1",,"x1492255549844566018 x16273541","Fanta_citorio makkox","it",,,,,,,,,,,,,,,,,,,,,,,,,,,,,,,,,,,,,"NA NA","NA NA","NA NA NA NA NA NA NA NA","https://twitter.com/lorenzoni_m5s/status/1533000895272730626","Gabriele🇮🇹Lorenzoni","Rieti, Lazio","⭐Portavoce del Movimento 5 Stelle alla Camera dei Deputati per la XVIII legislatura⭐ Commissione Bilancio-Finanze","https://t.co/b2zo98oJof",FALSE,1635,1152,20,936,979,2012-05-29 15:59:47,TRUE,"https://t.co/b2zo98oJof","https://www.camera.it/leg18/29?shadow_deputato=307483&idpersona=307483&idlegislatura=18",,"https://pbs.twimg.com/profile_banners/593903001/1536417500","http://abs.twimg.com/images/themes/theme1/bg.png","http://pbs.twimg.com/profile_images/1038435881558913024/KSZ_41nX_normal.jpg"
"x2149359853","x1533085060848549889",2022-06-04 13:55:36,"RaffaAngela","Caro Catenuccio mi dicono che ti stavi preoccupando perché ieri non ti avevo fatto la domanda. Beh era le festa della città e poi la risposta, assurda, dei tuoi assessori alla mia prima domanda merita una replica. Ecco qui le domande 3 e 4:

3. A chi vi … https://t.co/gnfUrmyGKE https://t.co/daXhFwekYG","IFTTT",279,,,,FALSE,FALSE,15,4,,,,,"instagr.am/p/CeYlgQnqIzE/","https://t.co/gnfUrmyGKE","https://instagr.am/p/CeYlgQnqIzE/","http://pbs.twimg.com/media/FUacvQ4WQAgF3VE.jpg","https://t.co/daXhFwekYG","https://twitter.com/RaffaAngela/status/1533085060848549889/photo/1","photo","http://pbs.twimg.com/media/FUacvQ4WQAgF3VE.jpg","https://t.co/daXhFwekYG","https://twitter.com/RaffaAngela/status/1533085060848549889/photo/1",,,,"it",,,,,,,,,,,,,,,,,,,,,,,,,,,,,,,,,,,,,"NA NA","NA NA","NA NA NA NA NA NA NA NA","https://twitter.com/RaffaAngela/status/1533085060848549889","Angela Raffa","Messina, Sicilia","Deputata Movimento 5 Stelle","https://t.co/QVUmXyFvz0",FALSE,2016,865,16,1250,203,2013-10-22 16:44:17,FALSE,"https://t.co/QVUmXyFvz0","http://facebook.com/angelaraffaM5S/",,"https://pbs.twimg.com/profile_banners/2149359853/1615924017","http://abs.twimg.com/images/themes/theme1/bg.png","http://pbs.twimg.com/profile_images/1371910875033001995/1LehpM1a_normal.jpg"
"x2149359853","x1532994478356762626",2022-06-04 07:55:39,"RaffaAngela","Ora su La7 a Omnibus lunga intervista ad Alessandro Benetton.
Ovviamente ci dispensa le sue perle di saggezza sui giovani (che a volte mancano di motivazione… certo nascere in una famiglia che finanzia con centinaia di milioni di euro qualsiasi tua i… https://t.co/kqBLwhZoWX https://t.co/jbHp52vJUK","IFTTT",275,,,,FALSE,FALSE,35,9,,,,,"instagr.am/p/CeYBAmFKXmf/","https://t.co/kqBLwhZoWX","https://instagr.am/p/CeYBAmFKXmf/","http://pbs.twimg.com/media/FUZKWrqWAAENmGl.jpg","https://t.co/jbHp52vJUK","https://twitter.com/RaffaAngela/status/1532994478356762626/photo/1","photo","http://pbs.twimg.com/media/FUZKWrqWAAENmGl.jpg","https://t.co/jbHp52vJUK","https://twitter.com/RaffaAngela/status/1532994478356762626/photo/1",,,,"it",,,,,,,,,,,,,,,,,,,,,,,,,,,,,,,,,,,,,"NA NA","NA NA","NA NA NA NA NA NA NA NA","https://twitter.com/RaffaAngela/status/1532994478356762626","Angela Raffa","Messina, Sicilia","Deputata Movimento 5 Stelle","https://t.co/QVUmXyFvz0",FALSE,2016,865,16,1250,203,2013-10-22 16:44:17,FALSE,"https://t.co/QVUmXyFvz0","http://facebook.com/angelaraffaM5S/",,"https://pbs.twimg.com/profile_banners/2149359853/1615924017","http://abs.twimg.com/images/themes/theme1/bg.png","http://pbs.twimg.com/profile_images/1371910875033001995/1LehpM1a_normal.jpg"
"x127025568","x1533077224383029248",2022-06-04 13:24:28,"carlosibilia","«In Italia serve il #SalarioMinimo» nette e chiare le parole del Commissario europeo Gentiloni. Il M5S lo propone dal 2019, siamo lieti che le voci a sostegno della misura siano aumentate. La nostra legge è pronta, aspetta solo di essere firmata dalle altre forze politiche.","Twitter for iPhone",274,,,,FALSE,FALSE,40,9,,,"SalarioMinimo",,,,,,,,,,,,,,,"it",,,,,,,,,,,,,,,,,,,,,,,,,,,,,,,,,,,,,"NA NA","NA NA","NA NA NA NA NA NA NA NA","https://twitter.com/carlosibilia/status/1533077224383029248","Carlo Sibilia","Avellino, Campania","Laureato in Biotecnologie Mediche. Parlamentare da 9 anni. 4 da Sottosegretario al Ministero dell'Interno.","https://t.co/LurVtHtd5m",FALSE,57408,771,349,14745,3727,2010-03-27 20:02:51,TRUE,"https://t.co/LurVtHtd5m","http://www.carlosibilia.it",,"https://pbs.twimg.com/profile_banners/127025568/1645873895","http://abs.twimg.com/images/themes/theme1/bg.png","http://pbs.twimg.com/profile_images/1500877497814196229/PUGZXtCA_normal.jpg"
"x127025568","x1533033072421224449",2022-06-04 10:29:01,"carlosibilia","27⁰ Raduno nazionale ""Insieme per la sicurezza e la memoria storica""

#vigilidelfuoco https://t.co/5ZZkBStI1p","Twitter for iPhone",85,,,,FALSE,FALSE,7,0,,,"vigilidelfuoco",,,,,"http://pbs.twimg.com/media/FUZtcqKWUAAuzMC.jpg","https://t.co/5ZZkBStI1p","https://twitter.com/carlosibilia/status/1533033072421224449/photo/1","photo","http://pbs.twimg.com/media/FUZtcqKWUAAuzMC.jpg http://pbs.twimg.com/media/FUZtcqBWIAEU70y.jpg http://pbs.twimg.com/media/FUZtcqGXsAA90oI.jpg","https://t.co/5ZZkBStI1p https://t.co/5ZZkBStI1p https://t.co/5ZZkBStI1p","https://twitter.com/carlosibilia/status/1533033072421224449/photo/1 https://twitter.com/carlosibilia/status/1533033072421224449/photo/1 https://twitter.com/carlosibilia/status/1533033072421224449/photo/1",,,,"it",,,,,,,,,,,,,,,,,,,,,,,,,,,,,,,,,,,,,"NA NA","NA NA","NA NA NA NA NA NA NA NA","https://twitter.com/carlosibilia/status/1533033072421224449","Carlo Sibilia","Avellino, Campania","Laureato in Biotecnologie Mediche. Parlamentare da 9 anni. 4 da Sottosegretario al Ministero dell'Interno.","https://t.co/LurVtHtd5m",FALSE,57408,771,349,14745,3727,2010-03-27 20:02:51,TRUE,"https://t.co/LurVtHtd5m","http://www.carlosibilia.it",,"https://pbs.twimg.com/profile_banners/127025568/1645873895","http://abs.twimg.com/images/themes/theme1/bg.png","http://pbs.twimg.com/profile_images/1500877497814196229/PUGZXtCA_normal.jpg"
"x1376730776","x1532974286318755840",2022-06-04 06:35:25,"mariaederaM5S","Ai cittadini, alle famiglie, alle imprese non vogliamo proporre qualche facile slogan, ma ascolto, studio e azione concreta. 
È con questo spirito che lunedì 6 e martedì 7 giugno saremo a Palermo con @GiuseppeConteIT con un'edizione speciale delle #10lezionidipolitica https://t.co/7Xi3PhqI4Y","Twitter for iPhone",140,,,,FALSE,TRUE,0,53,,,,,,,,,,,,,,,,"x1519695252529065985","ScuolaM5S","it",,,,,,,,,,,,,,,,"x1532794835492605954","Ai cittadini, alle famiglie, alle imprese non vogliamo proporre qualche facile slogan, ma ascolto, studio e azione concreta. 
È con questo spirito che lunedì 6 e martedì 7 giugno saremo a Palermo con @GiuseppeConteIT con un'edizione speciale delle #10lezionidipolitica https://t.co/7Xi3PhqI4Y",2022-06-03 18:42:21,"Twitter Web App",137,53,"x1519695252529065985","ScuolaM5S","ScuoladiFormazioneM5S",737,2,29,"","Alziamo il livello delle nostre competenze e delle nostre idee per cambiare il futuro.
Partecipa al laboratorio politico M5S per cambiare l’Italia e l’Europa.",FALSE,,,,,,,"NA NA","NA NA","NA NA NA NA NA NA NA NA","https://twitter.com/mariaederaM5S/status/1532974286318755840","Maria Edera Spadoni","Reggio nell'Emilia","Vicepresidente M5S Camera dei Deputati. “Se cambiamo strada rispetto a quella seguita da tutti rischiamo di perderci ma vale la pena provare a vedere oltre”.","https://t.co/EFgZ4ksifq",FALSE,14574,513,105,6590,5718,2013-04-24 10:43:51,TRUE,"https://t.co/EFgZ4ksifq","https://www.mariaederaspadoni.it/",,"https://pbs.twimg.com/profile_banners/1376730776/1606387274","http://abs.twimg.com/images/themes/theme19/bg.gif","http://pbs.twimg.com/profile_images/1471479324071149569/mEWcbSDL_normal.jpg"
"x337171830","x1533134296017522691",2022-06-04 17:11:15,"AngeloTofalo","Ricorre oggi il 189° anniversario della costituzione del Corpo #Sanitario dell'Esercito, parte integrante della logistica militare ed elemento centrale della nostra organizzazione, perché assicura l’efficienza e l’efficacia della principale risorsa a disposizione, quella umana. https://t.co/xkW4wfJrzi","Twitter for iPhone",140,,,,FALSE,TRUE,0,9,,,"Sanitario",,,,,,,,,,,,,"x437337751","Esercito","it",,,,,,,,,,,,,,,,"x1533064713159987200","Ricorre oggi il 189° anniversario della costituzione del Corpo #Sanitario dell'Esercito, parte integrante della logistica militare ed elemento centrale della nostra organizzazione, perché assicura l’efficienza e l’efficacia della principale risorsa a disposizione, quella umana. https://t.co/xkW4wfJrzi",2022-06-04 12:34:45,"Twitter for iPhone",46,9,"x437337751","Esercito","Esercito Italiano",110658,344,15882,"Roma","L'Esercito Italiano, fondato nel 1861, è la componente più antica tra le Forze Armate italiane.",TRUE,,,,,,,"NA NA","NA NA","NA NA NA NA NA NA NA NA","https://twitter.com/AngeloTofalo/status/1533134296017522691","Angelo Tofalo","Salerno, Pellezzano, Campania","Ingegnere, deputato della Repubblica, già Sottosegretario di Stato alla Difesa 🇮🇹 Rapito dall’Intelligence per diffondere la cultura della Sicurezza","https://t.co/4xUgrx6rHJ",FALSE,37895,5052,355,38045,16636,2011-07-17 15:43:34,TRUE,"https://t.co/4xUgrx6rHJ","http://www.angelotofalo.com",,"https://pbs.twimg.com/profile_banners/337171830/1613207709","http://abs.twimg.com/images/themes/theme1/bg.png","http://pbs.twimg.com/profile_images/1531700079572156418/4FLS2BRF_normal.jpg"
"x337171830","x1533126556322865161",2022-06-04 16:40:29,"AngeloTofalo","#PreghiamoInsieme per i bambini rimasti orfani e che fuggono dalla guerra; per quelli che soffrono in tutto il mondo a causa della fame, della mancanza di cure, degli abusi e delle violenze; per quelli a cui è stato negato il diritto di nascere. Proteggiamo tutti i bambini!","Twitter for iPhone",140,,,,FALSE,TRUE,0,204,,,"PreghiamoInsieme",,,,,,,,,,,,,"x500711588","Pontifex_it","it",,,,,,,,,,,,,,,,"x1533048418108571651","#PreghiamoInsieme per i bambini rimasti orfani e che fuggono dalla guerra; per quelli che soffrono in tutto il mondo a causa della fame, della mancanza di cure, degli abusi e delle violenze; per quelli a cui è stato negato il diritto di nascere. Proteggiamo tutti i bambini!",2022-06-04 11:30:00,"TweetDeck",1901,204,"x500711588","Pontifex_it","Papa Francesco",5212780,8,3999,"Città del Vaticano","Benvenuti alla pagina Twitter ufficiale di Sua Santità Papa Francesco",TRUE,,,,,,,"NA NA","NA NA","NA NA NA NA NA NA NA NA","https://twitter.com/AngeloTofalo/status/1533126556322865161","Angelo Tofalo","Salerno, Pellezzano, Campania","Ingegnere, deputato della Repubblica, già Sottosegretario di Stato alla Difesa 🇮🇹 Rapito dall’Intelligence per diffondere la cultura della Sicurezza","https://t.co/4xUgrx6rHJ",FALSE,37895,5052,355,38045,16636,2011-07-17 15:43:34,TRUE,"https://t.co/4xUgrx6rHJ","http://www.angelotofalo.com",,"https://pbs.twimg.com/profile_banners/337171830/1613207709","http://abs.twimg.com/images/themes/theme1/bg.png","http://pbs.twimg.com/profile_images/1531700079572156418/4FLS2BRF_normal.jpg"
"x636328779","x1533132147946569729",2022-06-04 17:02:42,"AlexBazzaro","@forzaitaliota @borghi_claudio @n3ur0n3 @Mick_692 @CiccioIlBrillo @manuel_moschini @Birobiro72 @Guglielmo_Totti @Gigadesires Ho letto la discussione. Quando si arriva a dire che l’alternativa a Mattarella era Casini, che si è ritirato dopo 4 minuti temendo vi fosse anche solo il dubbio, significa non aver capito. M. aveva già vinto alla prima votazione. Giusto per citare uno degli errori da Lei scritti","Twitter for iPhone",280,"x1533051805126561796","x1371831023021998084","forzaitaliota",FALSE,FALSE,0,0,,,,,,,,,,,,,,,,"x1371831023021998084 x337767301 x761548420192538625 x1461608078701379585 x424962086 x1068233784351444992 x568511477 x860157576364863488 x792731002900709376","forzaitaliota borghi_claudio n3ur0n3 Mick_692 CiccioIlBrillo manuel_moschini Birobiro72 Guglielmo_Totti Gigadesires","it",,,,,,,,,,,,,,,,,,,,,,,,,,,,,,,,,,,,,"NA NA","NA NA","NA NA NA NA NA NA NA NA","https://twitter.com/AlexBazzaro/status/1533132147946569729","Alex Bazzaro","Venezia ","🇮🇹Deputato Lega, Commissione XIV  🦁Consigliere Comunale Venezia. ✈️ Delegazione @OSCE Liberale e libertario","https://t.co/yXFTMiY4b3",FALSE,6044,516,51,16033,12398,2012-07-15 15:20:42,TRUE,"https://t.co/yXFTMiY4b3","https://www.camera.it/leg18/29?shadow_deputato=307696&idpersona=307696&idlegislatura=18",,"https://pbs.twimg.com/profile_banners/636328779/1646324685","http://abs.twimg.com/images/themes/theme1/bg.png","http://pbs.twimg.com/profile_images/1499374659665645573/f2Yd2Tdd_normal.jpg"
"x636328779","x1533115938685468673",2022-06-04 15:58:18,"AlexBazzaro","Anniversario di #Tienanmen per ricordare al mondo le mostruosità della #Cina comunista. Orrori ripetuti contro gli stessi cinesi ogni giorno ad #HongKong e che potrebbero ripetersi contro la democratica e liberale #taiwan 
Non esistono dittature buone. https://t.co/xvyzT2W9FL","Twitter for iPhone",252,,,,FALSE,FALSE,11,4,,,"Tienanmen Cina HongKong taiwan",,,,,"http://pbs.twimg.com/media/FUa40geWIAAfmqU.jpg","https://t.co/xvyzT2W9FL","https://twitter.com/AlexBazzaro/status/1533115938685468673/photo/1","photo","http://pbs.twimg.com/media/FUa40geWIAAfmqU.jpg","https://t.co/xvyzT2W9FL","https://twitter.com/AlexBazzaro/status/1533115938685468673/photo/1",,,,"it",,,,,,,,,,,,,,,,,,,,,,,,,,,,,,,,,,,,,"NA NA","NA NA","NA NA NA NA NA NA NA NA","https://twitter.com/AlexBazzaro/status/1533115938685468673","Alex Bazzaro","Venezia ","🇮🇹Deputato Lega, Commissione XIV  🦁Consigliere Comunale Venezia. ✈️ Delegazione @OSCE Liberale e libertario","https://t.co/yXFTMiY4b3",FALSE,6044,516,51,16033,12398,2012-07-15 15:20:42,TRUE,"https://t.co/yXFTMiY4b3","https://www.camera.it/leg18/29?shadow_deputato=307696&idpersona=307696&idlegislatura=18",,"https://pbs.twimg.com/profile_banners/636328779/1646324685","http://abs.twimg.com/images/themes/theme1/bg.png","http://pbs.twimg.com/profile_images/1499374659665645573/f2Yd2Tdd_normal.jpg"
