"x605614784","x1477592660395311105",2022-01-02 10:48:37,"ElioLannutti","Sudafrica, a fuoco la sede ottocentesca del Parlamento: fiamme e fumo si levano dall’edificio principale: le immagini del rogo https://t.co/n6yI9YDGje via @fattoquotidiano","Twitter for iPhone",171,,,,FALSE,FALSE,0,0,,,,,"ilfattoquotidiano.it/2022/01/02/sud…","https://t.co/n6yI9YDGje","https://www.ilfattoquotidiano.it/2022/01/02/sudafrica-a-fuoco-la-sede-ottocentesca-del-parlamento-fiamme-e-fumo-si-levano-dalledificio-principale-le-immagini-del-rogo/6443053/",,,,,,,,,"x52424550","fattoquotidiano","it",,,,,,,,,,,,,,,,,,,,,,,,,,,,,,,,,,,,,"NA NA","NA NA","NA NA NA NA NA NA NA NA","https://twitter.com/ElioLannutti/status/1477592660395311105","Elio Lannutti","Roma, Lazio","Giornalista, scrittore, ex portavoce M5S Senato, 6^ Commissione Finanze; Antimafia; Commissione inchiesta banche","https://t.co/dM8TNmvnzl",FALSE,26379,3698,177,134392,51236,2012-06-11 17:58:09,FALSE,"https://t.co/dM8TNmvnzl","http://www.eliolannutti.it",,,"http://abs.twimg.com/images/themes/theme1/bg.png","http://pbs.twimg.com/profile_images/2746500033/8d046e016842a92a39f853fbfd0e1bc0_normal.png"
"x605614784","x1477592596784594946",2022-01-02 10:48:22,"ElioLannutti","Clima, nel 2021 in Italia 187 eventi estremi e 9 morti: Roma la città più colpita, Sicilia e Lombardia primeggiano tra le regioni https://t.co/4lNrpcTGsY via @fattoquotidiano","Twitter for iPhone",174,,,,FALSE,FALSE,8,8,,,,,"ilfattoquotidiano.it/2021/12/29/cli…","https://t.co/4lNrpcTGsY","https://www.ilfattoquotidiano.it/2021/12/29/clima-nel-2021-in-italia-187-eventi-estremi-e-9-morti-roma-la-citta-piu-colpita-sicilia-e-lombardia-primeggiano-tra-le-regioni/6440154/",,,,,,,,,"x52424550","fattoquotidiano","it",,,,,,,,,,,,,,,,,,,,,,,,,,,,,,,,,,,,,"NA NA","NA NA","NA NA NA NA NA NA NA NA","https://twitter.com/ElioLannutti/status/1477592596784594946","Elio Lannutti","Roma, Lazio","Giornalista, scrittore, ex portavoce M5S Senato, 6^ Commissione Finanze; Antimafia; Commissione inchiesta banche","https://t.co/dM8TNmvnzl",FALSE,26379,3698,177,134392,51236,2012-06-11 17:58:09,FALSE,"https://t.co/dM8TNmvnzl","http://www.eliolannutti.it",,,"http://abs.twimg.com/images/themes/theme1/bg.png","http://pbs.twimg.com/profile_images/2746500033/8d046e016842a92a39f853fbfd0e1bc0_normal.png"
"x605614784","x1477592463468605442",2022-01-02 10:47:50,"ElioLannutti","Clima impazzito: caldo sulle Alpi e in Alaska, neve record in California. “Sono i 2 lati della stessa medaglia. E’ il surriscaldamento globale e si sta intensificando” https://t.co/3NJGwZ8ou8 via @fattoquotidiano","Twitter for iPhone",212,,,,FALSE,FALSE,2,1,,,,,"ilfattoquotidiano.it/2022/01/02/cli…","https://t.co/3NJGwZ8ou8","https://www.ilfattoquotidiano.it/2022/01/02/clima-impazzito-caldo-sulle-alpi-e-in-alaska-neve-record-in-california-sono-i-2-lati-della-stessa-medaglia-e-il-surriscaldamento-globale-e-si-sta-intensificando/6442164/",,,,,,,,,"x52424550","fattoquotidiano","it",,,,,,,,,,,,,,,,,,,,,,,,,,,,,,,,,,,,,"NA NA","NA NA","NA NA NA NA NA NA NA NA","https://twitter.com/ElioLannutti/status/1477592463468605442","Elio Lannutti","Roma, Lazio","Giornalista, scrittore, ex portavoce M5S Senato, 6^ Commissione Finanze; Antimafia; Commissione inchiesta banche","https://t.co/dM8TNmvnzl",FALSE,26379,3698,177,134392,51236,2012-06-11 17:58:09,FALSE,"https://t.co/dM8TNmvnzl","http://www.eliolannutti.it",,,"http://abs.twimg.com/images/themes/theme1/bg.png","http://pbs.twimg.com/profile_images/2746500033/8d046e016842a92a39f853fbfd0e1bc0_normal.png"
"x605614784","x1477569188692639744",2022-01-02 09:15:21,"ElioLannutti","Oltre 1.200 euro a famiglia di stangate già scattate, ma Draghi e Cingolani si trastullano lavorando alacremente per il ritorno al nucleare,bocciato sonoramente da un referendum popolare. Ma loro del popolo se ne infischiano, assecondando Confindustria che esige altri soldi.
FQ https://t.co/FEcBR5LwdE","Twitter for iPhone",278,,,,FALSE,FALSE,122,73,,,,,,,,"http://pbs.twimg.com/media/FIFhWBMWUAgB4n-.jpg","https://t.co/FEcBR5LwdE","https://twitter.com/ElioLannutti/status/1477569188692639744/photo/1","photo","http://pbs.twimg.com/media/FIFhWBMWUAgB4n-.jpg","https://t.co/FEcBR5LwdE","https://twitter.com/ElioLannutti/status/1477569188692639744/photo/1",,,,"it",,,,,,,,,,,,,,,,,,,,,,,,,,,,,,,,,,,,,"NA NA","NA NA","NA NA NA NA NA NA NA NA","https://twitter.com/ElioLannutti/status/1477569188692639744","Elio Lannutti","Roma, Lazio","Giornalista, scrittore, ex portavoce M5S Senato, 6^ Commissione Finanze; Antimafia; Commissione inchiesta banche","https://t.co/dM8TNmvnzl",FALSE,26379,3698,177,134392,51236,2012-06-11 17:58:09,FALSE,"https://t.co/dM8TNmvnzl","http://www.eliolannutti.it",,,"http://abs.twimg.com/images/themes/theme1/bg.png","http://pbs.twimg.com/profile_images/2746500033/8d046e016842a92a39f853fbfd0e1bc0_normal.png"
"x605614784","x1477564440430194690",2022-01-02 08:56:29,"ElioLannutti","Dal Lazio alla Lombardia, l’inizio anno parte col piede sbagliato.Da lunedì vanno in giallo assieme a Piemonte e Sicilia. E l’Istituto superiore della sanità lancia l’allarme: “L’incidenza è raddoppiata”. In che mani siamo,oltre gli apprendisti stregoni 
https://t.co/m69aRyujFm","Twitter Web App",278,,,,FALSE,FALSE,25,15,,,,,"lanotiziagiornale.it/linizio-anno-p…","https://t.co/m69aRyujFm","https://www.lanotiziagiornale.it/linizio-anno-parte-col-piede-sbagliato/",,,,,,,,,,,"it",,,,,,,,,,,,,,,,,,,,,,,,,,,,,,,,,,,,,"NA NA","NA NA","NA NA NA NA NA NA NA NA","https://twitter.com/ElioLannutti/status/1477564440430194690","Elio Lannutti","Roma, Lazio","Giornalista, scrittore, ex portavoce M5S Senato, 6^ Commissione Finanze; Antimafia; Commissione inchiesta banche","https://t.co/dM8TNmvnzl",FALSE,26379,3698,177,134392,51236,2012-06-11 17:58:09,FALSE,"https://t.co/dM8TNmvnzl","http://www.eliolannutti.it",,,"http://abs.twimg.com/images/themes/theme1/bg.png","http://pbs.twimg.com/profile_images/2746500033/8d046e016842a92a39f853fbfd0e1bc0_normal.png"
"x605614784","x1477554710278193154",2022-01-02 08:17:49,"ElioLannutti","Vent'anni di euro: più luci che ombre. Per i cittadini ed i consumatori spennati, che hanno subito rincari speculativi da changeover, con consistente perdita del potere di acquisto, le ombre son più delle luci https://t.co/9m8hiKfnMq via @ilgiornale","Twitter for iPhone",249,,,,FALSE,FALSE,17,9,,,,,"ilgiornale.it/news/cronache/…","https://t.co/9m8hiKfnMq","https://www.ilgiornale.it/news/cronache/ventanni-euro-pi-luci-che-ombre-1999369.html",,,,,,,,,"x25508589","ilgiornale","it",,,,,,,,,,,,,,,,,,,,,,,,,,,,,,,,,,,,,"NA NA","NA NA","NA NA NA NA NA NA NA NA","https://twitter.com/ElioLannutti/status/1477554710278193154","Elio Lannutti","Roma, Lazio","Giornalista, scrittore, ex portavoce M5S Senato, 6^ Commissione Finanze; Antimafia; Commissione inchiesta banche","https://t.co/dM8TNmvnzl",FALSE,26379,3698,177,134392,51236,2012-06-11 17:58:09,FALSE,"https://t.co/dM8TNmvnzl","http://www.eliolannutti.it",,,"http://abs.twimg.com/images/themes/theme1/bg.png","http://pbs.twimg.com/profile_images/2746500033/8d046e016842a92a39f853fbfd0e1bc0_normal.png"
"x605614784","x1477552644428341249",2022-01-02 08:09:36,"ElioLannutti","Myanmar, i golpisti fanno terra bruciata: nelle foto satellitari l'orrore dei roghi nei villaggi https://t.co/Z15z3iFrNF via @repubblica","Twitter for iPhone",136,,,,FALSE,FALSE,2,0,,,,,"repubblica.it/esteri/2022/01…","https://t.co/Z15z3iFrNF","https://www.repubblica.it/esteri/2022/01/02/news/myanmar_golpisti_strage_bambini_ribelli-332349053/?__vfz=medium%3Dsharebar",,,,,,,,,"x18935802","repubblica","it",,,,,,,,,,,,,,,,,,,,,,,,,,,,,,,,,,,,,"NA NA","NA NA","NA NA NA NA NA NA NA NA","https://twitter.com/ElioLannutti/status/1477552644428341249","Elio Lannutti","Roma, Lazio","Giornalista, scrittore, ex portavoce M5S Senato, 6^ Commissione Finanze; Antimafia; Commissione inchiesta banche","https://t.co/dM8TNmvnzl",FALSE,26379,3698,177,134392,51236,2012-06-11 17:58:09,FALSE,"https://t.co/dM8TNmvnzl","http://www.eliolannutti.it",,,"http://abs.twimg.com/images/themes/theme1/bg.png","http://pbs.twimg.com/profile_images/2746500033/8d046e016842a92a39f853fbfd0e1bc0_normal.png"
"x605614784","x1477552550421409792",2022-01-02 08:09:14,"ElioLannutti","Colorado, tre persone disperse dopo gli incendi e le nevicate
 https://t.co/CbvbdFNsy6","Twitter for iPhone",86,,,,FALSE,FALSE,1,1,,,,,"tgcom24.mediaset.it/mondo/colorado…","https://t.co/CbvbdFNsy6","https://www.tgcom24.mediaset.it/mondo/colorado-tre-persone-disperse-dopo-gli-incendi-e-le-nevicate_43886752-202202k.shtml",,,,,,,,,,,"it",,,,,,,,,,,,,,,,,,,,,,,,,,,,,,,,,,,,,"NA NA","NA NA","NA NA NA NA NA NA NA NA","https://twitter.com/ElioLannutti/status/1477552550421409792","Elio Lannutti","Roma, Lazio","Giornalista, scrittore, ex portavoce M5S Senato, 6^ Commissione Finanze; Antimafia; Commissione inchiesta banche","https://t.co/dM8TNmvnzl",FALSE,26379,3698,177,134392,51236,2012-06-11 17:58:09,FALSE,"https://t.co/dM8TNmvnzl","http://www.eliolannutti.it",,,"http://abs.twimg.com/images/themes/theme1/bg.png","http://pbs.twimg.com/profile_images/2746500033/8d046e016842a92a39f853fbfd0e1bc0_normal.png"
"x919526072","x1477772032205074445",2022-01-02 22:41:22,"LucioMalan","Sono riusciti a rovinare anche quel minimo di serenità delle feste, ma non l' hanno fatto apposta noooooo, solo per sfiancare psicologicamente le persone.","Twitter for iPhone",140,,,,FALSE,TRUE,0,20,,,,,,,,,,,,,,,,"x1245445880540467203","paolobura1","it",,,,,,,,,,,,,,,,"x1477737278801862657","Sono riusciti a rovinare anche quel minimo di serenità delle feste, ma non l' hanno fatto apposta noooooo, solo per sfiancare psicologicamente le persone.",2022-01-02 20:23:16,"Twitter for Android",79,20,"x1245445880540467203","paolobura1","paolobura",337,442,26114,"Lombardia, Italia","",FALSE,,,,,,,"NA NA","NA NA","NA NA NA NA NA NA NA NA","https://twitter.com/LucioMalan/status/1477772032205074445","Lucio Malan","Italia","Senatore Fratelli d'Italia. “Chi è disposto a perdere libertà fondamentale in cambio di temporanea sicurezza, non merita, e non avrà, né libertà né sicurezza.”","https://t.co/KZCpB50DyP",FALSE,16945,3636,130,34479,9888,2012-11-01 17:48:51,FALSE,"https://t.co/KZCpB50DyP","http://www.luciomalan.it",,"https://pbs.twimg.com/profile_banners/919526072/1636186892","http://abs.twimg.com/images/themes/theme1/bg.png","http://pbs.twimg.com/profile_images/1456899523222069249/i60vvKs__normal.jpg"
"x919526072","x1477767869027041281",2022-01-02 22:24:50,"LucioMalan","#ObbligoVaccinale per un farmaco che dopo tre mesi ha #efficacianegativa? Domani vediamo di cosa si tratta","Twitter for iPhone",106,,,,FALSE,FALSE,1194,267,,,"ObbligoVaccinale efficacianegativa",,,,,,,,,,,,,,,"it",,,,,,,,,,,,,,,,,,,,,,,,,,,,,,,,,,,,,"NA NA","NA NA","NA NA NA NA NA NA NA NA","https://twitter.com/LucioMalan/status/1477767869027041281","Lucio Malan","Italia","Senatore Fratelli d'Italia. “Chi è disposto a perdere libertà fondamentale in cambio di temporanea sicurezza, non merita, e non avrà, né libertà né sicurezza.”","https://t.co/KZCpB50DyP",FALSE,16945,3636,130,34479,9888,2012-11-01 17:48:51,FALSE,"https://t.co/KZCpB50DyP","http://www.luciomalan.it",,"https://pbs.twimg.com/profile_banners/919526072/1636186892","http://abs.twimg.com/images/themes/theme1/bg.png","http://pbs.twimg.com/profile_images/1456899523222069249/i60vvKs__normal.jpg"
"x919526072","x1477742670583943172",2022-01-02 20:44:42,"LucioMalan","La realtà è che si fa osservazione passiva, quindi viene segnalato un caso ogni cento…. https://t.co/7Fi02f73e4","Twitter for iPhone",104,,,,FALSE,TRUE,0,48,,,,,,,,,,,,,,,,"x862970692958138368","Pietro_Otto","it",,,,,,,,,,,,,,,,"x1477719633872490498","La realtà è che si fa osservazione passiva, quindi viene segnalato un caso ogni cento…. https://t.co/7Fi02f73e4",2022-01-02 19:13:10,"Twitter for iPhone",70,48,"x862970692958138368","Pietro_Otto","Pietro",4202,2221,89132,"Legnano, Lombardia","Continua a non arrenderti, i tuoi giorni migliori sono davanti a te.",FALSE,,,,,,,"NA NA","NA NA","NA NA NA NA NA NA NA NA","https://twitter.com/LucioMalan/status/1477742670583943172","Lucio Malan","Italia","Senatore Fratelli d'Italia. “Chi è disposto a perdere libertà fondamentale in cambio di temporanea sicurezza, non merita, e non avrà, né libertà né sicurezza.”","https://t.co/KZCpB50DyP",FALSE,16945,3636,130,34479,9888,2012-11-01 17:48:51,FALSE,"https://t.co/KZCpB50DyP","http://www.luciomalan.it",,"https://pbs.twimg.com/profile_banners/919526072/1636186892","http://abs.twimg.com/images/themes/theme1/bg.png","http://pbs.twimg.com/profile_images/1456899523222069249/i60vvKs__normal.jpg"
"x919526072","x1477742606914367492",2022-01-02 20:44:27,"LucioMalan","@jimmomo @Yi_Benevolence obbligo di un vaccino che non funziona nemmeno tra le persone in lockdown al Polo Sud? il primo vac coronavirus al mondo che ha 1 anno di Storia? che ha creato in 1 anno 20 volte gli effetti avversi del farmaco più segnalato cumulati in 54 anni?
Ma qui siamo alla follia!","Twitter for iPhone",140,,,,FALSE,TRUE,0,41,,,,,,,,,,,,,,,,"x1043948268932214786 x11170692 x585968039","Ussignur_ jimmomo Yi_Benevolence","it",,,,,,,,,,,,,,,,"x1477736377592725508","@jimmomo @Yi_Benevolence obbligo di un vaccino che non funziona nemmeno tra le persone in lockdown al Polo Sud? il primo vac coronavirus al mondo che ha 1 anno di Storia? che ha creato in 1 anno 20 volte gli effetti avversi del farmaco più segnalato cumulati in 54 anni?
Ma qui siamo alla follia!",2022-01-02 20:19:42,"Twitter Web App",117,41,"x1043948268932214786","Ussignur_","Ussi (matematica e proporzioni sono tue amiche!)",3499,323,49776,"Borgo Eretici,Fortezza Galileo","Uomo.
Focus ipnotico: esiste solo C19!
Morte e danni son poca cosa rispetto al nobile scopo: sconfiggerlo!
Il resto non conta.
Credere, obbedire, vaccinarsi!",FALSE,,,,,,,"NA NA","NA NA","NA NA NA NA NA NA NA NA","https://twitter.com/LucioMalan/status/1477742606914367492","Lucio Malan","Italia","Senatore Fratelli d'Italia. “Chi è disposto a perdere libertà fondamentale in cambio di temporanea sicurezza, non merita, e non avrà, né libertà né sicurezza.”","https://t.co/KZCpB50DyP",FALSE,16945,3636,130,34479,9888,2012-11-01 17:48:51,FALSE,"https://t.co/KZCpB50DyP","http://www.luciomalan.it",,"https://pbs.twimg.com/profile_banners/919526072/1636186892","http://abs.twimg.com/images/themes/theme1/bg.png","http://pbs.twimg.com/profile_images/1456899523222069249/i60vvKs__normal.jpg"
"x919526072","x1477742435786760195",2022-01-02 20:43:46,"LucioMalan","Freccero-Cacciari: NUOVE MISURE INACCETTABILI IN UN SISTEMA DEMOCRATICO L’irrigidimento delle restrizioni per i non vaccinati “non ha nulla a che vedere con il contrasto all’epidemia” ma “si sostanzia in una discriminazione in violazione della Costituzione”https://t.co/frjngZ5nKD","Twitter for iPhone",140,,,,FALSE,TRUE,0,391,,,,,,,,,,,,,,,,"x422152255","GuidoDeMartini","it",,,,,,,,,,,,,,,,"x1477653934118510592","Freccero-Cacciari: NUOVE MISURE INACCETTABILI IN UN SISTEMA DEMOCRATICO L’irrigidimento delle restrizioni per i non vaccinati “non ha nulla a che vedere con il contrasto all’epidemia” ma “si sostanzia in una discriminazione in violazione della Costituzione”https://t.co/frjngZ5nKD",2022-01-02 14:52:06,"Twitter for iPhone",933,391,"x422152255","GuidoDeMartini","Guido De Martini",6815,164,6130,"","Deputato Lega Salvini Premier eletto in Sardegna 🇮🇹 NO UNIONE EUROPEA-NO EURO 🇮🇹                                        Medico chirurgo specialista oculista",TRUE,,,,,,,"NA NA","NA NA","NA NA NA NA NA NA NA NA","https://twitter.com/LucioMalan/status/1477742435786760195","Lucio Malan","Italia","Senatore Fratelli d'Italia. “Chi è disposto a perdere libertà fondamentale in cambio di temporanea sicurezza, non merita, e non avrà, né libertà né sicurezza.”","https://t.co/KZCpB50DyP",FALSE,16945,3636,130,34479,9888,2012-11-01 17:48:51,FALSE,"https://t.co/KZCpB50DyP","http://www.luciomalan.it",,"https://pbs.twimg.com/profile_banners/919526072/1636186892","http://abs.twimg.com/images/themes/theme1/bg.png","http://pbs.twimg.com/profile_images/1456899523222069249/i60vvKs__normal.jpg"
"x919526072","x1477736704874364928",2022-01-02 20:21:00,"LucioMalan","Cluster registrato in Antartide tra i ricercatori. 
Il Covid ha bucato tutte le misure possibili da adottare quali cicli vaccinali completi, tamponi, quarantene preventive.
Il silenzio dei virologi non è degli innocenti.🤓","Twitter for iPhone",140,,,,FALSE,TRUE,0,46,,,,,,,,,,,,,,,,"x1263019585898512384","Budicca3","it",,,,,,,,,,,,,,,,"x1477734525920759808","Cluster registrato in Antartide tra i ricercatori. 
Il Covid ha bucato tutte le misure possibili da adottare quali cicli vaccinali completi, tamponi, quarantene preventive.
Il silenzio dei virologi non è degli innocenti.🤓",2022-01-02 20:12:20,"Twitter for iPad",144,46,"x1263019585898512384","Budicca3","Budicca",1146,1203,4322,"","",FALSE,,,,,,,"NA NA","NA NA","NA NA NA NA NA NA NA NA","https://twitter.com/LucioMalan/status/1477736704874364928","Lucio Malan","Italia","Senatore Fratelli d'Italia. “Chi è disposto a perdere libertà fondamentale in cambio di temporanea sicurezza, non merita, e non avrà, né libertà né sicurezza.”","https://t.co/KZCpB50DyP",FALSE,16945,3636,130,34479,9888,2012-11-01 17:48:51,FALSE,"https://t.co/KZCpB50DyP","http://www.luciomalan.it",,"https://pbs.twimg.com/profile_banners/919526072/1636186892","http://abs.twimg.com/images/themes/theme1/bg.png","http://pbs.twimg.com/profile_images/1456899523222069249/i60vvKs__normal.jpg"
"x919526072","x1477724904539705345",2022-01-02 19:34:06,"LucioMalan","@dietrolapolitic @janavel7 Di cui però la maggioranza sono vaccinati. https://t.co/4hxFvsJ1fU","Twitter for iPhone",42,"x1477557416380317699","x1147012447288602624","dietrolapolitic",FALSE,FALSE,0,0,,,,,,,,"http://pbs.twimg.com/media/FIHu931WQA08dg1.jpg","https://t.co/4hxFvsJ1fU","https://twitter.com/LucioMalan/status/1477724904539705345/photo/1","photo","http://pbs.twimg.com/media/FIHu931WQA08dg1.jpg","https://t.co/4hxFvsJ1fU","https://twitter.com/LucioMalan/status/1477724904539705345/photo/1",,"x1147012447288602624 x2204706469","dietrolapolitic janavel7","it",,,,,,,,,,,,,,,,,,,,,,,,,,,,,,,,,,,,,"NA NA","NA NA","NA NA NA NA NA NA NA NA","https://twitter.com/LucioMalan/status/1477724904539705345","Lucio Malan","Italia","Senatore Fratelli d'Italia. “Chi è disposto a perdere libertà fondamentale in cambio di temporanea sicurezza, non merita, e non avrà, né libertà né sicurezza.”","https://t.co/KZCpB50DyP",FALSE,16945,3636,130,34479,9888,2012-11-01 17:48:51,FALSE,"https://t.co/KZCpB50DyP","http://www.luciomalan.it",,"https://pbs.twimg.com/profile_banners/919526072/1636186892","http://abs.twimg.com/images/themes/theme1/bg.png","http://pbs.twimg.com/profile_images/1456899523222069249/i60vvKs__normal.jpg"
"x919526072","x1477722927583879168",2022-01-02 19:26:15,"LucioMalan","@paolovetriolo @janavel7 Lo dica a chi, in questi commenti annuncia felice la morte di 6 milioni di non vaccinati","Twitter for iPhone",88,"x1477646591741902853","x975944821","paolovetriolo",FALSE,FALSE,0,0,,,,,,,,,,,,,,,,"x975944821 x2204706469","paolovetriolo janavel7","it",,,,,,,,,,,,,,,,,,,,,,,,,,,,,,,,,,,,,"NA NA","NA NA","NA NA NA NA NA NA NA NA","https://twitter.com/LucioMalan/status/1477722927583879168","Lucio Malan","Italia","Senatore Fratelli d'Italia. “Chi è disposto a perdere libertà fondamentale in cambio di temporanea sicurezza, non merita, e non avrà, né libertà né sicurezza.”","https://t.co/KZCpB50DyP",FALSE,16945,3636,130,34479,9888,2012-11-01 17:48:51,FALSE,"https://t.co/KZCpB50DyP","http://www.luciomalan.it",,"https://pbs.twimg.com/profile_banners/919526072/1636186892","http://abs.twimg.com/images/themes/theme1/bg.png","http://pbs.twimg.com/profile_images/1456899523222069249/i60vvKs__normal.jpg"
"x919526072","x1477722578664017921",2022-01-02 19:24:52,"LucioMalan","@laura_ceruti @janavel7 I novax vaccinati, poi, non ne parliamo. A proposito: quante dosi ci vogliono oggi per non essere novax?","Twitter for iPhone",104,"x1477598973846249475","x318713537","laura_ceruti",FALSE,FALSE,0,0,,,,,,,,,,,,,,,,"x318713537 x2204706469","laura_ceruti janavel7","it",,,,,,,,,,,,,,,,,,,,,,,,,,,,,,,,,,,,,"NA NA","NA NA","NA NA NA NA NA NA NA NA","https://twitter.com/LucioMalan/status/1477722578664017921","Lucio Malan","Italia","Senatore Fratelli d'Italia. “Chi è disposto a perdere libertà fondamentale in cambio di temporanea sicurezza, non merita, e non avrà, né libertà né sicurezza.”","https://t.co/KZCpB50DyP",FALSE,16945,3636,130,34479,9888,2012-11-01 17:48:51,FALSE,"https://t.co/KZCpB50DyP","http://www.luciomalan.it",,"https://pbs.twimg.com/profile_banners/919526072/1636186892","http://abs.twimg.com/images/themes/theme1/bg.png","http://pbs.twimg.com/profile_images/1456899523222069249/i60vvKs__normal.jpg"
"x919526072","x1477722331032264705",2022-01-02 19:23:53,"LucioMalan","@sergioalesi @janavel7 Eh sì, lo ammetto: non sono un pozzo di scienza come lei","Twitter for iPhone",56,"x1477608853978157057","x2222783701","sergioalesi",FALSE,FALSE,0,0,,,,,,,,,,,,,,,,"x2222783701 x2204706469","sergioalesi janavel7","it",,,,,,,,,,,,,,,,,,,,,,,,,,,,,,,,,,,,,"NA NA","NA NA","NA NA NA NA NA NA NA NA","https://twitter.com/LucioMalan/status/1477722331032264705","Lucio Malan","Italia","Senatore Fratelli d'Italia. “Chi è disposto a perdere libertà fondamentale in cambio di temporanea sicurezza, non merita, e non avrà, né libertà né sicurezza.”","https://t.co/KZCpB50DyP",FALSE,16945,3636,130,34479,9888,2012-11-01 17:48:51,FALSE,"https://t.co/KZCpB50DyP","http://www.luciomalan.it",,"https://pbs.twimg.com/profile_banners/919526072/1636186892","http://abs.twimg.com/images/themes/theme1/bg.png","http://pbs.twimg.com/profile_images/1456899523222069249/i60vvKs__normal.jpg"
"x919526072","x1477722168591007758",2022-01-02 19:23:14,"LucioMalan","@janavel7 Sì, e mi hanno anche insegnato che quando si danno dei numeri (56 volte ecc.) bisognerebbe dimostrarli. E spiegare perché sono diversissimi da altri paesi","Twitter for iPhone",154,"x1477565337008844800","x2204706469","janavel7",FALSE,FALSE,0,0,,,,,,,,,,,,,,,,"x2204706469","janavel7","it",,,,,,,,,,,,,,,,,,,,,,,,,,,,,,,,,,,,,"NA NA","NA NA","NA NA NA NA NA NA NA NA","https://twitter.com/LucioMalan/status/1477722168591007758","Lucio Malan","Italia","Senatore Fratelli d'Italia. “Chi è disposto a perdere libertà fondamentale in cambio di temporanea sicurezza, non merita, e non avrà, né libertà né sicurezza.”","https://t.co/KZCpB50DyP",FALSE,16945,3636,130,34479,9888,2012-11-01 17:48:51,FALSE,"https://t.co/KZCpB50DyP","http://www.luciomalan.it",,"https://pbs.twimg.com/profile_banners/919526072/1636186892","http://abs.twimg.com/images/themes/theme1/bg.png","http://pbs.twimg.com/profile_images/1456899523222069249/i60vvKs__normal.jpg"
"x919526072","x1477721416200081408",2022-01-02 19:20:15,"LucioMalan","@janavel7 @DavideCelli1 Un tantino razzista come commento.","Twitter for iPhone",34,"x1477592202675109891","x2204706469","janavel7",FALSE,FALSE,1,0,,,,,,,,,,,,,,,,"x2204706469 x965956884","janavel7 DavideCelli1","it",,,,,,,,,,,,,,,,,,,,,,,,,,,,,,,,,,,,,"NA NA","NA NA","NA NA NA NA NA NA NA NA","https://twitter.com/LucioMalan/status/1477721416200081408","Lucio Malan","Italia","Senatore Fratelli d'Italia. “Chi è disposto a perdere libertà fondamentale in cambio di temporanea sicurezza, non merita, e non avrà, né libertà né sicurezza.”","https://t.co/KZCpB50DyP",FALSE,16945,3636,130,34479,9888,2012-11-01 17:48:51,FALSE,"https://t.co/KZCpB50DyP","http://www.luciomalan.it",,"https://pbs.twimg.com/profile_banners/919526072/1636186892","http://abs.twimg.com/images/themes/theme1/bg.png","http://pbs.twimg.com/profile_images/1456899523222069249/i60vvKs__normal.jpg"
"x919526072","x1477721206002442253",2022-01-02 19:19:24,"LucioMalan","@emilnaca @janavel7 Il suo senso di umanità è toccante. È evidente che lei è uno di quelli che si è vaccinato per altruismo e solidarietà","Twitter for iPhone",117,"x1477595990727266305","x899443068","emilnaca",FALSE,FALSE,0,0,,,,,,,,,,,,,,,,"x899443068 x2204706469","emilnaca janavel7","it",,,,,,,,,,,,,,,,,,,,,,,,,,,,,,,,,,,,,"NA NA","NA NA","NA NA NA NA NA NA NA NA","https://twitter.com/LucioMalan/status/1477721206002442253","Lucio Malan","Italia","Senatore Fratelli d'Italia. “Chi è disposto a perdere libertà fondamentale in cambio di temporanea sicurezza, non merita, e non avrà, né libertà né sicurezza.”","https://t.co/KZCpB50DyP",FALSE,16945,3636,130,34479,9888,2012-11-01 17:48:51,FALSE,"https://t.co/KZCpB50DyP","http://www.luciomalan.it",,"https://pbs.twimg.com/profile_banners/919526072/1636186892","http://abs.twimg.com/images/themes/theme1/bg.png","http://pbs.twimg.com/profile_images/1456899523222069249/i60vvKs__normal.jpg"
