"x1376730776","x1500763699266654208",2022-03-07 09:22:03,"mariaederaM5S","We must rethink our relationship with nature as well as our inter-human relations.

This #InternationalWomensDay, stand up for gender equality and climate justice!

https://t.co/gQaUmBPXnI #IWD22 https://t.co/mmAbIil3P6","Twitter Web App",139,,,,FALSE,TRUE,0,64,,,"InternationalWomensDay",,,,,,,,,,,,,"x20646711","UNESCO","en",,,,,,,,,,,,,,,,"x1500511217911279621","We must rethink our relationship with nature as well as our inter-human relations.

This #InternationalWomensDay, stand up for gender equality and climate justice!

https://t.co/gQaUmBPXnI #IWD22 https://t.co/mmAbIil3P6",2022-03-06 16:38:47,"Hootsuite Inc.",145,64,"x20646711","UNESCO","UNESCO 🏛️ #Education #Sciences #Culture 🇺🇳😷",3558197,2277,33067,"","Building peace where it starts - in the minds of men & women.
Official Twitter account of UNESCO.

#Education #Sciences #Culture #Communication #Information",TRUE,,,,,,,"NA NA","NA NA","NA NA NA NA NA NA NA NA","https://twitter.com/mariaederaM5S/status/1500763699266654208","Maria Edera Spadoni","Reggio nell'Emilia","Vicepresidente M5S Camera dei Deputati. “Se cambiamo strada rispetto a quella seguita da tutti rischiamo di perderci ma vale la pena provare a vedere oltre”.","https://t.co/EFgZ4ksifq",FALSE,14545,500,108,5898,4539,2013-04-24 10:43:51,TRUE,"https://t.co/EFgZ4ksifq","https://www.mariaederaspadoni.it/",,"https://pbs.twimg.com/profile_banners/1376730776/1606387274","http://abs.twimg.com/images/themes/theme19/bg.gif","http://pbs.twimg.com/profile_images/1471479324071149569/mEWcbSDL_normal.jpg"
"x1376730776","x1500763609680551938",2022-03-07 09:21:42,"mariaederaM5S","Il Presidente #Mattarella prende parte alla messa presso la basilica di Santa Sofia, chiesa #Ucraina a Roma https://t.co/sL9XzNmi4i","Twitter Web App",140,,,,FALSE,TRUE,0,642,,,"Mattarella Ucraina",,,,,,,,,,,,,"x732819391","Quirinale","it",,,,,,,,,,,,,,,,"x1500408235668512771","Il Presidente #Mattarella prende parte alla messa presso la basilica di Santa Sofia, chiesa #Ucraina a Roma https://t.co/sL9XzNmi4i",2022-03-06 09:49:34,"Twitter for iPhone",4364,642,"x732819391","Quirinale","Quirinale",762001,7,7207,"","Presidenza della Repubblica Italiana - Official Account",TRUE,,,,,,,"NA NA","NA NA","NA NA NA NA NA NA NA NA","https://twitter.com/mariaederaM5S/status/1500763609680551938","Maria Edera Spadoni","Reggio nell'Emilia","Vicepresidente M5S Camera dei Deputati. “Se cambiamo strada rispetto a quella seguita da tutti rischiamo di perderci ma vale la pena provare a vedere oltre”.","https://t.co/EFgZ4ksifq",FALSE,14545,500,108,5898,4539,2013-04-24 10:43:51,TRUE,"https://t.co/EFgZ4ksifq","https://www.mariaederaspadoni.it/",,"https://pbs.twimg.com/profile_banners/1376730776/1606387274","http://abs.twimg.com/images/themes/theme19/bg.gif","http://pbs.twimg.com/profile_images/1471479324071149569/mEWcbSDL_normal.jpg"
"x1376730776","x1500763410082025472",2022-03-07 09:20:54,"mariaederaM5S","Ahead of #IWD2022, learn about climate change activist @vanessa_vash's work and why it's so important to make space for the voices of women of African descent in #ClimateAction. 

🔗 https://t.co/wzhbYhxuNL https://t.co/uARLMnmxE1","Twitter Web App",140,,,,FALSE,TRUE,0,255,,,"IWD2022",,,,,,,,,,,,,"x17137628 x1134059457191776257","UN_Women vanessa_vash","en",,,,,,,,,,,,,,,,"x1500500212548345862","Ahead of #IWD2022, learn about climate change activist @vanessa_vash's work and why it's so important to make space for the voices of women of African descent in #ClimateAction. 

🔗 https://t.co/wzhbYhxuNL https://t.co/uARLMnmxE1",2022-03-06 15:55:03,"Hootsuite Inc.",705,255,"x17137628","UN_Women","UN Women",2134540,4337,66769,"Worldwide","UN Women is the United Nations entity for gender equality and women's empowerment.",TRUE,,,,,,,"NA NA","NA NA","NA NA NA NA NA NA NA NA","https://twitter.com/mariaederaM5S/status/1500763410082025472","Maria Edera Spadoni","Reggio nell'Emilia","Vicepresidente M5S Camera dei Deputati. “Se cambiamo strada rispetto a quella seguita da tutti rischiamo di perderci ma vale la pena provare a vedere oltre”.","https://t.co/EFgZ4ksifq",FALSE,14545,500,108,5898,4539,2013-04-24 10:43:51,TRUE,"https://t.co/EFgZ4ksifq","https://www.mariaederaspadoni.it/",,"https://pbs.twimg.com/profile_banners/1376730776/1606387274","http://abs.twimg.com/images/themes/theme19/bg.gif","http://pbs.twimg.com/profile_images/1471479324071149569/mEWcbSDL_normal.jpg"
"x1376730776","x1500743893637386243",2022-03-07 08:03:21,"mariaederaM5S","Martedì riapre il #Transatlantico; il corridoio adiacente all'Aula, usato durante l'emergenza Covid per ospitare le postazioni per il voto elettronico dei deputati, tornerà adesso alla sua funzione originaria. 

Scoprilo nel Tour visuale di https://t.co/grH6KBaogt
#OpenCamera https://t.co/iGTGDLmcdF","Twitter for iPhone",140,,,,FALSE,TRUE,0,8,,,"Transatlantico",,,,,,,,,,,,,"x2278995820","Montecitorio","it",,,,,,,,,,,,,,,,"x1500512782604775434","Martedì riapre il #Transatlantico; il corridoio adiacente all'Aula, usato durante l'emergenza Covid per ospitare le postazioni per il voto elettronico dei deputati, tornerà adesso alla sua funzione originaria. 

Scoprilo nel Tour visuale di https://t.co/grH6KBaogt
#OpenCamera https://t.co/iGTGDLmcdF",2022-03-06 16:45:00,"Twitter Web App",17,8,"x2278995820","Montecitorio","Camera dei deputati",353187,843,24784,"Roma, Italia","Account ufficiale della Camera dei deputati - La democrazia si fa qui - Netiquette: https://t.co/b7xiVxpnPH",TRUE,,,,,,,"NA NA","NA NA","NA NA NA NA NA NA NA NA","https://twitter.com/mariaederaM5S/status/1500743893637386243","Maria Edera Spadoni","Reggio nell'Emilia","Vicepresidente M5S Camera dei Deputati. “Se cambiamo strada rispetto a quella seguita da tutti rischiamo di perderci ma vale la pena provare a vedere oltre”.","https://t.co/EFgZ4ksifq",FALSE,14545,500,108,5898,4539,2013-04-24 10:43:51,TRUE,"https://t.co/EFgZ4ksifq","https://www.mariaederaspadoni.it/",,"https://pbs.twimg.com/profile_banners/1376730776/1606387274","http://abs.twimg.com/images/themes/theme19/bg.gif","http://pbs.twimg.com/profile_images/1471479324071149569/mEWcbSDL_normal.jpg"
"x337171830","x1500914131129536520",2022-03-07 19:19:49,"AngeloTofalo","Il 10/03 alle 18:30 avrò il piacere di parlare dell’importanza del #COPASIR con l’On. @federicadieni  Vicepresidente del Comitato, con l'On. @AngeloTofalo SE l’Amb @gionfavilli , il Gen. Ippoliti, l'Uff. Cav. @rasizza ceo @Openjobmetis spa  e il Dott. @MichelePavan95 
@uniLUM https://t.co/UY5vSIZEMV","Twitter for iPhone",140,,,,FALSE,TRUE,0,4,,,"COPASIR",,,,,,,,,,,,,"x100578253 x940100618","MarcoBacini federicadieni","it",,,,,,,,,,,,,,,,"x1500894786454237191","Il 10/03 alle 18:30 avrò il piacere di parlare dell’importanza del #COPASIR con l’On. @federicadieni  Vicepresidente del Comitato, con l'On. @AngeloTofalo SE l’Amb @gionfavilli , il Gen. Ippoliti, l'Uff. Cav. @rasizza ceo @Openjobmetis spa  e il Dott. @MichelePavan95 
@uniLUM https://t.co/UY5vSIZEMV",2022-03-07 18:02:57,"Twitter for iPhone",4,4,"x100578253","MarcoBacini","Marco Bacini",1834,185,3272,"Milano","Prof. Università LUM I Ceo MB Group I Business, Marketing & Communication consultant.        Autore del libro “La relazione e lo schermo”, Rubbettino Editore.",FALSE,,,,,,,"NA NA","NA NA","NA NA NA NA NA NA NA NA","https://twitter.com/AngeloTofalo/status/1500914131129536520","Angelo Tofalo","Salerno, Pellezzano, Campania","Ingegnere, deputato della Repubblica, già Sottosegretario di Stato alla Difesa 🇮🇹 Rapito dall’Intelligence per diffondere la cultura della Sicurezza","https://t.co/4xUgrx6rHJ",FALSE,37982,4995,359,37977,16734,2011-07-17 15:43:34,TRUE,"https://t.co/4xUgrx6rHJ","http://www.angelotofalo.com",,"https://pbs.twimg.com/profile_banners/337171830/1613207709","http://abs.twimg.com/images/themes/theme1/bg.png","http://pbs.twimg.com/profile_images/1035471039734718464/UIb1-oK3_normal.jpg"
"x337171830","x1500893801824591877",2022-03-07 17:59:02,"AngeloTofalo","Vessazioni fisiche e verbali, minacce e omissioni. E’ quanto documentato dai #Carabinieri NAS con un’indagine che ha svelato maltrattamenti nei confronti di anziani ospiti di una comunità del litorale laziale https://t.co/BuBv4hl8pA
#PossiamoAiutarvi https://t.co/FvydQDD930","Twitter for iPhone",140,,,,FALSE,TRUE,0,13,,,"Carabinieri",,,,,,,,,,,,,"x2965811733","_Carabinieri_","it",,,,,,,,,,,,,,,,"x1500793669024198662","Vessazioni fisiche e verbali, minacce e omissioni. E’ quanto documentato dai #Carabinieri NAS con un’indagine che ha svelato maltrattamenti nei confronti di anziani ospiti di una comunità del litorale laziale https://t.co/BuBv4hl8pA
#PossiamoAiutarvi https://t.co/FvydQDD930",2022-03-07 11:21:08,"Twitter Web App",64,13,"x2965811733","_Carabinieri_","Arma dei Carabinieri",152104,306,8790,"Roma (ITALIA)","Account ufficiale. Questo profilo non tratta segnalazioni o denunce. In caso di urgenza, chiama il 112 o contatta una Stazione #Carabinieri",TRUE,,,,,,,"NA NA","NA NA","NA NA NA NA NA NA NA NA","https://twitter.com/AngeloTofalo/status/1500893801824591877","Angelo Tofalo","Salerno, Pellezzano, Campania","Ingegnere, deputato della Repubblica, già Sottosegretario di Stato alla Difesa 🇮🇹 Rapito dall’Intelligence per diffondere la cultura della Sicurezza","https://t.co/4xUgrx6rHJ",FALSE,37982,4995,359,37977,16734,2011-07-17 15:43:34,TRUE,"https://t.co/4xUgrx6rHJ","http://www.angelotofalo.com",,"https://pbs.twimg.com/profile_banners/337171830/1613207709","http://abs.twimg.com/images/themes/theme1/bg.png","http://pbs.twimg.com/profile_images/1035471039734718464/UIb1-oK3_normal.jpg"
"x337171830","x1500893751325171714",2022-03-07 17:58:50,"AngeloTofalo","I #Carabinieri  di Santa Maria Capua Vetere (CE) hanno eseguito misure cautelari nei confronti di 40 persone ritenute responsabili di associazione finalizzata al traffico illecito di sostanze stupefacenti https://t.co/FimycvD8Wj
#PossiamoAiutarvi https://t.co/233rmwOPEe","Twitter for iPhone",140,,,,FALSE,TRUE,0,17,,,"Carabinieri",,,,,,,,,,,,,"x2965811733","_Carabinieri_","it",,,,,,,,,,,,,,,,"x1500861840049455104","I #Carabinieri  di Santa Maria Capua Vetere (CE) hanno eseguito misure cautelari nei confronti di 40 persone ritenute responsabili di associazione finalizzata al traffico illecito di sostanze stupefacenti https://t.co/FimycvD8Wj
#PossiamoAiutarvi https://t.co/233rmwOPEe",2022-03-07 15:52:01,"Twitter Web App",90,17,"x2965811733","_Carabinieri_","Arma dei Carabinieri",152104,306,8790,"Roma (ITALIA)","Account ufficiale. Questo profilo non tratta segnalazioni o denunce. In caso di urgenza, chiama il 112 o contatta una Stazione #Carabinieri",TRUE,,,,,,,"NA NA","NA NA","NA NA NA NA NA NA NA NA","https://twitter.com/AngeloTofalo/status/1500893751325171714","Angelo Tofalo","Salerno, Pellezzano, Campania","Ingegnere, deputato della Repubblica, già Sottosegretario di Stato alla Difesa 🇮🇹 Rapito dall’Intelligence per diffondere la cultura della Sicurezza","https://t.co/4xUgrx6rHJ",FALSE,37982,4995,359,37977,16734,2011-07-17 15:43:34,TRUE,"https://t.co/4xUgrx6rHJ","http://www.angelotofalo.com",,"https://pbs.twimg.com/profile_banners/337171830/1613207709","http://abs.twimg.com/images/themes/theme1/bg.png","http://pbs.twimg.com/profile_images/1035471039734718464/UIb1-oK3_normal.jpg"
"x337171830","x1500893690621054979",2022-03-07 17:58:35,"AngeloTofalo","#AccaddeOggi
22 anni fa, il 7 marzo 2000, il 31° Stormo dell'#AeronauticaMilitare riceve il primo A.319CJ, scelto come sostituto del DC.9-32.

𝐕𝐞𝐫𝐬𝐨 #𝐀𝐞𝐫𝐨𝐧𝐚𝐮𝐭𝐢𝐜𝐚𝐌𝐢𝐥𝐢𝐭𝐚𝐫𝐞𝟏𝟎𝟎
#lanostrastoria #latuasquadrachevola https://t.co/54xlSm1VwU","Twitter for iPhone",140,,,,FALSE,TRUE,0,13,,,"AccaddeOggi AeronauticaMilitare",,,,,,,,,,,,,"x1280597143","ItalianAirForce","it",,,,,,,,,,,,,,,,"x1500821983352795141","#AccaddeOggi
22 anni fa, il 7 marzo 2000, il 31° Stormo dell'#AeronauticaMilitare riceve il primo A.319CJ, scelto come sostituto del DC.9-32.

𝐕𝐞𝐫𝐬𝐨 #𝐀𝐞𝐫𝐨𝐧𝐚𝐮𝐭𝐢𝐜𝐚𝐌𝐢𝐥𝐢𝐭𝐚𝐫𝐞𝟏𝟎𝟎
#lanostrastoria #latuasquadrachevola https://t.co/54xlSm1VwU",2022-03-07 13:13:39,"Twitter Web App",36,13,"x1280597143","ItalianAirForce","Aeronautica Militare",114025,434,28302,"","La Difesa Aerea è la missione principale dell'Aeronautica Militare.365 giorni l'anno,24 ore su 24, i velivoli caccia sono pronti al decollo #latuasquadrachevola",TRUE,,,,,,,"NA NA","NA NA","NA NA NA NA NA NA NA NA","https://twitter.com/AngeloTofalo/status/1500893690621054979","Angelo Tofalo","Salerno, Pellezzano, Campania","Ingegnere, deputato della Repubblica, già Sottosegretario di Stato alla Difesa 🇮🇹 Rapito dall’Intelligence per diffondere la cultura della Sicurezza","https://t.co/4xUgrx6rHJ",FALSE,37982,4995,359,37977,16734,2011-07-17 15:43:34,TRUE,"https://t.co/4xUgrx6rHJ","http://www.angelotofalo.com",,"https://pbs.twimg.com/profile_banners/337171830/1613207709","http://abs.twimg.com/images/themes/theme1/bg.png","http://pbs.twimg.com/profile_images/1035471039734718464/UIb1-oK3_normal.jpg"
"x337171830","x1500893591727706112",2022-03-07 17:58:12,"AngeloTofalo","#naveRizzo nel Golfo di Guinea per l'Operazione Gabinia che ha come obiettivo la vigilanza marittima a tutela degli interessi nazionali e la cooperazione con le marine dei paesi rivieraschi. Comunicato stampa nr.14 ► https://t.co/JL4KByZxzy
#MarinaMilitare https://t.co/SErISlnnNz","Twitter for iPhone",140,,,,FALSE,TRUE,0,12,,,"naveRizzo",,,,,,,,,,,,,"x252039915","ItalianNavy","it",,,,,,,,,,,,,,,,"x1500879724884725764","#naveRizzo nel Golfo di Guinea per l'Operazione Gabinia che ha come obiettivo la vigilanza marittima a tutela degli interessi nazionali e la cooperazione con le marine dei paesi rivieraschi. Comunicato stampa nr.14 ► https://t.co/JL4KByZxzy
#MarinaMilitare https://t.co/SErISlnnNz",2022-03-07 17:03:06,"Twitter for Android",60,12,"x252039915","ItalianNavy","Marina Militare",104003,190,20688,"Italia","#ProfessionistidelMare #NoisiamolaMarina #UnMarediOpportunità",TRUE,,,,,,,"NA NA","NA NA","NA NA NA NA NA NA NA NA","https://twitter.com/AngeloTofalo/status/1500893591727706112","Angelo Tofalo","Salerno, Pellezzano, Campania","Ingegnere, deputato della Repubblica, già Sottosegretario di Stato alla Difesa 🇮🇹 Rapito dall’Intelligence per diffondere la cultura della Sicurezza","https://t.co/4xUgrx6rHJ",FALSE,37982,4995,359,37977,16734,2011-07-17 15:43:34,TRUE,"https://t.co/4xUgrx6rHJ","http://www.angelotofalo.com",,"https://pbs.twimg.com/profile_banners/337171830/1613207709","http://abs.twimg.com/images/themes/theme1/bg.png","http://pbs.twimg.com/profile_images/1035471039734718464/UIb1-oK3_normal.jpg"
"x337171830","x1500893510643367937",2022-03-07 17:57:52,"AngeloTofalo","Operazione conclusa con successo! I nostri #artificieri, effettivi al 21° Reggimento Genio Guastatori, hanno terminato le operazioni di disinnesco della bomba d’aereo rinvenuta a #Sapri che è stata fatta brillare presso la cava di Casalbuono (SA). Ben fatto 💪🇮🇹
#6marzo https://t.co/N4EJSIfioU","Twitter for iPhone",140,,,,FALSE,TRUE,0,21,,,"artificieri",,,,,,,,,,,,,"x437337751","Esercito","it",,,,,,,,,,,,,,,,"x1500482198767554570","Operazione conclusa con successo! I nostri #artificieri, effettivi al 21° Reggimento Genio Guastatori, hanno terminato le operazioni di disinnesco della bomba d’aereo rinvenuta a #Sapri che è stata fatta brillare presso la cava di Casalbuono (SA). Ben fatto 💪🇮🇹
#6marzo https://t.co/N4EJSIfioU",2022-03-06 14:43:28,"Twitter for iPhone",124,21,"x437337751","Esercito","Esercito Italiano",106767,343,15615,"Roma","L'Esercito Italiano, fondato nel 1861, è la componente più antica tra le Forze Armate italiane.",TRUE,,,,,,,"NA NA","NA NA","NA NA NA NA NA NA NA NA","https://twitter.com/AngeloTofalo/status/1500893510643367937","Angelo Tofalo","Salerno, Pellezzano, Campania","Ingegnere, deputato della Repubblica, già Sottosegretario di Stato alla Difesa 🇮🇹 Rapito dall’Intelligence per diffondere la cultura della Sicurezza","https://t.co/4xUgrx6rHJ",FALSE,37982,4995,359,37977,16734,2011-07-17 15:43:34,TRUE,"https://t.co/4xUgrx6rHJ","http://www.angelotofalo.com",,"https://pbs.twimg.com/profile_banners/337171830/1613207709","http://abs.twimg.com/images/themes/theme1/bg.png","http://pbs.twimg.com/profile_images/1035471039734718464/UIb1-oK3_normal.jpg"
"x636328779","x1501004343931289607",2022-03-08 01:18:17,"AlexBazzaro","Ci sono ancora esperti che te la menano col “numero dei casi”. Basta! #greenpass","Twitter for iPhone",80,,,,FALSE,FALSE,13,3,,,"greenpass",,,,,,,,,,,,,,,"it",,,,,,,,,,,,,,,,,,,,,,,,,,,,,,,,,,,,,"NA NA","NA NA","NA NA NA NA NA NA NA NA","https://twitter.com/AlexBazzaro/status/1501004343931289607","Alex Bazzaro","Venezia ","🇮🇹Deputato Lega, Commissione XIV  🦁Consigliere Comunale Venezia. ✈️ Delegazione @OSCE Liberale e libertario","https://t.co/yXFTMiY4b3",FALSE,4441,475,45,14681,9286,2012-07-15 15:20:42,TRUE,"https://t.co/yXFTMiY4b3","https://www.camera.it/leg18/29?shadow_deputato=307696&idpersona=307696&idlegislatura=18",,"https://pbs.twimg.com/profile_banners/636328779/1646324685","http://abs.twimg.com/images/themes/theme1/bg.png","http://pbs.twimg.com/profile_images/1499374659665645573/f2Yd2Tdd_normal.jpg"
"x636328779","x1500961226762956800",2022-03-07 22:26:57,"AlexBazzaro","Il Governatore della Florida spiega che da loro non c’è posto per il “teatro Covid”.
Il mondo libero non ha Speranza e Brunetta. #greenpass https://t.co/NW27kf9ZuO","Twitter for iPhone",139,,,,FALSE,FALSE,100,31,,,"greenpass",,,,,"http://pbs.twimg.com/media/FNR8R3nX0AQlTry.jpg","https://t.co/NW27kf9ZuO","https://twitter.com/AlexBazzaro/status/1500961226762956800/photo/1","photo","http://pbs.twimg.com/media/FNR8R3nX0AQlTry.jpg","https://t.co/NW27kf9ZuO","https://twitter.com/AlexBazzaro/status/1500961226762956800/photo/1",,,,"it",,,,,,,,,,,,,,,,,,,,,,,,,,,,,,,,,,,,,"NA NA","NA NA","NA NA NA NA NA NA NA NA","https://twitter.com/AlexBazzaro/status/1500961226762956800","Alex Bazzaro","Venezia ","🇮🇹Deputato Lega, Commissione XIV  🦁Consigliere Comunale Venezia. ✈️ Delegazione @OSCE Liberale e libertario","https://t.co/yXFTMiY4b3",FALSE,4441,475,45,14681,9286,2012-07-15 15:20:42,TRUE,"https://t.co/yXFTMiY4b3","https://www.camera.it/leg18/29?shadow_deputato=307696&idpersona=307696&idlegislatura=18",,"https://pbs.twimg.com/profile_banners/636328779/1646324685","http://abs.twimg.com/images/themes/theme1/bg.png","http://pbs.twimg.com/profile_images/1499374659665645573/f2Yd2Tdd_normal.jpg"
"x636328779","x1500934098281447429",2022-03-07 20:39:09,"AlexBazzaro","Quando bloccheranno le vostre carte di credito, i vostri account di cryptovalute e i vostri conti correnti scoprirete che nessuna giusta causa può essere valida per impedire al singolo individuo di usare il proprio denaro. #Ucraina","Twitter for iPhone",231,,,,FALSE,FALSE,196,41,,,"Ucraina",,,,,,,,,,,,,,,"it",,,,,,,,,,,,,,,,,,,,,,,,,,,,,,,,,,,,,"NA NA","NA NA","NA NA NA NA NA NA NA NA","https://twitter.com/AlexBazzaro/status/1500934098281447429","Alex Bazzaro","Venezia ","🇮🇹Deputato Lega, Commissione XIV  🦁Consigliere Comunale Venezia. ✈️ Delegazione @OSCE Liberale e libertario","https://t.co/yXFTMiY4b3",FALSE,4441,475,45,14681,9286,2012-07-15 15:20:42,TRUE,"https://t.co/yXFTMiY4b3","https://www.camera.it/leg18/29?shadow_deputato=307696&idpersona=307696&idlegislatura=18",,"https://pbs.twimg.com/profile_banners/636328779/1646324685","http://abs.twimg.com/images/themes/theme1/bg.png","http://pbs.twimg.com/profile_images/1499374659665645573/f2Yd2Tdd_normal.jpg"
"x636328779","x1500933212754919430",2022-03-07 20:35:38,"AlexBazzaro","@EsteriLega Eh eh","Twitter for iPhone",5,"x1500910797505146883","x1176749662155530240","EsteriLega",FALSE,FALSE,3,0,,,,,,,,,,,,,,,,"x1176749662155530240","EsteriLega","tl",,,,,,,,,,,,,,,,,,,,,,,,,,,,,,,,,,,,,"NA NA","NA NA","NA NA NA NA NA NA NA NA","https://twitter.com/AlexBazzaro/status/1500933212754919430","Alex Bazzaro","Venezia ","🇮🇹Deputato Lega, Commissione XIV  🦁Consigliere Comunale Venezia. ✈️ Delegazione @OSCE Liberale e libertario","https://t.co/yXFTMiY4b3",FALSE,4441,475,45,14681,9286,2012-07-15 15:20:42,TRUE,"https://t.co/yXFTMiY4b3","https://www.camera.it/leg18/29?shadow_deputato=307696&idpersona=307696&idlegislatura=18",,"https://pbs.twimg.com/profile_banners/636328779/1646324685","http://abs.twimg.com/images/themes/theme1/bg.png","http://pbs.twimg.com/profile_images/1499374659665645573/f2Yd2Tdd_normal.jpg"
"x636328779","x1500932795027308549",2022-03-07 20:33:58,"AlexBazzaro","@info_tornato Esatto!!!","Twitter for iPhone",9,"x1500932005701246982","x1575107407","info_tornato",FALSE,FALSE,2,0,,,,,,,,,,,,,,,,"x1575107407","info_tornato","it",,,,,,,,,,,,,,,,,,,,,,,,,,,,,,,,,,,,,"NA NA","NA NA","NA NA NA NA NA NA NA NA","https://twitter.com/AlexBazzaro/status/1500932795027308549","Alex Bazzaro","Venezia ","🇮🇹Deputato Lega, Commissione XIV  🦁Consigliere Comunale Venezia. ✈️ Delegazione @OSCE Liberale e libertario","https://t.co/yXFTMiY4b3",FALSE,4441,475,45,14681,9286,2012-07-15 15:20:42,TRUE,"https://t.co/yXFTMiY4b3","https://www.camera.it/leg18/29?shadow_deputato=307696&idpersona=307696&idlegislatura=18",,"https://pbs.twimg.com/profile_banners/636328779/1646324685","http://abs.twimg.com/images/themes/theme1/bg.png","http://pbs.twimg.com/profile_images/1499374659665645573/f2Yd2Tdd_normal.jpg"
"x636328779","x1500930357423751174",2022-03-07 20:24:17,"AlexBazzaro","“Stiamo al freddo per combattere Putin”

Solitamente detto da chi al freddo non ci starebbe nemmeno 5 minuti ma vuole farci stare voi. #Ucraina","Twitter for iPhone",143,,,,FALSE,FALSE,142,26,,,"Ucraina",,,,,,,,,,,,,,,"it",,,,,,,,,,,,,,,,,,,,,,,,,,,,,,,,,,,,,"NA NA","NA NA","NA NA NA NA NA NA NA NA","https://twitter.com/AlexBazzaro/status/1500930357423751174","Alex Bazzaro","Venezia ","🇮🇹Deputato Lega, Commissione XIV  🦁Consigliere Comunale Venezia. ✈️ Delegazione @OSCE Liberale e libertario","https://t.co/yXFTMiY4b3",FALSE,4441,475,45,14681,9286,2012-07-15 15:20:42,TRUE,"https://t.co/yXFTMiY4b3","https://www.camera.it/leg18/29?shadow_deputato=307696&idpersona=307696&idlegislatura=18",,"https://pbs.twimg.com/profile_banners/636328779/1646324685","http://abs.twimg.com/images/themes/theme1/bg.png","http://pbs.twimg.com/profile_images/1499374659665645573/f2Yd2Tdd_normal.jpg"
"x636328779","x1500925879022723082",2022-03-07 20:06:30,"AlexBazzaro","A Londra niente pù mascherine, niente #greenpass niente tamponi. Sei positivo? Pace.
Il resto del mondo sa che la pandemia è finita e si adegua di conseguenza. Noi abbiamo #Speranza e Brunetta. La giornalista stupita. Dovrebbe stupirsi di come siamo ridotti noi! #ViaLaTessera https://t.co/0AS6DQ0Rlf","Twitter Web App",276,,,,FALSE,FALSE,116,44,,,"greenpass Speranza ViaLaTessera",,,,,"http://pbs.twimg.com/ext_tw_video_thumb/1500925242251915265/pu/img/GZfGGJAbIKIO8f2t.jpg","https://t.co/0AS6DQ0Rlf","https://twitter.com/AlexBazzaro/status/1500925879022723082/video/1","photo","http://pbs.twimg.com/ext_tw_video_thumb/1500925242251915265/pu/img/GZfGGJAbIKIO8f2t.jpg","https://t.co/0AS6DQ0Rlf","https://twitter.com/AlexBazzaro/status/1500925879022723082/video/1",,,,"it",,,,,,,,,,,,,,,,,,,,,,,,,,,,,,,,,,,,,"NA NA","NA NA","NA NA NA NA NA NA NA NA","https://twitter.com/AlexBazzaro/status/1500925879022723082","Alex Bazzaro","Venezia ","🇮🇹Deputato Lega, Commissione XIV  🦁Consigliere Comunale Venezia. ✈️ Delegazione @OSCE Liberale e libertario","https://t.co/yXFTMiY4b3",FALSE,4441,475,45,14681,9286,2012-07-15 15:20:42,TRUE,"https://t.co/yXFTMiY4b3","https://www.camera.it/leg18/29?shadow_deputato=307696&idpersona=307696&idlegislatura=18",,"https://pbs.twimg.com/profile_banners/636328779/1646324685","http://abs.twimg.com/images/themes/theme1/bg.png","http://pbs.twimg.com/profile_images/1499374659665645573/f2Yd2Tdd_normal.jpg"
"x636328779","x1500920307019833351",2022-03-07 19:44:21,"AlexBazzaro","La locomotiva d’Europa.

Nel senso che l’auto te la scordi. #Ucraina https://t.co/yJmmhx4HLJ","Twitter for iPhone",68,,,,FALSE,FALSE,25,4,,,"Ucraina",,,,,"http://pbs.twimg.com/media/FNRXD-dWYAEhPUt.jpg","https://t.co/yJmmhx4HLJ","https://twitter.com/AlexBazzaro/status/1500920307019833351/photo/1","photo","http://pbs.twimg.com/media/FNRXD-dWYAEhPUt.jpg","https://t.co/yJmmhx4HLJ","https://twitter.com/AlexBazzaro/status/1500920307019833351/photo/1",,,,"it",,,,,,,,,,,,,,,,,,,,,,,,,,,,,,,,,,,,,"NA NA","NA NA","NA NA NA NA NA NA NA NA","https://twitter.com/AlexBazzaro/status/1500920307019833351","Alex Bazzaro","Venezia ","🇮🇹Deputato Lega, Commissione XIV  🦁Consigliere Comunale Venezia. ✈️ Delegazione @OSCE Liberale e libertario","https://t.co/yXFTMiY4b3",FALSE,4441,475,45,14681,9286,2012-07-15 15:20:42,TRUE,"https://t.co/yXFTMiY4b3","https://www.camera.it/leg18/29?shadow_deputato=307696&idpersona=307696&idlegislatura=18",,"https://pbs.twimg.com/profile_banners/636328779/1646324685","http://abs.twimg.com/images/themes/theme1/bg.png","http://pbs.twimg.com/profile_images/1499374659665645573/f2Yd2Tdd_normal.jpg"
